claim,source_url,source_domain,article_title,risk_score,risk_category,has_factcheck,factcheck_rating,factcheck_source,source_type,checked_at
"Andere Nutzungen verletzen das Urheberrecht Die Lage am Morgen Die Debatte über die Leihmutterschaft geht jetzt erst richtig los Von Susanne Beyer Heute geht es um die Frage, ob beim Thema Leihmutterschaft schon alle Argumente ausgetauscht sind",https://www.spiegel.de/politik/deutschland/news-leihmutterschaft-jens-spahn-afd-machtkampf-andy-burnham-a-76319d29-366e-4bfa-8d7f-f36bc0800f96#ref=rss,www.spiegel.de,"News: Leihmutterschaft, Jens Spahn, AfD-Machtkampf, Andy Burnham - DER SPIEGEL",0.1,LOW,False,,,mainstream,2026-07-21T08:33:37.567613
"Auch wenn jemand finanziell erst mal keine Not leidet, kann es i",https://www.spiegel.de/politik/deutschland/news-leihmutterschaft-jens-spahn-afd-machtkampf-andy-burnham-a-76319d29-366e-4bfa-8d7f-f36bc0800f96#ref=rss,www.spiegel.de,"News: Leihmutterschaft, Jens Spahn, AfD-Machtkampf, Andy Burnham - DER SPIEGEL",0.1,LOW,False,,,mainstream,2026-07-21T08:33:37.625084
"&quot;As one figure in Whitehall, steeped in defence, texted to remind me, Healey wrote in his resignation letter that &quot;I am certain that a headmark date for 3% of GDP on defence in 2030 is what Britain must set",https://www.bbc.co.uk/news/articles/c24mnnnd18do?at_medium=RSS&amp;at_campaign=rss,www.bbc.co.uk,New chancellor John Healey faces tough spending choices - BBC News,0,LOW,False,,,mainstream,2026-07-21T08:33:37.891298
"Canada was one of the few countries to retaliate in 2025 against Trump&#x27;s tariffs, placing a 25% levy on about C$30bn (Â£16bn; $21",https://www.bbc.co.uk/news/articles/cg4dzq3x3e1o?at_medium=RSS&amp;at_campaign=rss,www.bbc.co.uk,Trump slaps 50% tariffs on Canada and Carney vows to &#x27;intensify&#x27; trade talks - BBC News,0,LOW,False,,,mainstream,2026-07-21T08:33:38.015403
"The US has been maintaining active tariffs ranging from 15% to 50% on Canadian steel, aluminium and copper",https://www.bbc.co.uk/news/articles/cg4dzq3x3e1o?at_medium=RSS&amp;at_campaign=rss,www.bbc.co.uk,Trump slaps 50% tariffs on Canada and Carney vows to &#x27;intensify&#x27; trade talks - BBC News,0,LOW,False,,,mainstream,2026-07-21T08:33:38.072939
"Washington also charges a 35% tariff on Canadian softwood lumber, alongside a 25% tax on non-US parts in cars",https://www.bbc.co.uk/news/articles/cg4dzq3x3e1o?at_medium=RSS&amp;at_campaign=rss,www.bbc.co.uk,Trump slaps 50% tariffs on Canada and Carney vows to &#x27;intensify&#x27; trade talks - BBC News,0,LOW,False,,,mainstream,2026-07-21T08:33:38.130041
Up to the middle of summer - 15 July - parts of eastern and north-eastern England had received just 26% of their total expected summer rainfall,https://www.bbc.co.uk/weather/articles/cjwx0xv571eo?at_medium=RSS&amp;at_campaign=rss,www.bbc.co.uk,Is UK facing drought for second summer in a row? - BBC Weather,0,LOW,False,,,mainstream,2026-07-21T08:33:38.637946
"However, the ONS noted that regular wage growth in the private sector fell below 3% for the first time since 2020",https://www.bbc.co.uk/news/articles/cx2vd3qgjy9o?at_medium=RSS&amp;at_campaign=rss,www.bbc.co.uk,UK government borrowing lower than expected in June - BBC News,0,LOW,False,,,mainstream,2026-07-21T08:33:38.941603
"Red-tailed, buff-tailed and common carder bumblebees - three of the country&#x27;s most common species - peaked well below normal levels - down 20%, 25% and 35% respectively - before dropping further into autumn as colonies struggled",https://www.bbc.co.uk/news/articles/c141lymnl2yo?at_medium=RSS&amp;at_campaign=rss,www.bbc.co.uk,UK&#x27;s furry bumblebees &#x27;keeling over&#x27; in heatwaves - BBC News,0.1,LOW,False,,,mainstream,2026-07-21T08:33:39.058308
