claim,source_url,source_domain,article_title,risk_score,risk_category,has_factcheck,factcheck_rating,factcheck_source,source_type,checked_at
Giftschlange: Großeinsatz wurde abgebrochen Auslöser war laut Polizei die Meldung einer Giftschlange durch einen Mitarbeiter einer Baumschule,"https://www.ndr.de/nachrichten/schleswig-holstein/pinneberg_segeberg_stormarn/ki-fake-foto-von-schlange-polizei-will-einsatzkosten-einfordern,fakefoto-schlange-100.html",ndr.de,KI-Fake-Foto von Schlange: Polizei will Einsatzkosten einfordern | ndr.de,0,LOW,False,,,unknown,2026-07-21T08:31:10.328006
Entlaufene Wildkatze eingefangen - Serval jetzt im Tierheim Laut Polizei ist der Serval in der Nacht auf Freitag (11,"https://www.ndr.de/nachrichten/schleswig-holstein/pinneberg_segeberg_stormarn/ki-fake-foto-von-schlange-polizei-will-einsatzkosten-einfordern,fakefoto-schlange-100.html",ndr.de,KI-Fake-Foto von Schlange: Polizei will Einsatzkosten einfordern | ndr.de,0,LOW,False,,,unknown,2026-07-21T08:31:10.398382
"Gründe dafür können laut der Mail eine abgelaufene Karte, eine Ablehnung durch die Bank oder ein zu geringes Guthaben sein, was euch zum Handeln bewegen soll",https://www.giga.de/tech/millionen-von-spotify-kunden-schweben-jetzt-in-gefahr--01KY1N097ENS5VQYDKDFJJD6E4,giga.de,Millionen von Spotify-Kunden schweben jetzt in Gefahr,0,LOW,False,,,unknown,2026-07-21T08:31:11.746496
"Ein weiteres verdächtiges Merkmal ist die Absenderadresse, die bei genauerem Hinsehen nichts mit der offiziellen Domain von Spotify zu tun hat",https://www.giga.de/tech/millionen-von-spotify-kunden-schweben-jetzt-in-gefahr--01KY1N097ENS5VQYDKDFJJD6E4,giga.de,Millionen von Spotify-Kunden schweben jetzt in Gefahr,0,LOW,False,,,unknown,2026-07-21T08:31:11.806907
"Solche Phishing-Versuche sind keine Seltenheit und zielen darauf ab, durch den aufgebauten Zeitdruck unüberlegte Handlungen zu provozieren",https://www.giga.de/tech/millionen-von-spotify-kunden-schweben-jetzt-in-gefahr--01KY1N097ENS5VQYDKDFJJD6E4,giga.de,Millionen von Spotify-Kunden schweben jetzt in Gefahr,0.1,LOW,False,,,unknown,2026-07-21T08:31:11.869833
"Die Masche ist dabei immer ähnlich: In der E-Mail wird behauptet, dass eine Bestätigung der Kontodaten notwendig sei, um den reibungslosen Zugang zum Konto zu gewährleisten",https://www.giga.de/tech/bis-zum-22-juli-betrueger-setzen-sparkassen-kunden-unter-druck--01KY1NR2QNWG259WJ27Q8GP25N,giga.de,Bis zum 22. Juli: Betrüger setzen Sparkassen-Kunden unter Druck,0.1,LOW,False,,,unknown,2026-07-21T08:31:12.867624
"AboDigital Für alle, die Online lesen wollen Alle Artikel online lesen E-Paper inklusive App (iOS & Android) Schnupperabo CHF 19 (8 Ausgaben) Monatsabo CHF 9 /erster Monat -> 29",https://weltwoche.ch/daily/wegen-unzureichender-produktkontrollen-eu-verhaengt-millionenbusse-gegen-onlinehaendler-aliexpress/,weltwoche.ch,Wegen unzureichender Produktkontrollen: EU verhängt Millionenbusse gegen Onlinehändler Aliexpress,0.1,LOW,False,,,unknown,2026-07-21T08:31:13.907386
) AboPrint & Digital Printausgabe & digital jederzeit dabei Wöchentliche Printausgabe Alle Artikel online lesen E-Paper inklusive App (iOS & Android) Schnupperabo CHF 38 (8 Ausgaben) Halbjahresabo CHF 199 (33,https://weltwoche.ch/daily/wegen-unzureichender-produktkontrollen-eu-verhaengt-millionenbusse-gegen-onlinehaendler-aliexpress/,weltwoche.ch,Wegen unzureichender Produktkontrollen: EU verhängt Millionenbusse gegen Onlinehändler Aliexpress,0.1,LOW,False,,,unknown,2026-07-21T08:31:13.964820
0× + − 100% + Mehr ▾ Sie können uns nicht hören,https://weltwoche.ch/daily/wegen-unzureichender-produktkontrollen-eu-verhaengt-millionenbusse-gegen-onlinehaendler-aliexpress/,weltwoche.ch,Wegen unzureichender Produktkontrollen: EU verhängt Millionenbusse gegen Onlinehändler Aliexpress,0.1,LOW,False,,,unknown,2026-07-21T08:31:14.041741
(Symbolbild) picture alliance/dpa | Sebastian Kahnert Immer mehr Restaurants und Hotels löschen Bewertungen auf Google,https://www.mopo.de/news/panorama/kritik-geloescht-viele-restaurants-und-hotels-entfernen-online-bewertungen/4892347,mopo.de,Google-Bewertungen: Warum so viele Einträge gelöscht werden,0.1,LOW,False,,,unknown,2026-07-21T08:31:14.471550
In immer mehr Google-Bewertungen von Restaurants und Hotels taucht der Hinweis auf: Bewertungen aufgrund von Beschwerden wegen Diffamierung entfernt,https://www.mopo.de/news/panorama/kritik-geloescht-viele-restaurants-und-hotels-entfernen-online-bewertungen/4892347,mopo.de,Google-Bewertungen: Warum so viele Einträge gelöscht werden,0.1,LOW,False,,,unknown,2026-07-21T08:31:14.529842
"Eine Stichprobe der Deutschen Presse-Agentur bei mehr als 3700 Gastbetrieben in mehreren deutschen Städten zeigt, dass je nach Ort zwischen elf bis 30 Prozent der Gastbetriebe Online-Bewertungen gelöscht haben",https://www.mopo.de/news/panorama/kritik-geloescht-viele-restaurants-und-hotels-entfernen-online-bewertungen/4892347,mopo.de,Google-Bewertungen: Warum so viele Einträge gelöscht werden,0,LOW,False,,,unknown,2026-07-21T08:31:14.589093
"Wie der NDR berichtet, kursieren derzeit E-Mails, die angebliche Betriebsprüfungen ankündigen und den Anschein erwecken sollen, von einer offiziellen Adresse des Finanzamts zu stammen",http://www.hna.de/niedersachsen/kurz-vor-steuer-deadline-niedersachsen-warnt-vor-phishing-mails-94407340.html,hna.de,Kurz vor Steuer-Deadline: Niedersachsen warnt vor Phishing-Mails,0,LOW,False,,,unknown,2026-07-21T08:31:15.603810
"Auch interessantKommentareLiebe Leserinnen und Leser,wir bitten um Verständnis, dass es im Unterschied zu vielen anderen Artikeln auf unserem Portal unter diesem Artikel keine Kommentarfunktion gibt",http://www.hna.de/niedersachsen/kurz-vor-steuer-deadline-niedersachsen-warnt-vor-phishing-mails-94407340.html,hna.de,Kurz vor Steuer-Deadline: Niedersachsen warnt vor Phishing-Mails,0.1,LOW,False,,,unknown,2026-07-21T08:31:15.658957
"Wie der NDR berichtet, kursieren derzeit E-Mails, die angebliche Betriebsprüfungen ankündigen und den Anschein erwecken sollen, von einer offiziellen Adresse des Finanzamts zu stammen",https://www.hna.de/niedersachsen/kurz-vor-steuer-deadline-niedersachsen-warnt-vor-phishing-mails-94407340.html,hna.de,Kurz vor Steuer-Deadline: Niedersachsen warnt vor Phishing-Mails,0,LOW,False,,,unknown,2026-07-21T08:31:16.676059
"Auch interessantKommentareLiebe Leserinnen und Leser,wir bitten um Verständnis, dass es im Unterschied zu vielen anderen Artikeln auf unserem Portal unter diesem Artikel keine Kommentarfunktion gibt",https://www.hna.de/niedersachsen/kurz-vor-steuer-deadline-niedersachsen-warnt-vor-phishing-mails-94407340.html,hna.de,Kurz vor Steuer-Deadline: Niedersachsen warnt vor Phishing-Mails,0.1,LOW,False,,,unknown,2026-07-21T08:31:16.738595
"Nach Angaben des Landeskriminalamts lag die Zahl der Drogentoten in Niedersachsen bis 2021 etwa auf vergleichbarem Niveau, erst danach stiegen die Zahl deutlich an",https://www.n-tv.de/regionales/niedersachsen-und-bremen/132-Menschen-sterben-an-Folgen-von-Drogenkonsum-id31107235.html,n-tv.de,Niedersachsen &amp; Bremen: 132 Menschen sterben an Folgen von Drogenkonsum - n-tv.de,0.1,LOW,False,,,unknown,2026-07-21T08:31:17.284065
"Laut LKA sind zunehmend Kokain, Crack und synthetische Drogen wie etwa Ecstasy oder neue sogenannte psychoaktive Substanzen gefragt",https://www.n-tv.de/regionales/niedersachsen-und-bremen/132-Menschen-sterben-an-Folgen-von-Drogenkonsum-id31107235.html,n-tv.de,Niedersachsen &amp; Bremen: 132 Menschen sterben an Folgen von Drogenkonsum - n-tv.de,0,LOW,False,,,unknown,2026-07-21T08:31:17.340068
"Die Behörde riet bei diesen Substanzen zu besonderer Vorsicht, weil häufig keine Informationen zu Herkunft, Reinheits- oder Wirkstoffgehalt und möglichen Streckmitteln vorlägen",https://www.n-tv.de/regionales/niedersachsen-und-bremen/132-Menschen-sterben-an-Folgen-von-Drogenkonsum-id31107235.html,n-tv.de,Niedersachsen &amp; Bremen: 132 Menschen sterben an Folgen von Drogenkonsum - n-tv.de,0.1,LOW,False,,,unknown,2026-07-21T08:31:17.399318
"Doch immer mehr Menschen zahlen lieber dafür, sich einen solchen Schein durch Fälschungen zu verschaffen","https://www.gea.de/land_artikel,-verband-immer-mehr-f%C3%A4lschungen-bei-fischereischeinen-_arid,7161866.html",gea.de,Verband: immer mehr Fälschungen bei Fischereischeinen - Land Baden-Württemberg - Reutlinger General-,0.1,LOW,False,,,unknown,2026-07-21T08:31:19.412606
(Symbolbild) Foto: Danny Gohlke/DPA Anzeige--> Bitte aktivieren Sie Javascript Die Zahl der durch Fälschungen erworbenen Fischereischeine hat laut Experten in den vergangenen Jahren zugenommen,"https://www.gea.de/land_artikel,-verband-immer-mehr-f%C3%A4lschungen-bei-fischereischeinen-_arid,7161866.html",gea.de,Verband: immer mehr Fälschungen bei Fischereischeinen - Land Baden-Württemberg - Reutlinger General-,0,LOW,False,,,unknown,2026-07-21T08:31:19.474201
"Das war damals schon immer wieder mal ein Fall«, sagt Reinhart Sosat, Geschäftsführer des Landesfischereiverbandes Baden-Württemberg","https://www.gea.de/land_artikel,-verband-immer-mehr-f%C3%A4lschungen-bei-fischereischeinen-_arid,7161866.html",gea.de,Verband: immer mehr Fälschungen bei Fischereischeinen - Land Baden-Württemberg - Reutlinger General-,0.1,LOW,False,,,unknown,2026-07-21T08:31:19.532848
(Symbolbild) Foto: Stefan Sauer/DPA Anzeige--> Bitte aktivieren Sie Javascript Die Zahl an Fälschungen für Fischereischeine nimmt laut dem Landesfischereiverband Baden-Württemberg zu,"https://www.gea.de/land_artikel,-darum-sind-f%C3%A4lschungen-bei-fischereischeinen-ein-problem-_arid,7161867.html",gea.de,Darum sind Fälschungen bei Fischereischeinen ein Problem - Land Baden-Württemberg - Reutlinger Gener,0,LOW,False,,,unknown,2026-07-21T08:31:21.013731
"Schon für die Fischerprüfung lägen die Kosten bei 250 bis 300 Euro - inklusive Dolmetscher kämen dann schätzungsweise 500, 600 Euro zusammen","https://www.gea.de/land_artikel,-darum-sind-f%C3%A4lschungen-bei-fischereischeinen-ein-problem-_arid,7161867.html",gea.de,Darum sind Fälschungen bei Fischereischeinen ein Problem - Land Baden-Württemberg - Reutlinger Gener,0,LOW,False,,,unknown,2026-07-21T08:31:21.075884
"Laut dem Regierungspräsidium Karlsruhe gibt es aber auch Fälle, bei denen sich Menschen unwissendlich Fälschungen beschaffen","https://www.gea.de/land_artikel,-darum-sind-f%C3%A4lschungen-bei-fischereischeinen-ein-problem-_arid,7161867.html",gea.de,Darum sind Fälschungen bei Fischereischeinen ein Problem - Land Baden-Württemberg - Reutlinger Gener,0,LOW,False,,,unknown,2026-07-21T08:31:21.138971
2026 • 04:02 Uhr)Artikel teilenDie Zahl an Fälschungen für Fischereischeine nimmt laut dem Landesfischereiverband Baden-Württemberg zu,https://www.schwaebische.de/regional/baden-wuerttemberg/darum-sind-faelschungen-bei-fischereischeinen-ein-problem-4732528,schwaebische.de,Darum sind Fälschungen bei Fischereischeinen ein Problem,0,LOW,False,,,unknown,2026-07-21T08:31:22.640026
"Schon für die Fischerprüfung lägen die Kosten bei 250 bis 300 Euro - inklusive Dolmetscher kämen dann schätzungsweise 500, 600 Euro zusammen",https://www.schwaebische.de/regional/baden-wuerttemberg/darum-sind-faelschungen-bei-fischereischeinen-ein-problem-4732528,schwaebische.de,Darum sind Fälschungen bei Fischereischeinen ein Problem,0,LOW,False,,,unknown,2026-07-21T08:31:22.700666
"Laut dem Regierungspräsidium Karlsruhe gibt es aber auch Fälle, bei denen sich Menschen unwissendlich Fälschungen beschaffen",https://www.schwaebische.de/regional/baden-wuerttemberg/darum-sind-faelschungen-bei-fischereischeinen-ein-problem-4732528,schwaebische.de,Darum sind Fälschungen bei Fischereischeinen ein Problem,0,LOW,False,,,unknown,2026-07-21T08:31:22.761539
"2026, 05:00 Uhr Zusammengefasst Immer mehr Menschen nutzen Sprachmodelle wie ChatGPT als Hilfe beim Online-Dating; laut US-Umfrage 2025 verwendete jede vierte Person KI fürs Dating, unter aktiven Datenden zwei von fünf",https://www.weser-kurier.de/kultur/ki-beim-online-dating-bremer-forscher-warnen-vor-taeuschung-doc86p7zxv4bdy118qfhco6,weser-kurier.de,KI beim Online-Dating: Bremer Forscher warnen vor Täuschung,0.1,LOW,False,,,unknown,2026-07-21T08:31:24.302565
"Selbst wer noch nie im Theater war, k&ouml;nnte eine vergleichbare Szene schon erlebt haben",https://www.weser-kurier.de/kultur/ki-beim-online-dating-bremer-forscher-warnen-vor-taeuschung-doc86p7zxv4bdy118qfhco6,weser-kurier.de,KI beim Online-Dating: Bremer Forscher warnen vor Täuschung,0.1,LOW,False,,,unknown,2026-07-21T08:31:24.362850
"Denn immer mehr Menschen nutzen in Dating-Apps einen modernen Cyrano: Sie lassen sich ihre Worte von Sprachmodellen, also einer k&uuml;nstlichen Intelligenz wie ChatGPT, formulieren",https://www.weser-kurier.de/kultur/ki-beim-online-dating-bremer-forscher-warnen-vor-taeuschung-doc86p7zxv4bdy118qfhco6,weser-kurier.de,KI beim Online-Dating: Bremer Forscher warnen vor Täuschung,0.1,LOW,False,,,unknown,2026-07-21T08:31:24.421524
132 Menschen sind laut Landeskriminalamt im vergangenen Jahr in Niedersachsen an den Folgen ihres Drogenkonsums gestorben,https://www.weser-kurier.de/deutschland-welt/132-menschen-sterben-an-folgen-von-drogenkonsum-doc86t2iwk7i7o1n696a1iq,weser-kurier.de,132 Menschen sterben an Folgen von Drogenkonsum,0.1,LOW,False,,,unknown,2026-07-21T08:31:25.418012
"Nach Angaben des Landeskriminalamts lag die Zahl der Drogentoten in Niedersachsen bis 2021 etwa auf vergleichbarem Niveau, erst danach stiegen die Zahl deutlich an",https://www.weser-kurier.de/deutschland-welt/132-menschen-sterben-an-folgen-von-drogenkonsum-doc86t2iwk7i7o1n696a1iq,weser-kurier.de,132 Menschen sterben an Folgen von Drogenkonsum,0.1,LOW,False,,,unknown,2026-07-21T08:31:25.473519
"Laut LKA sind zunehmend Kokain, Crack und synthetische Drogen wie etwa Ecstasy oder neue sogenannte psychoaktive Substanzen gefragt",https://www.weser-kurier.de/deutschland-welt/132-menschen-sterben-an-folgen-von-drogenkonsum-doc86t2iwk7i7o1n696a1iq,weser-kurier.de,132 Menschen sterben an Folgen von Drogenkonsum,0,LOW,False,,,unknown,2026-07-21T08:31:25.532766
Gef&auml;lschte Jobs als Einfallstor Doch Phishing wird immer raffinierter,https://www.boerse-express.com/news/articles/kratos-schlag-bka-zerlegt-phishing-dienst-mit-ueber-200-servern-930404,boerse-express.com,Kratos-Schlag: BKA zerlegt Phishing-Dienst mit über 200 Servern,0.1,LOW,False,,,unknown,2026-07-21T08:31:32.703906
Die Masche f&auml;llt auf fruchtbaren Boden &ndash; einer Marktstudie zufolge plant jeder dritte Angeh&ouml;rige der Generation Z einen Jobwechsel,https://www.boerse-express.com/news/articles/kratos-schlag-bka-zerlegt-phishing-dienst-mit-ueber-200-servern-930404,boerse-express.com,Kratos-Schlag: BKA zerlegt Phishing-Dienst mit über 200 Servern,0,LOW,False,,,unknown,2026-07-21T08:31:32.766695
Die Zahl an Fälschungen für Fischereischeine nimmt laut dem Landesfischereiverband Baden-Württemberg zu,"https://www.pz-news.de/baden-wuerttemberg_artikel,-Darum-sind-Faelschungen-bei-Fischereischeinen-ein-Problem-_arid,2360921.html",pz-news.de,Darum sind Fälschungen bei Fischereischeinen ein Problem - Baden-Württemberg - Pforzheimer-Zeitung,0,LOW,False,,,unknown,2026-07-21T08:31:41.531019
"Schon für die Fischerprüfung lägen die Kosten bei 250 bis 300 Euro - inklusive Dolmetscher kämen dann schätzungsweise 500, 600 Euro zusammen","https://www.pz-news.de/baden-wuerttemberg_artikel,-Darum-sind-Faelschungen-bei-Fischereischeinen-ein-Problem-_arid,2360921.html",pz-news.de,Darum sind Fälschungen bei Fischereischeinen ein Problem - Baden-Württemberg - Pforzheimer-Zeitung,0,LOW,False,,,unknown,2026-07-21T08:31:41.588057
"Laut dem Regierungspräsidium Karlsruhe gibt es aber auch Fälle, bei denen sich Menschen unwissendlich Fälschungen beschaffen","https://www.pz-news.de/baden-wuerttemberg_artikel,-Darum-sind-Faelschungen-bei-Fischereischeinen-ein-Problem-_arid,2360921.html",pz-news.de,Darum sind Fälschungen bei Fischereischeinen ein Problem - Baden-Württemberg - Pforzheimer-Zeitung,0,LOW,False,,,unknown,2026-07-21T08:31:41.645888
"Doch immer mehr Menschen zahlen lieber daf&uuml;r, sich einen solchen Schein durch F&auml;lschungen zu verschaffen",https://www.badische-zeitung.de/verband-immer-mehr-faelschungen-bei-fischereischeinen,badische-zeitung.de,Verband: immer mehr F&auml;lschungen bei Fischereischeinen - Baden-Württemberg - Badische Zeitung,0.1,LOW,False,,,unknown,2026-07-21T08:31:42.771462
Stuttgart (dpa/lsw) - Die Zahl der durch Fälschungen erworbenen Fischereischeine hat laut Experten in den vergangenen Jahren zugenommen,https://www.badische-zeitung.de/verband-immer-mehr-faelschungen-bei-fischereischeinen,badische-zeitung.de,Verband: immer mehr F&auml;lschungen bei Fischereischeinen - Baden-Württemberg - Badische Zeitung,0,LOW,False,,,unknown,2026-07-21T08:31:42.834553
"Das war damals schon immer wieder mal ein Fall"", sagt Reinhart Sosat, Geschäftsführer des Landesfischereiverbandes Baden-Württemberg",https://www.badische-zeitung.de/verband-immer-mehr-faelschungen-bei-fischereischeinen,badische-zeitung.de,Verband: immer mehr F&auml;lschungen bei Fischereischeinen - Baden-Württemberg - Badische Zeitung,0.1,LOW,False,,,unknown,2026-07-21T08:31:42.891713
Stuttgart (dpa/lsw) - Die Zahl an Fälschungen für Fischereischeine nimmt laut dem Landesfischereiverband Baden-Württemberg zu,https://www.badische-zeitung.de/darum-sind-faelschungen-bei-fischereischeinen-ein-problem,badische-zeitung.de,Darum sind F&auml;lschungen bei Fischereischeinen ein Problem - Baden-Württemberg - Badische Zeitung,0,LOW,False,,,unknown,2026-07-21T08:31:43.638773
Audioplayer wird geladenAnzeigeDie Zahl an Fälschungen für Fischereischeine nimmt laut dem Landesfischereiverband Baden-Württemb,https://www.welt.de/regionales/baden-wuerttemberg/article6a5ed37d3d7c8c257075f593/darum-sind-faelschungen-bei-fischereischeinen-ein-problem.html,welt.de,Darum sind Fälschungen bei Fischereischeinen ein Problem - WELT,0,LOW,False,,,unknown,2026-07-21T08:31:44.505079
"Doch immer mehr Menschen zahlen lieber dafür, sich einen solchen Schein durch Fälschungen zu verschaffen",https://www.welt.de/regionales/baden-wuerttemberg/article6a5ed3ba85fbf0a2ffee442f/verband-immer-mehr-faelschungen-bei-fischereischeinen.html,welt.de,Verband: immer mehr Fälschungen bei Fischereischeinen - WELT,0.1,LOW,False,,,unknown,2026-07-21T08:31:46.294317
Audioplayer wird geladenAnzeigeDie Zahl der durch Fälschungen erworbenen Fischereischeine hat laut Experten in den vergangenen Jahren,https://www.welt.de/regionales/baden-wuerttemberg/article6a5ed3ba85fbf0a2ffee442f/verband-immer-mehr-faelschungen-bei-fischereischeinen.html,welt.de,Verband: immer mehr Fälschungen bei Fischereischeinen - WELT,0,LOW,False,,,unknown,2026-07-21T08:31:46.353790
+++ 07:52 IWF genehmigt Ukraine Zugriff auf weitere millionenschwere Hilfskredite +++Der Internationale Währungsfonds (IWF) macht den Weg frei für die sofortige Auszahlung von rund 690 Millionen Dollar (umgerechnet 604 Millionen Euro) an die Ukraine,https://www.n-tv.de/politik/22-00-Russland-greift-Wohnblock-in-Sumy-an-id30859357.html,n-tv.de,Ukraine-Krieg im Liveticker: +++ 10:08 Gouverneur: Eine Tote bei russischem Drohnenangriff in Charki,0,LOW,False,,,unknown,2026-07-21T08:31:48.443303
"Die Ukraine wird mit einem Kreditprogramm in Höhe von 8,1 Milliarden Dollar unterstützt",https://www.n-tv.de/politik/22-00-Russland-greift-Wohnblock-in-Sumy-an-id30859357.html,n-tv.de,Ukraine-Krieg im Liveticker: +++ 10:08 Gouverneur: Eine Tote bei russischem Drohnenangriff in Charki,0,LOW,False,,,unknown,2026-07-21T08:31:48.501385
"Mit der jüngsten Freigabe steigen die bisherigen Auszahlungen auf etwa 2,2 Milliarden Dollar",https://www.n-tv.de/politik/22-00-Russland-greift-Wohnblock-in-Sumy-an-id30859357.html,n-tv.de,Ukraine-Krieg im Liveticker: +++ 10:08 Gouverneur: Eine Tote bei russischem Drohnenangriff in Charki,0,LOW,False,,,unknown,2026-07-21T08:31:48.557881
Juli 2026 · in Cloud &amp; Sicherheit A− A+ ▶ Vorlesen Merken Teilen In diesem Artikel Lesefortschritt 0% Teilen WhatsApp Telegram X / Twitter LinkedIn E-Mail Link kopieren Rund 15,https://www.blogspan.net/kratos-phishing-baukasten-bka-zerschlagen/,blogspan.net,Kratos zerschlagen: BKA legt den Phishing-Baukasten still,0,LOW,False,,,unknown,2026-07-21T08:31:50.816071
"000 Kampagnen pro Monat, Opfer in 30+ Ländern seit Ende 2024 Der Kern: täuschend echte Microsoft-Anmeldeseiten zum Abgreifen von Zugangsdaten Phishing zum Mieten &mdash; der Baukasten dahinter Kratos war kein Werkzeug für Profis, sondern für alle",https://www.blogspan.net/kratos-phishing-baukasten-bka-zerschlagen/,blogspan.net,Kratos zerschlagen: BKA legt den Phishing-Baukasten still,0.1,LOW,False,,,unknown,2026-07-21T08:31:50.871698
"Damals hatte die EU-Kommission diese Zusagen der Firma zunächst akzeptiert, aber damit nicht alle ihre Kritikpunkte ausgeräumt gesehen",https://www.unsertirol24.com/2026/07/20/gefaelschte-und-gefaehrliche-produkte-mega-strafe-fuer-aliexpress/,unsertirol24.com,Gefälschte und gefährliche Produkte- Mega-Strafe für AliExpress - UnserTirol24,0.1,LOW,False,,,unknown,2026-07-21T08:31:52.231490
Der betrachtete Jahresumsatz des Alibaba-Konzerns lag laut Europäischer Kommission bei etwa 120 Mrd,https://www.unsertirol24.com/2026/07/20/gefaelschte-und-gefaehrliche-produkte-mega-strafe-fuer-aliexpress/,unsertirol24.com,Gefälschte und gefährliche Produkte- Mega-Strafe für AliExpress - UnserTirol24,0,LOW,False,,,unknown,2026-07-21T08:31:52.291642
Der Discounter hat eine Datenschutzverletzung bestätigt,https://www.bild.de/leben-wissen/mein-recht-verbraucherportal/kriminelle-greifen-kundendaten-ab-lidl-kunden-im-visier-von-betruegern-6a5e2ee13d7c8c257075e80c,bild.de,Kriminelle greifen Kundendaten ab: Lidl-Kunden im Visier von Betrügern | Leben &amp; Wissen | BILD.d,0,LOW,False,,,unknown,2026-07-21T08:31:52.885875
Das ist passiert Nach Angaben von Lidl waren nicht die eigenen Systeme das Einfallstor,https://www.bild.de/leben-wissen/mein-recht-verbraucherportal/kriminelle-greifen-kundendaten-ab-lidl-kunden-im-visier-von-betruegern-6a5e2ee13d7c8c257075e80c,bild.de,Kriminelle greifen Kundendaten ab: Lidl-Kunden im Visier von Betrügern | Leben &amp; Wissen | BILD.d,0,LOW,False,,,unknown,2026-07-21T08:31:52.947022
"Keine Links anklicken, keine Daten eingeben und im Zweifel direkt über die offizielle Lidl-Website nachprüfen",https://www.bild.de/leben-wissen/mein-recht-verbraucherportal/kriminelle-greifen-kundendaten-ab-lidl-kunden-im-visier-von-betruegern-6a5e2ee13d7c8c257075e80c,bild.de,Kriminelle greifen Kundendaten ab: Lidl-Kunden im Visier von Betrügern | Leben &amp; Wissen | BILD.d,0.1,LOW,False,,,unknown,2026-07-21T08:31:53.004045
Weiterlesen nach der Anzeige Angriffe auf hunderttausende potenzielle Opfer abgewehrt Laut den Angaben wurde der Entwickler und technische Administrator des Phishing-Services namens „Kratos“ in Indonesien von den dortigen Behörden festgenommen,https://www.heise.de/news/Hunderttausende-Opfe-Schlag-gegen-Phishing-Service-11371371.html,heise.de,Hunderttausende Opfer: Schlag gegen Phishing-Service | heise online,0,LOW,False,,,unknown,2026-07-21T08:31:54.665284
[DEBUNKED] Gerüchtekiller: Können beim Schielen die Augen stehen bleiben?,https://correctiv.org/faktencheck/2026/07/17/geruechtekiller-14-koennen-beim-schielen-die-augen-stehen-bleiben/,correctiv.org,Gerüchtekiller: Können beim Schielen die Augen stehen bleiben?,0.9,HIGH,True,FALSE - Debunked by fact-checkers,correctiv.org,factcheck,2026-07-21T08:31:55.791396
Das ist für Redaktionen immer eine spannende Zeit: Gehen alle Gesetze noch wie geplant durch oder kommt es zu Problemen,https://correctiv.org/aktuelles/politik-2/2026/07/17/dritte-abstimmung-wohl-ungueltig-bundestag-muss-ueber-polizeigesetz-neu-abstimmen/,correctiv.org,Dritte Abstimmung ungültig: Bundestag muss über Polizeigesetz neu abstimmen,0.1,LOW,False,,,factcheck,2026-07-21T08:31:56.713012
"Der sitzungsleitende Bundestags-Vizepräsident hat es auch nicht bemerkt Zudem hätte die Sitzungsleitung, in diesem Fall eben Bundestags-Vizepräsident Nouripour, laut Paragraf 48 Absatz 3 der Geschäftsordnung des Bundestag",https://correctiv.org/aktuelles/politik-2/2026/07/17/dritte-abstimmung-wohl-ungueltig-bundestag-muss-ueber-polizeigesetz-neu-abstimmen/,correctiv.org,Dritte Abstimmung ungültig: Bundestag muss über Polizeigesetz neu abstimmen,0,LOW,False,,,factcheck,2026-07-21T08:31:56.773357
"„Wir haben diesen Fall gemäß unserer Richtlinien geprüft“, teilte eine Sprecherin mit",https://correctiv.org/aktuelles/kuenstliche-intelligenz/2026/07/17/afd-firma-drohen-konsequenzen-wegen-partei-ki/,correctiv.org,AfD-Firma drohen Konsequenzen wegen Partei-KI - correctiv.org,0.1,LOW,False,,,factcheck,2026-07-21T08:31:57.824745
"[DEBUNKED] Nein, Hans-Werner Sinn wurde nicht nach einer ZDF-Sendung festgenommen",https://correctiv.org/faktencheck/2026/07/16/nein-hans-werner-sinn-wurde-nicht-nach-einer-zdf-sendung-festgenommen/,correctiv.org,"Nein, Hans-Werner Sinn wurde nicht nach einer ZDF-Sendung festgenommen",0.9,HIGH,True,FALSE - Debunked by fact-checkers,correctiv.org,factcheck,2026-07-21T08:31:58.760976
"Auch dass der Unabhängige Kontrollrat alle Kontrollaufgaben der G10-Kommission und des Bundesdatenschutzbeauftragten übernehmen soll, bewertet der Verein kritisch",https://correctiv.org/aktuelles/sicherheit-und-verteidigung/2026/07/17/mehr-befugnisse-weniger-kontrolle-breite-kritik-an-geplanter-reform-der-nachrichtendienste-bnd-bundesnachrichtendienst-bfv-verfassungsschutz-dobrindt/,correctiv.org,Verbände kritisieren geplante Reform der Nachrichtendienste,0.1,LOW,False,,,factcheck,2026-07-21T08:31:59.639730
