claim,source_url,source_domain,article_title,risk_score,risk_category,has_factcheck,factcheck_rating,factcheck_source,source_type,checked_at
"Er bezeichnete sich als „Vegetarier aus einer muslimischen Familie“, kämpfte für die „Ehe für alle“ und für die Cannabis-Legalisierung",https://correctiv.org/aktuelles/denkanstoss/2026/03/09/erster-ministerpraesident-im-migrationslaendle/,correctiv.org,Erster Ministerpräsident im Migrationsländle - correctiv.org,0.1,LOW,False,,,factcheck,2026-03-09T18:56:07.062266
Er ist keine Symbolfigur für eine liberale Politik,https://correctiv.org/aktuelles/denkanstoss/2026/03/09/erster-ministerpraesident-im-migrationslaendle/,correctiv.org,Erster Ministerpräsident im Migrationsländle - correctiv.org,0.1,LOW,False,,,factcheck,2026-03-09T18:56:07.276843
"Dem Bundesland, in dem inzwischen mehr als jeder Dritte Migrationshintergrund hat und das als Wirtschaftswunderland gilt",https://correctiv.org/aktuelles/denkanstoss/2026/03/09/erster-ministerpraesident-im-migrationslaendle/,correctiv.org,Erster Ministerpräsident im Migrationsländle - correctiv.org,0,LOW,False,,,factcheck,2026-03-09T18:56:07.493956
[DEBUNKED] Gefälschtes CORRECTIV-Video: Spuren führen zu russischer Einflusskampagne,https://correctiv.org/faktencheck/hintergrund/2026/03/06/gefaelschtes-correctiv-video-spuren-fuehren-zu-russischer-einflusskampagne-overload-matrjoschka/,correctiv.org,Gefälschtes CORRECTIV-Video: Spuren führen zu russischer Einflusskampagne,0.9,HIGH,True,FALSE - Debunked by fact-checkers,correctiv.org,factcheck,2026-03-09T18:56:09.771995
In Sachsen gibt es an jeder zweiten allgemeinbildenden Schule keine Sozialarbeiterin,https://correctiv.org/aktuelles/bildung/2026/03/06/bildungsgewerkschaft-wissenschaftler-und-traeger-fordern-mehr-schulsozialarbeit/,correctiv.org,Gewerkschaft und Wissenschaftler fordern mehr Schulsozialarbeit,0.1,LOW,False,,,factcheck,2026-03-09T18:56:11.018936
Ähnlich schlecht ist die Lage in Thüringen: Gut 43 Prozent der allgemeinbildenden Schulen haben keine Sozialarbeit,https://correctiv.org/aktuelles/bildung/2026/03/06/bildungsgewerkschaft-wissenschaftler-und-traeger-fordern-mehr-schulsozialarbeit/,correctiv.org,Gewerkschaft und Wissenschaftler fordern mehr Schulsozialarbeit,0.1,LOW,False,,,factcheck,2026-03-09T18:56:11.233152
Besonders an Grundschulen und Förderschulen in Thüringen fehlen jene Fachkräfte – rund 60 Prozent dieser Schulen haben keine Schulsozialarbeit,https://correctiv.org/aktuelles/bildung/2026/03/06/bildungsgewerkschaft-wissenschaftler-und-traeger-fordern-mehr-schulsozialarbeit/,correctiv.org,Gewerkschaft und Wissenschaftler fordern mehr Schulsozialarbeit,0.1,LOW,False,,,factcheck,2026-03-09T18:56:11.479772
"„Der Sieg von Martin Vincentz wird alle widerlegen, die von einer fortwährenden Radikalisierung der AfD sprechen“, sagt Krah gegenüber CORRECTIV",https://correctiv.org/aktuelles/afd/2026/03/06/helferich-gegen-vincentz-afd-parteitag-in-nrw/,correctiv.org,Völkisches Lager: Showdown beim NRW-Parteitag der AfD,0.1,LOW,False,,,factcheck,2026-03-09T18:56:12.917584
"März erklärte Trump laut dem US-Medium Axios, er wolle an der Auswahl des nächsten Staatsoberhaupts beteiligt werden, so wie kürzlich nach dem US-Militäreinsatz in Venezuela",https://correctiv.org/aktuelles/international/2026/03/06/fragen-und-antworten-zum-krieg-im-iran/,correctiv.org,Fragen und Antworten zum Krieg im Iran,0,LOW,False,,,factcheck,2026-03-09T18:56:14.349827
"[DEBUNKED] Nein, Videos zeigen nicht die USS Abraham Lincoln nach iranischen Angriffen",https://correctiv.org/faktencheck/2026/03/05/nein-diese-videos-zeigen-keinen-iranischen-angriff-auf-die-uss-abraham-lincoln/,correctiv.org,"Nein, Videos zeigen nicht die USS Abraham Lincoln nach iranischen Angriffen",0.9,HIGH,True,FALSE - Debunked by fact-checkers,correctiv.org,factcheck,2026-03-09T18:56:15.538450
[DEBUNKED] Potsdam-Recherche: Erfolg gegen AfD-Erlangen,https://correctiv.org/in-eigener-sache/2026/03/06/potsdam-recherche-erfolg-gegen-afd-verband-erlangen/,correctiv.org,Potsdam-Recherche: Erfolg gegen AfD-Erlangen,0.9,HIGH,True,FALSE - Debunked by fact-checkers,correctiv.org,factcheck,2026-03-09T18:56:16.590222
[DEBUNKED] Raketen über Dubai: Aktuell geteiltes Video ist schon Jahre alt,https://correctiv.org/faktencheck/2026/03/05/video-von-iran-raketen-ueber-dubai-ist-jahre-alt/,correctiv.org,Raketen über Dubai: Aktuell geteiltes Video ist schon Jahre alt,0.9,HIGH,True,FALSE - Debunked by fact-checkers,correctiv.org,factcheck,2026-03-09T18:56:17.747049
[DEBUNKED] Sozialleistungen im Ausland? Frohnmaier mit irreführenden Aussagen zu Ukrainern,https://correctiv.org/faktencheck/2026/03/05/markus-frohnmaier-irrefuehrende-aussage-zu-sozialleistungen-fuer-menschen-aus-ukraine/,correctiv.org,Sozialleistungen im Ausland? Frohnmaier mit irreführenden Aussagen zu Ukrainern,0.9,HIGH,True,FALSE - Debunked by fact-checkers,correctiv.org,factcheck,2026-03-09T18:56:18.935612
[DEBUNKED] Angriff auf Schule im Iran: Grok streut Falschbehauptung über Medien,https://correctiv.org/faktencheck/2026/03/05/angriff-auf-schule-im-iran-ki-programm-grok-lag-falsch-zdf-zeigte-authentisches-bildmaterial/,correctiv.org,Angriff auf Schule im Iran: Grok streut Falschbehauptung über Medien,0.9,HIGH,True,FALSE - Debunked by fact-checkers,correctiv.org,factcheck,2026-03-09T18:56:20.120061
In Sachsen hingegen ist die Einstufung als gesichert rechtsextremistisch gerichtlich bestätigt,https://correctiv.org/aktuelles/afd/2026/03/05/justiz-ab-wann-ist-die-afd-gesichert-rechtsextrem/,correctiv.org,Gerichte: Ab wann gilt die Partei als „gesichert rechtsextremistisch“?,0,LOW,False,,,factcheck,2026-03-09T18:56:21.564842
"Aber diese Bestrebungen prägen die Partei laut Gericht nicht so stark, dass „ihrem Gesamtbild nach eine verfassungsfeindliche Grundtendenz“ festgestellt werden könne",https://correctiv.org/aktuelles/afd/2026/03/05/justiz-ab-wann-ist-die-afd-gesichert-rechtsextrem/,correctiv.org,Gerichte: Ab wann gilt die Partei als „gesichert rechtsextremistisch“?,0,LOW,False,,,factcheck,2026-03-09T18:56:21.787630
Anders in Sachsen: Dort hat das Oberverwaltungsgericht Bautzen die Einstufung bereits gerichtlich bestätigt,https://correctiv.org/aktuelles/afd/2026/03/05/justiz-ab-wann-ist-die-afd-gesichert-rechtsextrem/,correctiv.org,Gerichte: Ab wann gilt die Partei als „gesichert rechtsextremistisch“?,0,LOW,False,,,factcheck,2026-03-09T18:56:21.991866
"[DEBUNKED] Nein, Manuel Hagel sagte nicht, dass Bio-Diesel-LKW CO2-neutral seien",https://correctiv.org/faktencheck/2026/03/04/cdu-politiker-manuel-hagel-sagte-nicht-dass-bio-diesel-lkw-co2-neutral-seien/,correctiv.org,"Nein, Manuel Hagel sagte nicht, dass Bio-Diesel-LKW CO2-neutral seien",0.9,HIGH,True,FALSE - Debunked by fact-checkers,correctiv.org,factcheck,2026-03-09T18:56:23.233603
"Die Lücke soll der sogenannte Nationale Sicherheitsrat schließen: ein Ort, an dem alle Fäden zusammenlaufen",https://correctiv.org/aktuelles/sicherheit-und-verteidigung/2026/03/04/merz-geheimzirkel-im-kanzleramt-nationaler-sicherheitsrat-verteidigung-sicherheit-bundeswehr-sicherheitspolitik/,correctiv.org,Nationaler Sicherheitsrat: Merz&#039; Prestigeprojekt hat Probleme,0.1,LOW,False,,,factcheck,2026-03-09T18:56:24.612495
"Bislang scheiterten solche Vorhaben laut Medienberichten aber an Kompetenzstreitigkeiten, vor allem zwischen dem Kanzleramt und dem Auswärtigen Amt",https://correctiv.org/aktuelles/sicherheit-und-verteidigung/2026/03/04/merz-geheimzirkel-im-kanzleramt-nationaler-sicherheitsrat-verteidigung-sicherheit-bundeswehr-sicherheitspolitik/,correctiv.org,Nationaler Sicherheitsrat: Merz&#039; Prestigeprojekt hat Probleme,0.1,LOW,False,,,factcheck,2026-03-09T18:56:24.828575
"Damit macht die AfD auf eine besonders skurrile Art und Weise Stimmung in Richtung völkischer Positionen – und lenkt damit gleichzeitig davon ab, dass sie keine konsistente außenpolitische Stellung vertritt",https://correctiv.org/aktuelles/neue-rechte/2026/03/04/afd-und-iran-irrungen-wirrungen-und-der-voelkische-kern/,correctiv.org,Nahost-Debatte sorgt für Streit in AfD,0.1,LOW,False,,,factcheck,2026-03-09T18:56:26.287700
"27, 2026 | Analyse Gastautorin Yvonne Schmidt Die Rolle von Frauen im Rechtsextremismus wird noch immer unterschätzt",https://www.volksverpetzer.de/analyse/lukreta-afd-frauen/,www.volksverpetzer.de,Rechtsextreme Politik für Frauen: Lukreta als AfD-Vorfeldorganisation - Volksverpetzer,0.1,LOW,False,,,factcheck,2026-03-09T18:56:28.706066
Die Forschung zeigt: Die Gesellschaft schätzt weibliche Personen meist als weniger gewalttätig und politisch uninteressiert ein,https://www.volksverpetzer.de/analyse/lukreta-afd-frauen/,www.volksverpetzer.de,Rechtsextreme Politik für Frauen: Lukreta als AfD-Vorfeldorganisation - Volksverpetzer,0,LOW,False,,,factcheck,2026-03-09T18:56:28.924492
"Einerseits seien Frauen in der rechtsextremen, männerdominierten Szene noch immer unterrepräsentiert",https://www.volksverpetzer.de/analyse/lukreta-afd-frauen/,www.volksverpetzer.de,Rechtsextreme Politik für Frauen: Lukreta als AfD-Vorfeldorganisation - Volksverpetzer,0.1,LOW,False,,,factcheck,2026-03-09T18:56:29.064131
"108 Seiten dick, wies aber trotzdem erhebliche Lücken auf: Das BfV berücksichtigte keine Anträge und Äußerungen in Parlamenten, es konzentrierte sich fast ausschließlich auf den Bundesverband der Partei und ging auf diverse Punkte wie z",https://www.volksverpetzer.de/analyse/verwaltungsgericht-koeln-afd-verbotsverfahren/,www.volksverpetzer.de,Warum der Köln-Beschluss einem AfD-Verbotsverfahren nicht entgegensteht - Volksverpetzer,0.1,LOW,False,,,factcheck,2026-03-09T18:56:38.571540
"26, 2026 | Serie Es gibt nicht nur immer mehr Prozesse gegen Demokratiefeinde – es gibt auch immer mehr Urteile",https://www.volksverpetzer.de/serie/urteile-februar-geldstrafe-halemba-2/,www.volksverpetzer.de,Urteile Februar 2026: Hohe Geldstrafe für AfD-Abgeordneten Halemba - Volksverpetzer,0.1,LOW,False,,,factcheck,2026-03-09T18:56:40.759573
Jeder Wahlkreis wählt mit den Erststimmen eine:n Direktkandidat:in,https://www.volksverpetzer.de/analyse/wahlkarten-osten/,www.volksverpetzer.de,"Diese Wahlkarten machen den Osten rechter, als er ist! - Volksverpetzer",0,LOW,False,,,factcheck,2026-03-09T18:56:42.096393
[DEBUNKED] Heizungsgesetz: Regierung will deine Nebenkosten massiv erhöhen - Volksverpetzer,https://www.volksverpetzer.de/aktuelles/heizungsgesetz-erhoeht-nebenkosten/,www.volksverpetzer.de,Heizungsgesetz: Regierung will deine Nebenkosten massiv erhöhen - Volksverpetzer,0.9,HIGH,True,FALSE - Debunked by fact-checkers,www.volksverpetzer.de,factcheck,2026-03-09T18:56:43.231966
"Und das Wort von der „Zeitenwende“, das uns seitdem begleitet, oder der Begriff „Epochenbruch“, den der Bundespräsident prägte – wie immer Sie es nennen mögen&nbsp;–: Es ist eine tiefe Zäsur",https://www.volksverpetzer.de/faktencheck/merz-recht-weltkrieg-ukraine/,www.volksverpetzer.de,Merz hat nicht Unrecht: Der 2. Weltkrieg in der Ukraine dauerte weniger als 4 Jahre - Volksverpetzer,0.1,LOW,False,,,factcheck,2026-03-09T18:56:45.216839
"Dass der Kanzler mit seinem Satz die Perspektive der Ukraine meinte, bestätigt uns das Bundeskanzleramt auf Nachfrage: „Der Bundeskanzler hat das aus der Sicht der Sowjetunion als eines angegriffenen Landes im Zweiten Weltkrieg genannt",https://www.volksverpetzer.de/faktencheck/merz-recht-weltkrieg-ukraine/,www.volksverpetzer.de,Merz hat nicht Unrecht: Der 2. Weltkrieg in der Ukraine dauerte weniger als 4 Jahre - Volksverpetzer,0,LOW,False,,,factcheck,2026-03-09T18:56:45.416890
"Eine offizielle Anfrage bei der Presseabteilung der Stiftung nach den Hintergründen dieser problematischen Repräsentation förderte eine Antwort zutage, die für Kopfschütteln sorgt",https://www.volksverpetzer.de/analyse/tanya-inyshina-mixmarkt/,www.volksverpetzer.de,Tanya Inyshina &amp; Mix Markt: Sowjet-Nostalgie und russische Propaganda? - Volksverpetzer,0,LOW,False,,,factcheck,2026-03-09T18:56:47.107579
"[DEBUNKED] Sorry, Bodderas, wir kennen die ungefähre Höhe der COVID-19-Todesfälle - Volksverpetzer",https://www.volksverpetzer.de/analyse/bodderas-covid-19-todesfaelle/,www.volksverpetzer.de,"Sorry, Bodderas, wir kennen die ungefähre Höhe der COVID-19-Todesfälle - Volksverpetzer",0.9,HIGH,True,FALSE - Debunked by fact-checkers,www.volksverpetzer.de,factcheck,2026-03-09T18:56:50.145309
[DEBUNKED] Sen. Thom Tillis didn't ask Kristi Noem about salacious text from Corey Lewandowski | Snopes.com,https://www.snopes.com/fact-check/tillis-noem-lewandowski-text/,www.snopes.com,Sen. Thom Tillis didn't ask Kristi Noem about salacious text from Corey Lewandowski | Snopes.com,0.9,HIGH,True,FALSE - Debunked by fact-checkers,www.snopes.com,factcheck,2026-03-09T18:56:50.229523
[DEBUNKED] 16 claims involving Trump's DHS secretary Kristi Noem we've investigated | Snopes.com,https://www.snopes.com/collections/kristi-noem-trump-rumors-collection/,www.snopes.com,16 claims involving Trump's DHS secretary Kristi Noem we've investigated | Snopes.com,0.9,HIGH,True,FALSE - Debunked by fact-checkers,www.snopes.com,factcheck,2026-03-09T18:56:50.318226
[DEBUNKED] Video of Iranian missile strikes on Tel Aviv predates 2026 war | Snopes.com,https://www.snopes.com/fact-check/iran-strikes-tel-aviv-video/,www.snopes.com,Video of Iranian missile strikes on Tel Aviv predates 2026 war | Snopes.com,0.9,HIGH,True,FALSE - Debunked by fact-checkers,www.snopes.com,factcheck,2026-03-09T18:56:50.398835
[DEBUNKED] Who bombed girls' school in Iran? Examining unproven claims of military misfire | Snopes.com,https://www.snopes.com/news/2026/03/03/iran-girls-school-missile-attack/,www.snopes.com,Who bombed girls' school in Iran? Examining unproven claims of military misfire | Snopes.com,0.9,HIGH,True,FALSE - Debunked by fact-checkers,www.snopes.com,factcheck,2026-03-09T18:56:50.494608
[DEBUNKED] There's no proof Iran bombed Minab girls' school. Evidence points to likely US role | Snopes.com,https://www.snopes.com/news/2026/03/07/iran-girls-school-strike/,www.snopes.com,There's no proof Iran bombed Minab girls' school. Evidence points to likely US role | Snopes.com,0.9,HIGH,True,FALSE - Debunked by fact-checkers,www.snopes.com,factcheck,2026-03-09T18:56:50.592383
[DEBUNKED] Did Bill Gates donate $50M to create 'biologically modified' crops? Here's the truth | Snopes.com,https://www.snopes.com/fact-check/bill-gates-modified-crops/,www.snopes.com,Did Bill Gates donate $50M to create 'biologically modified' crops? Here's the truth | Snopes.com,0.9,HIGH,True,FALSE - Debunked by fact-checkers,www.snopes.com,factcheck,2026-03-09T18:56:50.697745
"[DEBUNKED] Watch out for claim photo shows James Peterson, man lobotomized for being gay in 1948 | Snopes.com",https://www.snopes.com/fact-check/james-peterson-lobotomy/,www.snopes.com,"Watch out for claim photo shows James Peterson, man lobotomized for being gay in 1948 | Snopes.com",0.9,HIGH,True,FALSE - Debunked by fact-checkers,www.snopes.com,factcheck,2026-03-09T18:56:50.875346
[DEBUNKED] Did Hillary Clinton supply Iran with uranium? Inspecting her role in nuclear deal | Snopes.com,https://www.snopes.com/fact-check/hillary-clinton-iran-uranium/,www.snopes.com,Did Hillary Clinton supply Iran with uranium? Inspecting her role in nuclear deal | Snopes.com,0.9,HIGH,True,FALSE - Debunked by fact-checkers,www.snopes.com,factcheck,2026-03-09T18:56:51.130624
[DEBUNKED] U.S.-Israel war on Iran: 14 claims we've examined | Snopes.com,https://www.snopes.com/collections/us-israel-war-iran-claims/,www.snopes.com,U.S.-Israel war on Iran: 14 claims we've examined | Snopes.com,0.9,HIGH,True,FALSE - Debunked by fact-checkers,www.snopes.com,factcheck,2026-03-09T18:56:51.228852
"[DEBUNKED] Medicare durable medical equipment moratorium hits new suppliers, not patients. It could still affect your care | Snopes.com",https://www.snopes.com/fact-check/trump-medicare-moratorium-medical-equipment/,www.snopes.com,"Medicare durable medical equipment moratorium hits new suppliers, not patients. It could still affec",0.9,HIGH,True,FALSE - Debunked by fact-checkers,www.snopes.com,factcheck,2026-03-09T18:56:51.507640
"[DEBUNKED] PolitiFact | What did Sen. Markwayne Mullin, Trump&#x27;s DHS secretary pick, say about the ‘smell’ of war?",http://www.politifact.com/article/2026/mar/06/Markwayne-Mullin-smell-war-Afghanistan-Noem/,www.politifact.com,"PolitiFact | What did Sen. Markwayne Mullin, Trump&#x27;s DHS secretary pick, say about the ‘smell’ ",0.9,HIGH,True,FALSE - Debunked by fact-checkers,www.politifact.com,factcheck,2026-03-09T18:56:51.578367
"[DEBUNKED] PolitiFact | No, Joe Biden didn’t reverse US policy to deport felony criminals. That’s False.",http://www.politifact.com/factchecks/2026/mar/05/ashley-moody/immigration-biden-deportation-criminals-policy/,www.politifact.com,"PolitiFact | No, Joe Biden didn’t reverse US policy to deport felony criminals. That’s False.",0.9,HIGH,True,FALSE - Debunked by fact-checkers,www.politifact.com,factcheck,2026-03-09T18:56:51.939279
[DEBUNKED] PolitiFact | President Donald Trump fires Kristi Noem as DHS secretary. A look back at her falsehoods,http://www.politifact.com/article/2026/mar/05/kristi-noem-dhs-trump-mullin/,www.politifact.com,PolitiFact | President Donald Trump fires Kristi Noem as DHS secretary. A look back at her falsehood,0.9,HIGH,True,FALSE - Debunked by fact-checkers,www.politifact.com,factcheck,2026-03-09T18:56:52.005089
"More Info I would like to contribute One Time Monthly Yearly Join Now James Fishback stated on February 26, 2026 in a speech: Artificial intelligence data centers ""drive up electric bills by 30 or 40%"" and ""suck up 500,000 gallons of water a day",http://www.politifact.com/factchecks/2026/mar/04/james-fishback/ai-data-centers-energy-water-florida-governor/,www.politifact.com,"PolitiFact | Fact-checking Florida governor candidate James Fishback on AI data center water, energy",0,LOW,False,,,factcheck,2026-03-09T18:56:52.419774
"However, PolitiFact found no public data showing 30% or 40% electric bill increases",http://www.politifact.com/factchecks/2026/mar/04/james-fishback/ai-data-centers-energy-water-florida-governor/,www.politifact.com,"PolitiFact | Fact-checking Florida governor candidate James Fishback on AI data center water, energy",0,LOW,False,,,factcheck,2026-03-09T18:56:52.625781
"""What it actually does, is it drives up your electric bills by 30 or 40%",http://www.politifact.com/factchecks/2026/mar/04/james-fishback/ai-data-centers-energy-water-florida-governor/,www.politifact.com,"PolitiFact | Fact-checking Florida governor candidate James Fishback on AI data center water, energy",0,LOW,False,,,factcheck,2026-03-09T18:56:52.832231
"[DEBUNKED] PolitiFact | Viral video shows strikes on Yemen, not attack on U.S. airbase",http://www.politifact.com/factchecks/2026/mar/04/tweets/iran-strikes-airbase-yemen-explosion/,www.politifact.com,"PolitiFact | Viral video shows strikes on Yemen, not attack on U.S. airbase",0.9,HIGH,True,FALSE - Debunked by fact-checkers,www.politifact.com,factcheck,2026-03-09T18:56:52.917817
[DEBUNKED] Fake image of Iranian children’s funeral shared online by MP – Full Fact,https://fullfact.org/conflict/fake-image-iranian-schoolchildren-burial/,fullfact.org,Fake image of Iranian children’s funeral shared online by MP – Full Fact,0.9,HIGH,True,FALSE - Debunked by fact-checkers,fullfact.org,factcheck,2026-03-09T18:56:53.896413
[DEBUNKED] Post about Toby Carvery giveaway is fake – Full Fact,https://fullfact.org/shopping/toby-fake-carvery-deal/,fullfact.org,Post about Toby Carvery giveaway is fake – Full Fact,0.9,HIGH,True,FALSE - Debunked by fact-checkers,fullfact.org,factcheck,2026-03-09T18:56:54.999080
"[DEBUNKED] AI images, old videos and false viral claims: what to watch out for when checking posts about the Middle East on social media – Full Fact",https://fullfact.org/conflict/middle-east-conflict-overview/,fullfact.org,"AI images, old videos and false viral claims: what to watch out for when checking posts about the Mi",0.9,HIGH,True,FALSE - Debunked by fact-checkers,fullfact.org,factcheck,2026-03-09T18:56:55.621879
[DEBUNKED] NYC mayor not banned from UK – Full Fact,https://fullfact.org/us/mamdani-uk-lost-moral-compass-false/,fullfact.org,NYC mayor not banned from UK – Full Fact,0.9,HIGH,True,FALSE - Debunked by fact-checkers,fullfact.org,factcheck,2026-03-09T18:56:56.795157
[DEBUNKED] Footage of 2015 fire shared with false claims it shows Iran attacking Dubai – Full Fact,https://fullfact.org/conflict/dubai-cia-base-iran-attack-video-false/,fullfact.org,Footage of 2015 fire shared with false claims it shows Iran attacking Dubai – Full Fact,0.9,HIGH,True,FALSE - Debunked by fact-checkers,fullfact.org,factcheck,2026-03-09T18:56:57.415777
[DEBUNKED] Missile strikes video does not show recent attack on Dubai – Full Fact,https://fullfact.org/conflict/old-video-2024-shared-recent-dubai-attack/,fullfact.org,Missile strikes video does not show recent attack on Dubai – Full Fact,0.9,HIGH,True,FALSE - Debunked by fact-checkers,fullfact.org,factcheck,2026-03-09T18:56:58.510586
[DEBUNKED] Video of blaze doesn’t show aftermath of drone attack on US embassy in Saudi Arabia – Full Fact,https://fullfact.org/conflict/us-embassy-saudi-arabia-riyadh-fire-video-false/,fullfact.org,Video of blaze doesn’t show aftermath of drone attack on US embassy in Saudi Arabia – Full Fact,0.9,HIGH,True,FALSE - Debunked by fact-checkers,fullfact.org,factcheck,2026-03-09T18:56:59.132651
[DEBUNKED] Biden Makes Flawed Comparisons with Trump - FactCheck.org,https://www.factcheck.org/2026/03/biden-makes-flawed-comparisons-with-trump/,www.factcheck.org,Biden Makes Flawed Comparisons with Trump - FactCheck.org,0.9,HIGH,True,FALSE - Debunked by fact-checkers,www.factcheck.org,factcheck,2026-03-09T18:56:59.765631
[DEBUNKED] FactChecking Claims in Casey Means&#039; Surgeon General Confirmation Hearing - FactCheck.org,https://www.factcheck.org/2026/03/factchecking-claims-in-casey-means-surgeon-general-confirmation-hearing/,www.factcheck.org,FactChecking Claims in Casey Means&#039; Surgeon General Confirmation Hearing - FactCheck.org,0.9,HIGH,True,FALSE - Debunked by fact-checkers,www.factcheck.org,factcheck,2026-03-09T18:57:00.515225
[DEBUNKED] FactChecking Trump&#039;s State of the Union Address - FactCheck.org,https://www.factcheck.org/2026/02/factchecking-trumps-state-of-the-union-address/,www.factcheck.org,FactChecking Trump&#039;s State of the Union Address - FactCheck.org,0.9,HIGH,True,FALSE - Debunked by fact-checkers,www.factcheck.org,factcheck,2026-03-09T18:57:01.616355
[DEBUNKED] A Pre-SOTU Guide to Trump&#039;s Economic Claims - FactCheck.org,https://www.factcheck.org/2026/02/a-pre-sotu-guide-to-trumps-economic-claims/,www.factcheck.org,A Pre-SOTU Guide to Trump&#039;s Economic Claims - FactCheck.org,0.9,HIGH,True,FALSE - Debunked by fact-checkers,www.factcheck.org,factcheck,2026-03-09T18:57:02.073543
[DEBUNKED] Trump and Musk Amplify Long-Ago Debunked Mail-In Vote Fraud Claim - FactCheck.org,https://www.factcheck.org/2026/02/trump-and-musk-amplify-long-ago-debunked-mail-in-vote-fraud-claim/,www.factcheck.org,Trump and Musk Amplify Long-Ago Debunked Mail-In Vote Fraud Claim - FactCheck.org,0.9,HIGH,True,FALSE - Debunked by fact-checkers,www.factcheck.org,factcheck,2026-03-09T18:57:03.402924
"6% in the first quarter of 2025, which covers the three months from January to March, real gross domestic product (meaning it has been adjusted for inflation) grew at an annualized rate of 3",https://www.factcheck.org/2026/02/trump-oversells-recent-u-s-economic-growth/,www.factcheck.org,Trump Oversells Recent U.S. Economic Growth - FactCheck.org,0,LOW,False,,,factcheck,2026-03-09T18:57:03.854408
8% in the second quarter of 2025 and at a rate of 4,https://www.factcheck.org/2026/02/trump-oversells-recent-u-s-economic-growth/,www.factcheck.org,Trump Oversells Recent U.S. Economic Growth - FactCheck.org,0,LOW,False,,,factcheck,2026-03-09T18:57:04.062690
[DEBUNKED] Fact Check: Video Purporting To Show Iddo Netanyahu's House Fire PREDATES The 2026 U.S.-Israel Attack On Iran | Lead Stories,https://leadstories.com/hoax-alert/2026/03/fact-check-video-of-house-fire-predates-2026-war-between-us-israel-and-iran.html,leadstories.com,Fact Check: Video Purporting To Show Iddo Netanyahu's House Fire PREDATES The 2026 U.S.-Israel Attac,0.9,HIGH,True,FALSE - Debunked by fact-checkers,leadstories.com,factcheck,2026-03-09T18:57:04.229398
[DEBUNKED] Fact Check: Trump Did NOT Post 'Mojtaba Khamenei Are You Ready To Meet Your Father?' | Lead Stories,https://leadstories.com/hoax-alert/2026/03/fact-check-trump-did-not-post-mojtaba-khamenei-are-you-ready-to-meet-your-father.html,leadstories.com,Fact Check: Trump Did NOT Post 'Mojtaba Khamenei Are You Ready To Meet Your Father?' | Lead Stories,0.9,HIGH,True,FALSE - Debunked by fact-checkers,leadstories.com,factcheck,2026-03-09T18:57:04.406152
[DEBUNKED] Fact Check: Joke Post Said Epstein Photo With 'Why We Fight' Caption Inserted In 'Manual For Warfighters' By Army Prankster -- Not Real | Lead Stories,https://leadstories.com/hoax-alert/2026/03/fact-check-jeffrey-epstein-photo-why-we-fight-manual-warfighters-hegseth-prankster.html,leadstories.com,Fact Check: Joke Post Said Epstein Photo With 'Why We Fight' Caption Inserted In 'Manual For Warfigh,0.9,HIGH,True,FALSE - Debunked by fact-checkers,leadstories.com,factcheck,2026-03-09T18:57:04.571816
