claim,source_url,source_domain,article_title,risk_score,risk_category,has_factcheck,factcheck_rating,factcheck_source,source_type,checked_at
"[DEBUNKED] PolitiFact | At GlobalFact 2026, fact-checkers report challenges, resilience",http://www.politifact.com/article/2026/jun/24/at-globalfact-2026-fact-checkers-report-challenges/,www.politifact.com,"PolitiFact | At GlobalFact 2026, fact-checkers report challenges, resilience",0.9,HIGH,True,FALSE - Debunked by fact-checkers,www.politifact.com,factcheck,2026-06-27T13:46:32.245380
[DEBUNKED] PolitiFact | It’s unclear who will pay for Iran’s $300B reconstruction fund. Here’s why,http://www.politifact.com/article/2026/jun/22/trump-iran-300-billion-fund/,www.politifact.com,PolitiFact | It’s unclear who will pay for Iran’s $300B reconstruction fund. Here’s why,0.9,HIGH,True,FALSE - Debunked by fact-checkers,www.politifact.com,factcheck,2026-06-27T13:46:32.543655
[DEBUNKED] PolitiFact | AI ads skewed Talarico’s words and positions. It’s part of a changing scene in political advertising,http://www.politifact.com/article/2026/jun/22/talarico-artificial-intelligence-ads-senate-texas/,www.politifact.com,PolitiFact | AI ads skewed Talarico’s words and positions. It’s part of a changing scene in politica,0.9,HIGH,True,FALSE - Debunked by fact-checkers,www.politifact.com,factcheck,2026-06-27T13:46:32.630723
[DEBUNKED] PolitiFact | What PolitiFact learned from looking at presidential falsehoods throughout U.S. history,http://www.politifact.com/article/2026/jun/22/america-250-presidential-falsehoods-lies/,www.politifact.com,PolitiFact | What PolitiFact learned from looking at presidential falsehoods throughout U.S. history,0.9,HIGH,True,FALSE - Debunked by fact-checkers,www.politifact.com,factcheck,2026-06-27T13:46:32.735050
[DEBUNKED] Video of ‘British Muslims’ marching for ‘halal standards’ is an AI fake – Full Fact,https://fullfact.org/culture-and-society/muslims-march-halal-standards-fake-AI/,fullfact.org,Video of ‘British Muslims’ marching for ‘halal standards’ is an AI fake – Full Fact,0.9,HIGH,True,FALSE - Debunked by fact-checkers,fullfact.org,factcheck,2026-06-27T13:46:33.864320
[DEBUNKED] Image of queueing traffic does not show people leaving Crimea over fuel shortages – Full Fact,https://fullfact.org/world/crimea-fuel-shortage-queue-image-armenia-misleading/,fullfact.org,Image of queueing traffic does not show people leaving Crimea over fuel shortages – Full Fact,0.9,HIGH,True,FALSE - Debunked by fact-checkers,fullfact.org,factcheck,2026-06-27T13:46:34.510715
"Who we are Our team Careers Funding Independence Impartiality Feedback &amp; corrections International networks FAQs Contact us Search Home / Economy, Business &amp; Finance What does the new 22% charge mean for stocks and shares ISAs",https://fullfact.org/economy/stocks-and-shares-isa-22-percent/,fullfact.org,What does the new 22% charge mean for stocks and shares ISAs? – Full Fact,0,LOW,False,,,factcheck,2026-06-27T13:46:35.201932
25 June 2026 What was claimed The government is introducing a 22% tax on stocks and shares ISAs,https://fullfact.org/economy/stocks-and-shares-isa-22-percent/,fullfact.org,What does the new 22% charge mean for stocks and shares ISAs? – Full Fact,0,LOW,False,,,factcheck,2026-06-27T13:46:35.259620
"The 22% rate will only apply to interest gained on cash held inside stocks and shares ISAs not the actual cash itself, and it also won’t apply to investment growth in a stocks and shares ISA",https://fullfact.org/economy/stocks-and-shares-isa-22-percent/,fullfact.org,What does the new 22% charge mean for stocks and shares ISAs? – Full Fact,0,LOW,False,,,factcheck,2026-06-27T13:46:35.317516
"[DEBUNKED] No, Amazon is not selling HP laptops for £3 – Full Fact",https://fullfact.org/shopping/amazon-laptop-deals-fake-repeated/,fullfact.org,"No, Amazon is not selling HP laptops for £3 – Full Fact",0.9,HIGH,True,FALSE - Debunked by fact-checkers,fullfact.org,factcheck,2026-06-27T13:46:35.874375
"The UKSA also said it was worried that the Conservatives were giving the impression that “welfare” was mainly about sickness and out-of-work benefits, when “approximately 55% of social security expenditure is spent on pensioners”",https://fullfact.org/economy/statistics-watchdog-challenges-badenoch-over-welfare-claim-after-full-fact-intervention/,fullfact.org,Statistics watchdog challenges Badenoch over welfare claim after Full Fact intervention – Full Fact,0,LOW,False,,,factcheck,2026-06-27T13:46:36.342180
[DEBUNKED] Grimsby housing development homes aren’t ‘exclusively for immigrants’ – Full Fact,https://fullfact.org/immigration/grimsby-immigrants-ferriby-fields-false/,fullfact.org,Grimsby housing development homes aren’t ‘exclusively for immigrants’ – Full Fact,0.9,HIGH,True,FALSE - Debunked by fact-checkers,fullfact.org,factcheck,2026-06-27T13:46:36.979677
[DEBUNKED] Video shows explosions in China not Russian attack on Ukraine – Full Fact,https://fullfact.org/conflict/russia-ukraine-attack-miscaptioned-video/,fullfact.org,Video shows explosions in China not Russian attack on Ukraine – Full Fact,0.9,HIGH,True,FALSE - Debunked by fact-checkers,fullfact.org,factcheck,2026-06-27T13:46:37.445077
[DEBUNKED] More AI videos of small boat crossings circulate on Facebook – Full Fact,https://fullfact.org/immigration/ai-video-migrant-boat/,fullfact.org,More AI videos of small boat crossings circulate on Facebook – Full Fact,0.9,HIGH,True,FALSE - Debunked by fact-checkers,fullfact.org,factcheck,2026-06-27T13:46:37.897495
[DEBUNKED] Incorrect name for crocodile attack arrest circulates online – Full Fact,https://fullfact.org/crime/crocodile-attack-arrest-misidentified/,fullfact.org,Incorrect name for crocodile attack arrest circulates online – Full Fact,0.9,HIGH,True,FALSE - Debunked by fact-checkers,fullfact.org,factcheck,2026-06-27T13:46:38.360636
[DEBUNKED] How Trump&#039;s Preliminary Deal with Iran Compares with His Rhetoric - FactCheck.org,https://www.factcheck.org/2026/06/how-trumps-preliminary-deal-with-iran-compares-with-his-rhetoric/,www.factcheck.org,How Trump&#039;s Preliminary Deal with Iran Compares with His Rhetoric - FactCheck.org,0.9,HIGH,True,FALSE - Debunked by fact-checkers,www.factcheck.org,factcheck,2026-06-27T13:46:38.695323
"&#8220;We cut the flow of fentanyl across our border by 59%, which is unheard of,&#8221; Trump said in May 22 remarks in New York",https://www.factcheck.org/2026/06/trump-makes-unsupported-claims-about-drug-flows/,www.factcheck.org,Trump Makes Unsupported Claims About Drug Flows - FactCheck.org,0,LOW,False,,,factcheck,2026-06-27T13:46:39.271575
"&#8220;And we cut the flow of fentanyl and drugs into our country by the ocean and the sea, in other words, coming in by water, by ocean and sea by 97%",https://www.factcheck.org/2026/06/trump-makes-unsupported-claims-about-drug-flows/,www.factcheck.org,Trump Makes Unsupported Claims About Drug Flows - FactCheck.org,0,LOW,False,,,factcheck,2026-06-27T13:46:39.328247
"Then, on May 28, in an interview with his daughter-in-law, Lara Trump, on Fox News, he said, &#8220;We have drugs down 97%",https://www.factcheck.org/2026/06/trump-makes-unsupported-claims-about-drug-flows/,www.factcheck.org,Trump Makes Unsupported Claims About Drug Flows - FactCheck.org,0,LOW,False,,,factcheck,2026-06-27T13:46:39.389592
[DEBUNKED] FactChecking Trump&#039;s Contentious &#039;Meet the Press&#039; Interview - FactCheck.org,https://www.factcheck.org/2026/06/factchecking-trumps-contentious-meet-the-press-interview/,www.factcheck.org,FactChecking Trump&#039;s Contentious &#039;Meet the Press&#039; Interview - FactCheck.org,0.9,HIGH,True,FALSE - Debunked by fact-checkers,www.factcheck.org,factcheck,2026-06-27T13:46:40.358346
[DEBUNKED] Fact Check: Trump Has NOT Posted An Image Of Reflecting Pool Showing Him Together With Epstein In June 2026 | Lead Stories,https://leadstories.com/hoax-alert/2026/06/fact-check-trump-has-not-posted-image-of-reflecting-pool-showing-him-together-with-epstein-in-june-2026.html,leadstories.com,Fact Check: Trump Has NOT Posted An Image Of Reflecting Pool Showing Him Together With Epstein In Ju,0.9,HIGH,True,FALSE - Debunked by fact-checkers,leadstories.com,factcheck,2026-06-27T13:46:40.837369
[DEBUNKED] Fact Check: FAKE Photo Labeled With Recycled Caption 'Bengali Woman Carrying A British Merchant' And Dated 1903 Was Made With OpenAI Tools | Lead Stories,https://leadstories.com/hoax-alert/2026/06/fact-check-fake-photo-labeled-with-recycled-caption-bengali-woman-carrying-a-british-merchant-and-dated-1903-was-made-with-openai-tools.html,leadstories.com,Fact Check: FAKE Photo Labeled With Recycled Caption 'Bengali Woman Carrying A British Merchant' And,0.9,HIGH,True,FALSE - Debunked by fact-checkers,leadstories.com,factcheck,2026-06-27T13:46:40.975199
[DEBUNKED] Fact Check: Photo Does NOT Show Officer In Montreal Shooting -- Victim Was NOT A Rabbi | Lead Stories,https://leadstories.com/hoax-alert/2026/06/fact-check-photo-does-not-show-officer-in-montreal-shooting-victim-was-not-a-rabbi.html,leadstories.com,Fact Check: Photo Does NOT Show Officer In Montreal Shooting -- Victim Was NOT A Rabbi | Lead Storie,0.9,HIGH,True,FALSE - Debunked by fact-checkers,leadstories.com,factcheck,2026-06-27T13:46:41.134004
[DEBUNKED] Prebunk: Yucky Videos Of Indian Street Food Stalls Taste Like Fakery --  Cooked Up With Artificial Intelligence | Lead Stories,https://leadstories.com/hoax-alert/2026/06/prebunk-ai-videos-of-indian-street-food.html,leadstories.com,Prebunk: Yucky Videos Of Indian Street Food Stalls Taste Like Fakery --  Cooked Up With Artificial I,0.9,HIGH,True,FALSE - Debunked by fact-checkers,leadstories.com,factcheck,2026-06-27T13:46:41.286786
[DEBUNKED] Fact Check: FAKE Video Shows Two Towers Crashing Into Each Other During Venezuela Earthquakes | Lead Stories,https://leadstories.com/hoax-alert/2026/06/fact-check-fake-video-shows-two-towers-crashing-into-each-other-during-venezuela-earthquakes.html,leadstories.com,Fact Check: FAKE Video Shows Two Towers Crashing Into Each Other During Venezuela Earthquakes | Lead,0.9,HIGH,True,FALSE - Debunked by fact-checkers,leadstories.com,factcheck,2026-06-27T13:46:41.412353
[DEBUNKED] Fact Check: AI-Enhanced 'Reflecting Pool Dipper' Images Do NOT Reliably Identify Suspect | Lead Stories,https://leadstories.com/hoax-alert/2026/06/fact-check-ai-images-of-reflecting-pool-dipper-are-not-real.html,leadstories.com,Fact Check: AI-Enhanced 'Reflecting Pool Dipper' Images Do NOT Reliably Identify Suspect | Lead Stor,0.9,HIGH,True,FALSE - Debunked by fact-checkers,leadstories.com,factcheck,2026-06-27T13:46:41.536941
[DEBUNKED] Fact Check: FAKE Image Shows Alyssa Thomas Smiling As She Fouls Caitlin Clark In WNBA Game | Lead Stories,https://leadstories.com/hoax-alert/2026/06/fact-check-fake-image-shows-alyssa-thomas-smiling-as-she-fouls-caitlin-clark-in-wnba-game.html,leadstories.com,Fact Check: FAKE Image Shows Alyssa Thomas Smiling As She Fouls Caitlin Clark In WNBA Game | Lead St,0.9,HIGH,True,FALSE - Debunked by fact-checkers,leadstories.com,factcheck,2026-06-27T13:46:41.653566
[DEBUNKED] Fact Check: Fake Video Shows A Man In A Muslim Mob Spray Painting A Butcher Shop Window In England -- AI-Generated With Many Glitches | Lead Stories,https://leadstories.com/hoax-alert/2026/06/fact-check-fake-video-shows-a-man-in-a-muslim-mob-spray-painting-a-butcher-shop-window-in-England-ai-generated-with-many-glitches.html,leadstories.com,Fact Check: Fake Video Shows A Man In A Muslim Mob Spray Painting A Butcher Shop Window In England -,0.9,HIGH,True,FALSE - Debunked by fact-checkers,leadstories.com,factcheck,2026-06-27T13:46:41.782803
[DEBUNKED] Fact Check: FAKE Quotes Not From Lionel Messi About 100-Year-Old Fan -- Came From 'Fan Account' Not Argentine Soccer Player | Lead Stories,https://leadstories.com/hoax-alert/2026/06/fact-check-fake-quotes-not-from-lionel-messi-about-100-year-old-fan-are-fake-came-from-fan-account-not-argentine-soccer-player.html,leadstories.com,Fact Check: FAKE Quotes Not From Lionel Messi About 100-Year-Old Fan -- Came From 'Fan Account' Not ,0.9,HIGH,True,FALSE - Debunked by fact-checkers,leadstories.com,factcheck,2026-06-27T13:46:41.916825
"[DEBUNKED] Fact Check: WNBA Did NOT Say Caitlin Clark Would Get Technical Foul For Lifting Her Knee Toward Alyssa Thomas -- Day After Game Thomas Gets Foul, 1-Game Suspension | Lead Stories",https://leadstories.com/hoax-alert/2026/06/fact-check-wnba-did-not-say-caitlin-clark-would-get-technical-foul-for-lifting-her-knee-toward-alyssa-thomas-day-after-game-thomas-gets-foul-1-game-suspension.html,leadstories.com,Fact Check: WNBA Did NOT Say Caitlin Clark Would Get Technical Foul For Lifting Her Knee Toward Alys,0.9,HIGH,True,FALSE - Debunked by fact-checkers,leadstories.com,factcheck,2026-06-27T13:46:42.050491
[DEBUNKED] Fact Check: Harry Kane Did NOT Say He Lost Control of His Body During Ghana Match After Witch Doctor's 'Curse' | Lead Stories,https://leadstories.com/hoax-alert/2026/06/fact-check-harry-kane-did-not-say-he-lost-control-of-his-body-during-ghana-match-after-witch-doctors-curse.html,leadstories.com,Fact Check: Harry Kane Did NOT Say He Lost Control of His Body During Ghana Match After Witch Doctor,0.9,HIGH,True,FALSE - Debunked by fact-checkers,leadstories.com,factcheck,2026-06-27T13:46:42.175488
[DEBUNKED] Fact Check: FAKE Photo Does NOT Show Officer From Montreal Shooting -- The Image Is Likely AI-Generated And Victim Was Not A Rabbi  | Lead Stories,https://leadstories.com/hoax-alert/2026/06/fact-check-fake-photo-does-not-show-police-officer-who-reportedly-shot-rabbi-during-montreal-attack-carrying-rifle-wearing-uniform.html,leadstories.com,Fact Check: FAKE Photo Does NOT Show Officer From Montreal Shooting -- The Image Is Likely AI-Genera,0.9,HIGH,True,FALSE - Debunked by fact-checkers,leadstories.com,factcheck,2026-06-27T13:46:42.305827
[DEBUNKED] Viral Video Of Littered Street In Paris -- What We Know | Lead Stories,https://leadstories.com/hoax-alert/2026/06/video-of-littered-street-in-paris-what-we-know.html,leadstories.com,Viral Video Of Littered Street In Paris -- What We Know | Lead Stories,0.9,HIGH,True,FALSE - Debunked by fact-checkers,leadstories.com,factcheck,2026-06-27T13:46:42.425631
[DEBUNKED] Fact Check: Altered Photo Of Tray Liner Under McDonald's Breakfast Shows Charlie Kirk Lookalike -- Not Real | Lead Stories,https://leadstories.com/hoax-alert/2026/06/fact-check-someone-who-looks-like-charlie-kirk-on-tray-liner-picture-under-mcdonalds-breakfast-photo-was-changed.html,leadstories.com,Fact Check: Altered Photo Of Tray Liner Under McDonald's Breakfast Shows Charlie Kirk Lookalike -- N,0.9,HIGH,True,FALSE - Debunked by fact-checkers,leadstories.com,factcheck,2026-06-27T13:46:42.551290
[DEBUNKED] Fact Check: Video Clip Does NOT Show Victims From Hot Air Balloon Accident In Brazil -- Different Ride In Initial Footage | Lead Stories,https://leadstories.com/hoax-alert/2026/06/fact-check-video-clip-does-not-show-victims-from-hot-air-balloon-accident-brazil-different-ride-initial-footage.html,leadstories.com,Fact Check: Video Clip Does NOT Show Victims From Hot Air Balloon Accident In Brazil -- Different Ri,0.9,HIGH,True,FALSE - Debunked by fact-checkers,leadstories.com,factcheck,2026-06-27T13:46:42.683145
"Die Staatsmedien berichteten nicht von dem Vorfall, eine offizielle Mitteilung der Behörden zu möglichen Betroffenen fehlt bislang ebenfalls",https://www.spiegel.de/panorama/china-augenzeugenvideos-nach-flugzeug-crash-zensiert-a-75044ec3-6d88-4cd9-9586-b10d58dd0a67#ref=rss,www.spiegel.de,China: Augenzeugenvideos nach Flugzeug-Crash zensiert - DER SPIEGEL,0,LOW,False,,,mainstream,2026-06-27T13:46:53.694078
Laut dem auf Flugzeugunfälle spezialisierten Aviation Safety Network soll es sich um ein in China hergestelltes Leicht-SportFlugzeug handeln,https://www.spiegel.de/panorama/china-augenzeugenvideos-nach-flugzeug-crash-zensiert-a-75044ec3-6d88-4cd9-9586-b10d58dd0a67#ref=rss,www.spiegel.de,China: Augenzeugenvideos nach Flugzeug-Crash zensiert - DER SPIEGEL,0,LOW,False,,,mainstream,2026-06-27T13:46:53.746463
"Zum Login SPIEGEL plus Nur für Neukunden € 1,– für 4 Wochen danach € 5,99 pro Woche Freier Zugriff auf alle S+-Artikel auf SPIEGEL",https://www.spiegel.de/wirtschaft/serbien-wie-berlin-fuer-lithium-vucics-berater-finanziert-a-b9ad24a7-8292-420b-86c4-21561224f9cc#ref=rss,www.spiegel.de,Serbien: Kampf um Rohstoffe - Deutschlands Mann an der Seite des Autokraten - DER SPIEGEL,0.1,LOW,False,,,mainstream,2026-06-27T13:46:54.552786
"E-Paper (PDF), Digital-Archiv und S+-Newsletter Jederzeit kündigen Jetzt abonnieren SPIEGEL plus 52 Wochen 25 % sparen € 4,49 pro Woche für 52 Wochen danach € 5,99 pro Woche Freier Zugriff auf alle S+-Artikel auf SPIEGEL",https://www.spiegel.de/wirtschaft/serbien-wie-berlin-fuer-lithium-vucics-berater-finanziert-a-b9ad24a7-8292-420b-86c4-21561224f9cc#ref=rss,www.spiegel.de,Serbien: Kampf um Rohstoffe - Deutschlands Mann an der Seite des Autokraten - DER SPIEGEL,0.1,LOW,False,,,mainstream,2026-06-27T13:46:54.608928
Seit Produktionsbeginn wurden laut Piaggio fast 20 Millionen Exemplare verkauft,https://www.spiegel.de/mobilitaet/rom-80-vespa-geburtstag-mit-parade-in-rom-gefeiert-a-1b76b65f-da8a-4d16-adac-e96b202ad440#ref=rss,www.spiegel.de,Rom: 80. Vespa-Geburtstag mit Parade in Rom gefeiert - DER SPIEGEL,0,LOW,False,,,mainstream,2026-06-27T13:46:56.034724
"Dabei wurden laut der Staatsanwaltschaft insgesamt 225 Menschen festgenommen, gegen 178 von ihnen wurde Untersuchungshaft verfügt",https://www.spiegel.de/ausland/tuerkei-178-menschen-vor-nato-gipfel-in-ankara-in-u-haft-genommen-a-98a9bb64-4ddc-4f68-bf55-0f7e952c87f9#ref=rss,www.spiegel.de,Türkei: 178 Menschen vor Nato-Gipfel in Ankara in U-Haft genommen - DER SPIEGEL,0,LOW,False,,,mainstream,2026-06-27T13:46:57.411228
"Ein Atemalkoholtest habe das bestätigt: Laut Polizei hatte die 43-Jährige 0,62 Promille",https://www.spiegel.de/panorama/justiz/hof-frau-faehrt-offenbar-angetrunken-zur-polizei-a-822254db-bb83-4102-be3a-17c3e7419d6f#ref=rss,www.spiegel.de,Hof: Frau fährt angetrunken zur Polizei - DER SPIEGEL,0,LOW,False,,,mainstream,2026-06-27T13:46:58.167056
"Zum Login SPIEGEL plus Nur für Neukunden € 1,– für 4 Wochen danach € 5,99 pro Woche Freier Zugriff auf alle S+-Artikel auf SPIEGEL",https://www.spiegel.de/ausland/russland-die-benzinkrise-wird-fuer-wladimir-putin-heikel-kolumne-a-fdf2e37e-b649-4bba-925d-f9d40cd8925b#ref=rss,www.spiegel.de,Russland: Die Benzinkrise wird für Wladimir Putin heikel - Kolumne - DER SPIEGEL,0.1,LOW,False,,,mainstream,2026-06-27T13:46:58.929809
"E-Paper (PDF), Digital-Archiv und S+-Newsletter Jederzeit kündigen Jetzt abonnieren SPIEGEL plus 52 Wochen 25 % sparen € 4,49 pro Woche für 52 Wochen danach € 5,99 pro Woche Freier Zugriff auf alle S+-Artikel auf SPIEGEL",https://www.spiegel.de/ausland/russland-die-benzinkrise-wird-fuer-wladimir-putin-heikel-kolumne-a-fdf2e37e-b649-4bba-925d-f9d40cd8925b#ref=rss,www.spiegel.de,Russland: Die Benzinkrise wird für Wladimir Putin heikel - Kolumne - DER SPIEGEL,0.1,LOW,False,,,mainstream,2026-06-27T13:46:58.988692
2026 • Alle Ausgaben Sie können den Artikel leider nicht mehr aufrufen,https://www.spiegel.de/familie/lerntherapeutin-gibt-tipps-zu-zeugnissen-eltern-unterschaetzen-wie-viel-ueber-gestik-und-mimik-laeuft-a-62189cbd-206f-4c59-960d-1be0914db67c#ref=rss,www.spiegel.de,"Lerntherapeutin gibt Tipps zu Zeugnissen: »Eltern unterschätzen, wie viel über Gestik und Mimik läuf",0.1,LOW,False,,,mainstream,2026-06-27T13:46:59.768475
"Zum Login SPIEGEL plus Nur für Neukunden € 1,– für 4 Wochen danach € 5,99 pro Woche Freier Zugriff auf alle S+-Artikel auf SPIEGEL",https://www.spiegel.de/familie/lerntherapeutin-gibt-tipps-zu-zeugnissen-eltern-unterschaetzen-wie-viel-ueber-gestik-und-mimik-laeuft-a-62189cbd-206f-4c59-960d-1be0914db67c#ref=rss,www.spiegel.de,"Lerntherapeutin gibt Tipps zu Zeugnissen: »Eltern unterschätzen, wie viel über Gestik und Mimik läuf",0.1,LOW,False,,,mainstream,2026-06-27T13:46:59.823410
"E-Paper (PDF), Digital-Archiv und S+-Newsletter Jederzeit kündigen Jetzt abonnieren SPIEGEL plus 52 Wochen 25 % sparen € 4,49 pro Woche für 52 Wochen danach € 5,99 pro Woche Freier Zugriff auf alle S+-Artikel auf SPIEGEL",https://www.spiegel.de/familie/lerntherapeutin-gibt-tipps-zu-zeugnissen-eltern-unterschaetzen-wie-viel-ueber-gestik-und-mimik-laeuft-a-62189cbd-206f-4c59-960d-1be0914db67c#ref=rss,www.spiegel.de,"Lerntherapeutin gibt Tipps zu Zeugnissen: »Eltern unterschätzen, wie viel über Gestik und Mimik läuf",0.1,LOW,False,,,mainstream,2026-06-27T13:46:59.880964
"Zum Login SPIEGEL plus Nur für Neukunden € 1,– für 4 Wochen danach € 5,99 pro Woche Freier Zugriff auf alle S+-Artikel auf SPIEGEL",https://www.spiegel.de/wissenschaft/medizin/haut-wie-man-sie-schuetzt-und-welche-pflegemittel-ihr-wirklich-helfen-a-eebe3b3c-8cd6-47ea-9a8d-3795626f8e68#ref=rss,www.spiegel.de,Haut: Wie man sie schützt und welche Pflegemittel ihr wirklich helfen - DER SPIEGEL,0.1,LOW,False,,,mainstream,2026-06-27T13:47:00.697234
"E-Paper (PDF), Digital-Archiv und S+-Newsletter Jederzeit kündigen Jetzt abonnieren SPIEGEL plus 52 Wochen 25 % sparen € 4,49 pro Woche für 52 Wochen danach € 5,99 pro Woche Freier Zugriff auf alle S+-Artikel auf SPIEGEL",https://www.spiegel.de/wissenschaft/medizin/haut-wie-man-sie-schuetzt-und-welche-pflegemittel-ihr-wirklich-helfen-a-eebe3b3c-8cd6-47ea-9a8d-3795626f8e68#ref=rss,www.spiegel.de,Haut: Wie man sie schützt und welche Pflegemittel ihr wirklich helfen - DER SPIEGEL,0.1,LOW,False,,,mainstream,2026-06-27T13:47:00.752731
000 Euro Schaden Korianderlager in Baden-Württemberg brennt komplett ab Der Besitzer eines Bauernhofs habe einen Knall gehört und die Feuerwehr gerufen: Am Morgen hat eine Halle in Külsheim gebrannt,https://www.spiegel.de/panorama/kuelsheim-baden-wuerttemberg-korianderlager-brennt-komplett-ab-a-6ae787c4-7975-4284-8d81-925b1d5da537#ref=rss,www.spiegel.de,"Külsheim, Baden-Württemberg: Korianderlager brennt komplett ab - DER SPIEGEL",0.1,LOW,False,,,mainstream,2026-06-27T13:47:01.432683
Laut Polizei befand sich darin unter anderem eine »größere Menge« Koriander,https://www.spiegel.de/panorama/kuelsheim-baden-wuerttemberg-korianderlager-brennt-komplett-ab-a-6ae787c4-7975-4284-8d81-925b1d5da537#ref=rss,www.spiegel.de,"Külsheim, Baden-Württemberg: Korianderlager brennt komplett ab - DER SPIEGEL",0,LOW,False,,,mainstream,2026-06-27T13:47:01.493296
000 Euro Foto: Rolf Vennenbernd / dpa Im Main-Tauber-Kreis ist ein Korianderlager komplett abgebrannt und hat mehrere Hunderttausend Euro Schaden verursacht,https://www.spiegel.de/panorama/kuelsheim-baden-wuerttemberg-korianderlager-brennt-komplett-ab-a-6ae787c4-7975-4284-8d81-925b1d5da537#ref=rss,www.spiegel.de,"Külsheim, Baden-Württemberg: Korianderlager brennt komplett ab - DER SPIEGEL",0,LOW,False,,,mainstream,2026-06-27T13:47:01.548395
"Andere Nutzungen verletzen das Urheberrecht »Pride Game« zwischen Ägypten und Iran Keine Vielfalt, nicht mal beim Toreschießen Ausgerechnet Ägypten und Iran tragen bei dieser WM das »Pride Match« aus",https://www.spiegel.de/sport/wm-2026-pride-match-und-angriff-auf-deutschen-fan-entfachen-toleranzdebatte-a-7d6c0a16-388e-4ddc-894f-7efebf09fbfc#ref=rss,www.spiegel.de,WM 2026: Pride Match und Angriff auf deutschen Fan entfachen Toleranzdebatte - DER SPIEGEL,0.1,LOW,False,,,mainstream,2026-06-27T13:47:02.374451
"Zum Login SPIEGEL plus Nur für Neukunden € 1,– für 4 Wochen danach € 5,99 pro Woche Freier Zugriff auf alle S+-Artikel auf SPIEGEL",https://www.spiegel.de/sport/wm-2026-pride-match-und-angriff-auf-deutschen-fan-entfachen-toleranzdebatte-a-7d6c0a16-388e-4ddc-894f-7efebf09fbfc#ref=rss,www.spiegel.de,WM 2026: Pride Match und Angriff auf deutschen Fan entfachen Toleranzdebatte - DER SPIEGEL,0.1,LOW,False,,,mainstream,2026-06-27T13:47:02.430644
"E-Paper (PDF), Digital-Archiv und S+-Newsletter Jederzeit kündigen Jetzt abonnieren SPIEGEL plus 52 Wochen 25 % sparen € 4,49 pro Woche für 52 Wochen danach € 5,99 pro Woche Freier Zugriff auf alle S+-Artikel auf SPIEGEL",https://www.spiegel.de/sport/wm-2026-pride-match-und-angriff-auf-deutschen-fan-entfachen-toleranzdebatte-a-7d6c0a16-388e-4ddc-894f-7efebf09fbfc#ref=rss,www.spiegel.de,WM 2026: Pride Match und Angriff auf deutschen Fan entfachen Toleranzdebatte - DER SPIEGEL,0.1,LOW,False,,,mainstream,2026-06-27T13:47:02.486518
"»Sehr schade, dass Naomi aufgegeben hat, weil wir haben alle sehr auf das Finale hingefiebert",https://www.spiegel.de/sport/tennis/tennisturnier-in-bad-homburg-naomi-osaka-gibt-auf-karolina-muchova-gewinnt-a-3ae9cf71-d1b6-44b4-a733-c0d252442a76#ref=rss,www.spiegel.de,"Tennisturnier in Bad Homburg: Naomi Osaka gibt auf, Karolina Muchova gewinnt - DER SPIEGEL",0.1,LOW,False,,,mainstream,2026-06-27T13:47:03.794260
Sie bestehe laut MDSE hauptsächlich aus Bergematerial,https://www.spiegel.de/panorama/hettstedt-kaeufer-fuer-niewandtschacht-gesucht-a-352ce9e8-0b9b-4e27-a362-b1149aff7a98#ref=rss,www.spiegel.de,Hettstedt: Käufer für Niewandtschacht gesucht - DER SPIEGEL,0,LOW,False,,,mainstream,2026-06-27T13:47:04.462275
"In Canada, 70% of sponsored refugees find work within a year - 30% higher than those resettled through government schemes, according to the Home Office",https://www.bbc.co.uk/news/articles/c5yz952dm74o?at_medium=RSS&amp;at_campaign=rss,www.bbc.co.uk,Mahmood announces new refugee sponsorship route into UK - BBC News,0,LOW,False,,,mainstream,2026-06-27T13:47:04.671268
