claim,source_url,source_domain,article_title,risk_score,risk_category,has_factcheck,factcheck_rating,factcheck_source,source_type,checked_at
"Erst heute &auml;u&szlig;erte sich Nintendo zu einem gemeldeten Datenleck mit einer L&ouml;segeldforderung von umgerechnet rund 1,8 Millionen Euro",https://www.boerse-express.com/news/articles/honor-of-kings-ransomware-tarnt-sich-als-cheat-tool-922993,boerse-express.com,Honor of Kings: Ransomware tarnt sich als Cheat-Tool,0,LOW,False,,,unknown,2026-06-30T09:38:51.473544
"Der Konzern stellte klar: Zwar habe ein Diebstahl stattgefunden, die kompromittierten Daten enthielten jedoch keine kritischen Informationen",https://www.boerse-express.com/news/articles/honor-of-kings-ransomware-tarnt-sich-als-cheat-tool-922993,boerse-express.com,Honor of Kings: Ransomware tarnt sich als Cheat-Tool,0.1,LOW,False,,,unknown,2026-06-30T09:38:51.582484
"Anzeige Immer mehr Unternehmen werden Opfer von Cyberangriffen &ndash; diese Checkliste hilft Ihnen, es zu verhindern",https://www.boerse-express.com/news/articles/honor-of-kings-ransomware-tarnt-sich-als-cheat-tool-922993,boerse-express.com,Honor of Kings: Ransomware tarnt sich als Cheat-Tool,0.1,LOW,False,,,unknown,2026-06-30T09:38:51.683266
"Der eigentliche Clou liegt in der Methode: Die Angreifer knacken keine Verschlüsselung, sie bringen ihre Opfer dazu, ihnen die Tür selbst aufzuhalten",https://www.blogspan.net/russland-signal-phishing-belohnung/,blogspan.net,10 Mio. Dollar Kopfgeld gegen Russlands Signal-Phishing,0.1,LOW,False,,,unknown,2026-06-30T09:38:52.528379
"Im Visier stehen keine Privatleute mit Katzenfotos, sondern Regierungs- und NATO-Mitarbeiter, Diplomaten, Sicherheitspersonal, Journalisten mit Russland- und Ukraine-Bezug sowie Hilfsorganisationen für die Ukraine",https://www.blogspan.net/russland-signal-phishing-belohnung/,blogspan.net,10 Mio. Dollar Kopfgeld gegen Russlands Signal-Phishing,0.1,LOW,False,,,unknown,2026-06-30T09:38:52.609650
"Kein Schadcode, keine geknackte Krypto, kein Alarm",https://www.blogspan.net/russland-signal-phishing-belohnung/,blogspan.net,10 Mio. Dollar Kopfgeld gegen Russlands Signal-Phishing,0.1,LOW,False,,,unknown,2026-06-30T09:38:52.690155
F&uuml;r Waren wie Schmuck oder Handtaschen gelten Grenzen f&uuml;r Warenwerte von insgesamt 300 Euro beziehungsweise bei Flug- und Seereisenden bis zu 430 Euro,https://www.lz.de/owl/24364230_Regeln-fuer-Reisesouvenirs-Fuer-diese-Mitbringsel-kann-es-Aerger-vom-Zoll-geben.html,lz.de,Regeln für Reisesouvenirs: Für diese Mitbringsel kann es Ärger vom Zoll geben | Nachrichten aus Ostw,0,LOW,False,,,unknown,2026-06-30T09:38:54.075788
"Dazu z&auml;hlen laut Generalzolldirektion insbesondere die Kanarischen Inseln und die franz&ouml;sischen &Uuml;bersee-Departements, aber auch die Nordseeinsel Helgoland",https://www.lz.de/owl/24364230_Regeln-fuer-Reisesouvenirs-Fuer-diese-Mitbringsel-kann-es-Aerger-vom-Zoll-geben.html,lz.de,Regeln für Reisesouvenirs: Für diese Mitbringsel kann es Ärger vom Zoll geben | Nachrichten aus Ostw,0,LOW,False,,,unknown,2026-06-30T09:38:54.154186
700Die offizielle Zahl der Toten nach dem verheerenden Doppel-Erdbeben in Venezuela ist auf 1,"https://www.rnz.de/politik/wirtschaft-regional_artikel,-Digitale-Gewalt-EU-Verbot-fuer-sexualisierte-Deepfake-KI-bekommt-gruenes-Licht-_arid,2363624.html",rnz.de,Digitale Gewalt: EU-Verbot für sexualisierte Deepfake-KI bekommt grünes Licht - Wirtschaft Regional ,0,LOW,False,,,unknown,2026-06-30T09:38:56.396573
"2026 14:41 Uhr 1 Minute, 2 Sekunden Pornografische Bilder sind längst nicht immer echt - oft werden Frauen ohne ihr Wissen mit Hilfe von KI zu Darstellerinnen gemacht","https://www.rnz.de/politik/wirtschaft-regional_artikel,-Digitale-Gewalt-EU-Verbot-fuer-sexualisierte-Deepfake-KI-bekommt-gruenes-Licht-_arid,2363624.html",rnz.de,Digitale Gewalt: EU-Verbot für sexualisierte Deepfake-KI bekommt grünes Licht - Wirtschaft Regional ,0.1,LOW,False,,,unknown,2026-06-30T09:38:56.475945
"Migration, Asyl und Flucht Aktuelle Berichte und Hintergründe Nie war die Zahl der Menschen, die weltweit vor Krieg, Konflikten und Verfolgung fliehen, so hoch wie heute",https://www.deutschlandfunk.de/marcel-rosenbach-spiegel-zu-russisch-gesteuerter-desinformationskampagne-100.html,deutschlandfunk.de,Rusissche Desinformation zielt auf Landtagswahlen im Osten,0.1,LOW,False,,,unknown,2026-06-30T09:38:57.316405
"Rente und Altersvorsorge Aktuelle Berichte und Hintergründe Das Rentensystem in Deutschland ist ins Wanken geraten, weil immer weniger Erwerbstätige die Rente finanzieren müssen",https://www.deutschlandfunk.de/marcel-rosenbach-spiegel-zu-russisch-gesteuerter-desinformationskampagne-100.html,deutschlandfunk.de,Rusissche Desinformation zielt auf Landtagswahlen im Osten,0.1,LOW,False,,,unknown,2026-06-30T09:38:57.398780
"Transparenz bei KI-Inhalten Da KI-generierte Inhalte in unserem Alltag immer präsenter werden, ist Transparenz unerlässlich",https://www.tageblatt.lu/Meinung/KI-gestalten-bevor-sie-die-Gesellschaft-gestaltet-66046.html,tageblatt.lu,"Tageblatt.lu | Forum von Isabel Wiseler-Lima und H&#233;lder Sousa Silva | KI gestalten, bevor sie d",0.1,LOW,False,,,unknown,2026-06-30T09:38:59.918914
Kontaktieren Sie im Zweifel Ihre Bank über die Ihnen bekannten offiziellen Kommunikationswege,http://www.wa.de/polizei-meldungen/hamm/pol-ham-75-jaehriger-wird-opfer-von-phishing-betrug-zr-94374044.html,wa.de,POL-HAM: 75-Jähriger wird Opfer von Phishing-Betrug,0,LOW,False,,,unknown,2026-06-30T09:39:02.209034
"Käufer können mit 150 Euro Strafe belegt werden, wenn sie Waren wie Handtücher oder Sonnenbrillen von Strandhändlern kaufen",https://www.sueddeutsche.de/panorama/ibiza-verkauf-strandwaren-massagen-verbot-li.3503006,sueddeutsche.de,"Ibiza: Wer bei Strandverkäufern einkauft, muss Strafe zahlen - Panorama - SZ.de",0,LOW,False,,,unknown,2026-06-30T09:39:02.699485
"150 Euro Strafe können fällig werden, wenn zum Beispiel eine Sonnenbrille den Besitzer wechselt",https://www.sueddeutsche.de/panorama/ibiza-verkauf-strandwaren-massagen-verbot-li.3503006,sueddeutsche.de,"Ibiza: Wer bei Strandverkäufern einkauft, muss Strafe zahlen - Panorama - SZ.de",0,LOW,False,,,unknown,2026-06-30T09:39:02.779851
[DEBUNKED] Hitzedarstellung im TV: Video zu Wetterkarten ist nicht echt,https://correctiv.org/faktencheck/2026/06/29/hitzedarstellung-im-tv-video-zu-wetterkarten-ist-nicht-echt/,correctiv.org,Hitzedarstellung im TV: Video zu Wetterkarten ist nicht echt,0.9,HIGH,True,FALSE - Debunked by fact-checkers,correctiv.org,factcheck,2026-06-30T09:39:03.385832
Die AfD führt die Wahlumfragen mit rund 40 Prozent an,https://correctiv.org/aktuelles/afd/2026/06/30/afd-ulrich-siegmund-potsdam-sachsen-anhalt/,correctiv.org,Sachsen-Anhalt: Was Ulrich Siegmund (AfD) wirklich plant,0,LOW,False,,,factcheck,2026-06-30T09:39:04.780386
"[DEBUNKED] Video von Kind, das Regenbogenflagge in den Müll wirft, ist KI-generiert",https://correctiv.org/faktencheck/2026/06/29/video-von-kind-das-regenbogenflagge-in-den-muell-wirft-ist-ki-generiert/,correctiv.org,"Video von Kind, das Regenbogenflagge in den Müll wirft, ist KI-generiert",0.9,HIGH,True,FALSE - Debunked by fact-checkers,correctiv.org,factcheck,2026-06-30T09:39:05.384339
"Laut Insidern fürchtet der Vorstand um Blume, dass Europas größter Autohersteller ab dem Jahr 2030 dauerhaft in die Verlustzone rutschen könnte",https://correctiv.org/aktuelles/wirtschaft/2026/06/29/vorstand-will-sparpaket-mit-aller-macht-durchdruecken/,correctiv.org,Vorstand will Sparpaket auch gegen Nein von Aufsichtsrat durchdrücken - correctiv.org,0,LOW,False,,,factcheck,2026-06-30T09:39:06.072839
"Foto: Hans-Joachim Scheidemann / picture alliance / dpa Ein Zwischenbericht einer Untersuchung von Kardinal Franz Hengsbach bestätigt, dass der erste Ruhrbischof Missbrauch begangen haben soll",https://correctiv.org/aktuelles/akten-des-missbrauchs/2026/06/26/neue-studie-aus-dem-bistum-essen-kardinal-hengsbach-war-taeter-und-pflegte-enge-kontakte-zu-ratzinger/,correctiv.org,Neue Studie: Kardinal Hengsbach war Täter und pflegte Kontakte zu Ratzinger,0,LOW,False,,,factcheck,2026-06-30T09:39:06.761543
Nach Angaben der Koordinierungsstelle des Programms wurden zwischen 2020 und 2025 mehr als 75,https://correctiv.org/aktuelles/integration-gesellschaft/2026/06/26/foerderung-fuer-den-studienzugang-zugewanderter-vor-dem-aus/,correctiv.org,Förderung für den Studienzugang Zugewanderter vor dem Aus - correctiv.org,0.1,LOW,False,,,factcheck,2026-06-30T09:39:08.053790
Als besonders erfolgreich gelten die Sprachkurse: 83 Prozent der Teilnehmenden erreichten das für ein Studium erforderliche Sprachniveau C1,https://correctiv.org/aktuelles/integration-gesellschaft/2026/06/26/foerderung-fuer-den-studienzugang-zugewanderter-vor-dem-aus/,correctiv.org,Förderung für den Studienzugang Zugewanderter vor dem Aus - correctiv.org,0,LOW,False,,,factcheck,2026-06-30T09:39:08.132407
"„Eine Fortführung des Programms hätte vor dem Hintergrund der haushaltspolitischen und strukturellen Rahmenbedingungen keine tragfähige Grundlage“, sagte sie",https://correctiv.org/aktuelles/integration-gesellschaft/2026/06/26/foerderung-fuer-den-studienzugang-zugewanderter-vor-dem-aus/,correctiv.org,Förderung für den Studienzugang Zugewanderter vor dem Aus - correctiv.org,0.1,LOW,False,,,factcheck,2026-06-30T09:39:08.211943
[DEBUNKED] Landverkauf an Israel? Bild von Grenzschild in Albanien ist nicht echt,https://correctiv.org/faktencheck/2026/06/26/landverkauf-an-israel-bild-von-grenzschild-in-albanien-ist-nicht-echt/,correctiv.org,Landverkauf an Israel? Bild von Grenzschild in Albanien ist nicht echt,0.9,HIGH,True,FALSE - Debunked by fact-checkers,correctiv.org,factcheck,2026-06-30T09:39:08.817697
"&nbsp; CORRECTIV hat Guttenberg mehrfach angeschrieben und um seine Sicht der Dinge gebeten, erhielt jedoch keine Antwort",https://correctiv.org/aktuelles/lobbyismus/2026/06/26/guttenberg-der-mann-aller-maerkte/,correctiv.org,Guttenberg: Der Mann aller Märkte,0.1,LOW,False,,,factcheck,2026-06-30T09:39:09.498826
"Der Vorwurf ließ sich nicht belegen, da der Beschuldigte ihn bestritt und keine Anzeige erstattet wurde",https://correctiv.org/aktuelles/gewalt-im-sport/2026/06/26/bvb-bericht-zu-mutmasslichen-missbrauchsfaellen/,correctiv.org,BVB: Bericht zu Missbrauchsvorwürfen soll Ende des Jahres veröffentlicht werden,0.1,LOW,False,,,factcheck,2026-06-30T09:39:10.189796
"Ziel des Gutachtens ist laut der GFF, „wichtige Lücken in der Debatte um ein Verbot der AfD“ zu schließen",https://correctiv.org/aktuelles/debatte-um-afd-verbot/2026/06/25/afd-verbot-gutachten-faq/,correctiv.org,FAQ zu AfD-Gutachten: 1500 Seiten zur Verfassungsfeindlichkeit,0,LOW,False,,,factcheck,2026-06-30T09:39:10.975045
"Denn bislang habe es keine belastbare, wissenschaftlich erarbeitete Antwort auf die Frage gegeben, ob die AfD nach den Maßstäben des Artikels 21 des Grundgesetzes verfassungswidrig sei – und damit verboten werden könnte",https://correctiv.org/aktuelles/debatte-um-afd-verbot/2026/06/25/afd-verbot-gutachten-faq/,correctiv.org,FAQ zu AfD-Gutachten: 1500 Seiten zur Verfassungsfeindlichkeit,0.1,LOW,False,,,factcheck,2026-06-30T09:39:11.053740
"Anfang 2022 hielt Gazprom Germania, die deutsche Tochtergesellschaft des russischen Staatskonzerns, 25 Prozent der Erdgasspeicherkapazitäten in Deutschland",https://correctiv.org/hybride-kriegsfuehrung/2026/06/24/wollte-gazprom-deutschland-ins-chaos-stuerzen-bundesanwaltschaft-ermittelt-wegen-versuchter-sabotage/,correctiv.org,Wollte Gazprom Deutschland ins Chaos stürzen? Bundesanwaltschaft ermittelt,0,LOW,False,,,factcheck,2026-06-30T09:39:11.740926
"Laut der Bundesanwaltschaft konnte so der Sabotageplan vereitelt werden, da das Bundeswirtschaftsministerium die treuhänderische Verwaltung der Gazprom Germania durch die Bundesnetzagentur anordnete",https://correctiv.org/hybride-kriegsfuehrung/2026/06/24/wollte-gazprom-deutschland-ins-chaos-stuerzen-bundesanwaltschaft-ermittelt-wegen-versuchter-sabotage/,correctiv.org,Wollte Gazprom Deutschland ins Chaos stürzen? Bundesanwaltschaft ermittelt,0,LOW,False,,,factcheck,2026-06-30T09:39:11.825057
Die Kosten für die Kampfschiffe hätten sich auf 18 Milliarden Euro mehr als verdoppelt,https://correctiv.org/aktuelles/bundeswehr/2026/06/24/pistorius-beendet-teuerstes-marine-projekt-der-geschichte/,correctiv.org,Pistorius beendet teuerstes Marine-Projekt der Geschichte,0,LOW,False,,,factcheck,2026-06-30T09:39:12.470169
"Weiter wird der Bau aber nicht gehen – am späten Dienstag hat Verteidigungsminister Boris Pistorius (SPD) laut beteiligten Personen die mitwirkenden Werften informiert, das Projekt F126 sei beendet",https://correctiv.org/aktuelles/bundeswehr/2026/06/24/pistorius-beendet-teuerstes-marine-projekt-der-geschichte/,correctiv.org,Pistorius beendet teuerstes Marine-Projekt der Geschichte,0,LOW,False,,,factcheck,2026-06-30T09:39:12.514452
"Die offiziellen Kündigungsschreiben wolle die Beschaffungsbehörde an diesem Mittwoch an die Werften Damen (Niederlande) und die Rheinmetall-Tochter NVL verschicken, wie die Personen CORRECTIV berichteten",https://correctiv.org/aktuelles/bundeswehr/2026/06/24/pistorius-beendet-teuerstes-marine-projekt-der-geschichte/,correctiv.org,Pistorius beendet teuerstes Marine-Projekt der Geschichte,0.1,LOW,False,,,factcheck,2026-06-30T09:39:12.597914
Nach Angaben der Polizei kamen etwa 4,https://correctiv.org/faktencheck/hintergrund/2026/06/24/warum-die-polizei-das-trommeln-auf-einer-anti-merz-demo-einschraenkte/,correctiv.org,Warum die Polizei das Trommeln auf einer Anti-Merz-Demo einschränkte,0,LOW,False,,,factcheck,2026-06-30T09:39:13.288122
Signal wurde laut Behörden nicht geknackt,https://www.mimikama.org/fbi-warnt-russische-akteure-signal-keys/,www.mimikama.org,FBI warnt: Russische Akteure zielen auf Signal-Keys,0,LOW,False,,,factcheck,2026-06-30T09:39:13.431131
Die wichtigste Einordnung: Signal selbst wurde laut den Behörden nicht gehackt,https://www.mimikama.org/fbi-warnt-russische-akteure-signal-keys/,www.mimikama.org,FBI warnt: Russische Akteure zielen auf Signal-Keys,0,LOW,False,,,factcheck,2026-06-30T09:39:13.509566
Betrifft das alle Signal-Nutzer,https://www.mimikama.org/fbi-warnt-russische-akteure-signal-keys/,www.mimikama.org,FBI warnt: Russische Akteure zielen auf Signal-Keys,0.1,LOW,False,,,factcheck,2026-06-30T09:39:13.554632
[DEBUNKED] Facebook-Betrug: Gefälschte Werbung lockt in gefährliche Fallen,https://www.mimikama.org/betrueger-geben-sich-als-facebook-aus-5/,www.mimikama.org,Facebook-Betrug: Gefälschte Werbung lockt in gefährliche Fallen,0.9,HIGH,True,FALSE - Debunked by fact-checkers,www.mimikama.org,factcheck,2026-06-30T09:39:13.751606
[DEBUNKED] Ist eine Ampel in Berlin wegen 35 Grad Hitze geschmolzen?,https://www.mimikama.org/ampel-berlin-35-grad-geschmolzen/,www.mimikama.org,Ist eine Ampel in Berlin wegen 35 Grad Hitze geschmolzen?,0.9,HIGH,True,FALSE - Debunked by fact-checkers,www.mimikama.org,factcheck,2026-06-30T09:39:13.813902
[DEBUNKED] Sind diese Angebote für Klimageräte und Ventilatoren von Lidl und Netto echt?,https://www.mimikama.org/klimageraet-ventilator-lidl-netto-fake-shop/,www.mimikama.org,Sind diese Angebote für Klimageräte und Ventilatoren von Lidl und Netto echt?,0.9,HIGH,True,FALSE - Debunked by fact-checkers,www.mimikama.org,factcheck,2026-06-30T09:39:13.873742
[DEBUNKED] Solaranlagen verursachen keine Hitzewelle – Fakten statt Falschinfo!,https://www.mimikama.org/solaranlagen-verursachen-keine-hitzewelle/,www.mimikama.org,Solaranlagen verursachen keine Hitzewelle – Fakten statt Falschinfo!,0.9,HIGH,True,FALSE - Debunked by fact-checkers,www.mimikama.org,factcheck,2026-06-30T09:39:13.937523
Unter 16-Jährige sollten keine Accounts mehr auf großen Social-Media-Plattformen haben,https://www.mimikama.org/australiens-social-media-verbot-scheitert-am-alltag/,www.mimikama.org,Australiens Social-Media-Verbot scheitert am Alltag,0.1,LOW,False,,,factcheck,2026-06-30T09:39:14.087445
Die neue Studie zeigt: So einfach ist es nicht,https://www.mimikama.org/australiens-social-media-verbot-scheitert-am-alltag/,www.mimikama.org,Australiens Social-Media-Verbot scheitert am Alltag,0,LOW,False,,,factcheck,2026-06-30T09:39:14.166917
Bei den 14- bis 15-Jährigen sank sie leicht von 78 auf 69 Prozent,https://www.mimikama.org/australiens-social-media-verbot-scheitert-am-alltag/,www.mimikama.org,Australiens Social-Media-Verbot scheitert am Alltag,0,LOW,False,,,factcheck,2026-06-30T09:39:14.249151
[DEBUNKED] CERN wird 2026 nicht wegen einer „Matrix“ abgeschaltet,https://www.mimikama.org/cern-2026-nicht-wegen-einer-matrix-abgeschaltet/,www.mimikama.org,CERN wird 2026 nicht wegen einer „Matrix“ abgeschaltet,0.9,HIGH,True,FALSE - Debunked by fact-checkers,www.mimikama.org,factcheck,2026-06-30T09:39:14.322162
[DEBUNKED] Maischberger: Eskalation im Studio zwischen Merz und Chrupalla?,https://www.mimikama.org/maischberger-eskalation-studio-merz-chrupalla-fake/,www.mimikama.org,Maischberger: Eskalation im Studio zwischen Merz und Chrupalla?,0.9,HIGH,True,FALSE - Debunked by fact-checkers,www.mimikama.org,factcheck,2026-06-30T09:39:14.394815
[DEBUNKED] Früher war es auch heiß,https://www.mimikama.org/frueher-war-es-auch-heiss-hitzetage-klimawandel/,www.mimikama.org,Früher war es auch heiß,0.9,HIGH,True,FALSE - Debunked by fact-checkers,www.mimikama.org,factcheck,2026-06-30T09:39:14.473775
[DEBUNKED] Wurde in Indien ein 5G-Mast aus Protest angezündet?,https://www.mimikama.org/indien-5g-mast-angezuendet/,www.mimikama.org,Wurde in Indien ein 5G-Mast aus Protest angezündet?,0.9,HIGH,True,FALSE - Debunked by fact-checkers,www.mimikama.org,factcheck,2026-06-30T09:39:14.558409
"[DEBUNKED] Heimarbeit mit Kugelschreibern, Haargummis und Perlen?",https://www.mimikama.org/heimarbeit-kugelschreiber-haargummi-perlen-betrug/,www.mimikama.org,"Heimarbeit mit Kugelschreibern, Haargummis und Perlen?",0.9,HIGH,True,FALSE - Debunked by fact-checkers,www.mimikama.org,factcheck,2026-06-30T09:39:14.625261
[DEBUNKED] Lamborghini auf A12? KI-Bild entlarvt zahlreiche Fehler!,https://www.mimikama.org/lamborghini-auf-der-a12-fehler-entlarven-ki-bild/,www.mimikama.org,Lamborghini auf A12? KI-Bild entlarvt zahlreiche Fehler!,0.9,HIGH,True,FALSE - Debunked by fact-checkers,www.mimikama.org,factcheck,2026-06-30T09:39:14.694915
[DEBUNKED] Verschenkt Elon Musk tatsächlich Geld für ein Krypto-Casino?,https://www.mimikama.org/verschenkt-elon-musk-geld-krypto-casino/,www.mimikama.org,Verschenkt Elon Musk tatsächlich Geld für ein Krypto-Casino?,0.9,HIGH,True,FALSE - Debunked by fact-checkers,www.mimikama.org,factcheck,2026-06-30T09:39:14.765271
"Sie müssen keine neue Geschichte erfinden, sondern nur eine vertraute Kaufsituation nachbauen: ein Angebot, ein Login, ein Warenkorb, eine Zahlung",https://www.mimikama.org/amazon-prime-day-2026-betrug-erkennen/,www.mimikama.org,Vorsicht: Amazon Prime Day 2026 – Betrug erkennen und schützen!,0.1,LOW,False,,,factcheck,2026-06-30T09:39:14.921121
Nach Angaben von Check Point Research wurden bereits Monate vor dem Shopping-Event tausende neue Amazon-bezogene Domains registriert,https://www.mimikama.org/amazon-prime-day-2026-betrug-erkennen/,www.mimikama.org,Vorsicht: Amazon Prime Day 2026 – Betrug erkennen und schützen!,0,LOW,False,,,factcheck,2026-06-30T09:39:15.000368
Im Umfeld des Prime Day wurden laut Check Point Research etwa Domains nach dem Muster „amazon-prime,https://www.mimikama.org/amazon-prime-day-2026-betrug-erkennen/,www.mimikama.org,Vorsicht: Amazon Prime Day 2026 – Betrug erkennen und schützen!,0,LOW,False,,,factcheck,2026-06-30T09:39:15.081695
[DEBUNKED] Werden auf Vinted Kinder verkauft?,https://www.mimikama.org/vinted-kinder-verkauft-faktencheck/,www.mimikama.org,Werden auf Vinted Kinder verkauft?,0.9,HIGH,True,FALSE - Debunked by fact-checkers,www.mimikama.org,factcheck,2026-06-30T09:39:15.149093
"Auf diesen Widerspruch zur Bezeichnung hinzuweisen, ist keine Spitzfindigkeit",https://www.volksverpetzer.de/analyse/eu-verordnung-rueckfuehrung/,www.volksverpetzer.de,Abschreckung durch Angst: Wie die neue EU-Verordnung das Wort ‚Rückführung&#039; aushöhlt - Volksver,0.1,LOW,False,,,factcheck,2026-06-30T09:39:16.015970
Die Partei findet aber immer mehr politische Anschlussstellen auf der Suche nach einer neuen deutschen Identität,https://www.volksverpetzer.de/analyse/afd-sachsen-anhalt-bauhaus/,www.volksverpetzer.de,Will die AfD Sachsen-Anhalt das Architektur-Erbe ihres eigenen Bundeslandes verbannen? - Volksverpet,0.1,LOW,False,,,factcheck,2026-06-30T09:39:16.883333
"Im ersten Wahlgang gewann der Rechtsextremist Hartung mit 29 Prozent der Stimmen, musste aber in die Stichwahl gegen Hoffmann von der CDU, der 23,6 Prozent der Stimmen geholt hatte",https://www.volksverpetzer.de/aktuelles/aue-bad-schlema-nazi-ard/,www.volksverpetzer.de,Aue-Bad Schlema: Neonazi verliert die Wahl – und bekommt ARD-Sendezeit - Volksverpetzer,0,LOW,False,,,factcheck,2026-06-30T09:39:17.754240
Laut einem Policy Paper des Else Frenkel-Brunswik-Instituts von 2022 ist er „eine der bekanntesten Personen aus der Neonazi-Szene im Erzgebirgskreis,https://www.volksverpetzer.de/aktuelles/aue-bad-schlema-nazi-ard/,www.volksverpetzer.de,Aue-Bad Schlema: Neonazi verliert die Wahl – und bekommt ARD-Sendezeit - Volksverpetzer,0,LOW,False,,,factcheck,2026-06-30T09:39:17.835286
[DEBUNKED] Volksverpetzer gewinnt gegen die Ostdeutsche Allgemeine vor Gericht - Volksverpetzer,https://www.volksverpetzer.de/aktuelles/volksverpetzer-gewinnt-ostdeutsche-allgemeine/,www.volksverpetzer.de,Volksverpetzer gewinnt gegen die Ostdeutsche Allgemeine vor Gericht - Volksverpetzer,0.9,HIGH,True,FALSE - Debunked by fact-checkers,www.volksverpetzer.de,factcheck,2026-06-30T09:39:18.620928
"“ Warte mal - die AfD, das waren doch die, die überall eine „Islamisierung“ wittern, für die es überhaupt keine Faktengrundlage gibt",https://www.volksverpetzer.de/analyse/afd-unterstuetzt-terroristen/,www.volksverpetzer.de,‚Selbst anpacken‘: AfD unterstützt Terroristen in Deutschland? - Volksverpetzer,0.1,LOW,False,,,factcheck,2026-06-30T09:39:19.498840
Auch kandidiert er laut seinem Instagram-Profil für die „Generation Deutschland“ Baden-Württemberg,https://www.volksverpetzer.de/analyse/afd-unterstuetzt-terroristen/,www.volksverpetzer.de,‚Selbst anpacken‘: AfD unterstützt Terroristen in Deutschland? - Volksverpetzer,0,LOW,False,,,factcheck,2026-06-30T09:39:19.576020
"OAZ-Chefredakteur mit „langem Bart“ Vor ein paar Wochen berichtete er hinter vorgehaltener Hand über seine Erfahrungen dort als Redakteur: „Die Wahrheit ist: Der wahre Chefredakteur, und das weiß auch jeder im Haus, trägt einen langen Bart",https://www.volksverpetzer.de/aktuelles/100-tage-oaz-fake-redaktion-autoren-geklaut/,www.volksverpetzer.de,Fake-Redaktion der „Ostdeutschen Allgemeinen“: Fast 400 Autoren „geklaut“ - Volksverpetzer,0,LOW,False,,,factcheck,2026-06-30T09:39:20.439262
"Friedrich würde nie, nie, nie einen selbstbewussten, eigenständigen und unabhängigen Chefredakteur akzeptieren",https://www.volksverpetzer.de/aktuelles/100-tage-oaz-fake-redaktion-autoren-geklaut/,www.volksverpetzer.de,Fake-Redaktion der „Ostdeutschen Allgemeinen“: Fast 400 Autoren „geklaut“ - Volksverpetzer,0.1,LOW,False,,,factcheck,2026-06-30T09:39:20.517616
Und die alle hatten bis auf wenige Ausnahmen eines miteinander gemein: Sie hatten noch nicht eine Zeile für die OAZ geschrieben,https://www.volksverpetzer.de/aktuelles/100-tage-oaz-fake-redaktion-autoren-geklaut/,www.volksverpetzer.de,Fake-Redaktion der „Ostdeutschen Allgemeinen“: Fast 400 Autoren „geklaut“ - Volksverpetzer,0.1,LOW,False,,,factcheck,2026-06-30T09:39:20.595964
"Diesen Monat schauen wir auf eine Millionenspende an die AfD, die die rechtsextreme Partei laut Gericht nicht zurückbekommt",https://www.volksverpetzer.de/serie/urteile-mai-2026-afd-spende/,www.volksverpetzer.de,Urteile Mai 2026: Die AfD spendiert dem Staat unfreiwillig Millionen - Volksverpetzer,0,LOW,False,,,factcheck,2026-06-30T09:39:21.678358
"2,35 Millionen Euro an - vermeintlicher Spender: der Österreicher Gerhard Dingler - ein früherer Regionalpolitiker der FPÖ",https://www.volksverpetzer.de/serie/urteile-mai-2026-afd-spende/,www.volksverpetzer.de,Urteile Mai 2026: Die AfD spendiert dem Staat unfreiwillig Millionen - Volksverpetzer,0,LOW,False,,,factcheck,2026-06-30T09:39:21.765532
"Geldwerte Leistungen, auch Werbemaßnahmen ab einer bestimmten Größenordnung, sind laut Verwaltungsgericht Berlin Spenden",https://www.volksverpetzer.de/serie/urteile-mai-2026-afd-spende/,www.volksverpetzer.de,Urteile Mai 2026: Die AfD spendiert dem Staat unfreiwillig Millionen - Volksverpetzer,0,LOW,False,,,factcheck,2026-06-30T09:39:21.843745
"Man sieht, dass bis auf den letzten Stuhl alle Plätze belegt sind",https://www.volksverpetzer.de/aktuelles/lohnt-kaempfen-merz-keine-antwort/,www.volksverpetzer.de,Wofür lohnt es sich zu kämpfen? Warum Merz keine Antwort auf diese Frage hat - Volksverpetzer,0.1,LOW,False,,,factcheck,2026-06-30T09:39:22.721256
Er räumt Ängste und Vorwürfe aus und geht sachlich auf alle Entgegnungen ein,https://www.volksverpetzer.de/aktuelles/lohnt-kaempfen-merz-keine-antwort/,www.volksverpetzer.de,Wofür lohnt es sich zu kämpfen? Warum Merz keine Antwort auf diese Frage hat - Volksverpetzer,0.1,LOW,False,,,factcheck,2026-06-30T09:39:22.805887
