claim,source_url,source_domain,article_title,risk_score,risk_category,has_factcheck,factcheck_rating,factcheck_source,source_type,checked_at
(&#8230;)“ Hierzu stelle ich fest: Ich war nie im Aufsichtsrat des Forschungsinstituts Center for Strategic and International Studies (CSIS) tätig,https://correctiv.org/aktuelles/lobbyismus/2026/07/10/gegendarstellung/,correctiv.org,Gegendarstellung - correctiv.org,0.1,LOW,False,,,factcheck,2026-07-11T19:05:18.816363
"Jetzt Feedback geben Sicherheit und Verteidigung Bis Ende 2027: Bundeswehr-Beschaffungsamt soll massiv umgebaut werden Kampfdrohnen, Jets, Panzer, KI-Systeme: Alle zentralen Rüstungsprojekte laufen über das Beschaffungsamt der Bundeswehr in Koblenz",https://correctiv.org/aktuelles/sicherheit-und-verteidigung/2026/07/10/bis-ende-2027-bundeswehr-beschaffungsamt-soll-massiv-umgebaut-werden/,correctiv.org,Bis Ende 2027: Bundeswehr-Beschaffungsamt im Umbau,0.1,LOW,False,,,factcheck,2026-07-11T19:05:19.965112
"Jetzt gibt es neue Details zu dem massiven Umbauprogramm: Die bisherigen zwölf Abteilungen sollen laut Beamtin Ohl so zusammengefasst werden, dass sie die vier Teilstreitkräfte der Truppe spiegeln: Heer, Luftwaffe, Marine, Cyber-Kräfte",https://correctiv.org/aktuelles/sicherheit-und-verteidigung/2026/07/10/bis-ende-2027-bundeswehr-beschaffungsamt-soll-massiv-umgebaut-werden/,correctiv.org,Bis Ende 2027: Bundeswehr-Beschaffungsamt im Umbau,0,LOW,False,,,factcheck,2026-07-11T19:05:20.149014
"Zwischen 2023 und 2025 wickelte das Beschaffungsamt Projekte für rund 189 Milliarden Euro ab: unter anderem für Kampfjets, Luftverteidigungssysteme, die Digitalisierung des Heeres oder KI-Projekte",https://correctiv.org/aktuelles/sicherheit-und-verteidigung/2026/07/10/bis-ende-2027-bundeswehr-beschaffungsamt-soll-massiv-umgebaut-werden/,correctiv.org,Bis Ende 2027: Bundeswehr-Beschaffungsamt im Umbau,0,LOW,False,,,factcheck,2026-07-11T19:05:20.331392
"Lies hatte nach Angaben aus dem Umfeld des Aufsichtsrats einen Kompromiss vorgeschlagen, um die Lage zu entschärfen",https://correctiv.org/aktuelles/wirtschaft/2026/07/10/blumes-umbauplaene-scheitern-im-vw-aufsichtsrat/,correctiv.org,Blumes Umbaupläne scheitern im VW-Aufsichtsrat,0,LOW,False,,,factcheck,2026-07-11T19:05:21.468841
"Kosten: mindestens 1,2 Millionen Euro in zwei Jahren",https://correctiv.org/aktuelles/politik-2/2026/07/08/wirtschaftsministerin-reiche-will-erneut-millionen-auftrag-an-externe-berater-vergeben-kritik-kommt-aus-dem-eigenen-haus/,correctiv.org,Reiche will erneut Millionen-Auftrag an externe Berater vergeben,0,LOW,False,,,factcheck,2026-07-11T19:05:23.525609
"Kosten für die ersten zwei Jahre: mindestens 1,2 Millionen Euro Dabei sollen die Berater neben einer kurzfristigen mündlichen „ad-hoc-Beratung“ vor allem „wissenschaftliche Kurzgutachten“ liefern",https://correctiv.org/aktuelles/politik-2/2026/07/08/wirtschaftsministerin-reiche-will-erneut-millionen-auftrag-an-externe-berater-vergeben-kritik-kommt-aus-dem-eigenen-haus/,correctiv.org,Reiche will erneut Millionen-Auftrag an externe Berater vergeben,0.1,LOW,False,,,factcheck,2026-07-11T19:05:23.727239
"Doch setzt man branchenübliche Stundensätze an, wie der Spiegel zuletzt, kommt man – bei vorsichtigen Schätzungen von rund 180 Euro pro Stunde – auf mindestens 1,2 Millionen Euro",https://correctiv.org/aktuelles/politik-2/2026/07/08/wirtschaftsministerin-reiche-will-erneut-millionen-auftrag-an-externe-berater-vergeben-kritik-kommt-aus-dem-eigenen-haus/,correctiv.org,Reiche will erneut Millionen-Auftrag an externe Berater vergeben,0,LOW,False,,,factcheck,2026-07-11T19:05:23.940877
"CORRECTIV stellt alle 14 Mitglieder vor: ihre Positionen, ihre Verbindungen – und wer künftig in der Partei den Ton angibt",https://correctiv.org/aktuelles/afd/2026/07/08/afd-vorstand-voelkisch-parteitag-erfurt/,correctiv.org,AfD: So völkisch ist der neue Bundesvorstand,0.1,LOW,False,,,factcheck,2026-07-11T19:05:25.236438
"Es darf keine öffentlichen Gelder für Hetze, Rassismus und Hassrede geben“, sagte der Fraktionsvorsitzende der Linken im EU-Parlament, Martin Schirdewan",https://correctiv.org/aktuelles/afd/2026/07/07/eu-parlament-bringt-verbotsverfahren-von-afd-europapartei-esn-auf-den-weg/,correctiv.org,EU-Parlament stimmt für Prüfverfahren der AfD-Parteienfamilie,0.1,LOW,False,,,factcheck,2026-07-11T19:05:26.347483
"Ehemalige Europol-Mitarbeiter beschreiben das System als „Schatten-IT-Umgebung“, die parallel zu den offiziellen Systemen der Strafverfolgungsbehörde genutzt wurde – allerdings ohne die rechtlich notwendigen Sicherheits- und Datenschutzvorkehrungen",https://correctiv.org/aktuelles/europa-aktuelles/2026/07/07/europol-correctiv-recherche-reaktion-beschwerde-eugh/,correctiv.org,Beschwerde gegen Europol nach CORRECTIV-Recherche,0.1,LOW,False,,,factcheck,2026-07-11T19:05:27.485714
[DEBUNKED] Ampel vor Berliner Club „Wilde Renate“ nicht wegen Juni-Hitze geschmolzen,https://correctiv.org/faktencheck/2026/07/06/ampel-vor-berliner-club-wilde-renate-nicht-wegen-juni-hitze-geschmolzen/,correctiv.org,Ampel vor Berliner Club „Wilde Renate“ nicht wegen Juni-Hitze geschmolzen,0.9,HIGH,True,FALSE - Debunked by fact-checkers,correctiv.org,factcheck,2026-07-11T19:05:28.601374
"Die AfD hat offiziell zwar eine andere Definition für diesen völkischen Kampfbegriff, allerdings stehen viele AfDler Sellner und dessen Konzept nahe",https://correctiv.org/aktuelles/afd/2026/07/03/helferich-urteil-gewinn-fuer-das-voelkische-lager-der-afd-in-nrw/,correctiv.org,Schiedsgericht-Urteil: Gewinn für das völkische Lager der AfD,0.1,LOW,False,,,factcheck,2026-07-11T19:05:29.718268
"&nbsp; „Alle Geschütze werden aufgefahren“, bestätigt ein hochrangiger Mitarbeiter eines deutschen Chemiekonzerns gegenüber CORRECTIV",https://correctiv.org/aktuelles/lobbyismus/2026/07/06/emissonshandel-chemie-lobby-attackiert-klimaschutz/,correctiv.org,Emmissonshandel: Chemie-Lobby attackiert Klimaschutz,0.1,LOW,False,,,factcheck,2026-07-11T19:05:30.854618
CORRECTIV wird zu 65 Prozent aus privaten Spenden getragen,https://correctiv.org/in-eigener-sache/2026/07/03/gemeinwohlorientierter-journalismus-unter-druck-correctiv-startet-veraenderungsprozess/,correctiv.org,Gemeinwohlorientierter Journalismus unter Druck: CORRECTIV startet Veränderungsprozess - correctiv.o,0,LOW,False,,,factcheck,2026-07-11T19:05:31.739276
Jetzt Feedback geben Klimawandel Reform der Rente: Mehr Geld für klimaschädliche Industrien Die Koalition will alle Vorschläge der Rentenkommission umsetzen,https://correctiv.org/aktuelles/klimawandel/2026/07/02/reform-der-rente-mehr-geld-fuer-klimaschaedliche-industrien/,correctiv.org,Reform der Rente: Mehr Geld für klimaschädliche Industrien - correctiv.org,0.1,LOW,False,,,factcheck,2026-07-11T19:05:32.873550
"Am Donnerstag, den zweiten Juli, verkündete Bundeskanzler Friedrich Merz, dass alle 33 Vorschläge der Rentenkommission umgesetzt werden sollen",https://correctiv.org/aktuelles/klimawandel/2026/07/02/reform-der-rente-mehr-geld-fuer-klimaschaedliche-industrien/,correctiv.org,Reform der Rente: Mehr Geld für klimaschädliche Industrien - correctiv.org,0.1,LOW,False,,,factcheck,2026-07-11T19:05:33.057283
"Es soll besonders Menschen zugutekommen, die noch keine Erfahrungen mit dem Aktienmarkt haben",https://correctiv.org/aktuelles/klimawandel/2026/07/02/reform-der-rente-mehr-geld-fuer-klimaschaedliche-industrien/,correctiv.org,Reform der Rente: Mehr Geld für klimaschädliche Industrien - correctiv.org,0.1,LOW,False,,,factcheck,2026-07-11T19:05:33.244489
"000 Stimmen, die aktuelle Stimmung in der Bevölkerung ist laut Umfragen aber gespalten",https://correctiv.org/aktuelles/denkanstoss/2026/07/02/spanien-und-migration-einfach-mal-machen/,correctiv.org,Spanien und Migration? Einfach mal machen!,0,LOW,False,,,factcheck,2026-07-11T19:05:34.264756
"CORRECTIV analysiert ideologische Gräben: Wo sind Bruchlinien, worüber zerstreitet sich die Partei immer wieder",https://correctiv.org/aktuelles/neue-rechte/2026/07/02/die-ideologischen-brueche-in-der-afd/,correctiv.org,Die Karte: Über diese Brüche streitet die AfD,0.1,LOW,False,,,factcheck,2026-07-11T19:05:35.713139
"Juli 2026 In der AfD gibt es viele, oft konträre Positionen, die immer wieder für Streit sorgen",https://correctiv.org/aktuelles/neue-rechte/2026/07/02/die-ideologischen-brueche-in-der-afd/,correctiv.org,Die Karte: Über diese Brüche streitet die AfD,0.1,LOW,False,,,factcheck,2026-07-11T19:05:35.815138
"CORRECTIV nimmt den Parteitag zum Anlass, die ideologische Landkarte der AfD zu analysieren: Wo sind Bruchlinien, worüber zerstreitet sich die Partei immer wieder",https://correctiv.org/aktuelles/neue-rechte/2026/07/02/die-ideologischen-brueche-in-der-afd/,correctiv.org,Die Karte: Über diese Brüche streitet die AfD,0.1,LOW,False,,,factcheck,2026-07-11T19:05:35.906219
[DEBUNKED] Wie Wohlfühl-Content in Verschwörungserzählungen kippt,https://www.mimikama.org/wie-wohlfuehl-content-in-verschwoerungserzaehlungen-kippt/,www.mimikama.org,Wie Wohlfühl-Content in Verschwörungserzählungen kippt,0.9,HIGH,True,FALSE - Debunked by fact-checkers,www.mimikama.org,factcheck,2026-07-11T19:05:36.012150
[DEBUNKED] Warum Angst sich sicher anfühlen kann,https://www.mimikama.org/warum-angst-sich-sicher-anfuehlen-kann/,www.mimikama.org,Warum Angst sich sicher anfühlen kann,0.9,HIGH,True,FALSE - Debunked by fact-checkers,www.mimikama.org,factcheck,2026-07-11T19:05:36.104624
[DEBUNKED] Vorsicht: Fake-News über Alice Weidels angebliches Testament!,https://www.mimikama.org/clickbait-angebliches-testament-von-alice-weidel/,www.mimikama.org,Vorsicht: Fake-News über Alice Weidels angebliches Testament!,0.9,HIGH,True,FALSE - Debunked by fact-checkers,www.mimikama.org,factcheck,2026-07-11T19:05:36.201531
[DEBUNKED] Die Mimikama-Stempel,https://www.mimikama.org/mimikama-stempel/,www.mimikama.org,Die Mimikama-Stempel,0.9,HIGH,True,FALSE - Debunked by fact-checkers,www.mimikama.org,factcheck,2026-07-11T19:05:36.304267
[DEBUNKED] Grooming-Gangs: 250.000 Opfer? Falsche Zahl in Großbritannien!,https://www.mimikama.org/250-000-opfer-zahl-zu-grooming-gangs-in-grossbritannien-nicht-belegt/,www.mimikama.org,Grooming-Gangs: 250.000 Opfer? Falsche Zahl in Großbritannien!,0.9,HIGH,True,FALSE - Debunked by fact-checkers,www.mimikama.org,factcheck,2026-07-11T19:05:36.397956
[DEBUNKED] Achtung auf Facebook: So erkennst du die manipulativen Videos!,https://www.mimikama.org/du-bist-auf-facebook-unterwegs/,www.mimikama.org,Achtung auf Facebook: So erkennst du die manipulativen Videos!,0.9,HIGH,True,FALSE - Debunked by fact-checkers,www.mimikama.org,factcheck,2026-07-11T19:05:36.698803
[DEBUNKED] Facebook belohnt Unsinn – Warum die Nutzer darauf hereinfallen,https://www.mimikama.org/warum-facebook-so-viel-unsinn-belohnt/,www.mimikama.org,Facebook belohnt Unsinn – Warum die Nutzer darauf hereinfallen,0.9,HIGH,True,FALSE - Debunked by fact-checkers,www.mimikama.org,factcheck,2026-07-11T19:05:37.349958
"[DEBUNKED] Fake-Jobangebote von Adidas, Netflix &amp; Co. im Umlauf",https://www.mimikama.org/fake-jobangebote-adidas-netflix-fifa/,www.mimikama.org,"Fake-Jobangebote von Adidas, Netflix &amp; Co. im Umlauf",0.9,HIGH,True,FALSE - Debunked by fact-checkers,www.mimikama.org,factcheck,2026-07-11T19:05:37.641888
[DEBUNKED] WhatsApp-Benutzernamen: Wie groß ist die Betrugsgefahr?,https://www.mimikama.org/whatsapp-benutzernamen-betrugsgefahr/,www.mimikama.org,WhatsApp-Benutzernamen: Wie groß ist die Betrugsgefahr?,0.9,HIGH,True,FALSE - Debunked by fact-checkers,www.mimikama.org,factcheck,2026-07-11T19:05:38.280462
Öffentliche Instagram-Inhalte können laut Meta auch für KI-Funktionen wiederverwendet werden,https://www.mimikama.org/meta-muse-instagram-bilder-ungefragt-genutzt/,www.mimikama.org,Meta Muse: Können Instagram-Bilder ungefragt genutzt werden?,0,LOW,False,,,factcheck,2026-07-11T19:05:38.764070
Meta bestätigt den Instagram-Bezug In der offiziellen Meldung vom 7,https://www.mimikama.org/meta-muse-instagram-bilder-ungefragt-genutzt/,www.mimikama.org,Meta Muse: Können Instagram-Bilder ungefragt genutzt werden?,0,LOW,False,,,factcheck,2026-07-11T19:05:38.950334
Das bestätigt den Kern der Verunsicherung: Öffentliche Instagram-Konten können offenbar per @-Mention in KI-Bildfunktionen einbezogen werden,https://www.mimikama.org/meta-muse-instagram-bilder-ungefragt-genutzt/,www.mimikama.org,Meta Muse: Können Instagram-Bilder ungefragt genutzt werden?,0,LOW,False,,,factcheck,2026-07-11T19:05:39.135579
[DEBUNKED] Faktencheck: Kokainpakete mit Selenskyj-Foto? Fake News entlarvt!,https://www.mimikama.org/kokainpakete-mit-selenskyjs-foto-vom-rumaenischen-zoll-abgefangen/,www.mimikama.org,Faktencheck: Kokainpakete mit Selenskyj-Foto? Fake News entlarvt!,0.9,HIGH,True,FALSE - Debunked by fact-checkers,www.mimikama.org,factcheck,2026-07-11T19:05:39.394483
[DEBUNKED] Vorsicht: Hitzewelle vergleicht Sommer 1947 mit heutigen Warnungen!,https://www.mimikama.org/hitzewelle-in-deutschland-sommer-1947-warnungen/,www.mimikama.org,Vorsicht: Hitzewelle vergleicht Sommer 1947 mit heutigen Warnungen!,0.9,HIGH,True,FALSE - Debunked by fact-checkers,www.mimikama.org,factcheck,2026-07-11T19:05:39.697069
[DEBUNKED] Faktencheck: Drogen in Berlins Briefkästen? Polizei warnt Eltern!,https://www.mimikama.org/drogen-in-berlins-briefkaesten-ja-polizei-warnt/,www.mimikama.org,Faktencheck: Drogen in Berlins Briefkästen? Polizei warnt Eltern!,0.9,HIGH,True,FALSE - Debunked by fact-checkers,www.mimikama.org,factcheck,2026-07-11T19:05:39.964239
[DEBUNKED] Vergewaltigungszahlen in Europa: Grafik führt in die Irre,https://www.mimikama.org/vergewaltigungszahlen-europa-video-irrefuehrend/,www.mimikama.org,Vergewaltigungszahlen in Europa: Grafik führt in die Irre,0.9,HIGH,True,FALSE - Debunked by fact-checkers,www.mimikama.org,factcheck,2026-07-11T19:05:40.100666
[DEBUNKED] Steuergelder für ukrainische Luxusimmobilien in Bulgarien?,https://www.mimikama.org/steuergeld-ukrainische-luxusimmobilien-bulgarien/,www.mimikama.org,Steuergelder für ukrainische Luxusimmobilien in Bulgarien?,0.9,HIGH,True,FALSE - Debunked by fact-checkers,www.mimikama.org,factcheck,2026-07-11T19:05:40.371415
"Juli 2026 | 8 min Während Deutschland und Italien nach dem Gaspreisschock steigende Strompreise bekommen haben, sparte sich jeder spanische Haushalt sogar 10 € im Monat",https://volksverpetzer.de/aktuelles/spanien-unsere-strompreise/,volksverpetzer.de,Warum Spanien seit März über unsere Strompreise lacht - Volksverpetzer,0.05,LOW,False,,,factcheck,2026-07-11T19:05:41.307717
"Die Grafik von Ember zeigt sehr schön, wie der Anteil der Fossilen (alles, was so braun ist) an der Stromerzeugung immer weiter zurückgeht, während Wind und in den letzten Jahren vor allem Solar (dunkel-/hellgrün) steigen",https://volksverpetzer.de/aktuelles/spanien-unsere-strompreise/,volksverpetzer.de,Warum Spanien seit März über unsere Strompreise lacht - Volksverpetzer,0.1,LOW,False,,,factcheck,2026-07-11T19:05:41.494993
Im August 2025 wurde laut Red Eléctrica den gesamten Monat über keine einzige Kilowattstunde Kohlestrom produziert – nachdem Mitte Juli das letzte große Kohlekraftwerk Aboño II umgerüstet worden war,https://volksverpetzer.de/aktuelles/spanien-unsere-strompreise/,volksverpetzer.de,Warum Spanien seit März über unsere Strompreise lacht - Volksverpetzer,0.1,LOW,False,,,factcheck,2026-07-11T19:05:41.587549
"[DEBUNKED] Ruhs: Nein, diese Zahl belegt nicht, dass Deutschland zum „gescheiterten Staat“ wird - Volksverpetzer",https://volksverpetzer.de/faktencheck/ruhs-gescheiterter-staat/,volksverpetzer.de,"Ruhs: Nein, diese Zahl belegt nicht, dass Deutschland zum „gescheiterten Staat“ wird - Volksverpetze",0.9,HIGH,True,FALSE - Debunked by fact-checkers,volksverpetzer.de,factcheck,2026-07-11T19:05:42.346900
"[DEBUNKED] Wir kriegen gerade weder ein AfD-Verbot noch &quot;gute Politik, die gegen die AfD hilft&quot; - Volksverpetzer",https://volksverpetzer.de/aktuelles/weder-afd-verbot-noch-gute-politik/,volksverpetzer.de,"Wir kriegen gerade weder ein AfD-Verbot noch &quot;gute Politik, die gegen die AfD hilft&quot; - Vol",0.9,HIGH,True,FALSE - Debunked by fact-checkers,volksverpetzer.de,factcheck,2026-07-11T19:05:43.114696
Nur eine Partei macht das Gegenteil: Die AfD radikalisiert sich immer weiter und wächst trotzdem,https://volksverpetzer.de/analyse/afd-eu-ausnahme/,volksverpetzer.de,"Die AfD ist Europas gefährlichste, rechtsextreme Ausnahme - Volksverpetzer",0.1,LOW,False,,,factcheck,2026-07-11T19:05:44.051876
"­­­ Dieser Vergleich zeigt, dass die Rechtsaußen-Parteien von 2020 bis 2025 europaweit um durchschnittlich fünf Prozentpunkte gewachsen sind",https://volksverpetzer.de/analyse/afd-eu-ausnahme/,volksverpetzer.de,"Die AfD ist Europas gefährlichste, rechtsextreme Ausnahme - Volksverpetzer",0,LOW,False,,,factcheck,2026-07-11T19:05:44.145133
"Ihre Stimmengewichte unterscheiden sich deutlich: Zum Stichpunkt 2025 kamen Rechtspopulist*innen auf einen Schnitt von 17,5 Prozent bei nationalen Wahlen, während rechtsextreme Parteien lediglich 3,7 Prozent erreichten",https://volksverpetzer.de/analyse/afd-eu-ausnahme/,volksverpetzer.de,"Die AfD ist Europas gefährlichste, rechtsextreme Ausnahme - Volksverpetzer",0,LOW,False,,,factcheck,2026-07-11T19:05:44.336501
[DEBUNKED] BILD hat schon früher Fakes verbreitet - so heiß war es damals nicht! - Volksverpetzer,https://volksverpetzer.de/faktencheck/bild-fakes-heiss/,volksverpetzer.de,BILD hat schon früher Fakes verbreitet - so heiß war es damals nicht! - Volksverpetzer,0.9,HIGH,True,FALSE - Debunked by fact-checkers,volksverpetzer.de,factcheck,2026-07-11T19:05:45.088905
"Rund 1,2 Millionen Menschen haben unsere Petition mit dieser Forderung unterschrieben",https://volksverpetzer.de/aktuelles/afd-verbot-erfolg-gutachten/,volksverpetzer.de,Ein AfD-Verbot hätte wohl Erfolg – dieses Gutachten ändert alles! - Volksverpetzer,0,LOW,False,,,factcheck,2026-07-11T19:05:46.013145
Aber bisher ist nichts passiert zum Thema AfD-Verbot - obwohl die Zahl der Befürworter immer größer wurde,https://volksverpetzer.de/aktuelles/afd-verbot-erfolg-gutachten/,volksverpetzer.de,Ein AfD-Verbot hätte wohl Erfolg – dieses Gutachten ändert alles! - Volksverpetzer,0.1,LOW,False,,,factcheck,2026-07-11T19:05:46.200477
Aber die AfD erfüllt alle notwendigen Voraussetzungen,https://volksverpetzer.de/aktuelles/afd-verbot-erfolg-gutachten/,volksverpetzer.de,Ein AfD-Verbot hätte wohl Erfolg – dieses Gutachten ändert alles! - Volksverpetzer,0.1,LOW,False,,,factcheck,2026-07-11T19:05:46.384727
[DEBUNKED] Dreist! AfD-Fans teilen mit KI gefälschte Wetterkarten - Volksverpetzer,https://volksverpetzer.de/faktencheck/afd-fans-ki-wetterkarten/,volksverpetzer.de,Dreist! AfD-Fans teilen mit KI gefälschte Wetterkarten - Volksverpetzer,0.9,HIGH,True,FALSE - Debunked by fact-checkers,volksverpetzer.de,factcheck,2026-07-11T19:05:47.139579
"Auf diesen Widerspruch zur Bezeichnung hinzuweisen, ist keine Spitzfindigkeit",https://volksverpetzer.de/analyse/eu-verordnung-rueckfuehrung/,volksverpetzer.de,Abschreckung durch Angst: Wie die neue EU-Verordnung das Wort ‚Rückführung&#039; aushöhlt - Volksver,0.1,LOW,False,,,factcheck,2026-07-11T19:05:48.066907
Die Partei findet aber immer mehr politische Anschlussstellen auf der Suche nach einer neuen deutschen Identität,https://volksverpetzer.de/analyse/afd-sachsen-anhalt-bauhaus/,volksverpetzer.de,Will die AfD Sachsen-Anhalt das Architektur-Erbe ihres eigenen Bundeslandes verbannen? - Volksverpet,0.1,LOW,False,,,factcheck,2026-07-11T19:05:48.924186
[DEBUNKED] 14 rumors about 'The View' too dramatic to be true | Snopes.com,https://www.snopes.com/collections/the-view-rumors-collection/,www.snopes.com,14 rumors about 'The View' too dramatic to be true | Snopes.com,0.9,HIGH,True,FALSE - Debunked by fact-checkers,www.snopes.com,factcheck,2026-07-11T19:05:49.037200
[DEBUNKED] Mitch McConnell didn't post proof of life on X | Snopes.com,https://www.snopes.com/fact-check/mitch-mcconnell-proof-life-post/,www.snopes.com,Mitch McConnell didn't post proof of life on X | Snopes.com,0.9,HIGH,True,FALSE - Debunked by fact-checkers,www.snopes.com,factcheck,2026-07-11T19:05:49.393028
A country where 40% of adults can't cover a $400 emergency without borrowing… pic,https://www.snopes.com/news/2026/07/10/australian-reply-trump-nato/,www.snopes.com,Australian allegedly scolded Trump over NATO comments. We tried to track down the author | Snopes.co,0,LOW,False,,,factcheck,2026-07-11T19:05:49.715151
"[DEBUNKED] Did Oregon governor sign bill removing math, literacy requirements for graduation to help students of color? | Snopes.com",https://www.snopes.com/fact-check/oregon-high-school-graduation-requirements/,www.snopes.com,"Did Oregon governor sign bill removing math, literacy requirements for graduation to help students o",0.9,HIGH,True,FALSE - Debunked by fact-checkers,www.snopes.com,factcheck,2026-07-11T19:05:49.832739
[DEBUNKED] Posts claim Muslims in Dearborn tried to silence church bells. Here's the truth | Snopes.com,https://www.snopes.com/fact-check/muslims-dearborn-church-bells/,www.snopes.com,Posts claim Muslims in Dearborn tried to silence church bells. Here's the truth | Snopes.com,0.9,HIGH,True,FALSE - Debunked by fact-checkers,www.snopes.com,factcheck,2026-07-11T19:05:49.962229
"[DEBUNKED] Is Mamdani pushing for 20% raise for himself, city officials? | Snopes.com",https://www.snopes.com/fact-check/mamdani-pay-raise/,www.snopes.com,"Is Mamdani pushing for 20% raise for himself, city officials? | Snopes.com",0.9,HIGH,True,FALSE - Debunked by fact-checkers,www.snopes.com,factcheck,2026-07-11T19:05:50.549591
[DEBUNKED] Is Trump 'number one on TikTok'? The numbers tell a different story | Snopes.com,https://www.snopes.com/fact-check/trump-number-one-on-tiktok/,www.snopes.com,Is Trump 'number one on TikTok'? The numbers tell a different story | Snopes.com,0.9,HIGH,True,FALSE - Debunked by fact-checkers,www.snopes.com,factcheck,2026-07-11T19:05:50.666090
"[DEBUNKED] Did Trump put 2,000% tariff on Belgian chocolate after US World Cup defeat? Don't bite | Snopes.com",https://www.snopes.com/fact-check/trump-belgian-chocolate-tariff/,www.snopes.com,"Did Trump put 2,000% tariff on Belgian chocolate after US World Cup defeat? Don't bite | Snopes.com",0.9,HIGH,True,FALSE - Debunked by fact-checkers,www.snopes.com,factcheck,2026-07-11T19:05:50.883724
[DEBUNKED] PolitiFact | Trump exaggerates about how much illegal immigration raised rental housing prices,http://www.politifact.com/factchecks/2026/jul/10/donald-trump/immigration-rental-housing-federal-reserve/,www.politifact.com,PolitiFact | Trump exaggerates about how much illegal immigration raised rental housing prices,0.9,HIGH,True,FALSE - Debunked by fact-checkers,www.politifact.com,factcheck,2026-07-11T19:05:50.989960
[DEBUNKED] PolitiFact | What Trump’s communism claims miss about Democrats and democratic socialists,http://www.politifact.com/article/2026/jul/09/Trump-communist-democratic-socialist-Chevalier/,www.politifact.com,PolitiFact | What Trump’s communism claims miss about Democrats and democratic socialists,0.9,HIGH,True,FALSE - Debunked by fact-checkers,www.politifact.com,factcheck,2026-07-11T19:05:51.097892
Credible estimates show that two-thirds to 80% of his total 2025 income gains came from non-stock sources,http://www.politifact.com/factchecks/2026/jul/07/donald-trump/disclosure-crypto-stocks-wealth/,www.politifact.com,"PolitiFact | Trump says stock market drove his 2025 income gains, but the majority came from crypto",0,LOW,False,,,factcheck,2026-07-11T19:05:51.964374
[DEBUNKED] HAARP can’t cause heatwaves – Full Fact,https://fullfact.org/environment/haarp-heatwave-false-claims/,fullfact.org,HAARP can’t cause heatwaves – Full Fact,0.9,HIGH,True,FALSE - Debunked by fact-checkers,fullfact.org,factcheck,2026-07-11T19:05:53.679107
[DEBUNKED] Convicted child murderer Jamie Varley hasn’t been stabbed in prison – Full Fact,https://fullfact.org/crime/jamie-varley-prison-stabbed-false-claim/,fullfact.org,Convicted child murderer Jamie Varley hasn’t been stabbed in prison – Full Fact,0.9,HIGH,True,FALSE - Debunked by fact-checkers,fullfact.org,factcheck,2026-07-11T19:05:55.290090
[DEBUNKED] Twin Venezuelan earthquakes not caused by HAARP – Full Fact,https://fullfact.org/environment/venezuela-earthquake-haarp-false/,fullfact.org,Twin Venezuelan earthquakes not caused by HAARP – Full Fact,0.9,HIGH,True,FALSE - Debunked by fact-checkers,fullfact.org,factcheck,2026-07-11T19:05:57.991337
[DEBUNKED] Videos don’t show traffic lights ‘melting’ due to heatwave – Full Fact,https://fullfact.org/environment/video-traffic-light-melting-heatwave-false/,fullfact.org,Videos don’t show traffic lights ‘melting’ due to heatwave – Full Fact,0.9,HIGH,True,FALSE - Debunked by fact-checkers,fullfact.org,factcheck,2026-07-11T19:05:58.653325
[DEBUNKED] False claim cancer is ‘trying to heal’ shared again online – Full Fact,https://fullfact.org/health/cancer-tumours-toxins-repeat/,fullfact.org,False claim cancer is ‘trying to heal’ shared again online – Full Fact,0.9,HIGH,True,FALSE - Debunked by fact-checkers,fullfact.org,factcheck,2026-07-11T19:05:59.267661
[DEBUNKED] Alaska Senate Race Ads Mislead on Peltola&#039;s Votes on Military Pay Raise - FactCheck.org,https://www.factcheck.org/2026/07/alaska-senate-race-ads-mislead-on-peltolas-votes-on-military-pay-raise/,www.factcheck.org,Alaska Senate Race Ads Mislead on Peltola&#039;s Votes on Military Pay Raise - FactCheck.org,0.9,HIGH,True,FALSE - Debunked by fact-checkers,www.factcheck.org,factcheck,2026-07-11T19:05:59.632608
