claim,source_url,source_domain,article_title,risk_score,risk_category,has_factcheck,factcheck_rating,factcheck_source,source_type,checked_at
"Die Ermittler hoben fünf illegale Labore aus, es wurden Waren im Werte von 33,2 Millionen Euro beschlagnahmt",https://brf.be/international/2054037/,brf.be,Einsätze gegen Medikamentenmissbrauch in 30 Ländern - BRF Nachrichten,0,LOW,False,,,unknown,2026-02-25T19:09:29.742323
"Laut der Verbraucherzentrale Baden-Württemberg sind Händler, die selbst Einwegpfand-Flaschen oder -Dosen verkaufen, verpflichtet, entsprechendes Leergut zurückzunehmen – unabhängig von der Marke",https://www.merkur.de/verbraucher/supermarkt-kunden-klagen-ueber-probleme-bei-der-pfandrueckgabe-experte-verurteilt-masche-94186994.html,merkur.de,Supermarkt-Kunden klagen über Probleme bei der Pfandrückgabe – Experte verurteilt Masche,0,LOW,False,,,unknown,2026-02-25T19:09:31.041733
"Jeder könne solche Etiketten im Internet kaufen, so die Aussage des Angestellten",https://www.merkur.de/verbraucher/supermarkt-kunden-klagen-ueber-probleme-bei-der-pfandrueckgabe-experte-verurteilt-masche-94186994.html,merkur.de,Supermarkt-Kunden klagen über Probleme bei der Pfandrückgabe – Experte verurteilt Masche,0,LOW,False,,,unknown,2026-02-25T19:09:31.308782
"Sein Fazit: Das offizielle DPG-Logo sei in zwei sehr spezifischen Farben gehalten und werde mit speziellen Drucktechniken hergestellt, die nur bestimmte Druckereien beherrschen",https://www.merkur.de/verbraucher/supermarkt-kunden-klagen-ueber-probleme-bei-der-pfandrueckgabe-experte-verurteilt-masche-94186994.html,merkur.de,Supermarkt-Kunden klagen über Probleme bei der Pfandrückgabe – Experte verurteilt Masche,0,LOW,False,,,unknown,2026-02-25T19:09:31.549511
Eine Gegenleistung werden die Geschädigten dafür nie erhalten,https://www.kfz-betrieb.vogel.de/erneute-warnung-vor-betrug-mit-gebrauchtwagen-a-5e6dc6b50014028ef76b8980aaee2504/,kfz-betrieb.vogel.de,Erneute Warnung vor Betrug mit Gebrauchtwagen,0.1,LOW,False,,,unknown,2026-02-25T19:09:32.854037
Laut Volkswagen und Volkswagen Financial Services würden derzeit auf solchen gefälschten Internetseiten oder per E-,https://www.kfz-betrieb.vogel.de/erneute-warnung-vor-betrug-mit-gebrauchtwagen-a-5e6dc6b50014028ef76b8980aaee2504/,kfz-betrieb.vogel.de,Erneute Warnung vor Betrug mit Gebrauchtwagen,0,LOW,False,,,unknown,2026-02-25T19:09:33.067571
") gar keine Sorgen machen“, sagte Wilke",https://www.mz.de/panorama/minister-verteidigt-fake-accounts-des-verfassungsschutzes-4205757,mz.de,Geheimdienst im Internet: Minister verteidigt Fake-Accounts des Verfassungsschutzes,0.1,LOW,False,,,unknown,2026-02-25T19:09:33.624887
Dort sprangen laut Polizei drei dunkel gekleidete Männer aus einem Ford Fiesta und bedrohten den Spanier mit mehreren Schusswaffen,https://www.express.de:443/koeln/schockierender-raub-in-koeln-59-jaehriger-in-vorgetaeuschtem-autokauf-in-falle-gelockt-und-mit-waffe-ausgeraubt-1229701,express.de,Schockierender Raub in Köln: 59-Jähriger in vorgetäuschtem Autokauf in Falle gelockt und mit Waffe a,0.1,LOW,False,,,unknown,2026-02-25T19:09:34.422166
"&quot;Der Grund für den Umzug aus Litauen waren Sicherheitsbedenken&quot;, sagte Tichanowskaja nach Angaben der Nachrichtenagentur PAP",https://www.n-tv.de/politik/Belarussische-Oppositionsfuehrerin-verlegt-Exil-nach-Polen-id30404791.html,n-tv.de,Angst vor Verfolgung durch KGB: Belarussische Oppositionsführerin verlegt Exil nach Polen - ntv.de,0,LOW,False,,,unknown,2026-02-25T19:09:36.129592
"Als Lukaschenko sich mit rund 80 Prozent der Stimmen zum Sieger erklären ließ, kam es zu Massenprotesten",https://www.n-tv.de/politik/Belarussische-Oppositionsfuehrerin-verlegt-Exil-nach-Polen-id30404791.html,n-tv.de,Angst vor Verfolgung durch KGB: Belarussische Oppositionsführerin verlegt Exil nach Polen - ntv.de,0,LOW,False,,,unknown,2026-02-25T19:09:36.335429
"Nach Angaben des Krankenhauses seien Teile der IT Infrastruktur betroffen, die medizinische Versorgung sei jedoch weiterhin sichergestellt",https://www.nordkurier.de/regional/mecklenburg-vorpommern/cyberangriff-auf-klinik-in-mv-das-muessen-patienten-jetzt-beachten-4390256,nordkurier.de,Cyberangriff auf Klinik in MV: Das müssen Patienten jetzt beachten,0,LOW,False,,,unknown,2026-02-25T19:09:36.885263
"Schmidt: „Bürgerinnen und Bürger sollten keine unbekannten Anhänge und Links in Nachrichten oder E-Mails öffnen, die sie nicht eindeutig zuordnen können",https://www.nordkurier.de/regional/mecklenburg-vorpommern/cyberangriff-auf-klinik-in-mv-das-muessen-patienten-jetzt-beachten-4390256,nordkurier.de,Cyberangriff auf Klinik in MV: Das müssen Patienten jetzt beachten,0.1,LOW,False,,,unknown,2026-02-25T19:09:37.097599
"Die &ldquo;Operation SHIELD VI&rdquo; ging unter der &Auml;gide von Europol in 30 europ&auml;ischen Staaten &uuml;ber die B&uuml;hne, darunter auch in &Ouml;sterreich",https://www.suedtirolnews.it/chronik/illegales-pharma-labor-in-wien-ausgehoben,suedtirolnews.it,Illegales Pharma-Labor in Wien ausgehoben &#8211; SÃ¼dtirol News,0,LOW,False,,,unknown,2026-02-25T19:09:38.568515
"Die ""Operation SHIELD VI"" ging unter der Ägide von Europol in 30 europäischen Staaten über die Bühne, darunter auch in Österreich",https://www.sn.at/panorama/oesterreich/illegales-pharma-labor-in-wien-ausgehoben-art-637448,sn.at,Illegales Pharma-Labor in Wien ausgehoben - SN.at,0,LOW,False,,,unknown,2026-02-25T19:09:39.909519
Diese Substanzen seien gemäß der Verbotsliste der Welt-Anti-Doping-Agentur (WADA) der Kategorie S1 (anabole Stoffe) zugeordnet und sowohl im als auch außerhalb des Wettkampfs untersagt,https://www.sn.at/panorama/oesterreich/illegales-pharma-labor-in-wien-ausgehoben-art-637448,sn.at,Illegales Pharma-Labor in Wien ausgehoben - SN.at,0,LOW,False,,,unknown,2026-02-25T19:09:40.114421
Die Kriminellen lockten ihr Opfer zunächst mit vermeintlich lukrativen Investments – und forderten danach immer neue Zahlungen,https://www.merkur.de/bayern/regensburg/ueber-monate-hinweg-um-hunderttausende-euro-betrogen-bayer-wird-opfer-von-spezieller-finanz-masche-94185961.html,merkur.de,Über Monate hinweg um Hunderttausende Euro betrogen: Bayer wird Opfer von spezieller Finanz-Masche,0.1,LOW,False,,,unknown,2026-02-25T19:09:45.627852
Anlagebetrug in der Oberpfalz: Opfer zahlte monatelang auf ausländische KontenBereits im Mai 2025 hatte sich der 60-Jährige laut Ermittlern an die Polizei gewandt,https://www.merkur.de/bayern/regensburg/ueber-monate-hinweg-um-hunderttausende-euro-betrogen-bayer-wird-opfer-von-spezieller-finanz-masche-94185961.html,merkur.de,Über Monate hinweg um Hunderttausende Euro betrogen: Bayer wird Opfer von spezieller Finanz-Masche,0,LOW,False,,,unknown,2026-02-25T19:09:45.843734
In der Folge meldeten sich die Täter immer wieder bei dem Mann,https://www.merkur.de/bayern/regensburg/ueber-monate-hinweg-um-hunderttausende-euro-betrogen-bayer-wird-opfer-von-spezieller-finanz-masche-94185961.html,merkur.de,Über Monate hinweg um Hunderttausende Euro betrogen: Bayer wird Opfer von spezieller Finanz-Masche,0.1,LOW,False,,,unknown,2026-02-25T19:09:46.049128
Nach einem Maskengeschäft für 22 Millionen Euro muss ein Unternehmer jetzt ins Gefängnis,https://www.sueddeutsche.de/bayern/urteile-haftstrafe-fuer-steuerbetrug-nach-millionen-maskendeal-dpa.urn-newsml-dpa-com-20090101-260225-930-732566,sueddeutsche.de,Urteile - Haftstrafe für Steuerbetrug nach Millionen-Maskendeal - Bayern - SZ.de,0,LOW,False,,,unknown,2026-02-25T19:09:46.753053
"Allerdings gab er dies bei der Steuerklärung nicht richtig an: Er zahlte den Angaben zufolge 10,7 Millionen Euro Steuern zu wenig",https://www.sueddeutsche.de/bayern/urteile-haftstrafe-fuer-steuerbetrug-nach-millionen-maskendeal-dpa.urn-newsml-dpa-com-20090101-260225-930-732566,sueddeutsche.de,Urteile - Haftstrafe für Steuerbetrug nach Millionen-Maskendeal - Bayern - SZ.de,0.1,LOW,False,,,unknown,2026-02-25T19:09:46.971165
"Sein Geltungsbedürfnis und der luxuriöse Lebensstil hätten den Angeklagten auf den falschen Weg geführt, urteile der Vorsitzende Richter laut einer Gerichtssprecherin",https://www.sueddeutsche.de/bayern/urteile-haftstrafe-fuer-steuerbetrug-nach-millionen-maskendeal-dpa.urn-newsml-dpa-com-20090101-260225-930-732566,sueddeutsche.de,Urteile - Haftstrafe für Steuerbetrug nach Millionen-Maskendeal - Bayern - SZ.de,0,LOW,False,,,unknown,2026-02-25T19:09:47.175184
"Fake-E-Mails nutzen das Design der Deutschen Rentenversicherung, um Daten abzugreifenSeit einiger Zeit kursieren laut der Deutschen Rentenversicherung Phishing-Mails, die auf den ersten Blick nicht von echten Nachrichten zu unterscheiden sind",http://www.hna.de/verbraucher/aus-sie-betrifft-alle-rentner-deutsche-rentenversicherung-spricht-dringende-warnung-zr-94179486.html,hna.de,Betrifft alle Rentner: Deutsche Rentenversicherung spricht dringende Warnung aus,0,LOW,False,,,unknown,2026-02-25T19:09:48.464259
"Die Betrüger haben Logo und Aufmachung der Rentenversicherung übernommen, um den Eindruck einer offiziellen Mitteilung zu erzeugen",http://www.hna.de/verbraucher/aus-sie-betrifft-alle-rentner-deutsche-rentenversicherung-spricht-dringende-warnung-zr-94179486.html,hna.de,Betrifft alle Rentner: Deutsche Rentenversicherung spricht dringende Warnung aus,0,LOW,False,,,unknown,2026-02-25T19:09:48.674434
"000 EuroParallel zu den gefälschten Mails meldet die DRV eine zweite Betrugsmasche, die hauptsächlich ältere Menschen betrifft",http://www.hna.de/verbraucher/aus-sie-betrifft-alle-rentner-deutsche-rentenversicherung-spricht-dringende-warnung-zr-94179486.html,hna.de,Betrifft alle Rentner: Deutsche Rentenversicherung spricht dringende Warnung aus,0.1,LOW,False,,,unknown,2026-02-25T19:09:48.887693
Worauf die Richterin noch einmal alle Augen zudrückt und den Angeklagten ein weiteres Mal gewähren lässt,https://www.krone.at/4057762,krone.at,„War so verlockend“ - 16-Jähriger wollte mit Falschgeld iPhone kaufen | krone.at,0.1,LOW,False,,,unknown,2026-02-25T19:09:50.629368
Soll im konkreten Fall heißen: 600 Euro Geldbuße statt eines Eintrags ins Strafregister,https://www.krone.at/4057762,krone.at,„War so verlockend“ - 16-Jähriger wollte mit Falschgeld iPhone kaufen | krone.at,0,LOW,False,,,unknown,2026-02-25T19:09:50.841511
"Hinweis: Um alle Funktionen unserer Seiten nutzen zu können, wird JavaScript empfohlen","https://www.br.de/nachrichten/bayern/corona-maskendeals-lange-haftstrafe-fuer-geschaeftsmann,VCArasL",br.de,Corona-Maskendeals: Lange Haftstrafe für Geschäftsmann | BR24,0.1,LOW,False,,,unknown,2026-02-25T19:09:53.293388
"Die Wirtschaftsstrafkammer sah es als erwiesen an, dass der Angeklagte im Zusammenhang mit Maskengeschäften während der Corona-Pandemie betriebliche und persönliche Steuern in Höhe von insgesamt rund 10,7 Millionen Euro hinterzogen hat","https://www.br.de/nachrichten/bayern/corona-maskendeals-lange-haftstrafe-fuer-geschaeftsmann,VCArasL",br.de,Corona-Maskendeals: Lange Haftstrafe für Geschäftsmann | BR24,0,LOW,False,,,unknown,2026-02-25T19:09:53.521792
Im April 2020 habe die Firma vom Bundesgesundheitsministerium den Zuschlag für die Lieferung von fünf Millionen FFP2-Masken im Wert von über 22 Millionen Euro bekommen,"https://www.br.de/nachrichten/bayern/corona-maskendeals-lange-haftstrafe-fuer-geschaeftsmann,VCArasL",br.de,Corona-Maskendeals: Lange Haftstrafe für Geschäftsmann | BR24,0,LOW,False,,,unknown,2026-02-25T19:09:53.722897
"Stell dir vor, der Streber in der Klasse hat jahrelang gelernt und andere Mitschüler stellen ihm einfach Millionen gezielte Fragen, schreiben alle Antworten ab und geben sie als ihre eigene Leistung aus",https://www.20min.ch/story/ki-diebstahl-ki-klau-wie-china-us-firmen-ausgetrickst-haben-soll-103512611,20min.ch,KI-Diebstahl: Anthropic klagt chinesische Firmen wegen gefälschter Nutzerkonten an - 20 Minuten,0.1,LOW,False,,,unknown,2026-02-25T19:09:54.278887
"Darüber führten sie angeblich mehr als 16 Millionen Gespräche mit Anthropics KI-Assistent Claude – und das alles mit dem Ziel, dessen Fähigkeiten für ihre eigene KIs zu kopieren",https://www.20min.ch/story/ki-diebstahl-ki-klau-wie-china-us-firmen-ausgetrickst-haben-soll-103512611,20min.ch,KI-Diebstahl: Anthropic klagt chinesische Firmen wegen gefälschter Nutzerkonten an - 20 Minuten,0.1,LOW,False,,,unknown,2026-02-25T19:09:54.492595
Warum das uns alle betrifftLaut Anthropic fehle,https://www.20min.ch/story/ki-diebstahl-ki-klau-wie-china-us-firmen-ausgetrickst-haben-soll-103512611,20min.ch,KI-Diebstahl: Anthropic klagt chinesische Firmen wegen gefälschter Nutzerkonten an - 20 Minuten,0.1,LOW,False,,,unknown,2026-02-25T19:09:54.698288
[DEBUNKED] Vermisstenfall in Baden-Württemberg hat nichts mit Epstein zu tun,https://correctiv.org/faktencheck/2026/02/25/vermisstenfall-in-baden-wuerttemberg-hat-nichts-mit-jeffrey-epstein-zu-tun/,correctiv.org,Vermisstenfall in Baden-Württemberg hat nichts mit Epstein zu tun,0.9,HIGH,True,FALSE - Debunked by fact-checkers,correctiv.org,factcheck,2026-02-25T19:09:55.785724
Der Schriftsteller stand der öffentlichen Meinung zwar skeptisch gegenüber – doch das Zitat passt laut Fachleuten nicht in den Sprachgebrauch der Zeit,https://correctiv.org/faktencheck/2026/02/25/johann-wolfgang-von-goethe-zitat-ueber-oeffentliche-meinung-als-hirngespinst-stammt-nicht-von-ihm/,correctiv.org,Zitat über öffentliche Meinung als Hirngespinst fälschlich Goethe zugeschrieben,0,LOW,False,,,factcheck,2026-02-25T19:09:57.206811
"Niemand weiß genau, wer sie macht, niemand hat sie je persönlich kennengelernt, aber alle lassen sich von ihr tyrannisieren",https://correctiv.org/faktencheck/2026/02/25/johann-wolfgang-von-goethe-zitat-ueber-oeffentliche-meinung-als-hirngespinst-stammt-nicht-von-ihm/,correctiv.org,Zitat über öffentliche Meinung als Hirngespinst fälschlich Goethe zugeschrieben,0.1,LOW,False,,,factcheck,2026-02-25T19:09:57.424088
"Das „mächtigste Hirngespinst“ sei die öffentliche Meinung, von der sich alle „tyrannisieren“ ließen, soll Goethe geschrieben haben",https://correctiv.org/faktencheck/2026/02/25/johann-wolfgang-von-goethe-zitat-ueber-oeffentliche-meinung-als-hirngespinst-stammt-nicht-von-ihm/,correctiv.org,Zitat über öffentliche Meinung als Hirngespinst fälschlich Goethe zugeschrieben,0.1,LOW,False,,,factcheck,2026-02-25T19:09:57.645022
[DEBUNKED] Hitlergruß auf Wahlplakat: Fotocollage vergleicht falsches AfD-Motiv,https://correctiv.org/faktencheck/2026/02/25/hitlergruss-auf-wahlplakat-afd-politiker-verbreitet-nach-urteil-falsches-motiv/,correctiv.org,Hitlergruß auf Wahlplakat: Fotocollage vergleicht falsches AfD-Motiv,0.9,HIGH,True,FALSE - Debunked by fact-checkers,correctiv.org,factcheck,2026-02-25T19:09:58.921646
"Was in Sachsen-Anhalt begann, hat mittlerweile fast alle Landesverbände und sogar den Bundestag erfasst",https://correctiv.org/aktuelles/afd/2026/02/24/afd-vetternwirtschaft-machtkampf-nrw-helferich-weidel/,correctiv.org,AfD: Vetternwirtschaft-Affäre verschärft Machtkämpfe,0.1,LOW,False,,,factcheck,2026-02-25T19:10:00.096920
"Laut Spiegel-Recherchen ist eine Mitte-Achtzigjährige Ehefrau eines ehemaligen AfD-Kommunalpolitikers, im Landtagsbüro von Klaus Esser (AfD) beschäftigt",https://correctiv.org/aktuelles/afd/2026/02/24/afd-vetternwirtschaft-machtkampf-nrw-helferich-weidel/,correctiv.org,AfD: Vetternwirtschaft-Affäre verschärft Machtkämpfe,0,LOW,False,,,factcheck,2026-02-25T19:10:00.300850
"Der stellvertretende AfD-Fraktionsvorsitzende im Bundestag, Stefan Keuter, beschäftigt laut T-Online seine eigene Freundin in seinem Abgeordnetenbüro",https://correctiv.org/aktuelles/afd/2026/02/24/afd-vetternwirtschaft-machtkampf-nrw-helferich-weidel/,correctiv.org,AfD: Vetternwirtschaft-Affäre verschärft Machtkämpfe,0,LOW,False,,,factcheck,2026-02-25T19:10:00.503261
[DEBUNKED] Ukraine-Krieg länger als Zweiter Weltkrieg: Kritik an Merz-Aussage,https://correctiv.org/faktencheck/hintergrund/2026/02/24/ukraine-krieg-dauere-laenger-als-zweiter-weltkrieg-fachleute-kritisieren-aussage-von-merz/,correctiv.org,Ukraine-Krieg länger als Zweiter Weltkrieg: Kritik an Merz-Aussage,0.9,HIGH,True,FALSE - Debunked by fact-checkers,correctiv.org,factcheck,2026-02-25T19:10:01.696390
"Hubert Aiwanger von der Partei Freie Wähler kritisierte das online mit dem Einwand, 80 Prozent der Wohnungen in Berlin hingen an diesem Netz",https://correctiv.org/faktencheck/2026/02/24/hubert-aiwanger-uebertreibt-bei-wohnungen-die-am-berliner-gasnetz-haengen/,correctiv.org,"Hubert Aiwanger übertreibt bei Wohnungen, die am Berliner Gasnetz hängen",0,LOW,False,,,factcheck,2026-02-25T19:10:02.982804
"In Berlin hingen 80 Prozent der Wohnungen am Gasnetz, in München 50 Prozent, im Bundesdurchschnitt über 50 Prozent",https://correctiv.org/faktencheck/2026/02/24/hubert-aiwanger-uebertreibt-bei-wohnungen-die-am-berliner-gasnetz-haengen/,correctiv.org,"Hubert Aiwanger übertreibt bei Wohnungen, die am Berliner Gasnetz hängen",0,LOW,False,,,factcheck,2026-02-25T19:10:03.194763
"Direkt am Gasnetz hängen in Berlin jedoch nur knapp 45 Prozent der Wohnungen, ähnlich sieht es auch in München und im Bundesdurchschnitt aus",https://correctiv.org/faktencheck/2026/02/24/hubert-aiwanger-uebertreibt-bei-wohnungen-die-am-berliner-gasnetz-haengen/,correctiv.org,"Hubert Aiwanger übertreibt bei Wohnungen, die am Berliner Gasnetz hängen",0,LOW,False,,,factcheck,2026-02-25T19:10:03.283139
"Dann fuhr er fort: „Und ich habe es immer gesagt, und das meine ich ernst",https://correctiv.org/aktuelles/afd/2026/02/24/der-wird-erschossen-verfahren-gegen-afd-politiker-wegen-toetungsfantasien-gegen-linke-eingestellt/,correctiv.org,„Der wird erschossen“: Ermittlungen gegen AfD-Politiker eingestellt,0.1,LOW,False,,,factcheck,2026-02-25T19:10:04.537285
"“ Nach einer kurzen unverständlichen Passage sagte Schmidt laut Mitschnitt: „Der wird erschossen, mit einem gezielten Schuss",https://correctiv.org/aktuelles/afd/2026/02/24/der-wird-erschossen-verfahren-gegen-afd-politiker-wegen-toetungsfantasien-gegen-linke-eingestellt/,correctiv.org,„Der wird erschossen“: Ermittlungen gegen AfD-Politiker eingestellt,0,LOW,False,,,factcheck,2026-02-25T19:10:04.765375
"Der stellvertretende Leiter der Polizeiinspektion Weilheim bestätigte dem Weilheimer Tagblatt, dass der Polizei anonym ein Mitschnitt des AfD-Bürgerdialogs mit den Aussagen übermittelt worden sei",https://correctiv.org/aktuelles/afd/2026/02/24/der-wird-erschossen-verfahren-gegen-afd-politiker-wegen-toetungsfantasien-gegen-linke-eingestellt/,correctiv.org,„Der wird erschossen“: Ermittlungen gegen AfD-Politiker eingestellt,0,LOW,False,,,factcheck,2026-02-25T19:10:05.014082
Wenn alle kurz vorm Feierabend sind,https://correctiv.org/aktuelles/denkanstoss/2026/02/23/die-rassismus-studie-von-der-dobrindt-nichts-hoeren-will/,correctiv.org,Studie zu Rassismus in deutschen Behörden,0.1,LOW,False,,,factcheck,2026-02-25T19:10:07.372850
"Gefördert mit 6 Millionen Euro sind 23 Einzelstudien entstanden, die zeigen: Rassismus steckt in vielen behördlichen Strukturen",https://correctiv.org/aktuelles/denkanstoss/2026/02/23/die-rassismus-studie-von-der-dobrindt-nichts-hoeren-will/,correctiv.org,Studie zu Rassismus in deutschen Behörden,0,LOW,False,,,factcheck,2026-02-25T19:10:07.577225
"Und die Ergebnisse sind teilweise brisant: Da gibt es aus der Ukraine geflohene Roma, die hier nicht anerkannt werden und keine Wohnung bekommen",https://correctiv.org/aktuelles/denkanstoss/2026/02/23/die-rassismus-studie-von-der-dobrindt-nichts-hoeren-will/,correctiv.org,Studie zu Rassismus in deutschen Behörden,0.1,LOW,False,,,factcheck,2026-02-25T19:10:07.790690
[DEBUNKED] KI-Video eines weinenden Lehrers in Frankreich schürt Rassismus,https://correctiv.org/faktencheck/2026/02/23/ki-video-eines-weinenden-lehrers-in-frankreich-schuert-rassismus/,correctiv.org,KI-Video eines weinenden Lehrers in Frankreich schürt Rassismus,0.9,HIGH,True,FALSE - Debunked by fact-checkers,correctiv.org,factcheck,2026-02-25T19:10:08.862197
Fast zwei Monate später liegt sie immer noch nicht vor,https://correctiv.org/aktuelles/sicherheit-und-verteidigung/2026/02/23/us-angriff-auf-venezuela-war-da-was-mit-dem-voelkerrecht/,correctiv.org,US-Angriff auf Venezuela: Und das Völkerrecht?,0.1,LOW,False,,,factcheck,2026-02-25T19:10:10.106040
Auch habe der UN-Sicherheitsrat keine Ermächtigung für einen Angriff erteilt,https://correctiv.org/aktuelles/sicherheit-und-verteidigung/2026/02/23/us-angriff-auf-venezuela-war-da-was-mit-dem-voelkerrecht/,correctiv.org,US-Angriff auf Venezuela: Und das Völkerrecht?,0.1,LOW,False,,,factcheck,2026-02-25T19:10:10.319410
“ Knapp zwei Monate später hat die Bundesregierung immer noch keine solche rechtliche Einordnung vorgelegt,https://correctiv.org/aktuelles/sicherheit-und-verteidigung/2026/02/23/us-angriff-auf-venezuela-war-da-was-mit-dem-voelkerrecht/,correctiv.org,US-Angriff auf Venezuela: Und das Völkerrecht?,0.1,LOW,False,,,factcheck,2026-02-25T19:10:10.523418
Seine Beteiligung liege unter 10 Prozent und er sei kein Mitglied des Aufsichtsrates,https://correctiv.org/aktuelles/sicherheit-und-verteidigung/2026/02/20/kampfdrohnen-verteidigungsministerium-hat-kein-problem-mit-thiel-beteiligung-kamikazedrohnen-bundeswehr-pistorius/,correctiv.org,Verteidigungsministerium hat kein Problem mit Thiel-Beteiligung,0,LOW,False,,,factcheck,2026-02-25T19:10:11.818210
000 Euro pro Monat für ukrainische Bürgergeldempfänger,https://correctiv.org/faktencheck/2026/02/20/buergergeld-4-000-euro-fuer-ukrainer-waeren-moeglich-sind-aber-sehr-selten/,correctiv.org,"4.000 Euro Bürgergeld pro Monat für Ukrainer? Möglich, aber sehr selten",0,LOW,False,,,factcheck,2026-02-25T19:10:13.054131
"000 Euro pro Monat sollen ukrainische Bürgergeldempfänger bekommen, behauptet, René Springer, AfD-Abgeordneter im Bundestag",https://correctiv.org/faktencheck/2026/02/20/buergergeld-4-000-euro-fuer-ukrainer-waeren-moeglich-sind-aber-sehr-selten/,correctiv.org,"4.000 Euro Bürgergeld pro Monat für Ukrainer? Möglich, aber sehr selten",0,LOW,False,,,factcheck,2026-02-25T19:10:13.267133
"Das ist zwar möglich, der Anteil liegt aber bei weniger als 0,1 Prozent",https://correctiv.org/faktencheck/2026/02/20/buergergeld-4-000-euro-fuer-ukrainer-waeren-moeglich-sind-aber-sehr-selten/,correctiv.org,"4.000 Euro Bürgergeld pro Monat für Ukrainer? Möglich, aber sehr selten",0,LOW,False,,,factcheck,2026-02-25T19:10:13.470962
Worum es darin geht: Im Frühjahr 2025 verhängte die irische Datenschutzbehörde DPC ein Bußgeld von 530 Millionen Euro gegen die Plattform Tiktok – wegen der unzulässigen Übermittlung europäischer Nutzerdaten etwa nach China,https://correctiv.org/aktuelles/netzpolitik/2026/02/20/warnung-tiktok-weshalb-europaeische-daten-nach-china-gehen-noyb-irisches-gericht-dpc/,correctiv.org,Tiktok: Europäische Daten wandern nach China – was dagegen getan wird,0,LOW,False,,,factcheck,2026-02-25T19:10:14.798948
Bis zu einer Einigung darf die App laut einer gerichtlichen Auflage des irischen Gerichts (PDF) vom November 2025 zwar zunächst weiterhin Daten nach China senden,https://correctiv.org/aktuelles/netzpolitik/2026/02/20/warnung-tiktok-weshalb-europaeische-daten-nach-china-gehen-noyb-irisches-gericht-dpc/,correctiv.org,Tiktok: Europäische Daten wandern nach China – was dagegen getan wird,0,LOW,False,,,factcheck,2026-02-25T19:10:15.013368
Es müssen aber alle europäischen Nutzer darüber informiert werden – in Form der besagten Benachrichtigung,https://correctiv.org/aktuelles/netzpolitik/2026/02/20/warnung-tiktok-weshalb-europaeische-daten-nach-china-gehen-noyb-irisches-gericht-dpc/,correctiv.org,Tiktok: Europäische Daten wandern nach China – was dagegen getan wird,0.1,LOW,False,,,factcheck,2026-02-25T19:10:15.225773
"„Doch das nehmen alle Verantwortlichen in Kauf, um Deutschland und die Europäische Union (EU) als führenden Chemiestandort zu sichern",https://correctiv.org/aktuelles/lobbyismus/2026/02/25/der-pakt-mit-der-chemiebranche/,correctiv.org,Der Pakt mit der Chemiebranche,0.1,LOW,False,,,factcheck,2026-02-25T19:10:16.580069
"“ Deshalb setze die EU – jedes Jahr entschiedener – auf die Interessen der Industrie: weniger Auflagen, weniger Kontrollen, keine neuen Grenzwerte",https://correctiv.org/aktuelles/lobbyismus/2026/02/25/der-pakt-mit-der-chemiebranche/,correctiv.org,Der Pakt mit der Chemiebranche,0.1,LOW,False,,,factcheck,2026-02-25T19:10:16.786437
Experten sind alarmiert und drängen seit langem auf gesetzliche Maßnahmen gegen die Flut der unbekannten und immer neuen Chemikalien,https://correctiv.org/aktuelles/lobbyismus/2026/02/25/der-pakt-mit-der-chemiebranche/,correctiv.org,Der Pakt mit der Chemiebranche,0.1,LOW,False,,,factcheck,2026-02-25T19:10:16.990759
"[DEBUNKED] Sorry, Bodderas, wir kennen die ungefähre Höhe der COVID-19-Todesfälle - Volksverpetzer",https://www.volksverpetzer.de/analyse/bodderas-covid-19-todesfaelle/,www.volksverpetzer.de,"Sorry, Bodderas, wir kennen die ungefähre Höhe der COVID-19-Todesfälle - Volksverpetzer",0.9,HIGH,True,FALSE - Debunked by fact-checkers,www.volksverpetzer.de,factcheck,2026-02-25T19:10:22.610474
[DEBUNKED] Social-Media-Sucht: Wie Schwarz-Rot die Verantwortung auf Nutzer schiebt - Volksverpetzer,https://www.volksverpetzer.de/aktuelles/social-media-sucht-verbot/,www.volksverpetzer.de,Social-Media-Sucht: Wie Schwarz-Rot die Verantwortung auf Nutzer schiebt - Volksverpetzer,0.9,HIGH,True,FALSE - Debunked by fact-checkers,www.volksverpetzer.de,factcheck,2026-02-25T19:10:23.694885
