claim,source_url,source_domain,article_title,risk_score,risk_category,has_factcheck,factcheck_rating,factcheck_source,source_type,checked_at
90 12051 Berlin Fax: +49 (0) 30 – 555 780 2 20 Büro Berlin Singerstraße 109 10179 Berlin Buchladen Essen Akazienallee 10 45127 Essen Online-Shop Jugendredaktion Salon5 Alle Standorte CORRECTIV,https://correctiv.org/in-eigener-sache/2026/05/14/aufarbeitung-fehlern-veroeffentlichung-digitaler-nsdap-mitgliederkartei/,correctiv.org,Veröffentlichung von digitaler NSDAP-Mitgliederkartei - correctiv.org,0.1,LOW,False,,,factcheck,2026-05-15T03:38:19.486623
[DEBUNKED] Ekel für Klicks? Diese Videos von indischem Essen sind KI-generiert,https://correctiv.org/faktencheck/2026/05/13/ekel-fuer-klicks-diese-videos-von-essen-in-indien-sind-ki-generiert/,correctiv.org,Ekel für Klicks? Diese Videos von indischem Essen sind KI-generiert,0.9,HIGH,True,FALSE - Debunked by fact-checkers,correctiv.org,factcheck,2026-05-15T03:38:20.683363
[DEBUNKED] Altes Trump-Video wird fälschlich dem Hantavirus zugeschrieben,https://correctiv.org/faktencheck/2026/05/13/hantavirus-altes-donald-trump-video-ueber-corona-pandemie-falsch-zugeschrieben/,correctiv.org,Altes Trump-Video wird fälschlich dem Hantavirus zugeschrieben,0.9,HIGH,True,FALSE - Debunked by fact-checkers,correctiv.org,factcheck,2026-05-15T03:38:21.286627
[DEBUNKED] Was hinter dem Vorwurf zu Merz’ Gehaltserhöhung steckt,https://correctiv.org/faktencheck/hintergrund/2026/05/12/was-hinter-dem-vorwurf-zu-merz-gehaltserhoehung-steckt/,correctiv.org,Was hinter dem Vorwurf zu Merz’ Gehaltserhöhung steckt,0.9,HIGH,True,FALSE - Debunked by fact-checkers,correctiv.org,factcheck,2026-05-15T03:38:21.888412
"Wir laden alle Gemeinden ein, die Noten hier herunterzuladen",https://correctiv.org/in-eigener-sache/2026/05/13/kirchenlied-missbrauch-der-vorhang-zerreisst/,correctiv.org,Erstes Kirchenlied zu Missbrauch: „Der Vorhang zerreißt“,0.1,LOW,False,,,factcheck,2026-05-15T03:38:22.476544
[DEBUNKED] CORRECTIV macht Medienbildung und neue Formate auf der re:publica 2026 erlebbar - correctiv.org,https://correctiv.org/in-eigener-sache/2026/05/12/correctiv-macht-medienbildung-und-neue-formate-auf-der-republica-2026-erlebbar/,correctiv.org,CORRECTIV macht Medienbildung und neue Formate auf der re:publica 2026 erlebbar - correctiv.org,0.9,HIGH,True,FALSE - Debunked by fact-checkers,correctiv.org,factcheck,2026-05-15T03:38:22.976558
"[DEBUNKED] „AfD Wuppertal“: Tiktok-Kanal gab vor, offizielles Partei-Profil zu sein",https://correctiv.org/faktencheck/2026/05/12/afd-wuppertal-tiktok-kanal-gab-vor-offizielles-partei-profil-zu-sein/,correctiv.org,"„AfD Wuppertal“: Tiktok-Kanal gab vor, offizielles Partei-Profil zu sein",0.9,HIGH,True,FALSE - Debunked by fact-checkers,correctiv.org,factcheck,2026-05-15T03:38:23.577876
"[DEBUNKED] Der Mann, der sich nicht erinnert - correctiv.org",https://correctiv.org/aktuelles/afd/2026/05/12/hans-holger-malcomess-afd-gold-bessergold/,correctiv.org,"Der Mann, der sich nicht erinnert - correctiv.org",0.9,HIGH,True,FALSE - Debunked by fact-checkers,correctiv.org,factcheck,2026-05-15T03:38:24.279517
[DEBUNKED] Das verschwundene Gold der AfD - correctiv.org,https://correctiv.org/aktuelles/afd/2026/05/12/afd-gold-strangfeld-erbe/,correctiv.org,Das verschwundene Gold der AfD - correctiv.org,0.9,HIGH,True,FALSE - Debunked by fact-checkers,correctiv.org,factcheck,2026-05-15T03:38:24.969965
"Immer wieder setzt die Redaktion Themenwochen und Projekte rund um demokratische Grundwerte um und schafft Räume für Austausch, Diskussion und Aufklärung",https://correctiv.org/in-eigener-sache/2026/05/11/6-jahre-salon5-jugendjournalismus-fuer-eine-starke-demokratie/,correctiv.org,6 Jahre Salon5 – Jugendjournalismus für eine starke Demokratie - correctiv.org,0.1,LOW,False,,,factcheck,2026-05-15T03:38:25.559822
[DEBUNKED] Keine „Islam-Hüpfburg“ in Leipzig: AfD-Politiker zeigt christliches Fest,https://correctiv.org/faktencheck/2026/05/08/islam-huepfburg-afd-politiker-behauptet-ueber-christlichem-fest-es-sei-muslimisch/,correctiv.org,Keine „Islam-Hüpfburg“ in Leipzig: AfD-Politiker zeigt christliches Fest,0.9,HIGH,True,FALSE - Debunked by fact-checkers,correctiv.org,factcheck,2026-05-15T03:38:26.898841
"Diese will die Bundesregierung beenden, seither werden keine neuen Zusagen mehr erteilt und auch bestehende zurückgezogen",https://correctiv.org/aktuelles/grenzpolitik/2026/05/08/bundesregierung-haelt-schutzzusage-fuer-fast-800-afghanen-nicht-ein/,correctiv.org,Bundesregierung hält Schutzzusage für fast 800 Afghanen nicht ein,0.1,LOW,False,,,factcheck,2026-05-15T03:38:27.571094
Der Verein sei eine „Nicht-Regierungsorganisation“ für alle „ethnisch Deutschen“,https://correctiv.org/aktuelles/neue-rechte/2026/05/08/afd-neonazis-thueringen-jungeuropa-treffen-2026/,correctiv.org,AfD und Neonazis: Abgeordnete sponsern Treffen,0.1,LOW,False,,,factcheck,2026-05-15T03:38:28.392546
[DEBUNKED] Faktencheck: Wurden in Deutschland 7 Quarantänezentren eröffnet?,https://www.mimikama.org/haben-7-quarantaenezentren-in-deutschland-eroeffnet/,www.mimikama.org,Faktencheck: Wurden in Deutschland 7 Quarantänezentren eröffnet?,0.9,HIGH,True,FALSE - Debunked by fact-checkers,www.mimikama.org,factcheck,2026-05-15T03:38:28.460243
[DEBUNKED] Kennst du diese Facebook-Seiten mit den einfachen Fragen?,https://www.mimikama.org/facebook-seiten-einfache-fragen/,www.mimikama.org,Kennst du diese Facebook-Seiten mit den einfachen Fragen?,0.9,HIGH,True,FALSE - Debunked by fact-checkers,www.mimikama.org,factcheck,2026-05-15T03:38:28.529667
[DEBUNKED] Faktencheck: Ist die MV Hondius wirklich ein Pharma-Testlauf?,https://www.mimikama.org/ist-die-mv-hondius-ein-pharma-testlauf/,www.mimikama.org,Faktencheck: Ist die MV Hondius wirklich ein Pharma-Testlauf?,0.9,HIGH,True,FALSE - Debunked by fact-checkers,www.mimikama.org,factcheck,2026-05-15T03:38:28.599139
[DEBUNKED] WhatsApp-Gruppen: Aktuelle Warnung vor massenhaften Sperrungen?,https://www.mimikama.org/werden-whatsapp-gruppen-derzeit-wirklich-massenhaft-gesperrt/,www.mimikama.org,WhatsApp-Gruppen: Aktuelle Warnung vor massenhaften Sperrungen?,0.9,HIGH,True,FALSE - Debunked by fact-checkers,www.mimikama.org,factcheck,2026-05-15T03:38:28.660050
[DEBUNKED] Ist Hantavirus das neue Corona? Faktencheck zum Ausbruch auf der MV Hondius,https://www.mimikama.org/hantavirus-corona-faktencheck/,www.mimikama.org,Ist Hantavirus das neue Corona? Faktencheck zum Ausbruch auf der MV Hondius,0.9,HIGH,True,FALSE - Debunked by fact-checkers,www.mimikama.org,factcheck,2026-05-15T03:38:28.737398
[DEBUNKED] Hantavirus: Warum Verschwörungs-Narrative bleiben,https://www.mimikama.org/hantavirus-alte-narrative-corona/,www.mimikama.org,Hantavirus: Warum Verschwörungs-Narrative bleiben,0.9,HIGH,True,FALSE - Debunked by fact-checkers,www.mimikama.org,factcheck,2026-05-15T03:38:28.809016
[DEBUNKED] Hantavirus: Wie Social Media Desinformation verstärkt,https://www.mimikama.org/hantavirus-algorithmus-reichweite-dynamik/,www.mimikama.org,Hantavirus: Wie Social Media Desinformation verstärkt,0.9,HIGH,True,FALSE - Debunked by fact-checkers,www.mimikama.org,factcheck,2026-05-15T03:38:28.874909
[DEBUNKED] Hantavirus: Warum sich plötzlich alle einmischen,https://www.mimikama.org/hantavirus-kommentare-narrative-mischen/,www.mimikama.org,Hantavirus: Warum sich plötzlich alle einmischen,0.9,HIGH,True,FALSE - Debunked by fact-checkers,www.mimikama.org,factcheck,2026-05-15T03:38:28.938620
[DEBUNKED] Hantavirus und Geschäft: Wie Angst zu Geld gemacht wird,https://www.mimikama.org/hantavirus-geschaeftsmodell-social-media-angst/,www.mimikama.org,Hantavirus und Geschäft: Wie Angst zu Geld gemacht wird,0.9,HIGH,True,FALSE - Debunked by fact-checkers,www.mimikama.org,factcheck,2026-05-15T03:38:29.014631
[DEBUNKED] Hantavirus: Warum sich Mythen schneller verbreiten als Fakten,https://www.mimikama.org/hantavirus-mythen-soziale-medien-desinformation/,www.mimikama.org,Hantavirus: Warum sich Mythen schneller verbreiten als Fakten,0.9,HIGH,True,FALSE - Debunked by fact-checkers,www.mimikama.org,factcheck,2026-05-15T03:38:29.082542
[DEBUNKED] Hantavirus-Impfstoff: Wo bleibt die Genehmigung für den Einsatz?,https://www.mimikama.org/ist-der-hantavirus-impfstoff-schon-genehmigt/,www.mimikama.org,Hantavirus-Impfstoff: Wo bleibt die Genehmigung für den Einsatz?,0.9,HIGH,True,FALSE - Debunked by fact-checkers,www.mimikama.org,factcheck,2026-05-15T03:38:29.150072
[DEBUNKED] Ist die Hantavirus-Verordnung aus Österreich echt?,https://www.mimikama.org/hantavirus-oesterreich-bgbl-114-2026/,www.mimikama.org,Ist die Hantavirus-Verordnung aus Österreich echt?,0.9,HIGH,True,FALSE - Debunked by fact-checkers,www.mimikama.org,factcheck,2026-05-15T03:38:29.244834
[DEBUNKED] Wurde Lars Klingbeil wirklich festgenommen?,https://www.mimikama.org/wurde-lars-klingbeil-festgenommen/,www.mimikama.org,Wurde Lars Klingbeil wirklich festgenommen?,0.9,HIGH,True,FALSE - Debunked by fact-checkers,www.mimikama.org,factcheck,2026-05-15T03:38:29.306903
[DEBUNKED] Hat ein Tweet 2022 den Hantavirus-Ausbruch vorhergesagt?,https://www.mimikama.org/tweet-2022-hantavirus-vorhersage-faktencheck/,www.mimikama.org,Hat ein Tweet 2022 den Hantavirus-Ausbruch vorhergesagt?,0.9,HIGH,True,FALSE - Debunked by fact-checkers,www.mimikama.org,factcheck,2026-05-15T03:38:29.369665
[DEBUNKED] Vorsicht: Nachrichtenmüdigkeit erhöht Risiko für Fake News!,https://www.mimikama.org/nachrichtenmuedigkeit-anfaelliger-fuer-fake-news/,www.mimikama.org,Vorsicht: Nachrichtenmüdigkeit erhöht Risiko für Fake News!,0.9,HIGH,True,FALSE - Debunked by fact-checkers,www.mimikama.org,factcheck,2026-05-15T03:38:29.446106
"„Generation Deutschland“: ein Sammelbecken an Rechtsextremisten Nach der Gründung der neuen AfD-Jugend auf Bundesebene im letzten Jahr in Gießen haben sich nun auch fast alle Landesverbände der ""Generation Deutschland"" gegründet",https://www.volksverpetzer.de/analyse/grosse-generation-deutschland/,www.volksverpetzer.de,Die große &quot;Generation Deutschland&quot;-Recherche: Der Trick der AfD‑Jugend entlarvt! - Volksve,0.1,LOW,False,,,factcheck,2026-05-15T03:38:29.974801
[DEBUNKED] Warum Zehdenick für die AfD eine Ausnahme bleiben wird - Volksverpetzer,https://www.volksverpetzer.de/analyse/zehdenick-afd-problem/,www.volksverpetzer.de,Warum Zehdenick für die AfD eine Ausnahme bleiben wird - Volksverpetzer,0.9,HIGH,True,FALSE - Debunked by fact-checkers,www.volksverpetzer.de,factcheck,2026-05-15T03:38:30.422303
[DEBUNKED] Wie die Ostdeutsche Allgemeine Volksverpetzer zum Schweigen bringen will - Volksverpetzer,https://www.volksverpetzer.de/aktuelles/ostdeutsche-allgemeine-anwalt-anschwaerzen/,www.volksverpetzer.de,Wie die Ostdeutsche Allgemeine Volksverpetzer zum Schweigen bringen will - Volksverpetzer,0.9,HIGH,True,FALSE - Debunked by fact-checkers,www.volksverpetzer.de,factcheck,2026-05-15T03:38:30.873883
Ein paar Fakten zum Einstieg: Mehr Migration entlastet die öffentlichen Haushalte langfristig um rund 104 Milliarden Euro jährlich,https://www.volksverpetzer.de/faktencheck/bas-tagesthemen-faktencheck/,www.volksverpetzer.de,"Bärbel Bas hat RECHT: Aber Tagesthemen stimmen NIUS, BILD &amp; AfD zu!? - Volksverpetzer",0,LOW,False,,,factcheck,2026-05-15T03:38:31.462824
"Das würde man aber nie erfahren, wenn man die Tagesthemen am Donnerstag gesehen hätte",https://www.volksverpetzer.de/faktencheck/bas-tagesthemen-faktencheck/,www.volksverpetzer.de,"Bärbel Bas hat RECHT: Aber Tagesthemen stimmen NIUS, BILD &amp; AfD zu!? - Volksverpetzer",0.1,LOW,False,,,factcheck,2026-05-15T03:38:31.545358
[DEBUNKED] 75 % wollen KEINEN AfD-Kanzler: Wie die WELT für die AfD lügt - Volksverpetzer,https://www.volksverpetzer.de/faktencheck/75-kein-afd-kanzler/,www.volksverpetzer.de,75 % wollen KEINEN AfD-Kanzler: Wie die WELT für die AfD lügt - Volksverpetzer,0.9,HIGH,True,FALSE - Debunked by fact-checkers,www.volksverpetzer.de,factcheck,2026-05-15T03:38:31.982801
"Diesel kostete am Samstagmittag im Schnitt 2,15 Euro pro Liter, am Sonntagmorgen lag der Preis erneut höher als 24 Stunden zuvor",https://www.volksverpetzer.de/analyse/tankrabatt-2026-flopp/,www.volksverpetzer.de,Warum der Tankrabatt wirklich floppt - Volksverpetzer,0,LOW,False,,,factcheck,2026-05-15T03:38:32.567625
"Mai stand Diesel bei 2,104 Euro, E10 bei 2,017 Euro",https://www.volksverpetzer.de/analyse/tankrabatt-2026-flopp/,www.volksverpetzer.de,Warum der Tankrabatt wirklich floppt - Volksverpetzer,0,LOW,False,,,factcheck,2026-05-15T03:38:32.643384
Laut diesem werden beim Benzin nur 12 Cent von den 17 weitergegeben,https://www.volksverpetzer.de/analyse/tankrabatt-2026-flopp/,www.volksverpetzer.de,Warum der Tankrabatt wirklich floppt - Volksverpetzer,0,LOW,False,,,factcheck,2026-05-15T03:38:32.721165
[DEBUNKED] Reiche-Lüge verbreitet: Warum ist die Tagesschau so schlecht bei Fakes der Regierung? - Volksverpetzer,https://www.volksverpetzer.de/faktencheck/reiche-luege-tagesschau/,www.volksverpetzer.de,Reiche-Lüge verbreitet: Warum ist die Tagesschau so schlecht bei Fakes der Regierung? - Volksverpetz,0.9,HIGH,True,FALSE - Debunked by fact-checkers,www.volksverpetzer.de,factcheck,2026-05-15T03:38:33.164845
"Nur wenige machen sich aber die Mühe, gegen den Rundfunkbeitrag von derzeit 18,36 Euro pro Monat zu klagen",https://www.volksverpetzer.de/serie/april-2026-swr-ausgewogen/,www.volksverpetzer.de,Urteile April 2026: SWR berichtet ausgewogen – Gericht weist Klage ab! - Volksverpetzer,0,LOW,False,,,factcheck,2026-05-15T03:38:33.694787
[DEBUNKED] &quot;Sämtlich unwahr&quot;: Gericht-Doppel-Klatsche für Reichelts Hetz-Portal NIUS! - Volksverpetzer,https://www.volksverpetzer.de/aktuelles/gericht-doppel-klatsche-nius/,www.volksverpetzer.de,&quot;Sämtlich unwahr&quot;: Gericht-Doppel-Klatsche für Reichelts Hetz-Portal NIUS! - Volksverpetze,0.9,HIGH,True,FALSE - Debunked by fact-checkers,www.volksverpetzer.de,factcheck,2026-05-15T03:38:34.139769
[DEBUNKED] Does 'hanta' mean 'scam' in Hebrew slang? Social media users confused similar words | Snopes.com,https://www.snopes.com/fact-check/hantavirus-slang-scam-hebrew/,www.snopes.com,Does 'hanta' mean 'scam' in Hebrew slang? Social media users confused similar words | Snopes.com,0.9,HIGH,True,FALSE - Debunked by fact-checkers,www.snopes.com,factcheck,2026-05-15T03:38:34.315633
[DEBUNKED] Does same baker make Girl Scout Cookies and Dollar Tree knockoffs? We checked | Snopes.com,https://www.snopes.com/fact-check/dollar-tree-girl-scout-cookies/,www.snopes.com,Does same baker make Girl Scout Cookies and Dollar Tree knockoffs? We checked | Snopes.com,0.9,HIGH,True,FALSE - Debunked by fact-checkers,www.snopes.com,factcheck,2026-05-15T03:38:34.496923
[DEBUNKED] Is Trump allowing hunting in national parks? We tracked down the facts | Snopes.com,https://www.snopes.com/news/2026/05/14/trump-hunting-in-national-parks/,www.snopes.com,Is Trump allowing hunting in national parks? We tracked down the facts | Snopes.com,0.9,HIGH,True,FALSE - Debunked by fact-checkers,www.snopes.com,factcheck,2026-05-15T03:38:34.590058
[DEBUNKED] Alleged vintage TV ad shows toothpaste tube squirting into toothbrush's mouth. Is it real? | Snopes.com,https://www.snopes.com/fact-check/tv-ad-toothpaste-mouth/,www.snopes.com,Alleged vintage TV ad shows toothpaste tube squirting into toothbrush's mouth. Is it real? | Snopes.,0.9,HIGH,True,FALSE - Debunked by fact-checkers,www.snopes.com,factcheck,2026-05-15T03:38:34.769472
[DEBUNKED] Did Mark Carney mock Trump at G7 summit in Italy? | Snopes.com,https://www.snopes.com/fact-check/trump-mark-carney-g7/,www.snopes.com,Did Mark Carney mock Trump at G7 summit in Italy? | Snopes.com,0.9,HIGH,True,FALSE - Debunked by fact-checkers,www.snopes.com,factcheck,2026-05-15T03:38:34.858712
"[DEBUNKED] Vatican gave Iranian ambassador diplomatic honor, but Pope Leo XIV didn't personally bestow it | Snopes.com",https://www.snopes.com/fact-check/vatican-iran-ambassador-honor/,www.snopes.com,"Vatican gave Iranian ambassador diplomatic honor, but Pope Leo XIV didn't personally bestow it | Sno",0.9,HIGH,True,FALSE - Debunked by fact-checkers,www.snopes.com,factcheck,2026-05-15T03:38:35.057981
"[DEBUNKED] Did 323 vials of pathogens, including hantavirus, go missing from Australian lab? | Snopes.com",https://www.snopes.com/fact-check/hantavirus-vials-australia/,www.snopes.com,"Did 323 vials of pathogens, including hantavirus, go missing from Australian lab? | Snopes.com",0.9,HIGH,True,FALSE - Debunked by fact-checkers,www.snopes.com,factcheck,2026-05-15T03:38:35.166643
"[DEBUNKED] Was golden Trump statue vandalized with garbage, as shown in image? | Snopes.com",https://www.snopes.com/fact-check/trump-gold-statue-trash/,www.snopes.com,"Was golden Trump statue vandalized with garbage, as shown in image? | Snopes.com",0.9,HIGH,True,FALSE - Debunked by fact-checkers,www.snopes.com,factcheck,2026-05-15T03:38:35.450078
[DEBUNKED] Did Trump sign White House report targeting trans rights advocates for death? Here's the real story | Snopes.com,https://www.snopes.com/fact-check/trump-white-house-death-trans-rights-advocates/,www.snopes.com,Did Trump sign White House report targeting trans rights advocates for death? Here's the real story ,0.9,HIGH,True,FALSE - Debunked by fact-checkers,www.snopes.com,factcheck,2026-05-15T03:38:35.538162
"Nationwide, 91% of people sentenced were United States citizens",http://www.politifact.com/article/2026/may/14/vice-president-JD-Vance-Maine-fraud-Janet-Mills/,www.politifact.com,"PolitiFact | Fact-checking JD Vance on Maine Democrats, Medicaid fraud and autism coverage",0,LOW,False,,,factcheck,2026-05-15T03:38:35.687433
"illegally, just under 1% of the state’s population and one of the smallest unauthorized immigrant populations in the U",http://www.politifact.com/article/2026/may/14/vice-president-JD-Vance-Maine-fraud-Janet-Mills/,www.politifact.com,"PolitiFact | Fact-checking JD Vance on Maine Democrats, Medicaid fraud and autism coverage",0.1,LOW,False,,,factcheck,2026-05-15T03:38:35.771909
"Although hantavirus’ mortality rate is quite high — close to 40% for some strains — there is not evidence it easily spreads or mutates, making it more likely that the public health response can keep pace to reduce further spread",http://www.politifact.com/article/2026/may/13/hantavirus-outbreak-cruise-ship-facts-not-covid/,www.politifact.com,PolitiFact | Why experts say hantavirus isn’t ‘COVID-19: The Sequel.’ Four facts to calm your nerves,0,LOW,False,,,factcheck,2026-05-15T03:38:36.278726
"More Info I would like to contribute One Time Monthly Yearly Join Now Nicholas Langworthy stated on March 31, 2026 in an X post: “The average IRS tax refund is up 11% compared to last year",http://www.politifact.com/factchecks/2026/may/11/nicholas-langworthy/tax-refunds-11-percent-reduction-irs/,www.politifact.com,PolitiFact | Have IRS refunds increased by 11% in 2026? Yes,0,LOW,False,,,factcheck,2026-05-15T03:38:36.653151
"” Taxes New York Nicholas Langworthy (AP) By Holden Turek May 11, 2026 Have IRS refunds increased by 11% in 2026",http://www.politifact.com/factchecks/2026/may/11/nicholas-langworthy/tax-refunds-11-percent-reduction-irs/,www.politifact.com,PolitiFact | Have IRS refunds increased by 11% in 2026? Yes,0,LOW,False,,,factcheck,2026-05-15T03:38:36.731574
"1% higher than they were in 2025, a number that has remained steady in the weeks since",http://www.politifact.com/factchecks/2026/may/11/nicholas-langworthy/tax-refunds-11-percent-reduction-irs/,www.politifact.com,PolitiFact | Have IRS refunds increased by 11% in 2026? Yes,0,LOW,False,,,factcheck,2026-05-15T03:38:36.813822
Studies of GLP-1s show patients’ average weight loss ranges from 5% to 20% of their body weight,http://www.politifact.com/article/2026/may/11/glp1-weight-loss-side-effects-diet-exercise-wegovy/,www.politifact.com,PolitiFact | Realities of life on GLP-1s for weight loss: What doctors say you can expect,0,LOW,False,,,factcheck,2026-05-15T03:38:36.971182
2 cent drop amounted to a decline of two-tenths of 1%,http://www.politifact.com/factchecks/2026/may/08/donald-trump/gasoline-prices-falling-crude-oil/,www.politifact.com,"PolitiFact | Trump is wrong: Gas prices have reached near record highs, not &#x27;come down very sub",0,LOW,False,,,factcheck,2026-05-15T03:38:37.140089
"Brent crude, the standard price metric for international oil markets, fell from a peak of about $114 a barrel on May 4 to roughly $103 around the time Trump spoke on May 7, a drop of about 10%",http://www.politifact.com/factchecks/2026/may/08/donald-trump/gasoline-prices-falling-crude-oil/,www.politifact.com,"PolitiFact | Trump is wrong: Gas prices have reached near record highs, not &#x27;come down very sub",0,LOW,False,,,factcheck,2026-05-15T03:38:37.219222
"-produced oil, fell from almost $84 a barrel on May 4 to around $79 when Trump spoke, roughly a 6% decline",http://www.politifact.com/factchecks/2026/may/08/donald-trump/gasoline-prices-falling-crude-oil/,www.politifact.com,"PolitiFact | Trump is wrong: Gas prices have reached near record highs, not &#x27;come down very sub",0,LOW,False,,,factcheck,2026-05-15T03:38:37.295739
[DEBUNKED] Viral map doesn’t show all councils Reform UK controls – Full Fact,https://fullfact.org/politics/map-reform-councils-uk-missing-context/,fullfact.org,Viral map doesn’t show all councils Reform UK controls – Full Fact,0.9,HIGH,True,FALSE - Debunked by fact-checkers,fullfact.org,factcheck,2026-05-15T03:38:37.986366
[DEBUNKED] WHO has not said hantavirus is spreading ‘very fast across the world’ – Full Fact,https://fullfact.org/health/who-hantavirus-spreading-fast-false/,fullfact.org,WHO has not said hantavirus is spreading ‘very fast across the world’ – Full Fact,0.9,HIGH,True,FALSE - Debunked by fact-checkers,fullfact.org,factcheck,2026-05-15T03:38:38.659638
[DEBUNKED] Local election bar charts revisited: how misleading were they in the end? – Full Fact,https://fullfact.org/politics/election-2026-leaflet-results/,fullfact.org,Local election bar charts revisited: how misleading were they in the end? – Full Fact,0.9,HIGH,True,FALSE - Debunked by fact-checkers,fullfact.org,factcheck,2026-05-15T03:38:40.122228
"[DEBUNKED] No, Reform UK did not field a ‘fake’ candidate in Norfolk – Full Fact",https://fullfact.org/politics/reform-did-not-field-fake-candidate-george-boyd/,fullfact.org,"No, Reform UK did not field a ‘fake’ candidate in Norfolk – Full Fact",0.9,HIGH,True,FALSE - Debunked by fact-checkers,fullfact.org,factcheck,2026-05-15T03:38:41.028001
[DEBUNKED] More fake pictures of Nigel Farage in hospital circulate online – Full Fact,https://fullfact.org/politics/more-nigel-farage-hospital-images-false/,fullfact.org,More fake pictures of Nigel Farage in hospital circulate online – Full Fact,0.9,HIGH,True,FALSE - Debunked by fact-checkers,fullfact.org,factcheck,2026-05-15T03:38:41.871017
"56, or 53%, from the average price of $2",https://www.factcheck.org/2026/05/what-will-happen-to-gasoline-prices-when-the-iran-war-ends/,www.factcheck.org,What Will Happen To Gasoline Prices When the Iran War Ends? - FactCheck.org,0,LOW,False,,,factcheck,2026-05-15T03:38:42.000481
[DEBUNKED] Kennedy Denies the One Big Beautiful Bill Act&#039;s Spending Cuts to Medicaid - FactCheck.org,https://www.factcheck.org/2026/05/kennedy-denies-the-one-big-beautiful-bill-acts-spending-cuts-to-medicaid/,www.factcheck.org,Kennedy Denies the One Big Beautiful Bill Act&#039;s Spending Cuts to Medicaid - FactCheck.org,0.9,HIGH,True,FALSE - Debunked by fact-checkers,www.factcheck.org,factcheck,2026-05-15T03:38:42.550640
[DEBUNKED] Project 2025 Series Wins National Headliner Award - FactCheck.org,https://www.factcheck.org/2026/04/project-2025-series-wins-national-headliner-award/,www.factcheck.org,Project 2025 Series Wins National Headliner Award - FactCheck.org,0.9,HIGH,True,FALSE - Debunked by fact-checkers,www.factcheck.org,factcheck,2026-05-15T03:38:43.577995
[DEBUNKED] The Persistent Misleading Claim That Vaccines Aren’t Properly Tested for Safety - FactCheck.org,https://www.factcheck.org/2026/04/the-persistent-misleading-claim-that-vaccines-arent-properly-tested-for-safety/,www.factcheck.org,The Persistent Misleading Claim That Vaccines Aren’t Properly Tested for Safety - FactCheck.org,0.9,HIGH,True,FALSE - Debunked by fact-checkers,www.factcheck.org,factcheck,2026-05-15T03:38:43.629129
"[DEBUNKED] Fact Check: FAKE 'After Image' Does NOT Match Actual Destruction For ""Gaza in 2023 and 2026"" Comparison | Lead Stories",https://leadstories.com/hoax-alert/2026/05/fact-check-fake-after-image-does-not-match-actual-destruction-comparing-gaza-in-2023-and-2026.html,leadstories.com,"Fact Check: FAKE 'After Image' Does NOT Match Actual Destruction For ""Gaza in 2023 and 2026"" Compari",0.9,HIGH,True,FALSE - Debunked by fact-checkers,leadstories.com,factcheck,2026-05-15T03:38:43.765995
[DEBUNKED] Fact Check: Justin Bieber Did NOT Say Jim Carrey 'Died Of Kuru' After Years of Child Meat Parties in Hollywood -- Story Came From Prolific Fake News Site | Lead Stories,https://leadstories.com/hoax-alert/2026/05/fact-check-justin-bieber-did-not-reveal-jim-carrey-died-of-kuru-after-years-of-child-meat-parties-in-hollywood.html,leadstories.com,Fact Check: Justin Bieber Did NOT Say Jim Carrey 'Died Of Kuru' After Years of Child Meat Parties in,0.9,HIGH,True,FALSE - Debunked by fact-checkers,leadstories.com,factcheck,2026-05-15T03:38:43.893032
