claim,source_url,source_domain,article_title,risk_score,risk_category,has_factcheck,factcheck_rating,factcheck_source,source_type,checked_at
[DEBUNKED] Video of Italian Prime Minister saying Sharia law won’t be allowed in Italy is AI-generated – Full Fact,https://fullfact.org/europe/giorgia-meloni-sharia-law-italy-video-fake/,fullfact.org,Video of Italian Prime Minister saying Sharia law won’t be allowed in Italy is AI-generated – Full F,0.9,HIGH,True,FALSE - Debunked by fact-checkers,fullfact.org,factcheck,2026-07-22T13:58:15.546959
[DEBUNKED] Viral clip does not show Nigel Farage rehearsing a ‘grief walk’ after Ann Widdecombe’s death – Full Fact,https://fullfact.org/politics/farage-grief-walk-ann-widdecombe-misleading/,fullfact.org,Viral clip does not show Nigel Farage rehearsing a ‘grief walk’ after Ann Widdecombe’s death – Full ,0.9,HIGH,True,FALSE - Debunked by fact-checkers,fullfact.org,factcheck,2026-07-22T13:58:16.376315
"Ofcom data shows 89% of UK residences had gigabit-capable coverage in January 2026, as did 84% of small and medium-sized businesses",https://fullfact.org/government-tracker/is-the-national-roll-out-of-gigabit-broadband-on-track/,fullfact.org,Is the national roll-out of gigabit broadband on track? – Full Fact,0,LOW,False,,,factcheck,2026-07-22T13:58:17.095948
"In 2022, the previous Conservative government set a target for UK-wide gigabit-capable broadband by 2030, where ‘nationwide’ means 99% of all UK domestic and business premises have access",https://fullfact.org/government-tracker/is-the-national-roll-out-of-gigabit-broadband-on-track/,fullfact.org,Is the national roll-out of gigabit broadband on track? – Full Fact,0,LOW,False,,,factcheck,2026-07-22T13:58:17.175356
"In 2020, it had previously set a separate target for 85% coverage by 2025, which data published by Think Broadband shows was achieved",https://fullfact.org/government-tracker/is-the-national-roll-out-of-gigabit-broadband-on-track/,fullfact.org,Is the national roll-out of gigabit broadband on track? – Full Fact,0,LOW,False,,,factcheck,2026-07-22T13:58:17.258157
"“Male sperm counts, I think, in this country are down 50% for teenage males,” he said on a May 28 episode of his recently launched podcast, after introducing concerns about a &#8220;stunning&#8221; drop in the rate of childbirths",https://www.factcheck.org/2026/07/rfk-jr-s-flawed-claims-about-sperm-count-and-fertility/,www.factcheck.org,RFK Jr.’s Flawed Claims About Sperm Count and Fertility - FactCheck.org,0,LOW,False,,,factcheck,2026-07-22T13:58:17.978994
There are some studies that have found about a 50% drop in sperm counts in men over the past half century or so,https://www.factcheck.org/2026/07/rfk-jr-s-flawed-claims-about-sperm-count-and-fertility/,www.factcheck.org,RFK Jr.’s Flawed Claims About Sperm Count and Fertility - FactCheck.org,0,LOW,False,,,factcheck,2026-07-22T13:58:18.063369
"[DEBUNKED] No Clear Evidence Religion Is &#039;Bigger and Stronger&#039; in U.S., Despite Trump Claim - FactCheck.org",https://www.factcheck.org/2026/07/no-clear-evidence-religion-is-bigger-and-stronger-in-u-s-despite-trump-claim/,www.factcheck.org,"No Clear Evidence Religion Is &#039;Bigger and Stronger&#039; in U.S., Despite Trump Claim - FactChe",0.9,HIGH,True,FALSE - Debunked by fact-checkers,www.factcheck.org,factcheck,2026-07-22T13:58:18.109632
[DEBUNKED] FactCheck.org Wins Sigma Delta Chi Award for Fact-Checking - FactCheck.org,https://www.factcheck.org/2026/07/factcheck-org-wins-sigma-delta-chi-award-for-fact-checking/,www.factcheck.org,FactCheck.org Wins Sigma Delta Chi Award for Fact-Checking - FactCheck.org,0.9,HIGH,True,FALSE - Debunked by fact-checkers,www.factcheck.org,factcheck,2026-07-22T13:58:18.454697
[DEBUNKED] Alaska Senate Race Ads Mislead on Peltola&#039;s Votes on Military Pay Raise - FactCheck.org,https://www.factcheck.org/2026/07/alaska-senate-race-ads-mislead-on-peltolas-votes-on-military-pay-raise/,www.factcheck.org,Alaska Senate Race Ads Mislead on Peltola&#039;s Votes on Military Pay Raise - FactCheck.org,0.9,HIGH,True,FALSE - Debunked by fact-checkers,www.factcheck.org,factcheck,2026-07-22T13:58:18.495722
[DEBUNKED] Democratic Group Makes False Claim in Insider-Trading Ad Attacking Susan Collins - FactCheck.org,https://www.factcheck.org/2026/07/democratic-group-makes-false-claim-in-insider-trading-ad-attacking-susan-collins/,www.factcheck.org,Democratic Group Makes False Claim in Insider-Trading Ad Attacking Susan Collins - FactCheck.org,0.9,HIGH,True,FALSE - Debunked by fact-checkers,www.factcheck.org,factcheck,2026-07-22T13:58:18.633685
[DEBUNKED] Fact Check: Lamine Yamal Did NOT Unfold Keffiyeh At Pitch During 2026 FIFA World Cup  | Lead Stories,https://leadstories.com/hoax-alert/2026/07/fact-check-lamine-yamal-did-not-unfold-keffiyeh-during-2026-fifa-world-cup.html,leadstories.com,Fact Check: Lamine Yamal Did NOT Unfold Keffiyeh At Pitch During 2026 FIFA World Cup  | Lead Stories,0.9,HIGH,True,FALSE - Debunked by fact-checkers,leadstories.com,factcheck,2026-07-22T13:58:19.154856
[DEBUNKED] Fact Check: Art Exhibition Featuring Elderly Woman's Dead Body Was NOT Created After Ann Widdecombe's Death | Lead Stories,https://leadstories.com/hoax-alert/2026/07/fact-check-art-exhibition-featuring-elderly-womans-dead-body-was-not-created-after-ann-widdecombes-death.html,leadstories.com,Fact Check: Art Exhibition Featuring Elderly Woman's Dead Body Was NOT Created After Ann Widdecombe',0.9,HIGH,True,FALSE - Debunked by fact-checkers,leadstories.com,factcheck,2026-07-22T13:58:19.283535
"[DEBUNKED] Fact Check: FAKE Photo Shows Lamine Yamal Draped In The Palestine Flag, Holding World Cup Trophy | Lead Stories",https://leadstories.com/hoax-alert/2026/07/fact-check-fake-photo-shows-lamine-yamal-draped-in-the-palestine-flag-holding-world-cup-trophy.html,leadstories.com,"Fact Check: FAKE Photo Shows Lamine Yamal Draped In The Palestine Flag, Holding World Cup Trophy | L",0.9,HIGH,True,FALSE - Debunked by fact-checkers,leadstories.com,factcheck,2026-07-22T13:58:19.406608
[DEBUNKED] Fact Check: Fireworks Were NOT Blue After FIFA World Cup Final -- Real Footage With Altered Colors | Lead Stories,https://leadstories.com/hoax-alert/2026/07/fact-check-fireworks-were-not-blue-after-fifa-world-cup-final-real-footage-with-altered-colors.html,leadstories.com,Fact Check: Fireworks Were NOT Blue After FIFA World Cup Final -- Real Footage With Altered Colors |,0.9,HIGH,True,FALSE - Debunked by fact-checkers,leadstories.com,factcheck,2026-07-22T13:58:19.532164
[DEBUNKED] Fact Check: Lamine Yamal Did NOT Show V Sign To Avoid Shaking Hands With Trump  | Lead Stories,https://leadstories.com/hoax-alert/2026/07/fact-check-lamine-yamal-did-not-show-v-sign-to-avoid-shaking-hands-with-trump.html,leadstories.com,Fact Check: Lamine Yamal Did NOT Show V Sign To Avoid Shaking Hands With Trump  | Lead Stories,0.9,HIGH,True,FALSE - Debunked by fact-checkers,leadstories.com,factcheck,2026-07-22T13:58:19.680202
[DEBUNKED] Fact Check: Trump Did NOT Say He Would 'Turn The Giant Faucet' Toward Canada On Truth Social | Lead Stories,https://leadstories.com/hoax-alert/2026/07/fact-check-trump-did-not-say-he-would-turn-the-giant-faucet-toward-canada-on-truth-social.html,leadstories.com,Fact Check: Trump Did NOT Say He Would 'Turn The Giant Faucet' Toward Canada On Truth Social | Lead ,0.9,HIGH,True,FALSE - Debunked by fact-checkers,leadstories.com,factcheck,2026-07-22T13:58:19.803147
[DEBUNKED] Fact Check: Trump NOT Edited Out of Spanish Team Photo From World Cup Trophy Presentation | Lead Stories,https://leadstories.com/hoax-alert/2026/07/fact-check-trump-not-edited-out-of-spanish-team-photo-from-world-cup-trophy-presentation.html,leadstories.com,Fact Check: Trump NOT Edited Out of Spanish Team Photo From World Cup Trophy Presentation | Lead Sto,0.9,HIGH,True,FALSE - Debunked by fact-checkers,leadstories.com,factcheck,2026-07-22T13:58:19.927658
[DEBUNKED] Fact Check: Video Of Crying Referee PREDATES 2026 FIFA World Cup Final Match Between Spain And Argentina | Lead Stories,https://leadstories.com/hoax-alert/2026/07/video-of-crying-referee-predates-2026-fifa-world-cup.html,leadstories.com,Fact Check: Video Of Crying Referee PREDATES 2026 FIFA World Cup Final Match Between Spain And Argen,0.9,HIGH,True,FALSE - Debunked by fact-checkers,leadstories.com,factcheck,2026-07-22T13:58:20.053363
[DEBUNKED] Fact Check: NO EVIDENCE Mitch McConnell's Staff Posted Hospital Photo Containing Possible AI Glitches | Lead Stories,https://leadstories.com/hoax-alert/2026/07/fact-check-no-evidence-mitch-mcconnells-staff-posted-hospital-photo-containing-possible-ai-glitches.html,leadstories.com,Fact Check: NO EVIDENCE Mitch McConnell's Staff Posted Hospital Photo Containing Possible AI Glitche,0.9,HIGH,True,FALSE - Debunked by fact-checkers,leadstories.com,factcheck,2026-07-22T13:58:20.194897
[DEBUNKED] Fact Check: FAKE Video Of IED Attack On M1A Abrams Tanks Driving Over Bridge In Southern Lebanon -- AI-Generated | Lead Stories,https://leadstories.com/hoax-alert/2026/07/fact-check-fake-video-of-ied-attack-on-m1a-abrams-tanks-driving-over-bridge-in-south-lebanon.html,leadstories.com,Fact Check: FAKE Video Of IED Attack On M1A Abrams Tanks Driving Over Bridge In Southern Lebanon -- ,0.9,HIGH,True,FALSE - Debunked by fact-checkers,leadstories.com,factcheck,2026-07-22T13:58:20.337261
[DEBUNKED] Fact Check: FAKE Trump Post 'Paul McCartney Is An Anti-Trump Joke' -- Creator Says Not Real | Lead Stories,https://leadstories.com/hoax-alert/2026/07/fact-check-fake-trump-post-paul-mccartney-anti-trump-joke-creator-says-not-real.html,leadstories.com,Fact Check: FAKE Trump Post 'Paul McCartney Is An Anti-Trump Joke' -- Creator Says Not Real | Lead S,0.9,HIGH,True,FALSE - Debunked by fact-checkers,leadstories.com,factcheck,2026-07-22T13:58:20.479760
[DEBUNKED] Fact Check: FAKE Video Falsely Shows A U.S. B-52 Being Shot Down By A Missile -- Computer Generated | Lead Stories,https://leadstories.com/hoax-alert/2026/07/fact-check-fake-video-falsely-shows-a-u.s.-b52-being-shot-down-by-a-missile.html,leadstories.com,Fact Check: FAKE Video Falsely Shows A U.S. B-52 Being Shot Down By A Missile -- Computer Generated ,0.9,HIGH,True,FALSE - Debunked by fact-checkers,leadstories.com,factcheck,2026-07-22T13:58:20.611195
[DEBUNKED] Fact Check: FAKE Video Of Iranian Attack On Base In Jordan Used By U.S. Forces -- Digitally Created | Lead Stories,https://leadstories.com/hoax-alert/2026/07/fact-check-fake-video-of-iranian-attack-on-base-in-jordan-used-by-us-forces-digitally-created.html,leadstories.com,Fact Check: FAKE Video Of Iranian Attack On Base In Jordan Used By U.S. Forces -- Digitally Created ,0.9,HIGH,True,FALSE - Debunked by fact-checkers,leadstories.com,factcheck,2026-07-22T13:58:20.725937
"[DEBUNKED] Prebunk: AI Insect, Animal Fight Videos Have Bugs In Them -- Stop Fakes From Crawling Through | Lead Stories",https://leadstories.com/hoax-alert/2026/07/prebunk-ai-insect-animal-fight-videos-have-bugs-in-them-stop-fakes-from-crawling-through.html,leadstories.com,"Prebunk: AI Insect, Animal Fight Videos Have Bugs In Them -- Stop Fakes From Crawling Through | Lead",0.9,HIGH,True,FALSE - Debunked by fact-checkers,leadstories.com,factcheck,2026-07-22T13:58:20.878241
[DEBUNKED] Fact Check: FAKE Photo Shows Elliot Page On Men's Health Cover For August 2026 | Lead Stories,https://leadstories.com/hoax-alert/2026/07/fact-check-fake-photo-shows-elliot-page-onl-mens-health-cover-for-august-2026.html,leadstories.com,Fact Check: FAKE Photo Shows Elliot Page On Men's Health Cover For August 2026 | Lead Stories,0.9,HIGH,True,FALSE - Debunked by fact-checkers,leadstories.com,factcheck,2026-07-22T13:58:21.034121
"«Nachrichtendienste warnten ständig, dass es keine Abhängigkeit durch Geschäfte mit Russland mehr geben dürfe, sagte Haßelmann",https://www.spiegel.de/wirtschaft/lingen-rosatom-fabrik-im-emsland-darf-brennelemente-mit-russland-beteiligung-herstellen-a-887c9cba-b4a7-4062-8377-a89022facc98#ref=rss,www.spiegel.de,Lingen – Rosatom: Fabrik im Emsland darf Brennelemente mit Russland-Beteiligung herstellen - DER SPI,0.1,LOW,False,,,mainstream,2026-07-22T13:58:29.791886
"»Wir alle kennen die Risiken von Spionage, Sabotage und Desinformation durch Russland und durch seinen Angriffskrieg auf die Ukraine, der eine massive Gefahr für ganz Europa darstellt",https://www.spiegel.de/wirtschaft/lingen-rosatom-fabrik-im-emsland-darf-brennelemente-mit-russland-beteiligung-herstellen-a-887c9cba-b4a7-4062-8377-a89022facc98#ref=rss,www.spiegel.de,Lingen – Rosatom: Fabrik im Emsland darf Brennelemente mit Russland-Beteiligung herstellen - DER SPI,0.1,LOW,False,,,mainstream,2026-07-22T13:58:29.869052
"length - 1, 500, false)"" data-area=""nav-bar"" data-app-hidden x-lazyload> Menü Startseite Kultur Musik Igor Levit »Keine Angst« von Danger Dan: Ist es wirklich sinnvoll, alle Nachbarn zu verprügeln, bis sie wieder richtig wählen",https://www.spiegel.de/kultur/musik/keine-angst-von-danger-dan-ist-es-wirklich-sinnvoll-alle-nachbarn-zu-verpruegeln-bis-sie-wieder-richtig-waehlen-a-41da1432-1320-43ca-92f9-a0061aee688d#ref=rss,www.spiegel.de,"»Keine Angst« von Danger Dan: Ist es wirklich sinnvoll, alle Nachbarn zu verprügeln, bis sie wieder ",0.1,LOW,False,,,mainstream,2026-07-22T13:58:30.434514
"Andere Nutzungen verletzen das Urheberrecht Berlin-Auftritt von Danger Dan Ist es wirklich sinnvoll, alle Nachbarn zu verprügeln, bis sie wieder richtig wählen",https://www.spiegel.de/kultur/musik/keine-angst-von-danger-dan-ist-es-wirklich-sinnvoll-alle-nachbarn-zu-verpruegeln-bis-sie-wieder-richtig-waehlen-a-41da1432-1320-43ca-92f9-a0061aee688d#ref=rss,www.spiegel.de,"»Keine Angst« von Danger Dan: Ist es wirklich sinnvoll, alle Nachbarn zu verprügeln, bis sie wieder ",0.1,LOW,False,,,mainstream,2026-07-22T13:58:30.511273
"Das ZDF ließ sie nicht, nun haben Danger Dan und Igor Levit den Antifa-Song »Keine Angst« in einem Berliner Theater aufgeführt",https://www.spiegel.de/kultur/musik/keine-angst-von-danger-dan-ist-es-wirklich-sinnvoll-alle-nachbarn-zu-verpruegeln-bis-sie-wieder-richtig-waehlen-a-41da1432-1320-43ca-92f9-a0061aee688d#ref=rss,www.spiegel.de,"»Keine Angst« von Danger Dan: Ist es wirklich sinnvoll, alle Nachbarn zu verprügeln, bis sie wieder ",0.1,LOW,False,,,mainstream,2026-07-22T13:58:30.589169
Zu seiner genaueren Herkunft machten die Behörden keine näheren Angaben,https://www.spiegel.de/panorama/sizilien-deutscher-urlauber-stuerzt-in-den-tod-a-38266900-fc59-4fd5-83d7-2b5d0eb0e1f2#ref=rss,www.spiegel.de,Sizilien: Deutscher Urlauber stürzt in den Tod - DER SPIEGEL,0.1,LOW,False,,,mainstream,2026-07-22T13:58:31.115003
"Dort, am Strand der Grafschaft Sligo, entdeckten die Experten dann allerdings eine Spezies, die nie zuvor in Irland angespült wurde: einen toten Grönlandhai",https://www.spiegel.de/wissenschaft/natur/irland-150-jahre-alter-groenland-hai-angespuelt-was-die-obduktion-ueber-sein-leben-verraet-a-7294d10f-12b6-4882-94c9-d2180505a243#ref=rss,www.spiegel.de,Irland: 150 Jahre alter Grönland-Hai angespült – was die Obduktion über sein Leben verrät - DER SPIE,0.1,LOW,False,,,mainstream,2026-07-22T13:58:31.735963
"length - 1, 500, false)"" data-area=""nav-bar"" data-app-hidden x-lazyload> Menü Startseite Wissenschaft Mensch Altern Lebenserwartung: Die Menschen werden immer älter – aber auch länger krank $swiper",https://www.spiegel.de/wissenschaft/mensch/lebenserwartung-die-menschen-werden-immer-aelter-aber-auch-laenger-krank-a-b0cc1e54-0a76-4516-9e92-73babd896aa4#ref=rss,www.spiegel.de,Lebenserwartung: Die Menschen werden immer älter – aber auch länger krank - DER SPIEGEL,0.1,LOW,False,,,mainstream,2026-07-22T13:58:32.356704
Andere Nutzungen verletzen das Urheberrecht Lebenserwartung und Lebensqualität Die Menschen werden immer älter – aber auch länger krank Die gute Nachricht: Die Lebenserwartung steigt,https://www.spiegel.de/wissenschaft/mensch/lebenserwartung-die-menschen-werden-immer-aelter-aber-auch-laenger-krank-a-b0cc1e54-0a76-4516-9e92-73babd896aa4#ref=rss,www.spiegel.de,Lebenserwartung: Die Menschen werden immer älter – aber auch länger krank - DER SPIEGEL,0.1,LOW,False,,,mainstream,2026-07-22T13:58:32.434189
"Zum Login SPIEGEL plus Nur für Neukunden € 1,– für 4 Wochen danach € 5,99 pro Woche Freier Zugriff auf alle S+-Artikel auf SPIEGEL",https://www.spiegel.de/sport/die-finals-in-hannover-2026-sportarten-tv-zeiten-stars-a-4de8b0b3-3d30-4f4e-8eab-a5a63421f4d5#ref=rss,www.spiegel.de,"Die Finals in Hannover 2026: Sportarten, TV-Zeiten, Stars - DER SPIEGEL",0.1,LOW,False,,,mainstream,2026-07-22T13:58:33.002781
"E-Paper (PDF), Digital-Archiv und S+-Newsletter Jederzeit kündigen Jetzt abonnieren SPIEGEL plus 52 Wochen 25 % sparen € 4,49 pro Woche für 52 Wochen danach € 5,99 pro Woche Freier Zugriff auf alle S+-Artikel auf SPIEGEL",https://www.spiegel.de/sport/die-finals-in-hannover-2026-sportarten-tv-zeiten-stars-a-4de8b0b3-3d30-4f4e-8eab-a5a63421f4d5#ref=rss,www.spiegel.de,"Die Finals in Hannover 2026: Sportarten, TV-Zeiten, Stars - DER SPIEGEL",0.1,LOW,False,,,mainstream,2026-07-22T13:58:33.083524
"Zum Login SPIEGEL plus Nur für Neukunden € 1,– für 4 Wochen danach € 5,99 pro Woche Freier Zugriff auf alle S+-Artikel auf SPIEGEL",https://www.spiegel.de/familie/sommerferien-ein-abc-fuer-entspannte-ferien-mit-der-familie-a-634eb371-cbe4-43e8-a702-0e1b5d2e58ae#ref=rss,www.spiegel.de,Sommerferien: Ein ABC für entspannte Ferien mit der Familie - DER SPIEGEL,0.1,LOW,False,,,mainstream,2026-07-22T13:58:33.706418
"E-Paper (PDF), Digital-Archiv und S+-Newsletter Jederzeit kündigen Jetzt abonnieren SPIEGEL plus 52 Wochen 25 % sparen € 4,49 pro Woche für 52 Wochen danach € 5,99 pro Woche Freier Zugriff auf alle S+-Artikel auf SPIEGEL",https://www.spiegel.de/familie/sommerferien-ein-abc-fuer-entspannte-ferien-mit-der-familie-a-634eb371-cbe4-43e8-a702-0e1b5d2e58ae#ref=rss,www.spiegel.de,Sommerferien: Ein ABC für entspannte Ferien mit der Familie - DER SPIEGEL,0.1,LOW,False,,,mainstream,2026-07-22T13:58:33.787059
"Zum Login SPIEGEL plus Nur für Neukunden € 1,– für 4 Wochen danach € 5,99 pro Woche Freier Zugriff auf alle S+-Artikel auf SPIEGEL",https://www.spiegel.de/wirtschaft/donald-trump-die-erneute-zoll-wut-des-us-praesidenten-a-494ad84c-2f1e-44e7-aa3e-2b831b6144a8#ref=rss,www.spiegel.de,Donald Trump: Die erneute Zoll-Wut des US-Präsidenten - DER SPIEGEL,0.1,LOW,False,,,mainstream,2026-07-22T13:58:34.381062
"E-Paper (PDF), Digital-Archiv und S+-Newsletter Jederzeit kündigen Jetzt abonnieren SPIEGEL plus 52 Wochen 25 % sparen € 4,49 pro Woche für 52 Wochen danach € 5,99 pro Woche Freier Zugriff auf alle S+-Artikel auf SPIEGEL",https://www.spiegel.de/wirtschaft/donald-trump-die-erneute-zoll-wut-des-us-praesidenten-a-494ad84c-2f1e-44e7-aa3e-2b831b6144a8#ref=rss,www.spiegel.de,Donald Trump: Die erneute Zoll-Wut des US-Präsidenten - DER SPIEGEL,0.1,LOW,False,,,mainstream,2026-07-22T13:58:34.459200
Nur die Preise schmerzten immer,https://www.spiegel.de/netzwelt/gadgets/samsung-galaxy-z-fold8-fold8-ultra-und-flip8-neue-faltbare-smartphones-vorgestellt-a-dc885222-c88a-4bc8-ab3d-414c1caca936#ref=rss,www.spiegel.de,"Samsung Galaxy Z Fold8, Fold8 Ultra und Flip8: Neue faltbare Smartphones vorgestellt - DER SPIEGEL",0.1,LOW,False,,,mainstream,2026-07-22T13:58:35.063338
Für das Fold7 etwa musste man bei der Einführung im Sommer 2025 mindestens 2099 Euro investieren,https://www.spiegel.de/netzwelt/gadgets/samsung-galaxy-z-fold8-fold8-ultra-und-flip8-neue-faltbare-smartphones-vorgestellt-a-dc885222-c88a-4bc8-ab3d-414c1caca936#ref=rss,www.spiegel.de,"Samsung Galaxy Z Fold8, Fold8 Ultra und Flip8: Neue faltbare Smartphones vorgestellt - DER SPIEGEL",0,LOW,False,,,mainstream,2026-07-22T13:58:35.140970
"Zum Login SPIEGEL plus Nur für Neukunden € 1,– für 4 Wochen danach € 5,99 pro Woche Freier Zugriff auf alle S+-Artikel auf SPIEGEL",https://www.spiegel.de/kultur/kino/toy-story-5-ist-das-der-letzte-animationsfilm-der-noch-ohne-ki-auskommt-a-5be5f158-b792-4650-9b3f-912281bb7576#ref=rss,www.spiegel.de,"»Toy Story 5«: Ist das der letzte Animationsfilm, der noch ohne KI auskommt? - DER SPIEGEL",0.1,LOW,False,,,mainstream,2026-07-22T13:58:35.714192
"E-Paper (PDF), Digital-Archiv und S+-Newsletter Jederzeit kündigen Jetzt abonnieren SPIEGEL plus 52 Wochen 25 % sparen € 4,49 pro Woche für 52 Wochen danach € 5,99 pro Woche Freier Zugriff auf alle S+-Artikel auf SPIEGEL",https://www.spiegel.de/kultur/kino/toy-story-5-ist-das-der-letzte-animationsfilm-der-noch-ohne-ki-auskommt-a-5be5f158-b792-4650-9b3f-912281bb7576#ref=rss,www.spiegel.de,"»Toy Story 5«: Ist das der letzte Animationsfilm, der noch ohne KI auskommt? - DER SPIEGEL",0.1,LOW,False,,,mainstream,2026-07-22T13:58:35.796070
"Zum Login SPIEGEL plus Nur für Neukunden € 1,– für 4 Wochen danach € 5,99 pro Woche Freier Zugriff auf alle S+-Artikel auf SPIEGEL",https://www.spiegel.de/politik/thorsten-frei-cdu-warum-der-neue-unionsfraktionschef-nur-zweite-wahl-ist-a-c778c0e9-d007-4896-ac0d-228b3700461d#ref=rss,www.spiegel.de,Thorsten Frei (CDU): Warum der neue Unionsfraktionschef nur zweite Wahl ist - DER SPIEGEL,0.1,LOW,False,,,mainstream,2026-07-22T13:58:36.366025
"E-Paper (PDF), Digital-Archiv und S+-Newsletter Jederzeit kündigen Jetzt abonnieren SPIEGEL plus 52 Wochen 25 % sparen € 4,49 pro Woche für 52 Wochen danach € 5,99 pro Woche Freier Zugriff auf alle S+-Artikel auf SPIEGEL",https://www.spiegel.de/politik/thorsten-frei-cdu-warum-der-neue-unionsfraktionschef-nur-zweite-wahl-ist-a-c778c0e9-d007-4896-ac0d-228b3700461d#ref=rss,www.spiegel.de,Thorsten Frei (CDU): Warum der neue Unionsfraktionschef nur zweite Wahl ist - DER SPIEGEL,0.1,LOW,False,,,mainstream,2026-07-22T13:58:36.451653
Der DFB hat das bisher nicht bestätigt,https://www.spiegel.de/sport/fussball/dfb-sven-bender-soll-assistent-von-juergen-klopp-werden-a-7fab5057-70b0-4171-a59b-7e0bd465c478#ref=rss,www.spiegel.de,DFB: Sven Bender soll Assistent von Jürgen Klopp werden - DER SPIEGEL,0,LOW,False,,,mainstream,2026-07-22T13:58:37.018144
"Das Treffen werde trotz der gespannten Beziehungen zu den USA »auf jeden Fall nützlich« sein, sagte Lawrow nach Angaben staatlicher russischer Medien",https://www.spiegel.de/ausland/marco-rubio-und-sergej-lawrow-aussenminister-der-usa-und-russlands-kuendigen-gespraeche-an-a-71bde7e4-0f40-4244-ae6e-62f673eb988c#ref=rss,www.spiegel.de,Marco Rubio und Sergej Lawrow: Außenminister der USA und Russlands kündigen Gespräche an - DER SPIEG,0,LOW,False,,,mainstream,2026-07-22T13:58:37.558311
"Rubio sagte vor Journalisten, er habe Lawrow bereits am Dienstag kurz gesprochen und bestätigte das Treffen für Donnerstag",https://www.spiegel.de/ausland/marco-rubio-und-sergej-lawrow-aussenminister-der-usa-und-russlands-kuendigen-gespraeche-an-a-71bde7e4-0f40-4244-ae6e-62f673eb988c#ref=rss,www.spiegel.de,Marco Rubio und Sergej Lawrow: Außenminister der USA und Russlands kündigen Gespräche an - DER SPIEG,0,LOW,False,,,mainstream,2026-07-22T13:58:37.656419
"6% in the year to June, down from 2",https://www.bbc.co.uk/news/articles/ckg4xj8j5vjo?at_medium=RSS&amp;at_campaign=rss,www.bbc.co.uk,Some food prices have fallen â but inflation expected to rise from here - BBC News,0,LOW,False,,,mainstream,2026-07-22T13:58:38.445475
"8% in the year to May, according to the Office for National Statistics (ONS), driven largely by lower fuel and food prices",https://www.bbc.co.uk/news/articles/ckg4xj8j5vjo?at_medium=RSS&amp;at_campaign=rss,www.bbc.co.uk,Some food prices have fallen â but inflation expected to rise from here - BBC News,0,LOW,False,,,mainstream,2026-07-22T13:58:38.529522
"2% month-to-month, with sugar, chocolate and confectionery seeing the largest drop in price",https://www.bbc.co.uk/news/articles/ckg4xj8j5vjo?at_medium=RSS&amp;at_campaign=rss,www.bbc.co.uk,Some food prices have fallen â but inflation expected to rise from here - BBC News,0,LOW,False,,,mainstream,2026-07-22T13:58:38.606676
5% opposed wearing shorts to work in the summer while 46,https://www.bbc.co.uk/news/articles/cvgwp513jpvo?at_medium=RSS&amp;at_campaign=rss,www.bbc.co.uk,"Tokyo urges men to wear shorts to work, but women say it&#x27;s &#x27;leg hair harassment&#x27; - BB",0,LOW,False,,,mainstream,2026-07-22T13:58:39.004684
5% were in favour of the new recommendation,https://www.bbc.co.uk/news/articles/cvgwp513jpvo?at_medium=RSS&amp;at_campaign=rss,www.bbc.co.uk,"Tokyo urges men to wear shorts to work, but women say it&#x27;s &#x27;leg hair harassment&#x27; - BB",0,LOW,False,,,mainstream,2026-07-22T13:58:39.082511
