claim,source_url,source_domain,article_title,risk_score,risk_category,has_factcheck,factcheck_rating,factcheck_source,source_type,checked_at
"Zum Login SPIEGEL plus Nur für Neukunden € 1,– für 4 Wochen danach € 5,99 pro Woche Freier Zugriff auf alle S+-Artikel auf SPIEGEL",https://www.spiegel.de/politik/deutschland/fdp-und-die-brandmauer-zur-afd-was-hinter-dem-neuen-kurs-von-wolfgang-kubicki-steckt-a-8faf3c64-e9e0-45ce-acf1-2af87320ad7f#ref=rss,www.spiegel.de,FDP und die Brandmauer zur AfD: Was hinter dem neuen Kurs von Wolfgang Kubicki steckt - DER SPIEGEL,0.1,LOW,False,,,mainstream,2026-06-01T21:35:45.067048
"E-Paper (PDF), Digital-Archiv und S+-Newsletter Jederzeit kündigen Jetzt abonnieren SPIEGEL plus 52 Wochen 25 % sparen € 4,49 pro Woche für 52 Wochen danach € 5,99 pro Woche Freier Zugriff auf alle S+-Artikel auf SPIEGEL",https://www.spiegel.de/politik/deutschland/fdp-und-die-brandmauer-zur-afd-was-hinter-dem-neuen-kurs-von-wolfgang-kubicki-steckt-a-8faf3c64-e9e0-45ce-acf1-2af87320ad7f#ref=rss,www.spiegel.de,FDP und die Brandmauer zur AfD: Was hinter dem neuen Kurs von Wolfgang Kubicki steckt - DER SPIEGEL,0.1,LOW,False,,,mainstream,2026-06-01T21:35:45.143144
"Zum Login SPIEGEL plus Nur für Neukunden € 1,– für 4 Wochen danach € 5,99 pro Woche Freier Zugriff auf alle S+-Artikel auf SPIEGEL",https://www.spiegel.de/panorama/rauchen-und-nichtraucherschutzgesetz-in-welchen-bundeslaendern-welche-regeln-gelten-a-4a39af99-59ed-49c4-962a-59dd7e5d1b7e#ref=rss,www.spiegel.de,Rauchen und Nichtraucherschutzgesetz: In welchen Bundesländern welche Regeln gelten - DER SPIEGEL,0.1,LOW,False,,,mainstream,2026-06-01T21:35:46.801955
"E-Paper (PDF), Digital-Archiv und S+-Newsletter Jederzeit kündigen Jetzt abonnieren SPIEGEL plus 52 Wochen 25 % sparen € 4,49 pro Woche für 52 Wochen danach € 5,99 pro Woche Freier Zugriff auf alle S+-Artikel auf SPIEGEL",https://www.spiegel.de/panorama/rauchen-und-nichtraucherschutzgesetz-in-welchen-bundeslaendern-welche-regeln-gelten-a-4a39af99-59ed-49c4-962a-59dd7e5d1b7e#ref=rss,www.spiegel.de,Rauchen und Nichtraucherschutzgesetz: In welchen Bundesländern welche Regeln gelten - DER SPIEGEL,0.1,LOW,False,,,mainstream,2026-06-01T21:35:46.880399
Lesen Sie hier mehr zu Platte&nbsp; und Film&nbsp; – sowie den nie enden wollenden »Brat«-Sommer&nbsp;,https://www.spiegel.de/kultur/musik/charli-xcx-martin-scorsese-john-cale-und-marc-jacobs-auf-dem-cover-von-music-fashion-film-a-ededf0dd-39c1-452a-a30c-bbc03b67b74a#ref=rss,www.spiegel.de,"Charli xcx: Martin Scorsese, John Cale und Marc Jacobs auf dem Cover von »'Music, Fashion, Film« - D",0.1,LOW,False,,,mainstream,2026-06-01T21:35:47.548405
"But the rest of the world has still lost around 20% of its usual supply of oil and gas, as well as other vital exports",https://www.bbc.com/news/articles/cedp3lee059o?at_medium=RSS&amp;at_campaign=rss,www.bbc.com,Trump needs this war to end but Iran is not backing down,0,LOW,False,,,mainstream,2026-06-01T21:35:48.134442
"&#x27; He said, &#x27;33%&#x27;",https://www.bbc.com/sport/football/articles/cx21zjnjd2go?at_medium=RSS&amp;at_campaign=rss,www.bbc.com,Kevin Keegan: Former England captain and manager confirms stage four cancer diagnosis - BBC Sport,0,LOW,False,,,mainstream,2026-06-01T21:35:48.464196
