claim,source_url,source_domain,article_title,risk_score,risk_category,has_factcheck,factcheck_rating,factcheck_source,source_type,checked_at
"From his second inauguration to June 23, the day of his Pennsylvania speech, the S&amp;P rose by about 24%",http://www.politifact.com/factchecks/2026/jun/25/donald-trump/401k-second-term-balance-stock-market/,www.politifact.com,PolitiFact | Donald Trump exaggerates 401(k) gains during his second term,0,LOW,False,,,factcheck,2026-06-29T19:59:55.021490
"[DEBUNKED] PolitiFact | At GlobalFact 2026, fact-checkers report challenges, resilience",http://www.politifact.com/article/2026/jun/24/at-globalfact-2026-fact-checkers-report-challenges/,www.politifact.com,"PolitiFact | At GlobalFact 2026, fact-checkers report challenges, resilience",0.9,HIGH,True,FALSE - Debunked by fact-checkers,www.politifact.com,factcheck,2026-06-29T19:59:55.343302
[DEBUNKED] SEA LIFE London Aquarium is not offering ‘young explorer kits’ as survey reward – Full Fact,https://fullfact.org/shopping/sealife-explorer-kit-false/,fullfact.org,SEA LIFE London Aquarium is not offering ‘young explorer kits’ as survey reward – Full Fact,0.9,HIGH,True,FALSE - Debunked by fact-checkers,fullfact.org,factcheck,2026-06-29T19:59:56.499851
[DEBUNKED] Image of Thai police officers ‘undercover wearing drag’ is fake – Full Fact,https://fullfact.org/crime/thai-police-officers-drag-AI/,fullfact.org,Image of Thai police officers ‘undercover wearing drag’ is fake – Full Fact,0.9,HIGH,True,FALSE - Debunked by fact-checkers,fullfact.org,factcheck,2026-06-29T19:59:56.890593
[DEBUNKED] Video of ‘British Muslims’ marching for ‘halal standards’ is an AI fake – Full Fact,https://fullfact.org/culture-and-society/muslims-march-halal-standards-fake-AI/,fullfact.org,Video of ‘British Muslims’ marching for ‘halal standards’ is an AI fake – Full Fact,0.9,HIGH,True,FALSE - Debunked by fact-checkers,fullfact.org,factcheck,2026-06-29T19:59:57.761967
[DEBUNKED] Image of queueing traffic does not show people leaving Crimea over fuel shortages – Full Fact,https://fullfact.org/world/crimea-fuel-shortage-queue-image-armenia-misleading/,fullfact.org,Image of queueing traffic does not show people leaving Crimea over fuel shortages – Full Fact,0.9,HIGH,True,FALSE - Debunked by fact-checkers,fullfact.org,factcheck,2026-06-29T19:59:58.348664
"Who we are Our team Careers Funding Independence Impartiality Feedback &amp; corrections International networks FAQs Contact us Search Home / Economy, Business &amp; Finance What does the new 22% charge mean for stocks and shares ISAs",https://fullfact.org/economy/stocks-and-shares-isa-22-percent/,fullfact.org,What does the new 22% charge mean for stocks and shares ISAs? – Full Fact,0,LOW,False,,,factcheck,2026-06-29T19:59:58.846427
25 June 2026 What was claimed The government is introducing a 22% tax on stocks and shares ISAs,https://fullfact.org/economy/stocks-and-shares-isa-22-percent/,fullfact.org,What does the new 22% charge mean for stocks and shares ISAs? – Full Fact,0,LOW,False,,,factcheck,2026-06-29T19:59:58.937943
"The 22% rate will only apply to interest gained on cash held inside stocks and shares ISAs not the actual cash itself, and it also won’t apply to investment growth in a stocks and shares ISA",https://fullfact.org/economy/stocks-and-shares-isa-22-percent/,fullfact.org,What does the new 22% charge mean for stocks and shares ISAs? – Full Fact,0,LOW,False,,,factcheck,2026-06-29T19:59:59.031149
"[DEBUNKED] No, Amazon is not selling HP laptops for £3 – Full Fact",https://fullfact.org/shopping/amazon-laptop-deals-fake-repeated/,fullfact.org,"No, Amazon is not selling HP laptops for £3 – Full Fact",0.9,HIGH,True,FALSE - Debunked by fact-checkers,fullfact.org,factcheck,2026-06-29T19:59:59.705930
"The UKSA also said it was worried that the Conservatives were giving the impression that “welfare” was mainly about sickness and out-of-work benefits, when “approximately 55% of social security expenditure is spent on pensioners”",https://fullfact.org/economy/statistics-watchdog-challenges-badenoch-over-welfare-claim-after-full-fact-intervention/,fullfact.org,Statistics watchdog challenges Badenoch over welfare claim after Full Fact intervention – Full Fact,0,LOW,False,,,factcheck,2026-06-29T20:00:00.113378
[DEBUNKED] Grimsby housing development homes aren’t ‘exclusively for immigrants’ – Full Fact,https://fullfact.org/immigration/grimsby-immigrants-ferriby-fields-false/,fullfact.org,Grimsby housing development homes aren’t ‘exclusively for immigrants’ – Full Fact,0.9,HIGH,True,FALSE - Debunked by fact-checkers,fullfact.org,factcheck,2026-06-29T20:00:00.722714
[DEBUNKED] How Trump&#039;s Preliminary Deal with Iran Compares with His Rhetoric - FactCheck.org,https://www.factcheck.org/2026/06/how-trumps-preliminary-deal-with-iran-compares-with-his-rhetoric/,www.factcheck.org,How Trump&#039;s Preliminary Deal with Iran Compares with His Rhetoric - FactCheck.org,0.9,HIGH,True,FALSE - Debunked by fact-checkers,www.factcheck.org,factcheck,2026-06-29T20:00:01.832908
"&#8220;We cut the flow of fentanyl across our border by 59%, which is unheard of,&#8221; Trump said in May 22 remarks in New York",https://www.factcheck.org/2026/06/trump-makes-unsupported-claims-about-drug-flows/,www.factcheck.org,Trump Makes Unsupported Claims About Drug Flows - FactCheck.org,0,LOW,False,,,factcheck,2026-06-29T20:00:02.304403
"&#8220;And we cut the flow of fentanyl and drugs into our country by the ocean and the sea, in other words, coming in by water, by ocean and sea by 97%",https://www.factcheck.org/2026/06/trump-makes-unsupported-claims-about-drug-flows/,www.factcheck.org,Trump Makes Unsupported Claims About Drug Flows - FactCheck.org,0,LOW,False,,,factcheck,2026-06-29T20:00:02.397602
"Then, on May 28, in an interview with his daughter-in-law, Lara Trump, on Fox News, he said, &#8220;We have drugs down 97%",https://www.factcheck.org/2026/06/trump-makes-unsupported-claims-about-drug-flows/,www.factcheck.org,Trump Makes Unsupported Claims About Drug Flows - FactCheck.org,0,LOW,False,,,factcheck,2026-06-29T20:00:02.491682
[DEBUNKED] FactChecking Trump&#039;s Contentious &#039;Meet the Press&#039; Interview - FactCheck.org,https://www.factcheck.org/2026/06/factchecking-trumps-contentious-meet-the-press-interview/,www.factcheck.org,FactChecking Trump&#039;s Contentious &#039;Meet the Press&#039; Interview - FactCheck.org,0.9,HIGH,True,FALSE - Debunked by fact-checkers,www.factcheck.org,factcheck,2026-06-29T20:00:03.505872
[DEBUNKED] Fact Check: Video Of 'Laser Beams' Falsely Linked To Venezuela Earthquake Was Published On TikTok Months Before The Quake | Lead Stories,https://leadstories.com/hoax-alert/2026/06/fact-check-laser-beam-video-labeled-instant-before-the-venezuela-earthquake-struck-published-on-tiktok-months-before-quake.html,leadstories.com,Fact Check: Video Of 'Laser Beams' Falsely Linked To Venezuela Earthquake Was Published On TikTok Mo,0.9,HIGH,True,FALSE - Debunked by fact-checkers,leadstories.com,factcheck,2026-06-29T20:00:03.959881
[DEBUNKED] Fact Check: FAKE Photo Shows Pride Rainbow Flags On Field Ahead Of Iran-Egypt World Cup Match -- It Is AI-Generated | Lead Stories,https://leadstories.com/hoax-alert/2026/06/fact-check-fake-photo-shows-pride-rainbow-flags-on-pitch-ahead-of-iran-egypt-world-cup-match.html,leadstories.com,Fact Check: FAKE Photo Shows Pride Rainbow Flags On Field Ahead Of Iran-Egypt World Cup Match -- It ,0.9,HIGH,True,FALSE - Debunked by fact-checkers,leadstories.com,factcheck,2026-06-29T20:00:04.093541
"[DEBUNKED] Fact Check: Posts Claiming Sarah Palin, Michelle Obama, Or Other Celebs Wore 'Probably The Smallest Bikini In The World' Are NOT Real -- AI Slop From Macedonia | Lead Stories",https://leadstories.com/hoax-alert/2026/06/fact-check-post-claiming-palin-obama-wore-smallest-bikini-not-real.html,leadstories.com,"Fact Check: Posts Claiming Sarah Palin, Michelle Obama, Or Other Celebs Wore 'Probably The Smallest ",0.9,HIGH,True,FALSE - Debunked by fact-checkers,leadstories.com,factcheck,2026-06-29T20:00:04.236483
[DEBUNKED] Fact Check: Trump Has NOT Posted An Image Of Reflecting Pool Showing Him Together With Epstein In June 2026 | Lead Stories,https://leadstories.com/hoax-alert/2026/06/fact-check-trump-has-not-posted-image-of-reflecting-pool-showing-him-together-with-epstein-in-june-2026.html,leadstories.com,Fact Check: Trump Has NOT Posted An Image Of Reflecting Pool Showing Him Together With Epstein In Ju,0.9,HIGH,True,FALSE - Debunked by fact-checkers,leadstories.com,factcheck,2026-06-29T20:00:04.375537
[DEBUNKED] Fact Check: FAKE Photo Labeled With Recycled Caption 'Bengali Woman Carrying A British Merchant' And Dated 1903 Was Made With OpenAI Tools | Lead Stories,https://leadstories.com/hoax-alert/2026/06/fact-check-fake-photo-labeled-with-recycled-caption-bengali-woman-carrying-a-british-merchant-and-dated-1903-was-made-with-openai-tools.html,leadstories.com,Fact Check: FAKE Photo Labeled With Recycled Caption 'Bengali Woman Carrying A British Merchant' And,0.9,HIGH,True,FALSE - Debunked by fact-checkers,leadstories.com,factcheck,2026-06-29T20:00:04.536691
[DEBUNKED] Fact Check: Photo Does NOT Show Officer In Montreal Shooting -- Victim Was NOT A Rabbi | Lead Stories,https://leadstories.com/hoax-alert/2026/06/fact-check-photo-does-not-show-officer-in-montreal-shooting-victim-was-not-a-rabbi.html,leadstories.com,Fact Check: Photo Does NOT Show Officer In Montreal Shooting -- Victim Was NOT A Rabbi | Lead Storie,0.9,HIGH,True,FALSE - Debunked by fact-checkers,leadstories.com,factcheck,2026-06-29T20:00:04.693603
[DEBUNKED] Prebunk: Yucky Videos Of Indian Street Food Stalls Taste Like Fakery --  Cooked Up With Artificial Intelligence | Lead Stories,https://leadstories.com/hoax-alert/2026/06/prebunk-ai-videos-of-indian-street-food.html,leadstories.com,Prebunk: Yucky Videos Of Indian Street Food Stalls Taste Like Fakery --  Cooked Up With Artificial I,0.9,HIGH,True,FALSE - Debunked by fact-checkers,leadstories.com,factcheck,2026-06-29T20:00:04.846545
[DEBUNKED] Fact Check: FAKE Video Shows Two Towers Crashing Into Each Other During Venezuela Earthquakes | Lead Stories,https://leadstories.com/hoax-alert/2026/06/fact-check-fake-video-shows-two-towers-crashing-into-each-other-during-venezuela-earthquakes.html,leadstories.com,Fact Check: FAKE Video Shows Two Towers Crashing Into Each Other During Venezuela Earthquakes | Lead,0.9,HIGH,True,FALSE - Debunked by fact-checkers,leadstories.com,factcheck,2026-06-29T20:00:04.989739
[DEBUNKED] Fact Check: AI-Enhanced 'Reflecting Pool Dipper' Images Do NOT Reliably Identify Suspect | Lead Stories,https://leadstories.com/hoax-alert/2026/06/fact-check-ai-images-of-reflecting-pool-dipper-are-not-real.html,leadstories.com,Fact Check: AI-Enhanced 'Reflecting Pool Dipper' Images Do NOT Reliably Identify Suspect | Lead Stor,0.9,HIGH,True,FALSE - Debunked by fact-checkers,leadstories.com,factcheck,2026-06-29T20:00:05.141675
[DEBUNKED] Fact Check: FAKE Image Shows Alyssa Thomas Smiling As She Fouls Caitlin Clark In WNBA Game | Lead Stories,https://leadstories.com/hoax-alert/2026/06/fact-check-fake-image-shows-alyssa-thomas-smiling-as-she-fouls-caitlin-clark-in-wnba-game.html,leadstories.com,Fact Check: FAKE Image Shows Alyssa Thomas Smiling As She Fouls Caitlin Clark In WNBA Game | Lead St,0.9,HIGH,True,FALSE - Debunked by fact-checkers,leadstories.com,factcheck,2026-06-29T20:00:05.315829
[DEBUNKED] Fact Check: Fake Video Shows A Man In A Muslim Mob Spray Painting A Butcher Shop Window In England -- AI-Generated With Many Glitches | Lead Stories,https://leadstories.com/hoax-alert/2026/06/fact-check-fake-video-shows-a-man-in-a-muslim-mob-spray-painting-a-butcher-shop-window-in-England-ai-generated-with-many-glitches.html,leadstories.com,Fact Check: Fake Video Shows A Man In A Muslim Mob Spray Painting A Butcher Shop Window In England -,0.9,HIGH,True,FALSE - Debunked by fact-checkers,leadstories.com,factcheck,2026-06-29T20:00:05.471493
[DEBUNKED] Fact Check: FAKE Quotes Not From Lionel Messi About 100-Year-Old Fan -- Came From 'Fan Account' Not Argentine Soccer Player | Lead Stories,https://leadstories.com/hoax-alert/2026/06/fact-check-fake-quotes-not-from-lionel-messi-about-100-year-old-fan-are-fake-came-from-fan-account-not-argentine-soccer-player.html,leadstories.com,Fact Check: FAKE Quotes Not From Lionel Messi About 100-Year-Old Fan -- Came From 'Fan Account' Not ,0.9,HIGH,True,FALSE - Debunked by fact-checkers,leadstories.com,factcheck,2026-06-29T20:00:05.608641
"[DEBUNKED] Fact Check: WNBA Did NOT Say Caitlin Clark Would Get Technical Foul For Lifting Her Knee Toward Alyssa Thomas -- Day After Game Thomas Gets Foul, 1-Game Suspension | Lead Stories",https://leadstories.com/hoax-alert/2026/06/fact-check-wnba-did-not-say-caitlin-clark-would-get-technical-foul-for-lifting-her-knee-toward-alyssa-thomas-day-after-game-thomas-gets-foul-1-game-suspension.html,leadstories.com,Fact Check: WNBA Did NOT Say Caitlin Clark Would Get Technical Foul For Lifting Her Knee Toward Alys,0.9,HIGH,True,FALSE - Debunked by fact-checkers,leadstories.com,factcheck,2026-06-29T20:00:05.784929
[DEBUNKED] Fact Check: Harry Kane Did NOT Say He Lost Control of His Body During Ghana Match After Witch Doctor's 'Curse' | Lead Stories,https://leadstories.com/hoax-alert/2026/06/fact-check-harry-kane-did-not-say-he-lost-control-of-his-body-during-ghana-match-after-witch-doctors-curse.html,leadstories.com,Fact Check: Harry Kane Did NOT Say He Lost Control of His Body During Ghana Match After Witch Doctor,0.9,HIGH,True,FALSE - Debunked by fact-checkers,leadstories.com,factcheck,2026-06-29T20:00:05.938289
[DEBUNKED] Fact Check: FAKE Photo Does NOT Show Officer From Montreal Shooting -- The Image Is Likely AI-Generated And Victim Was Not A Rabbi  | Lead Stories,https://leadstories.com/hoax-alert/2026/06/fact-check-fake-photo-does-not-show-police-officer-who-reportedly-shot-rabbi-during-montreal-attack-carrying-rifle-wearing-uniform.html,leadstories.com,Fact Check: FAKE Photo Does NOT Show Officer From Montreal Shooting -- The Image Is Likely AI-Genera,0.9,HIGH,True,FALSE - Debunked by fact-checkers,leadstories.com,factcheck,2026-06-29T20:00:06.081970
[DEBUNKED] Explosives and propaganda: Russia’s dual-use drones - EUvsDisinfo,https://euvsdisinfo.eu/explosives-and-propaganda-russias-dual-use-drones/,euvsdisinfo.eu,Explosives and propaganda: Russia’s dual-use drones - EUvsDisinfo,0.9,HIGH,True,FALSE - Debunked by fact-checkers,euvsdisinfo.eu,factcheck,2026-06-29T20:00:07.384078
[DEBUNKED] How Moscow tries to cover up its failures on the Ukrainian battlefield - EUvsDisinfo,https://euvsdisinfo.eu/how-moscow-tries-to-cover-up-its-failures-on-the-ukrainian-battlefield/,euvsdisinfo.eu,How Moscow tries to cover up its failures on the Ukrainian battlefield - EUvsDisinfo,0.9,HIGH,True,FALSE - Debunked by fact-checkers,euvsdisinfo.eu,factcheck,2026-06-29T20:00:08.756014
"[DEBUNKED] Warmongering NATO, peaceful Belarus, and Bulgaria’s “punishment” - EUvsDisinfo",https://euvsdisinfo.eu/warmongering-nato-peaceful-belarus-and-bulgarias-punishment/,euvsdisinfo.eu,"Warmongering NATO, peaceful Belarus, and Bulgaria’s “punishment” - EUvsDisinfo",0.9,HIGH,True,FALSE - Debunked by fact-checkers,euvsdisinfo.eu,factcheck,2026-06-29T20:00:11.344106
"[DEBUNKED] Religion, drones, and “piracy”: latest trends in Russian FIMI - EUvsDisinfo",https://euvsdisinfo.eu/religion-drones-and-piracy-latest-trends-in-russian-fimi/,euvsdisinfo.eu,"Religion, drones, and “piracy”: latest trends in Russian FIMI - EUvsDisinfo",0.9,HIGH,True,FALSE - Debunked by fact-checkers,euvsdisinfo.eu,factcheck,2026-06-29T20:00:14.023855
"[DEBUNKED] Victim-blaming Kyiv, pressuring Moldova, and drone disinformation - EUvsDisinfo",https://euvsdisinfo.eu/victim-blaming-kyiv-pressuring-moldova-and-drone-disinformation/,euvsdisinfo.eu,"Victim-blaming Kyiv, pressuring Moldova, and drone disinformation - EUvsDisinfo",0.9,HIGH,True,FALSE - Debunked by fact-checkers,euvsdisinfo.eu,factcheck,2026-06-29T20:00:15.469516
"[DEBUNKED] Tough love: Spies, dating apps and the dark side of online intimacy - EUvsDisinfo",https://euvsdisinfo.eu/tough-love-spies-dating-apps-and-the-dark-side-of-online-intimacy/,euvsdisinfo.eu,"Tough love: Spies, dating apps and the dark side of online intimacy - EUvsDisinfo",0.9,HIGH,True,FALSE - Debunked by fact-checkers,euvsdisinfo.eu,factcheck,2026-06-29T20:00:18.299660
"[DEBUNKED] Lies about Russia’s military success, Yermak’s arrest and secret biolabs - EUvsDisinfo",https://euvsdisinfo.eu/lies-about-russias-military-success-yermaks-arrest-and-secret-biolabs/,euvsdisinfo.eu,"Lies about Russia’s military success, Yermak’s arrest and secret biolabs - EUvsDisinfo",0.9,HIGH,True,FALSE - Debunked by fact-checkers,euvsdisinfo.eu,factcheck,2026-06-29T20:00:19.392243
Laut einer Gutachterin ist seine Schuldfähigkeit nicht eingeschränkt – und sie vermutet ein Machtgefühl als möglichen Hintergrund der Taten,https://www.spiegel.de/panorama/justiz/berlin-gutachterin-haelt-angeklagten-palliativarzt-fuer-voll-schuldfaehig-a-0a06dd1d-1672-4623-8fd0-9ec68dcdcd0c#ref=rss,www.spiegel.de,Berlin: Gutachterin hält angeklagten Palliativarzt für voll schuldfähig - DER SPIEGEL,0,LOW,False,,,mainstream,2026-06-29T20:00:28.122661
"Eine psychiatrische Sachverständige sagte vor dem Gericht, es lasse sich keine relevante Erkrankung feststellen, die Schuldfähigkeit des Mannes sei nicht eingeschränkt",https://www.spiegel.de/panorama/justiz/berlin-gutachterin-haelt-angeklagten-palliativarzt-fuer-voll-schuldfaehig-a-0a06dd1d-1672-4623-8fd0-9ec68dcdcd0c#ref=rss,www.spiegel.de,Berlin: Gutachterin hält angeklagten Palliativarzt für voll schuldfähig - DER SPIEGEL,0.1,LOW,False,,,mainstream,2026-06-29T20:00:28.212913
"Zum Login SPIEGEL plus Nur für Neukunden € 1,– für 4 Wochen danach € 5,99 pro Woche Freier Zugriff auf alle S+-Artikel auf SPIEGEL",https://www.spiegel.de/ausland/strasse-von-hormus-die-iraner-verteidigen-ihr-bestes-druckmittel-a-9d50f451-10b2-4e68-99f6-a2118a92ede5#ref=rss,www.spiegel.de,Straße von Hormus: Die Iraner verteidigen ihr bestes Druckmittel - DER SPIEGEL,0.1,LOW,False,,,mainstream,2026-06-29T20:00:28.938008
"E-Paper (PDF), Digital-Archiv und S+-Newsletter Jederzeit kündigen Jetzt abonnieren SPIEGEL plus 52 Wochen 25 % sparen € 4,49 pro Woche für 52 Wochen danach € 5,99 pro Woche Freier Zugriff auf alle S+-Artikel auf SPIEGEL",https://www.spiegel.de/ausland/strasse-von-hormus-die-iraner-verteidigen-ihr-bestes-druckmittel-a-9d50f451-10b2-4e68-99f6-a2118a92ede5#ref=rss,www.spiegel.de,Straße von Hormus: Die Iraner verteidigen ihr bestes Druckmittel - DER SPIEGEL,0.1,LOW,False,,,mainstream,2026-06-29T20:00:29.033476
Der Täter habe keine Erlaubnis zum Führen einer Waffe besessen,https://www.spiegel.de/panorama/schuesse-in-stade-polizei-informiert-ueber-tat-a-6c18583e-5c9d-425b-a9de-458916e3f8c5#ref=rss,www.spiegel.de,Schüsse in Stade: Polizei informiert über Tat - DER SPIEGEL,0.1,LOW,False,,,mainstream,2026-06-29T20:00:29.723872
"Zum Login SPIEGEL plus Nur für Neukunden € 1,– für 4 Wochen danach € 5,99 pro Woche Freier Zugriff auf alle S+-Artikel auf SPIEGEL",https://www.spiegel.de/sport/fussball/fussball-wm-2026-alles-wichtige-ueber-das-sechzehntelfinale-der-dfb-elf-gegen-paraguay-a-8566bd67-3193-4062-b1e8-24de2eef1aa9#ref=rss,www.spiegel.de,Fußball-WM 2026: Alles Wichtige über das Sechzehntelfinale der DFB-Elf gegen Paraguay - DER SPIEGEL,0.1,LOW,False,,,mainstream,2026-06-29T20:00:30.966980
"E-Paper (PDF), Digital-Archiv und S+-Newsletter Jederzeit kündigen Jetzt abonnieren SPIEGEL plus 52 Wochen 25 % sparen € 4,49 pro Woche für 52 Wochen danach € 5,99 pro Woche Freier Zugriff auf alle S+-Artikel auf SPIEGEL",https://www.spiegel.de/sport/fussball/fussball-wm-2026-alles-wichtige-ueber-das-sechzehntelfinale-der-dfb-elf-gegen-paraguay-a-8566bd67-3193-4062-b1e8-24de2eef1aa9#ref=rss,www.spiegel.de,Fußball-WM 2026: Alles Wichtige über das Sechzehntelfinale der DFB-Elf gegen Paraguay - DER SPIEGEL,0.1,LOW,False,,,mainstream,2026-06-29T20:00:31.057805
"»Da müssen wir alle zusammen durch«, heißt es aus dem Bundestag",https://www.spiegel.de/politik/deutschland/wm-2026-deutschland-gegen-paraguay-abgeordnete-fiebern-trotz-uhrzeit-mit-a-379ad246-5815-40db-bb4f-90b6c4b004d2#ref=rss,www.spiegel.de,WM 2026 - Deutschland gegen Paraguay: Abgeordnete fiebern trotz Uhrzeit mit - DER SPIEGEL,0.1,LOW,False,,,mainstream,2026-06-29T20:00:31.688564
"Zum Login SPIEGEL plus Nur für Neukunden € 1,– für 4 Wochen danach € 5,99 pro Woche Freier Zugriff auf alle S+-Artikel auf SPIEGEL",https://www.spiegel.de/politik/deutschland/wm-2026-deutschland-gegen-paraguay-abgeordnete-fiebern-trotz-uhrzeit-mit-a-379ad246-5815-40db-bb4f-90b6c4b004d2#ref=rss,www.spiegel.de,WM 2026 - Deutschland gegen Paraguay: Abgeordnete fiebern trotz Uhrzeit mit - DER SPIEGEL,0.1,LOW,False,,,mainstream,2026-06-29T20:00:31.786283
"E-Paper (PDF), Digital-Archiv und S+-Newsletter Jederzeit kündigen Jetzt abonnieren SPIEGEL plus 52 Wochen 25 % sparen € 4,49 pro Woche für 52 Wochen danach € 5,99 pro Woche Freier Zugriff auf alle S+-Artikel auf SPIEGEL",https://www.spiegel.de/politik/deutschland/wm-2026-deutschland-gegen-paraguay-abgeordnete-fiebern-trotz-uhrzeit-mit-a-379ad246-5815-40db-bb4f-90b6c4b004d2#ref=rss,www.spiegel.de,WM 2026 - Deutschland gegen Paraguay: Abgeordnete fiebern trotz Uhrzeit mit - DER SPIEGEL,0.1,LOW,False,,,mainstream,2026-06-29T20:00:31.877408
"Was das konkret bedeutet, welche Motive es für die Tat geben könnte, darüber gibt die Polizei bislang keine Auskunft",https://www.spiegel.de/politik/deutschland/news-des-tages-schuesse-in-stade-joe-biden-kritisiert-donald-trump-stellenabbau-bei-vw-a-08055ec1-1128-4cf3-811e-3551e8372e91#ref=rss,www.spiegel.de,"News des Tages: Schüsse in Stade, Joe Biden kritisiert Donald Trump, Stellenabbau bei VW - DER SPIEG",0.1,LOW,False,,,mainstream,2026-06-29T20:00:32.641045
Alle aktuellen Entwicklungen lesen Sie hier: Tote nach Schüssen in Stade – Tat hatte wohl privaten Hintergrund 2,https://www.spiegel.de/politik/deutschland/news-des-tages-schuesse-in-stade-joe-biden-kritisiert-donald-trump-stellenabbau-bei-vw-a-08055ec1-1128-4cf3-811e-3551e8372e91#ref=rss,www.spiegel.de,"News des Tages: Schüsse in Stade, Joe Biden kritisiert Donald Trump, Stellenabbau bei VW - DER SPIEG",0.1,LOW,False,,,mainstream,2026-06-29T20:00:32.735985
"Zum Login SPIEGEL plus Nur für Neukunden € 1,– für 4 Wochen danach € 5,99 pro Woche Freier Zugriff auf alle S+-Artikel auf SPIEGEL",https://www.spiegel.de/politik/deutschland/sahra-wagenknecht-will-rededuelle-mit-alice-weidel-und-schmiedet-regierungsplaene-a-fc38b70b-aa5f-4188-9d1d-149f20806792#ref=rss,www.spiegel.de,Sahra Wagenknecht will Rededuelle mit Alice Weidel – und schmiedet Regierungspläne - DER SPIEGEL,0.1,LOW,False,,,mainstream,2026-06-29T20:00:34.066063
"E-Paper (PDF), Digital-Archiv und S+-Newsletter Jederzeit kündigen Jetzt abonnieren SPIEGEL plus 52 Wochen 25 % sparen € 4,49 pro Woche für 52 Wochen danach € 5,99 pro Woche Freier Zugriff auf alle S+-Artikel auf SPIEGEL",https://www.spiegel.de/politik/deutschland/sahra-wagenknecht-will-rededuelle-mit-alice-weidel-und-schmiedet-regierungsplaene-a-fc38b70b-aa5f-4188-9d1d-149f20806792#ref=rss,www.spiegel.de,Sahra Wagenknecht will Rededuelle mit Alice Weidel – und schmiedet Regierungspläne - DER SPIEGEL,0.1,LOW,False,,,mainstream,2026-06-29T20:00:34.128907
Das DFB-Team trifft im WM-Sechzehntelfinale auf Paraguay – noch nie im Turnier war die Aufstellung so umstritten wie jetzt,https://www.spiegel.de/sport/fussball/fussball-wm-2026-wie-soll-die-deutsche-mannschaft-gegen-paraguay-starten-a-c4ac9201-7160-4330-8c55-381129144442#ref=rss,www.spiegel.de,Fußball-WM 2026: Wie soll die deutsche Mannschaft gegen Paraguay starten? - DER SPIEGEL,0.1,LOW,False,,,mainstream,2026-06-29T20:00:34.837380
"Zum Login SPIEGEL plus Nur für Neukunden € 1,– für 4 Wochen danach € 5,99 pro Woche Freier Zugriff auf alle S+-Artikel auf SPIEGEL",https://www.spiegel.de/sport/fussball/fussball-wm-2026-wie-soll-die-deutsche-mannschaft-gegen-paraguay-starten-a-c4ac9201-7160-4330-8c55-381129144442#ref=rss,www.spiegel.de,Fußball-WM 2026: Wie soll die deutsche Mannschaft gegen Paraguay starten? - DER SPIEGEL,0.1,LOW,False,,,mainstream,2026-06-29T20:00:34.938012
"E-Paper (PDF), Digital-Archiv und S+-Newsletter Jederzeit kündigen Jetzt abonnieren SPIEGEL plus 52 Wochen 25 % sparen € 4,49 pro Woche für 52 Wochen danach € 5,99 pro Woche Freier Zugriff auf alle S+-Artikel auf SPIEGEL",https://www.spiegel.de/sport/fussball/fussball-wm-2026-wie-soll-die-deutsche-mannschaft-gegen-paraguay-starten-a-c4ac9201-7160-4330-8c55-381129144442#ref=rss,www.spiegel.de,Fußball-WM 2026: Wie soll die deutsche Mannschaft gegen Paraguay starten? - DER SPIEGEL,0.1,LOW,False,,,mainstream,2026-06-29T20:00:35.027260
"»Wir wollen keine Spielverderber sein«, sagte ein Polizeisprecher",https://www.spiegel.de/panorama/gesellschaft/autokorso-nicht-auf-dem-dach-sitzen-nicht-unnoetig-hupen-welche-regeln-gelten-a-ccc4d937-6d5f-45fa-b1ef-dace1c4671f9#ref=rss,www.spiegel.de,"Autokorso: Nicht auf dem Dach sitzen, nicht unnötig hupen – welche Regeln gelten - DER SPIEGEL",0.1,LOW,False,,,mainstream,2026-06-29T20:00:36.795557
