claim,source_url,source_domain,article_title,risk_score,risk_category,has_factcheck,factcheck_rating,factcheck_source,source_type,checked_at
Dort soll es keine algorithmischen Feeds oder personalisierte Empfehlungen geben,https://correctiv.org/aktuelles/netzpolitik/2026/02/18/was-bringt-ein-social-media-verbot-fuer-kinder-und-jugendliche/,correctiv.org,Was bringt ein Social-Media-Verbot für Kinder und Jugendliche? - correctiv.org,0.1,LOW,False,,,factcheck,2026-02-20T13:04:05.238347
"Alle Anbieter, darunter die beliebtesten Netzwerke in Deutschland – Instagram, Tiktok, Facebook, Snapchat und Pinterest – sollen nach den SPD-Plänen stärker in die Pflicht genommen werden",https://correctiv.org/aktuelles/netzpolitik/2026/02/18/was-bringt-ein-social-media-verbot-fuer-kinder-und-jugendliche/,correctiv.org,Was bringt ein Social-Media-Verbot für Kinder und Jugendliche? - correctiv.org,0.1,LOW,False,,,factcheck,2026-02-20T13:04:05.442532
(Foto: picture alliance/dpa | Kay Nietfeld) Das Verteidigungsministerium will neue Kampfdrohnen beschaffen und dafür Aufträge in Höhe von zunächst rund 540 Millionen Euro an zwei Start-ups erteilen,https://correctiv.org/aktuelles/sicherheit-und-verteidigung/2026/02/18/showdown-im-bundestag-kommen-pistorius-kampfdrohnen/,correctiv.org,Showdown im Bundestag: Kommen Pistorius’ Kampfdrohnen? - correctiv.org,0.1,LOW,False,,,factcheck,2026-02-20T13:04:06.635817
"Die Beschaffung könnte in den kommenden Jahren auf insgesamt rund 4,3 Milliarden Euro anwachsen und sich so in die teuersten Vorhaben der Bundeswehr einreihen",https://correctiv.org/aktuelles/sicherheit-und-verteidigung/2026/02/18/showdown-im-bundestag-kommen-pistorius-kampfdrohnen/,correctiv.org,Showdown im Bundestag: Kommen Pistorius’ Kampfdrohnen? - correctiv.org,0,LOW,False,,,factcheck,2026-02-20T13:04:06.832636
Laut den Beschlussvorlagen sollen sie an die jungen Unternehmen Stark und Helsing gehen,https://correctiv.org/aktuelles/sicherheit-und-verteidigung/2026/02/18/showdown-im-bundestag-kommen-pistorius-kampfdrohnen/,correctiv.org,Showdown im Bundestag: Kommen Pistorius’ Kampfdrohnen? - correctiv.org,0,LOW,False,,,factcheck,2026-02-20T13:04:07.029448
[DEBUNKED] Warum Schnee auf der Akropolis kein Beleg gegen den Klimawandel ist,https://correctiv.org/faktencheck/2026/02/18/video-von-schnee-akropolis-athen-griechenland-ist-alt-und-kein-beweis-gegen-klimawandel/,correctiv.org,Warum Schnee auf der Akropolis kein Beleg gegen den Klimawandel ist,0.9,HIGH,True,FALSE - Debunked by fact-checkers,correctiv.org,factcheck,2026-02-20T13:04:08.160801
[DEBUNKED] Keine Behandlung wegen Trump-Kappe? Arzt-Video ist ein Sketch - correctiv.org,https://correctiv.org/faktencheck/aus-der-community/2026/02/17/keine-behandlung-wegen-trump-kappe-arzt-video-ist-ein-sketch/,correctiv.org,Keine Behandlung wegen Trump-Kappe? Arzt-Video ist ein Sketch - correctiv.org,0.9,HIGH,True,FALSE - Debunked by fact-checkers,correctiv.org,factcheck,2026-02-20T13:04:09.133639
[DEBUNKED] Kein Epstein-Leak: Foto mit Friedrich Merz ist gefälscht,https://correctiv.org/faktencheck/2026/02/17/bild-von-friedrich-merz-und-jeffrey-epstein-ist-gefaelscht/,correctiv.org,Kein Epstein-Leak: Foto mit Friedrich Merz ist gefälscht,0.9,HIGH,True,FALSE - Debunked by fact-checkers,correctiv.org,factcheck,2026-02-20T13:04:10.084831
[DEBUNKED] Wie die Politik Leistungsberechtigte zum Problem erklärt,https://correctiv.org/faktencheck/hintergrund/2025/09/30/wie-die-politik-leistungsberechtigte-zum-problem-erklaert/,correctiv.org,Wie die Politik Leistungsberechtigte zum Problem erklärt,0.9,HIGH,True,FALSE - Debunked by fact-checkers,correctiv.org,factcheck,2026-02-20T13:04:11.227004
[DEBUNKED] Kernkraftwerke der vierten Generation machen Endlager nicht überflüssig,https://correctiv.org/faktencheck/2026/02/17/kernkraftwerke-der-vierten-generation-machen-endlager-nicht-ueberfluessig/,correctiv.org,Kernkraftwerke der vierten Generation machen Endlager nicht überflüssig,0.9,HIGH,True,FALSE - Debunked by fact-checkers,correctiv.org,factcheck,2026-02-20T13:04:12.315400
"Fast vier Jahre später erreicht der deutsche Ableger von Russia Today, RT DE, über Spiegelseiten noch immer Millionen Aufrufe",https://correctiv.org/faktencheck/hintergrund/2026/02/16/eu-sanktionen-inhalte-von-rt-de-erreichen-immer-noch-millionen-aufrufe/,correctiv.org,EU-Sanktionen: Inhalte von RT DE erreichen weiterhin Millionen,0.1,LOW,False,,,factcheck,2026-02-20T13:04:13.504332
"Einige sehen die Presse&#8211; und Meinungsfreiheit bedroht, andere kritisieren allgemein, dass technische Lösungen wie Sanktionen keine Probleme wie Propaganda oder Desinformationskampagnen lösen könnten",https://correctiv.org/faktencheck/hintergrund/2026/02/16/eu-sanktionen-inhalte-von-rt-de-erreichen-immer-noch-millionen-aufrufe/,correctiv.org,EU-Sanktionen: Inhalte von RT DE erreichen weiterhin Millionen,0.1,LOW,False,,,factcheck,2026-02-20T13:04:13.702336
Nach einer Polizeirazzia in einem Zürcher Rückkehrzentrum erhält ein Mann einen Strafbefehl wegen rechtswidrigen Aufenthalts – obwohl er das Land laut Dublin-Verordnung gar nicht verlassen darf,https://correctiv.org/zwischen-gefaengnis-und-nothilfe/2026/02/16/geh-aber-bleib/,correctiv.org,Weder ausreisen noch bleiben ist erlaubt - correctiv.org,0,LOW,False,,,factcheck,2026-02-20T13:04:14.882651
Im Fall von Italien tritt dieses Szenario derzeit immer ein,https://correctiv.org/zwischen-gefaengnis-und-nothilfe/2026/02/16/geh-aber-bleib/,correctiv.org,Weder ausreisen noch bleiben ist erlaubt - correctiv.org,0.1,LOW,False,,,factcheck,2026-02-20T13:04:15.080785
"Die Regierung von Giorgia Meloni hat 2022 beschlossen, „wegen der grossen Zahl an Anlandungen“ keine sogenannten Dublinfälle – also asylsuchende Personen, für die das Land gemäss Dublinabkommen zuständig wäre – mehr zurückzunehmen",https://correctiv.org/zwischen-gefaengnis-und-nothilfe/2026/02/16/geh-aber-bleib/,correctiv.org,Weder ausreisen noch bleiben ist erlaubt - correctiv.org,0.1,LOW,False,,,factcheck,2026-02-20T13:04:15.279125
"Er wurde als Geheimdienstmitarbeiter enttarnt und dann ganz offiziell zum Sicherheitsrisiko erklärt: Im Dezember 2024 belegte ihn die EU mit Sanktionen, weil er seine „destabilisierenden Aktivitäten“ im Auftrag der russischen Regierung ausübte",https://correctiv.org/aktuelles/russland-ukraine-2/2026/02/16/ein-russischer-agent-in-deutschland-und-der-glycerin-handel-russland-gru-sanktionen/,correctiv.org,Ein russischer Agent in Deutschland und der Glycerin-Handel,0.05,LOW,False,,,factcheck,2026-02-20T13:04:16.450830
"Auch das Land Bayern soll laut dem Dokument eine Summe eingezahlt haben, ebenso die Robert-Bosch-Stiftung und der Energieriese EnBW",https://correctiv.org/aktuelles/sicherheit-und-verteidigung/2026/02/13/millionen-aus-katar-wer-finanziert-die-muenchner-sicherheitskonferenz-msc-munich-security-conference/,correctiv.org,Millionen aus Katar: Wer finanziert die Sicherheitskonferenz? - correctiv.org,0,LOW,False,,,factcheck,2026-02-20T13:04:17.631787
Februar 2026 Hier sehen Sie noch einmal alle Cartoons dieser Woche,https://correctiv.org/aktuelles/politik-2/2026/02/13/cartoon-arena-sind-die-deutschen-zu-faul/,correctiv.org,Cartoon-Arena: Sind die Deutschen zu faul? - correctiv.org,0.1,LOW,False,,,factcheck,2026-02-20T13:04:18.637288
90 12051 Berlin Fax: +49 (0) 30 – 555 780 2 20 Büro Berlin Singerstraße 109 10179 Berlin Buchladen Essen Akazienallee 10 45127 Essen Online-Shop Jugendredaktion Salon5 Alle Standorte CORRECTIV,https://correctiv.org/aktuelles/politik-2/2026/02/13/cartoon-arena-sind-die-deutschen-zu-faul/,correctiv.org,Cartoon-Arena: Sind die Deutschen zu faul? - correctiv.org,0.1,LOW,False,,,factcheck,2026-02-20T13:04:18.838474
[DEBUNKED] Rote-Bete-Kapseln: Tiktok ignoriert Deepfake-Werbung mit Ärzten,https://correctiv.org/faktencheck/hintergrund/2026/02/13/rote-bete-kapseln-tiktok-ignoriert-deepfake-werbung-mit-aerzten/,correctiv.org,Rote-Bete-Kapseln: Tiktok ignoriert Deepfake-Werbung mit Ärzten,0.9,HIGH,True,FALSE - Debunked by fact-checkers,correctiv.org,factcheck,2026-02-20T13:04:20.920595
"[DEBUNKED] Nigeria-Öfen-Lüge: WELT will nicht, dass du diese Richtigstellung siehst! - Volksverpetzer",https://www.volksverpetzer.de/faktencheck/nigeria-oefen-luege-welt/,www.volksverpetzer.de,"Nigeria-Öfen-Lüge: WELT will nicht, dass du diese Richtigstellung siehst! - Volksverpetzer",0.9,HIGH,True,FALSE - Debunked by fact-checkers,www.volksverpetzer.de,factcheck,2026-02-20T13:04:24.726952
"Vier Bundesländer sind schon offiziell an Bord, bei vier weiteren steht theoretisch nichts mehr im Weg und mindestens zwei weitere wackeln bereits",https://www.volksverpetzer.de/analyse/afd-verbot-mehrheit-bundesrat/,www.volksverpetzer.de,AfD-Verbot: Für ein Szenario gibt es jetzt bereits eine Bundesrat-Mehrheit - Volksverpetzer,0,LOW,False,,,factcheck,2026-02-20T13:04:29.104454
[DEBUNKED] &quot;Nachdenkseiten&quot; enthüllt vor Gericht die wahren Geldgeber hinter Volksverpetzer! - Volksverpetzer,https://www.volksverpetzer.de/aktuelles/nachdenkseiten-gericht-geldgeber-volksverpetzer/,www.volksverpetzer.de,&quot;Nachdenkseiten&quot; enthüllt vor Gericht die wahren Geldgeber hinter Volksverpetzer! - Volksv,0.9,HIGH,True,FALSE - Debunked by fact-checkers,www.volksverpetzer.de,factcheck,2026-02-20T13:04:30.616897
"Nach einer aktuellen Studie der ARAG war im Jahr 2025 allerdings nur noch gut die Hälfte der Befragten in Deutschland davon überzeugt, dass Gerichte alle Menschen gleich behandeln",https://www.volksverpetzer.de/aktuelles/neutralitaet-ziel-kein-zustand/,www.volksverpetzer.de,Neutralität als Waffe: Wie man zum Schweigen gebracht wird - Volksverpetzer,0.1,LOW,False,,,factcheck,2026-02-20T13:04:31.947706
"Solche Modelle lassen sich prinzipiell auf jede beliebige Person zur Vorhersage von Informationen anwenden, die diese Person nie irgendwo preisgegeben hat",https://www.volksverpetzer.de/aktuelles/ice-personalisierter-werbung/,www.volksverpetzer.de,ICE &amp; KI: Von personalisierter Werbung zur staatlichen Verfolgung - Volksverpetzer,0.1,LOW,False,,,factcheck,2026-02-20T13:04:33.646562
"hereingefallen waren, ist der Absatz von Gasheizungen um über 65 % eingebrochen",https://www.volksverpetzer.de/faktencheck/mythos-gasmangellage/,www.volksverpetzer.de,Sogar Rechte machen jetzt Stimmung gegen Gasheizungen: Mythos &quot;Gasmangellage&quot; - Volksverpe,0.1,LOW,False,,,factcheck,2026-02-20T13:04:35.039584
"Im Neubau ist der Trend noch deutlicher, hier dominiert die Wärmepumpe bei 74 % der Heizungen",https://www.volksverpetzer.de/faktencheck/mythos-gasmangellage/,www.volksverpetzer.de,Sogar Rechte machen jetzt Stimmung gegen Gasheizungen: Mythos &quot;Gasmangellage&quot; - Volksverpe,0.1,LOW,False,,,factcheck,2026-02-20T13:04:35.235871
"470 Studie zeigt, warum BILD TV so peinlich gefloppt ist von Marie-Lena Nelle | Feb",https://www.volksverpetzer.de/aktuelles/studie-bild-tv-gefloppt/,www.volksverpetzer.de,"Studie zeigt, warum BILD TV so peinlich gefloppt ist - Volksverpetzer",0,LOW,False,,,factcheck,2026-02-20T13:04:36.516665
"Dazu der Druck, auch im Urlaub erreichbar zu sein, sowie das Gefühl, dass die Verantwortung immer bei denen landet, die gerade fehlen, selbst wenn sie krank sind",https://www.volksverpetzer.de/aktuelles/studie-bild-tv-gefloppt/,www.volksverpetzer.de,"Studie zeigt, warum BILD TV so peinlich gefloppt ist - Volksverpetzer",0.1,LOW,False,,,factcheck,2026-02-20T13:04:36.715865
"[DEBUNKED] Did Canada's Carney walk out on Trump, as George Will allegedly reported? Not so fast | Snopes.com",https://www.snopes.com/fact-check/video-carney-walk-out-on-trump/,www.snopes.com,"Did Canada's Carney walk out on Trump, as George Will allegedly reported? Not so fast | Snopes.com",0.9,HIGH,True,FALSE - Debunked by fact-checkers,www.snopes.com,factcheck,2026-02-20T13:04:36.784264
[DEBUNKED] Did Jesse Jackson's family bar Obama from funeral? Here's the truth | Snopes.com,https://www.snopes.com/fact-check/jesse-jackson-obama-funeral/,www.snopes.com,Did Jesse Jackson's family bar Obama from funeral? Here's the truth | Snopes.com,0.9,HIGH,True,FALSE - Debunked by fact-checkers,www.snopes.com,factcheck,2026-02-20T13:04:36.914306
[DEBUNKED] Epstein files' references to 'jerky' fuel cannibalism claims. The records tell a different story | Snopes.com,https://www.snopes.com/fact-check/epstein-jerky/,www.snopes.com,Epstein files' references to 'jerky' fuel cannibalism claims. The records tell a different story | S,0.9,HIGH,True,FALSE - Debunked by fact-checkers,www.snopes.com,factcheck,2026-02-20T13:04:37.259351
[DEBUNKED] Unpacking claim Seahawks QB Sam Darnold owed more in California taxes than his Super Bowl bonus | Snopes.com,https://www.snopes.com/news/2026/02/19/sam-darnold-taxes-california/,www.snopes.com,Unpacking claim Seahawks QB Sam Darnold owed more in California taxes than his Super Bowl bonus | Sn,0.9,HIGH,True,FALSE - Debunked by fact-checkers,www.snopes.com,factcheck,2026-02-20T13:04:37.391269
[DEBUNKED] Did George Will report Fox News cut away from Trump mid-speech? Watch out | Snopes.com,https://www.snopes.com/fact-check/trump-fox-news-george-will/,www.snopes.com,Did George Will report Fox News cut away from Trump mid-speech? Watch out | Snopes.com,0.9,HIGH,True,FALSE - Debunked by fact-checkers,www.snopes.com,factcheck,2026-02-20T13:04:37.465227
"stated on January 7, 2026 in a press briefing: Says “90% of health care spending treats chronic disease",http://www.politifact.com/factchecks/2026/feb/19/robert-f-kennedy-jr/chronic-disease-90-percent-health-spending-rfk/,www.politifact.com,PolitiFact | This chronic illness statistic touted by RFK Jr. and RealFood.gov doesn’t check out,0,LOW,False,,,factcheck,2026-02-20T13:04:37.975569
"With a quick scroll, football watchers who visited the website in the ad would have encountered the statistic that ""90% of U",http://www.politifact.com/factchecks/2026/feb/19/robert-f-kennedy-jr/chronic-disease-90-percent-health-spending-rfk/,www.politifact.com,PolitiFact | This chronic illness statistic touted by RFK Jr. and RealFood.gov doesn’t check out,0,LOW,False,,,factcheck,2026-02-20T13:04:38.173166
"7 announcement: ""The CDC reports that 90% of healthcare spending treats chronic disease",http://www.politifact.com/factchecks/2026/feb/19/robert-f-kennedy-jr/chronic-disease-90-percent-health-spending-rfk/,www.politifact.com,PolitiFact | This chronic illness statistic touted by RFK Jr. and RealFood.gov doesn’t check out,0,LOW,False,,,factcheck,2026-02-20T13:04:38.379704
[DEBUNKED] PolitiFact | Epstein files did not ‘expose’ Ellen DeGeneres as a cannibal; claim stems from AI-generated audio,http://www.politifact.com/factchecks/2026/feb/16/social-media/epstein-files-ellen-degeneres-cannibal/,www.politifact.com,PolitiFact | Epstein files did not ‘expose’ Ellen DeGeneres as a cannibal; claim stems from AI-gener,0.9,HIGH,True,FALSE - Debunked by fact-checkers,www.politifact.com,factcheck,2026-02-20T13:04:38.748062
"More Info I would like to contribute One Time Monthly Yearly Join Now Donald Trump stated on February 8, 2026 in an interview on NBC: Crime in Minneapolis “is down 25, 30% because we’ve removed thousands of criminals from the area",http://www.politifact.com/factchecks/2026/feb/13/donald-trump/Minneapolis-Minnesota-immigration-crime-drop/,www.politifact.com,PolitiFact | Trump credits immigration enforcement for Minneapolis crime drop. That’s wrong.,0,LOW,False,,,factcheck,2026-02-20T13:04:39.281631
"""The crime numbers in Minnesota, in Minneapolis in particular, are down 25, 30% because we’ve removed thousands of criminals from the area,"" Trump said",http://www.politifact.com/factchecks/2026/feb/13/donald-trump/Minneapolis-Minnesota-immigration-crime-drop/,www.politifact.com,PolitiFact | Trump credits immigration enforcement for Minneapolis crime drop. That’s wrong.,0,LOW,False,,,factcheck,2026-02-20T13:04:39.477999
"The vaccine isn’t 100% effective, but breakthrough infections among vaccinated people are rare and usually milder than what an unvaccinated person would experience",http://www.politifact.com/article/2026/feb/13/chickenpox-shingles-vaccines-FAQ/,www.politifact.com,PolitiFact | Can the chickenpox vaccine cause shingles? We answer questions about the infections and,0.1,LOW,False,,,factcheck,2026-02-20T13:04:39.647396
"More Info I would like to contribute One Time Monthly Yearly Join Now Tom O&#x27;Mara stated on January 20, 2026 in an op-ed: “New Yorkers pay 49% more than the national average for electricity",http://www.politifact.com/factchecks/2026/feb/13/tom-omara/new-york-electricity-rates-utilities/,www.politifact.com,PolitiFact | How much more do New Yorkers pay for electricity than the average US consumer?,0,LOW,False,,,factcheck,2026-02-20T13:04:39.914788
"In the column, O’Mara said such efforts are important because ""New Yorkers pay 49% more than the national average for electricity",http://www.politifact.com/factchecks/2026/feb/13/tom-omara/new-york-electricity-rates-utilities/,www.politifact.com,PolitiFact | How much more do New Yorkers pay for electricity than the average US consumer?,0,LOW,False,,,factcheck,2026-02-20T13:04:40.114169
"78 cents per kilowatt hour, so New York state’s rate was exactly 49% higher than the national average",http://www.politifact.com/factchecks/2026/feb/13/tom-omara/new-york-electricity-rates-utilities/,www.politifact.com,PolitiFact | How much more do New Yorkers pay for electricity than the average US consumer?,0,LOW,False,,,factcheck,2026-02-20T13:04:40.313388
[DEBUNKED] Videos showing ‘burning’ snow do not prove it is fake – Full Fact,https://fullfact.org/environment/snow-turning-black-lighter-experiment-chemsnow-chemtrails/,fullfact.org,Videos showing ‘burning’ snow do not prove it is fake – Full Fact,0.9,HIGH,True,FALSE - Debunked by fact-checkers,fullfact.org,factcheck,2026-02-20T13:04:41.867953
[DEBUNKED] Viral quote misattributed to Mexican President Claudia Sheinbaum recirculates – Full Fact,https://fullfact.org/world/fake-mexican-president-quote-wall-recirculates/,fullfact.org,Viral quote misattributed to Mexican President Claudia Sheinbaum recirculates – Full Fact,0.9,HIGH,True,FALSE - Debunked by fact-checkers,fullfact.org,factcheck,2026-02-20T13:04:42.352161
[DEBUNKED] Princess Anne’s husband hasn’t announced he’s ‘donating his entire fortune to charity’ – Full Fact,https://fullfact.org/culture-and-society/sir-tim-laurence-false-posts/,fullfact.org,Princess Anne’s husband hasn’t announced he’s ‘donating his entire fortune to charity’ – Full Fact,0.9,HIGH,True,FALSE - Debunked by fact-checkers,fullfact.org,factcheck,2026-02-20T13:04:42.867553
[DEBUNKED] Ed Miliband hasn’t resigned as Energy Secretary over ‘Mandelson-Epstein scandal’ – Full Fact,https://fullfact.org/politics/ed-miliband-resigned-mandelson-false/,fullfact.org,Ed Miliband hasn’t resigned as Energy Secretary over ‘Mandelson-Epstein scandal’ – Full Fact,0.9,HIGH,True,FALSE - Debunked by fact-checkers,fullfact.org,factcheck,2026-02-20T13:04:43.382267
[DEBUNKED] Old photos of Jeffrey Epstein edited to look like he was recently spotted in Israel – Full Fact,https://fullfact.org/world/old-photos-jeffrey-epstein-edited-israel/,fullfact.org,Old photos of Jeffrey Epstein edited to look like he was recently spotted in Israel – Full Fact,0.9,HIGH,True,FALSE - Debunked by fact-checkers,fullfact.org,factcheck,2026-02-20T13:04:44.016076
[DEBUNKED] Pictures showing Nigel Farage in hospital recovering from surgery are fake – Full Fact,https://fullfact.org/politics/nigel-farage-hospital-surgery-pictures-fake-ai/,fullfact.org,Pictures showing Nigel Farage in hospital recovering from surgery are fake – Full Fact,0.9,HIGH,True,FALSE - Debunked by fact-checkers,fullfact.org,factcheck,2026-02-20T13:04:45.290688
"[DEBUNKED] No, Keir Starmer was not ‘dragged out’ of the House of Commons following a clash with Nigel Farage – Full Fact",https://fullfact.org/politics/keir-starmer-commons-fake/,fullfact.org,"No, Keir Starmer was not ‘dragged out’ of the House of Commons following a clash with Nigel Farage –",0.9,HIGH,True,FALSE - Debunked by fact-checkers,fullfact.org,factcheck,2026-02-20T13:04:45.774654
[DEBUNKED] A Pre-SOTU Guide to Trump&#039;s Economic Claims - FactCheck.org,https://www.factcheck.org/2026/02/a-pre-sotu-guide-to-trumps-economic-claims/,www.factcheck.org,A Pre-SOTU Guide to Trump&#039;s Economic Claims - FactCheck.org,0.9,HIGH,True,FALSE - Debunked by fact-checkers,www.factcheck.org,factcheck,2026-02-20T13:04:46.800871
[DEBUNKED] Trump and Musk Amplify Long-Ago Debunked Mail-In Vote Fraud Claim - FactCheck.org,https://www.factcheck.org/2026/02/trump-and-musk-amplify-long-ago-debunked-mail-in-vote-fraud-claim/,www.factcheck.org,Trump and Musk Amplify Long-Ago Debunked Mail-In Vote Fraud Claim - FactCheck.org,0.9,HIGH,True,FALSE - Debunked by fact-checkers,www.factcheck.org,factcheck,2026-02-20T13:04:47.775049
"6% in the first quarter of 2025, which covers the three months from January to March, real gross domestic product (meaning it has been adjusted for inflation) grew at an annualized rate of 3",https://www.factcheck.org/2026/02/trump-oversells-recent-u-s-economic-growth/,www.factcheck.org,Trump Oversells Recent U.S. Economic Growth - FactCheck.org,0,LOW,False,,,factcheck,2026-02-20T13:04:48.342733
8% in the second quarter of 2025 and at a rate of 4,https://www.factcheck.org/2026/02/trump-oversells-recent-u-s-economic-growth/,www.factcheck.org,Trump Oversells Recent U.S. Economic Growth - FactCheck.org,0,LOW,False,,,factcheck,2026-02-20T13:04:48.539659
"[DEBUNKED] WHO Didn’t Recommend Lockdowns, Contrary to Health Officials&#039; Suggestions - FactCheck.org",https://www.factcheck.org/2026/02/who-didnt-recommend-lockdowns-contrary-to-health-officials-suggestions/,www.factcheck.org,"WHO Didn’t Recommend Lockdowns, Contrary to Health Officials&#039; Suggestions - FactCheck.org",0.9,HIGH,True,FALSE - Debunked by fact-checkers,www.factcheck.org,factcheck,2026-02-20T13:04:49.084962
"Yet, Trump has repeatedly boasted that “factory construction” is up 41%",https://www.factcheck.org/2026/02/manufacturing-construction-spending-declines-under-trump/,www.factcheck.org,Manufacturing Construction Spending Declines Under Trump - FactCheck.org,0,LOW,False,,,factcheck,2026-02-20T13:04:49.591133
Trump cited the 41% statistic in a White House press conference on Jan,https://www.factcheck.org/2026/02/manufacturing-construction-spending-declines-under-trump/,www.factcheck.org,Manufacturing Construction Spending Declines Under Trump - FactCheck.org,0,LOW,False,,,factcheck,2026-02-20T13:04:49.788633
”&nbsp; “Investment in American factories is up 41%,https://www.factcheck.org/2026/02/manufacturing-construction-spending-declines-under-trump/,www.factcheck.org,Manufacturing Construction Spending Declines Under Trump - FactCheck.org,0,LOW,False,,,factcheck,2026-02-20T13:04:49.988388
"[DEBUNKED] Americans Don&#039;t Need &#039;Dramatically&#039; More Protein, Despite Officials’ Claims - FactCheck.org",https://www.factcheck.org/2026/02/americans-dont-need-dramatically-more-protein-despite-officials-claims/,www.factcheck.org,"Americans Don&#039;t Need &#039;Dramatically&#039; More Protein, Despite Officials’ Claims - FactChe",0.9,HIGH,True,FALSE - Debunked by fact-checkers,www.factcheck.org,factcheck,2026-02-20T13:04:50.998587
[DEBUNKED] Fact Check: FAKE Image Of Ex Prince Andrew And Meghan Markle -- It's AI | Lead Stories,https://leadstories.com/hoax-alert/2026/02/fact-check-fake-image-former-prince-andrew-meghan-markle-ai.html,leadstories.com,Fact Check: FAKE Image Of Ex Prince Andrew And Meghan Markle -- It's AI | Lead Stories,0.9,HIGH,True,FALSE - Debunked by fact-checkers,leadstories.com,factcheck,2026-02-20T13:04:51.225973
"[DEBUNKED] Fact Check: Chelsea Clinton Did NOT Post ""Close but no cigar Trump!!!"" -- It's A Fake Screenshot | Lead Stories",https://leadstories.com/hoax-alert/2026/02/fact-check-chelsea-clinton-did-not-post-close-but-no-cigar-trump.html,leadstories.com,"Fact Check: Chelsea Clinton Did NOT Post ""Close but no cigar Trump!!!"" -- It's A Fake Screenshot | L",0.9,HIGH,True,FALSE - Debunked by fact-checkers,leadstories.com,factcheck,2026-02-20T13:04:51.454925
"[DEBUNKED] Fact Check: Victor Wembanyama, Other Celebrities Did NOT Reward Arena Worker With A White Pickup Truck For Helping Him-- Foreign Clickbait | Lead Stories",https://leadstories.com/hoax-alert/2026/02/fact-check-victor-wembanyama-did-not-give-maria-thompson-a-white-truck-for-helping-him-.html,leadstories.com,"Fact Check: Victor Wembanyama, Other Celebrities Did NOT Reward Arena Worker With A White Pickup Tru",0.9,HIGH,True,FALSE - Debunked by fact-checkers,leadstories.com,factcheck,2026-02-20T13:04:51.691475
[DEBUNKED] Fact Check: Seattle Seahawks Did NOT Decline a White House Invitation | Lead Stories,https://leadstories.com/hoax-alert/2026/02/fact-check-seattle-seahawks-did-not-decline-a-white-house-invitation.html,leadstories.com,Fact Check: Seattle Seahawks Did NOT Decline a White House Invitation | Lead Stories,0.9,HIGH,True,FALSE - Debunked by fact-checkers,leadstories.com,factcheck,2026-02-20T13:04:51.932879
[DEBUNKED] Fact Check: Swift and Kelce Did NOT Announce On Livestream They Are Spending $250 Million To Uncover Truth In Giuffre Case -- Foreign Clickbait | Lead Stories,https://leadstories.com/hoax-alert/2026/02/fact-check-kelce-swift-did-not-announce-250-million-spend-for-truth-in-giuffre-case.html,leadstories.com,Fact Check: Swift and Kelce Did NOT Announce On Livestream They Are Spending $250 Million To Uncover,0.9,HIGH,True,FALSE - Debunked by fact-checkers,leadstories.com,factcheck,2026-02-20T13:04:52.154415
