claim,source_url,source_domain,article_title,risk_score,risk_category,has_factcheck,factcheck_rating,factcheck_source,source_type,checked_at
[DEBUNKED] Social media posts share fake Boots La Roche-Posay offer – Full Fact,https://fullfact.org/shopping/boots-larocheposay-set-false/,fullfact.org,Social media posts share fake Boots La Roche-Posay offer – Full Fact,0.9,HIGH,True,FALSE - Debunked by fact-checkers,fullfact.org,factcheck,2026-05-25T19:42:30.905093
[DEBUNKED] Image of crowd doesn’t show last weekend’s Unite the Kingdom march – Full Fact,https://fullfact.org/politics/image-crowd-unite-kingdom-old-AI/,fullfact.org,Image of crowd doesn’t show last weekend’s Unite the Kingdom march – Full Fact,0.9,HIGH,True,FALSE - Debunked by fact-checkers,fullfact.org,factcheck,2026-05-25T19:42:31.409440
"[DEBUNKED] Video shows church attack in Mexico, not Yorkshire – Full Fact",https://fullfact.org/world/video-church-attack-mexico-not-yorkshire/,fullfact.org,"Video shows church attack in Mexico, not Yorkshire – Full Fact",0.9,HIGH,True,FALSE - Debunked by fact-checkers,fullfact.org,factcheck,2026-05-25T19:42:31.882087
"[DEBUNKED] No, the UK Government’s X account hasn’t been suspended – Full Fact",https://fullfact.org/politics/uk-gov-x-account-not-suspended/,fullfact.org,"No, the UK Government’s X account hasn’t been suspended – Full Fact",0.9,HIGH,True,FALSE - Debunked by fact-checkers,fullfact.org,factcheck,2026-05-25T19:42:32.290689
[DEBUNKED] Video of 2025 Unite the Kingdom protest shared as last weekend’s march – Full Fact,https://fullfact.org/politics/old-video-2025-unite-the-kingdom-march/,fullfact.org,Video of 2025 Unite the Kingdom protest shared as last weekend’s march – Full Fact,0.9,HIGH,True,FALSE - Debunked by fact-checkers,fullfact.org,factcheck,2026-05-25T19:42:33.642103
[DEBUNKED] Viral post includes several false claims about UK taxes – Full Fact,https://fullfact.org/economy/viral-post-includes-false-claims-about-UK-taxes/,fullfact.org,Viral post includes several false claims about UK taxes – Full Fact,0.9,HIGH,True,FALSE - Debunked by fact-checkers,fullfact.org,factcheck,2026-05-25T19:42:34.134498
[DEBUNKED] China hasn’t banned US citizens over hantavirus – Full Fact,https://fullfact.org/health/China-US-hantavirus-ban-false/,fullfact.org,China hasn’t banned US citizens over hantavirus – Full Fact,0.9,HIGH,True,FALSE - Debunked by fact-checkers,fullfact.org,factcheck,2026-05-25T19:42:34.709869
[DEBUNKED] RFK Jr.’s Muddled Claims on Drug Approval Speed - FactCheck.org,https://www.factcheck.org/2026/05/rfk-jr-s-muddled-claims-on-drug-approval-speed/,www.factcheck.org,RFK Jr.’s Muddled Claims on Drug Approval Speed - FactCheck.org,0.9,HIGH,True,FALSE - Debunked by fact-checkers,www.factcheck.org,factcheck,2026-05-25T19:42:34.798218
"[DEBUNKED] Ad in Texas GOP Runoff Attacks Cornyn on Immigration, Islam - FactCheck.org",https://www.factcheck.org/2026/05/ad-in-texas-gop-runoff-attacks-cornyn-on-immigration-islam/,www.factcheck.org,"Ad in Texas GOP Runoff Attacks Cornyn on Immigration, Islam - FactCheck.org",0.9,HIGH,True,FALSE - Debunked by fact-checkers,www.factcheck.org,factcheck,2026-05-25T19:42:35.284122
"56, or 53%, from the average price of $2",https://www.factcheck.org/2026/05/what-will-happen-to-gasoline-prices-when-the-iran-war-ends/,www.factcheck.org,What Will Happen To Gasoline Prices When the Iran War Ends? - FactCheck.org,0,LOW,False,,,factcheck,2026-05-25T19:42:35.478581
[DEBUNKED] Kennedy Denies the One Big Beautiful Bill Act&#039;s Spending Cuts to Medicaid - FactCheck.org,https://www.factcheck.org/2026/05/kennedy-denies-the-one-big-beautiful-bill-acts-spending-cuts-to-medicaid/,www.factcheck.org,Kennedy Denies the One Big Beautiful Bill Act&#039;s Spending Cuts to Medicaid - FactCheck.org,0.9,HIGH,True,FALSE - Debunked by fact-checkers,www.factcheck.org,factcheck,2026-05-25T19:42:36.137909
[DEBUNKED] Fact Check: No Evidence Bahamas Barred Trump From Attending Son's Wedding Under Immigration Laws | Lead Stories,https://leadstories.com/hoax-alert/2026/05/fact-check-no-evidence-bahamas-barred-trump-from-attending-sons-wedding-under-immigration-laws.html,leadstories.com,Fact Check: No Evidence Bahamas Barred Trump From Attending Son's Wedding Under Immigration Laws | L,0.9,HIGH,True,FALSE - Debunked by fact-checkers,leadstories.com,factcheck,2026-05-25T19:42:37.065119
[DEBUNKED] Fact Check: Fake Video Of HOA Courtroom Drama Is AI-Generated Engagement Bait | Lead Stories,https://leadstories.com/hoax-alert/2026/05/fact-check-fake-video-of-hoa-courtroom-drama-is-ai-generated-engagement-bait.html,leadstories.com,Fact Check: Fake Video Of HOA Courtroom Drama Is AI-Generated Engagement Bait | Lead Stories,0.9,HIGH,True,FALSE - Debunked by fact-checkers,leadstories.com,factcheck,2026-05-25T19:42:37.221034
[DEBUNKED] Fact Check: FAKE Video Shows Scooter Snapping In Half At A Green Light -- AI-Generated | Lead Stories,https://leadstories.com/hoax-alert/2026/05/fact-check-fake-video-of-scooter-snapping-in-half-at-a-green-light-is-not-real-footage.html,leadstories.com,Fact Check: FAKE Video Shows Scooter Snapping In Half At A Green Light -- AI-Generated | Lead Storie,0.9,HIGH,True,FALSE - Debunked by fact-checkers,leadstories.com,factcheck,2026-05-25T19:42:37.364838
[DEBUNKED] Fact Check: Posts Saying Your Favorite Celeb Filed a $50 Million Defamation Lawsuit Against A News Host for On-Air Defamation Are NOT Real -- Spam From Vietnam | Lead Stories,https://leadstories.com/hoax-alert/2026/05/fact-check-posts-saying-celeb-warned-you-defamed-me-on-live-tv-are-not-real.html,leadstories.com,Fact Check: Posts Saying Your Favorite Celeb Filed a $50 Million Defamation Lawsuit Against A News H,0.9,HIGH,True,FALSE - Debunked by fact-checkers,leadstories.com,factcheck,2026-05-25T19:42:37.509640
[DEBUNKED] Fact Check: 'Sovereign Settings' Do NOT Exist On X | Lead Stories,https://leadstories.com/hoax-alert/2026/05/fact-check-sovereign-settings-do-not-exist-on-x.html,leadstories.com,Fact Check: 'Sovereign Settings' Do NOT Exist On X | Lead Stories,0.9,HIGH,True,FALSE - Debunked by fact-checkers,leadstories.com,factcheck,2026-05-25T19:42:37.654670
[DEBUNKED] Fact Check: James Woods Did Not Call President Trump The 'Most Treacherous And Truly Worthless Republican Leader In The History Of The Party' -- He Was Referring To Senate Majority Leader John Thune | Lead Stories,https://leadstories.com/hoax-alert/2026/05/fact-check-james-woods-did-not-call-president-trump-the-most-treacherous-and-truly-worthless-republican-leader-in-the-history-of-the-party.html,leadstories.com,Fact Check: James Woods Did Not Call President Trump The 'Most Treacherous And Truly Worthless Repub,0.9,HIGH,True,FALSE - Debunked by fact-checkers,leadstories.com,factcheck,2026-05-25T19:42:37.789748
[DEBUNKED] Fact Check: OpenAI Has NOT Announced Plans To Let Users 'Securely Connect' ChatGPT To Their DNA -- Parody Post | Lead Stories,https://leadstories.com/hoax-alert/2026/05/fact-check-openai-has-not-announced-plans-to-let-users-securely-connect-chatgpt-to-their-dna-parody-post.html,leadstories.com,Fact Check: OpenAI Has NOT Announced Plans To Let Users 'Securely Connect' ChatGPT To Their DNA -- P,0.9,HIGH,True,FALSE - Debunked by fact-checkers,leadstories.com,factcheck,2026-05-25T19:42:37.979333
[DEBUNKED] Fact Check: Video Of Alleged Hitler Lookalike Is NOT Real Footage Of Person At Soccer Match In Argentina | Lead Stories,https://leadstories.com/hoax-alert/2026/05/fact-check-video-of-hitler-lookalike-is-not-real-footage.html,leadstories.com,Fact Check: Video Of Alleged Hitler Lookalike Is NOT Real Footage Of Person At Soccer Match In Argen,0.9,HIGH,True,FALSE - Debunked by fact-checkers,leadstories.com,factcheck,2026-05-25T19:42:38.123527
"[DEBUNKED] Fact Check: Video Of Fox News Guest Robert Harward, Focus Of 'Face Mask' Rumors, Is REAL And Unedited | Lead Stories",https://leadstories.com/hoax-alert/2026/05/fact-check-video-of-fox-news-guest-robert-harward-focus-of-face-mask-rumors-is-real-not-ai.html,leadstories.com,"Fact Check: Video Of Fox News Guest Robert Harward, Focus Of 'Face Mask' Rumors, Is REAL And Unedite",0.9,HIGH,True,FALSE - Debunked by fact-checkers,leadstories.com,factcheck,2026-05-25T19:42:38.262546
[DEBUNKED] Fact Check: FAKE Video Shows Trump Touching And Kissing Man's Belly -- Originated From Known Parody Account | Lead Stories,https://leadstories.com/hoax-alert/2026/05/fact-check-altered-video-showing-trump-touching-and-kissing-mans-belly-originated-from-known-satire-account.html,leadstories.com,Fact Check: FAKE Video Shows Trump Touching And Kissing Man's Belly -- Originated From Known Parody ,0.9,HIGH,True,FALSE - Debunked by fact-checkers,leadstories.com,factcheck,2026-05-25T19:42:38.417549
[DEBUNKED] Fact Check: Man In Video Saying He Would Cast Unclaimed Ballots For Spencer Pratt For Los Angeles Mayor Can't -- NOT LA Ballots | Lead Stories,https://leadstories.com/hoax-alert/2026/05/fact-check-multiple-ballots-filled-out-mailed-by-one-person-voting-spencer-pratt-la-mayor-will-not-counted.html,leadstories.com,Fact Check: Man In Video Saying He Would Cast Unclaimed Ballots For Spencer Pratt For Los Angeles Ma,0.9,HIGH,True,FALSE - Debunked by fact-checkers,leadstories.com,factcheck,2026-05-25T19:42:38.567509
[DEBUNKED] Fact Check: FAKE Video Shows Tesla Cybertruck Carrying Solar Panels -- Original Poster Admits It Is AI-Generated | Lead Stories,https://leadstories.com/hoax-alert/2026/05/fact-check-fake-video-shows-tesla-cybertruck-carrying-solar-panels.html,leadstories.com,Fact Check: FAKE Video Shows Tesla Cybertruck Carrying Solar Panels -- Original Poster Admits It Is ,0.9,HIGH,True,FALSE - Debunked by fact-checkers,leadstories.com,factcheck,2026-05-25T19:42:38.713544
[DEBUNKED] Fact Check: FAKE Image Of Judge Hugging '88-Year-Old Man Named Vietnam Veteran' Is NOT Real Photo | Lead Stories,https://leadstories.com/hoax-alert/2026/05/fact-check-image-of-judge-hugging-88-year-old-man-named-vietnam-veteran-is-not-real-photo.html,leadstories.com,Fact Check: FAKE Image Of Judge Hugging '88-Year-Old Man Named Vietnam Veteran' Is NOT Real Photo | ,0.9,HIGH,True,FALSE - Debunked by fact-checkers,leadstories.com,factcheck,2026-05-25T19:42:38.862148
[DEBUNKED] Fact Check: Plantation Simulator Game With 'Whipping Black People' WAS Released On Steam | Lead Stories,https://leadstories.com/hoax-alert/2026/05/fact-check-plantation-simulator-game-with-whipping-black-people-was-released-on-steam.html,leadstories.com,Fact Check: Plantation Simulator Game With 'Whipping Black People' WAS Released On Steam | Lead Stor,0.9,HIGH,True,FALSE - Debunked by fact-checkers,leadstories.com,factcheck,2026-05-25T19:42:39.009587
[DEBUNKED] Fact Check: NO Reputable Poll Shows Trump Has 99% Support In Israel -- Polls Show 69% To 79% | Lead Stories,https://leadstories.com/hoax-alert/2026/05/fact-check-no-reputable-poll-shows-trump-has-99-percent-support-in-israel.html,leadstories.com,Fact Check: NO Reputable Poll Shows Trump Has 99% Support In Israel -- Polls Show 69% To 79% | Lead ,0.9,HIGH,True,FALSE - Debunked by fact-checkers,leadstories.com,factcheck,2026-05-25T19:42:39.153482
[DEBUNKED] A video of a Florida governor candidate was AI slop. People spread it anyway. - Poynter,https://www.poynter.org/fact-checking/2026/did-byron-donalds-say-insider-trading-should-be-allowed/,www.poynter.org,A video of a Florida governor candidate was AI slop. People spread it anyway. - Poynter,0.9,HIGH,True,FALSE - Debunked by fact-checkers,www.poynter.org,factcheck,2026-05-25T19:42:39.778466
"[DEBUNKED] Lies about Russia’s military success, Yermak’s arrest and secret biolabs - EUvsDisinfo",https://euvsdisinfo.eu/lies-about-russias-military-success-yermaks-arrest-and-secret-biolabs/,euvsdisinfo.eu,"Lies about Russia’s military success, Yermak’s arrest and secret biolabs - EUvsDisinfo",0.9,HIGH,True,FALSE - Debunked by fact-checkers,euvsdisinfo.eu,factcheck,2026-05-25T19:42:41.326575
"[DEBUNKED] Victory Day propaganda, masking fear with intimidation, and abduction denial - EUvsDisinfo",https://euvsdisinfo.eu/victory-day-propaganda-masking-fear-with-intimidation-and-abduction-denial/,euvsdisinfo.eu,"Victory Day propaganda, masking fear with intimidation, and abduction denial - EUvsDisinfo",0.9,HIGH,True,FALSE - Debunked by fact-checkers,euvsdisinfo.eu,factcheck,2026-05-25T19:42:44.674819
[DEBUNKED] How Russia lies about the stolen Ukrainian children - EUvsDisinfo,https://euvsdisinfo.eu/how-russia-lies-about-the-stolen-ukrainian-children/,euvsdisinfo.eu,How Russia lies about the stolen Ukrainian children - EUvsDisinfo,0.9,HIGH,True,FALSE - Debunked by fact-checkers,euvsdisinfo.eu,factcheck,2026-05-25T19:42:47.654376
[DEBUNKED] Fake European crises and real Russian failures - EUvsDisinfo,https://euvsdisinfo.eu/fake-european-crises-and-real-russian-failures/,euvsdisinfo.eu,Fake European crises and real Russian failures - EUvsDisinfo,0.9,HIGH,True,FALSE - Debunked by fact-checkers,euvsdisinfo.eu,factcheck,2026-05-25T19:42:50.535244
[DEBUNKED] Russia’s fake nuclear drills and real failure in Mali - EUvsDisinfo,https://euvsdisinfo.eu/russias-fake-nuclear-drills-and-real-failure-in-mali/,euvsdisinfo.eu,Russia’s fake nuclear drills and real failure in Mali - EUvsDisinfo,0.9,HIGH,True,FALSE - Debunked by fact-checkers,euvsdisinfo.eu,factcheck,2026-05-25T19:42:51.731963
[DEBUNKED] Disinformation Review: EU Sanctions and the Kremlin’s Recycled Narratives - EUvsDisinfo,https://euvsdisinfo.eu/disinformation-review-eu-sanctions-and-the-kremlins-recycled-narratives/,euvsdisinfo.eu,Disinformation Review: EU Sanctions and the Kremlin’s Recycled Narratives - EUvsDisinfo,0.9,HIGH,True,FALSE - Debunked by fact-checkers,euvsdisinfo.eu,factcheck,2026-05-25T19:42:53.823425
"Wenn dieses Ergebnis bestätigt wird, vermeidet Venturini damit eine Stichwahl",https://www.spiegel.de/ausland/italien-giorgia-meloni-buendnis-verteidigt-venedig-bei-kommunalwahl-a-f7873353-8236-45e2-9726-a099b2f60a6f#ref=rss,www.spiegel.de,Italien: Giorgia-Meloni-Bündnis verteidigt Venedig bei Kommunalwahl - DER SPIEGEL,0,LOW,False,,,mainstream,2026-05-25T19:43:04.780118
Sein wichtigster Herausforderer kam demnach auf rund 38 Prozent,https://www.spiegel.de/ausland/italien-giorgia-meloni-buendnis-verteidigt-venedig-bei-kommunalwahl-a-f7873353-8236-45e2-9726-a099b2f60a6f#ref=rss,www.spiegel.de,Italien: Giorgia-Meloni-Bündnis verteidigt Venedig bei Kommunalwahl - DER SPIEGEL,0,LOW,False,,,mainstream,2026-05-25T19:43:04.833200
Laut dem Palast geht es der ehemaligen Monarchin »den Umständen entsprechend gut«,https://www.spiegel.de/panorama/leute/daenemark-ex-koenigin-margrethe-ii-erneut-im-krankenhaus-a-e8ec3e26-d350-4266-b099-a4a7aa8e6eb2#ref=rss,www.spiegel.de,Dänemark: Ex-Königin Margrethe II. erneut im Krankenhaus - DER SPIEGEL,0,LOW,False,,,mainstream,2026-05-25T19:43:06.483527
Laut dem Königshof musste sie sich einem Eingriff zur Erweiterung von Blutgefäßen unterziehen,https://www.spiegel.de/panorama/leute/daenemark-ex-koenigin-margrethe-ii-erneut-im-krankenhaus-a-e8ec3e26-d350-4266-b099-a4a7aa8e6eb2#ref=rss,www.spiegel.de,Dänemark: Ex-Königin Margrethe II. erneut im Krankenhaus - DER SPIEGEL,0,LOW,False,,,mainstream,2026-05-25T19:43:06.538103
000 Euro nach Tod von 89 Schafen $swiper,https://www.spiegel.de/ausland/portugal-bahn-fordert-26-000-euro-nach-tod-von-89-schafen-a-2a637a26-d151-4dfb-a32c-6301086c7c90#ref=rss,www.spiegel.de,Portugal: Bahn fordert 26.000 Euro nach Tod von 89 Schafen - DER SPIEGEL,0,LOW,False,,,mainstream,2026-05-25T19:43:09.128826
"000 Euro von Hirten Eine Herde Schafe stirbt bei einem Zugunglück, die portugiesische Infrastrukturgesellschaft der Bahn verlangt Tausende Euro Schadensersatz von zwei Hirten",https://www.spiegel.de/ausland/portugal-bahn-fordert-26-000-euro-nach-tod-von-89-schafen-a-2a637a26-d151-4dfb-a32c-6301086c7c90#ref=rss,www.spiegel.de,Portugal: Bahn fordert 26.000 Euro nach Tod von 89 Schafen - DER SPIEGEL,0,LOW,False,,,mainstream,2026-05-25T19:43:09.182060
Laut portugiesischen Medien verlangt die staatliche Infrastrukturgesellschaft Infraestruturas de Portugal nun von den Besitzern der Tiere einen Schadensersatz in Höhe von etwa 26,https://www.spiegel.de/ausland/portugal-bahn-fordert-26-000-euro-nach-tod-von-89-schafen-a-2a637a26-d151-4dfb-a32c-6301086c7c90#ref=rss,www.spiegel.de,Portugal: Bahn fordert 26.000 Euro nach Tod von 89 Schafen - DER SPIEGEL,0,LOW,False,,,mainstream,2026-05-25T19:43:09.240762
Das entspricht einem Rückgang von 17 Prozent im Vergleich zum Vorjahr,https://www.spiegel.de/ausland/sipri-studie-uno-friedensmissionen-erreichen-historischen-tiefstand-a-4a3cf3e4-f404-4753-8faf-1a19dbd16bb4#ref=rss,www.spiegel.de,Sipri-Studie: Uno-Friedensmissionen erreichen historischen Tiefstand - DER SPIEGEL,0,LOW,False,,,mainstream,2026-05-25T19:43:09.975008
"So hätten den UN-Friedenseinsätzen im Juli 2025 rund zwei Milliarden US-Dollar gefehlt, was mehr als einem Drittel des vorgesehenen Budgets von 5,6 Milliarden Dollar für den Zeitraum 2024/25 entspricht",https://www.spiegel.de/ausland/sipri-studie-uno-friedensmissionen-erreichen-historischen-tiefstand-a-4a3cf3e4-f404-4753-8faf-1a19dbd16bb4#ref=rss,www.spiegel.de,Sipri-Studie: Uno-Friedensmissionen erreichen historischen Tiefstand - DER SPIEGEL,0,LOW,False,,,mainstream,2026-05-25T19:43:10.031184
"Zur Ausgabe Die Tanznummer, die die Band in neuer Besetzung noch immer auf deutschen Bühnen spielt, ist ein zynisches Machwerk in der deutschen Mu",https://www.spiegel.de/wissenschaft/dschingis-khan-der-mann-aus-der-hoelle-der-sogar-berlin-bedrohte-a-a618a340-498e-41ef-acfb-e6d379d85b45#ref=rss,www.spiegel.de,"Dschingis Khan: Der Mann aus der Hölle, der sogar Berlin bedrohte - DER SPIEGEL",0.1,LOW,False,,,mainstream,2026-05-25T19:43:10.879808
Nach Angaben der Marine war er bei der Ausbildung schwer zu Schaden gekommen,https://www.spiegel.de/panorama/gesellschaft/minentaucher-marinesoldat-stirbt-nach-notfall-bei-einer-uebung-a-a60c4a05-61a4-4046-95a3-cf6c8ebdc386#ref=rss,www.spiegel.de,Eckernförde: Marinesoldat stirbt nach Notfall in der Minentaucherausbildung - DER SPIEGEL,0,LOW,False,,,mainstream,2026-05-25T19:43:11.863032
Körperlich und technisch anspruchsvollMarineinspekteur Kaack teilte mit: »Der Tod dieses jungen Soldaten erfüllt uns alle in der Marine mit tiefer Trauer,https://www.spiegel.de/panorama/gesellschaft/minentaucher-marinesoldat-stirbt-nach-notfall-bei-einer-uebung-a-a60c4a05-61a4-4046-95a3-cf6c8ebdc386#ref=rss,www.spiegel.de,Eckernförde: Marinesoldat stirbt nach Notfall in der Minentaucherausbildung - DER SPIEGEL,0.1,LOW,False,,,mainstream,2026-05-25T19:43:11.917971
"Laut einer Studie des Observatorio Cubano de Derechos Humanos (OCDH), einer spanischen NGO, leben 89 Prozent der Kubaner in extremer Armut; sieben von zehn Einwohnern verzichten regelmäßig auf Mahlzeiten",https://www.spiegel.de/ausland/kuba-wegen-der-oelblockade-der-usa-wird-selbst-reis-zum-luxusgut-a-7dadd46c-808d-487d-9251-86c9cc9781fa#ref=rss,www.spiegel.de,Kuba: Wegen der Ölblockade der USA wird selbst Reis zum Luxusgut - DER SPIEGEL,0,LOW,False,,,mainstream,2026-05-25T19:43:13.424146
"length - 1, 500, false)"" data-area=""nav-bar"" data-app-hidden x-lazyload> Menü Startseite Ausland Russland China und Russland betreiben laut WSJ-Bericht Abhörstationen auf Kuba $swiper",https://www.spiegel.de/ausland/china-und-russland-betreiben-laut-wsj-bericht-abhoerstationen-auf-kuba-a-891c71f5-a279-4b6a-85aa-07a516b015d5#ref=rss,www.spiegel.de,China und Russland betreiben laut WSJ-Bericht Abhörstationen auf Kuba - DER SPIEGEL,0,LOW,False,,,mainstream,2026-05-25T19:43:14.178641
"There was a 15% rise in incidents between 2019, when the organisation began collecting data, and 2024",https://www.bbc.com/news/articles/c4g009zq4neo?at_medium=RSS&amp;at_campaign=rss,www.bbc.com,"Portable charger problems on flights &#x27;on the rise&#x27;, watchdog warns",0,LOW,False,,,mainstream,2026-05-25T19:43:16.532475
