claim,source_url,source_domain,article_title,risk_score,risk_category,has_factcheck,factcheck_rating,factcheck_source,source_type,checked_at
"[DEBUNKED] Fact Check: Post Does NOT Prove 'No Kings' Rallies Participants Were Paid To Join Protests on March 28, 2026 | Lead Stories",https://leadstories.com/hoax-alert/2026/03/fact-check-post-does-not-prove-no-kings-rallies-participants-were-paid-to-join-protests.html,leadstories.com,Fact Check: Post Does NOT Prove 'No Kings' Rallies Participants Were Paid To Join Protests on March ,0.9,HIGH,True,FALSE - Debunked by fact-checkers,leadstories.com,factcheck,2026-03-30T19:03:25.809939
"[DEBUNKED] Fact Check: Israeli Channel 13, Al Jazeera Did NOT Confirm Hezbollah Captured All Or Part Of Kiryat Shmona | Lead Stories",https://leadstories.com/hoax-alert/2026/03/fact-check-israeli-channel-13-al-jazeera-did-not-confirm-hezbollah-captured-all-or-part-of-kiryat-shmona.html,leadstories.com,"Fact Check: Israeli Channel 13, Al Jazeera Did NOT Confirm Hezbollah Captured All Or Part Of Kiryat ",0.9,HIGH,True,FALSE - Debunked by fact-checkers,leadstories.com,factcheck,2026-03-30T19:03:25.976938
[DEBUNKED] Fact Check: Fake CCTV Footage Shows Mother Donkey Defending Her Foal From Fox Attack -- It's AI-Generated | Lead Stories,https://leadstories.com/hoax-alert/2026/03/fact-check-fake-cctv-footage-shows-mother-donkey-defending-her-foal-from-fox-attack.html,leadstories.com,Fact Check: Fake CCTV Footage Shows Mother Donkey Defending Her Foal From Fox Attack -- It's AI-Gene,0.9,HIGH,True,FALSE - Debunked by fact-checkers,leadstories.com,factcheck,2026-03-30T19:03:26.135192
"[DEBUNKED] Fact Check: No Trump Post About Ground Operation In Iran That Would Be Strong, Precise, Successful -- Fake Truth Social Screenshot | Lead Stories",https://leadstories.com/hoax-alert/2026/03/fact-check-trump-truth-social-iran-ground-operation-strong-precise-successful.html,leadstories.com,"Fact Check: No Trump Post About Ground Operation In Iran That Would Be Strong, Precise, Successful -",0.9,HIGH,True,FALSE - Debunked by fact-checkers,leadstories.com,factcheck,2026-03-30T19:03:26.291825
[DEBUNKED] Fact Check: Dancing Man Video NOT Leaked From Kash Patel's Gmail Account -- Has Been Online For Years | Lead Stories,https://leadstories.com/hoax-alert/2026/03/fact-check-kash-patel-leaked-gmail-video-dancing.html,leadstories.com,Fact Check: Dancing Man Video NOT Leaked From Kash Patel's Gmail Account -- Has Been Online For Year,0.9,HIGH,True,FALSE - Debunked by fact-checkers,leadstories.com,factcheck,2026-03-30T19:03:26.454338
[DEBUNKED] Fact Check: Satire Story About Trump Being Furious After 'Pro Kings' Rally Drew 'Sparse Crowd' Is NOT Real | Lead Stories,https://leadstories.com/hoax-alert/2026/03/fact-check-trump-furious-after-pro-kings-rally-draws-sparse-crowd.html,leadstories.com,Fact Check: Satire Story About Trump Being Furious After 'Pro Kings' Rally Drew 'Sparse Crowd' Is NO,0.9,HIGH,True,FALSE - Debunked by fact-checkers,leadstories.com,factcheck,2026-03-30T19:03:26.598908
[DEBUNKED] Fact Check: FAKE Screenshot Shows Trump Calling For Tiger Woods Pardon In DUI Case -- No Such Truth Social Post | Lead Stories,https://leadstories.com/hoax-alert/2026/03/fact-check-tiger-woods-trump-dui-pardon-ron-desantis.html,leadstories.com,Fact Check: FAKE Screenshot Shows Trump Calling For Tiger Woods Pardon In DUI Case -- No Such Truth ,0.9,HIGH,True,FALSE - Debunked by fact-checkers,leadstories.com,factcheck,2026-03-30T19:03:26.759913
[DEBUNKED] Fact Check: Trump Quote About Attacks From '17 Different Angles' Involving Carrier Was About U.S. Attacking Venezuela -- NOT Iran | Lead Stories,https://leadstories.com/hoax-alert/2026/03/fact-check-trump-carrier-17-angles-iran-one-in-the-morning.html,leadstories.com,Fact Check: Trump Quote About Attacks From '17 Different Angles' Involving Carrier Was About U.S. At,0.9,HIGH,True,FALSE - Debunked by fact-checkers,leadstories.com,factcheck,2026-03-30T19:03:26.932492
"[DEBUNKED] Fact Check: 'Lock Him Up For Lying To Congress' NOT Real Quote From Gavin Newsom, Others -- Foreign Clickbait | Lead Stories",https://leadstories.com/hoax-alert/2026/03/fact-check-lock-him-up-for-lying-to-congress-not-real-quote-from-gavin-newsom-others-foreign-clickbait.html,leadstories.com,"Fact Check: 'Lock Him Up For Lying To Congress' NOT Real Quote From Gavin Newsom, Others -- Foreign ",0.9,HIGH,True,FALSE - Debunked by fact-checkers,leadstories.com,factcheck,2026-03-30T19:03:27.104020
"[DEBUNKED] Fact Check: Mark Twain Did NOT Say, 'If You Don't Read The Newspaper, You're Uninformed. If You Do Read It, You're Misinformed' | Lead Stories",https://leadstories.com/hoax-alert/2026/03/fact-check-mark-twain-did-not-say-if-you-dont-read-the-newspaper-youre-uninformed-if-you-do-read-it-youre-misinformed.html,leadstories.com,"Fact Check: Mark Twain Did NOT Say, 'If You Don't Read The Newspaper, You're Uninformed. If You Do R",0.9,HIGH,True,FALSE - Debunked by fact-checkers,leadstories.com,factcheck,2026-03-30T19:03:27.259980
"[DEBUNKED] Fact Check: Video Of Transgender, LGBTQ+ People Blocked From Women's Restrooms Is NOT Real Footage | Lead Stories",https://leadstories.com/hoax-alert/2026/03/fact-check-video-of-transgender-lgbtq-people-blocked-from-womens-restrooms-is-not-real-footage.html,leadstories.com,"Fact Check: Video Of Transgender, LGBTQ+ People Blocked From Women's Restrooms Is NOT Real Footage |",0.9,HIGH,True,FALSE - Debunked by fact-checkers,leadstories.com,factcheck,2026-03-30T19:03:27.433001
[DEBUNKED] Fact Check: Photo Does NOT Show Hillary Clinton Pulling Jeffrey Epstein's Tie In Front Of Bill Clinton -- It's AI-Generated | Lead Stories,https://leadstories.com/hoax-alert/2026/03/fact-check-photo-does-not-show-hillary-clinton-pulling-jeffrey-epsteins-tie-in-front-of-bill-clinton.html,leadstories.com,Fact Check: Photo Does NOT Show Hillary Clinton Pulling Jeffrey Epstein's Tie In Front Of Bill Clint,0.9,HIGH,True,FALSE - Debunked by fact-checkers,leadstories.com,factcheck,2026-03-30T19:03:27.579013
[DEBUNKED] Fact Check: Skit Of ICE Agent Removing a U.S. Citizen From A Plane Is NOT Real | Lead Stories,https://leadstories.com/hoax-alert/2026/03/fact-check-skit-ice-agent-remove-us-citizen-plane-not-real.html,leadstories.com,Fact Check: Skit Of ICE Agent Removing a U.S. Citizen From A Plane Is NOT Real | Lead Stories,0.9,HIGH,True,FALSE - Debunked by fact-checkers,leadstories.com,factcheck,2026-03-30T19:03:27.751821
[DEBUNKED] Fact Check: Lunch Date Video Does NOT Show Real Woman Confronted By Her Husband For Cheating -- It's Staged Scene | Lead Stories,https://leadstories.com/hoax-alert/2026/03/fact-check-lunch-date-video-does-not-show-real-woman-confronted-by-her-husband-for-cheating.html,leadstories.com,Fact Check: Lunch Date Video Does NOT Show Real Woman Confronted By Her Husband For Cheating -- It's,0.9,HIGH,True,FALSE - Debunked by fact-checkers,leadstories.com,factcheck,2026-03-30T19:03:27.916938
[DEBUNKED] Fact Check: Video Does NOT Show Iranian Missiles Destroying U.S. Navy Warship In Strait Of Hormuz | Lead Stories,https://leadstories.com/hoax-alert/2026/03/fact-check-video-does-not-show-iranian-missiles-destroying-us-navy-warship-in-strait-of-hormuz.html,leadstories.com,Fact Check: Video Does NOT Show Iranian Missiles Destroying U.S. Navy Warship In Strait Of Hormuz | ,0.9,HIGH,True,FALSE - Debunked by fact-checkers,leadstories.com,factcheck,2026-03-30T19:03:28.090099
[DEBUNKED] The FCC chair is openly cheering the weakening of the press - Poynter,https://www.poynter.org/commentary/2026/brendan-carr-mission-accomplished-press-war/,www.poynter.org,The FCC chair is openly cheering the weakening of the press - Poynter,0.9,HIGH,True,FALSE - Debunked by fact-checkers,www.poynter.org,factcheck,2026-03-30T19:03:28.173845
[DEBUNKED] Savannah Guthrie opens up about mother’s disappearance in heart-wrenching interview - Poynter,https://www.poynter.org/commentary/2026/savannah-guthrie-today-show-interview-hoda/,www.poynter.org,Savannah Guthrie opens up about mother’s disappearance in heart-wrenching interview - Poynter,0.9,HIGH,True,FALSE - Debunked by fact-checkers,www.poynter.org,factcheck,2026-03-30T19:03:28.545714
"(AP Photo/Julie Jacobson) By: Amaris Castillo March 26, 2026 --> --> About a quarter of all AM/FM radio stations in the United States have a faith focus, and 98% of U",https://www.poynter.org/reporting-editing/2026/christian-news-radio-united-states/,www.poynter.org,"A quarter of US radio stations are religious, and most listeners aren’t tuning in for politics, stud",0,LOW,False,,,factcheck,2026-03-30T19:03:28.943911
"Among listeners, 62% of those surveyed said they tune in because the content is “spiritually uplifting",https://www.poynter.org/reporting-editing/2026/christian-news-radio-united-states/,www.poynter.org,"A quarter of US radio stations are religious, and most listeners aren’t tuning in for politics, stud",0,LOW,False,,,factcheck,2026-03-30T19:03:29.085775
"Forty percent said those topics are a minor reason for listening to these stations, and just 14% called it a major one",https://www.poynter.org/reporting-editing/2026/christian-news-radio-united-states/,www.poynter.org,"A quarter of US radio stations are religious, and most listeners aren’t tuning in for politics, stud",0.1,LOW,False,,,factcheck,2026-03-30T19:03:29.153637
[DEBUNKED] IFCN Director Angie Drobnic Holan comments on Meta and community notes following the Oversight Board’s recent advisory - Poynter,https://www.poynter.org/ifcn/2026/ifcn-director-angie-drobnic-holan-comments-on-meta-and-community-notes-following-the-oversight-boards-recent-advisory/,www.poynter.org,IFCN Director Angie Drobnic Holan comments on Meta and community notes following the Oversight Board,0.9,HIGH,True,FALSE - Debunked by fact-checkers,www.poynter.org,factcheck,2026-03-30T19:03:29.483893
"Meta is responsible for 70% of that, while YouTube is responsible for the other 30%",https://www.poynter.org/commentary/2026/meta-and-youtube-lawsuit-social-media-addiction/,www.poynter.org,Big Tech just lost a ‘social media addiction’ case. It may not be the last. - Poynter,0,LOW,False,,,factcheck,2026-03-30T19:03:29.725646
"(Courtesy: Spencer Najera) By: Alex Mahadevan March 26, 2026 --> --> Of the 440 applications Texas Tribune chief product officer Darla Cameron received for an AI engineering role, 90% were junk",https://www.poynter.org/tech-tools/2026/how-to-start-using-ai-journalism/,www.poynter.org,AI advice from journalists who stopped talking and started building - Poynter,0,LOW,False,,,factcheck,2026-03-30T19:03:29.910371
"At the Pew Research Center, audience editor Claire Dannenbaum noticed her team was spending 95% of its time writing formulaic social media posts and only 5% actually engaging with audiences",https://www.poynter.org/tech-tools/2026/how-to-start-using-ai-journalism/,www.poynter.org,AI advice from journalists who stopped talking and started building - Poynter,0,LOW,False,,,factcheck,2026-03-30T19:03:29.971875
"[DEBUNKED] Who is keeping the war with Iran going? Trump, once again, blames the media. - Poynter",https://www.poynter.org/commentary/2026/trump-blames-media-war-iran/,www.poynter.org,"Who is keeping the war with Iran going? Trump, once again, blames the media. - Poynter",0.9,HIGH,True,FALSE - Debunked by fact-checkers,www.poynter.org,factcheck,2026-03-30T19:03:30.070889
"Zum Login SPIEGEL plus Nur für Neukunden € 1,– für 4 Wochen danach € 5,99 pro Woche Freier Zugriff auf alle S+-Artikel auf SPIEGEL",https://www.spiegel.de/ausland/cpac-konferenz-in-texas-wie-der-iran-kkrieg-die-maga-bewegung-spaltet-a-f290f2c0-72bd-4015-9683-ac61cc9421fe#ref=rss,www.spiegel.de,CPAC-Konferenz in Texas: Wie der Iran-Kkrieg die MAGA-Bewegung spaltet - DER SPIEGEL,0.1,LOW,False,,,mainstream,2026-03-30T19:03:41.176774
"E-Paper (PDF), Digital-Archiv und S+-Newsletter Jederzeit kündigen Jetzt abonnieren SPIEGEL plus 52 Wochen 25 % sparen € 4,49 pro Woche für 52 Wochen danach € 5,99 pro Woche Freier Zugriff auf alle S+-Artikel auf SPIEGEL",https://www.spiegel.de/ausland/cpac-konferenz-in-texas-wie-der-iran-kkrieg-die-maga-bewegung-spaltet-a-f290f2c0-72bd-4015-9683-ac61cc9421fe#ref=rss,www.spiegel.de,CPAC-Konferenz in Texas: Wie der Iran-Kkrieg die MAGA-Bewegung spaltet - DER SPIEGEL,0.1,LOW,False,,,mainstream,2026-03-30T19:03:41.242469
"Zum Login SPIEGEL plus Nur für Neukunden € 1,– für 4 Wochen danach € 5,99 pro Woche Freier Zugriff auf alle S+-Artikel auf SPIEGEL",https://www.spiegel.de/wissenschaft/buckelwal-in-der-ostsee-warum-der-hype-um-timmy-dem-artenschutz-wenig-nuetzt-a-4b8eb271-649f-4029-b047-58079a237a83#ref=rss,www.spiegel.de,Buckelwal in der Ostsee: Warum der Hype um »Timmy« dem Artenschutz wenig nützt - DER SPIEGEL,0.1,LOW,False,,,mainstream,2026-03-30T19:03:43.787511
"E-Paper (PDF), Digital-Archiv und S+-Newsletter Jederzeit kündigen Jetzt abonnieren SPIEGEL plus 52 Wochen 25 % sparen € 4,49 pro Woche für 52 Wochen danach € 5,99 pro Woche Freier Zugriff auf alle S+-Artikel auf SPIEGEL",https://www.spiegel.de/wissenschaft/buckelwal-in-der-ostsee-warum-der-hype-um-timmy-dem-artenschutz-wenig-nuetzt-a-4b8eb271-649f-4029-b047-58079a237a83#ref=rss,www.spiegel.de,Buckelwal in der Ostsee: Warum der Hype um »Timmy« dem Artenschutz wenig nützt - DER SPIEGEL,0.1,LOW,False,,,mainstream,2026-03-30T19:03:43.854472
"Der Vizepräsident versprach, eine offizielle Untersuchung einzuleiten sowie Sicherheitsvorkehrungen an Bergbaustandorten und Handelszentren zu verbessern",https://www.spiegel.de/ausland/suedsudan-bewaffnete-toeten-73-menschen-in-goldmine-a-7b16c618-d063-4e60-aa48-10d7c825bb4d#ref=rss,www.spiegel.de,Südsudan: Bewaffnete töten 73 Menschen in Goldmine - DER SPIEGEL,0,LOW,False,,,mainstream,2026-03-30T19:03:44.730551
In den vergangenen Monaten hat sich die Situation im Land immer weiter verschlechtert,https://www.spiegel.de/ausland/suedsudan-bewaffnete-toeten-73-menschen-in-goldmine-a-7b16c618-d063-4e60-aa48-10d7c825bb4d#ref=rss,www.spiegel.de,Südsudan: Bewaffnete töten 73 Menschen in Goldmine - DER SPIEGEL,0.1,LOW,False,,,mainstream,2026-03-30T19:03:44.800306
Der Mann soll nach offiziellen Angaben schon bald an Deutschland ausgeliefert werden,https://www.spiegel.de/panorama/justiz/ibiza-vorwurf-des-millionenbetrugs-deutscher-vor-auslieferung-a-65d8657e-54f3-4dbd-b1a0-cf188b2fa7e2#ref=rss,www.spiegel.de,Ibiza: Vorwurf des Millionenbetrugs – Deutscher vor Auslieferung - DER SPIEGEL,0,LOW,False,,,mainstream,2026-03-30T19:03:45.554979
"Zum Login SPIEGEL plus Nur für Neukunden € 1,– für 4 Wochen danach € 5,99 pro Woche Freier Zugriff auf alle S+-Artikel auf SPIEGEL",https://www.spiegel.de/panorama/justiz/collien-fernandes-spanisches-gericht-widerspricht-den-anwaelten-von-christian-ulmen-a-61f3f685-c70d-41a3-831d-cb7fbf24706f#ref=rss,www.spiegel.de,Collien Fernandes: Spanisches Gericht widerspricht den Anwälten von Christian Ulmen - DER SPIEGEL,0.1,LOW,False,,,mainstream,2026-03-30T19:03:46.452674
"E-Paper (PDF), Digital-Archiv und S+-Newsletter Jederzeit kündigen Jetzt abonnieren SPIEGEL plus 52 Wochen 25 % sparen € 4,49 pro Woche für 52 Wochen danach € 5,99 pro Woche Freier Zugriff auf alle S+-Artikel auf SPIEGEL",https://www.spiegel.de/panorama/justiz/collien-fernandes-spanisches-gericht-widerspricht-den-anwaelten-von-christian-ulmen-a-61f3f685-c70d-41a3-831d-cb7fbf24706f#ref=rss,www.spiegel.de,Collien Fernandes: Spanisches Gericht widerspricht den Anwälten von Christian Ulmen - DER SPIEGEL,0.1,LOW,False,,,mainstream,2026-03-30T19:03:46.515639
"Zum Login SPIEGEL plus Nur für Neukunden € 1,– für 4 Wochen danach € 5,99 pro Woche Freier Zugriff auf alle S+-Artikel auf SPIEGEL",https://www.spiegel.de/wirtschaft/krankenversicherung-wieder-bezahlbar-machen-die-vorschlaege-der-reformkommission-a-85e7b770-1c79-45c3-8ce5-eda321cb08b9#ref=rss,www.spiegel.de,Krankenversicherung wieder bezahlbar machen - die Vorschläge der Reformkommission - DER SPIEGEL,0.1,LOW,False,,,mainstream,2026-03-30T19:03:47.289977
"E-Paper (PDF), Digital-Archiv und S+-Newsletter Jederzeit kündigen Jetzt abonnieren SPIEGEL plus 52 Wochen 25 % sparen € 4,49 pro Woche für 52 Wochen danach € 5,99 pro Woche Freier Zugriff auf alle S+-Artikel auf SPIEGEL",https://www.spiegel.de/wirtschaft/krankenversicherung-wieder-bezahlbar-machen-die-vorschlaege-der-reformkommission-a-85e7b770-1c79-45c3-8ce5-eda321cb08b9#ref=rss,www.spiegel.de,Krankenversicherung wieder bezahlbar machen - die Vorschläge der Reformkommission - DER SPIEGEL,0.1,LOW,False,,,mainstream,2026-03-30T19:03:47.355590
"length - 1, 500, false)"" data-area=""nav-bar"" data-app-hidden x-lazyload> Menü Startseite Politik Deutschland Friedrich Merz Friedrich Merz empfängt Ahmed al-Sharaa: Heimkehr von 80 Prozent der Syrer - geht das",https://www.spiegel.de/politik/deutschland/friedrich-merz-empfaengt-ahmed-al-sharaa-heimkehr-von-80-prozent-der-syrer-geht-das-a-64a59282-df20-4352-885e-c4caa28f7e48#ref=rss,www.spiegel.de,Friedrich Merz empfängt Ahmed al-Sharaa: Heimkehr von 80 Prozent der Syrer - geht das? - DER SPIEGEL,0,LOW,False,,,mainstream,2026-03-30T19:03:48.136933
"Zum Login SPIEGEL plus Nur für Neukunden € 1,– für 4 Wochen danach € 5,99 pro Woche Freier Zugriff auf alle S+-Artikel auf SPIEGEL",https://www.spiegel.de/politik/deutschland/friedrich-merz-empfaengt-ahmed-al-sharaa-heimkehr-von-80-prozent-der-syrer-geht-das-a-64a59282-df20-4352-885e-c4caa28f7e48#ref=rss,www.spiegel.de,Friedrich Merz empfängt Ahmed al-Sharaa: Heimkehr von 80 Prozent der Syrer - geht das? - DER SPIEGEL,0.1,LOW,False,,,mainstream,2026-03-30T19:03:48.197896
"E-Paper (PDF), Digital-Archiv und S+-Newsletter Jederzeit kündigen Jetzt abonnieren SPIEGEL plus 52 Wochen 25 % sparen € 4,49 pro Woche für 52 Wochen danach € 5,99 pro Woche Freier Zugriff auf alle S+-Artikel auf SPIEGEL",https://www.spiegel.de/politik/deutschland/friedrich-merz-empfaengt-ahmed-al-sharaa-heimkehr-von-80-prozent-der-syrer-geht-das-a-64a59282-df20-4352-885e-c4caa28f7e48#ref=rss,www.spiegel.de,Friedrich Merz empfängt Ahmed al-Sharaa: Heimkehr von 80 Prozent der Syrer - geht das? - DER SPIEGEL,0.1,LOW,False,,,mainstream,2026-03-30T19:03:48.283336
"Angeklagter bezeichnete sich offenbar als »das Monster«Laut der Anklageschrift soll der Mann gedroht haben, seine Frau zu töten, Benzin über sie zu schütten, sie zu verbrennen und ihr die Finger abzuschneiden",https://www.spiegel.de/panorama/schweden-mann-soll-ehefrau-zum-sex-mit-mindestens-120-maennern-gezwungen-haben-a-d9c5f142-d9df-4f1a-84e6-5ea0dbe071bd#ref=rss,www.spiegel.de,Schweden: Mann soll Ehefrau zum Sex mit mindestens 120 Männern gezwungen haben - DER SPIEGEL,0,LOW,False,,,mainstream,2026-03-30T19:03:49.527405
"Der 41 Jahre alte US-Amerikaner gewann die Houston Open nach vier starken Runden mit fünf Schlägen Vorsprung vor dem Dänen Nicolai Hojgaard und kassierte ein Preisgeld von rund 1,78 Millionen US-Dollar (umgerechnet 1,55 Millionen Euro)",https://www.spiegel.de/sport/golf/golf-profi-gary-woodland-gewinnt-erstes-turnier-nach-gehirnoperation-a-2831bc4d-43c3-49eb-abd3-7ffb8ab0f821#ref=rss,www.spiegel.de,Golf-Profi Gary Woodland gewinnt erstes Turnier nach Gehirnoperation - DER SPIEGEL,0,LOW,False,,,mainstream,2026-03-30T19:03:50.310203
"000 Euro, wie die Zeitung »Ouest France« berichtet&nbsp;",https://www.spiegel.de/ausland/russische-schattenflotte-kapitaen-von-voruebergehend-festgesetztem-tanker-zu-haft-verurteilt-a-53cfef69-7f53-463c-b6f5-efd8c33379dd#ref=rss,www.spiegel.de,Russische Schattenflotte: Kapitän von vorübergehend festgesetztem Tanker zu Haft verurteilt - DER SP,0,LOW,False,,,mainstream,2026-03-30T19:03:51.071565
"Dem Kapitän – laut Nachrichtenagentur AFP 39 Jahre alt – wurde vorgeworfen, französische Anweisungen nicht befolgt zu haben, als französische Seestreitkräfte den Tanker Ende September vor der bretonischen Küste aufbrachten",https://www.spiegel.de/ausland/russische-schattenflotte-kapitaen-von-voruebergehend-festgesetztem-tanker-zu-haft-verurteilt-a-53cfef69-7f53-463c-b6f5-efd8c33379dd#ref=rss,www.spiegel.de,Russische Schattenflotte: Kapitän von vorübergehend festgesetztem Tanker zu Haft verurteilt - DER SP,0,LOW,False,,,mainstream,2026-03-30T19:03:51.130826
Der Tanker steht auf der EU-Sanktionsliste und wird laut Staatsanwaltschaft der russischen Schattenflotte zugerechnet,https://www.spiegel.de/ausland/russische-schattenflotte-kapitaen-von-voruebergehend-festgesetztem-tanker-zu-haft-verurteilt-a-53cfef69-7f53-463c-b6f5-efd8c33379dd#ref=rss,www.spiegel.de,Russische Schattenflotte: Kapitän von vorübergehend festgesetztem Tanker zu Haft verurteilt - DER SP,0,LOW,False,,,mainstream,2026-03-30T19:03:51.189038
"com Facebook E-Mail Messenger WhatsApp Link kopieren image""> Bild vergrößern Jugendclub Wutzkyallee in Berlin: »Nie in den Sinn gekommen, Täter zu schützen« Foto: Jens Kalaene / dpa Sie können den Artikel leider nicht mehr aufrufen",https://www.spiegel.de/panorama/berlin-neukoelln-mutmassliche-vergewaltigung-jugendamtmitarbeiterin-widerspricht-vertuschungsvorwurf-a-8ddd56ec-1f92-45b8-8591-4e920ea82df6#ref=rss,www.spiegel.de,Berlin-Neukölln: Mutmaßliche Vergewaltigung - Jugendamtmitarbeiterin widerspricht Vertuschungsvorwur,0.1,LOW,False,,,mainstream,2026-03-30T19:03:51.943855
"Zum Login SPIEGEL plus Nur für Neukunden € 1,– für 4 Wochen danach € 5,99 pro Woche Freier Zugriff auf alle S+-Artikel auf SPIEGEL",https://www.spiegel.de/panorama/berlin-neukoelln-mutmassliche-vergewaltigung-jugendamtmitarbeiterin-widerspricht-vertuschungsvorwurf-a-8ddd56ec-1f92-45b8-8591-4e920ea82df6#ref=rss,www.spiegel.de,Berlin-Neukölln: Mutmaßliche Vergewaltigung - Jugendamtmitarbeiterin widerspricht Vertuschungsvorwur,0.1,LOW,False,,,mainstream,2026-03-30T19:03:52.010918
"E-Paper (PDF), Digital-Archiv und S+-Newsletter Jederzeit kündigen Jetzt abonnieren SPIEGEL plus 52 Wochen 25 % sparen € 4,49 pro Woche für 52 Wochen danach € 5,99 pro Woche Freier Zugriff auf alle S+-Artikel auf SPIEGEL",https://www.spiegel.de/panorama/berlin-neukoelln-mutmassliche-vergewaltigung-jugendamtmitarbeiterin-widerspricht-vertuschungsvorwurf-a-8ddd56ec-1f92-45b8-8591-4e920ea82df6#ref=rss,www.spiegel.de,Berlin-Neukölln: Mutmaßliche Vergewaltigung - Jugendamtmitarbeiterin widerspricht Vertuschungsvorwur,0.1,LOW,False,,,mainstream,2026-03-30T19:03:52.068695
"Sepideh Moafi, 40, aber hat darauf keine Lust",https://www.spiegel.de/kultur/tv/sepideh-moafi-warum-die-schauspielerin-ihren-namen-nicht-aendern-will-a-9d6cf2cc-58a9-46b4-a334-9a5cc49702f1#ref=rss,www.spiegel.de,Sepideh Moafi: Warum die Schauspielerin ihren Namen nicht ändern will - DER SPIEGEL,0.1,LOW,False,,,mainstream,2026-03-30T19:03:52.825275
positiv bewerten negativ bewerten Bei schweren Unwettern in Afghanistan und Pakistan sind nach offiziellen Angaben mindestens 45 Menschen ums Leben gekommen,https://www.spiegel.de/ausland/pakistan-und-afghanistan-dutzende-tote-nach-ueberschwemmungen-a-fad4f350-3dd1-428d-be97-0f20fb9de778#ref=rss,www.spiegel.de,Pakistan und Afghanistan: Dutzende Tote nach Überschwemmungen - DER SPIEGEL,0,LOW,False,,,mainstream,2026-03-30T19:03:53.605440
"Auf der anderen Seite der Grenze, in der pakistanischen Provinz Khyber Pakhtunkhwa, wurden laut der dortigen Katastrophenschutzbehörde seit Mittwoch 17 Menschen getötet und 56 weitere verletzt",https://www.spiegel.de/ausland/pakistan-und-afghanistan-dutzende-tote-nach-ueberschwemmungen-a-fad4f350-3dd1-428d-be97-0f20fb9de778#ref=rss,www.spiegel.de,Pakistan und Afghanistan: Dutzende Tote nach Überschwemmungen - DER SPIEGEL,0,LOW,False,,,mainstream,2026-03-30T19:03:53.673111
In der afghanischen Provinz Daikundi starb nach Angaben der Katastrophenschutzbehörde ein fünfjähriges Kind beim Einsturz eines Daches,https://www.spiegel.de/ausland/pakistan-und-afghanistan-dutzende-tote-nach-ueberschwemmungen-a-fad4f350-3dd1-428d-be97-0f20fb9de778#ref=rss,www.spiegel.de,Pakistan und Afghanistan: Dutzende Tote nach Überschwemmungen - DER SPIEGEL,0,LOW,False,,,mainstream,2026-03-30T19:03:53.747640
"China and India remain the largest buyers of Russian crude oil, though, accounting for 85% of its exports in February, according to the Centre for Research on Energy and Clean Air (CREA)",https://www.bbc.com/news/articles/c0e7lrxrelwo?at_medium=RSS&amp;at_campaign=rss,www.bbc.com,Zelensky says allies asked him to scale back attacks on Russian energy,0,LOW,False,,,mainstream,2026-03-30T19:03:54.702442
"Meanwhile, the EU is the largest buyer of Russian gas (34%) and LNG (49%)",https://www.bbc.com/news/articles/c0e7lrxrelwo?at_medium=RSS&amp;at_campaign=rss,www.bbc.com,Zelensky says allies asked him to scale back attacks on Russian energy,0,LOW,False,,,mainstream,2026-03-30T19:03:54.765692
Zelensky told journalists on Saturday that Ukraine&#x27;s attacks on the Ust-Luga oil terminal earlier this week had knocked out 60% of the port&#x27;s capacity,https://www.bbc.com/news/articles/c0e7lrxrelwo?at_medium=RSS&amp;at_campaign=rss,www.bbc.com,Zelensky says allies asked him to scale back attacks on Russian energy,0,LOW,False,,,mainstream,2026-03-30T19:03:54.838180
Around 90% of Iran&#x27;s oil exports pass through Kharg,https://www.bbc.com/news/articles/c937gd1vq7xo?at_medium=RSS&amp;at_campaign=rss,www.bbc.com,Kharg Island: How the US could seize Iran&#x27;s key oil terminal,0,LOW,False,,,mainstream,2026-03-30T19:03:55.011901
The war in Iran and the effective closure of the Strait of Hormuz - through which around 20% of the world&#x27;s oil and natural gas flows - has seen fuel costs rise sharply in the past month,https://www.bbc.com/news/articles/cjr9yr73xyeo?at_medium=RSS&amp;at_campaign=rss,www.bbc.com,Fuel rations and free buses: How countries are responding to rising oil prices,0,LOW,False,,,mainstream,2026-03-30T19:03:55.127118
