claim,source_url,source_domain,article_title,risk_score,risk_category,has_factcheck,factcheck_rating,factcheck_source,source_type,checked_at
[DEBUNKED] False claims Laura Kuenssberg clashed with Rupert Lowe on air shared online – Full Fact,https://fullfact.org/politics/kuenssberg-lowe-bbc-sunday-interview-fake/,fullfact.org,False claims Laura Kuenssberg clashed with Rupert Lowe on air shared online – Full Fact,0.9,HIGH,True,FALSE - Debunked by fact-checkers,fullfact.org,factcheck,2026-05-06T03:22:01.818215
[DEBUNKED] Fake BBC News report about stolen Cézanne painting appearing in Zelenskyy video circulates online – Full Fact,https://fullfact.org/culture-and-society/fake-bbc-news-report-stolen-cezanne-painting-zelenskyy/,fullfact.org,Fake BBC News report about stolen Cézanne painting appearing in Zelenskyy video circulates online – ,0.9,HIGH,True,FALSE - Debunked by fact-checkers,fullfact.org,factcheck,2026-05-06T03:22:02.207059
[DEBUNKED] Video of voters on the street is AI-generated – Full Fact,https://fullfact.org/politics/fake-reform-voters-street/,fullfact.org,Video of voters on the street is AI-generated – Full Fact,0.9,HIGH,True,FALSE - Debunked by fact-checkers,fullfact.org,factcheck,2026-05-06T03:22:02.626053
[DEBUNKED] Facebook ads offer fake Toby Carvery giveaway – Full Fact,https://fullfact.org/shopping/toby-carvery-facebook-ads/,fullfact.org,Facebook ads offer fake Toby Carvery giveaway – Full Fact,0.9,HIGH,True,FALSE - Debunked by fact-checkers,fullfact.org,factcheck,2026-05-06T03:22:02.934664
[DEBUNKED] Project 2025 Series Wins National Headliner Award - FactCheck.org,https://www.factcheck.org/2026/04/project-2025-series-wins-national-headliner-award/,www.factcheck.org,Project 2025 Series Wins National Headliner Award - FactCheck.org,0.9,HIGH,True,FALSE - Debunked by fact-checkers,www.factcheck.org,factcheck,2026-05-06T03:22:03.660822
[DEBUNKED] The Persistent Misleading Claim That Vaccines Aren’t Properly Tested for Safety - FactCheck.org,https://www.factcheck.org/2026/04/the-persistent-misleading-claim-that-vaccines-arent-properly-tested-for-safety/,www.factcheck.org,The Persistent Misleading Claim That Vaccines Aren’t Properly Tested for Safety - FactCheck.org,0.9,HIGH,True,FALSE - Debunked by fact-checkers,www.factcheck.org,factcheck,2026-05-06T03:22:03.755145
"border with Mexico decreased about 92%, and refugee admissions dropped by the same percentage",https://www.factcheck.org/2026/04/trumps-numbers-april-2026-update/,www.factcheck.org,"Trump&#039;s Numbers, April 2026 Update - FactCheck.org",0,LOW,False,,,factcheck,2026-05-06T03:22:03.904718
The trade deficit dropped 14% for the most recent 12 months,https://www.factcheck.org/2026/04/trumps-numbers-april-2026-update/,www.factcheck.org,"Trump&#039;s Numbers, April 2026 Update - FactCheck.org",0,LOW,False,,,factcheck,2026-05-06T03:22:03.993604
"7%, and oil imports declined almost 6",https://www.factcheck.org/2026/04/trumps-numbers-april-2026-update/,www.factcheck.org,"Trump&#039;s Numbers, April 2026 Update - FactCheck.org",0,LOW,False,,,factcheck,2026-05-06T03:22:04.086747
[DEBUNKED] Fact Check: Image Does NOT Show Real Bus Turned Into Mobile Grocery Store In Denmark | Lead Stories,https://leadstories.com/hoax-alert/2026/05/fact-check-image-does-not-show-real-bus-turned-into-mobile-grocery-store-in-denmark.html,leadstories.com,Fact Check: Image Does NOT Show Real Bus Turned Into Mobile Grocery Store In Denmark | Lead Stories,0.9,HIGH,True,FALSE - Debunked by fact-checkers,leadstories.com,factcheck,2026-05-06T03:22:04.684807
"[DEBUNKED] Fact Check: OLD Video Of Russian Submarine Arriving In Havana, Cuba Is From 2024 -- Not 2026 | Lead Stories",https://leadstories.com/hoax-alert/2026/05/fact-check-old-video-of-russian-submarine-arriving-in-havana-cuba-is-from-2024-not-2026.html,leadstories.com,"Fact Check: OLD Video Of Russian Submarine Arriving In Havana, Cuba Is From 2024 -- Not 2026 | Lead ",0.9,HIGH,True,FALSE - Debunked by fact-checkers,leadstories.com,factcheck,2026-05-06T03:22:04.821623
[DEBUNKED] Fact Check: U.S. Did NOT Have Election With 133 Million Registered Voters And 159 Million Votes Cast -- Official Figures Say Otherwise | Lead Stories,https://leadstories.com/hoax-alert/2026/05/fact-check-us-did-not-have-election-with-133-million-registered-voters-and-159-million-votes-cast.html,leadstories.com,Fact Check: U.S. Did NOT Have Election With 133 Million Registered Voters And 159 Million Votes Cast,0.9,HIGH,True,FALSE - Debunked by fact-checkers,leadstories.com,factcheck,2026-05-06T03:22:04.960145
[DEBUNKED] Fact Check: Video Does NOT Show Travis Kelce At 2026 Met Gala -- He Wasn't Even There | Lead Stories,https://leadstories.com/hoax-alert/2026/05/fact-check-video-does-not-show-travis-kelce-at-2026-met-gala.html,leadstories.com,Fact Check: Video Does NOT Show Travis Kelce At 2026 Met Gala -- He Wasn't Even There | Lead Stories,0.9,HIGH,True,FALSE - Debunked by fact-checkers,leadstories.com,factcheck,2026-05-06T03:22:05.101917
[DEBUNKED] Fact Check: Fake Video Shows Person Rescuing A Submerged Wolf That Was Trapped Under Ice -- AI-Generated  | Lead Stories,https://leadstories.com/hoax-alert/2026/05/fact-check-fake-video-shows-person-rescuing-a-submerged-wolf-that-was-trapped-under-ice.html,leadstories.com,Fact Check: Fake Video Shows Person Rescuing A Submerged Wolf That Was Trapped Under Ice -- AI-Gener,0.9,HIGH,True,FALSE - Debunked by fact-checkers,leadstories.com,factcheck,2026-05-06T03:22:05.261125
[DEBUNKED] Fact Check: Posts Saying Your Favorite Celeb Returns With A Deeply Personal 'Back To The Heart' Documentary Project Are NOT Real -- Spam From Vietnam | Lead Stories,https://leadstories.com/hoax-alert/2026/05/fact-check-post-saying-your-fav-celeb-returns-with-back-the-heart-project-not-real.html,leadstories.com,Fact Check: Posts Saying Your Favorite Celeb Returns With A Deeply Personal 'Back To The Heart' Docu,0.9,HIGH,True,FALSE - Debunked by fact-checkers,leadstories.com,factcheck,2026-05-06T03:22:05.400632
[DEBUNKED] Fact Check: Trump Did NOT Repost Crucifixion Image Depicting Himself As Jesus Christ | Lead Stories,https://leadstories.com/hoax-alert/2026/05/fact-check-trump-did-not-repost-crucifixion-image-depicting-himself-as-jesus-christ.html,leadstories.com,Fact Check: Trump Did NOT Repost Crucifixion Image Depicting Himself As Jesus Christ | Lead Stories,0.9,HIGH,True,FALSE - Debunked by fact-checkers,leadstories.com,factcheck,2026-05-06T03:22:05.540715
[DEBUNKED] Fact Check: Bruce Springsteen's Summer Tour Was NOT Canceled Over His Politics And Lack Of Ticket Sales | Lead Stories,https://leadstories.com/hoax-alert/2026/05/fact-check-bruce-springsteen-summer-tour-was-not-canceled-over-politics-lack-ticket-sales.html,leadstories.com,Fact Check: Bruce Springsteen's Summer Tour Was NOT Canceled Over His Politics And Lack Of Ticket Sa,0.9,HIGH,True,FALSE - Debunked by fact-checkers,leadstories.com,factcheck,2026-05-06T03:22:05.780306
[DEBUNKED] Fact Check: Trump Did NOT Encourage People To 'Drive Downhill' Due To High Gas Prices | Lead Stories,https://leadstories.com/hoax-alert/2026/05/fact-check-trump-did-not-encourage-people-to-drive-downhil-due-to-high-gas-prices.html,leadstories.com,Fact Check: Trump Did NOT Encourage People To 'Drive Downhill' Due To High Gas Prices | Lead Stories,0.9,HIGH,True,FALSE - Debunked by fact-checkers,leadstories.com,factcheck,2026-05-06T03:22:05.939773
"[DEBUNKED] Fact Check: Senator Elizabeth Warren Did NOT Sell 20,000 Shares Of Spirit Airlines Stock ""Two Weeks Ago"" -- Liberal Trolling From Satire Page | Lead Stories",https://leadstories.com/hoax-alert/2026/05/fact-check-senator-elizabeth-warren-did-not-sell-20000-shares-of-spirit-airline-stock-two-weeks-ago.html,leadstories.com,"Fact Check: Senator Elizabeth Warren Did NOT Sell 20,000 Shares Of Spirit Airlines Stock ""Two Weeks ",0.9,HIGH,True,FALSE - Debunked by fact-checkers,leadstories.com,factcheck,2026-05-06T03:22:06.089718
[DEBUNKED] Fact Check: OLD Video Of U.S. Ship Hit By Missiles Is From 2016 Target Practice On Retired Frigate -- Not Enemy Action | Lead Stories,https://leadstories.com/hoax-alert/2026/05/fact-check-old-video-of-us-ship-hit-by-missiles-is-from-2016-target-practice-on-retired-frigate-not-enemy-action.html,leadstories.com,Fact Check: OLD Video Of U.S. Ship Hit By Missiles Is From 2016 Target Practice On Retired Frigate -,0.9,HIGH,True,FALSE - Debunked by fact-checkers,leadstories.com,factcheck,2026-05-06T03:22:06.228314
[DEBUNKED] Fact Check: Trump DID Post Uno Meme Saying 'I Have All The Cards' -- A Losing Hand In That Game | Lead Stories,https://leadstories.com/hoax-alert/2026/05/fact-check-trump-uno-i-have-all-the-cards.html,leadstories.com,Fact Check: Trump DID Post Uno Meme Saying 'I Have All The Cards' -- A Losing Hand In That Game | Le,0.9,HIGH,True,FALSE - Debunked by fact-checkers,leadstories.com,factcheck,2026-05-06T03:22:06.366013
[DEBUNKED] Fact Check: Posts Saying You Can Stand Where Three States Meet Use FAKE Photos -- Spam From Bangladesh | Lead Stories,https://leadstories.com/hoax-alert/2026/05/fact-check-posts-saying+you+can-stand-where-three-states-meet-use-fake-photos.html,leadstories.com,Fact Check: Posts Saying You Can Stand Where Three States Meet Use FAKE Photos -- Spam From Banglade,0.9,HIGH,True,FALSE - Debunked by fact-checkers,leadstories.com,factcheck,2026-05-06T03:22:06.539538
[DEBUNKED] Fact Check: Fake AI-Generated Video Shows Erika Kirk Breathing Heavily Into The Microphone | Lead Stories,https://leadstories.com/hoax-alert/2026/05/fact-check-fake-ai-generated-video-shows-erika-kirk-breathing-heavily-into-the-microphone.html,leadstories.com,Fact Check: Fake AI-Generated Video Shows Erika Kirk Breathing Heavily Into The Microphone | Lead St,0.9,HIGH,True,FALSE - Debunked by fact-checkers,leadstories.com,factcheck,2026-05-06T03:22:06.676129
[DEBUNKED] Fact Check: Donald Trump Did NOT Post An Image Of Himself Helping Lady Liberty Give Birth To A Mini-Trump Wrapped In An American Flag | Lead Stories,https://leadstories.com/hoax-alert/2026/05/fact-check-donald-trump-did-not-post-image-helping-lady-liberty-give-brth-mini-trump-american-flag.html,leadstories.com,Fact Check: Donald Trump Did NOT Post An Image Of Himself Helping Lady Liberty Give Birth To A Mini-,0.9,HIGH,True,FALSE - Debunked by fact-checkers,leadstories.com,factcheck,2026-05-06T03:22:06.821285
"Diese Entscheidung sei in Abstimmung mit der Weltgesundheitsorganisation (WHO) und der EU gemäß internationalem Recht und humanitären Prinzipien getroffen worden, teilte das Gesundheitsministerium in Madrid mit",https://www.spiegel.de/wissenschaft/hantavirus-auf-der-mv-hondius-kreuzfahrtschiff-mit-erkrankten-passagieren-darf-nach-spanien-a-9628e68b-055c-4609-9d63-fe98f067d09b#ref=rss,www.spiegel.de,Hantavirus auf der »MV Hondius«: Kreuzfahrtschiff mit erkrankten Passagieren darf nach Spanien - DER,0,LOW,False,,,mainstream,2026-05-06T03:22:17.578466
"Damit ist nun vorerst Schluss, verkündet Präsident Trump",https://www.spiegel.de/ausland/iran-krieg-donald-trump-setzt-militaer-einsatz-fuer-sichere-hormus-durchfahrt-aus-a-09110b24-5de9-4643-9a3d-c701250ab14f#ref=rss,www.spiegel.de,Iran-Krieg: Donald Trump setzt Militär-Einsatz für sichere Hormus-Durchfahrt aus - DER SPIEGEL,0,LOW,False,,,mainstream,2026-05-06T03:22:19.397977
Die Aussetzung von »Projekt Freiheit« erfolgt laut Trump auf Bitten Pakistans und anderer Länder sowie den »enormen militärischen Erfolgen« der USA,https://www.spiegel.de/ausland/iran-krieg-donald-trump-setzt-militaer-einsatz-fuer-sichere-hormus-durchfahrt-aus-a-09110b24-5de9-4643-9a3d-c701250ab14f#ref=rss,www.spiegel.de,Iran-Krieg: Donald Trump setzt Militär-Einsatz für sichere Hormus-Durchfahrt aus - DER SPIEGEL,0,LOW,False,,,mainstream,2026-05-06T03:22:19.449521
"Bei einem Treffen im Jahr 2017 habe Musk die Führung von OpenAI beansprucht und argumentiert, er benötige 80 Milliarden Dollar für den Aufbau einer Stadt auf dem Mars, sagte Brockman (mehr zu den US-Träumen von Mars-Kolonien hier&nbsp;)",https://www.spiegel.de/netzwelt/elon-musk-wollte-mit-openai-offenbar-mars-besiedlung-finanzieren-aussage-von-greg-brockman-a-142af569-0e7f-4992-8ee8-08b46ffce4ec#ref=rss,www.spiegel.de,Elon Musk wollte mit OpenAI offenbar Mars-Besiedlung finanzieren - Aussage von Greg Brockman - DER S,0.1,LOW,False,,,mainstream,2026-05-06T03:22:20.613052
Musk fordert deswegen in dem Verfahren auch 150 Milliarden Dollar Schadensers,https://www.spiegel.de/netzwelt/elon-musk-wollte-mit-openai-offenbar-mars-besiedlung-finanzieren-aussage-von-greg-brockman-a-142af569-0e7f-4992-8ee8-08b46ffce4ec#ref=rss,www.spiegel.de,Elon Musk wollte mit OpenAI offenbar Mars-Besiedlung finanzieren - Aussage von Greg Brockman - DER S,0,LOW,False,,,mainstream,2026-05-06T03:22:20.705782
"Zum Login SPIEGEL plus Nur für Neukunden € 1,– für 4 Wochen danach € 5,99 pro Woche Freier Zugriff auf alle S+-Artikel auf SPIEGEL",https://www.spiegel.de/sport/fussball/champions-league-fc-arsenal-setzt-sich-gegen-atletico-madrid-durch-und-steht-im-finale-a-bd2c558b-461f-4513-b25d-ebd823770673#ref=rss,www.spiegel.de,Champions League: FC Arsenal setzt sich gegen Atlético Madrid durch und steht im Finale - DER SPIEGE,0.1,LOW,False,,,mainstream,2026-05-06T03:22:22.711664
"E-Paper (PDF), Digital-Archiv und S+-Newsletter Jederzeit kündigen Jetzt abonnieren SPIEGEL plus 52 Wochen 25 % sparen € 4,49 pro Woche für 52 Wochen danach € 5,99 pro Woche Freier Zugriff auf alle S+-Artikel auf SPIEGEL",https://www.spiegel.de/sport/fussball/champions-league-fc-arsenal-setzt-sich-gegen-atletico-madrid-durch-und-steht-im-finale-a-bd2c558b-461f-4513-b25d-ebd823770673#ref=rss,www.spiegel.de,Champions League: FC Arsenal setzt sich gegen Atlético Madrid durch und steht im Finale - DER SPIEGE,0.1,LOW,False,,,mainstream,2026-05-06T03:22:22.802850
"Dann legt er mit Kritik am Koalitionspartner nach – und wirft der SPD vor, immer noch vom »demokratischen Sozialismus« zu träumen",https://www.spiegel.de/politik/friedrich-merz-cdu-warnung-vor-spd-traeumereien-und-versprechen-von-wandel-a-c38930bf-8a9a-4253-830d-04b556827422#ref=rss,www.spiegel.de,Friedrich Merz (CDU): Warnung vor SPD-»Träumereien« und Versprechen von Wandel - DER SPIEGEL,0.1,LOW,False,,,mainstream,2026-05-06T03:22:23.496445
»Ich sage hier sehr klar und deutlich: Eine Minderheitsregierung ist für mich keine Option,https://www.spiegel.de/politik/friedrich-merz-cdu-warnung-vor-spd-traeumereien-und-versprechen-von-wandel-a-c38930bf-8a9a-4253-830d-04b556827422#ref=rss,www.spiegel.de,Friedrich Merz (CDU): Warnung vor SPD-»Träumereien« und Versprechen von Wandel - DER SPIEGEL,0.1,LOW,False,,,mainstream,2026-05-06T03:22:23.589117
"Zum Login SPIEGEL plus Nur für Neukunden € 1,– für 4 Wochen danach € 5,99 pro Woche Freier Zugriff auf alle S+-Artikel auf SPIEGEL",https://www.spiegel.de/kultur/biennale-von-venedig-wenn-kriegsnationen-und-pornografie-aufeinandertreffen-a-8b976883-4231-4ffa-80f9-08808e761229#ref=rss,www.spiegel.de,Biennale von Venedig: Wenn Kriegsnationen und Pornografie aufeinandertreffen - DER SPIEGEL,0.1,LOW,False,,,mainstream,2026-05-06T03:22:24.264726
"E-Paper (PDF), Digital-Archiv und S+-Newsletter Jederzeit kündigen Jetzt abonnieren SPIEGEL plus 52 Wochen 25 % sparen € 4,49 pro Woche für 52 Wochen danach € 5,99 pro Woche Freier Zugriff auf alle S+-Artikel auf SPIEGEL",https://www.spiegel.de/kultur/biennale-von-venedig-wenn-kriegsnationen-und-pornografie-aufeinandertreffen-a-8b976883-4231-4ffa-80f9-08808e761229#ref=rss,www.spiegel.de,Biennale von Venedig: Wenn Kriegsnationen und Pornografie aufeinandertreffen - DER SPIEGEL,0.1,LOW,False,,,mainstream,2026-05-06T03:22:24.357241
"Zum Login SPIEGEL plus Nur für Neukunden € 1,– für 4 Wochen danach € 5,99 pro Woche Freier Zugriff auf alle S+-Artikel auf SPIEGEL",https://www.spiegel.de/panorama/amokfahrt-in-leipzig-boxtrainer-fussballfan-psychisch-auffaellig-wer-ist-jeffrey-k-a-d4925e35-63fa-4295-a297-bd076a839dce#ref=rss,www.spiegel.de,"Amokfahrt in Leipzig: Boxtrainer, Fußballfan, psychisch auffällig - wer ist Jeffrey K.? - DER SPIEGE",0.1,LOW,False,,,mainstream,2026-05-06T03:22:25.031375
"E-Paper (PDF), Digital-Archiv und S+-Newsletter Jederzeit kündigen Jetzt abonnieren SPIEGEL plus 52 Wochen 25 % sparen € 4,49 pro Woche für 52 Wochen danach € 5,99 pro Woche Freier Zugriff auf alle S+-Artikel auf SPIEGEL",https://www.spiegel.de/panorama/amokfahrt-in-leipzig-boxtrainer-fussballfan-psychisch-auffaellig-wer-ist-jeffrey-k-a-d4925e35-63fa-4295-a297-bd076a839dce#ref=rss,www.spiegel.de,"Amokfahrt in Leipzig: Boxtrainer, Fußballfan, psychisch auffällig - wer ist Jeffrey K.? - DER SPIEGE",0.1,LOW,False,,,mainstream,2026-05-06T03:22:25.126183
"Zum Login SPIEGEL plus Nur für Neukunden € 1,– für 4 Wochen danach € 5,99 pro Woche Freier Zugriff auf alle S+-Artikel auf SPIEGEL",https://www.spiegel.de/kultur/met-gala-2026-zwischen-grosser-kunst-und-karnevalssitzung-a-ffe04bd2-3292-4e22-a9c5-dd228f9afc2b#ref=rss,www.spiegel.de,Met Gala 2026: Zwischen großer Kunst und Karnevalssitzung - DER SPIEGEL,0.1,LOW,False,,,mainstream,2026-05-06T03:22:25.891358
"E-Paper (PDF), Digital-Archiv und S+-Newsletter Jederzeit kündigen Jetzt abonnieren SPIEGEL plus 52 Wochen 25 % sparen € 4,49 pro Woche für 52 Wochen danach € 5,99 pro Woche Freier Zugriff auf alle S+-Artikel auf SPIEGEL",https://www.spiegel.de/kultur/met-gala-2026-zwischen-grosser-kunst-und-karnevalssitzung-a-ffe04bd2-3292-4e22-a9c5-dd228f9afc2b#ref=rss,www.spiegel.de,Met Gala 2026: Zwischen großer Kunst und Karnevalssitzung - DER SPIEGEL,0.1,LOW,False,,,mainstream,2026-05-06T03:22:25.984078
"Zum Login SPIEGEL plus Nur für Neukunden € 1,– für 4 Wochen danach € 5,99 pro Woche Freier Zugriff auf alle S+-Artikel auf SPIEGEL",https://www.spiegel.de/kultur/achtsamkeit-podcasterin-kathrin-fischer-rechnet-mit-dem-hype-ab-a-66d3eb4c-931c-4119-8162-fdb48a24f3b0#ref=rss,www.spiegel.de,Achtsamkeit: Podcasterin Kathrin Fischer rechnet mit dem Hype ab - DER SPIEGEL,0.1,LOW,False,,,mainstream,2026-05-06T03:22:26.659206
"E-Paper (PDF), Digital-Archiv und S+-Newsletter Jederzeit kündigen Jetzt abonnieren SPIEGEL plus 52 Wochen 25 % sparen € 4,49 pro Woche für 52 Wochen danach € 5,99 pro Woche Freier Zugriff auf alle S+-Artikel auf SPIEGEL",https://www.spiegel.de/kultur/achtsamkeit-podcasterin-kathrin-fischer-rechnet-mit-dem-hype-ab-a-66d3eb4c-931c-4119-8162-fdb48a24f3b0#ref=rss,www.spiegel.de,Achtsamkeit: Podcasterin Kathrin Fischer rechnet mit dem Hype ab - DER SPIEGEL,0.1,LOW,False,,,mainstream,2026-05-06T03:22:26.747857
"Immer wieder konnte Bezos mit seiner Jacht nicht in Häfen einlaufen, weil es schlicht nicht genug Platz gab",https://www.spiegel.de/panorama/leute/jeff-bezos-ist-seine-500-millionen-dollar-luxusjacht-zu-gross-a-df3b7f3a-7dbd-4343-b838-f507d2960792#ref=rss,www.spiegel.de,Jeff Bezos ist seine 500-Millionen-Dollar-Luxusjacht zu groß - DER SPIEGEL,0.1,LOW,False,,,mainstream,2026-05-06T03:22:27.422816
Umgerechnet fast 430 Millionen Euro kostete den Milliardär der Bau seiner Luxusjacht,https://www.spiegel.de/panorama/leute/jeff-bezos-ist-seine-500-millionen-dollar-luxusjacht-zu-gross-a-df3b7f3a-7dbd-4343-b838-f507d2960792#ref=rss,www.spiegel.de,Jeff Bezos ist seine 500-Millionen-Dollar-Luxusjacht zu groß - DER SPIEGEL,0,LOW,False,,,mainstream,2026-05-06T03:22:27.515902
Berichten zufolge soll der Betrieb beider Schiffe im Jahr knapp 26 Millionen Euro kosten,https://www.spiegel.de/panorama/leute/jeff-bezos-ist-seine-500-millionen-dollar-luxusjacht-zu-gross-a-df3b7f3a-7dbd-4343-b838-f507d2960792#ref=rss,www.spiegel.de,Jeff Bezos ist seine 500-Millionen-Dollar-Luxusjacht zu groß - DER SPIEGEL,0,LOW,False,,,mainstream,2026-05-06T03:22:27.604779
In der ‌Frontstadt Kramatorsk starben nach Angaben von Selenskyj fünf Menschen,https://www.spiegel.de/ausland/russland-ukraine-krieg-kyjiw-meldet-kurz-vor-angekuendigter-feuerpause-mehr-als-20-tote-a-fac07646-3620-4634-8df6-7efeb96249cb#ref=rss,www.spiegel.de,Russland-Ukraine-Krieg: Kyjiw meldet kurz vor angekündigter Feuerpause mehr als 20 Tote - DER SPIEGE,0,LOW,False,,,mainstream,2026-05-06T03:22:28.697705
Mehr zum Thema Kurz vor angekündigter Feuerpause: Ukraine meldet sechs Tote und Dutzende Verletzte nach russischen Angriffen Krieg gegen die Ukraine: Russland verkündet Waffenruhe für 8,https://www.spiegel.de/ausland/russland-ukraine-krieg-kyjiw-meldet-kurz-vor-angekuendigter-feuerpause-mehr-als-20-tote-a-fac07646-3620-4634-8df6-7efeb96249cb#ref=rss,www.spiegel.de,Russland-Ukraine-Krieg: Kyjiw meldet kurz vor angekündigter Feuerpause mehr als 20 Tote - DER SPIEGE,0,LOW,False,,,mainstream,2026-05-06T03:22:28.791176
Von Oliver Imhof Auch Kyjiw griff vor Beginn der verkündeten Waffe,https://www.spiegel.de/ausland/russland-ukraine-krieg-kyjiw-meldet-kurz-vor-angekuendigter-feuerpause-mehr-als-20-tote-a-fac07646-3620-4634-8df6-7efeb96249cb#ref=rss,www.spiegel.de,Russland-Ukraine-Krieg: Kyjiw meldet kurz vor angekündigter Feuerpause mehr als 20 Tote - DER SPIEGE,0,LOW,False,,,mainstream,2026-05-06T03:22:28.886180
"&quot;If I thought there was even a 1% chance that someone from Hezbollah lived here, I wouldn&#x27;t have stayed,&quot; he says",https://www.bbc.com/news/articles/c202652vvnjo?at_medium=RSS&amp;at_campaign=rss,www.bbc.com,How 10 minutes of bombing by Israel tore through Lebanon,0,LOW,False,,,mainstream,2026-05-06T03:22:30.312943
