claim,source_url,source_domain,article_title,risk_score,risk_category,has_factcheck,factcheck_rating,factcheck_source,source_type,checked_at
[DEBUNKED] Inspecting fictional claim ICE agents arrested Black federal judge Nadine Ashford | Snopes.com,https://www.snopes.com/fact-check/black-judge-ashford-ice-arrest/,www.snopes.com,Inspecting fictional claim ICE agents arrested Black federal judge Nadine Ashford | Snopes.com,0.9,HIGH,True,FALSE - Debunked by fact-checkers,www.snopes.com,factcheck,2026-02-19T02:25:49.030827
[DEBUNKED] Breaking down claim DOJ released unredacted Epstein files to other countries | Snopes.com,https://www.snopes.com/news/2026/02/17/epstein-files-other-countries/,www.snopes.com,Breaking down claim DOJ released unredacted Epstein files to other countries | Snopes.com,0.9,HIGH,True,FALSE - Debunked by fact-checkers,www.snopes.com,factcheck,2026-02-19T02:25:49.448172
[DEBUNKED] PolitiFact | Epstein files did not ‘expose’ Ellen DeGeneres as a cannibal; claim stems from AI-generated audio,http://www.politifact.com/factchecks/2026/feb/16/social-media/epstein-files-ellen-degeneres-cannibal/,www.politifact.com,PolitiFact | Epstein files did not ‘expose’ Ellen DeGeneres as a cannibal; claim stems from AI-gener,0.9,HIGH,True,FALSE - Debunked by fact-checkers,www.politifact.com,factcheck,2026-02-19T02:25:49.789163
"More Info I would like to contribute One Time Monthly Yearly Join Now Donald Trump stated on February 8, 2026 in an interview on NBC: Crime in Minneapolis “is down 25, 30% because we’ve removed thousands of criminals from the area",http://www.politifact.com/factchecks/2026/feb/13/donald-trump/Minneapolis-Minnesota-immigration-crime-drop/,www.politifact.com,PolitiFact | Trump credits immigration enforcement for Minneapolis crime drop. That’s wrong.,0,LOW,False,,,factcheck,2026-02-19T02:25:50.203618
"""The crime numbers in Minnesota, in Minneapolis in particular, are down 25, 30% because we’ve removed thousands of criminals from the area,"" Trump said",http://www.politifact.com/factchecks/2026/feb/13/donald-trump/Minneapolis-Minnesota-immigration-crime-drop/,www.politifact.com,PolitiFact | Trump credits immigration enforcement for Minneapolis crime drop. That’s wrong.,0,LOW,False,,,factcheck,2026-02-19T02:25:50.314281
"The vaccine isn’t 100% effective, but breakthrough infections among vaccinated people are rare and usually milder than what an unvaccinated person would experience",http://www.politifact.com/article/2026/feb/13/chickenpox-shingles-vaccines-FAQ/,www.politifact.com,PolitiFact | Can the chickenpox vaccine cause shingles? We answer questions about the infections and,0.1,LOW,False,,,factcheck,2026-02-19T02:25:50.511909
"More Info I would like to contribute One Time Monthly Yearly Join Now Tom O&#x27;Mara stated on January 20, 2026 in an op-ed: “New Yorkers pay 49% more than the national average for electricity",http://www.politifact.com/factchecks/2026/feb/13/tom-omara/new-york-electricity-rates-utilities/,www.politifact.com,PolitiFact | How much more do New Yorkers pay for electricity than the average US consumer?,0,LOW,False,,,factcheck,2026-02-19T02:25:50.709564
"In the column, O’Mara said such efforts are important because ""New Yorkers pay 49% more than the national average for electricity",http://www.politifact.com/factchecks/2026/feb/13/tom-omara/new-york-electricity-rates-utilities/,www.politifact.com,PolitiFact | How much more do New Yorkers pay for electricity than the average US consumer?,0,LOW,False,,,factcheck,2026-02-19T02:25:50.821474
"78 cents per kilowatt hour, so New York state’s rate was exactly 49% higher than the national average",http://www.politifact.com/factchecks/2026/feb/13/tom-omara/new-york-electricity-rates-utilities/,www.politifact.com,PolitiFact | How much more do New Yorkers pay for electricity than the average US consumer?,0,LOW,False,,,factcheck,2026-02-19T02:25:50.930228
[DEBUNKED] PolitiFact | Did Cooper prison settlement release suspect in fatal Charlotte stabbing?,http://www.politifact.com/article/2026/feb/09/did-cooper-prison-settlement-release-suspect-in-fa/,www.politifact.com,PolitiFact | Did Cooper prison settlement release suspect in fatal Charlotte stabbing?,0.9,HIGH,True,FALSE - Debunked by fact-checkers,www.politifact.com,factcheck,2026-02-19T02:25:51.298984
[DEBUNKED] Pictures showing Nigel Farage in hospital recovering from surgery are fake – Full Fact,https://fullfact.org/politics/nigel-farage-hospital-surgery-pictures-fake-ai/,fullfact.org,Pictures showing Nigel Farage in hospital recovering from surgery are fake – Full Fact,0.9,HIGH,True,FALSE - Debunked by fact-checkers,fullfact.org,factcheck,2026-02-19T02:25:52.260615
"[DEBUNKED] No, Keir Starmer was not ‘dragged out’ of the House of Commons following a clash with Nigel Farage – Full Fact",https://fullfact.org/politics/keir-starmer-commons-fake/,fullfact.org,"No, Keir Starmer was not ‘dragged out’ of the House of Commons following a clash with Nigel Farage –",0.9,HIGH,True,FALSE - Debunked by fact-checkers,fullfact.org,factcheck,2026-02-19T02:25:52.622398
[DEBUNKED] Trump and Musk Amplify Long-Ago Debunked Mail-In Vote Fraud Claim - FactCheck.org,https://www.factcheck.org/2026/02/trump-and-musk-amplify-long-ago-debunked-mail-in-vote-fraud-claim/,www.factcheck.org,Trump and Musk Amplify Long-Ago Debunked Mail-In Vote Fraud Claim - FactCheck.org,0.9,HIGH,True,FALSE - Debunked by fact-checkers,www.factcheck.org,factcheck,2026-02-19T02:25:55.645725
"6% in the first quarter of 2025, which covers the three months from January to March, real gross domestic product (meaning it has been adjusted for inflation) grew at an annualized rate of 3",https://www.factcheck.org/2026/02/trump-oversells-recent-u-s-economic-growth/,www.factcheck.org,Trump Oversells Recent U.S. Economic Growth - FactCheck.org,0,LOW,False,,,factcheck,2026-02-19T02:25:55.870865
8% in the second quarter of 2025 and at a rate of 4,https://www.factcheck.org/2026/02/trump-oversells-recent-u-s-economic-growth/,www.factcheck.org,Trump Oversells Recent U.S. Economic Growth - FactCheck.org,0,LOW,False,,,factcheck,2026-02-19T02:25:55.979047
"[DEBUNKED] WHO Didn’t Recommend Lockdowns, Contrary to Health Officials&#039; Suggestions - FactCheck.org",https://www.factcheck.org/2026/02/who-didnt-recommend-lockdowns-contrary-to-health-officials-suggestions/,www.factcheck.org,"WHO Didn’t Recommend Lockdowns, Contrary to Health Officials&#039; Suggestions - FactCheck.org",0.9,HIGH,True,FALSE - Debunked by fact-checkers,www.factcheck.org,factcheck,2026-02-19T02:25:56.090917
"Yet, Trump has repeatedly boasted that “factory construction” is up 41%",https://www.factcheck.org/2026/02/manufacturing-construction-spending-declines-under-trump/,www.factcheck.org,Manufacturing Construction Spending Declines Under Trump - FactCheck.org,0,LOW,False,,,factcheck,2026-02-19T02:25:56.300247
Trump cited the 41% statistic in a White House press conference on Jan,https://www.factcheck.org/2026/02/manufacturing-construction-spending-declines-under-trump/,www.factcheck.org,Manufacturing Construction Spending Declines Under Trump - FactCheck.org,0,LOW,False,,,factcheck,2026-02-19T02:25:56.410687
”&nbsp; “Investment in American factories is up 41%,https://www.factcheck.org/2026/02/manufacturing-construction-spending-declines-under-trump/,www.factcheck.org,Manufacturing Construction Spending Declines Under Trump - FactCheck.org,0,LOW,False,,,factcheck,2026-02-19T02:25:56.525044
"[DEBUNKED] Americans Don&#039;t Need &#039;Dramatically&#039; More Protein, Despite Officials’ Claims - FactCheck.org",https://www.factcheck.org/2026/02/americans-dont-need-dramatically-more-protein-despite-officials-claims/,www.factcheck.org,"Americans Don&#039;t Need &#039;Dramatically&#039; More Protein, Despite Officials’ Claims - FactChe",0.9,HIGH,True,FALSE - Debunked by fact-checkers,www.factcheck.org,factcheck,2026-02-19T02:25:56.882628
9% from the same period in 2024,https://www.factcheck.org/2026/02/trumps-selective-comparison-overstates-trade-deficit-decline/,www.factcheck.org,Trump&#039;s Selective Comparison Overstates Trade Deficit Decline - FactCheck.org,0,LOW,False,,,factcheck,2026-02-19T02:25:57.184819
His claim that he has &#8220;slashed our trade deficit by 77%&#8221; appears to compare the monthly trade deficit in January 2025 to the deficit nine months later in October,https://www.factcheck.org/2026/02/trumps-selective-comparison-overstates-trade-deficit-decline/,www.factcheck.org,Trump&#039;s Selective Comparison Overstates Trade Deficit Decline - FactCheck.org,0,LOW,False,,,factcheck,2026-02-19T02:25:57.300701
"&#8220;We had the largest trade deficit in world history&#8221; under former President Joe Biden, &#8220;but in one year I&#8217;ve slashed our gaping trade deficit by a staggering 77%,” Trump said in Jan",https://www.factcheck.org/2026/02/trumps-selective-comparison-overstates-trade-deficit-decline/,www.factcheck.org,Trump&#039;s Selective Comparison Overstates Trade Deficit Decline - FactCheck.org,0,LOW,False,,,factcheck,2026-02-19T02:25:57.436061
[DEBUNKED] Fact Check: Swift and Kelce Did NOT Announce On Livestream They Are Spending $250 Million To Uncover Truth In Giuffre Case -- Foreign Clickbait | Lead Stories,https://leadstories.com/hoax-alert/2026/02/fact-check-kelce-swift-did-not-announce-250-million-spend-for-truth-in-giuffre-case.html,leadstories.com,Fact Check: Swift and Kelce Did NOT Announce On Livestream They Are Spending $250 Million To Uncover,0.9,HIGH,True,FALSE - Debunked by fact-checkers,leadstories.com,factcheck,2026-02-19T02:25:57.639373
[DEBUNKED] Fact Check: Video Does NOT Show President Trump Kissing Nicki Minaj | Lead Stories,https://leadstories.com/hoax-alert/2026/02/fact-check-video-does-not-show-president-trump-kissing-nicki-minaj.html,leadstories.com,Fact Check: Video Does NOT Show President Trump Kissing Nicki Minaj | Lead Stories,0.9,HIGH,True,FALSE - Debunked by fact-checkers,leadstories.com,factcheck,2026-02-19T02:25:57.840445
"[DEBUNKED] Fact Check: There's NO Proof LifeTouch School Photos Put ""You And Every Other American Kid ... In The Epstein Files"" -- Mathematically Impossible, Since LifeTouch Only Accounts For 25% Of School Photos | Lead Stories",https://leadstories.com/hoax-alert/2026/02/fact-check-no-proof-every-american-kid-in-epstein-files-through-lifetouch-school-photos.html,leadstories.com,"Fact Check: There's NO Proof LifeTouch School Photos Put ""You And Every Other American Kid ... In Th",0.9,HIGH,True,FALSE - Debunked by fact-checkers,leadstories.com,factcheck,2026-02-19T02:25:58.034926
[DEBUNKED] Fact Check: Elon Musk DID Tweet 'I Agree With The Teachings Of Jesus' | Lead Stories,https://leadstories.com/hoax-alert/2026/02/fact-check-elon-musk-did-tweet-i-agree-with-the-teachings-of-jesus.html,leadstories.com,Fact Check: Elon Musk DID Tweet 'I Agree With The Teachings Of Jesus' | Lead Stories,0.9,HIGH,True,FALSE - Debunked by fact-checkers,leadstories.com,factcheck,2026-02-19T02:25:58.261563
[DEBUNKED] Fact Check: NO TMZ Story About Zelensky Buying Diddy's Mansion For $61 Million -- Nothing On Their Site | Lead Stories,https://leadstories.com/hoax-alert/2026/02/fact-check-tmz-did-not-report-zelenskyy-bought-diddy-mansion.html,leadstories.com,Fact Check: NO TMZ Story About Zelensky Buying Diddy's Mansion For $61 Million -- Nothing On Their S,0.9,HIGH,True,FALSE - Debunked by fact-checkers,leadstories.com,factcheck,2026-02-19T02:25:58.470005
"[DEBUNKED] Fact Check: Thitikul, De Niro, Hanks, Penrod Did NOT Say 'Don't Touch My Family Or My Country' To Karoline Leavitt Or Whoopi Goldberg -- It's Vietspam | Lead Stories",https://leadstories.com/hoax-alert/2026/02/fact-check-thitikul-and-dozens-of-other-celebs-did-not-say-dont-touch-my-family-or-country.html,leadstories.com,"Fact Check: Thitikul, De Niro, Hanks, Penrod Did NOT Say 'Don't Touch My Family Or My Country' To Ka",0.9,HIGH,True,FALSE - Debunked by fact-checkers,leadstories.com,factcheck,2026-02-19T02:25:58.686796
[DEBUNKED] Fact Check: Rep. Ted Lieu Did NOT Say Unreleased Epstein Files Show Donald Trump Raping Children -- He Referenced 'Allegations' | Lead Stories,https://leadstories.com/hoax-alert/2026/02/fact-check-ted-lieu-did-not-say-epstein-files-show-trump-raping-children.html,leadstories.com,Fact Check: Rep. Ted Lieu Did NOT Say Unreleased Epstein Files Show Donald Trump Raping Children -- ,0.9,HIGH,True,FALSE - Debunked by fact-checkers,leadstories.com,factcheck,2026-02-19T02:25:58.890669
"[DEBUNKED] Fact Check: Video Does NOT Show The ""Strange Behavior Of A Woman"" At The White House | Lead Stories",https://leadstories.com/hoax-alert/2026/02/fact-check-on-twitter-video-does-not-show-woman-strange-behavior-at-white-house.html,leadstories.com,"Fact Check: Video Does NOT Show The ""Strange Behavior Of A Woman"" At The White House | Lead Stories",0.9,HIGH,True,FALSE - Debunked by fact-checkers,leadstories.com,factcheck,2026-02-19T02:25:59.101954
[DEBUNKED] Fact Check: Fake Video Of Firefighter Rescuing A Mother Dog And Pups From Burning Building Is One Of Many AI Versions | Lead Stories,https://leadstories.com/hoax-alert/2026/02/fact-check-fake-video-showing-firefighter-rescuing-mother-dog-and-puppies-from-burning-building.html,leadstories.com,Fact Check: Fake Video Of Firefighter Rescuing A Mother Dog And Pups From Burning Building Is One Of,0.9,HIGH,True,FALSE - Debunked by fact-checkers,leadstories.com,factcheck,2026-02-19T02:25:59.322023
[DEBUNKED] Fact Check: Image Does NOT Show Pam Bondi At 14 With Donald Trump At An Epstein Party -- It's Old AI | Lead Stories,https://leadstories.com/hoax-alert/2026/02/fact-check-image-does-not-show-pam-bondi-at-14-with-trump.html,leadstories.com,Fact Check: Image Does NOT Show Pam Bondi At 14 With Donald Trump At An Epstein Party -- It's Old AI,0.9,HIGH,True,FALSE - Debunked by fact-checkers,leadstories.com,factcheck,2026-02-19T02:25:59.542067
[DEBUNKED] Fact Check: Rep. Randy Fine DID Say On X That 'The Choice Between Dogs And Muslims Is Not A Difficult One' | Lead Stories,https://leadstories.com/hoax-alert/2026/02/fact-check-congressman-randy-fine-did-say-on-X-that-choice-between-dogs-and-muslims-is-not-a-difficult-one.html,leadstories.com,Fact Check: Rep. Randy Fine DID Say On X That 'The Choice Between Dogs And Muslims Is Not A Difficul,0.9,HIGH,True,FALSE - Debunked by fact-checkers,leadstories.com,factcheck,2026-02-19T02:25:59.764183
[DEBUNKED] Fact Check: CNN Did NOT Report ICE Agent Who Shot Alex Pretti Found 'NOT-GUILTY' | Lead Stories,https://leadstories.com/hoax-alert/2026/02/fact-check-cnn-did-not-report-ice-agent-who-show-alex-pretti-found-not-guilty.html,leadstories.com,Fact Check: CNN Did NOT Report ICE Agent Who Shot Alex Pretti Found 'NOT-GUILTY' | Lead Stories,0.9,HIGH,True,FALSE - Debunked by fact-checkers,leadstories.com,factcheck,2026-02-19T02:25:59.998159
[DEBUNKED] Fact Check: Fake Video Shows Ground Crew Struggling Near A Jet Engine To Retrieve A Piece Of Metal That Has Almost Been Sucked In | Lead Stories,https://leadstories.com/hoax-alert/2026/02/fact-check-fake-video-ground-crew-struggles-with-metal-sucked-into-jet-engine.html,leadstories.com,Fact Check: Fake Video Shows Ground Crew Struggling Near A Jet Engine To Retrieve A Piece Of Metal T,0.9,HIGH,True,FALSE - Debunked by fact-checkers,leadstories.com,factcheck,2026-02-19T02:26:00.214869
"[DEBUNKED] Fact Check: DJ Vlad 'Confession' Saying Jay-Z and Roc Nation Paid Judges, Jury, Witnesses, Police To Convict Tory Lanez In Megan Thee Stallion Shooting IS Satirical Trolling -- Read The Last Line | Lead Stories",https://leadstories.com/hoax-alert/2026/02/fact-check-djvlad-roc-mafia-jayz-paid-jury-to-convict-tory-satire.html,leadstories.com,"Fact Check: DJ Vlad 'Confession' Saying Jay-Z and Roc Nation Paid Judges, Jury, Witnesses, Police To",0.9,HIGH,True,FALSE - Debunked by fact-checkers,leadstories.com,factcheck,2026-02-19T02:26:00.479094
[DEBUNKED] Fact Check: Various People Did NOT Introduce Bill To Block George Soros Funding Protests By Deeming It Organized Crime Under RICO Act | Lead Stories,https://leadstories.com/hoax-alert/2026/02/fact-check-bill-block-soros-funding-protests-organized-crime-rico-act.html,leadstories.com,Fact Check: Various People Did NOT Introduce Bill To Block George Soros Funding Protests By Deeming ,0.9,HIGH,True,FALSE - Debunked by fact-checkers,leadstories.com,factcheck,2026-02-19T02:26:00.688069
"[DEBUNKED] Long before the podcast boom, Howard Stern built the template for intimate, wide-ranging interviews - Poynter",https://www.poynter.org/reporting-editing/2026/howard-stern-interviewing-influenced-podcasting/,www.poynter.org,"Long before the podcast boom, Howard Stern built the template for intimate, wide-ranging interviews ",0.9,HIGH,True,FALSE - Debunked by fact-checkers,www.poynter.org,factcheck,2026-02-19T02:26:01.400557
[DEBUNKED] Bystander video is driving the biggest stories in America. The next era of journalism will be built on verifying it. - Poynter,https://www.poynter.org/reporting-editing/2026/bystander-surveillance-video-ai-visual-investigations-journalism/,www.poynter.org,Bystander video is driving the biggest stories in America. The next era of journalism will be built ,0.9,HIGH,True,FALSE - Debunked by fact-checkers,www.poynter.org,factcheck,2026-02-19T02:26:02.038952
"Laut dem britischen »Guardian«&nbsp; legte Damnit auch ein Video vor, das eine solche Beschimpfung zeigen soll",https://www.spiegel.de/panorama/justiz/vorwurf-der-homophoben-attacke-gegen-shia-labeouf-doch-der-feiert-weiter-a-d63b3648-33a6-44db-9d49-4247b447c75b#ref=rss,www.spiegel.de,Vorwurf der homophoben Attacke gegen Shia LaBeouf – doch der feiert weiter - DER SPIEGEL,0,LOW,False,,,mainstream,2026-02-19T02:26:12.601084
"Ein weiterer Mann, der ebenfalls angegriffen wurde, bestätigte demnach die Wortwahl",https://www.spiegel.de/panorama/justiz/vorwurf-der-homophoben-attacke-gegen-shia-labeouf-doch-der-feiert-weiter-a-d63b3648-33a6-44db-9d49-4247b447c75b#ref=rss,www.spiegel.de,Vorwurf der homophoben Attacke gegen Shia LaBeouf – doch der feiert weiter - DER SPIEGEL,0,LOW,False,,,mainstream,2026-02-19T02:26:12.711282
« Im offiziellen Polizei-Statement zu dem Fall am Dienstag taucht sie aber nicht mehr auf,https://www.spiegel.de/panorama/justiz/vorwurf-der-homophoben-attacke-gegen-shia-labeouf-doch-der-feiert-weiter-a-d63b3648-33a6-44db-9d49-4247b447c75b#ref=rss,www.spiegel.de,Vorwurf der homophoben Attacke gegen Shia LaBeouf – doch der feiert weiter - DER SPIEGEL,0,LOW,False,,,mainstream,2026-02-19T02:26:12.824695
"positiv bewerten negativ bewerten Die Demokraten im US-Kongress haben Zweifel an Aussagen des Milliardärs Leslie Wexner geäußert, wonach dieser keine Beziehungen zum verurteilten Sexualstraftäter Jeffrey Epstein gepflegt habe",https://www.spiegel.de/ausland/fall-jeffrey-epstein-leslie-wexner-sagt-aus-us-demokraten-zweifeln-an-erklaerung-des-milliardaers-a-6bc419c6-4dca-432a-8d68-91fbeb8abe79#ref=rss,www.spiegel.de,Fall Jeffrey Epstein: Leslie Wexner sagt aus - US-Demokraten zweifeln an Erklärung des Milliardärs -,0.1,LOW,False,,,mainstream,2026-02-19T02:26:13.732654
"»Ich glaube Herrn Wexner nicht, wenn er sagt, er habe keine persönliche oder freundschaftliche Beziehung zu Jeffrey Epstein gehabt«, sagte Robert Garcia, der führende Vertreter des Aufsichtsausschusses",https://www.spiegel.de/ausland/fall-jeffrey-epstein-leslie-wexner-sagt-aus-us-demokraten-zweifeln-an-erklaerung-des-milliardaers-a-6bc419c6-4dca-432a-8d68-91fbeb8abe79#ref=rss,www.spiegel.de,Fall Jeffrey Epstein: Leslie Wexner sagt aus - US-Demokraten zweifeln an Erklärung des Milliardärs -,0.1,LOW,False,,,mainstream,2026-02-19T02:26:13.840988
"Bild vergrößern Berge am Lake Tahoe (undatiertes Archivbild) Foto: Mike Tyler/ AP Nach Angaben von Einsatzleiter Captain Russell Greene berichteten die Überlebenden, jemand habe noch »Lawine",https://www.spiegel.de/panorama/kalifornien-acht-tote-skifahrer-nach-gewaltiger-lawine-bei-lake-tahoe-a-6fad4c8b-abad-4968-addc-0f3cd86085db#ref=rss,www.spiegel.de,Kalifornien: Acht tote Skifahrer nach gewaltiger Lawine bei Lake Tahoe - DER SPIEGEL,0,LOW,False,,,mainstream,2026-02-19T02:26:15.451611
