claim,source_url,source_domain,article_title,risk_score,risk_category,has_factcheck,factcheck_rating,factcheck_source,source_type,checked_at
Susan Collins votes “with Donald Trump 95% of the time,http://www.politifact.com/factchecks/2026/jun/10/graham-platner/Susan-Collins-Trump-vote-Maine-senate-election/,www.politifact.com,"PolitiFact | Yes, Collins usually votes with Trump, as Platner said. But she broke with him at key m",0,LOW,False,,,factcheck,2026-06-16T04:22:09.089945
"Susan Collins, R-Maine, supported President Donald Trump’s position about 95% of the time in 2025, according to CQ Roll Call, a nonpartisan source that analyzes congressional votes",http://www.politifact.com/factchecks/2026/jun/10/graham-platner/Susan-Collins-Trump-vote-Maine-senate-election/,www.politifact.com,"PolitiFact | Yes, Collins usually votes with Trump, as Platner said. But she broke with him at key m",0,LOW,False,,,factcheck,2026-06-16T04:22:09.287738
The same source found that Collins supported Trump about 90% during his first term,http://www.politifact.com/factchecks/2026/jun/10/graham-platner/Susan-Collins-Trump-vote-Maine-senate-election/,www.politifact.com,"PolitiFact | Yes, Collins usually votes with Trump, as Platner said. But she broke with him at key m",0,LOW,False,,,factcheck,2026-06-16T04:22:09.515463
"Google’s Debug project, launched in 2016 to slow mosquito-borne disease spread, estimates 40% of people on Earth are at risk of contracting a disease spread by this species of mosquito, which is invasive outside of Africa",http://www.politifact.com/article/2026/jun/10/sterilizing-insects-screwworms-mosquitoes-disease/,www.politifact.com,PolitiFact | Sometimes fighting dangerous pests like screwworms and mosquitoes means sterilizing bug,0,LOW,False,,,factcheck,2026-06-16T04:22:09.811626
[DEBUNKED] PolitiFact | Trump said the pace of California ballot counting proves a rigged election. Pants on Fire!,http://www.politifact.com/factchecks/2026/jun/08/donald-trump/California-election-LA-governor-Spencer-Pratt/,www.politifact.com,PolitiFact | Trump said the pace of California ballot counting proves a rigged election. Pants on Fi,0.9,HIGH,True,FALSE - Debunked by fact-checkers,www.politifact.com,factcheck,2026-06-16T04:22:09.926407
"[DEBUNKED] PolitiFact | No, Spencer Pratt didn’t get zero votes in a 24,000-vote Los Angeles mayor ballot update",http://www.politifact.com/factchecks/2026/jun/08/tweets/spencer-pratt-ballot-dump-zero-votes-24000/,www.politifact.com,"PolitiFact | No, Spencer Pratt didn’t get zero votes in a 24,000-vote Los Angeles mayor ballot updat",0.9,HIGH,True,FALSE - Debunked by fact-checkers,www.politifact.com,factcheck,2026-06-16T04:22:09.998478
[DEBUNKED] PolitiFact | This video of people screaming as ceiling collapses does not show June earthquake in the Philippines,http://www.politifact.com/factchecks/2026/jun/08/tweets/philippines-earthquake-old-video/,www.politifact.com,PolitiFact | This video of people screaming as ceiling collapses does not show June earthquake in th,0.9,HIGH,True,FALSE - Debunked by fact-checkers,www.politifact.com,factcheck,2026-06-16T04:22:10.084945
[DEBUNKED] PolitiFact | Image of a blue-haired person does not show ‘California voter’ committing fraud; it’s AI-generated,http://www.politifact.com/factchecks/2026/jun/08/social-media/california-voter-stuffing-ballots-AI-image/,www.politifact.com,PolitiFact | Image of a blue-haired person does not show ‘California voter’ committing fraud; it’s A,0.9,HIGH,True,FALSE - Debunked by fact-checkers,www.politifact.com,factcheck,2026-06-16T04:22:10.152371
"[DEBUNKED] Video shows 2020 market fire in UAE, not a recent Iranian attack on Tel Aviv – Full Fact",https://fullfact.org/conflict/video-market-fire-uae-not-iran-attack-tel-aviv/,fullfact.org,"Video shows 2020 market fire in UAE, not a recent Iranian attack on Tel Aviv – Full Fact",0.9,HIGH,True,FALSE - Debunked by fact-checkers,fullfact.org,factcheck,2026-06-16T04:22:10.875089
[DEBUNKED] Footage of police taking wheelie bin is from 2022 – Full Fact,https://fullfact.org/crime/old-video-northern-ireland-shared-southampton-bin/,fullfact.org,Footage of police taking wheelie bin is from 2022 – Full Fact,0.9,HIGH,True,FALSE - Debunked by fact-checkers,fullfact.org,factcheck,2026-06-16T04:22:11.492950
12 June 2026 What was claimed The government has cut net migration by 80%,https://fullfact.org/immigration/makerfield-debate-migration-claims/,fullfact.org,Are the Conservatives or Labour responsible for the fall in net migration? – Full Fact,0,LOW,False,,,factcheck,2026-06-16T04:22:12.667006
"Net migration fell by an estimated 82% between its peak in the year ending March 2023, and the year ending December 2025",https://fullfact.org/immigration/makerfield-debate-migration-claims/,fullfact.org,Are the Conservatives or Labour responsible for the fall in net migration? – Full Fact,0,LOW,False,,,factcheck,2026-06-16T04:22:12.864286
"The fall since the year ending June 2024, just before Labour took office, is 74%, and experts say this may be due to policies enacted under the Conservatives as well as under Labour",https://fullfact.org/immigration/makerfield-debate-migration-claims/,fullfact.org,Are the Conservatives or Labour responsible for the fall in net migration? – Full Fact,0,LOW,False,,,factcheck,2026-06-16T04:22:13.064234
[DEBUNKED] Henry Nowak killer has not been attacked in prison – Full Fact,https://fullfact.org/crime/vickrum-digwa-not-attacked-prison/,fullfact.org,Henry Nowak killer has not been attacked in prison – Full Fact,0.9,HIGH,True,FALSE - Debunked by fact-checkers,fullfact.org,factcheck,2026-06-16T04:22:13.688310
[DEBUNKED] Video of Russian gas explosion falsely claimed to show Belfast unrest – Full Fact,https://fullfact.org/crime/belfast-disorder-fire-video-russia-misleading/,fullfact.org,Video of Russian gas explosion falsely claimed to show Belfast unrest – Full Fact,0.9,HIGH,True,FALSE - Debunked by fact-checkers,fullfact.org,factcheck,2026-06-16T04:22:14.301207
"[DEBUNKED] Video shows Polish Corpus Christi procession, not Henry Nowak tribute – Full Fact",https://fullfact.org/crime/video-corpus-christi-procession-poland-not-henry-nowak-tribute/,fullfact.org,"Video shows Polish Corpus Christi procession, not Henry Nowak tribute – Full Fact",0.9,HIGH,True,FALSE - Debunked by fact-checkers,fullfact.org,factcheck,2026-06-16T04:22:14.919821
[DEBUNKED] Fake image of ‘anti-Reform’ rally in Wigan shared ahead of by-election – Full Fact,https://fullfact.org/politics/fake-ai-image-anti-reform-rally-wigan/,fullfact.org,Fake image of ‘anti-Reform’ rally in Wigan shared ahead of by-election – Full Fact,0.9,HIGH,True,FALSE - Debunked by fact-checkers,fullfact.org,factcheck,2026-06-16T04:22:15.533171
[DEBUNKED] Video of projectiles hurled at PSNI vehicles predates recent violent scenes in Belfast – Full Fact,https://fullfact.org/crime/belfast-disorder-video-old-footage/,fullfact.org,Video of projectiles hurled at PSNI vehicles predates recent violent scenes in Belfast – Full Fact,0.9,HIGH,True,FALSE - Debunked by fact-checkers,fullfact.org,factcheck,2026-06-16T04:22:16.229288
"The 82% figure represents the estimated decrease in net migration, not immigration, from its peak in March 2023, not since Labour took office",https://fullfact.org/immigration/anna-turley-immigration-down-82-percent-under-labour/,fullfact.org,‘Immigration’ has not fallen by 82% under Labour – Full Fact,0,LOW,False,,,factcheck,2026-06-16T04:22:17.097551
Figures for the year to December 2025 show a 37% fall in immigration since Labour took office,https://fullfact.org/immigration/anna-turley-immigration-down-82-percent-under-labour/,fullfact.org,‘Immigration’ has not fallen by 82% under Labour – Full Fact,0,LOW,False,,,factcheck,2026-06-16T04:22:17.296993
"The actual fall in immigration under Labour is much less, and if Ms Turley was citing the 82% figure which has been cited by the Prime Minister and home secretary recently, she was wrong for two reasons",https://fullfact.org/immigration/anna-turley-immigration-down-82-percent-under-labour/,fullfact.org,‘Immigration’ has not fallen by 82% under Labour – Full Fact,0.05,LOW,False,,,factcheck,2026-06-16T04:22:17.516762
"&#8220;We cut the flow of fentanyl across our border by 59%, which is unheard of,&#8221; Trump said in May 22 remarks in New York",https://www.factcheck.org/2026/06/trump-makes-unsupported-claims-about-drug-flows/,www.factcheck.org,Trump Makes Unsupported Claims About Drug Flows - FactCheck.org,0,LOW,False,,,factcheck,2026-06-16T04:22:18.253657
"&#8220;And we cut the flow of fentanyl and drugs into our country by the ocean and the sea, in other words, coming in by water, by ocean and sea by 97%",https://www.factcheck.org/2026/06/trump-makes-unsupported-claims-about-drug-flows/,www.factcheck.org,Trump Makes Unsupported Claims About Drug Flows - FactCheck.org,0,LOW,False,,,factcheck,2026-06-16T04:22:18.461609
"Then, on May 28, in an interview with his daughter-in-law, Lara Trump, on Fox News, he said, &#8220;We have drugs down 97%",https://www.factcheck.org/2026/06/trump-makes-unsupported-claims-about-drug-flows/,www.factcheck.org,Trump Makes Unsupported Claims About Drug Flows - FactCheck.org,0,LOW,False,,,factcheck,2026-06-16T04:22:18.661810
[DEBUNKED] FactChecking Trump&#039;s Contentious &#039;Meet the Press&#039; Interview - FactCheck.org,https://www.factcheck.org/2026/06/factchecking-trumps-contentious-meet-the-press-interview/,www.factcheck.org,FactChecking Trump&#039;s Contentious &#039;Meet the Press&#039; Interview - FactCheck.org,0.9,HIGH,True,FALSE - Debunked by fact-checkers,www.factcheck.org,factcheck,2026-06-16T04:22:18.972231
[DEBUNKED] Trump Misrepresents Climate Change Scenarios - FactCheck.org,https://www.factcheck.org/2026/06/trump-misrepresents-climate-change-scenarios/,www.factcheck.org,Trump Misrepresents Climate Change Scenarios - FactCheck.org,0.9,HIGH,True,FALSE - Debunked by fact-checkers,www.factcheck.org,factcheck,2026-06-16T04:22:19.314335
"[DEBUNKED] Stopping Fraud Won&#039;t &#039;Save&#039; Social Security, Create &#039;Balanced Budget,&#039; as Trump Suggests - FactCheck.org",https://www.factcheck.org/2026/06/stopping-fraud-wont-save-social-security-create-balanced-budget-as-trump-suggests/,www.factcheck.org,"Stopping Fraud Won&#039;t &#039;Save&#039; Social Security, Create &#039;Balanced Budget,&#039; as T",0.9,HIGH,True,FALSE - Debunked by fact-checkers,www.factcheck.org,factcheck,2026-06-16T04:22:19.380162
“The measles vaccine prevents measles in 97% of the people who take it,https://www.factcheck.org/2026/05/a-timeline-of-rfk-jr-s-mixed-messaging-on-the-measles-vaccine/,www.factcheck.org,A Timeline of RFK Jr.&#039;s Mixed Messaging on the Measles Vaccine - FactCheck.org,0,LOW,False,,,factcheck,2026-06-16T04:22:19.660787
[DEBUNKED] Trump Distorts Maryland&#039;s Primary Ballot Mix-up to Attack Mail-in Voting - FactCheck.org,https://www.factcheck.org/2026/05/trump-distorts-marylands-primary-ballot-mix-up-to-attack-mail-in-voting/,www.factcheck.org,Trump Distorts Maryland&#039;s Primary Ballot Mix-up to Attack Mail-in Voting - FactCheck.org,0.9,HIGH,True,FALSE - Debunked by fact-checkers,www.factcheck.org,factcheck,2026-06-16T04:22:19.724960
[DEBUNKED] Fact Check: 675 Ballots For Spencer Pratt Were NOT Found In Dumpster In 'San Recto' -- It's A Fake Community | Lead Stories,https://leadstories.com/hoax-alert/2026/06/fact-check-675-ballots-spencer-pratt-not-found-dumpster-san-recto-fake-community.html,leadstories.com,Fact Check: 675 Ballots For Spencer Pratt Were NOT Found In Dumpster In 'San Recto' -- It's A Fake C,0.9,HIGH,True,FALSE - Debunked by fact-checkers,leadstories.com,factcheck,2026-06-16T04:22:19.904607
[DEBUNKED] Fact Check: Video Does NOT Show US Destroying Iranian Fighter Jet In 'Combat Action' Over Strait of Hormuz | Lead Stories,https://leadstories.com/hoax-alert/2026/06/fact-check-video-does-not-show-us-destroying-iranian-fighter-jet-in-combat-action-over-strait-of-hormuz.html,leadstories.com,Fact Check: Video Does NOT Show US Destroying Iranian Fighter Jet In 'Combat Action' Over Strait of ,0.9,HIGH,True,FALSE - Debunked by fact-checkers,leadstories.com,factcheck,2026-06-16T04:22:20.075541
[DEBUNKED] Fact Check: Folarin Balogun Did NOT Unveil Charlie Kirk Shirt After Scoring For U.S. at The World Cup | Lead Stories,https://leadstories.com/hoax-alert/2026/06/fact-check-folarin-balogun-did-not-unveil-charlie-kirk-shirt-at-world-cup-match.html,leadstories.com,Fact Check: Folarin Balogun Did NOT Unveil Charlie Kirk Shirt After Scoring For U.S. at The World Cu,0.9,HIGH,True,FALSE - Debunked by fact-checkers,leadstories.com,factcheck,2026-06-16T04:22:20.256105
[DEBUNKED] Fact Check: AI-Generated Obama Voiceover Falsely Says He Barred Trump From His Presidential Center After Somali Referee Denied Entry To United States | Lead Stories,https://leadstories.com/hoax-alert/2026/06/fact-check-ai-generated-obama-voiceover-falsely-says-he-barred-trump-from-his-presidential-center-after-somali-referee-denied-entry-to-united-states.html,leadstories.com,Fact Check: AI-Generated Obama Voiceover Falsely Says He Barred Trump From His Presidential Center A,0.9,HIGH,True,FALSE - Debunked by fact-checkers,leadstories.com,factcheck,2026-06-16T04:22:20.436118
[DEBUNKED] Prebunk: AI Videos Of 'Floating Shoes' Sink Under Scrutiny -- A Dry Look At Physically Impossible Footwear | Lead Stories,https://leadstories.com/hoax-alert/2026/06/prebunk-floating-anti-gravity-shoes.html,leadstories.com,Prebunk: AI Videos Of 'Floating Shoes' Sink Under Scrutiny -- A Dry Look At Physically Impossible Fo,0.9,HIGH,True,FALSE - Debunked by fact-checkers,leadstories.com,factcheck,2026-06-16T04:22:20.606123
[DEBUNKED] Fact Check: Trump's Truth Social Account Did NOT Make Post About API Service Being Unavailable -- Fake Post Implies AI Writes His Content | Lead Stories,https://leadstories.com/hoax-alert/2026/06/fact-check-trumps-truth-social-account-did-not-make-post-about-api-service-being-unavailable-claim-implied-his-posts-were-written-by-ai.html,leadstories.com,Fact Check: Trump's Truth Social Account Did NOT Make Post About API Service Being Unavailable -- Fa,0.9,HIGH,True,FALSE - Debunked by fact-checkers,leadstories.com,factcheck,2026-06-16T04:22:20.808735
[DEBUNKED] Fact Check: FAKE Video Of Child Throwing LGBTQ+ Pride Flag In Trash Bin | Lead Stories,https://leadstories.com/hoax-alert/2026/06/fact-check-fake-video-of-child-throwing-lgbtq-plus-flag-in-trash-bin.html,leadstories.com,Fact Check: FAKE Video Of Child Throwing LGBTQ+ Pride Flag In Trash Bin | Lead Stories,0.9,HIGH,True,FALSE - Debunked by fact-checkers,leadstories.com,factcheck,2026-06-16T04:22:20.985995
[DEBUNKED] Fact Check: FAKE Video Of Shakira's FIFA World Cup 2026 Opening Song Performance Is AI   | Lead Stories,https://leadstories.com/hoax-alert/2026/06/fact-check-fake-shakira-fifa-world-cup-2026-opening-song-performance-video-ai.html,leadstories.com,Fact Check: FAKE Video Of Shakira's FIFA World Cup 2026 Opening Song Performance Is AI   | Lead Stor,0.9,HIGH,True,FALSE - Debunked by fact-checkers,leadstories.com,factcheck,2026-06-16T04:22:21.153367
"[DEBUNKED] Fact Check: Video Does NOT Show Chanting, Clapping, And Drumming Protesters In Belfast | Lead Stories",https://leadstories.com/hoax-alert/2026/06/fact-check-video-does-not-show-chanting-protesters-in-belfast.html,leadstories.com,"Fact Check: Video Does NOT Show Chanting, Clapping, And Drumming Protesters In Belfast | Lead Storie",0.9,HIGH,True,FALSE - Debunked by fact-checkers,leadstories.com,factcheck,2026-06-16T04:22:21.346280
[DEBUNKED] Fact Check: FAKE Fox Sports Graphic During Mexico-South Africa World Cup Match Includes Long Explanation That Team Is 'Down To 9 Players' | Lead Stories,https://leadstories.com/hoax-alert/2026/06/fact-check-fake-fox-sports-graphic-mexico-south-africa-world-cup-match-down-to-9-players.html,leadstories.com,Fact Check: FAKE Fox Sports Graphic During Mexico-South Africa World Cup Match Includes Long Explana,0.9,HIGH,True,FALSE - Debunked by fact-checkers,leadstories.com,factcheck,2026-06-16T04:22:21.532420
"[DEBUNKED] Fact Check: Posts MISDATE Scandicci Murder Case Involving Decapitated Woman, North African Suspect | Lead Stories",https://leadstories.com/hoax-alert/2026/06/fact-check-posts-misdate-scandicci-murder-case-involving-decapitated-woman-north-african-suspect.html,leadstories.com,"Fact Check: Posts MISDATE Scandicci Murder Case Involving Decapitated Woman, North African Suspect |",0.9,HIGH,True,FALSE - Debunked by fact-checkers,leadstories.com,factcheck,2026-06-16T04:22:21.722354
[DEBUNKED] Fact Check: EDITED Screenshot Of World Cup Predictions Was Altered To Correct One Score  | Lead Stories,https://leadstories.com/hoax-alert/2026/06/fact-check-edited-screenshot-of-world-cup-predictions-was-altered-to-correct-one-score.html,leadstories.com,Fact Check: EDITED Screenshot Of World Cup Predictions Was Altered To Correct One Score  | Lead Stor,0.9,HIGH,True,FALSE - Debunked by fact-checkers,leadstories.com,factcheck,2026-06-16T04:22:21.909123
[DEBUNKED] Fact Check: FAKE Video Does NOT Show Moment Iran Shot Down U.S. Apache Helicopter In Persian Gulf -- It Is AI-Generated | Lead Stories,https://leadstories.com/hoax-alert/2026/06/fact-check-fake-video-does-not-show-moment-iran-shot-down-us-apache-helicopter-in-persian-gulf.html,leadstories.com,Fact Check: FAKE Video Does NOT Show Moment Iran Shot Down U.S. Apache Helicopter In Persian Gulf --,0.9,HIGH,True,FALSE - Debunked by fact-checkers,leadstories.com,factcheck,2026-06-16T04:22:22.092272
[DEBUNKED] Fact Check: FAKE Video Shows Elaborate Gold Float From Iran At The FIFA World Cup Opening Ceremony -- It Is AI-Generated | Lead Stories,https://leadstories.com/hoax-alert/2026/06/fact-check-fake-video-shows-elaborate-gold-float-from-iran-at-the-fifa-world-cup-opening-ceremony-its-ai.html,leadstories.com,Fact Check: FAKE Video Shows Elaborate Gold Float From Iran At The FIFA World Cup Opening Ceremony -,0.9,HIGH,True,FALSE - Debunked by fact-checkers,leadstories.com,factcheck,2026-06-16T04:22:22.281905
[DEBUNKED] Fact Check: Video From Anonymous 'Irish Citizen Army' Is NOT New In 2026 -- Was Released On Social Media In September 2025  | Lead Stories,https://leadstories.com/hoax-alert/2026/06/fact-check-video-from-irish-citizen-army-is-not-reaction-to-2026-protests-it-originated-in-2025.html,leadstories.com,Fact Check: Video From Anonymous 'Irish Citizen Army' Is NOT New In 2026 -- Was Released On Social M,0.9,HIGH,True,FALSE - Debunked by fact-checkers,leadstories.com,factcheck,2026-06-16T04:22:22.484787
[DEBUNKED] Fake document falsely claims Ugandan president requested citizenship checks on supposed ministerial appointees - Africa Check,https://africacheck.org/fact-checks/meta-programme-fact-checks/fake-document-falsely-claims-ugandan-president-requested,africacheck.org,Fake document falsely claims Ugandan president requested citizenship checks on supposed ministerial ,0.9,HIGH,True,FALSE - Debunked by fact-checkers,africacheck.org,factcheck,2026-06-16T04:22:22.690597
[DEBUNKED] Fabricated quote used to claim Kenya&#039;s finance minister said he will work with everyone except the Kikuyu - Africa Check,https://africacheck.org/fact-checks/meta-programme-fact-checks/fabricated-quote-used-claim-kenyas-finance-minister-said-he,africacheck.org,Fabricated quote used to claim Kenya&#039;s finance minister said he will work with everyone except ,0.9,HIGH,True,FALSE - Debunked by fact-checkers,africacheck.org,factcheck,2026-06-16T04:22:22.912366
[DEBUNKED] No evidence principal and students were kidnapped in Kano state in early days of June 2026 - Africa Check,https://africacheck.org/fact-checks/meta-programme-fact-checks/no-evidence-principal-and-students-were-kidnapped-kano-state,africacheck.org,No evidence principal and students were kidnapped in Kano state in early days of June 2026 - Africa ,0.9,HIGH,True,FALSE - Debunked by fact-checkers,africacheck.org,factcheck,2026-06-16T04:22:23.578218
[DEBUNKED] Video of Burkina Faso president Ibrahim Traoré speaking on insecurity in Nigeria AI-generated - Africa Check,https://africacheck.org/fact-checks/meta-programme-fact-checks/video-burkina-faso-president-ibrahim-traore-speaking,africacheck.org,Video of Burkina Faso president Ibrahim Traoré speaking on insecurity in Nigeria AI-generated - Afri,0.9,HIGH,True,FALSE - Debunked by fact-checkers,africacheck.org,factcheck,2026-06-16T04:22:23.788647
"[DEBUNKED] No, Bauchi state governor Bala Mohammed did not recently back armed herders — old quote resurfaces - Africa Check",https://africacheck.org/fact-checks/meta-programme-fact-checks/no-bauchi-state-governor-bala-mohammed-did-not-recently-back,africacheck.org,"No, Bauchi state governor Bala Mohammed did not recently back armed herders — old quote resurfaces -",0.9,HIGH,True,FALSE - Debunked by fact-checkers,africacheck.org,factcheck,2026-06-16T04:22:24.002572
[DEBUNKED] No evidence that Kenyan president William Ruto said he will hand over power to his son in 2032 - Africa Check,https://africacheck.org/fact-checks/meta-programme-fact-checks/no-evidence-kenyan-president-william-ruto-said-he-will-hand,africacheck.org,No evidence that Kenyan president William Ruto said he will hand over power to his son in 2032 - Afr,0.9,HIGH,True,FALSE - Debunked by fact-checkers,africacheck.org,factcheck,2026-06-16T04:22:24.899448
[DEBUNKED] Ignore fake NTV Kenya graphic claiming tourism board rejected reassignment of education principal secretary to tourism sector - Africa Check,https://africacheck.org/fact-checks/meta-programme-fact-checks/ignore-fake-ntv-kenya-graphic-claiming-tourism-board,africacheck.org,Ignore fake NTV Kenya graphic claiming tourism board rejected reassignment of education principal se,0.9,HIGH,True,FALSE - Debunked by fact-checkers,africacheck.org,factcheck,2026-06-16T04:22:25.112421
"[DEBUNKED] No! Lautech was not shut down over a bandit invasion, school closed for holiday - Africa Check",https://africacheck.org/fact-checks/meta-programme-fact-checks/no-lautech-was-not-shut-down-over-bandit-invasion-school,africacheck.org,"No! Lautech was not shut down over a bandit invasion, school closed for holiday - Africa Check",0.9,HIGH,True,FALSE - Debunked by fact-checkers,africacheck.org,factcheck,2026-06-16T04:22:25.314280
"[DEBUNKED] No, Nigerian president Bola Tinubu did not say many Nigerians want him dead – he was referring to ‘cabals’ - Africa Check",https://africacheck.org/fact-checks/meta-programme-fact-checks/no-nigerian-president-bola-tinubu-did-not-say-many-nigerians,africacheck.org,"No, Nigerian president Bola Tinubu did not say many Nigerians want him dead – he was referring to ‘c",0.9,HIGH,True,FALSE - Debunked by fact-checkers,africacheck.org,factcheck,2026-06-16T04:22:25.520763
"[DEBUNKED] Victim-blaming Kyiv, pressuring Moldova, and drone disinformation - EUvsDisinfo",https://euvsdisinfo.eu/victim-blaming-kyiv-pressuring-moldova-and-drone-disinformation/,euvsdisinfo.eu,"Victim-blaming Kyiv, pressuring Moldova, and drone disinformation - EUvsDisinfo",0.9,HIGH,True,FALSE - Debunked by fact-checkers,euvsdisinfo.eu,factcheck,2026-06-16T04:22:27.106182
"[DEBUNKED] Tough love: Spies, dating apps and the dark side of online intimacy - EUvsDisinfo",https://euvsdisinfo.eu/tough-love-spies-dating-apps-and-the-dark-side-of-online-intimacy/,euvsdisinfo.eu,"Tough love: Spies, dating apps and the dark side of online intimacy - EUvsDisinfo",0.9,HIGH,True,FALSE - Debunked by fact-checkers,euvsdisinfo.eu,factcheck,2026-06-16T04:22:30.168612
"[DEBUNKED] Lies about Russia’s military success, Yermak’s arrest and secret biolabs - EUvsDisinfo",https://euvsdisinfo.eu/lies-about-russias-military-success-yermaks-arrest-and-secret-biolabs/,euvsdisinfo.eu,"Lies about Russia’s military success, Yermak’s arrest and secret biolabs - EUvsDisinfo",0.9,HIGH,True,FALSE - Debunked by fact-checkers,euvsdisinfo.eu,factcheck,2026-06-16T04:22:31.822231
"[DEBUNKED] Victory Day propaganda, masking fear with intimidation, and abduction denial - EUvsDisinfo",https://euvsdisinfo.eu/victory-day-propaganda-masking-fear-with-intimidation-and-abduction-denial/,euvsdisinfo.eu,"Victory Day propaganda, masking fear with intimidation, and abduction denial - EUvsDisinfo",0.9,HIGH,True,FALSE - Debunked by fact-checkers,euvsdisinfo.eu,factcheck,2026-06-16T04:22:34.910747
[DEBUNKED] How Russia lies about the stolen Ukrainian children - EUvsDisinfo,https://euvsdisinfo.eu/how-russia-lies-about-the-stolen-ukrainian-children/,euvsdisinfo.eu,How Russia lies about the stolen Ukrainian children - EUvsDisinfo,0.9,HIGH,True,FALSE - Debunked by fact-checkers,euvsdisinfo.eu,factcheck,2026-06-16T04:22:37.677787
[DEBUNKED] Fake European crises and real Russian failures - EUvsDisinfo,https://euvsdisinfo.eu/fake-european-crises-and-real-russian-failures/,euvsdisinfo.eu,Fake European crises and real Russian failures - EUvsDisinfo,0.9,HIGH,True,FALSE - Debunked by fact-checkers,euvsdisinfo.eu,factcheck,2026-06-16T04:22:40.638435
"Anhören Extern anhören Wie Emmanuel Macron mal wieder Donald Trump umwirbtEigentlich hat Donald Trump für die Ukraine gerade keine Zeit, und vermutlich auch in näherer Zukunft nicht",https://www.spiegel.de/ausland/news-emmanuel-macron-donald-trump-wolodymyr-selenskyj-friedrich-merz-benjamin-netanyahu-alexander-dobrindt-a-2f10d069-351f-4060-b114-620d3eaa1842#ref=rss,www.spiegel.de,"News: Emmanuel Macron, Donald Trump, Wolodymyr Selenskyj, Friedrich Merz, Benjamin Netanyahu, Alexan",0.1,LOW,False,,,mainstream,2026-06-16T04:22:54.209169
