claim,source_url,source_domain,article_title,risk_score,risk_category,has_factcheck,factcheck_rating,factcheck_source,source_type,checked_at
[DEBUNKED] Fact Check: Numeric Claims About Massie's Previous Primary Vote Counts And Gallrein's Mail-In Ballot Numbers Are TRUE -- No Evidence Supports Implied Conspiracy | Lead Stories,https://leadstories.com/hoax-alert/2026/05/fact-check-claims-about-massies-previous-primary-vote-counts-and-gallreins-mail-in-ballot-numbers-are-true.html,leadstories.com,Fact Check: Numeric Claims About Massie's Previous Primary Vote Counts And Gallrein's Mail-In Ballot,0.9,HIGH,True,FALSE - Debunked by fact-checkers,leadstories.com,factcheck,2026-05-20T20:22:01.830549
[DEBUNKED] Fact Check: Neymar Was NOT Thronged By Fans While Sitting On The Toilet -- Video Shows A Neymar Impersonator | Lead Stories,https://leadstories.com/hoax-alert/2026/05/fact-check-neymar-was-not-thronged-by-fans-while-sitting-on-the-toilet.html,leadstories.com,Fact Check: Neymar Was NOT Thronged By Fans While Sitting On The Toilet -- Video Shows A Neymar Impe,0.9,HIGH,True,FALSE - Debunked by fact-checkers,leadstories.com,factcheck,2026-05-20T20:22:01.962205
[DEBUNKED] Fact Check: Jack Dorsey Has NOT Joined Anthropic -- Trending Joke Is Using Names Of Many Notable People | Lead Stories,https://leadstories.com/hoax-alert/2026/05/fact-check-jack-dorsey-has-not-joined-anthropic-trending-joke-is-using-names-of-many-notable-people.html,leadstories.com,Fact Check: Jack Dorsey Has NOT Joined Anthropic -- Trending Joke Is Using Names Of Many Notable Peo,0.9,HIGH,True,FALSE - Debunked by fact-checkers,leadstories.com,factcheck,2026-05-20T20:22:02.101730
[DEBUNKED] Fact Check: 'Biden Body Double' AJ Barron Did NOT Turn State's Evidence -- It Is Satire | Lead Stories,https://leadstories.com/hoax-alert/2026/05/fact-check-biden-body-double-aj-barron-did-not-turn-state-evidence.html,leadstories.com,Fact Check: 'Biden Body Double' AJ Barron Did NOT Turn State's Evidence -- It Is Satire | Lead Stori,0.9,HIGH,True,FALSE - Debunked by fact-checkers,leadstories.com,factcheck,2026-05-20T20:22:02.248575
[DEBUNKED] Fact Check: 'Happy Birthday' Posts Showing Pink Wearing Anti-Trump Shirts Are Not Real -- Spam From Vietnam | Lead Stories,https://leadstories.com/hoax-alert/2026/05/fact-check-happy-birthday-posts-showing-pink-wearing-antitrump-shirt-not-real.html,leadstories.com,Fact Check: 'Happy Birthday' Posts Showing Pink Wearing Anti-Trump Shirts Are Not Real -- Spam From ,0.9,HIGH,True,FALSE - Debunked by fact-checkers,leadstories.com,factcheck,2026-05-20T20:22:02.402888
[DEBUNKED] Fact Check: NO EVIDENCE Memphis Man Was Arrested For 'Scratching Off Every Scratch-Off Ticket' At Germantown Exxon In Tennessee | Lead Stories,https://leadstories.com/hoax-alert/2026/05/fact-check-no-evidence-memphis-man-was-arrested-for-scratching-off-every-scratch-off-ticket.html,leadstories.com,Fact Check: NO EVIDENCE Memphis Man Was Arrested For 'Scratching Off Every Scratch-Off Ticket' At Ge,0.9,HIGH,True,FALSE - Debunked by fact-checkers,leadstories.com,factcheck,2026-05-20T20:22:02.539406
[DEBUNKED] Fact Check: FAKE Photo Shows Sasha Obama Wearing A MAGA Hat -- The Image Is Edited | Lead Stories,https://leadstories.com/hoax-alert/2026/05/fact-check-fake-photo-shows-sasha-obama-wearing-a-maga-hat.html,leadstories.com,Fact Check: FAKE Photo Shows Sasha Obama Wearing A MAGA Hat -- The Image Is Edited | Lead Stories,0.9,HIGH,True,FALSE - Debunked by fact-checkers,leadstories.com,factcheck,2026-05-20T20:22:02.675786
[DEBUNKED] Fact Check: Rep. Jack Kimble Post Saying They Make Less Than $200K For 140 Days Of Work Is NOT From Real Congressman -- It's Parody Account | Lead Stories,https://leadstories.com/hoax-alert/2026/05/fact-check-rep-jack-kimble-post-saying-they-make-less-than-200k-for-140-days-of-work-is-not-from-real-congressman-parody-account.html,leadstories.com,Fact Check: Rep. Jack Kimble Post Saying They Make Less Than $200K For 140 Days Of Work Is NOT From ,0.9,HIGH,True,FALSE - Debunked by fact-checkers,leadstories.com,factcheck,2026-05-20T20:22:02.796774
[DEBUNKED] Fact Check: Jimmy Savile Banner Image Is NOT Real Photo From London Rally | Lead Stories,https://leadstories.com/hoax-alert/2026/05/fact-check-jimmy-savile-banner-image-is-not-real-photo-from-london-rally.html,leadstories.com,Fact Check: Jimmy Savile Banner Image Is NOT Real Photo From London Rally | Lead Stories,0.9,HIGH,True,FALSE - Debunked by fact-checkers,leadstories.com,factcheck,2026-05-20T20:22:02.936553
[DEBUNKED] Fact Check: Data Center Did NOT Cause Power Outage At Six Flags Over Texas In May 2026 -- It Was A Construction Crew | Lead Stories,https://leadstories.com/hoax-alert/2026/05/fact-check-data-center-did-not-cause-power-outage-at-six-flags-over-texas-in-may-2026.html,leadstories.com,Fact Check: Data Center Did NOT Cause Power Outage At Six Flags Over Texas In May 2026 -- It Was A C,0.9,HIGH,True,FALSE - Debunked by fact-checkers,leadstories.com,factcheck,2026-05-20T20:22:03.064320
[DEBUNKED] Fact Check: Altered 'You'll Never Walk Alone' Audio NOT From 'Unite The Kingdom' Rally Livestream -- NOT Rikki Doolan's Voice | Lead Stories,https://leadstories.com/hoax-alert/2026/05/fact-check-audio-track-was-altered-not-taken-from-original-livestream-of-singing-at-utk-freedom-rally-in-london.html,leadstories.com,Fact Check: Altered 'You'll Never Walk Alone' Audio NOT From 'Unite The Kingdom' Rally Livestream --,0.9,HIGH,True,FALSE - Debunked by fact-checkers,leadstories.com,factcheck,2026-05-20T20:22:03.194135
[DEBUNKED] Fact Check: Posts Saying Your Favorite Celeb Went Live At 3 A.M. With An Urgent Message About Being Silenced Are NOT Real -- Spam From Vietnam | Lead Stories,https://leadstories.com/hoax-alert/2026/05/fact-check-posts-saying-celeb-went-live-at-3am-not-real.html,leadstories.com,Fact Check: Posts Saying Your Favorite Celeb Went Live At 3 A.M. With An Urgent Message About Being ,0.9,HIGH,True,FALSE - Debunked by fact-checkers,leadstories.com,factcheck,2026-05-20T20:22:03.342129
[DEBUNKED] Fact Check: FAKE Photo Shows Robert DeNiro Flipping The Bird In Front Of Trump Tower In Obama T-Shirt -- It is AI | Lead Stories,https://leadstories.com/hoax-alert/2026/05/fact-check-fake-photo-robert-deniro-flipping-the-bird-trump-tower-obama-tshirt-its-ai.html,leadstories.com,Fact Check: FAKE Photo Shows Robert DeNiro Flipping The Bird In Front Of Trump Tower In Obama T-Shir,0.9,HIGH,True,FALSE - Debunked by fact-checkers,leadstories.com,factcheck,2026-05-20T20:22:03.463617
[DEBUNKED] Fact Check: 'New York Clean Car Act' Was NOT Signed Into Law Banning Car Washing In New York State | Lead Stories,https://leadstories.com/hoax-alert/2026/05/fact-check-new-york-clean-car-act-was-not-signed-into-law-banning-car-washing-in-new-york-state.html,leadstories.com,Fact Check: 'New York Clean Car Act' Was NOT Signed Into Law Banning Car Washing In New York State |,0.9,HIGH,True,FALSE - Debunked by fact-checkers,leadstories.com,factcheck,2026-05-20T20:22:03.587925
[DEBUNKED] Fact Check: Trump Did NOT Write That 'Nobody Knows God Better Than Me' And That 'Nobody Is Loved More By God Than Me' | Lead Stories,https://leadstories.com/hoax-alert/2026/05/fact-check-trump-did-not-write-nobody-knows-god-better-than-me.html,leadstories.com,Fact Check: Trump Did NOT Write That 'Nobody Knows God Better Than Me' And That 'Nobody Is Loved Mor,0.9,HIGH,True,FALSE - Debunked by fact-checkers,leadstories.com,factcheck,2026-05-20T20:22:03.732932
[DEBUNKED] A video of a Florida governor candidate was AI slop. People spread it anyway. - Poynter,https://www.poynter.org/fact-checking/2026/did-byron-donalds-say-insider-trading-should-be-allowed/,www.poynter.org,A video of a Florida governor candidate was AI slop. People spread it anyway. - Poynter,0.9,HIGH,True,FALSE - Debunked by fact-checkers,www.poynter.org,factcheck,2026-05-20T20:22:04.858880
"Prices for key goods and services have increased Rising prices are a big concern for many Americans, after experiencing an inflation peak around 9% in 2022",https://www.poynter.org/fact-checking/2026/trump-think-americans-finances-charts/,www.poynter.org,Trump said he doesn’t think about Americans’ finances. These 7 charts show how Americans are actuall,0,LOW,False,,,factcheck,2026-05-20T20:22:05.581030
"[DEBUNKED] Victory Day propaganda, masking fear with intimidation, and abduction denial - EUvsDisinfo",https://euvsdisinfo.eu/victory-day-propaganda-masking-fear-with-intimidation-and-abduction-denial/,euvsdisinfo.eu,"Victory Day propaganda, masking fear with intimidation, and abduction denial - EUvsDisinfo",0.9,HIGH,True,FALSE - Debunked by fact-checkers,euvsdisinfo.eu,factcheck,2026-05-20T20:22:08.263676
[DEBUNKED] How Russia lies about the stolen Ukrainian children - EUvsDisinfo,https://euvsdisinfo.eu/how-russia-lies-about-the-stolen-ukrainian-children/,euvsdisinfo.eu,How Russia lies about the stolen Ukrainian children - EUvsDisinfo,0.9,HIGH,True,FALSE - Debunked by fact-checkers,euvsdisinfo.eu,factcheck,2026-05-20T20:22:11.331021
[DEBUNKED] Fake European crises and real Russian failures - EUvsDisinfo,https://euvsdisinfo.eu/fake-european-crises-and-real-russian-failures/,euvsdisinfo.eu,Fake European crises and real Russian failures - EUvsDisinfo,0.9,HIGH,True,FALSE - Debunked by fact-checkers,euvsdisinfo.eu,factcheck,2026-05-20T20:22:14.095237
[DEBUNKED] Russia’s fake nuclear drills and real failure in Mali - EUvsDisinfo,https://euvsdisinfo.eu/russias-fake-nuclear-drills-and-real-failure-in-mali/,euvsdisinfo.eu,Russia’s fake nuclear drills and real failure in Mali - EUvsDisinfo,0.9,HIGH,True,FALSE - Debunked by fact-checkers,euvsdisinfo.eu,factcheck,2026-05-20T20:22:15.497207
[DEBUNKED] Disinformation Review: EU Sanctions and the Kremlin’s Recycled Narratives - EUvsDisinfo,https://euvsdisinfo.eu/disinformation-review-eu-sanctions-and-the-kremlins-recycled-narratives/,euvsdisinfo.eu,Disinformation Review: EU Sanctions and the Kremlin’s Recycled Narratives - EUvsDisinfo,0.9,HIGH,True,FALSE - Debunked by fact-checkers,euvsdisinfo.eu,factcheck,2026-05-20T20:22:17.940200
Doch das Parlament verabschiedet sich nun offiziell aus dem Projekt,https://www.spiegel.de/politik/bundestag-baukommission-stimmt-fuer-stopp-von-neubau-a-63ca1828-e360-4d14-aaa8-ebc6f92c9186#ref=rss,www.spiegel.de,Bundestag: Baukommission stimmt für Stopp von Neubau - DER SPIEGEL,0,LOW,False,,,mainstream,2026-05-20T20:22:29.009569
"Der 94-Jährige soll laut US-Justizminister Todd Blanche in den Abschuss von Flugzeugen durch Kubas Luftwaffe 1996 verwickelt gewesen sein, bei dem auch US-Amerikaner starben",https://www.spiegel.de/ausland/usa-gegen-kuba-vereinigte-staaten-klagen-ex-staatschef-raul-castro-an-a-fc771c9e-ad54-4cf6-bc76-5ed1cbe8c6bf#ref=rss,www.spiegel.de,USA gegen Kuba: Vereinigte Staaten klagen Ex-Staatschef Raúl Castro an - DER SPIEGEL,0,LOW,False,,,mainstream,2026-05-20T20:22:30.732216
"Zum Login SPIEGEL plus Nur für Neukunden € 1,– für 4 Wochen danach € 5,99 pro Woche Freier Zugriff auf alle S+-Artikel auf SPIEGEL",https://www.spiegel.de/politik/deutschland/bundestag-afd-kandidat-erhaelt-unerwartete-stimmen-aus-anderen-fraktionen-a-13f80cb9-87ff-4c4e-b493-5944e1a85c30#ref=rss,www.spiegel.de,Bundestag: AfD-Kandidat erhält unerwartete Stimmen aus anderen Fraktionen - DER SPIEGEL,0.1,LOW,False,,,mainstream,2026-05-20T20:22:31.408268
"E-Paper (PDF), Digital-Archiv und S+-Newsletter Jederzeit kündigen Jetzt abonnieren SPIEGEL plus 52 Wochen 25 % sparen € 4,49 pro Woche für 52 Wochen danach € 5,99 pro Woche Freier Zugriff auf alle S+-Artikel auf SPIEGEL",https://www.spiegel.de/politik/deutschland/bundestag-afd-kandidat-erhaelt-unerwartete-stimmen-aus-anderen-fraktionen-a-13f80cb9-87ff-4c4e-b493-5944e1a85c30#ref=rss,www.spiegel.de,Bundestag: AfD-Kandidat erhält unerwartete Stimmen aus anderen Fraktionen - DER SPIEGEL,0.1,LOW,False,,,mainstream,2026-05-20T20:22:31.497309
"Zum Login SPIEGEL plus Nur für Neukunden € 1,– für 4 Wochen danach € 5,99 pro Woche Freier Zugriff auf alle S+-Artikel auf SPIEGEL",https://www.spiegel.de/sport/fussball/europa-league-finale-sc-freiburg-gegen-aston-villa-im-liveticker-a-39742b96-855f-4010-af6a-a90b5c9ac3cf#ref=rss,www.spiegel.de,Europa-League-Finale: SC Freiburg gegen Aston Villa im Liveticker - DER SPIEGEL,0.1,LOW,False,,,mainstream,2026-05-20T20:22:32.471581
"E-Paper (PDF), Digital-Archiv und S+-Newsletter Jederzeit kündigen Jetzt abonnieren SPIEGEL plus 52 Wochen 25 % sparen € 4,49 pro Woche für 52 Wochen danach € 5,99 pro Woche Freier Zugriff auf alle S+-Artikel auf SPIEGEL",https://www.spiegel.de/sport/fussball/europa-league-finale-sc-freiburg-gegen-aston-villa-im-liveticker-a-39742b96-855f-4010-af6a-a90b5c9ac3cf#ref=rss,www.spiegel.de,Europa-League-Finale: SC Freiburg gegen Aston Villa im Liveticker - DER SPIEGEL,0.1,LOW,False,,,mainstream,2026-05-20T20:22:32.549874
Im Gesundheitssport gilt bislang ein einfaches Motto: Jeder Schritt zählt,https://www.spiegel.de/fitness/gesundheit-warum-forscher-jetzt-mehr-als-zehn-stunden-sport-pro-woche-empfehlen-a-8d87f58f-62b1-4d31-aea0-e5fac45c7394#ref=rss,www.spiegel.de,Gesundheit: Warum Forscher jetzt mehr als zehn Stunden Sport pro Woche empfehlen - DER SPIEGEL,0,LOW,False,,,mainstream,2026-05-20T20:22:33.702315
"com Facebook E-Mail Messenger WhatsApp Link kopieren image""> Bild vergrößern Sarah Engels beim ESC: Wer Männer liebt, kann keine Feministin sein Foto: Hannibal Hanschke / EPA Sie können den Artikel leider nicht mehr aufrufen",https://www.spiegel.de/kultur/sarah-engels-warum-die-esc-saengerin-feminismus-mit-maennerhass-verwechselt-a-7a449d40-4211-415e-8483-adca175fa6ea#ref=rss,www.spiegel.de,Sarah Engels: Warum die ESC-Sängerin Feminismus mit Männerhass verwechselt - DER SPIEGEL,0.1,LOW,False,,,mainstream,2026-05-20T20:22:34.376642
"Ihr drittes Buch »Anti Opfer« (288 Seiten; 22,99 Euro) ist jüngst bei Ullstein erschienen",https://www.spiegel.de/kultur/sarah-engels-warum-die-esc-saengerin-feminismus-mit-maennerhass-verwechselt-a-7a449d40-4211-415e-8483-adca175fa6ea#ref=rss,www.spiegel.de,Sarah Engels: Warum die ESC-Sängerin Feminismus mit Männerhass verwechselt - DER SPIEGEL,0,LOW,False,,,mainstream,2026-05-20T20:22:34.461249
"Zum Login SPIEGEL plus Nur für Neukunden € 1,– für 4 Wochen danach € 5,99 pro Woche Freier Zugriff auf alle S+-Artikel auf SPIEGEL",https://www.spiegel.de/politik/deutschland/heizungsgesetz-kabinett-beschliesst-umstrittenen-entwurf-ohne-rechtspruefung-a-2cad02df-f645-4fb7-9804-5f4c719c3d10#ref=rss,www.spiegel.de,Heizungsgesetz: Kabinett beschließt umstrittenen Entwurf ohne Rechtsprüfung - DER SPIEGEL,0.1,LOW,False,,,mainstream,2026-05-20T20:22:35.530273
"Zum Login SPIEGEL plus Nur für Neukunden € 1,– für 4 Wochen danach € 5,99 pro Woche Freier Zugriff auf alle S+-Artikel auf SPIEGEL",https://www.spiegel.de/kultur/theatertreffen-2026-so-erklaert-man-arbeiten-von-frauen-im-theater-rueckwirkend-fuer-muell-a-0f31eab3-53ae-484c-83d8-dcc06fc43e21#ref=rss,www.spiegel.de,Theatertreffen 2026: So erklärt man Arbeiten von Frauen im Theater rückwirkend für Müll - DER SPIEGE,0.1,LOW,False,,,mainstream,2026-05-20T20:22:36.217266
"E-Paper (PDF), Digital-Archiv und S+-Newsletter Jederzeit kündigen Jetzt abonnieren SPIEGEL plus 52 Wochen 25 % sparen € 4,49 pro Woche für 52 Wochen danach € 5,99 pro Woche Freier Zugriff auf alle S+-Artikel auf SPIEGEL",https://www.spiegel.de/kultur/theatertreffen-2026-so-erklaert-man-arbeiten-von-frauen-im-theater-rueckwirkend-fuer-muell-a-0f31eab3-53ae-484c-83d8-dcc06fc43e21#ref=rss,www.spiegel.de,Theatertreffen 2026: So erklärt man Arbeiten von Frauen im Theater rückwirkend für Müll - DER SPIEGE,0.1,LOW,False,,,mainstream,2026-05-20T20:22:36.304382
Laut Ministerium werde die Familie wie zuvor der Mann mit einem Spezialflugzeug nach Deutschland geflogen – und in Berlin mit einem sogenannten Infektionsrettungswagen zur Klinik gebracht,https://www.spiegel.de/wissenschaft/ebola-familie-des-infizierten-aus-den-usa-soll-ebenfalls-an-charite-in-berlin-versorgt-werden-a-4be7babe-1bdc-445c-b13e-442e57f683a8#ref=rss,www.spiegel.de,Ebola: Familie des Infizierten aus den USA soll ebenfalls an Charité in Berlin versorgt werden - DER,0,LOW,False,,,mainstream,2026-05-20T20:22:37.668198
Demnach strebt der Bund zunächst eine Beteiligung von 40 Prozent an,https://www.spiegel.de/politik/deutschland/verteidigung-regierung-einig-ueber-einstieg-bei-ruestungskonzern-knds-a-f1187adf-3ec8-4ffd-a908-e8410cd976c1#ref=rss,www.spiegel.de,Verteidigung: Regierung einig über Einstieg bei Rüstungskonzern KNDS - DER SPIEGEL,0,LOW,False,,,mainstream,2026-05-20T20:22:38.337441
"Zugleich besteht die feste Absicht, diese Beteiligung in einem Zeitraum von zwei bis drei Jahren auf 30 Prozent der Anteile zu reduzieren",https://www.spiegel.de/politik/deutschland/verteidigung-regierung-einig-ueber-einstieg-bei-ruestungskonzern-knds-a-f1187adf-3ec8-4ffd-a908-e8410cd976c1#ref=rss,www.spiegel.de,Verteidigung: Regierung einig über Einstieg bei Rüstungskonzern KNDS - DER SPIEGEL,0,LOW,False,,,mainstream,2026-05-20T20:22:38.417240
"Newly-published inflation figures show the annual rate of food price rises was 3% in April, which was higher than the overall rate of inflation of 2",https://www.bbc.com/news/articles/c5y7qz806q3o?at_medium=RSS&amp;at_campaign=rss,www.bbc.com,"Supermarkets hit back over pressure to cap price of milk, bread and eggs",0,LOW,False,,,mainstream,2026-05-20T20:22:39.653828
Some industry groups have warned the rate of food price rises could hit nearly 10% by the end of the year,https://www.bbc.com/news/articles/c5y7qz806q3o?at_medium=RSS&amp;at_campaign=rss,www.bbc.com,"Supermarkets hit back over pressure to cap price of milk, bread and eggs",0,LOW,False,,,mainstream,2026-05-20T20:22:39.733505
