claim,source_url,source_domain,article_title,risk_score,risk_category,has_factcheck,factcheck_rating,factcheck_source,source_type,checked_at
Angriffe auf die freie Presse sind Angriffe auf uns alle,https://correctiv.org/aktuelles/medien/2026/05/01/apple-und-google-sollen-istories-app-in-russland-sperren/,correctiv.org,Apple und Google sollen iStories-App in Russland sperren - correctiv.org,0.1,LOW,False,,,factcheck,2026-05-04T03:23:48.583689
[DEBUNKED] Fake-Spendenaufruf für Wal „Timmy“ auf Tiktok,https://correctiv.org/faktencheck/2026/04/30/wal-timmy-profil-wirbt-mit-fake-dokumenten-auf-tiktok-fuer-spenden/,correctiv.org,Fake-Spendenaufruf für Wal „Timmy“ auf Tiktok,0.9,HIGH,True,FALSE - Debunked by fact-checkers,correctiv.org,factcheck,2026-05-04T03:23:49.188782
[DEBUNKED] Friedrich Merz wirbt nicht für Investitionsplattform – Video ist Betrug,https://correctiv.org/faktencheck/2026/04/30/friedrich-merz-wirbt-nicht-fuer-investitionsplattform-video-ist-betrug/,correctiv.org,Friedrich Merz wirbt nicht für Investitionsplattform – Video ist Betrug,0.9,HIGH,True,FALSE - Debunked by fact-checkers,correctiv.org,factcheck,2026-05-04T03:23:49.916391
"[DEBUNKED] Google-Trends zeigt nicht, dass Angriff auf Korrespondenten-Dinner inszeniert war",https://correctiv.org/faktencheck/2026/04/30/google-trends-zeigt-nicht-das-angriff-auf-korrespondenten-dinner-inszeniert-war/,correctiv.org,"Google-Trends zeigt nicht, dass Angriff auf Korrespondenten-Dinner inszeniert war",0.9,HIGH,True,FALSE - Debunked by fact-checkers,correctiv.org,factcheck,2026-05-04T03:23:50.519999
April 2026 Foto: Bodo Schackow / picture alliance / dpa Für ein Verbot der AfD gibt es im Moment keine politische Mehrheit,https://correctiv.org/aktuelles/afd/2026/04/30/rechtsexperten-halten-ein-teil-verbot-der-afd-fuer-denkbar/,correctiv.org,Rechtsexperten halten ein Teil-Verbot der AfD für denkbar,0.1,LOW,False,,,factcheck,2026-05-04T03:23:51.195743
"Zwar ist laut Markus Ogorek, Staatsrechtler an der Universität zu Köln, ein Verbotsantrag, der lediglich auf einen Landesverband abzielt, nicht ausdrücklich gesetzlich festgelegt",https://correctiv.org/aktuelles/afd/2026/04/30/rechtsexperten-halten-ein-teil-verbot-der-afd-fuer-denkbar/,correctiv.org,Rechtsexperten halten ein Teil-Verbot der AfD für denkbar,0,LOW,False,,,factcheck,2026-05-04T03:23:51.272619
Angriffe auf die freie Presse sind Angriffe auf uns alle,https://correctiv.org/aktuelles/afd/2026/04/30/rechtsexperten-halten-ein-teil-verbot-der-afd-fuer-denkbar/,correctiv.org,Rechtsexperten halten ein Teil-Verbot der AfD für denkbar,0.1,LOW,False,,,factcheck,2026-05-04T03:23:51.352967
[DEBUNKED] Keine Neuwahl in Rheinland-Pfalz – Youtube-Kanal sammelt Klicks,https://correctiv.org/faktencheck/2026/04/30/keine-neuwahl-in-rheinland-pfalz-youtube-kanal-sammelt-klicks/,correctiv.org,Keine Neuwahl in Rheinland-Pfalz – Youtube-Kanal sammelt Klicks,0.9,HIGH,True,FALSE - Debunked by fact-checkers,correctiv.org,factcheck,2026-05-04T03:23:51.957694
"Sie richtet sich laut deutschen Sicherheitsbehörden vorrangig gegen Vertreterinnen und Vertreter aus Politik, Militär, Diplomatie und Journalismus",https://correctiv.org/hybride-kriegsfuehrung/2026/04/29/spionage-ueber-signal-was-ueber-die-phishing-kampagne-bekannt-ist-und-wie-sie-sich-schuetzen-koennen/,correctiv.org,Spionage über Signal: Was über die Phishing-Kampagne bekannt ist – und wie Sie sich schützen können,0,LOW,False,,,factcheck,2026-05-04T03:23:52.707985
Angriffe auf die freie Presse sind Angriffe auf uns alle,https://correctiv.org/hybride-kriegsfuehrung/2026/04/29/spionage-ueber-signal-was-ueber-die-phishing-kampagne-bekannt-ist-und-wie-sie-sich-schuetzen-koennen/,correctiv.org,Spionage über Signal: Was über die Phishing-Kampagne bekannt ist – und wie Sie sich schützen können,0.1,LOW,False,,,factcheck,2026-05-04T03:23:52.788919
Jetzt lesen &amp; helfen Anders als bei anderen Angriffen wird dabei oft gar keine technisc,https://correctiv.org/hybride-kriegsfuehrung/2026/04/29/spionage-ueber-signal-was-ueber-die-phishing-kampagne-bekannt-ist-und-wie-sie-sich-schuetzen-koennen/,correctiv.org,Spionage über Signal: Was über die Phishing-Kampagne bekannt ist – und wie Sie sich schützen können,0.1,LOW,False,,,factcheck,2026-05-04T03:23:52.895661
[DEBUNKED] Bystron stellt irreführende Rechnung zu Rente und Ukraine-Kredit auf,https://correctiv.org/faktencheck/2026/04/29/irrefuehrende-rechnung-afd-politiker-bystron-vergleicht-ukraine-kredit-mit-renten/,correctiv.org,Bystron stellt irreführende Rechnung zu Rente und Ukraine-Kredit auf,0.9,HIGH,True,FALSE - Debunked by fact-checkers,correctiv.org,factcheck,2026-05-04T03:23:53.577259
"[DEBUNKED] Was die AfD Hamburg weglässt, wenn sie über Neubauten für Geflüchtete schreibt",https://correctiv.org/faktencheck/2026/04/29/was-die-afd-hamburg-weglaesst-wenn-sie-ueber-neubauten-fuer-gefluechtete-schreibt/,correctiv.org,"Was die AfD Hamburg weglässt, wenn sie über Neubauten für Geflüchtete schreibt",0.9,HIGH,True,FALSE - Debunked by fact-checkers,correctiv.org,factcheck,2026-05-04T03:23:54.167051
"[DEBUNKED] Doch, Schwedens König schüttelte Selenskyjs Hand",https://correctiv.org/faktencheck/2026/04/29/doch-schwedens-koenig-schuettelte-wolodymyr-selenskyjs-hand/,correctiv.org,"Doch, Schwedens König schüttelte Selenskyjs Hand",0.9,HIGH,True,FALSE - Debunked by fact-checkers,correctiv.org,factcheck,2026-05-04T03:23:54.839246
Angriffe auf die freie Presse sind Angriffe auf uns alle,https://correctiv.org/aktuelles/bildung/2026/04/29/bildungsministerin-prien-es-gibt-keine-neutralitaet-gegenueber-den-werten-des-grundgesetzes/,correctiv.org,Bildungsministerin Prien fordert grundlegende Reformen,0.1,LOW,False,,,factcheck,2026-05-04T03:23:55.621057
[DEBUNKED] Bielefeld: Neuer Oberbürgermeister-Kandidat ist „KI-Satire“,https://correctiv.org/faktencheck/2026/04/28/bielefeld-oberbuergermeister-kandidat-ist-ki-satire/,correctiv.org,Bielefeld: Neuer Oberbürgermeister-Kandidat ist „KI-Satire“,0.9,HIGH,True,FALSE - Debunked by fact-checkers,correctiv.org,factcheck,2026-05-04T03:23:56.225847
Angriffe auf die freie Presse sind Angriffe auf uns alle,https://correctiv.org/aktuelles/europa-aktuelles/2026/04/30/ein-ukrainer-in-russischer-uniform/,correctiv.org,Ein Ukrainer in russischer Uniform - correctiv.org,0.1,LOW,False,,,factcheck,2026-05-04T03:23:56.909202
"Sie war das Argument für die zweifelhaften Referenden von 2014, die eine Zustimmung von 89 bis 96 Prozent für einen Anschluss an Russland behaupteten",https://correctiv.org/aktuelles/europa-aktuelles/2026/04/30/ein-ukrainer-in-russischer-uniform/,correctiv.org,Ein Ukrainer in russischer Uniform - correctiv.org,0,LOW,False,,,factcheck,2026-05-04T03:23:56.993324
"[DEBUNKED] Doch, Leitungswasser gilt weiterhin als Trinkwasser",https://correctiv.org/faktencheck/2026/04/28/doch-deutsches-leitungswasser-gilt-weiterhin-als-trinkwasser/,correctiv.org,"Doch, Leitungswasser gilt weiterhin als Trinkwasser",0.9,HIGH,True,FALSE - Debunked by fact-checkers,correctiv.org,factcheck,2026-05-04T03:23:57.623683
[DEBUNKED] Umbau der Demokratieförderung schwächt Schulen - correctiv.org,https://correctiv.org/aktuelles/bildung/2026/04/28/streichliste-demokratie-leben-schwaecht-die-schulen/,correctiv.org,Umbau der Demokratieförderung schwächt Schulen - correctiv.org,0.9,HIGH,True,FALSE - Debunked by fact-checkers,correctiv.org,factcheck,2026-05-04T03:23:58.324810
[DEBUNKED] Hat Fedorovs Frau eine 26-Mio.-Yacht gekauft?,https://www.mimikama.org/fedorov-frau-yacht-eu-geld/,www.mimikama.org,Hat Fedorovs Frau eine 26-Mio.-Yacht gekauft?,0.9,HIGH,True,FALSE - Debunked by fact-checkers,www.mimikama.org,factcheck,2026-05-04T03:23:58.398247
[DEBUNKED] Native Advertising vs Fake-Advertorial: Der Unterschied,https://www.mimikama.org/native-advertising-vs-fake-advertorial/,www.mimikama.org,Native Advertising vs Fake-Advertorial: Der Unterschied,0.9,HIGH,True,FALSE - Debunked by fact-checkers,www.mimikama.org,factcheck,2026-05-04T03:23:58.466392
[DEBUNKED] Promi-Fake-Werbung: 5 Warnzeichen zum Schutz,https://www.mimikama.org/promi-fake-werbung-erkennen/,www.mimikama.org,Promi-Fake-Werbung: 5 Warnzeichen zum Schutz,0.9,HIGH,True,FALSE - Debunked by fact-checkers,www.mimikama.org,factcheck,2026-05-04T03:23:58.546406
[DEBUNKED] Fake-Advertorials erkennen: 5 Maschen + Schutz-Tipps,https://www.mimikama.org/fake-advertorials-erkennen/,www.mimikama.org,Fake-Advertorials erkennen: 5 Maschen + Schutz-Tipps,0.9,HIGH,True,FALSE - Debunked by fact-checkers,www.mimikama.org,factcheck,2026-05-04T03:23:58.615398
„Du hast doch keine Ahnung&#8230;&#8220; – Ad Hominem ist mehr als Unhöflichkeit,https://www.mimikama.org/ad-hominem-persoenlicher-angriff-erkennen/,www.mimikama.org,Ad Hominem erkennen: Persönliche Angriffe kontern,0.1,LOW,False,,,factcheck,2026-05-04T03:23:58.768125
"Plötzlich heißt es: „Du hast doch keine Ahnung&#8220; oder „Das sagst du nur, weil du zu dieser Gruppe gehörst",https://www.mimikama.org/ad-hominem-persoenlicher-angriff-erkennen/,www.mimikama.org,Ad Hominem erkennen: Persönliche Angriffe kontern,0.1,LOW,False,,,factcheck,2026-05-04T03:23:58.939625
"Das Muster ist fast immer gleich: Statt sich mit dem Inhalt auseinanderzusetzen, wird die Person als unglaubwürdig, lächerlich oder moralisch mangelhaft dargestellt",https://www.mimikama.org/ad-hominem-persoenlicher-angriff-erkennen/,www.mimikama.org,Ad Hominem erkennen: Persönliche Angriffe kontern,0.1,LOW,False,,,factcheck,2026-05-04T03:23:59.018472
[DEBUNKED] Confirmation Bias erklärt: 6 Strategien gegen Denkfehler,https://www.mimikama.org/confirmation-bias-bestaetigungsfehler-erklaert/,www.mimikama.org,Confirmation Bias erklärt: 6 Strategien gegen Denkfehler,0.9,HIGH,True,FALSE - Debunked by fact-checkers,www.mimikama.org,factcheck,2026-05-04T03:23:59.083119
Cannabis-Legalisierung: „Dann werden bald alle Drogen erlaubt,https://www.mimikama.org/dammbruch-argument-slippery-slope-erkennen/,www.mimikama.org,Dammbruch-Argument erkennen: Slippery Slope kontern,0.1,LOW,False,,,factcheck,2026-05-04T03:23:59.241667
"Dass zwei Fälle oberflächlich mit „Ehe&#8220; zu tun haben, beweist keine logische oder rechtliche Kette",https://www.mimikama.org/dammbruch-argument-slippery-slope-erkennen/,www.mimikama.org,Dammbruch-Argument erkennen: Slippery Slope kontern,0.1,LOW,False,,,factcheck,2026-05-04T03:23:59.318726
"Statt über eine konkrete Maßnahme zu sprechen, musst du dich gegen eine extreme Behauptung verteidigen, die du nie aufgestellt hast",https://www.mimikama.org/strohmann-argument-erkennen-kontern/,www.mimikama.org,Strohmann-Argument erkennen: 5 Beispiele + Konter,0.1,LOW,False,,,factcheck,2026-05-04T03:23:59.440191
"Ein Strohmann widerlegt nicht das Argument deines Gegenübers – sondern eine Verzerrung, die du nie gesagt hast",https://www.mimikama.org/strohmann-argument-erkennen-kontern/,www.mimikama.org,Strohmann-Argument erkennen: 5 Beispiele + Konter,0.1,LOW,False,,,factcheck,2026-05-04T03:23:59.528623
"&#8220; Person B antwortet: „Du willst, dass wir alle in der Höhle leben",https://www.mimikama.org/strohmann-argument-erkennen-kontern/,www.mimikama.org,Strohmann-Argument erkennen: 5 Beispiele + Konter,0.1,LOW,False,,,factcheck,2026-05-04T03:23:59.609537
[DEBUNKED] Whataboutism erkennen: 7 Konter für jede Diskussion,https://www.mimikama.org/whataboutism-erkennen-kontern/,www.mimikama.org,Whataboutism erkennen: 7 Konter für jede Diskussion,0.9,HIGH,True,FALSE - Debunked by fact-checkers,www.mimikama.org,factcheck,2026-05-04T03:23:59.698449
Warum nicht jeder aggressive Post dasselbe ist – und welche Muster auf ideologische Propaganda hinweisen VonTom Wannenmacher Stunden veröffentlicht am30,https://www.mimikama.org/rechtsextreme-propaganda-hate-speech-provokation/,www.mimikama.org,Rechtsextreme Propaganda erkennen: Unterschied zu Hate Speech &amp; Provokation,0,LOW,False,,,factcheck,2026-05-04T03:23:59.890777
Rechtsextreme Inhalte im Netz sind nicht immer leicht zu erkennen,https://www.mimikama.org/rechtsextreme-propaganda-hate-speech-provokation/,www.mimikama.org,Rechtsextreme Propaganda erkennen: Unterschied zu Hate Speech &amp; Provokation,0.1,LOW,False,,,factcheck,2026-05-04T03:23:59.969493
Nicht jeder aggressive oder abwertender Inhalt ist automatisch rechtsextreme Propaganda,https://www.mimikama.org/rechtsextreme-propaganda-hate-speech-provokation/,www.mimikama.org,Rechtsextreme Propaganda erkennen: Unterschied zu Hate Speech &amp; Provokation,0,LOW,False,,,factcheck,2026-05-04T03:24:00.047821
Es sind nicht immer offene Parolen oder eindeutige Symbole,https://www.mimikama.org/kind-rechtsextreme-inhalte-online-was-tun/,www.mimikama.org,Mein Kind sieht rechtsextreme Inhalte online – was Eltern jetzt tun können,0.1,LOW,False,,,factcheck,2026-05-04T03:24:00.217123
"Was Eltern machen können, wenn Kinder mit rechtsextremen Inhalten in Kontakt kommen Woran Eltern problematische Inhalte erkennen können Nicht jedes Symbol, nicht jeder zynische Kommentar und nicht jeder provokante Clip ist automatisch rechtsextrem",https://www.mimikama.org/kind-rechtsextreme-inhalte-online-was-tun/,www.mimikama.org,Mein Kind sieht rechtsextreme Inhalte online – was Eltern jetzt tun können,0,LOW,False,,,factcheck,2026-05-04T03:24:00.298687
"Auffällig werden Inhalte dann, wenn sie sich wiederholt gegen bestimmte Gruppen richten, Menschen abwerten, autoritäre Ordnung verherrlichen oder immer wieder dieselben Feindbilder bedienen",https://www.mimikama.org/kind-rechtsextreme-inhalte-online-was-tun/,www.mimikama.org,Mein Kind sieht rechtsextreme Inhalte online – was Eltern jetzt tun können,0.1,LOW,False,,,factcheck,2026-05-04T03:24:00.386800
"[DEBUNKED] Voice-Cloning und KI-Stimmen: Methoden, Beispiele, Schutz",https://www.mimikama.org/voice-cloning-uebersicht/,www.mimikama.org,"Voice-Cloning und KI-Stimmen: Methoden, Beispiele, Schutz",0.9,HIGH,True,FALSE - Debunked by fact-checkers,www.mimikama.org,factcheck,2026-05-04T03:24:00.460547
[DEBUNKED] Sind seit 2008 12 Millionen illegale Migranten nach Europa gekommen?,https://www.mimikama.org/seit-2008-12-millionen-illegale-migranten-nach-europa/,www.mimikama.org,Sind seit 2008 12 Millionen illegale Migranten nach Europa gekommen?,0.9,HIGH,True,FALSE - Debunked by fact-checkers,www.mimikama.org,factcheck,2026-05-04T03:24:00.553031
"[DEBUNKED] KI-Betrug-Maschen: Deepfake, Voice-Cloning, Fake-Shops",https://www.mimikama.org/ki-betrug-maschen-uebersicht/,www.mimikama.org,"KI-Betrug-Maschen: Deepfake, Voice-Cloning, Fake-Shops",0.9,HIGH,True,FALSE - Debunked by fact-checkers,www.mimikama.org,factcheck,2026-05-04T03:24:00.622154
"[DEBUNKED] KI-Fake-News erkennen: ChatGPT, Grok &amp; Co. im Faktencheck",https://www.mimikama.org/ki-fake-news-uebersicht/,www.mimikama.org,"KI-Fake-News erkennen: ChatGPT, Grok &amp; Co. im Faktencheck",0.9,HIGH,True,FALSE - Debunked by fact-checkers,www.mimikama.org,factcheck,2026-05-04T03:24:00.700536
[DEBUNKED] Reiche-Lüge verbreitet: Warum ist die Tagesschau so schlecht bei Fakes der Regierung? - Volksverpetzer,https://www.volksverpetzer.de/faktencheck/reiche-luege-tagesschau/,www.volksverpetzer.de,Reiche-Lüge verbreitet: Warum ist die Tagesschau so schlecht bei Fakes der Regierung? - Volksverpetz,0.9,HIGH,True,FALSE - Debunked by fact-checkers,www.volksverpetzer.de,factcheck,2026-05-04T03:24:01.186763
"Nur wenige machen sich aber die Mühe, gegen den Rundfunkbeitrag von derzeit 18,36 Euro pro Monat zu klagen",https://www.volksverpetzer.de/serie/april-2026-swr-ausgewogen/,www.volksverpetzer.de,Urteile April 2026: SWR berichtet ausgewogen – Gericht weist Klage ab! - Volksverpetzer,0,LOW,False,,,factcheck,2026-05-04T03:24:01.761864
[DEBUNKED] &quot;Sämtlich unwahr&quot;: Gericht-Doppel-Klatsche für Reichelts Hetz-Portal NIUS! - Volksverpetzer,https://www.volksverpetzer.de/aktuelles/gericht-doppel-klatsche-nius/,www.volksverpetzer.de,&quot;Sämtlich unwahr&quot;: Gericht-Doppel-Klatsche für Reichelts Hetz-Portal NIUS! - Volksverpetze,0.9,HIGH,True,FALSE - Debunked by fact-checkers,www.volksverpetzer.de,factcheck,2026-05-04T03:24:02.247408
"Immer wieder Robert Habeck, Karl Lauterbach, Dunja Hayali, wirklich ganz oft Merkel, aber auch Spahn, Söder und viele, viele mehr sind pausenlos Ziel des rechten Hasses und strafrechtlich relevanter Morddrohungen",https://www.volksverpetzer.de/aktuelles/extrem-hass-afd-merz-reiche/,www.volksverpetzer.de,Morddrohungen: So extrem ist der Hass in AfD-Gruppen auf Merz und Reiche - Volksverpetzer,0.1,LOW,False,,,factcheck,2026-05-04T03:24:02.814205
&#8220; Und noch nie machte der rechte Hass natürlich Halt vor der CDU oder CSU,https://www.volksverpetzer.de/aktuelles/extrem-hass-afd-merz-reiche/,www.volksverpetzer.de,Morddrohungen: So extrem ist der Hass in AfD-Gruppen auf Merz und Reiche - Volksverpetzer,0.1,LOW,False,,,factcheck,2026-05-04T03:24:02.894132
"Im Jahr 2025 sank die Zahl der angezeigten Verbrechen deutlich (-5,6%)",https://www.volksverpetzer.de/analyse/auslaenderkriminalitaet-geht-zurueck/,www.volksverpetzer.de,(Ausländer)Kriminalität geht zurück! Wie du über Sicherheit belogen wirst - Volksverpetzer,0,LOW,False,,,factcheck,2026-05-04T03:24:03.471862
"So gingen zum Beispiel zurück: Gewaltkriminalität (-2,3%), Straßenkriminalität (-7%), Raubüberfälle (-6%) oder Betrug (-8%)",https://www.volksverpetzer.de/analyse/auslaenderkriminalitaet-geht-zurueck/,www.volksverpetzer.de,(Ausländer)Kriminalität geht zurück! Wie du über Sicherheit belogen wirst - Volksverpetzer,0,LOW,False,,,factcheck,2026-05-04T03:24:03.552041
Und auch die Zahl der ausländischen Tatverdächtigen (-10%) und ihr Anteil an den Straftaten (-2%) ging zurück,https://www.volksverpetzer.de/analyse/auslaenderkriminalitaet-geht-zurueck/,www.volksverpetzer.de,(Ausländer)Kriminalität geht zurück! Wie du über Sicherheit belogen wirst - Volksverpetzer,0,LOW,False,,,factcheck,2026-05-04T03:24:03.630887
"Wildtiere, die an Orten auftauchen, an denen Menschen sie nicht gewohnt sind, sorgen ja immer wieder für Schlagzeilen und Diskussionen",https://www.volksverpetzer.de/aktuelles/rechte-ostsee-wal-afd/,www.volksverpetzer.de,"So weird versuchen manche AfD-Fans, den Ostsee-Wal zu instrumentalisieren! - Volksverpetzer",0.1,LOW,False,,,factcheck,2026-05-04T03:24:04.191460
"März strandete er mehrmals in der Ostsee, konnte sich aber immer wieder durch Rettungsmaßnahmen freischwimmen",https://www.volksverpetzer.de/aktuelles/rechte-ostsee-wal-afd/,www.volksverpetzer.de,"So weird versuchen manche AfD-Fans, den Ostsee-Wal zu instrumentalisieren! - Volksverpetzer",0.1,LOW,False,,,factcheck,2026-05-04T03:24:04.268027
""" Andere sagen ""Rettet Wale und keine Migranten",https://www.volksverpetzer.de/aktuelles/rechte-ostsee-wal-afd/,www.volksverpetzer.de,"So weird versuchen manche AfD-Fans, den Ostsee-Wal zu instrumentalisieren! - Volksverpetzer",0.1,LOW,False,,,factcheck,2026-05-04T03:24:04.345145
[DEBUNKED] Dreiste Wählertäuschung! Juristen zerlegen Migrations-Pläne der AfD Sachsen-Anhalt - Volksverpetzer,https://www.volksverpetzer.de/analyse/afd-sachsen-anhalt-migration-luege/,www.volksverpetzer.de,Dreiste Wählertäuschung! Juristen zerlegen Migrations-Pläne der AfD Sachsen-Anhalt - Volksverpetzer,0.9,HIGH,True,FALSE - Debunked by fact-checkers,www.volksverpetzer.de,factcheck,2026-05-04T03:24:04.830755
"Screenshot Jeder Blick in den Spiegel wird zur Bewertung, jeder Millimeter des Gesichts zu einem Datenpunkt",https://www.volksverpetzer.de/analyse/looksmaxxing-tiktok-nazi/,www.volksverpetzer.de,Looksmaxxing – Macht dieser TikTok-Trend dein Kind zum Nazi? - Volksverpetzer,0,LOW,False,,,factcheck,2026-05-04T03:24:05.387193
"Wissenschaftliche Belege gibt es dafür zwar keine, trotzdem scheint das nur die wenigsten abzuschrecken",https://www.volksverpetzer.de/analyse/looksmaxxing-tiktok-nazi/,www.volksverpetzer.de,Looksmaxxing – Macht dieser TikTok-Trend dein Kind zum Nazi? - Volksverpetzer,0.1,LOW,False,,,factcheck,2026-05-04T03:24:05.465777
In beiden Ländern träumt die AfD seit Monaten angesichts von Umfragewerten von deutlich über 30 bis zu 40 Prozent von der Regierung und sieht die Wahlen in Baden-Württemberg und Rheinland-Pfalz als gutes Vorzeichen,https://www.volksverpetzer.de/analyse/afd-osten-keiner-merkt-es/,www.volksverpetzer.de,Die AfD verliert alle Wahlen im Osten – und keiner bekommt es mit - Volksverpetzer,0,LOW,False,,,factcheck,2026-05-04T03:24:06.026146
"Bei den Bürgermeisterwahlen im vorpommerschen Anklam gewann der amtierende Bürgermeister Michael Galander von der Wählergemeinschaft Initiativen für Anklam mit 72,13 Prozent haushoch gegen AfD-Kandidat Jörg Valentin (27,9 Prozent)",https://www.volksverpetzer.de/analyse/afd-osten-keiner-merkt-es/,www.volksverpetzer.de,Die AfD verliert alle Wahlen im Osten – und keiner bekommt es mit - Volksverpetzer,0,LOW,False,,,factcheck,2026-05-04T03:24:06.101967
"Denn immer wieder zeigt sich, dass auf kommunaler Ebene eben nach persönlicher Sympathie und Kompetenz und weniger nach Parteibuch entschieden wird",https://www.volksverpetzer.de/analyse/afd-osten-keiner-merkt-es/,www.volksverpetzer.de,Die AfD verliert alle Wahlen im Osten – und keiner bekommt es mit - Volksverpetzer,0.1,LOW,False,,,factcheck,2026-05-04T03:24:06.178829
[DEBUNKED] Declassified CIA document doesn't reveal cure for cancer. Here's what it actually says | Snopes.com,https://www.snopes.com/fact-check/cancer-cure-cia-document/,www.snopes.com,Declassified CIA document doesn't reveal cure for cancer. Here's what it actually says | Snopes.com,0.9,HIGH,True,FALSE - Debunked by fact-checkers,www.snopes.com,factcheck,2026-05-04T03:24:06.286857
[DEBUNKED] Did photo of dog chasing bird off cliff inspire 'Looney Tunes' characters? Don't fall for claim | Snopes.com,https://www.snopes.com/fact-check/coyote-roadrunner-photo-looney-tunes/,www.snopes.com,Did photo of dog chasing bird off cliff inspire 'Looney Tunes' characters? Don't fall for claim | Sn,0.9,HIGH,True,FALSE - Debunked by fact-checkers,www.snopes.com,factcheck,2026-05-04T03:24:06.378526
[DEBUNKED] Watch out for these 17 fake Trump Truth Social posts | Snopes.com,https://www.snopes.com/collections/trump-truth-social-fake-posts/,www.snopes.com,Watch out for these 17 fake Trump Truth Social posts | Snopes.com,0.9,HIGH,True,FALSE - Debunked by fact-checkers,www.snopes.com,factcheck,2026-05-04T03:24:06.479074
[DEBUNKED] Was Rachel Maddow suspended without pay over comments about Trump assassination attempts? Don't be fooled | Snopes.com,https://www.snopes.com/fact-check/maddow-suspended-trump-assassins/,www.snopes.com,Was Rachel Maddow suspended without pay over comments about Trump assassination attempts? Don't be f,0.9,HIGH,True,FALSE - Debunked by fact-checkers,www.snopes.com,factcheck,2026-05-04T03:24:06.823993
"[DEBUNKED] Trump post saying he had Comey 'arrested,' threatening Kimmel is fake. Here's proof | Snopes.com",https://www.snopes.com/fact-check/fake-trump-post-comey-kimmel/,www.snopes.com,"Trump post saying he had Comey 'arrested,' threatening Kimmel is fake. Here's proof | Snopes.com",0.9,HIGH,True,FALSE - Debunked by fact-checkers,www.snopes.com,factcheck,2026-05-04T03:24:07.045335
[DEBUNKED] Posts claim Trump appointed Ghislaine Maxwell's former defense attorney as acting AG. Here's the real story | Snopes.com,https://www.snopes.com/fact-check/trump-ghislaine-maxwell-attorney-general/,www.snopes.com,Posts claim Trump appointed Ghislaine Maxwell's former defense attorney as acting AG. Here's the rea,0.9,HIGH,True,FALSE - Debunked by fact-checkers,www.snopes.com,factcheck,2026-05-04T03:24:07.342591
"[DEBUNKED] Investigating claim Chief Justice Roberts, wife took $20M from law firms he ruled on | Snopes.com",https://www.snopes.com/news/2026/05/01/chief-justice-roberts-wife-law-firms/,www.snopes.com,"Investigating claim Chief Justice Roberts, wife took $20M from law firms he ruled on | Snopes.com",0.9,HIGH,True,FALSE - Debunked by fact-checkers,www.snopes.com,factcheck,2026-05-04T03:24:07.563180
[DEBUNKED] 16 rumors we've inspected about King Charles III | Snopes.com,https://www.snopes.com/collections/king-charles-iii-rumors/,www.snopes.com,16 rumors we've inspected about King Charles III | Snopes.com,0.9,HIGH,True,FALSE - Debunked by fact-checkers,www.snopes.com,factcheck,2026-05-04T03:24:07.677683
"[DEBUNKED] Did Meghan, Duchess of Sussex, superglue sorority sisters' eyelids shut? There's no proof | Snopes.com",https://www.snopes.com/news/2026/05/01/meghan-sorority-eyelids-hazing/,www.snopes.com,"Did Meghan, Duchess of Sussex, superglue sorority sisters' eyelids shut? There's no proof | Snopes.c",0.9,HIGH,True,FALSE - Debunked by fact-checkers,www.snopes.com,factcheck,2026-05-04T03:24:07.762724
"A plurality means it was the highest of any single category, but not 50% plus one",http://www.politifact.com/factchecks/2026/apr/29/ron-desantis/florida-redistricting-republican-democrat-majority/,www.politifact.com,PolitiFact | Florida redistricting: DeSantis overstates voters’ shift from Democrats to Republicans,0,LOW,False,,,factcheck,2026-05-04T03:24:08.694619
"Drought Monitor, and about 22% of the state is in an ""exceptional drought,"" the system’s highest level",http://www.politifact.com/article/2026/apr/27/Florida-drought-hurricane-season-active/,www.politifact.com,PolitiFact | DeSantis said Florida’s drought could bring a quieter hurricane season. Is that true?,0,LOW,False,,,factcheck,2026-05-04T03:24:08.921684
[DEBUNKED] Footage of small boat being intercepted by Border Force is fake – Full Fact,https://fullfact.org/immigration/migrant-small-boat-channel-fake-ai-video/,fullfact.org,Footage of small boat being intercepted by Border Force is fake – Full Fact,0.9,HIGH,True,FALSE - Debunked by fact-checkers,fullfact.org,factcheck,2026-05-04T03:24:09.553576
