claim,source_url,source_domain,article_title,risk_score,risk_category,has_factcheck,factcheck_rating,factcheck_source,source_type,checked_at
[DEBUNKED] Klimawandel: Warum bisheriges Worst-Case-Szenario inzwischen unplausibel ist,https://correctiv.org/faktencheck/hintergrund/2026/05/28/klimawandel-warum-das-worst-case-szenario-abgeschwaecht-wurde/,correctiv.org,Klimawandel: Warum bisheriges Worst-Case-Szenario inzwischen unplausibel ist,0.9,HIGH,True,FALSE - Debunked by fact-checkers,correctiv.org,factcheck,2026-05-28T16:01:43.919017
[DEBUNKED] Tiktok-Video zu angeblichem Ikea-Vorfall vermischt KI und alte Aufnahmen,https://correctiv.org/faktencheck/aus-der-community/2026/05/28/kein-echter-vorfall-bei-ikea-tiktok-video-ist-mischung-aus-ki-und-alten-aufnahmen/,correctiv.org,Tiktok-Video zu angeblichem Ikea-Vorfall vermischt KI und alte Aufnahmen,0.9,HIGH,True,FALSE - Debunked by fact-checkers,correctiv.org,factcheck,2026-05-28T16:01:45.068422
[DEBUNKED] Illegale Deponie in Gelsenkirchen: „Natürlich sind das giftige Abfälle“ - correctiv.org,https://correctiv.org/umweltverbrechen-in-nrw/2026/05/28/illegale-deponie-in-gelsenkirchen-natuerlich-sind-das-gefaehrliche-abfaelle/,correctiv.org,Illegale Deponie in Gelsenkirchen: „Natürlich sind das giftige Abfälle“ - correctiv.org,0.9,HIGH,True,FALSE - Debunked by fact-checkers,correctiv.org,factcheck,2026-05-28T16:01:46.058284
[DEBUNKED] Care-Arbeitstage ohne Ende? - correctiv.org,https://correctiv.org/aktuelles/politik-2/2026/05/27/care-arbeitstage-ohne-ende/,correctiv.org,Care-Arbeitstage ohne Ende? - correctiv.org,0.9,HIGH,True,FALSE - Debunked by fact-checkers,correctiv.org,factcheck,2026-05-28T16:01:47.010337
Jeder Konferenztag beginnt mit einer gemeinsamen Auftaktveranstaltung,https://correctiv.org/in-eigener-sache/2026/05/26/perfekte-pitches-ki-und-pressefreiheit-in-bewegten-zeiten-ausblick-auf-die-correctiv-lokal-konferenz-2026/,correctiv.org,"Perfekte Pitches, KI und Pressefreiheit in bewegten Zeiten: Ausblick auf die CORRECTIV.Lokal Konfere",0,LOW,False,,,factcheck,2026-05-28T16:01:48.226719
"Erste Programm-Highlights veröffentlicht Die ersten bestätigten Beiträge verbinden investigative Praxis, wissenschaftliche Perspektiven und konkrete Werkzeuge für den Redaktionsalltag",https://correctiv.org/in-eigener-sache/2026/05/26/perfekte-pitches-ki-und-pressefreiheit-in-bewegten-zeiten-ausblick-auf-die-correctiv-lokal-konferenz-2026/,correctiv.org,"Perfekte Pitches, KI und Pressefreiheit in bewegten Zeiten: Ausblick auf die CORRECTIV.Lokal Konfere",0,LOW,False,,,factcheck,2026-05-28T16:01:48.436452
"Das Papier wird für 7,50 Euro im Online-Shop und auf der Webseite zum Herunterladen angeboten",https://correctiv.org/aktuelles/neue-rechte/2026/05/26/rechte-cancel-culture-gegen-cdu-broschuere/,correctiv.org,Rechte Cancel-Culture gegen CDU-Broschüre - correctiv.org,0,LOW,False,,,factcheck,2026-05-28T16:01:49.760825
Darin wird die AfD als „keine Alternative“ bezeichnet,https://correctiv.org/aktuelles/neue-rechte/2026/05/26/rechte-cancel-culture-gegen-cdu-broschuere/,correctiv.org,Rechte Cancel-Culture gegen CDU-Broschüre - correctiv.org,0.1,LOW,False,,,factcheck,2026-05-28T16:01:49.962550
"Und entsprechend sollen alle Menschen, die diesem völkischen Ideal der AfD nicht entsprechen, keinen Platz in unserem Land haben",https://correctiv.org/aktuelles/neue-rechte/2026/05/26/rechte-cancel-culture-gegen-cdu-broschuere/,correctiv.org,Rechte Cancel-Culture gegen CDU-Broschüre - correctiv.org,0.1,LOW,False,,,factcheck,2026-05-28T16:01:50.173156
[DEBUNKED] Keine Hantavirus-Einsatz: Foto zeigt Marineübung im Jahr 2025,https://correctiv.org/faktencheck/2026/05/22/kein-hantavirus-einsatz-foto-zeigt-marineuebung-im-jahr-2025/,correctiv.org,Keine Hantavirus-Einsatz: Foto zeigt Marineübung im Jahr 2025,0.9,HIGH,True,FALSE - Debunked by fact-checkers,correctiv.org,factcheck,2026-05-28T16:01:51.278612
"Diese Warnung hört man immer mal wieder, sie soll sogar von Albert Einstein sein",https://correctiv.org/faktencheck/2026/05/22/geruechtekiller-sterben-menschen-unweigerlich-aus-wenn-bienen-aussterben/,correctiv.org,"Gerüchtekiller: Stirbt die Menschheit unweigerlich aus, wenn Bienen aussterben?",0.1,LOW,False,,,factcheck,2026-05-28T16:01:52.612745
"Sterben die Menschen wirklich aus, wenn Bienen keine Pflanzen mehr bestäuben",https://correctiv.org/faktencheck/2026/05/22/geruechtekiller-sterben-menschen-unweigerlich-aus-wenn-bienen-aussterben/,correctiv.org,"Gerüchtekiller: Stirbt die Menschheit unweigerlich aus, wenn Bienen aussterben?",0.1,LOW,False,,,factcheck,2026-05-28T16:01:52.697121
Basisnahrungsmittel brauchen keine tierische Bestäubung Die einfache Antwort: Nein,https://correctiv.org/faktencheck/2026/05/22/geruechtekiller-sterben-menschen-unweigerlich-aus-wenn-bienen-aussterben/,correctiv.org,"Gerüchtekiller: Stirbt die Menschheit unweigerlich aus, wenn Bienen aussterben?",0.1,LOW,False,,,factcheck,2026-05-28T16:01:52.921659
Dafür gibt es jedoch keine Belege – das Zitat geht mutmaßlich auf eine unseriöse Webseite zurück,https://correctiv.org/faktencheck/2026/05/22/china-und-usa-profile-sammeln-mit-angeblichem-xi-jinping-zitat-zu-donaltrump-klicks/,correctiv.org,Mit angeblichem Xi-Jinping-Zitat zu Trump werden Klicks gesammelt,0.1,LOW,False,,,factcheck,2026-05-28T16:01:54.274349
"Das Zitat kursiert seit Sommer 2025, es finden sich aber keine seriösen Quellen dafür",https://correctiv.org/faktencheck/2026/05/22/china-und-usa-profile-sammeln-mit-angeblichem-xi-jinping-zitat-zu-donaltrump-klicks/,correctiv.org,Mit angeblichem Xi-Jinping-Zitat zu Trump werden Klicks gesammelt,0.1,LOW,False,,,factcheck,2026-05-28T16:01:54.483188
"Fakt ist: Es gibt keine Belege dafür, dass das Zitat so öffentlich gefallen ist und eine China-Expertin ordnet ein, warum der Satz auch nicht zu chinesischen Narrativen passt",https://correctiv.org/faktencheck/2026/05/22/china-und-usa-profile-sammeln-mit-angeblichem-xi-jinping-zitat-zu-donaltrump-klicks/,correctiv.org,Mit angeblichem Xi-Jinping-Zitat zu Trump werden Klicks gesammelt,0.1,LOW,False,,,factcheck,2026-05-28T16:01:54.591559
"Es gebe nach wie vor keine Statistik, die „das wahre Ausmaß“ abbilde, bemängelte Franziskus: Nicht von der Weltgesundheitsorganisation (WHO), nicht vom Kinderhilfswerk Unicef oder von Behörden wie Interpol",https://correctiv.org/aktuelles/akten-des-missbrauchs/2026/05/22/missbrauch-kirche-umfrage-hinweise/,correctiv.org,Missbrauch in Kirche: Melden Sie sich mit Hinweisen!,0.1,LOW,False,,,factcheck,2026-05-28T16:01:55.790760
"Auch CORRECTIV hat keine offizielle Statistik gefunden, die nicht von einer hohen Dunkelziffer ausgeht",https://correctiv.org/aktuelles/akten-des-missbrauchs/2026/05/22/missbrauch-kirche-umfrage-hinweise/,correctiv.org,Missbrauch in Kirche: Melden Sie sich mit Hinweisen!,0.1,LOW,False,,,factcheck,2026-05-28T16:01:55.991253
"Um der Frage näher zu kommen, hat CORRECTIV für die Recherche „Akten des Missbrauchs“ Anfragen an alle Bistümer und größere Orden auf der Welt gestellt",https://correctiv.org/aktuelles/akten-des-missbrauchs/2026/05/22/missbrauch-kirche-umfrage-hinweise/,correctiv.org,Missbrauch in Kirche: Melden Sie sich mit Hinweisen!,0.1,LOW,False,,,factcheck,2026-05-28T16:01:56.191310
[DEBUNKED] Linke will deutsche Zusammenarbeit mit Europol überprüfen lassen,https://correctiv.org/aktuelles/europa-aktuelles/2026/05/26/nach-correctiv-recherche-linke-fordert-deutschlands-zusammenarbeit-mit-europol-zu-ueberpruefen/,correctiv.org,Linke will deutsche Zusammenarbeit mit Europol überprüfen lassen,0.9,HIGH,True,FALSE - Debunked by fact-checkers,correctiv.org,factcheck,2026-05-28T16:01:57.156187
[DEBUNKED] Nirgendwo existieren: Queere und trans Afghanen auf der Flucht - correctiv.org,https://correctiv.org/aktuelles/international/2026/05/22/nirgendwo-existieren-wie-queere-und-trans-afghanen-durch-alle-sicherheitsnetze-fallen/,correctiv.org,Nirgendwo existieren: Queere und trans Afghanen auf der Flucht - correctiv.org,0.9,HIGH,True,FALSE - Debunked by fact-checkers,correctiv.org,factcheck,2026-05-28T16:01:58.261783
[DEBUNKED] Razzien wegen Sanktionsverstoß bei IT-Firmen in den Niederlanden,https://correctiv.org/faktencheck/hintergrund/2026/05/22/cyberangriffe-und-desinformation-razzien-wegen-sanktionsverstoss-bei-it-firmen-in-den-niederlanden/,correctiv.org,Razzien wegen Sanktionsverstoß bei IT-Firmen in den Niederlanden,0.9,HIGH,True,FALSE - Debunked by fact-checkers,correctiv.org,factcheck,2026-05-28T16:01:59.383668
[DEBUNKED] Foto von Busfahrer ohne Maske hat keinen Bezug zu Hantavirus,https://correctiv.org/faktencheck/2026/05/22/foto-von-busfahrer-ohne-maske-hat-keinen-bezug-zu-hantavirus/,correctiv.org,Foto von Busfahrer ohne Maske hat keinen Bezug zu Hantavirus,0.9,HIGH,True,FALSE - Debunked by fact-checkers,correctiv.org,factcheck,2026-05-28T16:02:00.489311
[DEBUNKED] Von München bis Aachen: Im Netz der China-Agenten,https://correctiv.org/hybride-kriegsfuehrung/2026/05/21/von-muenchen-bis-aachen-im-netz-der-china-agenten/,correctiv.org,Von München bis Aachen: Im Netz der China-Agenten,0.9,HIGH,True,FALSE - Debunked by fact-checkers,correctiv.org,factcheck,2026-05-28T16:02:01.612017
[DEBUNKED] FIFA-WM 2026: Riesiges Betrugsnetz entdeckt?,https://www.mimikama.org/fifa-wm-2026-riesiges-betrugsnetz-entdeckt/,www.mimikama.org,FIFA-WM 2026: Riesiges Betrugsnetz entdeckt?,0.9,HIGH,True,FALSE - Debunked by fact-checkers,www.mimikama.org,factcheck,2026-05-28T16:02:01.694678
[DEBUNKED] Hat Merz die UN-Feindstaatenklausel aktiviert?,https://www.mimikama.org/merz-un-feindstaatenklausel-aktiviert/,www.mimikama.org,Hat Merz die UN-Feindstaatenklausel aktiviert?,0.9,HIGH,True,FALSE - Debunked by fact-checkers,www.mimikama.org,factcheck,2026-05-28T16:02:01.935870
[DEBUNKED] Abzocke mit Mitgefühl: Die Mitleidsmasche,https://www.mimikama.org/abzocke-mit-mitgefuehl-mitleidsmasche/,www.mimikama.org,Abzocke mit Mitgefühl: Die Mitleidsmasche,0.9,HIGH,True,FALSE - Debunked by fact-checkers,www.mimikama.org,factcheck,2026-05-28T16:02:02.015180
[DEBUNKED] Sterben mehr Menschen an der Masernimpfung als an Masern?,https://www.mimikama.org/todesfaelle-masern-impfung/,www.mimikama.org,Sterben mehr Menschen an der Masernimpfung als an Masern?,0.9,HIGH,True,FALSE - Debunked by fact-checkers,www.mimikama.org,factcheck,2026-05-28T16:02:02.258916
[DEBUNKED] Warum Screenshots von Hilferufen problematisch sind,https://www.mimikama.org/alte-hilferuf-screenshots-teilen/,www.mimikama.org,Warum Screenshots von Hilferufen problematisch sind,0.9,HIGH,True,FALSE - Debunked by fact-checkers,www.mimikama.org,factcheck,2026-05-28T16:02:02.344612
"[DEBUNKED] Verlässt Dänemark EU, WHO, UN und WEF?",https://www.mimikama.org/verlaesst-daenemark-eu-who-un-wef/,www.mimikama.org,"Verlässt Dänemark EU, WHO, UN und WEF?",0.9,HIGH,True,FALSE - Debunked by fact-checkers,www.mimikama.org,factcheck,2026-05-28T16:02:02.601161
[DEBUNKED] Klimawandel-Szenario RCP8.5: Falsche Prognosen oder Wahrheit?,https://www.mimikama.org/klimawandel-szenario-wurde-nur-angepasst/,www.mimikama.org,Klimawandel-Szenario RCP8.5: Falsche Prognosen oder Wahrheit?,0.9,HIGH,True,FALSE - Debunked by fact-checkers,www.mimikama.org,factcheck,2026-05-28T16:02:02.705870
"[DEBUNKED] Sind wirklich nur 5,6 % der Bürgergeldempfänger Deutsche?",https://www.mimikama.org/nur-5-6-prozent-buergergeldempfaenger-deutsche/,www.mimikama.org,"Sind wirklich nur 5,6 % der Bürgergeldempfänger Deutsche?",0.9,HIGH,True,FALSE - Debunked by fact-checkers,www.mimikama.org,factcheck,2026-05-28T16:02:02.788961
"[DEBUNKED] Will Rutte eine 0,25 %-Dauerabgabe aller EU- und NATO-Staaten an die Ukraine?",https://www.mimikama.org/rutte-025-prozent-dauerabgabe-eu-nato-ukraine/,www.mimikama.org,"Will Rutte eine 0,25 %-Dauerabgabe aller EU- und NATO-Staaten an die Ukraine?",0.9,HIGH,True,FALSE - Debunked by fact-checkers,www.mimikama.org,factcheck,2026-05-28T16:02:02.888516
"[DEBUNKED] Mimikama SOS: Hilfe bei Betrug, Fake News &amp; Konto-Hack",https://www.mimikama.org/hilfe-bei-online-betrug-fake-news-konto-hack/,www.mimikama.org,"Mimikama SOS: Hilfe bei Betrug, Fake News &amp; Konto-Hack",0.9,HIGH,True,FALSE - Debunked by fact-checkers,www.mimikama.org,factcheck,2026-05-28T16:02:02.968032
[DEBUNKED] 10 %-Gebühr auf Geldeingänge? Falschmeldung auf Facebook entlarvt!,https://www.mimikama.org/stimmt-die-10-gebuehr-auf-geldeingaenge/,www.mimikama.org,10 %-Gebühr auf Geldeingänge? Falschmeldung auf Facebook entlarvt!,0.9,HIGH,True,FALSE - Debunked by fact-checkers,www.mimikama.org,factcheck,2026-05-28T16:02:03.230618
[DEBUNKED] Faktencheck: Aldi-Fleischpaket für Senioren kostenlos?,https://www.mimikama.org/aldi-fleischpaket-fuer-senioren-kostenlos/,www.mimikama.org,Faktencheck: Aldi-Fleischpaket für Senioren kostenlos?,0.9,HIGH,True,FALSE - Debunked by fact-checkers,www.mimikama.org,factcheck,2026-05-28T16:02:03.321139
[DEBUNKED] Nutzen Betrüger eine offizielle Microsoft-Adresse?,https://www.mimikama.org/betrueger-nutzen-offizielle-microsoft-adresse/,www.mimikama.org,Nutzen Betrüger eine offizielle Microsoft-Adresse?,0.9,HIGH,True,FALSE - Debunked by fact-checkers,www.mimikama.org,factcheck,2026-05-28T16:02:03.403400
[DEBUNKED] Faktencheck: Steckt hinter mNexspike wirklich eine Todesbotschaft?,https://www.mimikama.org/bedeutet-mnexspike-wirklich-tod/,www.mimikama.org,Faktencheck: Steckt hinter mNexspike wirklich eine Todesbotschaft?,0.9,HIGH,True,FALSE - Debunked by fact-checkers,www.mimikama.org,factcheck,2026-05-28T16:02:03.493195
[DEBUNKED] Kommt wegen Ebola jetzt der nächste Lockdown?,https://www.mimikama.org/kommt-wegen-ebola-jetzt-der-naechste-lockdown/,www.mimikama.org,Kommt wegen Ebola jetzt der nächste Lockdown?,0.9,HIGH,True,FALSE - Debunked by fact-checkers,www.mimikama.org,factcheck,2026-05-28T16:02:03.576238
"Laut der&nbsp;Mobilen Beratung gegen Rechtsextremismus in Thüringen&nbsp;ist Frank Haußner eine zentrale Mobilisierungsfigur des Netzwerks, das Verbindungen in die Reichsbürger- und Neonazi-Szene unterhält und zugleich enge Bezüge zur AfD pflegt",https://www.volksverpetzer.de/analyse/dunkle-maechte-afd-windkraft/,www.volksverpetzer.de,&quot;Dunkle Mächte&quot;: Das ECHTE Motiv hinter dem AfD-Windkraft-Protest - Volksverpetzer,0,LOW,False,,,factcheck,2026-05-28T16:02:04.785059
Der daraus jährlich erzeugte Strom könnte nach Angaben des Unternehmens den Bedarf von etwa 16,https://www.volksverpetzer.de/analyse/dunkle-maechte-afd-windkraft/,www.volksverpetzer.de,&quot;Dunkle Mächte&quot;: Das ECHTE Motiv hinter dem AfD-Windkraft-Protest - Volksverpetzer,0,LOW,False,,,factcheck,2026-05-28T16:02:04.997295
"Mit einem motivierenden Aufruf an alle Politiker:innen, Aktivist:innen, Wähler:innen und Entscheider:innen, jetzt richtig anzupacken",https://www.volksverpetzer.de/faktencheck/klimaschutz-wirkt-rechte-luegen-ipcc/,www.volksverpetzer.de,"Forscher bestätigen, dass Klimaschutz wirkt – deswegen wollen Rechte ihn jetzt abschaffen?! - Volksv",0.1,LOW,False,,,factcheck,2026-05-28T16:02:06.029758
"Sie veröffentlichten einen Offenen Brief an die Westend-Geschäftsführung, in dem sie Vorbehalte andeuten gegen die Poschardt-Bücher und auch die Titel des FDP-Politikers Wolfgang Kubicki, der seit Jahren immer wieder bei Westend publiziert",https://www.volksverpetzer.de/aktuelles/autoren-treten-aus-westend-verlag/,www.volksverpetzer.de,32 Autoren beenden Zusammenarbeit: Westend-Verlag driftet nach rechts - Volksverpetzer,0.1,LOW,False,,,factcheck,2026-05-28T16:02:07.040352
[DEBUNKED] Irreführende AfD-&quot;Angriffe&quot;: Was diese Statistik der Tagesschau alles nicht verrät - Volksverpetzer,https://www.volksverpetzer.de/faktencheck/statistik-tagesschau-afd-angriffe/,www.volksverpetzer.de,Irreführende AfD-&quot;Angriffe&quot;: Was diese Statistik der Tagesschau alles nicht verrät - Volks,0.9,HIGH,True,FALSE - Debunked by fact-checkers,www.volksverpetzer.de,factcheck,2026-05-28T16:02:07.844781
"[DEBUNKED] MV: Wie Medien AfD-Wahlkampf machen, ohne es zu merken - Volksverpetzer",https://www.volksverpetzer.de/aktuelles/medien-afd-mv-wahlkampf/,www.volksverpetzer.de,"MV: Wie Medien AfD-Wahlkampf machen, ohne es zu merken - Volksverpetzer",0.9,HIGH,True,FALSE - Debunked by fact-checkers,www.volksverpetzer.de,factcheck,2026-05-28T16:02:08.666103
[DEBUNKED] Die AfD schreibt bei der AfD ab – samt peinlicher Fehler! - Volksverpetzer,https://www.volksverpetzer.de/aktuelles/afd-schreibt-afd-ab/,www.volksverpetzer.de,Die AfD schreibt bei der AfD ab – samt peinlicher Fehler! - Volksverpetzer,0.9,HIGH,True,FALSE - Debunked by fact-checkers,www.volksverpetzer.de,factcheck,2026-05-28T16:02:09.502654
"„Generation Deutschland“: ein Sammelbecken an Rechtsextremisten Nach der Gründung der neuen AfD-Jugend auf Bundesebene im letzten Jahr in Gießen haben sich nun auch fast alle Landesverbände der ""Generation Deutschland"" gegründet",https://www.volksverpetzer.de/analyse/grosse-generation-deutschland/,www.volksverpetzer.de,Die große &quot;Generation Deutschland&quot;-Recherche: Der Trick der AfD‑Jugend entlarvt! - Volksve,0.1,LOW,False,,,factcheck,2026-05-28T16:02:10.542876
[DEBUNKED] Warum Zehdenick für die AfD eine Ausnahme bleiben wird - Volksverpetzer,https://www.volksverpetzer.de/analyse/zehdenick-afd-problem/,www.volksverpetzer.de,Warum Zehdenick für die AfD eine Ausnahme bleiben wird - Volksverpetzer,0.9,HIGH,True,FALSE - Debunked by fact-checkers,www.volksverpetzer.de,factcheck,2026-05-28T16:02:11.400745
[DEBUNKED] Wie die Ostdeutsche Allgemeine Volksverpetzer zum Schweigen bringen will - Volksverpetzer,https://www.volksverpetzer.de/aktuelles/ostdeutsche-allgemeine-anwalt-anschwaerzen/,www.volksverpetzer.de,Wie die Ostdeutsche Allgemeine Volksverpetzer zum Schweigen bringen will - Volksverpetzer,0.9,HIGH,True,FALSE - Debunked by fact-checkers,www.volksverpetzer.de,factcheck,2026-05-28T16:02:12.343546
"[DEBUNKED] Thieves aren't using perfume to knock out victims, despite persistent rumors | Snopes.com",https://www.snopes.com/fact-check/thieves-perfume-shock-victims/,www.snopes.com,"Thieves aren't using perfume to knock out victims, despite persistent rumors | Snopes.com",0.9,HIGH,True,FALSE - Debunked by fact-checkers,www.snopes.com,factcheck,2026-05-28T16:02:12.441493
[DEBUNKED] Was bad weather forecast nonexistent before Trump moved Cabinet meeting from Camp David? | Snopes.com,https://www.snopes.com/fact-check/trump-bad-weather-camp-david/,www.snopes.com,Was bad weather forecast nonexistent before Trump moved Cabinet meeting from Camp David? | Snopes.co,0.9,HIGH,True,FALSE - Debunked by fact-checkers,www.snopes.com,factcheck,2026-05-28T16:02:12.991090
[DEBUNKED] Is Donald Trump Jr.'s wife Bettina Anderson the daughter of Epstein's former banker? | Snopes.com,https://www.snopes.com/fact-check/bettina-anderson-father-epstein/,www.snopes.com,Is Donald Trump Jr.'s wife Bettina Anderson the daughter of Epstein's former banker? | Snopes.com,0.9,HIGH,True,FALSE - Debunked by fact-checkers,www.snopes.com,factcheck,2026-05-28T16:02:13.083204
"[DEBUNKED] Laws banning 'aimless driving' haven't taken effect in New York, other US states | Snopes.com",https://www.snopes.com/fact-check/aimless-driving-laws-fake/,www.snopes.com,"Laws banning 'aimless driving' haven't taken effect in New York, other US states | Snopes.com",0.9,HIGH,True,FALSE - Debunked by fact-checkers,www.snopes.com,factcheck,2026-05-28T16:02:13.787245
[DEBUNKED] Is new 'Godfather' movie in development? Not so fast | Snopes.com,https://www.snopes.com/fact-check/new-godfather-movie-sequel/,www.snopes.com,Is new 'Godfather' movie in development? Not so fast | Snopes.com,0.9,HIGH,True,FALSE - Debunked by fact-checkers,www.snopes.com,factcheck,2026-05-28T16:02:13.995346
[DEBUNKED] Did Big Mac shrink by 40% while price skyrocketed from 50 cents to $8? | Snopes.com,https://www.snopes.com/news/2026/05/25/big-mac-price-increase/,www.snopes.com,Did Big Mac shrink by 40% while price skyrocketed from 50 cents to $8? | Snopes.com,0.9,HIGH,True,FALSE - Debunked by fact-checkers,www.snopes.com,factcheck,2026-05-28T16:02:14.098669
"[DEBUNKED] PolitiFact | In Texas Senate race, Ken Paxton falsely claims James Talarico is a vegan",http://www.politifact.com/factchecks/2026/may/27/ken-paxton/in-texas-senate-race-ken-paxton-falsely-claims-jam/,www.politifact.com,"PolitiFact | In Texas Senate race, Ken Paxton falsely claims James Talarico is a vegan",0.9,HIGH,True,FALSE - Debunked by fact-checkers,www.politifact.com,factcheck,2026-05-28T16:02:14.199283
Medication abortions successfully end pregnancies about 95% of the time,http://www.politifact.com/article/2026/may/26/medication-abortion-mifepristone-safety-studies/,www.politifact.com,"PolitiFact | Amid efforts to restrict mifepristone access, here&#x27;s what studies say about the me",0,LOW,False,,,factcheck,2026-05-28T16:02:14.580763
"Higher SPF means stronger protection, but no sunscreen can block 100% of the sun’s UVB rays",http://www.politifact.com/article/2026/may/26/do-i-need-spf-30-50-or-100-we-answer-your-burning/,www.politifact.com,"PolitiFact | Do you need SPF 30, 50 or 100? We answer your burning sunscreen questions",0.1,LOW,False,,,factcheck,2026-05-28T16:02:14.858655
"SPF 30 sunscreen filters about 97% of UVB rays, for example, and SPF 50 filters about 98%, said Dr",http://www.politifact.com/article/2026/may/26/do-i-need-spf-30-50-or-100-we-answer-your-burning/,www.politifact.com,"PolitiFact | Do you need SPF 30, 50 or 100? We answer your burning sunscreen questions",0,LOW,False,,,factcheck,2026-05-28T16:02:15.065858
"It referred to calculations from the New York State Division of the Budget that put the ""new effective tariff rate"" at 21% on imported goods, or $4,200 more per New York household",http://www.politifact.com/factchecks/2026/may/21/kirsten-gillibrand/tariff-burden-households-new-york/,www.politifact.com,"PolitiFact | Sen. Kirsten Gillibrand says tariffs cost New Yorkers $4,200 a year. Most recent estima",0,LOW,False,,,factcheck,2026-05-28T16:02:15.577683
[DEBUNKED] PolitiFact | No evidence that San Diego mosque shooting suspects were transgender couple,http://www.politifact.com/factchecks/2026/may/20/social-media/no-evidence-san-diego-mosque-suspects-trans/,www.politifact.com,PolitiFact | No evidence that San Diego mosque shooting suspects were transgender couple,0.9,HIGH,True,FALSE - Debunked by fact-checkers,www.politifact.com,factcheck,2026-05-28T16:02:15.805500
"For this year, enrollees then faced premiums that increased, on average, by 26%",http://www.politifact.com/article/2026/may/20/as-aca-enrollment-drops-higher-insurance-rates-may/,www.politifact.com,"PolitiFact | As ACA enrollment drops, higher insurance rates may follow",0,LOW,False,,,factcheck,2026-05-28T16:02:16.089138
"A KFF analysis released May 19, for instance, found that the average ACA plan deductible saw the steepest increase in history — growing by 37%, or over $1,000, from $2,759 in 2025 to $3,786 in 2026 as enhanced premium tax credits expired",http://www.politifact.com/article/2026/may/20/as-aca-enrollment-drops-higher-insurance-rates-may/,www.politifact.com,"PolitiFact | As ACA enrollment drops, higher insurance rates may follow",0,LOW,False,,,factcheck,2026-05-28T16:02:16.292560
2% of students in grades 6 through 12 still reported second hand exposure to aerosols from e-cigarettes,http://www.politifact.com/article/2026/may/19/secondhand-vaping-health-risks-research/,www.politifact.com,"PolitiFact | When someone’s vaping nearby, what are you breathing in? The risks of vape pens’ second",0,LOW,False,,,factcheck,2026-05-28T16:02:16.579340
[DEBUNKED] Southport attacker Axel Rudakubana has not suffered ‘violent assault’ in prison – Full Fact,https://fullfact.org/crime/southport-killer-rudakubana-prison-attack-claim-false/,fullfact.org,Southport attacker Axel Rudakubana has not suffered ‘violent assault’ in prison – Full Fact,0.9,HIGH,True,FALSE - Debunked by fact-checkers,fullfact.org,factcheck,2026-05-28T16:02:17.386914
[DEBUNKED] Tony Blair’s son does not run a company being paid £100 billion to develop digital ID – Full Fact,https://fullfact.org/politics/tony-blair-son-euan-company-digital-id-contract-false/,fullfact.org,Tony Blair’s son does not run a company being paid £100 billion to develop digital ID – Full Fact,0.9,HIGH,True,FALSE - Debunked by fact-checkers,fullfact.org,factcheck,2026-05-28T16:02:19.419344
[DEBUNKED] Getting started with the Misinformation Toolkit – Full Fact,https://fullfact.org/toolkit/getting-started-with-the-misinformation-toolkit/,fullfact.org,Getting started with the Misinformation Toolkit – Full Fact,0.9,HIGH,True,FALSE - Debunked by fact-checkers,fullfact.org,factcheck,2026-05-28T16:02:19.910148
"[DEBUNKED] No, Aldi isn’t selling cheap food boxes to the over 40s – Full Fact",https://fullfact.org/shopping/aldi-40-over-food-box-false/,fullfact.org,"No, Aldi isn’t selling cheap food boxes to the over 40s – Full Fact",0.9,HIGH,True,FALSE - Debunked by fact-checkers,fullfact.org,factcheck,2026-05-28T16:02:20.380213
[DEBUNKED] Video of ‘Pallywood’ actor is actually from an Iraqi comedy skit – Full Fact,https://fullfact.org/conflict/pallywood-video-iraqi-comedy-skit/,fullfact.org,Video of ‘Pallywood’ actor is actually from an Iraqi comedy skit – Full Fact,0.9,HIGH,True,FALSE - Debunked by fact-checkers,fullfact.org,factcheck,2026-05-28T16:02:21.015422
[DEBUNKED] Video of Keir Starmer responding to criticism of the government is AI-generated – Full Fact,https://fullfact.org/politics/keir-starmer-jeremy-kyle-ai-edited-video/,fullfact.org,Video of Keir Starmer responding to criticism of the government is AI-generated – Full Fact,0.9,HIGH,True,FALSE - Debunked by fact-checkers,fullfact.org,factcheck,2026-05-28T16:02:21.647621
