claim,source_url,source_domain,article_title,risk_score,risk_category,has_factcheck,factcheck_rating,factcheck_source,source_type,checked_at
"Dabei haben die Behörden laut Statistik 686 verbotene Gegenstände beschlagnahmt – darunter Reptilienlederwaren, Kosmetika und Medikamente mit Bestandteilen geschüt",https://www.ndz.de/reise/gruselige-souvenirs-so-sieht-die-asservatenkammer-des-muenchner-flughafens-wirklich-aus-5T3RYQYZDRDWTG5QNKDF26KEVU.html,ndz.de,Gruselige Souvenirs: So sieht die Asservatenkammer des Münchner Flughafens wirklich aus,0,LOW,False,,,unknown,2026-04-03T13:08:19.898295
"Angesichts steigender Energiepreise freut sich jeder über Tipps, wie die eigenen Kosten gesenkt werden können",https://www.t-online.de/heim-garten/aktuelles/id_101192390/haustuer-abzocke-bei-energie-diese-maschen-sind-gerade-aktiv.html,t-online.de,Haustür-Abzocke bei Energie: Diese Maschen sind gerade aktiv,0,LOW,False,,,unknown,2026-04-03T13:08:20.541253
"Doch nicht jeder hat Zeit oder Lust, sich mit den vielen verschiedenen Anbietern und Tarif-Feinheiten auseinandersetzen",https://www.t-online.de/heim-garten/aktuelles/id_101192390/haustuer-abzocke-bei-energie-diese-maschen-sind-gerade-aktiv.html,t-online.de,Haustür-Abzocke bei Energie: Diese Maschen sind gerade aktiv,0,LOW,False,,,unknown,2026-04-03T13:08:20.784969
"1 EnWG) etwas ändert, hat sich nicht bestätigt",https://www.t-online.de/heim-garten/aktuelles/id_101192390/haustuer-abzocke-bei-energie-diese-maschen-sind-gerade-aktiv.html,t-online.de,Haustür-Abzocke bei Energie: Diese Maschen sind gerade aktiv,0,LOW,False,,,unknown,2026-04-03T13:08:21.023359
"Dabei haben die Behörden laut Statistik 686 verbotene Gegenstände beschlagnahmt – darunter Reptilienlederwaren, Kosmetika und Medikam",https://www.dewezet.de/reise/gruselige-souvenirs-so-sieht-die-asservatenkammer-des-muenchner-flughafens-wirklich-aus-5T3RYQYZDRDWTG5QNKDF26KEVU.html,dewezet.de,Gruselige Souvenirs: So sieht die Asservatenkammer des Münchner Flughafens wirklich aus,0,LOW,False,,,unknown,2026-04-03T13:08:21.672057
"Es gebe alle möglichen Fakes, die sie zeigten, auch vergleichsweise harmlose",https://www.rhein-zeitung.de/deutschland-welt/politik/lang-zu-erfahrung-mit-deepfake-porno-gefuehl-von-ohnmacht_arid-4116224.html,rhein-zeitung.de,Digitale Gewalt: Lang zu Erfahrung mit Deepfake-Porno: «Gefühl von Ohnmacht» - Politik - Rhein-Zeitu,0.1,LOW,False,,,unknown,2026-04-03T13:08:23.118520
"Es gebe alle möglichen Fakes, die sie zeigten, auch vergleichsweise harmlose",https://www.antenne.de/nachrichten/welt/lang-zu-erfahrung-mit-deepfake-porno-gefuehl-von-ohnmacht,antenne.de,Lang zu Erfahrung mit Deepfake-Porno: «Gefühl von Ohnmacht» | ANTENNE BAYERN,0.1,LOW,False,,,unknown,2026-04-03T13:08:26.336831
» Immer auf dem Laufenden bleiben,https://www.antenne.de/nachrichten/welt/lang-zu-erfahrung-mit-deepfake-porno-gefuehl-von-ohnmacht,antenne.de,Lang zu Erfahrung mit Deepfake-Porno: «Gefühl von Ohnmacht» | ANTENNE BAYERN,0.1,LOW,False,,,unknown,2026-04-03T13:08:26.547330
"Es gebe alle möglichen Fakes, die sie zeigten, auch vergleichsweise harmlose",https://www.mz.de/deutschland-und-welt/deutschland/lang-zu-erfahrung-mit-deepfake-porno-gefuhl-von-ohnmacht-4227380,mz.de,Digitale Gewalt: Lang zu Erfahrung mit Deepfake-Porno: „Gefühl von Ohnmacht“,0.1,LOW,False,,,unknown,2026-04-03T13:08:27.178693
"Sollten Sie keine E-Mail erhalten haben, so überprüfen Sie bitte Ihren Spam-Ordner oder wenden Sie sich an den Kundenservice","https://www.mannheimer-morgen.de/politik_artikel,-politik-lang-zu-erfahrung-mit-deepfake-porno-gefuehl-von-ohnmacht-_arid,2368164.html",mannheimer-morgen.de,Lang zu Erfahrung mit Deepfake-Porno: «Gefühl von Ohnmacht»,0.1,LOW,False,,,unknown,2026-04-03T13:08:28.609013
"Abonnement verknüpfenWenn Sie bereits ein Abonnement für E-Paper oder Print (täglicher Bezug) haben, können Sie sich alle Vorteile von freischalten","https://www.mannheimer-morgen.de/politik_artikel,-politik-lang-zu-erfahrung-mit-deepfake-porno-gefuehl-von-ohnmacht-_arid,2368164.html",mannheimer-morgen.de,Lang zu Erfahrung mit Deepfake-Porno: «Gefühl von Ohnmacht»,0.1,LOW,False,,,unknown,2026-04-03T13:08:28.830888
"Anmelden und LoslesenWenn Ihre E-Mailadresse bestätigt ist, können Sie nun Ihre 3 kostenfreien Artikel freischalten","https://www.mannheimer-morgen.de/politik_artikel,-politik-lang-zu-erfahrung-mit-deepfake-porno-gefuehl-von-ohnmacht-_arid,2368164.html",mannheimer-morgen.de,Lang zu Erfahrung mit Deepfake-Porno: «Gefühl von Ohnmacht»,0,LOW,False,,,unknown,2026-04-03T13:08:29.038168
"Es gebe alle m&ouml;glichen Fakes, die sie zeigten, auch vergleichsweise harmlose",https://www.weser-kurier.de/politik/inland/lang-zu-erfahrung-mit-deepfake-porno-gefuehl-von-ohnmacht-doc8597tnnntvbx33zwddm,weser-kurier.de,Lang zu Erfahrung mit Deepfake-Porno: „Gefühl von Ohnmacht“,0.1,LOW,False,,,unknown,2026-04-03T13:08:30.361446
"Es gebe alle m&ouml;glichen Fakes, die sie zeigten, auch vergleichsweise harmlose",https://www.nordbayern.de/schlagzeilen/lang-zu-erfahrung-mit-deepfake-porno-gefuhl-von-ohnmacht-1.15067019,nordbayern.de,Lang zu Erfahrung mit Deepfake-Porno: &bdquo;Gef&uuml;hl von Ohnmacht&ldquo;,0.1,LOW,False,,,unknown,2026-04-03T13:08:37.124700
Dabei haben die Behörden laut Statistik 686 verboten,https://www.dnn.de/reise/gruselige-souvenirs-so-sieht-die-asservatenkammer-des-muenchner-flughafens-wirklich-aus-5T3RYQYZDRDWTG5QNKDF26KEVU.html,dnn.de,Gruselige Souvenirs: So sieht die Asservatenkammer des Münchner Flughafens wirklich aus,0,LOW,False,,,unknown,2026-04-03T13:08:37.876826
"Außerdem alle News über Promis, TV-Shows, Politik und Wirtschaft",https://www.derwesten.de/panorama/promi-tv/eckart-von-hirschhausen-deepfakes-ard-id302033200.html,derwesten.de,Eckart von Hirschhausen schlägt Alarm: „Wir stehen an einem historischen Punkt“ - DerWesten.de,0.1,LOW,False,,,unknown,2026-04-03T13:08:38.352850
"Es gebe alle möglichen Fakes, die sie zeigten, auch vergleichsweise harmlose",https://www.badische-zeitung.de/lang-zu-erfahrung-mit-deepfake-porno-gefuehl-von-ohnmacht,badische-zeitung.de,"Lang zu Erfahrung mit Deepfake-Porno: ""Gef&uuml;hl von Ohnmacht"" - Politik Inland - Badische Zeitung",0.1,LOW,False,,,unknown,2026-04-03T13:08:39.594026
"Es gebe alle möglichen Fakes, die sie zeigten, auch vergleichsweise harmlose",https://www.az-online.de/politik/lang-zu-erfahrung-mit-deepfake-porno-gefuehl-von-ohnmacht-zr-94248309.html,az-online.de,Lang zu Erfahrung mit Deepfake-Porno: „Gefühl von Ohnmacht“,0.1,LOW,False,,,unknown,2026-04-03T13:08:41.070809
"Es gebe alle möglichen Fakes, die sie zeigten, auch vergleichsweise harmlose",https://www.zeit.de/news/2026-04/03/lang-zu-erfahrung-mit-deepfake-porno-gefuehl-von-ohnmacht,zeit.de,Digitale Gewalt: Lang zu Erfahrung mit Deepfake-Porno: &#34;Gefühl von Ohnmacht&#34; | DIE ZEIT,0.1,LOW,False,,,unknown,2026-04-03T13:08:43.253982
"Dabei haben die Behörden laut Statistik 686 verbotene Gegenstände beschlagnahmt – darunter Reptilienlederwaren, Kosmetika und Medikamente mit Bestandteilen ges",https://www.cz.de/reise/gruselige-souvenirs-so-sieht-die-asservatenkammer-des-muenchner-flughafens-wirklich-aus-5T3RYQYZDRDWTG5QNKDF26KEVU.html,cz.de,Gruselige Souvenirs: So sieht die Asservatenkammer des Münchner Flughafens wirklich aus,0,LOW,False,,,unknown,2026-04-03T13:08:44.654507
"Weil der Krieg der USA gegen den Iran immer länger andauert und sogar eine Bodenoffensive im Raum steht, wächst bei den Amerikanern die Angst vor einer Wehrpflicht",https://de.nachrichten.yahoo.com/gef%C3%A4hrliches-thema-f%C3%BCr-trump-iran-092800093.html,de.nachrichten.yahoo.com,Gefährliches Thema für Trump - Wegen Iran-Krieg geht in den USA die Wehrpflicht-Angst um - Yahoo Nac,0.1,LOW,False,,,unknown,2026-04-03T13:08:45.264278
"Derzeit gibt es in den Vereinigten Staaten keine Wehrpflicht, sie wurde 1973 abgeschafft",https://de.nachrichten.yahoo.com/gef%C3%A4hrliches-thema-f%C3%BCr-trump-iran-092800093.html,de.nachrichten.yahoo.com,Gefährliches Thema für Trump - Wegen Iran-Krieg geht in den USA die Wehrpflicht-Angst um - Yahoo Nac,0.1,LOW,False,,,unknown,2026-04-03T13:08:45.385197
"Es ist derzeit nicht Teil des Plans, aber der Präsident hält sich, wie gesagt, klugerweise alle Optionen offen",https://de.nachrichten.yahoo.com/gef%C3%A4hrliches-thema-f%C3%BCr-trump-iran-092800093.html,de.nachrichten.yahoo.com,Gefährliches Thema für Trump - Wegen Iran-Krieg geht in den USA die Wehrpflicht-Angst um - Yahoo Nac,0.1,LOW,False,,,unknown,2026-04-03T13:08:45.595467
Dabei haben die Behörden laut Statistik 686 verbotene Gegenstände beschlagnahmt – darunte,https://www.rga.de/reise/gruselige-souvenirs-so-sieht-die-asservatenkammer-des-muenchner-flughafens-wirklich-aus-5T3RYQYZDRDWTG5QNKDF26KEVU.html,rga.de,Gruselige Souvenirs: So sieht die Asservatenkammer des Münchner Flughafens wirklich aus,0,LOW,False,,,unknown,2026-04-03T13:08:46.833290
Dabei haben die Behörden laut Statistik 686 verbotene Gegenstände beschlagnahmt – darunter Reptilienlederw,https://www.waz-online.de/reise/gruselige-souvenirs-so-sieht-die-asservatenkammer-des-muenchner-flughafens-wirklich-aus-5T3RYQYZDRDWTG5QNKDF26KEVU.html,waz-online.de,Gruselige Souvenirs: So sieht die Asservatenkammer des Münchner Flughafens wirklich aus,0,LOW,False,,,unknown,2026-04-03T13:08:47.606722
Quelle: Rolf Vennenbernd/dpaAnhörenApp öffnenDeepfakes werden immer realistischer,https://www.dewezet.de/nordrhein-westfalen/hirschhausen-deepfakes-bringen-die-demokratie-ins-wanken-EH5VD7SDKFOEJ62X27Z6VZKXOE.html,dewezet.de,Hirschhausen: Deepfakes bringen die Demokratie ins Wanken,0.1,LOW,False,,,unknown,2026-04-03T13:08:48.247467
"Dabei haben die Behörden laut Statistik 686 verbotene Gegenstände beschlagnahmt – darunter Reptilienlederwaren, Kosmetika und Medikamente mit Bestandteilen geschützter Pflanzen",https://www.remszeitung.de/reise/gruselige-souvenirs-so-sieht-die-asservatenkammer-des-muenchner-flughafens-wirklich-aus-5T3RYQYZDRDWTG5QNKDF26KEVU.html,remszeitung.de,Gruselige Souvenirs: So sieht die Asservatenkammer des Münchner Flughafens wirklich aus,0,LOW,False,,,unknown,2026-04-03T13:08:51.567398
"Analysten vermuten einen Ransomware-Angriff, auch wenn bislang keine Erpressergruppe die Tat &ouml;ffentlich f&uuml;r sich beansprucht hat",https://www.boerse-express.com/news/articles/hasbro-datenleck-und-ki-betrugswelle-markieren-zeitenwende-887354,boerse-express.com,Hasbro-Datenleck und KI-Betrugswelle markieren Zeitenwende | Börse Express,0.1,LOW,False,,,unknown,2026-04-03T13:08:53.175041
"Der Vorfall ist besonders brisant angesichts des globalen Fu&szlig;abdrucks und eines Jahresumsatzes von rund 4,1 Milliarden Euro (2025)",https://www.boerse-express.com/news/articles/hasbro-datenleck-und-ki-betrugswelle-markieren-zeitenwende-887354,boerse-express.com,Hasbro-Datenleck und KI-Betrugswelle markieren Zeitenwende | Börse Express,0,LOW,False,,,unknown,2026-04-03T13:08:53.384977
"Mittlerweile enthalten 82,6 % der Phishing-E-Mails KI-generierte Inhalte",https://www.boerse-express.com/news/articles/hasbro-datenleck-und-ki-betrugswelle-markieren-zeitenwende-887354,boerse-express.com,Hasbro-Datenleck und KI-Betrugswelle markieren Zeitenwende | Börse Express,0,LOW,False,,,unknown,2026-04-03T13:08:53.617832
Quelle: Rolf Vennenbernd/dpaAnhörenApp öffnenDeepfakes werden immer realistischer,https://www.solinger-tageblatt.de/nordrhein-westfalen/hirschhausen-deepfakes-bringen-die-demokratie-ins-wanken-EH5VD7SDKFOEJ62X27Z6VZKXOE.html,solinger-tageblatt.de,Hirschhausen: Deepfakes bringen die Demokratie ins Wanken,0.1,LOW,False,,,unknown,2026-04-03T13:08:55.870276
Rolf Vennenbernd/dpaDeepfakes werden immer realistischer,https://www.sueddeutsche.de/leben/digitale-welt-hirschhausen-deepfakes-bringen-die-demokratie-ins-wanken-dpa.urn-newsml-dpa-com-20090101-260403-930-902089,sueddeutsche.de,Digitale Welt - Hirschhausen: Deepfakes bringen die Demokratie ins Wanken - Gesellschaft - SZ.de,0.1,LOW,False,,,unknown,2026-04-03T13:08:56.785183
(Foto: Rolf Vennenbernd/dpa)Deepfakes werden immer realistischer,https://www.nordkurier.de/regional/brandenburg/hirschhausen-deepfakes-bringen-die-demokratie-ins-wanken-4481137,nordkurier.de,Hirschhausen: Deepfakes bringen die Demokratie ins Wanken,0.1,LOW,False,,,unknown,2026-04-03T13:09:00.068350
[DEBUNKED] Berlin: Luftaufnahme von Naidoo-Demo ist KI-generiert,https://correctiv.org/faktencheck/2026/04/02/teilnehmerzahl-bei-naidoo-demo-in-berlin-luftaufnahme-ist-ki-generiert/,correctiv.org,Berlin: Luftaufnahme von Naidoo-Demo ist KI-generiert,0.9,HIGH,True,FALSE - Debunked by fact-checkers,correctiv.org,factcheck,2026-04-03T13:09:01.130503
"[DEBUNKED] Video zeigt Syrer, die Regimesturz feiern, nicht Staatsbesuch von al-Scharaa",https://correctiv.org/faktencheck/2026/04/02/staatsbesuch-von-al-scharaa-video-von-feiernden-syrern-in-falschem-kontext-verbreitet/,correctiv.org,"Video zeigt Syrer, die Regimesturz feiern, nicht Staatsbesuch von al-Scharaa",0.9,HIGH,True,FALSE - Debunked by fact-checkers,correctiv.org,factcheck,2026-04-03T13:09:02.190922
"Die Bundesregierung gibt in ihrer Antwort an, dass ihr keine zentralen statistischen Daten zur jährlichen Zahl deutsch-chinesischer Forschungskooperationen in sensiblen Bereichen seit 2016 vorliegen",https://correctiv.org/aktuelles/china-science-investigation/2026/04/02/wissensabfluss-ans-militaer-bundesregierung-hat-keinen-ueberblick-ueber-sensible-forschungskooperationen-mit-china/,correctiv.org,Kein Überblick über sensible Forschungskooperationen mit China,0.1,LOW,False,,,factcheck,2026-04-03T13:09:03.452584
Auch über national geförderte deutsch-chinesische Projekte mit potenziellen Dual-Use-Risiken gebe keine vollständige Übersicht,https://correctiv.org/aktuelles/china-science-investigation/2026/04/02/wissensabfluss-ans-militaer-bundesregierung-hat-keinen-ueberblick-ueber-sensible-forschungskooperationen-mit-china/,correctiv.org,Kein Überblick über sensible Forschungskooperationen mit China,0.1,LOW,False,,,factcheck,2026-04-03T13:09:03.664078
"Im Raum stehen Vorwürfe der Untreue und des Verstoßes gegen das Parteiengesetz, bestätigte Staatsanwältin Kathrin Söfker gegenüber CORRECTIV",https://correctiv.org/aktuelles/afd/2026/04/02/ermittlungen-afd-niedersachsen-untreue-schledde/,correctiv.org,AfD Niedersachsen: Ermittlungen nach Filz-Affäre,0,LOW,False,,,factcheck,2026-04-03T13:09:04.620941
Fraktionsgeld wird aus staatlichen Mitteln – also Steuergeld – finanziert und steht jeder Partei zu,https://correctiv.org/aktuelles/afd/2026/04/02/ermittlungen-afd-niedersachsen-untreue-schledde/,correctiv.org,AfD Niedersachsen: Ermittlungen nach Filz-Affäre,0,LOW,False,,,factcheck,2026-04-03T13:09:04.831870
Laut den Autoren der Universität Paderborn wurde dieses Argument „gebetsmühlenartig“ verwendet,https://correctiv.org/aktuelles/missbrauch-in-der-katholischen-kirche/2026/04/02/missbrauch-kirche-paderborn-studie-zeigt-auch-der-vatikan-war-informiert/,correctiv.org,Kirche: Studie zeigt Wissen über Missbrauch im Vatikan,0,LOW,False,,,factcheck,2026-04-03T13:09:05.944645
[DEBUNKED] CORRECTIV steigt aus der internationalen Faktencheck-Infrastruktur ClaimReview aus – Was jetzt folgt - correctiv.org,https://correctiv.org/in-eigener-sache/2026/04/02/correctiv-steigt-aus-der-internationalen-faktencheck-infrastruktur-claimreview-aus-was-jetzt-folgt/,correctiv.org,CORRECTIV steigt aus der internationalen Faktencheck-Infrastruktur ClaimReview aus – Was jetzt folgt,0.9,HIGH,True,FALSE - Debunked by fact-checkers,correctiv.org,factcheck,2026-04-03T13:09:06.830688
"Die rechtlichen Hürden sind hoch, wie Fachleute gegenüber CORRECTIV erklären: Damit der BND künftig selbst aktiv werden könne, brauche es laut ihnen kein einfaches Gesetz",https://correctiv.org/aktuelles/sicherheit-und-verteidigung/2026/04/01/im-dienste-ihres-bundeskanzlers-bundesnachrichtendienst-bnd-geheimdienst-merz/,correctiv.org,Braucht es für den geplanten Umbau des BND eine Verfassungsänderung?,0,LOW,False,,,factcheck,2026-04-03T13:09:08.811998
[DEBUNKED] Wahlen in Rheinland-Pfalz: Warum das AfD-Ergebnis keinen Betrug belegt,https://correctiv.org/faktencheck/2026/04/01/briefwahl-und-prognose-warum-das-afd-ergebnis-in-rheinland-pfalz-keinen-betrug-belegt/,correctiv.org,Wahlen in Rheinland-Pfalz: Warum das AfD-Ergebnis keinen Betrug belegt,0.9,HIGH,True,FALSE - Debunked by fact-checkers,correctiv.org,factcheck,2026-04-03T13:09:09.725597
[DEBUNKED] Verschwörungserzählung: Video mit Epstein-Doppelgänger geht viral - correctiv.org,https://correctiv.org/faktencheck/aus-der-community/2026/03/31/verschwoerungserzaehlung-video-mit-epstein-doppelgaenger-geht-viral/,correctiv.org,Verschwörungserzählung: Video mit Epstein-Doppelgänger geht viral - correctiv.org,0.9,HIGH,True,FALSE - Debunked by fact-checkers,correctiv.org,factcheck,2026-04-03T13:09:10.639035
[DEBUNKED] Wahlen in Deutschland: Was hinter diesen Fakes steckt,https://correctiv.org/faktencheck/hintergrund/2026/03/31/wahlen-deutschland-facebook-vietnam-netzwerk-verbreitet-falschbehauptungen-wahlbetrug/,correctiv.org,Wahlen in Deutschland: Was hinter diesen Fakes steckt,0.9,HIGH,True,FALSE - Debunked by fact-checkers,correctiv.org,factcheck,2026-04-03T13:09:11.688885
"[DEBUNKED] Landtagswahl: Nein, Peter Hahne hat keinen „Wahlbetrug“ enttarnt",https://correctiv.org/faktencheck/2026/03/31/landtagswahl-baden-wuerttemberg-peter-hahne-falschbehauptungen-ueber-wahlbetrug/,correctiv.org,"Landtagswahl: Nein, Peter Hahne hat keinen „Wahlbetrug“ enttarnt",0.9,HIGH,True,FALSE - Debunked by fact-checkers,correctiv.org,factcheck,2026-04-03T13:09:12.582247
"Der Name erinnert an Ereignisse aus dem Jahr 2014, als Separatisten im ukrainischen Donbass die Gründung von „Volksrepubliken“ in Donezk und Luhansk verkündeten",https://correctiv.org/aktuelles/russland-ukraine-2/2026/03/31/volksrepublik-narva-was-hinter-der-kampagne-eines-telegram-kanals-steht/,correctiv.org,„Volksrepublik Narva“ – Was hinter der Kampagne steht,0,LOW,False,,,factcheck,2026-04-03T13:09:13.821832
"Mehr als 90 Prozent ihrer Einwohner sprechen Russisch, die überwiegende Mehrheit sind ethnische Russen",https://correctiv.org/aktuelles/russland-ukraine-2/2026/03/31/volksrepublik-narva-was-hinter-der-kampagne-eines-telegram-kanals-steht/,correctiv.org,„Volksrepublik Narva“ – Was hinter der Kampagne steht,0,LOW,False,,,factcheck,2026-04-03T13:09:14.035203
[DEBUNKED] So kämpfen die Länderpolizeien um ihren Nachwuchs - correctiv.org,https://correctiv.org/aktuelles/sicherheit/2026/03/31/so-kaempfen-die-laenderpolizeien-um-ihren-nachwuchs/,correctiv.org,So kämpfen die Länderpolizeien um ihren Nachwuchs - correctiv.org,0.9,HIGH,True,FALSE - Debunked by fact-checkers,correctiv.org,factcheck,2026-04-03T13:09:14.923014
"Alle bleiben da, wo sie sind, weil mit jedem Umzug die Miete steigt",https://correctiv.org/in-eigener-sache/2026/03/31/wie-wohnt-deutschland-die-abschlussdoku-zur-ard-mitmachaktion-besserwohnen-zeigt-chancen-und-konflikte-auf-dem-wohnungsmarkt/,correctiv.org,Die Abschlussdoku zur ARD-Mitmachaktion #besserwohnen zeigt Chancen und Konflikte auf dem Wohnungsma,0.1,LOW,False,,,factcheck,2026-04-03T13:09:15.889253
"Mehr als 80 % erklärten aber auch, mit ihrer Wohnsituation grundsätzlich zufrieden zu sein",https://correctiv.org/in-eigener-sache/2026/03/31/wie-wohnt-deutschland-die-abschlussdoku-zur-ard-mitmachaktion-besserwohnen-zeigt-chancen-und-konflikte-auf-dem-wohnungsmarkt/,correctiv.org,Die Abschlussdoku zur ARD-Mitmachaktion #besserwohnen zeigt Chancen und Konflikte auf dem Wohnungsma,0,LOW,False,,,factcheck,2026-04-03T13:09:16.128536
"[DEBUNKED] 3 E-Auto-Fakes, auf die Grüne hereinfallen! - Volksverpetzer",https://www.volksverpetzer.de/faktencheck/e-auto-fakes-gruene/,www.volksverpetzer.de,"3 E-Auto-Fakes, auf die Grüne hereinfallen! - Volksverpetzer",0.9,HIGH,True,FALSE - Debunked by fact-checkers,www.volksverpetzer.de,factcheck,2026-04-03T13:09:18.147060
2026 | Serie Es gibt nicht nur immer mehr Prozesse gegen Demokratiefeinde – es gibt auch immer mehr Urteile,https://www.volksverpetzer.de/serie/maerz-2026-sieg-heil-afd/,www.volksverpetzer.de,Urteile März 2026: Geldstrafe für AfD-Stadtrat wegen &quot;Sieg-Heil&quot;-Ruf - Volksverpetzer,0.1,LOW,False,,,factcheck,2026-04-03T13:09:19.159384
"Escher erhielt eine Geldstrafe in Höhe von 60 Tagen zu je 70 Euro, insgesamt 4",https://www.volksverpetzer.de/serie/maerz-2026-sieg-heil-afd/,www.volksverpetzer.de,Urteile März 2026: Geldstrafe für AfD-Stadtrat wegen &quot;Sieg-Heil&quot;-Ruf - Volksverpetzer,0,LOW,False,,,factcheck,2026-04-03T13:09:19.367831
"Er bestritt alle Vorwürfe und kündigte bereits an, in Berufung zu gehen",https://www.volksverpetzer.de/serie/maerz-2026-sieg-heil-afd/,www.volksverpetzer.de,Urteile März 2026: Geldstrafe für AfD-Stadtrat wegen &quot;Sieg-Heil&quot;-Ruf - Volksverpetzer,0.1,LOW,False,,,factcheck,2026-04-03T13:09:19.580669
2026 | Analyse Eine neue Studie zeigt: Toleranz macht Deutschland sicherer und rechte Politik fördert Migrantenkriminalität,https://www.volksverpetzer.de/analyse/simple-loesung-migrantenkriminalitaet/,www.volksverpetzer.de,Die AfD hasst diese simple Lösung gegen Migrantenkriminalität - Volksverpetzer,0,LOW,False,,,factcheck,2026-04-03T13:09:20.775036
Allein diese simple Maßnahme senkt die Kriminalität um 70 % – und wird deshalb von Rechten totgeschwiegen,https://www.volksverpetzer.de/analyse/simple-loesung-migrantenkriminalitaet/,www.volksverpetzer.de,Die AfD hasst diese simple Lösung gegen Migrantenkriminalität - Volksverpetzer,0.1,LOW,False,,,factcheck,2026-04-03T13:09:21.010856
"Wenn Politiker über Kriminalität reden, endet die Debatte inzwischen immer am selben Ort",https://www.volksverpetzer.de/analyse/simple-loesung-migrantenkriminalitaet/,www.volksverpetzer.de,Die AfD hasst diese simple Lösung gegen Migrantenkriminalität - Volksverpetzer,0.1,LOW,False,,,factcheck,2026-04-03T13:09:21.105562
"Wird ein Herkunftsstaat als sicher eingestuft, gilt die widerlegliche Vermutung, dass dort keine Verfolgung droht",https://www.volksverpetzer.de/analyse/sichere-herkunftsstaaten-verfassungswidrig/,www.volksverpetzer.de,Sichere Herkunftsstaaten: Warum der Asyl-Trick der Regierung verfassungswidrig ist - Volksverpetzer,0.1,LOW,False,,,factcheck,2026-04-03T13:09:22.113227
"Da der Bundesrat die Ausweitung der Liste in der Vergangenheit blockiert hat – laut Bundesinnenminister Dobrindt eine „Behinderung der Begrenzung der illegalen Migration“ –, hat der Bundestag nun einen anderen Weg gewählt",https://www.volksverpetzer.de/analyse/sichere-herkunftsstaaten-verfassungswidrig/,www.volksverpetzer.de,Sichere Herkunftsstaaten: Warum der Asyl-Trick der Regierung verfassungswidrig ist - Volksverpetzer,0,LOW,False,,,factcheck,2026-04-03T13:09:22.327309
Dies beziehe sich laut den Regierungsfraktionen jedoch lediglich auf die Asylberechtigung nach Art,https://www.volksverpetzer.de/analyse/sichere-herkunftsstaaten-verfassungswidrig/,www.volksverpetzer.de,Sichere Herkunftsstaaten: Warum der Asyl-Trick der Regierung verfassungswidrig ist - Volksverpetzer,0,LOW,False,,,factcheck,2026-04-03T13:09:22.561444
"[DEBUNKED] False Flag: 15 Fälle von &quot;linken Angriffen auf die AfD&quot;, die keine waren! - Volksverpetzer",https://www.volksverpetzer.de/analyse/false-flag-15-faelle-afd/,www.volksverpetzer.de,"False Flag: 15 Fälle von &quot;linken Angriffen auf die AfD&quot;, die keine waren! - Volksverpetzer",0.9,HIGH,True,FALSE - Debunked by fact-checkers,www.volksverpetzer.de,factcheck,2026-04-03T13:09:23.700747
"März 2026 | Aktuelles Gerade gewählt, schon tritt ein Stadtrat aus der AfD in Freising aus – er ist verärgert, weil sie keine anderen Themen kennt als ihren Rassismus",https://www.volksverpetzer.de/aktuelles/afd-freising-halbiert/,www.volksverpetzer.de,AfD in Freising halbiert – eigener Stadtrat rechnet mit den Nazis ab! - Volksverpetzer,0.1,LOW,False,,,factcheck,2026-04-03T13:09:24.960102
"„Immer nur Remigration, die haben ja kein anderes Thema mehr",https://www.volksverpetzer.de/aktuelles/afd-freising-halbiert/,www.volksverpetzer.de,AfD in Freising halbiert – eigener Stadtrat rechnet mit den Nazis ab! - Volksverpetzer,0.1,LOW,False,,,factcheck,2026-04-03T13:09:25.170041
"„Immer nur Remigration, die haben ja kein anderes Thema mehr",https://www.volksverpetzer.de/aktuelles/afd-freising-halbiert/,www.volksverpetzer.de,AfD in Freising halbiert – eigener Stadtrat rechnet mit den Nazis ab! - Volksverpetzer,0.1,LOW,False,,,factcheck,2026-04-03T13:09:25.380335
[DEBUNKED] Die 15 witzigsten &quot;Heimatstrom&quot;-Memes – und wie sie Rechte entlarven - Volksverpetzer,https://www.volksverpetzer.de/aktuelles/witzigsten-heimatstrom-memes/,www.volksverpetzer.de,Die 15 witzigsten &quot;Heimatstrom&quot;-Memes – und wie sie Rechte entlarven - Volksverpetzer,0.9,HIGH,True,FALSE - Debunked by fact-checkers,www.volksverpetzer.de,factcheck,2026-04-03T13:09:26.183876
"Das trifft viele Brauereien hart, weil sie immer wieder in neue Flaschen investieren müssen",https://www.volksverpetzer.de/aktuelles/afd-bayern-bier-teurer/,www.volksverpetzer.de,Die AfD Bayern will dein Bier teurer machen! - Volksverpetzer,0.1,LOW,False,,,factcheck,2026-04-03T13:09:27.107260
[DEBUNKED] Wie du von Rechten bei Gewalt gegen Frauen belogen wirst - Volksverpetzer,https://www.volksverpetzer.de/analyse/merz-gewalt-gegen-frauen/,www.volksverpetzer.de,Wie du von Rechten bei Gewalt gegen Frauen belogen wirst - Volksverpetzer,0.9,HIGH,True,FALSE - Debunked by fact-checkers,www.volksverpetzer.de,factcheck,2026-04-03T13:09:27.907521
