claim,source_url,source_domain,article_title,risk_score,risk_category,has_factcheck,factcheck_rating,factcheck_source,checked_at
"Zum Login SPIEGEL plus Nur für Neukunden € 1,– für 4 Wochen danach € 5,99 pro Woche Freier Zugriff auf alle S+-Artikel auf SPIEGEL",https://www.spiegel.de/politik/deutschland/alkohol-am-steuer-betrunken-autofahren-auto-weg-kommentar-a-afa074cc-65c6-4173-8ddb-5f89c132d232#ref=rss,www.spiegel.de,Alkohol am Steuer: Betrunken Autofahren? Auto weg! - Kommentar - DER SPIEGEL,0.1,LOW,False,,,2026-01-27T16:33:27.164470
"E-Paper (PDF), Digital-Archiv und S+-Newsletter Jederzeit kündigen Jetzt abonnieren SPIEGEL plus 52 Wochen 25 % sparen € 4,49 pro Woche für 52 Wochen danach € 5,99 pro Woche Freier Zugriff auf alle S+-Artikel auf SPIEGEL",https://www.spiegel.de/politik/deutschland/alkohol-am-steuer-betrunken-autofahren-auto-weg-kommentar-a-afa074cc-65c6-4173-8ddb-5f89c132d232#ref=rss,www.spiegel.de,Alkohol am Steuer: Betrunken Autofahren? Auto weg! - Kommentar - DER SPIEGEL,0.1,LOW,False,,,2026-01-27T16:33:27.313627
"Zum Login SPIEGEL plus Nur für Neukunden € 1,– für 4 Wochen danach € 5,99 pro Woche Freier Zugriff auf alle S+-Artikel auf SPIEGEL",https://www.spiegel.de/politik/deutschland/klimakrise-cdu-fluegel-entschaerfen-radikalen-klima-antrag-a-83bc53db-02d6-427e-b80d-662c2bad4e37#ref=rss,www.spiegel.de,Klimakrise: CDU-Flügel entschärfen radikalen Klima-Antrag - DER SPIEGEL,0.1,LOW,False,,,2026-01-27T16:33:28.184365
"E-Paper (PDF), Digital-Archiv und S+-Newsletter Jederzeit kündigen Jetzt abonnieren SPIEGEL plus 52 Wochen 25 % sparen € 4,49 pro Woche für 52 Wochen danach € 5,99 pro Woche Freier Zugriff auf alle S+-Artikel auf SPIEGEL",https://www.spiegel.de/politik/deutschland/klimakrise-cdu-fluegel-entschaerfen-radikalen-klima-antrag-a-83bc53db-02d6-427e-b80d-662c2bad4e37#ref=rss,www.spiegel.de,Klimakrise: CDU-Flügel entschärfen radikalen Klima-Antrag - DER SPIEGEL,0.1,LOW,False,,,2026-01-27T16:33:28.301342
"»Das war wirklich im wahrsten Sinne des Wortes eine märchenhafte Winterhochzeit, waren sich am Ende alle einig«, schwärmte Rottmann hinterher",https://www.spiegel.de/panorama/schonungen-buergermeister-kommt-mit-dem-schneepflug-und-rettet-so-die-hochzeit-a-68274404-0d8a-4b28-a9a9-beb893da8214#ref=rss,www.spiegel.de,Schonungen: Bürgermeister kommt mit dem Schneepflug und rettet so die Hochzeit - DER SPIEGEL,0.1,LOW,False,,,2026-01-27T16:33:29.461404
Er hat nach eigenen Angaben »mehrere Hundert Paare« getraut – aber noch nie unter derart widrigen Bedingungen,https://www.spiegel.de/panorama/schonungen-buergermeister-kommt-mit-dem-schneepflug-und-rettet-so-die-hochzeit-a-68274404-0d8a-4b28-a9a9-beb893da8214#ref=rss,www.spiegel.de,Schonungen: Bürgermeister kommt mit dem Schneepflug und rettet so die Hochzeit - DER SPIEGEL,0.1,LOW,False,,,2026-01-27T16:33:29.572359
Nach Angaben von lokalen Medien gilt der Winterdienst dort als besonders anspruchsvoll,https://www.spiegel.de/panorama/schonungen-buergermeister-kommt-mit-dem-schneepflug-und-rettet-so-die-hochzeit-a-68274404-0d8a-4b28-a9a9-beb893da8214#ref=rss,www.spiegel.de,Schonungen: Bürgermeister kommt mit dem Schneepflug und rettet so die Hochzeit - DER SPIEGEL,0,LOW,False,,,2026-01-27T16:33:29.695806
SBB: Bahnen so pünktlich wie nie – in der Schweiz $swiper,https://www.spiegel.de/auto/db-vs-sbb-bahnen-so-puenktlich-wie-nie-in-der-schweiz-a-76ebd374-5dfa-4429-9a8a-82991533e37c#ref=rss,www.spiegel.de,DB vs. SBB: Bahnen so pünktlich wie nie – in der Schweiz - DER SPIEGEL,0.1,LOW,False,,,2026-01-27T16:33:30.589869
"outside=""close()"" :class=""{'lg:w-4/12': isOpen,'md:w-5/12': isOpen,}""> Suche starten Suche öffnen EILMELDUNG — __proto_headline__ EILMELDUNG — __proto_headline__ Trotz Baustellen Die Bahn war 2025 so pünktlich wie nie",https://www.spiegel.de/auto/db-vs-sbb-bahnen-so-puenktlich-wie-nie-in-der-schweiz-a-76ebd374-5dfa-4429-9a8a-82991533e37c#ref=rss,www.spiegel.de,DB vs. SBB: Bahnen so pünktlich wie nie – in der Schweiz - DER SPIEGEL,0.1,LOW,False,,,2026-01-27T16:33:30.701658
In der Schweiz Es ist ein Rekord: Rund 94 Prozent der Personenzüge im Schweizer Schienennetz erreichten 2025 planmäßig ihr Ziel,https://www.spiegel.de/auto/db-vs-sbb-bahnen-so-puenktlich-wie-nie-in-der-schweiz-a-76ebd374-5dfa-4429-9a8a-82991533e37c#ref=rss,www.spiegel.de,DB vs. SBB: Bahnen so pünktlich wie nie – in der Schweiz - DER SPIEGEL,0,LOW,False,,,2026-01-27T16:33:30.811266
"Nach Angaben der Behörden beziffern die Behörden allein für Sizilien den Schaden auf 1,5 Milliarden Euro",https://www.spiegel.de/panorama/sizilien-1500-menschen-wegen-erdrutsch-evakuiert-a-220d0bae-85c5-4c4a-a368-b186b9a8f475#ref=rss,www.spiegel.de,Sizilien: 1500 Menschen wegen Erdrutschs evakuiert - DER SPIEGEL,0.1,LOW,False,,,2026-01-27T16:33:32.178971
"Der Vorwurf: Die Einwanderungsbehörde ICE habe inhaftierten Einwanderern keine Anhörungen zur Festsetzung der Kaution gewährt, obwohl Richter in Minneapolis diese angeordnet hatten",https://www.spiegel.de/ausland/minnesota-us-bezirksrichter-laedt-ice-behoerdenchef-vor-a-511c96b2-7d9c-4242-a820-35f8f4db2f54#ref=rss,www.spiegel.de,Minnesota: US-Bezirksrichter lädt ICE-Behördenchef vor - DER SPIEGEL,0.1,LOW,False,,,2026-01-27T16:33:33.526658
"Zum Login SPIEGEL plus Nur für Neukunden € 1,– für 4 Wochen danach € 5,99 pro Woche Freier Zugriff auf alle S+-Artikel auf SPIEGEL",https://www.spiegel.de/ausland/holocaust-wie-ein-inder-juden-aus-wien-rettete-a-e26cae1e-9dbe-4dc1-945e-d9e3be6084af#ref=rss,www.spiegel.de,Holocaust: Wie ein Inder Juden aus Wien rettete - DER SPIEGEL,0.1,LOW,False,,,2026-01-27T16:33:34.332241
"E-Paper (PDF), Digital-Archiv und S+-Newsletter Jederzeit kündigen Jetzt abonnieren SPIEGEL plus 52 Wochen 25 % sparen € 4,49 pro Woche für 52 Wochen danach € 5,99 pro Woche Freier Zugriff auf alle S+-Artikel auf SPIEGEL",https://www.spiegel.de/ausland/holocaust-wie-ein-inder-juden-aus-wien-rettete-a-e26cae1e-9dbe-4dc1-945e-d9e3be6084af#ref=rss,www.spiegel.de,Holocaust: Wie ein Inder Juden aus Wien rettete - DER SPIEGEL,0.1,LOW,False,,,2026-01-27T16:33:34.443423
Mehr zum Thema Oscarnominierungen 2026: Die Vampire kommen Eine Analyse von Lars-Olav Beier Actionthriller »One Battle After Another«: Mit diesen Kerlen wird keine Revolution zu machen sein Von Andreas Borcholte Oscarfavorit und K,https://www.spiegel.de/kultur/kino/baftas-2026-one-battle-after-another-dominiert-nominierungen-fuer-britischen-filmpreis-a-c76bde87-0282-4318-ae14-97019429e1dc#ref=rss,www.spiegel.de,Baftas 2026: »One Battle After Another« dominiert Nominierungen für britischen Filmpreis - DER SPIEG,0.1,LOW,False,,,2026-01-27T16:33:35.535338
"Zum Login SPIEGEL plus Nur für Neukunden € 1,– für 4 Wochen danach € 5,99 pro Woche Freier Zugriff auf alle S+-Artikel auf SPIEGEL",https://www.spiegel.de/kultur/tv/dschungelcamp-2026-tag-4-willkommen-zur-einfuehrung-in-die-trashologie-a-588022ab-fed3-47bd-a548-b2af8597b7d4#ref=rss,www.spiegel.de,"Dschungelcamp 2026, Tag 4: Willkommen zur Einführung in die Trashologie - DER SPIEGEL",0.1,LOW,False,,,2026-01-27T16:33:36.365672
"E-Paper (PDF), Digital-Archiv und S+-Newsletter Jederzeit kündigen Jetzt abonnieren SPIEGEL plus 52 Wochen 25 % sparen € 4,49 pro Woche für 52 Wochen danach € 5,99 pro Woche Freier Zugriff auf alle S+-Artikel auf SPIEGEL",https://www.spiegel.de/kultur/tv/dschungelcamp-2026-tag-4-willkommen-zur-einfuehrung-in-die-trashologie-a-588022ab-fed3-47bd-a548-b2af8597b7d4#ref=rss,www.spiegel.de,"Dschungelcamp 2026, Tag 4: Willkommen zur Einführung in die Trashologie - DER SPIEGEL",0.1,LOW,False,,,2026-01-27T16:33:36.476195
Immer wieder haben es Diebe und Einbrecher auf Metalle abgesehen: Anfang Januar entwenden Unbekannte kilometerweise Kupferkabel aus einem im Bau befindlichen Solarpark an der A24 bei Möhnsen,https://www.spiegel.de/panorama/justiz/itzehoe-einbrecher-erbeuten-zwei-tonnen-kupferdraht-a-846f1ee6-7924-410c-aa4b-7ee024f8460a#ref=rss,www.spiegel.de,Itzehoe: Einbrecher erbeuten zwei Tonnen Kupferdraht - DER SPIEGEL,0.1,LOW,False,,,2026-01-27T16:33:37.297324
