claim,source_url,source_domain,article_title,risk_score,risk_category,has_factcheck,factcheck_rating,factcheck_source,source_type,checked_at
[DEBUNKED] Keine Hantavirus-Einsatz: Foto zeigt Marineübung im Jahr 2025,https://correctiv.org/faktencheck/2026/05/22/kein-hantavirus-einsatz-foto-zeigt-marineuebung-im-jahr-2025/,correctiv.org,Keine Hantavirus-Einsatz: Foto zeigt Marineübung im Jahr 2025,0.9,HIGH,True,FALSE - Debunked by fact-checkers,correctiv.org,factcheck,2026-05-25T19:42:08.308069
"Diese Warnung hört man immer mal wieder, sie soll sogar von Albert Einstein sein",https://correctiv.org/faktencheck/2026/05/22/geruechtekiller-sterben-menschen-unweigerlich-aus-wenn-bienen-aussterben/,correctiv.org,"Gerüchtekiller: Stirbt die Menschheit unweigerlich aus, wenn Bienen aussterben?",0.1,LOW,False,,,factcheck,2026-05-25T19:42:09.221531
"Sterben die Menschen wirklich aus, wenn Bienen keine Pflanzen mehr bestäuben",https://correctiv.org/faktencheck/2026/05/22/geruechtekiller-sterben-menschen-unweigerlich-aus-wenn-bienen-aussterben/,correctiv.org,"Gerüchtekiller: Stirbt die Menschheit unweigerlich aus, wenn Bienen aussterben?",0.1,LOW,False,,,factcheck,2026-05-25T19:42:09.278551
Basisnahrungsmittel brauchen keine tierische Bestäubung Die einfache Antwort: Nein,https://correctiv.org/faktencheck/2026/05/22/geruechtekiller-sterben-menschen-unweigerlich-aus-wenn-bienen-aussterben/,correctiv.org,"Gerüchtekiller: Stirbt die Menschheit unweigerlich aus, wenn Bienen aussterben?",0.1,LOW,False,,,factcheck,2026-05-25T19:42:09.359317
[DEBUNKED] Mit angeblichem Xi-Jinping-Zitat zu Trump werden Klicks gesammelt,https://correctiv.org/faktencheck/2026/05/22/china-und-usa-profile-sammeln-mit-angeblichem-xi-jinping-zitat-zu-donaltrump-klicks/,correctiv.org,Mit angeblichem Xi-Jinping-Zitat zu Trump werden Klicks gesammelt,0.9,HIGH,True,FALSE - Debunked by fact-checkers,correctiv.org,factcheck,2026-05-25T19:42:10.179943
"Es gebe nach wie vor keine Statistik, die „das wahre Ausmaß“ abbilde, bemängelte Franziskus: Nicht von der Weltgesundheitsorganisation (WHO), nicht vom Kinderhilfswerk Unicef oder von Behörden wie Interpol",https://correctiv.org/aktuelles/akten-des-missbrauchs/2026/05/22/missbrauch-kirche-umfrage-hinweise/,correctiv.org,Missbrauch in Kirche: Melden Sie sich mit Hinweisen!,0.1,LOW,False,,,factcheck,2026-05-25T19:42:11.030975
"Auch CORRECTIV hat keine offizielle Statistik gefunden, die nicht von einer hohen Dunkelziffer ausgeht",https://correctiv.org/aktuelles/akten-des-missbrauchs/2026/05/22/missbrauch-kirche-umfrage-hinweise/,correctiv.org,Missbrauch in Kirche: Melden Sie sich mit Hinweisen!,0.1,LOW,False,,,factcheck,2026-05-25T19:42:11.085705
"Um der Frage näher zu kommen, hat CORRECTIV für die Recherche „Akten des Missbrauchs“ Anfragen an alle Bistümer und größere Orden auf der Welt gestellt",https://correctiv.org/aktuelles/akten-des-missbrauchs/2026/05/22/missbrauch-kirche-umfrage-hinweise/,correctiv.org,Missbrauch in Kirche: Melden Sie sich mit Hinweisen!,0.1,LOW,False,,,factcheck,2026-05-25T19:42:11.149826
"Der Bericht “Nirgendwo existieren“ stützt sich auf fünf Zeugenaussagen, die durch Berichte von Human Rights Watch, Amnesty International, der Afghan LGBTQ+ Organization (ALO) sowie offizielle europäische Regierungs- und BAMF-Daten bestätigt wurden",https://correctiv.org/aktuelles/international/2026/05/22/nirgendwo-existieren-wie-queere-und-trans-afghanen-durch-alle-sicherheitsnetze-fallen/,correctiv.org,Nirgendwo existieren: Queere und trans Afghanen auf der Flucht - correctiv.org,0,LOW,False,,,factcheck,2026-05-25T19:42:11.878037
"Außerdem werden immer mehr kulturelle Verbote erlassen, gegen Musik, Tanz und unangepasste Kleidung, alles wichtige Ausdrucksmöglichkeiten von queerer Identität, die immer mehr zum Risiko werden",https://correctiv.org/aktuelles/international/2026/05/22/nirgendwo-existieren-wie-queere-und-trans-afghanen-durch-alle-sicherheitsnetze-fallen/,correctiv.org,Nirgendwo existieren: Queere und trans Afghanen auf der Flucht - correctiv.org,0.1,LOW,False,,,factcheck,2026-05-25T19:42:11.934267
“Trotz allem habe ich immer weite,https://correctiv.org/aktuelles/international/2026/05/22/nirgendwo-existieren-wie-queere-und-trans-afghanen-durch-alle-sicherheitsnetze-fallen/,correctiv.org,Nirgendwo existieren: Queere und trans Afghanen auf der Flucht - correctiv.org,0.1,LOW,False,,,factcheck,2026-05-25T19:42:11.987885
[DEBUNKED] Foto von Busfahrer ohne Maske hat keinen Bezug zu Hantavirus,https://correctiv.org/faktencheck/2026/05/22/foto-von-busfahrer-ohne-maske-hat-keinen-bezug-zu-hantavirus/,correctiv.org,Foto von Busfahrer ohne Maske hat keinen Bezug zu Hantavirus,0.9,HIGH,True,FALSE - Debunked by fact-checkers,correctiv.org,factcheck,2026-05-25T19:42:13.378727
"Am Mittwoch bekam deshalb unter anderem die RWTH Aachen Besuch von Ermittlungsbehörden, wie ein Sprecher auf Anfrage bestätigte",https://correctiv.org/hybride-kriegsfuehrung/2026/05/21/von-muenchen-bis-aachen-im-netz-der-china-agenten/,correctiv.org,Von München bis Aachen: Im Netz der China-Agenten,0,LOW,False,,,factcheck,2026-05-25T19:42:14.220717
"Konkret geht es um zwei Online-Vorträge eines RWTH-Forschers, die er nach Angaben des Sprechers vor Vertretern von chinesischen Unternehmen und Forschungseinrichtungen gehalten hat",https://correctiv.org/hybride-kriegsfuehrung/2026/05/21/von-muenchen-bis-aachen-im-netz-der-china-agenten/,correctiv.org,Von München bis Aachen: Im Netz der China-Agenten,0,LOW,False,,,factcheck,2026-05-25T19:42:14.274317
[DEBUNKED] AfD-Politiker Krah verbreitet Fake zu EU-Kredit für Ukraine,https://correctiv.org/faktencheck/2026/05/21/luxusyacht-gekauft-kreml-medien-und-afd-politiker-krah-verbreiten-fake-zu-eu-kredit-fuer-ukraine/,correctiv.org,AfD-Politiker Krah verbreitet Fake zu EU-Kredit für Ukraine,0.9,HIGH,True,FALSE - Debunked by fact-checkers,correctiv.org,factcheck,2026-05-25T19:42:15.067857
Nach der Verarbeitung wird russisches Gold offiziell Schweizerisch – und damit besser verkäuflich,https://correctiv.org/aktuelles/russland-ukraine-2/2026/05/21/russisches-gold-schweizer-markenzeichen-russland-ukraine/,correctiv.org,"Russisches Gold, Schweizer Markenzeichen",0,LOW,False,,,factcheck,2026-05-25T19:42:15.816950
"Seit Kriegsbeginn importierte die Schweiz russisches Gold im Wert von je rund 3,5 Milliarden Franken in den Jahren 2022 und 2023",https://correctiv.org/aktuelles/russland-ukraine-2/2026/05/21/russisches-gold-schweizer-markenzeichen-russland-ukraine/,correctiv.org,"Russisches Gold, Schweizer Markenzeichen",0,LOW,False,,,factcheck,2026-05-25T19:42:15.874731
"Zum Vergleich: Von 2014 bis 2021, ein mehr als doppelt so langer Zeitraum, belief sich der Gesamtwert auf 7,5 Milliarden Franken",https://correctiv.org/aktuelles/russland-ukraine-2/2026/05/21/russisches-gold-schweizer-markenzeichen-russland-ukraine/,correctiv.org,"Russisches Gold, Schweizer Markenzeichen",0,LOW,False,,,factcheck,2026-05-25T19:42:15.934209
"[DEBUNKED] Nein, diese Karte zeigt keine Hantavirus-Fälle",https://correctiv.org/faktencheck/2026/05/20/nein-diese-karte-zeigt-keine-hantavirus-faelle/,correctiv.org,"Nein, diese Karte zeigt keine Hantavirus-Fälle",0.9,HIGH,True,FALSE - Debunked by fact-checkers,correctiv.org,factcheck,2026-05-25T19:42:16.751057
[DEBUNKED] Umgeknicktes Windrad: Altes Video für Desinformation genutzt,https://correctiv.org/faktencheck/2026/05/20/umgeknicktes-windrad-altes-video-fuer-desinformation-genutzt/,correctiv.org,Umgeknicktes Windrad: Altes Video für Desinformation genutzt,0.9,HIGH,True,FALSE - Debunked by fact-checkers,correctiv.org,factcheck,2026-05-25T19:42:17.574880
[DEBUNKED] Parken beim Supermarkt: Keine deutschlandweite Gebühr geplant,https://correctiv.org/faktencheck/2026/05/19/parken-beim-supermarkt-keine-deutschlandweite-gebuehr-geplant/,correctiv.org,Parken beim Supermarkt: Keine deutschlandweite Gebühr geplant,0.9,HIGH,True,FALSE - Debunked by fact-checkers,correctiv.org,factcheck,2026-05-25T19:42:18.370845
"Beworben haben sich nach Angaben aus Branchenkreisen unter anderem die deutschen IT-Firmen Almato, One Data, Rohde &amp; Schwarz sowie ChapsVision aus Frankreich",https://correctiv.org/aktuelles/gesellschaft-2/2026/05/19/die-abkehr-von-palantir-hat-begonnen/,correctiv.org,Die Abkehr von Palantir hat begonnen - correctiv.org,0,LOW,False,,,factcheck,2026-05-25T19:42:19.128604
"Das Problem aber ist: „Bisher gibt es keine Lösung, die an die Le",https://correctiv.org/aktuelles/gesellschaft-2/2026/05/19/die-abkehr-von-palantir-hat-begonnen/,correctiv.org,Die Abkehr von Palantir hat begonnen - correctiv.org,0.1,LOW,False,,,factcheck,2026-05-25T19:42:19.183099
"Diese Lage sei „katastrophal, jedes Jahr mehr junge Menschen aus der Schule zu entlassen mit einer Qualifikation, die für keine Berufsausbildung reicht",https://correctiv.org/aktuelles/bildung/2026/05/20/neuer-hoechststand-bei-schulabgaengern-ohne-abschluss/,correctiv.org,Neuer Höchststand bei Schulabgängern ohne Abschluss - correctiv.org,0.1,LOW,False,,,factcheck,2026-05-25T19:42:20.010386
"Die höchsten Quoten haben Sachsen-Anhalt mit 13,4 Prozent des Jahrgangs, der die Schule ohne Abschluss verlassen hat, gefolgt von Thüringen mit 11,9 Prozent, dem Saarland mit 11,5, Bremen mit 10,6 und Mecklenburg-Vorpommern mit 10,4 Prozent",https://correctiv.org/aktuelles/bildung/2026/05/20/neuer-hoechststand-bei-schulabgaengern-ohne-abschluss/,correctiv.org,Neuer Höchststand bei Schulabgängern ohne Abschluss - correctiv.org,0,LOW,False,,,factcheck,2026-05-25T19:42:20.067323
"000 Kinder wiederholen die erste Klasse Wie die Demokratie in den Schulen durch die AfD unter Druck gerät Die niedrigste Quote ohne Schulabschluss hat im Schuljahr 2024/25 Hessen mit 6,3 Prozent, gefolgt von Bayern mit 6,6 Prozent",https://correctiv.org/aktuelles/bildung/2026/05/20/neuer-hoechststand-bei-schulabgaengern-ohne-abschluss/,correctiv.org,Neuer Höchststand bei Schulabgängern ohne Abschluss - correctiv.org,0.1,LOW,False,,,factcheck,2026-05-25T19:42:20.123616
[DEBUNKED] Faktencheck: Steckt hinter mNexspike wirklich eine Todesbotschaft?,https://www.mimikama.org/bedeutet-mnexspike-wirklich-tod/,www.mimikama.org,Faktencheck: Steckt hinter mNexspike wirklich eine Todesbotschaft?,0.9,HIGH,True,FALSE - Debunked by fact-checkers,www.mimikama.org,factcheck,2026-05-25T19:42:20.200474
[DEBUNKED] Kommt wegen Ebola jetzt der nächste Lockdown?,https://www.mimikama.org/kommt-wegen-ebola-jetzt-der-naechste-lockdown/,www.mimikama.org,Kommt wegen Ebola jetzt der nächste Lockdown?,0.9,HIGH,True,FALSE - Debunked by fact-checkers,www.mimikama.org,factcheck,2026-05-25T19:42:20.277192
[DEBUNKED] Erhöht Deutschland im August 2026 die Bahnpreise?,https://www.mimikama.org/erhoeht-deutschland-im-august-2026-die-bahnpreise/,www.mimikama.org,Erhöht Deutschland im August 2026 die Bahnpreise?,0.9,HIGH,True,FALSE - Debunked by fact-checkers,www.mimikama.org,factcheck,2026-05-25T19:42:20.346284
[DEBUNKED] „Ich habe die KI gefragt“ ist kein Beweis,https://www.mimikama.org/ich-habe-die-ki-gefragt-ist-kein-beweis/,www.mimikama.org,„Ich habe die KI gefragt“ ist kein Beweis,0.9,HIGH,True,FALSE - Debunked by fact-checkers,www.mimikama.org,factcheck,2026-05-25T19:42:20.438166
[DEBUNKED] Sind die Plopsaland-Tickets auf Facebook echt?,https://www.mimikama.org/plopsaland-tickets-auf-facebook/,www.mimikama.org,Sind die Plopsaland-Tickets auf Facebook echt?,0.9,HIGH,True,FALSE - Debunked by fact-checkers,www.mimikama.org,factcheck,2026-05-25T19:42:20.508416
[DEBUNKED] Faktencheck: KleasKunst nutzt KI für emotionale Manipulation!,https://www.mimikama.org/kleaskunst-ki-inhalte-mitleid/,www.mimikama.org,Faktencheck: KleasKunst nutzt KI für emotionale Manipulation!,0.9,HIGH,True,FALSE - Debunked by fact-checkers,www.mimikama.org,factcheck,2026-05-25T19:42:20.581258
[DEBUNKED] Warum blinkt diese „Microsoft“-Warnung? Ist sie echt?,https://www.mimikama.org/microsoft-warnung-blinkt/,www.mimikama.org,Warum blinkt diese „Microsoft“-Warnung? Ist sie echt?,0.9,HIGH,True,FALSE - Debunked by fact-checkers,www.mimikama.org,factcheck,2026-05-25T19:42:20.653613
[DEBUNKED] Werden Hunde in Dänemark sofort eingeschläfert?,https://www.mimikama.org/hunde-in-daenemark-sofort-eingeschlaefert/,www.mimikama.org,Werden Hunde in Dänemark sofort eingeschläfert?,0.9,HIGH,True,FALSE - Debunked by fact-checkers,www.mimikama.org,factcheck,2026-05-25T19:42:20.733029
[DEBUNKED] Stammt das Schutzanzug-Foto von der „Hondius“?,https://www.mimikama.org/schutzanzug-foto-hondius/,www.mimikama.org,Stammt das Schutzanzug-Foto von der „Hondius“?,0.9,HIGH,True,FALSE - Debunked by fact-checkers,www.mimikama.org,factcheck,2026-05-25T19:42:20.803848
[DEBUNKED] Demokratie ohne gemeinsame Fakten,https://www.mimikama.org/demokratie-ohne-gemeinsame-fakten/,www.mimikama.org,Demokratie ohne gemeinsame Fakten,0.9,HIGH,True,FALSE - Debunked by fact-checkers,www.mimikama.org,factcheck,2026-05-25T19:42:20.875216
[DEBUNKED] Lebt Michael Jackson in Brasilien?,https://www.mimikama.org/lebt-michael-jackson-in-brasilien/,www.mimikama.org,Lebt Michael Jackson in Brasilien?,0.9,HIGH,True,FALSE - Debunked by fact-checkers,www.mimikama.org,factcheck,2026-05-25T19:42:20.950101
"[DEBUNKED] Ukraine: Belegt ein Konzert in Kiew, dass Wahlen möglich sind?",https://www.mimikama.org/belegt-konzert-in-kiew-moegliche-wahlen/,www.mimikama.org,"Ukraine: Belegt ein Konzert in Kiew, dass Wahlen möglich sind?",0.9,HIGH,True,FALSE - Debunked by fact-checkers,www.mimikama.org,factcheck,2026-05-25T19:42:21.024489
"[DEBUNKED] Lauterbach, WHO und „Klima-Notstand“: Was im Bericht steht",https://www.mimikama.org/lauterbach-who-klima-notstand-bericht/,www.mimikama.org,"Lauterbach, WHO und „Klima-Notstand“: Was im Bericht steht",0.9,HIGH,True,FALSE - Debunked by fact-checkers,www.mimikama.org,factcheck,2026-05-25T19:42:21.096867
[DEBUNKED] Hat Selenskyj wirklich Dutzende Immobilien im Ausland?,https://www.mimikama.org/selenskyj-dutzende-immobilien-im-ausland/,www.mimikama.org,Hat Selenskyj wirklich Dutzende Immobilien im Ausland?,0.9,HIGH,True,FALSE - Debunked by fact-checkers,www.mimikama.org,factcheck,2026-05-25T19:42:21.179615
[DEBUNKED] Gefälschte Briefe der Bundesnetzagentur im Umlauf,https://www.mimikama.org/gefaelschte-briefe-bundesnetzagentur-eeg-sanktion/,www.mimikama.org,Gefälschte Briefe der Bundesnetzagentur im Umlauf,0.9,HIGH,True,FALSE - Debunked by fact-checkers,www.mimikama.org,factcheck,2026-05-25T19:42:21.288986
"Laut der&nbsp;Mobilen Beratung gegen Rechtsextremismus in Thüringen&nbsp;ist Frank Haußner eine zentrale Mobilisierungsfigur des Netzwerks, das Verbindungen in die Reichsbürger- und Neonazi-Szene unterhält und zugleich enge Bezüge zur AfD pflegt",https://www.volksverpetzer.de/analyse/dunkle-maechte-afd-windkraft/,www.volksverpetzer.de,&quot;Dunkle Mächte&quot;: Das ECHTE Motiv hinter dem AfD-Windkraft-Protest - Volksverpetzer,0,LOW,False,,,factcheck,2026-05-25T19:42:21.917023
Der daraus jährlich erzeugte Strom könnte nach Angaben des Unternehmens den Bedarf von etwa 16,https://www.volksverpetzer.de/analyse/dunkle-maechte-afd-windkraft/,www.volksverpetzer.de,&quot;Dunkle Mächte&quot;: Das ECHTE Motiv hinter dem AfD-Windkraft-Protest - Volksverpetzer,0,LOW,False,,,factcheck,2026-05-25T19:42:21.970188
"Mit einem motivierenden Aufruf an alle Politiker:innen, Aktivist:innen, Wähler:innen und Entscheider:innen, jetzt richtig anzupacken",https://www.volksverpetzer.de/faktencheck/klimaschutz-wirkt-rechte-luegen-ipcc/,www.volksverpetzer.de,"Forscher bestätigen, dass Klimaschutz wirkt – deswegen wollen Rechte ihn jetzt abschaffen?! - Volksv",0.1,LOW,False,,,factcheck,2026-05-25T19:42:22.635277
"Sie veröffentlichten einen Offenen Brief an die Westend-Geschäftsführung, in dem sie Vorbehalte andeuten gegen die Poschardt-Bücher und auch die Titel des FDP-Politikers Wolfgang Kubicki, der seit Jahren immer wieder bei Westend publiziert",https://www.volksverpetzer.de/aktuelles/autoren-treten-aus-westend-verlag/,www.volksverpetzer.de,32 Autoren beenden Zusammenarbeit: Westend-Verlag driftet nach rechts - Volksverpetzer,0.1,LOW,False,,,factcheck,2026-05-25T19:42:23.280073
[DEBUNKED] Irreführende AfD-&quot;Angriffe&quot;: Was diese Statistik der Tagesschau alles nicht verrät - Volksverpetzer,https://www.volksverpetzer.de/faktencheck/statistik-tagesschau-afd-angriffe/,www.volksverpetzer.de,Irreführende AfD-&quot;Angriffe&quot;: Was diese Statistik der Tagesschau alles nicht verrät - Volks,0.9,HIGH,True,FALSE - Debunked by fact-checkers,www.volksverpetzer.de,factcheck,2026-05-25T19:42:23.858365
"[DEBUNKED] MV: Wie Medien AfD-Wahlkampf machen, ohne es zu merken - Volksverpetzer",https://www.volksverpetzer.de/aktuelles/medien-afd-mv-wahlkampf/,www.volksverpetzer.de,"MV: Wie Medien AfD-Wahlkampf machen, ohne es zu merken - Volksverpetzer",0.9,HIGH,True,FALSE - Debunked by fact-checkers,www.volksverpetzer.de,factcheck,2026-05-25T19:42:24.435917
[DEBUNKED] Die AfD schreibt bei der AfD ab – samt peinlicher Fehler! - Volksverpetzer,https://www.volksverpetzer.de/aktuelles/afd-schreibt-afd-ab/,www.volksverpetzer.de,Die AfD schreibt bei der AfD ab – samt peinlicher Fehler! - Volksverpetzer,0.9,HIGH,True,FALSE - Debunked by fact-checkers,www.volksverpetzer.de,factcheck,2026-05-25T19:42:25.030330
"„Generation Deutschland“: ein Sammelbecken an Rechtsextremisten Nach der Gründung der neuen AfD-Jugend auf Bundesebene im letzten Jahr in Gießen haben sich nun auch fast alle Landesverbände der ""Generation Deutschland"" gegründet",https://www.volksverpetzer.de/analyse/grosse-generation-deutschland/,www.volksverpetzer.de,Die große &quot;Generation Deutschland&quot;-Recherche: Der Trick der AfD‑Jugend entlarvt! - Volksve,0.1,LOW,False,,,factcheck,2026-05-25T19:42:25.674088
[DEBUNKED] Warum Zehdenick für die AfD eine Ausnahme bleiben wird - Volksverpetzer,https://www.volksverpetzer.de/analyse/zehdenick-afd-problem/,www.volksverpetzer.de,Warum Zehdenick für die AfD eine Ausnahme bleiben wird - Volksverpetzer,0.9,HIGH,True,FALSE - Debunked by fact-checkers,www.volksverpetzer.de,factcheck,2026-05-25T19:42:26.277577
[DEBUNKED] Wie die Ostdeutsche Allgemeine Volksverpetzer zum Schweigen bringen will - Volksverpetzer,https://www.volksverpetzer.de/aktuelles/ostdeutsche-allgemeine-anwalt-anschwaerzen/,www.volksverpetzer.de,Wie die Ostdeutsche Allgemeine Volksverpetzer zum Schweigen bringen will - Volksverpetzer,0.9,HIGH,True,FALSE - Debunked by fact-checkers,www.volksverpetzer.de,factcheck,2026-05-25T19:42:26.862426
[DEBUNKED] Did Warren Buffett warn of Trump declaring martial law and 'canceling' democracy? Here's the truth | Snopes.com,https://www.snopes.com/fact-check/warren-buffett-trump-warning/,www.snopes.com,Did Warren Buffett warn of Trump declaring martial law and 'canceling' democracy? Here's the truth |,0.9,HIGH,True,FALSE - Debunked by fact-checkers,www.snopes.com,factcheck,2026-05-25T19:42:27.279039
[DEBUNKED] Did Big Mac shrink by 40% while price skyrocketed from 50 cents to $8? | Snopes.com,https://www.snopes.com/news/2026/05/25/big-mac-price-increase/,www.snopes.com,Did Big Mac shrink by 40% while price skyrocketed from 50 cents to $8? | Snopes.com,0.9,HIGH,True,FALSE - Debunked by fact-checkers,www.snopes.com,factcheck,2026-05-25T19:42:27.379722
[DEBUNKED] Debunking conspiracy theory Huggies put 'pedophile symbols' on diapers | Snopes.com,https://www.snopes.com/fact-check/huggies-pedophile-symbols-diapers/,www.snopes.com,Debunking conspiracy theory Huggies put 'pedophile symbols' on diapers | Snopes.com,0.9,HIGH,True,FALSE - Debunked by fact-checkers,www.snopes.com,factcheck,2026-05-25T19:42:27.483260
[DEBUNKED] 16 claims about Tucker Carlson we've investigated | Snopes.com,https://www.snopes.com/collections/tucker-carlson-collection/,www.snopes.com,16 claims about Tucker Carlson we've investigated | Snopes.com,0.9,HIGH,True,FALSE - Debunked by fact-checkers,www.snopes.com,factcheck,2026-05-25T19:42:27.587072
[DEBUNKED] Posts falsely claim Sasha Obama said Barack is gay and Michelle is trans | Snopes.com,https://www.snopes.com/fact-check/sasha-obama-parents-gay-trans-claim/,www.snopes.com,Posts falsely claim Sasha Obama said Barack is gay and Michelle is trans | Snopes.com,0.9,HIGH,True,FALSE - Debunked by fact-checkers,www.snopes.com,factcheck,2026-05-25T19:42:27.700095
[DEBUNKED] Historian Heather Cox Richardson didn't go live at 3 a.m. after receiving threat. Here's how we know | Snopes.com,https://www.snopes.com/fact-check/heather-cox-richardson-threat/,www.snopes.com,Historian Heather Cox Richardson didn't go live at 3 a.m. after receiving threat. Here's how we know,0.9,HIGH,True,FALSE - Debunked by fact-checkers,www.snopes.com,factcheck,2026-05-25T19:42:27.911812
[DEBUNKED] Don't fall for these 19 fake Trump Truth Social posts | Snopes.com,https://www.snopes.com/collections/fake-trump-truth-social-posts-2/,www.snopes.com,Don't fall for these 19 fake Trump Truth Social posts | Snopes.com,0.9,HIGH,True,FALSE - Debunked by fact-checkers,www.snopes.com,factcheck,2026-05-25T19:42:28.011528
[DEBUNKED] Have Driscoll's strawberries been linked to cancer-causing chemicals? We investigated | Snopes.com,https://www.snopes.com/fact-check/driscolls-strawberries-toxins-cancer/,www.snopes.com,Have Driscoll's strawberries been linked to cancer-causing chemicals? We investigated | Snopes.com,0.9,HIGH,True,FALSE - Debunked by fact-checkers,www.snopes.com,factcheck,2026-05-25T19:42:28.103223
"[DEBUNKED] 11 rumors we've probed about aliens, UFOs | Snopes.com",https://www.snopes.com/collections/aliens-ufos-collection/,www.snopes.com,"11 rumors we've probed about aliens, UFOs | Snopes.com",0.9,HIGH,True,FALSE - Debunked by fact-checkers,www.snopes.com,factcheck,2026-05-25T19:42:28.308846
"It referred to calculations from the New York State Division of the Budget that put the ""new effective tariff rate"" at 21% on imported goods, or $4,200 more per New York household",http://www.politifact.com/factchecks/2026/may/21/kirsten-gillibrand/tariff-burden-households-new-york/,www.politifact.com,"PolitiFact | Sen. Kirsten Gillibrand says tariffs cost New Yorkers $4,200 a year. Most recent estima",0,LOW,False,,,factcheck,2026-05-25T19:42:28.769713
[DEBUNKED] PolitiFact | No evidence that San Diego mosque shooting suspects were transgender couple,http://www.politifact.com/factchecks/2026/may/20/social-media/no-evidence-san-diego-mosque-suspects-trans/,www.politifact.com,PolitiFact | No evidence that San Diego mosque shooting suspects were transgender couple,0.9,HIGH,True,FALSE - Debunked by fact-checkers,www.politifact.com,factcheck,2026-05-25T19:42:28.982076
"For this year, enrollees then faced premiums that increased, on average, by 26%",http://www.politifact.com/article/2026/may/20/as-aca-enrollment-drops-higher-insurance-rates-may/,www.politifact.com,"PolitiFact | As ACA enrollment drops, higher insurance rates may follow",0,LOW,False,,,factcheck,2026-05-25T19:42:29.135402
"A KFF analysis released May 19, for instance, found that the average ACA plan deductible saw the steepest increase in history — growing by 37%, or over $1,000, from $2,759 in 2025 to $3,786 in 2026 as enhanced premium tax credits expired",http://www.politifact.com/article/2026/may/20/as-aca-enrollment-drops-higher-insurance-rates-may/,www.politifact.com,"PolitiFact | As ACA enrollment drops, higher insurance rates may follow",0,LOW,False,,,factcheck,2026-05-25T19:42:29.193353
2% of students in grades 6 through 12 still reported second hand exposure to aerosols from e-cigarettes,http://www.politifact.com/article/2026/may/19/secondhand-vaping-health-risks-research/,www.politifact.com,"PolitiFact | When someone’s vaping nearby, what are you breathing in? The risks of vape pens’ second",0,LOW,False,,,factcheck,2026-05-25T19:42:29.323022
"Prices for key goods and services have increased Rising prices are a big concern for many Americans, after experiencing an inflation peak around 9% in 2022",http://www.politifact.com/article/2026/may/15/trump-economy-inflation-jobs-consumers-polls/,www.politifact.com,PolitiFact | Trump said Americans&#x27; finances don&#x27;t motivate him in Iran talks. How are peop,0,LOW,False,,,factcheck,2026-05-25T19:42:29.690177
[DEBUNKED] PolitiFact | Altered video of Byron Donalds arguing for insider trading in Congress spreads online,http://www.politifact.com/factchecks/2026/may/15/tweets/byron-donalds-florida-insider-trading/,www.politifact.com,PolitiFact | Altered video of Byron Donalds arguing for insider trading in Congress spreads online,0.9,HIGH,True,FALSE - Debunked by fact-checkers,www.politifact.com,factcheck,2026-05-25T19:42:29.764156
"Nationwide, 91% of people sentenced were United States citizens",http://www.politifact.com/article/2026/may/14/vice-president-JD-Vance-Maine-fraud-Janet-Mills/,www.politifact.com,"PolitiFact | Fact-checking JD Vance on Maine Democrats, Medicaid fraud and autism coverage",0,LOW,False,,,factcheck,2026-05-25T19:42:29.892825
"illegally, just under 1% of the state’s population and one of the smallest unauthorized immigrant populations in the U",http://www.politifact.com/article/2026/may/14/vice-president-JD-Vance-Maine-fraud-Janet-Mills/,www.politifact.com,"PolitiFact | Fact-checking JD Vance on Maine Democrats, Medicaid fraud and autism coverage",0.1,LOW,False,,,factcheck,2026-05-25T19:42:29.948051
[DEBUNKED] Muslim majority countries host millions of refugees – Full Fact,https://fullfact.org/world/muslim-majority-countries-host-millions-refugees/,fullfact.org,Muslim majority countries host millions of refugees – Full Fact,0.9,HIGH,True,FALSE - Debunked by fact-checkers,fullfact.org,factcheck,2026-05-25T19:42:30.419024
