claim,source_url,source_domain,article_title,risk_score,risk_category,has_factcheck,factcheck_rating,factcheck_source,source_type,checked_at
[DEBUNKED] Fact Check: Video Showing Iranian 'Inflatable Building' Originated On Parody Account -- Likely AI Generated | Lead Stories,https://leadstories.com/hoax-alert/2026/03/fact-check-iran-inflatable-buildings.html,leadstories.com,Fact Check: Video Showing Iranian 'Inflatable Building' Originated On Parody Account -- Likely AI Ge,0.9,HIGH,True,FALSE - Debunked by fact-checkers,leadstories.com,factcheck,2026-03-09T18:57:04.734448
"[DEBUNKED] Fact Check: Peyton Manning, Dolly Parton, Denzel Washington Or Your Favorite Celebrity Did NOT Donate Millions To Support Funeral For Four U.S. Servicemen Killed In Kuwait -- Foreign Clickbait | Lead Stories",https://leadstories.com/hoax-alert/2026/03/fact-check-favorite-celebrity-did-not-donate-millions-to-support-funeral-for-us-servicemen-killed-in-kuwait.html,leadstories.com,"Fact Check: Peyton Manning, Dolly Parton, Denzel Washington Or Your Favorite Celebrity Did NOT Donat",0.9,HIGH,True,FALSE - Debunked by fact-checkers,leadstories.com,factcheck,2026-03-09T18:57:04.894049
[DEBUNKED] Fact Check: NO Evidence Barron Trump Bought $30 Million In Oil 2 Days Before Iran War Started | Lead Stories,https://leadstories.com/hoax-alert/2026/03/fact-check-no-evidence-barron-trump-bought-30-million-dollars-in-oil-2-days-before-iran-war.html,leadstories.com,Fact Check: NO Evidence Barron Trump Bought $30 Million In Oil 2 Days Before Iran War Started | Lead,0.9,HIGH,True,FALSE - Debunked by fact-checkers,leadstories.com,factcheck,2026-03-09T18:57:05.066417
[DEBUNKED] Fact Check: Video Does NOT Show a Real Child Crying Out For Daddy Beside A Flag-Draped Casket On The Tarmac -- Scene Made With AI | Lead Stories,https://leadstories.com/hoax-alert/2026/03/fact-check-video-does-not-show-real-child-crying-out-for-daddy-beside-a-flag-draped-casket-on-the-tarmac.html,leadstories.com,Fact Check: Video Does NOT Show a Real Child Crying Out For Daddy Beside A Flag-Draped Casket On The,0.9,HIGH,True,FALSE - Debunked by fact-checkers,leadstories.com,factcheck,2026-03-09T18:57:05.225723
"[DEBUNKED] Fact Check: Dennis Rodman Did NOT Fly To Tehran To Negotiate Peace, Iran Did NOT Agree To Meeting | Lead Stories",https://leadstories.com/hoax-alert/2026/03/fact-check-dennis-rodman-did-not-fly-to-tehran-to-negotiate-peace-iran-did-not-agree-to-meeting.html,leadstories.com,"Fact Check: Dennis Rodman Did NOT Fly To Tehran To Negotiate Peace, Iran Did NOT Agree To Meeting | ",0.9,HIGH,True,FALSE - Debunked by fact-checkers,leadstories.com,factcheck,2026-03-09T18:57:05.396775
"[DEBUNKED] Fact Check: Video Does NOT Show Real American B-2 Bomber Shot Down, Being Paraded Through Streets In Iran | Lead Stories",https://leadstories.com/hoax-alert/2026/03/Fact-Check-Video-Does-NOT-Show-Real-American-B-2-Bomber-Shot-Down-Being-Paraded-Through-Streets-In-Iran.html,leadstories.com,"Fact Check: Video Does NOT Show Real American B-2 Bomber Shot Down, Being Paraded Through Streets In",0.9,HIGH,True,FALSE - Debunked by fact-checkers,leadstories.com,factcheck,2026-03-09T18:57:05.565379
[DEBUNKED] Fact Check: Post Does NOT Prove Mark Zuckerberg Was Subpoenaed Over Payments From 'Horizon Bridge' to Epstein-Linked 'Butterfly Foundation | Lead Stories,https://leadstories.com/hoax-alert/2026/03/fact-check-post-does-not-prove-mark-zuckerberg-was-subpoenaed-over-payments-from-horizon-bridge-to-butterfly-foundation.html,leadstories.com,Fact Check: Post Does NOT Prove Mark Zuckerberg Was Subpoenaed Over Payments From 'Horizon Bridge' t,0.9,HIGH,True,FALSE - Debunked by fact-checkers,leadstories.com,factcheck,2026-03-09T18:57:05.737512
[DEBUNKED] Fact Check: Epstein Files Do NOT Reveal 'Cannibal' Ellen DeGeneres Ate Anne Heche After Murdering Her | Lead Stories,https://leadstories.com/hoax-alert/2026/03/fact-check-epstein-files-not-reveal-cannibal-ellen-degeneres-ate-anne-heche-murder.html,leadstories.com,Fact Check: Epstein Files Do NOT Reveal 'Cannibal' Ellen DeGeneres Ate Anne Heche After Murdering He,0.9,HIGH,True,FALSE - Debunked by fact-checkers,leadstories.com,factcheck,2026-03-09T18:57:05.900598
[DEBUNKED] Fact Check: Video Does NOT Show A Real Fire On Board U.S. Destroyer Or Aircraft Carrier | Lead Stories,https://leadstories.com/hoax-alert/2026/03/fact-check-video-does-not-show-real-fire-on-board-us-destroyer-or-aircraft-carrier.html,leadstories.com,Fact Check: Video Does NOT Show A Real Fire On Board U.S. Destroyer Or Aircraft Carrier | Lead Stori,0.9,HIGH,True,FALSE - Debunked by fact-checkers,leadstories.com,factcheck,2026-03-09T18:57:06.058889
[DEBUNKED] Fact Check: Video Does NOT Show U.S. Destroyer 'Attacked By Iranian Missiles' Near Cyprus -- It's 2017 Damage From Ship Collision Near Japan | Lead Stories,https://leadstories.com/hoax-alert/2026/03/fact-check-video-does-not-show-us-destroyer-attacked-by-iranian-missiles-near-cyprus-its-2017-damage.html,leadstories.com,Fact Check: Video Does NOT Show U.S. Destroyer 'Attacked By Iranian Missiles' Near Cyprus -- It's 20,0.9,HIGH,True,FALSE - Debunked by fact-checkers,leadstories.com,factcheck,2026-03-09T18:57:06.344242
[DEBUNKED] Fact Check: Photo Does NOT Show Real Israeli Pilot Named 'Halach Boome' Who Took Out Ayatollah Khamenei | Lead Stories,https://leadstories.com/hoax-alert/2026/03/fact-check-photo-does-not-show-real-israeli-pilot-named-halach-boome-who-took-out-ayatollah-khamenei.html,leadstories.com,Fact Check: Photo Does NOT Show Real Israeli Pilot Named 'Halach Boome' Who Took Out Ayatollah Khame,0.9,HIGH,True,FALSE - Debunked by fact-checkers,leadstories.com,factcheck,2026-03-09T18:57:06.511669
[DEBUNKED] Fact Check: FAKE Video Purportedly From The Epstein Files Claims To Show Trump With Blindfolded Children  | Lead Stories,https://leadstories.com/hoax-alert/2026/03/fact-check-fake-video-donald-trump-blindfolded-children-epstein-files.html,leadstories.com,Fact Check: FAKE Video Purportedly From The Epstein Files Claims To Show Trump With Blindfolded Chil,0.9,HIGH,True,FALSE - Debunked by fact-checkers,leadstories.com,factcheck,2026-03-09T18:57:06.691064
[DEBUNKED] Markwayne Mullin talked about the smell of war on Fox News. His record shows no military service - Poynter,https://www.poynter.org/fact-checking/2026/markwayne-mullin-smell-of-war/,www.poynter.org,Markwayne Mullin talked about the smell of war on Fox News. His record shows no military service - P,0.9,HIGH,True,FALSE - Debunked by fact-checkers,www.poynter.org,factcheck,2026-03-09T18:57:07.489030
"The letter, which was signed by more than 80% of the union representing editorial staff at Law360 and regulation news site MLex, states that the $22",https://www.poynter.org/business-work/2026/law360-reuters-newsrooms-letter-against-ice-dhs/,www.poynter.org,Journalists push back against parent companies’ contracts with ICE - Poynter,0,LOW,False,,,factcheck,2026-03-09T18:57:08.225042
"Präsident Donald Trump ordnete an, dass alle US-Bundesbehörden die Nutzung von Anthropic-Technologie einstellen sollen",https://www.spiegel.de/ausland/anthropic-vs-pentagon-streit-um-nutzung-von-ki-fuer-autonome-waffen-a-42ac0b9f-f7e9-4dd1-9d66-89c5348dd3ce#ref=rss,www.spiegel.de,Anthropic vs. Pentagon: Streit um Nutzung von KI für autonome Waffen - DER SPIEGEL,0.1,LOW,False,,,mainstream,2026-03-09T18:57:23.672110
Nach SPIEGEL-Informationen gibt es aber keine Verletzten,https://www.spiegel.de/ausland/iran-news-am-montag-expertenrat-ernennt-mojtaba-khamenei-zum-neuen-obersten-fuehrer-a-b28d09c0-96ca-4918-a06e-86bdfd9d103e#ref=rss,www.spiegel.de,Iran-News am Montag: Raketenangriff aus Iran auf deutsches Feldlager in Jordanien - DER SPIEGEL,0.1,LOW,False,,,mainstream,2026-03-09T18:57:25.424369
"Zum Login SPIEGEL plus Nur für Neukunden € 1,– für 4 Wochen danach € 5,99 pro Woche Freier Zugriff auf alle S+-Artikel auf SPIEGEL",https://www.spiegel.de/ausland/tuerkei-erdogan-gegner-ekrem-imamoglu-vor-gericht-mammutprozess-hat-begonnen-a-d7534df4-9854-4692-a183-1ebabf650dd8#ref=rss,www.spiegel.de,Türkei: Erdoğan-Gegner Ekrem İmamoğlu vor Gericht - Mammutprozess hat begonnen - DER SPIEGEL,0.1,LOW,False,,,mainstream,2026-03-09T18:57:26.650165
"E-Paper (PDF), Digital-Archiv und S+-Newsletter Jederzeit kündigen Jetzt abonnieren SPIEGEL plus 52 Wochen 25 % sparen € 4,49 pro Woche für 52 Wochen danach € 5,99 pro Woche Freier Zugriff auf alle S+-Artikel auf SPIEGEL",https://www.spiegel.de/ausland/tuerkei-erdogan-gegner-ekrem-imamoglu-vor-gericht-mammutprozess-hat-begonnen-a-d7534df4-9854-4692-a183-1ebabf650dd8#ref=rss,www.spiegel.de,Türkei: Erdoğan-Gegner Ekrem İmamoğlu vor Gericht - Mammutprozess hat begonnen - DER SPIEGEL,0.1,LOW,False,,,mainstream,2026-03-09T18:57:26.859649
"Zum Login SPIEGEL plus Nur für Neukunden € 1,– für 4 Wochen danach € 5,99 pro Woche Freier Zugriff auf alle S+-Artikel auf SPIEGEL",https://www.spiegel.de/sport/olympia/paralympics-2026-warwara-worontschichina-holt-gold-fuer-russland-die-stimmung-ist-angespannt-a-e7fd64bd-8a21-4378-a483-3261de535b13#ref=rss,www.spiegel.de,"Paralympics 2026: Warwara Worontschichina holt Gold für Russland, die Stimmung ist angespannt - DER ",0.1,LOW,False,,,mainstream,2026-03-09T18:57:28.016724
"E-Paper (PDF), Digital-Archiv und S+-Newsletter Jederzeit kündigen Jetzt abonnieren SPIEGEL plus 52 Wochen 25 % sparen € 4,49 pro Woche für 52 Wochen danach € 5,99 pro Woche Freier Zugriff auf alle S+-Artikel auf SPIEGEL",https://www.spiegel.de/sport/olympia/paralympics-2026-warwara-worontschichina-holt-gold-fuer-russland-die-stimmung-ist-angespannt-a-e7fd64bd-8a21-4378-a483-3261de535b13#ref=rss,www.spiegel.de,"Paralympics 2026: Warwara Worontschichina holt Gold für Russland, die Stimmung ist angespannt - DER ",0.1,LOW,False,,,mainstream,2026-03-09T18:57:28.245791
"Zum Login SPIEGEL plus Nur für Neukunden € 1,– für 4 Wochen danach € 5,99 pro Woche Freier Zugriff auf alle S+-Artikel auf SPIEGEL",https://www.spiegel.de/wissenschaft/weltall/meteorit-von-koblenz-wem-gehoert-der-stein-wer-zahlt-sie-schaeden-a-83448260-0f3b-482c-9463-b05d8f4dbf7d#ref=rss,www.spiegel.de,"Meteorit von Koblenz: Wem gehört der Stein, wer zahlt sie Schäden? - DER SPIEGEL",0.1,LOW,False,,,mainstream,2026-03-09T18:57:29.526233
"E-Paper (PDF), Digital-Archiv und S+-Newsletter Jederzeit kündigen Jetzt abonnieren SPIEGEL plus 52 Wochen 25 % sparen € 4,49 pro Woche für 52 Wochen danach € 5,99 pro Woche Freier Zugriff auf alle S+-Artikel auf SPIEGEL",https://www.spiegel.de/wissenschaft/weltall/meteorit-von-koblenz-wem-gehoert-der-stein-wer-zahlt-sie-schaeden-a-83448260-0f3b-482c-9463-b05d8f4dbf7d#ref=rss,www.spiegel.de,"Meteorit von Koblenz: Wem gehört der Stein, wer zahlt sie Schäden? - DER SPIEGEL",0.1,LOW,False,,,mainstream,2026-03-09T18:57:29.731337
"Zum Login SPIEGEL plus Nur für Neukunden € 1,– für 4 Wochen danach € 5,99 pro Woche Freier Zugriff auf alle S+-Artikel auf SPIEGEL",https://www.spiegel.de/ausland/iran-news-mojtaba-khamenei-neuer-religioeser-fuehrer-eskalation-droht-a-ee1f1a23-ce3f-41c3-a3eb-a42e105cacb5#ref=rss,www.spiegel.de,"Iran-News: Mojtaba Khamenei neuer religiöser Führer, Eskalation droht - DER SPIEGEL",0.1,LOW,False,,,mainstream,2026-03-09T18:57:31.300067
"E-Paper (PDF), Digital-Archiv und S+-Newsletter Jederzeit kündigen Jetzt abonnieren SPIEGEL plus 52 Wochen 25 % sparen € 4,49 pro Woche für 52 Wochen danach € 5,99 pro Woche Freier Zugriff auf alle S+-Artikel auf SPIEGEL",https://www.spiegel.de/ausland/iran-news-mojtaba-khamenei-neuer-religioeser-fuehrer-eskalation-droht-a-ee1f1a23-ce3f-41c3-a3eb-a42e105cacb5#ref=rss,www.spiegel.de,"Iran-News: Mojtaba Khamenei neuer religiöser Führer, Eskalation droht - DER SPIEGEL",0.1,LOW,False,,,mainstream,2026-03-09T18:57:31.520598
"Für alle, die informiert mitreden wollen",https://www.spiegel.de/politik/cem-oezdemir-das-lehrt-die-landtagswahl-in-baden-wuerttemberg-podcast-a-ffe49a4a-e43d-4721-bac3-830485993e4b#ref=rss,www.spiegel.de,Cem Özdemir: Das lehrt die Landtagswahl in Baden-Württemberg – Podcast - DER SPIEGEL,0.1,LOW,False,,,mainstream,2026-03-09T18:57:33.822069
"Für alle, die informiert mitreden wollen",https://www.spiegel.de/politik/cem-oezdemir-das-lehrt-die-landtagswahl-in-baden-wuerttemberg-podcast-a-89736f73-60a6-4119-aaeb-8da0e9582e30#ref=rss,www.spiegel.de,Cem Özdemir: Das lehrt die Landtagswahl in Baden-Württemberg – Podcast - DER SPIEGEL,0.1,LOW,False,,,mainstream,2026-03-09T18:57:35.106439
"Zum Login SPIEGEL plus Nur für Neukunden € 1,– für 4 Wochen danach € 5,99 pro Woche Freier Zugriff auf alle S+-Artikel auf SPIEGEL",https://www.spiegel.de/politik/deutschland/baden-wuerttemberg-friedrich-merz-aetzt-gegen-springer-verlag-a-d06e9590-cc01-4745-acae-2c5706bb3220#ref=rss,www.spiegel.de,Baden-Württemberg: Friedrich Merz ätzt gegen Springer-Verlag - DER SPIEGEL,0.1,LOW,False,,,mainstream,2026-03-09T18:57:36.264383
"E-Paper (PDF), Digital-Archiv und S+-Newsletter Jederzeit kündigen Jetzt abonnieren SPIEGEL plus 52 Wochen 25 % sparen € 4,49 pro Woche für 52 Wochen danach € 5,99 pro Woche Freier Zugriff auf alle S+-Artikel auf SPIEGEL",https://www.spiegel.de/politik/deutschland/baden-wuerttemberg-friedrich-merz-aetzt-gegen-springer-verlag-a-d06e9590-cc01-4745-acae-2c5706bb3220#ref=rss,www.spiegel.de,Baden-Württemberg: Friedrich Merz ätzt gegen Springer-Verlag - DER SPIEGEL,0.1,LOW,False,,,mainstream,2026-03-09T18:57:36.480010
"Zum Login SPIEGEL plus Nur für Neukunden € 1,– für 4 Wochen danach € 5,99 pro Woche Freier Zugriff auf alle S+-Artikel auf SPIEGEL",https://www.spiegel.de/karriere/nickerchen-am-arbeitsplatz-die-rechtlichen-folgen-vom-schlaefchen-im-job-a-6db32165-8b8d-43f8-93f2-b5c18cfb8fe7#ref=rss,www.spiegel.de,Nickerchen am Arbeitsplatz: Die rechtlichen Folgen vom Schläfchen im Job - DER SPIEGEL,0.1,LOW,False,,,mainstream,2026-03-09T18:57:37.784433
"E-Paper (PDF), Digital-Archiv und S+-Newsletter Jederzeit kündigen Jetzt abonnieren SPIEGEL plus 52 Wochen 25 % sparen € 4,49 pro Woche für 52 Wochen danach € 5,99 pro Woche Freier Zugriff auf alle S+-Artikel auf SPIEGEL",https://www.spiegel.de/karriere/nickerchen-am-arbeitsplatz-die-rechtlichen-folgen-vom-schlaefchen-im-job-a-6db32165-8b8d-43f8-93f2-b5c18cfb8fe7#ref=rss,www.spiegel.de,Nickerchen am Arbeitsplatz: Die rechtlichen Folgen vom Schläfchen im Job - DER SPIEGEL,0.1,LOW,False,,,mainstream,2026-03-09T18:57:37.993189
"« So gibt es in der Sozial-, Steuer- und Klimapolitik keine gemeinsame Linie",https://www.spiegel.de/politik/deutschland/news-des-tages-gruene-nach-wahlsieg-oezdemirs-iran-maennlichkeitskult-looksmaxxer-a-3c08b783-bbe0-454d-a332-f513f7ceab3d#ref=rss,www.spiegel.de,"News des Tages: Grüne nach Wahlsieg Özdemirs, Iran, Männlichkeitskult Looksmaxxer - DER SPIEGEL",0.1,LOW,False,,,mainstream,2026-03-09T18:57:39.191209
"Zum Login SPIEGEL plus Nur für Neukunden € 1,– für 4 Wochen danach € 5,99 pro Woche Freier Zugriff auf alle S+-Artikel auf SPIEGEL",https://www.spiegel.de/ausland/krieg-gegen-iran-der-kreuzzug-von-donald-trump-a-de3359a2-b6b8-4a72-a252-cedd4ac9207f#ref=rss,www.spiegel.de,Krieg gegen Iran: Der Kreuzzug von Donald Trump - DER SPIEGEL,0.1,LOW,False,,,mainstream,2026-03-09T18:57:40.476642
"E-Paper (PDF), Digital-Archiv und S+-Newsletter Jederzeit kündigen Jetzt abonnieren SPIEGEL plus 52 Wochen 25 % sparen € 4,49 pro Woche für 52 Wochen danach € 5,99 pro Woche Freier Zugriff auf alle S+-Artikel auf SPIEGEL",https://www.spiegel.de/ausland/krieg-gegen-iran-der-kreuzzug-von-donald-trump-a-de3359a2-b6b8-4a72-a252-cedd4ac9207f#ref=rss,www.spiegel.de,Krieg gegen Iran: Der Kreuzzug von Donald Trump - DER SPIEGEL,0.1,LOW,False,,,mainstream,2026-03-09T18:57:40.686960
"Zum Login SPIEGEL plus Nur für Neukunden € 1,– für 4 Wochen danach € 5,99 pro Woche Freier Zugriff auf alle S+-Artikel auf SPIEGEL",https://www.spiegel.de/ausland/ukraine-viktor-orban-setzt-im-wahlkampf-auf-die-antiukrainisch-karte-a-5c8d2460-1361-41e5-83b6-0b84d4b96438#ref=rss,www.spiegel.de,Ukraine: Viktor Orbán setzt im Wahlkampf auf die antiukrainisch Karte - DER SPIEGEL,0.1,LOW,False,,,mainstream,2026-03-09T18:57:42.307750
"E-Paper (PDF), Digital-Archiv und S+-Newsletter Jederzeit kündigen Jetzt abonnieren SPIEGEL plus 52 Wochen 25 % sparen € 4,49 pro Woche für 52 Wochen danach € 5,99 pro Woche Freier Zugriff auf alle S+-Artikel auf SPIEGEL",https://www.spiegel.de/ausland/ukraine-viktor-orban-setzt-im-wahlkampf-auf-die-antiukrainisch-karte-a-5c8d2460-1361-41e5-83b6-0b84d4b96438#ref=rss,www.spiegel.de,Ukraine: Viktor Orbán setzt im Wahlkampf auf die antiukrainisch Karte - DER SPIEGEL,0.1,LOW,False,,,mainstream,2026-03-09T18:57:42.398187
"87%, and the average five-year fix is up to 4",https://www.bbc.com/news/articles/c2e4ygndjpwo?at_medium=RSS&amp;at_campaign=rss,www.bbc.com,"Energy bills, mortgages and more: How the Iran war may affect your finances",0,LOW,False,,,mainstream,2026-03-09T18:57:43.826334
"98%, as of 9 March, according to the financial information service Moneyfacts",https://www.bbc.com/news/articles/c2e4ygndjpwo?at_medium=RSS&amp;at_campaign=rss,www.bbc.com,"Energy bills, mortgages and more: How the Iran war may affect your finances",0,LOW,False,,,mainstream,2026-03-09T18:57:44.032326
The last time both were above 5% was in August last year,https://www.bbc.com/news/articles/c2e4ygndjpwo?at_medium=RSS&amp;at_campaign=rss,www.bbc.com,"Energy bills, mortgages and more: How the Iran war may affect your finances",0,LOW,False,,,mainstream,2026-03-09T18:57:44.249060
"Lisa Wilding KC, representing Quinn, said that the woman&#x27;s account to police and evidence at the trial in 2004 showed that she had been 100% sure about the man who had attacked her",https://www.bbc.com/news/articles/cde4j20jr6jo?at_medium=RSS&amp;at_campaign=rss,www.bbc.com,Rape victim &#x27;warned police Andy Malkinson may not be attacker&#x27;,0.1,LOW,False,,,mainstream,2026-03-09T18:57:44.745187
