claim,source_url,source_domain,article_title,risk_score,risk_category,has_factcheck,factcheck_rating,factcheck_source,source_type,checked_at
[DEBUNKED] An Attack Over ICE in the Massachusetts Democratic Senate Race - FactCheck.org,https://www.factcheck.org/2026/04/an-attack-over-ice-in-the-massachusetts-democratic-senate-race/,www.factcheck.org,An Attack Over ICE in the Massachusetts Democratic Senate Race - FactCheck.org,0.9,HIGH,True,FALSE - Debunked by fact-checkers,www.factcheck.org,factcheck,2026-04-22T19:18:05.182216
[DEBUNKED] Trump Fumbles the Facts with Farmers - FactCheck.org,https://www.factcheck.org/2026/04/trump-fumbles-the-facts-with-farmers/,www.factcheck.org,Trump Fumbles the Facts with Farmers - FactCheck.org,0.9,HIGH,True,FALSE - Debunked by fact-checkers,www.factcheck.org,factcheck,2026-04-22T19:18:06.492906
[DEBUNKED] FactChecking Trump&#039;s Prime-Time Address on Iran - FactCheck.org,https://www.factcheck.org/2026/04/factchecking-trumps-prime-time-address-on-iran/,www.factcheck.org,FactChecking Trump&#039;s Prime-Time Address on Iran - FactCheck.org,0.9,HIGH,True,FALSE - Debunked by fact-checkers,www.factcheck.org,factcheck,2026-04-22T19:18:06.657901
[DEBUNKED] Fact Check: Trump Truth Social Post Does NOT Show '8 AI-Generated Women' Facing Execution in Iran | Lead Stories,https://leadstories.com/hoax-alert/2026/04/fact-check-trump-truth-social-post-does-not-show-8-ai-generated-women-facing-execution-in-iran.html,leadstories.com,Fact Check: Trump Truth Social Post Does NOT Show '8 AI-Generated Women' Facing Execution in Iran | ,0.9,HIGH,True,FALSE - Debunked by fact-checkers,leadstories.com,factcheck,2026-04-22T19:18:07.363685
[DEBUNKED] Fact Check: Donald Trump DID Post About Apple CEO Tim Cook Calling Him To 'Kiss My Ass' | Lead Stories,https://leadstories.com/hoax-alert/2026/04/fact-check-donald-trump-did-post-apple-ceo-tim-cook-calling-him-kiss-my-ass.html,leadstories.com,Fact Check: Donald Trump DID Post About Apple CEO Tim Cook Calling Him To 'Kiss My Ass' | Lead Stori,0.9,HIGH,True,FALSE - Debunked by fact-checkers,leadstories.com,factcheck,2026-04-22T19:18:07.518239
[DEBUNKED] Fact Check: FAKE Images Show IDF Soldier Repairing Crucifixion Statue He Vandalized -- AI-Generated | Lead Stories,https://leadstories.com/hoax-alert/2026/04/fact-check-images-are-not-real-showing-idf-soldier-repairing-the-crucifixion-statue-he-vandalized-they-are-ai-generated.html,leadstories.com,Fact Check: FAKE Images Show IDF Soldier Repairing Crucifixion Statue He Vandalized -- AI-Generated ,0.9,HIGH,True,FALSE - Debunked by fact-checkers,leadstories.com,factcheck,2026-04-22T19:18:07.683760
"[DEBUNKED] Fact Check: Report About Trump, Nuclear Codes NOT Verified, According To Retired CIA Analyst Larry Johnson, Who Mentioned It In Viral Video | Lead Stories",https://leadstories.com/hoax-alert/2026/04/fact-check-report-about-trump-nuclear-codes-not-verified-according-to-retired-cia-analyst-larry-johnson-who-mentioned-it-in-viral-video.html,leadstories.com,"Fact Check: Report About Trump, Nuclear Codes NOT Verified, According To Retired CIA Analyst Larry J",0.9,HIGH,True,FALSE - Debunked by fact-checkers,leadstories.com,factcheck,2026-04-22T19:18:07.838053
[DEBUNKED] Fact Check: FAKE Donald Trump Truth Social Post Claims Israel Is 'A Far More Important Ally Than The American People' | Lead Stories,https://leadstories.com/hoax-alert/2026/04/fact-check-fake-donald-trump-truth-social-post-claims-israel-is-a-far-more-important-ally-than-the-american-people-.html,leadstories.com,Fact Check: FAKE Donald Trump Truth Social Post Claims Israel Is 'A Far More Important Ally Than The,0.9,HIGH,True,FALSE - Debunked by fact-checkers,leadstories.com,factcheck,2026-04-22T19:18:08.005968
[DEBUNKED] Fact Check: Video Does NOT Prove Woman Sued 'Jason Miller' For Catching Her Baby Falling Out Of Window | Lead Stories,https://leadstories.com/hoax-alert/2026/04/fact-check-viral-video-does-not-prove-woman-sued-jason-miller-for-catching-her-baby.html,leadstories.com,Fact Check: Video Does NOT Prove Woman Sued 'Jason Miller' For Catching Her Baby Falling Out Of Wind,0.9,HIGH,True,FALSE - Debunked by fact-checkers,leadstories.com,factcheck,2026-04-22T19:18:08.167671
[DEBUNKED] Fact Check: Image Does NOT Show Steve Bannon Had Urine On His Pants At World Economic Forum Event | Lead Stories,https://leadstories.com/hoax-alert/2026/04/fact-check-image-does-not-show-steve-bannon-had-urine-on-his-pants-at-world-economic-forum-event.html,leadstories.com,Fact Check: Image Does NOT Show Steve Bannon Had Urine On His Pants At World Economic Forum Event | ,0.9,HIGH,True,FALSE - Debunked by fact-checkers,leadstories.com,factcheck,2026-04-22T19:18:08.335073
[DEBUNKED] Fact Check: FAKE Photo Shows Trump With No Damage To His Ear Immediately After Butler Assassination Attempt -- It's AI | Lead Stories,https://leadstories.com/hoax-alert/2026/04/fact-check-fake-photo-shows-trump-no-damage-ear-immediately-butler-assassination-attempt-ai.html,leadstories.com,Fact Check: FAKE Photo Shows Trump With No Damage To His Ear Immediately After Butler Assassination ,0.9,HIGH,True,FALSE - Debunked by fact-checkers,leadstories.com,factcheck,2026-04-22T19:18:08.527058
[DEBUNKED] Fact Check: Trump Did NOT Post That He Had Access To 'Vatican Files' And Could Bring Down 'The Entire Catholic Church Overnight' -- Fake Post | Lead Stories,https://leadstories.com/hoax-alert/2026/04/fact-check-trump-did-not-post-that-he-hadaccess-to-vatican-files-and-could-bring-down-the-entire-catholic-church-overnight.html,leadstories.com,Fact Check: Trump Did NOT Post That He Had Access To 'Vatican Files' And Could Bring Down 'The Entir,0.9,HIGH,True,FALSE - Debunked by fact-checkers,leadstories.com,factcheck,2026-04-22T19:18:08.681080
[DEBUNKED] Fact Check: Dan Caine Did NOT Storm Out of Emergency Meeting After Trump Suggested Threatening Iran With Nuclear Weapons | Lead Stories,https://leadstories.com/hoax-alert/2026/04/fact-check-caine-did-not-storm-out-of-emergency-meeting-after-trump-suggested-threatening-iran-with-nuclear-weapons.html,leadstories.com,Fact Check: Dan Caine Did NOT Storm Out of Emergency Meeting After Trump Suggested Threatening Iran ,0.9,HIGH,True,FALSE - Debunked by fact-checkers,leadstories.com,factcheck,2026-04-22T19:18:08.855032
"[DEBUNKED] Fact Check: Personal Assistants To Celebrities Like Tanya Tucker, Kid Rock, Nikki Sixx Did NOT Die At Age 30 -- Nor Was One Woman Assistant To Several | Lead Stories",https://leadstories.com/hoax-alert/2026/04/fact-check-personal-assistant-to-celebrities-like-tanya-tucker-kid-rock-nikki-sixx-did-not-die-at-age-30.html,leadstories.com,"Fact Check: Personal Assistants To Celebrities Like Tanya Tucker, Kid Rock, Nikki Sixx Did NOT Die A",0.9,HIGH,True,FALSE - Debunked by fact-checkers,leadstories.com,factcheck,2026-04-22T19:18:09.022637
[DEBUNKED] Fact Check: FAKE Video Shows Workers Creating A Dolphin-Shaped Swimming Pool -- It's AI | Lead Stories,https://leadstories.com/hoax-alert/2026/04/fact-check-fake-video-shows-workers-creating-dolphin-shaped-swimming-pool-its-ai.html,leadstories.com,Fact Check: FAKE Video Shows Workers Creating A Dolphin-Shaped Swimming Pool -- It's AI | Lead Stori,0.9,HIGH,True,FALSE - Debunked by fact-checkers,leadstories.com,factcheck,2026-04-22T19:18:09.195940
[DEBUNKED] Fact Check: FAKE Trump Truth Social Post Calls Australian PM Anthony Albanese 'Airbus' -- Fabricated Image | Lead Stories,https://leadstories.com/hoax-alert/2026/04/fact-check-fake-trump-truth-social-post-calls-australian-pm-anthony-albanese-airbus.html,leadstories.com,Fact Check: FAKE Trump Truth Social Post Calls Australian PM Anthony Albanese 'Airbus' -- Fabricated,0.9,HIGH,True,FALSE - Debunked by fact-checkers,leadstories.com,factcheck,2026-04-22T19:18:09.352013
[DEBUNKED] Fact Check: FAKE Video Shows Tiger Escaping Enclosure While Keeper Cleans With Hose | Lead Stories,https://leadstories.com/hoax-alert/2026/04/fact-check-fake-video-shows-tiger-escaping-enclosure-while-keeper-cleans-with-hose.html,leadstories.com,Fact Check: FAKE Video Shows Tiger Escaping Enclosure While Keeper Cleans With Hose | Lead Stories,0.9,HIGH,True,FALSE - Debunked by fact-checkers,leadstories.com,factcheck,2026-04-22T19:18:09.570939
[DEBUNKED] Fact Check: Trump Did NOT Urge His Catholic Supporters To Start A 'MAGA Reformation' And Form A New 'American Catholicism'  | Lead Stories,https://leadstories.com/hoax-alert/2026/04/fact-check-trump-did-not-urge-his-catholic-supporters-to-start-maga-reformation-and-form-new-american-catholicism.html,leadstories.com,Fact Check: Trump Did NOT Urge His Catholic Supporters To Start A 'MAGA Reformation' And Form A New ,0.9,HIGH,True,FALSE - Debunked by fact-checkers,leadstories.com,factcheck,2026-04-22T19:18:09.726852
[DEBUNKED] The White House Correspondents’ Dinner guest list keeps raising eyebrows - Poynter,https://www.poynter.org/commentary/2026/brendan-carr-fcc-chair-attending-whca-dinner/,www.poynter.org,The White House Correspondents’ Dinner guest list keeps raising eyebrows - Poynter,0.9,HIGH,True,FALSE - Debunked by fact-checkers,www.poynter.org,factcheck,2026-04-22T19:18:09.878308
"In the last presidential election, only 59% of registered voters cast a ballot",https://www.poynter.org/reporting-editing/2026/indiana-voter-tunrout-low-news-outlets-provide-voter-information/,www.poynter.org,Indiana’s got a voting problem. News outlets can only do so much to fix it - Poynter,0,LOW,False,,,factcheck,2026-04-22T19:18:10.488134
"Compare that to Washington, where 70% of eligible voters cast a ballot that same year",https://www.poynter.org/reporting-editing/2026/indiana-voter-tunrout-low-news-outlets-provide-voter-information/,www.poynter.org,Indiana’s got a voting problem. News outlets can only do so much to fix it - Poynter,0,LOW,False,,,factcheck,2026-04-22T19:18:10.606343
"The best states in the country for voter turnout are Wisconsin, Minnesota and Michigan, where 75% or more of eligible voters participate",https://www.poynter.org/reporting-editing/2026/indiana-voter-tunrout-low-news-outlets-provide-voter-information/,www.poynter.org,Indiana’s got a voting problem. News outlets can only do so much to fix it - Poynter,0,LOW,False,,,factcheck,2026-04-22T19:18:10.700238
[DEBUNKED] Kash Patel sued The Atlantic. Can he actually win? - Poynter,https://www.poynter.org/commentary/2026/will-kash-patel-win-atlantic-defamation-lawsuit/,www.poynter.org,Kash Patel sued The Atlantic. Can he actually win? - Poynter,0.9,HIGH,True,FALSE - Debunked by fact-checkers,www.poynter.org,factcheck,2026-04-22T19:18:10.879824
"[DEBUNKED] Even when Trump deflects, the job is simple. Keep asking the question. - Poynter",https://www.poynter.org/reporting-editing/2026/donald-trump-zolan-kanno-youngs-questioning/,www.poynter.org,"Even when Trump deflects, the job is simple. Keep asking the question. - Poynter",0.9,HIGH,True,FALSE - Debunked by fact-checkers,www.poynter.org,factcheck,2026-04-22T19:18:11.091816
"[DEBUNKED] A long, hard look at the false Facebook videos offering to ‘grow your 🥒’ with tomatoes and toothpaste - Africa Check",https://africacheck.org/fact-checks/meta-programme-fact-checks/long-hard-look-false-facebook-videos-offering-grow-your,africacheck.org,"A long, hard look at the false Facebook videos offering to ‘grow your 🥒’ with tomatoes and toothpast",0.9,HIGH,True,FALSE - Debunked by fact-checkers,africacheck.org,factcheck,2026-04-22T19:18:13.531064
"[DEBUNKED] Pomegranate may have promising health benefits, but no evidence fruit can prevent or treat cancer - Africa Check",https://africacheck.org/fact-checks/meta-programme-fact-checks/pomegranate-may-have-promising-health-benefits-no-evidence,africacheck.org,"Pomegranate may have promising health benefits, but no evidence fruit can prevent or treat cancer - ",0.9,HIGH,True,FALSE - Debunked by fact-checkers,africacheck.org,factcheck,2026-04-22T19:18:13.782404
[DEBUNKED] Imposter Facebook page uses Watu branding to lure users into paying for non-existent goods - Africa Check,https://africacheck.org/fact-checks/meta-programme-fact-checks/imposter-facebook-page-uses-watu-branding-lure-users-paying,africacheck.org,Imposter Facebook page uses Watu branding to lure users into paying for non-existent goods - Africa ,0.9,HIGH,True,FALSE - Debunked by fact-checkers,africacheck.org,factcheck,2026-04-22T19:18:13.994866
[DEBUNKED] AI-generated image used to falsely claim April 2026 helicopter crash in Kenya’s Baringo county - Africa Check,https://africacheck.org/fact-checks/meta-programme-fact-checks/ai-generated-image-used-falsely-claim-april-2026-helicopter,africacheck.org,AI-generated image used to falsely claim April 2026 helicopter crash in Kenya’s Baringo county - Afr,0.9,HIGH,True,FALSE - Debunked by fact-checkers,africacheck.org,factcheck,2026-04-22T19:18:14.228040
"[DEBUNKED] No, Nigerian army did not ‘recently’ arrest 488 Boko Haram members in Abia state - Africa Check",https://africacheck.org/fact-checks/meta-programme-fact-checks/no-nigerian-army-did-not-recently-arrest-488-boko-haram,africacheck.org,"No, Nigerian army did not ‘recently’ arrest 488 Boko Haram members in Abia state - Africa Check",0.9,HIGH,True,FALSE - Debunked by fact-checkers,africacheck.org,factcheck,2026-04-22T19:18:14.491635
"[DEBUNKED] No evidence for viral video alleging &#039;Fulani terrorists&#039; attack in Abuja, Nigeria - Africa Check",https://africacheck.org/fact-checks/meta-programme-fact-checks/no-evidence-viral-video-alleging-fulani-terrorists-attack,africacheck.org,"No evidence for viral video alleging &#039;Fulani terrorists&#039; attack in Abuja, Nigeria - Africa",0.9,HIGH,True,FALSE - Debunked by fact-checkers,africacheck.org,factcheck,2026-04-22T19:18:14.905177
"[DEBUNKED] No, Kenyan pollster Mizani Africa did not publish Rongo constituency poll showing Dorothy Otieno leading - Africa Check",https://africacheck.org/fact-checks/meta-programme-fact-checks/no-kenyan-pollster-mizani-africa-did-not-publish-rongo,africacheck.org,"No, Kenyan pollster Mizani Africa did not publish Rongo constituency poll showing Dorothy Otieno lea",0.9,HIGH,True,FALSE - Debunked by fact-checkers,africacheck.org,factcheck,2026-04-22T19:18:15.147868
[DEBUNKED] Viral graphics falsely quote Kenyan deputy president Kindiki as threatening to quit government if he loses his position - Africa Check,https://africacheck.org/fact-checks/meta-programme-fact-checks/viral-graphics-falsely-quote-kenyan-deputy-president-kindiki,africacheck.org,Viral graphics falsely quote Kenyan deputy president Kindiki as threatening to quit government if he,0.9,HIGH,True,FALSE - Debunked by fact-checkers,africacheck.org,factcheck,2026-04-22T19:18:15.374919
[DEBUNKED] Exposing eight Facebook pages promoting fake Nigerian customs impounded vehicle auctions - Africa Check,https://africacheck.org/fact-checks/meta-programme-fact-checks/exposing-eight-facebook-pages-promoting-fake-nigerian,africacheck.org,Exposing eight Facebook pages promoting fake Nigerian customs impounded vehicle auctions - Africa Ch,0.9,HIGH,True,FALSE - Debunked by fact-checkers,africacheck.org,factcheck,2026-04-22T19:18:15.888019
"Zum Login SPIEGEL plus Nur für Neukunden € 1,– für 4 Wochen danach € 5,99 pro Woche Freier Zugriff auf alle S+-Artikel auf SPIEGEL",https://www.spiegel.de/panorama/justiz/landkreis-elbe-elster-in-brandenburg-wie-kann-man-70-rinder-stehlen-a-2db9c283-5602-427c-a126-76fe3429837d#ref=rss,www.spiegel.de,Landkreis Elbe-Elster in Brandenburg: Wie kann man 70 Rinder stehlen? - DER SPIEGEL,0.1,LOW,False,,,mainstream,2026-04-22T19:18:27.114491
"E-Paper (PDF), Digital-Archiv und S+-Newsletter Jederzeit kündigen Jetzt abonnieren SPIEGEL plus 52 Wochen 25 % sparen € 4,49 pro Woche für 52 Wochen danach € 5,99 pro Woche Freier Zugriff auf alle S+-Artikel auf SPIEGEL",https://www.spiegel.de/panorama/justiz/landkreis-elbe-elster-in-brandenburg-wie-kann-man-70-rinder-stehlen-a-2db9c283-5602-427c-a126-76fe3429837d#ref=rss,www.spiegel.de,Landkreis Elbe-Elster in Brandenburg: Wie kann man 70 Rinder stehlen? - DER SPIEGEL,0.1,LOW,False,,,mainstream,2026-04-22T19:18:27.221586
"length - 1, 500, false)"" data-area=""nav-bar"" data-app-hidden x-lazyload> Menü Startseite Kultur Flughafen Frankfurt Terminal 3 in Frankfurt am Main: Hier baut Deutschland noch, wie es schon immer bauen wollte $swiper",https://www.spiegel.de/kultur/terminal-3-in-frankfurt-am-main-hier-baut-deutschland-noch-wie-es-schon-immer-bauen-wollte-a-db2435f6-45e6-4ce4-85cd-b30d84c4a9a9#ref=rss,www.spiegel.de,"Terminal 3 in Frankfurt am Main: Hier baut Deutschland noch, wie es schon immer bauen wollte - DER S",0.1,LOW,False,,,mainstream,2026-04-22T19:18:28.179884
"Zum Login SPIEGEL plus Nur für Neukunden € 1,– für 4 Wochen danach € 5,99 pro Woche Freier Zugriff auf alle S+-Artikel auf SPIEGEL",https://www.spiegel.de/kultur/terminal-3-in-frankfurt-am-main-hier-baut-deutschland-noch-wie-es-schon-immer-bauen-wollte-a-db2435f6-45e6-4ce4-85cd-b30d84c4a9a9#ref=rss,www.spiegel.de,"Terminal 3 in Frankfurt am Main: Hier baut Deutschland noch, wie es schon immer bauen wollte - DER S",0.1,LOW,False,,,mainstream,2026-04-22T19:18:28.285739
"E-Paper (PDF), Digital-Archiv und S+-Newsletter Jederzeit kündigen Jetzt abonnieren SPIEGEL plus 52 Wochen 25 % sparen € 4,49 pro Woche für 52 Wochen danach € 5,99 pro Woche Freier Zugriff auf alle S+-Artikel auf SPIEGEL",https://www.spiegel.de/kultur/terminal-3-in-frankfurt-am-main-hier-baut-deutschland-noch-wie-es-schon-immer-bauen-wollte-a-db2435f6-45e6-4ce4-85cd-b30d84c4a9a9#ref=rss,www.spiegel.de,"Terminal 3 in Frankfurt am Main: Hier baut Deutschland noch, wie es schon immer bauen wollte - DER S",0.1,LOW,False,,,mainstream,2026-04-22T19:18:28.378597
"Zum Login SPIEGEL plus Nur für Neukunden € 1,– für 4 Wochen danach € 5,99 pro Woche Freier Zugriff auf alle S+-Artikel auf SPIEGEL",https://www.spiegel.de/ausland/eskalation-in-nahost-wir-sehen-eine-machtverschiebung-zugunsten-irans-a-b33c6656-c57a-4d23-bf0c-2a761cf6cf07#ref=rss,www.spiegel.de,Eskalation in Nahost: »Wir sehen eine Machtverschiebung zugunsten Irans« - DER SPIEGEL,0.1,LOW,False,,,mainstream,2026-04-22T19:18:30.129685
"E-Paper (PDF), Digital-Archiv und S+-Newsletter Jederzeit kündigen Jetzt abonnieren SPIEGEL plus 52 Wochen 25 % sparen € 4,49 pro Woche für 52 Wochen danach € 5,99 pro Woche Freier Zugriff auf alle S+-Artikel auf SPIEGEL",https://www.spiegel.de/ausland/eskalation-in-nahost-wir-sehen-eine-machtverschiebung-zugunsten-irans-a-b33c6656-c57a-4d23-bf0c-2a761cf6cf07#ref=rss,www.spiegel.de,Eskalation in Nahost: »Wir sehen eine Machtverschiebung zugunsten Irans« - DER SPIEGEL,0.1,LOW,False,,,mainstream,2026-04-22T19:18:30.248224
"Zum Login SPIEGEL plus Nur für Neukunden € 1,– für 4 Wochen danach € 5,99 pro Woche Freier Zugriff auf alle S+-Artikel auf SPIEGEL",https://www.spiegel.de/ausland/prozess-nach-gift-tod-einer-hamburger-familie-in-istanbul-sie-dachten-sie-koennen-uns-ihr-mitleid-aussprechen-und-kommen-am-ende-doch-davon-a-27273ce5-f5a1-4bae-897f-1eec9d0dac60#ref=rss,www.spiegel.de,"Prozess nach Gift-Tod einer Hamburger Familie in Istanbul: »Sie dachten, sie können uns ihr Mitleid ",0.1,LOW,False,,,mainstream,2026-04-22T19:18:31.150373
"E-Paper (PDF), Digital-Archiv und S+-Newsletter Jederzeit kündigen Jetzt abonnieren SPIEGEL plus 52 Wochen 25 % sparen € 4,49 pro Woche für 52 Wochen danach € 5,99 pro Woche Freier Zugriff auf alle S+-Artikel auf SPIEGEL",https://www.spiegel.de/ausland/prozess-nach-gift-tod-einer-hamburger-familie-in-istanbul-sie-dachten-sie-koennen-uns-ihr-mitleid-aussprechen-und-kommen-am-ende-doch-davon-a-27273ce5-f5a1-4bae-897f-1eec9d0dac60#ref=rss,www.spiegel.de,"Prozess nach Gift-Tod einer Hamburger Familie in Istanbul: »Sie dachten, sie können uns ihr Mitleid ",0.1,LOW,False,,,mainstream,2026-04-22T19:18:31.273310
"25%;"" :style=""{minHeight: typeof iframeHeight === 'number' && iframeIsLoaded",https://www.spiegel.de/sport/fussball/fussball-bundesliga-der-frauen-fc-bayern-ist-nach-sieg-bei-union-berlin-vorzeitig-deutscher-meister-a-0de85906-3ead-4c69-82f7-b9f32d4efb29#ref=rss,www.spiegel.de,Fußball-Bundesliga der Frauen: FC Bayern ist nach Sieg bei Union Berlin vorzeitig Deutscher Meister ,0,LOW,False,,,mainstream,2026-04-22T19:18:32.663968
"25%',}"" x-lazyload> Vor dem Hinspiel in der Champions League an diesem Samstag in München gegen den FC Barcelona gingen die Bayern-Spielerinnen früh durch ein Tor von Edna Imade in der achten Minute in Führung",https://www.spiegel.de/sport/fussball/fussball-bundesliga-der-frauen-fc-bayern-ist-nach-sieg-bei-union-berlin-vorzeitig-deutscher-meister-a-0de85906-3ead-4c69-82f7-b9f32d4efb29#ref=rss,www.spiegel.de,Fußball-Bundesliga der Frauen: FC Bayern ist nach Sieg bei Union Berlin vorzeitig Deutscher Meister ,0,LOW,False,,,mainstream,2026-04-22T19:18:32.770102
Die Übernahmepläne waren vor zehn Monaten verkündet worden,https://www.spiegel.de/wirtschaft/unternehmen/rtl-darf-sky-kaufen-entscheidung-der-eu-kommission-a-5f9f2e4e-eb18-4feb-9313-c81bbdbcc20a#ref=rss,www.spiegel.de,RTL darf Sky kaufen – Entscheidung der EU-Kommission - DER SPIEGEL,0,LOW,False,,,mainstream,2026-04-22T19:18:33.640344
"Zum Login SPIEGEL plus Nur für Neukunden € 1,– für 4 Wochen danach € 5,99 pro Woche Freier Zugriff auf alle S+-Artikel auf SPIEGEL",https://www.spiegel.de/wirtschaft/iran-krieg-warnungen-vor-kerosinmangel-zugleich-werbung-fuer-sommerfluege-a-230aeef0-3db8-48ba-9703-4d5cb1f9a588#ref=rss,www.spiegel.de,"Iran-Krieg: Warnungen vor Kerosinmangel, zugleich Werbung für Sommerflüge - DER SPIEGEL",0.1,LOW,False,,,mainstream,2026-04-22T19:18:36.999510
"E-Paper (PDF), Digital-Archiv und S+-Newsletter Jederzeit kündigen Jetzt abonnieren SPIEGEL plus 52 Wochen 25 % sparen € 4,49 pro Woche für 52 Wochen danach € 5,99 pro Woche Freier Zugriff auf alle S+-Artikel auf SPIEGEL",https://www.spiegel.de/wirtschaft/iran-krieg-warnungen-vor-kerosinmangel-zugleich-werbung-fuer-sommerfluege-a-230aeef0-3db8-48ba-9703-4d5cb1f9a588#ref=rss,www.spiegel.de,"Iran-Krieg: Warnungen vor Kerosinmangel, zugleich Werbung für Sommerflüge - DER SPIEGEL",0.1,LOW,False,,,mainstream,2026-04-22T19:18:37.099571
"Ramstein, Trumpstein, bereit seinDen Ukrainern scheint - notgedrungen - keine Idee zu verrückt, um sie nicht wenigstens zu diskutieren",https://www.spiegel.de/politik/deutschland/news-des-tages-sollten-wir-ramstein-in-trumpstein-umbenennen-a-7c8b04b1-408a-4750-94f9-326d9ec288d2#ref=rss,www.spiegel.de,News des Tages: Sollten wir Ramstein in Trumpstein umbenennen? - DER SPIEGEL,0.1,LOW,False,,,mainstream,2026-04-22T19:18:37.993076
"Zum Login SPIEGEL plus Nur für Neukunden € 1,– für 4 Wochen danach € 5,99 pro Woche Freier Zugriff auf alle S+-Artikel auf SPIEGEL",https://www.spiegel.de/wirtschaft/bundesfinanzminister-lars-klingbeil-darf-wegen-schwacher-wirtschaft-mehr-schulden-machen-a-caff86cb-ff2f-4ea0-9af6-2a3ff4554e3c#ref=rss,www.spiegel.de,Bundesfinanzminister Lars Klingbeil darf wegen schwacher Wirtschaft mehr Schulden machen - DER SPIEG,0.1,LOW,False,,,mainstream,2026-04-22T19:18:38.888460
"E-Paper (PDF), Digital-Archiv und S+-Newsletter Jederzeit kündigen Jetzt abonnieren SPIEGEL plus 52 Wochen 25 % sparen € 4,49 pro Woche für 52 Wochen danach € 5,99 pro Woche Freier Zugriff auf alle S+-Artikel auf SPIEGEL",https://www.spiegel.de/wirtschaft/bundesfinanzminister-lars-klingbeil-darf-wegen-schwacher-wirtschaft-mehr-schulden-machen-a-caff86cb-ff2f-4ea0-9af6-2a3ff4554e3c#ref=rss,www.spiegel.de,Bundesfinanzminister Lars Klingbeil darf wegen schwacher Wirtschaft mehr Schulden machen - DER SPIEG,0.1,LOW,False,,,mainstream,2026-04-22T19:18:38.991406
"Zum Login SPIEGEL plus Nur für Neukunden € 1,– für 4 Wochen danach € 5,99 pro Woche Freier Zugriff auf alle S+-Artikel auf SPIEGEL",https://www.spiegel.de/ausland/pakistan-wie-das-land-zum-vermittler-zwischen-usa-und-iran-wurde-a-617b1f08-6670-4ac4-b74f-31061e973371#ref=rss,www.spiegel.de,Pakistan: Wie das Land zum Vermittler zwischen USA und Iran wurde - DER SPIEGEL,0.1,LOW,False,,,mainstream,2026-04-22T19:18:39.851593
"E-Paper (PDF), Digital-Archiv und S+-Newsletter Jederzeit kündigen Jetzt abonnieren SPIEGEL plus 52 Wochen 25 % sparen € 4,49 pro Woche für 52 Wochen danach € 5,99 pro Woche Freier Zugriff auf alle S+-Artikel auf SPIEGEL",https://www.spiegel.de/ausland/pakistan-wie-das-land-zum-vermittler-zwischen-usa-und-iran-wurde-a-617b1f08-6670-4ac4-b74f-31061e973371#ref=rss,www.spiegel.de,Pakistan: Wie das Land zum Vermittler zwischen USA und Iran wurde - DER SPIEGEL,0.1,LOW,False,,,mainstream,2026-04-22T19:18:39.948062
"Ein Check-in als Testpassagier zeigt, dass die Bahn für viele keine Alternative ist",https://www.spiegel.de/mobilitaet/flughafen-frankfurt-warum-am-neuen-terminal-3-schon-wieder-alles-aufs-auto-ausgerichtet-ist-a-7387700d-d0c6-4a76-a4b7-0279c6294333#ref=rss,www.spiegel.de,Flughafen Frankfurt: Warum am neuen Terminal 3 schon wieder alles aufs Auto ausgerichtet ist - DER S,0.1,LOW,False,,,mainstream,2026-04-22T19:18:40.936563
"Zum Login SPIEGEL plus Nur für Neukunden € 1,– für 4 Wochen danach € 5,99 pro Woche Freier Zugriff auf alle S+-Artikel auf SPIEGEL",https://www.spiegel.de/mobilitaet/flughafen-frankfurt-warum-am-neuen-terminal-3-schon-wieder-alles-aufs-auto-ausgerichtet-ist-a-7387700d-d0c6-4a76-a4b7-0279c6294333#ref=rss,www.spiegel.de,Flughafen Frankfurt: Warum am neuen Terminal 3 schon wieder alles aufs Auto ausgerichtet ist - DER S,0.1,LOW,False,,,mainstream,2026-04-22T19:18:41.039417
