claim,source_url,source_domain,article_title,risk_score,risk_category,has_factcheck,factcheck_rating,factcheck_source,source_type,checked_at
[DEBUNKED] Keine Hantavirus-Einsatz: Foto zeigt Marineübung im Jahr 2025,https://correctiv.org/faktencheck/2026/05/22/kein-hantavirus-einsatz-foto-zeigt-marineuebung-im-jahr-2025/,correctiv.org,Keine Hantavirus-Einsatz: Foto zeigt Marineübung im Jahr 2025,0.9,HIGH,True,FALSE - Debunked by fact-checkers,correctiv.org,factcheck,2026-05-26T03:42:17.494669
"Diese Warnung hört man immer mal wieder, sie soll sogar von Albert Einstein sein",https://correctiv.org/faktencheck/2026/05/22/geruechtekiller-sterben-menschen-unweigerlich-aus-wenn-bienen-aussterben/,correctiv.org,"Gerüchtekiller: Stirbt die Menschheit unweigerlich aus, wenn Bienen aussterben?",0.1,LOW,False,,,factcheck,2026-05-26T03:42:18.352786
"Sterben die Menschen wirklich aus, wenn Bienen keine Pflanzen mehr bestäuben",https://correctiv.org/faktencheck/2026/05/22/geruechtekiller-sterben-menschen-unweigerlich-aus-wenn-bienen-aussterben/,correctiv.org,"Gerüchtekiller: Stirbt die Menschheit unweigerlich aus, wenn Bienen aussterben?",0.1,LOW,False,,,factcheck,2026-05-26T03:42:18.457841
Basisnahrungsmittel brauchen keine tierische Bestäubung Die einfache Antwort: Nein,https://correctiv.org/faktencheck/2026/05/22/geruechtekiller-sterben-menschen-unweigerlich-aus-wenn-bienen-aussterben/,correctiv.org,"Gerüchtekiller: Stirbt die Menschheit unweigerlich aus, wenn Bienen aussterben?",0.1,LOW,False,,,factcheck,2026-05-26T03:42:18.573710
[DEBUNKED] Mit angeblichem Xi-Jinping-Zitat zu Trump werden Klicks gesammelt,https://correctiv.org/faktencheck/2026/05/22/china-und-usa-profile-sammeln-mit-angeblichem-xi-jinping-zitat-zu-donaltrump-klicks/,correctiv.org,Mit angeblichem Xi-Jinping-Zitat zu Trump werden Klicks gesammelt,0.9,HIGH,True,FALSE - Debunked by fact-checkers,correctiv.org,factcheck,2026-05-26T03:42:19.433492
"Es gebe nach wie vor keine Statistik, die „das wahre Ausmaß“ abbilde, bemängelte Franziskus: Nicht von der Weltgesundheitsorganisation (WHO), nicht vom Kinderhilfswerk Unicef oder von Behörden wie Interpol",https://correctiv.org/aktuelles/akten-des-missbrauchs/2026/05/22/missbrauch-kirche-umfrage-hinweise/,correctiv.org,Missbrauch in Kirche: Melden Sie sich mit Hinweisen!,0.1,LOW,False,,,factcheck,2026-05-26T03:42:20.391450
"Auch CORRECTIV hat keine offizielle Statistik gefunden, die nicht von einer hohen Dunkelziffer ausgeht",https://correctiv.org/aktuelles/akten-des-missbrauchs/2026/05/22/missbrauch-kirche-umfrage-hinweise/,correctiv.org,Missbrauch in Kirche: Melden Sie sich mit Hinweisen!,0.1,LOW,False,,,factcheck,2026-05-26T03:42:20.477965
"Um der Frage näher zu kommen, hat CORRECTIV für die Recherche „Akten des Missbrauchs“ Anfragen an alle Bistümer und größere Orden auf der Welt gestellt",https://correctiv.org/aktuelles/akten-des-missbrauchs/2026/05/22/missbrauch-kirche-umfrage-hinweise/,correctiv.org,Missbrauch in Kirche: Melden Sie sich mit Hinweisen!,0.1,LOW,False,,,factcheck,2026-05-26T03:42:20.586495
"Mai 2026 Europol hat über Jahre eine Schatten-IT aufgebaut, Teile davon könnten auch heute noch im Einsatz sein",https://correctiv.org/aktuelles/europa-aktuelles/2026/05/26/nach-correctiv-recherche-linke-fordert-deutschlands-zusammenarbeit-mit-europol-zu-ueberpruefen/,correctiv.org,Linke will deutsche Zusammenarbeit mit Europol überprüfen lassen,0,LOW,False,,,factcheck,2026-05-26T03:42:21.333337
"Der innenpolitische Sprecher der SPD-Fraktion im Bundestag, Sebastian Fiedler, sagte auf Anfrage, nach seinem Kenntnisstand spreche nichts dafür, dass Europol heimliche Datenstrukturen außerhalb jeder Kontrolle betrieben habe oder das heute tue",https://correctiv.org/aktuelles/europa-aktuelles/2026/05/26/nach-correctiv-recherche-linke-fordert-deutschlands-zusammenarbeit-mit-europol-zu-ueberpruefen/,correctiv.org,Linke will deutsche Zusammenarbeit mit Europol überprüfen lassen,0,LOW,False,,,factcheck,2026-05-26T03:42:21.436589
"Der Bericht “Nirgendwo existieren“ stützt sich auf fünf Zeugenaussagen, die durch Berichte von Human Rights Watch, Amnesty International, der Afghan LGBTQ+ Organization (ALO) sowie offizielle europäische Regierungs- und BAMF-Daten bestätigt wurden",https://correctiv.org/aktuelles/international/2026/05/22/nirgendwo-existieren-wie-queere-und-trans-afghanen-durch-alle-sicherheitsnetze-fallen/,correctiv.org,Nirgendwo existieren: Queere und trans Afghanen auf der Flucht - correctiv.org,0,LOW,False,,,factcheck,2026-05-26T03:42:22.290223
"Außerdem werden immer mehr kulturelle Verbote erlassen, gegen Musik, Tanz und unangepasste Kleidung, alles wichtige Ausdrucksmöglichkeiten von queerer Identität, die immer mehr zum Risiko werden",https://correctiv.org/aktuelles/international/2026/05/22/nirgendwo-existieren-wie-queere-und-trans-afghanen-durch-alle-sicherheitsnetze-fallen/,correctiv.org,Nirgendwo existieren: Queere und trans Afghanen auf der Flucht - correctiv.org,0.1,LOW,False,,,factcheck,2026-05-26T03:42:22.399151
“Trotz allem habe ich immer weite,https://correctiv.org/aktuelles/international/2026/05/22/nirgendwo-existieren-wie-queere-und-trans-afghanen-durch-alle-sicherheitsnetze-fallen/,correctiv.org,Nirgendwo existieren: Queere und trans Afghanen auf der Flucht - correctiv.org,0.1,LOW,False,,,factcheck,2026-05-26T03:42:22.501305
[DEBUNKED] Foto von Busfahrer ohne Maske hat keinen Bezug zu Hantavirus,https://correctiv.org/faktencheck/2026/05/22/foto-von-busfahrer-ohne-maske-hat-keinen-bezug-zu-hantavirus/,correctiv.org,Foto von Busfahrer ohne Maske hat keinen Bezug zu Hantavirus,0.9,HIGH,True,FALSE - Debunked by fact-checkers,correctiv.org,factcheck,2026-05-26T03:42:24.088694
"Am Mittwoch bekam deshalb unter anderem die RWTH Aachen Besuch von Ermittlungsbehörden, wie ein Sprecher auf Anfrage bestätigte",https://correctiv.org/hybride-kriegsfuehrung/2026/05/21/von-muenchen-bis-aachen-im-netz-der-china-agenten/,correctiv.org,Von München bis Aachen: Im Netz der China-Agenten,0,LOW,False,,,factcheck,2026-05-26T03:42:24.951849
"Konkret geht es um zwei Online-Vorträge eines RWTH-Forschers, die er nach Angaben des Sprechers vor Vertretern von chinesischen Unternehmen und Forschungseinrichtungen gehalten hat",https://correctiv.org/hybride-kriegsfuehrung/2026/05/21/von-muenchen-bis-aachen-im-netz-der-china-agenten/,correctiv.org,Von München bis Aachen: Im Netz der China-Agenten,0,LOW,False,,,factcheck,2026-05-26T03:42:25.052712
[DEBUNKED] AfD-Politiker Krah verbreitet Fake zu EU-Kredit für Ukraine,https://correctiv.org/faktencheck/2026/05/21/luxusyacht-gekauft-kreml-medien-und-afd-politiker-krah-verbreiten-fake-zu-eu-kredit-fuer-ukraine/,correctiv.org,AfD-Politiker Krah verbreitet Fake zu EU-Kredit für Ukraine,0.9,HIGH,True,FALSE - Debunked by fact-checkers,correctiv.org,factcheck,2026-05-26T03:42:25.894062
Nach der Verarbeitung wird russisches Gold offiziell Schweizerisch – und damit besser verkäuflich,https://correctiv.org/aktuelles/russland-ukraine-2/2026/05/21/russisches-gold-schweizer-markenzeichen-russland-ukraine/,correctiv.org,"Russisches Gold, Schweizer Markenzeichen",0,LOW,False,,,factcheck,2026-05-26T03:42:26.716238
"Seit Kriegsbeginn importierte die Schweiz russisches Gold im Wert von je rund 3,5 Milliarden Franken in den Jahren 2022 und 2023",https://correctiv.org/aktuelles/russland-ukraine-2/2026/05/21/russisches-gold-schweizer-markenzeichen-russland-ukraine/,correctiv.org,"Russisches Gold, Schweizer Markenzeichen",0,LOW,False,,,factcheck,2026-05-26T03:42:26.809262
"Zum Vergleich: Von 2014 bis 2021, ein mehr als doppelt so langer Zeitraum, belief sich der Gesamtwert auf 7,5 Milliarden Franken",https://correctiv.org/aktuelles/russland-ukraine-2/2026/05/21/russisches-gold-schweizer-markenzeichen-russland-ukraine/,correctiv.org,"Russisches Gold, Schweizer Markenzeichen",0,LOW,False,,,factcheck,2026-05-26T03:42:26.916600
"[DEBUNKED] Nein, diese Karte zeigt keine Hantavirus-Fälle",https://correctiv.org/faktencheck/2026/05/20/nein-diese-karte-zeigt-keine-hantavirus-faelle/,correctiv.org,"Nein, diese Karte zeigt keine Hantavirus-Fälle",0.9,HIGH,True,FALSE - Debunked by fact-checkers,correctiv.org,factcheck,2026-05-26T03:42:27.770445
[DEBUNKED] Umgeknicktes Windrad: Altes Video für Desinformation genutzt,https://correctiv.org/faktencheck/2026/05/20/umgeknicktes-windrad-altes-video-fuer-desinformation-genutzt/,correctiv.org,Umgeknicktes Windrad: Altes Video für Desinformation genutzt,0.9,HIGH,True,FALSE - Debunked by fact-checkers,correctiv.org,factcheck,2026-05-26T03:42:28.538295
[DEBUNKED] Parken beim Supermarkt: Keine deutschlandweite Gebühr geplant,https://correctiv.org/faktencheck/2026/05/19/parken-beim-supermarkt-keine-deutschlandweite-gebuehr-geplant/,correctiv.org,Parken beim Supermarkt: Keine deutschlandweite Gebühr geplant,0.9,HIGH,True,FALSE - Debunked by fact-checkers,correctiv.org,factcheck,2026-05-26T03:42:29.280255
"Beworben haben sich nach Angaben aus Branchenkreisen unter anderem die deutschen IT-Firmen Almato, One Data, Rohde &amp; Schwarz sowie ChapsVision aus Frankreich",https://correctiv.org/aktuelles/gesellschaft-2/2026/05/19/die-abkehr-von-palantir-hat-begonnen/,correctiv.org,Die Abkehr von Palantir hat begonnen - correctiv.org,0,LOW,False,,,factcheck,2026-05-26T03:42:30.108607
"Das Problem aber ist: „Bisher gibt es keine Lösung, die an die Le",https://correctiv.org/aktuelles/gesellschaft-2/2026/05/19/die-abkehr-von-palantir-hat-begonnen/,correctiv.org,Die Abkehr von Palantir hat begonnen - correctiv.org,0.1,LOW,False,,,factcheck,2026-05-26T03:42:30.213008
[DEBUNKED] Faktencheck: Steckt hinter mNexspike wirklich eine Todesbotschaft?,https://www.mimikama.org/bedeutet-mnexspike-wirklich-tod/,www.mimikama.org,Faktencheck: Steckt hinter mNexspike wirklich eine Todesbotschaft?,0.9,HIGH,True,FALSE - Debunked by fact-checkers,www.mimikama.org,factcheck,2026-05-26T03:42:30.311346
[DEBUNKED] Kommt wegen Ebola jetzt der nächste Lockdown?,https://www.mimikama.org/kommt-wegen-ebola-jetzt-der-naechste-lockdown/,www.mimikama.org,Kommt wegen Ebola jetzt der nächste Lockdown?,0.9,HIGH,True,FALSE - Debunked by fact-checkers,www.mimikama.org,factcheck,2026-05-26T03:42:30.412811
[DEBUNKED] Erhöht Deutschland im August 2026 die Bahnpreise?,https://www.mimikama.org/erhoeht-deutschland-im-august-2026-die-bahnpreise/,www.mimikama.org,Erhöht Deutschland im August 2026 die Bahnpreise?,0.9,HIGH,True,FALSE - Debunked by fact-checkers,www.mimikama.org,factcheck,2026-05-26T03:42:30.512131
[DEBUNKED] „Ich habe die KI gefragt“ ist kein Beweis,https://www.mimikama.org/ich-habe-die-ki-gefragt-ist-kein-beweis/,www.mimikama.org,„Ich habe die KI gefragt“ ist kein Beweis,0.9,HIGH,True,FALSE - Debunked by fact-checkers,www.mimikama.org,factcheck,2026-05-26T03:42:30.608870
[DEBUNKED] Sind die Plopsaland-Tickets auf Facebook echt?,https://www.mimikama.org/plopsaland-tickets-auf-facebook/,www.mimikama.org,Sind die Plopsaland-Tickets auf Facebook echt?,0.9,HIGH,True,FALSE - Debunked by fact-checkers,www.mimikama.org,factcheck,2026-05-26T03:42:30.716376
[DEBUNKED] Faktencheck: KleasKunst nutzt KI für emotionale Manipulation!,https://www.mimikama.org/kleaskunst-ki-inhalte-mitleid/,www.mimikama.org,Faktencheck: KleasKunst nutzt KI für emotionale Manipulation!,0.9,HIGH,True,FALSE - Debunked by fact-checkers,www.mimikama.org,factcheck,2026-05-26T03:42:30.829669
[DEBUNKED] Warum blinkt diese „Microsoft“-Warnung? Ist sie echt?,https://www.mimikama.org/microsoft-warnung-blinkt/,www.mimikama.org,Warum blinkt diese „Microsoft“-Warnung? Ist sie echt?,0.9,HIGH,True,FALSE - Debunked by fact-checkers,www.mimikama.org,factcheck,2026-05-26T03:42:30.919602
[DEBUNKED] Werden Hunde in Dänemark sofort eingeschläfert?,https://www.mimikama.org/hunde-in-daenemark-sofort-eingeschlaefert/,www.mimikama.org,Werden Hunde in Dänemark sofort eingeschläfert?,0.9,HIGH,True,FALSE - Debunked by fact-checkers,www.mimikama.org,factcheck,2026-05-26T03:42:31.035010
[DEBUNKED] Stammt das Schutzanzug-Foto von der „Hondius“?,https://www.mimikama.org/schutzanzug-foto-hondius/,www.mimikama.org,Stammt das Schutzanzug-Foto von der „Hondius“?,0.9,HIGH,True,FALSE - Debunked by fact-checkers,www.mimikama.org,factcheck,2026-05-26T03:42:31.148787
[DEBUNKED] Demokratie ohne gemeinsame Fakten,https://www.mimikama.org/demokratie-ohne-gemeinsame-fakten/,www.mimikama.org,Demokratie ohne gemeinsame Fakten,0.9,HIGH,True,FALSE - Debunked by fact-checkers,www.mimikama.org,factcheck,2026-05-26T03:42:31.270365
[DEBUNKED] Lebt Michael Jackson in Brasilien?,https://www.mimikama.org/lebt-michael-jackson-in-brasilien/,www.mimikama.org,Lebt Michael Jackson in Brasilien?,0.9,HIGH,True,FALSE - Debunked by fact-checkers,www.mimikama.org,factcheck,2026-05-26T03:42:31.366633
"[DEBUNKED] Ukraine: Belegt ein Konzert in Kiew, dass Wahlen möglich sind?",https://www.mimikama.org/belegt-konzert-in-kiew-moegliche-wahlen/,www.mimikama.org,"Ukraine: Belegt ein Konzert in Kiew, dass Wahlen möglich sind?",0.9,HIGH,True,FALSE - Debunked by fact-checkers,www.mimikama.org,factcheck,2026-05-26T03:42:31.469055
"[DEBUNKED] Lauterbach, WHO und „Klima-Notstand“: Was im Bericht steht",https://www.mimikama.org/lauterbach-who-klima-notstand-bericht/,www.mimikama.org,"Lauterbach, WHO und „Klima-Notstand“: Was im Bericht steht",0.9,HIGH,True,FALSE - Debunked by fact-checkers,www.mimikama.org,factcheck,2026-05-26T03:42:31.565539
[DEBUNKED] Hat Selenskyj wirklich Dutzende Immobilien im Ausland?,https://www.mimikama.org/selenskyj-dutzende-immobilien-im-ausland/,www.mimikama.org,Hat Selenskyj wirklich Dutzende Immobilien im Ausland?,0.9,HIGH,True,FALSE - Debunked by fact-checkers,www.mimikama.org,factcheck,2026-05-26T03:42:31.670847
[DEBUNKED] Gefälschte Briefe der Bundesnetzagentur im Umlauf,https://www.mimikama.org/gefaelschte-briefe-bundesnetzagentur-eeg-sanktion/,www.mimikama.org,Gefälschte Briefe der Bundesnetzagentur im Umlauf,0.9,HIGH,True,FALSE - Debunked by fact-checkers,www.mimikama.org,factcheck,2026-05-26T03:42:31.778421
"Laut der&nbsp;Mobilen Beratung gegen Rechtsextremismus in Thüringen&nbsp;ist Frank Haußner eine zentrale Mobilisierungsfigur des Netzwerks, das Verbindungen in die Reichsbürger- und Neonazi-Szene unterhält und zugleich enge Bezüge zur AfD pflegt",https://www.volksverpetzer.de/analyse/dunkle-maechte-afd-windkraft/,www.volksverpetzer.de,&quot;Dunkle Mächte&quot;: Das ECHTE Motiv hinter dem AfD-Windkraft-Protest - Volksverpetzer,0,LOW,False,,,factcheck,2026-05-26T03:42:32.543940
Der daraus jährlich erzeugte Strom könnte nach Angaben des Unternehmens den Bedarf von etwa 16,https://www.volksverpetzer.de/analyse/dunkle-maechte-afd-windkraft/,www.volksverpetzer.de,&quot;Dunkle Mächte&quot;: Das ECHTE Motiv hinter dem AfD-Windkraft-Protest - Volksverpetzer,0,LOW,False,,,factcheck,2026-05-26T03:42:32.646783
"Mit einem motivierenden Aufruf an alle Politiker:innen, Aktivist:innen, Wähler:innen und Entscheider:innen, jetzt richtig anzupacken",https://www.volksverpetzer.de/faktencheck/klimaschutz-wirkt-rechte-luegen-ipcc/,www.volksverpetzer.de,"Forscher bestätigen, dass Klimaschutz wirkt – deswegen wollen Rechte ihn jetzt abschaffen?! - Volksv",0.1,LOW,False,,,factcheck,2026-05-26T03:42:33.409653
"Sie veröffentlichten einen Offenen Brief an die Westend-Geschäftsführung, in dem sie Vorbehalte andeuten gegen die Poschardt-Bücher und auch die Titel des FDP-Politikers Wolfgang Kubicki, der seit Jahren immer wieder bei Westend publiziert",https://www.volksverpetzer.de/aktuelles/autoren-treten-aus-westend-verlag/,www.volksverpetzer.de,32 Autoren beenden Zusammenarbeit: Westend-Verlag driftet nach rechts - Volksverpetzer,0.1,LOW,False,,,factcheck,2026-05-26T03:42:34.160264
[DEBUNKED] Irreführende AfD-&quot;Angriffe&quot;: Was diese Statistik der Tagesschau alles nicht verrät - Volksverpetzer,https://www.volksverpetzer.de/faktencheck/statistik-tagesschau-afd-angriffe/,www.volksverpetzer.de,Irreführende AfD-&quot;Angriffe&quot;: Was diese Statistik der Tagesschau alles nicht verrät - Volks,0.9,HIGH,True,FALSE - Debunked by fact-checkers,www.volksverpetzer.de,factcheck,2026-05-26T03:42:34.815831
"[DEBUNKED] MV: Wie Medien AfD-Wahlkampf machen, ohne es zu merken - Volksverpetzer",https://www.volksverpetzer.de/aktuelles/medien-afd-mv-wahlkampf/,www.volksverpetzer.de,"MV: Wie Medien AfD-Wahlkampf machen, ohne es zu merken - Volksverpetzer",0.9,HIGH,True,FALSE - Debunked by fact-checkers,www.volksverpetzer.de,factcheck,2026-05-26T03:42:35.460053
[DEBUNKED] Die AfD schreibt bei der AfD ab – samt peinlicher Fehler! - Volksverpetzer,https://www.volksverpetzer.de/aktuelles/afd-schreibt-afd-ab/,www.volksverpetzer.de,Die AfD schreibt bei der AfD ab – samt peinlicher Fehler! - Volksverpetzer,0.9,HIGH,True,FALSE - Debunked by fact-checkers,www.volksverpetzer.de,factcheck,2026-05-26T03:42:36.117667
"„Generation Deutschland“: ein Sammelbecken an Rechtsextremisten Nach der Gründung der neuen AfD-Jugend auf Bundesebene im letzten Jahr in Gießen haben sich nun auch fast alle Landesverbände der ""Generation Deutschland"" gegründet",https://www.volksverpetzer.de/analyse/grosse-generation-deutschland/,www.volksverpetzer.de,Die große &quot;Generation Deutschland&quot;-Recherche: Der Trick der AfD‑Jugend entlarvt! - Volksve,0.1,LOW,False,,,factcheck,2026-05-26T03:42:36.868707
[DEBUNKED] Warum Zehdenick für die AfD eine Ausnahme bleiben wird - Volksverpetzer,https://www.volksverpetzer.de/analyse/zehdenick-afd-problem/,www.volksverpetzer.de,Warum Zehdenick für die AfD eine Ausnahme bleiben wird - Volksverpetzer,0.9,HIGH,True,FALSE - Debunked by fact-checkers,www.volksverpetzer.de,factcheck,2026-05-26T03:42:37.499764
[DEBUNKED] Wie die Ostdeutsche Allgemeine Volksverpetzer zum Schweigen bringen will - Volksverpetzer,https://www.volksverpetzer.de/aktuelles/ostdeutsche-allgemeine-anwalt-anschwaerzen/,www.volksverpetzer.de,Wie die Ostdeutsche Allgemeine Volksverpetzer zum Schweigen bringen will - Volksverpetzer,0.9,HIGH,True,FALSE - Debunked by fact-checkers,www.volksverpetzer.de,factcheck,2026-05-26T03:42:38.157649
[DEBUNKED] 19 claims about gas prices from our archives | Snopes.com,https://www.snopes.com/collections/gas-prices-claims/,www.snopes.com,19 claims about gas prices from our archives | Snopes.com,0.9,HIGH,True,FALSE - Debunked by fact-checkers,www.snopes.com,factcheck,2026-05-26T03:42:38.312840
[DEBUNKED] Don't trust ads claiming Bill Gates created Alzheimer's cure called 'Brain Honey' | Snopes.com,https://www.snopes.com/fact-check/bill-gates-brain-honey-alzheimers/,www.snopes.com,Don't trust ads claiming Bill Gates created Alzheimer's cure called 'Brain Honey' | Snopes.com,0.9,HIGH,True,FALSE - Debunked by fact-checkers,www.snopes.com,factcheck,2026-05-26T03:42:38.483550
[DEBUNKED] Did Warren Buffett warn of Trump declaring martial law and 'canceling' democracy? Here's the truth | Snopes.com,https://www.snopes.com/fact-check/warren-buffett-trump-warning/,www.snopes.com,Did Warren Buffett warn of Trump declaring martial law and 'canceling' democracy? Here's the truth |,0.9,HIGH,True,FALSE - Debunked by fact-checkers,www.snopes.com,factcheck,2026-05-26T03:42:39.082228
[DEBUNKED] Did Big Mac shrink by 40% while price skyrocketed from 50 cents to $8? | Snopes.com,https://www.snopes.com/news/2026/05/25/big-mac-price-increase/,www.snopes.com,Did Big Mac shrink by 40% while price skyrocketed from 50 cents to $8? | Snopes.com,0.9,HIGH,True,FALSE - Debunked by fact-checkers,www.snopes.com,factcheck,2026-05-26T03:42:39.220720
[DEBUNKED] Debunking conspiracy theory Huggies put 'pedophile symbols' on diapers | Snopes.com,https://www.snopes.com/fact-check/huggies-pedophile-symbols-diapers/,www.snopes.com,Debunking conspiracy theory Huggies put 'pedophile symbols' on diapers | Snopes.com,0.9,HIGH,True,FALSE - Debunked by fact-checkers,www.snopes.com,factcheck,2026-05-26T03:42:39.362608
[DEBUNKED] 16 claims about Tucker Carlson we've investigated | Snopes.com,https://www.snopes.com/collections/tucker-carlson-collection/,www.snopes.com,16 claims about Tucker Carlson we've investigated | Snopes.com,0.9,HIGH,True,FALSE - Debunked by fact-checkers,www.snopes.com,factcheck,2026-05-26T03:42:39.526635
[DEBUNKED] Posts falsely claim Sasha Obama said Barack is gay and Michelle is trans | Snopes.com,https://www.snopes.com/fact-check/sasha-obama-parents-gay-trans-claim/,www.snopes.com,Posts falsely claim Sasha Obama said Barack is gay and Michelle is trans | Snopes.com,0.9,HIGH,True,FALSE - Debunked by fact-checkers,www.snopes.com,factcheck,2026-05-26T03:42:39.667155
[DEBUNKED] Historian Heather Cox Richardson didn't go live at 3 a.m. after receiving threat. Here's how we know | Snopes.com,https://www.snopes.com/fact-check/heather-cox-richardson-threat/,www.snopes.com,Historian Heather Cox Richardson didn't go live at 3 a.m. after receiving threat. Here's how we know,0.9,HIGH,True,FALSE - Debunked by fact-checkers,www.snopes.com,factcheck,2026-05-26T03:42:39.969071
[DEBUNKED] Don't fall for these 19 fake Trump Truth Social posts | Snopes.com,https://www.snopes.com/collections/fake-trump-truth-social-posts-2/,www.snopes.com,Don't fall for these 19 fake Trump Truth Social posts | Snopes.com,0.9,HIGH,True,FALSE - Debunked by fact-checkers,www.snopes.com,factcheck,2026-05-26T03:42:40.103757
[DEBUNKED] Have Driscoll's strawberries been linked to cancer-causing chemicals? We investigated | Snopes.com,https://www.snopes.com/fact-check/driscolls-strawberries-toxins-cancer/,www.snopes.com,Have Driscoll's strawberries been linked to cancer-causing chemicals? We investigated | Snopes.com,0.9,HIGH,True,FALSE - Debunked by fact-checkers,www.snopes.com,factcheck,2026-05-26T03:42:40.254826
"It referred to calculations from the New York State Division of the Budget that put the ""new effective tariff rate"" at 21% on imported goods, or $4,200 more per New York household",http://www.politifact.com/factchecks/2026/may/21/kirsten-gillibrand/tariff-burden-households-new-york/,www.politifact.com,"PolitiFact | Sen. Kirsten Gillibrand says tariffs cost New Yorkers $4,200 a year. Most recent estima",0,LOW,False,,,factcheck,2026-05-26T03:42:41.076199
[DEBUNKED] PolitiFact | No evidence that San Diego mosque shooting suspects were transgender couple,http://www.politifact.com/factchecks/2026/may/20/social-media/no-evidence-san-diego-mosque-suspects-trans/,www.politifact.com,PolitiFact | No evidence that San Diego mosque shooting suspects were transgender couple,0.9,HIGH,True,FALSE - Debunked by fact-checkers,www.politifact.com,factcheck,2026-05-26T03:42:41.487239
"For this year, enrollees then faced premiums that increased, on average, by 26%",http://www.politifact.com/article/2026/may/20/as-aca-enrollment-drops-higher-insurance-rates-may/,www.politifact.com,"PolitiFact | As ACA enrollment drops, higher insurance rates may follow",0,LOW,False,,,factcheck,2026-05-26T03:42:41.725377
"A KFF analysis released May 19, for instance, found that the average ACA plan deductible saw the steepest increase in history — growing by 37%, or over $1,000, from $2,759 in 2025 to $3,786 in 2026 as enhanced premium tax credits expired",http://www.politifact.com/article/2026/may/20/as-aca-enrollment-drops-higher-insurance-rates-may/,www.politifact.com,"PolitiFact | As ACA enrollment drops, higher insurance rates may follow",0,LOW,False,,,factcheck,2026-05-26T03:42:41.831998
2% of students in grades 6 through 12 still reported second hand exposure to aerosols from e-cigarettes,http://www.politifact.com/article/2026/may/19/secondhand-vaping-health-risks-research/,www.politifact.com,"PolitiFact | When someone’s vaping nearby, what are you breathing in? The risks of vape pens’ second",0,LOW,False,,,factcheck,2026-05-26T03:42:42.080913
"Prices for key goods and services have increased Rising prices are a big concern for many Americans, after experiencing an inflation peak around 9% in 2022",http://www.politifact.com/article/2026/may/15/trump-economy-inflation-jobs-consumers-polls/,www.politifact.com,PolitiFact | Trump said Americans&#x27; finances don&#x27;t motivate him in Iran talks. How are peop,0,LOW,False,,,factcheck,2026-05-26T03:42:42.797699
[DEBUNKED] PolitiFact | Altered video of Byron Donalds arguing for insider trading in Congress spreads online,http://www.politifact.com/factchecks/2026/may/15/tweets/byron-donalds-florida-insider-trading/,www.politifact.com,PolitiFact | Altered video of Byron Donalds arguing for insider trading in Congress spreads online,0.9,HIGH,True,FALSE - Debunked by fact-checkers,www.politifact.com,factcheck,2026-05-26T03:42:42.934028
"Nationwide, 91% of people sentenced were United States citizens",http://www.politifact.com/article/2026/may/14/vice-president-JD-Vance-Maine-fraud-Janet-Mills/,www.politifact.com,"PolitiFact | Fact-checking JD Vance on Maine Democrats, Medicaid fraud and autism coverage",0,LOW,False,,,factcheck,2026-05-26T03:42:43.178097
"illegally, just under 1% of the state’s population and one of the smallest unauthorized immigrant populations in the U",http://www.politifact.com/article/2026/may/14/vice-president-JD-Vance-Maine-fraud-Janet-Mills/,www.politifact.com,"PolitiFact | Fact-checking JD Vance on Maine Democrats, Medicaid fraud and autism coverage",0.1,LOW,False,,,factcheck,2026-05-26T03:42:43.286340
[DEBUNKED] Muslim majority countries host millions of refugees – Full Fact,https://fullfact.org/world/muslim-majority-countries-host-millions-refugees/,fullfact.org,Muslim majority countries host millions of refugees – Full Fact,0.9,HIGH,True,FALSE - Debunked by fact-checkers,fullfact.org,factcheck,2026-05-26T03:42:43.794061
