claim,source_url,source_domain,article_title,risk_score,risk_category,has_factcheck,factcheck_rating,factcheck_source,source_type,checked_at
[DEBUNKED] Fact Check: Video That Shows Doctors And Nurses In Masks And Protective Gear Does NOT Show Patient With Hantavirus -- It's From COVID 2020 | Lead Stories,https://leadstories.com/hoax-alert/2026/05/fact-check-video-that-shows-doctors-nurses-masks-protective-gear-does-not-show-2026-hantavirus-patient.html,leadstories.com,Fact Check: Video That Shows Doctors And Nurses In Masks And Protective Gear Does NOT Show Patient W,0.9,HIGH,True,FALSE - Debunked by fact-checkers,leadstories.com,factcheck,2026-05-15T03:38:44.037401
[DEBUNKED] Fact Check: Memo About 'Unidentified Humanoid' Is NOT Real Department Of War Document Released In Official UFO Files | Lead Stories,https://leadstories.com/hoax-alert/2026/05/fact-check-memo-about-unidentified-humanoid-is-not-real-department-of-war-document-released-in-official-ufo-files.html,leadstories.com,Fact Check: Memo About 'Unidentified Humanoid' Is NOT Real Department Of War Document Released In Of,0.9,HIGH,True,FALSE - Debunked by fact-checkers,leadstories.com,factcheck,2026-05-15T03:38:44.155839
[DEBUNKED] Fact Check: FAKE Photo Shows Golden Trump Statue Covered In Toilet Paper And Trash | Lead Stories,https://leadstories.com/hoax-alert/2026/05/fact-check-fake-photo-shows-golden-trump-statue-covered-in-toilet-paper-and-trash.html,leadstories.com,Fact Check: FAKE Photo Shows Golden Trump Statue Covered In Toilet Paper And Trash | Lead Stories,0.9,HIGH,True,FALSE - Debunked by fact-checkers,leadstories.com,factcheck,2026-05-15T03:38:44.279481
[DEBUNKED] Fact Check: Posts Saying Boy George And Other Celebs Were Mocked And Denied Entry At Louis Vuitton For Dressing Too Casually Are NOT Real -- Spam From Vietnam | Lead Stories,https://leadstories.com/hoax-alert/2026/05/fact-check-post-saying-celebs-were-mocked-by-louis-vuitton-employees-not-real.html,leadstories.com,Fact Check: Posts Saying Boy George And Other Celebs Were Mocked And Denied Entry At Louis Vuitton F,0.9,HIGH,True,FALSE - Debunked by fact-checkers,leadstories.com,factcheck,2026-05-15T03:38:44.428283
[DEBUNKED] Fact Check: Image Of Trump Holding Up Frightened Little Girl Is Fake -- Manipulations Of Body Parts Are Obvious | Lead Stories,https://leadstories.com/hoax-alert/2026/05/fact-check-fake-image-purports-to-show-trump-holding-up-frightened-little-girl.html,leadstories.com,Fact Check: Image Of Trump Holding Up Frightened Little Girl Is Fake -- Manipulations Of Body Parts ,0.9,HIGH,True,FALSE - Debunked by fact-checkers,leadstories.com,factcheck,2026-05-15T03:38:44.557431
"[DEBUNKED] Fact Check: FAKE Video Shows Enormous Whale Breaching, Swamping Workers With A Wave -- It's AI | Lead Stories",https://leadstories.com/hoax-alert/2026/05/fact-check-fake-video-shows-enormous-whale-breaching-swamping-workers-with-a-wave-ai-generated.html,leadstories.com,"Fact Check: FAKE Video Shows Enormous Whale Breaching, Swamping Workers With A Wave -- It's AI | Lea",0.9,HIGH,True,FALSE - Debunked by fact-checkers,leadstories.com,factcheck,2026-05-15T03:38:44.679132
[DEBUNKED] Fact Check: Parody Post Said Mariah Carey Told Justin Bieber Off About Diddy Parties -- Not Real News | Lead Stories,https://leadstories.com/hoax-alert/2026/05/fact-check-parody-post-said-mariah-carey-told-justin-bieber-off-about-Diddy-parties.html,leadstories.com,Fact Check: Parody Post Said Mariah Carey Told Justin Bieber Off About Diddy Parties -- Not Real New,0.9,HIGH,True,FALSE - Debunked by fact-checkers,leadstories.com,factcheck,2026-05-15T03:38:44.810280
[DEBUNKED] Fact Check: FAKE Image of Trump And Musk Eating Panda Express On Air Force One Flight To China Is NOT Real Photo  | Lead Stories,https://leadstories.com/hoax-alert/2026/05/fact-check-fake-image-of-trump-and-musk-eating-panda-express-on-air-force-one.html,leadstories.com,Fact Check: FAKE Image of Trump And Musk Eating Panda Express On Air Force One Flight To China Is NO,0.9,HIGH,True,FALSE - Debunked by fact-checkers,leadstories.com,factcheck,2026-05-15T03:38:44.932841
[DEBUNKED] Fact Check: U.S. Supreme Court Did NOT Issue 7-2 Ruling Abolishing Income Tax Under Case Number 24-1791 -- Case Does NOT Exist | Lead Stories,https://leadstories.com/hoax-alert/2026/05/fact-check-us-supreme-court-did-not-issue-7-2-ruling-abolishing-income-tax-case-24-1791.html,leadstories.com,Fact Check: U.S. Supreme Court Did NOT Issue 7-2 Ruling Abolishing Income Tax Under Case Number 24-1,0.9,HIGH,True,FALSE - Debunked by fact-checkers,leadstories.com,factcheck,2026-05-15T03:38:45.054036
[DEBUNKED] Fact Check: Posts Saying Your Favorite Celeb Publicly Claimed 'Pro-Israel American Billionaires' Are Working To Undermine Their Career Are NOT Real -- Spam From Vietnam | Lead Stories,https://leadstories.com/hoax-alert/2026/05/fact-check-posts-saying-fav-celeb-claimed-pro-israeli-american-billionaires-undermine-career-not-real.html,leadstories.com,Fact Check: Posts Saying Your Favorite Celeb Publicly Claimed 'Pro-Israel American Billionaires' Are,0.9,HIGH,True,FALSE - Debunked by fact-checkers,leadstories.com,factcheck,2026-05-15T03:38:45.174798
[DEBUNKED] Fact Check: FAKE Video Shows Michael Jackson Sitting On A Bus In Brazil -- It's AI | Lead Stories,https://leadstories.com/hoax-alert/2026/05/fact-check-fake-video-michael-jackson-sitting-on-bus-in-brazil-ts-ai.html,leadstories.com,Fact Check: FAKE Video Shows Michael Jackson Sitting On A Bus In Brazil -- It's AI | Lead Stories,0.9,HIGH,True,FALSE - Debunked by fact-checkers,leadstories.com,factcheck,2026-05-15T03:38:45.304329
[DEBUNKED] Fact Check: NO EVIDENCE Real Magazine Article Said Melania Trump Was 'Poppers Girl At An East Village Gay Bar'  | Lead Stories,https://leadstories.com/hoax-alert/2026/05/fact-check-no-evidence-real-magazine-article-said-melania-trump-was-poppers-girl.html,leadstories.com,Fact Check: NO EVIDENCE Real Magazine Article Said Melania Trump Was 'Poppers Girl At An East Villag,0.9,HIGH,True,FALSE - Debunked by fact-checkers,leadstories.com,factcheck,2026-05-15T03:38:45.422135
"Although hantavirus’ mortality rate is quite high — close to 40% for some strains — there is not evidence it easily spreads or mutates, making it more likely that the public health response can keep pace to reduce further spread",https://www.poynter.org/fact-checking/2026/is-hantavirus-next-pandemic-covid-19/,www.poynter.org,Why experts say the hantavirus outbreak is not another COVID-19 - Poynter,0,LOW,False,,,factcheck,2026-05-15T03:38:46.165537
"Polls consistently show that the majority of Americans blame Trump and the war in Iran for a worsening economy, including a new CNN poll in which 77% blamed Trump",https://www.poynter.org/commentary/2026/i-dont-think-about-americans-financial-situation-trump/,www.poynter.org,Trump’s latest exchange with reporters handed Democrats a ready-made attack ad - Poynter,0,LOW,False,,,factcheck,2026-05-15T03:38:46.447410
The poll also showed Trump’s approval rating on the economy is at a career-worse 30%,https://www.poynter.org/commentary/2026/i-dont-think-about-americans-financial-situation-trump/,www.poynter.org,Trump’s latest exchange with reporters handed Democrats a ready-made attack ad - Poynter,0,LOW,False,,,factcheck,2026-05-15T03:38:46.569822
"Meanwhile, an NBC poll last month had Trump’s disapproval rating at 63%",https://www.poynter.org/commentary/2026/i-dont-think-about-americans-financial-situation-trump/,www.poynter.org,Trump’s latest exchange with reporters handed Democrats a ready-made attack ad - Poynter,0,LOW,False,,,factcheck,2026-05-15T03:38:46.653851
[DEBUNKED] How Russia lies about the stolen Ukrainian children - EUvsDisinfo,https://euvsdisinfo.eu/how-russia-lies-about-the-stolen-ukrainian-children/,euvsdisinfo.eu,How Russia lies about the stolen Ukrainian children - EUvsDisinfo,0.9,HIGH,True,FALSE - Debunked by fact-checkers,euvsdisinfo.eu,factcheck,2026-05-15T03:38:49.789858
[DEBUNKED] Fake European crises and real Russian failures - EUvsDisinfo,https://euvsdisinfo.eu/fake-european-crises-and-real-russian-failures/,euvsdisinfo.eu,Fake European crises and real Russian failures - EUvsDisinfo,0.9,HIGH,True,FALSE - Debunked by fact-checkers,euvsdisinfo.eu,factcheck,2026-05-15T03:38:52.571968
[DEBUNKED] Russia’s fake nuclear drills and real failure in Mali - EUvsDisinfo,https://euvsdisinfo.eu/russias-fake-nuclear-drills-and-real-failure-in-mali/,euvsdisinfo.eu,Russia’s fake nuclear drills and real failure in Mali - EUvsDisinfo,0.9,HIGH,True,FALSE - Debunked by fact-checkers,euvsdisinfo.eu,factcheck,2026-05-15T03:38:53.851515
[DEBUNKED] Disinformation Review: EU Sanctions and the Kremlin’s Recycled Narratives - EUvsDisinfo,https://euvsdisinfo.eu/disinformation-review-eu-sanctions-and-the-kremlins-recycled-narratives/,euvsdisinfo.eu,Disinformation Review: EU Sanctions and the Kremlin’s Recycled Narratives - EUvsDisinfo,0.9,HIGH,True,FALSE - Debunked by fact-checkers,euvsdisinfo.eu,factcheck,2026-05-15T03:38:56.225818
[DEBUNKED] Russia targets elections in Hungary and Bulgaria - EUvsDisinfo,https://euvsdisinfo.eu/russia-targets-elections-in-hungary-and-bulgaria/,euvsdisinfo.eu,Russia targets elections in Hungary and Bulgaria - EUvsDisinfo,0.9,HIGH,True,FALSE - Debunked by fact-checkers,euvsdisinfo.eu,factcheck,2026-05-15T03:38:58.871652
[DEBUNKED] Pranked by the Kremlin: fake phone calls as a FIMI instrument - EUvsDisinfo,https://euvsdisinfo.eu/pranked-by-the-kremlin-fake-phone-calls-as-a-fimi-instrument/,euvsdisinfo.eu,Pranked by the Kremlin: fake phone calls as a FIMI instrument - EUvsDisinfo,0.9,HIGH,True,FALSE - Debunked by fact-checkers,euvsdisinfo.eu,factcheck,2026-05-15T03:39:00.168469
"Besser essen – immer freitags image""> Foto: Jonathan Knowles / Digital Vision / Getty Images Ausgabe Nr",https://www.spiegel.de/effilee/gastgeben-als-akt-des-widerstands-eine-neue-generation-entdeckt-das-einladen-zum-essen-a-91fe0c3d-d5d1-4a72-b32c-460acf77c387#ref=rss,www.spiegel.de,Gastgeben als Akt des Widerstands: Eine neue Generation entdeckt das Einladen zum Essen - DER SPIEGE,0.1,LOW,False,,,mainstream,2026-05-15T03:39:08.211725
2026 • Alle Ausgaben Sie können den Artikel leider nicht mehr aufrufen,https://www.spiegel.de/effilee/gastgeben-als-akt-des-widerstands-eine-neue-generation-entdeckt-das-einladen-zum-essen-a-91fe0c3d-d5d1-4a72-b32c-460acf77c387#ref=rss,www.spiegel.de,Gastgeben als Akt des Widerstands: Eine neue Generation entdeckt das Einladen zum Essen - DER SPIEGE,0.1,LOW,False,,,mainstream,2026-05-15T03:39:08.292151
"(Ich war da beruflich, privat hätte ich es nie in diese Runde geschafft",https://www.spiegel.de/effilee/gastgeben-als-akt-des-widerstands-eine-neue-generation-entdeckt-das-einladen-zum-essen-a-91fe0c3d-d5d1-4a72-b32c-460acf77c387#ref=rss,www.spiegel.de,Gastgeben als Akt des Widerstands: Eine neue Generation entdeckt das Einladen zum Essen - DER SPIEGE,0.1,LOW,False,,,mainstream,2026-05-15T03:39:08.377825
"Besser essen – immer freitags image""> Foto: Alice Foster / iStockphoto / Getty Images Ausgabe Nr",https://www.spiegel.de/effilee/sommerdrinks-erdbeeren-und-wein-fuenf-gelungene-kombinationen-a-b8f53c2a-2dfc-4a16-9738-cc3277784463#ref=rss,www.spiegel.de,Sommerdrinks: Erdbeeren und Wein – fünf gelungene Kombinationen - DER SPIEGEL,0.1,LOW,False,,,mainstream,2026-05-15T03:39:09.059389
2026 • Alle Ausgaben Sie können den Artikel leider nicht mehr aufrufen,https://www.spiegel.de/effilee/sommerdrinks-erdbeeren-und-wein-fuenf-gelungene-kombinationen-a-b8f53c2a-2dfc-4a16-9738-cc3277784463#ref=rss,www.spiegel.de,Sommerdrinks: Erdbeeren und Wein – fünf gelungene Kombinationen - DER SPIEGEL,0.1,LOW,False,,,mainstream,2026-05-15T03:39:09.140349
"13 Euro – Falls Sie schon den neuen Jahrgang bekommen können, greifen Sie zu",https://www.spiegel.de/effilee/sommerdrinks-erdbeeren-und-wein-fuenf-gelungene-kombinationen-a-b8f53c2a-2dfc-4a16-9738-cc3277784463#ref=rss,www.spiegel.de,Sommerdrinks: Erdbeeren und Wein – fünf gelungene Kombinationen - DER SPIEGEL,0,LOW,False,,,mainstream,2026-05-15T03:39:09.229510
"Besser essen – immer freitags image""> Foto: Dirk Bruniecki / DER SPIEGEL Ausgabe Nr",https://www.spiegel.de/effilee/essen/wirtshaeuser-ort-des-gesellschaftlichen-zusammenhalts-und-kontrolle-a-1cffe278-bc2d-48a9-afd8-24bc43d71e64#ref=rss,www.spiegel.de,Wirtshäuser: Ort des gesellschaftlichen Zusammenhalts und Kontrolle - DER SPIEGEL,0.1,LOW,False,,,mainstream,2026-05-15T03:39:09.903217
Doch immer mehr Betriebe müssen schließen,https://www.spiegel.de/effilee/essen/wirtshaeuser-ort-des-gesellschaftlichen-zusammenhalts-und-kontrolle-a-1cffe278-bc2d-48a9-afd8-24bc43d71e64#ref=rss,www.spiegel.de,Wirtshäuser: Ort des gesellschaftlichen Zusammenhalts und Kontrolle - DER SPIEGEL,0.1,LOW,False,,,mainstream,2026-05-15T03:39:09.990350
2026 • Alle Ausgaben Sie können den Artikel leider nicht mehr aufrufen,https://www.spiegel.de/effilee/essen/wirtshaeuser-ort-des-gesellschaftlichen-zusammenhalts-und-kontrolle-a-1cffe278-bc2d-48a9-afd8-24bc43d71e64#ref=rss,www.spiegel.de,Wirtshäuser: Ort des gesellschaftlichen Zusammenhalts und Kontrolle - DER SPIEGEL,0.1,LOW,False,,,mainstream,2026-05-15T03:39:10.066784
Nun werden immer mehr Opfer geborgen – darunter auch drei tote Kinder,https://www.spiegel.de/ausland/ukraine-meldet-21-tote-nach-russischem-grossangriff-auf-kyjiw-a-e91a8a53-7ecc-425c-949a-2727e9b42e35#ref=rss,www.spiegel.de,Ukraine meldet 21 Tote nach russischem Großangriff auf Kyjiw - DER SPIEGEL,0.1,LOW,False,,,mainstream,2026-05-15T03:39:11.400857
Laut dem ukrainischen Präsidenten Wolodymyr Selenskyj hatte Moskau mehr als 675 Angriffsdrohnen gestartet und feuerte 56 Raketen ab,https://www.spiegel.de/ausland/ukraine-meldet-21-tote-nach-russischem-grossangriff-auf-kyjiw-a-e91a8a53-7ecc-425c-949a-2727e9b42e35#ref=rss,www.spiegel.de,Ukraine meldet 21 Tote nach russischem Großangriff auf Kyjiw - DER SPIEGEL,0,LOW,False,,,mainstream,2026-05-15T03:39:11.479033
Laut der britischen BBC&nbsp; hat sich die Universität von Genua zu dem Unfall geäußert,https://www.spiegel.de/panorama/malediven-fuenf-italienische-todesopfer-nach-tauchunfall-befuerchtet-a-86d0e9e3-003e-403d-be33-ac6867f62522#ref=rss,www.spiegel.de,Malediven: Fünf italienische Todesopfer nach Tauchunfall befürchtet - DER SPIEGEL,0,LOW,False,,,mainstream,2026-05-15T03:39:12.828108
positiv bewerten negativ bewerten Die US-Küstenwache hat nach eigenen Angaben Drogenschmuggler mit Rauschmitteln im Wert von über 61 Millionen Dollar aufgegriffen,https://www.spiegel.de/ausland/kolumbien-us-kuestenwache-stoppt-drei-boote-mit-tonnenweise-kokain-a-dd941059-5809-48f4-b636-e6c4af253b3c#ref=rss,www.spiegel.de,Kolumbien: US-Küstenwache stoppt drei Boote mit tonnenweise Kokain - DER SPIEGEL,0,LOW,False,,,mainstream,2026-05-15T03:39:13.591071
"Allein die fast 2,8 Tonnen Kokain an Bord haben demnach einen Wert von über 45 Millionen Dollar (39 Millionen Euro)",https://www.spiegel.de/ausland/kolumbien-us-kuestenwache-stoppt-drei-boote-mit-tonnenweise-kokain-a-dd941059-5809-48f4-b636-e6c4af253b3c#ref=rss,www.spiegel.de,Kolumbien: US-Küstenwache stoppt drei Boote mit tonnenweise Kokain - DER SPIEGEL,0.1,LOW,False,,,mainstream,2026-05-15T03:39:13.671557
Mit »Keine Zeit zu sterben« hat sich Daniel Craig von der Rolle des James Bond verabschiedet,https://www.spiegel.de/panorama/leute/james-bond-amazon-mgm-studios-aeussern-sich-zur-suche-nach-neuem-007-a-5325fe95-eaa3-4188-bd3a-214abd63655c#ref=rss,www.spiegel.de,James Bond: Amazon MGM Studios äußern sich zur Suche nach neuem 007 - DER SPIEGEL,0.1,LOW,False,,,mainstream,2026-05-15T03:39:14.330493
Später bestätigten auch US-Beamte das Treffen,https://www.spiegel.de/ausland/cia-chef-john-ratcliffe-zu-gespraechen-in-kuba-a-8a5c777c-f0e6-481f-a8ce-49b2ab01307e#ref=rss,www.spiegel.de,CIA-Chef John Ratcliffe zu Gesprächen in Kuba - DER SPIEGEL,0,LOW,False,,,mainstream,2026-05-15T03:39:15.033357
"Ratcliffe traf sich nach Angaben der Nachrichtenagentur AP mit Raúl Guillermo Rodríguez Castro, Innenminister Lázaro Álvarez Casas und dem Chef des kubanischen Geheimdienstes",https://www.spiegel.de/ausland/cia-chef-john-ratcliffe-zu-gespraechen-in-kuba-a-8a5c777c-f0e6-481f-a8ce-49b2ab01307e#ref=rss,www.spiegel.de,CIA-Chef John Ratcliffe zu Gesprächen in Kuba - DER SPIEGEL,0.05,LOW,False,,,mainstream,2026-05-15T03:39:15.071626
"Die kubanische Regierung ‌habe der US-Delegation zudem ​versichert, ‌dass Kuba keine Bedrohung für die nationale Sicherheit der USA darstelle",https://www.spiegel.de/ausland/cia-chef-john-ratcliffe-zu-gespraechen-in-kuba-a-8a5c777c-f0e6-481f-a8ce-49b2ab01307e#ref=rss,www.spiegel.de,CIA-Chef John Ratcliffe zu Gesprächen in Kuba - DER SPIEGEL,0.1,LOW,False,,,mainstream,2026-05-15T03:39:15.153700
"Zur Ausgabe Der Stiftungsratsvorsitzende Heinz Lederer, sein Stellvertreter und ein weiteres Mitglied des Gremiums werden in einen quadratischen Besprechungsraum geführt, alle nehmen an einem Holztisch Platz",https://www.spiegel.de/kultur/orf-roland-weissmann-und-die-penisbild-affaere-ich-stehe-seit-3-jahren-auf-dich-aber-gar-nichts-zu-bekommen-ist-nicht-gut-a-bae2d0fb-c5fc-4dd8-b86c-81f1b3f53bcc#ref=rss,www.spiegel.de,ORF-Skandal um Roland Weißmann: Er schickte seiner Mitarbeiterin Penisbilder - DER SPIEGEL,0.1,LOW,False,,,mainstream,2026-05-15T03:39:15.830056
Banks verkündete seinen Rücktritt in einem Interview mit dem Fernsehsender Fox News,https://www.spiegel.de/ausland/us-grenzschutzchef-michael-banks-ueberraschend-zurueckgetreten-a-515bc6f1-d637-4994-b3dc-2fad55d1d420#ref=rss,www.spiegel.de,US-Grenzschutzchef Michael Banks überraschend zurückgetreten - DER SPIEGEL,0,LOW,False,,,mainstream,2026-05-15T03:39:16.577262
"In einer Abschiedsnachricht an die Mitarbeiter erklärte Banks, er werde »für immer der größte Verteidiger« seiner Behörde bleiben",https://www.spiegel.de/ausland/us-grenzschutzchef-michael-banks-ueberraschend-zurueckgetreten-a-515bc6f1-d637-4994-b3dc-2fad55d1d420#ref=rss,www.spiegel.de,US-Grenzschutzchef Michael Banks überraschend zurückgetreten - DER SPIEGEL,0.1,LOW,False,,,mainstream,2026-05-15T03:39:16.654512
Mehr zum Thema Ex-Border-Patrol-Chief Gregory Bovino: 100 Millionen Menschen aus den USA abschieben,https://www.spiegel.de/ausland/us-grenzschutzchef-michael-banks-ueberraschend-zurueckgetreten-a-515bc6f1-d637-4994-b3dc-2fad55d1d420#ref=rss,www.spiegel.de,US-Grenzschutzchef Michael Banks überraschend zurückgetreten - DER SPIEGEL,0,LOW,False,,,mainstream,2026-05-15T03:39:16.731306
"length - 1, 500, false)"" data-area=""nav-bar"" data-app-hidden x-lazyload> Menü Startseite Wissenschaft Mensch Entwicklungshilfe Trumps Kürzungen bei der Entwicklungshilfe: Studie zeigt dramatische Folgen $swiper",https://www.spiegel.de/wissenschaft/mensch/trumps-kuerzungen-bei-der-entwicklungshilfe-studie-zeigt-dramatische-folgen-a-e640d611-83d2-4795-a0e1-6c7d76c8b547#ref=rss,www.spiegel.de,Trumps Kürzungen bei der Entwicklungshilfe: Studie zeigt dramatische Folgen - DER SPIEGEL,0,LOW,False,,,mainstream,2026-05-15T03:39:17.403483
"positiv bewerten negativ bewerten Die massiven Einschnitte bei der US-Entwicklungsbehörde USAID&nbsp; haben laut einer Studie dafür gesorgt, dass die Gewalt in mehreren afrikanischen Ländern deutlich gestiegen ist",https://www.spiegel.de/wissenschaft/mensch/trumps-kuerzungen-bei-der-entwicklungshilfe-studie-zeigt-dramatische-folgen-a-e640d611-83d2-4795-a0e1-6c7d76c8b547#ref=rss,www.spiegel.de,Trumps Kürzungen bei der Entwicklungshilfe: Studie zeigt dramatische Folgen - DER SPIEGEL,0,LOW,False,,,mainstream,2026-05-15T03:39:17.453139
"«Demo-Teilnehmer:»Es gibt keine Legitimation dafür und man muss dem entgegentreten, entschieden, jeder Einzelne, wie die Politik",https://www.spiegel.de/panorama/vatertag-maenner-demonstrieren-gegen-gewalt-an-frauen-a-529a48d1-c983-4163-9530-253bf2359f09#ref=rss,www.spiegel.de,Vatertag: Männer demonstrieren gegen Gewalt an Frauen - DER SPIEGEL,0.1,LOW,False,,,mainstream,2026-05-15T03:39:18.772644
"A YouGov opinion poll last month found 64% supported the monarchy, but only 53% thought the Royal Family represented good value for money",https://www.bbc.com/news/articles/c4g0e92dp6ko?at_medium=RSS&amp;at_campaign=rss,www.bbc.com,Royal finances face a cut. But will much really change?,0,LOW,False,,,mainstream,2026-05-15T03:39:19.178080
More on the Eurovision Song Contest 2026:A guide to all 35 Eurovision songsIsrael qualifies but Boy George is out of EurovisionAs it happened: The first Eurovision semi-finalEurovision boss: &#x27;We&#x27;re,https://www.bbc.com/news/articles/c9weyz8nk4ro?at_medium=RSS&amp;at_campaign=rss,www.bbc.com,Australia soars into Eurovision final as UK song gets mixed reception,0,LOW,False,,,mainstream,2026-05-15T03:39:19.429213
"The NYPD said at least 5,700 &#x27;dangerous illegal vehicles&#x27; had been seized so far since the start of 2026, a 10% increase compared to the same period in 2025",https://www.bbc.com/news/videos/c1m2p42v847o?at_medium=RSS&amp;at_campaign=rss,www.bbc.com,Hundreds of illegal motorbikes bulldozed in NYC crime crackdown,0,LOW,False,,,mainstream,2026-05-15T03:39:19.772831
"PoliticsWatch: How victory for the Green Party unfoldedLabour, which took the Greater Manchester seat with more than 50% of the vote in 2024, was pushed into third place",https://www.bbc.com/news/videos/c3w2ngny1v6o?at_medium=RSS&amp;at_campaign=rss,www.bbc.com,Watch: The day Labour&#x27;s potential leadership race began to heat up,0,LOW,False,,,mainstream,2026-05-15T03:39:20.168391
