claim,source_url,source_domain,article_title,risk_score,risk_category,has_factcheck,factcheck_rating,factcheck_source,source_type,checked_at
"CORRECTIV berichtete bereits mehrfach, dass deshalb immer häufiger Bürgermeisterinnen, Landräte oder Stadtverordnete unter anderem wegen Anfeindungen resigniert ihr Amt an den Nagel hängen",https://correctiv.org/aktuelles/politik-2/2026/07/13/endlich-berufspolitiker/,correctiv.org,Endlich Berufspolitiker!,0.1,LOW,False,,,factcheck,2026-07-14T02:35:18.120957
"Merz sagte bei der Veranstaltung laut der Rheinischen Post, dass es bei der Ausbildung „junger Entscheidungsträger“ unter anderem darum gehe, demokratische Prozesse noch besser mit Effizienz zu verbinden",https://correctiv.org/aktuelles/politik-2/2026/07/13/endlich-berufspolitiker/,correctiv.org,Endlich Berufspolitiker!,0,LOW,False,,,factcheck,2026-07-14T02:35:18.329749
"Über die Neueröffnung freut sich nicht jeder Die Macher hinter der neuen Kölner Ausbildung kündigen selbst an, dort „Entscheidungsträger“ heranbilden zu wollen",https://correctiv.org/aktuelles/politik-2/2026/07/13/endlich-berufspolitiker/,correctiv.org,Endlich Berufspolitiker!,0,LOW,False,,,factcheck,2026-07-14T02:35:18.567413
[DEBUNKED] Von DJ und Graffiti bis Poetry Slam und Spielenachmittag - correctiv.org,https://correctiv.org/in-eigener-sache/2026/07/13/von-dj-und-graffiti-bis-poetry-slam-und-spielenachmittag/,correctiv.org,Von DJ und Graffiti bis Poetry Slam und Spielenachmittag - correctiv.org,0.9,HIGH,True,FALSE - Debunked by fact-checkers,correctiv.org,factcheck,2026-07-14T02:35:19.514352
(&#8230;)“ Hierzu stelle ich fest: Ich war nie im Aufsichtsrat des Forschungsinstituts Center for Strategic and International Studies (CSIS) tätig,https://correctiv.org/aktuelles/lobbyismus/2026/07/10/gegendarstellung/,correctiv.org,Gegendarstellung - correctiv.org,0.1,LOW,False,,,factcheck,2026-07-14T02:35:20.509533
"Jetzt gibt es neue Details zu dem massiven Umbauprogramm: Die bisherigen zwölf Abteilungen sollen laut Beamtin Ohl so zusammengefasst werden, dass sie die vier Teilstreitkräfte der Truppe spiegeln: Heer, Luftwaffe, Marine, Cyber-Kräfte",https://correctiv.org/aktuelles/sicherheit-und-verteidigung/2026/07/10/bis-ende-2027-bundeswehr-beschaffungsamt-soll-massiv-umgebaut-werden/,correctiv.org,Bis Ende 2027: Bundeswehr-Beschaffungsamt im Umbau,0,LOW,False,,,factcheck,2026-07-14T02:35:21.656139
"Zwischen 2023 und 2025 wickelte das Beschaffungsamt Projekte für rund 189 Milliarden Euro ab: unter anderem für Kampfjets, Luftverteidigungssysteme, die Digitalisierung des Heeres oder KI-Projekte",https://correctiv.org/aktuelles/sicherheit-und-verteidigung/2026/07/10/bis-ende-2027-bundeswehr-beschaffungsamt-soll-massiv-umgebaut-werden/,correctiv.org,Bis Ende 2027: Bundeswehr-Beschaffungsamt im Umbau,0,LOW,False,,,factcheck,2026-07-14T02:35:21.880168
"Lies hatte nach Angaben aus dem Umfeld des Aufsichtsrats einen Kompromiss vorgeschlagen, um die Lage zu entschärfen",https://correctiv.org/aktuelles/wirtschaft/2026/07/10/blumes-umbauplaene-scheitern-im-vw-aufsichtsrat/,correctiv.org,Blumes Umbaupläne scheitern im VW-Aufsichtsrat,0,LOW,False,,,factcheck,2026-07-14T02:35:23.032965
"Kosten: mindestens 1,2 Millionen Euro in zwei Jahren",https://correctiv.org/aktuelles/politik-2/2026/07/08/wirtschaftsministerin-reiche-will-erneut-millionen-auftrag-an-externe-berater-vergeben-kritik-kommt-aus-dem-eigenen-haus/,correctiv.org,Reiche will erneut Millionen-Auftrag an externe Berater vergeben,0,LOW,False,,,factcheck,2026-07-14T02:35:25.309505
"Doch setzt man branchenübliche Stundensätze an, wie der Spiegel zuletzt, kommt man – bei vorsichtigen Schätzungen von rund 180 Euro pro Stunde – auf mindestens 1,2 Millionen Euro",https://correctiv.org/aktuelles/politik-2/2026/07/08/wirtschaftsministerin-reiche-will-erneut-millionen-auftrag-an-externe-berater-vergeben-kritik-kommt-aus-dem-eigenen-haus/,correctiv.org,Reiche will erneut Millionen-Auftrag an externe Berater vergeben,0,LOW,False,,,factcheck,2026-07-14T02:35:25.516293
"CORRECTIV stellt alle 14 Mitglieder vor: ihre Positionen, ihre Verbindungen – und wer künftig in der Partei den Ton angibt",https://correctiv.org/aktuelles/afd/2026/07/08/afd-vorstand-voelkisch-parteitag-erfurt/,correctiv.org,AfD: So völkisch ist der neue Bundesvorstand,0.1,LOW,False,,,factcheck,2026-07-14T02:35:26.969069
"Es darf keine öffentlichen Gelder für Hetze, Rassismus und Hassrede geben“, sagte der Fraktionsvorsitzende der Linken im EU-Parlament, Martin Schirdewan",https://correctiv.org/aktuelles/afd/2026/07/07/eu-parlament-bringt-verbotsverfahren-von-afd-europapartei-esn-auf-den-weg/,correctiv.org,EU-Parlament stimmt für Prüfverfahren der AfD-Parteienfamilie,0.1,LOW,False,,,factcheck,2026-07-14T02:35:28.141446
"Ehemalige Europol-Mitarbeiter beschreiben das System als „Schatten-IT-Umgebung“, die parallel zu den offiziellen Systemen der Strafverfolgungsbehörde genutzt wurde – allerdings ohne die rechtlich notwendigen Sicherheits- und Datenschutzvorkehrungen",https://correctiv.org/aktuelles/europa-aktuelles/2026/07/07/europol-correctiv-recherche-reaktion-beschwerde-eugh/,correctiv.org,Beschwerde gegen Europol nach CORRECTIV-Recherche,0.1,LOW,False,,,factcheck,2026-07-14T02:35:29.332821
[DEBUNKED] Ampel vor Berliner Club „Wilde Renate“ nicht wegen Juni-Hitze geschmolzen,https://correctiv.org/faktencheck/2026/07/06/ampel-vor-berliner-club-wilde-renate-nicht-wegen-juni-hitze-geschmolzen/,correctiv.org,Ampel vor Berliner Club „Wilde Renate“ nicht wegen Juni-Hitze geschmolzen,0.9,HIGH,True,FALSE - Debunked by fact-checkers,correctiv.org,factcheck,2026-07-14T02:35:30.282954
"Die AfD hat offiziell zwar eine andere Definition für diesen völkischen Kampfbegriff, allerdings stehen viele AfDler Sellner und dessen Konzept nahe",https://correctiv.org/aktuelles/afd/2026/07/03/helferich-urteil-gewinn-fuer-das-voelkische-lager-der-afd-in-nrw/,correctiv.org,Schiedsgericht-Urteil: Gewinn für das völkische Lager der AfD,0.1,LOW,False,,,factcheck,2026-07-14T02:35:31.419764
Ebenfalls eine verfassungsfeindliche Zielsetzung hat laut Bundesverwaltungsgericht Martin Sellners Konzept der „Remigration” auch für S,https://correctiv.org/aktuelles/afd/2026/07/03/helferich-urteil-gewinn-fuer-das-voelkische-lager-der-afd-in-nrw/,correctiv.org,Schiedsgericht-Urteil: Gewinn für das völkische Lager der AfD,0,LOW,False,,,factcheck,2026-07-14T02:35:31.627803
"&nbsp; „Alle Geschütze werden aufgefahren“, bestätigt ein hochrangiger Mitarbeiter eines deutschen Chemiekonzerns gegenüber CORRECTIV",https://correctiv.org/aktuelles/lobbyismus/2026/07/06/emissonshandel-chemie-lobby-attackiert-klimaschutz/,correctiv.org,Emmissonshandel: Chemie-Lobby attackiert Klimaschutz,0.1,LOW,False,,,factcheck,2026-07-14T02:35:32.781187
CORRECTIV wird zu 65 Prozent aus privaten Spenden getragen,https://correctiv.org/in-eigener-sache/2026/07/03/gemeinwohlorientierter-journalismus-unter-druck-correctiv-startet-veraenderungsprozess/,correctiv.org,Gemeinwohlorientierter Journalismus unter Druck: CORRECTIV startet Veränderungsprozess - correctiv.o,0,LOW,False,,,factcheck,2026-07-14T02:35:33.929346
"Am Donnerstag, den zweiten Juli, verkündete Bundeskanzler Friedrich Merz, dass alle 33 Vorschläge der Rentenkommission umgesetzt werden sollen",https://correctiv.org/aktuelles/klimawandel/2026/07/02/reform-der-rente-mehr-geld-fuer-klimaschaedliche-industrien/,correctiv.org,Reform der Rente: Mehr Geld für klimaschädliche Industrien - correctiv.org,0.1,LOW,False,,,factcheck,2026-07-14T02:35:35.065766
"Es soll besonders Menschen zugutekommen, die noch keine Erfahrungen mit dem Aktienmarkt haben",https://correctiv.org/aktuelles/klimawandel/2026/07/02/reform-der-rente-mehr-geld-fuer-klimaschaedliche-industrien/,correctiv.org,Reform der Rente: Mehr Geld für klimaschädliche Industrien - correctiv.org,0.1,LOW,False,,,factcheck,2026-07-14T02:35:35.266978
Darin sind ebenfalls keine klimafreundlichen Anlagekriterien erwähnt,https://correctiv.org/aktuelles/klimawandel/2026/07/02/reform-der-rente-mehr-geld-fuer-klimaschaedliche-industrien/,correctiv.org,Reform der Rente: Mehr Geld für klimaschädliche Industrien - correctiv.org,0.1,LOW,False,,,factcheck,2026-07-14T02:35:35.465118
[DEBUNKED] Gefälschter Tagesschau-Artikel über Eklat bei Maischberger,https://www.mimikama.org/fake-tagesschau-eklat-maischberger-nuhr/,www.mimikama.org,Gefälschter Tagesschau-Artikel über Eklat bei Maischberger,0.9,HIGH,True,FALSE - Debunked by fact-checkers,www.mimikama.org,factcheck,2026-07-14T02:35:35.554581
[DEBUNKED] Ursula von der Leyen in Epstein Files? Kein Beleg,https://www.mimikama.org/ursula-von-der-leyen-epstein-files-kein-beleg/,www.mimikama.org,Ursula von der Leyen in Epstein Files? Kein Beleg,0.9,HIGH,True,FALSE - Debunked by fact-checkers,www.mimikama.org,factcheck,2026-07-14T02:35:35.625765
[DEBUNKED] Drohgrafik mit Merz und Trump: Herkunft und Wahrheit aufgedeckt,https://www.mimikama.org/iranische-zeitung-veroeffentlichte-drohgrafik/,www.mimikama.org,Drohgrafik mit Merz und Trump: Herkunft und Wahrheit aufgedeckt,0.9,HIGH,True,FALSE - Debunked by fact-checkers,www.mimikama.org,factcheck,2026-07-14T02:35:35.688152
[DEBUNKED] Vorsicht: Fake-Video mit Markus Lanz – Frau verliert über 1 Million Euro,https://www.mimikama.org/fake-video-mit-markus-lanz-frau-verliert-euro/,www.mimikama.org,Vorsicht: Fake-Video mit Markus Lanz – Frau verliert über 1 Million Euro,0.9,HIGH,True,FALSE - Debunked by fact-checkers,www.mimikama.org,factcheck,2026-07-14T02:35:35.792437
[DEBUNKED] Wie Wohlfühl-Content in Verschwörungserzählungen kippt,https://www.mimikama.org/wie-wohlfuehl-content-in-verschwoerungserzaehlungen-kippt/,www.mimikama.org,Wie Wohlfühl-Content in Verschwörungserzählungen kippt,0.9,HIGH,True,FALSE - Debunked by fact-checkers,www.mimikama.org,factcheck,2026-07-14T02:35:35.872745
[DEBUNKED] Warum Angst sich sicher anfühlen kann,https://www.mimikama.org/warum-angst-sich-sicher-anfuehlen-kann/,www.mimikama.org,Warum Angst sich sicher anfühlen kann,0.9,HIGH,True,FALSE - Debunked by fact-checkers,www.mimikama.org,factcheck,2026-07-14T02:35:35.942284
[DEBUNKED] Vorsicht: Fake-News über Alice Weidels angebliches Testament!,https://www.mimikama.org/clickbait-angebliches-testament-von-alice-weidel/,www.mimikama.org,Vorsicht: Fake-News über Alice Weidels angebliches Testament!,0.9,HIGH,True,FALSE - Debunked by fact-checkers,www.mimikama.org,factcheck,2026-07-14T02:35:36.013304
[DEBUNKED] Die Mimikama-Stempel,https://www.mimikama.org/mimikama-stempel/,www.mimikama.org,Die Mimikama-Stempel,0.9,HIGH,True,FALSE - Debunked by fact-checkers,www.mimikama.org,factcheck,2026-07-14T02:35:36.245368
[DEBUNKED] Grooming-Gangs: 250.000 Opfer? Falsche Zahl in Großbritannien!,https://www.mimikama.org/250-000-opfer-zahl-zu-grooming-gangs-in-grossbritannien-nicht-belegt/,www.mimikama.org,Grooming-Gangs: 250.000 Opfer? Falsche Zahl in Großbritannien!,0.9,HIGH,True,FALSE - Debunked by fact-checkers,www.mimikama.org,factcheck,2026-07-14T02:35:36.314070
[DEBUNKED] Achtung auf Facebook: So erkennst du die manipulativen Videos!,https://www.mimikama.org/du-bist-auf-facebook-unterwegs/,www.mimikama.org,Achtung auf Facebook: So erkennst du die manipulativen Videos!,0.9,HIGH,True,FALSE - Debunked by fact-checkers,www.mimikama.org,factcheck,2026-07-14T02:35:36.382033
[DEBUNKED] Facebook belohnt Unsinn – Warum die Nutzer darauf hereinfallen,https://www.mimikama.org/warum-facebook-so-viel-unsinn-belohnt/,www.mimikama.org,Facebook belohnt Unsinn – Warum die Nutzer darauf hereinfallen,0.9,HIGH,True,FALSE - Debunked by fact-checkers,www.mimikama.org,factcheck,2026-07-14T02:35:37.284580
"[DEBUNKED] Fake-Jobangebote von Adidas, Netflix &amp; Co. im Umlauf",https://www.mimikama.org/fake-jobangebote-adidas-netflix-fifa/,www.mimikama.org,"Fake-Jobangebote von Adidas, Netflix &amp; Co. im Umlauf",0.9,HIGH,True,FALSE - Debunked by fact-checkers,www.mimikama.org,factcheck,2026-07-14T02:35:37.537406
[DEBUNKED] WhatsApp-Benutzernamen: Wie groß ist die Betrugsgefahr?,https://www.mimikama.org/whatsapp-benutzernamen-betrugsgefahr/,www.mimikama.org,WhatsApp-Benutzernamen: Wie groß ist die Betrugsgefahr?,0.9,HIGH,True,FALSE - Debunked by fact-checkers,www.mimikama.org,factcheck,2026-07-14T02:35:37.813431
Öffentliche Instagram-Inhalte können laut Meta auch für KI-Funktionen wiederverwendet werden,https://www.mimikama.org/meta-muse-instagram-bilder-ungefragt-genutzt/,www.mimikama.org,Meta Muse: Können Instagram-Bilder ungefragt genutzt werden?,0,LOW,False,,,factcheck,2026-07-14T02:35:39.545838
Meta bestätigt den Instagram-Bezug In der offiziellen Meldung vom 7,https://www.mimikama.org/meta-muse-instagram-bilder-ungefragt-genutzt/,www.mimikama.org,Meta Muse: Können Instagram-Bilder ungefragt genutzt werden?,0,LOW,False,,,factcheck,2026-07-14T02:35:39.756370
Das bestätigt den Kern der Verunsicherung: Öffentliche Instagram-Konten können offenbar per @-Mention in KI-Bildfunktionen einbezogen werden,https://www.mimikama.org/meta-muse-instagram-bilder-ungefragt-genutzt/,www.mimikama.org,Meta Muse: Können Instagram-Bilder ungefragt genutzt werden?,0,LOW,False,,,factcheck,2026-07-14T02:35:39.956770
[DEBUNKED] Faktencheck: Kokainpakete mit Selenskyj-Foto? Fake News entlarvt!,https://www.mimikama.org/kokainpakete-mit-selenskyjs-foto-vom-rumaenischen-zoll-abgefangen/,www.mimikama.org,Faktencheck: Kokainpakete mit Selenskyj-Foto? Fake News entlarvt!,0.9,HIGH,True,FALSE - Debunked by fact-checkers,www.mimikama.org,factcheck,2026-07-14T02:35:40.189863
[DEBUNKED] Studie belegt: Wie BILD mit dem erfundenen „Heizungshammer&quot; unsere Politik manipulierte - Volksverpetzer,https://volksverpetzer.de/analyse/heizhammer-studie/,volksverpetzer.de,Studie belegt: Wie BILD mit dem erfundenen „Heizungshammer&quot; unsere Politik manipulierte - Volks,0.9,HIGH,True,FALSE - Debunked by fact-checkers,volksverpetzer.de,factcheck,2026-07-14T02:35:41.007783
Das hat uns das Bundeskriminalamt auf Anfrage schriftlich bestätigt,https://volksverpetzer.de/aktuelles/bka-anschlag-halle-vergessen/,volksverpetzer.de,Das BKA hat den Anschlag von Halle vergessen - Volksverpetzer,0,LOW,False,,,factcheck,2026-07-14T02:35:41.897169
Gemäß der PKS-Richtlinien erfolgt die statistische Erfassung eines Falles in der PKS mit Abschluss der Ermittlungen,https://volksverpetzer.de/aktuelles/bka-anschlag-halle-vergessen/,volksverpetzer.de,Das BKA hat den Anschlag von Halle vergessen - Volksverpetzer,0.1,LOW,False,,,factcheck,2026-07-14T02:35:42.104805
"AfD-Einstufungsupdate: Niederlagen für die AfD in Niedersachsen, Hessen und Bayern Immer mehr AfD-Landesverbände erreichen die höchste Beobachtungsstufe der jeweiligen Verfassungsschutzämter",https://volksverpetzer.de/serie/urteile-juni-26-afd-gegen-verfassungsschutz/,volksverpetzer.de,Urteile Juni 2026: Drei AfD-Niederlagen gegen den Verfassungsschutz - Volksverpetzer,0.1,LOW,False,,,factcheck,2026-07-14T02:35:43.096843
"Gemäßigte Strömungen innerhalb des Landesverbands seien laut Verwaltungsgericht ""nicht mehr erkennbar""",https://volksverpetzer.de/serie/urteile-juni-26-afd-gegen-verfassungsschutz/,volksverpetzer.de,Urteile Juni 2026: Drei AfD-Niederlagen gegen den Verfassungsschutz - Volksverpetzer,0,LOW,False,,,factcheck,2026-07-14T02:35:43.297135
"Seitdem versucht die AfD auf allen juristisch möglichen Wegen, gegen die Einstufung als rechtsextremistischer Verdachtsfall vorzugehen - und scheiterte dabei immer wieder",https://volksverpetzer.de/serie/urteile-juni-26-afd-gegen-verfassungsschutz/,volksverpetzer.de,Urteile Juni 2026: Drei AfD-Niederlagen gegen den Verfassungsschutz - Volksverpetzer,0.1,LOW,False,,,factcheck,2026-07-14T02:35:43.523205
"Dabei wird Deutschland seit Jahren immer sicherer: Die Straftaten gehen kontinuierlich zurück, während die Zahl der hier lebenden Ausländer steigt",https://volksverpetzer.de/analyse/anstieg-mord-statistik-deep-dive/,volksverpetzer.de,Diese drei Deutschen erklären jeden Anstieg in der Mord-Statistik - Deep Dive - Volksverpetzer,0.1,LOW,False,,,factcheck,2026-07-14T02:35:44.585980
"Die Zahl der Ausländer stieg seit 2005 um mehr als 70 Prozent, die Kriminalitätsrate ging im gleichen Zeitraum aber um rund 14 Prozent zurück",https://volksverpetzer.de/analyse/anstieg-mord-statistik-deep-dive/,volksverpetzer.de,Diese drei Deutschen erklären jeden Anstieg in der Mord-Statistik - Deep Dive - Volksverpetzer,0,LOW,False,,,factcheck,2026-07-14T02:35:44.789535
"Die PKS ist die Zahlenbasis, auf der die AfD seit zehn Jahren ihren Diskurs aufbaut, auf der NIUS, BILD und alle anderen ihre Migrationserzählungen drehen und mittlerweile sogar alle anderen Parteien ihre Politik begründen",https://volksverpetzer.de/analyse/anstieg-mord-statistik-deep-dive/,volksverpetzer.de,Diese drei Deutschen erklären jeden Anstieg in der Mord-Statistik - Deep Dive - Volksverpetzer,0.1,LOW,False,,,factcheck,2026-07-14T02:35:44.993726
"Juli 2026 | 8 min Während Deutschland und Italien nach dem Gaspreisschock steigende Strompreise bekommen haben, sparte sich jeder spanische Haushalt sogar 10 € im Monat",https://volksverpetzer.de/aktuelles/spanien-unsere-strompreise/,volksverpetzer.de,Warum Spanien seit März über unsere Strompreise lacht - Volksverpetzer,0.05,LOW,False,,,factcheck,2026-07-14T02:35:46.008047
"Die Grafik von Ember zeigt sehr schön, wie der Anteil der Fossilen (alles, was so braun ist) an der Stromerzeugung immer weiter zurückgeht, während Wind und in den letzten Jahren vor allem Solar (dunkel-/hellgrün) steigen",https://volksverpetzer.de/aktuelles/spanien-unsere-strompreise/,volksverpetzer.de,Warum Spanien seit März über unsere Strompreise lacht - Volksverpetzer,0.1,LOW,False,,,factcheck,2026-07-14T02:35:46.211057
Im August 2025 wurde laut Red Eléctrica den gesamten Monat über keine einzige Kilowattstunde Kohlestrom produziert – nachdem Mitte Juli das letzte große Kohlekraftwerk Aboño II umgerüstet worden war,https://volksverpetzer.de/aktuelles/spanien-unsere-strompreise/,volksverpetzer.de,Warum Spanien seit März über unsere Strompreise lacht - Volksverpetzer,0.1,LOW,False,,,factcheck,2026-07-14T02:35:46.412263
"[DEBUNKED] Ruhs: Nein, diese Zahl belegt nicht, dass Deutschland zum „gescheiterten Staat“ wird - Volksverpetzer",https://volksverpetzer.de/faktencheck/ruhs-gescheiterter-staat/,volksverpetzer.de,"Ruhs: Nein, diese Zahl belegt nicht, dass Deutschland zum „gescheiterten Staat“ wird - Volksverpetze",0.9,HIGH,True,FALSE - Debunked by fact-checkers,volksverpetzer.de,factcheck,2026-07-14T02:35:47.241547
"[DEBUNKED] Wir kriegen gerade weder ein AfD-Verbot noch &quot;gute Politik, die gegen die AfD hilft&quot; - Volksverpetzer",https://volksverpetzer.de/aktuelles/weder-afd-verbot-noch-gute-politik/,volksverpetzer.de,"Wir kriegen gerade weder ein AfD-Verbot noch &quot;gute Politik, die gegen die AfD hilft&quot; - Vol",0.9,HIGH,True,FALSE - Debunked by fact-checkers,volksverpetzer.de,factcheck,2026-07-14T02:35:48.063195
Nur eine Partei macht das Gegenteil: Die AfD radikalisiert sich immer weiter und wächst trotzdem,https://volksverpetzer.de/analyse/afd-eu-ausnahme/,volksverpetzer.de,"Die AfD ist Europas gefährlichste, rechtsextreme Ausnahme - Volksverpetzer",0.1,LOW,False,,,factcheck,2026-07-14T02:35:49.095505
"­­­ Dieser Vergleich zeigt, dass die Rechtsaußen-Parteien von 2020 bis 2025 europaweit um durchschnittlich fünf Prozentpunkte gewachsen sind",https://volksverpetzer.de/analyse/afd-eu-ausnahme/,volksverpetzer.de,"Die AfD ist Europas gefährlichste, rechtsextreme Ausnahme - Volksverpetzer",0,LOW,False,,,factcheck,2026-07-14T02:35:49.305096
"Ihre Stimmengewichte unterscheiden sich deutlich: Zum Stichpunkt 2025 kamen Rechtspopulist*innen auf einen Schnitt von 17,5 Prozent bei nationalen Wahlen, während rechtsextreme Parteien lediglich 3,7 Prozent erreichten",https://volksverpetzer.de/analyse/afd-eu-ausnahme/,volksverpetzer.de,"Die AfD ist Europas gefährlichste, rechtsextreme Ausnahme - Volksverpetzer",0,LOW,False,,,factcheck,2026-07-14T02:35:49.505895
[DEBUNKED] BILD hat schon früher Fakes verbreitet - so heiß war es damals nicht! - Volksverpetzer,https://volksverpetzer.de/faktencheck/bild-fakes-heiss/,volksverpetzer.de,BILD hat schon früher Fakes verbreitet - so heiß war es damals nicht! - Volksverpetzer,0.9,HIGH,True,FALSE - Debunked by fact-checkers,volksverpetzer.de,factcheck,2026-07-14T02:35:50.313097
"[DEBUNKED] Is this Mitch McConnell photo real? There's no evidence of AI, despite claims | Snopes.com",https://www.snopes.com/news/2026/07/13/mitch-mcconnell-photo/,www.snopes.com,"Is this Mitch McConnell photo real? There's no evidence of AI, despite claims | Snopes.com",0.9,HIGH,True,FALSE - Debunked by fact-checkers,www.snopes.com,factcheck,2026-07-14T02:35:50.391539
"[DEBUNKED] Lindsey Graham died. Here are 12 claims about the late senator, fact-checked | Snopes.com",https://www.snopes.com/collections/lindsey-graham-rumors/,www.snopes.com,"Lindsey Graham died. Here are 12 claims about the late senator, fact-checked | Snopes.com",0.9,HIGH,True,FALSE - Debunked by fact-checkers,www.snopes.com,factcheck,2026-07-14T02:35:50.471874
[DEBUNKED] Did Trump say he talked to Jesus? | Snopes.com,https://www.snopes.com/fact-check/trump-jesus-post/,www.snopes.com,Did Trump say he talked to Jesus? | Snopes.com,0.9,HIGH,True,FALSE - Debunked by fact-checkers,www.snopes.com,factcheck,2026-07-14T02:35:50.554827
A country where 40% of adults can't cover a $400 emergency without borrowing… pic,https://www.snopes.com/news/2026/07/10/australian-reply-trump-nato/,www.snopes.com,Australian allegedly scolded Trump over NATO comments. We tried to track down the author | Snopes.co,0,LOW,False,,,factcheck,2026-07-14T02:35:50.845813
"[DEBUNKED] Story claims 'K9 Valor' survived suicide bomber, saved 47 soldiers. Don't bite | Snopes.com",https://www.snopes.com/fact-check/k9-valor-rescue-story/,www.snopes.com,"Story claims 'K9 Valor' survived suicide bomber, saved 47 soldiers. Don't bite | Snopes.com",0.9,HIGH,True,FALSE - Debunked by fact-checkers,www.snopes.com,factcheck,2026-07-14T02:35:50.921435
"[DEBUNKED] Yes, Sen. Lindsey Graham has died | Snopes.com",https://www.snopes.com/news/2026/07/12/lindsey-graham-dead/,www.snopes.com,"Yes, Sen. Lindsey Graham has died | Snopes.com",0.9,HIGH,True,FALSE - Debunked by fact-checkers,www.snopes.com,factcheck,2026-07-14T02:35:51.153049
"[DEBUNKED] Trump admin hasn't proposed building interstate through Yellowstone, Grand Teton National Parks | Snopes.com",https://www.snopes.com/fact-check/trump-admin-interstate-yellowstone/,www.snopes.com,"Trump admin hasn't proposed building interstate through Yellowstone, Grand Teton National Parks | Sn",0.9,HIGH,True,FALSE - Debunked by fact-checkers,www.snopes.com,factcheck,2026-07-14T02:35:51.388197
[DEBUNKED] The facts behind 25 Taylor Swift claims | Snopes.com,https://www.snopes.com/collections/taylor-swift-rumors/,www.snopes.com,The facts behind 25 Taylor Swift claims | Snopes.com,0.9,HIGH,True,FALSE - Debunked by fact-checkers,www.snopes.com,factcheck,2026-07-14T02:35:51.469122
[DEBUNKED] Was Tom Homan honored for deportations as Obama's 'ICE chief'? Here are the facts | Snopes.com,https://www.snopes.com/fact-check/tom-homan-ice-award-obama/,www.snopes.com,Was Tom Homan honored for deportations as Obama's 'ICE chief'? Here are the facts | Snopes.com,0.9,HIGH,True,FALSE - Debunked by fact-checkers,www.snopes.com,factcheck,2026-07-14T02:35:51.552801
""" Application is by invitation only and imposes strict requirements, including meeting a certain income threshold, paying at least 30% toward rent and being a Massachusetts resident",https://www.snopes.com/news/2026/07/11/maura-healey-100-million-noncitizens/,www.snopes.com,Unpacking claim Massachusetts governor gave $100M in taxpayer money to noncitizens | Snopes.com,0,LOW,False,,,factcheck,2026-07-14T02:35:51.859751
[DEBUNKED] 14 rumors about 'The View' too dramatic to be true | Snopes.com,https://www.snopes.com/collections/the-view-rumors-collection/,www.snopes.com,14 rumors about 'The View' too dramatic to be true | Snopes.com,0.9,HIGH,True,FALSE - Debunked by fact-checkers,www.snopes.com,factcheck,2026-07-14T02:35:51.936131
[DEBUNKED] PolitiFact | Trump exaggerates about how much illegal immigration raised rental housing prices,http://www.politifact.com/factchecks/2026/jul/10/donald-trump/immigration-rental-housing-federal-reserve/,www.politifact.com,PolitiFact | Trump exaggerates about how much illegal immigration raised rental housing prices,0.9,HIGH,True,FALSE - Debunked by fact-checkers,www.politifact.com,factcheck,2026-07-14T02:35:52.229902
[DEBUNKED] PolitiFact | What Trump’s communism claims miss about Democrats and democratic socialists,http://www.politifact.com/article/2026/jul/09/Trump-communist-democratic-socialist-Chevalier/,www.politifact.com,PolitiFact | What Trump’s communism claims miss about Democrats and democratic socialists,0.9,HIGH,True,FALSE - Debunked by fact-checkers,www.politifact.com,factcheck,2026-07-14T02:35:52.302439
Credible estimates show that two-thirds to 80% of his total 2025 income gains came from non-stock sources,http://www.politifact.com/factchecks/2026/jul/07/donald-trump/disclosure-crypto-stocks-wealth/,www.politifact.com,"PolitiFact | Trump says stock market drove his 2025 income gains, but the majority came from crypto",0,LOW,False,,,factcheck,2026-07-14T02:35:52.901980
[DEBUNKED] Vaccines funded by Bill Gates did not cause autism to increase in Vietnam – Full Fact,https://fullfact.org/health/autism-vietnam-vaccine-bill-gates/,fullfact.org,Vaccines funded by Bill Gates did not cause autism to increase in Vietnam – Full Fact,0.9,HIGH,True,FALSE - Debunked by fact-checkers,fullfact.org,factcheck,2026-07-14T02:35:53.745337
