claim,source_url,source_domain,article_title,risk_score,risk_category,has_factcheck,factcheck_rating,factcheck_source,source_type,checked_at
"Der journalistische Quellenschutz sei laut des Deutschen Journalistenverbands, des Presserats, der ARD und weiteren Organisationen nicht ausreichend gesichert",https://correctiv.org/aktuelles/sicherheit-und-verteidigung/2026/07/17/mehr-befugnisse-weniger-kontrolle-breite-kritik-an-geplanter-reform-der-nachrichtendienste-bnd-bundesnachrichtendienst-bfv-verfassungsschutz-dobrindt/,correctiv.org,Verbände kritisieren geplante Reform der Nachrichtendienste,0,LOW,False,,,factcheck,2026-07-21T08:31:59.698039
"Statt IT-Sicherheit zu stärken, würden staatliche Hackbefugnisse und offensive Cyberfähigkeiten laut der AG Kritis ausgebaut",https://correctiv.org/aktuelles/sicherheit-und-verteidigung/2026/07/17/mehr-befugnisse-weniger-kontrolle-breite-kritik-an-geplanter-reform-der-nachrichtendienste-bnd-bundesnachrichtendienst-bfv-verfassungsschutz-dobrindt/,correctiv.org,Verbände kritisieren geplante Reform der Nachrichtendienste,0,LOW,False,,,factcheck,2026-07-21T08:31:59.755052
[DEBUNKED] Tagesschau-Beitrag zu angeblicher Drohung Netanjahus ist eine Fälschung,https://correctiv.org/faktencheck/2026/07/16/tagesschau-beitrag-zu-angeblicher-drohung-netanjahus-ist-eine-faelschung/,correctiv.org,Tagesschau-Beitrag zu angeblicher Drohung Netanjahus ist eine Fälschung,0.9,HIGH,True,FALSE - Debunked by fact-checkers,correctiv.org,factcheck,2026-07-21T08:32:00.723042
[DEBUNKED] Angebliches Ukraine-Werbeplakat in Indien ist eine Fälschung,https://correctiv.org/faktencheck/2026/07/16/angebliches-ukraine-werbeplakat-in-indien-ist-eine-faelschung/,correctiv.org,Angebliches Ukraine-Werbeplakat in Indien ist eine Fälschung,0.9,HIGH,True,FALSE - Debunked by fact-checkers,correctiv.org,factcheck,2026-07-21T08:32:01.870034
Juli 2026 Laut einer Anfrage von CORRECTIV und Spiegel wurden bei einem Drittel der Drogentoten unter 30 Jahren auch opioidhaltige Medikamente festgestellt,https://correctiv.org/aktuelles/gesundheit/2026/07/16/neue-zahlen-zu-drogentoten-toxischer-mischkonsum-gerade-bei-jungen-menschen/,correctiv.org,Drogentote: Toxischer Mischkonsum gerade bei jungen Menschen,0,LOW,False,,,factcheck,2026-07-21T08:32:04.084006
Laut Geschäftsstelle des Beauftragten der Bundesregierung für Sucht- und Drogenfragen war dies 284 mal der Fall,https://correctiv.org/aktuelles/gesundheit/2026/07/16/neue-zahlen-zu-drogentoten-toxischer-mischkonsum-gerade-bei-jungen-menschen/,correctiv.org,Drogentote: Toxischer Mischkonsum gerade bei jungen Menschen,0,LOW,False,,,factcheck,2026-07-21T08:32:04.142329
Fast jeder vierte Drogentote ist heute also jünger als 30 Jahre,https://correctiv.org/aktuelles/gesundheit/2026/07/16/neue-zahlen-zu-drogentoten-toxischer-mischkonsum-gerade-bei-jungen-menschen/,correctiv.org,Drogentote: Toxischer Mischkonsum gerade bei jungen Menschen,0,LOW,False,,,factcheck,2026-07-21T08:32:04.199605
"Bislang gilt, dass es bis 2027 pro Jahr 4,3 Prozent und ab 2028 4,4 Prozent weniger Zertifikate geben soll",https://correctiv.org/aktuelles/wirtschaft/2026/07/17/emissionshandel-eu-entlastet-energieintensive-industrie/,correctiv.org,Emissionshandel: EU entlastet energieintensive Industrie - correctiv.org,0,LOW,False,,,factcheck,2026-07-21T08:32:05.410102
"In den Jahren von 2031 bis 2035 sollen die Zertifikate jährlich nun nur noch um 3,7 Prozent reduziert werden, ab dem Jahr 2036 nur noch um 1,7 Prozent",https://correctiv.org/aktuelles/wirtschaft/2026/07/17/emissionshandel-eu-entlastet-energieintensive-industrie/,correctiv.org,Emissionshandel: EU entlastet energieintensive Industrie - correctiv.org,0,LOW,False,,,factcheck,2026-07-21T08:32:05.468494
Damit entstehen nach dem Jahr 2030 rund 51 Millionen zusätzliche kostenlose Zertifikate im Wert von rund acht Milliarden Euro,https://correctiv.org/aktuelles/wirtschaft/2026/07/17/emissionshandel-eu-entlastet-energieintensive-industrie/,correctiv.org,Emissionshandel: EU entlastet energieintensive Industrie - correctiv.org,0,LOW,False,,,factcheck,2026-07-21T08:32:05.526941
"„Wir fallen mal wieder hinten runter, weil wir keine laute Stimme haben und keine Wählergruppe sind“, konstatiert die Generalsekretärin Amy Kirchhoff",https://correctiv.org/aktuelles/bildung/2026/07/16/fehlender-hitzeschutz-an-schulen-als-bildungspolitisches-problem/,correctiv.org,Fehlender Hitzeschutz an Schulen als bildungspolitisches Problem - correctiv.org,0.1,LOW,False,,,factcheck,2026-07-21T08:32:07.805083
"Dabei beziehen sich die Klagen nicht immer nur auf Altbauten: „Unser Neubau heizt sich so auf, dass man darin nicht mal stehen möchte, geschweige den",https://correctiv.org/aktuelles/bildung/2026/07/16/fehlender-hitzeschutz-an-schulen-als-bildungspolitisches-problem/,correctiv.org,Fehlender Hitzeschutz an Schulen als bildungspolitisches Problem - correctiv.org,0.1,LOW,False,,,factcheck,2026-07-21T08:32:07.862453
"Speichel kann also kurzfristig Linderung verschaffen, einen starken Effekt hat er allerdings laut Metz nicht",https://correctiv.org/faktencheck/2026/07/15/geruechtekiller-13-hilft-spucke-gegen-juckende-mueckenstiche/,correctiv.org,Gerüchtekiller: Hilft Spucke gegen juckende Mückenstiche?,0.1,LOW,False,,,factcheck,2026-07-21T08:32:08.887862
"Besser ist laut Metz Hitze, da sie zu einem Schmerzreiz führe",https://correctiv.org/faktencheck/2026/07/15/geruechtekiller-13-hilft-spucke-gegen-juckende-mueckenstiche/,correctiv.org,Gerüchtekiller: Hilft Spucke gegen juckende Mückenstiche?,0,LOW,False,,,factcheck,2026-07-21T08:32:08.950020
"Laut Metz ist jedoch unklar, ob dieser Wirkstoff überhaupt tief genug in die Haut eindringt und etwas bewirkt",https://correctiv.org/faktencheck/2026/07/15/geruechtekiller-13-hilft-spucke-gegen-juckende-mueckenstiche/,correctiv.org,Gerüchtekiller: Hilft Spucke gegen juckende Mückenstiche?,0,LOW,False,,,factcheck,2026-07-21T08:32:09.007600
[DEBUNKED] „Massenproteste am Kanzleramt“: Angeblicher Medienbericht ist KI-Fake,https://correctiv.org/faktencheck/2026/07/15/massenproteste-am-kanzleramt-angeblicher-medienbericht-ist-ki-fake/,correctiv.org,„Massenproteste am Kanzleramt“: Angeblicher Medienbericht ist KI-Fake,0.9,HIGH,True,FALSE - Debunked by fact-checkers,correctiv.org,factcheck,2026-07-21T08:32:09.975783
Laut Branchenkreisen bewegt sich die Summe im Milliardenbereich,https://correctiv.org/aktuelles/sicherheit-und-verteidigung/2026/07/15/baustopp-deutscher-kriegsschiffe-zieht-wohl-milliardenschwere-schadensersatzforderung-nach-sich-pistorius-bundeswehr-marine-fregatte-f126/,correctiv.org,F126-Baustopp: Milliardenschwere Schadensersatzforderung droht,0,LOW,False,,,factcheck,2026-07-21T08:32:11.016935
[DEBUNKED] Wohnungsbetrug erkennen: So schützt du dich vor falschen Angeboten,https://www.mimikama.org/die-luege-vermietet-dir-ein-zuhause/?pk_campaign=feed&#038;pk_kwd=die-luege-vermietet-dir-ein-zuhause,www.mimikama.org,Wohnungsbetrug erkennen: So schützt du dich vor falschen Angeboten,0.9,HIGH,True,FALSE - Debunked by fact-checkers,www.mimikama.org,factcheck,2026-07-21T08:32:11.632652
[DEBUNKED] Jobangebote entpuppen sich als Betrug – So erkennst du Scams!,https://www.mimikama.org/die-luege-bietet-dir-arbeit/?pk_campaign=feed&#038;pk_kwd=die-luege-bietet-dir-arbeit,www.mimikama.org,Jobangebote entpuppen sich als Betrug – So erkennst du Scams!,0.9,HIGH,True,FALSE - Debunked by fact-checkers,www.mimikama.org,factcheck,2026-07-21T08:32:12.213419
Das ist keine politische Kritik,https://www.mimikama.org/ein-altes-foto-von-hape-kerkeling/?pk_campaign=feed&#038;pk_kwd=ein-altes-foto-von-hape-kerkeling,www.mimikama.org,Ein altes Foto von Hape Kerkeling – und sofort beginnt der politische Hass,0.1,LOW,False,,,factcheck,2026-07-21T08:32:13.205384
Warum plötzlich alle über die AfD reden Das Foto selbst enthält keine politische Aussage,https://www.mimikama.org/ein-altes-foto-von-hape-kerkeling/?pk_campaign=feed&#038;pk_kwd=ein-altes-foto-von-hape-kerkeling,www.mimikama.org,Ein altes Foto von Hape Kerkeling – und sofort beginnt der politische Hass,0.1,LOW,False,,,factcheck,2026-07-21T08:32:13.263470
[DEBUNKED] Schöne Schei**e: Mann im Dixi-Klo-Tank – Kein Hinweis auf Fake,https://www.mimikama.org/mann-dixi-klo-tank-kein-hinweis-auf-fake/?pk_campaign=feed&#038;pk_kwd=mann-dixi-klo-tank-kein-hinweis-auf-fake,www.mimikama.org,Schöne Schei**e: Mann im Dixi-Klo-Tank – Kein Hinweis auf Fake,0.9,HIGH,True,FALSE - Debunked by fact-checkers,www.mimikama.org,factcheck,2026-07-21T08:32:13.508838
[DEBUNKED] KI-Fehler führt zu monatelanger Haft einer Frau in Tennessee,https://www.mimikama.org/eine-frau-aus-tennessee-nach-einem-ki-fehler-frei/?pk_campaign=feed&#038;pk_kwd=eine-frau-aus-tennessee-nach-einem-ki-fehler-frei,www.mimikama.org,KI-Fehler führt zu monatelanger Haft einer Frau in Tennessee,0.9,HIGH,True,FALSE - Debunked by fact-checkers,www.mimikama.org,factcheck,2026-07-21T08:32:14.411083
[DEBUNKED] Vermisste Kinder: So missbrauchen Betrüger deine Hilfsbereitschaft!,https://www.mimikama.org/die-luege-zeigt-dir-ein-vermisstes-kind/?pk_campaign=feed&#038;pk_kwd=die-luege-zeigt-dir-ein-vermisstes-kind,www.mimikama.org,Vermisste Kinder: So missbrauchen Betrüger deine Hilfsbereitschaft!,0.9,HIGH,True,FALSE - Debunked by fact-checkers,www.mimikama.org,factcheck,2026-07-21T08:32:14.803262
[DEBUNKED] Freundschaft oder Betrug? So erkennen Sie gekaperte Konten,https://www.mimikama.org/die-luege-ist-dein-freund/?pk_campaign=feed&#038;pk_kwd=die-luege-ist-dein-freund,www.mimikama.org,Freundschaft oder Betrug? So erkennen Sie gekaperte Konten,0.9,HIGH,True,FALSE - Debunked by fact-checkers,www.mimikama.org,factcheck,2026-07-21T08:32:15.392491
"[DEBUNKED] Verstehen, warum viele die AfD wählen – Ein Kommentar zur Wut",https://www.mimikama.org/ich-kann-verstehen-warum-so-viele-die-afd-waehlen/?pk_campaign=feed&#038;pk_kwd=ich-kann-verstehen-warum-so-viele-die-afd-waehlen,www.mimikama.org,"Verstehen, warum viele die AfD wählen – Ein Kommentar zur Wut",0.9,HIGH,True,FALSE - Debunked by fact-checkers,www.mimikama.org,factcheck,2026-07-21T08:32:15.794795
[DEBUNKED] Meta-Störung: Facebook und Instagram haben derzeit technische Probleme,https://www.mimikama.org/meta-stoerung-facebook-und-instagram-mit-problemen/?pk_campaign=feed&#038;pk_kwd=meta-stoerung-facebook-und-instagram-mit-problemen,www.mimikama.org,Meta-Störung: Facebook und Instagram haben derzeit technische Probleme,0.9,HIGH,True,FALSE - Debunked by fact-checkers,www.mimikama.org,factcheck,2026-07-21T08:32:16.577960
"Die Schreiben wirken offiziell, setzen kurze Zahlungsfristen und drohen mit Inkasso oder Schufa-Einträgen",https://www.mimikama.org/rechnungen-aus-hongkong-meistens-abo-falle/?pk_campaign=feed&#038;pk_kwd=rechnungen-aus-hongkong-meistens-abo-falle,www.mimikama.org,Rechnungen aus Hongkong: Abo-Falle oder berechtigte Forderung?,0,LOW,False,,,factcheck,2026-07-21T08:32:17.370009
Nicht jeder Fall ist gleich Hier ist eine wichtige Unterscheidung,https://www.mimikama.org/rechnungen-aus-hongkong-meistens-abo-falle/?pk_campaign=feed&#038;pk_kwd=rechnungen-aus-hongkong-meistens-abo-falle,www.mimikama.org,Rechnungen aus Hongkong: Abo-Falle oder berechtigte Forderung?,0,LOW,False,,,factcheck,2026-07-21T08:32:17.426668
[DEBUNKED] KI-Influencer: Die Lüge mit einer Million Follower entlarvt,https://www.mimikama.org/die-luege-hat-eine-million-follower/?pk_campaign=feed&#038;pk_kwd=die-luege-hat-eine-million-follower,www.mimikama.org,KI-Influencer: Die Lüge mit einer Million Follower entlarvt,0.9,HIGH,True,FALSE - Debunked by fact-checkers,www.mimikama.org,factcheck,2026-07-21T08:32:20.362177
"Keine aufwendige KI, kein monatelanges Drehbuch, nur eine Nachricht, die aussieht, als käme sie von jemandem, dem du ohnehin vertraust: deiner Bank, der Post, einem Streamingdienst, einer Behörde",https://www.mimikama.org/die-luege-schreibt-wie-deine-bank/?pk_campaign=feed&#038;pk_kwd=die-luege-schreibt-wie-deine-bank,www.mimikama.org,Phishing erkennen: So schützen Sie sich vor fiesen Betrügern!,0.1,LOW,False,,,factcheck,2026-07-21T08:32:23.276809
"Mal droht sie („Ihr Konto wird gesperrt&#8220;), mal lockt sie („Ihre Rückerstattung wartet&#8220;), immer will sie dasselbe: dass du auf einen Link klickst und dort Daten eingibst, die dann den Tätern gehören",https://www.mimikama.org/die-luege-schreibt-wie-deine-bank/?pk_campaign=feed&#038;pk_kwd=die-luege-schreibt-wie-deine-bank,www.mimikama.org,Phishing erkennen: So schützen Sie sich vor fiesen Betrügern!,0.1,LOW,False,,,factcheck,2026-07-21T08:32:23.334809
Phishing braucht keine dummen Opfer,https://www.mimikama.org/die-luege-schreibt-wie-deine-bank/?pk_campaign=feed&#038;pk_kwd=die-luege-schreibt-wie-deine-bank,www.mimikama.org,Phishing erkennen: So schützen Sie sich vor fiesen Betrügern!,0.1,LOW,False,,,factcheck,2026-07-21T08:32:23.393378
[DEBUNKED] Doppelgängerkampagne: Ausländische Einflussnahme vor Wahlen!,https://www.mimikama.org/doppelgaenger-sachsen-anhalt-wahl/?pk_campaign=feed&#038;pk_kwd=doppelgaenger-sachsen-anhalt-wahl,www.mimikama.org,Doppelgängerkampagne: Ausländische Einflussnahme vor Wahlen!,0.9,HIGH,True,FALSE - Debunked by fact-checkers,www.mimikama.org,factcheck,2026-07-21T08:32:24.132554
[DEBUNKED] Friedrich Merz und Jeffrey Epstein: Foto ist KI-Fake,https://www.mimikama.org/friedrich-merz-jeffrey-epstein-foto-ki-fake/?pk_campaign=feed&#038;pk_kwd=friedrich-merz-jeffrey-epstein-foto-ki-fake,www.mimikama.org,Friedrich Merz und Jeffrey Epstein: Foto ist KI-Fake,0.9,HIGH,True,FALSE - Debunked by fact-checkers,www.mimikama.org,factcheck,2026-07-21T08:32:24.388336
[DEBUNKED] HAARP erzeugt keine Hitzewelle in Europa,https://www.mimikama.org/haarp-erzeugt-keine-hitzewelle/?pk_campaign=feed&#038;pk_kwd=haarp-erzeugt-keine-hitzewelle,www.mimikama.org,HAARP erzeugt keine Hitzewelle in Europa,0.9,HIGH,True,FALSE - Debunked by fact-checkers,www.mimikama.org,factcheck,2026-07-21T08:32:27.250756
"Juli 2026 | 11 min Im Pazifik entwickelt sich gerade ein El Niño, wie ihn die Messgeschichte noch nie gesehen hat",https://volksverpetzer.de/aktuelles/klimaschutz-el-nino-diese-grafik-sollte-auf-jede-titelseite/,volksverpetzer.de,Diese Grafik sollte auf jede Titelseite - Volksverpetzer,0.1,LOW,False,,,factcheck,2026-07-21T08:32:28.157381
Eine Studie zeigt: Sie fallen dabei auf einen rechten Mythos herein,https://volksverpetzer.de/aktuelles/klimaschutz-el-nino-diese-grafik-sollte-auf-jede-titelseite/,volksverpetzer.de,Diese Grafik sollte auf jede Titelseite - Volksverpetzer,0.1,LOW,False,,,factcheck,2026-07-21T08:32:28.216129
"Statt rechte Lügen in alle Schlagzeilen zu packen, sollte diese Grafik die Debatte dominieren",https://volksverpetzer.de/aktuelles/klimaschutz-el-nino-diese-grafik-sollte-auf-jede-titelseite/,volksverpetzer.de,Diese Grafik sollte auf jede Titelseite - Volksverpetzer,0.1,LOW,False,,,factcheck,2026-07-21T08:32:28.274881
[DEBUNKED] Studie belegt: Wie BILD mit dem erfundenen „Heizungshammer&quot; unsere Politik manipulierte - Volksverpetzer,https://volksverpetzer.de/analyse/heizhammer-studie/,volksverpetzer.de,Studie belegt: Wie BILD mit dem erfundenen „Heizungshammer&quot; unsere Politik manipulierte - Volks,0.9,HIGH,True,FALSE - Debunked by fact-checkers,volksverpetzer.de,factcheck,2026-07-21T08:32:29.084171
Das hat uns das Bundeskriminalamt auf Anfrage schriftlich bestätigt,https://volksverpetzer.de/aktuelles/bka-anschlag-halle-vergessen/,volksverpetzer.de,Das BKA hat den Anschlag von Halle vergessen - Volksverpetzer,0,LOW,False,,,factcheck,2026-07-21T08:32:29.948244
Gemäß der PKS-Richtlinien erfolgt die statistische Erfassung eines Falles in der PKS mit Abschluss der Ermittlungen,https://volksverpetzer.de/aktuelles/bka-anschlag-halle-vergessen/,volksverpetzer.de,Das BKA hat den Anschlag von Halle vergessen - Volksverpetzer,0.1,LOW,False,,,factcheck,2026-07-21T08:32:30.008260
"AfD-Einstufungsupdate: Niederlagen für die AfD in Niedersachsen, Hessen und Bayern Immer mehr AfD-Landesverbände erreichen die höchste Beobachtungsstufe der jeweiligen Verfassungsschutzämter",https://volksverpetzer.de/serie/urteile-juni-26-afd-gegen-verfassungsschutz/,volksverpetzer.de,Urteile Juni 2026: Drei AfD-Niederlagen gegen den Verfassungsschutz - Volksverpetzer,0.1,LOW,False,,,factcheck,2026-07-21T08:32:30.878131
"Gemäßigte Strömungen innerhalb des Landesverbands seien laut Verwaltungsgericht ""nicht mehr erkennbar""",https://volksverpetzer.de/serie/urteile-juni-26-afd-gegen-verfassungsschutz/,volksverpetzer.de,Urteile Juni 2026: Drei AfD-Niederlagen gegen den Verfassungsschutz - Volksverpetzer,0,LOW,False,,,factcheck,2026-07-21T08:32:30.937693
"Seitdem versucht die AfD auf allen juristisch möglichen Wegen, gegen die Einstufung als rechtsextremistischer Verdachtsfall vorzugehen - und scheiterte dabei immer wieder",https://volksverpetzer.de/serie/urteile-juni-26-afd-gegen-verfassungsschutz/,volksverpetzer.de,Urteile Juni 2026: Drei AfD-Niederlagen gegen den Verfassungsschutz - Volksverpetzer,0.1,LOW,False,,,factcheck,2026-07-21T08:32:30.998445
"Dabei wird Deutschland seit Jahren immer sicherer: Die Straftaten gehen kontinuierlich zurück, während die Zahl der hier lebenden Ausländer steigt",https://volksverpetzer.de/analyse/anstieg-mord-statistik-deep-dive/,volksverpetzer.de,Diese drei Deutschen erklären jeden Anstieg in der Mord-Statistik - Deep Dive - Volksverpetzer,0.1,LOW,False,,,factcheck,2026-07-21T08:32:31.899800
"Die Zahl der Ausländer stieg seit 2005 um mehr als 70 Prozent, die Kriminalitätsrate ging im gleichen Zeitraum aber um rund 14 Prozent zurück",https://volksverpetzer.de/analyse/anstieg-mord-statistik-deep-dive/,volksverpetzer.de,Diese drei Deutschen erklären jeden Anstieg in der Mord-Statistik - Deep Dive - Volksverpetzer,0,LOW,False,,,factcheck,2026-07-21T08:32:31.960107
"Die PKS ist die Zahlenbasis, auf der die AfD seit zehn Jahren ihren Diskurs aufbaut, auf der NIUS, BILD und alle anderen ihre Migrationserzählungen drehen und mittlerweile sogar alle anderen Parteien ihre Politik begründen",https://volksverpetzer.de/analyse/anstieg-mord-statistik-deep-dive/,volksverpetzer.de,Diese drei Deutschen erklären jeden Anstieg in der Mord-Statistik - Deep Dive - Volksverpetzer,0.1,LOW,False,,,factcheck,2026-07-21T08:32:32.014758
"Juli 2026 | 8 min Während Deutschland und Italien nach dem Gaspreisschock steigende Strompreise bekommen haben, sparte sich jeder spanische Haushalt sogar 10 € im Monat",https://volksverpetzer.de/aktuelles/spanien-unsere-strompreise/,volksverpetzer.de,Warum Spanien seit März über unsere Strompreise lacht - Volksverpetzer,0.05,LOW,False,,,factcheck,2026-07-21T08:32:32.912288
"Die Grafik von Ember zeigt sehr schön, wie der Anteil der Fossilen (alles, was so braun ist) an der Stromerzeugung immer weiter zurückgeht, während Wind und in den letzten Jahren vor allem Solar (dunkel-/hellgrün) steigen",https://volksverpetzer.de/aktuelles/spanien-unsere-strompreise/,volksverpetzer.de,Warum Spanien seit März über unsere Strompreise lacht - Volksverpetzer,0.1,LOW,False,,,factcheck,2026-07-21T08:32:32.970225
Im August 2025 wurde laut Red Eléctrica den gesamten Monat über keine einzige Kilowattstunde Kohlestrom produziert – nachdem Mitte Juli das letzte große Kohlekraftwerk Aboño II umgerüstet worden war,https://volksverpetzer.de/aktuelles/spanien-unsere-strompreise/,volksverpetzer.de,Warum Spanien seit März über unsere Strompreise lacht - Volksverpetzer,0.1,LOW,False,,,factcheck,2026-07-21T08:32:33.030973
"[DEBUNKED] Ruhs: Nein, diese Zahl belegt nicht, dass Deutschland zum „gescheiterten Staat“ wird - Volksverpetzer",https://volksverpetzer.de/faktencheck/ruhs-gescheiterter-staat/,volksverpetzer.de,"Ruhs: Nein, diese Zahl belegt nicht, dass Deutschland zum „gescheiterten Staat“ wird - Volksverpetze",0.9,HIGH,True,FALSE - Debunked by fact-checkers,volksverpetzer.de,factcheck,2026-07-21T08:32:33.851059
"[DEBUNKED] Wir kriegen gerade weder ein AfD-Verbot noch &quot;gute Politik, die gegen die AfD hilft&quot; - Volksverpetzer",https://volksverpetzer.de/aktuelles/weder-afd-verbot-noch-gute-politik/,volksverpetzer.de,"Wir kriegen gerade weder ein AfD-Verbot noch &quot;gute Politik, die gegen die AfD hilft&quot; - Vol",0.9,HIGH,True,FALSE - Debunked by fact-checkers,volksverpetzer.de,factcheck,2026-07-21T08:32:34.701575
Nur eine Partei macht das Gegenteil: Die AfD radikalisiert sich immer weiter und wächst trotzdem,https://volksverpetzer.de/analyse/afd-eu-ausnahme/,volksverpetzer.de,"Die AfD ist Europas gefährlichste, rechtsextreme Ausnahme - Volksverpetzer",0.1,LOW,False,,,factcheck,2026-07-21T08:32:35.590169
"­­­ Dieser Vergleich zeigt, dass die Rechtsaußen-Parteien von 2020 bis 2025 europaweit um durchschnittlich fünf Prozentpunkte gewachsen sind",https://volksverpetzer.de/analyse/afd-eu-ausnahme/,volksverpetzer.de,"Die AfD ist Europas gefährlichste, rechtsextreme Ausnahme - Volksverpetzer",0,LOW,False,,,factcheck,2026-07-21T08:32:35.649549
"Ihre Stimmengewichte unterscheiden sich deutlich: Zum Stichpunkt 2025 kamen Rechtspopulist*innen auf einen Schnitt von 17,5 Prozent bei nationalen Wahlen, während rechtsextreme Parteien lediglich 3,7 Prozent erreichten",https://volksverpetzer.de/analyse/afd-eu-ausnahme/,volksverpetzer.de,"Die AfD ist Europas gefährlichste, rechtsextreme Ausnahme - Volksverpetzer",0,LOW,False,,,factcheck,2026-07-21T08:32:35.712442
[DEBUNKED] Did Trump say he'd turn on 'giant faucet' in California to extinguish Canadian wildfires? | Snopes.com,https://www.snopes.com/fact-check/trump-giant-faucet-canada/,www.snopes.com,Did Trump say he'd turn on 'giant faucet' in California to extinguish Canadian wildfires? | Snopes.c,0.9,HIGH,True,FALSE - Debunked by fact-checkers,www.snopes.com,factcheck,2026-07-21T08:32:36.084895
[DEBUNKED] Is Taylor Farms produce source of cyclosporiasis outbreak? What we know | Snopes.com,https://www.snopes.com/news/2026/07/16/taylor-farms-cyclosporiasis-outbreak/,www.snopes.com,Is Taylor Farms produce source of cyclosporiasis outbreak? What we know | Snopes.com,0.9,HIGH,True,FALSE - Debunked by fact-checkers,www.snopes.com,factcheck,2026-07-21T08:32:36.182100
[DEBUNKED] Fake Mitch McConnell hospital image spread as questions surrounded his health | Snopes.com,https://www.snopes.com/fact-check/mitch-mcconnell-hospital-image/,www.snopes.com,Fake Mitch McConnell hospital image spread as questions surrounded his health | Snopes.com,0.9,HIGH,True,FALSE - Debunked by fact-checkers,www.snopes.com,factcheck,2026-07-21T08:32:36.659329
[DEBUNKED] Warning about 'new Facebook rule' for photos is long-running hoax | Snopes.com,https://www.snopes.com/fact-check/new-facebook-rule-just-in-case/,www.snopes.com,Warning about 'new Facebook rule' for photos is long-running hoax | Snopes.com,0.9,HIGH,True,FALSE - Debunked by fact-checkers,www.snopes.com,factcheck,2026-07-21T08:32:36.744256
[DEBUNKED] Mitch McConnell didn't post proof of life on X | Snopes.com,https://www.snopes.com/fact-check/mitch-mcconnell-proof-life-post/,www.snopes.com,Mitch McConnell didn't post proof of life on X | Snopes.com,0.9,HIGH,True,FALSE - Debunked by fact-checkers,www.snopes.com,factcheck,2026-07-21T08:32:36.831877
[DEBUNKED] Did Tennessee woman spend 6 months in jail after AI tool misidentified her? | Snopes.com,https://www.snopes.com/fact-check/ai-tennessee-woman-jail/,www.snopes.com,Did Tennessee woman spend 6 months in jail after AI tool misidentified her? | Snopes.com,0.9,HIGH,True,FALSE - Debunked by fact-checkers,www.snopes.com,factcheck,2026-07-21T08:32:37.027263
[DEBUNKED] Apple Maps didn't 'erase' Lebanese town names. Here's evidence | Snopes.com,https://www.snopes.com/fact-check/apple-maps-lebanon/,www.snopes.com,Apple Maps didn't 'erase' Lebanese town names. Here's evidence | Snopes.com,0.9,HIGH,True,FALSE - Debunked by fact-checkers,www.snopes.com,factcheck,2026-07-21T08:32:37.109990
"[DEBUNKED] Keir Starmer won’t get a £115,000 ‘pension’ or ‘salary’ for life – Full Fact",https://fullfact.org/politics/keir-starmer-115000-pension-false-repeat/,fullfact.org,"Keir Starmer won’t get a £115,000 ‘pension’ or ‘salary’ for life – Full Fact",0.9,HIGH,True,FALSE - Debunked by fact-checkers,fullfact.org,factcheck,2026-07-21T08:32:37.931721
[DEBUNKED] Video of Italian Prime Minister saying Sharia law won’t be allowed in Italy is AI-generated – Full Fact,https://fullfact.org/europe/giorgia-meloni-sharia-law-italy-video-fake/,fullfact.org,Video of Italian Prime Minister saying Sharia law won’t be allowed in Italy is AI-generated – Full F,0.9,HIGH,True,FALSE - Debunked by fact-checkers,fullfact.org,factcheck,2026-07-21T08:32:39.441630
[DEBUNKED] Viral clip does not show Nigel Farage rehearsing a ‘grief walk’ after Ann Widdecombe’s death – Full Fact,https://fullfact.org/politics/farage-grief-walk-ann-widdecombe-misleading/,fullfact.org,Viral clip does not show Nigel Farage rehearsing a ‘grief walk’ after Ann Widdecombe’s death – Full ,0.9,HIGH,True,FALSE - Debunked by fact-checkers,fullfact.org,factcheck,2026-07-21T08:32:40.948938
"Ofcom data shows 89% of UK residences had gigabit-capable coverage in January 2026, as did 84% of small and medium-sized businesses",https://fullfact.org/government-tracker/is-the-national-roll-out-of-gigabit-broadband-on-track/,fullfact.org,Is the national roll-out of gigabit broadband on track? – Full Fact,0,LOW,False,,,factcheck,2026-07-21T08:32:42.205488
