claim,source_url,source_domain,article_title,risk_score,risk_category,has_factcheck,factcheck_rating,factcheck_source,source_type,checked_at
"Die ehemalige Menschenrechtsbeauftragte der CDU Erika Steinbach facht den Hass auf Walter Lübcke über ihre Social-Media-Kanäle immer wieder an, sodass der CDU-Politiker Peter Tauber ihr eine direkte Mitschuld an dem Mord zuspricht",https://www.volksverpetzer.de/aktuelles/lohnt-kaempfen-merz-keine-antwort/,www.volksverpetzer.de,Wofür lohnt es sich zu kämpfen? Warum Merz keine Antwort auf diese Frage hat - Volksverpetzer,0.1,LOW,False,,,factcheck,2026-06-30T09:39:22.886885
"[DEBUNKED] Ich habe den WELT-Artikel von Kristina Schröder gelesen, damit ihr es nicht müsst - Volksverpetzer",https://www.volksverpetzer.de/faktencheck/welt-schroeder-klima-fake/,www.volksverpetzer.de,"Ich habe den WELT-Artikel von Kristina Schröder gelesen, damit ihr es nicht müsst - Volksverpetzer",0.9,HIGH,True,FALSE - Debunked by fact-checkers,www.volksverpetzer.de,factcheck,2026-06-30T09:39:23.674115
[DEBUNKED] Trump didn't accuse Kushner of 'ruining his presidency' by tricking him into starting Iran war | Snopes.com,https://www.snopes.com/fact-check/trump-kushner-ruin-presidency-iran/,www.snopes.com,Trump didn't accuse Kushner of 'ruining his presidency' by tricking him into starting Iran war | Sno,0.9,HIGH,True,FALSE - Debunked by fact-checkers,www.snopes.com,factcheck,2026-06-30T09:39:23.849001
[DEBUNKED] 13 stories about the founding fathers for America's 250th birthday | Snopes.com,https://www.snopes.com/collections/founding-fathers-america-250/,www.snopes.com,13 stories about the founding fathers for America's 250th birthday | Snopes.com,0.9,HIGH,True,FALSE - Debunked by fact-checkers,www.snopes.com,factcheck,2026-06-30T09:39:24.083572
"[DEBUNKED] Did Matthew McConaughey publicly praise Trump, calling him 'a great friend'? | Snopes.com",https://www.snopes.com/fact-check/matthew-mcconaughey-trump-statement/,www.snopes.com,"Did Matthew McConaughey publicly praise Trump, calling him 'a great friend'? | Snopes.com",0.9,HIGH,True,FALSE - Debunked by fact-checkers,www.snopes.com,factcheck,2026-06-30T09:39:24.183184
[DEBUNKED] Does image show Lindsey Graham posing with shirtless UFC fighters? | Snopes.com,https://www.snopes.com/fact-check/lindsey-graham-ufc-fighters/,www.snopes.com,Does image show Lindsey Graham posing with shirtless UFC fighters? | Snopes.com,0.9,HIGH,True,FALSE - Debunked by fact-checkers,www.snopes.com,factcheck,2026-06-30T09:39:24.577183
"[DEBUNKED] Social Security checks weren't renamed 'federal benefit payments,' despite claims | Snopes.com",https://www.snopes.com/fact-check/social-security-benefit-payment/,www.snopes.com,"Social Security checks weren't renamed 'federal benefit payments,' despite claims | Snopes.com",0.9,HIGH,True,FALSE - Debunked by fact-checkers,www.snopes.com,factcheck,2026-06-30T09:39:24.651407
"[DEBUNKED] Don't believe story about heroic 'K9 Valor' surviving suicide bombing, saving 47 soldiers | Snopes.com",https://www.snopes.com/fact-check/k9-valor-medal-honor-story/,www.snopes.com,"Don't believe story about heroic 'K9 Valor' surviving suicide bombing, saving 47 soldiers | Snopes.c",0.9,HIGH,True,FALSE - Debunked by fact-checkers,www.snopes.com,factcheck,2026-06-30T09:39:24.725408
"[DEBUNKED] Does image show barbed wire fencing, guard towers around reflecting pool? Don't be fooled | Snopes.com",https://www.snopes.com/fact-check/reflecting-pool-barbed-wire-towers/,www.snopes.com,"Does image show barbed wire fencing, guard towers around reflecting pool? Don't be fooled | Snopes.c",0.9,HIGH,True,FALSE - Debunked by fact-checkers,www.snopes.com,factcheck,2026-06-30T09:39:24.899907
"[DEBUNKED] PolitiFact | Ohio’s GOP governor said it’s ‘absurd’ to call Haiti safe, experts agree",http://www.politifact.com/article/2026/jun/29/Supreme-Court-TPS-Haitians-safe-Markwayne-Mullin/,www.politifact.com,"PolitiFact | Ohio’s GOP governor said it’s ‘absurd’ to call Haiti safe, experts agree",0.9,HIGH,True,FALSE - Debunked by fact-checkers,www.politifact.com,factcheck,2026-06-30T09:39:24.977571
[DEBUNKED] PolitiFact | Fact-checking 5 videos that falsely depict scenes from Venezuela’s earthquakes,http://www.politifact.com/article/2026/jun/29/Venezuela-earthquakes-old-videos-photos/,www.politifact.com,PolitiFact | Fact-checking 5 videos that falsely depict scenes from Venezuela’s earthquakes,0.9,HIGH,True,FALSE - Debunked by fact-checkers,www.politifact.com,factcheck,2026-06-30T09:39:25.037884
"Between 50% and 70% of all adult white men met the requirement, said Rosemarie Zagarri, a history professor at George Mason University who has researched voting in early America",http://www.politifact.com/article/2026/jun/29/250th-anniversary-history-voting-mail-election/,www.politifact.com,PolitiFact | From booze-filled parties to mail ballots: How did American voting actually evolve?,0,LOW,False,,,factcheck,2026-06-30T09:39:25.313544
[DEBUNKED] PolitiFact | Fact-checking Florida Republicans’ Sunshine State Showdown,http://www.politifact.com/article/2026/jun/27/Florida-GOP-Byron-Donalds-governor-election/,www.politifact.com,PolitiFact | Fact-checking Florida Republicans’ Sunshine State Showdown,0.9,HIGH,True,FALSE - Debunked by fact-checkers,www.politifact.com,factcheck,2026-06-30T09:39:25.374413
"[DEBUNKED] PolitiFact | Platner says Collins sided with Trump to cut Medicaid, SNAP and help the rich. That’s False.",http://www.politifact.com/factchecks/2026/jun/25/graham-platner/Susan-Collins-Maine-Senate-Trump-tax-bill-SNAP/,www.politifact.com,"PolitiFact | Platner says Collins sided with Trump to cut Medicaid, SNAP and help the rich. That’s F",0.9,HIGH,True,FALSE - Debunked by fact-checkers,www.politifact.com,factcheck,2026-06-30T09:39:25.677574
[DEBUNKED] PolitiFact | Colombia&#x27;s fast voting results aren&#x27;t proof of cheating in California elections,http://www.politifact.com/article/2026/jun/25/Colombia-presidential-elections-california-primary/,www.politifact.com,PolitiFact | Colombia&#x27;s fast voting results aren&#x27;t proof of cheating in California electio,0.9,HIGH,True,FALSE - Debunked by fact-checkers,www.politifact.com,factcheck,2026-06-30T09:39:25.741575
"Between his second inauguration and the day of his February 2026 State of the Union address — the first time he mentioned the $30,000 figure — the S&amp;P rose by about 13%",http://www.politifact.com/factchecks/2026/jun/25/donald-trump/401k-second-term-balance-stock-market/,www.politifact.com,PolitiFact | Donald Trump exaggerates 401(k) gains during his second term,0,LOW,False,,,factcheck,2026-06-30T09:39:25.902114
"From his second inauguration to June 23, the day of his Pennsylvania speech, the S&amp;P rose by about 24%",http://www.politifact.com/factchecks/2026/jun/25/donald-trump/401k-second-term-balance-stock-market/,www.politifact.com,PolitiFact | Donald Trump exaggerates 401(k) gains during his second term,0,LOW,False,,,factcheck,2026-06-30T09:39:25.943708
"[DEBUNKED] PolitiFact | At GlobalFact 2026, fact-checkers report challenges, resilience",http://www.politifact.com/article/2026/jun/24/at-globalfact-2026-fact-checkers-report-challenges/,www.politifact.com,"PolitiFact | At GlobalFact 2026, fact-checkers report challenges, resilience",0.9,HIGH,True,FALSE - Debunked by fact-checkers,www.politifact.com,factcheck,2026-06-30T09:39:26.145136
[DEBUNKED] SEA LIFE London Aquarium is not offering ‘young explorer kits’ as survey reward – Full Fact,https://fullfact.org/shopping/sealife-explorer-kit-false/,fullfact.org,SEA LIFE London Aquarium is not offering ‘young explorer kits’ as survey reward – Full Fact,0.9,HIGH,True,FALSE - Debunked by fact-checkers,fullfact.org,factcheck,2026-06-30T09:39:27.047810
[DEBUNKED] Image of Thai police officers ‘undercover wearing drag’ is fake – Full Fact,https://fullfact.org/crime/thai-police-officers-drag-AI/,fullfact.org,Image of Thai police officers ‘undercover wearing drag’ is fake – Full Fact,0.9,HIGH,True,FALSE - Debunked by fact-checkers,fullfact.org,factcheck,2026-06-30T09:39:27.618175
[DEBUNKED] Video of ‘British Muslims’ marching for ‘halal standards’ is an AI fake – Full Fact,https://fullfact.org/culture-and-society/muslims-march-halal-standards-fake-AI/,fullfact.org,Video of ‘British Muslims’ marching for ‘halal standards’ is an AI fake – Full Fact,0.9,HIGH,True,FALSE - Debunked by fact-checkers,fullfact.org,factcheck,2026-06-30T09:39:28.444143
[DEBUNKED] Image of queueing traffic does not show people leaving Crimea over fuel shortages – Full Fact,https://fullfact.org/world/crimea-fuel-shortage-queue-image-armenia-misleading/,fullfact.org,Image of queueing traffic does not show people leaving Crimea over fuel shortages – Full Fact,0.9,HIGH,True,FALSE - Debunked by fact-checkers,fullfact.org,factcheck,2026-06-30T09:39:28.857936
"Who we are Our team Careers Funding Independence Impartiality Feedback &amp; corrections International networks FAQs Contact us Search Home / Economy, Business &amp; Finance What does the new 22% charge mean for stocks and shares ISAs",https://fullfact.org/economy/stocks-and-shares-isa-22-percent/,fullfact.org,What does the new 22% charge mean for stocks and shares ISAs? – Full Fact,0,LOW,False,,,factcheck,2026-06-30T09:39:29.505206
25 June 2026 What was claimed The government is introducing a 22% tax on stocks and shares ISAs,https://fullfact.org/economy/stocks-and-shares-isa-22-percent/,fullfact.org,What does the new 22% charge mean for stocks and shares ISAs? – Full Fact,0,LOW,False,,,factcheck,2026-06-30T09:39:29.585705
"The 22% rate will only apply to interest gained on cash held inside stocks and shares ISAs not the actual cash itself, and it also won’t apply to investment growth in a stocks and shares ISA",https://fullfact.org/economy/stocks-and-shares-isa-22-percent/,fullfact.org,What does the new 22% charge mean for stocks and shares ISAs? – Full Fact,0,LOW,False,,,factcheck,2026-06-30T09:39:29.666891
"[DEBUNKED] No, Amazon is not selling HP laptops for £3 – Full Fact",https://fullfact.org/shopping/amazon-laptop-deals-fake-repeated/,fullfact.org,"No, Amazon is not selling HP laptops for £3 – Full Fact",0.9,HIGH,True,FALSE - Debunked by fact-checkers,fullfact.org,factcheck,2026-06-30T09:39:30.150063
"The UKSA also said it was worried that the Conservatives were giving the impression that “welfare” was mainly about sickness and out-of-work benefits, when “approximately 55% of social security expenditure is spent on pensioners”",https://fullfact.org/economy/statistics-watchdog-challenges-badenoch-over-welfare-claim-after-full-fact-intervention/,fullfact.org,Statistics watchdog challenges Badenoch over welfare claim after Full Fact intervention – Full Fact,0,LOW,False,,,factcheck,2026-06-30T09:39:30.524871
[DEBUNKED] Grimsby housing development homes aren’t ‘exclusively for immigrants’ – Full Fact,https://fullfact.org/immigration/grimsby-immigrants-ferriby-fields-false/,fullfact.org,Grimsby housing development homes aren’t ‘exclusively for immigrants’ – Full Fact,0.9,HIGH,True,FALSE - Debunked by fact-checkers,fullfact.org,factcheck,2026-06-30T09:39:31.093661
[DEBUNKED] How Trump&#039;s Preliminary Deal with Iran Compares with His Rhetoric - FactCheck.org,https://www.factcheck.org/2026/06/how-trumps-preliminary-deal-with-iran-compares-with-his-rhetoric/,www.factcheck.org,How Trump&#039;s Preliminary Deal with Iran Compares with His Rhetoric - FactCheck.org,0.9,HIGH,True,FALSE - Debunked by fact-checkers,www.factcheck.org,factcheck,2026-06-30T09:39:31.381809
"&#8220;We cut the flow of fentanyl across our border by 59%, which is unheard of,&#8221; Trump said in May 22 remarks in New York",https://www.factcheck.org/2026/06/trump-makes-unsupported-claims-about-drug-flows/,www.factcheck.org,Trump Makes Unsupported Claims About Drug Flows - FactCheck.org,0,LOW,False,,,factcheck,2026-06-30T09:39:31.995893
"&#8220;And we cut the flow of fentanyl and drugs into our country by the ocean and the sea, in other words, coming in by water, by ocean and sea by 97%",https://www.factcheck.org/2026/06/trump-makes-unsupported-claims-about-drug-flows/,www.factcheck.org,Trump Makes Unsupported Claims About Drug Flows - FactCheck.org,0,LOW,False,,,factcheck,2026-06-30T09:39:32.077035
"Then, on May 28, in an interview with his daughter-in-law, Lara Trump, on Fox News, he said, &#8220;We have drugs down 97%",https://www.factcheck.org/2026/06/trump-makes-unsupported-claims-about-drug-flows/,www.factcheck.org,Trump Makes Unsupported Claims About Drug Flows - FactCheck.org,0,LOW,False,,,factcheck,2026-06-30T09:39:32.156943
[DEBUNKED] FactChecking Trump&#039;s Contentious &#039;Meet the Press&#039; Interview - FactCheck.org,https://www.factcheck.org/2026/06/factchecking-trumps-contentious-meet-the-press-interview/,www.factcheck.org,FactChecking Trump&#039;s Contentious &#039;Meet the Press&#039; Interview - FactCheck.org,0.9,HIGH,True,FALSE - Debunked by fact-checkers,www.factcheck.org,factcheck,2026-06-30T09:39:32.616566
[DEBUNKED] Fact Check: REAL Photo On Stage At Freedom 250 Concert Shows Only A Handful Of People Reflected In Mirror Sunglasses | Lead Stories,https://leadstories.com/hoax-alert/2026/06/fact-check-real-photo-on-stage-at-freedom-250-concert-shows-only-a-handful-of-people-reflected-in-mirror-sunglasses.html,leadstories.com,Fact Check: REAL Photo On Stage At Freedom 250 Concert Shows Only A Handful Of People Reflected In M,0.9,HIGH,True,FALSE - Debunked by fact-checkers,leadstories.com,factcheck,2026-06-30T09:39:33.095583
[DEBUNKED] Fact Check: FAKE Images Show FIFA President Gianni Infantino Attending Two Simultaneous Matches In Different Cities | Lead Stories,https://leadstories.com/hoax-alert/2026/06/fact-check-fake-images-show-fifa-president-gianni-infantino-attending-two-simultaneous-matches-in-different-cities.html,leadstories.com,Fact Check: FAKE Images Show FIFA President Gianni Infantino Attending Two Simultaneous Matches In D,0.9,HIGH,True,FALSE - Debunked by fact-checkers,leadstories.com,factcheck,2026-06-30T09:39:33.233396
[DEBUNKED] Fact Check: FAKE Video Shows Fan Running Onto Field To Hug Messi At The World Cup -- It's AI | Lead Stories,https://leadstories.com/hoax-alert/2026/06/fact-check-fake-video-shows-fan-running-onto-field-hug-messi-world-cup-ai.html,leadstories.com,Fact Check: FAKE Video Shows Fan Running Onto Field To Hug Messi At The World Cup -- It's AI | Lead ,0.9,HIGH,True,FALSE - Debunked by fact-checkers,leadstories.com,factcheck,2026-06-30T09:39:33.356589
[DEBUNKED] Prebunk: AI Videos Of Rooftop Infinity Pools Collapsing Are Splashy Engagement Bait -- Just AI Wasting Water | Lead Stories,https://leadstories.com/hoax-alert/2026/06/prebunk-ai-videos-of-rooftop-infinity-pools-collapsing-are-engagement-bait.html,leadstories.com,Prebunk: AI Videos Of Rooftop Infinity Pools Collapsing Are Splashy Engagement Bait -- Just AI Wasti,0.9,HIGH,True,FALSE - Debunked by fact-checkers,leadstories.com,factcheck,2026-06-30T09:39:33.481274
[DEBUNKED] Fact Check: EDITED Video Of Erling Haaland Eating And Scaring Himself -- Is A Face Swap Of A Chinese Slapstick Comedy Video | Lead Stories,https://leadstories.com/hoax-alert/2026/06/fact-check-altered-video-of-erling-haaland-eating-and-scaring-himself-is-a-face-swap-spoof-of-a-chinese-slapstick-comedy-video.html,leadstories.com,Fact Check: EDITED Video Of Erling Haaland Eating And Scaring Himself -- Is A Face Swap Of A Chinese,0.9,HIGH,True,FALSE - Debunked by fact-checkers,leadstories.com,factcheck,2026-06-30T09:39:33.609794
[DEBUNKED] Fact Check: Video Of 'Laser Beams' Falsely Linked To Venezuela Earthquakes Was Published On TikTok Months Before The Quake | Lead Stories,https://leadstories.com/hoax-alert/2026/06/fact-check-laser-beam-video-labeled-instant-before-the-venezuela-earthquake-struck-published-on-tiktok-months-before-quake.html,leadstories.com,Fact Check: Video Of 'Laser Beams' Falsely Linked To Venezuela Earthquakes Was Published On TikTok M,0.9,HIGH,True,FALSE - Debunked by fact-checkers,leadstories.com,factcheck,2026-06-30T09:39:33.729811
[DEBUNKED] Fact Check: FAKE Photo Shows Pride Rainbow Flags On Field Ahead Of Iran-Egypt World Cup Match -- It Is AI-Generated | Lead Stories,https://leadstories.com/hoax-alert/2026/06/fact-check-fake-photo-shows-pride-rainbow-flags-on-pitch-ahead-of-iran-egypt-world-cup-match.html,leadstories.com,Fact Check: FAKE Photo Shows Pride Rainbow Flags On Field Ahead Of Iran-Egypt World Cup Match -- It ,0.9,HIGH,True,FALSE - Debunked by fact-checkers,leadstories.com,factcheck,2026-06-30T09:39:33.868452
"[DEBUNKED] Fact Check: Posts Claiming Sarah Palin, Michelle Obama, Or Other Celebs Wore 'Probably The Smallest Bikini In The World' Are NOT Real -- AI Slop From Macedonia | Lead Stories",https://leadstories.com/hoax-alert/2026/06/fact-check-post-claiming-palin-obama-wore-smallest-bikini-not-real.html,leadstories.com,"Fact Check: Posts Claiming Sarah Palin, Michelle Obama, Or Other Celebs Wore 'Probably The Smallest ",0.9,HIGH,True,FALSE - Debunked by fact-checkers,leadstories.com,factcheck,2026-06-30T09:39:33.998504
[DEBUNKED] Fact Check: Trump Has NOT Posted An Image Of Reflecting Pool Showing Him Together With Epstein In June 2026 | Lead Stories,https://leadstories.com/hoax-alert/2026/06/fact-check-trump-has-not-posted-image-of-reflecting-pool-showing-him-together-with-epstein-in-june-2026.html,leadstories.com,Fact Check: Trump Has NOT Posted An Image Of Reflecting Pool Showing Him Together With Epstein In Ju,0.9,HIGH,True,FALSE - Debunked by fact-checkers,leadstories.com,factcheck,2026-06-30T09:39:34.126814
[DEBUNKED] Fact Check: FAKE Photo Labeled With Recycled Caption 'Bengali Woman Carrying A British Merchant' And Dated 1903 Was Made With OpenAI Tools | Lead Stories,https://leadstories.com/hoax-alert/2026/06/fact-check-fake-photo-labeled-with-recycled-caption-bengali-woman-carrying-a-british-merchant-and-dated-1903-was-made-with-openai-tools.html,leadstories.com,Fact Check: FAKE Photo Labeled With Recycled Caption 'Bengali Woman Carrying A British Merchant' And,0.9,HIGH,True,FALSE - Debunked by fact-checkers,leadstories.com,factcheck,2026-06-30T09:39:34.261756
[DEBUNKED] Fact Check: Photo Does NOT Show Officer In Montreal Shooting -- Victim Was NOT A Rabbi | Lead Stories,https://leadstories.com/hoax-alert/2026/06/fact-check-photo-does-not-show-officer-in-montreal-shooting-victim-was-not-a-rabbi.html,leadstories.com,Fact Check: Photo Does NOT Show Officer In Montreal Shooting -- Victim Was NOT A Rabbi | Lead Storie,0.9,HIGH,True,FALSE - Debunked by fact-checkers,leadstories.com,factcheck,2026-06-30T09:39:34.388961
[DEBUNKED] Prebunk: Yucky Videos Of Indian Street Food Stalls Taste Like Fakery --  Cooked Up With Artificial Intelligence | Lead Stories,https://leadstories.com/hoax-alert/2026/06/prebunk-ai-videos-of-indian-street-food.html,leadstories.com,Prebunk: Yucky Videos Of Indian Street Food Stalls Taste Like Fakery --  Cooked Up With Artificial I,0.9,HIGH,True,FALSE - Debunked by fact-checkers,leadstories.com,factcheck,2026-06-30T09:39:34.526273
[DEBUNKED] Fact Check: FAKE Video Shows Two Towers Crashing Into Each Other During Venezuela Earthquakes | Lead Stories,https://leadstories.com/hoax-alert/2026/06/fact-check-fake-video-shows-two-towers-crashing-into-each-other-during-venezuela-earthquakes.html,leadstories.com,Fact Check: FAKE Video Shows Two Towers Crashing Into Each Other During Venezuela Earthquakes | Lead,0.9,HIGH,True,FALSE - Debunked by fact-checkers,leadstories.com,factcheck,2026-06-30T09:39:34.663148
[DEBUNKED] Fact Check: AI-Enhanced 'Reflecting Pool Dipper' Images Do NOT Reliably Identify Suspect | Lead Stories,https://leadstories.com/hoax-alert/2026/06/fact-check-ai-images-of-reflecting-pool-dipper-are-not-real.html,leadstories.com,Fact Check: AI-Enhanced 'Reflecting Pool Dipper' Images Do NOT Reliably Identify Suspect | Lead Stor,0.9,HIGH,True,FALSE - Debunked by fact-checkers,leadstories.com,factcheck,2026-06-30T09:39:34.788687
[DEBUNKED] Fact Check: FAKE Image Shows Alyssa Thomas Smiling As She Fouls Caitlin Clark In WNBA Game | Lead Stories,https://leadstories.com/hoax-alert/2026/06/fact-check-fake-image-shows-alyssa-thomas-smiling-as-she-fouls-caitlin-clark-in-wnba-game.html,leadstories.com,Fact Check: FAKE Image Shows Alyssa Thomas Smiling As She Fouls Caitlin Clark In WNBA Game | Lead St,0.9,HIGH,True,FALSE - Debunked by fact-checkers,leadstories.com,factcheck,2026-06-30T09:39:34.917655
[DEBUNKED] Explosives and propaganda: Russia’s dual-use drones - EUvsDisinfo,https://euvsdisinfo.eu/explosives-and-propaganda-russias-dual-use-drones/,euvsdisinfo.eu,Explosives and propaganda: Russia’s dual-use drones - EUvsDisinfo,0.9,HIGH,True,FALSE - Debunked by fact-checkers,euvsdisinfo.eu,factcheck,2026-06-30T09:39:36.249416
[DEBUNKED] How Moscow tries to cover up its failures on the Ukrainian battlefield - EUvsDisinfo,https://euvsdisinfo.eu/how-moscow-tries-to-cover-up-its-failures-on-the-ukrainian-battlefield/,euvsdisinfo.eu,How Moscow tries to cover up its failures on the Ukrainian battlefield - EUvsDisinfo,0.9,HIGH,True,FALSE - Debunked by fact-checkers,euvsdisinfo.eu,factcheck,2026-06-30T09:39:37.796627
"[DEBUNKED] Warmongering NATO, peaceful Belarus, and Bulgaria’s “punishment” - EUvsDisinfo",https://euvsdisinfo.eu/warmongering-nato-peaceful-belarus-and-bulgarias-punishment/,euvsdisinfo.eu,"Warmongering NATO, peaceful Belarus, and Bulgaria’s “punishment” - EUvsDisinfo",0.9,HIGH,True,FALSE - Debunked by fact-checkers,euvsdisinfo.eu,factcheck,2026-06-30T09:39:40.495873
"[DEBUNKED] Religion, drones, and “piracy”: latest trends in Russian FIMI - EUvsDisinfo",https://euvsdisinfo.eu/religion-drones-and-piracy-latest-trends-in-russian-fimi/,euvsdisinfo.eu,"Religion, drones, and “piracy”: latest trends in Russian FIMI - EUvsDisinfo",0.9,HIGH,True,FALSE - Debunked by fact-checkers,euvsdisinfo.eu,factcheck,2026-06-30T09:39:43.101396
"[DEBUNKED] Victim-blaming Kyiv, pressuring Moldova, and drone disinformation - EUvsDisinfo",https://euvsdisinfo.eu/victim-blaming-kyiv-pressuring-moldova-and-drone-disinformation/,euvsdisinfo.eu,"Victim-blaming Kyiv, pressuring Moldova, and drone disinformation - EUvsDisinfo",0.9,HIGH,True,FALSE - Debunked by fact-checkers,euvsdisinfo.eu,factcheck,2026-06-30T09:39:44.316640
"[DEBUNKED] Tough love: Spies, dating apps and the dark side of online intimacy - EUvsDisinfo",https://euvsdisinfo.eu/tough-love-spies-dating-apps-and-the-dark-side-of-online-intimacy/,euvsdisinfo.eu,"Tough love: Spies, dating apps and the dark side of online intimacy - EUvsDisinfo",0.9,HIGH,True,FALSE - Debunked by fact-checkers,euvsdisinfo.eu,factcheck,2026-06-30T09:39:46.418386
"[DEBUNKED] Lies about Russia’s military success, Yermak’s arrest and secret biolabs - EUvsDisinfo",https://euvsdisinfo.eu/lies-about-russias-military-success-yermaks-arrest-and-secret-biolabs/,euvsdisinfo.eu,"Lies about Russia’s military success, Yermak’s arrest and secret biolabs - EUvsDisinfo",0.9,HIGH,True,FALSE - Debunked by fact-checkers,euvsdisinfo.eu,factcheck,2026-06-30T09:39:47.642904
"»Auch wenn das Ausscheiden schmerzt: Was für ein Spiel«, hieß es in einem Beitrag des offiziellen Kanzler-Accounts des CDU-Politikers auf der Plattform X",https://www.spiegel.de/sport/fussball/fussball-wm-2026-friedrich-merz-troestet-dfb-team-und-erntet-spott-a-f4fc72f7-39e1-4e40-bb1a-83c40f74edbd#ref=rss,www.spiegel.de,Fußball-WM 2026: Friedrich Merz tröstet DFB-Team und erntet Spott - DER SPIEGEL,0,LOW,False,,,mainstream,2026-06-30T09:39:59.943424
von 4 Beiträgen verfügbar Die erste Million ist bekanntlich die schwerste – doch im vergangenen Jahr schafften so viele Menschen den Sprung in die Liga der Reichen wie nie zuvor,https://www.spiegel.de/wirtschaft/vermoegen-weltweit-2600-neue-millionaere-pro-tag-ubs-meldet-rekordstand-a-d3bcc553-f543-4cd6-b277-b8c238763f30#ref=rss,www.spiegel.de,Vermögen: Weltweit 2600 neue Millionäre pro Tag – UBS meldet Rekordstand - DER SPIEGEL,0.1,LOW,False,,,mainstream,2026-06-30T09:40:01.155878
"positiv bewerten negativ bewerten Der Hund ist der beste Freund des Menschen – jedenfalls laut einer Redensart, die im Deutschen und einigen anderen Sprachen bekannt ist",https://www.spiegel.de/wissenschaft/natur/haustiere-mensch-und-hund-sind-weltweit-gute-freunde-a-f0804bbc-8634-4e67-8e65-a51997ac4944#ref=rss,www.spiegel.de,Haustiere: Mensch und Hund sind weltweit gute Freunde - DER SPIEGEL,0,LOW,False,,,mainstream,2026-06-30T09:40:01.860481
Laut Forschenden der Friedrich-Schiller-Universität Jena und vom Max-Planck-Institut für evolutionäre Anthropologie Leipzig gibt es im Verhältnis zwischen Mensch und Hund weltweit »erstaunliche Gemeinsamkeiten«,https://www.spiegel.de/wissenschaft/natur/haustiere-mensch-und-hund-sind-weltweit-gute-freunde-a-f0804bbc-8634-4e67-8e65-a51997ac4944#ref=rss,www.spiegel.de,Haustiere: Mensch und Hund sind weltweit gute Freunde - DER SPIEGEL,0,LOW,False,,,mainstream,2026-06-30T09:40:01.943041
Die Heim-EM wird mir immer noch zu gut geredet,https://www.spiegel.de/sport/fussball/fussball-wm-2026-deutschland-scheidet-aus-kritik-an-bundestrainer-julian-nagelsmann-a-92dbc2fd-7a67-47eb-b5e2-e1a75b49ed53#ref=rss,www.spiegel.de,Fußball-WM 2026: Deutschland scheidet aus: Kritik an Bundestrainer Julian Nagelsmann - DER SPIEGEL,0.1,LOW,False,,,mainstream,2026-06-30T09:40:03.140906
