claim,source_url,source_domain,article_title,risk_score,risk_category,has_factcheck,factcheck_rating,factcheck_source,source_type,checked_at
"“Today, more than 50% of the traffic on the internet is actually machine-based and not human-based",https://www.thedrum.com/news/meet-the-company-teaching-marketers-how-to-market-to-bots,thedrum.com,Meet the company teaching marketers how to market to bots | The Drum,0,LOW,False,,,unknown,2026-06-22T11:57:36.559841
"” Several forecasts, he notes, suggest that more than 80% of internet traffic could be machine-generated within the next few years",https://www.thedrum.com/news/meet-the-company-teaching-marketers-how-to-market-to-bots,thedrum.com,Meet the company teaching marketers how to market to bots | The Drum,0,LOW,False,,,unknown,2026-06-22T11:57:36.693598
It is also crafted with 50% less salt compared to the much-loved Original Vegemite and contains no artificial colours,https://www.4cc.com.au/trending/stories/vegemite-launches-new-product-for-happy-little-vegemites/,4cc.com.au,Vegemite launches new product for happy little Vegemites - 4CC,0,LOW,False,,,unknown,2026-06-22T11:57:39.931242
"First, candidates must secure the backing of 81 Labour MPs, 20% of the party’s parliamentary strength",https://www.gazette-news.co.uk/news/26215314.happens-now-sir-keir-starmer-resigns-pm/,gazette-news.co.uk,What happens now as Sir Keir Starmer resigns as PM? | Gazette,0,LOW,False,,,unknown,2026-06-22T11:57:40.849892
"They then need to receive nominations from either 5% of constituency Labour parties, or three affiliated organisations (which must include two trade unions) which represent 5% of affiliated membership",https://www.gazette-news.co.uk/news/26215314.happens-now-sir-keir-starmer-resigns-pm/,gazette-news.co.uk,What happens now as Sir Keir Starmer resigns as PM? | Gazette,0,LOW,False,,,unknown,2026-06-22T11:57:40.938229
Adobe clocked AI-referred traffic to US retail sites up 393% year on year in the first quarter,https://www.thedrum.com/opinion/mark-ritson-ai-agents-are-already-learning-which-brands-to-pick,thedrum.com,Mark Ritson: Claude is my Cannes bartender. My AI agent is favoring established brands | The Drum,0,LOW,False,,,unknown,2026-06-22T11:57:41.950450
"Mit dem neuen Format erweitert CORRECTIV sein wachsendes tagesaktuelles Angebot um einen Podcast für alle, die sich zum Feierabend kompakt über die wichtigsten politischen Nachrichten und Einordnungen des Tages informieren möchten",https://correctiv.org/in-eigener-sache/2026/06/22/was-zaehlt-correctiv-startet-taeglichen-nachrichten-podcast/,correctiv.org,„Was zählt“: CORRECTIV startet täglichen Nachrichten-Podcast - correctiv.org,0.1,LOW,False,,,factcheck,2026-06-22T11:57:43.741306
90 12051 Berlin Fax: +49 (0) 30 – 555 780 2 20 Büro Berlin Singerstraße 109 10179 Berlin Buchladen Essen Akazienallee 10 45127 Essen Online-Shop Jugendredaktion Salon5 Alle Standorte CORRECTIV,https://correctiv.org/in-eigener-sache/2026/06/22/was-zaehlt-correctiv-startet-taeglichen-nachrichten-podcast/,correctiv.org,„Was zählt“: CORRECTIV startet täglichen Nachrichten-Podcast - correctiv.org,0.1,LOW,False,,,factcheck,2026-06-22T11:57:43.829195
[DEBUNKED] CSD Dresden: Video für Desinformation über Teilnehmendenzahl genutzt,https://correctiv.org/faktencheck/2026/06/19/csd-dresden-video-fuer-desinformation-ueber-teilnehmendenzahl-genutzt/,correctiv.org,CSD Dresden: Video für Desinformation über Teilnehmendenzahl genutzt,0.9,HIGH,True,FALSE - Debunked by fact-checkers,correctiv.org,factcheck,2026-06-22T11:57:44.531169
"Während SPD und Linke keine russische Einflussnahme erkennen, werfen CDU und Grüne der Landesregierung mangelnde Transparenz und eine zu große Nähe zu Moskau vor",https://correctiv.org/aktuelles/russland-ukraine-2/2026/06/19/nord-stream-untersuchung-endet-im-streit-regierung-spricht-von-entlastung-opposition-von-taeuschung-klimastiftung-russland/,correctiv.org,"Nord Stream 2: Regierung spricht von Entlastung, Opposition von Täuschung",0.1,LOW,False,,,factcheck,2026-06-22T11:57:45.347022
"Sitzung zusammen, um den Abschlussbericht zu beschließen, wie die Grünen bestätigten",https://correctiv.org/aktuelles/russland-ukraine-2/2026/06/19/nord-stream-untersuchung-endet-im-streit-regierung-spricht-von-entlastung-opposition-von-taeuschung-klimastiftung-russland/,correctiv.org,"Nord Stream 2: Regierung spricht von Entlastung, Opposition von Täuschung",0,LOW,False,,,factcheck,2026-06-22T11:57:45.444768
Nicht alle von ihnen haben diesen unversehrt überstanden,https://correctiv.org/aktuelles/bundeswehr/2026/06/19/krieg-im-kopf/,correctiv.org,Krieg im Kopf,0.1,LOW,False,,,factcheck,2026-06-22T11:57:46.147422
Viele von ihnen haben Gefechte erlebt – und sie nicht immer unbeschadet überstanden,https://correctiv.org/aktuelles/bundeswehr/2026/06/19/krieg-im-kopf/,correctiv.org,Krieg im Kopf,0.1,LOW,False,,,factcheck,2026-06-22T11:57:46.239753
"„Gleichzeitig sprechen wissenschaftliche Untersuchungen und die Erfahrungen aus der Veteranenarbeit dafür, dass die offiziell erfassten Zahlen den tatsächlichen Unterstützungsbedarf nur teilweise abbilden",https://correctiv.org/aktuelles/bundeswehr/2026/06/19/krieg-im-kopf/,correctiv.org,Krieg im Kopf,0,LOW,False,,,factcheck,2026-06-22T11:57:46.337020
[DEBUNKED] Spionage an deutschen Hochschulen: Das Playbook der China-Agenten,https://correctiv.org/hybride-kriegsfuehrung/2026/06/18/spionage-an-deutschen-hochschulen-das-playbook-der-china-agenten/,correctiv.org,Spionage an deutschen Hochschulen: Das Playbook der China-Agenten,0.9,HIGH,True,FALSE - Debunked by fact-checkers,correctiv.org,factcheck,2026-06-22T11:57:46.940098
[DEBUNKED] Jens Spahn nahm an Geheim-Treffen von Peter Thiel teil,https://correctiv.org/aktuelles/das-spahn-netzwerk/2026/06/18/jens-spahn-peter-thiel-dialog/,correctiv.org,Jens Spahn nahm an Geheim-Treffen von Peter Thiel teil,0.9,HIGH,True,FALSE - Debunked by fact-checkers,correctiv.org,factcheck,2026-06-22T11:57:47.664986
[DEBUNKED] Fast 100 Anschläge auf deutsche Verkehrsinfrastruktur,https://correctiv.org/hybride-kriegsfuehrung/2026/06/18/fast-100-anschlaege-auf-deutsche-verkehrsinfrastruktur-sabotage/,correctiv.org,Fast 100 Anschläge auf deutsche Verkehrsinfrastruktur,0.9,HIGH,True,FALSE - Debunked by fact-checkers,correctiv.org,factcheck,2026-06-22T11:57:48.368516
[DEBUNKED] Deutschland sagte keine 233 Millionen Euro für Sozialwohnungen in Ukraine zu,https://correctiv.org/faktencheck/2026/06/18/nein-deutschland-hat-keine-233-millionen-euro-fuer-sozialwohnungen-in-der-ukraine-zugesagt/,correctiv.org,Deutschland sagte keine 233 Millionen Euro für Sozialwohnungen in Ukraine zu,0.9,HIGH,True,FALSE - Debunked by fact-checkers,correctiv.org,factcheck,2026-06-22T11:57:49.067921
[DEBUNKED] Selenskyj soll über 80 Auslandsimmobilien besitzen? Vermeintliche Belege sind gefälscht - correctiv.org,https://correctiv.org/faktencheck/aus-der-community/2026/06/18/selenskyj-soll-ueber-80-auslandsimmobilien-besitzen-vermeintliche-belege-sind-gefaelscht/,correctiv.org,Selenskyj soll über 80 Auslandsimmobilien besitzen? Vermeintliche Belege sind gefälscht - correctiv.,0.9,HIGH,True,FALSE - Debunked by fact-checkers,correctiv.org,factcheck,2026-06-22T11:57:49.771517
Mindestens 80 Prozent der Kosten für diese Umrüstung sollen von der Pharma- und Kosmetikindustrie getragen werden,https://correctiv.org/aktuelles/europa-aktuelles/2026/06/18/evp-und-rechtspopulisten-stimmen-fuer-eine-verschiebung-der-eu-abwasserrichtlinie/,correctiv.org,Konservative wollen Pharmabranche entlasten - correctiv.org,0,LOW,False,,,factcheck,2026-06-22T11:57:50.466045
Bis Mitte 2027 müssen alle EU-Länder die neue Richtlinie umsetzen,https://correctiv.org/aktuelles/europa-aktuelles/2026/06/18/evp-und-rechtspopulisten-stimmen-fuer-eine-verschiebung-der-eu-abwasserrichtlinie/,correctiv.org,Konservative wollen Pharmabranche entlasten - correctiv.org,0.1,LOW,False,,,factcheck,2026-06-22T11:57:50.555015
„Zur Finanzierung werden alle Pharma- und Kosmetikkonzerne h,https://correctiv.org/aktuelles/europa-aktuelles/2026/06/18/evp-und-rechtspopulisten-stimmen-fuer-eine-verschiebung-der-eu-abwasserrichtlinie/,correctiv.org,Konservative wollen Pharmabranche entlasten - correctiv.org,0.1,LOW,False,,,factcheck,2026-06-22T11:57:50.649315
[DEBUNKED] Amtliche Mitteilung zu Ruhestörung wegen Türkei-Spiel bei Fußball-WM ist gefälscht,https://correctiv.org/faktencheck/2026/06/17/amtliche-mitteilung-zu-ruhestoerung-wegen-tuerkei-spiel-bei-fussball-wm-ist-gefaelscht/,correctiv.org,Amtliche Mitteilung zu Ruhestörung wegen Türkei-Spiel bei Fußball-WM ist gefälscht,0.9,HIGH,True,FALSE - Debunked by fact-checkers,correctiv.org,factcheck,2026-06-22T11:57:51.351853
[DEBUNKED] Angebliche neue Anti-Islam-Gesetze in Japan gibt es nicht,https://correctiv.org/faktencheck/2026/06/17/angebliche-neue-anti-islam-gesetze-in-japan-gibt-es-nicht/,correctiv.org,Angebliche neue Anti-Islam-Gesetze in Japan gibt es nicht,0.9,HIGH,True,FALSE - Debunked by fact-checkers,correctiv.org,factcheck,2026-06-22T11:57:52.050948
Ein Überblick über alle 16 Bundesländer,https://correctiv.org/aktuelles/afd/2026/06/17/wie-stuft-der-verfassungsschutz-die-afd-in-den-bundeslaendern-ein/,correctiv.org,Wie stuft der Verfassungsschutz die AfD in den Bundesländern ein?,0.1,LOW,False,,,factcheck,2026-06-22T11:57:53.468511
"Aber diese Bestrebungen prägen die Partei laut der Gerichtsentscheidung von Ende Februar nicht so stark, dass „ihrem Gesamtbild nach eine verfassungsfeindliche Grundtendenz“ festgestellt werden könne",https://correctiv.org/aktuelles/afd/2026/06/17/wie-stuft-der-verfassungsschutz-die-afd-in-den-bundeslaendern-ein/,correctiv.org,Wie stuft der Verfassungsschutz die AfD in den Bundesländern ein?,0,LOW,False,,,factcheck,2026-06-22T11:57:53.561036
Er sieht allerdings keine Änderung in Sachen obligatorische Impfungen und Strafrahmen vor – die Regelungen dazu bestehen seit Jahren,https://correctiv.org/faktencheck/2026/06/16/video-ueber-angeblich-geplante-impfpflicht-in-der-schweiz-fuehrt-in-die-irre/,correctiv.org,Video über angeblich geplante Impfpflicht in der Schweiz führt in die Irre,0.1,LOW,False,,,factcheck,2026-06-22T11:57:54.356469
"Aktuell gilt in Zürich keine Impfpflicht, aber sie wäre begrenzt möglich",https://correctiv.org/faktencheck/2026/06/16/video-ueber-angeblich-geplante-impfpflicht-in-der-schweiz-fuehrt-in-die-irre/,correctiv.org,Video über angeblich geplante Impfpflicht in der Schweiz führt in die Irre,0.1,LOW,False,,,factcheck,2026-06-22T11:57:54.448029
"000 Euro „freikaufen“ müsse, wenn man die Impfung ablehne",https://correctiv.org/faktencheck/2026/06/16/video-ueber-angeblich-geplante-impfpflicht-in-der-schweiz-fuehrt-in-die-irre/,correctiv.org,Video über angeblich geplante Impfpflicht in der Schweiz führt in die Irre,0,LOW,False,,,factcheck,2026-06-22T11:57:54.538107
[DEBUNKED] Berlin: Wurde ein Mann wegen der Deutschlandfahne gestoppt?,https://www.mimikama.org/berlin-mann-gestoppt-deutschlandfahne/,www.mimikama.org,Berlin: Wurde ein Mann wegen der Deutschlandfahne gestoppt?,0.9,HIGH,True,FALSE - Debunked by fact-checkers,www.mimikama.org,factcheck,2026-06-22T11:57:54.621806
[DEBUNKED] KI-Video zur Deutschlandflagge: Falscher Polizeieinsatz entlarvt,https://www.mimikama.org/ki-video-verbot-deutschlandflagge/,www.mimikama.org,KI-Video zur Deutschlandflagge: Falscher Polizeieinsatz entlarvt,0.9,HIGH,True,FALSE - Debunked by fact-checkers,www.mimikama.org,factcheck,2026-06-22T11:57:55.014110
[DEBUNKED] Faktencheck: Kringel am Himmel sind keine Chemtrails,https://www.mimikama.org/kringel-am-himmel-chemtrail-beweis-faellt-leider-aus/,www.mimikama.org,Faktencheck: Kringel am Himmel sind keine Chemtrails,0.9,HIGH,True,FALSE - Debunked by fact-checkers,www.mimikama.org,factcheck,2026-06-22T11:57:55.107314
"Es kennt keine Oma, die sich freut, keinen stolzen ersten Schultag, keinen rührenden Familienmoment und keine Herzchen unter dem Beitrag",https://www.mimikama.org/was-eltern-ueber-kinderfotos-und-ki-wissen-muessen/,www.mimikama.org,Kinderfotos im Netz: Was Eltern über Risiken und KI wissen müssen,0.1,LOW,False,,,factcheck,2026-06-22T11:57:55.280188
Viele Erwachsene denken noch immer: „Ich poste doch nichts Schlimmes,https://www.mimikama.org/was-eltern-ueber-kinderfotos-und-ki-wissen-muessen/,www.mimikama.org,Kinderfotos im Netz: Was Eltern über Risiken und KI wissen müssen,0.1,LOW,False,,,factcheck,2026-06-22T11:57:55.373488
"Heute liegt das Bild auf Servern, in Chats, in Screenshots, in Backups, in Plattformarchiven und manchmal an Orten, an denen es nie hätte landen dürfen",https://www.mimikama.org/was-eltern-ueber-kinderfotos-und-ki-wissen-muessen/,www.mimikama.org,Kinderfotos im Netz: Was Eltern über Risiken und KI wissen müssen,0.1,LOW,False,,,factcheck,2026-06-22T11:57:55.466183
[DEBUNKED] Ist diese Vintage-Zahnpasta-Werbung echt?,https://www.mimikama.org/vintage-zahnpasta-werbung-echt-oder-ki/,www.mimikama.org,Ist diese Vintage-Zahnpasta-Werbung echt?,0.9,HIGH,True,FALSE - Debunked by fact-checkers,www.mimikama.org,factcheck,2026-06-22T11:57:55.644105
[DEBUNKED] Ist das Voting für &quot;Mia&quot; bei der Zurich Dance Academy echt?,https://www.mimikama.org/voting-mia-zurich-dance-academy-fake/,www.mimikama.org,Ist das Voting für &quot;Mia&quot; bei der Zurich Dance Academy echt?,0.9,HIGH,True,FALSE - Debunked by fact-checkers,www.mimikama.org,factcheck,2026-06-22T11:57:55.848238
[DEBUNKED] 71 Mädchen im Tunnel: Keine Beweise für Entführung in Nyack,https://www.mimikama.org/71-maedchen-im-tunnel-keine-spur-von-entfuehrung/,www.mimikama.org,71 Mädchen im Tunnel: Keine Beweise für Entführung in Nyack,0.9,HIGH,True,FALSE - Debunked by fact-checkers,www.mimikama.org,factcheck,2026-06-22T11:57:55.932119
[DEBUNKED] Vorsicht: Fake-Video zu Mbappé und Macron – Betrug entlarvt!,https://www.mimikama.org/fake-euro-sport-video-mbappe-macron/,www.mimikama.org,Vorsicht: Fake-Video zu Mbappé und Macron – Betrug entlarvt!,0.9,HIGH,True,FALSE - Debunked by fact-checkers,www.mimikama.org,factcheck,2026-06-22T11:57:56.032166
[DEBUNKED] Trump und Iran: Keine Beweise für 300 Milliarden Dollar Zahlung,https://www.mimikama.org/trump-keine-belege-fuer-300-milliarden-dollar/,www.mimikama.org,Trump und Iran: Keine Beweise für 300 Milliarden Dollar Zahlung,0.9,HIGH,True,FALSE - Debunked by fact-checkers,www.mimikama.org,factcheck,2026-06-22T11:57:56.118721
[DEBUNKED] Weidel bei WM 2026? Fake-Bild entlarvt Fußball-Lüge!,https://www.mimikama.org/weidel-bei-wm-2026-ki-bild-taeuscht-szene-vor/,www.mimikama.org,Weidel bei WM 2026? Fake-Bild entlarvt Fußball-Lüge!,0.9,HIGH,True,FALSE - Debunked by fact-checkers,www.mimikama.org,factcheck,2026-06-22T11:57:56.195583
[DEBUNKED] Steht Deutschland kurz vor dem „Spannungsfall“?,https://www.mimikama.org/deutschland-kurz-vor-dem-spannungsfall/,www.mimikama.org,Steht Deutschland kurz vor dem „Spannungsfall“?,0.9,HIGH,True,FALSE - Debunked by fact-checkers,www.mimikama.org,factcheck,2026-06-22T11:57:56.308245
[DEBUNKED] Zwei-Euro-Abgabe auf Bankkonten? Fake-News auf Social Media entlarvt,https://www.mimikama.org/keine-zwei-euro-abgabe-auf-bankkonten/,www.mimikama.org,Zwei-Euro-Abgabe auf Bankkonten? Fake-News auf Social Media entlarvt,0.9,HIGH,True,FALSE - Debunked by fact-checkers,www.mimikama.org,factcheck,2026-06-22T11:57:56.387699
[DEBUNKED] Vorsicht: Fake-Foto von Esther Sedlaczek zur WM verbreitet!,https://www.mimikama.org/esther-sedlaczek-sexistisches-fake-foto-wm/,www.mimikama.org,Vorsicht: Fake-Foto von Esther Sedlaczek zur WM verbreitet!,0.9,HIGH,True,FALSE - Debunked by fact-checkers,www.mimikama.org,factcheck,2026-06-22T11:57:56.467206
[DEBUNKED] Facebook ist kein soziales Netzwerk mehr,https://www.mimikama.org/facebook-ist-kein-soziales-netzwerk-mehr/,www.mimikama.org,Facebook ist kein soziales Netzwerk mehr,0.9,HIGH,True,FALSE - Debunked by fact-checkers,www.mimikama.org,factcheck,2026-06-22T11:57:56.560605
[DEBUNKED] Social Media zeigt uns: Die Welt wirkt dümmer als sie ist,https://www.mimikama.org/social-media-laesst-welt-duemmer-wirken/,www.mimikama.org,Social Media zeigt uns: Die Welt wirkt dümmer als sie ist,0.9,HIGH,True,FALSE - Debunked by fact-checkers,www.mimikama.org,factcheck,2026-06-22T11:57:56.642645
Die Partei findet aber immer mehr politische Anschlussstellen auf der Suche nach einer neuen deutschen Identität,https://www.volksverpetzer.de/analyse/afd-sachsen-anhalt-bauhaus/,www.volksverpetzer.de,Will die AfD Sachsen-Anhalt das Architektur-Erbe ihres eigenen Bundeslandes verbannen? - Volksverpet,0.1,LOW,False,,,factcheck,2026-06-22T11:57:57.224920
"Im ersten Wahlgang gewann der Rechtsextremist Hartung mit 29 Prozent der Stimmen, musste aber in die Stichwahl gegen Hoffmann von der CDU, der 23,6 Prozent der Stimmen geholt hatte",https://www.volksverpetzer.de/aktuelles/aue-bad-schlema-nazi-ard/,www.volksverpetzer.de,Aue-Bad Schlema: Neonazi verliert die Wahl – und bekommt ARD-Sendezeit - Volksverpetzer,0,LOW,False,,,factcheck,2026-06-22T11:57:57.817664
Laut einem Policy Paper des Else Frenkel-Brunswik-Instituts von 2022 ist er „eine der bekanntesten Personen aus der Neonazi-Szene im Erzgebirgskreis,https://www.volksverpetzer.de/aktuelles/aue-bad-schlema-nazi-ard/,www.volksverpetzer.de,Aue-Bad Schlema: Neonazi verliert die Wahl – und bekommt ARD-Sendezeit - Volksverpetzer,0,LOW,False,,,factcheck,2026-06-22T11:57:57.908230
[DEBUNKED] Volksverpetzer gewinnt gegen die Ostdeutsche Allgemeine vor Gericht - Volksverpetzer,https://www.volksverpetzer.de/aktuelles/volksverpetzer-gewinnt-ostdeutsche-allgemeine/,www.volksverpetzer.de,Volksverpetzer gewinnt gegen die Ostdeutsche Allgemeine vor Gericht - Volksverpetzer,0.9,HIGH,True,FALSE - Debunked by fact-checkers,www.volksverpetzer.de,factcheck,2026-06-22T11:57:58.398872
"“ Warte mal - die AfD, das waren doch die, die überall eine „Islamisierung“ wittern, für die es überhaupt keine Faktengrundlage gibt",https://www.volksverpetzer.de/analyse/afd-unterstuetzt-terroristen/,www.volksverpetzer.de,‚Selbst anpacken‘: AfD unterstützt Terroristen in Deutschland? - Volksverpetzer,0.1,LOW,False,,,factcheck,2026-06-22T11:57:58.995213
Auch kandidiert er laut seinem Instagram-Profil für die „Generation Deutschland“ Baden-Württemberg,https://www.volksverpetzer.de/analyse/afd-unterstuetzt-terroristen/,www.volksverpetzer.de,‚Selbst anpacken‘: AfD unterstützt Terroristen in Deutschland? - Volksverpetzer,0,LOW,False,,,factcheck,2026-06-22T11:57:59.082629
"OAZ-Chefredakteur mit „langem Bart“ Vor ein paar Wochen berichtete er hinter vorgehaltener Hand über seine Erfahrungen dort als Redakteur: „Die Wahrheit ist: Der wahre Chefredakteur, und das weiß auch jeder im Haus, trägt einen langen Bart",https://www.volksverpetzer.de/aktuelles/100-tage-oaz-fake-redaktion-autoren-geklaut/,www.volksverpetzer.de,Fake-Redaktion der „Ostdeutschen Allgemeinen“: Fast 400 Autoren „geklaut“ - Volksverpetzer,0,LOW,False,,,factcheck,2026-06-22T11:57:59.666545
"Friedrich würde nie, nie, nie einen selbstbewussten, eigenständigen und unabhängigen Chefredakteur akzeptieren",https://www.volksverpetzer.de/aktuelles/100-tage-oaz-fake-redaktion-autoren-geklaut/,www.volksverpetzer.de,Fake-Redaktion der „Ostdeutschen Allgemeinen“: Fast 400 Autoren „geklaut“ - Volksverpetzer,0.1,LOW,False,,,factcheck,2026-06-22T11:57:59.758228
Und die alle hatten bis auf wenige Ausnahmen eines miteinander gemein: Sie hatten noch nicht eine Zeile für die OAZ geschrieben,https://www.volksverpetzer.de/aktuelles/100-tage-oaz-fake-redaktion-autoren-geklaut/,www.volksverpetzer.de,Fake-Redaktion der „Ostdeutschen Allgemeinen“: Fast 400 Autoren „geklaut“ - Volksverpetzer,0.1,LOW,False,,,factcheck,2026-06-22T11:57:59.852446
"Diesen Monat schauen wir auf eine Millionenspende an die AfD, die die rechtsextreme Partei laut Gericht nicht zurückbekommt",https://www.volksverpetzer.de/serie/urteile-mai-2026-afd-spende/,www.volksverpetzer.de,Urteile Mai 2026: Die AfD spendiert dem Staat unfreiwillig Millionen - Volksverpetzer,0,LOW,False,,,factcheck,2026-06-22T11:58:00.451603
"2,35 Millionen Euro an - vermeintlicher Spender: der Österreicher Gerhard Dingler - ein früherer Regionalpolitiker der FPÖ",https://www.volksverpetzer.de/serie/urteile-mai-2026-afd-spende/,www.volksverpetzer.de,Urteile Mai 2026: Die AfD spendiert dem Staat unfreiwillig Millionen - Volksverpetzer,0,LOW,False,,,factcheck,2026-06-22T11:58:00.542562
"Geldwerte Leistungen, auch Werbemaßnahmen ab einer bestimmten Größenordnung, sind laut Verwaltungsgericht Berlin Spenden",https://www.volksverpetzer.de/serie/urteile-mai-2026-afd-spende/,www.volksverpetzer.de,Urteile Mai 2026: Die AfD spendiert dem Staat unfreiwillig Millionen - Volksverpetzer,0,LOW,False,,,factcheck,2026-06-22T11:58:00.630824
"Man sieht, dass bis auf den letzten Stuhl alle Plätze belegt sind",https://www.volksverpetzer.de/aktuelles/lohnt-kaempfen-merz-keine-antwort/,www.volksverpetzer.de,Wofür lohnt es sich zu kämpfen? Warum Merz keine Antwort auf diese Frage hat - Volksverpetzer,0.1,LOW,False,,,factcheck,2026-06-22T11:58:01.225991
Er räumt Ängste und Vorwürfe aus und geht sachlich auf alle Entgegnungen ein,https://www.volksverpetzer.de/aktuelles/lohnt-kaempfen-merz-keine-antwort/,www.volksverpetzer.de,Wofür lohnt es sich zu kämpfen? Warum Merz keine Antwort auf diese Frage hat - Volksverpetzer,0.1,LOW,False,,,factcheck,2026-06-22T11:58:01.317442
"Die ehemalige Menschenrechtsbeauftragte der CDU Erika Steinbach facht den Hass auf Walter Lübcke über ihre Social-Media-Kanäle immer wieder an, sodass der CDU-Politiker Peter Tauber ihr eine direkte Mitschuld an dem Mord zuspricht",https://www.volksverpetzer.de/aktuelles/lohnt-kaempfen-merz-keine-antwort/,www.volksverpetzer.de,Wofür lohnt es sich zu kämpfen? Warum Merz keine Antwort auf diese Frage hat - Volksverpetzer,0.1,LOW,False,,,factcheck,2026-06-22T11:58:01.404436
"[DEBUNKED] Ich habe den WELT-Artikel von Kristina Schröder gelesen, damit ihr es nicht müsst - Volksverpetzer",https://www.volksverpetzer.de/faktencheck/welt-schroeder-klima-fake/,www.volksverpetzer.de,"Ich habe den WELT-Artikel von Kristina Schröder gelesen, damit ihr es nicht müsst - Volksverpetzer",0.9,HIGH,True,FALSE - Debunked by fact-checkers,www.volksverpetzer.de,factcheck,2026-06-22T11:58:01.905933
"Das ließ für die OAZ, als Online-Angebot mit wöchentlicher Printausgabe immer noch weit kleiner als ursprünglich geplant, einiges erwarten und befürchten",https://www.volksverpetzer.de/aktuelles/holger-friedrich-kongress-afd/,www.volksverpetzer.de,Verleger Holger Friedrich spricht bei „Demokratiekongress“ der AfD - Volksverpetzer,0.1,LOW,False,,,factcheck,2026-06-22T11:58:02.488693
"Vorahnungen wie Kreml-Propaganda und China-Connection, ganz generell eine Sympathie für Autokraten, haben sich nun auch dort bestätigt",https://www.volksverpetzer.de/aktuelles/holger-friedrich-kongress-afd/,www.volksverpetzer.de,Verleger Holger Friedrich spricht bei „Demokratiekongress“ der AfD - Volksverpetzer,0,LOW,False,,,factcheck,2026-06-22T11:58:02.575751
"Der tschechische Schriftsteller Jaroslav Rudiš, das als Exkurs an dieser Stelle, schrieb über Okamura in der FAZ, er „hetzt gegen alles, was nicht ,urtschechisch‘ ist, was auch immer das heißen mag",https://www.volksverpetzer.de/aktuelles/holger-friedrich-kongress-afd/,www.volksverpetzer.de,Verleger Holger Friedrich spricht bei „Demokratiekongress“ der AfD - Volksverpetzer,0.1,LOW,False,,,factcheck,2026-06-22T11:58:02.667265
[DEBUNKED] Posts claim Canada criminalized quoting the Bible. Here's the truth | Snopes.com,https://www.snopes.com/fact-check/canada-bible-bill-criminalize/,www.snopes.com,Posts claim Canada criminalized quoting the Bible. Here's the truth | Snopes.com,0.9,HIGH,True,FALSE - Debunked by fact-checkers,www.snopes.com,factcheck,2026-06-22T11:58:02.759043
[DEBUNKED] Does sunscreen enter your bloodstream and weaken cancer defenses? Claim distorts studies | Snopes.com,https://www.snopes.com/fact-check/sunscreen-bloodstream-cancer/,www.snopes.com,Does sunscreen enter your bloodstream and weaken cancer defenses? Claim distorts studies | Snopes.co,0.9,HIGH,True,FALSE - Debunked by fact-checkers,www.snopes.com,factcheck,2026-06-22T11:58:02.984720
[DEBUNKED] Sean Penn on Trump: 'Enemy of mankind' and 'the state' | Snopes.com,https://www.snopes.com/fact-check/sean-penn-trump-enemy-state/,www.snopes.com,Sean Penn on Trump: 'Enemy of mankind' and 'the state' | Snopes.com,0.9,HIGH,True,FALSE - Debunked by fact-checkers,www.snopes.com,factcheck,2026-06-22T11:58:03.089273
"[DEBUNKED] 11 rumors about Lindsey Graham, examined | Snopes.com",https://www.snopes.com/collections/lindsey-graham-rumors-collection/,www.snopes.com,"11 rumors about Lindsey Graham, examined | Snopes.com",0.9,HIGH,True,FALSE - Debunked by fact-checkers,www.snopes.com,factcheck,2026-06-22T11:58:03.198524
[DEBUNKED] Meet people born in 1800s interviewed in this video | Snopes.com,https://www.snopes.com/fact-check/video-people-born-1800s/,www.snopes.com,Meet people born in 1800s interviewed in this video | Snopes.com,0.9,HIGH,True,FALSE - Debunked by fact-checkers,www.snopes.com,factcheck,2026-06-22T11:58:03.291465
[DEBUNKED] Did Matthew McConaughey say he's never met anyone 'braver' or 'smarter' than Trump? | Snopes.com,https://www.snopes.com/fact-check/matthew-mcconaughey-trump-brave/,www.snopes.com,Did Matthew McConaughey say he's never met anyone 'braver' or 'smarter' than Trump? | Snopes.com,0.9,HIGH,True,FALSE - Debunked by fact-checkers,www.snopes.com,factcheck,2026-06-22T11:58:03.376604
