claim,source_url,source_domain,article_title,risk_score,risk_category,has_factcheck,factcheck_rating,factcheck_source,source_type,checked_at
"Zum Login SPIEGEL plus Nur für Neukunden € 1,– für 4 Wochen danach € 5,99 pro Woche Freier Zugriff auf alle S+-Artikel auf SPIEGEL",https://www.spiegel.de/politik/deutschland/elterngeld-reform-gleichberechtigung-ist-der-regierung-zu-teuer-a-e6ca486c-5de7-48c6-8939-f2ed72909eaf#ref=rss,www.spiegel.de,Elterngeld-Reform: Gleichberechtigung ist der Regierung zu teuer - DER SPIEGEL,0.1,LOW,False,,,mainstream,2026-06-29T20:00:37.442172
"E-Paper (PDF), Digital-Archiv und S+-Newsletter Jederzeit kündigen Jetzt abonnieren SPIEGEL plus 52 Wochen 25 % sparen € 4,49 pro Woche für 52 Wochen danach € 5,99 pro Woche Freier Zugriff auf alle S+-Artikel auf SPIEGEL",https://www.spiegel.de/politik/deutschland/elterngeld-reform-gleichberechtigung-ist-der-regierung-zu-teuer-a-e6ca486c-5de7-48c6-8939-f2ed72909eaf#ref=rss,www.spiegel.de,Elterngeld-Reform: Gleichberechtigung ist der Regierung zu teuer - DER SPIEGEL,0.1,LOW,False,,,mainstream,2026-06-29T20:00:37.553018
Some 53% of eligible British Medical Association members voted in favour in a referendum,https://www.bbc.co.uk/news/articles/cwy01n5z48qo?at_medium=RSS&amp;at_campaign=rss,www.bbc.co.uk,Resident doctors in England accept pay deal and end strikes - BBC News,0,LOW,False,,,mainstream,2026-06-29T20:00:37.995103
"The turnout was 57%, with 32,932 doctors voting",https://www.bbc.co.uk/news/articles/cwy01n5z48qo?at_medium=RSS&amp;at_campaign=rss,www.bbc.co.uk,Resident doctors in England accept pay deal and end strikes - BBC News,0,LOW,False,,,mainstream,2026-06-29T20:00:38.096373
"5% pay rise this year, as recommended by an independent review body",https://www.bbc.co.uk/news/articles/cwy01n5z48qo?at_medium=RSS&amp;at_campaign=rss,www.bbc.co.uk,Resident doctors in England accept pay deal and end strikes - BBC News,0,LOW,False,,,mainstream,2026-06-29T20:00:38.187268
Obviously the injuries to Reece James and Jarell Quansah at right-back have not helped and neither has Bukayo Saka not being 100% fit,https://www.bbc.co.uk/sport/football/articles/cqj1g9egd80o?at_medium=RSS&amp;at_campaign=rss,www.bbc.co.uk,World Cup 2026: How Thomas Tuchel is still searching for solutions out wide - Alan Shearer - BBC Spo,0.1,LOW,False,,,mainstream,2026-06-29T20:00:39.522769
