claim,source_url,source_domain,article_title,risk_score,risk_category,has_factcheck,factcheck_rating,factcheck_source,source_type,checked_at
PauliKulturWirtschaftPolitikGastronomieHeute in HamburgPanoramaRatgeber & WissenMensch zu MenschAlle ThemenSpiele Home Wirtschaft WM 2026: 75 Euro für ein Kinder-Trikot,https://www.abendblatt.de/wirtschaft/article412143903/75-euro-fuer-ein-kinder-trikot-das-muss-guenstiger-gehen.html,abendblatt.de,WM 2026: 75 Euro für ein Kinder-Trikot? Das muss günstiger gehen!,0.1,LOW,False,,,unknown,2026-05-31T19:19:11.093907
"*]:shrink-0"" data-test-id=""teaserv2-labels""> Funke Mediengruppe Meinung Fußball-WM 2026 75 Euro für ein Kinder-Trikot",https://www.abendblatt.de/wirtschaft/article412143903/75-euro-fuer-ein-kinder-trikot-das-muss-guenstiger-gehen.html,abendblatt.de,WM 2026: 75 Euro für ein Kinder-Trikot? Das muss günstiger gehen!,0,LOW,False,,,unknown,2026-05-31T19:19:11.187056
75 Euro kostet mittlerweile das WM-Trikot für Kinder,https://www.abendblatt.de/wirtschaft/article412143903/75-euro-fuer-ein-kinder-trikot-das-muss-guenstiger-gehen.html,abendblatt.de,WM 2026: 75 Euro für ein Kinder-Trikot? Das muss günstiger gehen!,0,LOW,False,,,unknown,2026-05-31T19:19:11.292211
"Was sie aber sehr ärgere: &quot;Trotzdem gibt es immer noch Leute im Internet - ich weiß nicht, ob die Faktenallergie haben oder was auch immer -, die sagen: Es gibt ja gar keine Beweise",https://www.n-tv.de/leute/Fernandes-ueber-Ulmen-Ich-sehe-keine-Einsicht-id30864436.html,n-tv.de,&quot;Krass kriminelle Energie&quot;: Fernandes über Ulmen: &quot;Ich sehe keine Einsicht&quot; - nt,0.1,LOW,False,,,unknown,2026-05-31T19:19:11.930388
&quot;Die aktuellen Ermittlungen beziehen sich laut Fernandes allerdings zunächst nur auf mutmaßliche häusliche Gewalt,https://www.n-tv.de/leute/Fernandes-ueber-Ulmen-Ich-sehe-keine-Einsicht-id30864436.html,n-tv.de,&quot;Krass kriminelle Energie&quot;: Fernandes über Ulmen: &quot;Ich sehe keine Einsicht&quot; - nt,0.1,LOW,False,,,unknown,2026-05-31T19:19:12.030706
Deutschland habe bislang keine passenden gesetzlichen Regelungen dafür geschaffen,https://www.n-tv.de/leute/Fernandes-ueber-Ulmen-Ich-sehe-keine-Einsicht-id30864436.html,n-tv.de,&quot;Krass kriminelle Energie&quot;: Fernandes über Ulmen: &quot;Ich sehe keine Einsicht&quot; - nt,0.1,LOW,False,,,unknown,2026-05-31T19:19:12.124612
"Foto: LandeskriminalamtAnzeigeAnzeigeMagdeburg - Immer häufiger hat es Sachsen-Anhalts Polizei mit Requisiten- oder Spielgeld als Euro-Banknoten zu tun, die echten Geldscheinen extrem ähneln",https://www.volksstimme.de/sachsen-anhalt/wie-das-lka-einen-millionen-coup-mit-filmgeld-rechtzeitig-verhindern-konnte-4259237,volksstimme.de,Falschgeld in Sachsen-Anhalt: Wie das LKA einen Millionen-Coup mit „Filmgeld“ rechtzeitig verhindern,0.1,LOW,False,,,unknown,2026-05-31T19:19:12.579163
"Beratung, Gutachten und Studien Sachsen-Anhalts Regierung engagierte externe Berater für 84 Millionen Euro polymarket",https://www.volksstimme.de/sachsen-anhalt/wie-das-lka-einen-millionen-coup-mit-filmgeld-rechtzeitig-verhindern-konnte-4259237,volksstimme.de,Falschgeld in Sachsen-Anhalt: Wie das LKA einen Millionen-Coup mit „Filmgeld“ rechtzeitig verhindern,0,LOW,False,,,unknown,2026-05-31T19:19:12.671830
"Mit ihren Drohnen versetzt die Ukraine etwa der russischen Ölindustrie immer wieder schwere Schläge, wenn sie nicht umgeleitet werden",http://www.merkur.de/politik/baltikum-putins-satnav-falle-russland-kapert-drohnen-und-lenkt-sie-ins-zr-94329633.html,merkur.de,Putins Satnav-Falle: Russland kapert Drohnen und lenkt sie ins Baltikum,0.1,LOW,False,,,unknown,2026-05-31T19:19:13.648357
"Forscher der Cornell University und der University of California haben 111 Millionen Referenzen aus 2,5 Millionen wissenschaftlichen Artikeln durchleuchtet",http://www.op-online.de/leben/digital/ki-halluzinationen-verseuchen-die-wissenschaft-fake-zitate-studie-forschung-zr-94328055.html,op-online.de,Wissenschaft in Gefahr: Wie KI-Halluzinationen die Forschung untergraben,0,LOW,False,,,unknown,2026-05-31T19:19:14.453751
KI-Halluzinationen verursachen immer mehr falsche Zitate,http://www.op-online.de/leben/digital/ki-halluzinationen-verseuchen-die-wissenschaft-fake-zitate-studie-forschung-zr-94328055.html,op-online.de,Wissenschaft in Gefahr: Wie KI-Halluzinationen die Forschung untergraben,0.1,LOW,False,,,unknown,2026-05-31T19:19:14.564601
"Die Studie zeigt: Viele Autoren verlassen sich blind auf KI-Vorschläge, statt die Existenz der Quellen zu verifizieren",http://www.op-online.de/leben/digital/ki-halluzinationen-verseuchen-die-wissenschaft-fake-zitate-studie-forschung-zr-94328055.html,op-online.de,Wissenschaft in Gefahr: Wie KI-Halluzinationen die Forschung untergraben,0,LOW,False,,,unknown,2026-05-31T19:19:14.665300
"Forscher der Cornell University und der University of California haben 111 Millionen Referenzen aus 2,5 Millionen wissenschaftlichen Artikeln durchleuchtet",https://www.kreiszeitung.de/technik/ki-halluzinationen-verseuchen-die-wissenschaft-fake-zitate-studie-forschung-zr-94328055.html,kreiszeitung.de,Wissenschaft in Gefahr: Wie KI-Halluzinationen die Forschung untergraben,0,LOW,False,,,unknown,2026-05-31T19:19:15.877648
KI-Halluzinationen verursachen immer mehr falsche Zitate,https://www.kreiszeitung.de/technik/ki-halluzinationen-verseuchen-die-wissenschaft-fake-zitate-studie-forschung-zr-94328055.html,kreiszeitung.de,Wissenschaft in Gefahr: Wie KI-Halluzinationen die Forschung untergraben,0.1,LOW,False,,,unknown,2026-05-31T19:19:15.981359
"Die Studie zeigt: Viele Autoren verlassen sich blind auf KI-Vorschläge, statt die Existenz der Quellen zu verifizieren",https://www.kreiszeitung.de/technik/ki-halluzinationen-verseuchen-die-wissenschaft-fake-zitate-studie-forschung-zr-94328055.html,kreiszeitung.de,Wissenschaft in Gefahr: Wie KI-Halluzinationen die Forschung untergraben,0,LOW,False,,,unknown,2026-05-31T19:19:16.082464
"Es waren zwar keine ewig langen Krankenstände, ein paar Tage am Stück waren es doch immer wieder",https://www.vn.at/gewalt-und-verbrechen/2026/05/31/postler-organisierte-sich-selbstaendig-krankenstand.vn,vn.at,Postler organisierte sich selbständig Krankenstand - Vorarlberger Nachrichten | VN.at,0.1,LOW,False,,,unknown,2026-05-31T19:19:18.192615
"Selbst ist der MannAuf Frage der Richterin erklärt der Beschuldigte, wie er die erfundenen Krankenstände &#8220;bestätigte&#8221;",https://www.vn.at/gewalt-und-verbrechen/2026/05/31/postler-organisierte-sich-selbstaendig-krankenstand.vn,vn.at,Postler organisierte sich selbständig Krankenstand - Vorarlberger Nachrichten | VN.at,0,LOW,False,,,unknown,2026-05-31T19:19:18.284654
Der bislang strafrechtlich Unbescholtene wird zu einer Geldstrafe von 720 Euro plus 720 Euro auf Bewährung verurteilt,https://www.vn.at/gewalt-und-verbrechen/2026/05/31/postler-organisierte-sich-selbstaendig-krankenstand.vn,vn.at,Postler organisierte sich selbständig Krankenstand - Vorarlberger Nachrichten | VN.at,0,LOW,False,,,unknown,2026-05-31T19:19:18.392687
"Forscher der Cornell University und der University of California haben 111 Millionen Referenzen aus 2,5 Millionen wissenschaftlichen Artikeln durchleuchtet",http://www.wa.de/leben/digital/ki-halluzinationen-verseuchen-die-wissenschaft-fake-zitate-studie-forschung-zr-94328055.html,wa.de,Wissenschaft in Gefahr: Wie KI-Halluzinationen die Forschung untergraben,0,LOW,False,,,unknown,2026-05-31T19:19:19.089462
KI-Halluzinationen verursachen immer mehr falsche Zitate,http://www.wa.de/leben/digital/ki-halluzinationen-verseuchen-die-wissenschaft-fake-zitate-studie-forschung-zr-94328055.html,wa.de,Wissenschaft in Gefahr: Wie KI-Halluzinationen die Forschung untergraben,0.1,LOW,False,,,unknown,2026-05-31T19:19:19.190083
"Die Studie zeigt: Viele Autoren verlassen sich blind auf KI-Vorschläge, statt die Existenz der Quellen zu verifizieren",http://www.wa.de/leben/digital/ki-halluzinationen-verseuchen-die-wissenschaft-fake-zitate-studie-forschung-zr-94328055.html,wa.de,Wissenschaft in Gefahr: Wie KI-Halluzinationen die Forschung untergraben,0,LOW,False,,,unknown,2026-05-31T19:19:19.283398
"Konstanz (mag) - ""36 Grad und es wird noch heißer, mach' diesen Beat nie wieder leiser"", sangen 2raumwohnung einst","https://laut.de/News/ReviewFotos--Ikkimel,-Sean-Paul-u.a.-beim-Campus-Festival-30-05-2026-21784",laut.de,"Review/Fotos : Ikkimel, Sean Paul u.a. beim Campus Festival – laut.de – News",0.1,LOW,False,,,unknown,2026-05-31T19:19:20.135227
"Frytz gibt sich im Anschluss locker und bleibt es auch, als mitten in einem Song alle Lichter ausgehen: Der Strom ist kurz weg, aber die Crowd singt einfach a-cappella weiter","https://laut.de/News/ReviewFotos--Ikkimel,-Sean-Paul-u.a.-beim-Campus-Festival-30-05-2026-21784",laut.de,"Review/Fotos : Ikkimel, Sean Paul u.a. beim Campus Festival – laut.de – News",0.1,LOW,False,,,unknown,2026-05-31T19:19:20.231890
Der durchschnittliche Schaden pro Betrugsfall liegt laut Bericht bei mehr als 4,https://vorarlberg.orf.at/stories/3355955/,vorarlberg.orf.at,&Auml;ltere Menschen h&auml;ufiger Opfer von Internetbetrug - vorarlberg.ORF.at,0,LOW,False,,,unknown,2026-05-31T19:19:21.585572
"Mehr zum Thema Wie Betrüger versuchen, an Daten zu kommen Ältere Menschen häufiger betroffenAuffällig ist laut Bericht vor allem das Alter der Opfer im Zusammenhang mit der Schadenshöhe",https://vorarlberg.orf.at/stories/3355955/,vorarlberg.orf.at,&Auml;ltere Menschen h&auml;ufiger Opfer von Internetbetrug - vorarlberg.ORF.at,0.1,LOW,False,,,unknown,2026-05-31T19:19:21.682002
"500 Euro verloren, lag der Durchschnittsschaden bei den 80- bis 89-Jährigen bereits bei mehr als 12",https://vorarlberg.orf.at/stories/3355955/,vorarlberg.orf.at,&Auml;ltere Menschen h&auml;ufiger Opfer von Internetbetrug - vorarlberg.ORF.at,0,LOW,False,,,unknown,2026-05-31T19:19:21.792528
Xbox-Content-Chef Matt Booty bestätigte die Entscheidung im offiziellen Xbox-Podcast,https://www.play3.de/2026/05/31/asha-sharma-logo-debatte-branchenvertreter-kritisieren-moeglichen-rueckzieher-der-xbox-chefin/,play3.de,Asha Sharma und die Logo-Debatte: Branchenvertreter kritisieren möglichen Rückzieher der Xbox-Chefin,0,LOW,False,,,unknown,2026-05-31T19:19:22.316020
"Keine Zero-Days nötig — nur eine falsche SMS Die unabhängige Forschungsgruppe Osservatorio Nessuno hat zwei dieser Produkte dokumentiert: Morpheus, das der Firma IPS Intelligence zugeordnet wird, und Spyrtacus, entwickelt von SIO S",https://www.blogspan.net/italien-billig-spyware-masseninfektion-routine/,blogspan.net,Billig-Spyware statt Pegasus: Wie Italiens Überwachungsindustrie Masseninfektionen zur Routine macht,0.1,LOW,False,,,unknown,2026-05-31T19:19:23.105624
Keine vergleichbare EU-Nation liegt auch nur annähernd in dieser Größenordnung,https://www.blogspan.net/italien-billig-spyware-masseninfektion-routine/,blogspan.net,Billig-Spyware statt Pegasus: Wie Italiens Überwachungsindustrie Masseninfektionen zur Routine macht,0.1,LOW,False,,,unknown,2026-05-31T19:19:23.197290
"Mit offizieller Genehmigung, ohne öffentliche Transparenzpflicht",https://www.blogspan.net/italien-billig-spyware-masseninfektion-routine/,blogspan.net,Billig-Spyware statt Pegasus: Wie Italiens Überwachungsindustrie Masseninfektionen zur Routine macht,0,LOW,False,,,unknown,2026-05-31T19:19:23.306587
"Was hinter „Silent Calls“ steckt und wie Autodialer funktionierenDer Begriff „Silent Call“ bezeichnet einen stummen Anruf, bei dem sich am anderen Ende der Leitung keine Person befindet",http://www.merkur.de/verbraucher/silent-calls-wie-sie-sich-vor-stummen-anrufen-schuetzen-94330019.html,merkur.de,Silent Calls: Wie Sie sich vor stummen Anrufen schützen,0.1,LOW,False,,,unknown,2026-05-31T19:19:25.371402
"Was hinter „Silent Calls“ steckt und wie Autodialer funktionierenDer Begriff „Silent Call“ bezeichnet einen stummen Anruf, bei dem sich am anderen Ende der Leitung keine Person befindet",http://www.hna.de/verbraucher/silent-calls-wie-sie-sich-vor-stummen-anrufen-schuetzen-94330023.html,hna.de,Silent Calls: Wie Sie sich vor stummen Anrufen schützen,0.1,LOW,False,,,unknown,2026-05-31T19:19:26.177600
Direkt darunter sind alle „Geschenkgutschein-Aktivitäten“ aufgelistet,https://www.giga.de/tech/amazon-gutschein-angeblich-verbraucht-so-prueft-ihr-das-guthaben-und-erkennt-moegliche-betrugsfallen--01J4SCDCH8276Z8SF0TPR92BC6,giga.de,"Amazon-Gutschein schon eingelöst: Wie ihr prüft, was passiert ist",0.1,LOW,False,,,unknown,2026-05-31T19:19:27.552233
"„Nichts kann die Fortsetzung der israelischen Militäroperationen im Libanon und eine immer tiefere Besetzung libanesischen Territoriums rechtfertigen“, sagte Außenminister Jean-Noël Barrot dem Sender BFMTV",http://www.merkur.de/politik/news-aktuell-ticker-iran-krieg-trump-regime-strasse-von-hormus-eskalation-angriffe-verhandlungen-zr-94325450.html,merkur.de,Iran-Krieg: Libanon-Kämpfe eskalieren - Wadephul warnt vor „neuen Fluchtbewegungen“,0.1,LOW,False,,,unknown,2026-05-31T19:19:29.270821
Rund 41 Millionen Kolumbianer sind am 31,https://amerika21.de/analyse/285797/wahlen-kolumbien-linker-sieg-sicht,amerika21.de,Wahlen in Kolumbien: Neuer Sieg der Linken in Sicht? | amerika21,0,LOW,False,,,unknown,2026-05-31T19:19:31.725000
"Um im ersten Wahlgang zu gewinnen, sind mehr als 50 Prozent der gültigen Stimmen erforderlich",https://amerika21.de/analyse/285797/wahlen-kolumbien-linker-sieg-sicht,amerika21.de,Wahlen in Kolumbien: Neuer Sieg der Linken in Sicht? | amerika21,0,LOW,False,,,unknown,2026-05-31T19:19:31.830684
"Da die Wahlteilnahme freiwillig ist, wird die Wahlenthaltung, die in Kolumbien historisch gesehen sehr hoch ist (45 Prozent bei den Präsidentschaftswahlen 2022), einen wichtigen Einfluss auf die Ergebnisse haben",https://amerika21.de/analyse/285797/wahlen-kolumbien-linker-sieg-sicht,amerika21.de,Wahlen in Kolumbien: Neuer Sieg der Linken in Sicht? | amerika21,0,LOW,False,,,unknown,2026-05-31T19:19:31.940279
"„Nichts kann die Fortsetzung der israelischen Militäroperationen im Libanon und eine immer tiefere Besetzung libanesischen Territoriums rechtfertigen“, sagte Außenminister Jean-Noël Barrot dem Sender BFMTV",http://www.az-online.de/politik/news-aktuell-ticker-iran-krieg-trump-regime-strasse-von-hormus-eskalation-angriffe-verhandlungen-zr-94325450.html,az-online.de,Iran-Krieg: Libanon-Kämpfe eskalieren - Wadephul warnt vor „neuen Fluchtbewegungen“,0.1,LOW,False,,,unknown,2026-05-31T19:19:33.119783
"Angezeigt wird laut Google die geschätzte Menge der Kommentare, die nach Diffamierungs-Beschwerden innerhalb der letzten 365 Tage geprüft und gelöscht wurden",http://www.wa.de/nordrhein-westfalen/google-bewertungen-koelner-wirte-erklaeren-loesch-gruende-zr-94329678.html,wa.de,Google-Bewertungen: Kölner Wirte erklären Lösch-Gründe.,0,LOW,False,,,unknown,2026-05-31T19:19:35.220994
"Teheran bietet Trump die Stirn Au&szlig;enamtssprecher Ismail Baghai sagte laut der Nachrichtenagentur Isna, dass der Iran und die USA weiterhin Botschaften austauschten",https://www.aktiencheck.de/news/Artikel-ROUNDUP_Trump_ohne_Entscheidung_Iran_pocht_auf_eigene_Interessen-19807629,aktiencheck.de,ROUNDUP: Trump ohne Entscheidung - Iran pocht auf eigene Interessen () | aktiencheck.de,0,LOW,False,,,unknown,2026-05-31T19:19:37.633647
Ohne diese Freigabe werde der Iran in keine weiteren Verhandlungsphasen eintreten,https://www.aktiencheck.de/news/Artikel-ROUNDUP_Trump_ohne_Entscheidung_Iran_pocht_auf_eigene_Interessen-19807629,aktiencheck.de,ROUNDUP: Trump ohne Entscheidung - Iran pocht auf eigene Interessen () | aktiencheck.de,0.1,LOW,False,,,unknown,2026-05-31T19:19:37.720756
"* Das Abkommen enthalte keine Bestimmung zur geb&uuml;hrenfreien &Ouml;ffnung der Stra&szlig;e von Hormus, hie&szlig; es",https://www.aktiencheck.de/news/Artikel-ROUNDUP_Trump_ohne_Entscheidung_Iran_pocht_auf_eigene_Interessen-19807629,aktiencheck.de,ROUNDUP: Trump ohne Entscheidung - Iran pocht auf eigene Interessen () | aktiencheck.de,0.1,LOW,False,,,unknown,2026-05-31T19:19:37.822748
"LinkedIn Zum Autorenprofil &rarr; Botnetz zerschlagen: 17 Millionen Geräte befreit, 200 Server beschlagnahmt Dieter Jaworski Heute, 03:40 Uhr Parallel dazu r&uuml;sten Apple und Samsung ihre Smartphones mit neuartigen Anti-Diebstahl-Funktionen auf",https://www.boerse-express.com/news/articles/botnetz-zerschlagen-17-millionen-geraete-befreit-200-server-beschlagnahmt-911364,boerse-express.com,"Botnetz zerschlagen: 17 Millionen Geräte befreit, 200 Server beschlagnahmt",0.1,LOW,False,,,unknown,2026-05-31T19:19:39.075602
"Mai best&auml;tigten die niederl&auml;ndischen Ermittler die erfolgreiche Zerschlagung eines Botnetzes mit mindestens 17 Millionen infizierten Ger&auml;ten &ndash; darunter Computer, Tablets und Smartphones",https://www.boerse-express.com/news/articles/botnetz-zerschlagen-17-millionen-geraete-befreit-200-server-beschlagnahmt-911364,boerse-express.com,"Botnetz zerschlagen: 17 Millionen Geräte befreit, 200 Server beschlagnahmt",0.1,LOW,False,,,unknown,2026-05-31T19:19:39.176938
Die offizielle Vorstellung wird f&uuml;r die Entwicklerkonferenz am 8,https://www.boerse-express.com/news/articles/botnetz-zerschlagen-17-millionen-geraete-befreit-200-server-beschlagnahmt-911364,boerse-express.com,"Botnetz zerschlagen: 17 Millionen Geräte befreit, 200 Server beschlagnahmt",0,LOW,False,,,unknown,2026-05-31T19:19:39.292030
Laut Polizei handelt es sich um betrügerische Phishing-E-Mails,https://www.sr.de/sr/home/nachrichten/panorama/warnung_phishing-mails_rauchmelder_brandschutz_st_wendel_100.html,sr.de,SR.de: Polizei St. Wendel warnt vor gefälschten Mails zu Rauchmeldern,0,LOW,False,,,unknown,2026-05-31T19:19:40.378770
„Bitte lassen Sie keine unbekannten Personen in Ihre Wohnung oder Ihr Haus,https://www.sr.de/sr/home/nachrichten/panorama/warnung_phishing-mails_rauchmelder_brandschutz_st_wendel_100.html,sr.de,SR.de: Polizei St. Wendel warnt vor gefälschten Mails zu Rauchmeldern,0.1,LOW,False,,,unknown,2026-05-31T19:19:40.496333
"Bitte öffnen Sie keine Links oder Anhänge aus E-Mails, deren Absender Ihnen nicht bekannt ist und geben Sie keine persönlichen Daten weiter",https://www.sr.de/sr/home/nachrichten/panorama/warnung_phishing-mails_rauchmelder_brandschutz_st_wendel_100.html,sr.de,SR.de: Polizei St. Wendel warnt vor gefälschten Mails zu Rauchmeldern,0.1,LOW,False,,,unknown,2026-05-31T19:19:40.607099
"Mit ihren Drohnen versetzt die Ukraine etwa der russischen Ölindustrie immer wieder schwere Schläge, wenn sie nicht umgeleitet werden",https://www.kreiszeitung.de/politik/putins-satnav-falle-russland-kapert-drohnen-und-lenkt-sie-ins-baltikum-zr-94329633.html,kreiszeitung.de,Putins Satnav-Falle: Russland kapert Drohnen und lenkt sie ins Baltikum,0.1,LOW,False,,,unknown,2026-05-31T19:19:41.602695
"Mit ihren Drohnen versetzt die Ukraine etwa der russischen Ölindustrie immer wieder schwere Schläge, wenn sie nicht umgeleitet werden",http://www.wa.de/politik/putins-satnav-falle-russland-kapert-drohnen-und-lenkt-sie-ins-baltikum-zr-94329633.html,wa.de,Putins Satnav-Falle: Russland kapert Drohnen und lenkt sie ins Baltikum,0.1,LOW,False,,,unknown,2026-05-31T19:19:42.634579
"Mit ihren Drohnen versetzt die Ukraine etwa der russischen Ölindustrie immer wieder schwere Schläge, wenn sie nicht umgeleitet werden",https://www.hna.de/politik/putins-satnav-falle-russland-kapert-drohnen-und-lenkt-sie-ins-baltikum-zr-94329633.html,hna.de,Putins Satnav-Falle: Russland kapert Drohnen und lenkt sie ins Baltikum,0.1,LOW,False,,,unknown,2026-05-31T19:19:43.742479
[DEBUNKED] Ein unerklärter Krieg: Polen als Testgebiet russischer Operationen,https://correctiv.org/hybride-kriegsfuehrung/2026/05/29/ein-unerklaerter-krieg-polen-als-testgebiet-russischer-operationen-gegen-den-westen/,correctiv.org,Ein unerklärter Krieg: Polen als Testgebiet russischer Operationen,0.9,HIGH,True,FALSE - Debunked by fact-checkers,correctiv.org,factcheck,2026-05-31T19:19:44.625708
[DEBUNKED] Kriegsschiff beschädigt: Erneut Sabotageverdacht bei der Marine,https://correctiv.org/hybride-kriegsfuehrung/2026/05/29/kriegsschiff-beschaedigt-erneut-sabotageverdacht-bei-der-marine/,correctiv.org,Kriegsschiff beschädigt: Erneut Sabotageverdacht bei der Marine,0.9,HIGH,True,FALSE - Debunked by fact-checkers,correctiv.org,factcheck,2026-05-31T19:19:45.398904
[DEBUNKED] Meeresspiegel steigt in Sydney – Fotovergleich sagt nichts aus,https://correctiv.org/faktencheck/2026/05/29/meeresspiegel-steigt-auch-in-sydney-fotovergleich-sagt-nichts-aus/,correctiv.org,Meeresspiegel steigt in Sydney – Fotovergleich sagt nichts aus,0.9,HIGH,True,FALSE - Debunked by fact-checkers,correctiv.org,factcheck,2026-05-31T19:19:46.308660
[DEBUNKED] KI-Stimme von Friedrich Merz verkündet erfundene Mindestlohn-Kürzung,https://correctiv.org/faktencheck/2026/05/29/ki-stimme-von-friedrich-merz-verkuendet-erfundene-mindestlohn-kuerzung-auf-tiktok/,correctiv.org,KI-Stimme von Friedrich Merz verkündet erfundene Mindestlohn-Kürzung,0.9,HIGH,True,FALSE - Debunked by fact-checkers,correctiv.org,factcheck,2026-05-31T19:19:47.144304
"[DEBUNKED] Nein, es gibt keinen 3.500-Hektar-Solarpark bei Cottbus",https://correctiv.org/faktencheck/2026/05/28/cottbus-angeblichen-3500-hektar-solarpark-gibt-es-nicht/,correctiv.org,"Nein, es gibt keinen 3.500-Hektar-Solarpark bei Cottbus",0.9,HIGH,True,FALSE - Debunked by fact-checkers,correctiv.org,factcheck,2026-05-31T19:19:48.033143
[DEBUNKED] Klimawandel: Warum bisheriges Worst-Case-Szenario inzwischen unplausibel ist,https://correctiv.org/faktencheck/hintergrund/2026/05/28/klimawandel-warum-das-worst-case-szenario-abgeschwaecht-wurde/,correctiv.org,Klimawandel: Warum bisheriges Worst-Case-Szenario inzwischen unplausibel ist,0.9,HIGH,True,FALSE - Debunked by fact-checkers,correctiv.org,factcheck,2026-05-31T19:19:49.686912
[DEBUNKED] Tiktok-Video zu angeblichem Ikea-Vorfall vermischt KI und alte Aufnahmen,https://correctiv.org/faktencheck/aus-der-community/2026/05/28/kein-echter-vorfall-bei-ikea-tiktok-video-ist-mischung-aus-ki-und-alten-aufnahmen/,correctiv.org,Tiktok-Video zu angeblichem Ikea-Vorfall vermischt KI und alte Aufnahmen,0.9,HIGH,True,FALSE - Debunked by fact-checkers,correctiv.org,factcheck,2026-05-31T19:19:50.400880
[DEBUNKED] Illegale Deponie in Gelsenkirchen: „Natürlich sind das giftige Abfälle“ - correctiv.org,https://correctiv.org/umweltverbrechen-in-nrw/2026/05/28/illegale-deponie-in-gelsenkirchen-natuerlich-sind-das-gefaehrliche-abfaelle/,correctiv.org,Illegale Deponie in Gelsenkirchen: „Natürlich sind das giftige Abfälle“ - correctiv.org,0.9,HIGH,True,FALSE - Debunked by fact-checkers,correctiv.org,factcheck,2026-05-31T19:19:51.144924
[DEBUNKED] Care-Arbeitstage ohne Ende? - correctiv.org,https://correctiv.org/aktuelles/politik-2/2026/05/27/care-arbeitstage-ohne-ende/,correctiv.org,Care-Arbeitstage ohne Ende? - correctiv.org,0.9,HIGH,True,FALSE - Debunked by fact-checkers,correctiv.org,factcheck,2026-05-31T19:19:51.906118
Jeder Konferenztag beginnt mit einer gemeinsamen Auftaktveranstaltung,https://correctiv.org/in-eigener-sache/2026/05/26/perfekte-pitches-ki-und-pressefreiheit-in-bewegten-zeiten-ausblick-auf-die-correctiv-lokal-konferenz-2026/,correctiv.org,"Perfekte Pitches, KI und Pressefreiheit in bewegten Zeiten: Ausblick auf die CORRECTIV.Lokal Konfere",0,LOW,False,,,factcheck,2026-05-31T19:19:52.653815
"Erste Programm-Highlights veröffentlicht Die ersten bestätigten Beiträge verbinden investigative Praxis, wissenschaftliche Perspektiven und konkrete Werkzeuge für den Redaktionsalltag",https://correctiv.org/in-eigener-sache/2026/05/26/perfekte-pitches-ki-und-pressefreiheit-in-bewegten-zeiten-ausblick-auf-die-correctiv-lokal-konferenz-2026/,correctiv.org,"Perfekte Pitches, KI und Pressefreiheit in bewegten Zeiten: Ausblick auf die CORRECTIV.Lokal Konfere",0,LOW,False,,,factcheck,2026-05-31T19:19:52.754002
"Das Papier wird für 7,50 Euro im Online-Shop und auf der Webseite zum Herunterladen angeboten",https://correctiv.org/aktuelles/neue-rechte/2026/05/26/rechte-cancel-culture-gegen-cdu-broschuere/,correctiv.org,Rechte Cancel-Culture gegen CDU-Broschüre - correctiv.org,0,LOW,False,,,factcheck,2026-05-31T19:19:53.727253
Darin wird die AfD als „keine Alternative“ bezeichnet,https://correctiv.org/aktuelles/neue-rechte/2026/05/26/rechte-cancel-culture-gegen-cdu-broschuere/,correctiv.org,Rechte Cancel-Culture gegen CDU-Broschüre - correctiv.org,0.1,LOW,False,,,factcheck,2026-05-31T19:19:53.835515
"Und entsprechend sollen alle Menschen, die diesem völkischen Ideal der AfD nicht entsprechen, keinen Platz in unserem Land haben",https://correctiv.org/aktuelles/neue-rechte/2026/05/26/rechte-cancel-culture-gegen-cdu-broschuere/,correctiv.org,Rechte Cancel-Culture gegen CDU-Broschüre - correctiv.org,0.1,LOW,False,,,factcheck,2026-05-31T19:19:53.941280
[DEBUNKED] Keine Hantavirus-Einsatz: Foto zeigt Marineübung im Jahr 2025,https://correctiv.org/faktencheck/2026/05/22/kein-hantavirus-einsatz-foto-zeigt-marineuebung-im-jahr-2025/,correctiv.org,Keine Hantavirus-Einsatz: Foto zeigt Marineübung im Jahr 2025,0.9,HIGH,True,FALSE - Debunked by fact-checkers,correctiv.org,factcheck,2026-05-31T19:19:54.783286
"Diese Warnung hört man immer mal wieder, sie soll sogar von Albert Einstein sein",https://correctiv.org/faktencheck/2026/05/22/geruechtekiller-sterben-menschen-unweigerlich-aus-wenn-bienen-aussterben/,correctiv.org,"Gerüchtekiller: Stirbt die Menschheit unweigerlich aus, wenn Bienen aussterben?",0.1,LOW,False,,,factcheck,2026-05-31T19:19:55.800962
