claim,source_url,source_domain,article_title,risk_score,risk_category,has_factcheck,factcheck_rating,factcheck_source,source_type,checked_at
[DEBUNKED] Fact Check: Video Does NOT Show President Trump Kissing Nicki Minaj | Lead Stories,https://leadstories.com/hoax-alert/2026/02/fact-check-video-does-not-show-president-trump-kissing-nicki-minaj.html,leadstories.com,Fact Check: Video Does NOT Show President Trump Kissing Nicki Minaj | Lead Stories,0.9,HIGH,True,FALSE - Debunked by fact-checkers,leadstories.com,factcheck,2026-02-20T13:04:52.390101
"[DEBUNKED] Fact Check: There's NO Proof LifeTouch School Photos Put ""You And Every Other American Kid ... In The Epstein Files"" -- Mathematically Impossible, Since LifeTouch Only Accounts For 25% Of School Photos | Lead Stories",https://leadstories.com/hoax-alert/2026/02/fact-check-no-proof-every-american-kid-in-epstein-files-through-lifetouch-school-photos.html,leadstories.com,"Fact Check: There's NO Proof LifeTouch School Photos Put ""You And Every Other American Kid ... In Th",0.9,HIGH,True,FALSE - Debunked by fact-checkers,leadstories.com,factcheck,2026-02-20T13:04:52.614381
[DEBUNKED] Fact Check: Elon Musk DID Tweet 'I Agree With The Teachings Of Jesus' | Lead Stories,https://leadstories.com/hoax-alert/2026/02/fact-check-elon-musk-did-tweet-i-agree-with-the-teachings-of-jesus.html,leadstories.com,Fact Check: Elon Musk DID Tweet 'I Agree With The Teachings Of Jesus' | Lead Stories,0.9,HIGH,True,FALSE - Debunked by fact-checkers,leadstories.com,factcheck,2026-02-20T13:04:52.856334
[DEBUNKED] Fact Check: NO TMZ Story About Zelensky Buying Diddy's Mansion For $61 Million -- Nothing On Their Site | Lead Stories,https://leadstories.com/hoax-alert/2026/02/fact-check-tmz-did-not-report-zelenskyy-bought-diddy-mansion.html,leadstories.com,Fact Check: NO TMZ Story About Zelensky Buying Diddy's Mansion For $61 Million -- Nothing On Their S,0.9,HIGH,True,FALSE - Debunked by fact-checkers,leadstories.com,factcheck,2026-02-20T13:04:53.096613
"[DEBUNKED] Fact Check: Thitikul, De Niro, Hanks, Penrod Did NOT Say 'Don't Touch My Family Or My Country' To Karoline Leavitt Or Whoopi Goldberg -- It's Vietspam | Lead Stories",https://leadstories.com/hoax-alert/2026/02/fact-check-thitikul-and-dozens-of-other-celebs-did-not-say-dont-touch-my-family-or-country.html,leadstories.com,"Fact Check: Thitikul, De Niro, Hanks, Penrod Did NOT Say 'Don't Touch My Family Or My Country' To Ka",0.9,HIGH,True,FALSE - Debunked by fact-checkers,leadstories.com,factcheck,2026-02-20T13:04:53.330057
[DEBUNKED] Fact Check: Rep. Ted Lieu Did NOT Say Unreleased Epstein Files Show Donald Trump Raping Children -- He Referenced 'Allegations' | Lead Stories,https://leadstories.com/hoax-alert/2026/02/fact-check-ted-lieu-did-not-say-epstein-files-show-trump-raping-children.html,leadstories.com,Fact Check: Rep. Ted Lieu Did NOT Say Unreleased Epstein Files Show Donald Trump Raping Children -- ,0.9,HIGH,True,FALSE - Debunked by fact-checkers,leadstories.com,factcheck,2026-02-20T13:04:53.556677
"[DEBUNKED] Fact Check: Video Does NOT Show The ""Strange Behavior Of A Woman"" At The White House | Lead Stories",https://leadstories.com/hoax-alert/2026/02/fact-check-on-twitter-video-does-not-show-woman-strange-behavior-at-white-house.html,leadstories.com,"Fact Check: Video Does NOT Show The ""Strange Behavior Of A Woman"" At The White House | Lead Stories",0.9,HIGH,True,FALSE - Debunked by fact-checkers,leadstories.com,factcheck,2026-02-20T13:04:53.771176
[DEBUNKED] Fact Check: Fake Video Of Firefighter Rescuing A Mother Dog And Pups From Burning Building Is One Of Many AI Versions | Lead Stories,https://leadstories.com/hoax-alert/2026/02/fact-check-fake-video-showing-firefighter-rescuing-mother-dog-and-puppies-from-burning-building.html,leadstories.com,Fact Check: Fake Video Of Firefighter Rescuing A Mother Dog And Pups From Burning Building Is One Of,0.9,HIGH,True,FALSE - Debunked by fact-checkers,leadstories.com,factcheck,2026-02-20T13:04:54.000045
[DEBUNKED] Fact Check: Image Does NOT Show Pam Bondi At 14 With Donald Trump At An Epstein Party -- It's Old AI | Lead Stories,https://leadstories.com/hoax-alert/2026/02/fact-check-image-does-not-show-pam-bondi-at-14-with-trump.html,leadstories.com,Fact Check: Image Does NOT Show Pam Bondi At 14 With Donald Trump At An Epstein Party -- It's Old AI,0.9,HIGH,True,FALSE - Debunked by fact-checkers,leadstories.com,factcheck,2026-02-20T13:04:54.224141
[DEBUNKED] Fact Check: Rep. Randy Fine DID Say On X That 'The Choice Between Dogs And Muslims Is Not A Difficult One' | Lead Stories,https://leadstories.com/hoax-alert/2026/02/fact-check-congressman-randy-fine-did-say-on-X-that-choice-between-dogs-and-muslims-is-not-a-difficult-one.html,leadstories.com,Fact Check: Rep. Randy Fine DID Say On X That 'The Choice Between Dogs And Muslims Is Not A Difficul,0.9,HIGH,True,FALSE - Debunked by fact-checkers,leadstories.com,factcheck,2026-02-20T13:04:54.470417
[DEBUNKED] Viral posts falsely name Savannah Guthrie’s husband as a ‘co-conspirator’ in the Epstein files - Poynter,https://www.poynter.org/fact-checking/2026/michael-feldman-fgs-global-epstein-files/,www.poynter.org,Viral posts falsely name Savannah Guthrie’s husband as a ‘co-conspirator’ in the Epstein files - Poy,0.9,HIGH,True,FALSE - Debunked by fact-checkers,www.poynter.org,factcheck,2026-02-20T13:04:55.278222
"Zum Login SPIEGEL plus Nur für Neukunden € 1,– für 4 Wochen danach € 5,99 pro Woche Freier Zugriff auf alle S+-Artikel auf SPIEGEL",https://www.spiegel.de/ausland/russland-auf-tiktok-instagram-und-co-klagen-nutzer-ueber-hohe-lebensmittelpreise-a-0e21a9ef-b2c5-4269-b45c-1b875d32437f#ref=rss,www.spiegel.de,"Russland: Auf TikTok, Instagram und Co. klagen Nutzer über hohe Lebensmittelpreise - DER SPIEGEL",0.1,LOW,False,,,mainstream,2026-02-20T13:05:12.335782
"E-Paper (PDF), Digital-Archiv und S+-Newsletter Jederzeit kündigen Jetzt abonnieren SPIEGEL plus 52 Wochen 25 % sparen € 4,49 pro Woche für 52 Wochen danach € 5,99 pro Woche Freier Zugriff auf alle S+-Artikel auf SPIEGEL",https://www.spiegel.de/ausland/russland-auf-tiktok-instagram-und-co-klagen-nutzer-ueber-hohe-lebensmittelpreise-a-0e21a9ef-b2c5-4269-b45c-1b875d32437f#ref=rss,www.spiegel.de,"Russland: Auf TikTok, Instagram und Co. klagen Nutzer über hohe Lebensmittelpreise - DER SPIEGEL",0.1,LOW,False,,,mainstream,2026-02-20T13:05:12.532407
Auf »No Lube So Rude« ist die Ikone des sexuellen Empowerments politisch wie nie – wenn auch schwer hörbar,https://www.spiegel.de/kultur/peaches-mit-neuem-album-no-lube-so-rude-grober-keil-grober-klotz-a-d00dc9ee-e35c-4a0f-a62d-f9aecfea7a6f#ref=rss,www.spiegel.de,"Peaches mit neuem Album »No Lube So Rude«: Grober Keil, grober Klotz - DER SPIEGEL",0.1,LOW,False,,,mainstream,2026-02-20T13:05:13.737316
"Zum Login SPIEGEL plus Nur für Neukunden € 1,– für 4 Wochen danach € 5,99 pro Woche Freier Zugriff auf alle S+-Artikel auf SPIEGEL",https://www.spiegel.de/kultur/peaches-mit-neuem-album-no-lube-so-rude-grober-keil-grober-klotz-a-d00dc9ee-e35c-4a0f-a62d-f9aecfea7a6f#ref=rss,www.spiegel.de,"Peaches mit neuem Album »No Lube So Rude«: Grober Keil, grober Klotz - DER SPIEGEL",0.1,LOW,False,,,mainstream,2026-02-20T13:05:13.942285
"E-Paper (PDF), Digital-Archiv und S+-Newsletter Jederzeit kündigen Jetzt abonnieren SPIEGEL plus 52 Wochen 25 % sparen € 4,49 pro Woche für 52 Wochen danach € 5,99 pro Woche Freier Zugriff auf alle S+-Artikel auf SPIEGEL",https://www.spiegel.de/kultur/peaches-mit-neuem-album-no-lube-so-rude-grober-keil-grober-klotz-a-d00dc9ee-e35c-4a0f-a62d-f9aecfea7a6f#ref=rss,www.spiegel.de,"Peaches mit neuem Album »No Lube So Rude«: Grober Keil, grober Klotz - DER SPIEGEL",0.1,LOW,False,,,mainstream,2026-02-20T13:05:14.150794
Laut Anklage landeten die Informationen auch in Iran,https://www.spiegel.de/netzwelt/netzpolitik/silicon-valley-iranische-ingenieure-sollen-google-geheimnisse-gestohlen-haben-a-5dafb82e-48fc-4ba0-b2b1-79338f6373ad#ref=rss,www.spiegel.de,Silicon Valley: Iranische Ingenieure sollen Google-Geheimnisse gestohlen haben - DER SPIEGEL,0,LOW,False,,,mainstream,2026-02-20T13:05:15.384662
FBI spricht von »kalkuliertem Vertrauensbruch«Laut Anklageschrift handelt es sich bei den Beschuldigten um iranische Staatsangehörige: ein 41 und 40 Jahre altes Ehepaar sowie die 32-jährige Schwester der Frau,https://www.spiegel.de/netzwelt/netzpolitik/silicon-valley-iranische-ingenieure-sollen-google-geheimnisse-gestohlen-haben-a-5dafb82e-48fc-4ba0-b2b1-79338f6373ad#ref=rss,www.spiegel.de,Silicon Valley: Iranische Ingenieure sollen Google-Geheimnisse gestohlen haben - DER SPIEGEL,0,LOW,False,,,mainstream,2026-02-20T13:05:15.583116
"Die Frage beim angestrebten Bürgerentscheid soll nach Angaben der Brauerei lauten: »Bist du dafür, dass die Landeshauptstadt München ab 2027 auch den Ausschank von Bier der Brauerei Giesinger Bräu auf dem Münchner Oktoberfest erlaubt",https://www.spiegel.de/wirtschaft/unternehmen/oktoberfest-brauerei-startet-buergerbegehren-um-auf-die-wiesn-zu-kommen-a-0ff4ba40-ef5a-40ee-9a27-7d69c37efd8c#ref=rss,www.spiegel.de,"Oktoberfest: Brauerei startet Bürgerbegehren, um auf die Wiesn zu kommen - DER SPIEGEL",0,LOW,False,,,mainstream,2026-02-20T13:05:16.738107
Das Quiz besteht immer aus sieben Fragen,https://www.spiegel.de/games/taegliches-quiz-beim-spiegel-7-fragen-zum-allgemeinwissen-pro-tag-a-8a9692b2-4462-4192-942c-fd7809c7519c#ref=rss,www.spiegel.de,Quiz des Tages beim SPIEGEL: 7 Fragen zum Allgemeinwissen pro Tag - DER SPIEGEL,0.1,LOW,False,,,mainstream,2026-02-20T13:05:17.946498
"Zum Login SPIEGEL plus Nur für Neukunden € 1,– für 4 Wochen danach € 5,99 pro Woche Freier Zugriff auf alle S+-Artikel auf SPIEGEL",https://www.spiegel.de/psychologie/enttaeuschungen-ueberwinden-so-finden-sie-die-richtigen-worte-fuer-ihre-gefuehle-coaching-a-5fcbbde2-c700-479c-867f-d5245300d04f#ref=rss,www.spiegel.de,Enttäuschungen überwinden: So finden Sie die richtigen Worte für Ihre Gefühle (Coaching) - DER SPIEG,0.1,LOW,False,,,mainstream,2026-02-20T13:05:19.079644
"E-Paper (PDF), Digital-Archiv und S+-Newsletter Jederzeit kündigen Jetzt abonnieren SPIEGEL plus 52 Wochen 25 % sparen € 4,49 pro Woche für 52 Wochen danach € 5,99 pro Woche Freier Zugriff auf alle S+-Artikel auf SPIEGEL",https://www.spiegel.de/psychologie/enttaeuschungen-ueberwinden-so-finden-sie-die-richtigen-worte-fuer-ihre-gefuehle-coaching-a-5fcbbde2-c700-479c-867f-d5245300d04f#ref=rss,www.spiegel.de,Enttäuschungen überwinden: So finden Sie die richtigen Worte für Ihre Gefühle (Coaching) - DER SPIEG,0.1,LOW,False,,,mainstream,2026-02-20T13:05:19.279925
"Zum Login SPIEGEL plus Nur für Neukunden € 1,– für 4 Wochen danach € 5,99 pro Woche Freier Zugriff auf alle S+-Artikel auf SPIEGEL",https://www.spiegel.de/kultur/kino/berlinale-filme-where-to-und-chronicles-from-the-siege-wenn-kino-mehr-kann-als-offene-briefe-a-8f7b9600-55c2-49da-9232-13b30b8e993c#ref=rss,www.spiegel.de,Berlinale-Filme »Where to?« und »Chronicles from the Siege«: Wenn Kino mehr kann als offene Briefe -,0.1,LOW,False,,,mainstream,2026-02-20T13:05:20.425892
"E-Paper (PDF), Digital-Archiv und S+-Newsletter Jederzeit kündigen Jetzt abonnieren SPIEGEL plus 52 Wochen 25 % sparen € 4,49 pro Woche für 52 Wochen danach € 5,99 pro Woche Freier Zugriff auf alle S+-Artikel auf SPIEGEL",https://www.spiegel.de/kultur/kino/berlinale-filme-where-to-und-chronicles-from-the-siege-wenn-kino-mehr-kann-als-offene-briefe-a-8f7b9600-55c2-49da-9232-13b30b8e993c#ref=rss,www.spiegel.de,Berlinale-Filme »Where to?« und »Chronicles from the Siege«: Wenn Kino mehr kann als offene Briefe -,0.1,LOW,False,,,mainstream,2026-02-20T13:05:20.631904
Die Schaubühne Berlin hat den Vorgang auf SPIEGEL-Anfrage bestätigt,https://www.spiegel.de/kultur/berliner-schaubuehne-lars-eidinger-verletzt-theaterzuschauerin-versehentlich-mit-degen-a-14762275-9af4-4e60-88e6-015507ac2014#ref=rss,www.spiegel.de,Berliner Schaubühne: Lars Eidinger verletzt Theaterzuschauerin versehentlich mit Degen - DER SPIEGEL,0,LOW,False,,,mainstream,2026-02-20T13:05:22.055187
"‹ zutiefst und stehen noch immer unter Schock«, heißt es von dem Theater",https://www.spiegel.de/kultur/berliner-schaubuehne-lars-eidinger-verletzt-theaterzuschauerin-versehentlich-mit-degen-a-14762275-9af4-4e60-88e6-015507ac2014#ref=rss,www.spiegel.de,Berliner Schaubühne: Lars Eidinger verletzt Theaterzuschauerin versehentlich mit Degen - DER SPIEGEL,0.15,LOW,False,,,mainstream,2026-02-20T13:05:22.261941
Eidinger war laut dem Bericht »si,https://www.spiegel.de/kultur/berliner-schaubuehne-lars-eidinger-verletzt-theaterzuschauerin-versehentlich-mit-degen-a-14762275-9af4-4e60-88e6-015507ac2014#ref=rss,www.spiegel.de,Berliner Schaubühne: Lars Eidinger verletzt Theaterzuschauerin versehentlich mit Degen - DER SPIEGEL,0,LOW,False,,,mainstream,2026-02-20T13:05:22.345145
Laut DW war der Journalist am Donnerstag vor den Augen seiner Familie von etwa 30 Polizisten in Ankara festgenommen und abgeführt worden,https://www.spiegel.de/ausland/tuerkei-staatsanwaltschaft-verhoert-deutsche-welle-korrespondenten-alican-uludag-a-b506c445-1933-4a57-b8c1-7ba615e97ea8#ref=rss,www.spiegel.de,Türkei: Gericht erlässt Haftbefehl gegen Korrespondenten der Deutschen Welle - DER SPIEGEL,0,LOW,False,,,mainstream,2026-02-20T13:05:23.350274
« Vorgeworfen werden Uludağ laut DW neben Präsidentenbeleidigung auch die »V,https://www.spiegel.de/ausland/tuerkei-staatsanwaltschaft-verhoert-deutsche-welle-korrespondenten-alican-uludag-a-b506c445-1933-4a57-b8c1-7ba615e97ea8#ref=rss,www.spiegel.de,Türkei: Gericht erlässt Haftbefehl gegen Korrespondenten der Deutschen Welle - DER SPIEGEL,0,LOW,False,,,mainstream,2026-02-20T13:05:23.548911
"Das ZDF hatte auf Anfrage erst mitgeteilt, dass zwar tatsächlich KI-generierte Bilder verwendet worden seien – aber lediglich eine laut internen KI-Regeln vorgeschriebene Kennzeichnung sei unterblieben, aus technischen Gründen",https://www.spiegel.de/kultur/zdf-beruft-nach-ki-panne-new-york-korrespondentin-nicola-albrecht-ab-a-91bc26c1-6fd5-4be4-a8a0-b17828c7978e#ref=rss,www.spiegel.de,ZDF beruft nach KI-Affäre New-York-Korrespondentin Nicola Albrecht ab - DER SPIEGEL,0,LOW,False,,,mainstream,2026-02-20T13:05:24.756619
"Diese Anpassungsfähigkeit erschwert es Menschen laut einer Studie, die Tiere zu vertreiben",https://www.spiegel.de/wissenschaft/natur/woelfe-koennen-sich-an-menschen-gewoehnen-wenn-es-sich-lohnt-a-62c68890-c5f3-4578-9d10-76f0341c3a1c#ref=rss,www.spiegel.de,Wölfe können sich an Menschen gewöhnen – wenn es sich lohnt - DER SPIEGEL,0,LOW,False,,,mainstream,2026-02-20T13:05:25.908720
Das Verwaltungsgericht Schleswig bestätigte die Sicht der Behörden nun und sah keinen Anspruch auf Wohngeld,https://www.spiegel.de/panorama/bildung/schleswig-langzeitstudent-will-weiter-wohngeld-und-scheitert-vor-gericht-a-f0c76a73-e705-4b81-93a4-20f7f00cccfb#ref=rss,www.spiegel.de,Schleswig: Langzeitstudent will weiter Wohngeld und scheitert vor Gericht - DER SPIEGEL,0.1,LOW,False,,,mainstream,2026-02-20T13:05:29.084631
"Der Langzeitstudent klagte dagegen, das Gericht bestätigte das Vorgehen – so wie nun auch in Schleswig",https://www.spiegel.de/panorama/bildung/schleswig-langzeitstudent-will-weiter-wohngeld-und-scheitert-vor-gericht-a-f0c76a73-e705-4b81-93a4-20f7f00cccfb#ref=rss,www.spiegel.de,Schleswig: Langzeitstudent will weiter Wohngeld und scheitert vor Gericht - DER SPIEGEL,0,LOW,False,,,mainstream,2026-02-20T13:05:29.289780
"8% increase in January was the strongest monthly growth since May 2024, figures from the Office for National Statistics (ONS) show, and much higher than the 0",https://www.bbc.com/news/articles/c78x7jwjg4no?at_medium=RSS&amp;at_campaign=rss,www.bbc.com,New Year&#x27;s sport supplement buying adds to January retail sales surge,0,LOW,False,,,mainstream,2026-02-20T13:05:30.834352
2% predicted by some economists,https://www.bbc.com/news/articles/c78x7jwjg4no?at_medium=RSS&amp;at_campaign=rss,www.bbc.com,New Year&#x27;s sport supplement buying adds to January retail sales surge,0,LOW,False,,,mainstream,2026-02-20T13:05:31.043008
"1% in the three months to January, compared with the three months to October 2025",https://www.bbc.com/news/articles/c78x7jwjg4no?at_medium=RSS&amp;at_campaign=rss,www.bbc.com,New Year&#x27;s sport supplement buying adds to January retail sales surge,0,LOW,False,,,mainstream,2026-02-20T13:05:31.244471
"Military experts believe our analysis might represent 45-65% of the total, putting the potential number of Russian deaths at between 286,000 and 413",https://www.bbc.com/news/articles/ce8n4l8elpgo?at_medium=RSS&amp;at_campaign=rss,www.bbc.com,Russia-Ukraine war: How one Russian village lost its fighting-age men to conflict,0,LOW,False,,,mainstream,2026-02-20T13:05:32.655038
