claim,source_url,source_domain,article_title,risk_score,risk_category,has_factcheck,factcheck_rating,factcheck_source,source_type,checked_at
&quot;Eine der Forderungen war die Einführung einer Identitätspflicht für alle Anbieter auf Online-Plattformen sowie eine verpflichtende Zertifizierung der Verkaufsportale,https://www.n-tv.de/regionales/rheinland-pfalz-und-saarland/Tollwut-Virus-bei-totem-Hund-Ermittlungen-laufen-id30376696.html,n-tv.de,Rheinland-Pfalz &amp; Saarland: Tollwut-Virus bei totem Hund – Ermittlungen laufen - ntv.de,0.1,LOW,False,,,unknown,2026-02-18T13:09:34.466214
"Wie der aktuelle Stand außerhalb des Zuständigkeitsgebiets sei, darüber habe man keine Kenntnis",https://www.n-tv.de/regionales/rheinland-pfalz-und-saarland/Tollwut-Virus-bei-totem-Hund-Ermittlungen-laufen-id30376696.html,n-tv.de,Rheinland-Pfalz &amp; Saarland: Tollwut-Virus bei totem Hund – Ermittlungen laufen - ntv.de,0.1,LOW,False,,,unknown,2026-02-18T13:09:34.579498
Die für die Überführung erforderlichen Papiere – laut denen der Hund g,https://www.n-tv.de/regionales/rheinland-pfalz-und-saarland/Tollwut-Virus-bei-totem-Hund-Ermittlungen-laufen-id30376696.html,n-tv.de,Rheinland-Pfalz &amp; Saarland: Tollwut-Virus bei totem Hund – Ermittlungen laufen - ntv.de,0,LOW,False,,,unknown,2026-02-18T13:09:34.704909
Immer wieder sterben Konsumenten – und die Dunkelziffer ist hoch,http://www.op-online.de/deutschland/drogen-phaenomen-mit-fake-arnzei-bedrohlicher-als-die-mafia-zr-94175251.html,op-online.de,Drogen-Phänomen mit Fake-Arnzei „bedrohlicher als die Mafia“,0.1,LOW,False,,,unknown,2026-02-18T13:09:37.493804
Immer wieder sterben Konsumenten an Überdosen,http://www.op-online.de/deutschland/drogen-phaenomen-mit-fake-arnzei-bedrohlicher-als-die-mafia-zr-94175251.html,op-online.de,Drogen-Phänomen mit Fake-Arnzei „bedrohlicher als die Mafia“,0.1,LOW,False,,,unknown,2026-02-18T13:09:37.605527
Dabei geht es vor allem um sogenannte synthetische Opioide und immer neue hochpotente Designer-Drogen wie Cychlorphin,http://www.op-online.de/deutschland/drogen-phaenomen-mit-fake-arnzei-bedrohlicher-als-die-mafia-zr-94175251.html,op-online.de,Drogen-Phänomen mit Fake-Arnzei „bedrohlicher als die Mafia“,0.1,LOW,False,,,unknown,2026-02-18T13:09:37.722156
Für mich bedeutet das einen Schaden von 2000 Euro,http://www.wa.de/hamm/hammer-immobilienverwaltung-zweigt-auch-versicherungsbeitraege-ab-94174287.html,wa.de,Hammer Immobilienverwaltung zweigt auch Versicherungsbeiträge ab,0,LOW,False,,,unknown,2026-02-18T13:09:38.698233
Immer mehr Fälle von potenziell geschädigten Eigentümern wurden bekannt,http://www.wa.de/hamm/hammer-immobilienverwaltung-zweigt-auch-versicherungsbeitraege-ab-94174287.html,wa.de,Hammer Immobilienverwaltung zweigt auch Versicherungsbeiträge ab,0.1,LOW,False,,,unknown,2026-02-18T13:09:38.809991
Zwar blieb der Saal mit der «Mona Lisa» laut France 24 unversehrt,https://www.watson.ch/international/frankreich/746605491-louvre-in-der-krise-juwelenraub-und-millionenbetrug-durch-mitarbeiter,watson.ch,Louvre in der Krise: Juwelenraub und Millionenbetrug durch Mitarbeiter,0,LOW,False,,,unknown,2026-02-18T13:09:40.839981
Er treibt ein spektakuläres Renovierungsprogramm in der Höhe von 820 Millionen Euro voran,https://www.watson.ch/international/frankreich/746605491-louvre-in-der-krise-juwelenraub-und-millionenbetrug-durch-mitarbeiter,watson.ch,Louvre in der Krise: Juwelenraub und Millionenbetrug durch Mitarbeiter,0,LOW,False,,,unknown,2026-02-18T13:09:40.950607
"Menschen, die vor Beginn des Online-Zeitalters geboren wurden, die also keine digitalen Eingeborenen (Digital Natives),sondern Digital Zuagroaste aus einer analogen Zeit sind, fühlen sich mitunter verloren in der Parallelwelt des Webs",https://kurier.at/chronik/burgenland/digitale-kompetenz-senioren-online-betrug-schutz/403132435,kurier.at,Schützen und unterstützen wir die Älteren &#x7C; Kurier,0.1,LOW,False,,,unknown,2026-02-18T13:09:41.256984
"Burgenland: Falsche Heizungsinstallateure bestahlen 84-Jährigen Unlängst hieß es, ältere Menschen müssten sich keine Sorgen machen, man könne die ID-Austria auch weiterhin offline beantragen",https://kurier.at/chronik/burgenland/digitale-kompetenz-senioren-online-betrug-schutz/403132435,kurier.at,Schützen und unterstützen wir die Älteren &#x7C; Kurier,0.1,LOW,False,,,unknown,2026-02-18T13:09:41.365030
"Rehe, Dachse oder Hasen: Sie alle leben bei uns in Ostholstein",https://www.ln-online.de/lokales/ostholstein/das-sind-die-neuigkeiten-aus-ostholstein-fuer-den-18-februar-2026-M2MAJCDAMNHNPGURDQX4K4QLXE.html,ln-online.de,Das sind die Neuigkeiten aus Ostholstein für den 18. Februar 2026,0.1,LOW,False,,,unknown,2026-02-18T13:09:41.943683
Jetzt anmelden Kostenlos registrieren Copyright-Hinweis öffnen/schließen &copy; Jürg ChristandlExhumierungen haben immer wieder zu Ermittlungserfolgen geführt,https://kurier.at/chronik/niederoesterreich/pflegerin-unter-mordverdacht-gruft-jahrelang-von-wasser-geflutet/403132423,kurier.at,Pflegerin unter Mordverdacht: Gruft jahrelang von Wasser geflutet &#x7C; Kurier,0.1,LOW,False,,,unknown,2026-02-18T13:09:42.135417
"""Weil sie ihm die versprochene Gage für seine Hilfe angeblich nie bezahlt hat“, heißt es aus Ermittlerkreisen",https://kurier.at/chronik/niederoesterreich/pflegerin-unter-mordverdacht-gruft-jahrelang-von-wasser-geflutet/403132423,kurier.at,Pflegerin unter Mordverdacht: Gruft jahrelang von Wasser geflutet &#x7C; Kurier,0.1,LOW,False,,,unknown,2026-02-18T13:09:42.242429
"Das Unternehmen aus Aachen ist auf die Produktion von Fahrzeuglampen spezialisiert, stellte zuletzt im November eine LED-Lampe vor, die für „eine um bis zu 450 Prozent höhere Leuchtkraft“ sorgen soll",http://www.merkur.de/wirtschaft/not-insolvenz-deutsche-tochter-von-us-skandalkonzern-in-grosser-94173582.html,merkur.de,Insolvenz: Deutsche Tochter von US-Skandalkonzern zahlungsunfähig,0,LOW,False,,,unknown,2026-02-18T13:09:43.714182
"Das Unternehmen aus Aachen ist auf die Produktion von Fahrzeuglampen spezialisiert, stellte zuletzt im November eine LED-Lampe vor, die für „eine um bis zu 450 Prozent höhere Leuchtkraft“ sorgen soll",https://www.hna.de/wirtschaft/not-insolvenz-deutsche-tochter-von-us-skandalkonzern-in-grosser-94173592.html,hna.de,Insolvenz: Deutsche Tochter von US-Skandalkonzern zahlungsunfähig,0,LOW,False,,,unknown,2026-02-18T13:09:44.726084
"die Mail wirkt auf den ersten Blick offiziell: Logos von Innenministerium, Landespolizeidirektion und Europol sollen Seriosität vortäuschen",https://www.heute.at/s/fake-mails-im-umlauf-polizei-droht-mit-haftbefehl-120162991,heute.at,"Heftige Vorwürfe – Fake-Mails im Umlauf – ""Polizei"" droht mit Haftbefehl | Heute.at",0,LOW,False,,,unknown,2026-02-18T13:09:45.558642
"Damals hieß es in der offiziellen Info: ""Dieser Brief ist gefälscht",https://www.heute.at/s/fake-mails-im-umlauf-polizei-droht-mit-haftbefehl-120162991,heute.at,"Heftige Vorwürfe – Fake-Mails im Umlauf – ""Polizei"" droht mit Haftbefehl | Heute.at",0,LOW,False,,,unknown,2026-02-18T13:09:45.667698
"Wichtig: nicht antworten, keine Daten schicken, nichts anklicken",https://www.heute.at/s/fake-mails-im-umlauf-polizei-droht-mit-haftbefehl-120162991,heute.at,"Heftige Vorwürfe – Fake-Mails im Umlauf – ""Polizei"" droht mit Haftbefehl | Heute.at",0.1,LOW,False,,,unknown,2026-02-18T13:09:45.777769
"&nbsp; Eishockey im TV--> Shows im TV Tatort im TV UEFA Champions- &Europa-League im TV--> clear Alle TV-Themen im Überblick Sender Mi, 18",https://www.tele.at/sendungsdetails/22071025/auf-streife.html,tele.at,"&quot;Auf Streife&quot; - Unterhaltung - Doku-Soap, Puls 4, 18.02.2026, 04:00 Uhr - Sendung im TV-Pr",0.1,LOW,False,,,unknown,2026-02-18T13:09:50.554479
"Nicht alle sind echt, aber doch sehr viele",https://www.bild.de/politik/inland/falsche-bilder-im-heute-journal-des-zdf-anne-gellinek-entschuldigt-sich-6994bb626e842744e5c58baf,bild.de,Falsche Bilder im „heute journal“ des ZDF: Anne Gellinek entschuldigt sich | Politik | BILD.de,0.1,LOW,False,,,unknown,2026-02-18T13:09:51.113035
Im Verlauf üben die Kriminellen dabei immer mehr Druck auf ihre Opfer aus,http://www.op-online.de/hessen/falscher-polizist-ergaunert-vermoegen-per-telefon-seniorin-ueberweist-115-000-euro-94174973.html,op-online.de,Falscher Polizist ergaunert Vermögen per Telefon – Seniorin überweist 115.000 Euro,0.1,LOW,False,,,unknown,2026-02-18T13:09:51.930071
Der Verfassungsschutz betreibt nach Angaben des Brandenburger Innenministeriums insgesamt 287 Accounts auf entsprechenden Plattformen als Mittel der Informationsbeschaffung,https://www.n-tv.de/regionales/berlin-und-brandenburg/AfD-will-Fake-Accounts-des-Verfassungsschutzes-stoppen-id30374195.html,n-tv.de,Berlin &amp; Brandenburg: AfD will &quot;Fake-Accounts&quot; des Verfassungsschutzes stoppen - ntv.d,0,LOW,False,,,unknown,2026-02-18T13:09:54.223750
Der Verfassungsschutz betreibt nach Angaben des Brandenburger Innenministeriums insgesamt 287 Accounts auf entsprechenden Plattformen als Mittel der Informationsbeschaffung,https://www.stern.de/gesellschaft/regional/berlin-brandenburg/nachrichtendienst--afd-will--fake-accounts--des-verfassungsschutzes-stoppen-37146284.html,stern.de,Nachrichtendienst: AfD will &quot;Fake-Accounts&quot; des Verfassungsschutzes stoppen | STERN.de,0,LOW,False,,,unknown,2026-02-18T13:09:55.185516
Illusion der Mehrheit als psychologische Waffe Die Gefahr liegt laut den Wissenschaftlern weniger in einzelnen Falschmeldungen als in der schleichenden Verschiebung gesellschaftlicher Normen durch einen „künstlichen Konsens“,https://www.heise.de/news/Angriff-der-KI-Schwaerme-Wie-simulierte-Mehrheiten-die-Demokratie-bedrohen-11180217.html,heise.de,Neue Eskalationsstufe: KI-Schwärme bedrohen demokratischen Diskurs | heise online,0,LOW,False,,,unknown,2026-02-18T13:09:55.995406
"Dieser falsche Eindruck, dass „ja jeder das sage“, beeinflusse Überzeugungen massiv",https://www.heise.de/news/Angriff-der-KI-Schwaerme-Wie-simulierte-Mehrheiten-die-Demokratie-bedrohen-11180217.html,heise.de,Neue Eskalationsstufe: KI-Schwärme bedrohen demokratischen Diskurs | heise online,0,LOW,False,,,unknown,2026-02-18T13:09:56.103636
Zur Unfallursache sowie zu möglichen Verletzten können derzeit keine Angaben gemacht werden,https://www.niederlausitz-aktuell.de/niederlausitz-aktuell/orte/cottbus/309922/verkehrsunfall-in-cottbus-saspow-auto-gegen-baum-geprallt.html,niederlausitz-aktuell.de,Verkehrsunfall in Cottbus-Saspow. Auto gegen Baum geprallt | NIEDERLAUSITZ aktuell,0.1,LOW,False,,,unknown,2026-02-18T13:09:56.448476
000 Euro an den beiden weiter fahrbereiten Fahrzeugen zur Folge hatte,https://www.niederlausitz-aktuell.de/niederlausitz-aktuell/orte/cottbus/309922/verkehrsunfall-in-cottbus-saspow-auto-gegen-baum-geprallt.html,niederlausitz-aktuell.de,Verkehrsunfall in Cottbus-Saspow. Auto gegen Baum geprallt | NIEDERLAUSITZ aktuell,0,LOW,False,,,unknown,2026-02-18T13:09:56.562326
000 Euro an den weiter betriebsbereiten Fahrzeugen,https://www.niederlausitz-aktuell.de/niederlausitz-aktuell/orte/cottbus/309922/verkehrsunfall-in-cottbus-saspow-auto-gegen-baum-geprallt.html,niederlausitz-aktuell.de,Verkehrsunfall in Cottbus-Saspow. Auto gegen Baum geprallt | NIEDERLAUSITZ aktuell,0,LOW,False,,,unknown,2026-02-18T13:09:56.671198
"Thema war die Frage, ob die AfD verboten werden soll, es gab „Zeugen“ und eine „Jury“ &#8211; das „Urteil“ lautete nach dem „Prozess“ laut Theater: „Am Ende der dreit&#228;tigen (sic",https://www.nachdenkseiten.de/?p=146416,nachdenkseiten.de,„Wir reden hier über das Ende der Demokratie“: Harald Martensteins Rede beim „Prozess gegen Deutschl,0,LOW,False,,,unknown,2026-02-18T13:09:57.825121
"Zudem sprach sich die Jury daf&#252;r aus, die AfD von jeder staatlichen Finanzierung auszuschlie&#223;en",https://www.nachdenkseiten.de/?p=146416,nachdenkseiten.de,„Wir reden hier über das Ende der Demokratie“: Harald Martensteins Rede beim „Prozess gegen Deutschl,0,LOW,False,,,unknown,2026-02-18T13:09:57.933255
Die Meinung gro&#223;er und immer noch wachsender Teile der Bev&#246;lkerung soll f&#252;r die Politik in Zukunft keine Rolle mehr spielen,https://www.nachdenkseiten.de/?p=146416,nachdenkseiten.de,„Wir reden hier über das Ende der Demokratie“: Harald Martensteins Rede beim „Prozess gegen Deutschl,0.1,LOW,False,,,unknown,2026-02-18T13:09:58.042699
"In jeder Folge treten zwei politische Schwergewichte aus der gesamten EU gegeneinander an, um unterschiedliche Meinungen zu vertreten und Diskussionen über die wichtigsten Themen der EU-Politik anzuregen",https://de.euronews.com/2026/02/17/belarus-taliba-minsk-kabul,de.euronews.com,Annäherung trotz Isolation: Belarus sucht Kontakt zur Taliban-Regierung | Euronews,0,LOW,False,,,unknown,2026-02-18T13:09:58.244821
"--> As a subscriber, you are shown 80% less display advertising when reading our articles",https://www.eveningnews24.co.uk/news/25864913.men-charged-car-stolen-norwich-found-scole/,eveningnews24.co.uk,Men charged after car stolen from Norwich found in Scole | Norwich Evening News,0,LOW,False,,,unknown,2026-02-18T13:09:59.732387
[DEBUNKED] Warum Schnee auf der Akropolis kein Beleg gegen den Klimawandel ist,https://correctiv.org/faktencheck/2026/02/18/video-von-schnee-akropolis-athen-griechenland-ist-alt-und-kein-beweis-gegen-klimawandel/,correctiv.org,Warum Schnee auf der Akropolis kein Beleg gegen den Klimawandel ist,0.9,HIGH,True,FALSE - Debunked by fact-checkers,correctiv.org,factcheck,2026-02-18T13:10:14.717190
[DEBUNKED] Keine Behandlung wegen Trump-Kappe? Arzt-Video ist ein Sketch - correctiv.org,https://correctiv.org/faktencheck/aus-der-community/2026/02/17/keine-behandlung-wegen-trump-kappe-arzt-video-ist-ein-sketch/,correctiv.org,Keine Behandlung wegen Trump-Kappe? Arzt-Video ist ein Sketch - correctiv.org,0.9,HIGH,True,FALSE - Debunked by fact-checkers,correctiv.org,factcheck,2026-02-18T13:10:15.430620
[DEBUNKED] Kein Epstein-Leak: Foto mit Friedrich Merz ist gefälscht,https://correctiv.org/faktencheck/2026/02/17/bild-von-friedrich-merz-und-jeffrey-epstein-ist-gefaelscht/,correctiv.org,Kein Epstein-Leak: Foto mit Friedrich Merz ist gefälscht,0.9,HIGH,True,FALSE - Debunked by fact-checkers,correctiv.org,factcheck,2026-02-18T13:10:16.276871
[DEBUNKED] Wie die Politik Leistungsberechtigte zum Problem erklärt,https://correctiv.org/faktencheck/hintergrund/2025/09/30/wie-die-politik-leistungsberechtigte-zum-problem-erklaert/,correctiv.org,Wie die Politik Leistungsberechtigte zum Problem erklärt,0.9,HIGH,True,FALSE - Debunked by fact-checkers,correctiv.org,factcheck,2026-02-18T13:10:17.105056
[DEBUNKED] Kernkraftwerke der vierten Generation machen Endlager nicht überflüssig,https://correctiv.org/faktencheck/2026/02/17/kernkraftwerke-der-vierten-generation-machen-endlager-nicht-ueberfluessig/,correctiv.org,Kernkraftwerke der vierten Generation machen Endlager nicht überflüssig,0.9,HIGH,True,FALSE - Debunked by fact-checkers,correctiv.org,factcheck,2026-02-18T13:10:17.950910
"Fast vier Jahre später erreicht der deutsche Ableger von Russia Today, RT DE, über Spiegelseiten noch immer Millionen Aufrufe",https://correctiv.org/faktencheck/hintergrund/2026/02/16/eu-sanktionen-inhalte-von-rt-de-erreichen-immer-noch-millionen-aufrufe/,correctiv.org,EU-Sanktionen: Inhalte von RT DE erreichen weiterhin Millionen,0.1,LOW,False,,,factcheck,2026-02-18T13:10:18.887558
"Einige sehen die Presse&#8211; und Meinungsfreiheit bedroht, andere kritisieren allgemein, dass technische Lösungen wie Sanktionen keine Probleme wie Propaganda oder Desinformationskampagnen lösen könnten",https://correctiv.org/faktencheck/hintergrund/2026/02/16/eu-sanktionen-inhalte-von-rt-de-erreichen-immer-noch-millionen-aufrufe/,correctiv.org,EU-Sanktionen: Inhalte von RT DE erreichen weiterhin Millionen,0.1,LOW,False,,,factcheck,2026-02-18T13:10:19.067449
Nach einer Polizeirazzia in einem Zürcher Rückkehrzentrum erhält ein Mann einen Strafbefehl wegen rechtswidrigen Aufenthalts – obwohl er das Land laut Dublin-Verordnung gar nicht verlassen darf,https://correctiv.org/zwischen-gefaengnis-und-nothilfe/2026/02/16/geh-aber-bleib/,correctiv.org,Weder ausreisen noch bleiben ist erlaubt - correctiv.org,0,LOW,False,,,factcheck,2026-02-18T13:10:19.781415
Im Fall von Italien tritt dieses Szenario derzeit immer ein,https://correctiv.org/zwischen-gefaengnis-und-nothilfe/2026/02/16/geh-aber-bleib/,correctiv.org,Weder ausreisen noch bleiben ist erlaubt - correctiv.org,0.1,LOW,False,,,factcheck,2026-02-18T13:10:19.889601
"Die Regierung von Giorgia Meloni hat 2022 beschlossen, „wegen der grossen Zahl an Anlandungen“ keine sogenannten Dublinfälle – also asylsuchende Personen, für die das Land gemäss Dublinabkommen zuständig wäre – mehr zurückzunehmen",https://correctiv.org/zwischen-gefaengnis-und-nothilfe/2026/02/16/geh-aber-bleib/,correctiv.org,Weder ausreisen noch bleiben ist erlaubt - correctiv.org,0.1,LOW,False,,,factcheck,2026-02-18T13:10:19.999660
"Er wurde als Geheimdienstmitarbeiter enttarnt und dann ganz offiziell zum Sicherheitsrisiko erklärt: Im Dezember 2024 belegte ihn die EU mit Sanktionen, weil er seine „destabilisierenden Aktivitäten“ im Auftrag der russischen Regierung ausübte",https://correctiv.org/aktuelles/russland-ukraine-2/2026/02/16/ein-russischer-agent-in-deutschland-und-der-glycerin-handel-russland-gru-sanktionen/,correctiv.org,Ein russischer Agent in Deutschland und der Glycerin-Handel,0.05,LOW,False,,,factcheck,2026-02-18T13:10:20.938163
"Auch das Land Bayern soll laut dem Dokument eine Summe eingezahlt haben, ebenso die Robert-Bosch-Stiftung und der Energieriese EnBW",https://correctiv.org/aktuelles/sicherheit-und-verteidigung/2026/02/13/millionen-aus-katar-wer-finanziert-die-muenchner-sicherheitskonferenz-msc-munich-security-conference/,correctiv.org,Millionen aus Katar: Wer finanziert die Sicherheitskonferenz? - correctiv.org,0,LOW,False,,,factcheck,2026-02-18T13:10:21.748235
Februar 2026 Hier sehen Sie noch einmal alle Cartoons dieser Woche,https://correctiv.org/aktuelles/politik-2/2026/02/13/cartoon-arena-sind-die-deutschen-zu-faul/,correctiv.org,Cartoon-Arena: Sind die Deutschen zu faul? - correctiv.org,0.1,LOW,False,,,factcheck,2026-02-18T13:10:22.459831
90 12051 Berlin Fax: +49 (0) 30 – 555 780 2 20 Büro Berlin Singerstraße 109 10179 Berlin Buchladen Essen Akazienallee 10 45127 Essen Online-Shop Jugendredaktion Salon5 Alle Standorte CORRECTIV,https://correctiv.org/aktuelles/politik-2/2026/02/13/cartoon-arena-sind-die-deutschen-zu-faul/,correctiv.org,Cartoon-Arena: Sind die Deutschen zu faul? - correctiv.org,0.1,LOW,False,,,factcheck,2026-02-18T13:10:22.569855
[DEBUNKED] Rote-Bete-Kapseln: Tiktok ignoriert Deepfake-Werbung mit Ärzten,https://correctiv.org/faktencheck/hintergrund/2026/02/13/rote-bete-kapseln-tiktok-ignoriert-deepfake-werbung-mit-aerzten/,correctiv.org,Rote-Bete-Kapseln: Tiktok ignoriert Deepfake-Werbung mit Ärzten,0.9,HIGH,True,FALSE - Debunked by fact-checkers,correctiv.org,factcheck,2026-02-18T13:10:23.898016
[DEBUNKED] Tino Chrupalla: Vorwurf der Vetternwirtschaft auch gegen AfD-Chef,https://correctiv.org/aktuelles/kandidierenden-check/2026/02/12/tino-chrupalla-vetternwirtschaft-afd-weisswasser/,correctiv.org,Tino Chrupalla: Vorwurf der Vetternwirtschaft auch gegen AfD-Chef,0.9,HIGH,True,FALSE - Debunked by fact-checkers,correctiv.org,factcheck,2026-02-18T13:10:26.097183
"Vier Bundesländer sind schon offiziell an Bord, bei vier weiteren steht theoretisch nichts mehr im Weg und mindestens zwei weitere wackeln bereits",https://www.volksverpetzer.de/analyse/afd-verbot-mehrheit-bundesrat/,www.volksverpetzer.de,AfD-Verbot: Für ein Szenario gibt es jetzt bereits eine Bundesrat-Mehrheit - Volksverpetzer,0,LOW,False,,,factcheck,2026-02-18T13:10:37.103887
[DEBUNKED] &quot;Nachdenkseiten&quot; enthüllt vor Gericht die wahren Geldgeber hinter Volksverpetzer! - Volksverpetzer,https://www.volksverpetzer.de/aktuelles/nachdenkseiten-gericht-geldgeber-volksverpetzer/,www.volksverpetzer.de,&quot;Nachdenkseiten&quot; enthüllt vor Gericht die wahren Geldgeber hinter Volksverpetzer! - Volksv,0.9,HIGH,True,FALSE - Debunked by fact-checkers,www.volksverpetzer.de,factcheck,2026-02-18T13:10:41.369016
"Nach einer aktuellen Studie der ARAG war im Jahr 2025 allerdings nur noch gut die Hälfte der Befragten in Deutschland davon überzeugt, dass Gerichte alle Menschen gleich behandeln",https://www.volksverpetzer.de/aktuelles/neutralitaet-ziel-kein-zustand/,www.volksverpetzer.de,Neutralität als Waffe: Wie man zum Schweigen gebracht wird - Volksverpetzer,0.1,LOW,False,,,factcheck,2026-02-18T13:10:45.016375
"Solche Modelle lassen sich prinzipiell auf jede beliebige Person zur Vorhersage von Informationen anwenden, die diese Person nie irgendwo preisgegeben hat",https://www.volksverpetzer.de/aktuelles/ice-personalisierter-werbung/,www.volksverpetzer.de,ICE &amp; KI: Von personalisierter Werbung zur staatlichen Verfolgung - Volksverpetzer,0.1,LOW,False,,,factcheck,2026-02-18T13:10:48.632819
"hereingefallen waren, ist der Absatz von Gasheizungen um über 65 % eingebrochen",https://www.volksverpetzer.de/faktencheck/mythos-gasmangellage/,www.volksverpetzer.de,Sogar Rechte machen jetzt Stimmung gegen Gasheizungen: Mythos &quot;Gasmangellage&quot; - Volksverpe,0.1,LOW,False,,,factcheck,2026-02-18T13:10:51.524118
"Im Neubau ist der Trend noch deutlicher, hier dominiert die Wärmepumpe bei 74 % der Heizungen",https://www.volksverpetzer.de/faktencheck/mythos-gasmangellage/,www.volksverpetzer.de,Sogar Rechte machen jetzt Stimmung gegen Gasheizungen: Mythos &quot;Gasmangellage&quot; - Volksverpe,0.1,LOW,False,,,factcheck,2026-02-18T13:10:51.638239
"330 Studie zeigt, warum BILD TV so peinlich gefloppt ist von Marie-Lena Nelle | Feb",https://www.volksverpetzer.de/aktuelles/studie-bild-tv-gefloppt/,www.volksverpetzer.de,"Studie zeigt, warum BILD TV so peinlich gefloppt ist - Volksverpetzer",0,LOW,False,,,factcheck,2026-02-18T13:10:54.376155
"Dazu der Druck, auch im Urlaub erreichbar zu sein, sowie das Gefühl, dass die Verantwortung immer bei denen landet, die gerade fehlen, selbst wenn sie krank sind",https://www.volksverpetzer.de/aktuelles/studie-bild-tv-gefloppt/,www.volksverpetzer.de,"Studie zeigt, warum BILD TV so peinlich gefloppt ist - Volksverpetzer",0.1,LOW,False,,,factcheck,2026-02-18T13:10:54.486791
Und damit starten wir rein: Es gibt nicht nur immer mehr Prozesse gegen Demokratiefeinde – es gibt auch immer mehr Urteile,https://www.volksverpetzer.de/serie/urteile-januar-2026-schule-nein-zu-afd-praktikum/,www.volksverpetzer.de,Urteile Januar 2026: Schule darf Praktikum bei der AfD ablehnen - Volksverpetzer,0.1,LOW,False,,,factcheck,2026-02-18T13:10:57.774337
&nbsp; Das Oberverwaltungsgericht Berlin-Brandenburg bestätigte nun in seinem Beschluss eine Entscheidung des Verwaltungsgerichts Frankfurt (Oder) und wies die Beschwerde der Schülerin zurück,https://www.volksverpetzer.de/serie/urteile-januar-2026-schule-nein-zu-afd-praktikum/,www.volksverpetzer.de,Urteile Januar 2026: Schule darf Praktikum bei der AfD ablehnen - Volksverpetzer,0,LOW,False,,,factcheck,2026-02-18T13:10:57.900131
[DEBUNKED] False claim that Epstein is alive in Colorado misrepresents 2021 emails about different man | Snopes.com,https://www.snopes.com/fact-check/epstein-colorado-emails/,www.snopes.com,False claim that Epstein is alive in Colorado misrepresents 2021 emails about different man | Snopes,0.9,HIGH,True,FALSE - Debunked by fact-checkers,www.snopes.com,factcheck,2026-02-18T13:10:58.079602
[DEBUNKED] Breaking down claim DOJ released unredacted Epstein files to other countries | Snopes.com,https://www.snopes.com/news/2026/02/17/epstein-files-other-countries/,www.snopes.com,Breaking down claim DOJ released unredacted Epstein files to other countries | Snopes.com,0.9,HIGH,True,FALSE - Debunked by fact-checkers,www.snopes.com,factcheck,2026-02-18T13:10:58.303842
"[DEBUNKED] 19 false or misleading Pam Bondi rumors, investigated | Snopes.com",https://www.snopes.com/collections/pam-bondi-false-misleading-claims/,www.snopes.com,"19 false or misleading Pam Bondi rumors, investigated | Snopes.com",0.9,HIGH,True,FALSE - Debunked by fact-checkers,www.snopes.com,factcheck,2026-02-18T13:10:58.385834
[DEBUNKED] Unpacking claim Netanyahu sent 'torture video' to Epstein while in China | Snopes.com,https://www.snopes.com/news/2026/02/05/video-netanyahu-china-visit-epstein/,www.snopes.com,Unpacking claim Netanyahu sent 'torture video' to Epstein while in China | Snopes.com,0.9,HIGH,True,FALSE - Debunked by fact-checkers,www.snopes.com,factcheck,2026-02-18T13:10:58.536702
[DEBUNKED] Epstein didn't email Netanyahu about 'torture video.' Here's who actually received it | Snopes.com,https://www.snopes.com/fact-check/epstein-torture-email-sultan/,www.snopes.com,Epstein didn't email Netanyahu about 'torture video.' Here's who actually received it | Snopes.com,0.9,HIGH,True,FALSE - Debunked by fact-checkers,www.snopes.com,factcheck,2026-02-18T13:10:58.609422
[DEBUNKED] Family once said Pam Bondi 'stole' dog after Hurricane Katrina. We broke down the details | Snopes.com,https://www.snopes.com/fact-check/bondi-katrina-dog/,www.snopes.com,Family once said Pam Bondi 'stole' dog after Hurricane Katrina. We broke down the details | Snopes.c,0.9,HIGH,True,FALSE - Debunked by fact-checkers,www.snopes.com,factcheck,2026-02-18T13:10:58.706931
"[DEBUNKED] Jesse Watters didn't share post suggesting Epstein victims 'have a good laugh,' despite claims | Snopes.com",https://www.snopes.com/fact-check/jesse-watters-epstein-good-laugh/,www.snopes.com,"Jesse Watters didn't share post suggesting Epstein victims 'have a good laugh,' despite claims | Sno",0.9,HIGH,True,FALSE - Debunked by fact-checkers,www.snopes.com,factcheck,2026-02-18T13:10:58.961846
