claim,source_url,source_domain,article_title,risk_score,risk_category,has_factcheck,factcheck_rating,factcheck_source,source_type,checked_at
[DEBUNKED] „Remigration“: AfD sucht Nähe zu Sellner und US-Hardliner Bovino,https://correctiv.org/aktuelles/neue-rechte/2026/06/01/afd-remigration-summit-sellner-bovino-2026/,correctiv.org,„Remigration“: AfD sucht Nähe zu Sellner und US-Hardliner Bovino,0.9,HIGH,True,FALSE - Debunked by fact-checkers,correctiv.org,factcheck,2026-06-01T21:34:42.333913
[DEBUNKED] Ein unerklärter Krieg: Polen als Testgebiet russischer Operationen,https://correctiv.org/hybride-kriegsfuehrung/2026/05/29/ein-unerklaerter-krieg-polen-als-testgebiet-russischer-operationen-gegen-den-westen/,correctiv.org,Ein unerklärter Krieg: Polen als Testgebiet russischer Operationen,0.9,HIGH,True,FALSE - Debunked by fact-checkers,correctiv.org,factcheck,2026-06-01T21:34:43.032659
[DEBUNKED] Kriegsschiff beschädigt: Erneut Sabotageverdacht bei der Marine,https://correctiv.org/hybride-kriegsfuehrung/2026/05/29/kriegsschiff-beschaedigt-erneut-sabotageverdacht-bei-der-marine/,correctiv.org,Kriegsschiff beschädigt: Erneut Sabotageverdacht bei der Marine,0.9,HIGH,True,FALSE - Debunked by fact-checkers,correctiv.org,factcheck,2026-06-01T21:34:43.638839
[DEBUNKED] Meeresspiegel steigt in Sydney – Fotovergleich sagt nichts aus,https://correctiv.org/faktencheck/2026/05/29/meeresspiegel-steigt-auch-in-sydney-fotovergleich-sagt-nichts-aus/,correctiv.org,Meeresspiegel steigt in Sydney – Fotovergleich sagt nichts aus,0.9,HIGH,True,FALSE - Debunked by fact-checkers,correctiv.org,factcheck,2026-06-01T21:34:44.316133
[DEBUNKED] KI-Stimme von Friedrich Merz verkündet erfundene Mindestlohn-Kürzung,https://correctiv.org/faktencheck/2026/05/29/ki-stimme-von-friedrich-merz-verkuendet-erfundene-mindestlohn-kuerzung-auf-tiktok/,correctiv.org,KI-Stimme von Friedrich Merz verkündet erfundene Mindestlohn-Kürzung,0.9,HIGH,True,FALSE - Debunked by fact-checkers,correctiv.org,factcheck,2026-06-01T21:34:45.010654
"[DEBUNKED] Nein, es gibt keinen 3.500-Hektar-Solarpark bei Cottbus",https://correctiv.org/faktencheck/2026/05/28/cottbus-angeblichen-3500-hektar-solarpark-gibt-es-nicht/,correctiv.org,"Nein, es gibt keinen 3.500-Hektar-Solarpark bei Cottbus",0.9,HIGH,True,FALSE - Debunked by fact-checkers,correctiv.org,factcheck,2026-06-01T21:34:45.614718
"Im Jahr 2025 lag laut UBA der Anteil der Erneuerbaren am Endenergieverbrauch Wärme bei 19,0 Prozent, der Anteil von Holzbrennst",https://correctiv.org/faktencheck/2026/06/01/brennholz-gleich-klimaschutz-was-an-dieser-aussage-von-hubert-aiwanger-dran-ist/,correctiv.org,Brennholz gleich Klimaschutz? Was Aiwangers Aussagen dran ist,0,LOW,False,,,factcheck,2026-06-01T21:34:46.987587
[DEBUNKED] Klimawandel: Warum bisheriges Worst-Case-Szenario inzwischen unplausibel ist,https://correctiv.org/faktencheck/hintergrund/2026/05/28/klimawandel-warum-das-worst-case-szenario-abgeschwaecht-wurde/,correctiv.org,Klimawandel: Warum bisheriges Worst-Case-Szenario inzwischen unplausibel ist,0.9,HIGH,True,FALSE - Debunked by fact-checkers,correctiv.org,factcheck,2026-06-01T21:34:47.690343
[DEBUNKED] Tiktok-Video zu angeblichem Ikea-Vorfall vermischt KI und alte Aufnahmen,https://correctiv.org/faktencheck/aus-der-community/2026/05/28/kein-echter-vorfall-bei-ikea-tiktok-video-ist-mischung-aus-ki-und-alten-aufnahmen/,correctiv.org,Tiktok-Video zu angeblichem Ikea-Vorfall vermischt KI und alte Aufnahmen,0.9,HIGH,True,FALSE - Debunked by fact-checkers,correctiv.org,factcheck,2026-06-01T21:34:48.292925
[DEBUNKED] Illegale Deponie in Gelsenkirchen: „Natürlich sind das giftige Abfälle“ - correctiv.org,https://correctiv.org/umweltverbrechen-in-nrw/2026/05/28/illegale-deponie-in-gelsenkirchen-natuerlich-sind-das-gefaehrliche-abfaelle/,correctiv.org,Illegale Deponie in Gelsenkirchen: „Natürlich sind das giftige Abfälle“ - correctiv.org,0.9,HIGH,True,FALSE - Debunked by fact-checkers,correctiv.org,factcheck,2026-06-01T21:34:48.893205
[DEBUNKED] Care-Arbeitstage ohne Ende? - correctiv.org,https://correctiv.org/aktuelles/politik-2/2026/05/27/care-arbeitstage-ohne-ende/,correctiv.org,Care-Arbeitstage ohne Ende? - correctiv.org,0.9,HIGH,True,FALSE - Debunked by fact-checkers,correctiv.org,factcheck,2026-06-01T21:34:49.494774
Jeder Konferenztag beginnt mit einer gemeinsamen Auftaktveranstaltung,https://correctiv.org/in-eigener-sache/2026/05/26/perfekte-pitches-ki-und-pressefreiheit-in-bewegten-zeiten-ausblick-auf-die-correctiv-lokal-konferenz-2026/,correctiv.org,"Perfekte Pitches, KI und Pressefreiheit in bewegten Zeiten: Ausblick auf die CORRECTIV.Lokal Konfere",0,LOW,False,,,factcheck,2026-06-01T21:34:50.129544
"Erste Programm-Highlights veröffentlicht Die ersten bestätigten Beiträge verbinden investigative Praxis, wissenschaftliche Perspektiven und konkrete Werkzeuge für den Redaktionsalltag",https://correctiv.org/in-eigener-sache/2026/05/26/perfekte-pitches-ki-und-pressefreiheit-in-bewegten-zeiten-ausblick-auf-die-correctiv-lokal-konferenz-2026/,correctiv.org,"Perfekte Pitches, KI und Pressefreiheit in bewegten Zeiten: Ausblick auf die CORRECTIV.Lokal Konfere",0,LOW,False,,,factcheck,2026-06-01T21:34:50.252117
[DEBUNKED] Rechte Cancel-Culture gegen CDU-Broschüre - correctiv.org,https://correctiv.org/aktuelles/neue-rechte/2026/05/26/rechte-cancel-culture-gegen-cdu-broschuere/,correctiv.org,Rechte Cancel-Culture gegen CDU-Broschüre - correctiv.org,0.9,HIGH,True,FALSE - Debunked by fact-checkers,correctiv.org,factcheck,2026-06-01T21:34:50.929558
[DEBUNKED] Keine Hantavirus-Einsatz: Foto zeigt Marineübung im Jahr 2025,https://correctiv.org/faktencheck/2026/05/22/kein-hantavirus-einsatz-foto-zeigt-marineuebung-im-jahr-2025/,correctiv.org,Keine Hantavirus-Einsatz: Foto zeigt Marineübung im Jahr 2025,0.9,HIGH,True,FALSE - Debunked by fact-checkers,correctiv.org,factcheck,2026-06-01T21:34:51.627503
[DEBUNKED] Können &quot;stumme Anrufe&quot; gefährlich sein?,https://www.mimikama.org/stumme-anrufe-gefaehrlich/,www.mimikama.org,Können &quot;stumme Anrufe&quot; gefährlich sein?,0.9,HIGH,True,FALSE - Debunked by fact-checkers,www.mimikama.org,factcheck,2026-06-01T21:34:51.708881
[DEBUNKED] Zecken wegen Lyme-Impfstoff ausgesetzt? Falsche Behauptungen entlarvt!,https://www.mimikama.org/wurden-zecken-wegen-lyme-impfstoff-ausgesetzt/,www.mimikama.org,Zecken wegen Lyme-Impfstoff ausgesetzt? Falsche Behauptungen entlarvt!,0.9,HIGH,True,FALSE - Debunked by fact-checkers,www.mimikama.org,factcheck,2026-06-01T21:34:51.784052
"[DEBUNKED] WhatsApp: Vorsicht vor Fake-Gewinnspielen von Krombacher, adidas!",https://www.mimikama.org/krombacher-adidas-puma-echte-gewinnspiele-via-whatsapp/,www.mimikama.org,"WhatsApp: Vorsicht vor Fake-Gewinnspielen von Krombacher, adidas!",0.9,HIGH,True,FALSE - Debunked by fact-checkers,www.mimikama.org,factcheck,2026-06-01T21:34:51.858578
[DEBUNKED] Ist die Rechnung von &quot;Web Domain Deutschland&quot; echt?,https://www.mimikama.org/rechnung-von-web-domain-deutschland/,www.mimikama.org,Ist die Rechnung von &quot;Web Domain Deutschland&quot; echt?,0.9,HIGH,True,FALSE - Debunked by fact-checkers,www.mimikama.org,factcheck,2026-06-01T21:34:51.963202
[DEBUNKED] Apple-Paten für AirPods: Können sie wirklich Gedanken lesen?,https://www.mimikama.org/koennen-apples-airpods-bald-gedanken-lesen-was-wirklich-hinter-dem-patent-steckt/,www.mimikama.org,Apple-Paten für AirPods: Können sie wirklich Gedanken lesen?,0.9,HIGH,True,FALSE - Debunked by fact-checkers,www.mimikama.org,factcheck,2026-06-01T21:34:52.156492
[DEBUNKED] Kommentarspalten können teuer werden – So schütze dich jetzt!,https://www.mimikama.org/deine-kommentarspalte-kann-zur-kostenfalle-werden/,www.mimikama.org,Kommentarspalten können teuer werden – So schütze dich jetzt!,0.9,HIGH,True,FALSE - Debunked by fact-checkers,www.mimikama.org,factcheck,2026-06-01T21:34:52.241589
[DEBUNKED] Gepanzerte Geldtransporte aus Österreich in die Ukraine? Faktencheck!,https://www.mimikama.org/oesterreich-fahren-regelmaessig-gepanzerte-geldtransporte-in-die-ukraine/,www.mimikama.org,Gepanzerte Geldtransporte aus Österreich in die Ukraine? Faktencheck!,0.9,HIGH,True,FALSE - Debunked by fact-checkers,www.mimikama.org,factcheck,2026-06-01T21:34:52.318892
[DEBUNKED] Pädophilen-Symbole auf Windeln? Faktencheck deckt Fake-News auf,https://www.mimikama.org/paedophilen-symbole-auf-windeln/,www.mimikama.org,Pädophilen-Symbole auf Windeln? Faktencheck deckt Fake-News auf,0.9,HIGH,True,FALSE - Debunked by fact-checkers,www.mimikama.org,factcheck,2026-06-01T21:34:52.418650
[DEBUNKED] Putin ruft Ostdeutsche zum Umsturz? Video entlarvt Fälschung!,https://www.mimikama.org/hat-putin-ostdeutsche-zum-umsturz-aufgerufen/,www.mimikama.org,Putin ruft Ostdeutsche zum Umsturz? Video entlarvt Fälschung!,0.9,HIGH,True,FALSE - Debunked by fact-checkers,www.mimikama.org,factcheck,2026-06-01T21:34:52.496337
[DEBUNKED] Trump-Haarbilder: Echte Fotos oder manipulierte Fälschungen?,https://www.mimikama.org/sind-diese-trump-haarbilder-echt/,www.mimikama.org,Trump-Haarbilder: Echte Fotos oder manipulierte Fälschungen?,0.9,HIGH,True,FALSE - Debunked by fact-checkers,www.mimikama.org,factcheck,2026-06-01T21:34:52.572499
[DEBUNKED] FIFA-WM 2026: Riesiges Betrugsnetz entdeckt?,https://www.mimikama.org/fifa-wm-2026-riesiges-betrugsnetz-entdeckt/,www.mimikama.org,FIFA-WM 2026: Riesiges Betrugsnetz entdeckt?,0.9,HIGH,True,FALSE - Debunked by fact-checkers,www.mimikama.org,factcheck,2026-06-01T21:34:52.642494
[DEBUNKED] Hat Merz die UN-Feindstaatenklausel aktiviert?,https://www.mimikama.org/merz-un-feindstaatenklausel-aktiviert/,www.mimikama.org,Hat Merz die UN-Feindstaatenklausel aktiviert?,0.9,HIGH,True,FALSE - Debunked by fact-checkers,www.mimikama.org,factcheck,2026-06-01T21:34:52.726042
[DEBUNKED] Abzocke mit Mitgefühl: Die Mitleidsmasche,https://www.mimikama.org/abzocke-mit-mitgefuehl-mitleidsmasche/,www.mimikama.org,Abzocke mit Mitgefühl: Die Mitleidsmasche,0.9,HIGH,True,FALSE - Debunked by fact-checkers,www.mimikama.org,factcheck,2026-06-01T21:34:52.815468
[DEBUNKED] Sterben mehr Menschen an der Masernimpfung als an Masern?,https://www.mimikama.org/todesfaelle-masern-impfung/,www.mimikama.org,Sterben mehr Menschen an der Masernimpfung als an Masern?,0.9,HIGH,True,FALSE - Debunked by fact-checkers,www.mimikama.org,factcheck,2026-06-01T21:34:52.890747
[DEBUNKED] Warum Screenshots von Hilferufen problematisch sind,https://www.mimikama.org/alte-hilferuf-screenshots-teilen/,www.mimikama.org,Warum Screenshots von Hilferufen problematisch sind,0.9,HIGH,True,FALSE - Debunked by fact-checkers,www.mimikama.org,factcheck,2026-06-01T21:34:52.973837
"Diesen Monat schauen wir auf eine Millionenspende an die AfD, die die rechtsextreme Partei laut Gericht nicht zurückbekommt",https://www.volksverpetzer.de/serie/urteile-mai-2026-afd-spende/,www.volksverpetzer.de,Urteile Mai 2026: Die AfD spendiert dem Staat unfreiwillig Millionen - Volksverpetzer,0,LOW,False,,,factcheck,2026-06-01T21:34:53.548615
"2,35 Millionen Euro an - vermeintlicher Spender: der Österreicher Gerhard Dingler - ein früherer Regionalpolitiker der FPÖ",https://www.volksverpetzer.de/serie/urteile-mai-2026-afd-spende/,www.volksverpetzer.de,Urteile Mai 2026: Die AfD spendiert dem Staat unfreiwillig Millionen - Volksverpetzer,0,LOW,False,,,factcheck,2026-06-01T21:34:53.631499
"Geldwerte Leistungen, auch Werbemaßnahmen ab einer bestimmten Größenordnung, sind laut Verwaltungsgericht Berlin Spenden",https://www.volksverpetzer.de/serie/urteile-mai-2026-afd-spende/,www.volksverpetzer.de,Urteile Mai 2026: Die AfD spendiert dem Staat unfreiwillig Millionen - Volksverpetzer,0,LOW,False,,,factcheck,2026-06-01T21:34:53.712578
"Man sieht, dass bis auf den letzten Stuhl alle Plätze belegt sind",https://www.volksverpetzer.de/aktuelles/lohnt-kaempfen-merz-keine-antwort/,www.volksverpetzer.de,Wofür lohnt es sich zu kämpfen? Warum Merz keine Antwort auf diese Frage hat - Volksverpetzer,0.1,LOW,False,,,factcheck,2026-06-01T21:34:54.290885
Er räumt Ängste und Vorwürfe aus und geht sachlich auf alle Entgegnungen ein,https://www.volksverpetzer.de/aktuelles/lohnt-kaempfen-merz-keine-antwort/,www.volksverpetzer.de,Wofür lohnt es sich zu kämpfen? Warum Merz keine Antwort auf diese Frage hat - Volksverpetzer,0.1,LOW,False,,,factcheck,2026-06-01T21:34:54.370170
"Die ehemalige Menschenrechtsbeauftragte der CDU Erika Steinbach facht den Hass auf Walter Lübcke über ihre Social-Media-Kanäle immer wieder an, sodass der CDU-Politiker Peter Tauber ihr eine direkte Mitschuld an dem Mord zuspricht",https://www.volksverpetzer.de/aktuelles/lohnt-kaempfen-merz-keine-antwort/,www.volksverpetzer.de,Wofür lohnt es sich zu kämpfen? Warum Merz keine Antwort auf diese Frage hat - Volksverpetzer,0.1,LOW,False,,,factcheck,2026-06-01T21:34:54.453028
"[DEBUNKED] Ich habe den WELT-Artikel von Kristina Schröder gelesen, damit ihr es nicht müsst - Volksverpetzer",https://www.volksverpetzer.de/faktencheck/welt-schroeder-klima-fake/,www.volksverpetzer.de,"Ich habe den WELT-Artikel von Kristina Schröder gelesen, damit ihr es nicht müsst - Volksverpetzer",0.9,HIGH,True,FALSE - Debunked by fact-checkers,www.volksverpetzer.de,factcheck,2026-06-01T21:34:54.937338
"Das ließ für die OAZ, als Online-Angebot mit wöchentlicher Printausgabe immer noch weit kleiner als ursprünglich geplant, einiges erwarten und befürchten",https://www.volksverpetzer.de/aktuelles/holger-friedrich-kongress-afd/,www.volksverpetzer.de,Verleger Holger Friedrich spricht bei „Demokratiekongress“ der AfD - Volksverpetzer,0.1,LOW,False,,,factcheck,2026-06-01T21:34:55.506464
"Vorahnungen wie Kreml-Propaganda und China-Connection, ganz generell eine Sympathie für Autokraten, haben sich nun auch dort bestätigt",https://www.volksverpetzer.de/aktuelles/holger-friedrich-kongress-afd/,www.volksverpetzer.de,Verleger Holger Friedrich spricht bei „Demokratiekongress“ der AfD - Volksverpetzer,0,LOW,False,,,factcheck,2026-06-01T21:34:55.590689
"Der tschechische Schriftsteller Jaroslav Rudiš, das als Exkurs an dieser Stelle, schrieb über Okamura in der FAZ, er „hetzt gegen alles, was nicht ,urtschechisch‘ ist, was auch immer das heißen mag",https://www.volksverpetzer.de/aktuelles/holger-friedrich-kongress-afd/,www.volksverpetzer.de,Verleger Holger Friedrich spricht bei „Demokratiekongress“ der AfD - Volksverpetzer,0.1,LOW,False,,,factcheck,2026-06-01T21:34:55.873925
"Laut der&nbsp;Mobilen Beratung gegen Rechtsextremismus in Thüringen&nbsp;ist Frank Haußner eine zentrale Mobilisierungsfigur des Netzwerks, das Verbindungen in die Reichsbürger- und Neonazi-Szene unterhält und zugleich enge Bezüge zur AfD pflegt",https://www.volksverpetzer.de/analyse/dunkle-maechte-afd-windkraft/,www.volksverpetzer.de,&quot;Dunkle Mächte&quot;: Das ECHTE Motiv hinter dem AfD-Windkraft-Protest - Volksverpetzer,0,LOW,False,,,factcheck,2026-06-01T21:34:56.447274
Der daraus jährlich erzeugte Strom könnte nach Angaben des Unternehmens den Bedarf von etwa 16,https://www.volksverpetzer.de/analyse/dunkle-maechte-afd-windkraft/,www.volksverpetzer.de,&quot;Dunkle Mächte&quot;: Das ECHTE Motiv hinter dem AfD-Windkraft-Protest - Volksverpetzer,0,LOW,False,,,factcheck,2026-06-01T21:34:56.499886
"Mit einem motivierenden Aufruf an alle Politiker:innen, Aktivist:innen, Wähler:innen und Entscheider:innen, jetzt richtig anzupacken",https://www.volksverpetzer.de/faktencheck/klimaschutz-wirkt-rechte-luegen-ipcc/,www.volksverpetzer.de,"Forscher bestätigen, dass Klimaschutz wirkt – deswegen wollen Rechte ihn jetzt abschaffen?! - Volksv",0.1,LOW,False,,,factcheck,2026-06-01T21:34:57.065586
"Sie veröffentlichten einen Offenen Brief an die Westend-Geschäftsführung, in dem sie Vorbehalte andeuten gegen die Poschardt-Bücher und auch die Titel des FDP-Politikers Wolfgang Kubicki, der seit Jahren immer wieder bei Westend publiziert",https://www.volksverpetzer.de/aktuelles/autoren-treten-aus-westend-verlag/,www.volksverpetzer.de,32 Autoren beenden Zusammenarbeit: Westend-Verlag driftet nach rechts - Volksverpetzer,0.1,LOW,False,,,factcheck,2026-06-01T21:34:57.643343
[DEBUNKED] Irreführende AfD-&quot;Angriffe&quot;: Was diese Statistik der Tagesschau alles nicht verrät - Volksverpetzer,https://www.volksverpetzer.de/faktencheck/statistik-tagesschau-afd-angriffe/,www.volksverpetzer.de,Irreführende AfD-&quot;Angriffe&quot;: Was diese Statistik der Tagesschau alles nicht verrät - Volks,0.9,HIGH,True,FALSE - Debunked by fact-checkers,www.volksverpetzer.de,factcheck,2026-06-01T21:34:58.133351
"[DEBUNKED] MV: Wie Medien AfD-Wahlkampf machen, ohne es zu merken - Volksverpetzer",https://www.volksverpetzer.de/aktuelles/medien-afd-mv-wahlkampf/,www.volksverpetzer.de,"MV: Wie Medien AfD-Wahlkampf machen, ohne es zu merken - Volksverpetzer",0.9,HIGH,True,FALSE - Debunked by fact-checkers,www.volksverpetzer.de,factcheck,2026-06-01T21:34:58.619426
[DEBUNKED] Posts claim Senate candidate Graham Platner has tattoo of Nazi symbol. That's not the full story | Snopes.com,https://www.snopes.com/fact-check/graham-platner-nazi-tattoo/,www.snopes.com,Posts claim Senate candidate Graham Platner has tattoo of Nazi symbol. That's not the full story | S,0.9,HIGH,True,FALSE - Debunked by fact-checkers,www.snopes.com,factcheck,2026-06-01T21:34:58.794460
[DEBUNKED] Were Driscoll's strawberries confirmed to cause cancer? Posts exaggerate pesticide test results | Snopes.com,https://www.snopes.com/fact-check/driscolls-strawberries-cancer-toxins/,www.snopes.com,Were Driscoll's strawberries confirmed to cause cancer? Posts exaggerate pesticide test results | Sn,0.9,HIGH,True,FALSE - Debunked by fact-checkers,www.snopes.com,factcheck,2026-06-01T21:34:58.991497
[DEBUNKED] 9 claims about Donald Trump Jr. we've researched since the start of his father's 2nd term | Snopes.com,https://www.snopes.com/collections/donald-trump-jr-rumors/,www.snopes.com,9 claims about Donald Trump Jr. we've researched since the start of his father's 2nd term | Snopes.c,0.9,HIGH,True,FALSE - Debunked by fact-checkers,www.snopes.com,factcheck,2026-06-01T21:34:59.194641
"Claim: In May 2026, former President Bill Clinton said, ""I offered Palestine all of Gaza and 97% of the West Bank, but they never really wanted a homeland for themselves",https://www.snopes.com/fact-check/bill-clinton-palestinians-homeland/,www.snopes.com,Did Bill Clinton say Palestinians 'never really wanted a homeland' and 'just wanted to kill the Jews,0.1,LOW,False,,,factcheck,2026-06-01T21:34:59.380821
"For example, one popular X post from May 26 read, ""BILL CLINTON: 'I offered Palestine all of Gaza and 97% of the West Bank, but they never really wanted a homeland for themselves",https://www.snopes.com/fact-check/bill-clinton-palestinians-homeland/,www.snopes.com,Did Bill Clinton say Palestinians 'never really wanted a homeland' and 'just wanted to kill the Jews,0.1,LOW,False,,,factcheck,2026-06-01T21:34:59.493472
[DEBUNKED] Unpacking claim Trump personally paid to rebuild Central Park ice rink in the '80s | Snopes.com,https://www.snopes.com/news/2026/06/01/trump-paid-rebuild-central-park-ice-rink/,www.snopes.com,Unpacking claim Trump personally paid to rebuild Central Park ice rink in the '80s | Snopes.com,0.9,HIGH,True,FALSE - Debunked by fact-checkers,www.snopes.com,factcheck,2026-06-01T21:34:59.583495
[DEBUNKED] Did Trump say he'd outlaw photographing or posting gas prices? | Snopes.com,https://www.snopes.com/fact-check/trump-gas-prices-post/,www.snopes.com,Did Trump say he'd outlaw photographing or posting gas prices? | Snopes.com,0.9,HIGH,True,FALSE - Debunked by fact-checkers,www.snopes.com,factcheck,2026-06-01T21:34:59.693958
[DEBUNKED] Planned Parenthood founder Margaret Sanger didn't call Black people 'human weeds' that should be 'exterminated' | Snopes.com,https://www.snopes.com/fact-check/maragret-sanger-black-people-human-weeds-quote/,www.snopes.com,Planned Parenthood founder Margaret Sanger didn't call Black people 'human weeds' that should be 'ex,0.9,HIGH,True,FALSE - Debunked by fact-checkers,www.snopes.com,factcheck,2026-06-01T21:34:59.781585
[DEBUNKED] 10 times Trump or his administration posted AI-generated content online | Snopes.com,https://www.snopes.com/collections/trump-ai-posts/,www.snopes.com,10 times Trump or his administration posted AI-generated content online | Snopes.com,0.9,HIGH,True,FALSE - Debunked by fact-checkers,www.snopes.com,factcheck,2026-06-01T21:34:59.869485
[DEBUNKED] Investigating alleged image of chained McDonald's worker preparing food | Snopes.com,https://www.snopes.com/news/2026/05/31/chained-mcdonalds-worker-image/,www.snopes.com,Investigating alleged image of chained McDonald's worker preparing food | Snopes.com,0.9,HIGH,True,FALSE - Debunked by fact-checkers,www.snopes.com,factcheck,2026-06-01T21:34:59.966584
[DEBUNKED] Did 65-year-old Georgia history teacher quit over 'controversial' syllabus? | Snopes.com,https://www.snopes.com/fact-check/georgia-history-teacher-syllabus/,www.snopes.com,Did 65-year-old Georgia history teacher quit over 'controversial' syllabus? | Snopes.com,0.9,HIGH,True,FALSE - Debunked by fact-checkers,www.snopes.com,factcheck,2026-06-01T21:35:00.054509
[DEBUNKED] Did Canada deny $573B railroad bailout request from Trump? Don't go off the rails | Snopes.com,https://www.snopes.com/fact-check/trump-canada-bailout-request/,www.snopes.com,Did Canada deny $573B railroad bailout request from Trump? Don't go off the rails | Snopes.com,0.9,HIGH,True,FALSE - Debunked by fact-checkers,www.snopes.com,factcheck,2026-06-01T21:35:00.162429
[DEBUNKED] 23 rumors about Nancy Pelosi from our archives | Snopes.com,https://www.snopes.com/collections/nancy-pelosi-claims/,www.snopes.com,23 rumors about Nancy Pelosi from our archives | Snopes.com,0.9,HIGH,True,FALSE - Debunked by fact-checkers,www.snopes.com,factcheck,2026-06-01T21:35:00.290260
"[DEBUNKED] PolitiFact | Does this video show workers removing Trump’s name from the Kennedy Center? No, it’s AI-generated",http://www.politifact.com/factchecks/2026/jun/01/social-media/trump-name-removed-kennedy-center-AI/,www.politifact.com,"PolitiFact | Does this video show workers removing Trump’s name from the Kennedy Center? No, it’s AI",0.9,HIGH,True,FALSE - Debunked by fact-checkers,www.politifact.com,factcheck,2026-06-01T21:35:00.438151
More Info I would like to contribute One Time Monthly Yearly Join Now Fact-checking DeSantis: Would his plan exempt 60% of Florida homeowners from paying property taxes,http://www.politifact.com/article/2026/may/29/florida-property-taxes-plan-homestead-exemption/,www.politifact.com,PolitiFact | Fact-checking DeSantis: Would his plan exempt 60% of Florida homeowners from paying pro,0,LOW,False,,,factcheck,2026-06-01T21:35:00.703454
"A September 2025 state analysis found that 28% of Florida’s primary residences have a market value of $250,000 or below, and 76% are valued at $500,000 or below",http://www.politifact.com/article/2026/may/29/florida-property-taxes-plan-homestead-exemption/,www.politifact.com,PolitiFact | Fact-checking DeSantis: Would his plan exempt 60% of Florida homeowners from paying pro,0,LOW,False,,,factcheck,2026-06-01T21:35:00.784552
"Ron DeSantis unveiled his long-awaited plan to overhaul the state’s property tax system, saying it would initially eliminate property taxes for 60% of Florida homeowners",http://www.politifact.com/article/2026/may/29/florida-property-taxes-plan-homestead-exemption/,www.politifact.com,PolitiFact | Fact-checking DeSantis: Would his plan exempt 60% of Florida homeowners from paying pro,0,LOW,False,,,factcheck,2026-06-01T21:35:00.972762
[DEBUNKED] PolitiFact | Did James Talarico say US border should have ‘a giant welcome mat’? Ken Paxton ad omits full remarks,http://www.politifact.com/factchecks/2026/may/28/ken-paxton/talarico-southern-border-front-porch-texas-senate/,www.politifact.com,PolitiFact | Did James Talarico say US border should have ‘a giant welcome mat’? Ken Paxton ad omits,0.9,HIGH,True,FALSE - Debunked by fact-checkers,www.politifact.com,factcheck,2026-06-01T21:35:01.108046
"[DEBUNKED] PolitiFact | In Texas Senate race, Ken Paxton falsely claims James Talarico is a vegan",http://www.politifact.com/factchecks/2026/may/27/ken-paxton/in-texas-senate-race-ken-paxton-falsely-claims-jam/,www.politifact.com,"PolitiFact | In Texas Senate race, Ken Paxton falsely claims James Talarico is a vegan",0.9,HIGH,True,FALSE - Debunked by fact-checkers,www.politifact.com,factcheck,2026-06-01T21:35:01.296338
Medication abortions successfully end pregnancies about 95% of the time,http://www.politifact.com/article/2026/may/26/medication-abortion-mifepristone-safety-studies/,www.politifact.com,"PolitiFact | Amid efforts to restrict mifepristone access, here&#x27;s what studies say about the me",0,LOW,False,,,factcheck,2026-06-01T21:35:01.534700
"Higher SPF means stronger protection, but no sunscreen can block 100% of the sun’s UVB rays",http://www.politifact.com/article/2026/may/26/do-i-need-spf-30-50-or-100-we-answer-your-burning/,www.politifact.com,"PolitiFact | Do you need SPF 30, 50 or 100? We answer your burning sunscreen questions",0.1,LOW,False,,,factcheck,2026-06-01T21:35:01.697221
"SPF 30 sunscreen filters about 97% of UVB rays, for example, and SPF 50 filters about 98%, said Dr",http://www.politifact.com/article/2026/may/26/do-i-need-spf-30-50-or-100-we-answer-your-burning/,www.politifact.com,"PolitiFact | Do you need SPF 30, 50 or 100? We answer your burning sunscreen questions",0,LOW,False,,,factcheck,2026-06-01T21:35:01.781676
