claim,source_url,source_domain,article_title,risk_score,risk_category,has_factcheck,factcheck_rating,factcheck_source,source_type,checked_at
[DEBUNKED] Mutmaßliche Amokfahrt in Leipzig: Videos zeigen keine Pro-AfD-Demonstrationen,https://correctiv.org/faktencheck/2026/05/05/mutmassliche-amokfahrt-in-leipzig-videos-von-angeblichen-pro-afd-demonstrationen-sind-manipuliert/,correctiv.org,Mutmaßliche Amokfahrt in Leipzig: Videos zeigen keine Pro-AfD-Demonstrationen,0.9,HIGH,True,FALSE - Debunked by fact-checkers,correctiv.org,factcheck,2026-05-06T03:21:37.871083
"[DEBUNKED] Der mutmaßliche Leipziger Amokfahrer ist kein Afghane, sondern Deutscher",https://correctiv.org/faktencheck/2026/05/05/amokfahrt-in-leipzig-tatverdaechtiger-ist-kein-afghane-sondern-deutscher-falschinformation/,correctiv.org,"Der mutmaßliche Leipziger Amokfahrer ist kein Afghane, sondern Deutscher",0.9,HIGH,True,FALSE - Debunked by fact-checkers,correctiv.org,factcheck,2026-05-06T03:21:38.539243
[DEBUNKED] CORRECTIV bringt Faktenforum in die Kneipe - correctiv.org,https://correctiv.org/in-eigener-sache/2026/05/04/correctiv-bringt-faktenforum-in-die-kneipe/,correctiv.org,CORRECTIV bringt Faktenforum in die Kneipe - correctiv.org,0.9,HIGH,True,FALSE - Debunked by fact-checkers,correctiv.org,factcheck,2026-05-06T03:21:40.267828
Mai 2026 Laut einem Geheimdienst-Bericht eines EU-Staates hat Russlands Präsident Wladimir Putin zunehmend Angst vor Attentaten und Putschversuchen,https://correctiv.org/russland/2026/05/04/spannungen-in-putins-machtapparat-angst-vor-attentaten-und-putschversuchen-russland/,correctiv.org,Angst vor Putsch und Attentaten: Spannungen in Putins Machtapparat,0.05,LOW,False,,,factcheck,2026-05-06T03:21:41.098555
"Wer in Putins Nähe arbeite, dürfe keine Mobiltelefone dabei haben und kein Internet nutzen",https://correctiv.org/russland/2026/05/04/spannungen-in-putins-machtapparat-angst-vor-attentaten-und-putschversuchen-russland/,correctiv.org,Angst vor Putsch und Attentaten: Spannungen in Putins Machtapparat,0.1,LOW,False,,,factcheck,2026-05-06T03:21:41.230722
Anders als 2025 gebe es in diesem Jahr keine Besuche Putins von militärischer Infrastruktur mehr,https://correctiv.org/russland/2026/05/04/spannungen-in-putins-machtapparat-angst-vor-attentaten-und-putschversuchen-russland/,correctiv.org,Angst vor Putsch und Attentaten: Spannungen in Putins Machtapparat,0.1,LOW,False,,,factcheck,2026-05-06T03:21:41.321738
[DEBUNKED] Fake-Spendenaufruf für Wal „Timmy“ auf Tiktok,https://correctiv.org/faktencheck/2026/04/30/wal-timmy-profil-wirbt-mit-fake-dokumenten-auf-tiktok-fuer-spenden/,correctiv.org,Fake-Spendenaufruf für Wal „Timmy“ auf Tiktok,0.9,HIGH,True,FALSE - Debunked by fact-checkers,correctiv.org,factcheck,2026-05-06T03:21:42.566422
[DEBUNKED] Friedrich Merz wirbt nicht für Investitionsplattform – Video ist Betrug,https://correctiv.org/faktencheck/2026/04/30/friedrich-merz-wirbt-nicht-fuer-investitionsplattform-video-ist-betrug/,correctiv.org,Friedrich Merz wirbt nicht für Investitionsplattform – Video ist Betrug,0.9,HIGH,True,FALSE - Debunked by fact-checkers,correctiv.org,factcheck,2026-05-06T03:21:43.720122
"[DEBUNKED] Google-Trends zeigt nicht, dass Angriff auf Korrespondenten-Dinner inszeniert war",https://correctiv.org/faktencheck/2026/04/30/google-trends-zeigt-nicht-das-angriff-auf-korrespondenten-dinner-inszeniert-war/,correctiv.org,"Google-Trends zeigt nicht, dass Angriff auf Korrespondenten-Dinner inszeniert war",0.9,HIGH,True,FALSE - Debunked by fact-checkers,correctiv.org,factcheck,2026-05-06T03:21:44.387859
April 2026 Foto: Bodo Schackow / picture alliance / dpa Für ein Verbot der AfD gibt es im Moment keine politische Mehrheit,https://correctiv.org/aktuelles/afd/2026/04/30/rechtsexperten-halten-ein-teil-verbot-der-afd-fuer-denkbar/,correctiv.org,Rechtsexperten halten ein Teil-Verbot der AfD für denkbar,0.1,LOW,False,,,factcheck,2026-05-06T03:21:45.054947
"Zwar ist laut Markus Ogorek, Staatsrechtler an der Universität zu Köln, ein Verbotsantrag, der lediglich auf einen Landesverband abzielt, nicht ausdrücklich gesetzlich festgelegt",https://correctiv.org/aktuelles/afd/2026/04/30/rechtsexperten-halten-ein-teil-verbot-der-afd-fuer-denkbar/,correctiv.org,Rechtsexperten halten ein Teil-Verbot der AfD für denkbar,0,LOW,False,,,factcheck,2026-05-06T03:21:45.175704
"Man könne „immer beantragen, die ganze Partei zu verbieten und dann einen Hilfsantrag stellen, der sich nur auf ein Land bezieht“, sagte er auf Anfrage",https://correctiv.org/aktuelles/afd/2026/04/30/rechtsexperten-halten-ein-teil-verbot-der-afd-fuer-denkbar/,correctiv.org,Rechtsexperten halten ein Teil-Verbot der AfD für denkbar,0.1,LOW,False,,,factcheck,2026-05-06T03:21:45.266864
[DEBUNKED] Keine Neuwahl in Rheinland-Pfalz – Youtube-Kanal sammelt Klicks,https://correctiv.org/faktencheck/2026/04/30/keine-neuwahl-in-rheinland-pfalz-youtube-kanal-sammelt-klicks/,correctiv.org,Keine Neuwahl in Rheinland-Pfalz – Youtube-Kanal sammelt Klicks,0.9,HIGH,True,FALSE - Debunked by fact-checkers,correctiv.org,factcheck,2026-05-06T03:21:45.842960
"Sie richtet sich laut deutschen Sicherheitsbehörden vorrangig gegen Vertreterinnen und Vertreter aus Politik, Militär, Diplomatie und Journalismus",https://correctiv.org/hybride-kriegsfuehrung/2026/04/29/spionage-ueber-signal-was-ueber-die-phishing-kampagne-bekannt-ist-und-wie-sie-sich-schuetzen-koennen/,correctiv.org,Spionage über Signal: Was über die Phishing-Kampagne bekannt ist – und wie Sie sich schützen können,0,LOW,False,,,factcheck,2026-05-06T03:21:46.509822
[DEBUNKED] Bystron stellt irreführende Rechnung zu Rente und Ukraine-Kredit auf,https://correctiv.org/faktencheck/2026/04/29/irrefuehrende-rechnung-afd-politiker-bystron-vergleicht-ukraine-kredit-mit-renten/,correctiv.org,Bystron stellt irreführende Rechnung zu Rente und Ukraine-Kredit auf,0.9,HIGH,True,FALSE - Debunked by fact-checkers,correctiv.org,factcheck,2026-05-06T03:21:47.178924
[DEBUNKED] Zeigt dieses Bild den Leipzig-Amokfahrer mit AfD- oder Antifa-Shirt?,https://www.mimikama.org/bild-leipzig-amokfahrer-afd-antifa-shirt/,www.mimikama.org,Zeigt dieses Bild den Leipzig-Amokfahrer mit AfD- oder Antifa-Shirt?,0.9,HIGH,True,FALSE - Debunked by fact-checkers,www.mimikama.org,factcheck,2026-05-06T03:21:47.258804
[DEBUNKED] Ist diese AutoPASS-Mail zur Norwegen-Maut echt?,https://www.mimikama.org/ist-diese-autopass-mail-zur-norwegen-maut-echt/,www.mimikama.org,Ist diese AutoPASS-Mail zur Norwegen-Maut echt?,0.9,HIGH,True,FALSE - Debunked by fact-checkers,www.mimikama.org,factcheck,2026-05-06T03:21:47.343918
"[DEBUNKED] Stimmt die Behauptung, der Tatverdächtige von Leipzig sei Afghane?",https://www.mimikama.org/behauptung-tatverdaechtiger-leipzig-afghane/,www.mimikama.org,"Stimmt die Behauptung, der Tatverdächtige von Leipzig sei Afghane?",0.9,HIGH,True,FALSE - Debunked by fact-checkers,www.mimikama.org,factcheck,2026-05-06T03:21:47.425658
[DEBUNKED] Faktencheck: Kommt ein Pfandlimit von 10 Flaschen pro Tag?,https://www.mimikama.org/kommt-ein-pfandlimit-von-10-flaschen-pro-tag/,www.mimikama.org,Faktencheck: Kommt ein Pfandlimit von 10 Flaschen pro Tag?,0.9,HIGH,True,FALSE - Debunked by fact-checkers,www.mimikama.org,factcheck,2026-05-06T03:21:47.504172
[DEBUNKED] Fußball-WM: Trikot kaufen – Woran erkennt man Fake Shops?,https://www.mimikama.org/fussball-wm-trikot-kaufen-fake-shops/,www.mimikama.org,Fußball-WM: Trikot kaufen – Woran erkennt man Fake Shops?,0.9,HIGH,True,FALSE - Debunked by fact-checkers,www.mimikama.org,factcheck,2026-05-06T03:21:47.602798
[DEBUNKED] Faktencheck: Hat Trump „nur bergab fahren“ empfohlen?,https://www.mimikama.org/hat-trump-nur-bergab-fahren-empfohlen/,www.mimikama.org,Faktencheck: Hat Trump „nur bergab fahren“ empfohlen?,0.9,HIGH,True,FALSE - Debunked by fact-checkers,www.mimikama.org,factcheck,2026-05-06T03:21:47.675998
[DEBUNKED] Hat die Zerstörung von US-Radaren Irans Dürre beendet?,https://www.mimikama.org/zerstoerung-us-radar-iran-regen-duerre/,www.mimikama.org,Hat die Zerstörung von US-Radaren Irans Dürre beendet?,0.9,HIGH,True,FALSE - Debunked by fact-checkers,www.mimikama.org,factcheck,2026-05-06T03:21:47.767037
"000 kompromittierte Facebook-Konten zeigt sich ein Muster, das nicht neu ist, aber immer professioneller umgesetzt wird",https://www.mimikama.org/30-000-facebook-konten-gehackt/,www.mimikama.org,Vorsicht: Phishing-Welle „AccountDumpling“ gefährdet Facebook-Konten,0.1,LOW,False,,,factcheck,2026-05-06T03:21:47.929728
Ein ähnliches Vorgehen wird im Bereich Phishing erkennen immer wieder dokumentiert,https://www.mimikama.org/30-000-facebook-konten-gehackt/,www.mimikama.org,Vorsicht: Phishing-Welle „AccountDumpling“ gefährdet Facebook-Konten,0.1,LOW,False,,,factcheck,2026-05-06T03:21:48.023140
Laut Sicherheitsforschern wird die aktuelle Kampagne mit einer organisierten Gruppe in Verbindung gebracht,https://www.mimikama.org/30-000-facebook-konten-gehackt/,www.mimikama.org,Vorsicht: Phishing-Welle „AccountDumpling“ gefährdet Facebook-Konten,0,LOW,False,,,factcheck,2026-05-06T03:21:48.112414
[DEBUNKED] Vorsicht: Deepfake-Betrug mit Promis – So werden Sie getäuscht!,https://www.mimikama.org/deepfake-betrug-mit-promis-wie-echt-ist-echt/,www.mimikama.org,Vorsicht: Deepfake-Betrug mit Promis – So werden Sie getäuscht!,0.9,HIGH,True,FALSE - Debunked by fact-checkers,www.mimikama.org,factcheck,2026-05-06T03:21:48.197647
[DEBUNKED] Hat Fedorovs Frau eine 26-Mio.-Yacht gekauft?,https://www.mimikama.org/fedorov-frau-yacht-eu-geld/,www.mimikama.org,Hat Fedorovs Frau eine 26-Mio.-Yacht gekauft?,0.9,HIGH,True,FALSE - Debunked by fact-checkers,www.mimikama.org,factcheck,2026-05-06T03:21:48.303018
[DEBUNKED] Native Advertising vs Fake-Advertorial: Der Unterschied,https://www.mimikama.org/native-advertising-vs-fake-advertorial/,www.mimikama.org,Native Advertising vs Fake-Advertorial: Der Unterschied,0.9,HIGH,True,FALSE - Debunked by fact-checkers,www.mimikama.org,factcheck,2026-05-06T03:21:48.403891
[DEBUNKED] Promi-Fake-Werbung: 5 Warnzeichen zum Schutz,https://www.mimikama.org/promi-fake-werbung-erkennen/,www.mimikama.org,Promi-Fake-Werbung: 5 Warnzeichen zum Schutz,0.9,HIGH,True,FALSE - Debunked by fact-checkers,www.mimikama.org,factcheck,2026-05-06T03:21:48.485994
[DEBUNKED] Fake-Advertorials erkennen: 5 Maschen + Schutz-Tipps,https://www.mimikama.org/fake-advertorials-erkennen/,www.mimikama.org,Fake-Advertorials erkennen: 5 Maschen + Schutz-Tipps,0.9,HIGH,True,FALSE - Debunked by fact-checkers,www.mimikama.org,factcheck,2026-05-06T03:21:48.579377
„Du hast doch keine Ahnung&#8230;&#8220; – Ad Hominem ist mehr als Unhöflichkeit,https://www.mimikama.org/ad-hominem-persoenlicher-angriff-erkennen/,www.mimikama.org,Ad Hominem erkennen: Persönliche Angriffe kontern,0.1,LOW,False,,,factcheck,2026-05-06T03:21:48.783639
"Plötzlich heißt es: „Du hast doch keine Ahnung&#8220; oder „Das sagst du nur, weil du zu dieser Gruppe gehörst",https://www.mimikama.org/ad-hominem-persoenlicher-angriff-erkennen/,www.mimikama.org,Ad Hominem erkennen: Persönliche Angriffe kontern,0.1,LOW,False,,,factcheck,2026-05-06T03:21:48.873486
"Das Muster ist fast immer gleich: Statt sich mit dem Inhalt auseinanderzusetzen, wird die Person als unglaubwürdig, lächerlich oder moralisch mangelhaft dargestellt",https://www.mimikama.org/ad-hominem-persoenlicher-angriff-erkennen/,www.mimikama.org,Ad Hominem erkennen: Persönliche Angriffe kontern,0.1,LOW,False,,,factcheck,2026-05-06T03:21:48.968962
[DEBUNKED] Confirmation Bias erklärt: 6 Strategien gegen Denkfehler,https://www.mimikama.org/confirmation-bias-bestaetigungsfehler-erklaert/,www.mimikama.org,Confirmation Bias erklärt: 6 Strategien gegen Denkfehler,0.9,HIGH,True,FALSE - Debunked by fact-checkers,www.mimikama.org,factcheck,2026-05-06T03:21:49.143625
[DEBUNKED] Reiche-Lüge verbreitet: Warum ist die Tagesschau so schlecht bei Fakes der Regierung? - Volksverpetzer,https://www.volksverpetzer.de/faktencheck/reiche-luege-tagesschau/,www.volksverpetzer.de,Reiche-Lüge verbreitet: Warum ist die Tagesschau so schlecht bei Fakes der Regierung? - Volksverpetz,0.9,HIGH,True,FALSE - Debunked by fact-checkers,www.volksverpetzer.de,factcheck,2026-05-06T03:21:49.626614
"Nur wenige machen sich aber die Mühe, gegen den Rundfunkbeitrag von derzeit 18,36 Euro pro Monat zu klagen",https://www.volksverpetzer.de/serie/april-2026-swr-ausgewogen/,www.volksverpetzer.de,Urteile April 2026: SWR berichtet ausgewogen – Gericht weist Klage ab! - Volksverpetzer,0,LOW,False,,,factcheck,2026-05-06T03:21:50.210734
[DEBUNKED] &quot;Sämtlich unwahr&quot;: Gericht-Doppel-Klatsche für Reichelts Hetz-Portal NIUS! - Volksverpetzer,https://www.volksverpetzer.de/aktuelles/gericht-doppel-klatsche-nius/,www.volksverpetzer.de,&quot;Sämtlich unwahr&quot;: Gericht-Doppel-Klatsche für Reichelts Hetz-Portal NIUS! - Volksverpetze,0.9,HIGH,True,FALSE - Debunked by fact-checkers,www.volksverpetzer.de,factcheck,2026-05-06T03:21:50.692925
"Immer wieder Robert Habeck, Karl Lauterbach, Dunja Hayali, wirklich ganz oft Merkel, aber auch Spahn, Söder und viele, viele mehr sind pausenlos Ziel des rechten Hasses und strafrechtlich relevanter Morddrohungen",https://www.volksverpetzer.de/aktuelles/extrem-hass-afd-merz-reiche/,www.volksverpetzer.de,Morddrohungen: So extrem ist der Hass in AfD-Gruppen auf Merz und Reiche - Volksverpetzer,0.1,LOW,False,,,factcheck,2026-05-06T03:21:51.267451
&#8220; Und noch nie machte der rechte Hass natürlich Halt vor der CDU oder CSU,https://www.volksverpetzer.de/aktuelles/extrem-hass-afd-merz-reiche/,www.volksverpetzer.de,Morddrohungen: So extrem ist der Hass in AfD-Gruppen auf Merz und Reiche - Volksverpetzer,0.1,LOW,False,,,factcheck,2026-05-06T03:21:51.361098
"Im Jahr 2025 sank die Zahl der angezeigten Verbrechen deutlich (-5,6%)",https://www.volksverpetzer.de/analyse/auslaenderkriminalitaet-geht-zurueck/,www.volksverpetzer.de,(Ausländer)Kriminalität geht zurück! Wie du über Sicherheit belogen wirst - Volksverpetzer,0,LOW,False,,,factcheck,2026-05-06T03:21:51.946408
"So gingen zum Beispiel zurück: Gewaltkriminalität (-2,3%), Straßenkriminalität (-7%), Raubüberfälle (-6%) oder Betrug (-8%)",https://www.volksverpetzer.de/analyse/auslaenderkriminalitaet-geht-zurueck/,www.volksverpetzer.de,(Ausländer)Kriminalität geht zurück! Wie du über Sicherheit belogen wirst - Volksverpetzer,0,LOW,False,,,factcheck,2026-05-06T03:21:52.037827
Und auch die Zahl der ausländischen Tatverdächtigen (-10%) und ihr Anteil an den Straftaten (-2%) ging zurück,https://www.volksverpetzer.de/analyse/auslaenderkriminalitaet-geht-zurueck/,www.volksverpetzer.de,(Ausländer)Kriminalität geht zurück! Wie du über Sicherheit belogen wirst - Volksverpetzer,0,LOW,False,,,factcheck,2026-05-06T03:21:52.128792
"Wildtiere, die an Orten auftauchen, an denen Menschen sie nicht gewohnt sind, sorgen ja immer wieder für Schlagzeilen und Diskussionen",https://www.volksverpetzer.de/aktuelles/rechte-ostsee-wal-afd/,www.volksverpetzer.de,"So weird versuchen manche AfD-Fans, den Ostsee-Wal zu instrumentalisieren! - Volksverpetzer",0.1,LOW,False,,,factcheck,2026-05-06T03:21:52.705841
"März strandete er mehrmals in der Ostsee, konnte sich aber immer wieder durch Rettungsmaßnahmen freischwimmen",https://www.volksverpetzer.de/aktuelles/rechte-ostsee-wal-afd/,www.volksverpetzer.de,"So weird versuchen manche AfD-Fans, den Ostsee-Wal zu instrumentalisieren! - Volksverpetzer",0.1,LOW,False,,,factcheck,2026-05-06T03:21:52.801144
""" Andere sagen ""Rettet Wale und keine Migranten",https://www.volksverpetzer.de/aktuelles/rechte-ostsee-wal-afd/,www.volksverpetzer.de,"So weird versuchen manche AfD-Fans, den Ostsee-Wal zu instrumentalisieren! - Volksverpetzer",0.1,LOW,False,,,factcheck,2026-05-06T03:21:52.861618
[DEBUNKED] Dreiste Wählertäuschung! Juristen zerlegen Migrations-Pläne der AfD Sachsen-Anhalt - Volksverpetzer,https://www.volksverpetzer.de/analyse/afd-sachsen-anhalt-migration-luege/,www.volksverpetzer.de,Dreiste Wählertäuschung! Juristen zerlegen Migrations-Pläne der AfD Sachsen-Anhalt - Volksverpetzer,0.9,HIGH,True,FALSE - Debunked by fact-checkers,www.volksverpetzer.de,factcheck,2026-05-06T03:21:53.344822
"Screenshot Jeder Blick in den Spiegel wird zur Bewertung, jeder Millimeter des Gesichts zu einem Datenpunkt",https://www.volksverpetzer.de/analyse/looksmaxxing-tiktok-nazi/,www.volksverpetzer.de,Looksmaxxing – Macht dieser TikTok-Trend dein Kind zum Nazi? - Volksverpetzer,0,LOW,False,,,factcheck,2026-05-06T03:21:53.915745
"Wissenschaftliche Belege gibt es dafür zwar keine, trotzdem scheint das nur die wenigsten abzuschrecken",https://www.volksverpetzer.de/analyse/looksmaxxing-tiktok-nazi/,www.volksverpetzer.de,Looksmaxxing – Macht dieser TikTok-Trend dein Kind zum Nazi? - Volksverpetzer,0.1,LOW,False,,,factcheck,2026-05-06T03:21:54.005425
In beiden Ländern träumt die AfD seit Monaten angesichts von Umfragewerten von deutlich über 30 bis zu 40 Prozent von der Regierung und sieht die Wahlen in Baden-Württemberg und Rheinland-Pfalz als gutes Vorzeichen,https://www.volksverpetzer.de/analyse/afd-osten-keiner-merkt-es/,www.volksverpetzer.de,Die AfD verliert alle Wahlen im Osten – und keiner bekommt es mit - Volksverpetzer,0,LOW,False,,,factcheck,2026-05-06T03:21:54.581668
"Bei den Bürgermeisterwahlen im vorpommerschen Anklam gewann der amtierende Bürgermeister Michael Galander von der Wählergemeinschaft Initiativen für Anklam mit 72,13 Prozent haushoch gegen AfD-Kandidat Jörg Valentin (27,9 Prozent)",https://www.volksverpetzer.de/analyse/afd-osten-keiner-merkt-es/,www.volksverpetzer.de,Die AfD verliert alle Wahlen im Osten – und keiner bekommt es mit - Volksverpetzer,0,LOW,False,,,factcheck,2026-05-06T03:21:54.673308
"Denn immer wieder zeigt sich, dass auf kommunaler Ebene eben nach persönlicher Sympathie und Kompetenz und weniger nach Parteibuch entschieden wird",https://www.volksverpetzer.de/analyse/afd-osten-keiner-merkt-es/,www.volksverpetzer.de,Die AfD verliert alle Wahlen im Osten – und keiner bekommt es mit - Volksverpetzer,0.1,LOW,False,,,factcheck,2026-05-06T03:21:54.764859
[DEBUNKED] Hegseth falsely claimed Biden sent troops to polling stations in 15 states during 2024 election | Snopes.com,https://www.snopes.com/fact-check/hegseth-biden-polling-stations/,www.snopes.com,Hegseth falsely claimed Biden sent troops to polling stations in 15 states during 2024 election | Sn,0.9,HIGH,True,FALSE - Debunked by fact-checkers,www.snopes.com,factcheck,2026-05-06T03:21:54.887172
[DEBUNKED] Posts claim Trump appointed Ghislaine Maxwell's former defense attorney as acting AG. Here's the real story | Snopes.com,https://www.snopes.com/fact-check/trump-ghislaine-maxwell-attorney-general/,www.snopes.com,Posts claim Trump appointed Ghislaine Maxwell's former defense attorney as acting AG. Here's the rea,0.9,HIGH,True,FALSE - Debunked by fact-checkers,www.snopes.com,factcheck,2026-05-06T03:21:55.123183
[DEBUNKED] Did acting AG Todd Blanche say predators won't be prosecuted in Epstein case? There's no proof | Snopes.com,https://www.snopes.com/fact-check/blanche-esptein-prosecution-quote/,www.snopes.com,Did acting AG Todd Blanche say predators won't be prosecuted in Epstein case? There's no proof | Sno,0.9,HIGH,True,FALSE - Debunked by fact-checkers,www.snopes.com,factcheck,2026-05-06T03:21:55.237305
[DEBUNKED] Trump did not post AI image of himself delivering Lady Liberty's baby version of him | Snopes.com,https://www.snopes.com/fact-check/trump-jesus-lady-liberty-birth/,www.snopes.com,Trump did not post AI image of himself delivering Lady Liberty's baby version of him | Snopes.com,0.9,HIGH,True,FALSE - Debunked by fact-checkers,www.snopes.com,factcheck,2026-05-06T03:21:55.484431
[DEBUNKED] Watch out for fake video of Queen Camilla calling Trump 'arrogant and rude clown' | Snopes.com,https://www.snopes.com/fact-check/queen-camilla-trump-rude-clown/,www.snopes.com,Watch out for fake video of Queen Camilla calling Trump 'arrogant and rude clown' | Snopes.com,0.9,HIGH,True,FALSE - Debunked by fact-checkers,www.snopes.com,factcheck,2026-05-06T03:21:55.717347
[DEBUNKED] Did Bill Clinton criticize Hegseth's testimony? How we know audio is fake | Snopes.com,https://www.snopes.com/fact-check/bill-clinton-hegseth-testimony/,www.snopes.com,Did Bill Clinton criticize Hegseth's testimony? How we know audio is fake | Snopes.com,0.9,HIGH,True,FALSE - Debunked by fact-checkers,www.snopes.com,factcheck,2026-05-06T03:21:55.839758
"[DEBUNKED] Investigating claim Chief Justice Roberts, wife took $20M from law firms he ruled on | Snopes.com",https://www.snopes.com/news/2026/05/01/chief-justice-roberts-wife-law-firms/,www.snopes.com,"Investigating claim Chief Justice Roberts, wife took $20M from law firms he ruled on | Snopes.com",0.9,HIGH,True,FALSE - Debunked by fact-checkers,www.snopes.com,factcheck,2026-05-06T03:21:56.083218
[DEBUNKED] Did Trump say people should 'only drive downhill' to save gas? | Snopes.com,https://www.snopes.com/fact-check/trump-drive-downhill-post/,www.snopes.com,Did Trump say people should 'only drive downhill' to save gas? | Snopes.com,0.9,HIGH,True,FALSE - Debunked by fact-checkers,www.snopes.com,factcheck,2026-05-06T03:21:56.223000
[DEBUNKED] Don't put faith in claim Florida man was arrested after trying to 'baptize' alligator in Waffle House | Snopes.com,https://www.snopes.com/fact-check/florida-man-arrest-waffle-house-alligator-baptism/,www.snopes.com,Don't put faith in claim Florida man was arrested after trying to 'baptize' alligator in Waffle Hous,0.9,HIGH,True,FALSE - Debunked by fact-checkers,www.snopes.com,factcheck,2026-05-06T03:21:56.581847
"""Hate crimes in New York City increased by 152% this January from last January,"" he said",http://www.politifact.com/factchecks/2026/may/05/sam-sutton/hate-crimes-new-york-city-houses-worship/,www.politifact.com,PolitiFact | Fact-checking a 152% increase in hate crimes in New York City,0,LOW,False,,,factcheck,2026-05-06T03:21:56.754646
"1 finding is that tens of millions of Americans support political violence, while between 75% and 80% of Americans abhor political violence,"" said Robert Pape, director of the Chicago Project on Security and Threats",http://www.politifact.com/article/2026/may/04/political-violence-democrats-polling/,www.politifact.com,PolitiFact | Are Democrats growing more accepting of political violence?,0,LOW,False,,,factcheck,2026-05-06T03:21:56.995235
"Three polls from late 2025 — by Reuters/Ipsos, Marquette University Law School and the Public Religion Research Institute — found that between 79% and 91% of Americans oppose political violence",http://www.politifact.com/article/2026/may/04/political-violence-democrats-polling/,www.politifact.com,PolitiFact | Are Democrats growing more accepting of political violence?,0,LOW,False,,,factcheck,2026-05-06T03:21:57.083535
"A plurality means it was the highest of any single category, but not 50% plus one",http://www.politifact.com/factchecks/2026/apr/29/ron-desantis/florida-redistricting-republican-democrat-majority/,www.politifact.com,PolitiFact | Florida redistricting: DeSantis overstates voters’ shift from Democrats to Republicans,0,LOW,False,,,factcheck,2026-05-06T03:21:58.324437
"Drought Monitor, and about 22% of the state is in an ""exceptional drought,"" the system’s highest level",http://www.politifact.com/article/2026/apr/27/Florida-drought-hurricane-season-active/,www.politifact.com,PolitiFact | DeSantis said Florida’s drought could bring a quieter hurricane season. Is that true?,0,LOW,False,,,factcheck,2026-05-06T03:21:58.620603
5 May 2026 What was claimed Scotland is housing 10% of the UK’s asylum seekers,https://fullfact.org/politics/asylum-seekers-scotland-6percent/,fullfact.org,Are 10% of the UK’s asylum seekers being housed in Scotland? – Full Fact,0,LOW,False,,,factcheck,2026-05-06T03:21:59.189685
"Our verdict This isn’t correct according to the latest figures, which show just over 6% of asylum seekers who are being supported by the UK government are housed in Scotland",https://fullfact.org/politics/asylum-seekers-scotland-6percent/,fullfact.org,Are 10% of the UK’s asylum seekers being housed in Scotland? – Full Fact,0,LOW,False,,,factcheck,2026-05-06T03:21:59.279061
Leaflets from Reform UK landing on doorsteps during the Scottish parliament election campaign have claimed that “Scotland now houses 10% of UK asylum seekers”,https://fullfact.org/politics/asylum-seekers-scotland-6percent/,fullfact.org,Are 10% of the UK’s asylum seekers being housed in Scotland? – Full Fact,0,LOW,False,,,factcheck,2026-05-06T03:21:59.369159
[DEBUNKED] Footage of small boat being intercepted by Border Force is fake – Full Fact,https://fullfact.org/immigration/migrant-small-boat-channel-fake-ai-video/,fullfact.org,Footage of small boat being intercepted by Border Force is fake – Full Fact,0.9,HIGH,True,FALSE - Debunked by fact-checkers,fullfact.org,factcheck,2026-05-06T03:22:00.127054
"[DEBUNKED] No, the Supreme Court has not ordered Keir Starmer to resign – Full Fact",https://fullfact.org/politics/supreme-court-not-ordered-keir-starmer-to-resign/,fullfact.org,"No, the Supreme Court has not ordered Keir Starmer to resign – Full Fact",0.9,HIGH,True,FALSE - Debunked by fact-checkers,fullfact.org,factcheck,2026-05-06T03:22:00.837286
[DEBUNKED] Fake report of van and truck drivers ramming into Muslim street prayers shared online – Full Fact,https://fullfact.org/crime/van-ram-muslim-prayers-false/,fullfact.org,Fake report of van and truck drivers ramming into Muslim street prayers shared online – Full Fact,0.9,HIGH,True,FALSE - Debunked by fact-checkers,fullfact.org,factcheck,2026-05-06T03:22:01.247480
