claim,source_url,source_domain,article_title,risk_score,risk_category,has_factcheck,factcheck_rating,factcheck_source,source_type,checked_at
[DEBUNKED] Mehrheit der Kreise in Sachsen hat Schulsozialarbeit seit 2024 gekürzt,https://correctiv.org/aktuelles/bildung/2026/03/30/mehrheit-der-kreise-in-sachsen-hat-schulsozialarbeit-seit-2024-gekuerzt/,correctiv.org,Mehrheit der Kreise in Sachsen hat Schulsozialarbeit seit 2024 gekürzt,0.9,HIGH,True,FALSE - Debunked by fact-checkers,correctiv.org,factcheck,2026-03-30T19:02:53.002380
[DEBUNKED] Proteste gegen hohe Spritpreise an Aral-Tankstellen sind erfunden - correctiv.org,https://correctiv.org/faktencheck/aus-der-community/2026/03/30/proteste-gegen-hohe-spritpreise-an-aral-tankstellen-sind-erfunden/,correctiv.org,Proteste gegen hohe Spritpreise an Aral-Tankstellen sind erfunden - correctiv.org,0.9,HIGH,True,FALSE - Debunked by fact-checkers,correctiv.org,factcheck,2026-03-30T19:02:53.732205
[DEBUNKED] Iran-Krieg: Fake-Satellitenbild stellt Brände von Öl-Anlagen falsch dar,https://correctiv.org/faktencheck/2026/03/27/iran-krieg-fake-satellitenbild-stellt-braende-von-oel-anlagen-in-golfstaaten-falsch-dar/,correctiv.org,Iran-Krieg: Fake-Satellitenbild stellt Brände von Öl-Anlagen falsch dar,0.9,HIGH,True,FALSE - Debunked by fact-checkers,correctiv.org,factcheck,2026-03-30T19:02:54.562563
[DEBUNKED] Wahlbetrug in Baden-Württemberg? Video mit Chrupalla in falschen Kontext gesetzt,https://correctiv.org/faktencheck/2026/03/26/video-in-falschem-kontext-tino-chrupalla-hat-keinen-wahlbetrug-in-baden-wuerttemberg-aufgedeckt/,correctiv.org,Wahlbetrug in Baden-Württemberg? Video mit Chrupalla in falschen Kontext gesetzt,0.9,HIGH,True,FALSE - Debunked by fact-checkers,correctiv.org,factcheck,2026-03-30T19:02:55.972164
[DEBUNKED] Ausraster an Berliner Supermarktkasse ist KI-generiert - correctiv.org,https://correctiv.org/faktencheck/aus-der-community/2026/03/26/ausraster-an-berliner-supermarktkasse-ist-ki-generiert/,correctiv.org,Ausraster an Berliner Supermarktkasse ist KI-generiert - correctiv.org,0.9,HIGH,True,FALSE - Debunked by fact-checkers,correctiv.org,factcheck,2026-03-30T19:02:57.390904
"Laut dem Bundesamt für Verfassungsschutz, das bereits Anfang Februar auf die Attacke hingewiesen hatte, ohne jedoch Russland zu nennen, läuft die Phishing-Kampagne „seit mehreren Monaten und ist aktuell noch aktiv“",https://correctiv.org/hybride-kriegsfuehrung/2026/03/25/nach-correctiv-recherche-zu-phishing-attacke-innenpolitiker-sehen-defizite-im-umgang-mit-hybriden-bedrohungen-russlands/,correctiv.org,Politiker fordern nach Phishing-Angriff Schritte gegen hybride Bedrohung,0,LOW,False,,,factcheck,2026-03-30T19:02:58.328426
"(Symbolfoto: picture alliance/dpa | Ronny Hartmann) Rund 900 Millionen Euro will die Bundeswehr für Container ausgeben, in denen Soldatinnen und Soldatinnen zeitweise schlafen sollen",https://correctiv.org/aktuelles/sicherheit-und-verteidigung/2026/03/26/milliardenteure-uebergangsloesung-tausende-soldaten-sollen-in-containern-schlafen-bundeswehr-verteidigungsministerium/,correctiv.org,Bundeswehr: Tausende Soldaten sollen in Containern schlafen,0,LOW,False,,,factcheck,2026-03-30T19:02:59.133503
Das Containerprogramm mit dem Namen „SIPGO“ ist jedoch in sechs EU-weiten Ausschreibungen zu finden: Sie summieren sich auf das Gesamtvolumen von rund 900 Millionen Euro,https://correctiv.org/aktuelles/sicherheit-und-verteidigung/2026/03/26/milliardenteure-uebergangsloesung-tausende-soldaten-sollen-in-containern-schlafen-bundeswehr-verteidigungsministerium/,correctiv.org,Bundeswehr: Tausende Soldaten sollen in Containern schlafen,0,LOW,False,,,factcheck,2026-03-30T19:02:59.190943
Diese haben einen Umfang von mindestens 400 Millionen Euro,https://correctiv.org/aktuelles/sicherheit-und-verteidigung/2026/03/26/milliardenteure-uebergangsloesung-tausende-soldaten-sollen-in-containern-schlafen-bundeswehr-verteidigungsministerium/,correctiv.org,Bundeswehr: Tausende Soldaten sollen in Containern schlafen,0,LOW,False,,,factcheck,2026-03-30T19:02:59.279344
90 12051 Berlin Fax: +49 (0) 30 – 555 780 2 20 Büro Berlin Singerstraße 109 10179 Berlin Buchladen Essen Akazienallee 10 45127 Essen Online-Shop Jugendredaktion Salon5 Alle S,https://correctiv.org/in-eigener-sache/2026/03/25/top-investigativjournalist-martin-murphy-verstaerkt-correctiv/,correctiv.org,Top-Investigativjournalist Martin Murphy verstärkt CORRECTIV - correctiv.org,0.1,LOW,False,,,factcheck,2026-03-30T19:03:00.681991
[DEBUNKED] EU-Strafen für US-Techfirmen sind nicht mit Steuern vergleichbar,https://correctiv.org/faktencheck/2026/03/24/warum-eu-strafgelder-fuer-us-techfirmen-nicht-mit-steuern-europaeischer-firmen-vergleichbar-sind/,correctiv.org,EU-Strafen für US-Techfirmen sind nicht mit Steuern vergleichbar,0.9,HIGH,True,FALSE - Debunked by fact-checkers,correctiv.org,factcheck,2026-03-30T19:03:01.511524
[DEBUNKED] Hackerangriff über Signal: Neue Spuren führen nach Russland - correctiv.org,https://correctiv.org/hybride-kriegsfuehrung/2026/03/24/hackerangriff-ueber-signal-neue-spuren-fuehren-nach-russland-cyber-phishing/,correctiv.org,Hackerangriff über Signal: Neue Spuren führen nach Russland - correctiv.org,0.9,HIGH,True,FALSE - Debunked by fact-checkers,correctiv.org,factcheck,2026-03-30T19:03:02.328813
[DEBUNKED] Warum die Berichte über angebliche Kürzungen bei CORRECTIV falsch sind - correctiv.org,https://correctiv.org/in-eigener-sache/2026/03/24/warum-die-berichte-ueber-angebliche-kuerzungen-bei-correctiv-falsch-sind/,correctiv.org,Warum die Berichte über angebliche Kürzungen bei CORRECTIV falsch sind - correctiv.org,0.9,HIGH,True,FALSE - Debunked by fact-checkers,correctiv.org,factcheck,2026-03-30T19:03:02.921102
[DEBUNKED] Falschbehauptung zu angeblichem Wahlbetrug in Baden-Württemberg,https://correctiv.org/faktencheck/2026/03/23/falsche-behauptungen-zu-angeblichem-wahlbetrug-in-baden-wuerttemberg/,correctiv.org,Falschbehauptung zu angeblichem Wahlbetrug in Baden-Württemberg,0.9,HIGH,True,FALSE - Debunked by fact-checkers,correctiv.org,factcheck,2026-03-30T19:03:03.738346
[DEBUNKED] Die 15 witzigsten &quot;Heimatstrom&quot;-Memes – und wie sie Rechte entlarven - Volksverpetzer,https://www.volksverpetzer.de/aktuelles/witzigsten-heimatstrom-memes/,www.volksverpetzer.de,Die 15 witzigsten &quot;Heimatstrom&quot;-Memes – und wie sie Rechte entlarven - Volksverpetzer,0.9,HIGH,True,FALSE - Debunked by fact-checkers,www.volksverpetzer.de,factcheck,2026-03-30T19:03:05.286880
"Das trifft viele Brauereien hart, weil sie immer wieder in neue Flaschen investieren müssen",https://www.volksverpetzer.de/aktuelles/afd-bayern-bier-teurer/,www.volksverpetzer.de,Die AfD Bayern will dein Bier teurer machen! - Volksverpetzer,0.1,LOW,False,,,factcheck,2026-03-30T19:03:06.170969
[DEBUNKED] Wie du von Rechten bei Gewalt gegen Frauen belogen wirst - Volksverpetzer,https://www.volksverpetzer.de/analyse/merz-gewalt-gegen-frauen/,www.volksverpetzer.de,Wie du von Rechten bei Gewalt gegen Frauen belogen wirst - Volksverpetzer,0.9,HIGH,True,FALSE - Debunked by fact-checkers,www.volksverpetzer.de,factcheck,2026-03-30T19:03:06.997008
[DEBUNKED] Etliche Rügen: So haben euch WELT &amp; BILD über NGOs belogen - Volksverpetzer,https://www.volksverpetzer.de/analyse/welt-bild-ngo-luege-presserat/,www.volksverpetzer.de,Etliche Rügen: So haben euch WELT &amp; BILD über NGOs belogen - Volksverpetzer,0.9,HIGH,True,FALSE - Debunked by fact-checkers,www.volksverpetzer.de,factcheck,2026-03-30T19:03:07.944238
"Die vielen „Einzelfälle“ der inszenierten ""Angriffe"" auf die AfD Erst vor zwei Wochen stellte sich heraus, dass ein „linksextremer Angriff“, der von der AfD in Rosenheim so angezeigt und den Medien so berichtet worden war, gar nie gab",https://www.volksverpetzer.de/aktuelles/afd-auto-angezuendet-fake/,www.volksverpetzer.de,AfD-Mitglied hat Auto selbst angezündet – Nächster Fake-„Antifa-Anschlag“ aufgeflogen! - Volksverpet,0.1,LOW,False,,,factcheck,2026-03-30T19:03:08.993704
"Wie viele Fälle von „linker Gewalt“ gibt es noch, die nie welche waren",https://www.volksverpetzer.de/aktuelles/afd-auto-angezuendet-fake/,www.volksverpetzer.de,AfD-Mitglied hat Auto selbst angezündet – Nächster Fake-„Antifa-Anschlag“ aufgeflogen! - Volksverpet,0.1,LOW,False,,,factcheck,2026-03-30T19:03:09.061174
"Es gab keine Hinweise auf eine Injektion, keine auf einen Anschlag",https://www.volksverpetzer.de/aktuelles/afd-auto-angezuendet-fake/,www.volksverpetzer.de,AfD-Mitglied hat Auto selbst angezündet – Nächster Fake-„Antifa-Anschlag“ aufgeflogen! - Volksverpet,0.1,LOW,False,,,factcheck,2026-03-30T19:03:09.125061
"Während SPD und CDU um den ersten Platz kämpfen, liegt die rechtsextreme AfD in Umfragen seit Monaten stabil auf Platz drei, aktuell mit 19 Prozent",https://www.volksverpetzer.de/analyse/rheinland-pfalz-rechte-landnahme/,www.volksverpetzer.de,Rheinland-Pfalz: Sie wollten das Dorf übernehmen – dann passierte DAS! - Volksverpetzer,0,LOW,False,,,factcheck,2026-03-30T19:03:10.214708
"Bei der letzten Landtagswahl war sie noch bei 8,3 Prozent gelandet",https://www.volksverpetzer.de/analyse/rheinland-pfalz-rechte-landnahme/,www.volksverpetzer.de,Rheinland-Pfalz: Sie wollten das Dorf übernehmen – dann passierte DAS! - Volksverpetzer,0,LOW,False,,,factcheck,2026-03-30T19:03:10.329550
[DEBUNKED] Nur 1000: Rechter KI-Fake über Teilnehmerzahl bei Naidoo-Demo - Volksverpetzer,https://www.volksverpetzer.de/faktencheck/ki-fake-teilnehmer-naidoo-demo/,www.volksverpetzer.de,Nur 1000: Rechter KI-Fake über Teilnehmerzahl bei Naidoo-Demo - Volksverpetzer,0.9,HIGH,True,FALSE - Debunked by fact-checkers,www.volksverpetzer.de,factcheck,2026-03-30T19:03:11.191000
""" kommt, wenn sie in einem Wahlkreis knapp mit 25 % auf Platz 1 liegt*, warum werden ihre Niederlagen verschwiegen",https://www.volksverpetzer.de/analyse/kommunalwahl-ergebnis-ioffenbach-halbiert/,www.volksverpetzer.de,Warum titelt niemand: &quot;AfD-Ergebnis in Offenbach HALBIERT&quot;? - Volksverpetzer,0.1,LOW,False,,,factcheck,2026-03-30T19:03:12.527844
"Wenn sie in Büdingen aber mit 25,36 Prozent der Stimmen knapp Platz 1 belegt, titeln die Medien ""Erdrutsch"" und ""AfD-Sieg""",https://www.volksverpetzer.de/analyse/kommunalwahl-ergebnis-ioffenbach-halbiert/,www.volksverpetzer.de,Warum titelt niemand: &quot;AfD-Ergebnis in Offenbach HALBIERT&quot;? - Volksverpetzer,0,LOW,False,,,factcheck,2026-03-30T19:03:12.590929
Der rechte Flopp in Offenbach bekommt gar keine Aufmerksamkeit,https://www.volksverpetzer.de/analyse/kommunalwahl-ergebnis-ioffenbach-halbiert/,www.volksverpetzer.de,Warum titelt niemand: &quot;AfD-Ergebnis in Offenbach HALBIERT&quot;? - Volksverpetzer,0.1,LOW,False,,,factcheck,2026-03-30T19:03:12.689340
"Im Intranet-Beitrag stand laut t-online allerdings bereits in der Überschrift, dass die neue Kantinenpächterin einlädt",https://www.volksverpetzer.de/faktencheck/ramadan-buffet-nius-blamiert/,www.volksverpetzer.de,Ramadan-Luxusbuffet erfunden: NIUS blamiert sich wieder mit Fake-Story! - Volksverpetzer,0.1,LOW,False,,,factcheck,2026-03-30T19:03:13.769228
"Es war aber keine ""Ramadanfeier"" – und auch Getränke wurden vorher schon ausgeteilt",https://www.volksverpetzer.de/faktencheck/ramadan-buffet-nius-blamiert/,www.volksverpetzer.de,Ramadan-Luxusbuffet erfunden: NIUS blamiert sich wieder mit Fake-Story! - Volksverpetzer,0.1,LOW,False,,,factcheck,2026-03-30T19:03:13.830280
"&nbsp; Hier kombiniert man clever alle rechten Feindbilder&nbsp;– Bürgergeldempfänger, Muslime und Steuergelder",https://www.volksverpetzer.de/faktencheck/ramadan-buffet-nius-blamiert/,www.volksverpetzer.de,Ramadan-Luxusbuffet erfunden: NIUS blamiert sich wieder mit Fake-Story! - Volksverpetzer,0.1,LOW,False,,,factcheck,2026-03-30T19:03:13.896139
[DEBUNKED] Did Obamas open $100M 'Humanitarian Hope Center'? | Snopes.com,https://www.snopes.com/fact-check/obama-humanitarian-hope-center/,www.snopes.com,Did Obamas open $100M 'Humanitarian Hope Center'? | Snopes.com,0.9,HIGH,True,FALSE - Debunked by fact-checkers,www.snopes.com,factcheck,2026-03-30T19:03:14.014362
[DEBUNKED] Did Trump ask DeSantis to pardon Tiger Woods? | Snopes.com,https://www.snopes.com/fact-check/trump-tiger-woods-desantis/,www.snopes.com,Did Trump ask DeSantis to pardon Tiger Woods? | Snopes.com,0.9,HIGH,True,FALSE - Debunked by fact-checkers,www.snopes.com,factcheck,2026-03-30T19:03:14.236575
[DEBUNKED] Inspecting alleged Trump Truth Social post saying he's no longer interested in making Canada the 51st state | Snopes.com,https://www.snopes.com/fact-check/trump-truth-social-canada-51-state/,www.snopes.com,Inspecting alleged Trump Truth Social post saying he's no longer interested in making Canada the 51s,0.9,HIGH,True,FALSE - Debunked by fact-checkers,www.snopes.com,factcheck,2026-03-30T19:03:14.344050
[DEBUNKED] No solid evidence Argentine navy deployed warships to Strait of Hormuz to protect oil tankers | Snopes.com,https://www.snopes.com/fact-check/argentina-strait-hormuz-warships/,www.snopes.com,No solid evidence Argentine navy deployed warships to Strait of Hormuz to protect oil tankers | Snop,0.9,HIGH,True,FALSE - Debunked by fact-checkers,www.snopes.com,factcheck,2026-03-30T19:03:14.802603
[DEBUNKED] Photo of Trump kissing young girl isn't real. Here's the proof | Snopes.com,https://www.snopes.com/fact-check/trump-kissing-girl-fake-photo/,www.snopes.com,Photo of Trump kissing young girl isn't real. Here's the proof | Snopes.com,0.9,HIGH,True,FALSE - Debunked by fact-checkers,www.snopes.com,factcheck,2026-03-30T19:03:14.917089
[DEBUNKED] Don't buy claim BlackRock 'quietly filed' to acquire $22B in single-family homes across 14 states | Snopes.com,https://www.snopes.com/fact-check/blackrock-single-family-homes/,www.snopes.com,Don't buy claim BlackRock 'quietly filed' to acquire $22B in single-family homes across 14 states | ,0.9,HIGH,True,FALSE - Debunked by fact-checkers,www.snopes.com,factcheck,2026-03-30T19:03:15.138396
[DEBUNKED] Probing claim declassified CIA document confirms aliens turned Soviet troops to stone | Snopes.com,https://www.snopes.com/fact-check/cia-document-aliens-soviet-troops/,www.snopes.com,Probing claim declassified CIA document confirms aliens turned Soviet troops to stone | Snopes.com,0.9,HIGH,True,FALSE - Debunked by fact-checkers,www.snopes.com,factcheck,2026-03-30T19:03:15.276648
"Dittrich recorded that behavior in 83% of amplexed females, and it was almost always the first attempted strategy",https://www.snopes.com/news/2026/03/29/female-frogs-scientific-study/,www.snopes.com,Did scientific study reveal some female frogs play dead to avoid mating? | Snopes.com,0.1,LOW,False,,,factcheck,2026-03-30T19:03:15.549114
"If rotation was unsuccessful, 48% of the amplexed females began mimicking mating calls, as if to communicate, ""I'm a male frog, not a female frog",https://www.snopes.com/news/2026/03/29/female-frogs-scientific-study/,www.snopes.com,Did scientific study reveal some female frogs play dead to avoid mating? | Snopes.com,0,LOW,False,,,factcheck,2026-03-30T19:03:15.628543
""" The tonic immobility was a last resort — 33% of amplexed female frogs stiffened their limbs, with ""arms and legs outstretched from the body after being amplexed by a male",https://www.snopes.com/news/2026/03/29/female-frogs-scientific-study/,www.snopes.com,Did scientific study reveal some female frogs play dead to avoid mating? | Snopes.com,0,LOW,False,,,factcheck,2026-03-30T19:03:15.690341
"[DEBUNKED] 8 claims about Cuba, investigated | Snopes.com",https://www.snopes.com/collections/cuba-rumors-collection/,www.snopes.com,"8 claims about Cuba, investigated | Snopes.com",0.9,HIGH,True,FALSE - Debunked by fact-checkers,www.snopes.com,factcheck,2026-03-30T19:03:15.785604
"In Northern Europe, it grew more prevalent this winter, with 30% of cases in Germany, Denmark and The Netherlands linked to the ""cicada"" variant",http://www.politifact.com/article/2026/mar/26/covid-19-variant-cicada-ba32-vaccine-coronavirus/,www.politifact.com,PolitiFact | What we know about the new COVID-19 variant ‘cicada’ or BA.3.2.,0,LOW,False,,,factcheck,2026-03-30T19:03:15.925517
"[DEBUNKED] PolitiFact | After voting by mail in Florida, Trump said mail-in voting means cheating. Pants on Fire!",http://www.politifact.com/factchecks/2026/mar/25/donald-trump/trump-voted-by-mail-in-florida-the-same-month-he-f/,www.politifact.com,"PolitiFact | After voting by mail in Florida, Trump said mail-in voting means cheating. Pants on Fir",0.9,HIGH,True,FALSE - Debunked by fact-checkers,www.politifact.com,factcheck,2026-03-30T19:03:16.085304
"About 95% of TSA’s 60,000 employees are considered essential workers",http://www.politifact.com/article/2026/mar/23/TSA-ICE-DHS-shutdown-funding-paid-Trump-airport/,www.politifact.com,PolitiFact | Why are ICE agents paid during the partial government shutdown but TSA agents aren&#x27,0,LOW,False,,,factcheck,2026-03-30T19:03:16.569535
[DEBUNKED] PolitiFact | This video doesn&#x27;t show Israelis fleeing to Cyprus; it&#x27;s from the Philippines,http://www.politifact.com/factchecks/2026/mar/23/social-media/israelis-fleeing-cyprus-video/,www.politifact.com,PolitiFact | This video doesn&#x27;t show Israelis fleeing to Cyprus; it&#x27;s from the Philippines,0.9,HIGH,True,FALSE - Debunked by fact-checkers,www.politifact.com,factcheck,2026-03-30T19:03:16.673789
"Online searches for gambling addiction help have risen 23% since the 2018 Supreme Court decision, a 2025 JAMA Internal Medicine study found",http://www.politifact.com/article/2026/mar/23/march-madness-sports-betting-gambling-help-support/,www.politifact.com,PolitiFact | Is this March Madness betting cause for concern? How to tell and what to do,0,LOW,False,,,factcheck,2026-03-30T19:03:16.861090
"That’s also true of 22% of Americans broadly, the poll found",http://www.politifact.com/article/2026/mar/23/march-madness-sports-betting-gambling-help-support/,www.politifact.com,PolitiFact | Is this March Madness betting cause for concern? How to tell and what to do,0,LOW,False,,,factcheck,2026-03-30T19:03:16.925448
[DEBUNKED] PolitiFact | Trump says Iran is a country ‘based on disinformation.’ Here’s how Iran conducts influence ops,http://www.politifact.com/article/2026/mar/23/iran-disinformation-campaigns-influence-operations/,www.politifact.com,PolitiFact | Trump says Iran is a country ‘based on disinformation.’ Here’s how Iran conducts influe,0.9,HIGH,True,FALSE - Debunked by fact-checkers,www.politifact.com,factcheck,2026-03-30T19:03:17.117614
"More Info I would like to contribute One Time Monthly Yearly Join Now James Fishback stated on March 11, 2026 in a speech: ""Youth underemployment for college grads is 70%"" nationwide",http://www.politifact.com/factchecks/2026/mar/23/james-fishback/florida-youth-underemployment-college-graduate/,www.politifact.com,"PolitiFact | Is underemployment for young US college grads 70%, as FL governor candidate James Fishb",0,LOW,False,,,factcheck,2026-03-30T19:03:17.302729
"National Jobs Florida James Fishback By Samantha Putterman March 23, 2026 Is underemployment for young US college grads 70%, as FL governor candidate James Fishback says",http://www.politifact.com/factchecks/2026/mar/23/james-fishback/florida-youth-underemployment-college-graduate/,www.politifact.com,"PolitiFact | Is underemployment for young US college grads 70%, as FL governor candidate James Fishb",0,LOW,False,,,factcheck,2026-03-30T19:03:17.382605
The rate since 2008 has ranged from 38% to 48%,http://www.politifact.com/factchecks/2026/mar/23/james-fishback/florida-youth-underemployment-college-graduate/,www.politifact.com,"PolitiFact | Is underemployment for young US college grads 70%, as FL governor candidate James Fishb",0,LOW,False,,,factcheck,2026-03-30T19:03:17.449140
"More Info I would like to contribute One Time Monthly Yearly Join Now Tammy Duckworth stated on March 18, 2026 in an X post: “9% of American citizens don't have the identification that the SAVE act requires to vote",http://www.politifact.com/factchecks/2026/mar/20/tammy-duckworth/SAVE-America-Act-voter-ID-drivers-licenses-REAL-ID/,www.politifact.com,PolitiFact | Do nearly 1 in 10 Americans lack the ID the SAVE America Act would require to vote?,0,LOW,False,,,factcheck,2026-03-30T19:03:17.584547
A 2023 national survey found 9% of adult U,http://www.politifact.com/factchecks/2026/mar/20/tammy-duckworth/SAVE-America-Act-voter-ID-drivers-licenses-REAL-ID/,www.politifact.com,PolitiFact | Do nearly 1 in 10 Americans lack the ID the SAVE America Act would require to vote?,0,LOW,False,,,factcheck,2026-03-30T19:03:17.681940
"citizens could not readily access documentary proof of citizenship, and 9% also lack a nonexpired driver’s license",http://www.politifact.com/factchecks/2026/mar/20/tammy-duckworth/SAVE-America-Act-voter-ID-drivers-licenses-REAL-ID/,www.politifact.com,PolitiFact | Do nearly 1 in 10 Americans lack the ID the SAVE America Act would require to vote?,0,LOW,False,,,factcheck,2026-03-30T19:03:17.749022
[DEBUNKED] Video of 2025 cinema brawl shared with false claims it shows clashes at Tel Aviv airport – Full Fact,https://fullfact.org/conflict/telv-aviv-ben-gurion-aiport-clash-video-false/,fullfact.org,Video of 2025 cinema brawl shared with false claims it shows clashes at Tel Aviv airport – Full Fact,0.9,HIGH,True,FALSE - Debunked by fact-checkers,fullfact.org,factcheck,2026-03-30T19:03:18.349151
[DEBUNKED] UK Cadbury chocolate eggs still say ‘Easter’ on them – Full Fact,https://fullfact.org/culture-and-society/cadbury-chocolate-eggs-easter-repeat/,fullfact.org,UK Cadbury chocolate eggs still say ‘Easter’ on them – Full Fact,0.9,HIGH,True,FALSE - Debunked by fact-checkers,fullfact.org,factcheck,2026-03-30T19:03:18.856557
[DEBUNKED] False claims about Boots mini perfume set giveaway is repeated again – Full Fact,https://fullfact.org/shopping/boots-mini-perfume-false-repeat/,fullfact.org,False claims about Boots mini perfume set giveaway is repeated again – Full Fact,0.9,HIGH,True,FALSE - Debunked by fact-checkers,fullfact.org,factcheck,2026-03-30T19:03:19.251538
[DEBUNKED] Meta Oversight Board thinks Community Notes are inadequate as a standalone solution for addressing harmful misinformation – Full Fact,https://fullfact.org/technology/meta-oversight-board-community-notes-are-inadequate/,fullfact.org,Meta Oversight Board thinks Community Notes are inadequate as a standalone solution for addressing h,0.9,HIGH,True,FALSE - Debunked by fact-checkers,fullfact.org,factcheck,2026-03-30T19:03:20.006925
[DEBUNKED] Fake Keir Starmer post about US leaving NATO circulates online – Full Fact,https://fullfact.org/politics/keir-starmer-america-NATO-bases-statement-x-fake/,fullfact.org,Fake Keir Starmer post about US leaving NATO circulates online – Full Fact,0.9,HIGH,True,FALSE - Debunked by fact-checkers,fullfact.org,factcheck,2026-03-30T19:03:20.500723
[DEBUNKED] Video of 2022 fire in Saudi Arabia shared with false claims it shows Tel Aviv – Full Fact,https://fullfact.org/conflict/2022-saudi-arabia-fire-falsely-shared-as-tel-aviv/,fullfact.org,Video of 2022 fire in Saudi Arabia shared with false claims it shows Tel Aviv – Full Fact,0.9,HIGH,True,FALSE - Debunked by fact-checkers,fullfact.org,factcheck,2026-03-30T19:03:20.959755
"5% in 2027, and we will hit that",https://fullfact.org/politics/keir-starmer-270-billion-defence/,fullfact.org,Defence spending is not set to get an extra £270 billion – Full Fact,0,LOW,False,,,factcheck,2026-03-30T19:03:21.779698
[DEBUNKED] Old footage of market fire shared with false claims it shows Dubai airport in flames – Full Fact,https://fullfact.org/conflict/dubai-airport-fire-miscaptioned-old-footage/,fullfact.org,Old footage of market fire shared with false claims it shows Dubai airport in flames – Full Fact,0.9,HIGH,True,FALSE - Debunked by fact-checkers,fullfact.org,factcheck,2026-03-30T19:03:22.276309
"According to&nbsp;a 2023 survey&nbsp;by New York University’s Brennan Center for Justice and other groups, more than 9% of Americans of voting age, or 21",https://www.factcheck.org/2026/03/competing-claims-on-save-america-act-disenfranchising-voters/,www.factcheck.org,Competing Claims on SAVE America Act Disenfranchising Voters - FactCheck.org,0,LOW,False,,,factcheck,2026-03-30T19:03:22.491892
[DEBUNKED] EPA’s Misleading Claim of $1.3 Trillion in Deregulatory ‘Savings’ - FactCheck.org,https://www.factcheck.org/2026/03/epas-misleading-claim-of-1-3-trillion-in-deregulatory-savings/,www.factcheck.org,EPA’s Misleading Claim of $1.3 Trillion in Deregulatory ‘Savings’ - FactCheck.org,0.9,HIGH,True,FALSE - Debunked by fact-checkers,www.factcheck.org,factcheck,2026-03-30T19:03:23.068498
[DEBUNKED] Biden Makes Flawed Comparisons with Trump - FactCheck.org,https://www.factcheck.org/2026/03/biden-makes-flawed-comparisons-with-trump/,www.factcheck.org,Biden Makes Flawed Comparisons with Trump - FactCheck.org,0.9,HIGH,True,FALSE - Debunked by fact-checkers,www.factcheck.org,factcheck,2026-03-30T19:03:25.144808
[DEBUNKED] FactChecking Claims in Casey Means&#039; Surgeon General Confirmation Hearing - FactCheck.org,https://www.factcheck.org/2026/03/factchecking-claims-in-casey-means-surgeon-general-confirmation-hearing/,www.factcheck.org,FactChecking Claims in Casey Means&#039; Surgeon General Confirmation Hearing - FactCheck.org,0.9,HIGH,True,FALSE - Debunked by fact-checkers,www.factcheck.org,factcheck,2026-03-30T19:03:25.641859
