claim,source_url,source_domain,article_title,risk_score,risk_category,has_factcheck,factcheck_rating,factcheck_source,source_type,checked_at
[DEBUNKED] Videos don’t show traffic lights ‘melting’ due to heatwave – Full Fact,https://fullfact.org/environment/video-traffic-light-melting-heatwave-false/,fullfact.org,Videos don’t show traffic lights ‘melting’ due to heatwave – Full Fact,0.9,HIGH,True,FALSE - Debunked by fact-checkers,fullfact.org,factcheck,2026-07-08T08:31:03.260714
[DEBUNKED] False claim cancer is ‘trying to heal’ shared again online – Full Fact,https://fullfact.org/health/cancer-tumours-toxins-repeat/,fullfact.org,False claim cancer is ‘trying to heal’ shared again online – Full Fact,0.9,HIGH,True,FALSE - Debunked by fact-checkers,fullfact.org,factcheck,2026-07-08T08:31:03.768738
[DEBUNKED] Democratic Group Makes False Claim in Insider-Trading Ad Attacking Susan Collins - FactCheck.org,https://www.factcheck.org/2026/07/democratic-group-makes-false-claim-in-insider-trading-ad-attacking-susan-collins/,www.factcheck.org,Democratic Group Makes False Claim in Insider-Trading Ad Attacking Susan Collins - FactCheck.org,0.9,HIGH,True,FALSE - Debunked by fact-checkers,www.factcheck.org,factcheck,2026-07-08T08:31:05.437472
[DEBUNKED] How Trump&#039;s Preliminary Deal with Iran Compares with His Rhetoric - FactCheck.org,https://www.factcheck.org/2026/06/how-trumps-preliminary-deal-with-iran-compares-with-his-rhetoric/,www.factcheck.org,How Trump&#039;s Preliminary Deal with Iran Compares with His Rhetoric - FactCheck.org,0.9,HIGH,True,FALSE - Debunked by fact-checkers,www.factcheck.org,factcheck,2026-07-08T08:31:06.062395
"&#8220;We cut the flow of fentanyl across our border by 59%, which is unheard of,&#8221; Trump said in May 22 remarks in New York",https://www.factcheck.org/2026/06/trump-makes-unsupported-claims-about-drug-flows/,www.factcheck.org,Trump Makes Unsupported Claims About Drug Flows - FactCheck.org,0,LOW,False,,,factcheck,2026-07-08T08:31:06.754365
"&#8220;And we cut the flow of fentanyl and drugs into our country by the ocean and the sea, in other words, coming in by water, by ocean and sea by 97%",https://www.factcheck.org/2026/06/trump-makes-unsupported-claims-about-drug-flows/,www.factcheck.org,Trump Makes Unsupported Claims About Drug Flows - FactCheck.org,0,LOW,False,,,factcheck,2026-07-08T08:31:06.832914
"Then, on May 28, in an interview with his daughter-in-law, Lara Trump, on Fox News, he said, &#8220;We have drugs down 97%",https://www.factcheck.org/2026/06/trump-makes-unsupported-claims-about-drug-flows/,www.factcheck.org,Trump Makes Unsupported Claims About Drug Flows - FactCheck.org,0,LOW,False,,,factcheck,2026-07-08T08:31:06.915551
"[DEBUNKED] Fact Check: Congressman Jack Kimble Did NOT Speak With Senator Mitch McConnell On July 7, 2026 -- Or Ever | Lead Stories",https://leadstories.com/hoax-alert/2026/07/fact-check-congressman-jack-kimble-did-not-speak-with-mitch-mcconnell.html,leadstories.com,"Fact Check: Congressman Jack Kimble Did NOT Speak With Senator Mitch McConnell On July 7, 2026 -- Or",0.9,HIGH,True,FALSE - Debunked by fact-checkers,leadstories.com,factcheck,2026-07-08T08:31:07.479707
"[DEBUNKED] Fact Check: FAKE Image Does NOT Show Tall Ships Sailing Near Liberty Island In New York Harbor On July 4, 2026 | Lead Stories",https://leadstories.com/hoax-alert/2026/07/fact-check-fake-image-does-not-show-real-tall-ships-sailing-near-liberty-island.html,leadstories.com,Fact Check: FAKE Image Does NOT Show Tall Ships Sailing Near Liberty Island In New York Harbor On Ju,0.9,HIGH,True,FALSE - Debunked by fact-checkers,leadstories.com,factcheck,2026-07-08T08:31:07.634586
[DEBUNKED] Fact Check: Mitch McConnell's Wife Elaine Chao Did NOT Go To China After He Was Hospitalized With 'Cardiac Arrest' -- Had Been There For Days | Lead Stories,https://leadstories.com/hoax-alert/2026/07/fact-check-mitch-mcconnells-wife-elaine-chao-did-not-go-to-china-after-he-was-hospitalized-with-cardiac-arrest.html,leadstories.com,Fact Check: Mitch McConnell's Wife Elaine Chao Did NOT Go To China After He Was Hospitalized With 'C,0.9,HIGH,True,FALSE - Debunked by fact-checkers,leadstories.com,factcheck,2026-07-08T08:31:07.761572
[DEBUNKED] Prebunk: Fake Digital Natives Used To Sell Indigenous Jackets -- 'Artificial Indians' Bank On Sympathy For Real Native Americans | Lead Stories,https://leadstories.com/hoax-alert/2026/07/prebunk-fake-digital-natives-used-to-sell-indigenous-jackets-artificial-indians-bank-on-sympathy-for-real-native-americans.html,leadstories.com,Prebunk: Fake Digital Natives Used To Sell Indigenous Jackets -- 'Artificial Indians' Bank On Sympat,0.9,HIGH,True,FALSE - Debunked by fact-checkers,leadstories.com,factcheck,2026-07-08T08:31:07.892572
"[DEBUNKED] Fact Check: Saint-Michel Basilica in Bordeaux, France, Was NOT Set On Fire By Immigrants in July 2026 -- Basilica Remained Intact | Lead Stories",https://leadstories.com/hoax-alert/2026/07/fact-check-saint-michel-basilica-in-bordeaux-france-was-not-set-on-fire-by-immigrants-in-july-2026.html,leadstories.com,"Fact Check: Saint-Michel Basilica in Bordeaux, France, Was NOT Set On Fire By Immigrants in July 202",0.9,HIGH,True,FALSE - Debunked by fact-checkers,leadstories.com,factcheck,2026-07-08T08:31:08.011389
[DEBUNKED] Fact Check: Mamdani Was NOT Barred From Katz's Deli In New York City -- Claim Originated On Parody Hub | Lead Stories,https://leadstories.com/hoax-alert/2026/07/fact-check-mamdani-was-not-barred-from-katzs-deli-in-new-york-city-claim-originated-on-parody-hub.html,leadstories.com,Fact Check: Mamdani Was NOT Barred From Katz's Deli In New York City -- Claim Originated On Parody H,0.9,HIGH,True,FALSE - Debunked by fact-checkers,leadstories.com,factcheck,2026-07-08T08:31:08.139177
[DEBUNKED] Fact Check: FAKE Bodycam Footage Shows Kidnapped Child Being Rescued At Orlando Airport -- Made With Google AI | Lead Stories,https://leadstories.com/hoax-alert/2026/07/fact-check-fake-bodycam-footage-of-the-moment-a-kidnapped-child-was-rescued-at-orlando-airport-made-with-google-ai.html,leadstories.com,Fact Check: FAKE Bodycam Footage Shows Kidnapped Child Being Rescued At Orlando Airport -- Made With,0.9,HIGH,True,FALSE - Debunked by fact-checkers,leadstories.com,factcheck,2026-07-08T08:31:08.292357
[DEBUNKED] Fact Check: FAKE Trump Post Says 'Belgium Is 2 Weeks Away From Developing A Nuclear Bomb!' | Lead Stories,https://leadstories.com/hoax-alert/2026/07/fact-check-fake-trump-post-says-belgium-is-2-weeks-away-from-developing-a-nuclear-bomb.html,leadstories.com,Fact Check: FAKE Trump Post Says 'Belgium Is 2 Weeks Away From Developing A Nuclear Bomb!' | Lead St,0.9,HIGH,True,FALSE - Debunked by fact-checkers,leadstories.com,factcheck,2026-07-08T08:31:08.416779
[DEBUNKED] Prebunk: Believing Fake Promo Videos For Christian Clothing Brand Requires Leap Of Faith -- AI Breaks Commandment Against Lying | Lead Stories,https://leadstories.com/hoax-alert/2026/07/prebunk-believing-fake-promo-videos-for-christian-clothing-brand-requires-leap-of-faith.html,leadstories.com,Prebunk: Believing Fake Promo Videos For Christian Clothing Brand Requires Leap Of Faith -- AI Break,0.9,HIGH,True,FALSE - Debunked by fact-checkers,leadstories.com,factcheck,2026-07-08T08:31:08.547267
[DEBUNKED] Fact Check: NO EVIDENCE Photo Of Donald Trump Sleeping With His Mouth Open During Fourth Of July Fireworks Is Real | Lead Stories,https://leadstories.com/hoax-alert/2026/07/fact-check-no-evidence-photo-of-donald-trump-sleeping-with-his-mouth-open-during-fourth-of-july-fireworks-is-real.html,leadstories.com,Fact Check: NO EVIDENCE Photo Of Donald Trump Sleeping With His Mouth Open During Fourth Of July Fir,0.9,HIGH,True,FALSE - Debunked by fact-checkers,leadstories.com,factcheck,2026-07-08T08:31:08.689873
[DEBUNKED] Fact Check: Euronews Did NOT Report That Zelenskyy's Parents Were Detained For Laundering $11 Million -- Story Is Fabricated | Lead Stories,https://leadstories.com/hoax-alert/2026/07/fact-check-euronews-did-not-report-that-zelenskyys-parents-were-detained-for-laundering-11-million.html,leadstories.com,Fact Check: Euronews Did NOT Report That Zelenskyy's Parents Were Detained For Laundering $11 Millio,0.9,HIGH,True,FALSE - Debunked by fact-checkers,leadstories.com,factcheck,2026-07-08T08:31:08.823278
[DEBUNKED] Fact Check: Trump Did NOT Post A Fake Video Of Folarin Balogun Showing 'Trump Card' After His Red Card In World Cup Game | Lead Stories,https://leadstories.com/hoax-alert/2026/07/fact-check-trump-did-not-post-fake-video-folarin-balogun-Trump-card-after-red-card-world-cup-game.html,leadstories.com,Fact Check: Trump Did NOT Post A Fake Video Of Folarin Balogun Showing 'Trump Card' After His Red Ca,0.9,HIGH,True,FALSE - Debunked by fact-checkers,leadstories.com,factcheck,2026-07-08T08:31:08.973839
[DEBUNKED] Fact Check: Mamdani Did NOT Only Put Iran's Flag on New York Subway Trains -- 48 World Cup Team Countries Total | Lead Stories,https://leadstories.com/hoax-alert/2026/07/fact-check-mamdani-did-not-only-put-irans-flag-on-new-york-subway-trains-48-world-cup-team-countries-total.html,leadstories.com,Fact Check: Mamdani Did NOT Only Put Iran's Flag on New York Subway Trains -- 48 World Cup Team Coun,0.9,HIGH,True,FALSE - Debunked by fact-checkers,leadstories.com,factcheck,2026-07-08T08:31:09.105081
[DEBUNKED] Fact Check: FAKE 'Before Patriot Front' Video Seems To Show Woman From Reuters Photo--But It Was Made With Google AI | Lead Stories,https://leadstories.com/hoax-alert/2026/07/fact-check-fake-before-patriot-front-video-seems-to-show-woman-from-reuters-photo-but-it-was-made-with-google-ai.html,leadstories.com,Fact Check: FAKE 'Before Patriot Front' Video Seems To Show Woman From Reuters Photo--But It Was Mad,0.9,HIGH,True,FALSE - Debunked by fact-checkers,leadstories.com,factcheck,2026-07-08T08:31:09.232432
[DEBUNKED] Fact Check: Breakfast Attack In London Video Is NOT Real-Life Footage -- It Is AI-Generated | Lead Stories,https://leadstories.com/hoax-alert/2026/07/fact-check-video-of-breakfast-attack-in-london-is-not-real-life-footage.html,leadstories.com,Fact Check: Breakfast Attack In London Video Is NOT Real-Life Footage -- It Is AI-Generated | Lead S,0.9,HIGH,True,FALSE - Debunked by fact-checkers,leadstories.com,factcheck,2026-07-08T08:31:09.372866
"Zum Login SPIEGEL plus Nur für Neukunden € 1,– für 4 Wochen danach € 5,99 pro Woche Freier Zugriff auf alle S+-Artikel auf SPIEGEL",https://www.spiegel.de/kultur/die-damentoilette-22-liebeserklaerungen-eine-replik-an-denis-scheck-a-55caa5c0-eb6a-4571-a5f7-0c51aafaa0d9#ref=rss,www.spiegel.de,»Die Damentoilette. 22 Liebeserklärungen« - eine Replik an Denis Scheck - DER SPIEGEL,0.1,LOW,False,,,mainstream,2026-07-08T08:31:18.380627
"E-Paper (PDF), Digital-Archiv und S+-Newsletter Jederzeit kündigen Jetzt abonnieren SPIEGEL plus 52 Wochen 25 % sparen € 4,49 pro Woche für 52 Wochen danach € 5,99 pro Woche Freier Zugriff auf alle S+-Artikel auf SPIEGEL",https://www.spiegel.de/kultur/die-damentoilette-22-liebeserklaerungen-eine-replik-an-denis-scheck-a-55caa5c0-eb6a-4571-a5f7-0c51aafaa0d9#ref=rss,www.spiegel.de,»Die Damentoilette. 22 Liebeserklärungen« - eine Replik an Denis Scheck - DER SPIEGEL,0.1,LOW,False,,,mainstream,2026-07-08T08:31:18.462589
"Zum Login SPIEGEL plus Nur für Neukunden € 1,– für 4 Wochen danach € 5,99 pro Woche Freier Zugriff auf alle S+-Artikel auf SPIEGEL",https://www.spiegel.de/sport/fussball/wm-2026-mats-hummels-juergen-klopp-oder-christoph-kramer-das-tv-experten-ranking-a-208f0329-61b7-4317-90ae-a133703566ba#ref=rss,www.spiegel.de,"WM 2026: Mats Hummels, Jürgen Klopp oder Christoph Kramer? – das TV-Experten-Ranking - DER SPIEGEL",0.1,LOW,False,,,mainstream,2026-07-08T08:31:19.756547
"E-Paper (PDF), Digital-Archiv und S+-Newsletter Jederzeit kündigen Jetzt abonnieren SPIEGEL plus 52 Wochen 25 % sparen € 4,49 pro Woche für 52 Wochen danach € 5,99 pro Woche Freier Zugriff auf alle S+-Artikel auf SPIEGEL",https://www.spiegel.de/sport/fussball/wm-2026-mats-hummels-juergen-klopp-oder-christoph-kramer-das-tv-experten-ranking-a-208f0329-61b7-4317-90ae-a133703566ba#ref=rss,www.spiegel.de,"WM 2026: Mats Hummels, Jürgen Klopp oder Christoph Kramer? – das TV-Experten-Ranking - DER SPIEGEL",0.1,LOW,False,,,mainstream,2026-07-08T08:31:19.838574
Laut den Münchner Wirstchaftsforschern würde die Regierung Investitionen aus dem Sondervermögen Infrastruktur und Klimaneutralität (SVIK) in die schuldenfinanzierte Bereichsausnahme für ​Verteidigung verschieben,https://www.spiegel.de/wirtschaft/haushalt-ifo-institut-wirft-bundesregierung-buchungstricks-vor-a-2c03c88e-12b3-4e28-bdfb-7bbdb26a88b2#ref=rss,www.spiegel.de,Haushalt: Ifo-Institut wirft Bundesregierung Buchungstricks vor - DER SPIEGEL,0,LOW,False,,,mainstream,2026-07-08T08:31:20.552207
"«Auffällige 4,2 Milliarden EuroLaut den Ifo-Experten stechen vor allem 4,2 Milliarden Euro, die bisher für den Bau von Straßen und Schienen aus dem SVIK kommen sollten, heraus",https://www.spiegel.de/wirtschaft/haushalt-ifo-institut-wirft-bundesregierung-buchungstricks-vor-a-2c03c88e-12b3-4e28-bdfb-7bbdb26a88b2#ref=rss,www.spiegel.de,Haushalt: Ifo-Institut wirft Bundesregierung Buchungstricks vor - DER SPIEGEL,0.1,LOW,False,,,mainstream,2026-07-08T08:31:20.629151
"Ohne die Umbuchung läge die Investitionsquote des Bundeshaushalts laut den Ifo-Berechnungen bei 9,9 Prozent und nicht bei den ausgewiesenen 10,8 Prozent",https://www.spiegel.de/wirtschaft/haushalt-ifo-institut-wirft-bundesregierung-buchungstricks-vor-a-2c03c88e-12b3-4e28-bdfb-7bbdb26a88b2#ref=rss,www.spiegel.de,Haushalt: Ifo-Institut wirft Bundesregierung Buchungstricks vor - DER SPIEGEL,0,LOW,False,,,mainstream,2026-07-08T08:31:20.711282
"Im Fünf-Jahres-Vergleich liege die Kostensteigerung bei 30 bis 40 Prozent, über 15 Jahre bei mehr als 50 Prozent",https://www.spiegel.de/wirtschaft/unternehmen/energiewende-enbw-stellt-ausbauziele-fuer-windkraft-infrage-a-8847ad8a-80a3-4ff7-9483-ce172bb531bf#ref=rss,www.spiegel.de,Energiewende: EnBW stellt Ausbauziele für Windkraft infrage - DER SPIEGEL,0,LOW,False,,,mainstream,2026-07-08T08:31:21.324591
Suchmaßnahmen laufenNach offiziellen Angaben haben pakistanische Militär- und Zivilbehörden kurz nach dem Verschwinden des Flugzeugs Such- und Rettungsmaßnahmen eingeleitet,https://www.spiegel.de/panorama/pakistan-frachtflugzeug-verschwindet-ueber-dem-arabischen-meer-a-72fa8044-cff3-4681-9083-ef2384cab95e#ref=rss,www.spiegel.de,Pakistan: Frachtflugzeug verschwindet über dem Arabischen Meer - DER SPIEGEL,0,LOW,False,,,mainstream,2026-07-08T08:31:22.010861
"Man habe bisher jedoch keine Unfallstelle lokalisieren können, erfuhr die Nachrichtenagentur dpa von der pakistanischen Luftfahrtbehörde",https://www.spiegel.de/panorama/pakistan-frachtflugzeug-verschwindet-ueber-dem-arabischen-meer-a-72fa8044-cff3-4681-9083-ef2384cab95e#ref=rss,www.spiegel.de,Pakistan: Frachtflugzeug verschwindet über dem Arabischen Meer - DER SPIEGEL,0.1,LOW,False,,,mainstream,2026-07-08T08:31:22.092772
"Zum Login SPIEGEL plus Nur für Neukunden € 1,– für 4 Wochen danach € 5,99 pro Woche Freier Zugriff auf alle S+-Artikel auf SPIEGEL",https://www.spiegel.de/sport/extremsportlerin-kelsey-pfendler-fuer-einen-weltrekord-ruderte-sie-sich-den-hintern-wund-a-d63016ac-7fa0-49f9-b577-1184beb0dcfe#ref=rss,www.spiegel.de,Extremsportlerin Kelsey Pfendler: Für einen Weltrekord ruderte sie sich den Hintern wund - DER SPIEG,0.1,LOW,False,,,mainstream,2026-07-08T08:31:22.713125
"E-Paper (PDF), Digital-Archiv und S+-Newsletter Jederzeit kündigen Jetzt abonnieren SPIEGEL plus 52 Wochen 25 % sparen € 4,49 pro Woche für 52 Wochen danach € 5,99 pro Woche Freier Zugriff auf alle S+-Artikel auf SPIEGEL",https://www.spiegel.de/sport/extremsportlerin-kelsey-pfendler-fuer-einen-weltrekord-ruderte-sie-sich-den-hintern-wund-a-d63016ac-7fa0-49f9-b577-1184beb0dcfe#ref=rss,www.spiegel.de,Extremsportlerin Kelsey Pfendler: Für einen Weltrekord ruderte sie sich den Hintern wund - DER SPIEG,0.1,LOW,False,,,mainstream,2026-07-08T08:31:22.755371
"length - 1, 500, false)"" data-area=""nav-bar"" data-app-hidden x-lazyload> Menü Startseite Politik Deutschland Lars Klingbeil Haushaltspolitik: Lieber 25 Euro Kinderzuschlag streichen, als Milliardäre fair besteuern",https://www.spiegel.de/politik/deutschland/haushaltspolitik-lieber-25-euro-kinderzuschlag-streichen-als-milliardaere-fair-besteuern-meinung-a-29517339-ed06-4bbe-99ea-378f0648c64b#ref=rss,www.spiegel.de,"Haushaltspolitik: Lieber 25 Euro Kinderzuschlag streichen, als Milliardäre fair besteuern? – Meinung",0,LOW,False,,,mainstream,2026-07-08T08:31:23.390872
Andere Nutzungen verletzen das Urheberrecht meinung &bull;Schwarz-roter Haushalt Lieber 25 Euro Kinderzuschlag streichen als Milliardäre fair besteuern,https://www.spiegel.de/politik/deutschland/haushaltspolitik-lieber-25-euro-kinderzuschlag-streichen-als-milliardaere-fair-besteuern-meinung-a-29517339-ed06-4bbe-99ea-378f0648c64b#ref=rss,www.spiegel.de,"Haushaltspolitik: Lieber 25 Euro Kinderzuschlag streichen, als Milliardäre fair besteuern? – Meinung",0,LOW,False,,,mainstream,2026-07-08T08:31:23.468185
"Zum Login SPIEGEL plus Nur für Neukunden € 1,– für 4 Wochen danach € 5,99 pro Woche Freier Zugriff auf alle S+-Artikel auf SPIEGEL",https://www.spiegel.de/politik/deutschland/haushaltspolitik-lieber-25-euro-kinderzuschlag-streichen-als-milliardaere-fair-besteuern-meinung-a-29517339-ed06-4bbe-99ea-378f0648c64b#ref=rss,www.spiegel.de,"Haushaltspolitik: Lieber 25 Euro Kinderzuschlag streichen, als Milliardäre fair besteuern? – Meinung",0.1,LOW,False,,,mainstream,2026-07-08T08:31:23.549324
"Zum Login SPIEGEL plus Nur für Neukunden € 1,– für 4 Wochen danach € 5,99 pro Woche Freier Zugriff auf alle S+-Artikel auf SPIEGEL",https://www.spiegel.de/international/germany/new-information-in-the-nazi-database-what-you-need-to-know-about-the-ss-a-f7e09472-e9da-4b11-9846-87f1778116e3#ref=rss,www.spiegel.de,New Information in the Nazi Database: What You Need to Know About the SS - DER SPIEGEL,0.1,LOW,False,,,mainstream,2026-07-08T08:31:24.154953
"E-Paper (PDF), Digital-Archiv und S+-Newsletter Jederzeit kündigen Jetzt abonnieren SPIEGEL plus 52 Wochen 25 % sparen € 4,49 pro Woche für 52 Wochen danach € 5,99 pro Woche Freier Zugriff auf alle S+-Artikel auf SPIEGEL",https://www.spiegel.de/international/germany/new-information-in-the-nazi-database-what-you-need-to-know-about-the-ss-a-f7e09472-e9da-4b11-9846-87f1778116e3#ref=rss,www.spiegel.de,New Information in the Nazi Database: What You Need to Know About the SS - DER SPIEGEL,0.1,LOW,False,,,mainstream,2026-07-08T08:31:24.194987
»Erfolg hat immer seinen Preis – man muss viel investieren und gleichzeitig auf anderes verzichten,https://www.spiegel.de/panorama/leute/rick-astley-spricht-ueber-durchbruch-rueckzug-und-comeback-a-8732abec-d908-4d9f-ad18-8812ea784bfc#ref=rss,www.spiegel.de,"Rick Astley spricht über Durchbruch, Rückzug und Comeback - DER SPIEGEL",0.1,LOW,False,,,mainstream,2026-07-08T08:31:24.811300
"Zum Login SPIEGEL plus Nur für Neukunden € 1,– für 4 Wochen danach € 5,99 pro Woche Freier Zugriff auf alle S+-Artikel auf SPIEGEL",https://www.spiegel.de/sport/fussball/fussball-wm-news-heute-juergen-klopp-wollte-dass-rudi-voeller-dfb-sportdirektor-bleibt-a-ff998775-e5ff-4969-a28b-ea17a49a433a#ref=rss,www.spiegel.de,Fußball-WM News heute: Ägypten-Trainer spricht nach Aus gegen Argentinien von Spielmanipulation - DE,0.1,LOW,False,,,mainstream,2026-07-08T08:31:25.458843
"E-Paper (PDF), Digital-Archiv und S+-Newsletter Jederzeit kündigen Jetzt abonnieren SPIEGEL plus 52 Wochen 25 % sparen € 4,49 pro Woche für 52 Wochen danach € 5,99 pro Woche Freier Zugriff auf alle S+-Artikel auf SPIEGEL",https://www.spiegel.de/sport/fussball/fussball-wm-news-heute-juergen-klopp-wollte-dass-rudi-voeller-dfb-sportdirektor-bleibt-a-ff998775-e5ff-4969-a28b-ea17a49a433a#ref=rss,www.spiegel.de,Fußball-WM News heute: Ägypten-Trainer spricht nach Aus gegen Argentinien von Spielmanipulation - DE,0.1,LOW,False,,,mainstream,2026-07-08T08:31:25.537757
"Zum Login SPIEGEL plus Nur für Neukunden € 1,– für 4 Wochen danach € 5,99 pro Woche Freier Zugriff auf alle S+-Artikel auf SPIEGEL",https://www.spiegel.de/wirtschaft/service/waermepumpen-regierung-kuerzt-foerderung-was-hauseigentuemer-jetzt-tun-sollten-a-cd2776f4-a10a-4adb-944c-ca7a4cfa590a#ref=rss,www.spiegel.de,Wärmepumpen: Regierung kürzt Förderung – was Hauseigentümer jetzt tun sollten - DER SPIEGEL,0.1,LOW,False,,,mainstream,2026-07-08T08:31:26.157037
"E-Paper (PDF), Digital-Archiv und S+-Newsletter Jederzeit kündigen Jetzt abonnieren SPIEGEL plus 52 Wochen 25 % sparen € 4,49 pro Woche für 52 Wochen danach € 5,99 pro Woche Freier Zugriff auf alle S+-Artikel auf SPIEGEL",https://www.spiegel.de/wirtschaft/service/waermepumpen-regierung-kuerzt-foerderung-was-hauseigentuemer-jetzt-tun-sollten-a-cd2776f4-a10a-4adb-944c-ca7a4cfa590a#ref=rss,www.spiegel.de,Wärmepumpen: Regierung kürzt Förderung – was Hauseigentümer jetzt tun sollten - DER SPIEGEL,0.1,LOW,False,,,mainstream,2026-07-08T08:31:26.235762
Laut dem Betreiber sei das Problem am Dienstagabend ⁠in ⁠den meisten Regionen wieder behoben gewesen,https://www.spiegel.de/ausland/kuba-menschen-in-havanna-protestieren-nach-landesweitem-stromausfall-a-a8646826-a4a4-4851-90ea-a75d556b39ca#ref=rss,www.spiegel.de,Kuba: Menschen in Havanna protestieren nach landesweitem Stromausfall - DER SPIEGEL,0,LOW,False,,,mainstream,2026-07-08T08:31:26.848704
"The penalty was reduced by 30% given Virgin Media admitted its failing and agreed to settle the case, Ofcom added",https://www.bbc.co.uk/news/articles/c982vm2jzl1o?at_medium=RSS&amp;at_campaign=rss,www.bbc.co.uk,Virgin Media fined Â£28m for preventing customers from cancelling contracts - BBC News,0,LOW,False,,,mainstream,2026-07-08T08:31:27.221489
"5% of GDP spent on defence by 2035, a target agreed by nearly all Nato members last year",https://www.bbc.co.uk/news/articles/ckg4e3lwzqzo?at_medium=RSS&amp;at_campaign=rss,www.bbc.co.uk,Nato allies announce Â£37bn for new missile project - BBC News,0,LOW,False,,,mainstream,2026-07-08T08:31:27.357143
"Trump has repeatedly made clear he wants Nato members to contribute more to defence spending in Europe and at last year&#x27;s Nato summit, members of the alliance agreed to spend 5% of GDP on defence and security by 2035",https://www.bbc.co.uk/news/articles/ckg4e3lwzqzo?at_medium=RSS&amp;at_campaign=rss,www.bbc.co.uk,Nato allies announce Â£37bn for new missile project - BBC News,0,LOW,False,,,mainstream,2026-07-08T08:31:27.440445
The government said Nato had scrambled fighter jets to intercept Russian aircraft approaching allied airspace more than 700 times and that Russian military activity around UK waters had surged 30%,https://www.bbc.co.uk/news/articles/ckg4e3lwzqzo?at_medium=RSS&amp;at_campaign=rss,www.bbc.co.uk,Nato allies announce Â£37bn for new missile project - BBC News,0,LOW,False,,,mainstream,2026-07-08T08:31:27.480244
"&quot;We need to eat our water as well as drink it,&quot; says Dr Daly, &quot;80-90% of fruit and vegetables are f",https://www.bbc.co.uk/news/articles/clyw89g3443o?at_medium=RSS&amp;at_campaign=rss,www.bbc.co.uk,More or less protein? What to eat to get you through a heatwave  - BBC News,0,LOW,False,,,mainstream,2026-07-08T08:31:27.794823
"&quot;Cornell&#x27;s research found users cut back most on calorie-dense, processed foods, spending 10% less on savoury snacks, for example",https://www.bbc.co.uk/news/articles/cy49w2knlrdo?at_medium=RSS&amp;at_campaign=rss,www.bbc.co.uk,From mouthwash to hair dye: How weight-loss jabs are changing shopping habits - BBC News,0,LOW,False,,,mainstream,2026-07-08T08:31:28.050752
