claim,source_url,source_domain,article_title,risk_score,risk_category,has_factcheck,factcheck_rating,factcheck_source,source_type,checked_at
[DEBUNKED] Nur 1000: Rechter KI-Fake über Teilnehmerzahl bei Naidoo-Demo - Volksverpetzer,https://www.volksverpetzer.de/faktencheck/ki-fake-teilnehmer-naidoo-demo/,www.volksverpetzer.de,Nur 1000: Rechter KI-Fake über Teilnehmerzahl bei Naidoo-Demo - Volksverpetzer,0.9,HIGH,True,FALSE - Debunked by fact-checkers,www.volksverpetzer.de,factcheck,2026-03-29T18:47:19.547261
""" kommt, wenn sie in einem Wahlkreis knapp mit 25 % auf Platz 1 liegt*, warum werden ihre Niederlagen verschwiegen",https://www.volksverpetzer.de/analyse/kommunalwahl-ergebnis-ioffenbach-halbiert/,www.volksverpetzer.de,Warum titelt niemand: &quot;AfD-Ergebnis in Offenbach HALBIERT&quot;? - Volksverpetzer,0.1,LOW,False,,,factcheck,2026-03-29T18:47:20.498724
"Wenn sie in Büdingen aber mit 25,36 Prozent der Stimmen knapp Platz 1 belegt, titeln die Medien ""Erdrutsch"" und ""AfD-Sieg""",https://www.volksverpetzer.de/analyse/kommunalwahl-ergebnis-ioffenbach-halbiert/,www.volksverpetzer.de,Warum titelt niemand: &quot;AfD-Ergebnis in Offenbach HALBIERT&quot;? - Volksverpetzer,0,LOW,False,,,factcheck,2026-03-29T18:47:20.565940
Der rechte Flopp in Offenbach bekommt gar keine Aufmerksamkeit,https://www.volksverpetzer.de/analyse/kommunalwahl-ergebnis-ioffenbach-halbiert/,www.volksverpetzer.de,Warum titelt niemand: &quot;AfD-Ergebnis in Offenbach HALBIERT&quot;? - Volksverpetzer,0.1,LOW,False,,,factcheck,2026-03-29T18:47:20.626934
"Im Intranet-Beitrag stand laut t-online allerdings bereits in der Überschrift, dass die neue Kantinenpächterin einlädt",https://www.volksverpetzer.de/faktencheck/ramadan-buffet-nius-blamiert/,www.volksverpetzer.de,Ramadan-Luxusbuffet erfunden: NIUS blamiert sich wieder mit Fake-Story! - Volksverpetzer,0.1,LOW,False,,,factcheck,2026-03-29T18:47:21.599995
"Es war aber keine ""Ramadanfeier"" – und auch Getränke wurden vorher schon ausgeteilt",https://www.volksverpetzer.de/faktencheck/ramadan-buffet-nius-blamiert/,www.volksverpetzer.de,Ramadan-Luxusbuffet erfunden: NIUS blamiert sich wieder mit Fake-Story! - Volksverpetzer,0.1,LOW,False,,,factcheck,2026-03-29T18:47:21.663470
"&nbsp; Hier kombiniert man clever alle rechten Feindbilder&nbsp;– Bürgergeldempfänger, Muslime und Steuergelder",https://www.volksverpetzer.de/faktencheck/ramadan-buffet-nius-blamiert/,www.volksverpetzer.de,Ramadan-Luxusbuffet erfunden: NIUS blamiert sich wieder mit Fake-Story! - Volksverpetzer,0.1,LOW,False,,,factcheck,2026-03-29T18:47:21.733376
"[DEBUNKED] 8 claims about Cuba, investigated | Snopes.com",https://www.snopes.com/collections/cuba-rumors-collection/,www.snopes.com,"8 claims about Cuba, investigated | Snopes.com",0.9,HIGH,True,FALSE - Debunked by fact-checkers,www.snopes.com,factcheck,2026-03-29T18:47:21.840300
[DEBUNKED] Is Erika Kirk banned from Romania due to child trafficking? Baseless claim resurfaces | Snopes.com,https://www.snopes.com/news/2026/03/29/erika-kirk-banned-romania/,www.snopes.com,Is Erika Kirk banned from Romania due to child trafficking? Baseless claim resurfaces | Snopes.com,0.9,HIGH,True,FALSE - Debunked by fact-checkers,www.snopes.com,factcheck,2026-03-29T18:47:21.950219
"[DEBUNKED] Did Ted Lieu claim Epstein paid Pam Bondi's college, law school tuition? | Snopes.com",https://www.snopes.com/fact-check/ted-lieu-pam-bondis-tuition-epstein/,www.snopes.com,"Did Ted Lieu claim Epstein paid Pam Bondi's college, law school tuition? | Snopes.com",0.9,HIGH,True,FALSE - Debunked by fact-checkers,www.snopes.com,factcheck,2026-03-29T18:47:22.056120
[DEBUNKED] Did US Army raise maximum enlistment age to 42? Here's the full story | Snopes.com,https://www.snopes.com/fact-check/us-army-enlistment-age/,www.snopes.com,Did US Army raise maximum enlistment age to 42? Here's the full story | Snopes.com,0.9,HIGH,True,FALSE - Debunked by fact-checkers,www.snopes.com,factcheck,2026-03-29T18:47:22.167092
[DEBUNKED] 16 rumors about mail-in ballots we've inspected | Snopes.com,https://www.snopes.com/collections/mail-in-ballots-rumors-collection/,www.snopes.com,16 rumors about mail-in ballots we've inspected | Snopes.com,0.9,HIGH,True,FALSE - Debunked by fact-checkers,www.snopes.com,factcheck,2026-03-29T18:47:22.281869
[DEBUNKED] Inspecting alleged Trump Truth Social post saying he's no longer interested in making Canada the 51st state | Snopes.com,https://www.snopes.com/fact-check/trump-truth-social-canada-51-state/,www.snopes.com,Inspecting alleged Trump Truth Social post saying he's no longer interested in making Canada the 51s,0.9,HIGH,True,FALSE - Debunked by fact-checkers,www.snopes.com,factcheck,2026-03-29T18:47:22.803271
[DEBUNKED] Hegseth's pastor said he wants Democratic Texas Rep. James Talarico 'crucified.' Here's context | Snopes.com,https://www.snopes.com/fact-check/hegseth-pastor-talarico-crucified/,www.snopes.com,Hegseth's pastor said he wants Democratic Texas Rep. James Talarico 'crucified.' Here's context | Sn,0.9,HIGH,True,FALSE - Debunked by fact-checkers,www.snopes.com,factcheck,2026-03-29T18:47:22.891270
[DEBUNKED] Did Trump mistake White House patio umbrellas for Iranian officials? | Snopes.com,https://www.snopes.com/fact-check/trump-umbrellas-iran/,www.snopes.com,Did Trump mistake White House patio umbrellas for Iranian officials? | Snopes.com,0.9,HIGH,True,FALSE - Debunked by fact-checkers,www.snopes.com,factcheck,2026-03-29T18:47:22.993610
"In Northern Europe, it grew more prevalent this winter, with 30% of cases in Germany, Denmark and The Netherlands linked to the ""cicada"" variant",http://www.politifact.com/article/2026/mar/26/covid-19-variant-cicada-ba32-vaccine-coronavirus/,www.politifact.com,PolitiFact | What we know about the new COVID-19 variant ‘cicada’ or BA.3.2.,0,LOW,False,,,factcheck,2026-03-29T18:47:23.443982
"[DEBUNKED] PolitiFact | After voting by mail in Florida, Trump said mail-in voting means cheating. Pants on Fire!",http://www.politifact.com/factchecks/2026/mar/25/donald-trump/trump-voted-by-mail-in-florida-the-same-month-he-f/,www.politifact.com,"PolitiFact | After voting by mail in Florida, Trump said mail-in voting means cheating. Pants on Fir",0.9,HIGH,True,FALSE - Debunked by fact-checkers,www.politifact.com,factcheck,2026-03-29T18:47:23.623975
"About 95% of TSA’s 60,000 employees are considered essential workers",http://www.politifact.com/article/2026/mar/23/TSA-ICE-DHS-shutdown-funding-paid-Trump-airport/,www.politifact.com,PolitiFact | Why are ICE agents paid during the partial government shutdown but TSA agents aren&#x27,0,LOW,False,,,factcheck,2026-03-29T18:47:24.088679
[DEBUNKED] PolitiFact | This video doesn&#x27;t show Israelis fleeing to Cyprus; it&#x27;s from the Philippines,http://www.politifact.com/factchecks/2026/mar/23/social-media/israelis-fleeing-cyprus-video/,www.politifact.com,PolitiFact | This video doesn&#x27;t show Israelis fleeing to Cyprus; it&#x27;s from the Philippines,0.9,HIGH,True,FALSE - Debunked by fact-checkers,www.politifact.com,factcheck,2026-03-29T18:47:24.182200
"Online searches for gambling addiction help have risen 23% since the 2018 Supreme Court decision, a 2025 JAMA Internal Medicine study found",http://www.politifact.com/article/2026/mar/23/march-madness-sports-betting-gambling-help-support/,www.politifact.com,PolitiFact | Is this March Madness betting cause for concern? How to tell and what to do,0,LOW,False,,,factcheck,2026-03-29T18:47:24.324595
"That’s also true of 22% of Americans broadly, the poll found",http://www.politifact.com/article/2026/mar/23/march-madness-sports-betting-gambling-help-support/,www.politifact.com,PolitiFact | Is this March Madness betting cause for concern? How to tell and what to do,0,LOW,False,,,factcheck,2026-03-29T18:47:24.384047
[DEBUNKED] PolitiFact | Trump says Iran is a country ‘based on disinformation.’ Here’s how Iran conducts influence ops,http://www.politifact.com/article/2026/mar/23/iran-disinformation-campaigns-influence-operations/,www.politifact.com,PolitiFact | Trump says Iran is a country ‘based on disinformation.’ Here’s how Iran conducts influe,0.9,HIGH,True,FALSE - Debunked by fact-checkers,www.politifact.com,factcheck,2026-03-29T18:47:24.564073
"More Info I would like to contribute One Time Monthly Yearly Join Now James Fishback stated on March 11, 2026 in a speech: ""Youth underemployment for college grads is 70%"" nationwide",http://www.politifact.com/factchecks/2026/mar/23/james-fishback/florida-youth-underemployment-college-graduate/,www.politifact.com,"PolitiFact | Is underemployment for young US college grads 70%, as FL governor candidate James Fishb",0,LOW,False,,,factcheck,2026-03-29T18:47:24.711649
"National Jobs Florida James Fishback By Samantha Putterman March 23, 2026 Is underemployment for young US college grads 70%, as FL governor candidate James Fishback says",http://www.politifact.com/factchecks/2026/mar/23/james-fishback/florida-youth-underemployment-college-graduate/,www.politifact.com,"PolitiFact | Is underemployment for young US college grads 70%, as FL governor candidate James Fishb",0,LOW,False,,,factcheck,2026-03-29T18:47:24.771878
The rate since 2008 has ranged from 38% to 48%,http://www.politifact.com/factchecks/2026/mar/23/james-fishback/florida-youth-underemployment-college-graduate/,www.politifact.com,"PolitiFact | Is underemployment for young US college grads 70%, as FL governor candidate James Fishb",0,LOW,False,,,factcheck,2026-03-29T18:47:24.830070
"More Info I would like to contribute One Time Monthly Yearly Join Now Tammy Duckworth stated on March 18, 2026 in an X post: “9% of American citizens don't have the identification that the SAVE act requires to vote",http://www.politifact.com/factchecks/2026/mar/20/tammy-duckworth/SAVE-America-Act-voter-ID-drivers-licenses-REAL-ID/,www.politifact.com,PolitiFact | Do nearly 1 in 10 Americans lack the ID the SAVE America Act would require to vote?,0,LOW,False,,,factcheck,2026-03-29T18:47:24.971936
A 2023 national survey found 9% of adult U,http://www.politifact.com/factchecks/2026/mar/20/tammy-duckworth/SAVE-America-Act-voter-ID-drivers-licenses-REAL-ID/,www.politifact.com,PolitiFact | Do nearly 1 in 10 Americans lack the ID the SAVE America Act would require to vote?,0,LOW,False,,,factcheck,2026-03-29T18:47:25.032968
"citizens could not readily access documentary proof of citizenship, and 9% also lack a nonexpired driver’s license",http://www.politifact.com/factchecks/2026/mar/20/tammy-duckworth/SAVE-America-Act-voter-ID-drivers-licenses-REAL-ID/,www.politifact.com,PolitiFact | Do nearly 1 in 10 Americans lack the ID the SAVE America Act would require to vote?,0,LOW,False,,,factcheck,2026-03-29T18:47:25.094827
[DEBUNKED] Meta Oversight Board thinks Community Notes are inadequate as a standalone solution for addressing harmful misinformation – Full Fact,https://fullfact.org/technology/meta-oversight-board-community-notes-are-inadequate/,fullfact.org,Meta Oversight Board thinks Community Notes are inadequate as a standalone solution for addressing h,0.9,HIGH,True,FALSE - Debunked by fact-checkers,fullfact.org,factcheck,2026-03-29T18:47:25.579886
[DEBUNKED] Fake Keir Starmer post about US leaving NATO circulates online – Full Fact,https://fullfact.org/politics/keir-starmer-america-NATO-bases-statement-x-fake/,fullfact.org,Fake Keir Starmer post about US leaving NATO circulates online – Full Fact,0.9,HIGH,True,FALSE - Debunked by fact-checkers,fullfact.org,factcheck,2026-03-29T18:47:26.077702
[DEBUNKED] Video of 2022 fire in Saudi Arabia shared with false claims it shows Tel Aviv – Full Fact,https://fullfact.org/conflict/2022-saudi-arabia-fire-falsely-shared-as-tel-aviv/,fullfact.org,Video of 2022 fire in Saudi Arabia shared with false claims it shows Tel Aviv – Full Fact,0.9,HIGH,True,FALSE - Debunked by fact-checkers,fullfact.org,factcheck,2026-03-29T18:47:26.574179
"5% in 2027, and we will hit that",https://fullfact.org/politics/keir-starmer-270-billion-defence/,fullfact.org,Defence spending is not set to get an extra £270 billion – Full Fact,0,LOW,False,,,factcheck,2026-03-29T18:47:27.409590
[DEBUNKED] Old footage of market fire shared with false claims it shows Dubai airport in flames – Full Fact,https://fullfact.org/conflict/dubai-airport-fire-miscaptioned-old-footage/,fullfact.org,Old footage of market fire shared with false claims it shows Dubai airport in flames – Full Fact,0.9,HIGH,True,FALSE - Debunked by fact-checkers,fullfact.org,factcheck,2026-03-29T18:47:27.872856
[DEBUNKED] Fake Farage X post about Trump on £5 notes circulates – Full Fact,https://fullfact.org/politics/nigel-farage-donald-trump-5-pound-notes-fake-x-post/,fullfact.org,Fake Farage X post about Trump on £5 notes circulates – Full Fact,0.9,HIGH,True,FALSE - Debunked by fact-checkers,fullfact.org,factcheck,2026-03-29T18:47:28.357106
[DEBUNKED] Fake image of Jewish charity ambulances on fire shared online – Full Fact,https://fullfact.org/crime/fake-image-jewish-charity-ambulances-on-fire/,fullfact.org,Fake image of Jewish charity ambulances on fire shared online – Full Fact,0.9,HIGH,True,FALSE - Debunked by fact-checkers,fullfact.org,factcheck,2026-03-29T18:47:28.820358
"[DEBUNKED] Video shows queue for fuel in Spain, not UK – Full Fact",https://fullfact.org/economy/video-fuel-queue-spain-not-uk/,fullfact.org,"Video shows queue for fuel in Spain, not UK – Full Fact",0.9,HIGH,True,FALSE - Debunked by fact-checkers,fullfact.org,factcheck,2026-03-29T18:47:29.310221
[DEBUNKED] Footage doesn’t show attack on the King Fahd causeway – Full Fact,https://fullfact.org/conflict/king-fahd-bridge-attack-false/,fullfact.org,Footage doesn’t show attack on the King Fahd causeway – Full Fact,0.9,HIGH,True,FALSE - Debunked by fact-checkers,fullfact.org,factcheck,2026-03-29T18:47:29.818372
"According to&nbsp;a 2023 survey&nbsp;by New York University’s Brennan Center for Justice and other groups, more than 9% of Americans of voting age, or 21",https://www.factcheck.org/2026/03/competing-claims-on-save-america-act-disenfranchising-voters/,www.factcheck.org,Competing Claims on SAVE America Act Disenfranchising Voters - FactCheck.org,0,LOW,False,,,factcheck,2026-03-29T18:47:29.976730
[DEBUNKED] EPA’s Misleading Claim of $1.3 Trillion in Deregulatory ‘Savings’ - FactCheck.org,https://www.factcheck.org/2026/03/epas-misleading-claim-of-1-3-trillion-in-deregulatory-savings/,www.factcheck.org,EPA’s Misleading Claim of $1.3 Trillion in Deregulatory ‘Savings’ - FactCheck.org,0.9,HIGH,True,FALSE - Debunked by fact-checkers,www.factcheck.org,factcheck,2026-03-29T18:47:30.150663
[DEBUNKED] Biden Makes Flawed Comparisons with Trump - FactCheck.org,https://www.factcheck.org/2026/03/biden-makes-flawed-comparisons-with-trump/,www.factcheck.org,Biden Makes Flawed Comparisons with Trump - FactCheck.org,0.9,HIGH,True,FALSE - Debunked by fact-checkers,www.factcheck.org,factcheck,2026-03-29T18:47:31.153182
[DEBUNKED] FactChecking Claims in Casey Means&#039; Surgeon General Confirmation Hearing - FactCheck.org,https://www.factcheck.org/2026/03/factchecking-claims-in-casey-means-surgeon-general-confirmation-hearing/,www.factcheck.org,FactChecking Claims in Casey Means&#039; Surgeon General Confirmation Hearing - FactCheck.org,0.9,HIGH,True,FALSE - Debunked by fact-checkers,www.factcheck.org,factcheck,2026-03-29T18:47:31.238405
"[DEBUNKED] Fact Check: No Trump Post About Ground Operation In Iran That Would Be Strong, Precise And Successful -- Fake Truth Social Screenshot | Lead Stories",https://leadstories.com/hoax-alert/2026/03/fact-check-trump-truth-social-iran-ground-operation-strong-precise-successful.html,leadstories.com,"Fact Check: No Trump Post About Ground Operation In Iran That Would Be Strong, Precise And Successfu",0.9,HIGH,True,FALSE - Debunked by fact-checkers,leadstories.com,factcheck,2026-03-29T18:47:31.397267
[DEBUNKED] Fact Check: Dancing Man Video NOT Leaked From Kash Patel's Gmail Account -- Has Been Online For Years | Lead Stories,https://leadstories.com/hoax-alert/2026/03/fact-check-kash-patel-leaked-gmail-video-dancing.html,leadstories.com,Fact Check: Dancing Man Video NOT Leaked From Kash Patel's Gmail Account -- Has Been Online For Year,0.9,HIGH,True,FALSE - Debunked by fact-checkers,leadstories.com,factcheck,2026-03-29T18:47:31.559184
[DEBUNKED] Fact Check: Satire Story About Trump Being Furious After 'Pro Kings' Rally Drew 'Sparse Crowd' Is NOT Real | Lead Stories,https://leadstories.com/hoax-alert/2026/03/fact-check-trump-furious-after-pro-kings-rally-draws-sparse-crowd.html,leadstories.com,Fact Check: Satire Story About Trump Being Furious After 'Pro Kings' Rally Drew 'Sparse Crowd' Is NO,0.9,HIGH,True,FALSE - Debunked by fact-checkers,leadstories.com,factcheck,2026-03-29T18:47:31.697677
[DEBUNKED] Fact Check: FAKE Screenshot Shows Trump Calling For Tiger Woods Pardon In DUI Case -- No Such Truth Social Post | Lead Stories,https://leadstories.com/hoax-alert/2026/03/fact-check-tiger-woods-trump-dui-pardon-ron-desantis.html,leadstories.com,Fact Check: FAKE Screenshot Shows Trump Calling For Tiger Woods Pardon In DUI Case -- No Such Truth ,0.9,HIGH,True,FALSE - Debunked by fact-checkers,leadstories.com,factcheck,2026-03-29T18:47:31.847183
[DEBUNKED] Fact Check: Trump Quote About Attacks From '17 Different Angles' Involving Carrier Was About U.S. Attacking Venezuela -- NOT Iran | Lead Stories,https://leadstories.com/hoax-alert/2026/03/fact-check-trump-carrier-17-angles-iran-one-in-the-morning.html,leadstories.com,Fact Check: Trump Quote About Attacks From '17 Different Angles' Involving Carrier Was About U.S. At,0.9,HIGH,True,FALSE - Debunked by fact-checkers,leadstories.com,factcheck,2026-03-29T18:47:31.998652
"[DEBUNKED] Fact Check: 'Lock Him Up For Lying To Congress' NOT Real Quote From Gavin Newsom, Others -- Foreign Clickbait | Lead Stories",https://leadstories.com/hoax-alert/2026/03/fact-check-lock-him-up-for-lying-to-congress-not-real-quote-from-gavin-newsom-others-foreign-clickbait.html,leadstories.com,"Fact Check: 'Lock Him Up For Lying To Congress' NOT Real Quote From Gavin Newsom, Others -- Foreign ",0.9,HIGH,True,FALSE - Debunked by fact-checkers,leadstories.com,factcheck,2026-03-29T18:47:32.150334
"[DEBUNKED] Fact Check: Mark Twain Did NOT Say, 'If You Don't Read The Newspaper, You're Uninformed. If You Do Read It, You're Misinformed' | Lead Stories",https://leadstories.com/hoax-alert/2026/03/fact-check-mark-twain-did-not-say-if-you-dont-read-the-newspaper-youre-uninformed-if-you-do-read-it-youre-misinformed.html,leadstories.com,"Fact Check: Mark Twain Did NOT Say, 'If You Don't Read The Newspaper, You're Uninformed. If You Do R",0.9,HIGH,True,FALSE - Debunked by fact-checkers,leadstories.com,factcheck,2026-03-29T18:47:32.305864
"[DEBUNKED] Fact Check: Video Of Transgender, LGBTQ+ People Blocked From Women's Restrooms Is NOT Real Footage | Lead Stories",https://leadstories.com/hoax-alert/2026/03/fact-check-video-of-transgender-lgbtq-people-blocked-from-womens-restrooms-is-not-real-footage.html,leadstories.com,"Fact Check: Video Of Transgender, LGBTQ+ People Blocked From Women's Restrooms Is NOT Real Footage |",0.9,HIGH,True,FALSE - Debunked by fact-checkers,leadstories.com,factcheck,2026-03-29T18:47:32.471508
[DEBUNKED] Fact Check: Photo Does NOT Show Hillary Clinton Pulling Jeffrey Epstein's Tie In Front Of Bill Clinton -- It's AI-Generated | Lead Stories,https://leadstories.com/hoax-alert/2026/03/fact-check-photo-does-not-show-hillary-clinton-pulling-jeffrey-epsteins-tie-in-front-of-bill-clinton.html,leadstories.com,Fact Check: Photo Does NOT Show Hillary Clinton Pulling Jeffrey Epstein's Tie In Front Of Bill Clint,0.9,HIGH,True,FALSE - Debunked by fact-checkers,leadstories.com,factcheck,2026-03-29T18:47:32.623182
[DEBUNKED] Fact Check: Skit Of ICE Agent Removing a U.S. Citizen From A Plane Is NOT Real | Lead Stories,https://leadstories.com/hoax-alert/2026/03/fact-check-skit-ice-agent-remove-us-citizen-plane-not-real.html,leadstories.com,Fact Check: Skit Of ICE Agent Removing a U.S. Citizen From A Plane Is NOT Real | Lead Stories,0.9,HIGH,True,FALSE - Debunked by fact-checkers,leadstories.com,factcheck,2026-03-29T18:47:32.786979
[DEBUNKED] Fact Check: Lunch Date Video Does NOT Show Real Woman Confronted By Her Husband For Cheating -- It's Staged Scene | Lead Stories,https://leadstories.com/hoax-alert/2026/03/fact-check-lunch-date-video-does-not-show-real-woman-confronted-by-her-husband-for-cheating.html,leadstories.com,Fact Check: Lunch Date Video Does NOT Show Real Woman Confronted By Her Husband For Cheating -- It's,0.9,HIGH,True,FALSE - Debunked by fact-checkers,leadstories.com,factcheck,2026-03-29T18:47:32.946554
[DEBUNKED] Fact Check: Video Does NOT Show Iranian Missiles Destroying U.S. Navy Warship In Strait Of Hormuz | Lead Stories,https://leadstories.com/hoax-alert/2026/03/fact-check-video-does-not-show-iranian-missiles-destroying-us-navy-warship-in-strait-of-hormuz.html,leadstories.com,Fact Check: Video Does NOT Show Iranian Missiles Destroying U.S. Navy Warship In Strait Of Hormuz | ,0.9,HIGH,True,FALSE - Debunked by fact-checkers,leadstories.com,factcheck,2026-03-29T18:47:33.098289
"[DEBUNKED] Fact Check: Erika Kirk Did NOT Announce She Is Opening An Orphanage ""In Honor Of Charlie"" -- It's A False Rumor Started From Clickbait | Lead Stories",https://leadstories.com/hoax-alert/2026/03/fact-check-erika-kirk-did-not-announce-she-is-opening-an-orphanage-in-honor-of-charlie.html,leadstories.com,"Fact Check: Erika Kirk Did NOT Announce She Is Opening An Orphanage ""In Honor Of Charlie"" -- It's A ",0.9,HIGH,True,FALSE - Debunked by fact-checkers,leadstories.com,factcheck,2026-03-29T18:47:33.261328
"[DEBUNKED] Fact Check: FAKE Photo Shows Hollywood Actors, Including Stallone and Schwarzenegger, Attending Chuck Norris' Funeral -- It's AI | Lead Stories",https://leadstories.com/hoax-alert/2026/03/fact-check-fake-photo-shows-hollywood-actors-including-stallone-and-schwarzenegger-attending-chuck-norris-funeral.html,leadstories.com,"Fact Check: FAKE Photo Shows Hollywood Actors, Including Stallone and Schwarzenegger, Attending Chuc",0.9,HIGH,True,FALSE - Debunked by fact-checkers,leadstories.com,factcheck,2026-03-29T18:47:33.420527
[DEBUNKED] Fact Check: Wolff's Book About Trump Does NOT Mention 'Gorilla Channel' -- It's A Joke From 2018 | Lead Stories,https://leadstories.com/hoax-alert/2026/03/fact-check-wolffs-book-about-trump-does-not-mention-gorilla-channel.html,leadstories.com,Fact Check: Wolff's Book About Trump Does NOT Mention 'Gorilla Channel' -- It's A Joke From 2018 | L,0.9,HIGH,True,FALSE - Debunked by fact-checkers,leadstories.com,factcheck,2026-03-29T18:47:33.564828
[DEBUNKED] Savannah Guthrie opens up about mother’s disappearance in heart-wrenching interview - Poynter,https://www.poynter.org/commentary/2026/savannah-guthrie-today-show-interview-hoda/,www.poynter.org,Savannah Guthrie opens up about mother’s disappearance in heart-wrenching interview - Poynter,0.9,HIGH,True,FALSE - Debunked by fact-checkers,www.poynter.org,factcheck,2026-03-29T18:47:33.650229
"(AP Photo/Julie Jacobson) By: Amaris Castillo March 26, 2026 --> --> About a quarter of all AM/FM radio stations in the United States have a faith focus, and 98% of U",https://www.poynter.org/reporting-editing/2026/christian-news-radio-united-states/,www.poynter.org,"A quarter of US radio stations are religious, and most listeners aren’t tuning in for politics, stud",0,LOW,False,,,factcheck,2026-03-29T18:47:33.912230
"Among listeners, 62% of those surveyed said they tune in because the content is “spiritually uplifting",https://www.poynter.org/reporting-editing/2026/christian-news-radio-united-states/,www.poynter.org,"A quarter of US radio stations are religious, and most listeners aren’t tuning in for politics, stud",0,LOW,False,,,factcheck,2026-03-29T18:47:33.976323
"Forty percent said those topics are a minor reason for listening to these stations, and just 14% called it a major one",https://www.poynter.org/reporting-editing/2026/christian-news-radio-united-states/,www.poynter.org,"A quarter of US radio stations are religious, and most listeners aren’t tuning in for politics, stud",0.1,LOW,False,,,factcheck,2026-03-29T18:47:34.038167
[DEBUNKED] IFCN Director Angie Drobnic Holan comments on Meta and community notes following the Oversight Board’s recent advisory - Poynter,https://www.poynter.org/ifcn/2026/ifcn-director-angie-drobnic-holan-comments-on-meta-and-community-notes-following-the-oversight-boards-recent-advisory/,www.poynter.org,IFCN Director Angie Drobnic Holan comments on Meta and community notes following the Oversight Board,0.9,HIGH,True,FALSE - Debunked by fact-checkers,www.poynter.org,factcheck,2026-03-29T18:47:34.135336
"Meta is responsible for 70% of that, while YouTube is responsible for the other 30%",https://www.poynter.org/commentary/2026/meta-and-youtube-lawsuit-social-media-addiction/,www.poynter.org,Big Tech just lost a ‘social media addiction’ case. It may not be the last. - Poynter,0,LOW,False,,,factcheck,2026-03-29T18:47:34.284388
"(Courtesy: Spencer Najera) By: Alex Mahadevan March 26, 2026 --> --> Of the 440 applications Texas Tribune chief product officer Darla Cameron received for an AI engineering role, 90% were junk",https://www.poynter.org/tech-tools/2026/how-to-start-using-ai-journalism/,www.poynter.org,AI advice from journalists who stopped talking and started building - Poynter,0,LOW,False,,,factcheck,2026-03-29T18:47:34.475137
