claim,source_url,source_domain,article_title,risk_score,risk_category,has_factcheck,factcheck_rating,factcheck_source,source_type,checked_at
[DEBUNKED] Fact Check: Parody Post Said Mariah Carey Told Justin Bieber Off About Diddy Parties -- Not Real News | Lead Stories,https://leadstories.com/hoax-alert/2026/05/fact-check-parody-post-said-mariah-carey-told-justin-bieber-off-about-Diddy-parties.html,leadstories.com,Fact Check: Parody Post Said Mariah Carey Told Justin Bieber Off About Diddy Parties -- Not Real New,0.9,HIGH,True,FALSE - Debunked by fact-checkers,leadstories.com,factcheck,2026-05-14T19:48:23.640450
[DEBUNKED] Fact Check: FAKE Image of Trump And Musk Eating Panda Express On Air Force One Flight To China Is NOT Real Photo  | Lead Stories,https://leadstories.com/hoax-alert/2026/05/fact-check-fake-image-of-trump-and-musk-eating-panda-express-on-air-force-one.html,leadstories.com,Fact Check: FAKE Image of Trump And Musk Eating Panda Express On Air Force One Flight To China Is NO,0.9,HIGH,True,FALSE - Debunked by fact-checkers,leadstories.com,factcheck,2026-05-14T19:48:23.825269
[DEBUNKED] Fact Check: U.S. Supreme Court Did NOT Issue 7-2 Ruling Abolishing Income Tax Under Case Number 24-1791 -- Case Does NOT Exist | Lead Stories,https://leadstories.com/hoax-alert/2026/05/fact-check-us-supreme-court-did-not-issue-7-2-ruling-abolishing-income-tax-case-24-1791.html,leadstories.com,Fact Check: U.S. Supreme Court Did NOT Issue 7-2 Ruling Abolishing Income Tax Under Case Number 24-1,0.9,HIGH,True,FALSE - Debunked by fact-checkers,leadstories.com,factcheck,2026-05-14T19:48:23.993874
[DEBUNKED] Fact Check: Posts Saying Your Favorite Celeb Publicly Claimed 'Pro-Israel American Billionaires' Are Working To Undermine Their Career Are NOT Real -- Spam From Vietnam | Lead Stories,https://leadstories.com/hoax-alert/2026/05/fact-check-posts-saying-fav-celeb-claimed-pro-israeli-american-billionaires-undermine-career-not-real.html,leadstories.com,Fact Check: Posts Saying Your Favorite Celeb Publicly Claimed 'Pro-Israel American Billionaires' Are,0.9,HIGH,True,FALSE - Debunked by fact-checkers,leadstories.com,factcheck,2026-05-14T19:48:24.157670
[DEBUNKED] Fact Check: FAKE Video Shows Michael Jackson Sitting On A Bus In Brazil -- It's AI | Lead Stories,https://leadstories.com/hoax-alert/2026/05/fact-check-fake-video-michael-jackson-sitting-on-bus-in-brazil-ts-ai.html,leadstories.com,Fact Check: FAKE Video Shows Michael Jackson Sitting On A Bus In Brazil -- It's AI | Lead Stories,0.9,HIGH,True,FALSE - Debunked by fact-checkers,leadstories.com,factcheck,2026-05-14T19:48:24.351214
[DEBUNKED] Fact Check: NO EVIDENCE Real Magazine Article Said Melania Trump Was 'Poppers Girl At An East Village Gay Bar'  | Lead Stories,https://leadstories.com/hoax-alert/2026/05/fact-check-no-evidence-real-magazine-article-said-melania-trump-was-poppers-girl.html,leadstories.com,Fact Check: NO EVIDENCE Real Magazine Article Said Melania Trump Was 'Poppers Girl At An East Villag,0.9,HIGH,True,FALSE - Debunked by fact-checkers,leadstories.com,factcheck,2026-05-14T19:48:24.524385
[DEBUNKED] Fact Check: Trump Administration's Counterterrorism Document Does NOT Mention 'Pro-Transgender' Groups And 'We Will Kill You' On The Same Page | Lead Stories,https://leadstories.com/hoax-alert/2026/05/fact-check-trump-administrations-counterterrorism-document-does-not-mention-pro-transgender-groups-and-we-will-kill-you-on-the-same-page.html,leadstories.com,Fact Check: Trump Administration's Counterterrorism Document Does NOT Mention 'Pro-Transgender' Grou,0.9,HIGH,True,FALSE - Debunked by fact-checkers,leadstories.com,factcheck,2026-05-14T19:48:24.722901
[DEBUNKED] Fact Check: Photo Of Star-Shaped Object Was NOT Released In Department Of War UFO Files -- It Predates The Release | Lead Stories,https://leadstories.com/hoax-alert/2026/05/fact-check-photo-star-shaped-object-not-released-department-war-ufo-files.html,leadstories.com,Fact Check: Photo Of Star-Shaped Object Was NOT Released In Department Of War UFO Files -- It Predat,0.9,HIGH,True,FALSE - Debunked by fact-checkers,leadstories.com,factcheck,2026-05-14T19:48:24.901230
[DEBUNKED] Fact Check: FAKE Video Shows U.S. Warship On Fire After Iranian Attack -- It Did NOT Happen | Lead Stories,https://leadstories.com/hoax-alert/2026/05/fact-check-fake-video-shows-us-warship-on-fire-after-iranian-attack.html,leadstories.com,Fact Check: FAKE Video Shows U.S. Warship On Fire After Iranian Attack -- It Did NOT Happen | Lead S,0.9,HIGH,True,FALSE - Debunked by fact-checkers,leadstories.com,factcheck,2026-05-14T19:48:25.081401
[DEBUNKED] Fact Check: FAKE Video Shows Pro-Palestinian Activists Smashing The Albion Arms Pub In England -- It's AI-Generated | Lead Stories,https://leadstories.com/hoax-alert/2026/05/fact-check-fake-video-shows-pro-palestinian-activists-smashing-the-albion-arms-pub-in-england-its-ai-generated.html,leadstories.com,Fact Check: FAKE Video Shows Pro-Palestinian Activists Smashing The Albion Arms Pub In England -- It,0.9,HIGH,True,FALSE - Debunked by fact-checkers,leadstories.com,factcheck,2026-05-14T19:48:25.255503
[DEBUNKED] Fact Check: Hantavirus Cruise Ship Influencer Jake Rosmarin Was NOT The COVID-19 Patient Shown In A 2022 BBC Report -- That Was Henry Dyne | Lead Stories,https://leadstories.com/hoax-alert/2026/05/fact-check-hantavirus-cruise-ship-influencer-jake-rosmarin-was-not-the-covid-patient-shown-in-a-2022-bbc-report.html,leadstories.com,Fact Check: Hantavirus Cruise Ship Influencer Jake Rosmarin Was NOT The COVID-19 Patient Shown In A ,0.9,HIGH,True,FALSE - Debunked by fact-checkers,leadstories.com,factcheck,2026-05-14T19:48:25.434853
"Although hantavirus’ mortality rate is quite high — close to 40% for some strains — there is not evidence it easily spreads or mutates, making it more likely that the public health response can keep pace to reduce further spread",https://www.poynter.org/fact-checking/2026/is-hantavirus-next-pandemic-covid-19/,www.poynter.org,Why experts say the hantavirus outbreak is not another COVID-19 - Poynter,0,LOW,False,,,factcheck,2026-05-14T19:48:26.120903
"Polls consistently show that the majority of Americans blame Trump and the war in Iran for a worsening economy, including a new CNN poll in which 77% blamed Trump",https://www.poynter.org/commentary/2026/i-dont-think-about-americans-financial-situation-trump/,www.poynter.org,Trump’s latest exchange with reporters handed Democrats a ready-made attack ad - Poynter,0,LOW,False,,,factcheck,2026-05-14T19:48:26.568235
The poll also showed Trump’s approval rating on the economy is at a career-worse 30%,https://www.poynter.org/commentary/2026/i-dont-think-about-americans-financial-situation-trump/,www.poynter.org,Trump’s latest exchange with reporters handed Democrats a ready-made attack ad - Poynter,0,LOW,False,,,factcheck,2026-05-14T19:48:26.782514
"Meanwhile, an NBC poll last month had Trump’s disapproval rating at 63%",https://www.poynter.org/commentary/2026/i-dont-think-about-americans-financial-situation-trump/,www.poynter.org,Trump’s latest exchange with reporters handed Democrats a ready-made attack ad - Poynter,0,LOW,False,,,factcheck,2026-05-14T19:48:27.014235
[DEBUNKED] How Russia lies about the stolen Ukrainian children - EUvsDisinfo,https://euvsdisinfo.eu/how-russia-lies-about-the-stolen-ukrainian-children/,euvsdisinfo.eu,How Russia lies about the stolen Ukrainian children - EUvsDisinfo,0.9,HIGH,True,FALSE - Debunked by fact-checkers,euvsdisinfo.eu,factcheck,2026-05-14T19:48:30.879968
[DEBUNKED] Fake European crises and real Russian failures - EUvsDisinfo,https://euvsdisinfo.eu/fake-european-crises-and-real-russian-failures/,euvsdisinfo.eu,Fake European crises and real Russian failures - EUvsDisinfo,0.9,HIGH,True,FALSE - Debunked by fact-checkers,euvsdisinfo.eu,factcheck,2026-05-14T19:48:34.252921
[DEBUNKED] Russia’s fake nuclear drills and real failure in Mali - EUvsDisinfo,https://euvsdisinfo.eu/russias-fake-nuclear-drills-and-real-failure-in-mali/,euvsdisinfo.eu,Russia’s fake nuclear drills and real failure in Mali - EUvsDisinfo,0.9,HIGH,True,FALSE - Debunked by fact-checkers,euvsdisinfo.eu,factcheck,2026-05-14T19:48:35.714260
[DEBUNKED] Disinformation Review: EU Sanctions and the Kremlin’s Recycled Narratives - EUvsDisinfo,https://euvsdisinfo.eu/disinformation-review-eu-sanctions-and-the-kremlins-recycled-narratives/,euvsdisinfo.eu,Disinformation Review: EU Sanctions and the Kremlin’s Recycled Narratives - EUvsDisinfo,0.9,HIGH,True,FALSE - Debunked by fact-checkers,euvsdisinfo.eu,factcheck,2026-05-14T19:48:38.902974
[DEBUNKED] Russia targets elections in Hungary and Bulgaria - EUvsDisinfo,https://euvsdisinfo.eu/russia-targets-elections-in-hungary-and-bulgaria/,euvsdisinfo.eu,Russia targets elections in Hungary and Bulgaria - EUvsDisinfo,0.9,HIGH,True,FALSE - Debunked by fact-checkers,euvsdisinfo.eu,factcheck,2026-05-14T19:48:42.088408
[DEBUNKED] Pranked by the Kremlin: fake phone calls as a FIMI instrument - EUvsDisinfo,https://euvsdisinfo.eu/pranked-by-the-kremlin-fake-phone-calls-as-a-fimi-instrument/,euvsdisinfo.eu,Pranked by the Kremlin: fake phone calls as a FIMI instrument - EUvsDisinfo,0.9,HIGH,True,FALSE - Debunked by fact-checkers,euvsdisinfo.eu,factcheck,2026-05-14T19:48:43.518197
"«Demo-Teilnehmer:»Es gibt keine Legitimation dafür und man muss dem entgegentreten, entschieden, jeder Einzelne, wie die Politik",https://www.spiegel.de/panorama/vatertag-maenner-demonstrieren-gegen-gewalt-an-frauen-a-529a48d1-c983-4163-9530-253bf2359f09#ref=rss,www.spiegel.de,Vatertag: Männer demonstrieren gegen Gewalt an Frauen - DER SPIEGEL,0.1,LOW,False,,,mainstream,2026-05-14T19:48:58.829945
"Die beiden Ehepartner, Jakub Cupriak-Trojan und Mateusz Trojan, bestätigten ihrerseits, eine Kopie der polnischen Heiratsurkunde erhalten zu haben",https://www.spiegel.de/ausland/lgbtq-in-polen-rathaus-in-warschau-erkennt-erstmals-gleichgeschlechtliche-ehe-an-a-b9c7d6c2-1aab-4629-9c3f-5ea60e079a21#ref=rss,www.spiegel.de,LGBTQ in Polen: Rathaus in Warschau erkennt erstmals gleichgeschlechtliche Ehe an - DER SPIEGEL,0,LOW,False,,,mainstream,2026-05-14T19:49:00.119110
"Ihr Antrag war zuvor abgelehnt worden, da laut polnischer Verfassung die Heirat eine Verbindung zwischen einem Mann und einer Frau ist",https://www.spiegel.de/ausland/lgbtq-in-polen-rathaus-in-warschau-erkennt-erstmals-gleichgeschlechtliche-ehe-an-a-b9c7d6c2-1aab-4629-9c3f-5ea60e079a21#ref=rss,www.spiegel.de,LGBTQ in Polen: Rathaus in Warschau erkennt erstmals gleichgeschlechtliche Ehe an - DER SPIEGEL,0,LOW,False,,,mainstream,2026-05-14T19:49:00.326167
Eine neue Studie zeigt: Diese Pillen könnten helfen,https://www.spiegel.de/wissenschaft/abnehmspritzen-wegovy-und-mounjaro-was-gegen-den-jo-jo-effekt-helfen-koennte-a-ae9a352b-c65e-43ac-a694-bc1ccdb145c8#ref=rss,www.spiegel.de,Abnehmspritzen Wegovy und Mounjaro: Was gegen den Jo-Jo-Effekt helfen könnte - DER SPIEGEL,0,LOW,False,,,mainstream,2026-05-14T19:49:02.565577
"Zum Login SPIEGEL plus Nur für Neukunden € 1,– für 4 Wochen danach € 5,99 pro Woche Freier Zugriff auf alle S+-Artikel auf SPIEGEL",https://www.spiegel.de/wissenschaft/abnehmspritzen-wegovy-und-mounjaro-was-gegen-den-jo-jo-effekt-helfen-koennte-a-ae9a352b-c65e-43ac-a694-bc1ccdb145c8#ref=rss,www.spiegel.de,Abnehmspritzen Wegovy und Mounjaro: Was gegen den Jo-Jo-Effekt helfen könnte - DER SPIEGEL,0.1,LOW,False,,,mainstream,2026-05-14T19:49:02.770938
"E-Paper (PDF), Digital-Archiv und S+-Newsletter Jederzeit kündigen Jetzt abonnieren SPIEGEL plus 52 Wochen 25 % sparen € 4,49 pro Woche für 52 Wochen danach € 5,99 pro Woche Freier Zugriff auf alle S+-Artikel auf SPIEGEL",https://www.spiegel.de/wissenschaft/abnehmspritzen-wegovy-und-mounjaro-was-gegen-den-jo-jo-effekt-helfen-koennte-a-ae9a352b-c65e-43ac-a694-bc1ccdb145c8#ref=rss,www.spiegel.de,Abnehmspritzen Wegovy und Mounjaro: Was gegen den Jo-Jo-Effekt helfen könnte - DER SPIEGEL,0.1,LOW,False,,,mainstream,2026-05-14T19:49:02.977562
"Der Kommandeur des für den Nahen Osten zuständigen Regionalkommandos Centcom sagte, er könne keine geheimdienstlichen Informationen preisgeben, aber die öffentlich kursierenden Zahlen seien aus seiner Sicht falsch",https://www.spiegel.de/ausland/krieg-in-iran-us-admiral-dementiert-berichte-ueber-iranische-raketenstellungen-a-23a3bd39-47da-4a77-9ef2-53c7b1b88273#ref=rss,www.spiegel.de,Krieg in Iran: US-Admiral dementiert Berichte über iranische Raketenstellungen - DER SPIEGEL,0.15,LOW,False,,,mainstream,2026-05-14T19:49:05.173726
"Mehrere Medien hatten zuvor unter Berufung auf informierte Quellen berichtet, Iran verfüge noch über etwa 70 bis 75 Prozent seiner mobilen Abschussrampen sowie 70 Prozent seines Raketenarsenals",https://www.spiegel.de/ausland/krieg-in-iran-us-admiral-dementiert-berichte-ueber-iranische-raketenstellungen-a-23a3bd39-47da-4a77-9ef2-53c7b1b88273#ref=rss,www.spiegel.de,Krieg in Iran: US-Admiral dementiert Berichte über iranische Raketenstellungen - DER SPIEGEL,0,LOW,False,,,mainstream,2026-05-14T19:49:05.370258
"Mehr zum Thema Bericht der »New York Times«: Irans Raketenstellungen sind laut US-Geheimdiensten offenbar größtenteils intakt Cooper sagte, bei der Beurteilung der iranischen Schlagkraft gehe es um mehr als nur Zahlen zu Raketen",https://www.spiegel.de/ausland/krieg-in-iran-us-admiral-dementiert-berichte-ueber-iranische-raketenstellungen-a-23a3bd39-47da-4a77-9ef2-53c7b1b88273#ref=rss,www.spiegel.de,Krieg in Iran: US-Admiral dementiert Berichte über iranische Raketenstellungen - DER SPIEGEL,0.05,LOW,False,,,mainstream,2026-05-14T19:49:05.570949
"Man kann es sich vorstellen wie Insekten, die immer wieder einmal auf die Windschutzscheibe eines fahrenden Autos klatschen",https://www.spiegel.de/wissenschaft/weltall/antarktis-forscher-finden-im-eis-spuren-einer-sternexplosion-a-d4d033da-23c8-46b6-b88f-b32d4cc02dcb#ref=rss,www.spiegel.de,Antarktis: Forscher finden im Eis Spuren einer Sternexplosion - DER SPIEGEL,0.1,LOW,False,,,mainstream,2026-05-14T19:49:06.809816
"25%;"" :style=""{minHeight: typeof iframeHeight === 'number' && iframeIsLoaded",https://www.spiegel.de/sport/fussball/fc-bayern-muenchen-vs-vfl-wolfsburg-alexandra-popp-geht-als-legende-aber-ohne-titel-a-69adac39-f84a-447c-a3e0-72e2dee10810#ref=rss,www.spiegel.de,"FC Bayern München vs. VfL Wolfsburg: Alexandra Popp geht als Legende, aber ohne Titel - DER SPIEGEL",0,LOW,False,,,mainstream,2026-05-14T19:49:08.007424
"25%',}"" x-lazyload> Erste Hälfte: Viel Einsatz, aber wenig Risiko",https://www.spiegel.de/sport/fussball/fc-bayern-muenchen-vs-vfl-wolfsburg-alexandra-popp-geht-als-legende-aber-ohne-titel-a-69adac39-f84a-447c-a3e0-72e2dee10810#ref=rss,www.spiegel.de,"FC Bayern München vs. VfL Wolfsburg: Alexandra Popp geht als Legende, aber ohne Titel - DER SPIEGEL",0,LOW,False,,,mainstream,2026-05-14T19:49:08.213701
"In der Hauptstadt Kubas leben die Menschen laut eigenen Angaben teils bis zu 22 Stunden am Tag ohne Strom, auch Lebensmittel und Trinkwasser seien knapp",https://www.spiegel.de/ausland/energiekrise-wegen-us-blockade-kuba-hat-keinen-tropfen-oel-mehr-a-4eb18bcc-257f-46e5-9a02-dd90eaa116b6#ref=rss,www.spiegel.de,"Kuba: Leere Zapfsäulen, Stromausfälle, verdorbenes Essen - DER SPIEGEL",0,LOW,False,,,mainstream,2026-05-14T19:49:10.957193
Auch das nationale Stromnetz befindet sich laut der Behörden in einem »kritischen« Zustand,https://www.spiegel.de/ausland/energiekrise-wegen-us-blockade-kuba-hat-keinen-tropfen-oel-mehr-a-4eb18bcc-257f-46e5-9a02-dd90eaa116b6#ref=rss,www.spiegel.de,"Kuba: Leere Zapfsäulen, Stromausfälle, verdorbenes Essen - DER SPIEGEL",0,LOW,False,,,mainstream,2026-05-14T19:49:11.223947
Immer wieder niesen sie in ihre Liveschalten hinein,https://www.spiegel.de/ausland/grossbritannien-gesundheitsminister-wes-streeting-entzieht-keir-starmer-das-vertrauen-a-c3d4a82e-39ab-4ff8-8991-2933d1db537e#ref=rss,www.spiegel.de,"Großbritannien: Wes Streeting - Der Mann, der die Vorhänge ausmaß - DER SPIEGEL",0.1,LOW,False,,,mainstream,2026-05-14T19:49:12.433837
"Und immer wieder rufen sie Ministern, die sich der schwarzen Tür von Nr",https://www.spiegel.de/ausland/grossbritannien-gesundheitsminister-wes-streeting-entzieht-keir-starmer-das-vertrauen-a-c3d4a82e-39ab-4ff8-8991-2933d1db537e#ref=rss,www.spiegel.de,"Großbritannien: Wes Streeting - Der Mann, der die Vorhänge ausmaß - DER SPIEGEL",0.1,LOW,False,,,mainstream,2026-05-14T19:49:12.638391
Für den Antrag stimmten 73 Abgeordnete; es gab keine Gegenstimmen und vier Enthaltungen,https://www.spiegel.de/ausland/tschechien-abgeordnete-stellen-sich-gegen-treffen-der-sudetendeutschen-a-2dbc9ecd-e358-4b7a-b9cf-68b7861e0e30#ref=rss,www.spiegel.de,Sudetendeutsche: Streit um Pfingsttreffen in Tschechien mit Bayerns Ministerpräsident - DER SPIEGEL,0.1,LOW,False,,,mainstream,2026-05-14T19:49:13.819535
"Von Freitag bis Sonntag streiken die Schiedsrichter nach der Tat vom vergangenen Wochenende, der Ausschuss stellt keine Unparteiischen zur Verfügung",https://www.spiegel.de/sport/fussball/fussball-schlag-gegen-linienrichter-spiele-in-thueringen-abgesagt-a-d09fe915-e5ae-4c23-92ad-23c810845efe#ref=rss,www.spiegel.de,Gewalt im Amateur-Fußball: Schlag gegen Linienrichter – Spiele in Thüringen abgesagt - DER SPIEGEL,0.1,LOW,False,,,mainstream,2026-05-14T19:49:15.051334
In der folgenden Rudelbildung kam es laut KFA zu einem »Faustschlag in den Brustkorb« des Linienrichters,https://www.spiegel.de/sport/fussball/fussball-schlag-gegen-linienrichter-spiele-in-thueringen-abgesagt-a-d09fe915-e5ae-4c23-92ad-23c810845efe#ref=rss,www.spiegel.de,Gewalt im Amateur-Fußball: Schlag gegen Linienrichter – Spiele in Thüringen abgesagt - DER SPIEGEL,0.1,LOW,False,,,mainstream,2026-05-14T19:49:15.254907
Mehr zum Thema Trip nach Italien: Kate plant erste offizielle Auslandsreise seit Krebstherapie Prinzessin Kate: Ist das,https://www.spiegel.de/reise/catherine-princess-of-wales-pasta-kochkurs-in-italien-dianas-ring-bleibt-am-finger-a-05b742f8-d888-49cf-9d32-e4145532fb8a#ref=rss,www.spiegel.de,"Catherine, Princess of Wales: Pasta-Kochkurs in Italien, Dianas Ring bleibt am Finger - DER SPIEGEL",0,LOW,False,,,mainstream,2026-05-14T19:49:16.428405
Schlagkräftige Royals: In welchem Sport Kate William keine Chance lässt Was Normalbürgerinnen vielleicht anders machen würden: den Verlobungsring der verstorbenen Schwiegermutter sicherheitshalber abnehmen,https://www.spiegel.de/reise/catherine-princess-of-wales-pasta-kochkurs-in-italien-dianas-ring-bleibt-am-finger-a-05b742f8-d888-49cf-9d32-e4145532fb8a#ref=rss,www.spiegel.de,"Catherine, Princess of Wales: Pasta-Kochkurs in Italien, Dianas Ring bleibt am Finger - DER SPIEGEL",0.1,LOW,False,,,mainstream,2026-05-14T19:49:16.648168
"Bild vergrößern Middleton befüllt Tortelli: Immer schön den Abstand wahren Foto: Phil Noble / REUTERS Für diejenigen, die lieber wissen wollen, was es denn nun zu Essen gab: Chefkoch Ivan Lampredi zeigte dem königlichen Ga",https://www.spiegel.de/reise/catherine-princess-of-wales-pasta-kochkurs-in-italien-dianas-ring-bleibt-am-finger-a-05b742f8-d888-49cf-9d32-e4145532fb8a#ref=rss,www.spiegel.de,"Catherine, Princess of Wales: Pasta-Kochkurs in Italien, Dianas Ring bleibt am Finger - DER SPIEGEL",0.1,LOW,False,,,mainstream,2026-05-14T19:49:16.847415
"6% in the first quarter from January to March, notably higher than recent sluggish history",https://www.bbc.com/news/articles/clyprjddgj3o?at_medium=RSS&amp;at_campaign=rss,www.bbc.com,Six things we now know about the UK economy in charts,0,LOW,False,,,mainstream,2026-05-14T19:49:17.309437
"At the height of the trade war last year, the two sides had levied tariffs that crossed 100% on each other",https://www.bbc.com/news/articles/cdxpypg9dgeo?at_medium=RSS&amp;at_campaign=rss,www.bbc.com,Trump in China: Xi Jinping welcomes US president but thorny issues remain,0.1,LOW,False,,,mainstream,2026-05-14T19:49:18.021279
Clinical studies have shown that patients can lose more than 20% of their body weight in a year and a half,https://www.bbc.com/news/articles/cm2pvl56l72o?at_medium=RSS&amp;at_campaign=rss,www.bbc.com,&#x27;I nearly died after buying weight loss jab from friend of friend&#x27;,0,LOW,False,,,mainstream,2026-05-14T19:49:18.408859
