claim,source_url,source_domain,article_title,risk_score,risk_category,has_factcheck,factcheck_rating,factcheck_source,source_type,checked_at
Offizielle Erklärung: Die Gäste müssten die Baderegeln verstehen können,https://correctiv.org/aktuelles/gesellschaft-2/2026/07/01/hitzkoepfe-und-populismus-das-freibad-als-politikum/,correctiv.org,Hitzköpfe und Populismus: Das Freibad als Politikum,0,LOW,False,,,factcheck,2026-07-02T03:42:39.212935
"Übergriffe und reißerische Berichte: Das Schwimmbad ist noch politischer geworden Dass es in Frei- und Strandbädern immer wieder zu Übergriffen und Streit kommt, ist unstrittig",https://correctiv.org/aktuelles/gesellschaft-2/2026/07/01/hitzkoepfe-und-populismus-das-freibad-als-politikum/,correctiv.org,Hitzköpfe und Populismus: Das Freibad als Politikum,0.1,LOW,False,,,factcheck,2026-07-02T03:42:39.420726
"Die Frage ist aber: Wird es wirklich immer schlimmer, wie die reißerische Berichterstattung suggeriert",https://correctiv.org/aktuelles/gesellschaft-2/2026/07/01/hitzkoepfe-und-populismus-das-freibad-als-politikum/,correctiv.org,Hitzköpfe und Populismus: Das Freibad als Politikum,0.1,LOW,False,,,factcheck,2026-07-02T03:42:39.644048
"Im Jahr 2009 hatte Audi angekündigt, für 90 Millionen Euro eine Beteiligung von 8,3 Prozent am FC Bayern erwerben zu wollen",https://correctiv.org/aktuelles/wirtschaft/2026/07/01/vw-prueft-verkauf-von-bayern-und-vfb-stuttgart/,correctiv.org,VW prüft Verkauf von Beteiligung an Bayern München und VfB Stuttgart - correctiv.org,0,LOW,False,,,factcheck,2026-07-02T03:42:40.816565
"Beteiligt sind auch die Allianz und Adidas, die ebenfalls je 8,3 Prozent kontrollieren",https://correctiv.org/aktuelles/wirtschaft/2026/07/01/vw-prueft-verkauf-von-bayern-und-vfb-stuttgart/,correctiv.org,VW prüft Verkauf von Beteiligung an Bayern München und VfB Stuttgart - correctiv.org,0,LOW,False,,,factcheck,2026-07-02T03:42:41.012282
"Der Sportwagenhersteller Porsche war erst im Jahr 2023 beim VfB Stuttgart mit 10,4 Prozent eingestiegen, die Kosten dafür lagen laut den Kreisen bei rund 45 Millionen Euro",https://correctiv.org/aktuelles/wirtschaft/2026/07/01/vw-prueft-verkauf-von-bayern-und-vfb-stuttgart/,correctiv.org,VW prüft Verkauf von Beteiligung an Bayern München und VfB Stuttgart - correctiv.org,0,LOW,False,,,factcheck,2026-07-02T03:42:41.215636
[DEBUNKED] Schule in NRW: Leiterin dementiert angebliches Flaggen-Verbot,https://correctiv.org/faktencheck/2026/06/30/schule-in-nrw-leiterin-dementiert-angebliches-deutschlandflaggen-verbot/,correctiv.org,Schule in NRW: Leiterin dementiert angebliches Flaggen-Verbot,0.9,HIGH,True,FALSE - Debunked by fact-checkers,correctiv.org,factcheck,2026-07-02T03:42:42.156776
[DEBUNKED] KI auf Whatsapp verfügbar? Warum dieser Kettenbrief nur teilweise stimmt,https://correctiv.org/faktencheck/2026/06/30/kuenstliche-intelligenz-ki-whatsapp-warum-dieser-kettenbrief-so-nicht-stimmt/,correctiv.org,KI auf Whatsapp verfügbar? Warum dieser Kettenbrief nur teilweise stimmt,0.9,HIGH,True,FALSE - Debunked by fact-checkers,correctiv.org,factcheck,2026-07-02T03:42:43.094274
"Für alle Menschen, denen es vor dem Vollmond graut, haben wir nachgeforscht: Schläft man erwiesenermaßen schlechter in Vollmond-Nächten",https://correctiv.org/faktencheck/2026/06/30/geruechtekiller-schlaeft-man-bei-vollmond-schlechter/,correctiv.org,Gerüchtekiller: Schläft man bei Vollmond schlechter?,0.1,LOW,False,,,factcheck,2026-07-02T03:42:44.383757
"Zudem maßen die Forschenden in Vollmondnächten in den Hirnströmen der Probandinnen und Probanden 30 Prozent weniger Deltawellen, die als Anzeichen für Tiefschlaf gelten",https://correctiv.org/faktencheck/2026/06/30/geruechtekiller-schlaeft-man-bei-vollmond-schlechter/,correctiv.org,Gerüchtekiller: Schläft man bei Vollmond schlechter?,0,LOW,False,,,factcheck,2026-07-02T03:42:44.584155
Alle Teilnehmenden der Studie schliefen in einem Raum ohne Einfluss von Mondlicht und einer Temperatur von 21 Grad Celsius,https://correctiv.org/faktencheck/2026/06/30/geruechtekiller-schlaeft-man-bei-vollmond-schlechter/,correctiv.org,Gerüchtekiller: Schläft man bei Vollmond schlechter?,0.1,LOW,False,,,factcheck,2026-07-02T03:42:44.800862
[DEBUNKED] Deutschlandfahne verboten? Beiträgen zu viralem Video aus Berlin fehlt Kontext,https://correctiv.org/faktencheck/hintergrund/2026/06/30/deutschlandfahne-verboten-beitraegen-zu-viralem-video-fehlt-kontext/,correctiv.org,Deutschlandfahne verboten? Beiträgen zu viralem Video aus Berlin fehlt Kontext,0.9,HIGH,True,FALSE - Debunked by fact-checkers,correctiv.org,factcheck,2026-07-02T03:42:45.749452
[DEBUNKED] Hitzedarstellung im TV: Video zu Wetterkarten ist nicht echt,https://correctiv.org/faktencheck/2026/06/29/hitzedarstellung-im-tv-video-zu-wetterkarten-ist-nicht-echt/,correctiv.org,Hitzedarstellung im TV: Video zu Wetterkarten ist nicht echt,0.9,HIGH,True,FALSE - Debunked by fact-checkers,correctiv.org,factcheck,2026-07-02T03:42:46.697298
Die AfD führt die Wahlumfragen mit rund 40 Prozent an,https://correctiv.org/aktuelles/afd/2026/06/30/afd-ulrich-siegmund-potsdam-sachsen-anhalt/,correctiv.org,Sachsen-Anhalt: Was Ulrich Siegmund (AfD) wirklich plant,0,LOW,False,,,factcheck,2026-07-02T03:42:48.943928
"[DEBUNKED] Video von Kind, das Regenbogenflagge in den Müll wirft, ist KI-generiert",https://correctiv.org/faktencheck/2026/06/29/video-von-kind-das-regenbogenflagge-in-den-muell-wirft-ist-ki-generiert/,correctiv.org,"Video von Kind, das Regenbogenflagge in den Müll wirft, ist KI-generiert",0.9,HIGH,True,FALSE - Debunked by fact-checkers,correctiv.org,factcheck,2026-07-02T03:42:49.876726
"Laut Insidern fürchtet der Vorstand um Blume, dass Europas größter Autohersteller ab dem Jahr 2030 dauerhaft in die Verlustzone rutschen könnte",https://correctiv.org/aktuelles/wirtschaft/2026/06/29/vorstand-will-sparpaket-mit-aller-macht-durchdruecken/,correctiv.org,Vorstand will Sparpaket auch gegen Nein von Aufsichtsrat durchdrücken - correctiv.org,0,LOW,False,,,factcheck,2026-07-02T03:42:51.027429
"Foto: Hans-Joachim Scheidemann / picture alliance / dpa Ein Zwischenbericht einer Untersuchung von Kardinal Franz Hengsbach bestätigt, dass der erste Ruhrbischof Missbrauch begangen haben soll",https://correctiv.org/aktuelles/akten-des-missbrauchs/2026/06/26/neue-studie-aus-dem-bistum-essen-kardinal-hengsbach-war-taeter-und-pflegte-enge-kontakte-zu-ratzinger/,correctiv.org,Neue Studie: Kardinal Hengsbach war Täter und pflegte Kontakte zu Ratzinger,0,LOW,False,,,factcheck,2026-07-02T03:42:52.198916
Nach Angaben der Koordinierungsstelle des Programms wurden zwischen 2020 und 2025 mehr als 75,https://correctiv.org/aktuelles/integration-gesellschaft/2026/06/26/foerderung-fuer-den-studienzugang-zugewanderter-vor-dem-aus/,correctiv.org,Förderung für den Studienzugang Zugewanderter vor dem Aus - correctiv.org,0.1,LOW,False,,,factcheck,2026-07-02T03:42:54.281596
Als besonders erfolgreich gelten die Sprachkurse: 83 Prozent der Teilnehmenden erreichten das für ein Studium erforderliche Sprachniveau C1,https://correctiv.org/aktuelles/integration-gesellschaft/2026/06/26/foerderung-fuer-den-studienzugang-zugewanderter-vor-dem-aus/,correctiv.org,Förderung für den Studienzugang Zugewanderter vor dem Aus - correctiv.org,0,LOW,False,,,factcheck,2026-07-02T03:42:54.487224
"„Eine Fortführung des Programms hätte vor dem Hintergrund der haushaltspolitischen und strukturellen Rahmenbedingungen keine tragfähige Grundlage“, sagte sie",https://correctiv.org/aktuelles/integration-gesellschaft/2026/06/26/foerderung-fuer-den-studienzugang-zugewanderter-vor-dem-aus/,correctiv.org,Förderung für den Studienzugang Zugewanderter vor dem Aus - correctiv.org,0.1,LOW,False,,,factcheck,2026-07-02T03:42:54.709841
[DEBUNKED] Landverkauf an Israel? Bild von Grenzschild in Albanien ist nicht echt,https://correctiv.org/faktencheck/2026/06/26/landverkauf-an-israel-bild-von-grenzschild-in-albanien-ist-nicht-echt/,correctiv.org,Landverkauf an Israel? Bild von Grenzschild in Albanien ist nicht echt,0.9,HIGH,True,FALSE - Debunked by fact-checkers,correctiv.org,factcheck,2026-07-02T03:42:55.657736
[DEBUNKED] EU-Chat gegen Trump? Was die Quellen zeigen,https://www.mimikama.org/eu-chat-gegen-trump-was-die-quellen-zeigen/,www.mimikama.org,EU-Chat gegen Trump? Was die Quellen zeigen,0.9,HIGH,True,FALSE - Debunked by fact-checkers,www.mimikama.org,factcheck,2026-07-02T03:42:55.915795
[DEBUNKED] FIFA-Suspendierung des Schiedsrichters: Fakten statt Fake-News!,https://www.mimikama.org/fifa-suspendiert-schiedsrichter-nach-spiel/,www.mimikama.org,FIFA-Suspendierung des Schiedsrichters: Fakten statt Fake-News!,0.9,HIGH,True,FALSE - Debunked by fact-checkers,www.mimikama.org,factcheck,2026-07-02T03:42:56.201369
[DEBUNKED] Hitze und Klimawandel: Omega-Blockade erklärt nicht alles,https://www.mimikama.org/hitze-klimawandel-omega-blockade-erklaert-nicht-alles/,www.mimikama.org,Hitze und Klimawandel: Omega-Blockade erklärt nicht alles,0.9,HIGH,True,FALSE - Debunked by fact-checkers,www.mimikama.org,factcheck,2026-07-02T03:42:56.276119
[DEBUNKED] Kann ChatGPT meinen digitalen Fußabdruck löschen?,https://www.mimikama.org/kann-chatgpt-digitalen-fussabdruck-loeschen/,www.mimikama.org,Kann ChatGPT meinen digitalen Fußabdruck löschen?,0.9,HIGH,True,FALSE - Debunked by fact-checkers,www.mimikama.org,factcheck,2026-07-02T03:42:56.353650
[DEBUNKED] Buch von 1989 beweist keinen Pandemie-Plan,https://www.mimikama.org/buch-von-1989-beweist-keinen-pandemie-plan/,www.mimikama.org,Buch von 1989 beweist keinen Pandemie-Plan,0.9,HIGH,True,FALSE - Debunked by fact-checkers,www.mimikama.org,factcheck,2026-07-02T03:42:56.448445
[DEBUNKED] Vorsicht: Sarah Connor KI-Fake täuscht mit Abnehmprodukt-Werbung!,https://www.mimikama.org/sarah-connor-ki-fake-wirbt-fuer-abnehmprodukt/,www.mimikama.org,Vorsicht: Sarah Connor KI-Fake täuscht mit Abnehmprodukt-Werbung!,0.9,HIGH,True,FALSE - Debunked by fact-checkers,www.mimikama.org,factcheck,2026-07-02T03:42:56.527886
Signal wurde laut Behörden nicht geknackt,https://www.mimikama.org/fbi-warnt-russische-akteure-signal-keys/,www.mimikama.org,FBI warnt: Russische Akteure zielen auf Signal-Keys,0,LOW,False,,,factcheck,2026-07-02T03:42:56.823922
Die wichtigste Einordnung: Signal selbst wurde laut den Behörden nicht gehackt,https://www.mimikama.org/fbi-warnt-russische-akteure-signal-keys/,www.mimikama.org,FBI warnt: Russische Akteure zielen auf Signal-Keys,0,LOW,False,,,factcheck,2026-07-02T03:42:57.033305
Betrifft das alle Signal-Nutzer,https://www.mimikama.org/fbi-warnt-russische-akteure-signal-keys/,www.mimikama.org,FBI warnt: Russische Akteure zielen auf Signal-Keys,0.1,LOW,False,,,factcheck,2026-07-02T03:42:57.232881
[DEBUNKED] Facebook-Betrug: Gefälschte Werbung lockt in gefährliche Fallen,https://www.mimikama.org/betrueger-geben-sich-als-facebook-aus-5/,www.mimikama.org,Facebook-Betrug: Gefälschte Werbung lockt in gefährliche Fallen,0.9,HIGH,True,FALSE - Debunked by fact-checkers,www.mimikama.org,factcheck,2026-07-02T03:42:57.304348
[DEBUNKED] Ist eine Ampel in Berlin wegen 35 Grad Hitze geschmolzen?,https://www.mimikama.org/ampel-berlin-35-grad-geschmolzen/,www.mimikama.org,Ist eine Ampel in Berlin wegen 35 Grad Hitze geschmolzen?,0.9,HIGH,True,FALSE - Debunked by fact-checkers,www.mimikama.org,factcheck,2026-07-02T03:42:57.377102
[DEBUNKED] Sind diese Angebote für Klimageräte und Ventilatoren von Lidl und Netto echt?,https://www.mimikama.org/klimageraet-ventilator-lidl-netto-fake-shop/,www.mimikama.org,Sind diese Angebote für Klimageräte und Ventilatoren von Lidl und Netto echt?,0.9,HIGH,True,FALSE - Debunked by fact-checkers,www.mimikama.org,factcheck,2026-07-02T03:42:57.478409
[DEBUNKED] Solaranlagen verursachen keine Hitzewelle – Fakten statt Falschinfo!,https://www.mimikama.org/solaranlagen-verursachen-keine-hitzewelle/,www.mimikama.org,Solaranlagen verursachen keine Hitzewelle – Fakten statt Falschinfo!,0.9,HIGH,True,FALSE - Debunked by fact-checkers,www.mimikama.org,factcheck,2026-07-02T03:42:57.559757
Unter 16-Jährige sollten keine Accounts mehr auf großen Social-Media-Plattformen haben,https://www.mimikama.org/australiens-social-media-verbot-scheitert-am-alltag/,www.mimikama.org,Australiens Social-Media-Verbot scheitert am Alltag,0.1,LOW,False,,,factcheck,2026-07-02T03:42:57.847707
Die neue Studie zeigt: So einfach ist es nicht,https://www.mimikama.org/australiens-social-media-verbot-scheitert-am-alltag/,www.mimikama.org,Australiens Social-Media-Verbot scheitert am Alltag,0,LOW,False,,,factcheck,2026-07-02T03:42:58.052132
Bei den 14- bis 15-Jährigen sank sie leicht von 78 auf 69 Prozent,https://www.mimikama.org/australiens-social-media-verbot-scheitert-am-alltag/,www.mimikama.org,Australiens Social-Media-Verbot scheitert am Alltag,0,LOW,False,,,factcheck,2026-07-02T03:42:58.249472
[DEBUNKED] CERN wird 2026 nicht wegen einer „Matrix“ abgeschaltet,https://www.mimikama.org/cern-2026-nicht-wegen-einer-matrix-abgeschaltet/,www.mimikama.org,CERN wird 2026 nicht wegen einer „Matrix“ abgeschaltet,0.9,HIGH,True,FALSE - Debunked by fact-checkers,www.mimikama.org,factcheck,2026-07-02T03:42:58.326848
[DEBUNKED] Maischberger: Eskalation im Studio zwischen Merz und Chrupalla?,https://www.mimikama.org/maischberger-eskalation-studio-merz-chrupalla-fake/,www.mimikama.org,Maischberger: Eskalation im Studio zwischen Merz und Chrupalla?,0.9,HIGH,True,FALSE - Debunked by fact-checkers,www.mimikama.org,factcheck,2026-07-02T03:42:58.409055
[DEBUNKED] Früher war es auch heiß,https://www.mimikama.org/frueher-war-es-auch-heiss-hitzetage-klimawandel/,www.mimikama.org,Früher war es auch heiß,0.9,HIGH,True,FALSE - Debunked by fact-checkers,www.mimikama.org,factcheck,2026-07-02T03:42:58.488463
Nur eine Partei macht das Gegenteil: Die AfD radikalisiert sich immer weiter und wächst trotzdem,https://volksverpetzer.de/analyse/afd-eu-ausnahme/,volksverpetzer.de,"Die AfD ist Europas gefährlichste, rechtsextreme Ausnahme - Volksverpetzer",0.1,LOW,False,,,factcheck,2026-07-02T03:42:59.508201
"­­­ Dieser Vergleich zeigt, dass die Rechtsaußen-Parteien von 2020 bis 2025 europaweit um durchschnittlich fünf Prozentpunkte gewachsen sind",https://volksverpetzer.de/analyse/afd-eu-ausnahme/,volksverpetzer.de,"Die AfD ist Europas gefährlichste, rechtsextreme Ausnahme - Volksverpetzer",0,LOW,False,,,factcheck,2026-07-02T03:42:59.710193
"Ihre Stimmengewichte unterscheiden sich deutlich: Zum Stichpunkt 2025 kamen Rechtspopulist*innen auf einen Schnitt von 17,5 Prozent bei nationalen Wahlen, während rechtsextreme Parteien lediglich 3,7 Prozent erreichten",https://volksverpetzer.de/analyse/afd-eu-ausnahme/,volksverpetzer.de,"Die AfD ist Europas gefährlichste, rechtsextreme Ausnahme - Volksverpetzer",0,LOW,False,,,factcheck,2026-07-02T03:42:59.909152
[DEBUNKED] BILD hat schon früher Fakes verbreitet - so heiß war es damals nicht! - Volksverpetzer,https://volksverpetzer.de/faktencheck/bild-fakes-heiss/,volksverpetzer.de,BILD hat schon früher Fakes verbreitet - so heiß war es damals nicht! - Volksverpetzer,0.9,HIGH,True,FALSE - Debunked by fact-checkers,volksverpetzer.de,factcheck,2026-07-02T03:43:00.705203
"Rund 1,2 Millionen Menschen haben unsere Petition mit dieser Forderung unterschrieben",https://volksverpetzer.de/aktuelles/afd-verbot-erfolg-gutachten/,volksverpetzer.de,Ein AfD-Verbot hätte wohl Erfolg – dieses Gutachten ändert alles! - Volksverpetzer,0,LOW,False,,,factcheck,2026-07-02T03:43:01.737138
Aber bisher ist nichts passiert zum Thema AfD-Verbot - obwohl die Zahl der Befürworter immer größer wurde,https://volksverpetzer.de/aktuelles/afd-verbot-erfolg-gutachten/,volksverpetzer.de,Ein AfD-Verbot hätte wohl Erfolg – dieses Gutachten ändert alles! - Volksverpetzer,0.1,LOW,False,,,factcheck,2026-07-02T03:43:01.940051
Aber die AfD erfüllt alle notwendigen Voraussetzungen,https://volksverpetzer.de/aktuelles/afd-verbot-erfolg-gutachten/,volksverpetzer.de,Ein AfD-Verbot hätte wohl Erfolg – dieses Gutachten ändert alles! - Volksverpetzer,0.1,LOW,False,,,factcheck,2026-07-02T03:43:02.163093
[DEBUNKED] Dreist! AfD-Fans teilen mit KI gefälschte Wetterkarten - Volksverpetzer,https://volksverpetzer.de/faktencheck/afd-fans-ki-wetterkarten/,volksverpetzer.de,Dreist! AfD-Fans teilen mit KI gefälschte Wetterkarten - Volksverpetzer,0.9,HIGH,True,FALSE - Debunked by fact-checkers,volksverpetzer.de,factcheck,2026-07-02T03:43:02.999434
"Auf diesen Widerspruch zur Bezeichnung hinzuweisen, ist keine Spitzfindigkeit",https://volksverpetzer.de/analyse/eu-verordnung-rueckfuehrung/,volksverpetzer.de,Abschreckung durch Angst: Wie die neue EU-Verordnung das Wort ‚Rückführung&#039; aushöhlt - Volksver,0.1,LOW,False,,,factcheck,2026-07-02T03:43:03.996930
Die Partei findet aber immer mehr politische Anschlussstellen auf der Suche nach einer neuen deutschen Identität,https://volksverpetzer.de/analyse/afd-sachsen-anhalt-bauhaus/,volksverpetzer.de,Will die AfD Sachsen-Anhalt das Architektur-Erbe ihres eigenen Bundeslandes verbannen? - Volksverpet,0.1,LOW,False,,,factcheck,2026-07-02T03:43:05.022774
"Im ersten Wahlgang gewann der Rechtsextremist Hartung mit 29 Prozent der Stimmen, musste aber in die Stichwahl gegen Hoffmann von der CDU, der 23,6 Prozent der Stimmen geholt hatte",https://volksverpetzer.de/aktuelles/aue-bad-schlema-nazi-ard/,volksverpetzer.de,Aue-Bad Schlema: Neonazi verliert die Wahl – und bekommt ARD-Sendezeit - Volksverpetzer,0,LOW,False,,,factcheck,2026-07-02T03:43:06.022143
Laut einem Policy Paper des Else Frenkel-Brunswik-Instituts von 2022 ist er „eine der bekanntesten Personen aus der Neonazi-Szene im Erzgebirgskreis,https://volksverpetzer.de/aktuelles/aue-bad-schlema-nazi-ard/,volksverpetzer.de,Aue-Bad Schlema: Neonazi verliert die Wahl – und bekommt ARD-Sendezeit - Volksverpetzer,0,LOW,False,,,factcheck,2026-07-02T03:43:06.223418
[DEBUNKED] Volksverpetzer gewinnt gegen die Ostdeutsche Allgemeine vor Gericht - Volksverpetzer,https://volksverpetzer.de/aktuelles/volksverpetzer-gewinnt-ostdeutsche-allgemeine/,volksverpetzer.de,Volksverpetzer gewinnt gegen die Ostdeutsche Allgemeine vor Gericht - Volksverpetzer,0.9,HIGH,True,FALSE - Debunked by fact-checkers,volksverpetzer.de,factcheck,2026-07-02T03:43:07.013789
"“ Warte mal - die AfD, das waren doch die, die überall eine „Islamisierung“ wittern, für die es überhaupt keine Faktengrundlage gibt",https://volksverpetzer.de/analyse/afd-unterstuetzt-terroristen/,volksverpetzer.de,‚Selbst anpacken‘: AfD unterstützt Terroristen in Deutschland? - Volksverpetzer,0.1,LOW,False,,,factcheck,2026-07-02T03:43:08.031907
Auch kandidiert er laut seinem Instagram-Profil für die „Generation Deutschland“ Baden-Württemberg,https://volksverpetzer.de/analyse/afd-unterstuetzt-terroristen/,volksverpetzer.de,‚Selbst anpacken‘: AfD unterstützt Terroristen in Deutschland? - Volksverpetzer,0,LOW,False,,,factcheck,2026-07-02T03:43:08.254041
[DEBUNKED] Was Ken Paxton caught on video traveling to Iceland with alleged 'mistress'? What we know | Snopes.com,https://www.snopes.com/news/2026/07/01/ken-paxton-mistress-iceland/,www.snopes.com,Was Ken Paxton caught on video traveling to Iceland with alleged 'mistress'? What we know | Snopes.c,0.9,HIGH,True,FALSE - Debunked by fact-checkers,www.snopes.com,factcheck,2026-07-02T03:43:08.431469
[DEBUNKED] Is Mitch McConnell dead? What we know about his health | Snopes.com,https://www.snopes.com/news/2026/06/30/mitch-mcconnell-death-rumor/,www.snopes.com,Is Mitch McConnell dead? What we know about his health | Snopes.com,0.9,HIGH,True,FALSE - Debunked by fact-checkers,www.snopes.com,factcheck,2026-07-02T03:43:08.584083
[DEBUNKED] Did Trump hang golden eagle decoration on White House balcony? | Snopes.com,https://www.snopes.com/fact-check/trump-golden-eagle-white-house/,www.snopes.com,Did Trump hang golden eagle decoration on White House balcony? | Snopes.com,0.9,HIGH,True,FALSE - Debunked by fact-checkers,www.snopes.com,factcheck,2026-07-02T03:43:08.766271
"[DEBUNKED] Did Martina Navratilova say 'respect is earned, not given' in response to Trump? | Snopes.com",https://www.snopes.com/fact-check/martina-navratilova-respect-trump/,www.snopes.com,"Did Martina Navratilova say 'respect is earned, not given' in response to Trump? | Snopes.com",0.9,HIGH,True,FALSE - Debunked by fact-checkers,www.snopes.com,factcheck,2026-07-02T03:43:08.998250
[DEBUNKED] Don't spread false claim wearing sunscreen 'massively increases' skin cancer risk | Snopes.com,https://www.snopes.com/fact-check/sunscreen-skin-cancer-risk/,www.snopes.com,Don't spread false claim wearing sunscreen 'massively increases' skin cancer risk | Snopes.com,0.9,HIGH,True,FALSE - Debunked by fact-checkers,www.snopes.com,factcheck,2026-07-02T03:43:09.173412
[DEBUNKED] Did UN demand investigations into ICE detention center deaths? Rumor overstates the truth | Snopes.com,https://www.snopes.com/fact-check/united-nations-ice-investigation/,www.snopes.com,Did UN demand investigations into ICE detention center deaths? Rumor overstates the truth | Snopes.c,0.9,HIGH,True,FALSE - Debunked by fact-checkers,www.snopes.com,factcheck,2026-07-02T03:43:09.351627
[DEBUNKED] 8 Ivanka Trump rumors where we separated real from AI-generated | Snopes.com,https://www.snopes.com/collections/ivanka-trump-real-ai-claims/,www.snopes.com,8 Ivanka Trump rumors where we separated real from AI-generated | Snopes.com,0.9,HIGH,True,FALSE - Debunked by fact-checkers,www.snopes.com,factcheck,2026-07-02T03:43:09.514447
"[DEBUNKED] PolitiFact | Ohio’s GOP governor said it’s ‘absurd’ to call Haiti safe, experts agree",http://www.politifact.com/article/2026/jun/29/Supreme-Court-TPS-Haitians-safe-Markwayne-Mullin/,www.politifact.com,"PolitiFact | Ohio’s GOP governor said it’s ‘absurd’ to call Haiti safe, experts agree",0.9,HIGH,True,FALSE - Debunked by fact-checkers,www.politifact.com,factcheck,2026-07-02T03:43:09.905884
[DEBUNKED] PolitiFact | Fact-checking 5 videos that falsely depict scenes from Venezuela’s earthquakes,http://www.politifact.com/article/2026/jun/29/Venezuela-earthquakes-old-videos-photos/,www.politifact.com,PolitiFact | Fact-checking 5 videos that falsely depict scenes from Venezuela’s earthquakes,0.9,HIGH,True,FALSE - Debunked by fact-checkers,www.politifact.com,factcheck,2026-07-02T03:43:09.991018
"Between 50% and 70% of all adult white men met the requirement, said Rosemarie Zagarri, a history professor at George Mason University who has researched voting in early America",http://www.politifact.com/article/2026/jun/29/250th-anniversary-history-voting-mail-election/,www.politifact.com,PolitiFact | From booze-filled parties to mail ballots: How did American voting actually evolve?,0,LOW,False,,,factcheck,2026-07-02T03:43:10.469824
[DEBUNKED] PolitiFact | Fact-checking Florida Republicans’ Sunshine State Showdown,http://www.politifact.com/article/2026/jun/27/Florida-GOP-Byron-Donalds-governor-election/,www.politifact.com,PolitiFact | Fact-checking Florida Republicans’ Sunshine State Showdown,0.9,HIGH,True,FALSE - Debunked by fact-checkers,www.politifact.com,factcheck,2026-07-02T03:43:10.561567
"[DEBUNKED] PolitiFact | Platner says Collins sided with Trump to cut Medicaid, SNAP and help the rich. That’s False.",http://www.politifact.com/factchecks/2026/jun/25/graham-platner/Susan-Collins-Maine-Senate-Trump-tax-bill-SNAP/,www.politifact.com,"PolitiFact | Platner says Collins sided with Trump to cut Medicaid, SNAP and help the rich. That’s F",0.9,HIGH,True,FALSE - Debunked by fact-checkers,www.politifact.com,factcheck,2026-07-02T03:43:10.865656
[DEBUNKED] PolitiFact | Colombia&#x27;s fast voting results aren&#x27;t proof of cheating in California elections,http://www.politifact.com/article/2026/jun/25/Colombia-presidential-elections-california-primary/,www.politifact.com,PolitiFact | Colombia&#x27;s fast voting results aren&#x27;t proof of cheating in California electio,0.9,HIGH,True,FALSE - Debunked by fact-checkers,www.politifact.com,factcheck,2026-07-02T03:43:10.954541
[DEBUNKED] Toy company not selling inflatable ‘bounce houses’ for £2 – Full Fact,https://fullfact.org/economy/smyths-toys-fake-offer/,fullfact.org,Toy company not selling inflatable ‘bounce houses’ for £2 – Full Fact,0.9,HIGH,True,FALSE - Debunked by fact-checkers,fullfact.org,factcheck,2026-07-02T03:43:13.325204
[DEBUNKED] Videos of people giving their views on immigration are AI fakes – Full Fact,https://fullfact.org/immigration/fake-ai-clips-immigration-vox-pops/,fullfact.org,Videos of people giving their views on immigration are AI fakes – Full Fact,0.9,HIGH,True,FALSE - Debunked by fact-checkers,fullfact.org,factcheck,2026-07-02T03:43:13.941184
[DEBUNKED] Video does not show police ‘seizing’ mannequin for ‘offending Pakistani community’ – Full Fact,https://fullfact.org/culture-and-society/video-does-not-show-police-seizing-mannequin-offending-pakistani-community/,fullfact.org,Video does not show police ‘seizing’ mannequin for ‘offending Pakistani community’ – Full Fact,0.9,HIGH,True,FALSE - Debunked by fact-checkers,fullfact.org,factcheck,2026-07-02T03:43:14.591253
[DEBUNKED] Video of Royal Navy officer discussing migrant Channel crossings is fake – Full Fact,https://fullfact.org/immigration/navy-officer-channel-crossings-fake/,fullfact.org,Video of Royal Navy officer discussing migrant Channel crossings is fake – Full Fact,0.9,HIGH,True,FALSE - Debunked by fact-checkers,fullfact.org,factcheck,2026-07-02T03:43:15.844020
