claim,source_url,source_domain,article_title,risk_score,risk_category,has_factcheck,factcheck_rating,factcheck_source,source_type,checked_at
[DEBUNKED] This Tesco HexClad offer is not a genuine deal from the retailer – Full Fact,https://fullfact.org/shopping/tesco-hexclad-fake-offer/,fullfact.org,This Tesco HexClad offer is not a genuine deal from the retailer – Full Fact,0.9,HIGH,True,FALSE - Debunked by fact-checkers,fullfact.org,factcheck,2026-05-30T19:19:18.125681
[DEBUNKED] Southport attacker Axel Rudakubana has not suffered ‘violent assault’ in prison – Full Fact,https://fullfact.org/crime/southport-killer-rudakubana-prison-attack-claim-false/,fullfact.org,Southport attacker Axel Rudakubana has not suffered ‘violent assault’ in prison – Full Fact,0.9,HIGH,True,FALSE - Debunked by fact-checkers,fullfact.org,factcheck,2026-05-30T19:19:18.664180
[DEBUNKED] Tony Blair’s son does not run a company being paid £100 billion to develop digital ID – Full Fact,https://fullfact.org/politics/tony-blair-son-euan-company-digital-id-contract-false/,fullfact.org,Tony Blair’s son does not run a company being paid £100 billion to develop digital ID – Full Fact,0.9,HIGH,True,FALSE - Debunked by fact-checkers,fullfact.org,factcheck,2026-05-30T19:19:20.267951
“The measles vaccine prevents measles in 97% of the people who take it,https://www.factcheck.org/2026/05/a-timeline-of-rfk-jr-s-mixed-messaging-on-the-measles-vaccine/,www.factcheck.org,A Timeline of RFK Jr.&#039;s Mixed Messaging on the Measles Vaccine - FactCheck.org,0,LOW,False,,,factcheck,2026-05-30T19:19:20.883289
[DEBUNKED] Trump Distorts Maryland&#039;s Primary Ballot Mix-up to Attack Mail-in Voting - FactCheck.org,https://www.factcheck.org/2026/05/trump-distorts-marylands-primary-ballot-mix-up-to-attack-mail-in-voting/,www.factcheck.org,Trump Distorts Maryland&#039;s Primary Ballot Mix-up to Attack Mail-in Voting - FactCheck.org,0.9,HIGH,True,FALSE - Debunked by fact-checkers,www.factcheck.org,factcheck,2026-05-30T19:19:21.345356
[DEBUNKED] RFK Jr.’s Muddled Claims on Drug Approval Speed - FactCheck.org,https://www.factcheck.org/2026/05/rfk-jr-s-muddled-claims-on-drug-approval-speed/,www.factcheck.org,RFK Jr.’s Muddled Claims on Drug Approval Speed - FactCheck.org,0.9,HIGH,True,FALSE - Debunked by fact-checkers,www.factcheck.org,factcheck,2026-05-30T19:19:21.843844
"[DEBUNKED] Ad in Texas GOP Runoff Attacks Cornyn on Immigration, Islam - FactCheck.org",https://www.factcheck.org/2026/05/ad-in-texas-gop-runoff-attacks-cornyn-on-immigration-islam/,www.factcheck.org,"Ad in Texas GOP Runoff Attacks Cornyn on Immigration, Islam - FactCheck.org",0.9,HIGH,True,FALSE - Debunked by fact-checkers,www.factcheck.org,factcheck,2026-05-30T19:19:22.173340
"56, or 53%, from the average price of $2",https://www.factcheck.org/2026/05/what-will-happen-to-gasoline-prices-when-the-iran-war-ends/,www.factcheck.org,What Will Happen to Gasoline Prices When the Iran War Ends? - FactCheck.org,0,LOW,False,,,factcheck,2026-05-30T19:19:22.638058
[DEBUNKED] Kennedy Denies the One Big Beautiful Bill Act&#039;s Spending Cuts to Medicaid - FactCheck.org,https://www.factcheck.org/2026/05/kennedy-denies-the-one-big-beautiful-bill-acts-spending-cuts-to-medicaid/,www.factcheck.org,Kennedy Denies the One Big Beautiful Bill Act&#039;s Spending Cuts to Medicaid - FactCheck.org,0.9,HIGH,True,FALSE - Debunked by fact-checkers,www.factcheck.org,factcheck,2026-05-30T19:19:23.970498
"[DEBUNKED] Fact Check: FAKE Quote By Muslim Man Saying 'Christians, You're No Longer Allowed To Say 'Merry Christmas'' | Lead Stories",https://leadstories.com/hoax-alert/2026/05/fact-check-fake-quote-muslim-man-saying-christians-youre-no-longer-allowed-say-merry-christmas.html,leadstories.com,"Fact Check: FAKE Quote By Muslim Man Saying 'Christians, You're No Longer Allowed To Say 'Merry Chri",0.9,HIGH,True,FALSE - Debunked by fact-checkers,leadstories.com,factcheck,2026-05-30T19:19:24.659639
"[DEBUNKED] Fact Check: UNVERIFIED Claim About Waiting List For Superyachts And Ukrainian Officials Comes From Single, Unnamed Source | Lead Stories",https://leadstories.com/hoax-alert/2026/05/fact-check-unverified-claim-about-waiting-list-for-superyachts-and-ukrainian-officials-unnamed-source.html,leadstories.com,Fact Check: UNVERIFIED Claim About Waiting List For Superyachts And Ukrainian Officials Comes From S,0.9,HIGH,True,FALSE - Debunked by fact-checkers,leadstories.com,factcheck,2026-05-30T19:19:24.834201
[DEBUNKED] Fact Check: FAKE Emerson Poll Shows Spencer Pratt Leading Karen Bass In LA Mayor's Race -- Made Up Numbers | Lead Stories,https://leadstories.com/hoax-alert/2026/05/fact-check-fake-emerson-poll-sows-spencer-pratt-leading-karen-bass-los-angeles-mayor-made-up-numbers.html,leadstories.com,Fact Check: FAKE Emerson Poll Shows Spencer Pratt Leading Karen Bass In LA Mayor's Race -- Made Up N,0.9,HIGH,True,FALSE - Debunked by fact-checkers,leadstories.com,factcheck,2026-05-30T19:19:24.989341
[DEBUNKED] Fact Check: Edited Audio Has Fart Sounds NOT In Original Video Of Trump's Return To White House After Arlington Memorial Day Ceremony | Lead Stories,https://leadstories.com/hoax-alert/2026/05/fact-check-edited-audio-has-fart-sounds-not-in-original-video-of-trumps-return-to-white-house-after-arlington-memorial-day-ceremony.html,leadstories.com,Fact Check: Edited Audio Has Fart Sounds NOT In Original Video Of Trump's Return To White House Afte,0.9,HIGH,True,FALSE - Debunked by fact-checkers,leadstories.com,factcheck,2026-05-30T19:19:25.158442
[DEBUNKED] Fact Check: FAKE Meme Shows 'Epic' Trump-Obama Exchange About Iran Nuclear Deal -- No Evidence It Happened | Lead Stories,https://leadstories.com/hoax-alert/2026/05/fact-check-meme-does-not-accurately-present-epic-moment-interaction-between-trump-obama-about-iran-nuclear-deals.html,leadstories.com,Fact Check: FAKE Meme Shows 'Epic' Trump-Obama Exchange About Iran Nuclear Deal -- No Evidence It Ha,0.9,HIGH,True,FALSE - Debunked by fact-checkers,leadstories.com,factcheck,2026-05-30T19:19:25.324108
[DEBUNKED] Fact Check: FAKE Video Shows U.S. Strike on Iranian Drone Carrier IRIS Shahid Bagheri -- It Was Created by AI | Lead Stories,https://leadstories.com/hoax-alert/2026/05/fact-check-fake-video-shows-us-strike-on-iranian-drone-carrier-iris-shahid-bagheri-or-any-iranian-aircraft-carrier.html,leadstories.com,Fact Check: FAKE Video Shows U.S. Strike on Iranian Drone Carrier IRIS Shahid Bagheri -- It Was Crea,0.9,HIGH,True,FALSE - Debunked by fact-checkers,leadstories.com,factcheck,2026-05-30T19:19:25.480846
"[DEBUNKED] Fact Check: Armenian Mirror-Spectator Did NOT Produce Report Saying PM Nikol Pashinyan Agreed To Resettle 250,000 Refugees Without Legal Status In EU | Lead Stories",https://leadstories.com/hoax-alert/2026/05/fact-check-armenian-mirror-spectator-did-not-produce-report-saying-that-pm-nikol-pashinyan-agreed-to-resettle-250-000-refugees.html,leadstories.com,Fact Check: Armenian Mirror-Spectator Did NOT Produce Report Saying PM Nikol Pashinyan Agreed To Res,0.9,HIGH,True,FALSE - Debunked by fact-checkers,leadstories.com,factcheck,2026-05-30T19:19:25.657639
"[DEBUNKED] Fact Check: NO Evidence Three Sisters Drowned In Brighton, England, Ran GoFundMe Campaign For Mother Whose Body Was Never Found | Lead Stories",https://leadstories.com/hoax-alert/2026/05/fact-check-no-evidence-family-of-three-sisters-drowned-in-brighton-england-previously-ran-gofundme-campaign-for-mother-whose-body-was-never-found.html,leadstories.com,"Fact Check: NO Evidence Three Sisters Drowned In Brighton, England, Ran GoFundMe Campaign For Mother",0.9,HIGH,True,FALSE - Debunked by fact-checkers,leadstories.com,factcheck,2026-05-30T19:19:25.829686
[DEBUNKED] Fact Check: FAKE BBC News Video Report Says France Is Deploying 800 French Foreign Legion Soldiers To Armenia | Lead Stories,https://leadstories.com/hoax-alert/2026/05/fact-check-fake-bbc-news-video-report-says-france-deploying-800-french-foreign-legion-soldiers-armenia.html,leadstories.com,Fact Check: FAKE BBC News Video Report Says France Is Deploying 800 French Foreign Legion Soldiers T,0.9,HIGH,True,FALSE - Debunked by fact-checkers,leadstories.com,factcheck,2026-05-30T19:19:25.998355
[DEBUNKED] Fact Check: The White House DID Publish A Post Commemorating The Tenth Anniversary Of The Death Of Harambe The Gorilla | Lead Stories,https://leadstories.com/hoax-alert/2026/05/fact-check-the-white-house-did-publish-a-post-commemorating-the-tenth-anniversary-of-the-death-of-harambe-the-gorilla.html,leadstories.com,Fact Check: The White House DID Publish A Post Commemorating The Tenth Anniversary Of The Death Of H,0.9,HIGH,True,FALSE - Debunked by fact-checkers,leadstories.com,factcheck,2026-05-30T19:19:26.152447
[DEBUNKED] Fact Check: Haaretz Did NOT Report That Zelenskyy's Associate Timur Mindich Fled To Israel With 800 kg Of Gold | Lead Stories,https://leadstories.com/hoax-alert/2026/05/fact-check-haaretz-did-not-report-that-mindich-fled-to-israel-with-800-kg-of-gold.html,leadstories.com,Fact Check: Haaretz Did NOT Report That Zelenskyy's Associate Timur Mindich Fled To Israel With 800 ,0.9,HIGH,True,FALSE - Debunked by fact-checkers,leadstories.com,factcheck,2026-05-30T19:19:26.334582
[DEBUNKED] Fact Check: FAKE Video Shows Woman Stuck Upside Down In A Water Slide -- AI-Generated | Lead Stories,https://leadstories.com/hoax-alert/2026/05/fact-check-fake-video-shows-woman-stuck-upside-down-in-a-water-slide.html,leadstories.com,Fact Check: FAKE Video Shows Woman Stuck Upside Down In A Water Slide -- AI-Generated | Lead Stories,0.9,HIGH,True,FALSE - Debunked by fact-checkers,leadstories.com,factcheck,2026-05-30T19:19:26.500775
[DEBUNKED] Fact Check: Real But Colorized 1923 Footage Shows Early French Roller Skates Called 'Paticycles' | Lead Stories,https://leadstories.com/hoax-alert/2026/05/fact-check-real-but-colorized-1923-footage-shows-early-french-roller-skates-called-paticycles.html,leadstories.com,Fact Check: Real But Colorized 1923 Footage Shows Early French Roller Skates Called 'Paticycles' | L,0.9,HIGH,True,FALSE - Debunked by fact-checkers,leadstories.com,factcheck,2026-05-30T19:19:26.658001
[DEBUNKED] Fact Check: Graphic ACCURATELY Depicts Net Worth Changes For Recent Presidents But Includes Formatting Errors | Lead Stories,https://leadstories.com/hoax-alert/2026/05/fact-check-graphic-accurately-depicts-net-worth-changes-for-recent-presidents-but-includes-formatting-errors.html,leadstories.com,Fact Check: Graphic ACCURATELY Depicts Net Worth Changes For Recent Presidents But Includes Formatti,0.9,HIGH,True,FALSE - Debunked by fact-checkers,leadstories.com,factcheck,2026-05-30T19:19:26.832948
[DEBUNKED] Fact Check: Video Does NOT Show Real Crowds At 2026 Hajj -- It Is AI-Generated | Lead Stories,https://leadstories.com/hoax-alert/2026/05/fact-check-video-of-crowds-does-not-show-2026-hajj.html,leadstories.com,Fact Check: Video Does NOT Show Real Crowds At 2026 Hajj -- It Is AI-Generated | Lead Stories,0.9,HIGH,True,FALSE - Debunked by fact-checkers,leadstories.com,factcheck,2026-05-30T19:19:27.008063
"[DEBUNKED] Victim-blaming Kyiv, pressuring Moldova, and drone disinformation - EUvsDisinfo",https://euvsdisinfo.eu/victim-blaming-kyiv-pressuring-moldova-and-drone-disinformation/,euvsdisinfo.eu,"Victim-blaming Kyiv, pressuring Moldova, and drone disinformation - EUvsDisinfo",0.9,HIGH,True,FALSE - Debunked by fact-checkers,euvsdisinfo.eu,factcheck,2026-05-30T19:19:29.979031
"[DEBUNKED] Tough love: Spies, dating apps and the dark side of online intimacy - EUvsDisinfo",https://euvsdisinfo.eu/tough-love-spies-dating-apps-and-the-dark-side-of-online-intimacy/,euvsdisinfo.eu,"Tough love: Spies, dating apps and the dark side of online intimacy - EUvsDisinfo",0.9,HIGH,True,FALSE - Debunked by fact-checkers,euvsdisinfo.eu,factcheck,2026-05-30T19:19:33.022042
"[DEBUNKED] Lies about Russia’s military success, Yermak’s arrest and secret biolabs - EUvsDisinfo",https://euvsdisinfo.eu/lies-about-russias-military-success-yermaks-arrest-and-secret-biolabs/,euvsdisinfo.eu,"Lies about Russia’s military success, Yermak’s arrest and secret biolabs - EUvsDisinfo",0.9,HIGH,True,FALSE - Debunked by fact-checkers,euvsdisinfo.eu,factcheck,2026-05-30T19:19:34.475055
"[DEBUNKED] Victory Day propaganda, masking fear with intimidation, and abduction denial - EUvsDisinfo",https://euvsdisinfo.eu/victory-day-propaganda-masking-fear-with-intimidation-and-abduction-denial/,euvsdisinfo.eu,"Victory Day propaganda, masking fear with intimidation, and abduction denial - EUvsDisinfo",0.9,HIGH,True,FALSE - Debunked by fact-checkers,euvsdisinfo.eu,factcheck,2026-05-30T19:19:38.399163
[DEBUNKED] How Russia lies about the stolen Ukrainian children - EUvsDisinfo,https://euvsdisinfo.eu/how-russia-lies-about-the-stolen-ukrainian-children/,euvsdisinfo.eu,How Russia lies about the stolen Ukrainian children - EUvsDisinfo,0.9,HIGH,True,FALSE - Debunked by fact-checkers,euvsdisinfo.eu,factcheck,2026-05-30T19:19:47.864913
[DEBUNKED] Fake European crises and real Russian failures - EUvsDisinfo,https://euvsdisinfo.eu/fake-european-crises-and-real-russian-failures/,euvsdisinfo.eu,Fake European crises and real Russian failures - EUvsDisinfo,0.9,HIGH,True,FALSE - Debunked by fact-checkers,euvsdisinfo.eu,factcheck,2026-05-30T19:19:50.751801
"Zum Login SPIEGEL plus Nur für Neukunden € 1,– für 4 Wochen danach € 5,99 pro Woche Freier Zugriff auf alle S+-Artikel auf SPIEGEL",https://www.spiegel.de/politik/deutschland/fdp-wolfgang-kubicki-setzt-sich-im-ueberraschenden-duell-um-vorsitz-durch-a-c5586743-aa84-480b-bd98-454907095cda#ref=rss,www.spiegel.de,FDP: Wolfgang Kubicki setzt sich im überraschenden Duell um Vorsitz durch - DER SPIEGEL,0.1,LOW,False,,,mainstream,2026-05-30T19:20:01.948330
"E-Paper (PDF), Digital-Archiv und S+-Newsletter Jederzeit kündigen Jetzt abonnieren SPIEGEL plus 52 Wochen 25 % sparen € 4,49 pro Woche für 52 Wochen danach € 5,99 pro Woche Freier Zugriff auf alle S+-Artikel auf SPIEGEL",https://www.spiegel.de/politik/deutschland/fdp-wolfgang-kubicki-setzt-sich-im-ueberraschenden-duell-um-vorsitz-durch-a-c5586743-aa84-480b-bd98-454907095cda#ref=rss,www.spiegel.de,FDP: Wolfgang Kubicki setzt sich im überraschenden Duell um Vorsitz durch - DER SPIEGEL,0.1,LOW,False,,,mainstream,2026-05-30T19:20:02.024363
An der Windrad-Aktion im westfälischen Hamm beteiligten sich nach Angaben der Organisatoren rund 2000 Menschen,https://www.spiegel.de/panorama/gesellschaft/hamm-klimaschuetzer-protestieren-mit-einem-windrad-aus-menschen-gegen-geplante-gaskraftwerke-a-fa9317ec-d903-4e23-ae1d-e7c366363de4#ref=rss,www.spiegel.de,Hamm: Klimaschützer protestieren mit einem Windrad aus Menschen gegen geplante Gaskraftwerke - DER S,0,LOW,False,,,mainstream,2026-05-30T19:20:05.021074
An ihr nahmen laut Polizei rund 2700 Menschen teil,https://www.spiegel.de/panorama/gesellschaft/hamm-klimaschuetzer-protestieren-mit-einem-windrad-aus-menschen-gegen-geplante-gaskraftwerke-a-fa9317ec-d903-4e23-ae1d-e7c366363de4#ref=rss,www.spiegel.de,Hamm: Klimaschützer protestieren mit einem Windrad aus Menschen gegen geplante Gaskraftwerke - DER S,0,LOW,False,,,mainstream,2026-05-30T19:20:05.096183
"Keine VerletztenNähere Angaben dazu, was sich an Bord abspielte, machte United Airlines nicht",https://www.spiegel.de/panorama/usa-united-airlines-flug-wegen-renitenten-passagiers-in-madison-gelandet-a-09b5ead8-3c66-46dc-9846-ae216ed31a90#ref=rss,www.spiegel.de,USA: United-Airlines-Flug wegen renitenten Passagiers in Madison gelandet - DER SPIEGEL,0.1,LOW,False,,,mainstream,2026-05-30T19:20:06.514076
Verletzt wurde nach Angaben der Fluggesellschaft niemand,https://www.spiegel.de/panorama/usa-united-airlines-flug-wegen-renitenten-passagiers-in-madison-gelandet-a-09b5ead8-3c66-46dc-9846-ae216ed31a90#ref=rss,www.spiegel.de,USA: United-Airlines-Flug wegen renitenten Passagiers in Madison gelandet - DER SPIEGEL,0.1,LOW,False,,,mainstream,2026-05-30T19:20:06.599141
In manchen Ländern ist jeder fünfte Mensch psychisch krank,https://www.spiegel.de/wissenschaft/mensch/angststoerungen-und-depressionen-weltweit-wo-besonders-viele-menschen-psychisch-krank-sind-a-29e3428f-e6a7-41a3-8d33-68e5db55cc1c#ref=rss,www.spiegel.de,Angststörungen und Depressionen weltweit: Wo besonders viele Menschen psychisch krank sind - DER SPI,0,LOW,False,,,mainstream,2026-05-30T19:20:08.855082
"com Facebook E-Mail Messenger WhatsApp Link kopieren image""> Bild vergrößern Psychische Erkrankungen: Immer mehr Menschen betroffen Foto: RBompiani Photo / iStockphoto / Getty Images Sie können den Artikel leider nicht mehr aufrufen",https://www.spiegel.de/wissenschaft/mensch/angststoerungen-und-depressionen-weltweit-wo-besonders-viele-menschen-psychisch-krank-sind-a-29e3428f-e6a7-41a3-8d33-68e5db55cc1c#ref=rss,www.spiegel.de,Angststörungen und Depressionen weltweit: Wo besonders viele Menschen psychisch krank sind - DER SPI,0.1,LOW,False,,,mainstream,2026-05-30T19:20:08.937795
"Zum Login SPIEGEL plus Nur für Neukunden € 1,– für 4 Wochen danach € 5,99 pro Woche Freier Zugriff auf alle S+-Artikel auf SPIEGEL",https://www.spiegel.de/wissenschaft/mensch/angststoerungen-und-depressionen-weltweit-wo-besonders-viele-menschen-psychisch-krank-sind-a-29e3428f-e6a7-41a3-8d33-68e5db55cc1c#ref=rss,www.spiegel.de,Angststörungen und Depressionen weltweit: Wo besonders viele Menschen psychisch krank sind - DER SPI,0.1,LOW,False,,,mainstream,2026-05-30T19:20:09.017604
"Zum Login SPIEGEL plus Nur für Neukunden € 1,– für 4 Wochen danach € 5,99 pro Woche Freier Zugriff auf alle S+-Artikel auf SPIEGEL",https://www.spiegel.de/politik/afd-in-mecklenburg-vorpommern-der-parteitag-der-afd-a-ad944917-eb5f-40e7-9022-4f7a540e9f53#ref=rss,www.spiegel.de,AfD in Mecklenburg-Vorpommern: Der Parteitag der AfD - DER SPIEGEL,0.1,LOW,False,,,mainstream,2026-05-30T19:20:10.452607
"E-Paper (PDF), Digital-Archiv und S+-Newsletter Jederzeit kündigen Jetzt abonnieren SPIEGEL plus 52 Wochen 25 % sparen € 4,49 pro Woche für 52 Wochen danach € 5,99 pro Woche Freier Zugriff auf alle S+-Artikel auf SPIEGEL",https://www.spiegel.de/politik/afd-in-mecklenburg-vorpommern-der-parteitag-der-afd-a-ad944917-eb5f-40e7-9022-4f7a540e9f53#ref=rss,www.spiegel.de,AfD in Mecklenburg-Vorpommern: Der Parteitag der AfD - DER SPIEGEL,0.1,LOW,False,,,mainstream,2026-05-30T19:20:10.526180
"Zum Login SPIEGEL plus Nur für Neukunden € 1,– für 4 Wochen danach € 5,99 pro Woche Freier Zugriff auf alle S+-Artikel auf SPIEGEL",https://www.spiegel.de/sport/fussball/champions-league-paris-saint-germain-oder-arsenal-wer-ist-das-beste-team-europas-a-6a56bb4d-8828-4e93-bee3-42559fed264c#ref=rss,www.spiegel.de,Champions League: Paris Saint-Germain oder Arsenal - wer ist das beste Team Europas? - DER SPIEGEL,0.1,LOW,False,,,mainstream,2026-05-30T19:20:11.621269
"E-Paper (PDF), Digital-Archiv und S+-Newsletter Jederzeit kündigen Jetzt abonnieren SPIEGEL plus 52 Wochen 25 % sparen € 4,49 pro Woche für 52 Wochen danach € 5,99 pro Woche Freier Zugriff auf alle S+-Artikel auf SPIEGEL",https://www.spiegel.de/sport/fussball/champions-league-paris-saint-germain-oder-arsenal-wer-ist-das-beste-team-europas-a-6a56bb4d-8828-4e93-bee3-42559fed264c#ref=rss,www.spiegel.de,Champions League: Paris Saint-Germain oder Arsenal - wer ist das beste Team Europas? - DER SPIEGEL,0.1,LOW,False,,,mainstream,2026-05-30T19:20:11.691370
"Nach und nach kamen immer mehr Menschen zusammen: Anwohner, Radfahrer – manche haben sich Brötchen mitgebracht",https://www.spiegel.de/panorama/brenner-autobahn-demonstration-auf-leerer-ferienroute-was-bringt-der-protest-a-5d2735de-5c0c-4217-a748-90391070f810#ref=rss,www.spiegel.de,Brenner-Autobahn: Demonstration auf leerer Ferienroute – was bringt der Protest? - DER SPIEGEL,0.1,LOW,False,,,mainstream,2026-05-30T19:20:12.558199
"Trotzdem haben wir immer wieder Transparente gesehen mit konkreten Forderungen: ›Menschen sind wichtiger als Wirtschaft‹, ›Genug ist genug‹",https://www.spiegel.de/panorama/brenner-autobahn-demonstration-auf-leerer-ferienroute-was-bringt-der-protest-a-5d2735de-5c0c-4217-a748-90391070f810#ref=rss,www.spiegel.de,Brenner-Autobahn: Demonstration auf leerer Ferienroute – was bringt der Protest? - DER SPIEGEL,0.1,LOW,False,,,mainstream,2026-05-30T19:20:12.633548
"Er wurde zu 88,3 Millionen Dollar Schadensersatz verurteilt",https://www.spiegel.de/ausland/donald-trump-vs-e-jean-carroll-trump-geht-mit-justizministerium-gegen-klaegerin-vor-a-2ffa3cdb-c14c-4cf8-96db-a00547ca6fe2#ref=rss,www.spiegel.de,Donald Trump vs. E. Jean Carroll: Trump geht mit Justizministerium gegen Klägerin vor - DER SPIEGEL,0,LOW,False,,,mainstream,2026-05-30T19:20:13.570766
"Zum Login SPIEGEL plus Nur für Neukunden € 1,– für 4 Wochen danach € 5,99 pro Woche Freier Zugriff auf alle S+-Artikel auf SPIEGEL",https://www.spiegel.de/ausland/donald-trump-vs-e-jean-carroll-trump-geht-mit-justizministerium-gegen-klaegerin-vor-a-2ffa3cdb-c14c-4cf8-96db-a00547ca6fe2#ref=rss,www.spiegel.de,Donald Trump vs. E. Jean Carroll: Trump geht mit Justizministerium gegen Klägerin vor - DER SPIEGEL,0.1,LOW,False,,,mainstream,2026-05-30T19:20:13.653310
"E-Paper (PDF), Digital-Archiv und S+-Newsletter Jederzeit kündigen Jetzt abonnieren SPIEGEL plus 52 Wochen 25 % sparen € 4,49 pro Woche für 52 Wochen danach € 5,99 pro Woche Freier Zugriff auf alle S+-Artikel auf SPIEGEL",https://www.spiegel.de/ausland/donald-trump-vs-e-jean-carroll-trump-geht-mit-justizministerium-gegen-klaegerin-vor-a-2ffa3cdb-c14c-4cf8-96db-a00547ca6fe2#ref=rss,www.spiegel.de,Donald Trump vs. E. Jean Carroll: Trump geht mit Justizministerium gegen Klägerin vor - DER SPIEGEL,0.1,LOW,False,,,mainstream,2026-05-30T19:20:13.733508
Immer wieder fiel der Ex-Mann von Kim Ka,https://www.spiegel.de/kultur/musik/italien-konzert-von-kanye-west-alias-ye-abgesagt-a-5c9ed168-5276-41f9-9dd2-41f38bfc4bef#ref=rss,www.spiegel.de,Kanye West alias Ye: Italien-Konzert abgesagt - DER SPIEGEL,0.1,LOW,False,,,mainstream,2026-05-30T19:20:15.169054
"Wolfgang Kubicki konnte die Wahl gegen Marie-Agnes Strack-Zimmermann für sich entscheiden, er erhielt 60 Prozent der Stimmen",https://www.spiegel.de/politik/deutschland/fdp-wolfgang-kubicki-zum-neuen-parteivorsitzenden-der-fdp-gewaehlt-a-6c0ef1f8-b1bb-4531-8a4b-6e70c39c12e5#ref=rss,www.spiegel.de,FDP: Wolfgang Kubicki zum neuen Parteivorsitzenden der FDP gewählt - DER SPIEGEL,0.1,LOW,False,,,mainstream,2026-05-30T19:20:16.765136
Ihm gelang aber keine Trendwende,https://www.spiegel.de/politik/deutschland/fdp-wolfgang-kubicki-zum-neuen-parteivorsitzenden-der-fdp-gewaehlt-a-6c0ef1f8-b1bb-4531-8a4b-6e70c39c12e5#ref=rss,www.spiegel.de,FDP: Wolfgang Kubicki zum neuen Parteivorsitzenden der FDP gewählt - DER SPIEGEL,0.1,LOW,False,,,mainstream,2026-05-30T19:20:16.852791
"In diesem Jahr kassierte die FDP bei den Landtagswahlen in Baden-Württemberg (4,4 Prozent) und Rheinland-Pfalz (2,1 Prozent) bittere Niederlagen",https://www.spiegel.de/politik/deutschland/fdp-wolfgang-kubicki-zum-neuen-parteivorsitzenden-der-fdp-gewaehlt-a-6c0ef1f8-b1bb-4531-8a4b-6e70c39c12e5#ref=rss,www.spiegel.de,FDP: Wolfgang Kubicki zum neuen Parteivorsitzenden der FDP gewählt - DER SPIEGEL,0.1,LOW,False,,,mainstream,2026-05-30T19:20:16.928023
net / photothek / IMAGO Die Techniker Krankenkasse (TK) hat im vergangenen Jahr so viele Verdachtsfälle auf Behandlungsfehler registriert wie nie zuvor,https://www.spiegel.de/wirtschaft/patientensicherheit-tk-verzeichnet-hoechststand-bei-verdacht-auf-behandlungsfehler-a-5777b448-d449-40b1-aee6-4131c67b3a60#ref=rss,www.spiegel.de,Techniker Krankenkasse verzeichnet Höchststand bei Verdacht auf Behandlungsfehler - DER SPIEGEL,0.1,LOW,False,,,mainstream,2026-05-30T19:20:17.758971
Das sind 14 Prozent mehr als im Vorjahr,https://www.spiegel.de/wirtschaft/patientensicherheit-tk-verzeichnet-hoechststand-bei-verdacht-auf-behandlungsfehler-a-5777b448-d449-40b1-aee6-4131c67b3a60#ref=rss,www.spiegel.de,Techniker Krankenkasse verzeichnet Höchststand bei Verdacht auf Behandlungsfehler - DER SPIEGEL,0,LOW,False,,,mainstream,2026-05-30T19:20:17.844846
"Etwa jeder dritte Fall erhärte sich im Rahmen der Überprüfung, sodass Medizinrechts-Spezialisten ein Verfahren in die Wege leiten konnten",https://www.spiegel.de/wirtschaft/patientensicherheit-tk-verzeichnet-hoechststand-bei-verdacht-auf-behandlungsfehler-a-5777b448-d449-40b1-aee6-4131c67b3a60#ref=rss,www.spiegel.de,Techniker Krankenkasse verzeichnet Höchststand bei Verdacht auf Behandlungsfehler - DER SPIEGEL,0,LOW,False,,,mainstream,2026-05-30T19:20:17.930628
"The UK is connected by about 60 undersea cables, which British officials say are increasingly under threat from Moscow, with a 30% rise in Russian vessels spotted in UK waters over the past few years",https://www.bbc.com/news/articles/c5y8wjvd1ypo?at_medium=RSS&amp;at_campaign=rss,www.bbc.com,"Aukus: US, UK and Australia to develop underwater drone technology",0,LOW,False,,,mainstream,2026-05-30T19:20:18.440892
"8% of 16- to 17-year-olds in Sefton were Neet, a figure that has halved since they started the scheme in 2019",https://www.bbc.com/news/articles/cd6p9yyg64vo?at_medium=RSS&amp;at_campaign=rss,www.bbc.com,How a borough in Merseyside is bucking the UK&#x27;s youth unemployment trend,0,LOW,False,,,mainstream,2026-05-30T19:20:19.174314
9% rate among patients who received chemotherapy as part of their care,https://www.bbc.com/news/articles/c2325j0xk1vo?at_medium=RSS&amp;at_campaign=rss,www.bbc.com,"Millions of breast cancer patients could safely avoid chemotherapy, study suggests",0,LOW,False,,,mainstream,2026-05-30T19:20:19.855931
