claim,source_url,source_domain,article_title,risk_score,risk_category,has_factcheck,factcheck_rating,factcheck_source,source_type,checked_at
"„Nur 30 Millionen Euro gibt es jährlich in Bayern für alle Frauenhäuser, alle Beratungsstellen und nebenbei noch den Kampf gegen digitale Gewalt gegen Frauen“, kritisierte sie, „das ist ein Witz, eine Schande",http://www.merkur.de/lokales/muenchen/3000-menschen-fordern-nach-collien-fernandes-vorwuerfen-kampf-gegen-deepfakes-94241011.html,merkur.de,Demo in München: 3000 Menschen fordern Kampf gegen digitale Gewalt,0.1,LOW,False,,,unknown,2026-03-29T18:46:22.165274
Dann brauchen Sie laut einer aktuellen ADAC-Auswertung ein großes Budget – oder einen langen Atem,http://www.merkur.de/verbraucher/die-geheimtipps-fuer-schmales-budget-nur-noch-drei-neuwagen-fuer-familien-unter-20-000-euro-adac-nennt-94238270.html,merkur.de,Nur noch drei Neuwagen für Familien unter 20.000 Euro – ADAC nennt „Geheimtipps“,0,LOW,False,,,unknown,2026-03-29T18:46:22.787339
Vor zehn Jahren war die Auswahl noch relativ komfortabel: Im Jahr 2016 boten laut ADAC immerhin 40 Modelle genug Platz für die Familie – und das zum Neupreis unter 20,http://www.merkur.de/verbraucher/die-geheimtipps-fuer-schmales-budget-nur-noch-drei-neuwagen-fuer-familien-unter-20-000-euro-adac-nennt-94238270.html,merkur.de,Nur noch drei Neuwagen für Familien unter 20.000 Euro – ADAC nennt „Geheimtipps“,0.1,LOW,False,,,unknown,2026-03-29T18:46:22.852375
"Der Dacia Jogger gehört laut ADAC zu den letzten drei Familienautos, die als Neuwagen unter 20",http://www.merkur.de/verbraucher/die-geheimtipps-fuer-schmales-budget-nur-noch-drei-neuwagen-fuer-familien-unter-20-000-euro-adac-nennt-94238270.html,merkur.de,Nur noch drei Neuwagen für Familien unter 20.000 Euro – ADAC nennt „Geheimtipps“,0,LOW,False,,,unknown,2026-03-29T18:46:22.925544
"„Nur 30 Millionen Euro gibt es jährlich in Bayern für alle Frauenhäuser, alle Beratungsstellen und nebenbei noch den Kampf gegen digitale Gewalt gegen Frauen“, kritisierte sie, „das ist ein Witz, eine Schande",http://www.tz.de/muenchen/stadt/3000-menschen-fordern-nach-collien-fernandes-vorwuerfen-kampf-gegen-deepfakes-94240811.html,tz.de,Demo in München: 3000 Menschen fordern Kampf gegen digitale Gewalt,0.1,LOW,False,,,unknown,2026-03-29T18:46:24.932575
Februar den Betrieb eingestellt – eine vollständige Rückkehr zum normalen Flugplan ist noch immer nicht in Sicht,https://www.waz-online.de/reise/iran-krieg-flugausfaelle-in-dubai-abu-dhabi-doha-die-aktuelle-lage-im-ueberblick-GE4IBMC2WBH3FMDI4RD25EFWCI.html,waz-online.de,"Iran-Krieg: Flugausfälle in Dubai, Abu Dhabi, Doha – die aktuelle Lage im Überblick",0.1,LOW,False,,,unknown,2026-03-29T18:46:25.450304
Einige Reiseveranstalter und Airlines haben alle Flüge in die Region abgesagt,https://www.waz-online.de/reise/iran-krieg-flugausfaelle-in-dubai-abu-dhabi-doha-die-aktuelle-lage-im-ueberblick-GE4IBMC2WBH3FMDI4RD25EFWCI.html,waz-online.de,"Iran-Krieg: Flugausfälle in Dubai, Abu Dhabi, Doha – die aktuelle Lage im Überblick",0.1,LOW,False,,,unknown,2026-03-29T18:46:25.519835
"Laut Reddit-CEO Steve Huffman, der sich im TBPN-Podcast äußerte, könnten künftig zusätzliche Verifizierungsschritte nötig werden",https://www.pcgames.de/Onlinestory-des-Tages-Thema-146260/News/Reddit-Face-ID-Gesichtsscans-Verifizierung-Bots-1523873/,pcgames.de,Reddit will Bots eindämmen: Zugang künftig nur noch per Face-ID?,0,LOW,False,,,unknown,2026-03-29T18:46:26.745031
Das reicht von einfachen Verifizierungen bis hin zu aufwendigeren Identitätsprüfungen mit offiziellen Ausweisdokumenten,https://www.pcgames.de/Onlinestory-des-Tages-Thema-146260/News/Reddit-Face-ID-Gesichtsscans-Verifizierung-Bots-1523873/,pcgames.de,Reddit will Bots eindämmen: Zugang künftig nur noch per Face-ID?,0,LOW,False,,,unknown,2026-03-29T18:46:26.814906
Günstig wie nie: Starker Gaming-Handheld MSI Claw 8 AI+ Würdet ihr für weniger Bots auch Gesichtsscans hinnehmen wollen,https://www.pcgames.de/Onlinestory-des-Tages-Thema-146260/News/Reddit-Face-ID-Gesichtsscans-Verifizierung-Bots-1523873/,pcgames.de,Reddit will Bots eindämmen: Zugang künftig nur noch per Face-ID?,0.1,LOW,False,,,unknown,2026-03-29T18:46:26.883518
Februar den Betrieb eingestellt – eine vollständige Rückkehr zum normalen Flugplan ist noch immer nicht in Sicht,https://www.cz.de/reise/iran-krieg-flugausfaelle-in-dubai-abu-dhabi-doha-die-aktuelle-lage-im-ueberblick-GE4IBMC2WBH3FMDI4RD25EFWCI.html,cz.de,"Iran-Krieg: Flugausfälle in Dubai, Abu Dhabi, Doha – die aktuelle Lage im Überblick",0.1,LOW,False,,,unknown,2026-03-29T18:46:27.572393
Einige Reiseveranstalter und Airlines haben alle Flüge in die Region abgesagt,https://www.cz.de/reise/iran-krieg-flugausfaelle-in-dubai-abu-dhabi-doha-die-aktuelle-lage-im-ueberblick-GE4IBMC2WBH3FMDI4RD25EFWCI.html,cz.de,"Iran-Krieg: Flugausfälle in Dubai, Abu Dhabi, Doha – die aktuelle Lage im Überblick",0.1,LOW,False,,,unknown,2026-03-29T18:46:27.632095
Februar den Betrieb eingestellt – eine vollständige Rückkehr zum normalen Flugplan ist noch immer nicht in Sicht,https://www.rga.de/reise/iran-krieg-flugausfaelle-in-dubai-abu-dhabi-doha-die-aktuelle-lage-im-ueberblick-GE4IBMC2WBH3FMDI4RD25EFWCI.html,rga.de,"Iran-Krieg: Flugausfälle in Dubai, Abu Dhabi, Doha – die aktuelle Lage im Überblick",0.1,LOW,False,,,unknown,2026-03-29T18:46:28.229912
Einige Reiseveranstalter und Airlines haben alle Flüge in die Region abgesagt,https://www.rga.de/reise/iran-krieg-flugausfaelle-in-dubai-abu-dhabi-doha-die-aktuelle-lage-im-ueberblick-GE4IBMC2WBH3FMDI4RD25EFWCI.html,rga.de,"Iran-Krieg: Flugausfälle in Dubai, Abu Dhabi, Doha – die aktuelle Lage im Überblick",0.1,LOW,False,,,unknown,2026-03-29T18:46:28.293885
"Laut Aussendung sprachen die Ministerinnen gemeinsam mit der Juristin, Expertin für Gleichberechtigung und CEO von Female Founders, Natascha Fürst, und der Autorin Gertraud Klemm über die Kernforderungen der Initiative",https://www.oe24.at/oesterreich/politik/ministerinnen-kaempfen-gegen-sexualisierte-deepfakes/674484372,oe24.at,Ministerinnen kämpfen gegen sexualisierte Deepfakes - Politik-Live,0,LOW,False,,,unknown,2026-03-29T18:46:28.520514
Februar den Betrieb eingestellt – eine vollständige Rückkehr zum normalen Flugplan ist noch immer nicht in Sicht,https://www.ndz.de/reise/iran-krieg-flugausfaelle-in-dubai-abu-dhabi-doha-die-aktuelle-lage-im-ueberblick-GE4IBMC2WBH3FMDI4RD25EFWCI.html,ndz.de,"Iran-Krieg: Flugausfälle in Dubai, Abu Dhabi, Doha – die aktuelle Lage im Überblick",0.1,LOW,False,,,unknown,2026-03-29T18:46:29.119847
Einige Reiseveranstalter und Airlines haben alle Flüge in die Region abgesagt,https://www.ndz.de/reise/iran-krieg-flugausfaelle-in-dubai-abu-dhabi-doha-die-aktuelle-lage-im-ueberblick-GE4IBMC2WBH3FMDI4RD25EFWCI.html,ndz.de,"Iran-Krieg: Flugausfälle in Dubai, Abu Dhabi, Doha – die aktuelle Lage im Überblick",0.1,LOW,False,,,unknown,2026-03-29T18:46:29.176454
"Bucher sagt, sie habe von Anfang an klargemacht, dass sie sich keine romantische Beziehung vorstellen könne",https://www.nzz.ch/nzz-am-sonntag/report-und-debatte/wie-digitale-gewalt-frauen-in-der-schweiz-trifft-ld.1931127,nzz.ch,Deepfake-Pornos und Stalking: Wie digitale Gewalt Frauen in der Schweiz trifft,0.1,LOW,False,,,unknown,2026-03-29T18:46:30.020781
"Laut Aussendung sprachen die Ministerinnen gemeinsam mit der Juristin, Expertin für Gleichberechtigung und CEO",https://www.diepresse.com/20722839/sporrer-und-holzleitner-im-kampf-gegen-sexualisierte-deepfakes,diepresse.com,Sporrer und Holzleitner im Kampf gegen sexualisierte Deepfakes – DiePresse.com,0,LOW,False,,,unknown,2026-03-29T18:46:31.520365
"com Facebook E-Mail Messenger WhatsApp Link kopieren Was zum Schauen:Privatjets, Luxussuiten im „Adlon“ und immer ein direkter Draht zur Politik",https://www.manager-magazin.de/lifestyle/leute/tipps-fuer-den-feierabend-aufstieg-und-fall-des-windkraft-schwindlers-hendrik-holt-a-2ea09788-b7e6-4241-be9d-63f361dd7496,manager-magazin.de,Tipps für den Feierabend: Aufstieg und Fall des Windkraft-Schwindlers Hendrik Holt - manager magazin,0.1,LOW,False,,,unknown,2026-03-29T18:46:32.392705
"Keine 30 Jahre alt, verkaufte der selbst ernannte „Dr",https://www.manager-magazin.de/lifestyle/leute/tipps-fuer-den-feierabend-aufstieg-und-fall-des-windkraft-schwindlers-hendrik-holt-a-2ea09788-b7e6-4241-be9d-63f361dd7496,manager-magazin.de,Tipps für den Feierabend: Aufstieg und Fall des Windkraft-Schwindlers Hendrik Holt - manager magazin,0.1,LOW,False,,,unknown,2026-03-29T18:46:32.460028
Alle Medientipps Was zum Lesen: Anzeige Sport,https://www.manager-magazin.de/lifestyle/leute/tipps-fuer-den-feierabend-aufstieg-und-fall-des-windkraft-schwindlers-hendrik-holt-a-2ea09788-b7e6-4241-be9d-63f361dd7496,manager-magazin.de,Tipps für den Feierabend: Aufstieg und Fall des Windkraft-Schwindlers Hendrik Holt - manager magazin,0.1,LOW,False,,,unknown,2026-03-29T18:46:32.519353
"Wir klären, was über den Fall bekannt ist, was plant Bundesjustizministerin Hubig plant und warum immer neue Einzelfall-Paragrafen nicht weiterhelfen",https://www.lto.de/recht/meinung/m/der-fall-ulmen-bnd-befugnisse-kokain-staatsanwalt,lto.de,"LTO-Podcast: Ulmen, Fernandes, Deepfakes und Strafrecht",0.1,LOW,False,,,unknown,2026-03-29T18:46:33.497415
"Laut Aussendung sprachen die Ministerinnen gemeinsam mit der Juristin, Expertin für Gleichberechtigung und CEO von Female Founders, Natascha Fürst, und der Autorin Gertraud Klemm über die Kernforderungen der Initiative",https://www.news.at/politik/sporrer-und-holzleitner-im-kampf-gegen-digitale-gewalt,news.at,Sporrer und Holzleitner im Kampf gegen digitale Gewalt,0,LOW,False,,,unknown,2026-03-29T18:46:34.788815
"Für Frauenministerin Holzleitner sei digitale Gewalt, wie etwa sexualisierte Deepfakes, keine neuen Randphänomene",https://www.news.at/politik/sporrer-und-holzleitner-im-kampf-gegen-digitale-gewalt,news.at,Sporrer und Holzleitner im Kampf gegen digitale Gewalt,0.1,LOW,False,,,unknown,2026-03-29T18:46:34.854437
"Vielmehr zeige sich dabei ein strukturelles Problem, das sich durch alle Gesellschaftsschichten ziehe und sowohl Würde als auch Selbstbestimmung ""von Frauen massiv angreift""",https://www.news.at/politik/sporrer-und-holzleitner-im-kampf-gegen-digitale-gewalt,news.at,Sporrer und Holzleitner im Kampf gegen digitale Gewalt,0.1,LOW,False,,,unknown,2026-03-29T18:46:34.916515
Februar den Betrieb eingestellt – eine vollständige Rückkehr zum normalen Flugplan ist noch immer nicht in Sicht,https://www.dnn.de/reise/iran-krieg-flugausfaelle-in-dubai-abu-dhabi-doha-die-aktuelle-lage-im-ueberblick-GE4IBMC2WBH3FMDI4RD25EFWCI.html,dnn.de,"Iran-Krieg: Flugausfälle in Dubai, Abu Dhabi, Doha – die aktuelle Lage im Überblick",0.1,LOW,False,,,unknown,2026-03-29T18:46:36.050353
Einige Reiseveranstalter und Airlines haben alle Flüge in die Region abgesagt,https://www.dnn.de/reise/iran-krieg-flugausfaelle-in-dubai-abu-dhabi-doha-die-aktuelle-lage-im-ueberblick-GE4IBMC2WBH3FMDI4RD25EFWCI.html,dnn.de,"Iran-Krieg: Flugausfälle in Dubai, Abu Dhabi, Doha – die aktuelle Lage im Überblick",0.1,LOW,False,,,unknown,2026-03-29T18:46:36.113234
"Laut Aussendung sprachen die Ministerinnen gemeinsam mit der Juristin, Expertin für Gleichberechtigung und CEO von Female Founders, Natascha Fürst, und der Autorin Gertraud Klemm über die Kernforderungen der Initiative",https://www.vol.at/sporrer-und-holzleitner-im-kampf-gegen-digitale-gewalt/10079201,vol.at,Sporrer und Holzleitner kämpfen gegen digitale Gewalt - VOL.AT,0,LOW,False,,,unknown,2026-03-29T18:46:38.341835
"Für Frauenministerin Holzleitner sei digitale Gewalt, wie etwa sexualisierte Deepfakes, keine neuen Randphänomene",https://www.vol.at/sporrer-und-holzleitner-im-kampf-gegen-digitale-gewalt/10079201,vol.at,Sporrer und Holzleitner kämpfen gegen digitale Gewalt - VOL.AT,0.1,LOW,False,,,unknown,2026-03-29T18:46:38.403607
"Vielmehr zeige sich dabei ein strukturelles Problem, das sich durch alle Gesellschaftsschichten ziehe und sowohl Würde als auch Selbstbestimmung &#8220;von Frauen massiv angreift&#8221;",https://www.vol.at/sporrer-und-holzleitner-im-kampf-gegen-digitale-gewalt/10079201,vol.at,Sporrer und Holzleitner kämpfen gegen digitale Gewalt - VOL.AT,0.1,LOW,False,,,unknown,2026-03-29T18:46:38.465937
Dann brauchen Sie laut einer aktuellen ADAC-Auswertung ein großes Budget – oder einen langen Atem,http://www.merkur.de/verbraucher/geheimtipps-fuer-schmales-budget-nur-noch-drei-neuwagen-fuer-familien-unter-20-000-euro-adac-nennt-die-94238270.html,merkur.de,Nur noch drei Neuwagen für Familien unter 20.000 Euro – ADAC nennt „Geheimtipps“,0,LOW,False,,,unknown,2026-03-29T18:46:39.187304
Vor zehn Jahren war die Auswahl noch relativ komfortabel: Im Jahr 2016 boten laut ADAC immerhin 40 Modelle genug Platz für die Familie – und das zum Neupreis unter 20,http://www.merkur.de/verbraucher/geheimtipps-fuer-schmales-budget-nur-noch-drei-neuwagen-fuer-familien-unter-20-000-euro-adac-nennt-die-94238270.html,merkur.de,Nur noch drei Neuwagen für Familien unter 20.000 Euro – ADAC nennt „Geheimtipps“,0.1,LOW,False,,,unknown,2026-03-29T18:46:39.246817
"Der Dacia Jogger gehört laut ADAC zu den letzten drei Familienautos, die als Neuwagen unter 20",http://www.merkur.de/verbraucher/geheimtipps-fuer-schmales-budget-nur-noch-drei-neuwagen-fuer-familien-unter-20-000-euro-adac-nennt-die-94238270.html,merkur.de,Nur noch drei Neuwagen für Familien unter 20.000 Euro – ADAC nennt „Geheimtipps“,0,LOW,False,,,unknown,2026-03-29T18:46:39.312626
"Gefälschter FührerscheinDer Mann war mit dem Kind auf der Autobahn unterwegs, obwohl er keine gültige Fahrerlaubnis besaß",https://www.heute.at/s/schock-kontrolle-bub-4-sitzt-mit-zigarette-am-steuer-120175445,heute.at,Einsatz auf Autobahn – Schock-Kontrolle! Bub (4) sitzt mit Zigarette am Steuer | Heute.at,0.1,LOW,False,,,unknown,2026-03-29T18:46:39.970914
"Laut Polizei versuchte das Kind sogar, die Zigarette mit einem Feuerzeug anzuzünden – die Beamten konnten dies jedoch verhindern",https://www.heute.at/s/schock-kontrolle-bub-4-sitzt-mit-zigarette-am-steuer-120175445,heute.at,Einsatz auf Autobahn – Schock-Kontrolle! Bub (4) sitzt mit Zigarette am Steuer | Heute.at,0,LOW,False,,,unknown,2026-03-29T18:46:40.029943
The Phil Lord and Chris Miller sci-fi adventure dipped only 32% after notching the best non-franchise opening weekend since 2023’s “Oppenheimer,https://www.mykxlg.com/news/national/ap-trending-summarybrief-at-1-40-p-m-edt/article_f7986689-2da6-5b11-a071-422c38b8b5c5.html,mykxlg.com,AP Trending SummaryBrief at 1:40 p.m. EDT | National News | mykxlg.com,0,LOW,False,,,unknown,2026-03-29T18:46:42.685487
"66 – 14% more than the cheapest retailer in the study, Asda, which cost £823",https://www.westerntelegraph.co.uk/news/25977954.tesco-sainsburys-now-expensive-waitrose/,westerntelegraph.co.uk,Tesco and Sainsbury’s now more expensive than Waitrose | Western Telegraph,0,LOW,False,,,unknown,2026-03-29T18:46:54.852670
"Tesco followed behind Sainsbury’s, with its non-Clubcard price totalling 11% more than Asda at £916",https://www.westerntelegraph.co.uk/news/25977954.tesco-sainsburys-now-expensive-waitrose/,westerntelegraph.co.uk,Tesco and Sainsbury’s now more expensive than Waitrose | Western Telegraph,0,LOW,False,,,unknown,2026-03-29T18:46:54.923738
"Waitrose was 9% more expensive than Asda and emerged as a “more competitive option”, Which",https://www.westerntelegraph.co.uk/news/25977954.tesco-sainsburys-now-expensive-waitrose/,westerntelegraph.co.uk,Tesco and Sainsbury’s now more expensive than Waitrose | Western Telegraph,0,LOW,False,,,unknown,2026-03-29T18:46:55.005856
[DEBUNKED] Iran-Krieg: Fake-Satellitenbild stellt Brände von Öl-Anlagen falsch dar,https://correctiv.org/faktencheck/2026/03/27/iran-krieg-fake-satellitenbild-stellt-braende-von-oel-anlagen-in-golfstaaten-falsch-dar/,correctiv.org,Iran-Krieg: Fake-Satellitenbild stellt Brände von Öl-Anlagen falsch dar,0.9,HIGH,True,FALSE - Debunked by fact-checkers,correctiv.org,factcheck,2026-03-29T18:46:58.992298
[DEBUNKED] Wahlbetrug in Baden-Württemberg? Video mit Chrupalla in falschen Kontext gesetzt,https://correctiv.org/faktencheck/2026/03/26/video-in-falschem-kontext-tino-chrupalla-hat-keinen-wahlbetrug-in-baden-wuerttemberg-aufgedeckt/,correctiv.org,Wahlbetrug in Baden-Württemberg? Video mit Chrupalla in falschen Kontext gesetzt,0.9,HIGH,True,FALSE - Debunked by fact-checkers,correctiv.org,factcheck,2026-03-29T18:47:00.843994
[DEBUNKED] Ausraster an Berliner Supermarktkasse ist KI-generiert - correctiv.org,https://correctiv.org/faktencheck/aus-der-community/2026/03/26/ausraster-an-berliner-supermarktkasse-ist-ki-generiert/,correctiv.org,Ausraster an Berliner Supermarktkasse ist KI-generiert - correctiv.org,0.9,HIGH,True,FALSE - Debunked by fact-checkers,correctiv.org,factcheck,2026-03-29T18:47:02.722796
"Laut dem Bundesamt für Verfassungsschutz, das bereits Anfang Februar auf die Attacke hingewiesen hatte, ohne jedoch Russland zu nennen, läuft die Phishing-Kampagne „seit mehreren Monaten und ist aktuell noch aktiv“",https://correctiv.org/hybride-kriegsfuehrung/2026/03/25/nach-correctiv-recherche-zu-phishing-attacke-innenpolitiker-sehen-defizite-im-umgang-mit-hybriden-bedrohungen-russlands/,correctiv.org,Politiker fordern nach Phishing-Angriff Schritte gegen hybride Bedrohung,0,LOW,False,,,factcheck,2026-03-29T18:47:03.695423
"(Symbolfoto: picture alliance/dpa | Ronny Hartmann) Rund 900 Millionen Euro will die Bundeswehr für Container ausgeben, in denen Soldatinnen und Soldatinnen zeitweise schlafen sollen",https://correctiv.org/aktuelles/sicherheit-und-verteidigung/2026/03/26/milliardenteure-uebergangsloesung-tausende-soldaten-sollen-in-containern-schlafen-bundeswehr-verteidigungsministerium/,correctiv.org,Bundeswehr: Tausende Soldaten sollen in Containern schlafen,0,LOW,False,,,factcheck,2026-03-29T18:47:04.562391
Das Containerprogramm mit dem Namen „SIPGO“ ist jedoch in sechs EU-weiten Ausschreibungen zu finden: Sie summieren sich auf das Gesamtvolumen von rund 900 Millionen Euro,https://correctiv.org/aktuelles/sicherheit-und-verteidigung/2026/03/26/milliardenteure-uebergangsloesung-tausende-soldaten-sollen-in-containern-schlafen-bundeswehr-verteidigungsministerium/,correctiv.org,Bundeswehr: Tausende Soldaten sollen in Containern schlafen,0,LOW,False,,,factcheck,2026-03-29T18:47:04.633261
Diese haben einen Umfang von mindestens 400 Millionen Euro,https://correctiv.org/aktuelles/sicherheit-und-verteidigung/2026/03/26/milliardenteure-uebergangsloesung-tausende-soldaten-sollen-in-containern-schlafen-bundeswehr-verteidigungsministerium/,correctiv.org,Bundeswehr: Tausende Soldaten sollen in Containern schlafen,0,LOW,False,,,factcheck,2026-03-29T18:47:04.693048
90 12051 Berlin Fax: +49 (0) 30 – 555 780 2 20 Büro Berlin Singerstraße 109 10179 Berlin Buchladen Essen Akazienallee 10 45127 Essen Online-Shop Jugendredaktion Salon5 Alle Standorte CORRECTIV,https://correctiv.org/in-eigener-sache/2026/03/25/top-investigativjournalist-martin-murphy-verstaerkt-correctiv/,correctiv.org,Top-Investigativjournalist Martin Murphy verstärkt CORRECTIV - correctiv.org,0.1,LOW,False,,,factcheck,2026-03-29T18:47:06.497360
[DEBUNKED] EU-Strafen für US-Techfirmen sind nicht mit Steuern vergleichbar,https://correctiv.org/faktencheck/2026/03/24/warum-eu-strafgelder-fuer-us-techfirmen-nicht-mit-steuern-europaeischer-firmen-vergleichbar-sind/,correctiv.org,EU-Strafen für US-Techfirmen sind nicht mit Steuern vergleichbar,0.9,HIGH,True,FALSE - Debunked by fact-checkers,correctiv.org,factcheck,2026-03-29T18:47:07.427620
"Die Recherche zeigt erstmals in einer unabhängigen Untersuchung, dass die Spuren alle nach Russland weisen",https://correctiv.org/hybride-kriegsfuehrung/2026/03/24/hackerangriff-ueber-signal-neue-spuren-fuehren-nach-russland-cyber-phishing/,correctiv.org,Hackerangriff über Signal: Neue Spuren führen nach Russland - correctiv.org,0.1,LOW,False,,,factcheck,2026-03-29T18:47:08.300947
"Die globale und beispiellose Attacke, die laut FBI inzwischen tausende Accounts kompromittiert hat, könnte mit einem Programm durchgeführt worden sein, das für knapp 700 US-Dollar auf russischen Hackerbörsen gehandelt wurde",https://correctiv.org/hybride-kriegsfuehrung/2026/03/24/hackerangriff-ueber-signal-neue-spuren-fuehren-nach-russland-cyber-phishing/,correctiv.org,Hackerangriff über Signal: Neue Spuren führen nach Russland - correctiv.org,0,LOW,False,,,factcheck,2026-03-29T18:47:08.359866
[DEBUNKED] Warum die Berichte über angebliche Kürzungen bei CORRECTIV falsch sind - correctiv.org,https://correctiv.org/in-eigener-sache/2026/03/24/warum-die-berichte-ueber-angebliche-kuerzungen-bei-correctiv-falsch-sind/,correctiv.org,Warum die Berichte über angebliche Kürzungen bei CORRECTIV falsch sind - correctiv.org,0.9,HIGH,True,FALSE - Debunked by fact-checkers,correctiv.org,factcheck,2026-03-29T18:47:09.134246
[DEBUNKED] Falschbehauptung zu angeblichem Wahlbetrug in Baden-Württemberg,https://correctiv.org/faktencheck/2026/03/23/falsche-behauptungen-zu-angeblichem-wahlbetrug-in-baden-wuerttemberg/,correctiv.org,Falschbehauptung zu angeblichem Wahlbetrug in Baden-Württemberg,0.9,HIGH,True,FALSE - Debunked by fact-checkers,correctiv.org,factcheck,2026-03-29T18:47:10.091520
[DEBUNKED] Strom für drei Milliarden Euro „weggeworfen“? Reiches Äußerung ist irreführend,https://correctiv.org/faktencheck/2026/03/23/katherina-reiche-strom-fuer-drei-milliarden-euro-weggeworfen-ist-irrefuehrend/,correctiv.org,Strom für drei Milliarden Euro „weggeworfen“? Reiches Äußerung ist irreführend,0.9,HIGH,True,FALSE - Debunked by fact-checkers,correctiv.org,factcheck,2026-03-29T18:47:11.040350
[DEBUNKED] Epsteins Verbindungen nach Russland: Der Fall Lana Poschidajewa,https://correctiv.org/aktuelles/russland-ukraine-2/2026/03/21/jeffrey-epstein-und-der-russische-geheimdienst-die-unerzaehlte-geschichte-der-lana-poschidajewa/,correctiv.org,Epsteins Verbindungen nach Russland: Der Fall Lana Poschidajewa,0.9,HIGH,True,FALSE - Debunked by fact-checkers,correctiv.org,factcheck,2026-03-29T18:47:11.842596
[DEBUNKED] Die 15 witzigsten &quot;Heimatstrom&quot;-Memes – und wie sie Rechte entlarven - Volksverpetzer,https://www.volksverpetzer.de/aktuelles/witzigsten-heimatstrom-memes/,www.volksverpetzer.de,Die 15 witzigsten &quot;Heimatstrom&quot;-Memes – und wie sie Rechte entlarven - Volksverpetzer,0.9,HIGH,True,FALSE - Debunked by fact-checkers,www.volksverpetzer.de,factcheck,2026-03-29T18:47:13.610121
"Das trifft viele Brauereien hart, weil sie immer wieder in neue Flaschen investieren müssen",https://www.volksverpetzer.de/aktuelles/afd-bayern-bier-teurer/,www.volksverpetzer.de,Die AfD Bayern will dein Bier teurer machen! - Volksverpetzer,0.1,LOW,False,,,factcheck,2026-03-29T18:47:14.477357
[DEBUNKED] Wie du von Rechten bei Gewalt gegen Frauen belogen wirst - Volksverpetzer,https://www.volksverpetzer.de/analyse/merz-gewalt-gegen-frauen/,www.volksverpetzer.de,Wie du von Rechten bei Gewalt gegen Frauen belogen wirst - Volksverpetzer,0.9,HIGH,True,FALSE - Debunked by fact-checkers,www.volksverpetzer.de,factcheck,2026-03-29T18:47:15.417822
[DEBUNKED] Etliche Rügen: So haben euch WELT &amp; BILD über NGOs belogen - Volksverpetzer,https://www.volksverpetzer.de/analyse/welt-bild-ngo-luege-presserat/,www.volksverpetzer.de,Etliche Rügen: So haben euch WELT &amp; BILD über NGOs belogen - Volksverpetzer,0.9,HIGH,True,FALSE - Debunked by fact-checkers,www.volksverpetzer.de,factcheck,2026-03-29T18:47:16.731278
"Die vielen „Einzelfälle“ der inszenierten ""Angriffe"" auf die AfD Erst vor zwei Wochen stellte sich heraus, dass ein „linksextremer Angriff“, der von der AfD in Rosenheim so angezeigt und den Medien so berichtet worden war, gar nie gab",https://www.volksverpetzer.de/aktuelles/afd-auto-angezuendet-fake/,www.volksverpetzer.de,AfD-Mitglied hat Auto selbst angezündet – Nächster Fake-„Antifa-Anschlag“ aufgeflogen! - Volksverpet,0.1,LOW,False,,,factcheck,2026-03-29T18:47:17.599563
"Wie viele Fälle von „linker Gewalt“ gibt es noch, die nie welche waren",https://www.volksverpetzer.de/aktuelles/afd-auto-angezuendet-fake/,www.volksverpetzer.de,AfD-Mitglied hat Auto selbst angezündet – Nächster Fake-„Antifa-Anschlag“ aufgeflogen! - Volksverpet,0.1,LOW,False,,,factcheck,2026-03-29T18:47:17.658411
"Es gab keine Hinweise auf eine Injektion, keine auf einen Anschlag",https://www.volksverpetzer.de/aktuelles/afd-auto-angezuendet-fake/,www.volksverpetzer.de,AfD-Mitglied hat Auto selbst angezündet – Nächster Fake-„Antifa-Anschlag“ aufgeflogen! - Volksverpet,0.1,LOW,False,,,factcheck,2026-03-29T18:47:17.724622
"Während SPD und CDU um den ersten Platz kämpfen, liegt die rechtsextreme AfD in Umfragen seit Monaten stabil auf Platz drei, aktuell mit 19 Prozent",https://www.volksverpetzer.de/analyse/rheinland-pfalz-rechte-landnahme/,www.volksverpetzer.de,Rheinland-Pfalz: Sie wollten das Dorf übernehmen – dann passierte DAS! - Volksverpetzer,0,LOW,False,,,factcheck,2026-03-29T18:47:18.551599
"Bei der letzten Landtagswahl war sie noch bei 8,3 Prozent gelandet",https://www.volksverpetzer.de/analyse/rheinland-pfalz-rechte-landnahme/,www.volksverpetzer.de,Rheinland-Pfalz: Sie wollten das Dorf übernehmen – dann passierte DAS! - Volksverpetzer,0,LOW,False,,,factcheck,2026-03-29T18:47:18.609916
