claim,source_url,source_domain,article_title,risk_score,risk_category,has_factcheck,factcheck_rating,factcheck_source,source_type,checked_at
"[DEBUNKED] Kamala Harris never said, 'Iran is a country, but we don't live there, so it's not our country' | Snopes.com",https://www.snopes.com/fact-check/kamala-harris-iran-country-quote/,www.snopes.com,"Kamala Harris never said, 'Iran is a country, but we don't live there, so it's not our country' | Sn",0.9,HIGH,True,FALSE - Debunked by fact-checkers,www.snopes.com,factcheck,2026-04-03T13:09:28.035174
[DEBUNKED] Why Trump's birthright citizenship executive order wouldn't impact his children | Snopes.com,https://www.snopes.com/fact-check/trump-children-birthright-citizenship/,www.snopes.com,Why Trump's birthright citizenship executive order wouldn't impact his children | Snopes.com,0.9,HIGH,True,FALSE - Debunked by fact-checkers,www.snopes.com,factcheck,2026-04-03T13:09:28.263158
"[DEBUNKED] Kurt Russell didn't receive Kennedy Center Honor from Trump, despite claims | Snopes.com",https://www.snopes.com/fact-check/kurt-russell-kennedy-center-trump/,www.snopes.com,"Kurt Russell didn't receive Kennedy Center Honor from Trump, despite claims | Snopes.com",0.9,HIGH,True,FALSE - Debunked by fact-checkers,www.snopes.com,factcheck,2026-04-03T13:09:28.494221
[DEBUNKED] 22 rumors involving Pam Bondi we fact-checked before her firing | Snopes.com,https://www.snopes.com/collections/pam-bondi-claims/,www.snopes.com,22 rumors involving Pam Bondi we fact-checked before her firing | Snopes.com,0.9,HIGH,True,FALSE - Debunked by fact-checkers,www.snopes.com,factcheck,2026-04-03T13:09:28.759592
[DEBUNKED] No need to worry: Claim Jonathan the tortoise died is just another death hoax | Snopes.com,https://www.snopes.com/fact-check/jonathan-the-tortoise-death-hoax/,www.snopes.com,No need to worry: Claim Jonathan the tortoise died is just another death hoax | Snopes.com,0.9,HIGH,True,FALSE - Debunked by fact-checkers,www.snopes.com,factcheck,2026-04-03T13:09:29.000356
"[DEBUNKED] Reports claim Kristi Noem's husband, Bryon, cross-dresses. Here's what to know | Snopes.com",https://www.snopes.com/news/2026/04/02/kristi-noem-husband-bryon-cross-dresses/,www.snopes.com,"Reports claim Kristi Noem's husband, Bryon, cross-dresses. Here's what to know | Snopes.com",0.9,HIGH,True,FALSE - Debunked by fact-checkers,www.snopes.com,factcheck,2026-04-03T13:09:29.110199
"[DEBUNKED] DHS denies ICE will be at Marine Corps graduations, contradicting military website's notice | Snopes.com",https://www.snopes.com/news/2026/03/31/ice-marine-corps-graduations/,www.snopes.com,"DHS denies ICE will be at Marine Corps graduations, contradicting military website's notice | Snopes",0.9,HIGH,True,FALSE - Debunked by fact-checkers,www.snopes.com,factcheck,2026-04-03T13:09:29.366803
"[DEBUNKED] PolitiFact | President Trump fires Attorney General Pam Bondi: How she helped his agenda, and shaded the truth",http://www.politifact.com/article/2026/apr/02/Trump-Fired-Pam-Bondi-Attorney-General-Fact-Check/,www.politifact.com,"PolitiFact | President Trump fires Attorney General Pam Bondi: How she helped his agenda, and shaded",0.9,HIGH,True,FALSE - Debunked by fact-checkers,www.politifact.com,factcheck,2026-04-03T13:09:29.952283
"[DEBUNKED] PolitiFact | In uncertain times, fact-checkers are working with special urgency",http://www.politifact.com/article/2026/apr/02/fact-checking-important-today-ifcn/,www.politifact.com,"PolitiFact | In uncertain times, fact-checkers are working with special urgency",0.9,HIGH,True,FALSE - Debunked by fact-checkers,www.politifact.com,factcheck,2026-04-03T13:09:30.310058
9% of prime-age workers were working or looking for work; the all-time high was 84,http://www.politifact.com/factchecks/2026/mar/31/donald-trump/more-americans-working-today-employment/,www.politifact.com,PolitiFact | Trump says more Americans are working today than ever. That masks weak job growth.,0,LOW,False,,,factcheck,2026-04-03T13:09:31.210704
"The Center for Immigration Studies, a think tank that favors low immigration levels, estimates 70,000 births to temporary visitors in 2023, which is less than 2% of the 3",http://www.politifact.com/article/2026/mar/31/birthright-citizenship-tourism-Trump-Supreme-Court/,www.politifact.com,"PolitiFact | Fact-check: Trump misleads about birthright citizenship, birth tourism before SCOTUS he",0,LOW,False,,,factcheck,2026-04-03T13:09:31.661710
"[DEBUNKED] PolitiFact | ICE agents are at some airports, but this video of a man being detained is a skit",http://www.politifact.com/factchecks/2026/mar/30/facebook-posts/Video-ICE-US-citizen-plane-skit-airport/,www.politifact.com,"PolitiFact | ICE agents are at some airports, but this video of a man being detained is a skit",0.9,HIGH,True,FALSE - Debunked by fact-checkers,www.politifact.com,factcheck,2026-04-03T13:09:31.773943
"[DEBUNKED] PolitiFact | No, Trump didn’t post on Truth Social asking DeSantis to pardon Tiger Woods",http://www.politifact.com/factchecks/2026/mar/30/social-media/donald-trump-fake-post-tiger-woods-pardon/,www.politifact.com,"PolitiFact | No, Trump didn’t post on Truth Social asking DeSantis to pardon Tiger Woods",0.9,HIGH,True,FALSE - Debunked by fact-checkers,www.politifact.com,factcheck,2026-04-03T13:09:31.885827
"A 2019 study out of Canada described research on traumatic stress after surgery as ""in its infancy,"" but said postoperative traumatic stress including PTSD occurs in about 20% of patients",http://www.politifact.com/article/2026/mar/30/Gary-Woodland-PTSD-surgery-medical-trauma-risk/,www.politifact.com,PolitiFact | Golfer Gary Woodland’s PGA win spotlights PTSD caused by surgery and medical trauma,0,LOW,False,,,factcheck,2026-04-03T13:09:32.212672
[DEBUNKED] False rumour spreads on social media about Plymouth hotel housing asylum seekers – Full Fact,https://fullfact.org/immigration/plymouth-hotel-migrant-asylum-seekers-refurb-false/,fullfact.org,False rumour spreads on social media about Plymouth hotel housing asylum seekers – Full Fact,0.9,HIGH,True,FALSE - Debunked by fact-checkers,fullfact.org,factcheck,2026-04-03T13:09:33.969374
[DEBUNKED] Post promoting Cadbury Dairy Milk box deal is fake – Full Fact,https://fullfact.org/shopping/cadbury-dairy-milk-box-fake/,fullfact.org,Post promoting Cadbury Dairy Milk box deal is fake – Full Fact,0.9,HIGH,True,FALSE - Debunked by fact-checkers,fullfact.org,factcheck,2026-04-03T13:09:35.584368
"[DEBUNKED] No, Keir Starmer didn’t threaten to embarrass Rupert Lowe on national TV – Full Fact",https://fullfact.org/politics/keir-starmer-rupert-lowe-embarass-tv-false-claim/,fullfact.org,"No, Keir Starmer didn’t threaten to embarrass Rupert Lowe on national TV – Full Fact",0.9,HIGH,True,FALSE - Debunked by fact-checkers,fullfact.org,factcheck,2026-04-03T13:09:36.079212
[DEBUNKED] ‘I’m just kicking myself’: How a fake garden seeds offer on Facebook almost cost a Full Fact reader over £500 – Full Fact,https://fullfact.org/shopping/fake-garden-seeds-offer-facebook-case-study/,fullfact.org,‘I’m just kicking myself’: How a fake garden seeds offer on Facebook almost cost a Full Fact reader ,0.9,HIGH,True,FALSE - Debunked by fact-checkers,fullfact.org,factcheck,2026-04-03T13:09:37.148078
[DEBUNKED] Video of 2025 cinema brawl shared with false claims it shows clashes at Tel Aviv airport – Full Fact,https://fullfact.org/conflict/telv-aviv-ben-gurion-aiport-clash-video-false/,fullfact.org,Video of 2025 cinema brawl shared with false claims it shows clashes at Tel Aviv airport – Full Fact,0.9,HIGH,True,FALSE - Debunked by fact-checkers,fullfact.org,factcheck,2026-04-03T13:09:37.714651
[DEBUNKED] Fact Check: Gavin Newsom Did NOT Have A $100 Million Lawsuit Against ANYBODY Completely Collapse After Whistleblower Testimony -- AI Spam From Vietnam | Lead Stories,https://leadstories.com/hoax-alert/2026/04/fact-check-Gavin-newsom-did-not-have-100-million-lawsuit-completely-collapse.html,leadstories.com,Fact Check: Gavin Newsom Did NOT Have A $100 Million Lawsuit Against ANYBODY Completely Collapse Aft,0.9,HIGH,True,FALSE - Debunked by fact-checkers,leadstories.com,factcheck,2026-04-03T13:09:37.896919
"[DEBUNKED] Fact Check: TIME Magazine Did NOT Publish 'Hey Donald, From NATO' Cover With World Leaders Showing Middle Fingers To Trump | Lead Stories",https://leadstories.com/hoax-alert/2026/04/fact-check-time-magazine-did-not-publish-hey-donald-from-nato-cover.html,leadstories.com,"Fact Check: TIME Magazine Did NOT Publish 'Hey Donald, From NATO' Cover With World Leaders Showing M",0.9,HIGH,True,FALSE - Debunked by fact-checkers,leadstories.com,factcheck,2026-04-03T13:09:38.078277
"[DEBUNKED] Fact Check: Leak of Anthropic's ""Claude Code"" Source Code Was NOT An April Fools' Prank | Lead Stories",https://leadstories.com/hoax-alert/2026/04/fact-check-leak-of-anthropics-claude-code-source-code-was-not-an-april-fools-prank.html,leadstories.com,"Fact Check: Leak of Anthropic's ""Claude Code"" Source Code Was NOT An April Fools' Prank | Lead Stori",0.9,HIGH,True,FALSE - Debunked by fact-checkers,leadstories.com,factcheck,2026-04-03T13:09:38.314205
[DEBUNKED] Fact Check: AI Photo Shows Bald Eagle Landing On Artemis II At Launch Pad Just Before Liftoff -- NOT Real | Lead Stories,https://leadstories.com/hoax-alert/2026/04/fact-check-photo-does-not-show-a-bald-eagle-landing-on-artemis-ii-at-launch-pad-just-before-liftoff.html,leadstories.com,Fact Check: AI Photo Shows Bald Eagle Landing On Artemis II At Launch Pad Just Before Liftoff -- NOT,0.9,HIGH,True,FALSE - Debunked by fact-checkers,leadstories.com,factcheck,2026-04-03T13:09:38.493330
[DEBUNKED] Fact Checking Day 2026: Fact Checking Matters More Than Ever In The U.S. | Lead Stories,https://leadstories.com/analysis/2026/04/fact-checking-day-2026-fact-checking-matters-more-than-ever.html,leadstories.com,Fact Checking Day 2026: Fact Checking Matters More Than Ever In The U.S. | Lead Stories,0.9,HIGH,True,FALSE - Debunked by fact-checkers,leadstories.com,factcheck,2026-04-03T13:09:38.663831
[DEBUNKED] Fact Check: Court Filing Does NOT Say The Bullet That Killed Charlie Kirk Doesn't Match The Rifle Allegedly Used By Tyler Robinson | Lead Stories,https://leadstories.com/hoax-alert/2026/04/fact-check-court-filing-does-not-say-the-bullet-that-killed-charlie-kirk-is-a-mismatch-to-the-rifle-allegedly-used-by-tyler-robinson.html,leadstories.com,Fact Check: Court Filing Does NOT Say The Bullet That Killed Charlie Kirk Doesn't Match The Rifle Al,0.9,HIGH,True,FALSE - Debunked by fact-checkers,leadstories.com,factcheck,2026-04-03T13:09:38.832664
[DEBUNKED] Fact Check: FAKE AI Video Does NOT Show Real Two-Year-Old Running To Soldier Dad | Lead Stories,https://leadstories.com/hoax-alert/2026/04/fact-check-video-of-two-year-old-soldier-dad-is-not-authentic.html,leadstories.com,Fact Check: FAKE AI Video Does NOT Show Real Two-Year-Old Running To Soldier Dad | Lead Stories,0.9,HIGH,True,FALSE - Debunked by fact-checkers,leadstories.com,factcheck,2026-04-03T13:09:39.014995
"[DEBUNKED] Fact Check: Fake ""Mean Gene"" Okerlund Interview With ""Real"" Guys Who Look Just Like Beavis And Butt-Head Is AI-Generated | Lead Stories",https://leadstories.com/hoax-alert/2026/04/fact-check-fake-mean-gene-okerlund-interview-with-real-guys-who-look-just-like-beavis-and-butt-head-is-ai-generated.html,leadstories.com,"Fact Check: Fake ""Mean Gene"" Okerlund Interview With ""Real"" Guys Who Look Just Like Beavis And Butt-",0.9,HIGH,True,FALSE - Debunked by fact-checkers,leadstories.com,factcheck,2026-04-03T13:09:39.219087
[DEBUNKED] Fact Check: FAKE Byron Noem Cross-Dressing Photo With Dog In Background And Daily Mail Logo NOT Published By Paper | Lead Stories,https://leadstories.com/hoax-alert/2026/04/fact-check-fake-byron-noem-cross-dressing-photo-in-daily-mail-shows-dog-in-background.html,leadstories.com,Fact Check: FAKE Byron Noem Cross-Dressing Photo With Dog In Background And Daily Mail Logo NOT Publ,0.9,HIGH,True,FALSE - Debunked by fact-checkers,leadstories.com,factcheck,2026-04-03T13:09:39.408125
[DEBUNKED] Fact Check: FAKE Photo Shows Trump's Face Being Carved Onto Mount Rushmore | Lead Stories,https://leadstories.com/hoax-alert/2026/04/fact-check-fake-photo-shows-trumps-face-being-carved-onto-mount-rushmore.html,leadstories.com,Fact Check: FAKE Photo Shows Trump's Face Being Carved Onto Mount Rushmore | Lead Stories,0.9,HIGH,True,FALSE - Debunked by fact-checkers,leadstories.com,factcheck,2026-04-03T13:09:39.592880
[DEBUNKED] Fact Check: Oprah Did NOT Try To Buy Sen. John Fetterman's Vote For $20 Million On 'Big Beautiful Bill' | Lead Stories,https://leadstories.com/hoax-alert/2026/04/fact-check-oprah-did-not-try-to-buy-sen-john-fettermans-vote-for-20-million-on-big-beautiful-bill.html,leadstories.com,Fact Check: Oprah Did NOT Try To Buy Sen. John Fetterman's Vote For $20 Million On 'Big Beautiful Bi,0.9,HIGH,True,FALSE - Debunked by fact-checkers,leadstories.com,factcheck,2026-04-03T13:09:39.782549
[DEBUNKED] Fact Check: Tearful Goodbye Of Husband Deploying To Iran Is AI-Generated Engagement Bait  | Lead Stories,https://leadstories.com/hoax-alert/2026/04/fact-check-tearful-goodbye-of-husband-deploying-to-iran-is-ai-generated-from-pakistan-based-account.html,leadstories.com,Fact Check: Tearful Goodbye Of Husband Deploying To Iran Is AI-Generated Engagement Bait  | Lead Sto,0.9,HIGH,True,FALSE - Debunked by fact-checkers,leadstories.com,factcheck,2026-04-03T13:09:39.966584
[DEBUNKED] Running List Of 2026 April Fool's Day Jokes | Lead Stories,https://leadstories.com/analysis/2026/04/april-fools-2026-running-list.html,leadstories.com,Running List Of 2026 April Fool's Day Jokes | Lead Stories,0.9,HIGH,True,FALSE - Debunked by fact-checkers,leadstories.com,factcheck,2026-04-03T13:09:40.138252
[DEBUNKED] Fact Check: REAL Video Shows LGBTQ+ Flag During Florida Panthers Game At Amerant Bank Arena | Lead Stories,https://leadstories.com/hoax-alert/2026/04/fact-check-real-video-shows-lgbtq-plus-flag-during-florida-panthers-game.html,leadstories.com,Fact Check: REAL Video Shows LGBTQ+ Flag During Florida Panthers Game At Amerant Bank Arena | Lead S,0.9,HIGH,True,FALSE - Debunked by fact-checkers,leadstories.com,factcheck,2026-04-03T13:09:40.323952
"[DEBUNKED] Fact Check: NO EVIDENCE Video Actually Shows Underage Muslim Man's Wife In Plano, Texas | Lead Stories",https://leadstories.com/hoax-alert/2026/03/fact-check-no-evidence-video-actually-shows-underage-muslim-mans-wife-in-plano-texas.html,leadstories.com,"Fact Check: NO EVIDENCE Video Actually Shows Underage Muslim Man's Wife In Plano, Texas | Lead Stori",0.9,HIGH,True,FALSE - Debunked by fact-checkers,leadstories.com,factcheck,2026-04-03T13:09:40.517852
[DEBUNKED] Three ways AI is making reliable information harder to find - Poynter,https://www.poynter.org/ifcn/2026/three-ways-ai-is-making-reliable-information-harder-to-find/,www.poynter.org,Three ways AI is making reliable information harder to find - Poynter,0.9,HIGH,True,FALSE - Debunked by fact-checkers,www.poynter.org,factcheck,2026-04-03T13:09:40.848108
"The National Association of Broadcasters has expressed the same sentiment, urging the FCC to change ownership rules that bar a single company from reaching more than 39% of all U",https://www.poynter.org/business-work/2026/wrtv-staff-layoff-indianapolis-broadcast-consolidation/,www.poynter.org,A local TV newsroom disappeared overnight. It’s a warning sign for what’s next. - Poynter,0,LOW,False,,,factcheck,2026-04-03T13:09:41.409203
"The combined company would reach 80% of households nationwide, about 265 television stations",https://www.poynter.org/business-work/2026/wrtv-staff-layoff-indianapolis-broadcast-consolidation/,www.poynter.org,A local TV newsroom disappeared overnight. It’s a warning sign for what’s next. - Poynter,0,LOW,False,,,factcheck,2026-04-03T13:09:41.619172
"” He claimed, with no evidence to back it up, that the Strait of Hormuz, where 20% of the global oil supply goes through, would “open up naturally",https://www.poynter.org/commentary/2026/what-did-trump-say-in-his-iran-speech/,www.poynter.org,Trump broke into prime time with a speech that broke little news - Poynter,0,LOW,False,,,factcheck,2026-04-03T13:09:42.011762
[DEBUNKED] Fact-checking has to go where misinformation actually spreads - Poynter,https://www.poynter.org/fact-checking/2026/fact-checking-has-to-go-where-misinformation-actually-spreads/,www.poynter.org,Fact-checking has to go where misinformation actually spreads - Poynter,0.9,HIGH,True,FALSE - Debunked by fact-checkers,www.poynter.org,factcheck,2026-04-03T13:09:42.147903
"[DEBUNKED] In the absence of truth, misinformation becomes harmful: Nepal’s experience shows why fact-checking matters in crises - Poynter",https://www.poynter.org/ifcn/2026/in-the-absence-of-truth-misinformation-becomes-harmful-nepals-experience-shows-why-fact-checking-matters-in-crises/,www.poynter.org,"In the absence of truth, misinformation becomes harmful: Nepal’s experience shows why fact-checking ",0.9,HIGH,True,FALSE - Debunked by fact-checkers,www.poynter.org,factcheck,2026-04-03T13:09:42.316212
"(For instance, Black defendants are 22% more likely to have their misdemeanor drug arrests result in charges",https://www.poynter.org/ethics-trust/2026/prosecutors-crime-coverage-misleading-public-data/,www.poynter.org,"Like journalists, prosecutors shaped a distorted view of crime. They can help fix it, too. - Poynter",0,LOW,False,,,factcheck,2026-04-03T13:09:42.849760
Nach Angaben von Experten der Schifffahrtszeitschrift »Lloyd’s List« bezahlten mindestens zwei Schiffe dafür Gebühren,https://www.spiegel.de/wirtschaft/iran-frachter-eines-franzoesischen-eigners-durchquert-strasse-von-hormus-a-00b35873-d254-4393-9897-77018e003ad4#ref=rss,www.spiegel.de,Iran: Frachter eines französischen Eigners durchquert Straße von Hormus - DER SPIEGEL,0,LOW,False,,,mainstream,2026-04-03T13:09:59.457166
"Zum Login SPIEGEL plus Nur für Neukunden € 1,– für 4 Wochen danach € 5,99 pro Woche Freier Zugriff auf alle S+-Artikel auf SPIEGEL",https://www.spiegel.de/kultur/musik/arlo-parks-thundercat-philine-sonny-sunn-o-abgehoert-album-der-woche-a-1ccd515b-ae08-44c0-86da-6632a57c314c#ref=rss,www.spiegel.de,"Arlo Parks, Thundercat, Philine Sonny, Sunn O))): Abgehört - Album der Woche - DER SPIEGEL",0.1,LOW,False,,,mainstream,2026-04-03T13:10:00.586754
"E-Paper (PDF), Digital-Archiv und S+-Newsletter Jederzeit kündigen Jetzt abonnieren SPIEGEL plus 52 Wochen 25 % sparen € 4,49 pro Woche für 52 Wochen danach € 5,99 pro Woche Freier Zugriff auf alle S+-Artikel auf SPIEGEL",https://www.spiegel.de/kultur/musik/arlo-parks-thundercat-philine-sonny-sunn-o-abgehoert-album-der-woche-a-1ccd515b-ae08-44c0-86da-6632a57c314c#ref=rss,www.spiegel.de,"Arlo Parks, Thundercat, Philine Sonny, Sunn O))): Abgehört - Album der Woche - DER SPIEGEL",0.1,LOW,False,,,mainstream,2026-04-03T13:10:00.813615
"Zum Login SPIEGEL plus Nur für Neukunden € 1,– für 4 Wochen danach € 5,99 pro Woche Freier Zugriff auf alle S+-Artikel auf SPIEGEL",https://www.spiegel.de/ausland/israel-gaza-krieg-waehrend-die-welt-auf-iran-schaut-schafft-israel-in-gaza-fakten-a-004fed64-bf81-4d3e-b326-0730b0e08991#ref=rss,www.spiegel.de,"Israel-Gaza-Krieg: Während die Welt auf Iran schaut, schafft Israel in Gaza Fakten - DER SPIEGEL",0.1,LOW,False,,,mainstream,2026-04-03T13:10:02.833470
"E-Paper (PDF), Digital-Archiv und S+-Newsletter Jederzeit kündigen Jetzt abonnieren SPIEGEL plus 52 Wochen 25 % sparen € 4,49 pro Woche für 52 Wochen danach € 5,99 pro Woche Freier Zugriff auf alle S+-Artikel auf SPIEGEL",https://www.spiegel.de/ausland/israel-gaza-krieg-waehrend-die-welt-auf-iran-schaut-schafft-israel-in-gaza-fakten-a-004fed64-bf81-4d3e-b326-0730b0e08991#ref=rss,www.spiegel.de,"Israel-Gaza-Krieg: Während die Welt auf Iran schaut, schafft Israel in Gaza Fakten - DER SPIEGEL",0.1,LOW,False,,,mainstream,2026-04-03T13:10:03.044777
"»Die Ermittler haben ihre Identität bestätigt und ihr Status als vermisste Person wurde offiziell aufgehoben«, heißt es da",https://www.spiegel.de/panorama/arizona-vermisste-taucht-nach-32-jahren-wieder-auf-a-6c46f0db-90f8-4d3b-820b-667860b82f6f#ref=rss,www.spiegel.de,Arizona: Vermisste taucht nach 32 Jahren wieder auf - DER SPIEGEL,0,LOW,False,,,mainstream,2026-04-03T13:10:04.914672
"Trotz umfangreicher Ermittlungen, Befragungen und Suchmaßnahmen durch Behörden und Freiwillige fanden die Ermittler damals keine verwertbaren Hinweise auf den Verbleib der Jugendlichen, so das Sheriff-Büro",https://www.spiegel.de/panorama/arizona-vermisste-taucht-nach-32-jahren-wieder-auf-a-6c46f0db-90f8-4d3b-820b-667860b82f6f#ref=rss,www.spiegel.de,Arizona: Vermisste taucht nach 32 Jahren wieder auf - DER SPIEGEL,0.1,LOW,False,,,mainstream,2026-04-03T13:10:05.013962
"Zum Login SPIEGEL plus Nur für Neukunden € 1,– für 4 Wochen danach € 5,99 pro Woche Freier Zugriff auf alle S+-Artikel auf SPIEGEL",https://www.spiegel.de/panorama/waschbaer-plage-in-berlin-der-augenzeuge-nichts-hilft-gegen-die-viecher-a-b1621fcc-6158-4206-8be5-3587be6bc074#ref=rss,www.spiegel.de,Waschbär-Plage in Berlin: »Nichts hilft gegen die Viecher« - DER SPIEGEL,0.1,LOW,False,,,mainstream,2026-04-03T13:10:06.103174
"E-Paper (PDF), Digital-Archiv und S+-Newsletter Jederzeit kündigen Jetzt abonnieren SPIEGEL plus 52 Wochen 25 % sparen € 4,49 pro Woche für 52 Wochen danach € 5,99 pro Woche Freier Zugriff auf alle S+-Artikel auf SPIEGEL",https://www.spiegel.de/panorama/waschbaer-plage-in-berlin-der-augenzeuge-nichts-hilft-gegen-die-viecher-a-b1621fcc-6158-4206-8be5-3587be6bc074#ref=rss,www.spiegel.de,Waschbär-Plage in Berlin: »Nichts hilft gegen die Viecher« - DER SPIEGEL,0.1,LOW,False,,,mainstream,2026-04-03T13:10:06.313862
« Mehr zum Thema 2800 Euro Strafe: Kranke Katze nicht behandelt – Frau wegen Tierquälerei verurteilt Überraschende Post in Nersingen: Miauen aus Paket löst,https://www.spiegel.de/panorama/justiz/oesterreich-mann-verurteilt-weil-er-katze-per-post-nach-deutschland-schicken-wollte-a-1b7d5a7f-e06b-498b-83bb-6107610be7f3#ref=rss,www.spiegel.de,"Österreich: Mann verurteilt, weil er Katze per Post nach Deutschland schicken wollte - DER SPIEGEL",0,LOW,False,,,mainstream,2026-04-03T13:10:07.444695
"Keine einfache Sache, wie sich derzeit in vielen Supermärkten zeigt",https://www.spiegel.de/wirtschaft/service/ostern-gibt-es-genuegend-eier-fuers-fest-engpass-befuerchtet-a-beee4c07-e35a-44fd-86f0-518086ed3a96#ref=rss,www.spiegel.de,Ostern: Gibt es genügend Eier fürs Fest? - Engpass befürchtet - DER SPIEGEL,0.1,LOW,False,,,mainstream,2026-04-03T13:10:08.904123
Fast alle Oppositionsparteien fordern den Rücktritt der Regierung unter Mitsotakis und vorgezogene Neuwahlen,https://www.spiegel.de/ausland/griechenland-korruptionsfall-um-veruntreute-eu-gelder-a-df5cc6d7-2cd2-49de-96fe-b9117346882a#ref=rss,www.spiegel.de,Griechenland: Korruptionsfall um veruntreute EU-Gelder - DER SPIEGEL,0.1,LOW,False,,,mainstream,2026-04-03T13:10:10.390934
Alle im Fokus stehenden Parlamentarier und Funktionäre gehören der konservativen Regierungspartei Nea Dimokratia (ND) von Ministerpräsident Kyriakos Mitsotakis an,https://www.spiegel.de/ausland/griechenland-korruptionsfall-um-veruntreute-eu-gelder-a-df5cc6d7-2cd2-49de-96fe-b9117346882a#ref=rss,www.spiegel.de,Griechenland: Korruptionsfall um veruntreute EU-Gelder - DER SPIEGEL,0.1,LOW,False,,,mainstream,2026-04-03T13:10:10.488097
"Zum Login SPIEGEL plus Nur für Neukunden € 1,– für 4 Wochen danach € 5,99 pro Woche Freier Zugriff auf alle S+-Artikel auf SPIEGEL",https://www.spiegel.de/panorama/laatzen-das-pflegeheim-sollte-ihre-letzte-bleibe-sein-dann-warf-man-sie-ohne-vorwarnung-raus-a-370f7f39-594f-4355-97fd-6b70a712a590#ref=rss,www.spiegel.de,Laatzen: Das Pflegeheim sollte ihre letzte Bleibe sein. Dann warf man sie ohne Vorwarnung raus - DER,0.1,LOW,False,,,mainstream,2026-04-03T13:10:11.626316
"E-Paper (PDF), Digital-Archiv und S+-Newsletter Jederzeit kündigen Jetzt abonnieren SPIEGEL plus 52 Wochen 25 % sparen € 4,49 pro Woche für 52 Wochen danach € 5,99 pro Woche Freier Zugriff auf alle S+-Artikel auf SPIEGEL",https://www.spiegel.de/panorama/laatzen-das-pflegeheim-sollte-ihre-letzte-bleibe-sein-dann-warf-man-sie-ohne-vorwarnung-raus-a-370f7f39-594f-4355-97fd-6b70a712a590#ref=rss,www.spiegel.de,Laatzen: Das Pflegeheim sollte ihre letzte Bleibe sein. Dann warf man sie ohne Vorwarnung raus - DER,0.1,LOW,False,,,mainstream,2026-04-03T13:10:11.836720
Laut Pressemitteilung der Polizei&nbsp; soll der Mann am Donnerstagabend im ICE von Aachen nach Frankfurt zwei pyrotechnische Gegenstände gezündet haben,https://www.spiegel.de/panorama/justiz/siegburg-staatsschutz-ermittelt-nach-anschlagsdrohung-in-ice-a-b475debf-965f-446f-8fa9-94c721145434#ref=rss,www.spiegel.de,Siegburg: Staatsschutz ermittelt nach Anschlagsdrohung in ICE - DER SPIEGEL,0,LOW,False,,,mainstream,2026-04-03T13:10:14.654376
"Eine Person erlitt laut Polizei ein Knalltrauma und kam kurzzeitig zur Behandlung ins Krankenhaus, konnte dies aber schnell wieder verlassen",https://www.spiegel.de/panorama/justiz/siegburg-staatsschutz-ermittelt-nach-anschlagsdrohung-in-ice-a-b475debf-965f-446f-8fa9-94c721145434#ref=rss,www.spiegel.de,Siegburg: Staatsschutz ermittelt nach Anschlagsdrohung in ICE - DER SPIEGEL,0,LOW,False,,,mainstream,2026-04-03T13:10:14.887657
Das Quiz besteht immer aus sieben Fragen,https://www.spiegel.de/games/taegliches-quiz-beim-spiegel-7-fragen-zum-allgemeinwissen-pro-tag-a-8a9692b2-4462-4192-942c-fd7809c7519c#ref=rss,www.spiegel.de,Quiz des Tages beim SPIEGEL: 7 Fragen zum Allgemeinwissen pro Tag - DER SPIEGEL,0.1,LOW,False,,,mainstream,2026-04-03T13:10:16.358293
