claim,source_url,source_domain,article_title,risk_score,risk_category,has_factcheck,factcheck_rating,factcheck_source,source_type,checked_at
"In 2022, the previous Conservative government set a target for UK-wide gigabit-capable broadband by 2030, where ‘nationwide’ means 99% of all UK domestic and business premises have access",https://fullfact.org/government-tracker/is-the-national-roll-out-of-gigabit-broadband-on-track/,fullfact.org,Is the national roll-out of gigabit broadband on track? – Full Fact,0,LOW,False,,,factcheck,2026-07-21T08:32:42.258855
"In 2020, it had previously set a separate target for 85% coverage by 2025, which data published by Think Broadband shows was achieved",https://fullfact.org/government-tracker/is-the-national-roll-out-of-gigabit-broadband-on-track/,fullfact.org,Is the national roll-out of gigabit broadband on track? – Full Fact,0,LOW,False,,,factcheck,2026-07-21T08:32:42.314623
[DEBUNKED] Vaccines funded by Bill Gates did not cause autism to increase in Vietnam – Full Fact,https://fullfact.org/health/autism-vietnam-vaccine-bill-gates/,fullfact.org,Vaccines funded by Bill Gates did not cause autism to increase in Vietnam – Full Fact,0.9,HIGH,True,FALSE - Debunked by fact-checkers,fullfact.org,factcheck,2026-07-21T08:32:42.992574
[DEBUNKED] Harry Kane didn’t refuse to wear a rainbow symbol in matches – Full Fact,https://fullfact.org/sport/harry-kane-lgbt-refused-to-wear-symbol-fake-quote/,fullfact.org,Harry Kane didn’t refuse to wear a rainbow symbol in matches – Full Fact,0.9,HIGH,True,FALSE - Debunked by fact-checkers,fullfact.org,factcheck,2026-07-21T08:32:43.623847
[DEBUNKED] HAARP can’t cause heatwaves – Full Fact,https://fullfact.org/environment/haarp-heatwave-false-claims/,fullfact.org,HAARP can’t cause heatwaves – Full Fact,0.9,HIGH,True,FALSE - Debunked by fact-checkers,fullfact.org,factcheck,2026-07-21T08:32:44.240452
"“Male sperm counts, I think, in this country are down 50% for teenage males,” he said on a May 28 episode of his recently launched podcast, after introducing concerns about a &#8220;stunning&#8221; drop in the rate of childbirths",https://www.factcheck.org/2026/07/rfk-jr-s-flawed-claims-about-sperm-count-and-fertility/,www.factcheck.org,RFK Jr.’s Flawed Claims About Sperm Count and Fertility - FactCheck.org,0,LOW,False,,,factcheck,2026-07-21T08:32:44.929897
There are some studies that have found about a 50% drop in sperm counts in men over the past half century or so,https://www.factcheck.org/2026/07/rfk-jr-s-flawed-claims-about-sperm-count-and-fertility/,www.factcheck.org,RFK Jr.’s Flawed Claims About Sperm Count and Fertility - FactCheck.org,0,LOW,False,,,factcheck,2026-07-21T08:32:44.990086
"[DEBUNKED] No Clear Evidence Religion Is &#039;Bigger and Stronger&#039; in U.S., Despite Trump Claim - FactCheck.org",https://www.factcheck.org/2026/07/no-clear-evidence-religion-is-bigger-and-stronger-in-u-s-despite-trump-claim/,www.factcheck.org,"No Clear Evidence Religion Is &#039;Bigger and Stronger&#039; in U.S., Despite Trump Claim - FactChe",0.9,HIGH,True,FALSE - Debunked by fact-checkers,www.factcheck.org,factcheck,2026-07-21T08:32:45.101204
[DEBUNKED] FactCheck.org Wins Sigma Delta Chi Award for Fact-Checking - FactCheck.org,https://www.factcheck.org/2026/07/factcheck-org-wins-sigma-delta-chi-award-for-fact-checking/,www.factcheck.org,FactCheck.org Wins Sigma Delta Chi Award for Fact-Checking - FactCheck.org,0.9,HIGH,True,FALSE - Debunked by fact-checkers,www.factcheck.org,factcheck,2026-07-21T08:32:46.264635
[DEBUNKED] Alaska Senate Race Ads Mislead on Peltola&#039;s Votes on Military Pay Raise - FactCheck.org,https://www.factcheck.org/2026/07/alaska-senate-race-ads-mislead-on-peltolas-votes-on-military-pay-raise/,www.factcheck.org,Alaska Senate Race Ads Mislead on Peltola&#039;s Votes on Military Pay Raise - FactCheck.org,0.9,HIGH,True,FALSE - Debunked by fact-checkers,www.factcheck.org,factcheck,2026-07-21T08:32:47.090793
[DEBUNKED] Democratic Group Makes False Claim in Insider-Trading Ad Attacking Susan Collins - FactCheck.org,https://www.factcheck.org/2026/07/democratic-group-makes-false-claim-in-insider-trading-ad-attacking-susan-collins/,www.factcheck.org,Democratic Group Makes False Claim in Insider-Trading Ad Attacking Susan Collins - FactCheck.org,0.9,HIGH,True,FALSE - Debunked by fact-checkers,www.factcheck.org,factcheck,2026-07-21T08:32:48.418388
[DEBUNKED] Fact Check: Lamine Yamal Did NOT Show V Sign To Avoid Shaking Hands With Trump  | Lead Stories,https://leadstories.com/hoax-alert/2026/07/fact-check-lamine-yamal-did-not-show-v-sign-to-avoid-shaking-hands-with-trump.html,leadstories.com,Fact Check: Lamine Yamal Did NOT Show V Sign To Avoid Shaking Hands With Trump  | Lead Stories,0.9,HIGH,True,FALSE - Debunked by fact-checkers,leadstories.com,factcheck,2026-07-21T08:32:49.309830
[DEBUNKED] Fact Check: Trump Did NOT Say He Would 'Turn The Giant Faucet' Toward Canada On Truth Social | Lead Stories,https://leadstories.com/hoax-alert/2026/07/fact-check-trump-did-not-say-he-would-turn-the-giant-faucet-toward-canada-on-truth-social.html,leadstories.com,Fact Check: Trump Did NOT Say He Would 'Turn The Giant Faucet' Toward Canada On Truth Social | Lead ,0.9,HIGH,True,FALSE - Debunked by fact-checkers,leadstories.com,factcheck,2026-07-21T08:32:49.484463
[DEBUNKED] Fact Check: Trump NOT Edited Out of Spanish Team Photo From World Cup Trophy Presentation | Lead Stories,https://leadstories.com/hoax-alert/2026/07/fact-check-trump-not-edited-out-of-spanish-team-photo-from-world-cup-trophy-presentation.html,leadstories.com,Fact Check: Trump NOT Edited Out of Spanish Team Photo From World Cup Trophy Presentation | Lead Sto,0.9,HIGH,True,FALSE - Debunked by fact-checkers,leadstories.com,factcheck,2026-07-21T08:32:49.651415
[DEBUNKED] Fact Check: Video Of Crying Referee PREDATES 2026 FIFA World Cup Final Match Between Spain And Argentina | Lead Stories,https://leadstories.com/hoax-alert/2026/07/video-of-crying-referee-predates-2026-fifa-world-cup.html,leadstories.com,Fact Check: Video Of Crying Referee PREDATES 2026 FIFA World Cup Final Match Between Spain And Argen,0.9,HIGH,True,FALSE - Debunked by fact-checkers,leadstories.com,factcheck,2026-07-21T08:32:49.843924
[DEBUNKED] Fact Check: NO EVIDENCE Mitch McConnell's Staff Posted Hospital Photo Containing Possible AI Glitches | Lead Stories,https://leadstories.com/hoax-alert/2026/07/fact-check-no-evidence-mitch-mcconnells-staff-posted-hospital-photo-containing-possible-ai-glitches.html,leadstories.com,Fact Check: NO EVIDENCE Mitch McConnell's Staff Posted Hospital Photo Containing Possible AI Glitche,0.9,HIGH,True,FALSE - Debunked by fact-checkers,leadstories.com,factcheck,2026-07-21T08:32:50.014319
[DEBUNKED] Fact Check: FAKE Video Of IED Attack On M1A Abrams Tanks Driving Over Bridge In Southern Lebanon -- AI-Generated | Lead Stories,https://leadstories.com/hoax-alert/2026/07/fact-check-fake-video-of-ied-attack-on-m1a-abrams-tanks-driving-over-bridge-in-south-lebanon.html,leadstories.com,Fact Check: FAKE Video Of IED Attack On M1A Abrams Tanks Driving Over Bridge In Southern Lebanon -- ,0.9,HIGH,True,FALSE - Debunked by fact-checkers,leadstories.com,factcheck,2026-07-21T08:32:50.175810
[DEBUNKED] Fact Check: FAKE Trump Post 'Paul McCartney Is An Anti-Trump Joke' -- Creator Says Not Real | Lead Stories,https://leadstories.com/hoax-alert/2026/07/fact-check-fake-trump-post-paul-mccartney-anti-trump-joke-creator-says-not-real.html,leadstories.com,Fact Check: FAKE Trump Post 'Paul McCartney Is An Anti-Trump Joke' -- Creator Says Not Real | Lead S,0.9,HIGH,True,FALSE - Debunked by fact-checkers,leadstories.com,factcheck,2026-07-21T08:32:50.346696
[DEBUNKED] Fact Check: FAKE Video Falsely Shows A U.S. B-52 Being Shot Down By A Missile -- Computer Generated | Lead Stories,https://leadstories.com/hoax-alert/2026/07/fact-check-fake-video-falsely-shows-a-u.s.-b52-being-shot-down-by-a-missile.html,leadstories.com,Fact Check: FAKE Video Falsely Shows A U.S. B-52 Being Shot Down By A Missile -- Computer Generated ,0.9,HIGH,True,FALSE - Debunked by fact-checkers,leadstories.com,factcheck,2026-07-21T08:32:50.523025
[DEBUNKED] Fact Check: FAKE Video Of Iranian Attack On Base In Jordan Used By U.S. Forces -- Digitally Created | Lead Stories,https://leadstories.com/hoax-alert/2026/07/fact-check-fake-video-of-iranian-attack-on-base-in-jordan-used-by-us-forces-digitally-created.html,leadstories.com,Fact Check: FAKE Video Of Iranian Attack On Base In Jordan Used By U.S. Forces -- Digitally Created ,0.9,HIGH,True,FALSE - Debunked by fact-checkers,leadstories.com,factcheck,2026-07-21T08:32:50.690805
"[DEBUNKED] Prebunk: AI Insect, Animal Fight Videos Have Bugs In Them -- Stop Fakes From Crawling Through | Lead Stories",https://leadstories.com/hoax-alert/2026/07/prebunk-ai-insect-animal-fight-videos-have-bugs-in-them-stop-fakes-from-crawling-through.html,leadstories.com,"Prebunk: AI Insect, Animal Fight Videos Have Bugs In Them -- Stop Fakes From Crawling Through | Lead",0.9,HIGH,True,FALSE - Debunked by fact-checkers,leadstories.com,factcheck,2026-07-21T08:32:50.871649
[DEBUNKED] Fact Check: FAKE Photo Shows Elliot Page On Men's Health Cover For August 2026 | Lead Stories,https://leadstories.com/hoax-alert/2026/07/fact-check-fake-photo-shows-elliot-page-onl-mens-health-cover-for-august-2026.html,leadstories.com,Fact Check: FAKE Photo Shows Elliot Page On Men's Health Cover For August 2026 | Lead Stories,0.9,HIGH,True,FALSE - Debunked by fact-checkers,leadstories.com,factcheck,2026-07-21T08:32:51.051340
[DEBUNKED] Fact Check: FIFA President Gianni Infantino Did NOT Say They Will Make A Decision About Argentina Political Message After Final Game | Lead Stories,https://leadstories.com/hoax-alert/2026/07/fact-check-fifa-president-gianni-infantino-did-not-say-will-make-decision-argentina-political-message-after-final-game.html,leadstories.com,Fact Check: FIFA President Gianni Infantino Did NOT Say They Will Make A Decision About Argentina Po,0.9,HIGH,True,FALSE - Debunked by fact-checkers,leadstories.com,factcheck,2026-07-21T08:32:51.252597
[DEBUNKED] Fact Check: Hillary Clinton Did NOT Appeal To China To Meddle In 2020 Election During TV Interview -- It Was A 'What If' Question | Lead Stories,https://leadstories.com/hoax-alert/2026/07/fact-check-hillary-clinton-did-not-appeal-to-china-to-meddle-in-2020-election-during-tv-interview-it-was-a-what-if-question.html,leadstories.com,Fact Check: Hillary Clinton Did NOT Appeal To China To Meddle In 2020 Election During TV Interview -,0.9,HIGH,True,FALSE - Debunked by fact-checkers,leadstories.com,factcheck,2026-07-21T08:32:51.424554
[DEBUNKED] Fact Check: Comedy Film Showing Woman Tied Up In Kitchen NOT From Epstein Files | Lead Stories,https://leadstories.com/hoax-alert/2026/07/fact-check-video-not-epstein-files-woman-tied-up-kitchen-comedy-sketch.html,leadstories.com,Fact Check: Comedy Film Showing Woman Tied Up In Kitchen NOT From Epstein Files | Lead Stories,0.9,HIGH,True,FALSE - Debunked by fact-checkers,leadstories.com,factcheck,2026-07-21T08:32:51.601721
[DEBUNKED] Fact Check: FAKE Pete Hegseth Yearbook Picture With Black Hair And Guyliner -- His Real Yearbook Pictures Are Different | Lead Stories,https://leadstories.com/hoax-alert/2026/07/fact-check-fake-pete-hegseth-yearbook-picture-with-black-hair-and-guyliner-his-real-yearbook-pictures-are-different.html,leadstories.com,Fact Check: FAKE Pete Hegseth Yearbook Picture With Black Hair And Guyliner -- His Real Yearbook Pic,0.9,HIGH,True,FALSE - Debunked by fact-checkers,leadstories.com,factcheck,2026-07-21T08:32:51.783220
"[DEBUNKED] EXPLAINER: International migrants, jobs and crime in South Africa: What do the numbers show? - Africa Check",https://africacheck.org/fact-checks/blog/explainer-international-migrants-jobs-and-crime-south-africa-what-do-numbers-show,africacheck.org,"EXPLAINER: International migrants, jobs and crime in South Africa: What do the numbers show? - Afric",0.9,HIGH,True,FALSE - Debunked by fact-checkers,africacheck.org,factcheck,2026-07-21T08:32:52.017871
[DEBUNKED] United Nations did not pass ‘technical vote of no confidence’ in Nigerian president Bola Tinubu - Africa Check,https://africacheck.org/fact-checks/meta-programme-fact-checks/united-nations-did-not-pass-technical-vote-no-confidence,africacheck.org,United Nations did not pass ‘technical vote of no confidence’ in Nigerian president Bola Tinubu - Af,0.9,HIGH,True,FALSE - Debunked by fact-checkers,africacheck.org,factcheck,2026-07-21T08:32:52.241006
"[DEBUNKED] Viral flood video from Bangladesh, not Lagos, Nigeria - Africa Check",https://africacheck.org/fact-checks/meta-programme-fact-checks/viral-flood-video-bangladesh-not-lagos-nigeria,africacheck.org,"Viral flood video from Bangladesh, not Lagos, Nigeria - Africa Check",0.9,HIGH,True,FALSE - Debunked by fact-checkers,africacheck.org,factcheck,2026-07-21T08:32:52.470589
"[DEBUNKED] Nigerian STEM champions were photographed holding Nigerian, not Biafran, flag - Africa Check",https://africacheck.org/fact-checks/meta-programme-fact-checks/nigerian-stem-champions-were-photographed-holding-nigerian,africacheck.org,"Nigerian STEM champions were photographed holding Nigerian, not Biafran, flag - Africa Check",0.9,HIGH,True,FALSE - Debunked by fact-checkers,africacheck.org,factcheck,2026-07-21T08:32:53.118922
"[DEBUNKED] Viral video of Nigerian president reciting old national anthem from 2023, not 2026 federal executive committee meeting - Africa Check",https://africacheck.org/fact-checks/meta-programme-fact-checks/viral-video-nigerian-president-reciting-old-national-anthem,africacheck.org,"Viral video of Nigerian president reciting old national anthem from 2023, not 2026 federal executive",0.9,HIGH,True,FALSE - Debunked by fact-checkers,africacheck.org,factcheck,2026-07-21T08:32:53.326712
"[DEBUNKED] No, Nairobi county senator Edwin Sifuna hasn’t said he has quit Orange Democratic Movement – viral quote fabricated - Africa Check",https://africacheck.org/fact-checks/meta-programme-fact-checks/no-nairobi-county-senator-edwin-sifuna-hasnt-said-he-has,africacheck.org,"No, Nairobi county senator Edwin Sifuna hasn’t said he has quit Orange Democratic Movement – viral q",0.9,HIGH,True,FALSE - Debunked by fact-checkers,africacheck.org,factcheck,2026-07-21T08:32:53.539769
"[DEBUNKED] No, Kenyan politician Gideon Moi didn’t endorse Nairobi county senator Edwin Sifuna for president – viral quote fabricated - Africa Check",https://africacheck.org/fact-checks/meta-programme-fact-checks/no-kenyan-politician-gideon-moi-didnt-endorse-nairobi-county,africacheck.org,"No, Kenyan politician Gideon Moi didn’t endorse Nairobi county senator Edwin Sifuna for president – ",0.9,HIGH,True,FALSE - Debunked by fact-checkers,africacheck.org,factcheck,2026-07-21T08:32:53.766819
"[DEBUNKED] Viral video of flood &#039;looting&#039; from Accra, not Lagos - Africa Check",https://africacheck.org/fact-checks/meta-programme-fact-checks/viral-video-flood-looting-accra-not-lagos,africacheck.org,"Viral video of flood &#039;looting&#039; from Accra, not Lagos - Africa Check",0.9,HIGH,True,FALSE - Debunked by fact-checkers,africacheck.org,factcheck,2026-07-21T08:32:54.548762
"[DEBUNKED] No, Spar supermarket chain hasn’t opened 15,000 new jobs for South Africans after anti-migrant demonstrations - Africa Check",https://africacheck.org/fact-checks/meta-programme-fact-checks/no-spar-supermarket-chain-hasnt-opened-15000-new-jobs-south,africacheck.org,"No, Spar supermarket chain hasn’t opened 15,000 new jobs for South Africans after anti-migrant demon",0.9,HIGH,True,FALSE - Debunked by fact-checkers,africacheck.org,factcheck,2026-07-21T08:32:54.771209
"[DEBUNKED] No, Kenya’s Standard newspaper didn’t report that former deputy president Rigathi Gachagua was rejected by Mount Kenya region - Africa Check",https://africacheck.org/fact-checks/meta-programme-fact-checks/no-kenyas-standard-newspaper-didnt-report-former-deputy,africacheck.org,"No, Kenya’s Standard newspaper didn’t report that former deputy president Rigathi Gachagua was rejec",0.9,HIGH,True,FALSE - Debunked by fact-checkers,africacheck.org,factcheck,2026-07-21T08:32:54.996506
[DEBUNKED] Russia’s attacks on Ukraine’s cultural heritage: a nail in the coffin of FIMI - EUvsDisinfo,https://euvsdisinfo.eu/russias-attacks-on-ukraines-cultural-heritage-a-nail-in-the-coffin-of-fimi/,euvsdisinfo.eu,Russia’s attacks on Ukraine’s cultural heritage: a nail in the coffin of FIMI - EUvsDisinfo,0.9,HIGH,True,FALSE - Debunked by fact-checkers,euvsdisinfo.eu,factcheck,2026-07-21T08:32:59.764901
[DEBUNKED] Russia’s information war against Ukraine’s European future is a threat to Europe itself - EUvsDisinfo,https://euvsdisinfo.eu/russias-information-war-against-ukraines-european-future-is-a-threat-to-europe-itself/,euvsdisinfo.eu,Russia’s information war against Ukraine’s European future is a threat to Europe itself - EUvsDisinf,0.9,HIGH,True,FALSE - Debunked by fact-checkers,euvsdisinfo.eu,factcheck,2026-07-21T08:33:01.150968
[DEBUNKED] Explosives and propaganda: Russia’s dual-use drones - EUvsDisinfo,https://euvsdisinfo.eu/explosives-and-propaganda-russias-dual-use-drones/,euvsdisinfo.eu,Explosives and propaganda: Russia’s dual-use drones - EUvsDisinfo,0.9,HIGH,True,FALSE - Debunked by fact-checkers,euvsdisinfo.eu,factcheck,2026-07-21T08:33:03.203508
[DEBUNKED] How Moscow tries to cover up its failures on the Ukrainian battlefield - EUvsDisinfo,https://euvsdisinfo.eu/how-moscow-tries-to-cover-up-its-failures-on-the-ukrainian-battlefield/,euvsdisinfo.eu,How Moscow tries to cover up its failures on the Ukrainian battlefield - EUvsDisinfo,0.9,HIGH,True,FALSE - Debunked by fact-checkers,euvsdisinfo.eu,factcheck,2026-07-21T08:33:05.049746
"[DEBUNKED] Warmongering NATO, peaceful Belarus, and Bulgaria’s “punishment” - EUvsDisinfo",https://euvsdisinfo.eu/warmongering-nato-peaceful-belarus-and-bulgarias-punishment/,euvsdisinfo.eu,"Warmongering NATO, peaceful Belarus, and Bulgaria’s “punishment” - EUvsDisinfo",0.9,HIGH,True,FALSE - Debunked by fact-checkers,euvsdisinfo.eu,factcheck,2026-07-21T08:33:07.760335
"[DEBUNKED] Religion, drones, and “piracy”: latest trends in Russian FIMI - EUvsDisinfo",https://euvsdisinfo.eu/religion-drones-and-piracy-latest-trends-in-russian-fimi/,euvsdisinfo.eu,"Religion, drones, and “piracy”: latest trends in Russian FIMI - EUvsDisinfo",0.9,HIGH,True,FALSE - Debunked by fact-checkers,euvsdisinfo.eu,factcheck,2026-07-21T08:33:10.469749
Das bestätigte die Vereinigung der professionellen Tennisspielerinnen WTA der Deutschen Presse-Agentur und verwies auf ihre aktualisierten Teilnahmebedingungen,https://www.spiegel.de/sport/tennis/tennis-neue-regel-verpflichtet-spielerinnen-zu-geschlechtstests-a-9d85cab3-a509-470c-82b9-4b0d8a702fe6#ref=rss,www.spiegel.de,Tennis: Neue Regel verpflichtet Spielerinnen zu Geschlechtstests - DER SPIEGEL,0,LOW,False,,,mainstream,2026-07-21T08:33:24.758382
"Zum Login SPIEGEL plus Nur für Neukunden € 1,– für 4 Wochen danach € 5,99 pro Woche Freier Zugriff auf alle S+-Artikel auf SPIEGEL",https://www.spiegel.de/wirtschaft/schuldenbremse-koalition-scheitert-an-reform-ein-finanzpolitisches-armutszeugnis-a-415f3501-c2ba-4405-a474-8ad7543b99d3#ref=rss,www.spiegel.de,Schuldenbremse: Koalition scheitert an Reform – ein finanzpolitisches Armutszeugnis - DER SPIEGEL,0.1,LOW,False,,,mainstream,2026-07-21T08:33:26.610583
"E-Paper (PDF), Digital-Archiv und S+-Newsletter Jederzeit kündigen Jetzt abonnieren SPIEGEL plus 52 Wochen 25 % sparen € 4,49 pro Woche für 52 Wochen danach € 5,99 pro Woche Freier Zugriff auf alle S+-Artikel auf SPIEGEL",https://www.spiegel.de/wirtschaft/schuldenbremse-koalition-scheitert-an-reform-ein-finanzpolitisches-armutszeugnis-a-415f3501-c2ba-4405-a474-8ad7543b99d3#ref=rss,www.spiegel.de,Schuldenbremse: Koalition scheitert an Reform – ein finanzpolitisches Armutszeugnis - DER SPIEGEL,0.1,LOW,False,,,mainstream,2026-07-21T08:33:26.665309
"Allerdings hat sich die Abkühlung in Deutschland überdurchschnittlich ​verteuert: Im Juni kostete der Eintritt 3,6 Prozent mehr als ein ‌Jahr zuvor, wie das Statistische Bundesamt am Dienstag mitteilte",https://www.spiegel.de/wirtschaft/service/inflation-schwimmbad-preise-steigen-deutlich-a-d772c7d8-ef2d-4773-a8d4-a703a07bf927#ref=rss,www.spiegel.de,Inflation: Schwimmbad-Preise steigen deutlich - DER SPIEGEL,0.1,LOW,False,,,mainstream,2026-07-21T08:33:29.387979
"Die Verbraucherpreise insgesamt stiegen in diesem Zeitraum nur um 2,3 Prozent",https://www.spiegel.de/wirtschaft/service/inflation-schwimmbad-preise-steigen-deutlich-a-d772c7d8-ef2d-4773-a8d4-a703a07bf927#ref=rss,www.spiegel.de,Inflation: Schwimmbad-Preise steigen deutlich - DER SPIEGEL,0,LOW,False,,,mainstream,2026-07-21T08:33:29.445318
"Sonnenschirme etwa waren um 0,7 Prozent günstiger ⁠zu ⁠haben als im Juni 2025",https://www.spiegel.de/wirtschaft/service/inflation-schwimmbad-preise-steigen-deutlich-a-d772c7d8-ef2d-4773-a8d4-a703a07bf927#ref=rss,www.spiegel.de,Inflation: Schwimmbad-Preise steigen deutlich - DER SPIEGEL,0,LOW,False,,,mainstream,2026-07-21T08:33:29.505100
"Zum Login SPIEGEL plus Nur für Neukunden € 1,– für 4 Wochen danach € 5,99 pro Woche Freier Zugriff auf alle S+-Artikel auf SPIEGEL",https://www.spiegel.de/wirtschaft/robin-alexander-wie-der-journalist-zum-politiklehrer-der-nation-wurde-a-72f515ad-33c1-4475-bd08-f37333c2bc11#ref=rss,www.spiegel.de,Robin Alexander: Wie der Journalist zum Politiklehrer der Nation wurde - DER SPIEGEL,0.1,LOW,False,,,mainstream,2026-07-21T08:33:30.566413
"E-Paper (PDF), Digital-Archiv und S+-Newsletter Jederzeit kündigen Jetzt abonnieren SPIEGEL plus 52 Wochen 25 % sparen € 4,49 pro Woche für 52 Wochen danach € 5,99 pro Woche Freier Zugriff auf alle S+-Artikel auf SPIEGEL",https://www.spiegel.de/wirtschaft/robin-alexander-wie-der-journalist-zum-politiklehrer-der-nation-wurde-a-72f515ad-33c1-4475-bd08-f37333c2bc11#ref=rss,www.spiegel.de,Robin Alexander: Wie der Journalist zum Politiklehrer der Nation wurde - DER SPIEGEL,0.1,LOW,False,,,mainstream,2026-07-21T08:33:30.623303
Andere Nutzungen verletzen das Urheberrecht Nach dem Fall Spahn »Etwas Plumperes habe ich noch nicht gelesen« – Laschet attackiert Brosius-Gersdorf in Leihmutter-Debatte Die Debatte über Leihmutterschaft wird immer hitziger,https://www.spiegel.de/politik/deutschland/leihmutter-debatte-armin-laschet-attackiert-frauke-brosius-gersdorf-a-bf92ab21-3e3f-4db3-a6a8-128a3ba703e0#ref=rss,www.spiegel.de,Leihmutterschaft: Armin Laschet attackiert Frauke Brosius-Gersdorf - DER SPIEGEL,0.1,LOW,False,,,mainstream,2026-07-21T08:33:31.786138
"Schweighöfer bestätigte den Bericht bei Instagram und zeigte sich überschwänglich: »Es ist einfach der Wahnsinn, Leute",https://www.spiegel.de/kultur/kino/matthias-schweighoefer-uebernimmt-rolle-in-neuem-conjuring-horrorfilm-a-07898b56-1a61-42c9-a5b6-0c323b7130b2#ref=rss,www.spiegel.de,Matthias Schweighöfer übernimmt Rolle in neuem »Conjuring«-Horrorfilm - DER SPIEGEL,0,LOW,False,,,mainstream,2026-07-21T08:33:32.760424
"Andere Nutzungen verletzen das Urheberrecht Hype um Anthropic-Chatbot Claude wird immer populärer, ich hänge noch bei ChatGPT",https://www.spiegel.de/netzwelt/web/claude-oder-chatgpt-fuer-wen-lohnt-sich-der-wechsel-von-openai-zu-anthropic-a-04295bcc-e5e0-408c-98c2-eb3a6681a0e1#ref=rss,www.spiegel.de,Claude oder ChatGPT: Für wen lohnt sich der Wechsel von OpenAI zu Anthropic? - DER SPIEGEL,0.1,LOW,False,,,mainstream,2026-07-21T08:33:35.453788
"Zum Login SPIEGEL plus Nur für Neukunden € 1,– für 4 Wochen danach € 5,99 pro Woche Freier Zugriff auf alle S+-Artikel auf SPIEGEL",https://www.spiegel.de/netzwelt/web/claude-oder-chatgpt-fuer-wen-lohnt-sich-der-wechsel-von-openai-zu-anthropic-a-04295bcc-e5e0-408c-98c2-eb3a6681a0e1#ref=rss,www.spiegel.de,Claude oder ChatGPT: Für wen lohnt sich der Wechsel von OpenAI zu Anthropic? - DER SPIEGEL,0.1,LOW,False,,,mainstream,2026-07-21T08:33:35.512271
"E-Paper (PDF), Digital-Archiv und S+-Newsletter Jederzeit kündigen Jetzt abonnieren SPIEGEL plus 52 Wochen 25 % sparen € 4,49 pro Woche für 52 Wochen danach € 5,99 pro Woche Freier Zugriff auf alle S+-Artikel auf SPIEGEL",https://www.spiegel.de/netzwelt/web/claude-oder-chatgpt-fuer-wen-lohnt-sich-der-wechsel-von-openai-zu-anthropic-a-04295bcc-e5e0-408c-98c2-eb3a6681a0e1#ref=rss,www.spiegel.de,Claude oder ChatGPT: Für wen lohnt sich der Wechsel von OpenAI zu Anthropic? - DER SPIEGEL,0.1,LOW,False,,,mainstream,2026-07-21T08:33:35.569409
"Zum Login SPIEGEL plus Nur für Neukunden € 1,– für 4 Wochen danach € 5,99 pro Woche Freier Zugriff auf alle S+-Artikel auf SPIEGEL",https://www.spiegel.de/kultur/hubert-ohne-staller-leberkaese-macht-langsam-im-hirn-was-lernt-man-in-der-serie-ueber-oberbayern-a-544f7b2a-e8da-4d81-9dd5-1ed08b8c03ee#ref=rss,www.spiegel.de,»Hubert ohne Staller«: Leberkäse macht langsam im Hirn. Was lernt man in der Serie über Oberbayern? ,0.1,LOW,False,,,mainstream,2026-07-21T08:33:36.553419
"E-Paper (PDF), Digital-Archiv und S+-Newsletter Jederzeit kündigen Jetzt abonnieren SPIEGEL plus 52 Wochen 25 % sparen € 4,49 pro Woche für 52 Wochen danach € 5,99 pro Woche Freier Zugriff auf alle S+-Artikel auf SPIEGEL",https://www.spiegel.de/kultur/hubert-ohne-staller-leberkaese-macht-langsam-im-hirn-was-lernt-man-in-der-serie-ueber-oberbayern-a-544f7b2a-e8da-4d81-9dd5-1ed08b8c03ee#ref=rss,www.spiegel.de,»Hubert ohne Staller«: Leberkäse macht langsam im Hirn. Was lernt man in der Serie über Oberbayern? ,0.1,LOW,False,,,mainstream,2026-07-21T08:33:36.613482
