claim,source_url,source_domain,article_title,risk_score,risk_category,has_factcheck,factcheck_rating,factcheck_source,source_type,checked_at
[DEBUNKED] Fact Check: FAKE Meme Shows 'Epic' Trump-Obama Exchange About Iran Nuclear Deal -- No Evidence It Happened | Lead Stories,https://leadstories.com/hoax-alert/2026/05/fact-check-meme-does-not-accurately-present-epic-moment-interaction-between-trump-obama-about-iran-nuclear-deals.html,leadstories.com,Fact Check: FAKE Meme Shows 'Epic' Trump-Obama Exchange About Iran Nuclear Deal -- No Evidence It Ha,0.9,HIGH,True,FALSE - Debunked by fact-checkers,leadstories.com,factcheck,2026-05-31T19:20:21.470610
[DEBUNKED] Fact Check: FAKE Video Shows U.S. Strike on Iranian Drone Carrier IRIS Shahid Bagheri -- It Was Created by AI | Lead Stories,https://leadstories.com/hoax-alert/2026/05/fact-check-fake-video-shows-us-strike-on-iranian-drone-carrier-iris-shahid-bagheri-or-any-iranian-aircraft-carrier.html,leadstories.com,Fact Check: FAKE Video Shows U.S. Strike on Iranian Drone Carrier IRIS Shahid Bagheri -- It Was Crea,0.9,HIGH,True,FALSE - Debunked by fact-checkers,leadstories.com,factcheck,2026-05-31T19:20:21.641368
"[DEBUNKED] Fact Check: Armenian Mirror-Spectator Did NOT Produce Report Saying PM Nikol Pashinyan Agreed To Resettle 250,000 Refugees Without Legal Status In EU | Lead Stories",https://leadstories.com/hoax-alert/2026/05/fact-check-armenian-mirror-spectator-did-not-produce-report-saying-that-pm-nikol-pashinyan-agreed-to-resettle-250-000-refugees.html,leadstories.com,Fact Check: Armenian Mirror-Spectator Did NOT Produce Report Saying PM Nikol Pashinyan Agreed To Res,0.9,HIGH,True,FALSE - Debunked by fact-checkers,leadstories.com,factcheck,2026-05-31T19:20:21.817566
"[DEBUNKED] Fact Check: NO Evidence Three Sisters Drowned In Brighton, England, Ran GoFundMe Campaign For Mother Whose Body Was Never Found | Lead Stories",https://leadstories.com/hoax-alert/2026/05/fact-check-no-evidence-family-of-three-sisters-drowned-in-brighton-england-previously-ran-gofundme-campaign-for-mother-whose-body-was-never-found.html,leadstories.com,"Fact Check: NO Evidence Three Sisters Drowned In Brighton, England, Ran GoFundMe Campaign For Mother",0.9,HIGH,True,FALSE - Debunked by fact-checkers,leadstories.com,factcheck,2026-05-31T19:20:21.991879
[DEBUNKED] Fact Check: FAKE BBC News Video Report Says France Is Deploying 800 French Foreign Legion Soldiers To Armenia | Lead Stories,https://leadstories.com/hoax-alert/2026/05/fact-check-fake-bbc-news-video-report-says-france-deploying-800-french-foreign-legion-soldiers-armenia.html,leadstories.com,Fact Check: FAKE BBC News Video Report Says France Is Deploying 800 French Foreign Legion Soldiers T,0.9,HIGH,True,FALSE - Debunked by fact-checkers,leadstories.com,factcheck,2026-05-31T19:20:22.156709
[DEBUNKED] Fact Check: The White House DID Publish A Post Commemorating The Tenth Anniversary Of The Death Of Harambe The Gorilla | Lead Stories,https://leadstories.com/hoax-alert/2026/05/fact-check-the-white-house-did-publish-a-post-commemorating-the-tenth-anniversary-of-the-death-of-harambe-the-gorilla.html,leadstories.com,Fact Check: The White House DID Publish A Post Commemorating The Tenth Anniversary Of The Death Of H,0.9,HIGH,True,FALSE - Debunked by fact-checkers,leadstories.com,factcheck,2026-05-31T19:20:22.325889
[DEBUNKED] Fact Check: Haaretz Did NOT Report That Zelenskyy's Associate Timur Mindich Fled To Israel With 800 kg Of Gold | Lead Stories,https://leadstories.com/hoax-alert/2026/05/fact-check-haaretz-did-not-report-that-mindich-fled-to-israel-with-800-kg-of-gold.html,leadstories.com,Fact Check: Haaretz Did NOT Report That Zelenskyy's Associate Timur Mindich Fled To Israel With 800 ,0.9,HIGH,True,FALSE - Debunked by fact-checkers,leadstories.com,factcheck,2026-05-31T19:20:22.507426
[DEBUNKED] Fact Check: FAKE Video Shows Woman Stuck Upside Down In A Water Slide -- AI-Generated | Lead Stories,https://leadstories.com/hoax-alert/2026/05/fact-check-fake-video-shows-woman-stuck-upside-down-in-a-water-slide.html,leadstories.com,Fact Check: FAKE Video Shows Woman Stuck Upside Down In A Water Slide -- AI-Generated | Lead Stories,0.9,HIGH,True,FALSE - Debunked by fact-checkers,leadstories.com,factcheck,2026-05-31T19:20:22.698269
[DEBUNKED] Fact Check: Real But Colorized 1923 Footage Shows Early French Roller Skates Called 'Paticycles' | Lead Stories,https://leadstories.com/hoax-alert/2026/05/fact-check-real-but-colorized-1923-footage-shows-early-french-roller-skates-called-paticycles.html,leadstories.com,Fact Check: Real But Colorized 1923 Footage Shows Early French Roller Skates Called 'Paticycles' | L,0.9,HIGH,True,FALSE - Debunked by fact-checkers,leadstories.com,factcheck,2026-05-31T19:20:22.912260
[DEBUNKED] Fact Check: Graphic ACCURATELY Depicts Net Worth Changes For Recent Presidents But Includes Formatting Errors | Lead Stories,https://leadstories.com/hoax-alert/2026/05/fact-check-graphic-accurately-depicts-net-worth-changes-for-recent-presidents-but-includes-formatting-errors.html,leadstories.com,Fact Check: Graphic ACCURATELY Depicts Net Worth Changes For Recent Presidents But Includes Formatti,0.9,HIGH,True,FALSE - Debunked by fact-checkers,leadstories.com,factcheck,2026-05-31T19:20:23.074200
"[DEBUNKED] Victim-blaming Kyiv, pressuring Moldova, and drone disinformation - EUvsDisinfo",https://euvsdisinfo.eu/victim-blaming-kyiv-pressuring-moldova-and-drone-disinformation/,euvsdisinfo.eu,"Victim-blaming Kyiv, pressuring Moldova, and drone disinformation - EUvsDisinfo",0.9,HIGH,True,FALSE - Debunked by fact-checkers,euvsdisinfo.eu,factcheck,2026-05-31T19:20:26.044902
"[DEBUNKED] Tough love: Spies, dating apps and the dark side of online intimacy - EUvsDisinfo",https://euvsdisinfo.eu/tough-love-spies-dating-apps-and-the-dark-side-of-online-intimacy/,euvsdisinfo.eu,"Tough love: Spies, dating apps and the dark side of online intimacy - EUvsDisinfo",0.9,HIGH,True,FALSE - Debunked by fact-checkers,euvsdisinfo.eu,factcheck,2026-05-31T19:20:28.970133
"[DEBUNKED] Lies about Russia’s military success, Yermak’s arrest and secret biolabs - EUvsDisinfo",https://euvsdisinfo.eu/lies-about-russias-military-success-yermaks-arrest-and-secret-biolabs/,euvsdisinfo.eu,"Lies about Russia’s military success, Yermak’s arrest and secret biolabs - EUvsDisinfo",0.9,HIGH,True,FALSE - Debunked by fact-checkers,euvsdisinfo.eu,factcheck,2026-05-31T19:20:30.487869
"[DEBUNKED] Victory Day propaganda, masking fear with intimidation, and abduction denial - EUvsDisinfo",https://euvsdisinfo.eu/victory-day-propaganda-masking-fear-with-intimidation-and-abduction-denial/,euvsdisinfo.eu,"Victory Day propaganda, masking fear with intimidation, and abduction denial - EUvsDisinfo",0.9,HIGH,True,FALSE - Debunked by fact-checkers,euvsdisinfo.eu,factcheck,2026-05-31T19:20:33.978384
[DEBUNKED] How Russia lies about the stolen Ukrainian children - EUvsDisinfo,https://euvsdisinfo.eu/how-russia-lies-about-the-stolen-ukrainian-children/,euvsdisinfo.eu,How Russia lies about the stolen Ukrainian children - EUvsDisinfo,0.9,HIGH,True,FALSE - Debunked by fact-checkers,euvsdisinfo.eu,factcheck,2026-05-31T19:20:37.418220
[DEBUNKED] Fake European crises and real Russian failures - EUvsDisinfo,https://euvsdisinfo.eu/fake-european-crises-and-real-russian-failures/,euvsdisinfo.eu,Fake European crises and real Russian failures - EUvsDisinfo,0.9,HIGH,True,FALSE - Debunked by fact-checkers,euvsdisinfo.eu,factcheck,2026-05-31T19:20:40.505021
"Beim Referendum stimmte eine Mehrheit von 54,9 Prozent gegen die Pläne des Senats","https://www.ndr.de/sport/mehr_sport/nein-beim-referendum-hamburgs-olympia-bewerbung-gescheitert,olympia-referendum-hamburg-100.html",www.ndr.de,Nein beim Referendum: Hamburgs Olympia-Bewerbung gescheitert | ndr.de,0,LOW,False,,,mainstream,2026-05-31T19:20:48.003036
"Das Ergebnis im Überblick: Ja: 45,1 Prozent (293","https://www.ndr.de/sport/mehr_sport/nein-beim-referendum-hamburgs-olympia-bewerbung-gescheitert,olympia-referendum-hamburg-100.html",www.ndr.de,Nein beim Referendum: Hamburgs Olympia-Bewerbung gescheitert | ndr.de,0,LOW,False,,,mainstream,2026-05-31T19:20:48.111971
"819 Stimmen) Nein: 54,9 Prozent (357","https://www.ndr.de/sport/mehr_sport/nein-beim-referendum-hamburgs-olympia-bewerbung-gescheitert,olympia-referendum-hamburg-100.html",www.ndr.de,Nein beim Referendum: Hamburgs Olympia-Bewerbung gescheitert | ndr.de,0,LOW,False,,,mainstream,2026-05-31T19:20:48.229715
Das bestätigte das Management des ehemaligen Formel-1-Rennfahrers Schumacher am Sonntag,https://www.spiegel.de/panorama/leute/ralf-schumacher-ex-formel-1-pilot-heiratet-partner-etienne-in-suedfrankreich-a-ba797aac-393a-4cfe-afcb-87e9b5b79395#ref=rss,www.spiegel.de,Ralf Schumacher: Ex-Formel-1-Pilot heiratet Partner Étienne in Südfrankreich - DER SPIEGEL,0,LOW,False,,,mainstream,2026-05-31T19:20:52.979385
"Laut Sky-Informationen zählte Ralfs Sohn David Schumacher zu den Gästen der Party, der als Trauzeuge gemeinsam mit seiner Frau angereist war",https://www.spiegel.de/panorama/leute/ralf-schumacher-ex-formel-1-pilot-heiratet-partner-etienne-in-suedfrankreich-a-ba797aac-393a-4cfe-afcb-87e9b5b79395#ref=rss,www.spiegel.de,Ralf Schumacher: Ex-Formel-1-Pilot heiratet Partner Étienne in Südfrankreich - DER SPIEGEL,0,LOW,False,,,mainstream,2026-05-31T19:20:53.079659
»Man sagt ja immer: Wahre Liebe findet ihren Weg,https://www.spiegel.de/panorama/leute/ralf-schumacher-ex-formel-1-pilot-heiratet-partner-etienne-in-suedfrankreich-a-ba797aac-393a-4cfe-afcb-87e9b5b79395#ref=rss,www.spiegel.de,Ralf Schumacher: Ex-Formel-1-Pilot heiratet Partner Étienne in Südfrankreich - DER SPIEGEL,0.1,LOW,False,,,mainstream,2026-05-31T19:20:53.178284
"Zum Login SPIEGEL plus Nur für Neukunden € 1,– für 4 Wochen danach € 5,99 pro Woche Freier Zugriff auf alle S+-Artikel auf SPIEGEL",https://www.spiegel.de/sport/fussball/fussball-liveticker-deutschland-gegen-finnland-a-7b0774cb-7d21-4e89-a44a-c5dc86358d8f#ref=rss,www.spiegel.de,Fußball-Liveticker: Deutschland gegen Finnland - DER SPIEGEL,0.1,LOW,False,,,mainstream,2026-05-31T19:20:54.498978
"E-Paper (PDF), Digital-Archiv und S+-Newsletter Jederzeit kündigen Jetzt abonnieren SPIEGEL plus 52 Wochen 25 % sparen € 4,49 pro Woche für 52 Wochen danach € 5,99 pro Woche Freier Zugriff auf alle S+-Artikel auf SPIEGEL",https://www.spiegel.de/sport/fussball/fussball-liveticker-deutschland-gegen-finnland-a-7b0774cb-7d21-4e89-a44a-c5dc86358d8f#ref=rss,www.spiegel.de,Fußball-Liveticker: Deutschland gegen Finnland - DER SPIEGEL,0.1,LOW,False,,,mainstream,2026-05-31T19:20:54.598006
"Munitionslager unter Kontrolle der RebellenDie Rebellengruppe Ta’ang National Liberation Army (TNLA) bestätigte, dass das betroffene Lager unter ihrer Kontrolle stand",https://www.spiegel.de/ausland/myanmar-schwere-explosion-in-munitionslager-mindestens-50-tote-a-faf439fe-8afe-41e1-9d13-a7ac74ce8988#ref=rss,www.spiegel.de,Myanmar: Schwere Explosion in Munitionslager – mindestens 50 Tote - DER SPIEGEL,0,LOW,False,,,mainstream,2026-05-31T19:20:56.023083
"Laut der Organisation befanden sich dort gewerbliche Sprengstoffe, die für Arbeiten in einem von ihr betriebenen Steinbruch vorgesehen waren",https://www.spiegel.de/ausland/myanmar-schwere-explosion-in-munitionslager-mindestens-50-tote-a-faf439fe-8afe-41e1-9d13-a7ac74ce8988#ref=rss,www.spiegel.de,Myanmar: Schwere Explosion in Munitionslager – mindestens 50 Tote - DER SPIEGEL,0,LOW,False,,,mainstream,2026-05-31T19:20:56.121735
"Zum Login SPIEGEL plus Nur für Neukunden € 1,– für 4 Wochen danach € 5,99 pro Woche Freier Zugriff auf alle S+-Artikel auf SPIEGEL",https://www.spiegel.de/politik/meltem-seker-wie-eine-influencerin-mit-videos-ueber-friedrich-merz-polarisiert-a-e5b8804f-598e-4208-a321-8b1cb7268e35#ref=rss,www.spiegel.de,Meltem Seker: Wie eine Politik-Influencerin mit Videos über Friedrich Merz polarisiert - DER SPIEGEL,0.1,LOW,False,,,mainstream,2026-05-31T19:20:57.154944
"E-Paper (PDF), Digital-Archiv und S+-Newsletter Jederzeit kündigen Jetzt abonnieren SPIEGEL plus 52 Wochen 25 % sparen € 4,49 pro Woche für 52 Wochen danach € 5,99 pro Woche Freier Zugriff auf alle S+-Artikel auf SPIEGEL",https://www.spiegel.de/politik/meltem-seker-wie-eine-influencerin-mit-videos-ueber-friedrich-merz-polarisiert-a-e5b8804f-598e-4208-a321-8b1cb7268e35#ref=rss,www.spiegel.de,Meltem Seker: Wie eine Politik-Influencerin mit Videos über Friedrich Merz polarisiert - DER SPIEGEL,0.1,LOW,False,,,mainstream,2026-05-31T19:20:57.254462
"length - 1, 500, false)"" data-area=""nav-bar"" data-app-hidden x-lazyload> Menü Startseite Sport Olympia Hamburg Olympia-Abstimmung: Hamburger wollen keine Spiele in ihrer Stadt $swiper",https://www.spiegel.de/sport/olympia/olympia-abstimmung-hamburger-wollen-keine-spiele-in-ihrer-stadt-a-8baa3af6-3704-4e03-82e0-20922c510c59#ref=rss,www.spiegel.de,Olympia-Abstimmung: Hamburger wollen keine Spiele in ihrer Stadt - DER SPIEGEL,0.1,LOW,False,,,mainstream,2026-05-31T19:20:58.951556
"Nach Auszählung aller Stimmen lagen die Gegner der Kandidatur für die Spiele 2036, 2040 oder 2044 mit 54,9 Prozent vorn",https://www.spiegel.de/sport/olympia/olympia-abstimmung-hamburger-wollen-keine-spiele-in-ihrer-stadt-a-8baa3af6-3704-4e03-82e0-20922c510c59#ref=rss,www.spiegel.de,Olympia-Abstimmung: Hamburger wollen keine Spiele in ihrer Stadt - DER SPIEGEL,0.1,LOW,False,,,mainstream,2026-05-31T19:20:59.060043
"45,1 Prozent stimmten für eine Bewerbung",https://www.spiegel.de/sport/olympia/olympia-abstimmung-hamburger-wollen-keine-spiele-in-ihrer-stadt-a-8baa3af6-3704-4e03-82e0-20922c510c59#ref=rss,www.spiegel.de,Olympia-Abstimmung: Hamburger wollen keine Spiele in ihrer Stadt - DER SPIEGEL,0,LOW,False,,,mainstream,2026-05-31T19:20:59.164905
"Zum Login SPIEGEL plus Nur für Neukunden € 1,– für 4 Wochen danach € 5,99 pro Woche Freier Zugriff auf alle S+-Artikel auf SPIEGEL",https://www.spiegel.de/ausland/kuba-blockade-von-donald-trump-wie-das-oelembargo-tourismus-zerstoert-a-90b21273-b991-4e10-9e70-06ffbdea4960#ref=rss,www.spiegel.de,Kuba-Blockade von Donald Trump: Wie das Ölembargo Tourismus zerstört - DER SPIEGEL,0.1,LOW,False,,,mainstream,2026-05-31T19:21:00.156857
"E-Paper (PDF), Digital-Archiv und S+-Newsletter Jederzeit kündigen Jetzt abonnieren SPIEGEL plus 52 Wochen 25 % sparen € 4,49 pro Woche für 52 Wochen danach € 5,99 pro Woche Freier Zugriff auf alle S+-Artikel auf SPIEGEL",https://www.spiegel.de/ausland/kuba-blockade-von-donald-trump-wie-das-oelembargo-tourismus-zerstoert-a-90b21273-b991-4e10-9e70-06ffbdea4960#ref=rss,www.spiegel.de,Kuba-Blockade von Donald Trump: Wie das Ölembargo Tourismus zerstört - DER SPIEGEL,0.1,LOW,False,,,mainstream,2026-05-31T19:21:00.268063
"Zum Login SPIEGEL plus Nur für Neukunden € 1,– für 4 Wochen danach € 5,99 pro Woche Freier Zugriff auf alle S+-Artikel auf SPIEGEL",https://www.spiegel.de/wissenschaft/christine-webb-warum-sie-im-zweifel-auch-einen-hund-retten-wuerde-statt-einen-menschen-a-a5740db6-c72d-49c2-8fa7-41957a127ff2#ref=rss,www.spiegel.de,Primatologin Christine Webb: Warum sie im Zweifel auch einen Hund retten würde statt einen Menschen ,0.1,LOW,False,,,mainstream,2026-05-31T19:21:03.228275
"E-Paper (PDF), Digital-Archiv und S+-Newsletter Jederzeit kündigen Jetzt abonnieren SPIEGEL plus 52 Wochen 25 % sparen € 4,49 pro Woche für 52 Wochen danach € 5,99 pro Woche Freier Zugriff auf alle S+-Artikel auf SPIEGEL",https://www.spiegel.de/wissenschaft/christine-webb-warum-sie-im-zweifel-auch-einen-hund-retten-wuerde-statt-einen-menschen-a-a5740db6-c72d-49c2-8fa7-41957a127ff2#ref=rss,www.spiegel.de,Primatologin Christine Webb: Warum sie im Zweifel auch einen Hund retten würde statt einen Menschen ,0.1,LOW,False,,,mainstream,2026-05-31T19:21:03.329440
"Zum Login SPIEGEL plus Nur für Neukunden € 1,– für 4 Wochen danach € 5,99 pro Woche Freier Zugriff auf alle S+-Artikel auf SPIEGEL",https://www.spiegel.de/kultur/donald-trump-und-die-abschiebungen-wie-team-trump-angst-vor-aliens-schuert-a-87b5b523-def1-4a4e-8157-da47cfa47e7d#ref=rss,www.spiegel.de,Donald Trump und die Abschiebungen: Wie Team Trump Angst vor »Aliens« schürt - DER SPIEGEL,0.1,LOW,False,,,mainstream,2026-05-31T19:21:04.171215
"E-Paper (PDF), Digital-Archiv und S+-Newsletter Jederzeit kündigen Jetzt abonnieren SPIEGEL plus 52 Wochen 25 % sparen € 4,49 pro Woche für 52 Wochen danach € 5,99 pro Woche Freier Zugriff auf alle S+-Artikel auf SPIEGEL",https://www.spiegel.de/kultur/donald-trump-und-die-abschiebungen-wie-team-trump-angst-vor-aliens-schuert-a-87b5b523-def1-4a4e-8157-da47cfa47e7d#ref=rss,www.spiegel.de,Donald Trump und die Abschiebungen: Wie Team Trump Angst vor »Aliens« schürt - DER SPIEGEL,0.1,LOW,False,,,mainstream,2026-05-31T19:21:04.279902
Immer wieder kommt es zu Auseinandersetzungen zwischen Demonstranten und der Polizei,https://www.spiegel.de/ausland/usa-rechtsextreme-proud-boys-bei-protesten-vor-ice-zentrum-newark-a-82be638d-b5ae-412d-82f1-e98179b34656#ref=rss,www.spiegel.de,USA: Rechtsextreme »Proud Boys« bei Protesten vor ICE-Zentrum Newark - DER SPIEGEL,0.1,LOW,False,,,mainstream,2026-05-31T19:21:05.760123
Nach Angaben des FBL sollen in dieser Zeit über 20 Millionen Euro vom DFB an den Ligaverband fließen,https://www.spiegel.de/sport/fussball/fussball-der-frauen-dfb-und-bundesliga-einigen-sich-auf-ausgliederung-a-b33b35ca-c7e2-444e-b6bc-ec08a8022b4f#ref=rss,www.spiegel.de,Fußball der Frauen: DFB und Bundesliga einigen sich auf Ausgliederung - DER SPIEGEL,0,LOW,False,,,mainstream,2026-05-31T19:21:07.211144
Einige Anwesende hätten laut Polizei kurzzeitig Brandgeruch wahrgenommen,https://www.spiegel.de/panorama/unwetter-in-deutschland-blitz-schlaegt-waehrend-taufe-in-osnabruecker-kirche-ein-a-f58e37e8-b33b-49f4-a7e3-d76442c53e2e#ref=rss,www.spiegel.de,Unwetter in Deutschland: Blitz schlägt während Taufe in Osnabrücker Kirche ein - DER SPIEGEL,0,LOW,False,,,mainstream,2026-05-31T19:21:08.035643
"Die Feuerwehr überprüfte daraufhin die Kirche, habe allerdings keine Schäden feststellen können",https://www.spiegel.de/panorama/unwetter-in-deutschland-blitz-schlaegt-waehrend-taufe-in-osnabruecker-kirche-ein-a-f58e37e8-b33b-49f4-a7e3-d76442c53e2e#ref=rss,www.spiegel.de,Unwetter in Deutschland: Blitz schlägt während Taufe in Osnabrücker Kirche ein - DER SPIEGEL,0.1,LOW,False,,,mainstream,2026-05-31T19:21:08.136690
"Vonseiten der Polizei Osnabrück hieß es: »Für die Taufgesellschaft blieb es damit bei einem gehörigen Schrecken – und einer außergewöhnlichen Geschichte, die wohl künftig zu jeder Erinnerung an diesen besonderen Tag gehören wird",https://www.spiegel.de/panorama/unwetter-in-deutschland-blitz-schlaegt-waehrend-taufe-in-osnabruecker-kirche-ein-a-f58e37e8-b33b-49f4-a7e3-d76442c53e2e#ref=rss,www.spiegel.de,Unwetter in Deutschland: Blitz schlägt während Taufe in Osnabrücker Kirche ein - DER SPIEGEL,0,LOW,False,,,mainstream,2026-05-31T19:21:08.242793
"length - 1, 500, false)"" data-area=""nav-bar"" data-app-hidden x-lazyload> Menü Startseite Ausland Russlands Krieg gegen die Ukraine Ukraine-Krieg: IAEA meldet keine erhöhte Strahlung nach Angriff auf AKW Saporischschja $swiper",https://www.spiegel.de/ausland/ukraine-krieg-iaea-meldet-keine-erhoehte-strahlung-nach-angriff-auf-akw-saporischschja-a-ecf5604d-8a98-4771-ac7f-b9ff16fd9528#ref=rss,www.spiegel.de,Ukraine-Krieg: IAEA meldet keine erhöhte Strahlung nach Angriff auf AKW Saporischschja - DER SPIEGEL,0.1,LOW,False,,,mainstream,2026-05-31T19:21:09.070313
positiv bewerten negativ bewerten Nach einem mutmaßlichen Drohneneinschlag im russisch besetzten Kernkraftwerk Saporischschja in der Ukraine haben internationale Beobachter vor Ort keine erhöhte Strahlung gemessen,https://www.spiegel.de/ausland/ukraine-krieg-iaea-meldet-keine-erhoehte-strahlung-nach-angriff-auf-akw-saporischschja-a-ecf5604d-8a98-4771-ac7f-b9ff16fd9528#ref=rss,www.spiegel.de,Ukraine-Krieg: IAEA meldet keine erhöhte Strahlung nach Angriff auf AKW Saporischschja - DER SPIEGEL,0.1,LOW,False,,,mainstream,2026-05-31T19:21:09.162822
"The government says it hopes to improve the availability of wi-fi from the current 50-60% to at least 90%, as well as increasing the speed between five- and 10-fold",https://www.bbc.com/news/articles/cn8pn4l03r7o?at_medium=RSS&amp;at_campaign=rss,www.bbc.com,Why Britain&#x27;s notoriously bad train wi-fi might soon be a thing of the past,0,LOW,False,,,mainstream,2026-05-31T19:21:10.794887
"The response from critics may not have borne that out (it has a weighted average of 56% on review aggregation site Metacritic), but so far, viewing figures are the show&#x27;s highest ever",https://www.bbc.com/news/articles/c78qyn1d7qvo?at_medium=RSS&amp;at_campaign=rss,www.bbc.com,&#x27;Almost rage bait&#x27;: Has Euphoria gone from defining Gen Z to dividing them?,0,LOW,False,,,mainstream,2026-05-31T19:21:10.988304
"3 million, while global viewership surpassed 20 million - a 68% increase on the season two premiere over the same period, according to Warner Bros",https://www.bbc.com/news/articles/c78qyn1d7qvo?at_medium=RSS&amp;at_campaign=rss,www.bbc.com,&#x27;Almost rage bait&#x27;: Has Euphoria gone from defining Gen Z to dividing them?,0,LOW,False,,,mainstream,2026-05-31T19:21:11.098623
