claim,source_url,source_domain,article_title,risk_score,risk_category,has_factcheck,factcheck_rating,factcheck_source,source_type,checked_at
"(AP) By Louis Jacobson April 22, 2026 Solar and wind account for 3% of global energy, but are a growing power source for homes, businesses If Your Time is short Together, solar and wind account for about 3% of global energy sources",http://www.politifact.com/factchecks/2026/apr/22/chris-wright/wind-solar-energy-oil-strait-hormuz-iran/,www.politifact.com,"PolitiFact | Solar and wind account for 3% of global energy, but are a growing power source for home",0,LOW,False,,,factcheck,2026-04-29T03:23:56.261764
This 3% includes everything from powering factories to fueling transportation to generating electricity,http://www.politifact.com/factchecks/2026/apr/22/chris-wright/wind-solar-energy-oil-strait-hormuz-iran/,www.politifact.com,"PolitiFact | Solar and wind account for 3% of global energy, but are a growing power source for home",0,LOW,False,,,factcheck,2026-04-29T03:23:56.360510
[DEBUNKED] PolitiFact | Facebook users shared a supposed video of Trump at Walter Reed hospital. It’s AI-generated,http://www.politifact.com/factchecks/2026/apr/21/facebook-posts/Trump-Walter-Reed-AI-video/,www.politifact.com,PolitiFact | Facebook users shared a supposed video of Trump at Walter Reed hospital. It’s AI-genera,0.9,HIGH,True,FALSE - Debunked by fact-checkers,www.politifact.com,factcheck,2026-04-29T03:23:56.473060
"In terms of percentage increase measured in actual dollars, Trump’s proposal would increase the defense budget by 44%, making it the largest percentage increase in actual dollars since the Korean War and the third largest since WWII",http://www.politifact.com/factchecks/2026/apr/20/democratic-national-committee/trump-defense-budget-ww2/,www.politifact.com,PolitiFact | Would Trump’s proposed military budget be the largest increase since WWII?,0,LOW,False,,,factcheck,2026-04-29T03:23:56.699222
"If the plan is approved, total national defense funding would increase by about 44%",http://www.politifact.com/factchecks/2026/apr/20/democratic-national-committee/trump-defense-budget-ww2/,www.politifact.com,PolitiFact | Would Trump’s proposed military budget be the largest increase since WWII?,0,LOW,False,,,factcheck,2026-04-29T03:23:56.799049
"7, 1941, bombing of Pearl Harbor, Congress approved a 1942 budget that included a landmark 299% military spending increase over the year before, according to th",http://www.politifact.com/factchecks/2026/apr/20/democratic-national-committee/trump-defense-budget-ww2/,www.politifact.com,PolitiFact | Would Trump’s proposed military budget be the largest increase since WWII?,0,LOW,False,,,factcheck,2026-04-29T03:23:56.901986
"[DEBUNKED] PolitiFact | This video shows a 2025 oil tankers collision, not a 2026 US strike on Iranian cargo ship",http://www.politifact.com/factchecks/2026/apr/20/social-media/old-video-us-attack-iran-ship/,www.politifact.com,"PolitiFact | This video shows a 2025 oil tankers collision, not a 2026 US strike on Iranian cargo sh",0.9,HIGH,True,FALSE - Debunked by fact-checkers,www.politifact.com,factcheck,2026-04-29T03:23:57.013281
"[DEBUNKED] PolitiFact | Social media users questioned Pete Hegseth, Pope Leo&#x27;s Bible quotes. Here&#x27;s the full context",http://www.politifact.com/article/2026/apr/17/Pope-Leo-Hegseth-Bible-verse-Jesus-Pulp-Fiction/,www.politifact.com,"PolitiFact | Social media users questioned Pete Hegseth, Pope Leo&#x27;s Bible quotes. Here&#x27;s t",0.9,HIGH,True,FALSE - Debunked by fact-checkers,www.politifact.com,factcheck,2026-04-29T03:23:57.133318
[DEBUNKED] Fake ‘Daily Mail’ report on Labour members’ views of Keir Starmer shared online – Full Fact,https://fullfact.org/politics/fake-daily-mail-labour-survey-article/,fullfact.org,Fake ‘Daily Mail’ report on Labour members’ views of Keir Starmer shared online – Full Fact,0.9,HIGH,True,FALSE - Debunked by fact-checkers,fullfact.org,factcheck,2026-04-29T03:23:57.701969
[DEBUNKED] Fake pictures of Katie Hopkins in hospital shared online – Full Fact,https://fullfact.org/health/katie-hopkins-hospital-ebed-pictures-fake/,fullfact.org,Fake pictures of Katie Hopkins in hospital shared online – Full Fact,0.9,HIGH,True,FALSE - Debunked by fact-checkers,fullfact.org,factcheck,2026-04-29T03:23:58.141989
[DEBUNKED] More fake claims about Boots ‘mini-perfume set’ giveaway shared online – Full Fact,https://fullfact.org/shopping/boots-mini-perfumes-false-repeat/,fullfact.org,More fake claims about Boots ‘mini-perfume set’ giveaway shared online – Full Fact,0.9,HIGH,True,FALSE - Debunked by fact-checkers,fullfact.org,factcheck,2026-04-29T03:23:58.581763
[DEBUNKED] Zia Yusuf was not included on Time magazine’s 2026 list of 100 most influential people – Full Fact,https://fullfact.org/politics/zia-yusuf-time-magazine-false/,fullfact.org,Zia Yusuf was not included on Time magazine’s 2026 list of 100 most influential people – Full Fact,0.9,HIGH,True,FALSE - Debunked by fact-checkers,fullfact.org,factcheck,2026-04-29T03:23:59.141486
[DEBUNKED] Video doesn’t show mayor calling for Sharia law and ‘expulsion’ of non-Muslims from Britain – Full Fact,https://fullfact.org/politics/muslim-rotherham-mayor-sharia-law-expulsion-citizens-false/,fullfact.org,Video doesn’t show mayor calling for Sharia law and ‘expulsion’ of non-Muslims from Britain – Full F,0.9,HIGH,True,FALSE - Debunked by fact-checkers,fullfact.org,factcheck,2026-04-29T03:23:59.649805
"[DEBUNKED] Video shows 2020 incident in Syria, not a recent Iranian attack on a US Black Hawk helicopter – Full Fact",https://fullfact.org/conflict/syria-2020-helicopter-video-not-iranian-attack-us-black-hawk/,fullfact.org,"Video shows 2020 incident in Syria, not a recent Iranian attack on a US Black Hawk helicopter – Full",0.9,HIGH,True,FALSE - Debunked by fact-checkers,fullfact.org,factcheck,2026-04-29T03:24:00.153783
[DEBUNKED] Video claiming to show 500-strong anti-government protest in Birmingham is AI – Full Fact,https://fullfact.org/politics/birmingham-government-protest-video-ai/,fullfact.org,Video claiming to show 500-strong anti-government protest in Birmingham is AI – Full Fact,0.9,HIGH,True,FALSE - Debunked by fact-checkers,fullfact.org,factcheck,2026-04-29T03:24:00.717847
[DEBUNKED] Revealed: how local election bar charts are misleading voters and using unreliable data – Full Fact,https://fullfact.org/politics/election-leaflets-2026/,fullfact.org,Revealed: how local election bar charts are misleading voters and using unreliable data – Full Fact,0.9,HIGH,True,FALSE - Debunked by fact-checkers,fullfact.org,factcheck,2026-04-29T03:24:01.259190
[DEBUNKED] No evidence for online claims Reform edited its Harrow candidate announcement after ‘backlash’ – Full Fact,https://fullfact.org/politics/harrow-reform-uk-candidate-headscarf-picture-edited/,fullfact.org,No evidence for online claims Reform edited its Harrow candidate announcement after ‘backlash’ – Ful,0.9,HIGH,True,FALSE - Debunked by fact-checkers,fullfact.org,factcheck,2026-04-29T03:24:01.821592
[DEBUNKED] Glasgow candidate’s ‘illustrative’ AI campaign videos don’t show real events – Full Fact,https://fullfact.org/politics/glasgow-southside-AI-generated-campaign-videos/,fullfact.org,Glasgow candidate’s ‘illustrative’ AI campaign videos don’t show real events – Full Fact,0.9,HIGH,True,FALSE - Debunked by fact-checkers,fullfact.org,factcheck,2026-04-29T03:24:02.207002
[DEBUNKED] Project 2025 Series Wins National Headliner Award - FactCheck.org,https://www.factcheck.org/2026/04/project-2025-series-wins-national-headliner-award/,www.factcheck.org,Project 2025 Series Wins National Headliner Award - FactCheck.org,0.9,HIGH,True,FALSE - Debunked by fact-checkers,www.factcheck.org,factcheck,2026-04-29T03:24:02.737609
[DEBUNKED] The Persistent Misleading Claim That Vaccines Aren’t Properly Tested for Safety - FactCheck.org,https://www.factcheck.org/2026/04/the-persistent-misleading-claim-that-vaccines-arent-properly-tested-for-safety/,www.factcheck.org,The Persistent Misleading Claim That Vaccines Aren’t Properly Tested for Safety - FactCheck.org,0.9,HIGH,True,FALSE - Debunked by fact-checkers,www.factcheck.org,factcheck,2026-04-29T03:24:02.885927
"border with Mexico decreased about 92%, and refugee admissions dropped by the same percentage",https://www.factcheck.org/2026/04/trumps-numbers-april-2026-update/,www.factcheck.org,"Trump&#039;s Numbers, April 2026 Update - FactCheck.org",0,LOW,False,,,factcheck,2026-04-29T03:24:03.154239
The trade deficit dropped 14% for the most recent 12 months,https://www.factcheck.org/2026/04/trumps-numbers-april-2026-update/,www.factcheck.org,"Trump&#039;s Numbers, April 2026 Update - FactCheck.org",0,LOW,False,,,factcheck,2026-04-29T03:24:03.250347
"7%, and oil imports declined almost 6",https://www.factcheck.org/2026/04/trumps-numbers-april-2026-update/,www.factcheck.org,"Trump&#039;s Numbers, April 2026 Update - FactCheck.org",0,LOW,False,,,factcheck,2026-04-29T03:24:03.357908
[DEBUNKED] An Attack Over ICE in the Massachusetts Democratic Senate Race - FactCheck.org,https://www.factcheck.org/2026/04/an-attack-over-ice-in-the-massachusetts-democratic-senate-race/,www.factcheck.org,An Attack Over ICE in the Massachusetts Democratic Senate Race - FactCheck.org,0.9,HIGH,True,FALSE - Debunked by fact-checkers,www.factcheck.org,factcheck,2026-04-29T03:24:04.973538
[DEBUNKED] Trump Fumbles the Facts with Farmers - FactCheck.org,https://www.factcheck.org/2026/04/trump-fumbles-the-facts-with-farmers/,www.factcheck.org,Trump Fumbles the Facts with Farmers - FactCheck.org,0.9,HIGH,True,FALSE - Debunked by fact-checkers,www.factcheck.org,factcheck,2026-04-29T03:24:06.214533
[DEBUNKED] Fact Check: White House Did NOT Display Australian Flag For King Charles Visit In 2026 -- Photo From 2019 | Lead Stories,https://leadstories.com/hoax-alert/2026/04/fact-check-white-house-did-not-display-australian-flag-king-charles-visit2026-photo2019.html,leadstories.com,Fact Check: White House Did NOT Display Australian Flag For King Charles Visit In 2026 -- Photo From,0.9,HIGH,True,FALSE - Debunked by fact-checkers,leadstories.com,factcheck,2026-04-29T03:24:06.386483
[DEBUNKED] Fact Check: Viral Post Does NOT Prove Woman Taking Bottles From 2026 White House Correspondents' Dinner Was Ukrainian Ambassador To U.S.  | Lead Stories,https://leadstories.com/hoax-alert/2026/04/fact-check-viral-post-does-not-prove-woman-taking-bottles-from-2026-white-house-correspondents-dinner-was-ukrainian-ambassador-to-us.html,leadstories.com,Fact Check: Viral Post Does NOT Prove Woman Taking Bottles From 2026 White House Correspondents' Din,0.9,HIGH,True,FALSE - Debunked by fact-checkers,leadstories.com,factcheck,2026-04-29T03:24:06.542894
[DEBUNKED] Fact Check: NO Evidence King Charles 'Dying of Kuru' After Decades of Child Meat Banquets -- Story Came From Prolific Fake News Site | Lead Stories,https://leadstories.com/hoax-alert/2026/04/fact-check-no-evidence-king-charles-dying-of-kuru-decades-child-meat-banquets.html,leadstories.com,Fact Check: NO Evidence King Charles 'Dying of Kuru' After Decades of Child Meat Banquets -- Story C,0.9,HIGH,True,FALSE - Debunked by fact-checkers,leadstories.com,factcheck,2026-04-29T03:24:06.708209
"[DEBUNKED] Fact Check: Kimmel Did NOT Offer A ""Sincere Apology To Everyone Regarding That Widow Joke"" On Monday's Episode Of 'Jimmy Kimmel Live!' | Lead Stories",https://leadstories.com/hoax-alert/2026/04/fact-check-kimmel-did-not-offer-a-sincere-apology-to-everyone-regarding-that-widow-joke-on-mondays-episode-of-jimmy-kimmel-live.html,leadstories.com,"Fact Check: Kimmel Did NOT Offer A ""Sincere Apology To Everyone Regarding That Widow Joke"" On Monday",0.9,HIGH,True,FALSE - Debunked by fact-checkers,leadstories.com,factcheck,2026-04-29T03:24:06.870139
[DEBUNKED] Fact Check: Iconic Raised-Fist Scene From Butler Assassination Attempt Is NOT Hidden Within An Abstract Digital Picture | Lead Stories,https://leadstories.com/hoax-alert/2026/04/fact-check-iconic-raised-fist-scene-from-butler-assassination-attempt-is-not-hidden-within-an-abstract-digital-picture.html,leadstories.com,Fact Check: Iconic Raised-Fist Scene From Butler Assassination Attempt Is NOT Hidden Within An Abstr,0.9,HIGH,True,FALSE - Debunked by fact-checkers,leadstories.com,factcheck,2026-04-29T03:24:07.033847
"[DEBUNKED] Fact Check: Clipped Video Shows Ilhan Omar Saying ""World War Eleven"" But Cuts Off Her Correction | Lead Stories",https://leadstories.com/hoax-alert/2026/04/fact-check-real-video-shows-ilhan-omar-saying-world-war-eleven-but-not-her-immediately-correcting-herself.html,leadstories.com,"Fact Check: Clipped Video Shows Ilhan Omar Saying ""World War Eleven"" But Cuts Off Her Correction | L",0.9,HIGH,True,FALSE - Debunked by fact-checkers,leadstories.com,factcheck,2026-04-29T03:24:07.191949
"[DEBUNKED] Fact Check: Video Does NOT Document Real $350,000 Lawsuit Against Crane Operator | Lead Stories",https://leadstories.com/hoax-alert/2026/04/fact-check-video-does-not-document-real-350000-dollar-lawsuit-against-crane-operator.html,leadstories.com,"Fact Check: Video Does NOT Document Real $350,000 Lawsuit Against Crane Operator | Lead Stories",0.9,HIGH,True,FALSE - Debunked by fact-checkers,leadstories.com,factcheck,2026-04-29T03:24:07.352595
[DEBUNKED] Fact Check: FAKE 'Senior Coordinating Producer For The White House Correspondents' Association Dinner' Claims Journalists Stole 147 Bottles Of Wine | Lead Stories,https://leadstories.com/hoax-alert/2026/04/fact-check-fake-senior-coordinating-producer-for-the-white-house-correspondents-association-dinner-claims-journalists-stole-147-bottles-of-wine.html,leadstories.com,Fact Check: FAKE 'Senior Coordinating Producer For The White House Correspondents' Association Dinne,0.9,HIGH,True,FALSE - Debunked by fact-checkers,leadstories.com,factcheck,2026-04-29T03:24:07.514247
[DEBUNKED] Fact Check: Posts Saying White House Correspondents' Dinner Shooting Suspect Cole Allen Worked Security For Sports Teams Are Not Real -- AI Spam From Vietnam | Lead Stories,https://leadstories.com/hoax-alert/2026/04/fact-check-posts-saying-cole-allen-worked-security-for-sports-teams-are-not-real.html,leadstories.com,Fact Check: Posts Saying White House Correspondents' Dinner Shooting Suspect Cole Allen Worked Secur,0.9,HIGH,True,FALSE - Debunked by fact-checkers,leadstories.com,factcheck,2026-04-29T03:24:07.688208
[DEBUNKED] Fact Check: Posts Saying White House Correspondents' Dinner Shooting Suspect Cole Allen Was A Driver For Dozens Of Celebrities Are Not Real -- AI Spam From Vietnam | Lead Stories,https://leadstories.com/hoax-alert/2026/04/fact-check-post-saying-cole-allen-worked-as-driver-for-celebs-not-real.html,leadstories.com,Fact Check: Posts Saying White House Correspondents' Dinner Shooting Suspect Cole Allen Was A Driver,0.9,HIGH,True,FALSE - Debunked by fact-checkers,leadstories.com,factcheck,2026-04-29T03:24:07.851266
[DEBUNKED] Fact Check: Press Did NOT Swipe Wine After Shooting At White House Correspondents' Association Dinner | Lead Stories,https://leadstories.com/hoax-alert/2026/04/fact-check-press-did-not-swipe-wine-after-shooting-attempt-at-white-house-correspondents-association-dinner.html,leadstories.com,Fact Check: Press Did NOT Swipe Wine After Shooting At White House Correspondents' Association Dinne,0.9,HIGH,True,FALSE - Debunked by fact-checkers,leadstories.com,factcheck,2026-04-29T03:24:08.009989
[DEBUNKED] Fact Check: White House Correspondents' Dinner Shooting Suspect Cole Allen Was NOT A Former Production Crew Member On Films Or Tours -- AI Spam From Vietnam | Lead Stories,https://leadstories.com/hoax-alert/2026/04/fact-check-whcd-shooting-suspect-coe-allen-not-former-production-crew-for-film-or-tour.html,leadstories.com,Fact Check: White House Correspondents' Dinner Shooting Suspect Cole Allen Was NOT A Former Producti,0.9,HIGH,True,FALSE - Debunked by fact-checkers,leadstories.com,factcheck,2026-04-29T03:24:08.170058
[DEBUNKED] Fact Check: Video Does NOT Discuss Real-Life Media Scandal Involving Supposed BBC Host 'James Whitmore' Mocking His Filipino Guest | Lead Stories,https://leadstories.com/hoax-alert/2026/04/fact-check-video-does-not-discuss-real-life-media-scandal-involving-supposed-bbc-host.html,leadstories.com,Fact Check: Video Does NOT Discuss Real-Life Media Scandal Involving Supposed BBC Host 'James Whitmo,0.9,HIGH,True,FALSE - Debunked by fact-checkers,leadstories.com,factcheck,2026-04-29T03:24:08.330027
[DEBUNKED] Fact Check: Trump Did NOT Post About The White House Correspondents' Dinner Shooting 2 Hours Before It Took Place | Lead Stories,https://leadstories.com/hoax-alert/2026/04/fact-check-trump-did-not-post-about-attempted-white-house-correspondents-dinner-shooting-2-hours-before-it-took-place.html,leadstories.com,Fact Check: Trump Did NOT Post About The White House Correspondents' Dinner Shooting 2 Hours Before ,0.9,HIGH,True,FALSE - Debunked by fact-checkers,leadstories.com,factcheck,2026-04-29T03:24:08.502037
[DEBUNKED] Fact Check: Video Showing A Judge Dancing On Her Desk Is NOT Real -- It's A Comedy Sketch | Lead Stories,https://leadstories.com/hoax-alert/2026/04/fact-check-video-shows-judge-dancing-on-her-desk-not-real.html,leadstories.com,Fact Check: Video Showing A Judge Dancing On Her Desk Is NOT Real -- It's A Comedy Sketch | Lead Sto,0.9,HIGH,True,FALSE - Debunked by fact-checkers,leadstories.com,factcheck,2026-04-29T03:24:08.664189
[DEBUNKED] False claims spread quickly after the White House Correspondents’ Dinner attack - Poynter,https://www.poynter.org/fact-checking/2026/false-claims-white-house-correspondents-dinner-shooting-misinformation/,www.poynter.org,False claims spread quickly after the White House Correspondents’ Dinner attack - Poynter,0.9,HIGH,True,FALSE - Debunked by fact-checkers,www.poynter.org,factcheck,2026-04-29T03:24:10.043218
[DEBUNKED] Viral Taifa Leo front page about former deputy president Gachagua and Rift Valley Kikuyus doctored - Africa Check,https://africacheck.org/fact-checks/meta-programme-fact-checks/viral-taifa-leo-front-page-about-former-deputy-president,africacheck.org,Viral Taifa Leo front page about former deputy president Gachagua and Rift Valley Kikuyus doctored -,0.9,HIGH,True,FALSE - Debunked by fact-checkers,africacheck.org,factcheck,2026-04-29T03:24:10.859858
"[DEBUNKED] No, popular Nigerian singer Davido didn’t send ‘stop the killing in Nigeria’ message to president while on tour - Africa Check",https://africacheck.org/fact-checks/meta-programme-fact-checks/no-popular-nigerian-singer-davido-didnt-send-stop-killing,africacheck.org,"No, popular Nigerian singer Davido didn’t send ‘stop the killing in Nigeria’ message to president wh",0.9,HIGH,True,FALSE - Debunked by fact-checkers,africacheck.org,factcheck,2026-04-29T03:24:11.352998
[DEBUNKED] Scam alert! Exposing fake Facebook pages using Nigerian celebrities’ photos to lure users to WhatsApp scams - Africa Check,https://africacheck.org/fact-checks/meta-programme-fact-checks/scam-alert-exposing-fake-facebook-pages-using-nigerian,africacheck.org,Scam alert! Exposing fake Facebook pages using Nigerian celebrities’ photos to lure users to WhatsAp,0.9,HIGH,True,FALSE - Debunked by fact-checkers,africacheck.org,factcheck,2026-04-29T03:24:11.619434
"[DEBUNKED] No, cabbage juice not an effective treatment for ulcers and gastritis – follow verified medical advice instead - Africa Check",https://africacheck.org/fact-checks/meta-programme-fact-checks/no-cabbage-juice-not-effective-treatment-ulcers-and,africacheck.org,"No, cabbage juice not an effective treatment for ulcers and gastritis – follow verified medical advi",0.9,HIGH,True,FALSE - Debunked by fact-checkers,africacheck.org,factcheck,2026-04-29T03:24:11.856599
[DEBUNKED] Manipulated image falsely depicts Kenya’s former health minister Susan Nakhumicha in miniskirt - Africa Check,https://africacheck.org/fact-checks/meta-programme-fact-checks/manipulated-image-falsely-depicts-kenyas-former-health,africacheck.org,Manipulated image falsely depicts Kenya’s former health minister Susan Nakhumicha in miniskirt - Afr,0.9,HIGH,True,FALSE - Debunked by fact-checkers,africacheck.org,factcheck,2026-04-29T03:24:14.284531
"[DEBUNKED] No, Uganda’s NBS TV did not air ‘Man kills himself and runs away’ broadcast – fake viral screengrab - Africa Check",https://africacheck.org/fact-checks/meta-programme-fact-checks/no-ugandas-nbs-tv-did-not-air-man-kills-himself-and-runs,africacheck.org,"No, Uganda’s NBS TV did not air ‘Man kills himself and runs away’ broadcast – fake viral screengrab ",0.9,HIGH,True,FALSE - Debunked by fact-checkers,africacheck.org,factcheck,2026-04-29T03:24:14.488972
[DEBUNKED] No evidence Bungoma county residents burned down Kenya ruling party office - Africa Check,https://africacheck.org/fact-checks/meta-programme-fact-checks/no-evidence-bungoma-county-residents-burned-down-kenya,africacheck.org,No evidence Bungoma county residents burned down Kenya ruling party office - Africa Check,0.9,HIGH,True,FALSE - Debunked by fact-checkers,africacheck.org,factcheck,2026-04-29T03:24:14.761435
"Eine Umsiedlung ins Ausland hängt laut Umweltministerium davon ab, dass andere Staaten die Tiere aufnehmen und entspr",https://www.spiegel.de/panorama/pablo-escobar-indischer-milliardaerssohn-will-80-kokain-hippos-aus-kolumbien-aufnehmen-a-0375a206-6d7d-40d0-a84d-5856543c50a5#ref=rss,www.spiegel.de,Pablo Escobar: Indischer Milliardärssohn will 80 »Kokain-Hippos« aus Kolumbien aufnehmen - DER SPIEG,0,LOW,False,,,mainstream,2026-04-29T03:24:26.722725
"Und inzwischen produziert die Rüstungsindustrie des angegriffenen Landes nach Angaben von Präsident Wolodymyr Selenskyj teilweise mehr, als die eigenen Streitkräfte an Waffen benötigen",https://www.spiegel.de/ausland/ukraine-wolodymyr-selenskyj-sieht-chancen-fuer-ruestungsexporte-wladimir-putin-kritisiert-kyjiw-fuer-kriegsfuehrung-a-a6894dd1-0844-4ddd-b1b7-66eaa8feaebe#ref=rss,www.spiegel.de,"Ukraine: Wolodymyr Selenskyj sieht Chancen für Rüstungsexporte, Wladimir Putin kritisiert Kyjiw für ",0,LOW,False,,,mainstream,2026-04-29T03:24:30.352499
"»Aktuell verfügen wir über Produktionsbereiche mit 50 Prozent Überkapazität«, sagte Selenskyj in seiner abendlichen Videobotschaft",https://www.spiegel.de/ausland/ukraine-wolodymyr-selenskyj-sieht-chancen-fuer-ruestungsexporte-wladimir-putin-kritisiert-kyjiw-fuer-kriegsfuehrung-a-a6894dd1-0844-4ddd-b1b7-66eaa8feaebe#ref=rss,www.spiegel.de,"Ukraine: Wolodymyr Selenskyj sieht Chancen für Rüstungsexporte, Wladimir Putin kritisiert Kyjiw für ",0,LOW,False,,,mainstream,2026-04-29T03:24:30.464748
Alle Stars glänzten in der Pariser Nacht,https://www.spiegel.de/sport/fussball/champions-league-pressestimmen-zum-4-5-des-fc-bayern-muenchen-bei-paris-saint-germain-a-ee19424b-5bfc-49b9-9a59-24b1df7aa791#ref=rss,www.spiegel.de,Champions League: Pressestimmen zum 4:5 des FC Bayern München bei Paris Saint-Germain - DER SPIEGEL,0.1,LOW,False,,,mainstream,2026-04-29T03:24:31.460814
« Mehr zum Thema Bayern-Trainer Kompany auf der PSG-Tribüne: »Das macht keine,https://www.spiegel.de/sport/fussball/champions-league-pressestimmen-zum-4-5-des-fc-bayern-muenchen-bei-paris-saint-germain-a-ee19424b-5bfc-49b9-9a59-24b1df7aa791#ref=rss,www.spiegel.de,Champions League: Pressestimmen zum 4:5 des FC Bayern München bei Paris Saint-Germain - DER SPIEGEL,0.1,LOW,False,,,mainstream,2026-04-29T03:24:31.559696
"Laut Kompany hätte es den Eckball vor dem Tor zum 2:1 durch João Neves nicht geben dürfen, zude",https://www.spiegel.de/sport/fussball/fc-bayern-muenchen-vincent-kompany-und-der-unfreiwillige-tribuenenplatz-das-macht-keinen-spass-a-662d5803-25ec-45cc-98b0-521ba0f1436d#ref=rss,www.spiegel.de,FC Bayern München: Vincent Kompany und der unfreiwillige Tribünenplatz – »Das macht keinen Spaß« - D,0,LOW,False,,,mainstream,2026-04-29T03:24:32.568524
"Zum Login SPIEGEL plus Nur für Neukunden € 1,– für 4 Wochen danach € 5,99 pro Woche Freier Zugriff auf alle S+-Artikel auf SPIEGEL",https://www.spiegel.de/sport/fussball/bayerns-spieler-in-der-einzelkritik-diaz-und-olise-stark-abwehr-nicht-finaltauglich-a-779e3354-d87a-404f-90ac-10e034ea3f3a#ref=rss,www.spiegel.de,"Bayerns Spieler in der Einzelkritik: Diaz und Olise stark, Abwehr nicht finaltauglich - DER SPIEGEL",0.1,LOW,False,,,mainstream,2026-04-29T03:24:33.440288
"E-Paper (PDF), Digital-Archiv und S+-Newsletter Jederzeit kündigen Jetzt abonnieren SPIEGEL plus 52 Wochen 25 % sparen € 4,49 pro Woche für 52 Wochen danach € 5,99 pro Woche Freier Zugriff auf alle S+-Artikel auf SPIEGEL",https://www.spiegel.de/sport/fussball/bayerns-spieler-in-der-einzelkritik-diaz-und-olise-stark-abwehr-nicht-finaltauglich-a-779e3354-d87a-404f-90ac-10e034ea3f3a#ref=rss,www.spiegel.de,"Bayerns Spieler in der Einzelkritik: Diaz und Olise stark, Abwehr nicht finaltauglich - DER SPIEGEL",0.1,LOW,False,,,mainstream,2026-04-29T03:24:33.554480
"Zum Login SPIEGEL plus Nur für Neukunden € 1,– für 4 Wochen danach € 5,99 pro Woche Freier Zugriff auf alle S+-Artikel auf SPIEGEL",https://www.spiegel.de/sport/fussball/champions-league-paris-saint-germain-schlaegt-den-fc-bayern-muenchen-in-einem-spektakel-a-68ab5d97-cf65-4911-acef-8d8fe1f7078a#ref=rss,www.spiegel.de,Champions League: Paris Saint-Germain schlägt den FC Bayern München in einem Spektakel - DER SPIEGEL,0.1,LOW,False,,,mainstream,2026-04-29T03:24:35.028199
