claim,source_url,source_domain,article_title,risk_score,risk_category,has_factcheck,factcheck_rating,factcheck_source,source_type,checked_at
[DEBUNKED] Fifa-WM: Bild von Deutschland-Fan als Hitler ist fake,https://correctiv.org/faktencheck/2026/06/15/fifa-wm-bild-von-deutschland-fan-als-hitler-ist-nicht-echt/,correctiv.org,Fifa-WM: Bild von Deutschland-Fan als Hitler ist fake,0.9,HIGH,True,FALSE - Debunked by fact-checkers,correctiv.org,factcheck,2026-06-16T04:21:34.359110
Juni 2026 Auf dem Reichstag wehen immer Deutschlandflaggen,https://correctiv.org/faktencheck/hintergrund/2026/06/12/weshalb-eine-deutschlandfahne-die-bundestagspolizei-auf-den-plan-rief/,correctiv.org,Weshalb eine Deutschlandfahne die Bundestagspolizei auf den Plan rief,0.1,LOW,False,,,factcheck,2026-06-16T04:21:35.520113
"Das heißt aber nicht, dass sie jeder dort schwenken darf",https://correctiv.org/faktencheck/hintergrund/2026/06/12/weshalb-eine-deutschlandfahne-die-bundestagspolizei-auf-den-plan-rief/,correctiv.org,Weshalb eine Deutschlandfahne die Bundestagspolizei auf den Plan rief,0,LOW,False,,,factcheck,2026-06-16T04:21:35.734982
Auf Nachfragen zu den aktuellen Ermittlungen äußerte sich die Bundestagsverwaltung nicht – man gebe grundsätzlich keine Auskünfte über Ermittlungen,https://correctiv.org/faktencheck/hintergrund/2026/06/12/weshalb-eine-deutschlandfahne-die-bundestagspolizei-auf-den-plan-rief/,correctiv.org,Weshalb eine Deutschlandfahne die Bundestagspolizei auf den Plan rief,0.1,LOW,False,,,factcheck,2026-06-16T04:21:35.943357
[DEBUNKED] Szene von in Einkaufswagen „eingesperrtem“ Polizisten ist gespielt,https://correctiv.org/faktencheck/2026/06/12/szene-von-in-einkaufswagen-eingesperrten-polizisten-war-gespielt/,correctiv.org,Szene von in Einkaufswagen „eingesperrtem“ Polizisten ist gespielt,0.9,HIGH,True,FALSE - Debunked by fact-checkers,correctiv.org,factcheck,2026-06-16T04:21:37.050060
[DEBUNKED] KI-Fake: US-Botschaft in Kiew wurde nicht evakuiert,https://correctiv.org/faktencheck/2026/06/12/usa-botschaft-in-kiew-wurde-nicht-evakuiert-grok-und-community-notes-liegen-bei-ki-fake-falsch/,correctiv.org,KI-Fake: US-Botschaft in Kiew wurde nicht evakuiert,0.9,HIGH,True,FALSE - Debunked by fact-checkers,correctiv.org,factcheck,2026-06-16T04:21:38.123736
[DEBUNKED] Deepfakes mit Christian Sievers wochenlang auf Tiktok online,https://correctiv.org/faktencheck/2026/06/12/deepfakes-mit-zdf-moderator-christian-sievers-weiter-bei-tiktok-online/,correctiv.org,Deepfakes mit Christian Sievers wochenlang auf Tiktok online,0.9,HIGH,True,FALSE - Debunked by fact-checkers,correctiv.org,factcheck,2026-06-16T04:21:39.231610
[DEBUNKED] Einstweilige Verfügung gegen DIE WELT: Gericht untersagt Falschbehauptung - correctiv.org,https://correctiv.org/in-eigener-sache/2026/06/15/einstweilige-verfuegung-gegen-die-welt-gericht-untersagt-falschbehauptung/,correctiv.org,Einstweilige Verfügung gegen DIE WELT: Gericht untersagt Falschbehauptung - correctiv.org,0.9,HIGH,True,FALSE - Debunked by fact-checkers,correctiv.org,factcheck,2026-06-16T04:21:40.155451
[DEBUNKED] Die Perfekte Frau: Wie Autokraten ein Ideal erschaffen - correctiv.org,https://correctiv.org/aktuelles/international/2026/06/12/die-perfekte-frau-wie-autokraten-ein-ideal-erschaffen/,correctiv.org,Die Perfekte Frau: Wie Autokraten ein Ideal erschaffen - correctiv.org,0.9,HIGH,True,FALSE - Debunked by fact-checkers,correctiv.org,factcheck,2026-06-16T04:21:41.230623
"Immer häufiger stehen zwischen journalistischen Inhalten und ihrem Publikum große Plattformen, Technologieunternehmen und KI-Systeme",https://correctiv.org/in-eigener-sache/2026/06/12/correctiv-fragt-sie/,correctiv.org,Die Zukunft von CORRECTIV: Wir fragen Sie - correctiv.org,0.1,LOW,False,,,factcheck,2026-06-16T04:21:42.213597
Alle Antworten werden anonym und vertraulich behande,https://correctiv.org/in-eigener-sache/2026/06/12/correctiv-fragt-sie/,correctiv.org,Die Zukunft von CORRECTIV: Wir fragen Sie - correctiv.org,0.1,LOW,False,,,factcheck,2026-06-16T04:21:42.438198
"Schweiz Pension um jeden Preis Acht Schweizer Pensionskassen investieren rund 638 Millionen Franken in die Rüstungsindustrie, darunter Atomwaffen, Streubomben oder automatisiertes Töten",https://correctiv.org/aktuelles/sicherheit-und-verteidigung/2026/06/12/pension-um-jeden-preis-pensionskasse-investitionen-waffen/,correctiv.org,Pension um jeden Preis,0,LOW,False,,,factcheck,2026-06-16T04:21:43.721117
"Selbst mit einem Jahreseinkommen von 10 Millionen bräuchte eine Person 100’000 Jahre, um auf diesen Betrag zu kommen",https://correctiv.org/aktuelles/sicherheit-und-verteidigung/2026/06/12/pension-um-jeden-preis-pensionskasse-investitionen-waffen/,correctiv.org,Pension um jeden Preis,0,LOW,False,,,factcheck,2026-06-16T04:21:43.935488
"Schweiz, dem Konsumentenmagazin Saldo und dem WAV Recherchekollektiv, dass acht Schweizer Pensionskassen rund 638 Millionen Franken in die Rüstungsindustrie investieren",https://correctiv.org/aktuelles/sicherheit-und-verteidigung/2026/06/12/pension-um-jeden-preis-pensionskasse-investitionen-waffen/,correctiv.org,Pension um jeden Preis,0,LOW,False,,,factcheck,2026-06-16T04:21:44.135527
[DEBUNKED] Neuer Höchststand bei Schülern mit sonderpädagogischer Förderung - correctiv.org,https://correctiv.org/aktuelles/bildung/2026/06/12/neuer-hoechststand-bei-foerderschuelern/,correctiv.org,Neuer Höchststand bei Schülern mit sonderpädagogischer Förderung - correctiv.org,0.9,HIGH,True,FALSE - Debunked by fact-checkers,correctiv.org,factcheck,2026-06-16T04:21:45.241787
"Deshalb sieht das bislang gültige Gebäudeenergiegesetz der Ampelkoalition vor, dass neu eingebaute Heizungen künftig zu mindestens 65 Prozent mit erneuerbaren Energien betrieben werden müssen",https://correctiv.org/aktuelles/klimawandel/2026/06/10/grossstaedte-warnen-vor-reiches-heizungsgesetz/,correctiv.org,Großstädte warnen vor Reiches „Heizungsgesetz“,0,LOW,False,,,factcheck,2026-06-16T04:21:47.323009
[DEBUNKED] Von der rechten Denkfabrik zu Katherina Reiche,https://correctiv.org/aktuelles/parteien/2026/06/10/von-der-rechten-denkfabrik-zu-katherina-reiche/,correctiv.org,Von der rechten Denkfabrik zu Katherina Reiche,0.9,HIGH,True,FALSE - Debunked by fact-checkers,correctiv.org,factcheck,2026-06-16T04:21:48.431080
[DEBUNKED] Salon5: Jugendliche entlarven Desinformation auf TikTok - correctiv.org,https://correctiv.org/in-eigener-sache/2026/06/10/salon5-jugendliche-entlarven-desinformation-auf-tiktok/,correctiv.org,Salon5: Jugendliche entlarven Desinformation auf TikTok - correctiv.org,0.9,HIGH,True,FALSE - Debunked by fact-checkers,correctiv.org,factcheck,2026-06-16T04:21:49.205334
[DEBUNKED] Deutschland will Kampfjet ohne Frankreich bauen,https://correctiv.org/aktuelles/bundeswehr/2026/06/09/deutschland-will-kampfjet-ohne-frankreich-bauen/,correctiv.org,Deutschland will Kampfjet ohne Frankreich bauen,0.9,HIGH,True,FALSE - Debunked by fact-checkers,correctiv.org,factcheck,2026-06-16T04:21:50.129141
[DEBUNKED] Fahrverbot für Senioren ab 70? Die Wahrheit über das Fahrgesetz 2026!,https://www.mimikama.org/fahrverbot-fuer-senioren-ab-70-fahrgesetz-2026/,www.mimikama.org,Fahrverbot für Senioren ab 70? Die Wahrheit über das Fahrgesetz 2026!,0.9,HIGH,True,FALSE - Debunked by fact-checkers,www.mimikama.org,factcheck,2026-06-16T04:21:50.357083
[DEBUNKED] Vorsicht: Fake-Video aus der Ukraine entpuppt sich als Filmset!,https://www.mimikama.org/beweist-ein-filmset-video-fake-aufnahmen-aus-der-ukraine/,www.mimikama.org,Vorsicht: Fake-Video aus der Ukraine entpuppt sich als Filmset!,0.9,HIGH,True,FALSE - Debunked by fact-checkers,www.mimikama.org,factcheck,2026-06-16T04:21:50.597004
[DEBUNKED] Deutschlandfahne Aufreger: Altes Foto zur WM 2026 erneut falsch geteilt,https://www.mimikama.org/altes-foto-deutschlandfahne-kursiert-wieder/,www.mimikama.org,Deutschlandfahne Aufreger: Altes Foto zur WM 2026 erneut falsch geteilt,0.9,HIGH,True,FALSE - Debunked by fact-checkers,www.mimikama.org,factcheck,2026-06-16T04:21:50.831885
[DEBUNKED] Presseinformation: Mimikama startet neues soziales Netzwerk für digitale AufklärungPresseinformation: Mimikama startet neues soziales Netzwerk 2026,https://www.mimikama.org/presseinformatio-neues-soziales-netzwerk/,www.mimikama.org,Presseinformation: Mimikama startet neues soziales Netzwerk für digitale AufklärungPresseinformation,0.9,HIGH,True,FALSE - Debunked by fact-checkers,www.mimikama.org,factcheck,2026-06-16T04:21:51.073237
[DEBUNKED] Wird Portugal Weltmeister 2026?,https://www.mimikama.org/wird-portugal-weltmeister-2026-faktencheck/,www.mimikama.org,Wird Portugal Weltmeister 2026?,0.9,HIGH,True,FALSE - Debunked by fact-checkers,www.mimikama.org,factcheck,2026-06-16T04:21:51.314761
[DEBUNKED] Shakira Double bei WM 2026? Fakten statt Gerüchte klären auf!,https://www.mimikama.org/shakira-bei-wm-2026-durch-double-ersetzt/,www.mimikama.org,Shakira Double bei WM 2026? Fakten statt Gerüchte klären auf!,0.9,HIGH,True,FALSE - Debunked by fact-checkers,www.mimikama.org,factcheck,2026-06-16T04:21:51.555824
"Mit dabei war laut Medienberichten auch Norbert Emmerich, AfD-Politiker und stellvertretender Bürgermeister von Gelsenkirchen",https://www.mimikama.org/afd-hat-migranten-in-gelsenkirchen-putzen-lassen/,www.mimikama.org,AfD lässt Migranten in Gelsenkirchen putzen – Was steckt dahinter?,0,LOW,False,,,factcheck,2026-06-16T04:21:52.024482
Nur: Ein Besen macht aus einer Inszenierung noch keine Amtshandlung,https://www.mimikama.org/afd-hat-migranten-in-gelsenkirchen-putzen-lassen/,www.mimikama.org,AfD lässt Migranten in Gelsenkirchen putzen – Was steckt dahinter?,0.1,LOW,False,,,factcheck,2026-06-16T04:21:52.228242
Und eine ernste Musikspur ersetzt keine saubere Einordnung,https://www.mimikama.org/afd-hat-migranten-in-gelsenkirchen-putzen-lassen/,www.mimikama.org,AfD lässt Migranten in Gelsenkirchen putzen – Was steckt dahinter?,0.1,LOW,False,,,factcheck,2026-06-16T04:21:52.427772
[DEBUNKED] Friedhofs-Videos aus Hamburg: Echte oder gefälschte Sensation?,https://www.mimikama.org/sind-die-friedhofs-videos-aus-hamburg-echt/,www.mimikama.org,Friedhofs-Videos aus Hamburg: Echte oder gefälschte Sensation?,0.9,HIGH,True,FALSE - Debunked by fact-checkers,www.mimikama.org,factcheck,2026-06-16T04:21:52.660496
[DEBUNKED] Faktencheck: Wurde Kristen Welker nach Trumps Interview entlassen?,https://www.mimikama.org/trump-abbruch-nach-beweisfrage-moderatorin-entlassen/,www.mimikama.org,Faktencheck: Wurde Kristen Welker nach Trumps Interview entlassen?,0.9,HIGH,True,FALSE - Debunked by fact-checkers,www.mimikama.org,factcheck,2026-06-16T04:21:52.915311
[DEBUNKED] Ist das Selenskyj-Hitler-Vergleichsbild echt?,https://www.mimikama.org/ist-das-selenskyj-hitler-vergleichsbild-echt/,www.mimikama.org,Ist das Selenskyj-Hitler-Vergleichsbild echt?,0.9,HIGH,True,FALSE - Debunked by fact-checkers,www.mimikama.org,factcheck,2026-06-16T04:21:53.158767
[DEBUNKED] Ist das Klingelschild mit „Meier“ und anderen Namen echt?,https://www.mimikama.org/klingelschild-meier-andere-namen/,www.mimikama.org,Ist das Klingelschild mit „Meier“ und anderen Namen echt?,0.9,HIGH,True,FALSE - Debunked by fact-checkers,www.mimikama.org,factcheck,2026-06-16T04:21:53.397298
[DEBUNKED] Das neue soziale Netzwerk für digitale Aufklärung,https://www.mimikama.org/das-soziale-netzwerk-fuer-digitale-aufklaerung/,www.mimikama.org,Das neue soziale Netzwerk für digitale Aufklärung,0.9,HIGH,True,FALSE - Debunked by fact-checkers,www.mimikama.org,factcheck,2026-06-16T04:21:53.671439
[DEBUNKED] Beweist ein TikTok-Video Chemtrails im Regen?,https://www.mimikama.org/video-chemtrails-regen/,www.mimikama.org,Beweist ein TikTok-Video Chemtrails im Regen?,0.9,HIGH,True,FALSE - Debunked by fact-checkers,www.mimikama.org,factcheck,2026-06-16T04:21:54.261410
"Der Grund ist laut Behörden eine Sicherheitsprüfung im Einzelfall, Details bleiben offen",https://www.mimikama.org/darf-ein-wm-schiedsrichter-nicht-in-die-usa/,www.mimikama.org,WM-Schiedsrichter: Einreise in die USA verweigert – Hintergründe klären,0,LOW,False,,,factcheck,2026-06-16T04:21:54.687285
"Auch die FIFA bestätigte, dass Artan nicht am Turnier teilnehmen kann",https://www.mimikama.org/darf-ein-wm-schiedsrichter-nicht-in-die-usa/,www.mimikama.org,WM-Schiedsrichter: Einreise in die USA verweigert – Hintergründe klären,0.1,LOW,False,,,factcheck,2026-06-16T04:21:54.885353
Ein Visum garantiert keine Einreise Nach Angaben aus Somalia verfügte Artan über ein gültiges US-Visum,https://www.mimikama.org/darf-ein-wm-schiedsrichter-nicht-in-die-usa/,www.mimikama.org,WM-Schiedsrichter: Einreise in die USA verweigert – Hintergründe klären,0.1,LOW,False,,,factcheck,2026-06-16T04:21:55.092256
[DEBUNKED] Hat Anthropic mit „Fable 5“ das umstrittene KI-Modell „Mythos“ in Claude freigegeben?,https://www.mimikama.org/anthropic-fable-5-ki-modell-mythos-claude/,www.mimikama.org,Hat Anthropic mit „Fable 5“ das umstrittene KI-Modell „Mythos“ in Claude freigegeben?,0.9,HIGH,True,FALSE - Debunked by fact-checkers,www.mimikama.org,factcheck,2026-06-16T04:21:55.316907
[DEBUNKED] Volksverpetzer gewinnt gegen die Ostdeutsche Allgemeine vor Gericht - Volksverpetzer,https://www.volksverpetzer.de/aktuelles/volksverpetzer-gewinnt-ostdeutsche-allgemeine/,www.volksverpetzer.de,Volksverpetzer gewinnt gegen die Ostdeutsche Allgemeine vor Gericht - Volksverpetzer,0.9,HIGH,True,FALSE - Debunked by fact-checkers,www.volksverpetzer.de,factcheck,2026-06-16T04:21:56.130080
"“ Warte mal - die AfD, das waren doch die, die überall eine „Islamisierung“ wittern, für die es überhaupt keine Faktengrundlage gibt",https://www.volksverpetzer.de/analyse/afd-unterstuetzt-terroristen/,www.volksverpetzer.de,‚Selbst anpacken‘: AfD unterstützt Terroristen in Deutschland? - Volksverpetzer,0.1,LOW,False,,,factcheck,2026-06-16T04:21:57.126135
Auch kandidiert er laut seinem Instagram-Profil für die „Generation Deutschland“ Baden-Württemberg,https://www.volksverpetzer.de/analyse/afd-unterstuetzt-terroristen/,www.volksverpetzer.de,‚Selbst anpacken‘: AfD unterstützt Terroristen in Deutschland? - Volksverpetzer,0,LOW,False,,,factcheck,2026-06-16T04:21:57.347728
"OAZ-Chefredakteur mit „langem Bart“ Vor ein paar Wochen berichtete er hinter vorgehaltener Hand über seine Erfahrungen dort als Redakteur: „Die Wahrheit ist: Der wahre Chefredakteur, und das weiß auch jeder im Haus, trägt einen langen Bart",https://www.volksverpetzer.de/aktuelles/100-tage-oaz-fake-redaktion-autoren-geklaut/,www.volksverpetzer.de,Fake-Redaktion der „Ostdeutschen Allgemeinen“: Fast 400 Autoren „geklaut“ - Volksverpetzer,0,LOW,False,,,factcheck,2026-06-16T04:21:58.264717
"Friedrich würde nie, nie, nie einen selbstbewussten, eigenständigen und unabhängigen Chefredakteur akzeptieren",https://www.volksverpetzer.de/aktuelles/100-tage-oaz-fake-redaktion-autoren-geklaut/,www.volksverpetzer.de,Fake-Redaktion der „Ostdeutschen Allgemeinen“: Fast 400 Autoren „geklaut“ - Volksverpetzer,0.1,LOW,False,,,factcheck,2026-06-16T04:21:58.467086
Und die alle hatten bis auf wenige Ausnahmen eines miteinander gemein: Sie hatten noch nicht eine Zeile für die OAZ geschrieben,https://www.volksverpetzer.de/aktuelles/100-tage-oaz-fake-redaktion-autoren-geklaut/,www.volksverpetzer.de,Fake-Redaktion der „Ostdeutschen Allgemeinen“: Fast 400 Autoren „geklaut“ - Volksverpetzer,0.1,LOW,False,,,factcheck,2026-06-16T04:21:58.691469
"Diesen Monat schauen wir auf eine Millionenspende an die AfD, die die rechtsextreme Partei laut Gericht nicht zurückbekommt",https://www.volksverpetzer.de/serie/urteile-mai-2026-afd-spende/,www.volksverpetzer.de,Urteile Mai 2026: Die AfD spendiert dem Staat unfreiwillig Millionen - Volksverpetzer,0,LOW,False,,,factcheck,2026-06-16T04:21:59.713956
"2,35 Millionen Euro an - vermeintlicher Spender: der Österreicher Gerhard Dingler - ein früherer Regionalpolitiker der FPÖ",https://www.volksverpetzer.de/serie/urteile-mai-2026-afd-spende/,www.volksverpetzer.de,Urteile Mai 2026: Die AfD spendiert dem Staat unfreiwillig Millionen - Volksverpetzer,0,LOW,False,,,factcheck,2026-06-16T04:21:59.914096
"Geldwerte Leistungen, auch Werbemaßnahmen ab einer bestimmten Größenordnung, sind laut Verwaltungsgericht Berlin Spenden",https://www.volksverpetzer.de/serie/urteile-mai-2026-afd-spende/,www.volksverpetzer.de,Urteile Mai 2026: Die AfD spendiert dem Staat unfreiwillig Millionen - Volksverpetzer,0,LOW,False,,,factcheck,2026-06-16T04:22:00.112163
"Man sieht, dass bis auf den letzten Stuhl alle Plätze belegt sind",https://www.volksverpetzer.de/aktuelles/lohnt-kaempfen-merz-keine-antwort/,www.volksverpetzer.de,Wofür lohnt es sich zu kämpfen? Warum Merz keine Antwort auf diese Frage hat - Volksverpetzer,0.1,LOW,False,,,factcheck,2026-06-16T04:22:01.145284
Er räumt Ängste und Vorwürfe aus und geht sachlich auf alle Entgegnungen ein,https://www.volksverpetzer.de/aktuelles/lohnt-kaempfen-merz-keine-antwort/,www.volksverpetzer.de,Wofür lohnt es sich zu kämpfen? Warum Merz keine Antwort auf diese Frage hat - Volksverpetzer,0.1,LOW,False,,,factcheck,2026-06-16T04:22:01.345761
"Die ehemalige Menschenrechtsbeauftragte der CDU Erika Steinbach facht den Hass auf Walter Lübcke über ihre Social-Media-Kanäle immer wieder an, sodass der CDU-Politiker Peter Tauber ihr eine direkte Mitschuld an dem Mord zuspricht",https://www.volksverpetzer.de/aktuelles/lohnt-kaempfen-merz-keine-antwort/,www.volksverpetzer.de,Wofür lohnt es sich zu kämpfen? Warum Merz keine Antwort auf diese Frage hat - Volksverpetzer,0.1,LOW,False,,,factcheck,2026-06-16T04:22:01.460752
"[DEBUNKED] Ich habe den WELT-Artikel von Kristina Schröder gelesen, damit ihr es nicht müsst - Volksverpetzer",https://www.volksverpetzer.de/faktencheck/welt-schroeder-klima-fake/,www.volksverpetzer.de,"Ich habe den WELT-Artikel von Kristina Schröder gelesen, damit ihr es nicht müsst - Volksverpetzer",0.9,HIGH,True,FALSE - Debunked by fact-checkers,www.volksverpetzer.de,factcheck,2026-06-16T04:22:02.354583
"Das ließ für die OAZ, als Online-Angebot mit wöchentlicher Printausgabe immer noch weit kleiner als ursprünglich geplant, einiges erwarten und befürchten",https://www.volksverpetzer.de/aktuelles/holger-friedrich-kongress-afd/,www.volksverpetzer.de,Verleger Holger Friedrich spricht bei „Demokratiekongress“ der AfD - Volksverpetzer,0.1,LOW,False,,,factcheck,2026-06-16T04:22:03.362580
"Vorahnungen wie Kreml-Propaganda und China-Connection, ganz generell eine Sympathie für Autokraten, haben sich nun auch dort bestätigt",https://www.volksverpetzer.de/aktuelles/holger-friedrich-kongress-afd/,www.volksverpetzer.de,Verleger Holger Friedrich spricht bei „Demokratiekongress“ der AfD - Volksverpetzer,0,LOW,False,,,factcheck,2026-06-16T04:22:03.562164
"Der tschechische Schriftsteller Jaroslav Rudiš, das als Exkurs an dieser Stelle, schrieb über Okamura in der FAZ, er „hetzt gegen alles, was nicht ,urtschechisch‘ ist, was auch immer das heißen mag",https://www.volksverpetzer.de/aktuelles/holger-friedrich-kongress-afd/,www.volksverpetzer.de,Verleger Holger Friedrich spricht bei „Demokratiekongress“ der AfD - Volksverpetzer,0.1,LOW,False,,,factcheck,2026-06-16T04:22:03.784944
"Laut der&nbsp;Mobilen Beratung gegen Rechtsextremismus in Thüringen&nbsp;ist Frank Haußner eine zentrale Mobilisierungsfigur des Netzwerks, das Verbindungen in die Reichsbürger- und Neonazi-Szene unterhält und zugleich enge Bezüge zur AfD pflegt",https://www.volksverpetzer.de/analyse/dunkle-maechte-afd-windkraft/,www.volksverpetzer.de,&quot;Dunkle Mächte&quot;: Das ECHTE Motiv hinter dem AfD-Windkraft-Protest - Volksverpetzer,0,LOW,False,,,factcheck,2026-06-16T04:22:04.805150
Der daraus jährlich erzeugte Strom könnte nach Angaben des Unternehmens den Bedarf von etwa 16,https://www.volksverpetzer.de/analyse/dunkle-maechte-afd-windkraft/,www.volksverpetzer.de,&quot;Dunkle Mächte&quot;: Das ECHTE Motiv hinter dem AfD-Windkraft-Protest - Volksverpetzer,0,LOW,False,,,factcheck,2026-06-16T04:22:05.003898
"Mit einem motivierenden Aufruf an alle Politiker:innen, Aktivist:innen, Wähler:innen und Entscheider:innen, jetzt richtig anzupacken",https://www.volksverpetzer.de/faktencheck/klimaschutz-wirkt-rechte-luegen-ipcc/,www.volksverpetzer.de,"Forscher bestätigen, dass Klimaschutz wirkt – deswegen wollen Rechte ihn jetzt abschaffen?! - Volksv",0.1,LOW,False,,,factcheck,2026-06-16T04:22:06.007435
"[DEBUNKED] UFC fighter Josh Hokit called Michelle Obama 'a man,' reviving baseless conspiracy theory | Snopes.com",https://www.snopes.com/news/2026/06/15/ufc-michelle-obama-man-trans/,www.snopes.com,"UFC fighter Josh Hokit called Michelle Obama 'a man,' reviving baseless conspiracy theory | Snopes.c",0.9,HIGH,True,FALSE - Debunked by fact-checkers,www.snopes.com,factcheck,2026-06-16T04:22:06.245043
[DEBUNKED] 'Tens of thousands' of mail-in ballots for Spencer Pratt weren't rejected in LA. Here's the proof | Snopes.com,https://www.snopes.com/fact-check/spencer-pratt-la-ballots-rejected/,www.snopes.com,'Tens of thousands' of mail-in ballots for Spencer Pratt weren't rejected in LA. Here's the proof | ,0.9,HIGH,True,FALSE - Debunked by fact-checkers,www.snopes.com,factcheck,2026-06-16T04:22:06.491818
[DEBUNKED] DOGE whistleblower's brake line was cut after Musk posted about him on X: Timeline of what we know | Snopes.com,https://www.snopes.com/fact-check/musk-doge-whistleblower-brakes-cut/,www.snopes.com,DOGE whistleblower's brake line was cut after Musk posted about him on X: Timeline of what we know |,0.9,HIGH,True,FALSE - Debunked by fact-checkers,www.snopes.com,factcheck,2026-06-16T04:22:06.724439
[DEBUNKED] Did Trump call Pope Leo XIV an 'insult to Jesus'? | Snopes.com,https://www.snopes.com/fact-check/trump-pope-insult-jesus/,www.snopes.com,Did Trump call Pope Leo XIV an 'insult to Jesus'? | Snopes.com,0.9,HIGH,True,FALSE - Debunked by fact-checkers,www.snopes.com,factcheck,2026-06-16T04:22:06.795304
"[DEBUNKED] US hospitals didn't get secret DOD letter suspending pharma contracts, contrary to claims | Snopes.com",https://www.snopes.com/fact-check/hospitals-dod-letter-pharma/,www.snopes.com,"US hospitals didn't get secret DOD letter suspending pharma contracts, contrary to claims | Snopes.c",0.9,HIGH,True,FALSE - Debunked by fact-checkers,www.snopes.com,factcheck,2026-06-16T04:22:07.032357
[DEBUNKED] 20 rumors about McDonald's we've unwrapped | Snopes.com,https://www.snopes.com/collections/mcdonalds-rumors-collection/,www.snopes.com,20 rumors about McDonald's we've unwrapped | Snopes.com,0.9,HIGH,True,FALSE - Debunked by fact-checkers,www.snopes.com,factcheck,2026-06-16T04:22:07.105082
"fail to reach a nuclear accord, he would restart military attacks or make the United States ""the guardian of the Middle East"" in return for 20% of the region’s revenues",http://www.politifact.com/article/2026/jun/15/Iran-nuclear-peace-deal-Obama-Strait-Hormuz/,www.politifact.com,PolitiFact | Would Trump’s Iran deal bring ‘peace’? Here’s why that is a stretch.,0,LOW,False,,,factcheck,2026-06-16T04:22:07.456867
"[DEBUNKED] PolitiFact | At the White House UFC fight, a victor said Michelle Obama is a man. That’s still Pants on Fire",http://www.politifact.com/factchecks/2026/jun/15/josh-hokit/josh-hokit-ufc-white-house-michelle-obama/,www.politifact.com,"PolitiFact | At the White House UFC fight, a victor said Michelle Obama is a man. That’s still Pants",0.9,HIGH,True,FALSE - Debunked by fact-checkers,www.politifact.com,factcheck,2026-06-16T04:22:07.533346
"Until now, the number of teams playing in the World Cup maxed out at 32 and the highest number of matches was 64 — about 40% fewer games than the U",http://www.politifact.com/article/2026/jun/12/World-cup-FIFA-tickets-pricing-Trump/,www.politifact.com,PolitiFact | Trump called the 2026 World Cup history’s ‘most successful.’ Problems cloud ticket sale,0,LOW,False,,,factcheck,2026-06-16T04:22:07.970455
"Elizabeth Warren stated on June 5, 2026 in an X post: “If you live near one of these large data centers, your electricity bills over the last five years have gone up by as much as 267%",http://www.politifact.com/factchecks/2026/jun/12/elizabeth-warren/data-centers-rising-electricity-costs/,www.politifact.com,PolitiFact | How much have data centers increased electricity prices?,0,LOW,False,,,factcheck,2026-06-16T04:22:08.244330
"""If you live near one of these large data centers, your electricity bills over the last five years have gone up by as much as 267%,"" Warren said in a June 5 X post",http://www.politifact.com/factchecks/2026/jun/12/elizabeth-warren/data-centers-rising-electricity-costs/,www.politifact.com,PolitiFact | How much have data centers increased electricity prices?,0,LOW,False,,,factcheck,2026-06-16T04:22:08.468352
"That article found that wholesale prices in locations near data centers have risen, in some places, by ""as much as 267%"" compared with five years ago",http://www.politifact.com/factchecks/2026/jun/12/elizabeth-warren/data-centers-rising-electricity-costs/,www.politifact.com,PolitiFact | How much have data centers increased electricity prices?,0,LOW,False,,,factcheck,2026-06-16T04:22:08.676858
[DEBUNKED] PolitiFact | Would North Carolina bill allow the ‘murder’ of birth control users? Vague bill likely to stall,http://www.politifact.com/article/2026/jun/11/would-north-carolina-bill-allow-the-murder-of-birt/,www.politifact.com,PolitiFact | Would North Carolina bill allow the ‘murder’ of birth control users? Vague bill likely ,0.9,HIGH,True,FALSE - Debunked by fact-checkers,www.politifact.com,factcheck,2026-06-16T04:22:08.827719
