claim,source_url,source_domain,article_title,risk_score,risk_category,has_factcheck,factcheck_rating,factcheck_source,source_type,checked_at
"[DEBUNKED] Nein, diese Karte zeigt keine Hantavirus-Fälle",https://correctiv.org/faktencheck/2026/05/20/nein-diese-karte-zeigt-keine-hantavirus-faelle/,correctiv.org,"Nein, diese Karte zeigt keine Hantavirus-Fälle",0.9,HIGH,True,FALSE - Debunked by fact-checkers,correctiv.org,factcheck,2026-05-20T20:21:36.178834
[DEBUNKED] Umgeknicktes Windrad: Altes Video für Desinformation genutzt,https://correctiv.org/faktencheck/2026/05/20/umgeknicktes-windrad-altes-video-fuer-desinformation-genutzt/,correctiv.org,Umgeknicktes Windrad: Altes Video für Desinformation genutzt,0.9,HIGH,True,FALSE - Debunked by fact-checkers,correctiv.org,factcheck,2026-05-20T20:21:36.878683
[DEBUNKED] Parken beim Supermarkt: Keine deutschlandweite Gebühr geplant,https://correctiv.org/faktencheck/2026/05/19/parken-beim-supermarkt-keine-deutschlandweite-gebuehr-geplant/,correctiv.org,Parken beim Supermarkt: Keine deutschlandweite Gebühr geplant,0.9,HIGH,True,FALSE - Debunked by fact-checkers,correctiv.org,factcheck,2026-05-20T20:21:37.487046
"Beworben haben sich nach Angaben aus Branchenkreisen unter anderem die deutschen IT-Firmen Almato, One Data, Rohde &amp; Schwarz sowie ChapsVision aus Frankreich",https://correctiv.org/aktuelles/gesellschaft-2/2026/05/19/die-abkehr-von-palantir-hat-begonnen/,correctiv.org,Die Abkehr von Palantir hat begonnen - correctiv.org,0,LOW,False,,,factcheck,2026-05-20T20:21:38.244905
"Das Problem aber ist: „Bisher gibt es keine Lösung, die an die Le",https://correctiv.org/aktuelles/gesellschaft-2/2026/05/19/die-abkehr-von-palantir-hat-begonnen/,correctiv.org,Die Abkehr von Palantir hat begonnen - correctiv.org,0.1,LOW,False,,,factcheck,2026-05-20T20:21:38.355588
"Diese Lage sei „katastrophal, jedes Jahr mehr junge Menschen aus der Schule zu entlassen mit einer Qualifikation, die für keine Berufsausbildung reicht",https://correctiv.org/aktuelles/bildung/2026/05/20/neuer-hoechststand-bei-schulabgaengern-ohne-abschluss/,correctiv.org,Neuer Höchststand bei Schulabgängern ohne Abschluss - correctiv.org,0.1,LOW,False,,,factcheck,2026-05-20T20:21:39.159395
"Die höchsten Quoten haben Sachsen-Anhalt mit 13,4 Prozent des Jahrgangs, der die Schule ohne Abschluss verlassen hat, gefolgt von Thüringen mit 11,9 Prozent, dem Saarland mit 11,5, Bremen mit 10,6 und Mecklenburg-Vorpommern mit 10,4 Prozent",https://correctiv.org/aktuelles/bildung/2026/05/20/neuer-hoechststand-bei-schulabgaengern-ohne-abschluss/,correctiv.org,Neuer Höchststand bei Schulabgängern ohne Abschluss - correctiv.org,0,LOW,False,,,factcheck,2026-05-20T20:21:39.239974
"000 Kinder wiederholen die erste Klasse Wie die Demokratie in den Schulen durch die AfD unter Druck gerät Die niedrigste Quote ohne Schulabschluss hat im Schuljahr 2024/25 Hessen mit 6,3 Prozent, gefolgt von Bayern mit 6,6 Prozent",https://correctiv.org/aktuelles/bildung/2026/05/20/neuer-hoechststand-bei-schulabgaengern-ohne-abschluss/,correctiv.org,Neuer Höchststand bei Schulabgängern ohne Abschluss - correctiv.org,0.1,LOW,False,,,factcheck,2026-05-20T20:21:39.323969
[DEBUNKED] Kammergericht: Treffen in Potsdam darf als „Deportationskonferenz“ bezeichnet werden - correctiv.org,https://correctiv.org/aktuelles/afd/2026/05/19/kammergericht-treffen-in-potsdam-darf-als-deportationskonferenz-bezeichnet-werden/,correctiv.org,Kammergericht: Treffen in Potsdam darf als „Deportationskonferenz“ bezeichnet werden - correctiv.org,0.9,HIGH,True,FALSE - Debunked by fact-checkers,correctiv.org,factcheck,2026-05-20T20:21:39.925887
Zugleich werden die ukrainischen Drohnenangriffe tief in russischem Hoheitsgebiet immer effektiver und verursachen immer größeren Schaden,https://correctiv.org/aktuelles/2026/05/19/die-kartografie-der-macht-russlands-game-of-thrones/,correctiv.org,Die Kartografie der Macht: Russlands „Game of Thrones“ - correctiv.org,0.1,LOW,False,,,factcheck,2026-05-20T20:21:40.887261
"Laut einem kürzlich von iStories, der Financial Times und CNN veröffentlichten Bericht des Geheimdienstes eines EU-Staates geben sich hochrangige russische Sicherheitsbeamte zunehmend gegenseitig die Schuld für die Misserfolge in der Ukraine",https://correctiv.org/aktuelles/2026/05/19/die-kartografie-der-macht-russlands-game-of-thrones/,correctiv.org,Die Kartografie der Macht: Russlands „Game of Thrones“ - correctiv.org,0.05,LOW,False,,,factcheck,2026-05-20T20:21:40.975726
"Ein Führer, der alle glauben machen will, er gewinne den Krieg, bittet seine Feinde nicht um eine vorübergehende Waffenruhe, damit er die Parade seiner stark dezimierten Armee gefahrlos verfolgen kann",https://correctiv.org/aktuelles/2026/05/19/die-kartografie-der-macht-russlands-game-of-thrones/,correctiv.org,Die Kartografie der Macht: Russlands „Game of Thrones“ - correctiv.org,0.1,LOW,False,,,factcheck,2026-05-20T20:21:41.054683
90 12051 Berlin Fax: +49 (0) 30 – 555 780 2 20 Büro Berlin Singerstraße 109 10179 Berlin Buchladen Essen Akazienallee 10 45127 Essen Online-Shop Jugendredaktion Salon5 Alle Standorte CORRECTIV,https://correctiv.org/in-eigener-sache/2026/05/14/aufarbeitung-fehlern-veroeffentlichung-digitaler-nsdap-mitgliederkartei/,correctiv.org,Veröffentlichung von digitaler NSDAP-Mitgliederkartei - correctiv.org,0.1,LOW,False,,,factcheck,2026-05-20T20:21:41.653767
[DEBUNKED] Ekel für Klicks? Diese Videos von indischem Essen sind KI-generiert,https://correctiv.org/faktencheck/2026/05/13/ekel-fuer-klicks-diese-videos-von-essen-in-indien-sind-ki-generiert/,correctiv.org,Ekel für Klicks? Diese Videos von indischem Essen sind KI-generiert,0.9,HIGH,True,FALSE - Debunked by fact-checkers,correctiv.org,factcheck,2026-05-20T20:21:42.850641
[DEBUNKED] Altes Trump-Video wird fälschlich dem Hantavirus zugeschrieben,https://correctiv.org/faktencheck/2026/05/13/hantavirus-altes-donald-trump-video-ueber-corona-pandemie-falsch-zugeschrieben/,correctiv.org,Altes Trump-Video wird fälschlich dem Hantavirus zugeschrieben,0.9,HIGH,True,FALSE - Debunked by fact-checkers,correctiv.org,factcheck,2026-05-20T20:21:43.550657
[DEBUNKED] Was hinter dem Vorwurf zu Merz’ Gehaltserhöhung steckt,https://correctiv.org/faktencheck/hintergrund/2026/05/12/was-hinter-dem-vorwurf-zu-merz-gehaltserhoehung-steckt/,correctiv.org,Was hinter dem Vorwurf zu Merz’ Gehaltserhöhung steckt,0.9,HIGH,True,FALSE - Debunked by fact-checkers,correctiv.org,factcheck,2026-05-20T20:21:44.148137
"Wir laden alle Gemeinden ein, die Noten hier herunterzuladen",https://correctiv.org/in-eigener-sache/2026/05/13/kirchenlied-missbrauch-der-vorhang-zerreisst/,correctiv.org,Erstes Kirchenlied zu Missbrauch: „Der Vorhang zerreißt“,0.1,LOW,False,,,factcheck,2026-05-20T20:21:44.762238
[DEBUNKED] CORRECTIV macht Medienbildung und neue Formate auf der re:publica 2026 erlebbar - correctiv.org,https://correctiv.org/in-eigener-sache/2026/05/12/correctiv-macht-medienbildung-und-neue-formate-auf-der-republica-2026-erlebbar/,correctiv.org,CORRECTIV macht Medienbildung und neue Formate auf der re:publica 2026 erlebbar - correctiv.org,0.9,HIGH,True,FALSE - Debunked by fact-checkers,correctiv.org,factcheck,2026-05-20T20:21:45.268219
"[DEBUNKED] „AfD Wuppertal“: Tiktok-Kanal gab vor, offizielles Partei-Profil zu sein",https://correctiv.org/faktencheck/2026/05/12/afd-wuppertal-tiktok-kanal-gab-vor-offizielles-partei-profil-zu-sein/,correctiv.org,"„AfD Wuppertal“: Tiktok-Kanal gab vor, offizielles Partei-Profil zu sein",0.9,HIGH,True,FALSE - Debunked by fact-checkers,correctiv.org,factcheck,2026-05-20T20:21:45.968005
[DEBUNKED] Lebt Michael Jackson in Brasilien?,https://www.mimikama.org/lebt-michael-jackson-in-brasilien/,www.mimikama.org,Lebt Michael Jackson in Brasilien?,0.9,HIGH,True,FALSE - Debunked by fact-checkers,www.mimikama.org,factcheck,2026-05-20T20:21:46.033650
"[DEBUNKED] Ukraine: Belegt ein Konzert in Kiew, dass Wahlen möglich sind?",https://www.mimikama.org/belegt-konzert-in-kiew-moegliche-wahlen/,www.mimikama.org,"Ukraine: Belegt ein Konzert in Kiew, dass Wahlen möglich sind?",0.9,HIGH,True,FALSE - Debunked by fact-checkers,www.mimikama.org,factcheck,2026-05-20T20:21:46.095932
"[DEBUNKED] Lauterbach, WHO und „Klima-Notstand“: Was im Bericht steht",https://www.mimikama.org/lauterbach-who-klima-notstand-bericht/,www.mimikama.org,"Lauterbach, WHO und „Klima-Notstand“: Was im Bericht steht",0.9,HIGH,True,FALSE - Debunked by fact-checkers,www.mimikama.org,factcheck,2026-05-20T20:21:46.164693
[DEBUNKED] Hat Selenskyj wirklich Dutzende Immobilien im Ausland?,https://www.mimikama.org/selenskyj-dutzende-immobilien-im-ausland/,www.mimikama.org,Hat Selenskyj wirklich Dutzende Immobilien im Ausland?,0.9,HIGH,True,FALSE - Debunked by fact-checkers,www.mimikama.org,factcheck,2026-05-20T20:21:46.251564
[DEBUNKED] Gefälschte Briefe der Bundesnetzagentur im Umlauf,https://www.mimikama.org/gefaelschte-briefe-bundesnetzagentur-eeg-sanktion/,www.mimikama.org,Gefälschte Briefe der Bundesnetzagentur im Umlauf,0.9,HIGH,True,FALSE - Debunked by fact-checkers,www.mimikama.org,factcheck,2026-05-20T20:21:46.341268
[DEBUNKED] EU-Pläne: Droht ein Verbot von VPNs in Europa?,https://www.mimikama.org/will-die-eu-vpns-verbieten/,www.mimikama.org,EU-Pläne: Droht ein Verbot von VPNs in Europa?,0.9,HIGH,True,FALSE - Debunked by fact-checkers,www.mimikama.org,factcheck,2026-05-20T20:21:46.405724
[DEBUNKED] Ist Hantavirus ohne engen Kontakt ansteckend?,https://www.mimikama.org/hantavirus-ohne-engen-kontakt-ansteckend/,www.mimikama.org,Ist Hantavirus ohne engen Kontakt ansteckend?,0.9,HIGH,True,FALSE - Debunked by fact-checkers,www.mimikama.org,factcheck,2026-05-20T20:21:46.495939
[DEBUNKED] Hat Alice Weidel den Frosch-Logo-Skandal aufgedeckt?,https://www.mimikama.org/weidel-frosch-logo-skandal/,www.mimikama.org,Hat Alice Weidel den Frosch-Logo-Skandal aufgedeckt?,0.9,HIGH,True,FALSE - Debunked by fact-checkers,www.mimikama.org,factcheck,2026-05-20T20:21:46.574335
[DEBUNKED] Menschliche Verachtung im Netz: Hass über Argumente hinweg,https://www.mimikama.org/viele-wollen-keine-diskussion-nur-jemanden-fertigmachen/,www.mimikama.org,Menschliche Verachtung im Netz: Hass über Argumente hinweg,0.9,HIGH,True,FALSE - Debunked by fact-checkers,www.mimikama.org,factcheck,2026-05-20T20:21:46.642794
[DEBUNKED] Hantavirus-Ausbruch: Wie Misstrauen zur Manipulation führt,https://www.mimikama.org/das-falsche-erwachen-misstrauen-manipulation/,www.mimikama.org,Hantavirus-Ausbruch: Wie Misstrauen zur Manipulation führt,0.9,HIGH,True,FALSE - Debunked by fact-checkers,www.mimikama.org,factcheck,2026-05-20T20:21:46.711605
[DEBUNKED] Hantavirus-Fake-News: 18 Faktenchecks gegen Panik und Verschwörungen,https://www.mimikama.org/hantavirus-fake-news-faktencheck-ueberblick/,www.mimikama.org,Hantavirus-Fake-News: 18 Faktenchecks gegen Panik und Verschwörungen,0.9,HIGH,True,FALSE - Debunked by fact-checkers,www.mimikama.org,factcheck,2026-05-20T20:21:46.796611
[DEBUNKED] Hantavirus-Gen-Therapien: Wahrheit oder Verschwörungstheorie?,https://www.mimikama.org/bereiten-das-impfkartell-und-die-us-armee-hantavirus-gen-therapien-vor/,www.mimikama.org,Hantavirus-Gen-Therapien: Wahrheit oder Verschwörungstheorie?,0.9,HIGH,True,FALSE - Debunked by fact-checkers,www.mimikama.org,factcheck,2026-05-20T20:21:46.893364
[DEBUNKED] Facebook-Konto gehackt? Recovery-Anleitung Schritt für Schritt,https://www.mimikama.org/facebook-konto-gehackt-recovery-anleitung/,www.mimikama.org,Facebook-Konto gehackt? Recovery-Anleitung Schritt für Schritt,0.9,HIGH,True,FALSE - Debunked by fact-checkers,www.mimikama.org,factcheck,2026-05-20T20:21:46.964925
[DEBUNKED] Warum ist diese neue Facebook-Phishing-Masche so gefährlich?,https://www.mimikama.org/facebook-phishing-page-nur-koeder-profil-ziel/,www.mimikama.org,Warum ist diese neue Facebook-Phishing-Masche so gefährlich?,0.9,HIGH,True,FALSE - Debunked by fact-checkers,www.mimikama.org,factcheck,2026-05-20T20:21:47.046112
[DEBUNKED] Vorsicht: Spendenbetrug mit Fake-Tierleid-Videos erkennen!,https://www.mimikama.org/spendenbetrug-mit-tierleid-fake-videos/,www.mimikama.org,Vorsicht: Spendenbetrug mit Fake-Tierleid-Videos erkennen!,0.9,HIGH,True,FALSE - Debunked by fact-checkers,www.mimikama.org,factcheck,2026-05-20T20:21:47.116719
"[DEBUNKED] MV: Wie Medien AfD-Wahlkampf machen, ohne es zu merken - Volksverpetzer",https://www.volksverpetzer.de/aktuelles/medien-afd-mv-wahlkampf/,www.volksverpetzer.de,"MV: Wie Medien AfD-Wahlkampf machen, ohne es zu merken - Volksverpetzer",0.9,HIGH,True,FALSE - Debunked by fact-checkers,www.volksverpetzer.de,factcheck,2026-05-20T20:21:47.619229
[DEBUNKED] Die AfD schreibt bei der AfD ab – samt peinlicher Fehler! - Volksverpetzer,https://www.volksverpetzer.de/aktuelles/afd-schreibt-afd-ab/,www.volksverpetzer.de,Die AfD schreibt bei der AfD ab – samt peinlicher Fehler! - Volksverpetzer,0.9,HIGH,True,FALSE - Debunked by fact-checkers,www.volksverpetzer.de,factcheck,2026-05-20T20:21:48.137835
"„Generation Deutschland“: ein Sammelbecken an Rechtsextremisten Nach der Gründung der neuen AfD-Jugend auf Bundesebene im letzten Jahr in Gießen haben sich nun auch fast alle Landesverbände der ""Generation Deutschland"" gegründet",https://www.volksverpetzer.de/analyse/grosse-generation-deutschland/,www.volksverpetzer.de,Die große &quot;Generation Deutschland&quot;-Recherche: Der Trick der AfD‑Jugend entlarvt! - Volksve,0.1,LOW,False,,,factcheck,2026-05-20T20:21:48.727648
[DEBUNKED] Warum Zehdenick für die AfD eine Ausnahme bleiben wird - Volksverpetzer,https://www.volksverpetzer.de/analyse/zehdenick-afd-problem/,www.volksverpetzer.de,Warum Zehdenick für die AfD eine Ausnahme bleiben wird - Volksverpetzer,0.9,HIGH,True,FALSE - Debunked by fact-checkers,www.volksverpetzer.de,factcheck,2026-05-20T20:21:49.221702
[DEBUNKED] Wie die Ostdeutsche Allgemeine Volksverpetzer zum Schweigen bringen will - Volksverpetzer,https://www.volksverpetzer.de/aktuelles/ostdeutsche-allgemeine-anwalt-anschwaerzen/,www.volksverpetzer.de,Wie die Ostdeutsche Allgemeine Volksverpetzer zum Schweigen bringen will - Volksverpetzer,0.9,HIGH,True,FALSE - Debunked by fact-checkers,www.volksverpetzer.de,factcheck,2026-05-20T20:21:49.724044
Ein paar Fakten zum Einstieg: Mehr Migration entlastet die öffentlichen Haushalte langfristig um rund 104 Milliarden Euro jährlich,https://www.volksverpetzer.de/faktencheck/bas-tagesthemen-faktencheck/,www.volksverpetzer.de,"Bärbel Bas hat RECHT: Aber Tagesthemen stimmen NIUS, BILD &amp; AfD zu!? - Volksverpetzer",0,LOW,False,,,factcheck,2026-05-20T20:21:50.312842
"Das würde man aber nie erfahren, wenn man die Tagesthemen am Donnerstag gesehen hätte",https://www.volksverpetzer.de/faktencheck/bas-tagesthemen-faktencheck/,www.volksverpetzer.de,"Bärbel Bas hat RECHT: Aber Tagesthemen stimmen NIUS, BILD &amp; AfD zu!? - Volksverpetzer",0.1,LOW,False,,,factcheck,2026-05-20T20:21:50.391094
[DEBUNKED] 75 % wollen KEINEN AfD-Kanzler: Wie die WELT für die AfD lügt - Volksverpetzer,https://www.volksverpetzer.de/faktencheck/75-kein-afd-kanzler/,www.volksverpetzer.de,75 % wollen KEINEN AfD-Kanzler: Wie die WELT für die AfD lügt - Volksverpetzer,0.9,HIGH,True,FALSE - Debunked by fact-checkers,www.volksverpetzer.de,factcheck,2026-05-20T20:21:50.891536
"Diesel kostete am Samstagmittag im Schnitt 2,15 Euro pro Liter, am Sonntagmorgen lag der Preis erneut höher als 24 Stunden zuvor",https://www.volksverpetzer.de/analyse/tankrabatt-2026-flopp/,www.volksverpetzer.de,Warum der Tankrabatt wirklich floppt - Volksverpetzer,0,LOW,False,,,factcheck,2026-05-20T20:21:51.486557
"Mai stand Diesel bei 2,104 Euro, E10 bei 2,017 Euro",https://www.volksverpetzer.de/analyse/tankrabatt-2026-flopp/,www.volksverpetzer.de,Warum der Tankrabatt wirklich floppt - Volksverpetzer,0,LOW,False,,,factcheck,2026-05-20T20:21:51.569889
Laut diesem werden beim Benzin nur 12 Cent von den 17 weitergegeben,https://www.volksverpetzer.de/analyse/tankrabatt-2026-flopp/,www.volksverpetzer.de,Warum der Tankrabatt wirklich floppt - Volksverpetzer,0,LOW,False,,,factcheck,2026-05-20T20:21:51.650593
[DEBUNKED] Reiche-Lüge verbreitet: Warum ist die Tagesschau so schlecht bei Fakes der Regierung? - Volksverpetzer,https://www.volksverpetzer.de/faktencheck/reiche-luege-tagesschau/,www.volksverpetzer.de,Reiche-Lüge verbreitet: Warum ist die Tagesschau so schlecht bei Fakes der Regierung? - Volksverpetz,0.9,HIGH,True,FALSE - Debunked by fact-checkers,www.volksverpetzer.de,factcheck,2026-05-20T20:21:52.156204
[DEBUNKED] Posts claim video shows young girls on Epstein's island. There's no evidence that's true | Snopes.com,https://www.snopes.com/news/2026/05/20/epstein-island-girls-video/,www.snopes.com,Posts claim video shows young girls on Epstein's island. There's no evidence that's true | Snopes.co,0.9,HIGH,True,FALSE - Debunked by fact-checkers,www.snopes.com,factcheck,2026-05-20T20:21:52.739952
[DEBUNKED] Gas pump 'screw method' scam warning is a hoax | Snopes.com,https://www.snopes.com/fact-check/gas-pump-screw-scam/,www.snopes.com,Gas pump 'screw method' scam warning is a hoax | Snopes.com,0.9,HIGH,True,FALSE - Debunked by fact-checkers,www.snopes.com,factcheck,2026-05-20T20:21:52.947855
"[DEBUNKED] Did Trump say, 'Nobody knows God better than me'? Don't be fooled | Snopes.com",https://www.snopes.com/fact-check/trump-nobody-knows-god-better-than-me/,www.snopes.com,"Did Trump say, 'Nobody knows God better than me'? Don't be fooled | Snopes.com",0.9,HIGH,True,FALSE - Debunked by fact-checkers,www.snopes.com,factcheck,2026-05-20T20:21:53.246224
[DEBUNKED] Trump's windswept hair: Untangling fake images from real photos | Snopes.com,https://www.snopes.com/news/2026/05/19/trump-photos-hair-china/,www.snopes.com,Trump's windswept hair: Untangling fake images from real photos | Snopes.com,0.9,HIGH,True,FALSE - Debunked by fact-checkers,www.snopes.com,factcheck,2026-05-20T20:21:53.469918
[DEBUNKED] Copenhagen isn't restricting seniors' beef intake. The limit is only guidance | Snopes.com,https://www.snopes.com/fact-check/copenhagen-denmark-beef-limit/,www.snopes.com,Copenhagen isn't restricting seniors' beef intake. The limit is only guidance | Snopes.com,0.9,HIGH,True,FALSE - Debunked by fact-checkers,www.snopes.com,factcheck,2026-05-20T20:21:53.652535
"For this year, enrollees then faced premiums that increased, on average, by 26%",http://www.politifact.com/article/2026/may/20/as-aca-enrollment-drops-higher-insurance-rates-may/,www.politifact.com,"PolitiFact | As ACA enrollment drops, higher insurance rates may follow",0,LOW,False,,,factcheck,2026-05-20T20:21:53.808744
"A KFF analysis released May 19, for instance, found that the average ACA plan deductible saw the steepest increase in history — growing by 37%, or over $1,000, from $2,759 in 2025 to $3,786 in 2026 as enhanced premium tax credits expired",http://www.politifact.com/article/2026/may/20/as-aca-enrollment-drops-higher-insurance-rates-may/,www.politifact.com,"PolitiFact | As ACA enrollment drops, higher insurance rates may follow",0,LOW,False,,,factcheck,2026-05-20T20:21:53.893461
2% of students in grades 6 through 12 still reported second hand exposure to aerosols from e-cigarettes,http://www.politifact.com/article/2026/may/19/secondhand-vaping-health-risks-research/,www.politifact.com,"PolitiFact | When someone’s vaping nearby, what are you breathing in? The risks of vape pens’ second",0,LOW,False,,,factcheck,2026-05-20T20:21:54.047202
"Prices for key goods and services have increased Rising prices are a big concern for many Americans, after experiencing an inflation peak around 9% in 2022",http://www.politifact.com/article/2026/may/15/trump-economy-inflation-jobs-consumers-polls/,www.politifact.com,PolitiFact | Trump said Americans&#x27; finances don&#x27;t motivate him in Iran talks. How are peop,0,LOW,False,,,factcheck,2026-05-20T20:21:54.455098
[DEBUNKED] PolitiFact | Altered video of Byron Donalds arguing for insider trading in Congress spreads online,http://www.politifact.com/factchecks/2026/may/15/tweets/byron-donalds-florida-insider-trading/,www.politifact.com,PolitiFact | Altered video of Byron Donalds arguing for insider trading in Congress spreads online,0.9,HIGH,True,FALSE - Debunked by fact-checkers,www.politifact.com,factcheck,2026-05-20T20:21:54.541826
"Nationwide, 91% of people sentenced were United States citizens",http://www.politifact.com/article/2026/may/14/vice-president-JD-Vance-Maine-fraud-Janet-Mills/,www.politifact.com,"PolitiFact | Fact-checking JD Vance on Maine Democrats, Medicaid fraud and autism coverage",0,LOW,False,,,factcheck,2026-05-20T20:21:54.686889
"illegally, just under 1% of the state’s population and one of the smallest unauthorized immigrant populations in the U",http://www.politifact.com/article/2026/may/14/vice-president-JD-Vance-Maine-fraud-Janet-Mills/,www.politifact.com,"PolitiFact | Fact-checking JD Vance on Maine Democrats, Medicaid fraud and autism coverage",0.1,LOW,False,,,factcheck,2026-05-20T20:21:54.767848
"Although hantavirus’ mortality rate is quite high — close to 40% for some strains — there is not evidence it easily spreads or mutates, making it more likely that the public health response can keep pace to reduce further spread",http://www.politifact.com/article/2026/may/13/hantavirus-outbreak-cruise-ship-facts-not-covid/,www.politifact.com,PolitiFact | Why experts say hantavirus isn’t ‘COVID-19: The Sequel.’ Four facts to calm your nerves,0,LOW,False,,,factcheck,2026-05-20T20:21:55.268040
"[DEBUNKED] No, the UK Government’s X account hasn’t been suspended – Full Fact",https://fullfact.org/politics/uk-gov-x-account-not-suspended/,fullfact.org,"No, the UK Government’s X account hasn’t been suspended – Full Fact",0.9,HIGH,True,FALSE - Debunked by fact-checkers,fullfact.org,factcheck,2026-05-20T20:21:55.808540
[DEBUNKED] Video of 2025 Unite the Kingdom protest shared as last weekend’s march – Full Fact,https://fullfact.org/politics/old-video-2025-unite-the-kingdom-march/,fullfact.org,Video of 2025 Unite the Kingdom protest shared as last weekend’s march – Full Fact,0.9,HIGH,True,FALSE - Debunked by fact-checkers,fullfact.org,factcheck,2026-05-20T20:21:57.192439
[DEBUNKED] Viral post includes several false claims about UK taxes – Full Fact,https://fullfact.org/economy/viral-post-includes-false-claims-about-UK-taxes/,fullfact.org,Viral post includes several false claims about UK taxes – Full Fact,0.9,HIGH,True,FALSE - Debunked by fact-checkers,fullfact.org,factcheck,2026-05-20T20:21:57.568014
[DEBUNKED] China hasn’t banned US citizens over hantavirus – Full Fact,https://fullfact.org/health/China-US-hantavirus-ban-false/,fullfact.org,China hasn’t banned US citizens over hantavirus – Full Fact,0.9,HIGH,True,FALSE - Debunked by fact-checkers,fullfact.org,factcheck,2026-05-20T20:21:58.016519
"[DEBUNKED] Revealed: the Facebook pages using AI to flood feeds with bizarre fake stories about politicians saving kennels, cafes and babies – Full Fact",https://fullfact.org/politics/ai-photos-fake-stories-uk-politicians/,fullfact.org,Revealed: the Facebook pages using AI to flood feeds with bizarre fake stories about politicians sav,0.9,HIGH,True,FALSE - Debunked by fact-checkers,fullfact.org,factcheck,2026-05-20T20:21:58.392621
[DEBUNKED] Campaign video shared with false claims it shows Green Party celebrating election win in Bengali – Full Fact,https://fullfact.org/politics/campaign-video-falsely-shared-as-green-party-celebration-in-bengali/,fullfact.org,Campaign video shared with false claims it shows Green Party celebrating election win in Bengali – F,0.9,HIGH,True,FALSE - Debunked by fact-checkers,fullfact.org,factcheck,2026-05-20T20:21:59.311507
[DEBUNKED] Viral map doesn’t show all councils Reform UK controls – Full Fact,https://fullfact.org/politics/map-reform-councils-uk-missing-context/,fullfact.org,Viral map doesn’t show all councils Reform UK controls – Full Fact,0.9,HIGH,True,FALSE - Debunked by fact-checkers,fullfact.org,factcheck,2026-05-20T20:21:59.683357
"56, or 53%, from the average price of $2",https://www.factcheck.org/2026/05/what-will-happen-to-gasoline-prices-when-the-iran-war-ends/,www.factcheck.org,What Will Happen To Gasoline Prices When the Iran War Ends? - FactCheck.org,0,LOW,False,,,factcheck,2026-05-20T20:21:59.988095
[DEBUNKED] Kennedy Denies the One Big Beautiful Bill Act&#039;s Spending Cuts to Medicaid - FactCheck.org,https://www.factcheck.org/2026/05/kennedy-denies-the-one-big-beautiful-bill-acts-spending-cuts-to-medicaid/,www.factcheck.org,Kennedy Denies the One Big Beautiful Bill Act&#039;s Spending Cuts to Medicaid - FactCheck.org,0.9,HIGH,True,FALSE - Debunked by fact-checkers,www.factcheck.org,factcheck,2026-05-20T20:22:00.315625
[DEBUNKED] Project 2025 Series Wins National Headliner Award - FactCheck.org,https://www.factcheck.org/2026/04/project-2025-series-wins-national-headliner-award/,www.factcheck.org,Project 2025 Series Wins National Headliner Award - FactCheck.org,0.9,HIGH,True,FALSE - Debunked by fact-checkers,www.factcheck.org,factcheck,2026-05-20T20:22:01.673536
[DEBUNKED] The Persistent Misleading Claim That Vaccines Aren’t Properly Tested for Safety - FactCheck.org,https://www.factcheck.org/2026/04/the-persistent-misleading-claim-that-vaccines-arent-properly-tested-for-safety/,www.factcheck.org,The Persistent Misleading Claim That Vaccines Aren’t Properly Tested for Safety - FactCheck.org,0.9,HIGH,True,FALSE - Debunked by fact-checkers,www.factcheck.org,factcheck,2026-05-20T20:22:01.716017
