claim,source_url,source_domain,article_title,risk_score,risk_category,has_factcheck,factcheck_rating,factcheck_source,source_type,checked_at
"E-Paper (PDF), Digital-Archiv und S+-Newsletter Jederzeit kündigen Jetzt abonnieren SPIEGEL plus 52 Wochen 25 % sparen € 4,49 pro Woche für 52 Wochen danach € 5,99 pro Woche Freier Zugriff auf alle S+-Artikel auf SPIEGEL",https://www.spiegel.de/sport/fussball/champions-league-paris-saint-germain-schlaegt-den-fc-bayern-muenchen-in-einem-spektakel-a-68ab5d97-cf65-4911-acef-8d8fe1f7078a#ref=rss,www.spiegel.de,Champions League: Paris Saint-Germain schlägt den FC Bayern München in einem Spektakel - DER SPIEGEL,0.1,LOW,False,,,mainstream,2026-04-29T03:24:35.118428
"com Facebook E-Mail Messenger WhatsApp Link kopieren image""> Bild vergrößern James Comey (im März 2017): »Und ich glaube immer noch an die unabhängige Bundesjustiz",https://www.spiegel.de/ausland/ex-fbi-chef-comey-wegen-angeblicher-morddrohung-gegen-trump-angeklagt-a-28708f2f-24d2-487a-b702-6eb5dbf9b25a#ref=rss,www.spiegel.de,Ex-FBI-Chef Comey wegen angeblicher Morddrohung gegen Trump angeklagt - DER SPIEGEL,0.1,LOW,False,,,mainstream,2026-04-29T03:24:35.992393
Der Post habe »laut und deutlich« von Ermordung gesprochen,https://www.spiegel.de/ausland/ex-fbi-chef-comey-wegen-angeblicher-morddrohung-gegen-trump-angeklagt-a-28708f2f-24d2-487a-b702-6eb5dbf9b25a#ref=rss,www.spiegel.de,Ex-FBI-Chef Comey wegen angeblicher Morddrohung gegen Trump angeklagt - DER SPIEGEL,0,LOW,False,,,mainstream,2026-04-29T03:24:36.077190
"25%;"" :style=""{minHeight: typeof iframeHeight === 'number' && iframeIsLoaded",https://www.spiegel.de/sport/fussball/champions-league-fc-bayern-verliert-spektakulaeres-halbfinal-hinspiel-in-paris-a-23080fec-999f-4fd8-b0a2-993c46a1ea2e#ref=rss,www.spiegel.de,Champions League: FC Bayern verliert spektakuläres Halbfinal-Hinspiel in Paris - DER SPIEGEL,0,LOW,False,,,mainstream,2026-04-29T03:24:36.945245
"25%',}"" x-lazyload> Im Halbfinal-Rückspiel am Mittwoch kommender Woche müssen die Bayern in der heimischen Allianz-Arena trotzdem ganz groß aufspielen, um den Titelverteidiger zu entthronen",https://www.spiegel.de/sport/fussball/champions-league-fc-bayern-verliert-spektakulaeres-halbfinal-hinspiel-in-paris-a-23080fec-999f-4fd8-b0a2-993c46a1ea2e#ref=rss,www.spiegel.de,Champions League: FC Bayern verliert spektakuläres Halbfinal-Hinspiel in Paris - DER SPIEGEL,0,LOW,False,,,mainstream,2026-04-29T03:24:37.031750
Immer mehr Menschen zweifeln an der Wirtschaftskompetenz des US-Präsidenten,https://www.spiegel.de/wirtschaft/donald-trump-irankrieg-macht-benzinpreise-in-den-usa-teurer-und-teurer-a-91744fd7-13cc-4f31-bd3e-06e16f9546ad#ref=rss,www.spiegel.de,Donald Trump: Irankrieg macht Benzinpreise in den USA teurer und teurer - DER SPIEGEL,0.1,LOW,False,,,mainstream,2026-04-29T03:24:38.327948
"Zum Login SPIEGEL plus Nur für Neukunden € 1,– für 4 Wochen danach € 5,99 pro Woche Freier Zugriff auf alle S+-Artikel auf SPIEGEL",https://www.spiegel.de/wirtschaft/donald-trump-irankrieg-macht-benzinpreise-in-den-usa-teurer-und-teurer-a-91744fd7-13cc-4f31-bd3e-06e16f9546ad#ref=rss,www.spiegel.de,Donald Trump: Irankrieg macht Benzinpreise in den USA teurer und teurer - DER SPIEGEL,0.1,LOW,False,,,mainstream,2026-04-29T03:24:38.427486
"E-Paper (PDF), Digital-Archiv und S+-Newsletter Jederzeit kündigen Jetzt abonnieren SPIEGEL plus 52 Wochen 25 % sparen € 4,49 pro Woche für 52 Wochen danach € 5,99 pro Woche Freier Zugriff auf alle S+-Artikel auf SPIEGEL",https://www.spiegel.de/wirtschaft/donald-trump-irankrieg-macht-benzinpreise-in-den-usa-teurer-und-teurer-a-91744fd7-13cc-4f31-bd3e-06e16f9546ad#ref=rss,www.spiegel.de,Donald Trump: Irankrieg macht Benzinpreise in den USA teurer und teurer - DER SPIEGEL,0.1,LOW,False,,,mainstream,2026-04-29T03:24:38.525455
"Zum Login SPIEGEL plus Nur für Neukunden € 1,– für 4 Wochen danach € 5,99 pro Woche Freier Zugriff auf alle S+-Artikel auf SPIEGEL",https://www.spiegel.de/sport/fussball/champions-league-paris-saint-germain-vs-fc-bayern-im-liveticker-a-72fb3b3e-c4f5-46e3-985c-91464b248e12#ref=rss,www.spiegel.de,Champions League: Drei Erkenntnisse aus dem wilden 4:5 der Bayern in Paris - DER SPIEGEL,0.1,LOW,False,,,mainstream,2026-04-29T03:24:39.538959
"E-Paper (PDF), Digital-Archiv und S+-Newsletter Jederzeit kündigen Jetzt abonnieren SPIEGEL plus 52 Wochen 25 % sparen € 4,49 pro Woche für 52 Wochen danach € 5,99 pro Woche Freier Zugriff auf alle S+-Artikel auf SPIEGEL",https://www.spiegel.de/sport/fussball/champions-league-paris-saint-germain-vs-fc-bayern-im-liveticker-a-72fb3b3e-c4f5-46e3-985c-91464b248e12#ref=rss,www.spiegel.de,Champions League: Drei Erkenntnisse aus dem wilden 4:5 der Bayern in Paris - DER SPIEGEL,0.1,LOW,False,,,mainstream,2026-04-29T03:24:39.632076
"Zum Login SPIEGEL plus Nur für Neukunden € 1,– für 4 Wochen danach € 5,99 pro Woche Freier Zugriff auf alle S+-Artikel auf SPIEGEL",https://www.spiegel.de/wissenschaft/walrettung-vor-poel-wir-haben-es-den-kritikern-gezeigt-a-c5a0300c-9f85-4c49-8477-bc74edd14d3f#ref=rss,www.spiegel.de,Walrettung vor Poel: »Wir haben es den Kritikern gezeigt« - DER SPIEGEL,0.1,LOW,False,,,mainstream,2026-04-29T03:24:40.529360
"E-Paper (PDF), Digital-Archiv und S+-Newsletter Jederzeit kündigen Jetzt abonnieren SPIEGEL plus 52 Wochen 25 % sparen € 4,49 pro Woche für 52 Wochen danach € 5,99 pro Woche Freier Zugriff auf alle S+-Artikel auf SPIEGEL",https://www.spiegel.de/wissenschaft/walrettung-vor-poel-wir-haben-es-den-kritikern-gezeigt-a-c5a0300c-9f85-4c49-8477-bc74edd14d3f#ref=rss,www.spiegel.de,Walrettung vor Poel: »Wir haben es den Kritikern gezeigt« - DER SPIEGEL,0.1,LOW,False,,,mainstream,2026-04-29T03:24:40.637500
"Opec is less important to world oil markets than it was in the 1970s, with the 85% share of internationally traded oil it had then more like 50% today",https://www.bbc.com/news/articles/cj4pxyklw1jo?at_medium=RSS&amp;at_campaign=rss,www.bbc.com,Why the UAE&#x27;s exit from Opec is a big deal,0,LOW,False,,,mainstream,2026-04-29T03:24:42.797446
