claim,source_url,source_domain,article_title,risk_score,risk_category,has_factcheck,factcheck_rating,factcheck_source,source_type,checked_at
"[DEBUNKED] Nigeria-Öfen-Lüge: WELT will nicht, dass du diese Richtigstellung siehst! - Volksverpetzer",https://www.volksverpetzer.de/faktencheck/nigeria-oefen-luege-welt/,www.volksverpetzer.de,"Nigeria-Öfen-Lüge: WELT will nicht, dass du diese Richtigstellung siehst! - Volksverpetzer",0.9,HIGH,True,FALSE - Debunked by fact-checkers,www.volksverpetzer.de,factcheck,2026-02-25T19:10:25.219365
"Vier Bundesländer sind schon offiziell an Bord, bei vier weiteren steht theoretisch nichts mehr im Weg und mindestens zwei weitere wackeln bereits",https://www.volksverpetzer.de/analyse/afd-verbot-mehrheit-bundesrat/,www.volksverpetzer.de,AfD-Verbot: Für ein Szenario gibt es jetzt bereits eine Bundesrat-Mehrheit - Volksverpetzer,0,LOW,False,,,factcheck,2026-02-25T19:10:31.097062
[DEBUNKED] &quot;Nachdenkseiten&quot; enthüllt vor Gericht die wahren Geldgeber hinter Volksverpetzer! - Volksverpetzer,https://www.volksverpetzer.de/aktuelles/nachdenkseiten-gericht-geldgeber-volksverpetzer/,www.volksverpetzer.de,&quot;Nachdenkseiten&quot; enthüllt vor Gericht die wahren Geldgeber hinter Volksverpetzer! - Volksv,0.9,HIGH,True,FALSE - Debunked by fact-checkers,www.volksverpetzer.de,factcheck,2026-02-25T19:10:33.056878
"Nach einer aktuellen Studie der ARAG war im Jahr 2025 allerdings nur noch gut die Hälfte der Befragten in Deutschland davon überzeugt, dass Gerichte alle Menschen gleich behandeln",https://www.volksverpetzer.de/aktuelles/neutralitaet-ziel-kein-zustand/,www.volksverpetzer.de,Neutralität als Waffe: Wie man zum Schweigen gebracht wird - Volksverpetzer,0.1,LOW,False,,,factcheck,2026-02-25T19:10:34.455259
[DEBUNKED] Don't fall for alleged Epstein emails stating Trump doesn't like Black girls | Snopes.com,https://www.snopes.com/fact-check/epstein-trump-black-girls/,www.snopes.com,Don't fall for alleged Epstein emails stating Trump doesn't like Black girls | Snopes.com,0.9,HIGH,True,FALSE - Debunked by fact-checkers,www.snopes.com,factcheck,2026-02-25T19:10:34.537163
[DEBUNKED] Don't fall for AI-generated image of Puerto Vallarta after cartel attacks | Snopes.com,https://www.snopes.com/fact-check/puerto-vallarta-cartel-church-fire/,www.snopes.com,Don't fall for AI-generated image of Puerto Vallarta after cartel attacks | Snopes.com,0.9,HIGH,True,FALSE - Debunked by fact-checkers,www.snopes.com,factcheck,2026-02-25T19:10:34.615178
[DEBUNKED] Tune out claims mechanic escaped from hospital that secretly harvested organs | Snopes.com,https://www.snopes.com/fact-check/mechanic-organ-harvesting-story/,www.snopes.com,Tune out claims mechanic escaped from hospital that secretly harvested organs | Snopes.com,0.9,HIGH,True,FALSE - Debunked by fact-checkers,www.snopes.com,factcheck,2026-02-25T19:10:34.771888
[DEBUNKED] This photo doesn't show Melania Trump on Epstein's plane. Here's where it was really taken | Snopes.com,https://www.snopes.com/fact-check/epstein-photo-plane-melania-trump/,www.snopes.com,This photo doesn't show Melania Trump on Epstein's plane. Here's where it was really taken | Snopes.,0.9,HIGH,True,FALSE - Debunked by fact-checkers,www.snopes.com,factcheck,2026-02-25T19:10:34.848572
[DEBUNKED] Epstein files don't reveal Leonardo DiCaprio ate 70 pounds of 'child meat' | Snopes.com,https://www.snopes.com/fact-check/epstein-files-dicaprio-cannibalism/,www.snopes.com,Epstein files don't reveal Leonardo DiCaprio ate 70 pounds of 'child meat' | Snopes.com,0.9,HIGH,True,FALSE - Debunked by fact-checkers,www.snopes.com,factcheck,2026-02-25T19:10:34.931515
"[DEBUNKED] Olympian Alysa Liu did not say she no longer believes in pronouns, pro-LGBTQ+ stance | Snopes.com",https://www.snopes.com/fact-check/alysa-liu-pronouns/,www.snopes.com,"Olympian Alysa Liu did not say she no longer believes in pronouns, pro-LGBTQ+ stance | Snopes.com",0.9,HIGH,True,FALSE - Debunked by fact-checkers,www.snopes.com,factcheck,2026-02-25T19:10:35.073817
[DEBUNKED] Did Trump call C-SPAN as 'John Barron' after SCOTUS tariff ruling? We inspected the claim | Snopes.com,https://www.snopes.com/news/2026/02/23/trump-john-barron-cspan/,www.snopes.com,Did Trump call C-SPAN as 'John Barron' after SCOTUS tariff ruling? We inspected the claim | Snopes.c,0.9,HIGH,True,FALSE - Debunked by fact-checkers,www.snopes.com,factcheck,2026-02-25T19:10:35.351422
"[DEBUNKED] Epstein files don't reveal Ellen DeGeneres is 'prolific cannibal,' despite claims | Snopes.com",https://www.snopes.com/fact-check/ellen-cannibal-epstein-files/,www.snopes.com,"Epstein files don't reveal Ellen DeGeneres is 'prolific cannibal,' despite claims | Snopes.com",0.9,HIGH,True,FALSE - Debunked by fact-checkers,www.snopes.com,factcheck,2026-02-25T19:10:35.431368
[DEBUNKED] Did Eric Clapton stop 1992 concert to bring deaf teen onstage? Not so fast | Snopes.com,https://www.snopes.com/fact-check/eric-clapton-1992-concert-deaf-teen/,www.snopes.com,Did Eric Clapton stop 1992 concert to bring deaf teen onstage? Not so fast | Snopes.com,0.9,HIGH,True,FALSE - Debunked by fact-checkers,www.snopes.com,factcheck,2026-02-25T19:10:35.566443
"That’s lower than the year-over-year rate when he took office in January 2025, but it had already fallen from a peak of roughly 9% in the summer of 2022 under former President Joe Biden",http://www.politifact.com/article/2026/feb/25/Donald-trump-state-union-green/,www.politifact.com,"PolitiFact | State of the Union fact-check: Trump exaggerates on economy, immigration",0.1,LOW,False,,,factcheck,2026-02-25T19:10:35.923715
"Even if accountholders added a total of $9,000 during that time to that starting $1,000 — something many Americans couldn't afford to do — it would produce about $60,000 in 18 years, at a 10% rate of growth",http://www.politifact.com/article/2026/feb/25/trump-accounts-100k-state-of-union/,www.politifact.com,"PolitiFact | Will Trump account holders have $100,000 at age 18? It’s not guaranteed",0,LOW,False,,,factcheck,2026-02-25T19:10:36.203444
"stock market is about 10%, but that rate of gain is not assured",http://www.politifact.com/article/2026/feb/25/trump-accounts-100k-state-of-union/,www.politifact.com,"PolitiFact | Will Trump account holders have $100,000 at age 18? It’s not guaranteed",0,LOW,False,,,factcheck,2026-02-25T19:10:36.413014
Even a modest 2% inflation rate would take a big bite out of the final amount,http://www.politifact.com/article/2026/feb/25/trump-accounts-100k-state-of-union/,www.politifact.com,"PolitiFact | Will Trump account holders have $100,000 at age 18? It’s not guaranteed",0,LOW,False,,,factcheck,2026-02-25T19:10:36.639325
[DEBUNKED] PolitiFact | Fact-checking Donald Trump on inflation rate at State of the Union,http://www.politifact.com/article/2026/feb/25/trump-inflation-state-of-union-biden/,www.politifact.com,PolitiFact | Fact-checking Donald Trump on inflation rate at State of the Union,0.9,HIGH,True,FALSE - Debunked by fact-checkers,www.politifact.com,factcheck,2026-02-25T19:10:36.722955
[DEBUNKED] PolitiFact | Live fact-check: Donald Trump&#x27;s 2026 State of the Union address,http://www.politifact.com/article/2026/feb/25/live-fact-check-state-union-trump-address/,www.politifact.com,PolitiFact | Live fact-check: Donald Trump&#x27;s 2026 State of the Union address,0.9,HIGH,True,FALSE - Debunked by fact-checkers,www.politifact.com,factcheck,2026-02-25T19:10:36.783597
"Promises Kept Trump has kept about 19% of his promises, including on his first day, when he pardoned the defendants of the Jan",http://www.politifact.com/article/2026/feb/23/Trump-promises-tariffs-taxes-immigration-deport/,www.politifact.com,PolitiFact | Trump says he&#x27;s kept all of his campaign promises. Our MAGA-Meter shows something ,0,LOW,False,,,factcheck,2026-02-25T19:10:37.049862
[DEBUNKED] PolitiFact | Is President Donald Trump right that drugs entering the US by sea have dropped by 97%?,http://www.politifact.com/factchecks/2026/feb/23/donald-trump/drug-water-down-97-percent-cocaine-seizures-sea/,www.politifact.com,PolitiFact | Is President Donald Trump right that drugs entering the US by sea have dropped by 97%?,0.9,HIGH,True,FALSE - Debunked by fact-checkers,www.politifact.com,factcheck,2026-02-25T19:10:37.126896
[DEBUNKED] PolitiFact | This isn’t a real image of Puerto Vallarta on fire after the killing of a cartel leader; it’s AI,http://www.politifact.com/factchecks/2026/feb/23/social-media/El-Mencho-Mexico-cartel-Puerto-Vallarta-AI/,www.politifact.com,PolitiFact | This isn’t a real image of Puerto Vallarta on fire after the killing of a cartel leader,0.9,HIGH,True,FALSE - Debunked by fact-checkers,www.politifact.com,factcheck,2026-02-25T19:10:37.189605
[DEBUNKED] PolitiFact | Supreme Court strikes down use of primary law Donald Trump used to impose tariffs,http://www.politifact.com/article/2026/feb/20/supreme-court-strikes-down-tariffs-Trump/,www.politifact.com,PolitiFact | Supreme Court strikes down use of primary law Donald Trump used to impose tariffs,0.9,HIGH,True,FALSE - Debunked by fact-checkers,www.politifact.com,factcheck,2026-02-25T19:10:37.417386
[DEBUNKED] PolitiFact | Is the federal SAVE tool booting naturalized citizens from voter rolls?,http://www.politifact.com/article/2026/feb/20/naturalized-citizens-save-database-florida/,www.politifact.com,PolitiFact | Is the federal SAVE tool booting naturalized citizens from voter rolls?,0.9,HIGH,True,FALSE - Debunked by fact-checkers,www.politifact.com,factcheck,2026-02-25T19:10:37.491363
"stated on January 7, 2026 in a press briefing: Says “90% of health care spending treats chronic disease",http://www.politifact.com/factchecks/2026/feb/19/robert-f-kennedy-jr/chronic-disease-90-percent-health-spending-rfk/,www.politifact.com,PolitiFact | This chronic illness statistic touted by RFK Jr. and RealFood.gov doesn’t check out,0,LOW,False,,,factcheck,2026-02-25T19:10:37.759865
"With a quick scroll, football watchers who visited the website in the ad would have encountered the statistic that ""90% of U",http://www.politifact.com/factchecks/2026/feb/19/robert-f-kennedy-jr/chronic-disease-90-percent-health-spending-rfk/,www.politifact.com,PolitiFact | This chronic illness statistic touted by RFK Jr. and RealFood.gov doesn’t check out,0,LOW,False,,,factcheck,2026-02-25T19:10:37.970704
"7 announcement: ""The CDC reports that 90% of healthcare spending treats chronic disease",http://www.politifact.com/factchecks/2026/feb/19/robert-f-kennedy-jr/chronic-disease-90-percent-health-spending-rfk/,www.politifact.com,PolitiFact | This chronic illness statistic touted by RFK Jr. and RealFood.gov doesn’t check out,0,LOW,False,,,factcheck,2026-02-25T19:10:38.177897
[DEBUNKED] Labour by-election bar chart fails to show poll put them level with the Greens – Full Fact,https://fullfact.org/politics/labour-opinium-bar-chart/,fullfact.org,Labour by-election bar chart fails to show poll put them level with the Greens – Full Fact,0.9,HIGH,True,FALSE - Debunked by fact-checkers,fullfact.org,factcheck,2026-02-25T19:10:38.829272
[DEBUNKED] The Representation of the People Bill does not protect UK democracy from misinformation – Full Fact,https://fullfact.org/politics/the-representation-of-the-people-bill-does-not-protect-uk-democracy-from-misinformation/,fullfact.org,The Representation of the People Bill does not protect UK democracy from misinformation – Full Fact,0.9,HIGH,True,FALSE - Debunked by fact-checkers,fullfact.org,factcheck,2026-02-25T19:10:39.822903
[DEBUNKED] The Gorton and Denton by-election: fact checked – Full Fact,https://fullfact.org/politics/gorton-and-denton-by-election-round-up/,fullfact.org,The Gorton and Denton by-election: fact checked – Full Fact,0.9,HIGH,True,FALSE - Debunked by fact-checkers,fullfact.org,factcheck,2026-02-25T19:10:40.472196
[DEBUNKED] Fake Andrew Mountbatten-Windsor mugshot circulates following arrest – Full Fact,https://fullfact.org/crime/andrew-mountbatten-windsor-mugshot-fake/,fullfact.org,Fake Andrew Mountbatten-Windsor mugshot circulates following arrest – Full Fact,0.9,HIGH,True,FALSE - Debunked by fact-checkers,fullfact.org,factcheck,2026-02-25T19:10:41.103529
[DEBUNKED] Nigel Farage has not introduced a ‘Parliamentary Allegiance Act’ – Full Fact,https://fullfact.org/politics/farage-parliamentary-allegiance/,fullfact.org,Nigel Farage has not introduced a ‘Parliamentary Allegiance Act’ – Full Fact,0.9,HIGH,True,FALSE - Debunked by fact-checkers,fullfact.org,factcheck,2026-02-25T19:10:41.774897
[DEBUNKED] Zarah Sultana MP has not been ‘thrown out of’ the House of Commons – Full Fact,https://fullfact.org/politics/zarah-sultana-thrown-out-commons-veterans-false/,fullfact.org,Zarah Sultana MP has not been ‘thrown out of’ the House of Commons – Full Fact,0.9,HIGH,True,FALSE - Debunked by fact-checkers,fullfact.org,factcheck,2026-02-25T19:10:42.445983
"[DEBUNKED] No, Kemi Badenoch didn’t use a Commons speech to accuse Zarah Sultana of ‘spewing hatred’ – Full Fact",https://fullfact.org/politics/fake-badenoch-sultana-comments/,fullfact.org,"No, Kemi Badenoch didn’t use a Commons speech to accuse Zarah Sultana of ‘spewing hatred’ – Full Fac",0.9,HIGH,True,FALSE - Debunked by fact-checkers,fullfact.org,factcheck,2026-02-25T19:10:42.944851
[DEBUNKED] Facebook post shares fake Angela Rayner and Suella Braverman quotes – Full Fact,https://fullfact.org/politics/rayner-braverman-fake-embarrass/,fullfact.org,Facebook post shares fake Angela Rayner and Suella Braverman quotes – Full Fact,0.9,HIGH,True,FALSE - Debunked by fact-checkers,fullfact.org,factcheck,2026-02-25T19:10:43.443945
[DEBUNKED] Are 350 ‘illegal boat migrants’ living in Gorton and Denton? – Full Fact,https://fullfact.org/immigration/gorton-and-denton-reform-small-boats/,fullfact.org,Are 350 ‘illegal boat migrants’ living in Gorton and Denton? – Full Fact,0.9,HIGH,True,FALSE - Debunked by fact-checkers,fullfact.org,factcheck,2026-02-25T19:10:44.086779
[DEBUNKED] FactChecking Trump&#039;s State of the Union Address - FactCheck.org,https://www.factcheck.org/2026/02/factchecking-trumps-state-of-the-union-address/,www.factcheck.org,FactChecking Trump&#039;s State of the Union Address - FactCheck.org,0.9,HIGH,True,FALSE - Debunked by fact-checkers,www.factcheck.org,factcheck,2026-02-25T19:10:44.149866
[DEBUNKED] A Pre-SOTU Guide to Trump&#039;s Economic Claims - FactCheck.org,https://www.factcheck.org/2026/02/a-pre-sotu-guide-to-trumps-economic-claims/,www.factcheck.org,A Pre-SOTU Guide to Trump&#039;s Economic Claims - FactCheck.org,0.9,HIGH,True,FALSE - Debunked by fact-checkers,www.factcheck.org,factcheck,2026-02-25T19:10:44.763096
[DEBUNKED] Trump and Musk Amplify Long-Ago Debunked Mail-In Vote Fraud Claim - FactCheck.org,https://www.factcheck.org/2026/02/trump-and-musk-amplify-long-ago-debunked-mail-in-vote-fraud-claim/,www.factcheck.org,Trump and Musk Amplify Long-Ago Debunked Mail-In Vote Fraud Claim - FactCheck.org,0.9,HIGH,True,FALSE - Debunked by fact-checkers,www.factcheck.org,factcheck,2026-02-25T19:10:45.431427
"6% in the first quarter of 2025, which covers the three months from January to March, real gross domestic product (meaning it has been adjusted for inflation) grew at an annualized rate of 3",https://www.factcheck.org/2026/02/trump-oversells-recent-u-s-economic-growth/,www.factcheck.org,Trump Oversells Recent U.S. Economic Growth - FactCheck.org,0,LOW,False,,,factcheck,2026-02-25T19:10:45.672073
8% in the second quarter of 2025 and at a rate of 4,https://www.factcheck.org/2026/02/trump-oversells-recent-u-s-economic-growth/,www.factcheck.org,Trump Oversells Recent U.S. Economic Growth - FactCheck.org,0,LOW,False,,,factcheck,2026-02-25T19:10:45.879734
"[DEBUNKED] WHO Didn’t Recommend Lockdowns, Contrary to Health Officials&#039; Suggestions - FactCheck.org",https://www.factcheck.org/2026/02/who-didnt-recommend-lockdowns-contrary-to-health-officials-suggestions/,www.factcheck.org,"WHO Didn’t Recommend Lockdowns, Contrary to Health Officials&#039; Suggestions - FactCheck.org",0.9,HIGH,True,FALSE - Debunked by fact-checkers,www.factcheck.org,factcheck,2026-02-25T19:10:46.497656
"Yet, Trump has repeatedly boasted that “factory construction” is up 41%",https://www.factcheck.org/2026/02/manufacturing-construction-spending-declines-under-trump/,www.factcheck.org,Manufacturing Construction Spending Declines Under Trump - FactCheck.org,0,LOW,False,,,factcheck,2026-02-25T19:10:47.055025
Trump cited the 41% statistic in a White House press conference on Jan,https://www.factcheck.org/2026/02/manufacturing-construction-spending-declines-under-trump/,www.factcheck.org,Manufacturing Construction Spending Declines Under Trump - FactCheck.org,0,LOW,False,,,factcheck,2026-02-25T19:10:47.259264
”&nbsp; “Investment in American factories is up 41%,https://www.factcheck.org/2026/02/manufacturing-construction-spending-declines-under-trump/,www.factcheck.org,Manufacturing Construction Spending Declines Under Trump - FactCheck.org,0,LOW,False,,,factcheck,2026-02-25T19:10:47.471842
[DEBUNKED] Fact Check: Sam Bankman-Fried Did NOT Offer AOC Bitcoin To Fund 2028 Presidential Campaign | Lead Stories,https://leadstories.com/hoax-alert/2026/02/fact-check-sam-bankman-fried-did-not-offer-aoc-bitcoin-to-find-2028-presidential-campaign.html,leadstories.com,Fact Check: Sam Bankman-Fried Did NOT Offer AOC Bitcoin To Fund 2028 Presidential Campaign | Lead St,0.9,HIGH,True,FALSE - Debunked by fact-checkers,leadstories.com,factcheck,2026-02-25T19:10:48.525953
"[DEBUNKED] Fact Check: Ghislaine Maxwell Was NOT Spotted In Québec, Canada -- AI Face Swap Video | Lead Stories",https://leadstories.com/hoax-alert/2026/02/fact-check-ghislains-maxwell-was-not-spotted-in-quebec-face-swap.html,leadstories.com,"Fact Check: Ghislaine Maxwell Was NOT Spotted In Québec, Canada -- AI Face Swap Video | Lead Stories",0.9,HIGH,True,FALSE - Debunked by fact-checkers,leadstories.com,factcheck,2026-02-25T19:10:48.682961
[DEBUNKED] Fact Check: FAKE Video Shows Specimen 9X At Blackridge Containment Facility In Nevada | Lead Stories,https://leadstories.com/hoax-alert/2026/02/fact-check-fake-video-shows-specimen-9x-blackridge-containment-facility-nevada.html,leadstories.com,Fact Check: FAKE Video Shows Specimen 9X At Blackridge Containment Facility In Nevada | Lead Stories,0.9,HIGH,True,FALSE - Debunked by fact-checkers,leadstories.com,factcheck,2026-02-25T19:10:48.850187
[DEBUNKED] Fact Check: FAKE Images Of Maria Julissa And 'El Mencho' -- Google AI Detector Says They Were Made By Google's AI | Lead Stories,https://leadstories.com/hoax-alert/2026/02/fact-check-fake-images-of-maria-julissa-and-el-mencho-created-by-ai.html,leadstories.com,Fact Check: FAKE Images Of Maria Julissa And 'El Mencho' -- Google AI Detector Says They Were Made B,0.9,HIGH,True,FALSE - Debunked by fact-checkers,leadstories.com,factcheck,2026-02-25T19:10:49.021685
"[DEBUNKED] Fact Check: Bruce Springsteen, Willie Nelson, Ringo Starr, Or Your Favorite Celeb Did NOT Call Trump Adviser Stephen Miller A 'Nazi' -- De Niro Did | Lead Stories",https://leadstories.com/hoax-alert/2026/02/fact-check-springsteen-nelson-starr-did-not-call-stephen-miller-a-nazi.html,leadstories.com,"Fact Check: Bruce Springsteen, Willie Nelson, Ringo Starr, Or Your Favorite Celeb Did NOT Call Trump",0.9,HIGH,True,FALSE - Debunked by fact-checkers,leadstories.com,factcheck,2026-02-25T19:10:49.197549
"[DEBUNKED] Fact Check: NO Mention of Blackface, Trudeau, Perry Or Drake In USA Hockey Captain Auston Matthews Post Gold Medal Game Interview | Lead Stories",https://leadstories.com/hoax-alert/2026/02/fact-check-team-usa-hockey-captain-auston-matthews-did-not-slam-canada-gold-medal-game.html,leadstories.com,"Fact Check: NO Mention of Blackface, Trudeau, Perry Or Drake In USA Hockey Captain Auston Matthews P",0.9,HIGH,True,FALSE - Debunked by fact-checkers,leadstories.com,factcheck,2026-02-25T19:10:49.355967
[DEBUNKED] Fact Check: C-SPAN DENIES 'John Barron' Caller Was Trump | Lead Stories,https://leadstories.com/hoax-alert/2026/02/fact-check-cspan-denied-caller-was-trump.html,leadstories.com,Fact Check: C-SPAN DENIES 'John Barron' Caller Was Trump | Lead Stories,0.9,HIGH,True,FALSE - Debunked by fact-checkers,leadstories.com,factcheck,2026-02-25T19:10:49.518911
[DEBUNKED] Fact Check: Mislabeled Photos Do NOT Show Austin Tucker Martin Or Demonstrate He Was Transgender -- Unidentified Person | Lead Stories,https://leadstories.com/hoax-alert/2026/02/fact-check-mislabeled-photos-do-not-show-austin-tucker-martin-is-transgender.html,leadstories.com,Fact Check: Mislabeled Photos Do NOT Show Austin Tucker Martin Or Demonstrate He Was Transgender -- ,0.9,HIGH,True,FALSE - Debunked by fact-checkers,leadstories.com,factcheck,2026-02-25T19:10:49.702192
[DEBUNKED] Fact Check: California Did NOT Give Coalition For Humane Immigrant Rights $100 Million Mainly To Pay Protesters | Lead Stories,https://leadstories.com/hoax-alert/2026/02/fact-check-california-did-not-give-coalition-for-humane-immigrant-rights-100-million-mainly-to-pay-protesters.html,leadstories.com,Fact Check: California Did NOT Give Coalition For Humane Immigrant Rights $100 Million Mainly To Pay,0.9,HIGH,True,FALSE - Debunked by fact-checkers,leadstories.com,factcheck,2026-02-25T19:10:49.895951
"[DEBUNKED] Fact Check: Patel, Kennedy, Buttigieg, Vince Gill, Others Are Not Demanding Obama Return Millions From 'Ownership' of Obamacare | Lead Stories",https://leadstories.com/hoax-alert/2026/02/fact-check-fake-story-says-obama-collects-obamacare-royalty-and-should-refund-them.html,leadstories.com,"Fact Check: Patel, Kennedy, Buttigieg, Vince Gill, Others Are Not Demanding Obama Return Millions Fr",0.9,HIGH,True,FALSE - Debunked by fact-checkers,leadstories.com,factcheck,2026-02-25T19:10:50.050245
[DEBUNKED] Fact Check: Video Of Erika Kirk Dancing In Front Of 'Charlie Kirk Memorial Highway' Sign In Arizona Is NOT Real | Lead Stories,https://leadstories.com/hoax-alert/2026/02/fact-check-video-of-erika-kirk-dancing-in-front-of-charlie-kirk-memorial-highway-sign-is-not-real.html,leadstories.com,Fact Check: Video Of Erika Kirk Dancing In Front Of 'Charlie Kirk Memorial Highway' Sign In Arizona ,0.9,HIGH,True,FALSE - Debunked by fact-checkers,leadstories.com,factcheck,2026-02-25T19:10:50.218871
[DEBUNKED] Fact Check: Plane Fire Image After Mexican Army Killed Cartel Leader Is AI-Generated -- No Such Plane Attacks Occurred | Lead Stories,https://leadstories.com/hoax-alert/2026/02/fact-check-plane-fire-picture-after-cartel-leader-killing-is-ai-generated.html,leadstories.com,Fact Check: Plane Fire Image After Mexican Army Killed Cartel Leader Is AI-Generated -- No Such Plan,0.9,HIGH,True,FALSE - Debunked by fact-checkers,leadstories.com,factcheck,2026-02-25T19:10:50.391375
"[DEBUNKED] Fact Check: Image Of Buildings On Fire Is NOT Real Photo Of Puerto Vallarta, Mexico  | Lead Stories",https://leadstories.com/hoax-alert/2026/02/fact-check-image-of-buildings-on-fire-is-not-real-photo-of-puerto-vallarta.html,leadstories.com,"Fact Check: Image Of Buildings On Fire Is NOT Real Photo Of Puerto Vallarta, Mexico  | Lead Stories",0.9,HIGH,True,FALSE - Debunked by fact-checkers,leadstories.com,factcheck,2026-02-25T19:10:50.564160
[DEBUNKED] Fact Check: Bernie Sanders Joke Meme About Owning Companies And Bank Accounts In China Originated On Satire Page | Lead Stories,https://leadstories.com/hoax-alert/2026/02/fact-check-bernie-sanders-china-companies-bank-accounts-national-intelligence-agency.html,leadstories.com,Fact Check: Bernie Sanders Joke Meme About Owning Companies And Bank Accounts In China Originated On,0.9,HIGH,True,FALSE - Debunked by fact-checkers,leadstories.com,factcheck,2026-02-25T19:10:50.739594
[DEBUNKED] Fact Check: Jon Stewart Did NOT Livestream The 'Dark Side' Of Virginia Giuffre Case From Home; NO 3.2 Billion Views -- It's Viet Spam | Lead Stories,https://leadstories.com/hoax-alert/2026/02/fact-check-jon-stewart-did-not-livestream-from-home-virginia-giuffre-case.html,leadstories.com,Fact Check: Jon Stewart Did NOT Livestream The 'Dark Side' Of Virginia Giuffre Case From Home; NO 3.,0.9,HIGH,True,FALSE - Debunked by fact-checkers,leadstories.com,factcheck,2026-02-25T19:10:50.904162
"[DEBUNKED] How did the media react to Trump’s long, long speech? - Poynter",https://www.poynter.org/commentary/2026/reaction-donald-trump-state-union-address/,www.poynter.org,"How did the media react to Trump’s long, long speech? - Poynter",0.9,HIGH,True,FALSE - Debunked by fact-checkers,www.poynter.org,factcheck,2026-02-25T19:10:51.147108
"That’s lower than the year-over-year rate when he took office in January 2025, but it had already fallen from a peak of roughly 9% in the summer",https://www.poynter.org/fact-checking/2026/trump-state-of-the-union-fact-check/,www.poynter.org,"A fact check of Trump’s State of the Union finds exaggerations on inflation, gas prices and immigrat",0.1,LOW,False,,,factcheck,2026-02-25T19:10:51.490291
"Promises kept Trump has kept about 19% of his promises, including on his first day, when he pardoned the defendants of the Jan",https://www.poynter.org/fact-checking/2026/has-trump-kept-campaign-promises/,www.poynter.org,Donald Trump says he kept his campaign promises. The record is more complicated. - Poynter,0,LOW,False,,,factcheck,2026-02-25T19:10:52.615563
"Calls rose 42% from the 2022-23 school year to 2024-25, he said",https://www.poynter.org/educators-students/2026/student-newspaper-challenges-business-censorship/,www.poynter.org,"Cash-starved and censored, America’s student newspapers are fighting to survive - Poynter",0,LOW,False,,,factcheck,2026-02-25T19:10:52.949373
