claim,source_url,source_domain,article_title,risk_score,risk_category,has_factcheck,factcheck_rating,factcheck_source,source_type,checked_at
"[DEBUNKED] Fact Check: 'Lock Him Up For Lying To Congress' NOT Real Quote From Gavin Newsom, Others -- Foreign Clickbait | Lead Stories",https://leadstories.com/hoax-alert/2026/03/fact-check-lock-him-up-for-lying-to-congress-not-real-quote-from-gavin-newsom-others-foreign-clickbait.html,leadstories.com,"Fact Check: 'Lock Him Up For Lying To Congress' NOT Real Quote From Gavin Newsom, Others -- Foreign ",0.9,HIGH,True,FALSE - Debunked by fact-checkers,leadstories.com,factcheck,2026-03-29T07:08:15.487061
"[DEBUNKED] Fact Check: Mark Twain Did NOT Say, 'If You Don't Read The Newspaper, You're Uninformed. If You Do Read It, You're Misinformed' | Lead Stories",https://leadstories.com/hoax-alert/2026/03/fact-check-mark-twain-did-not-say-if-you-dont-read-the-newspaper-youre-uninformed-if-you-do-read-it-youre-misinformed.html,leadstories.com,"Fact Check: Mark Twain Did NOT Say, 'If You Don't Read The Newspaper, You're Uninformed. If You Do R",0.9,HIGH,True,FALSE - Debunked by fact-checkers,leadstories.com,factcheck,2026-03-29T07:08:15.622964
"[DEBUNKED] Fact Check: Video Of Transgender, LGBTQ+ People Blocked From Women's Restrooms Is NOT Real Footage | Lead Stories",https://leadstories.com/hoax-alert/2026/03/fact-check-video-of-transgender-lgbtq-people-blocked-from-womens-restrooms-is-not-real-footage.html,leadstories.com,"Fact Check: Video Of Transgender, LGBTQ+ People Blocked From Women's Restrooms Is NOT Real Footage |",0.9,HIGH,True,FALSE - Debunked by fact-checkers,leadstories.com,factcheck,2026-03-29T07:08:15.849407
[DEBUNKED] Fact Check: Photo Does NOT Show Hillary Clinton Pulling Jeffrey Epstein's Tie In Front Of Bill Clinton -- It's AI-Generated | Lead Stories,https://leadstories.com/hoax-alert/2026/03/fact-check-photo-does-not-show-hillary-clinton-pulling-jeffrey-epsteins-tie-in-front-of-bill-clinton.html,leadstories.com,Fact Check: Photo Does NOT Show Hillary Clinton Pulling Jeffrey Epstein's Tie In Front Of Bill Clint,0.9,HIGH,True,FALSE - Debunked by fact-checkers,leadstories.com,factcheck,2026-03-29T07:08:16.010245
[DEBUNKED] Fact Check: Skit Of ICE Agent Removing a U.S. Citizen From A Plane Is NOT Real | Lead Stories,https://leadstories.com/hoax-alert/2026/03/fact-check-skit-ice-agent-remove-us-citizen-plane-not-real.html,leadstories.com,Fact Check: Skit Of ICE Agent Removing a U.S. Citizen From A Plane Is NOT Real | Lead Stories,0.9,HIGH,True,FALSE - Debunked by fact-checkers,leadstories.com,factcheck,2026-03-29T07:08:16.161418
[DEBUNKED] Fact Check: Lunch Date Video Does NOT Show Real Woman Confronted By Her Husband For Cheating -- It's Staged Scene | Lead Stories,https://leadstories.com/hoax-alert/2026/03/fact-check-lunch-date-video-does-not-show-real-woman-confronted-by-her-husband-for-cheating.html,leadstories.com,Fact Check: Lunch Date Video Does NOT Show Real Woman Confronted By Her Husband For Cheating -- It's,0.9,HIGH,True,FALSE - Debunked by fact-checkers,leadstories.com,factcheck,2026-03-29T07:08:16.315500
[DEBUNKED] Fact Check: Video Does NOT Show Iranian Missiles Destroying U.S. Navy Warship In Strait Of Hormuz | Lead Stories,https://leadstories.com/hoax-alert/2026/03/fact-check-video-does-not-show-iranian-missiles-destroying-us-navy-warship-in-strait-of-hormuz.html,leadstories.com,Fact Check: Video Does NOT Show Iranian Missiles Destroying U.S. Navy Warship In Strait Of Hormuz | ,0.9,HIGH,True,FALSE - Debunked by fact-checkers,leadstories.com,factcheck,2026-03-29T07:08:16.475071
"[DEBUNKED] Fact Check: Erika Kirk Did NOT Announce She Is Opening An Orphanage ""In Honor Of Charlie"" -- It's A False Rumor Started From Clickbait | Lead Stories",https://leadstories.com/hoax-alert/2026/03/fact-check-erika-kirk-did-not-announce-she-is-opening-an-orphanage-in-honor-of-charlie.html,leadstories.com,"Fact Check: Erika Kirk Did NOT Announce She Is Opening An Orphanage ""In Honor Of Charlie"" -- It's A ",0.9,HIGH,True,FALSE - Debunked by fact-checkers,leadstories.com,factcheck,2026-03-29T07:08:16.624790
"[DEBUNKED] Fact Check: FAKE Photo Shows Hollywood Actors, Including Stallone and Schwarzenegger, Attending Chuck Norris' Funeral -- It's AI | Lead Stories",https://leadstories.com/hoax-alert/2026/03/fact-check-fake-photo-shows-hollywood-actors-including-stallone-and-schwarzenegger-attending-chuck-norris-funeral.html,leadstories.com,"Fact Check: FAKE Photo Shows Hollywood Actors, Including Stallone and Schwarzenegger, Attending Chuc",0.9,HIGH,True,FALSE - Debunked by fact-checkers,leadstories.com,factcheck,2026-03-29T07:08:16.768704
[DEBUNKED] Fact Check: Wolff's Book About Trump Does NOT Mention 'Gorilla Channel' -- It's A Joke From 2018 | Lead Stories,https://leadstories.com/hoax-alert/2026/03/fact-check-wolffs-book-about-trump-does-not-mention-gorilla-channel.html,leadstories.com,Fact Check: Wolff's Book About Trump Does NOT Mention 'Gorilla Channel' -- It's A Joke From 2018 | L,0.9,HIGH,True,FALSE - Debunked by fact-checkers,leadstories.com,factcheck,2026-03-29T07:08:16.911813
[DEBUNKED] Fact Check: Lufthansa Did NOT Offer Free Business Class Tickets To People In Israel To Apologize For Holocaust | Lead Stories,https://leadstories.com/hoax-alert/2026/03/fact-check-lufthansa-did-not-offer-free-business-class-tickets-to-people-in-israel-to-apologize-for-holocaust.html,leadstories.com,Fact Check: Lufthansa Did NOT Offer Free Business Class Tickets To People In Israel To Apologize For,0.9,HIGH,True,FALSE - Debunked by fact-checkers,leadstories.com,factcheck,2026-03-29T07:08:17.066304
[DEBUNKED] Fact Check: Trump Did NOT Announce That Everyone Born Before 2000 Would Have All Debt Erased | Lead Stories,https://leadstories.com/hoax-alert/2026/03/fact-check-trump-did-not-announce-that-everyone-born-before-2000-would-have-all-debt-erased.html,leadstories.com,Fact Check: Trump Did NOT Announce That Everyone Born Before 2000 Would Have All Debt Erased | Lead ,0.9,HIGH,True,FALSE - Debunked by fact-checkers,leadstories.com,factcheck,2026-03-29T07:08:17.208898
[DEBUNKED] Fact Check: Trump Did NOT Say Queen Elizabeth Should Pardon Prince Andrew -- Satire Post | Lead Stories,https://leadstories.com/hoax-alert/2026/03/fact-check-trump-did-not-say-queen-elizabeth-should-pardon-prince-andrew-satire.html,leadstories.com,Fact Check: Trump Did NOT Say Queen Elizabeth Should Pardon Prince Andrew -- Satire Post | Lead Stor,0.9,HIGH,True,FALSE - Debunked by fact-checkers,leadstories.com,factcheck,2026-03-29T07:08:17.359575
[DEBUNKED] Savannah Guthrie opens up about mother’s disappearance in heart-wrenching interview - Poynter,https://www.poynter.org/commentary/2026/savannah-guthrie-today-show-interview-hoda/,www.poynter.org,Savannah Guthrie opens up about mother’s disappearance in heart-wrenching interview - Poynter,0.9,HIGH,True,FALSE - Debunked by fact-checkers,www.poynter.org,factcheck,2026-03-29T07:08:17.455037
"(AP Photo/Julie Jacobson) By: Amaris Castillo March 26, 2026 --> --> About a quarter of all AM/FM radio stations in the United States have a faith focus, and 98% of U",https://www.poynter.org/reporting-editing/2026/christian-news-radio-united-states/,www.poynter.org,"A quarter of US radio stations are religious, and most listeners aren’t tuning in for politics, stud",0,LOW,False,,,factcheck,2026-03-29T07:08:17.713776
"Among listeners, 62% of those surveyed said they tune in because the content is “spiritually uplifting",https://www.poynter.org/reporting-editing/2026/christian-news-radio-united-states/,www.poynter.org,"A quarter of US radio stations are religious, and most listeners aren’t tuning in for politics, stud",0,LOW,False,,,factcheck,2026-03-29T07:08:17.791999
"Forty percent said those topics are a minor reason for listening to these stations, and just 14% called it a major one",https://www.poynter.org/reporting-editing/2026/christian-news-radio-united-states/,www.poynter.org,"A quarter of US radio stations are religious, and most listeners aren’t tuning in for politics, stud",0.1,LOW,False,,,factcheck,2026-03-29T07:08:17.851456
[DEBUNKED] IFCN Director Angie Drobnic Holan comments on Meta and community notes following the Oversight Board’s recent advisory - Poynter,https://www.poynter.org/ifcn/2026/ifcn-director-angie-drobnic-holan-comments-on-meta-and-community-notes-following-the-oversight-boards-recent-advisory/,www.poynter.org,IFCN Director Angie Drobnic Holan comments on Meta and community notes following the Oversight Board,0.9,HIGH,True,FALSE - Debunked by fact-checkers,www.poynter.org,factcheck,2026-03-29T07:08:17.934412
"Meta is responsible for 70% of that, while YouTube is responsible for the other 30%",https://www.poynter.org/commentary/2026/meta-and-youtube-lawsuit-social-media-addiction/,www.poynter.org,Big Tech just lost a ‘social media addiction’ case. It may not be the last. - Poynter,0,LOW,False,,,factcheck,2026-03-29T07:08:18.078911
"(Courtesy: Spencer Najera) By: Alex Mahadevan March 26, 2026 --> --> Of the 440 applications Texas Tribune chief product officer Darla Cameron received for an AI engineering role, 90% were junk",https://www.poynter.org/tech-tools/2026/how-to-start-using-ai-journalism/,www.poynter.org,AI advice from journalists who stopped talking and started building - Poynter,0,LOW,False,,,factcheck,2026-03-29T07:08:18.221344
"At the Pew Research Center, audience editor Claire Dannenbaum noticed her team was spending 95% of its time writing formulaic social media posts and only 5% actually engaging with audiences",https://www.poynter.org/tech-tools/2026/how-to-start-using-ai-journalism/,www.poynter.org,AI advice from journalists who stopped talking and started building - Poynter,0,LOW,False,,,factcheck,2026-03-29T07:08:18.285077
"[DEBUNKED] Who is keeping the war with Iran going? Trump, once again, blames the media. - Poynter",https://www.poynter.org/commentary/2026/trump-blames-media-war-iran/,www.poynter.org,"Who is keeping the war with Iran going? Trump, once again, blames the media. - Poynter",0.9,HIGH,True,FALSE - Debunked by fact-checkers,www.poynter.org,factcheck,2026-03-29T07:08:18.405487
"About 95% of TSA’s 60,000 employees are considered essential workers",https://www.poynter.org/fact-checking/2026/why-is-tsa-not-being-paid-ice-is/,www.poynter.org,Why are ICE agents still being paid during the shutdown while TSA workers aren’t? - Poynter,0,LOW,False,,,factcheck,2026-03-29T07:08:18.624195
"Zum Login SPIEGEL plus Nur für Neukunden € 1,– für 4 Wochen danach € 5,99 pro Woche Freier Zugriff auf alle S+-Artikel auf SPIEGEL",https://www.spiegel.de/politik/deutschland/news-spd-lars-klingbeil-spiegel-cover-iran-krieg-donald-trump-collien-fernandes-christian-ulmen-a-958627d5-4a9f-4eb0-a930-6cda0e9f8902#ref=rss,www.spiegel.de,"News: SPD, Lars Klingbeil, SPIEGEL-Cover, Iran-Krieg, Donald Trump, Collien Fernandes, Christian Ulm",0.1,LOW,False,,,mainstream,2026-03-29T07:08:29.958523
"E-Paper (PDF), Digital-Archiv und S+-Newsletter Jederzeit kündigen Jetzt abonnieren SPIEGEL plus 52 Wochen 25 % sparen € 4,49 pro Woche für 52 Wochen danach € 5,99 pro Woche Freier Zugriff auf alle S+-Artikel auf SPIEGEL",https://www.spiegel.de/politik/deutschland/news-spd-lars-klingbeil-spiegel-cover-iran-krieg-donald-trump-collien-fernandes-christian-ulmen-a-958627d5-4a9f-4eb0-a930-6cda0e9f8902#ref=rss,www.spiegel.de,"News: SPD, Lars Klingbeil, SPIEGEL-Cover, Iran-Krieg, Donald Trump, Collien Fernandes, Christian Ulm",0.1,LOW,False,,,mainstream,2026-03-29T07:08:30.013390
"Zum Login SPIEGEL plus Nur für Neukunden € 1,– für 4 Wochen danach € 5,99 pro Woche Freier Zugriff auf alle S+-Artikel auf SPIEGEL",https://www.spiegel.de/ausland/kuba-sandro-castro-fidel-castros-enkel-macht-auf-influencer-a-d3e68615-3ff5-48b0-a978-1e343534a134#ref=rss,www.spiegel.de,Kuba: Sandro Castro – Fidel Castros Enkel macht auf Influencer - DER SPIEGEL,0.1,LOW,False,,,mainstream,2026-03-29T07:08:31.303082
"E-Paper (PDF), Digital-Archiv und S+-Newsletter Jederzeit kündigen Jetzt abonnieren SPIEGEL plus 52 Wochen 25 % sparen € 4,49 pro Woche für 52 Wochen danach € 5,99 pro Woche Freier Zugriff auf alle S+-Artikel auf SPIEGEL",https://www.spiegel.de/ausland/kuba-sandro-castro-fidel-castros-enkel-macht-auf-influencer-a-d3e68615-3ff5-48b0-a978-1e343534a134#ref=rss,www.spiegel.de,Kuba: Sandro Castro – Fidel Castros Enkel macht auf Influencer - DER SPIEGEL,0.1,LOW,False,,,mainstream,2026-03-29T07:08:31.369473
"Zum Login SPIEGEL plus Nur für Neukunden € 1,– für 4 Wochen danach € 5,99 pro Woche Freier Zugriff auf alle S+-Artikel auf SPIEGEL",https://www.spiegel.de/sport/schach/matthias-bluebaum-spielt-im-schach-kandidatenturnier-wie-sind-seine-chancen-a-e6887347-f64f-45d3-94ee-e9ab6d75502c#ref=rss,www.spiegel.de,Matthias Blübaum spielt im Schach-Kandidatenturnier: Wie sind seine Chancen? - DER SPIEGEL,0.1,LOW,False,,,mainstream,2026-03-29T07:08:32.132155
"E-Paper (PDF), Digital-Archiv und S+-Newsletter Jederzeit kündigen Jetzt abonnieren SPIEGEL plus 52 Wochen 25 % sparen € 4,49 pro Woche für 52 Wochen danach € 5,99 pro Woche Freier Zugriff auf alle S+-Artikel auf SPIEGEL",https://www.spiegel.de/sport/schach/matthias-bluebaum-spielt-im-schach-kandidatenturnier-wie-sind-seine-chancen-a-e6887347-f64f-45d3-94ee-e9ab6d75502c#ref=rss,www.spiegel.de,Matthias Blübaum spielt im Schach-Kandidatenturnier: Wie sind seine Chancen? - DER SPIEGEL,0.1,LOW,False,,,mainstream,2026-03-29T07:08:32.192979
"Zum Login SPIEGEL plus Nur für Neukunden € 1,– für 4 Wochen danach € 5,99 pro Woche Freier Zugriff auf alle S+-Artikel auf SPIEGEL",https://www.spiegel.de/mobilitaet/berlin-wie-autofahrer-und-autogegner-sich-im-streit-um-poller-aufreiben-a-f5036254-3e67-4a06-84d2-63c675b3b6ea#ref=rss,www.spiegel.de,Berlin: Wie Autofahrer und Autogegner sich im Streit um Poller aufreiben - DER SPIEGEL,0.1,LOW,False,,,mainstream,2026-03-29T07:08:33.716952
"E-Paper (PDF), Digital-Archiv und S+-Newsletter Jederzeit kündigen Jetzt abonnieren SPIEGEL plus 52 Wochen 25 % sparen € 4,49 pro Woche für 52 Wochen danach € 5,99 pro Woche Freier Zugriff auf alle S+-Artikel auf SPIEGEL",https://www.spiegel.de/mobilitaet/berlin-wie-autofahrer-und-autogegner-sich-im-streit-um-poller-aufreiben-a-f5036254-3e67-4a06-84d2-63c675b3b6ea#ref=rss,www.spiegel.de,Berlin: Wie Autofahrer und Autogegner sich im Streit um Poller aufreiben - DER SPIEGEL,0.1,LOW,False,,,mainstream,2026-03-29T07:08:33.781011
"Zum Login SPIEGEL plus Nur für Neukunden € 1,– für 4 Wochen danach € 5,99 pro Woche Freier Zugriff auf alle S+-Artikel auf SPIEGEL",https://www.spiegel.de/wissenschaft/medizin/abnehmspritze-welche-dosis-ist-die-richtige-a-02a9b27f-7c1d-468f-8db0-bc1025b936d8#ref=rss,www.spiegel.de,Abnehmspritze: Welche Dosis ist die richtige? - DER SPIEGEL,0.1,LOW,False,,,mainstream,2026-03-29T07:08:35.099958
"E-Paper (PDF), Digital-Archiv und S+-Newsletter Jederzeit kündigen Jetzt abonnieren SPIEGEL plus 52 Wochen 25 % sparen € 4,49 pro Woche für 52 Wochen danach € 5,99 pro Woche Freier Zugriff auf alle S+-Artikel auf SPIEGEL",https://www.spiegel.de/wissenschaft/medizin/abnehmspritze-welche-dosis-ist-die-richtige-a-02a9b27f-7c1d-468f-8db0-bc1025b936d8#ref=rss,www.spiegel.de,Abnehmspritze: Welche Dosis ist die richtige? - DER SPIEGEL,0.1,LOW,False,,,mainstream,2026-03-29T07:08:35.156799
"Zum Login SPIEGEL plus Nur für Neukunden € 1,– für 4 Wochen danach € 5,99 pro Woche Freier Zugriff auf alle S+-Artikel auf SPIEGEL",https://www.spiegel.de/ausland/cpac-konferenz-in-texas-wie-donald-trump-anhaenger-sich-den-iran-krieg-schoenreden-a-8135c537-255a-4282-83d8-201de0ff81d3#ref=rss,www.spiegel.de,CPAC-Konferenz in Texas: Wie Donald-Trump-Anhänger sich den Iran-Krieg schönreden - DER SPIEGEL,0.1,LOW,False,,,mainstream,2026-03-29T07:08:35.914231
"E-Paper (PDF), Digital-Archiv und S+-Newsletter Jederzeit kündigen Jetzt abonnieren SPIEGEL plus 52 Wochen 25 % sparen € 4,49 pro Woche für 52 Wochen danach € 5,99 pro Woche Freier Zugriff auf alle S+-Artikel auf SPIEGEL",https://www.spiegel.de/ausland/cpac-konferenz-in-texas-wie-donald-trump-anhaenger-sich-den-iran-krieg-schoenreden-a-8135c537-255a-4282-83d8-201de0ff81d3#ref=rss,www.spiegel.de,CPAC-Konferenz in Texas: Wie Donald-Trump-Anhänger sich den Iran-Krieg schönreden - DER SPIEGEL,0.1,LOW,False,,,mainstream,2026-03-29T07:08:35.972233
"Mehr Glück in Liebe und Beziehung – immer sonntags image""> Foto: Ausgabe Nr",https://www.spiegel.de/partnerschaft/freundschaft-koennen-maenner-und-frauen-nur-befreundet-sein-a-6d42be16-0b87-447c-8554-ba58d3009548#ref=rss,www.spiegel.de,Freundschaft: Können Männer und Frauen nur befreundet sein? - DER SPIEGEL,0.1,LOW,False,,,mainstream,2026-03-29T07:08:36.851135
2026 • Alle Ausgaben Sie können den Artikel leider nicht mehr aufrufen,https://www.spiegel.de/partnerschaft/freundschaft-koennen-maenner-und-frauen-nur-befreundet-sein-a-6d42be16-0b87-447c-8554-ba58d3009548#ref=rss,www.spiegel.de,Freundschaft: Können Männer und Frauen nur befreundet sein? - DER SPIEGEL,0.1,LOW,False,,,mainstream,2026-03-29T07:08:36.916875
"Zum Login SPIEGEL plus Nur für Neukunden € 1,– für 4 Wochen danach € 5,99 pro Woche Freier Zugriff auf alle S+-Artikel auf SPIEGEL",https://www.spiegel.de/partnerschaft/freundschaft-koennen-maenner-und-frauen-nur-befreundet-sein-a-6d42be16-0b87-447c-8554-ba58d3009548#ref=rss,www.spiegel.de,Freundschaft: Können Männer und Frauen nur befreundet sein? - DER SPIEGEL,0.1,LOW,False,,,mainstream,2026-03-29T07:08:36.982397
"Mehr Glück in Liebe und Beziehung – immer sonntags image""> Foto: Dima Sikorski / Stocksy Ausgabe Nr",https://www.spiegel.de/partnerschaft/freundschaft-vom-besten-freund-zur-grossen-liebe-a-6f9ba17e-6e7f-438f-823f-4da4d92b45c2#ref=rss,www.spiegel.de,Freundschaft: Vom besten Freund zur großen Liebe - DER SPIEGEL,0.1,LOW,False,,,mainstream,2026-03-29T07:08:38.274918
2026 • Alle Ausgaben Sie können den Artikel leider nicht mehr aufrufen,https://www.spiegel.de/partnerschaft/freundschaft-vom-besten-freund-zur-grossen-liebe-a-6f9ba17e-6e7f-438f-823f-4da4d92b45c2#ref=rss,www.spiegel.de,Freundschaft: Vom besten Freund zur großen Liebe - DER SPIEGEL,0.1,LOW,False,,,mainstream,2026-03-29T07:08:38.332105
"Zum Login SPIEGEL plus Nur für Neukunden € 1,– für 4 Wochen danach € 5,99 pro Woche Freier Zugriff auf alle S+-Artikel auf SPIEGEL",https://www.spiegel.de/partnerschaft/freundschaft-vom-besten-freund-zur-grossen-liebe-a-6f9ba17e-6e7f-438f-823f-4da4d92b45c2#ref=rss,www.spiegel.de,Freundschaft: Vom besten Freund zur großen Liebe - DER SPIEGEL,0.1,LOW,False,,,mainstream,2026-03-29T07:08:38.391918
Bei ‌einer am Samstag veröffentlichten Testabstimmung bei dem Treffen im texanischen Grapevine erhielt Vance rund 53 Prozent der mehr als 1600 Stimmen,https://www.spiegel.de/ausland/jd-vance-bei-cpac-in-texas-zum-favoriten-fuer-nachfolge-von-donald-trump-gekuert-a-e589b4f7-7638-4104-95de-1d561af87061#ref=rss,www.spiegel.de,JD Vance bei CPAC in Texas zum Favoriten für Nachfolge von Donald Trump gekürt - DER SPIEGEL,0,LOW,False,,,mainstream,2026-03-29T07:08:39.141610
Auf dem zweiten Platz landete US-Außenminister Marco Rubio mit 35 Prozent,https://www.spiegel.de/ausland/jd-vance-bei-cpac-in-texas-zum-favoriten-fuer-nachfolge-von-donald-trump-gekuert-a-e589b4f7-7638-4104-95de-1d561af87061#ref=rss,www.spiegel.de,JD Vance bei CPAC in Texas zum Favoriten für Nachfolge von Donald Trump gekürt - DER SPIEGEL,0,LOW,False,,,mainstream,2026-03-29T07:08:39.200416
"Die Abstimmung ⁠erlaubt ⁠zwar keine Vorhersage, wer letztlich Präsidentschaftskandidat wird",https://www.spiegel.de/ausland/jd-vance-bei-cpac-in-texas-zum-favoriten-fuer-nachfolge-von-donald-trump-gekuert-a-e589b4f7-7638-4104-95de-1d561af87061#ref=rss,www.spiegel.de,JD Vance bei CPAC in Texas zum Favoriten für Nachfolge von Donald Trump gekürt - DER SPIEGEL,0.1,LOW,False,,,mainstream,2026-03-29T07:08:39.259440
Den offiziellen Angaben zufolge&nbsp; kam es gegen 21,https://www.spiegel.de/panorama/derby-in-grossbritannien-auto-fahrer-faehrt-in-innenstadt-in-menschenmenge-mehrere-verletzte-a-d25a7def-ba30-441b-afc7-bf39b00c2a69#ref=rss,www.spiegel.de,Derby in Großbritannien: Auto-Fahrer fährt in Innenstadt in Menschenmenge – mehrere Verletzte - DER ,0,LOW,False,,,mainstream,2026-03-29T07:08:39.998940
"Zum Login SPIEGEL plus Nur für Neukunden € 1,– für 4 Wochen danach € 5,99 pro Woche Freier Zugriff auf alle S+-Artikel auf SPIEGEL",https://www.spiegel.de/kultur/zurueck-in-die-zukunft-als-musical-hier-wird-vor-allem-fuer-das-auto-geklatscht-a-7e576701-8051-40f6-8840-0136116c88dc#ref=rss,www.spiegel.de,»Zurück in die Zukunft« als Musical: Hier wird vor allem für das Auto geklatscht - DER SPIEGEL,0.1,LOW,False,,,mainstream,2026-03-29T07:08:41.445809
"E-Paper (PDF), Digital-Archiv und S+-Newsletter Jederzeit kündigen Jetzt abonnieren SPIEGEL plus 52 Wochen 25 % sparen € 4,49 pro Woche für 52 Wochen danach € 5,99 pro Woche Freier Zugriff auf alle S+-Artikel auf SPIEGEL",https://www.spiegel.de/kultur/zurueck-in-die-zukunft-als-musical-hier-wird-vor-allem-fuer-das-auto-geklatscht-a-7e576701-8051-40f6-8840-0136116c88dc#ref=rss,www.spiegel.de,»Zurück in die Zukunft« als Musical: Hier wird vor allem für das Auto geklatscht - DER SPIEGEL,0.1,LOW,False,,,mainstream,2026-03-29T07:08:41.504052
"Zum Login SPIEGEL plus Nur für Neukunden € 1,– für 4 Wochen danach € 5,99 pro Woche Freier Zugriff auf alle S+-Artikel auf SPIEGEL",https://www.spiegel.de/wirtschaft/unternehmen/donald-trump-liebt-florsheim-schuhe-doch-die-firma-ist-so-gar-nicht-auf-seiner-linie-a-6cb59d25-210e-491e-b2c3-1718cc9e956f#ref=rss,www.spiegel.de,Donald Trump liebt Florsheim-Schuhe – doch die Firma ist so gar nicht auf seiner Linie - DER SPIEGEL,0.1,LOW,False,,,mainstream,2026-03-29T07:08:42.255789
"E-Paper (PDF), Digital-Archiv und S+-Newsletter Jederzeit kündigen Jetzt abonnieren SPIEGEL plus 52 Wochen 25 % sparen € 4,49 pro Woche für 52 Wochen danach € 5,99 pro Woche Freier Zugriff auf alle S+-Artikel auf SPIEGEL",https://www.spiegel.de/wirtschaft/unternehmen/donald-trump-liebt-florsheim-schuhe-doch-die-firma-ist-so-gar-nicht-auf-seiner-linie-a-6cb59d25-210e-491e-b2c3-1718cc9e956f#ref=rss,www.spiegel.de,Donald Trump liebt Florsheim-Schuhe – doch die Firma ist so gar nicht auf seiner Linie - DER SPIEGEL,0.1,LOW,False,,,mainstream,2026-03-29T07:08:42.317055
"Kebede said schools would struggle to fund an increase in teachers&#x27; pay of even 2% next year from their budgets, and the inclusion fund would &quot;merely soften the blow of underfunding&quot;",https://www.bbc.com/news/articles/c15dzz8z153o?at_medium=RSS&amp;at_campaign=rss,www.bbc.com,"Schools do not have enough staff to make SEND reforms work, union warns",0,LOW,False,,,mainstream,2026-03-29T07:08:43.209448
"According to the union, 86% of teachers responding said insufficient staff was a barrier to inclusion, followed by 73% who identified workload as a barrier",https://www.bbc.com/news/articles/c15dzz8z153o?at_medium=RSS&amp;at_campaign=rss,www.bbc.com,"Schools do not have enough staff to make SEND reforms work, union warns",0,LOW,False,,,mainstream,2026-03-29T07:08:43.271048
