claim,source_url,source_domain,article_title,risk_score,risk_category,has_factcheck,factcheck_rating,factcheck_source,source_type,checked_at
[DEBUNKED] False claims about sunglasses shared on Facebook again – Full Fact,https://fullfact.org/health/moritz-sunglasses-cancer-repeat/,fullfact.org,False claims about sunglasses shared on Facebook again – Full Fact,0.9,HIGH,True,FALSE - Debunked by fact-checkers,fullfact.org,factcheck,2026-05-28T16:02:22.148697
[DEBUNKED] AI-generated images of women in niqabs being turned away from Tesco stores circulate online – Full Fact,https://fullfact.org/culture-and-society/ai-generated-tesco-niqab-ban-false/,fullfact.org,AI-generated images of women in niqabs being turned away from Tesco stores circulate online – Full F,0.9,HIGH,True,FALSE - Debunked by fact-checkers,fullfact.org,factcheck,2026-05-28T16:02:22.795962
[DEBUNKED] Trump Distorts Maryland&#039;s Primary Ballot Mix-up to Attack Mail-in Voting - FactCheck.org,https://www.factcheck.org/2026/05/trump-distorts-marylands-primary-ballot-mix-up-to-attack-mail-in-voting/,www.factcheck.org,Trump Distorts Maryland&#039;s Primary Ballot Mix-up to Attack Mail-in Voting - FactCheck.org,0.9,HIGH,True,FALSE - Debunked by fact-checkers,www.factcheck.org,factcheck,2026-05-28T16:02:23.497421
[DEBUNKED] RFK Jr.’s Muddled Claims on Drug Approval Speed - FactCheck.org,https://www.factcheck.org/2026/05/rfk-jr-s-muddled-claims-on-drug-approval-speed/,www.factcheck.org,RFK Jr.’s Muddled Claims on Drug Approval Speed - FactCheck.org,0.9,HIGH,True,FALSE - Debunked by fact-checkers,www.factcheck.org,factcheck,2026-05-28T16:02:23.574835
"[DEBUNKED] Ad in Texas GOP Runoff Attacks Cornyn on Immigration, Islam - FactCheck.org",https://www.factcheck.org/2026/05/ad-in-texas-gop-runoff-attacks-cornyn-on-immigration-islam/,www.factcheck.org,"Ad in Texas GOP Runoff Attacks Cornyn on Immigration, Islam - FactCheck.org",0.9,HIGH,True,FALSE - Debunked by fact-checkers,www.factcheck.org,factcheck,2026-05-28T16:02:23.657444
"56, or 53%, from the average price of $2",https://www.factcheck.org/2026/05/what-will-happen-to-gasoline-prices-when-the-iran-war-ends/,www.factcheck.org,What Will Happen To Gasoline Prices When the Iran War Ends? - FactCheck.org,0,LOW,False,,,factcheck,2026-05-28T16:02:23.938278
[DEBUNKED] Kennedy Denies the One Big Beautiful Bill Act&#039;s Spending Cuts to Medicaid - FactCheck.org,https://www.factcheck.org/2026/05/kennedy-denies-the-one-big-beautiful-bill-acts-spending-cuts-to-medicaid/,www.factcheck.org,Kennedy Denies the One Big Beautiful Bill Act&#039;s Spending Cuts to Medicaid - FactCheck.org,0.9,HIGH,True,FALSE - Debunked by fact-checkers,www.factcheck.org,factcheck,2026-05-28T16:02:24.152946
[DEBUNKED] Fact Check: Haaretz Did NOT Report That Zelenskyy's Associate Timur Mindich Fled To Israel With 800 kg Of Gold | Lead Stories,https://leadstories.com/hoax-alert/2026/05/fact-check-haaretz-did-not-report-that-mindich-fled-to-israel-with-800-kg-of-gold.html,leadstories.com,Fact Check: Haaretz Did NOT Report That Zelenskyy's Associate Timur Mindich Fled To Israel With 800 ,0.9,HIGH,True,FALSE - Debunked by fact-checkers,leadstories.com,factcheck,2026-05-28T16:02:24.545530
[DEBUNKED] Fact Check: FAKE Video Shows Woman Stuck Upside Down In A Water Slide -- AI-Generated | Lead Stories,https://leadstories.com/hoax-alert/2026/05/fact-check-fake-video-shows-woman-stuck-upside-down-in-a-water-slide.html,leadstories.com,Fact Check: FAKE Video Shows Woman Stuck Upside Down In A Water Slide -- AI-Generated | Lead Stories,0.9,HIGH,True,FALSE - Debunked by fact-checkers,leadstories.com,factcheck,2026-05-28T16:02:24.726835
[DEBUNKED] Fact Check: Real But Colorized 1923 Footage Shows Early French Roller Skates Called 'Paticycles' | Lead Stories,https://leadstories.com/hoax-alert/2026/05/fact-check-real-but-colorized-1923-footage-shows-early-french-roller-skates-called-paticycles.html,leadstories.com,Fact Check: Real But Colorized 1923 Footage Shows Early French Roller Skates Called 'Paticycles' | L,0.9,HIGH,True,FALSE - Debunked by fact-checkers,leadstories.com,factcheck,2026-05-28T16:02:24.917548
[DEBUNKED] Fact Check: Graphic ACCURATELY Depicts Net Worth Changes For Recent Presidents But Includes Formatting Errors | Lead Stories,https://leadstories.com/hoax-alert/2026/05/fact-check-graphic-accurately-depicts-net-worth-changes-for-recent-presidents-but-includes-formatting-errors.html,leadstories.com,Fact Check: Graphic ACCURATELY Depicts Net Worth Changes For Recent Presidents But Includes Formatti,0.9,HIGH,True,FALSE - Debunked by fact-checkers,leadstories.com,factcheck,2026-05-28T16:02:25.098951
[DEBUNKED] Fact Check: Video Does NOT Show Real Crowds At 2026 Hajj -- It Is AI-Generated | Lead Stories,https://leadstories.com/hoax-alert/2026/05/fact-check-video-of-crowds-does-not-show-2026-hajj.html,leadstories.com,Fact Check: Video Does NOT Show Real Crowds At 2026 Hajj -- It Is AI-Generated | Lead Stories,0.9,HIGH,True,FALSE - Debunked by fact-checkers,leadstories.com,factcheck,2026-05-28T16:02:25.290481
[DEBUNKED] Fact Check: Video Does NOT Show 'Illegal Cutout Windows' In Maricopa County Ballot Envelopes Used To Easily Identify Republican Ballots For Election-Fraud Purposes | Lead Stories,https://leadstories.com/hoax-alert/2026/05/fact-check-video-does-not-show-illegal-cutout-windows-in-maricopa-county-ballot-envelopes-used-to-easily-identify-republican-ballots-for-election-fraud-purposes.html,leadstories.com,Fact Check: Video Does NOT Show 'Illegal Cutout Windows' In Maricopa County Ballot Envelopes Used To,0.9,HIGH,True,FALSE - Debunked by fact-checkers,leadstories.com,factcheck,2026-05-28T16:02:25.482083
[DEBUNKED] Fact Check: Video Of Hailstorm Does NOT Show Real Destruction In Indian Cities | Lead Stories,https://leadstories.com/hoax-alert/2026/05/fact-check-video-of-hailstorm-does-not-show-real-destruction-in-indian-cities.html,leadstories.com,Fact Check: Video Of Hailstorm Does NOT Show Real Destruction In Indian Cities | Lead Stories,0.9,HIGH,True,FALSE - Debunked by fact-checkers,leadstories.com,factcheck,2026-05-28T16:02:25.678129
[DEBUNKED] Fact Check: STAGED Video Of Woman Vanishing During Traffic Stop Is 'Pre-Enactment' Of Rapture From Religious Campaign | Lead Stories,https://leadstories.com/hoax-alert/2026/05/fact-check-staged-video-of-woman-vanishing-during-traffic-stop-is-preenactment-of-rapture-from-religious-campaign.html,leadstories.com,Fact Check: STAGED Video Of Woman Vanishing During Traffic Stop Is 'Pre-Enactment' Of Rapture From R,0.9,HIGH,True,FALSE - Debunked by fact-checkers,leadstories.com,factcheck,2026-05-28T16:02:25.860461
[DEBUNKED] Fact Check: FAKE Euronews Video Falsely Claims Armenian PM Nikol Pashinyan's Press Secretary Accused Him Of Sexual Assault | Lead Stories,https://leadstories.com/hoax-alert/2026/05/fake-euronews-video-falsely-claims-armenian-pm-nikol-pashinyans-press-secretary-accused-him-of-sexual-assault.html,leadstories.com,Fact Check: FAKE Euronews Video Falsely Claims Armenian PM Nikol Pashinyan's Press Secretary Accused,0.9,HIGH,True,FALSE - Debunked by fact-checkers,leadstories.com,factcheck,2026-05-28T16:02:26.058895
[DEBUNKED] Fact Check: Video Of Jesus-Shaped Cloud Is FAKE -- AI-Generated | Lead Stories,https://leadstories.com/hoax-alert/2026/05/fact-check-video-of-jesus-shaped-cloud-is-fake.html,leadstories.com,Fact Check: Video Of Jesus-Shaped Cloud Is FAKE -- AI-Generated | Lead Stories,0.9,HIGH,True,FALSE - Debunked by fact-checkers,leadstories.com,factcheck,2026-05-28T16:02:26.265840
"[DEBUNKED] Fact Check: AI Train Crash Photo With Yellow Van NOT Real -- AI-Generated Image Of Real Accident In Buggenhout, Belgium | Lead Stories",https://leadstories.com/hoax-alert/2026/05/fact-check-buggenhout-belgium-train-crash-photo.html,leadstories.com,Fact Check: AI Train Crash Photo With Yellow Van NOT Real -- AI-Generated Image Of Real Accident In ,0.9,HIGH,True,FALSE - Debunked by fact-checkers,leadstories.com,factcheck,2026-05-28T16:02:26.489277
[DEBUNKED] Fact Check: Kid Rock Did NOT Say He 'Will Not Put Out Any More Music' If Democrats Win The House During The Midterms | Lead Stories,https://leadstories.com/hoax-alert/2026/05/fact-check-kid-rock-did-not-say-he-wouldnt-put-out-more-music-democrats-midterms.html,leadstories.com,Fact Check: Kid Rock Did NOT Say He 'Will Not Put Out Any More Music' If Democrats Win The House Dur,0.9,HIGH,True,FALSE - Debunked by fact-checkers,leadstories.com,factcheck,2026-05-28T16:02:26.685269
[DEBUNKED] Fact Check: No Evidence Bahamas Barred Trump From Attending Son's Wedding Under Immigration Laws | Lead Stories,https://leadstories.com/hoax-alert/2026/05/fact-check-no-evidence-bahamas-barred-trump-from-attending-sons-wedding-under-immigration-laws.html,leadstories.com,Fact Check: No Evidence Bahamas Barred Trump From Attending Son's Wedding Under Immigration Laws | L,0.9,HIGH,True,FALSE - Debunked by fact-checkers,leadstories.com,factcheck,2026-05-28T16:02:26.905504
[DEBUNKED] Fact Check: Fake Video Of HOA Courtroom Drama Is AI-Generated Engagement Bait | Lead Stories,https://leadstories.com/hoax-alert/2026/05/fact-check-fake-video-of-hoa-courtroom-drama-is-ai-generated-engagement-bait.html,leadstories.com,Fact Check: Fake Video Of HOA Courtroom Drama Is AI-Generated Engagement Bait | Lead Stories,0.9,HIGH,True,FALSE - Debunked by fact-checkers,leadstories.com,factcheck,2026-05-28T16:02:27.132438
[DEBUNKED] Fact Check: FAKE Video Shows Scooter Snapping In Half At A Green Light -- AI-Generated | Lead Stories,https://leadstories.com/hoax-alert/2026/05/fact-check-fake-video-of-scooter-snapping-in-half-at-a-green-light-is-not-real-footage.html,leadstories.com,Fact Check: FAKE Video Shows Scooter Snapping In Half At A Green Light -- AI-Generated | Lead Storie,0.9,HIGH,True,FALSE - Debunked by fact-checkers,leadstories.com,factcheck,2026-05-28T16:02:27.327578
"[DEBUNKED] Tough love: Spies, dating apps and the dark side of online intimacy - EUvsDisinfo",https://euvsdisinfo.eu/tough-love-spies-dating-apps-and-the-dark-side-of-online-intimacy/,euvsdisinfo.eu,"Tough love: Spies, dating apps and the dark side of online intimacy - EUvsDisinfo",0.9,HIGH,True,FALSE - Debunked by fact-checkers,euvsdisinfo.eu,factcheck,2026-05-28T16:02:32.403739
"[DEBUNKED] Lies about Russia’s military success, Yermak’s arrest and secret biolabs - EUvsDisinfo",https://euvsdisinfo.eu/lies-about-russias-military-success-yermaks-arrest-and-secret-biolabs/,euvsdisinfo.eu,"Lies about Russia’s military success, Yermak’s arrest and secret biolabs - EUvsDisinfo",0.9,HIGH,True,FALSE - Debunked by fact-checkers,euvsdisinfo.eu,factcheck,2026-05-28T16:02:33.825109
"[DEBUNKED] Victory Day propaganda, masking fear with intimidation, and abduction denial - EUvsDisinfo",https://euvsdisinfo.eu/victory-day-propaganda-masking-fear-with-intimidation-and-abduction-denial/,euvsdisinfo.eu,"Victory Day propaganda, masking fear with intimidation, and abduction denial - EUvsDisinfo",0.9,HIGH,True,FALSE - Debunked by fact-checkers,euvsdisinfo.eu,factcheck,2026-05-28T16:02:37.189791
[DEBUNKED] How Russia lies about the stolen Ukrainian children - EUvsDisinfo,https://euvsdisinfo.eu/how-russia-lies-about-the-stolen-ukrainian-children/,euvsdisinfo.eu,How Russia lies about the stolen Ukrainian children - EUvsDisinfo,0.9,HIGH,True,FALSE - Debunked by fact-checkers,euvsdisinfo.eu,factcheck,2026-05-28T16:02:39.962602
[DEBUNKED] Fake European crises and real Russian failures - EUvsDisinfo,https://euvsdisinfo.eu/fake-european-crises-and-real-russian-failures/,euvsdisinfo.eu,Fake European crises and real Russian failures - EUvsDisinfo,0.9,HIGH,True,FALSE - Debunked by fact-checkers,euvsdisinfo.eu,factcheck,2026-05-28T16:02:42.939244
[DEBUNKED] Russia’s fake nuclear drills and real failure in Mali - EUvsDisinfo,https://euvsdisinfo.eu/russias-fake-nuclear-drills-and-real-failure-in-mali/,euvsdisinfo.eu,Russia’s fake nuclear drills and real failure in Mali - EUvsDisinfo,0.9,HIGH,True,FALSE - Debunked by fact-checkers,euvsdisinfo.eu,factcheck,2026-05-28T16:02:43.986167
"Laut Anklageschrift&nbsp; erzielte er dabei Gewinne in Höhe von 1,2 Millionen Dollar",https://www.spiegel.de/netzwelt/netzpolitik/google-ingenieur-wegen-insiderhandels-auf-polymarket-angeklagt-a-1f279a88-afe9-4d97-9f97-0993bf294533#ref=rss,www.spiegel.de,Google: Ingenieur wegen Insiderhandels auf Polymarket angeklagt - DER SPIEGEL,0,LOW,False,,,mainstream,2026-05-28T16:02:57.768774
"Laut Anklage setzte der Google-Mitarbeiter insgesamt 2,7 Millionen Dollar auf 25 verschiedene Ergebnisse im Google-Suchmarkt und erzielte dabei einen Gewinn von 1,2 Mil",https://www.spiegel.de/netzwelt/netzpolitik/google-ingenieur-wegen-insiderhandels-auf-polymarket-angeklagt-a-1f279a88-afe9-4d97-9f97-0993bf294533#ref=rss,www.spiegel.de,Google: Ingenieur wegen Insiderhandels auf Polymarket angeklagt - DER SPIEGEL,0,LOW,False,,,mainstream,2026-05-28T16:02:57.969238
"Zum Login SPIEGEL plus Nur für Neukunden € 1,– für 4 Wochen danach € 5,99 pro Woche Freier Zugriff auf alle S+-Artikel auf SPIEGEL",https://www.spiegel.de/politik/deutschland/sahra-wagenknecht-wittert-in-sachsen-anhalt-ihre-letzte-chance-a-5dc065bf-d898-4ae2-8dd5-552218bb6ff0#ref=rss,www.spiegel.de,Sahra Wagenknecht wittert in Sachsen-Anhalt ihre letzte Chance - DER SPIEGEL,0.1,LOW,False,,,mainstream,2026-05-28T16:02:59.339349
"E-Paper (PDF), Digital-Archiv und S+-Newsletter Jederzeit kündigen Jetzt abonnieren SPIEGEL plus 52 Wochen 25 % sparen € 4,49 pro Woche für 52 Wochen danach € 5,99 pro Woche Freier Zugriff auf alle S+-Artikel auf SPIEGEL",https://www.spiegel.de/politik/deutschland/sahra-wagenknecht-wittert-in-sachsen-anhalt-ihre-letzte-chance-a-5dc065bf-d898-4ae2-8dd5-552218bb6ff0#ref=rss,www.spiegel.de,Sahra Wagenknecht wittert in Sachsen-Anhalt ihre letzte Chance - DER SPIEGEL,0.1,LOW,False,,,mainstream,2026-05-28T16:02:59.547434
Insbesondere Kinder hätten ihren Spaß mit der Figur gehabt und immer wieder den Schweif des Einhorns geflochten,https://www.spiegel.de/panorama/justiz/korbach-unbekannte-koepfen-einhorn-oder-war-es-doch-der-dessen-name-nicht-genannt-werden-darf-a-1649eafe-371a-4d19-bac2-a4d2cb4e0e83#ref=rss,www.spiegel.de,"Korbach: Unbekannte köpfen Einhorn – oder war es doch der, dessen Name nicht genannt werden darf? - ",0.1,LOW,False,,,mainstream,2026-05-28T16:03:00.868204
"Bislang hätten sich keine Zeugen gemeldet, sagte ein Polizeisprecher in Korbach",https://www.spiegel.de/panorama/justiz/korbach-unbekannte-koepfen-einhorn-oder-war-es-doch-der-dessen-name-nicht-genannt-werden-darf-a-1649eafe-371a-4d19-bac2-a4d2cb4e0e83#ref=rss,www.spiegel.de,"Korbach: Unbekannte köpfen Einhorn – oder war es doch der, dessen Name nicht genannt werden darf? - ",0.1,LOW,False,,,mainstream,2026-05-28T16:03:01.073649
"Zum Login SPIEGEL plus Nur für Neukunden € 1,– für 4 Wochen danach € 5,99 pro Woche Freier Zugriff auf alle S+-Artikel auf SPIEGEL",https://www.spiegel.de/wirtschaft/service/heizungsgesetz-verbaende-fuerchten-drastische-folgen-fuer-mieter-durch-waermepumpen-a-d0d2ab97-124b-4632-ab2c-4289e3ec19e3#ref=rss,www.spiegel.de,Heizungsgesetz: Verbände fürchten drastische Folgen für Mieter durch Wärmepumpen - DER SPIEGEL,0.1,LOW,False,,,mainstream,2026-05-28T16:03:02.401394
"E-Paper (PDF), Digital-Archiv und S+-Newsletter Jederzeit kündigen Jetzt abonnieren SPIEGEL plus 52 Wochen 25 % sparen € 4,49 pro Woche für 52 Wochen danach € 5,99 pro Woche Freier Zugriff auf alle S+-Artikel auf SPIEGEL",https://www.spiegel.de/wirtschaft/service/heizungsgesetz-verbaende-fuerchten-drastische-folgen-fuer-mieter-durch-waermepumpen-a-d0d2ab97-124b-4632-ab2c-4289e3ec19e3#ref=rss,www.spiegel.de,Heizungsgesetz: Verbände fürchten drastische Folgen für Mieter durch Wärmepumpen - DER SPIEGEL,0.1,LOW,False,,,mainstream,2026-05-28T16:03:02.599685
positiv bewerten negativ bewerten Seit 1866 wurde keine lebende Person mehr auf US-Banknoten abgebildet,https://www.spiegel.de/ausland/donald-trump-portraet-des-us-praesidenten-koennte-demnaechst-250-dollar-schein-zieren-a-8a091cb9-7907-42a5-a3f6-331cf451ad4a#ref=rss,www.spiegel.de,Donald Trump: Porträt des US-Präsidenten könnte demnächst 250-Dollar-Schein zieren - DER SPIEGEL,0.1,LOW,False,,,mainstream,2026-05-28T16:03:03.916890
"Zum Login SPIEGEL plus Nur für Neukunden € 1,– für 4 Wochen danach € 5,99 pro Woche Freier Zugriff auf alle S+-Artikel auf SPIEGEL",https://www.spiegel.de/politik/afd-in-berlin-radikales-law-and-order-programm-fuer-die-hauptstadt-a-d7545f5b-4776-49a6-8752-eb01c8929b9b#ref=rss,www.spiegel.de,AfD in Berlin: Radikales Law-and-Order-Programm für die Hauptstadt - DER SPIEGEL,0.1,LOW,False,,,mainstream,2026-05-28T16:03:06.232541
"E-Paper (PDF), Digital-Archiv und S+-Newsletter Jederzeit kündigen Jetzt abonnieren SPIEGEL plus 52 Wochen 25 % sparen € 4,49 pro Woche für 52 Wochen danach € 5,99 pro Woche Freier Zugriff auf alle S+-Artikel auf SPIEGEL",https://www.spiegel.de/politik/afd-in-berlin-radikales-law-and-order-programm-fuer-die-hauptstadt-a-d7545f5b-4776-49a6-8752-eb01c8929b9b#ref=rss,www.spiegel.de,AfD in Berlin: Radikales Law-and-Order-Programm für die Hauptstadt - DER SPIEGEL,0.1,LOW,False,,,mainstream,2026-05-28T16:03:06.449211
"Zum Login SPIEGEL plus Nur für Neukunden € 1,– für 4 Wochen danach € 5,99 pro Woche Freier Zugriff auf alle S+-Artikel auf SPIEGEL",https://www.spiegel.de/ausland/iran-und-waffenruhe-in-nahost-donald-trump-droht-zentrale-partner-fuer-iran-deal-zu-verlieren-a-f40e7239-215f-4550-b9b9-bf77d32d6450#ref=rss,www.spiegel.de,Iran und Waffenruhe in Nahost: Donald Trump droht zentrale Partner für Iran-Deal zu verlieren - DER ,0.1,LOW,False,,,mainstream,2026-05-28T16:03:07.764015
"E-Paper (PDF), Digital-Archiv und S+-Newsletter Jederzeit kündigen Jetzt abonnieren SPIEGEL plus 52 Wochen 25 % sparen € 4,49 pro Woche für 52 Wochen danach € 5,99 pro Woche Freier Zugriff auf alle S+-Artikel auf SPIEGEL",https://www.spiegel.de/ausland/iran-und-waffenruhe-in-nahost-donald-trump-droht-zentrale-partner-fuer-iran-deal-zu-verlieren-a-f40e7239-215f-4550-b9b9-bf77d32d6450#ref=rss,www.spiegel.de,Iran und Waffenruhe in Nahost: Donald Trump droht zentrale Partner für Iran-Deal zu verlieren - DER ,0.1,LOW,False,,,mainstream,2026-05-28T16:03:07.976064
"length - 1, 500, false)"" data-area=""nav-bar"" data-app-hidden x-lazyload> Menü Startseite Panorama Leute Nicolas Cage Nicolas Cage heißt jetzt offiziell Nicolas Cage $swiper",https://www.spiegel.de/panorama/leute/nicolas-cage-heisst-jetzt-offiziell-nicolas-cage-a-128979f7-ac71-4147-ad77-cda5d658f397#ref=rss,www.spiegel.de,Nicolas Cage heißt jetzt offiziell Nicolas Cage - DER SPIEGEL,0,LOW,False,,,mainstream,2026-05-28T16:03:09.161951
Inzwischen hat der Schauspieler seinen Namen auch offiziell ändern lassen,https://www.spiegel.de/panorama/leute/nicolas-cage-heisst-jetzt-offiziell-nicolas-cage-a-128979f7-ac71-4147-ad77-cda5d658f397#ref=rss,www.spiegel.de,Nicolas Cage heißt jetzt offiziell Nicolas Cage - DER SPIEGEL,0,LOW,False,,,mainstream,2026-05-28T16:03:09.383576
»Ich habe meinen Namen letztes Jahr offiziell geändert,https://www.spiegel.de/panorama/leute/nicolas-cage-heisst-jetzt-offiziell-nicolas-cage-a-128979f7-ac71-4147-ad77-cda5d658f397#ref=rss,www.spiegel.de,Nicolas Cage heißt jetzt offiziell Nicolas Cage - DER SPIEGEL,0,LOW,False,,,mainstream,2026-05-28T16:03:09.611039
Der Albino-Büffel mit der Trump-Frisur ist seit Wochen internationaler Internet-Star – und auch im Heimatort Dhaka in Bangladesch wollen ihn alle sehen,https://www.spiegel.de/panorama/donald-trump-in-bangladesch-bueffel-wird-dank-online-ruhm-doch-nicht-geschlachtet-a-073ba63b-a65f-43d2-ab25-49f07d352ea7#ref=rss,www.spiegel.de,»Donald Trump« in Bangladesch: Büffel wird dank Online-Ruhm doch nicht geschlachtet - DER SPIEGEL,0.1,LOW,False,,,mainstream,2026-05-28T16:03:10.754541
"com Facebook E-Mail Messenger WhatsApp Link kopieren image""> Bild vergrößern Einzelhandelsgeschäft in Stuttgart (2023) Foto: Marijan Murat / dpa In deutschen Innenstädten schließen immer mehr kleinere, inhabergeführte Geschäfte",https://www.spiegel.de/wirtschaft/unternehmen/einzelhandel-kleine-laeden-sterben-aus-waehrend-grosse-handelsketten-wachsen-a-8f83d1e4-9f1b-4203-8687-6bd43503ec13#ref=rss,www.spiegel.de,"Einzelhandel: Kleine Läden sterben aus, während große Handelsketten wachsen - DER SPIEGEL",0.1,LOW,False,,,mainstream,2026-05-28T16:03:11.902221
Die ‌Zahl der Einzelhandelsbetriebe sei zwischen 2010 und 2025 um rund 16 Prozent auf 316,https://www.spiegel.de/wirtschaft/unternehmen/einzelhandel-kleine-laeden-sterben-aus-waehrend-grosse-handelsketten-wachsen-a-8f83d1e4-9f1b-4203-8687-6bd43503ec13#ref=rss,www.spiegel.de,"Einzelhandel: Kleine Läden sterben aus, während große Handelsketten wachsen - DER SPIEGEL",0,LOW,False,,,mainstream,2026-05-28T16:03:12.114084
« Das klassische Warenhausmodell habe vielerorts keine ⁠Zukunft mehr,https://www.spiegel.de/wirtschaft/unternehmen/einzelhandel-kleine-laeden-sterben-aus-waehrend-grosse-handelsketten-wachsen-a-8f83d1e4-9f1b-4203-8687-6bd43503ec13#ref=rss,www.spiegel.de,"Einzelhandel: Kleine Läden sterben aus, während große Handelsketten wachsen - DER SPIEGEL",0.1,LOW,False,,,mainstream,2026-05-28T16:03:12.316180
"Der sodann erfolgten Aufforderung, sich auszuweisen, kam er laut Staatsanwaltschaft nicht nach",https://www.spiegel.de/panorama/justiz/zugbegleiter-bei-ticketkontrolle-toedlich-verletzt-verdaechtiger-wegen-mordes-angeklagt-a-232bdd8f-40fd-4aaf-b9b7-21d4e9d004a7#ref=rss,www.spiegel.de,Zugbegleiter bei Ticketkontrolle tödlich verletzt – Verdächtiger wegen Mordes angeklagt - DER SPIEGE,0,LOW,False,,,mainstream,2026-05-28T16:03:13.539049
"Auch wenn er nie selbst in einer Fabrik habe arbeiten wollen, spüre er Nostalgie nach den Werten der Werftarbeiter von früher",https://www.spiegel.de/kultur/musik/sting-meint-zu-ahnen-woher-die-toxischen-maenner-kommen-a-7522aa89-caa2-4724-bd3a-042c5a6bebee#ref=rss,www.spiegel.de,"Sting meint zu ahnen, woher die toxischen Männer kommen - DER SPIEGEL",0.1,LOW,False,,,mainstream,2026-05-28T16:03:14.731671
"»Ich habe keine Antworten, aber vielleicht kommt das Toxische in der Gesellschaft daher, dass wir das Ziel für unsere Energie verloren haben, diese männliche Kraft«, sagte Sting dem britischen »Guardian«&nbsp;",https://www.spiegel.de/kultur/musik/sting-meint-zu-ahnen-woher-die-toxischen-maenner-kommen-a-7522aa89-caa2-4724-bd3a-042c5a6bebee#ref=rss,www.spiegel.de,"Sting meint zu ahnen, woher die toxischen Männer kommen - DER SPIEGEL",0.1,LOW,False,,,mainstream,2026-05-28T16:03:14.932332
"Zu Stings Musik hallen in dem Stück laut eigener Beschreibung »Themen wie Verlust, Stolz und Verbundenheit« nach",https://www.spiegel.de/kultur/musik/sting-meint-zu-ahnen-woher-die-toxischen-maenner-kommen-a-7522aa89-caa2-4724-bd3a-042c5a6bebee#ref=rss,www.spiegel.de,"Sting meint zu ahnen, woher die toxischen Männer kommen - DER SPIEGEL",0.1,LOW,False,,,mainstream,2026-05-28T16:03:15.131284
"Immer wieder ging der Italiener in den spärlichen Schatten am Seitenrand, doch auch dort fand er keine Kraft",https://www.spiegel.de/sport/tennis/sensation-bei-french-open-jannik-sinner-verliert-in-der-hitze-gegen-juan-manuel-cerundolo-a-b7c9decb-d35c-49f8-bd6e-545cc33637c8#ref=rss,www.spiegel.de,Sensation bei French Open: Jannik Sinner verliert in der Hitze gegen Juan Manuel Cerúndolo - DER SPI,0.1,LOW,False,,,mainstream,2026-05-28T16:03:16.289624
"Sinner, 24, hatte in den vergangenen Jahren bei hohen Temperaturen immer wieder mit seinem Körper zu kämpfen gehabt",https://www.spiegel.de/sport/tennis/sensation-bei-french-open-jannik-sinner-verliert-in-der-hitze-gegen-juan-manuel-cerundolo-a-b7c9decb-d35c-49f8-bd6e-545cc33637c8#ref=rss,www.spiegel.de,Sensation bei French Open: Jannik Sinner verliert in der Hitze gegen Juan Manuel Cerúndolo - DER SPI,0.1,LOW,False,,,mainstream,2026-05-28T16:03:16.501230
"Das heißt, jede und jeder leistet den Beitrag, der persönlich möglich ist, um eine Versorgung aller zu gewährleisten«, sagte Schmidt der »Rheinischen Post«",https://www.spiegel.de/wirtschaft/soziales/pflegekosten-spd-zeigt-sich-offen-fuer-pflege-vorstoss-aus-der-union-vermoegende-mehr-zu-belasten-a-f1dee248-5b0d-40dc-a7e3-4974efe3547a#ref=rss,www.spiegel.de,"Pflegekosten: SPD zeigt sich offen für Pflege-Vorstoß aus der Union, Vermögende mehr zu belasten - D",0.1,LOW,False,,,mainstream,2026-05-28T16:03:17.768088
"26 million fly-tipping incidents in 2024-25 – a 9% increase on the previous year, according to the Department for Environment, Food and Rural Affairs (Defra)",https://www.bbc.com/news/articles/cpdpyg9xwwwo?at_medium=RSS&amp;at_campaign=rss,www.bbc.com,How CSI tactics are fighting the fly-tippers in Luton,0,LOW,False,,,mainstream,2026-05-28T16:03:18.872532
