claim,source_url,source_domain,article_title,risk_score,risk_category,has_factcheck,factcheck_rating,factcheck_source,source_type,checked_at
[DEBUNKED] Epstein files don't show Ellen DeGeneres is a cannibal | Snopes.com,https://www.snopes.com/fact-check/ellen-degeneres-cannibalism-epstein/,www.snopes.com,Epstein files don't show Ellen DeGeneres is a cannibal | Snopes.com,0.9,HIGH,True,FALSE - Debunked by fact-checkers,www.snopes.com,factcheck,2026-02-18T13:10:59.120437
[DEBUNKED] PolitiFact | Epstein files did not ‘expose’ Ellen DeGeneres as a cannibal; claim stems from AI-generated audio,http://www.politifact.com/factchecks/2026/feb/16/social-media/epstein-files-ellen-degeneres-cannibal/,www.politifact.com,PolitiFact | Epstein files did not ‘expose’ Ellen DeGeneres as a cannibal; claim stems from AI-gener,0.9,HIGH,True,FALSE - Debunked by fact-checkers,www.politifact.com,factcheck,2026-02-18T13:10:59.257901
"More Info I would like to contribute One Time Monthly Yearly Join Now Donald Trump stated on February 8, 2026 in an interview on NBC: Crime in Minneapolis “is down 25, 30% because we’ve removed thousands of criminals from the area",http://www.politifact.com/factchecks/2026/feb/13/donald-trump/Minneapolis-Minnesota-immigration-crime-drop/,www.politifact.com,PolitiFact | Trump credits immigration enforcement for Minneapolis crime drop. That’s wrong.,0,LOW,False,,,factcheck,2026-02-18T13:10:59.639831
"""The crime numbers in Minnesota, in Minneapolis in particular, are down 25, 30% because we’ve removed thousands of criminals from the area,"" Trump said",http://www.politifact.com/factchecks/2026/feb/13/donald-trump/Minneapolis-Minnesota-immigration-crime-drop/,www.politifact.com,PolitiFact | Trump credits immigration enforcement for Minneapolis crime drop. That’s wrong.,0,LOW,False,,,factcheck,2026-02-18T13:10:59.751532
"The vaccine isn’t 100% effective, but breakthrough infections among vaccinated people are rare and usually milder than what an unvaccinated person would experience",http://www.politifact.com/article/2026/feb/13/chickenpox-shingles-vaccines-FAQ/,www.politifact.com,PolitiFact | Can the chickenpox vaccine cause shingles? We answer questions about the infections and,0.1,LOW,False,,,factcheck,2026-02-18T13:10:59.941192
"More Info I would like to contribute One Time Monthly Yearly Join Now Tom O&#x27;Mara stated on January 20, 2026 in an op-ed: “New Yorkers pay 49% more than the national average for electricity",http://www.politifact.com/factchecks/2026/feb/13/tom-omara/new-york-electricity-rates-utilities/,www.politifact.com,PolitiFact | How much more do New Yorkers pay for electricity than the average US consumer?,0,LOW,False,,,factcheck,2026-02-18T13:11:00.123044
"In the column, O’Mara said such efforts are important because ""New Yorkers pay 49% more than the national average for electricity",http://www.politifact.com/factchecks/2026/feb/13/tom-omara/new-york-electricity-rates-utilities/,www.politifact.com,PolitiFact | How much more do New Yorkers pay for electricity than the average US consumer?,0,LOW,False,,,factcheck,2026-02-18T13:11:00.233711
"78 cents per kilowatt hour, so New York state’s rate was exactly 49% higher than the national average",http://www.politifact.com/factchecks/2026/feb/13/tom-omara/new-york-electricity-rates-utilities/,www.politifact.com,PolitiFact | How much more do New Yorkers pay for electricity than the average US consumer?,0,LOW,False,,,factcheck,2026-02-18T13:11:00.346740
[DEBUNKED] PolitiFact | Did Cooper prison settlement release suspect in fatal Charlotte stabbing?,http://www.politifact.com/article/2026/feb/09/did-cooper-prison-settlement-release-suspect-in-fa/,www.politifact.com,PolitiFact | Did Cooper prison settlement release suspect in fatal Charlotte stabbing?,0.9,HIGH,True,FALSE - Debunked by fact-checkers,www.politifact.com,factcheck,2026-02-18T13:11:00.735381
[DEBUNKED] PolitiFact | Image of Bad Bunny in a dress and burning the U.S. flag is AI-generated,http://www.politifact.com/factchecks/2026/feb/09/social-media/bad-bunny-burning-flag-AI/,www.politifact.com,PolitiFact | Image of Bad Bunny in a dress and burning the U.S. flag is AI-generated,0.9,HIGH,True,FALSE - Debunked by fact-checkers,www.politifact.com,factcheck,2026-02-18T13:11:00.820257
"[DEBUNKED] No, Keir Starmer was not ‘dragged out’ of the House of Commons following a clash with Nigel Farage – Full Fact",https://fullfact.org/politics/keir-starmer-commons-fake/,fullfact.org,"No, Keir Starmer was not ‘dragged out’ of the House of Commons following a clash with Nigel Farage –",0.9,HIGH,True,FALSE - Debunked by fact-checkers,fullfact.org,factcheck,2026-02-18T13:11:01.281062
[DEBUNKED] Boots still isn’t giving away mini perfume sets to those who complete surveys – Full Fact,https://fullfact.org/shopping/boots-fragrance-false-repeat/,fullfact.org,Boots still isn’t giving away mini perfume sets to those who complete surveys – Full Fact,0.9,HIGH,True,FALSE - Debunked by fact-checkers,fullfact.org,factcheck,2026-02-18T13:11:04.475763
[DEBUNKED] Archiving the content we check: How we are working with others to support the infrastructure for international fact checking. – Full Fact,https://fullfact.org/technology/archiving-the-content-we-check-how-we-are-working-with-others-to-support-the-infrastructure-for-international-fact-checking/,fullfact.org,Archiving the content we check: How we are working with others to support the infrastructure for int,0.9,HIGH,True,FALSE - Debunked by fact-checkers,fullfact.org,factcheck,2026-02-18T13:11:04.822191
[DEBUNKED] Trump and Musk Amplify Long-Ago Debunked Mail-In Vote Fraud Claim - FactCheck.org,https://www.factcheck.org/2026/02/trump-and-musk-amplify-long-ago-debunked-mail-in-vote-fraud-claim/,www.factcheck.org,Trump and Musk Amplify Long-Ago Debunked Mail-In Vote Fraud Claim - FactCheck.org,0.9,HIGH,True,FALSE - Debunked by fact-checkers,www.factcheck.org,factcheck,2026-02-18T13:11:05.134262
"6% in the first quarter of 2025, which covers the three months from January to March, real gross domestic product (meaning it has been adjusted for inflation) grew at an annualized rate of 3",https://www.factcheck.org/2026/02/trump-oversells-recent-u-s-economic-growth/,www.factcheck.org,Trump Oversells Recent U.S. Economic Growth - FactCheck.org,0,LOW,False,,,factcheck,2026-02-18T13:11:05.382693
8% in the second quarter of 2025 and at a rate of 4,https://www.factcheck.org/2026/02/trump-oversells-recent-u-s-economic-growth/,www.factcheck.org,Trump Oversells Recent U.S. Economic Growth - FactCheck.org,0,LOW,False,,,factcheck,2026-02-18T13:11:05.446777
"[DEBUNKED] WHO Didn’t Recommend Lockdowns, Contrary to Health Officials&#039; Suggestions - FactCheck.org",https://www.factcheck.org/2026/02/who-didnt-recommend-lockdowns-contrary-to-health-officials-suggestions/,www.factcheck.org,"WHO Didn’t Recommend Lockdowns, Contrary to Health Officials&#039; Suggestions - FactCheck.org",0.9,HIGH,True,FALSE - Debunked by fact-checkers,www.factcheck.org,factcheck,2026-02-18T13:11:05.553571
"Yet, Trump has repeatedly boasted that “factory construction” is up 41%",https://www.factcheck.org/2026/02/manufacturing-construction-spending-declines-under-trump/,www.factcheck.org,Manufacturing Construction Spending Declines Under Trump - FactCheck.org,0,LOW,False,,,factcheck,2026-02-18T13:11:05.830652
Trump cited the 41% statistic in a White House press conference on Jan,https://www.factcheck.org/2026/02/manufacturing-construction-spending-declines-under-trump/,www.factcheck.org,Manufacturing Construction Spending Declines Under Trump - FactCheck.org,0,LOW,False,,,factcheck,2026-02-18T13:11:05.939931
”&nbsp; “Investment in American factories is up 41%,https://www.factcheck.org/2026/02/manufacturing-construction-spending-declines-under-trump/,www.factcheck.org,Manufacturing Construction Spending Declines Under Trump - FactCheck.org,0,LOW,False,,,factcheck,2026-02-18T13:11:06.047708
"[DEBUNKED] Americans Don&#039;t Need &#039;Dramatically&#039; More Protein, Despite Officials’ Claims - FactCheck.org",https://www.factcheck.org/2026/02/americans-dont-need-dramatically-more-protein-despite-officials-claims/,www.factcheck.org,"Americans Don&#039;t Need &#039;Dramatically&#039; More Protein, Despite Officials’ Claims - FactChe",0.9,HIGH,True,FALSE - Debunked by fact-checkers,www.factcheck.org,factcheck,2026-02-18T13:11:06.344333
9% from the same period in 2024,https://www.factcheck.org/2026/02/trumps-selective-comparison-overstates-trade-deficit-decline/,www.factcheck.org,Trump&#039;s Selective Comparison Overstates Trade Deficit Decline - FactCheck.org,0,LOW,False,,,factcheck,2026-02-18T13:11:06.538310
His claim that he has &#8220;slashed our trade deficit by 77%&#8221; appears to compare the monthly trade deficit in January 2025 to the deficit nine months later in October,https://www.factcheck.org/2026/02/trumps-selective-comparison-overstates-trade-deficit-decline/,www.factcheck.org,Trump&#039;s Selective Comparison Overstates Trade Deficit Decline - FactCheck.org,0,LOW,False,,,factcheck,2026-02-18T13:11:06.650749
"&#8220;We had the largest trade deficit in world history&#8221; under former President Joe Biden, &#8220;but in one year I&#8217;ve slashed our gaping trade deficit by a staggering 77%,” Trump said in Jan",https://www.factcheck.org/2026/02/trumps-selective-comparison-overstates-trade-deficit-decline/,www.factcheck.org,Trump&#039;s Selective Comparison Overstates Trade Deficit Decline - FactCheck.org,0,LOW,False,,,factcheck,2026-02-18T13:11:06.757554
"[DEBUNKED] Fact Check: Video Does NOT Show The ""Strange Behavior Of A Woman"" At The White House | Lead Stories",https://leadstories.com/hoax-alert/2026/02/fact-check-on-twitter-video-does-not-show-woman-strange-behavior-at-white-house.html,leadstories.com,"Fact Check: Video Does NOT Show The ""Strange Behavior Of A Woman"" At The White House | Lead Stories",0.9,HIGH,True,FALSE - Debunked by fact-checkers,leadstories.com,factcheck,2026-02-18T13:11:07.138141
[DEBUNKED] Fact Check: Fake Video Of Firefighter Rescuing A Mother Dog And Pups From Burning Building Is One Of Many AI Versions | Lead Stories,https://leadstories.com/hoax-alert/2026/02/fact-check-fake-video-showing-firefighter-rescuing-mother-dog-and-puppies-from-burning-building.html,leadstories.com,Fact Check: Fake Video Of Firefighter Rescuing A Mother Dog And Pups From Burning Building Is One Of,0.9,HIGH,True,FALSE - Debunked by fact-checkers,leadstories.com,factcheck,2026-02-18T13:11:07.369216
[DEBUNKED] Fact Check: Image Does NOT Show Pam Bondi At 14 With Donald Trump At An Epstein Party -- It's Old AI | Lead Stories,https://leadstories.com/hoax-alert/2026/02/fact-check-image-does-not-show-pam-bondi-at-14-with-trump.html,leadstories.com,Fact Check: Image Does NOT Show Pam Bondi At 14 With Donald Trump At An Epstein Party -- It's Old AI,0.9,HIGH,True,FALSE - Debunked by fact-checkers,leadstories.com,factcheck,2026-02-18T13:11:07.620787
[DEBUNKED] Fact Check: Rep. Randy Fine DID Say On X That 'The Choice Between Dogs And Muslims Is Not A Difficult One' | Lead Stories,https://leadstories.com/hoax-alert/2026/02/fact-check-congressman-randy-fine-did-say-on-X-that-choice-between-dogs-and-muslims-is-not-a-difficult-one.html,leadstories.com,Fact Check: Rep. Randy Fine DID Say On X That 'The Choice Between Dogs And Muslims Is Not A Difficul,0.9,HIGH,True,FALSE - Debunked by fact-checkers,leadstories.com,factcheck,2026-02-18T13:11:07.842613
[DEBUNKED] Fact Check: CNN Did NOT Report ICE Agent Who Shot Alex Pretti Found 'NOT-GUILTY' | Lead Stories,https://leadstories.com/hoax-alert/2026/02/fact-check-cnn-did-not-report-ice-agent-who-show-alex-pretti-found-not-guilty.html,leadstories.com,Fact Check: CNN Did NOT Report ICE Agent Who Shot Alex Pretti Found 'NOT-GUILTY' | Lead Stories,0.9,HIGH,True,FALSE - Debunked by fact-checkers,leadstories.com,factcheck,2026-02-18T13:11:08.079613
[DEBUNKED] Fact Check: Fake Video Shows Ground Crew Struggling Near A Jet Engine To Retrieve A Piece Of Metal That Has Almost Been Sucked In | Lead Stories,https://leadstories.com/hoax-alert/2026/02/fact-check-fake-video-ground-crew-struggles-with-metal-sucked-into-jet-engine.html,leadstories.com,Fact Check: Fake Video Shows Ground Crew Struggling Near A Jet Engine To Retrieve A Piece Of Metal T,0.9,HIGH,True,FALSE - Debunked by fact-checkers,leadstories.com,factcheck,2026-02-18T13:11:08.330579
"[DEBUNKED] Fact Check: DJ Vlad 'Confession' Saying Jay-Z and Roc Nation Paid Judges, Jury, Witnesses, Police To Convict Tory Lanez In Megan Thee Stallion Shooting IS Satirical Trolling -- Read The Last Line | Lead Stories",https://leadstories.com/hoax-alert/2026/02/fact-check-djvlad-roc-mafia-jayz-paid-jury-to-convict-tory-satire.html,leadstories.com,"Fact Check: DJ Vlad 'Confession' Saying Jay-Z and Roc Nation Paid Judges, Jury, Witnesses, Police To",0.9,HIGH,True,FALSE - Debunked by fact-checkers,leadstories.com,factcheck,2026-02-18T13:11:08.694958
[DEBUNKED] Fact Check: Various People Did NOT Introduce Bill To Block George Soros Funding Protests By Deeming It Organized Crime Under RICO Act | Lead Stories,https://leadstories.com/hoax-alert/2026/02/fact-check-bill-block-soros-funding-protests-organized-crime-rico-act.html,leadstories.com,Fact Check: Various People Did NOT Introduce Bill To Block George Soros Funding Protests By Deeming ,0.9,HIGH,True,FALSE - Debunked by fact-checkers,leadstories.com,factcheck,2026-02-18T13:11:09.029692
"[DEBUNKED] Fact Check: Trump NOT Mentioned In Original Claim Epstein Received 4,725 Wire Transfers For $1.1 Billion Via Russian Banks -- Other Parts Of Claim Mangled Too | Lead Stories",https://leadstories.com/hoax-alert/2026/02/fact-check-trump-4725-wire-transfers-epstein-1-1-billion-dollar-russian-banks.html,leadstories.com,"Fact Check: Trump NOT Mentioned In Original Claim Epstein Received 4,725 Wire Transfers For $1.1 Bil",0.9,HIGH,True,FALSE - Debunked by fact-checkers,leadstories.com,factcheck,2026-02-18T13:11:09.268048
"[DEBUNKED] Fact Check: Schneider, Seinfeld, Buttigieg, Emmylou Harris, Others Did NOT Each Launch A Fox News 'Anti-Woke' Morning Show -- Fake News From Copy-Paste Spam Sites | Lead Stories",https://leadstories.com/hoax-alert/2026/02/fact-check-buttigieg-schneider-seinfeld-other-celebs-did-not-each-launch-fox-antiwoke-morning-show.html,leadstories.com,"Fact Check: Schneider, Seinfeld, Buttigieg, Emmylou Harris, Others Did NOT Each Launch A Fox News 'A",0.9,HIGH,True,FALSE - Debunked by fact-checkers,leadstories.com,factcheck,2026-02-18T13:11:09.541491
[DEBUNKED] Fact Check: Video Does NOT Show People's Real Reactions To Bad Bunny's Performance At 2026 Super Bowl Halftime Show | Lead Stories,https://leadstories.com/hoax-alert/2026/02/fact-check-video-does-not-show-peoples-real-reactions-to-bad-bunnys-2026-super-bowl-half-time-show-performance.html,leadstories.com,Fact Check: Video Does NOT Show People's Real Reactions To Bad Bunny's Performance At 2026 Super Bow,0.9,HIGH,True,FALSE - Debunked by fact-checkers,leadstories.com,factcheck,2026-02-18T13:11:09.755932
[DEBUNKED] Fact Check: Elon Musk Did NOT Reveal Plans To Buy CBS After February 20 -- Spam From Vietnam | Lead Stories,https://leadstories.com/hoax-alert/2026/02/fact-check-elon-musk-did-not-buy-cbs-february-20.html,leadstories.com,Fact Check: Elon Musk Did NOT Reveal Plans To Buy CBS After February 20 -- Spam From Vietnam | Lead ,0.9,HIGH,True,FALSE - Debunked by fact-checkers,leadstories.com,factcheck,2026-02-18T13:11:10.014981
"[DEBUNKED] Fact Check: Fake 2006 Group Photo Of Jeffrey Epstein With Bill and Hillary Clinton, Diddy, Bill Gates, Jay-Z, and Stephen Hawking Is Fabricated | Lead Stories",https://leadstories.com/hoax-alert/2026/02/fact-check-fake-2006-group-photo-with-jeffrey-epstein-clintons-diddy-gates-jayz-and-hawking.html,leadstories.com,"Fact Check: Fake 2006 Group Photo Of Jeffrey Epstein With Bill and Hillary Clinton, Diddy, Bill Gate",0.9,HIGH,True,FALSE - Debunked by fact-checkers,leadstories.com,factcheck,2026-02-18T13:11:10.266381
"[DEBUNKED] Fact Check: Streisand, Bon Jovi, Stevie Nicks, 'Mr. Bean' Did NOT All Say 'You Are Not Creating Change, You Are Creating Noise' To Elites -- Copy-Paste Posts From Vietnam Fake News Factory | Lead Stories",https://leadstories.com/hoax-alert/2026/02/fact-check-nicks-bonjovi-atkinson-streisand-did-not-lecture-zuckerberg-and-other-wealthy-people-they-are-making-noise-not-change.html,leadstories.com,"Fact Check: Streisand, Bon Jovi, Stevie Nicks, 'Mr. Bean' Did NOT All Say 'You Are Not Creating Chan",0.9,HIGH,True,FALSE - Debunked by fact-checkers,leadstories.com,factcheck,2026-02-18T13:11:10.483806
[DEBUNKED] Fact Check: Image Of Donald Trump Jr. With Rifle Scope Mounted Backwards Has Been Digitally Edited | Lead Stories,https://leadstories.com/hoax-alert/2026/02/fact-check-donald-trump-jr-with-scope-mounted-backwards-has-been-digitally-edited.html,leadstories.com,Fact Check: Image Of Donald Trump Jr. With Rifle Scope Mounted Backwards Has Been Digitally Edited |,0.9,HIGH,True,FALSE - Debunked by fact-checkers,leadstories.com,factcheck,2026-02-18T13:11:10.758651
"[DEBUNKED] Long before the podcast boom, Howard Stern built the template for intimate, wide-ranging interviews - Poynter",https://www.poynter.org/reporting-editing/2026/howard-stern-interviewing-influenced-podcasting/,www.poynter.org,"Long before the podcast boom, Howard Stern built the template for intimate, wide-ranging interviews ",0.9,HIGH,True,FALSE - Debunked by fact-checkers,www.poynter.org,factcheck,2026-02-18T13:11:11.201180
[DEBUNKED] Bystander video is driving the biggest stories in America. The next era of journalism will be built on verifying it. - Poynter,https://www.poynter.org/reporting-editing/2026/bystander-surveillance-video-ai-visual-investigations-journalism/,www.poynter.org,Bystander video is driving the biggest stories in America. The next era of journalism will be built ,0.9,HIGH,True,FALSE - Debunked by fact-checkers,www.poynter.org,factcheck,2026-02-18T13:11:11.580566
"Zum Login SPIEGEL plus Nur für Neukunden € 1,– für 4 Wochen danach € 5,99 pro Woche Freier Zugriff auf alle S+-Artikel auf SPIEGEL",https://www.spiegel.de/sport/olympia/olympia-2026-tatjana-huefner-ist-olympiasiegerin-jetzt-arbeitet-sie-als-volunteer-in-cortina-dampezzo-a-11833627-99e9-41a7-9308-c0d514066245#ref=rss,www.spiegel.de,"Olympia 2026: Tatjana Hüfner ist Olympiasiegerin, jetzt arbeitet sie als Volunteer in Cortina d'Ampe",0.1,LOW,False,,,mainstream,2026-02-18T13:11:22.894459
"E-Paper (PDF), Digital-Archiv und S+-Newsletter Jederzeit kündigen Jetzt abonnieren SPIEGEL plus 52 Wochen 25 % sparen € 4,49 pro Woche für 52 Wochen danach € 5,99 pro Woche Freier Zugriff auf alle S+-Artikel auf SPIEGEL",https://www.spiegel.de/sport/olympia/olympia-2026-tatjana-huefner-ist-olympiasiegerin-jetzt-arbeitet-sie-als-volunteer-in-cortina-dampezzo-a-11833627-99e9-41a7-9308-c0d514066245#ref=rss,www.spiegel.de,"Olympia 2026: Tatjana Hüfner ist Olympiasiegerin, jetzt arbeitet sie als Volunteer in Cortina d'Ampe",0.1,LOW,False,,,mainstream,2026-02-18T13:11:23.007133
"39 Prozent gaben an, im ersten PJ-Tertial keine festen Ansprechpartner wie Mentorinnen oder Mentoren gehabt zu haben",https://www.spiegel.de/karriere/medizin-praktisches-jahr-pj-ein-drittel-der-jungen-aerzte-erwaegt-berufswechsel-a-8aa81e3b-c56d-4488-a80e-e46ab5dbb07e#ref=rss,www.spiegel.de,Medizin: Praktisches Jahr (PJ) - Ein Drittel der jungen Ärzte erwägt Berufswechsel - DER SPIEGEL,0.1,LOW,False,,,mainstream,2026-02-18T13:11:23.893737
"Zum Login SPIEGEL plus Nur für Neukunden € 1,– für 4 Wochen danach € 5,99 pro Woche Freier Zugriff auf alle S+-Artikel auf SPIEGEL",https://www.spiegel.de/politik/deutschland/friedrich-merz-und-die-bundespraesidenten-wahl-droht-ein-zweites-personal-debakel-a-fbd0ac5f-1ce4-4bd0-81ae-6a4a68b2a10e#ref=rss,www.spiegel.de,Friedrich Merz und die Bundespräsidenten-Wahl: Droht ein zweites Personal-Debakel? - DER SPIEGEL,0.1,LOW,False,,,mainstream,2026-02-18T13:11:25.058279
"E-Paper (PDF), Digital-Archiv und S+-Newsletter Jederzeit kündigen Jetzt abonnieren SPIEGEL plus 52 Wochen 25 % sparen € 4,49 pro Woche für 52 Wochen danach € 5,99 pro Woche Freier Zugriff auf alle S+-Artikel auf SPIEGEL",https://www.spiegel.de/politik/deutschland/friedrich-merz-und-die-bundespraesidenten-wahl-droht-ein-zweites-personal-debakel-a-fbd0ac5f-1ce4-4bd0-81ae-6a4a68b2a10e#ref=rss,www.spiegel.de,Friedrich Merz und die Bundespräsidenten-Wahl: Droht ein zweites Personal-Debakel? - DER SPIEGEL,0.1,LOW,False,,,mainstream,2026-02-18T13:11:25.131682
