claim,source_url,source_domain,article_title,risk_score,risk_category,has_factcheck,factcheck_rating,factcheck_source,source_type,checked_at
[DEBUNKED] SEA LIFE London Aquarium is not offering ‘young explorer kits’ as survey reward – Full Fact,https://fullfact.org/shopping/sealife-explorer-kit-false/,fullfact.org,SEA LIFE London Aquarium is not offering ‘young explorer kits’ as survey reward – Full Fact,0.9,HIGH,True,FALSE - Debunked by fact-checkers,fullfact.org,factcheck,2026-07-02T03:43:17.041651
[DEBUNKED] Fact Check: FAKE Video Shows Military Dog Jumping Barrier After Seeing Former Handler At TSA Checkpoint | Lead Stories,https://leadstories.com/hoax-alert/2026/07/fact-check-fake-video-shows-military-dog-jumping-barrier-after-seeing-former-handler-at-tsa-checkpoint.html,leadstories.com,Fact Check: FAKE Video Shows Military Dog Jumping Barrier After Seeing Former Handler At TSA Checkpo,0.9,HIGH,True,FALSE - Debunked by fact-checkers,leadstories.com,factcheck,2026-07-02T03:43:17.207771
"[DEBUNKED] Fact Check: OK Magazine Did NOT Publish Video Claiming German Chancellor Friedrich Merz Booked $8,000 OnlyFans Private Session With Transgender Model During G7 Summit | Lead Stories",https://leadstories.com/hoax-alert/2026/07/fact-check-ok-magazine-did-not-publish-video-claiming-german-chancellor-friedrich-merz-booked-8000-dollar-onlyfans-private-session-with-transgender-model-during-g7-summit.html,leadstories.com,"Fact Check: OK Magazine Did NOT Publish Video Claiming German Chancellor Friedrich Merz Booked $8,00",0.9,HIGH,True,FALSE - Debunked by fact-checkers,leadstories.com,factcheck,2026-07-02T03:43:17.386397
[DEBUNKED] Prebunk: AI Videos Of Disrespected Old Veterans Disrespect Reality -- Don't Let Patriotic Ragebait Bully You Into Sharing | Lead Stories,https://leadstories.com/hoax-alert/2026/07/prebunk-ai-videos-of-disrespected-old-veterans-disrespect-reality-dont-let-patriotic-ragebait-bully-you-into-sharing.html,leadstories.com,Prebunk: AI Videos Of Disrespected Old Veterans Disrespect Reality -- Don't Let Patriotic Ragebait B,0.9,HIGH,True,FALSE - Debunked by fact-checkers,leadstories.com,factcheck,2026-07-02T03:43:17.546411
[DEBUNKED] Fact Check: FAKE Video Shows A Transparent Squid 'The Real Invisible Man Of The Ocean' -- Made With Google AI | Lead Stories,https://leadstories.com/hoax-alert/2026/07/fact-check-fake-video-shows-a-transparent-squid-the-real-invisible-man-of-the-ocean-made-with-google-ai.html,leadstories.com,Fact Check: FAKE Video Shows A Transparent Squid 'The Real Invisible Man Of The Ocean' -- Made With ,0.9,HIGH,True,FALSE - Debunked by fact-checkers,leadstories.com,factcheck,2026-07-02T03:43:17.726510
[DEBUNKED] Fact Check: Video Of Woman 'Accidentally' Attending Pride Fest Does NOT Show Real-Life 'Christian Influencer' | Lead Stories,https://leadstories.com/hoax-alert/2026/07/fact-check-video-of-woman-accidentally-attending-pride-fest-does-not-show-real-christian-influencer.html,leadstories.com,Fact Check: Video Of Woman 'Accidentally' Attending Pride Fest Does NOT Show Real-Life 'Christian In,0.9,HIGH,True,FALSE - Debunked by fact-checkers,leadstories.com,factcheck,2026-07-02T03:43:17.907875
[DEBUNKED] Prebunk: Digging Into AI Videos Of Secret Bunker Construction -- Deep Wish Fulfillment Fantasy | Lead Stories,https://leadstories.com/hoax-alert/2026/06/prebunk-digging-into-ai-videos-of-secret-bunker-construction-deep-wish-fulfillment-fantasy.html,leadstories.com,Prebunk: Digging Into AI Videos Of Secret Bunker Construction -- Deep Wish Fulfillment Fantasy | Lea,0.9,HIGH,True,FALSE - Debunked by fact-checkers,leadstories.com,factcheck,2026-07-02T03:43:18.062692
[DEBUNKED] Fact Check: FAKE Video Shows Pregnant Woman Attacked On Subway In NYC | Lead Stories,https://leadstories.com/hoax-alert/2026/06/fact-check-fake-video-shows-pregnant-woman-attacked-on-subway-in-nyc.html,leadstories.com,Fact Check: FAKE Video Shows Pregnant Woman Attacked On Subway In NYC | Lead Stories,0.9,HIGH,True,FALSE - Debunked by fact-checkers,leadstories.com,factcheck,2026-07-02T03:43:18.246522
[DEBUNKED] Claims About Halal Meat At Aldi UK: What We Know | Lead Stories,https://leadstories.com/hoax-alert/2026/06/claims-about-halal-meat-at-aldi-uk-what-we-know.html,leadstories.com,Claims About Halal Meat At Aldi UK: What We Know | Lead Stories,0.9,HIGH,True,FALSE - Debunked by fact-checkers,leadstories.com,factcheck,2026-07-02T03:43:18.403593
[DEBUNKED] Fact Check: DECEPTIVELY Reversed Video Appears To Show 'Japan Fans Destroy Stadium After Defeat By Brazil' -- They Were Really Cleaning Up | Lead Stories,https://leadstories.com/hoax-alert/2026/06/fact-check-deceptively-reversed-video-appears-to-show-japan-fans-destroy-stadium-after-defeat-by-brazil-they-were-really-cleaning-up.html,leadstories.com,Fact Check: DECEPTIVELY Reversed Video Appears To Show 'Japan Fans Destroy Stadium After Defeat By B,0.9,HIGH,True,FALSE - Debunked by fact-checkers,leadstories.com,factcheck,2026-07-02T03:43:18.604097
[DEBUNKED] Fact Check: Trump Posted AI-Generated Photo Of Golden Eagle 'Gifted' To White House For 250th Birthday | Lead Stories,https://leadstories.com/hoax-alert/2026/06/fact-check-donald-trump-posted-fake-photo-of-golden-eagle-hanging-from-white-house-columns-in-front-of-balcony.html,leadstories.com,Fact Check: Trump Posted AI-Generated Photo Of Golden Eagle 'Gifted' To White House For 250th Birthd,0.9,HIGH,True,FALSE - Debunked by fact-checkers,leadstories.com,factcheck,2026-07-02T03:43:18.774283
[DEBUNKED] Fact Check: REAL Photo On Stage At Freedom 250 Concert Shows Only A Handful Of People Reflected In Mirror Sunglasses | Lead Stories,https://leadstories.com/hoax-alert/2026/06/fact-check-real-photo-on-stage-at-freedom-250-concert-shows-only-a-handful-of-people-reflected-in-mirror-sunglasses.html,leadstories.com,Fact Check: REAL Photo On Stage At Freedom 250 Concert Shows Only A Handful Of People Reflected In M,0.9,HIGH,True,FALSE - Debunked by fact-checkers,leadstories.com,factcheck,2026-07-02T03:43:18.973413
[DEBUNKED] Fact Check: FAKE Images Show FIFA President Gianni Infantino Attending Two Simultaneous Matches In Different Cities | Lead Stories,https://leadstories.com/hoax-alert/2026/06/fact-check-fake-images-show-fifa-president-gianni-infantino-attending-two-simultaneous-matches-in-different-cities.html,leadstories.com,Fact Check: FAKE Images Show FIFA President Gianni Infantino Attending Two Simultaneous Matches In D,0.9,HIGH,True,FALSE - Debunked by fact-checkers,leadstories.com,factcheck,2026-07-02T03:43:19.156239
[DEBUNKED] Fact Check: FAKE Video Shows Fan Running Onto Field To Hug Messi At The World Cup -- It's AI | Lead Stories,https://leadstories.com/hoax-alert/2026/06/fact-check-fake-video-shows-fan-running-onto-field-hug-messi-world-cup-ai.html,leadstories.com,Fact Check: FAKE Video Shows Fan Running Onto Field To Hug Messi At The World Cup -- It's AI | Lead ,0.9,HIGH,True,FALSE - Debunked by fact-checkers,leadstories.com,factcheck,2026-07-02T03:43:19.327503
[DEBUNKED] Prebunk: AI Videos Of Rooftop Infinity Pools Collapsing Are Splashy Engagement Bait -- Just AI Wasting Water | Lead Stories,https://leadstories.com/hoax-alert/2026/06/prebunk-ai-videos-of-rooftop-infinity-pools-collapsing-are-engagement-bait.html,leadstories.com,Prebunk: AI Videos Of Rooftop Infinity Pools Collapsing Are Splashy Engagement Bait -- Just AI Wasti,0.9,HIGH,True,FALSE - Debunked by fact-checkers,leadstories.com,factcheck,2026-07-02T03:43:19.499477
[DEBUNKED] Fact Check: EDITED Video Of Erling Haaland Eating And Scaring Himself -- Is A Face Swap Of A Chinese Slapstick Comedy Video | Lead Stories,https://leadstories.com/hoax-alert/2026/06/fact-check-altered-video-of-erling-haaland-eating-and-scaring-himself-is-a-face-swap-spoof-of-a-chinese-slapstick-comedy-video.html,leadstories.com,Fact Check: EDITED Video Of Erling Haaland Eating And Scaring Himself -- Is A Face Swap Of A Chinese,0.9,HIGH,True,FALSE - Debunked by fact-checkers,leadstories.com,factcheck,2026-07-02T03:43:19.676120
"Gesund leben, sich gut fühlen – immer donnerstags image""> [M] DER SPIEGEL; Foto: Popovo Bros / iStockphoto / Getty Images Ausgabe Nr",https://www.spiegel.de/gesundheit/durchfall-verstopfung-blaehungen-was-ihre-verdauung-ueber-die-gesundheit-sagen-a-f1a1fde5-27e2-4606-bfc8-3f1266d54bdc#ref=rss,www.spiegel.de,"Durchfall, Verstopfung, Blähungen: Was Ihre Verdauung über die Gesundheit sagen - DER SPIEGEL",0.1,LOW,False,,,mainstream,2026-07-02T03:43:32.919550
2026 • Alle Ausgaben Sie können den Artikel leider nicht mehr aufrufen,https://www.spiegel.de/gesundheit/durchfall-verstopfung-blaehungen-was-ihre-verdauung-ueber-die-gesundheit-sagen-a-f1a1fde5-27e2-4606-bfc8-3f1266d54bdc#ref=rss,www.spiegel.de,"Durchfall, Verstopfung, Blähungen: Was Ihre Verdauung über die Gesundheit sagen - DER SPIEGEL",0.1,LOW,False,,,mainstream,2026-07-02T03:43:33.147130
"Zum Login SPIEGEL plus Nur für Neukunden € 1,– für 4 Wochen danach € 5,99 pro Woche Freier Zugriff auf alle S+-Artikel auf SPIEGEL",https://www.spiegel.de/gesundheit/durchfall-verstopfung-blaehungen-was-ihre-verdauung-ueber-die-gesundheit-sagen-a-f1a1fde5-27e2-4606-bfc8-3f1266d54bdc#ref=rss,www.spiegel.de,"Durchfall, Verstopfung, Blähungen: Was Ihre Verdauung über die Gesundheit sagen - DER SPIEGEL",0.1,LOW,False,,,mainstream,2026-07-02T03:43:33.347753
"Gesund leben, sich gut fühlen – immer donnerstags image""> Foto: Anastassiya Bezhekeneva / Moment / Getty Images Ausgabe Nr",https://www.spiegel.de/gesundheit/haemorrhoiden-ein-proktologe-erklaert-welche-einfachen-tipps-wirklich-helfen-a-f55204b8-2cf8-43d0-8020-565e4e1c166e#ref=rss,www.spiegel.de,"Hämorrhoiden: Ein Proktologe erklärt, welche einfachen Tipps wirklich helfen - DER SPIEGEL",0.1,LOW,False,,,mainstream,2026-07-02T03:43:34.497813
"27 »Viele ertragen Schmerzen, Blutungen oder Juckreiz, obwohl die Therapie oft simpel und schmerzfrei ist« Jeder Zweite leidet im Laufe seines Lebens unter Schmerzen am Po – und kaum einer redet drüber",https://www.spiegel.de/gesundheit/haemorrhoiden-ein-proktologe-erklaert-welche-einfachen-tipps-wirklich-helfen-a-f55204b8-2cf8-43d0-8020-565e4e1c166e#ref=rss,www.spiegel.de,"Hämorrhoiden: Ein Proktologe erklärt, welche einfachen Tipps wirklich helfen - DER SPIEGEL",0,LOW,False,,,mainstream,2026-07-02T03:43:34.707753
2026 • Alle Ausgaben Sie können den Artikel leider nicht mehr aufrufen,https://www.spiegel.de/gesundheit/haemorrhoiden-ein-proktologe-erklaert-welche-einfachen-tipps-wirklich-helfen-a-f55204b8-2cf8-43d0-8020-565e4e1c166e#ref=rss,www.spiegel.de,"Hämorrhoiden: Ein Proktologe erklärt, welche einfachen Tipps wirklich helfen - DER SPIEGEL",0.1,LOW,False,,,mainstream,2026-07-02T03:43:34.905521
"Zum Login SPIEGEL plus Nur für Neukunden € 1,– für 4 Wochen danach € 5,99 pro Woche Freier Zugriff auf alle S+-Artikel auf SPIEGEL",https://www.spiegel.de/politik/deutschland/boris-pistorius-ueber-trump-die-nato-und-seine-persoenliche-krisenvorsorge-ein-paar-tage-koennten-meine-frau-und-ich-uns-ohne-probleme-verpflegen-a-7f18389a-576d-4c60-94a7-0ddcecdc6bcb#ref=rss,www.spiegel.de,"Boris Pistorius über Trump, die Nato und seine persönliche Krisenvorsorge: »Ein paar Tage könnten me",0.1,LOW,False,,,mainstream,2026-07-02T03:43:36.136765
"E-Paper (PDF), Digital-Archiv und S+-Newsletter Jederzeit kündigen Jetzt abonnieren SPIEGEL plus 52 Wochen 25 % sparen € 4,49 pro Woche für 52 Wochen danach € 5,99 pro Woche Freier Zugriff auf alle S+-Artikel auf SPIEGEL",https://www.spiegel.de/politik/deutschland/boris-pistorius-ueber-trump-die-nato-und-seine-persoenliche-krisenvorsorge-ein-paar-tage-koennten-meine-frau-und-ich-uns-ohne-probleme-verpflegen-a-7f18389a-576d-4c60-94a7-0ddcecdc6bcb#ref=rss,www.spiegel.de,"Boris Pistorius über Trump, die Nato und seine persönliche Krisenvorsorge: »Ein paar Tage könnten me",0.1,LOW,False,,,mainstream,2026-07-02T03:43:36.334997
"Andere Nutzungen verletzen das Urheberrecht Einnahmen während zweiter Amtszeit Scharfe Kritik an Trumps Kryptomilliarden – doch der US-Präsident winkt ab Allein 2025 kassierte Donald Trump mehr als 1,4 Milliarden Dollar durch Kryptodeals",https://www.spiegel.de/ausland/donald-trump-scharfe-kritik-an-seinen-milliarden-doch-der-us-praesident-winkt-ab-a-0b9a84f8-9af4-4e03-bf0e-f8c6225d3381#ref=rss,www.spiegel.de,"Donald Trump: Scharfe Kritik an seinen Milliarden, doch der US-Präsident winkt ab - DER SPIEGEL",0.1,LOW,False,,,mainstream,2026-07-02T03:43:37.491878
"So hat Trump allein im vergangenen Jahr mit Kryptowährungen rund 1,2 Milliarden Dollar (gut eine Milliarde Euro) eingenommen (mehr dazu hier)",https://www.spiegel.de/ausland/donald-trump-scharfe-kritik-an-seinen-milliarden-doch-der-us-praesident-winkt-ab-a-0b9a84f8-9af4-4e03-bf0e-f8c6225d3381#ref=rss,www.spiegel.de,"Donald Trump: Scharfe Kritik an seinen Milliarden, doch der US-Präsident winkt ab - DER SPIEGEL",0.1,LOW,False,,,mainstream,2026-07-02T03:43:37.716383
"Alle profitierten von dem Boom, sagte Trump am Mittwoch (Ortszeit) auf einem Militärflugplatz bei Washington",https://www.spiegel.de/ausland/donald-trump-scharfe-kritik-an-seinen-milliarden-doch-der-us-praesident-winkt-ab-a-0b9a84f8-9af4-4e03-bf0e-f8c6225d3381#ref=rss,www.spiegel.de,"Donald Trump: Scharfe Kritik an seinen Milliarden, doch der US-Präsident winkt ab - DER SPIEGEL",0.1,LOW,False,,,mainstream,2026-07-02T03:43:37.913999
"Der 29-Jährige soll bei den Nets einen Zweijahresvertrag über 19 Millionen Dollar erhalten, wie der US-Sender berichtete",https://www.spiegel.de/sport/basketball/nba-moritz-wagner-wechselt-von-den-orlando-magic-nach-brooklyn-a-6ae78019-46f7-46b5-be6b-c20ee35eabc9#ref=rss,www.spiegel.de,NBA: Moritz Wagner wechselt von den Orlando Magic nach Brooklyn - DER SPIEGEL,0,LOW,False,,,mainstream,2026-07-02T03:43:39.906098
"000 Soldaten im Ukrainekrieg getötet Mindestens 1,4 Millionen verletzte oder vermisste Soldaten und bis zu 600",https://www.spiegel.de/ausland/bis-zu-600-000-soldaten-im-ukrainekrieg-getoetet-a-9b4a6233-8ad4-4b92-bbe1-e1fbfd290521#ref=rss,www.spiegel.de,Bis zu 600.000 Soldaten im Ukrainekrieg getötet - DER SPIEGEL,0,LOW,False,,,mainstream,2026-07-02T03:43:41.908088
000 Gefallene – das ist laut einer US-Studie die bisherige Bilanz von Putins Angriffskrieg gegen die Ukraine,https://www.spiegel.de/ausland/bis-zu-600-000-soldaten-im-ukrainekrieg-getoetet-a-9b4a6233-8ad4-4b92-bbe1-e1fbfd290521#ref=rss,www.spiegel.de,Bis zu 600.000 Soldaten im Ukrainekrieg getötet - DER SPIEGEL,0.1,LOW,False,,,mainstream,2026-07-02T03:43:42.121014
"Seit Beginn des Ukraine-Krieges im Februar 2022 hat die russische Armee der Studie des CSIS zufolge rund 1,4 Millionen Verluste verzeichnet",https://www.spiegel.de/ausland/bis-zu-600-000-soldaten-im-ukrainekrieg-getoetet-a-9b4a6233-8ad4-4b92-bbe1-e1fbfd290521#ref=rss,www.spiegel.de,Bis zu 600.000 Soldaten im Ukrainekrieg getötet - DER SPIEGEL,0,LOW,False,,,mainstream,2026-07-02T03:43:42.341049
"Zum Login SPIEGEL plus Nur für Neukunden € 1,– für 4 Wochen danach € 5,99 pro Woche Freier Zugriff auf alle S+-Artikel auf SPIEGEL",https://www.spiegel.de/sport/fussball/wm-2026-belgien-gewinnt-spektakulaeres-duell-gegen-senegal-und-steht-im-achtelfinale-a-a2ea6895-ef5b-4da3-a6dd-90b7b7e91ab5#ref=rss,www.spiegel.de,WM 2026: Belgien gewinnt spektakuläres Duell gegen Senegal und steht im Achtelfinale - DER SPIEGEL,0.1,LOW,False,,,mainstream,2026-07-02T03:43:43.466131
"E-Paper (PDF), Digital-Archiv und S+-Newsletter Jederzeit kündigen Jetzt abonnieren SPIEGEL plus 52 Wochen 25 % sparen € 4,49 pro Woche für 52 Wochen danach € 5,99 pro Woche Freier Zugriff auf alle S+-Artikel auf SPIEGEL",https://www.spiegel.de/sport/fussball/wm-2026-belgien-gewinnt-spektakulaeres-duell-gegen-senegal-und-steht-im-achtelfinale-a-a2ea6895-ef5b-4da3-a6dd-90b7b7e91ab5#ref=rss,www.spiegel.de,WM 2026: Belgien gewinnt spektakuläres Duell gegen Senegal und steht im Achtelfinale - DER SPIEGEL,0.1,LOW,False,,,mainstream,2026-07-02T03:43:43.680312
Details sollen am Donnerstag verkündet werden,https://www.spiegel.de/politik/koalition-einigt-sich-ueber-reformpaket-a-ae0f6cc9-a2b7-4dc4-8620-b7ceb8d92fe6#ref=rss,www.spiegel.de,Koalition einigt sich über Reformpaket - DER SPIEGEL,0,LOW,False,,,mainstream,2026-07-02T03:43:44.794963
Nach Angaben von Teilnehmern enthält die Einigung auch eine Reform der Einkommensteuer,https://www.spiegel.de/politik/koalition-einigt-sich-ueber-reformpaket-a-ae0f6cc9-a2b7-4dc4-8620-b7ceb8d92fe6#ref=rss,www.spiegel.de,Koalition einigt sich über Reformpaket - DER SPIEGEL,0,LOW,False,,,mainstream,2026-07-02T03:43:45.017316
"Zum Login SPIEGEL plus Nur für Neukunden € 1,– für 4 Wochen danach € 5,99 pro Woche Freier Zugriff auf alle S+-Artikel auf SPIEGEL",https://www.spiegel.de/wissenschaft/venezuela-satellitenbilder-zeigen-das-ausmass-der-katastrophe-a-8f07e2ae-a919-4cbe-87c3-0325ae9be904#ref=rss,www.spiegel.de,Venezuela: Satellitenbilder zeigen das Ausmaß der Katastrophe - DER SPIEGEL,0.1,LOW,False,,,mainstream,2026-07-02T03:43:46.117121
"E-Paper (PDF), Digital-Archiv und S+-Newsletter Jederzeit kündigen Jetzt abonnieren SPIEGEL plus 52 Wochen 25 % sparen € 4,49 pro Woche für 52 Wochen danach € 5,99 pro Woche Freier Zugriff auf alle S+-Artikel auf SPIEGEL",https://www.spiegel.de/wissenschaft/venezuela-satellitenbilder-zeigen-das-ausmass-der-katastrophe-a-8f07e2ae-a919-4cbe-87c3-0325ae9be904#ref=rss,www.spiegel.de,Venezuela: Satellitenbilder zeigen das Ausmaß der Katastrophe - DER SPIEGEL,0.1,LOW,False,,,mainstream,2026-07-02T03:43:46.318815
Banker hatten zuvor 15 Milliarden Euro für ​realistisch gehalten,https://www.spiegel.de/wirtschaft/unternehmen/knds-panzerbauer-will-mit-boersengang-auf-hoeheren-kurs-warten-a-74b1a806-89e1-40b0-bfb6-3969e8e9ed41#ref=rss,www.spiegel.de,KNDS: Panzerbauer will mit Börsengang auf höheren Kurs warten - DER SPIEGEL,0,LOW,False,,,mainstream,2026-07-02T03:43:47.383514
"Zum Login SPIEGEL plus Nur für Neukunden € 1,– für 4 Wochen danach € 5,99 pro Woche Freier Zugriff auf alle S+-Artikel auf SPIEGEL",https://www.spiegel.de/sport/fussball/wm-2026-live-belgien-gegen-senegal-im-liveticker-a-899174ba-526f-4fff-94ec-23ff7e310e56#ref=rss,www.spiegel.de,WM 2026 live: Belgien gegen Senegal im Liveticker - DER SPIEGEL,0.1,LOW,False,,,mainstream,2026-07-02T03:43:48.483209
"E-Paper (PDF), Digital-Archiv und S+-Newsletter Jederzeit kündigen Jetzt abonnieren SPIEGEL plus 52 Wochen 25 % sparen € 4,49 pro Woche für 52 Wochen danach € 5,99 pro Woche Freier Zugriff auf alle S+-Artikel auf SPIEGEL",https://www.spiegel.de/sport/fussball/wm-2026-live-belgien-gegen-senegal-im-liveticker-a-899174ba-526f-4fff-94ec-23ff7e310e56#ref=rss,www.spiegel.de,WM 2026 live: Belgien gegen Senegal im Liveticker - DER SPIEGEL,0.1,LOW,False,,,mainstream,2026-07-02T03:43:48.690360
"Zum Login SPIEGEL plus Nur für Neukunden € 1,– für 4 Wochen danach € 5,99 pro Woche Freier Zugriff auf alle S+-Artikel auf SPIEGEL",https://www.spiegel.de/kultur/kino/bill-und-tom-kaulitz-es-gehoert-als-kuenstler-dazu-anzuecken-das-darf-man-sich-nicht-nehmen-lassen-a-373a6206-185c-461f-a298-180a27af9fbc#ref=rss,www.spiegel.de,Bill und Tom Kaulitz: »Es gehört als Künstler dazu anzuecken. Das darf man sich nicht nehmen lassen.,0.1,LOW,False,,,mainstream,2026-07-02T03:43:49.791462
"E-Paper (PDF), Digital-Archiv und S+-Newsletter Jederzeit kündigen Jetzt abonnieren SPIEGEL plus 52 Wochen 25 % sparen € 4,49 pro Woche für 52 Wochen danach € 5,99 pro Woche Freier Zugriff auf alle S+-Artikel auf SPIEGEL",https://www.spiegel.de/kultur/kino/bill-und-tom-kaulitz-es-gehoert-als-kuenstler-dazu-anzuecken-das-darf-man-sich-nicht-nehmen-lassen-a-373a6206-185c-461f-a298-180a27af9fbc#ref=rss,www.spiegel.de,Bill und Tom Kaulitz: »Es gehört als Künstler dazu anzuecken. Das darf man sich nicht nehmen lassen.,0.1,LOW,False,,,mainstream,2026-07-02T03:43:49.996073
"Kein Bekennerschreiben, keine bekannten HintergründeLaut der Polizei sind die improvisierten Sprengsätze aus Butangasflaschen hergestellt worden",https://www.spiegel.de/ausland/thessaloniki-griechenland-eine-tote-bei-angriffen-auf-politikerhaeuser-a-1775ad4a-247d-4a67-a78f-bf5631c1b8eb#ref=rss,www.spiegel.de,Thessaloniki – Griechenland: Eine Tote bei Angriffen auf Politikerhäuser - DER SPIEGEL,0.1,LOW,False,,,mainstream,2026-07-02T03:43:51.101612
"As of June there had been 11,638 arrivals to the UK via small boats this year - a figure that is 37% lower than the same period in 2025",https://www.bbc.co.uk/news/articles/cgev8ey9wrwo?at_medium=RSS&amp;at_campaign=rss,www.bbc.co.uk,More than 300 arrests in organised immigration crime crackdown - BBC News,0,LOW,False,,,mainstream,2026-07-02T03:43:52.371878
