claim,source_url,source_domain,article_title,risk_score,risk_category,has_factcheck,factcheck_rating,factcheck_source,source_type,checked_at
[DEBUNKED] Democratic Group Makes False Claim in Insider-Trading Ad Attacking Susan Collins - FactCheck.org,https://www.factcheck.org/2026/07/democratic-group-makes-false-claim-in-insider-trading-ad-attacking-susan-collins/,www.factcheck.org,Democratic Group Makes False Claim in Insider-Trading Ad Attacking Susan Collins - FactCheck.org,0.9,HIGH,True,FALSE - Debunked by fact-checkers,www.factcheck.org,factcheck,2026-07-11T19:06:00.880619
[DEBUNKED] How Trump&#039;s Preliminary Deal with Iran Compares with His Rhetoric - FactCheck.org,https://www.factcheck.org/2026/06/how-trumps-preliminary-deal-with-iran-compares-with-his-rhetoric/,www.factcheck.org,How Trump&#039;s Preliminary Deal with Iran Compares with His Rhetoric - FactCheck.org,0.9,HIGH,True,FALSE - Debunked by fact-checkers,www.factcheck.org,factcheck,2026-07-11T19:06:02.756034
"&#8220;We cut the flow of fentanyl across our border by 59%, which is unheard of,&#8221; Trump said in May 22 remarks in New York",https://www.factcheck.org/2026/06/trump-makes-unsupported-claims-about-drug-flows/,www.factcheck.org,Trump Makes Unsupported Claims About Drug Flows - FactCheck.org,0,LOW,False,,,factcheck,2026-07-11T19:06:04.168593
"&#8220;And we cut the flow of fentanyl and drugs into our country by the ocean and the sea, in other words, coming in by water, by ocean and sea by 97%",https://www.factcheck.org/2026/06/trump-makes-unsupported-claims-about-drug-flows/,www.factcheck.org,Trump Makes Unsupported Claims About Drug Flows - FactCheck.org,0,LOW,False,,,factcheck,2026-07-11T19:06:04.358758
"Then, on May 28, in an interview with his daughter-in-law, Lara Trump, on Fox News, he said, &#8220;We have drugs down 97%",https://www.factcheck.org/2026/06/trump-makes-unsupported-claims-about-drug-flows/,www.factcheck.org,Trump Makes Unsupported Claims About Drug Flows - FactCheck.org,0,LOW,False,,,factcheck,2026-07-11T19:06:04.543815
[DEBUNKED] Fact Check: UNSOURCED Wikipedia Page Does NOT Prove Egypt-Argentina Match Referee Francois Letexier Grew Up In 'Orthodox Jewish Family' | Lead Stories,https://leadstories.com/hoax-alert/2026/07/fact-check-unsourced-wikipedia-page-does-not-prove-egypt-argentina-match-referee-francois-letexier-grew-up-in-orthodox-jewish-family.html,leadstories.com,Fact Check: UNSOURCED Wikipedia Page Does NOT Prove Egypt-Argentina Match Referee Francois Letexier ,0.9,HIGH,True,FALSE - Debunked by fact-checkers,leadstories.com,factcheck,2026-07-11T19:06:04.726130
[DEBUNKED] Fact Check: Image Does NOT Show FIFA President Infantino Making Phone Call During Egypt-Argentina Match -- He Was At A Different Game | Lead Stories,https://leadstories.com/hoax-alert/2026/07/fact-check-video-does-not-show-fifa-president-infantino-making-phone-call-during-egypt-argentina-match.html,leadstories.com,Fact Check: Image Does NOT Show FIFA President Infantino Making Phone Call During Egypt-Argentina Ma,0.9,HIGH,True,FALSE - Debunked by fact-checkers,leadstories.com,factcheck,2026-07-11T19:06:04.926910
[DEBUNKED] Fact Check: FAKE France 24 Video Does NOT Accurately Summarize UPA-Related Monument Legislation | Lead Stories,https://leadstories.com/hoax-alert/2026/07/fact-check-fake-france-24-video-does-not-accurately-summarize-upa-related-monument-legislation.html,leadstories.com,Fact Check: FAKE France 24 Video Does NOT Accurately Summarize UPA-Related Monument Legislation | Le,0.9,HIGH,True,FALSE - Debunked by fact-checkers,leadstories.com,factcheck,2026-07-11T19:06:05.136683
[DEBUNKED] Fact Check: REAL Email In Epstein Files Contains Joke About Mitt Romney's Wife And Barack Obama | Lead Stories,https://leadstories.com/hoax-alert/2026/07/fact-check-real-email-in-epstein-files-contains-joke-about-mitt-romneys-wife-and-barack-obama.html,leadstories.com,Fact Check: REAL Email In Epstein Files Contains Joke About Mitt Romney's Wife And Barack Obama | Le,0.9,HIGH,True,FALSE - Debunked by fact-checkers,leadstories.com,factcheck,2026-07-11T19:06:05.360924
[DEBUNKED] Fact Check: Image Trump Posted as 'Retribution' Against Iran Does NOT Show July 2026 U.S. Bombing -- It Is June 2025 Israeli Attack | Lead Stories,https://leadstories.com/hoax-alert/2026/07/fact-check-image-trump-posted-as-retribution-against-iran-does-not-show-july-2026-us-bombing-its-june-2025-israeli-attack.html,leadstories.com,Fact Check: Image Trump Posted as 'Retribution' Against Iran Does NOT Show July 2026 U.S. Bombing --,0.9,HIGH,True,FALSE - Debunked by fact-checkers,leadstories.com,factcheck,2026-07-11T19:06:05.558864
[DEBUNKED] Prebunk: London Calling To Stop Falling For Fake UK Protest Videos -- AI Is Leading You Down The River Thames | Lead Stories,https://leadstories.com/hoax-alert/2026/07/prebunk-london-calling-to-stop-falling-for-fake-uk-protest-videos-ai-is-leading-you-down-the-river-thames.html,leadstories.com,Prebunk: London Calling To Stop Falling For Fake UK Protest Videos -- AI Is Leading You Down The Riv,0.9,HIGH,True,FALSE - Debunked by fact-checkers,leadstories.com,factcheck,2026-07-11T19:06:05.755409
[DEBUNKED] Fact Check: Video Does NOT Show FIFA's Infantino Reaction To Egypt Scoring Goal During World Cup In July 2026  | Lead Stories,https://leadstories.com/hoax-alert/2026/07/fact-check-video-does-not-show-fifas-infantino-reaction-to-egypt-scoring-goal-during-world-cup-in-july-2026.html,leadstories.com,Fact Check: Video Does NOT Show FIFA's Infantino Reaction To Egypt Scoring Goal During World Cup In ,0.9,HIGH,True,FALSE - Debunked by fact-checkers,leadstories.com,factcheck,2026-07-11T19:06:05.950327
[DEBUNKED] Fact Check: Image Does NOT Show FIFA President Infantino Looking Anxious After Messi Missed Penalty Against Egypt -- Predates The Match | Lead Stories,https://leadstories.com/hoax-alert/2026/07/fact-check-image-does-not-show-fifa-president-infantino-looking-anxious-after-messi-missed-penalty-against-egypt-it-was-from-another-match.html,leadstories.com,Fact Check: Image Does NOT Show FIFA President Infantino Looking Anxious After Messi Missed Penalty ,0.9,HIGH,True,FALSE - Debunked by fact-checkers,leadstories.com,factcheck,2026-07-11T19:06:06.136235
[DEBUNKED] Fact Check: FAKE Video Of PM Giorgia Meloni Saying She Is A Christian Daughter Of Italy Who Will Not Allow Sharia Law In Her Country | Lead Stories,https://leadstories.com/hoax-alert/2026/07/fact-check-fake-video-of-pm-giorgia-meloni-describing-herself-as-christian-daughter-of-italy-who-will-not-allow-implementation-of-sharia-law.html,leadstories.com,Fact Check: FAKE Video Of PM Giorgia Meloni Saying She Is A Christian Daughter Of Italy Who Will Not,0.9,HIGH,True,FALSE - Debunked by fact-checkers,leadstories.com,factcheck,2026-07-11T19:06:06.365345
"[DEBUNKED] Fact Check: FAKE ""Breaking News"" Video Shows Furries Chasing Patriot Front Member In Downtown D.C. -- AI Media Account Origin | Lead Stories",https://leadstories.com/hoax-alert/2026/07/fact-check-fake-breaking-news-video-shows-furries-chasing-patriot-front-member-in-downtown-dc-ai-media-account-origin.html,leadstories.com,"Fact Check: FAKE ""Breaking News"" Video Shows Furries Chasing Patriot Front Member In Downtown D.C. -",0.9,HIGH,True,FALSE - Debunked by fact-checkers,leadstories.com,factcheck,2026-07-11T19:06:06.584462
[DEBUNKED] Fact Check: FAKE Photo Of Mitch McConnell On Life Support Was Generated Using OpenAI | Lead Stories,https://leadstories.com/hoax-alert/2026/07/fact-check-fake-photo-of-mitch-mcconnell-on-life-support-was-generated-using-openai.html,leadstories.com,Fact Check: FAKE Photo Of Mitch McConnell On Life Support Was Generated Using OpenAI | Lead Stories,0.9,HIGH,True,FALSE - Debunked by fact-checkers,leadstories.com,factcheck,2026-07-11T19:06:06.775854
[DEBUNKED] Fact Check: FAKE Screenshot Shows Trump Asking Mullin To Lock Up Communists In ICE Detention Centers -- No Such Truth Social Post | Lead Stories,https://leadstories.com/hoax-alert/2026/07/fact-check-trump-markwayne-mullin-ice-detention-centers-communists.html,leadstories.com,Fact Check: FAKE Screenshot Shows Trump Asking Mullin To Lock Up Communists In ICE Detention Centers,0.9,HIGH,True,FALSE - Debunked by fact-checkers,leadstories.com,factcheck,2026-07-11T19:06:06.965685
"[DEBUNKED] Fact Check: Congressman Jack Kimble Did NOT Speak With Senator Mitch McConnell On July 7, 2026 -- Or Ever | Lead Stories",https://leadstories.com/hoax-alert/2026/07/fact-check-congressman-jack-kimble-did-not-speak-with-mitch-mcconnell.html,leadstories.com,"Fact Check: Congressman Jack Kimble Did NOT Speak With Senator Mitch McConnell On July 7, 2026 -- Or",0.9,HIGH,True,FALSE - Debunked by fact-checkers,leadstories.com,factcheck,2026-07-11T19:06:07.169661
"[DEBUNKED] Fact Check: FAKE Image Does NOT Show Tall Ships Sailing Near Liberty Island In New York Harbor On July 4, 2026 | Lead Stories",https://leadstories.com/hoax-alert/2026/07/fact-check-fake-image-does-not-show-real-tall-ships-sailing-near-liberty-island.html,leadstories.com,Fact Check: FAKE Image Does NOT Show Tall Ships Sailing Near Liberty Island In New York Harbor On Ju,0.9,HIGH,True,FALSE - Debunked by fact-checkers,leadstories.com,factcheck,2026-07-11T19:06:07.362677
[DEBUNKED] Fact Check: Mitch McConnell's Wife Elaine Chao Did NOT Go To China After He Was Hospitalized With 'Cardiac Arrest' -- Had Been There For Days | Lead Stories,https://leadstories.com/hoax-alert/2026/07/fact-check-mitch-mcconnells-wife-elaine-chao-did-not-go-to-china-after-he-was-hospitalized-with-cardiac-arrest.html,leadstories.com,Fact Check: Mitch McConnell's Wife Elaine Chao Did NOT Go To China After He Was Hospitalized With 'C,0.9,HIGH,True,FALSE - Debunked by fact-checkers,leadstories.com,factcheck,2026-07-11T19:06:07.592276
"""Alle anderen Parteien beschäftigen sich nur noch mit uns, haben keine eigenen Positionen","https://www.mdr.de/nachrichten/sachsen-anhalt/landtagswahl/100-tage-programm-nach-wahl,afd-parteitag-magdeburg-116.html",www.mdr.de,"Abschieben, kündigen, sparen – Die Pläne der AfD für Sachsen-Anhalt | mdr.de",0.1,LOW,False,,,mainstream,2026-07-11T19:06:19.248435
"""Denn ohne die Linken hat Herr Schulze überhaupt keine Chance auf irgendwelche Mehrheiten","https://www.mdr.de/nachrichten/sachsen-anhalt/landtagswahl/100-tage-programm-nach-wahl,afd-parteitag-magdeburg-116.html",www.mdr.de,"Abschieben, kündigen, sparen – Die Pläne der AfD für Sachsen-Anhalt | mdr.de",0.1,LOW,False,,,mainstream,2026-07-11T19:06:19.438654
"Insgesamt retteten Einsatzkräfte nach Angaben des Gouverneurs Hunderte Menschen aus überfluteten Fahrzeugen, von Dächern, Bäumen und aus den Fluten",https://www.spiegel.de/panorama/missouri-hunderte-menschen-nach-sturzfluten-gerettet-a-44044c68-50d6-4fbb-a24e-51e08ecaacfd#ref=rss,www.spiegel.de,Missouri: Hunderte Menschen nach Sturzfluten gerettet - DER SPIEGEL,0,LOW,False,,,mainstream,2026-07-11T19:06:21.403920
Nach Angaben des nationalen Wetterdienstes handelt es sich um ungewöhnliche hohe Regenmengen,https://www.spiegel.de/panorama/missouri-hunderte-menschen-nach-sturzfluten-gerettet-a-44044c68-50d6-4fbb-a24e-51e08ecaacfd#ref=rss,www.spiegel.de,Missouri: Hunderte Menschen nach Sturzfluten gerettet - DER SPIEGEL,0,LOW,False,,,mainstream,2026-07-11T19:06:21.588731
Ein Meteorologe der Behörde sprach US-Medienberichten zufolge von einem statistisch etwa alle tausend Jahre zu erwa,https://www.spiegel.de/panorama/missouri-hunderte-menschen-nach-sturzfluten-gerettet-a-44044c68-50d6-4fbb-a24e-51e08ecaacfd#ref=rss,www.spiegel.de,Missouri: Hunderte Menschen nach Sturzfluten gerettet - DER SPIEGEL,0.1,LOW,False,,,mainstream,2026-07-11T19:06:21.778656
Der Zugverkehr rollt nach Angaben der Deutschen Bahn wieder ohne Einschränkungen,https://www.spiegel.de/panorama/gesellschaft/duesseldorf-koeln-bahnstrecke-nach-boeschungsbrand-wieder-freigegeben-a-9fe53f3a-f721-4b23-b3b0-9de563dff28f#ref=rss,www.spiegel.de,Düsseldorf–Köln: Bahnstrecke nach Böschungsbrand wieder freigegeben - DER SPIEGEL,0,LOW,False,,,mainstream,2026-07-11T19:06:23.052499
Am Freitagvormittag hatte die Böschung zwischen Langenfeld und Leverkusen laut Bahn an zwei Stellen gebrannt,https://www.spiegel.de/panorama/gesellschaft/duesseldorf-koeln-bahnstrecke-nach-boeschungsbrand-wieder-freigegeben-a-9fe53f3a-f721-4b23-b3b0-9de563dff28f#ref=rss,www.spiegel.de,Düsseldorf–Köln: Bahnstrecke nach Böschungsbrand wieder freigegeben - DER SPIEGEL,0,LOW,False,,,mainstream,2026-07-11T19:06:23.239411
"Die Feuerwehr löschte die Brände, das Feuer beschädigte jedoch mehrere Signalkabel, sodass auf dem Abschnitt keine Züge fahren konnten",https://www.spiegel.de/panorama/gesellschaft/duesseldorf-koeln-bahnstrecke-nach-boeschungsbrand-wieder-freigegeben-a-9fe53f3a-f721-4b23-b3b0-9de563dff28f#ref=rss,www.spiegel.de,Düsseldorf–Köln: Bahnstrecke nach Böschungsbrand wieder freigegeben - DER SPIEGEL,0.1,LOW,False,,,mainstream,2026-07-11T19:06:23.422302
"Zum Login SPIEGEL plus Nur für Neukunden € 1,– für 4 Wochen danach € 5,99 pro Woche Freier Zugriff auf alle S+-Artikel auf SPIEGEL",https://www.spiegel.de/kultur/asha-hedayati-und-mathis-boente-streiten-ueber-maennergewalt-was-sie-sagen-macht-mich-wirklich-wuetend-a-ad336ff6-1f49-44f4-bbe4-0a1df0aa33a6#ref=rss,www.spiegel.de,"Asha Hedayati und Mathis Bönte streiten über Männergewalt: »Was Sie sagen, macht mich wirklich wüten",0.1,LOW,False,,,mainstream,2026-07-11T19:06:25.695211
"E-Paper (PDF), Digital-Archiv und S+-Newsletter Jederzeit kündigen Jetzt abonnieren SPIEGEL plus 52 Wochen 25 % sparen € 4,49 pro Woche für 52 Wochen danach € 5,99 pro Woche Freier Zugriff auf alle S+-Artikel auf SPIEGEL",https://www.spiegel.de/kultur/asha-hedayati-und-mathis-boente-streiten-ueber-maennergewalt-was-sie-sagen-macht-mich-wirklich-wuetend-a-ad336ff6-1f49-44f4-bbe4-0a1df0aa33a6#ref=rss,www.spiegel.de,"Asha Hedayati und Mathis Bönte streiten über Männergewalt: »Was Sie sagen, macht mich wirklich wüten",0.1,LOW,False,,,mainstream,2026-07-11T19:06:25.882886
"In der nordukrainischen Stadt Sumy kamen nach Angaben des dortigen Bürgermeisters zunächst vier Zivilisten ums Leben, als russische Gleitbomben einen Bus und eine Bushaltestelle trafen",https://www.spiegel.de/ausland/russland-greift-bushaltestelle-in-sumy-mit-gleitbombe-an-a-ab66b3c8-9511-4b59-a604-bf01dedd98cc#ref=rss,www.spiegel.de,Russland greift Bushaltestelle in Sumy mit Gleitbombe an - DER SPIEGEL,0,LOW,False,,,mainstream,2026-07-11T19:06:27.115003
Bei einem Raketenangriff in der südukrainischen Hafenstadt Odessa starben nach Angaben des Regionalgouverneurs zwei Menschen,https://www.spiegel.de/ausland/russland-greift-bushaltestelle-in-sumy-mit-gleitbombe-an-a-ab66b3c8-9511-4b59-a604-bf01dedd98cc#ref=rss,www.spiegel.de,Russland greift Bushaltestelle in Sumy mit Gleitbombe an - DER SPIEGEL,0,LOW,False,,,mainstream,2026-07-11T19:06:27.297974
"Zum Login SPIEGEL plus Nur für Neukunden € 1,– für 4 Wochen danach € 5,99 pro Woche Freier Zugriff auf alle S+-Artikel auf SPIEGEL",https://www.spiegel.de/sport/fussball/wm-2026-news-heute-argentiniens-verband-moeglicherweise-gehackt-a-fe4c2a94-bc0d-4f36-a77a-e55bb266255c#ref=rss,www.spiegel.de,WM 2026 News heute: Die DFB-Jugend macht Hoffnung – gewinnt die U19 das EM-Finale gegen Spanien? - D,0.1,LOW,False,,,mainstream,2026-07-11T19:06:28.388920
"E-Paper (PDF), Digital-Archiv und S+-Newsletter Jederzeit kündigen Jetzt abonnieren SPIEGEL plus 52 Wochen 25 % sparen € 4,49 pro Woche für 52 Wochen danach € 5,99 pro Woche Freier Zugriff auf alle S+-Artikel auf SPIEGEL",https://www.spiegel.de/sport/fussball/wm-2026-news-heute-argentiniens-verband-moeglicherweise-gehackt-a-fe4c2a94-bc0d-4f36-a77a-e55bb266255c#ref=rss,www.spiegel.de,WM 2026 News heute: Die DFB-Jugend macht Hoffnung – gewinnt die U19 das EM-Finale gegen Spanien? - D,0.1,LOW,False,,,mainstream,2026-07-11T19:06:28.577514
"Mit ihrem Triumph darf sich Nosková, die zuvor das Vorbereitungsturnier in Berlin sowohl im Einzel als auch im Doppel gewonnen hatte und jetzt ihre überragende Rasensaison krönte, über ein Preisgeld von umgerechnet 4,22 Millionen Euro freuen",https://www.spiegel.de/sport/tennis/wimbledon-linda-noskova-aus-tschechien-gewinnt-finale-gegen-karolina-muchova-a-66099822-d3b7-4ec3-9038-2b70e50d1309#ref=rss,www.spiegel.de,Wimbledon: Linda Nosková aus Tschechien gewinnt Finale gegen Karolina Muchova - DER SPIEGEL,0.1,LOW,False,,,mainstream,2026-07-11T19:06:29.680925
"Dieser Text enthält mit dem Hinweis »Anzeige« gekennzeichnete Affiliate-Links, über die der Verlag, aber nie der Autor individuell, bei Verkäufen eine geringe Provision vom Händler erhält",https://www.spiegel.de/netzwelt/gadgets/sennheiser-momentum-5-im-test-dieser-kopfhoerer-hat-kein-mindesthaltbarkeitsdatum-a-adc1debd-4dcb-4d49-9938-c31670e46c3d#ref=rss,www.spiegel.de,Sennheiser Momentum 5 im Test: Dieser Kopfhörer hat kein Mindesthaltbarkeitsdatum - DER SPIEGEL,0.1,LOW,False,,,mainstream,2026-07-11T19:06:30.780156
"Für das Vorgängermodell kostet ein Paar beim Hersteller 30 Euro, spezielle Polster für den Momentum 5 sind bislang nicht erhältlich, Kopfpolster gar nicht",https://www.spiegel.de/netzwelt/gadgets/sennheiser-momentum-5-im-test-dieser-kopfhoerer-hat-kein-mindesthaltbarkeitsdatum-a-adc1debd-4dcb-4d49-9938-c31670e46c3d#ref=rss,www.spiegel.de,Sennheiser Momentum 5 im Test: Dieser Kopfhörer hat kein Mindesthaltbarkeitsdatum - DER SPIEGEL,0,LOW,False,,,mainstream,2026-07-11T19:06:30.967879
Nach Angaben ihrer Familie auf einer GoFundMe-Seite blieb Lillard trotz ihrer schweren gesundheitlichen Einschränkungen selbstständig und kreativ,https://www.spiegel.de/wissenschaft/kinderlaehmung-letzte-nutzerin-der-eisernen-lunge-ist-gestorben-a-d967a223-1942-42b2-af40-b63671870dcd#ref=rss,www.spiegel.de,Kinderlähmung: Letzte Nutzerin der Eisernen Lunge ist gestorben – Martha Lillard ist tot - DER SPIEG,0,LOW,False,,,mainstream,2026-07-11T19:06:32.068002
"»Rekord aufstellen, Geschichte im Entstehen«, kommentierte der Rapper die Aktion, bevor Will Munford vom Guinnessbuch den Rekord offiziell bestätigte",https://www.spiegel.de/panorama/leute/pitbull-tausende-fans-imitieren-rapper-bei-konzert-in-london-sie-tragen-kuenstliche-glatzen-a-4eb8666c-07ba-43b7-8fac-0b11cd8dec28#ref=rss,www.spiegel.de,Pitbull-Renaissance: Tausende Fans tragen Latexglatzen bei Konzert in London - DER SPIEGEL,0,LOW,False,,,mainstream,2026-07-11T19:06:33.309892
"Bei einem seiner Konzerte im vergangenen Jahr sagte Pitbull dazu: »Ich habe noch nie so viele glatzköpfige, schöne, sexy Menschen an einem Ort gesehen",https://www.spiegel.de/panorama/leute/pitbull-tausende-fans-imitieren-rapper-bei-konzert-in-london-sie-tragen-kuenstliche-glatzen-a-4eb8666c-07ba-43b7-8fac-0b11cd8dec28#ref=rss,www.spiegel.de,Pitbull-Renaissance: Tausende Fans tragen Latexglatzen bei Konzert in London - DER SPIEGEL,0.1,LOW,False,,,mainstream,2026-07-11T19:06:33.410241
"An alle von euch, die mit einer Glatzenkappe gekommen sind: Ich hoffe, ihr fühlt euch, wie ich mich jeden Tag fühle",https://www.spiegel.de/panorama/leute/pitbull-tausende-fans-imitieren-rapper-bei-konzert-in-london-sie-tragen-kuenstliche-glatzen-a-4eb8666c-07ba-43b7-8fac-0b11cd8dec28#ref=rss,www.spiegel.de,Pitbull-Renaissance: Tausende Fans tragen Latexglatzen bei Konzert in London - DER SPIEGEL,0.1,LOW,False,,,mainstream,2026-07-11T19:06:33.594046
"Zum Login SPIEGEL plus Nur für Neukunden € 1,– für 4 Wochen danach € 5,99 pro Woche Freier Zugriff auf alle S+-Artikel auf SPIEGEL",https://www.spiegel.de/ausland/russland-ukraine-krieg-grafiken-zeigen-die-drohnen-angriffe-auf-russische-raffinerien-a-5d22c9e7-895e-42f8-a634-8471f42a1882#ref=rss,www.spiegel.de,Benzinkrise in Russland: Grafiken zeigen die Drohnen-Angriffe auf Raffinerien - DER SPIEGEL,0.1,LOW,False,,,mainstream,2026-07-11T19:06:34.676253
"E-Paper (PDF), Digital-Archiv und S+-Newsletter Jederzeit kündigen Jetzt abonnieren SPIEGEL plus 52 Wochen 25 % sparen € 4,49 pro Woche für 52 Wochen danach € 5,99 pro Woche Freier Zugriff auf alle S+-Artikel auf SPIEGEL",https://www.spiegel.de/ausland/russland-ukraine-krieg-grafiken-zeigen-die-drohnen-angriffe-auf-russische-raffinerien-a-5d22c9e7-895e-42f8-a634-8471f42a1882#ref=rss,www.spiegel.de,Benzinkrise in Russland: Grafiken zeigen die Drohnen-Angriffe auf Raffinerien - DER SPIEGEL,0.1,LOW,False,,,mainstream,2026-07-11T19:06:34.867022
"Zum Login SPIEGEL plus Nur für Neukunden € 1,– für 4 Wochen danach € 5,99 pro Woche Freier Zugriff auf alle S+-Artikel auf SPIEGEL",https://www.spiegel.de/politik/wehrpflicht-debatte-wie-der-gruene-janosch-dahmen-vom-pazifisten-zum-reservisten-wurde-a-0ed300dc-531e-4e0f-b4ba-c867f7e3ca2c#ref=rss,www.spiegel.de,Janosch Dahmen: Wie der Grüne vom Pazifisten zum Reservisten wurde - DER SPIEGEL,0.1,LOW,False,,,mainstream,2026-07-11T19:06:36.041608
"E-Paper (PDF), Digital-Archiv und S+-Newsletter Jederzeit kündigen Jetzt abonnieren SPIEGEL plus 52 Wochen 25 % sparen € 4,49 pro Woche für 52 Wochen danach € 5,99 pro Woche Freier Zugriff auf alle S+-Artikel auf SPIEGEL",https://www.spiegel.de/politik/wehrpflicht-debatte-wie-der-gruene-janosch-dahmen-vom-pazifisten-zum-reservisten-wurde-a-0ed300dc-531e-4e0f-b4ba-c867f7e3ca2c#ref=rss,www.spiegel.de,Janosch Dahmen: Wie der Grüne vom Pazifisten zum Reservisten wurde - DER SPIEGEL,0.1,LOW,False,,,mainstream,2026-07-11T19:06:36.229650
"Zum Login SPIEGEL plus Nur für Neukunden € 1,– für 4 Wochen danach € 5,99 pro Woche Freier Zugriff auf alle S+-Artikel auf SPIEGEL",https://www.spiegel.de/ausland/italien-mehr-als-90-menschen-kaufen-in-der-toskana-zusammen-ein-dorf-a-8b8fccda-f0eb-40b6-b9e2-c18d005eeaff#ref=rss,www.spiegel.de,Italien: Mehr als 90 Menschen kaufen in der Toskana zusammen ein Dorf - DER SPIEGEL,0.1,LOW,False,,,mainstream,2026-07-11T19:06:38.240157
"E-Paper (PDF), Digital-Archiv und S+-Newsletter Jederzeit kündigen Jetzt abonnieren SPIEGEL plus 52 Wochen 25 % sparen € 4,49 pro Woche für 52 Wochen danach € 5,99 pro Woche Freier Zugriff auf alle S+-Artikel auf SPIEGEL",https://www.spiegel.de/ausland/italien-mehr-als-90-menschen-kaufen-in-der-toskana-zusammen-ein-dorf-a-8b8fccda-f0eb-40b6-b9e2-c18d005eeaff#ref=rss,www.spiegel.de,Italien: Mehr als 90 Menschen kaufen in der Toskana zusammen ein Dorf - DER SPIEGEL,0.1,LOW,False,,,mainstream,2026-07-11T19:06:38.449612
Andere Nutzungen verletzen das Urheberrecht Zur Ausgabe Artikel 7 / 64 meinung &bull;Deutsche im Ausland Ferien mit Hitler Eine Kolumne von Susanne Beyer In anderen Ländern werden wir immer noch über die NS-Vergangenheit wahrgenommen,https://www.spiegel.de/politik/deutschland/deutsche-auf-reisen-auch-im-ausland-begegnet-uns-die-ns-vergangenheit-kolumne-a-2d7132a9-c986-4c48-97d0-53c09b90d63d#ref=rss,www.spiegel.de,Deutsche auf Reisen: Auch im Ausland begegnet uns die NS-Vergangenheit - Kolumne - DER SPIEGEL,0.1,LOW,False,,,mainstream,2026-07-11T19:06:39.550683
"Zum Login SPIEGEL plus Nur für Neukunden € 1,– für 4 Wochen danach € 5,99 pro Woche Freier Zugriff auf alle S+-Artikel auf SPIEGEL",https://www.spiegel.de/politik/deutschland/deutsche-auf-reisen-auch-im-ausland-begegnet-uns-die-ns-vergangenheit-kolumne-a-2d7132a9-c986-4c48-97d0-53c09b90d63d#ref=rss,www.spiegel.de,Deutsche auf Reisen: Auch im Ausland begegnet uns die NS-Vergangenheit - Kolumne - DER SPIEGEL,0.1,LOW,False,,,mainstream,2026-07-11T19:06:39.736339
"E-Paper (PDF), Digital-Archiv und S+-Newsletter Jederzeit kündigen Jetzt abonnieren SPIEGEL plus 52 Wochen 25 % sparen € 4,49 pro Woche für 52 Wochen danach € 5,99 pro Woche Freier Zugriff auf alle S+-Artikel auf SPIEGEL",https://www.spiegel.de/politik/deutschland/deutsche-auf-reisen-auch-im-ausland-begegnet-uns-die-ns-vergangenheit-kolumne-a-2d7132a9-c986-4c48-97d0-53c09b90d63d#ref=rss,www.spiegel.de,Deutsche auf Reisen: Auch im Ausland begegnet uns die NS-Vergangenheit - Kolumne - DER SPIEGEL,0.1,LOW,False,,,mainstream,2026-07-11T19:06:39.924678
This week the Arsenal winger said he would have loved to have arrived at the tournament 100% fit but that he had been managed &quot;in the best way possible&quot; and was feeling &quot;great and ready to go&quot;,https://www.bbc.co.uk/sport/football/articles/c7vyp994jjgo?at_medium=RSS&amp;at_campaign=rss,www.bbc.co.uk,World Cup 2026: England team news - Stones set to start against Norway - BBC Sport,0.1,LOW,False,,,mainstream,2026-07-11T19:06:40.422881
"At kick-off time, the risk of storms in the area stands at about 20-30%, Taylor added",https://www.bbc.co.uk/news/articles/cm204lgrv10o?at_medium=RSS&amp;at_campaign=rss,www.bbc.co.uk,World Cup: England fans can stay in pub for full Norway game - even if kick-off delayed - BBC News,0,LOW,False,,,mainstream,2026-07-11T19:06:41.288373
