claim,source_url,source_domain,article_title,risk_score,risk_category,has_factcheck,factcheck_rating,factcheck_source,source_type,checked_at
"E-Paper (PDF), Digital-Archiv und S+-Newsletter Jederzeit kündigen Jetzt abonnieren SPIEGEL plus 52 Wochen 25 % sparen € 4,49 pro Woche für 52 Wochen danach € 5,99 pro Woche Freier Zugriff auf alle S+-Artikel auf SPIEGEL",https://www.spiegel.de/mobilitaet/flughafen-frankfurt-warum-am-neuen-terminal-3-schon-wieder-alles-aufs-auto-ausgerichtet-ist-a-7387700d-d0c6-4a76-a4b7-0279c6294333#ref=rss,www.spiegel.de,Flughafen Frankfurt: Warum am neuen Terminal 3 schon wieder alles aufs Auto ausgerichtet ist - DER S,0.1,LOW,False,,,mainstream,2026-04-22T19:18:41.148707
"Using data from the first half of 2024, the report found that an estimated total of 377 strip searches took place in the whole of that year - down 56% on 854 searches recorded in 2020",https://www.bbc.com/news/articles/cn8de0dg5j9o?at_medium=RSS&amp;at_campaign=rss,www.bbc.com,Black children eight times more likely to be strip searched by police - report,0,LOW,False,,,mainstream,2026-04-22T19:18:42.345039
"&quot;Although only 6% of the population of 10-17 year olds in the 2021 census were black, 35% of the children strip searched were of black ethnicity,&quot; it said",https://www.bbc.com/news/articles/cn8de0dg5j9o?at_medium=RSS&amp;at_campaign=rss,www.bbc.com,Black children eight times more likely to be strip searched by police - report,0,LOW,False,,,mainstream,2026-04-22T19:18:42.458866
"German airline Lufthansa will cut 20,000 European short-haul flights over the summer, saying soaring fuel prices have made many journeys &quot;unprofitable&quot; for the firm",https://www.bbc.com/news/articles/cre1r4n5j5wo?at_medium=RSS&amp;at_campaign=rss,www.bbc.com,"Lufthansa cuts 20,000 summer flights as fuel prices surge",0,LOW,False,,,mainstream,2026-04-22T19:18:42.627745
"Airlines cut flights and hike fares as fuel prices surgeThe Gulf is a major source of aviation fuel, accounting for about 50% of Europe&#x27;s imports",https://www.bbc.com/news/articles/cre1r4n5j5wo?at_medium=RSS&amp;at_campaign=rss,www.bbc.com,"Lufthansa cuts 20,000 summer flights as fuel prices surge",0,LOW,False,,,mainstream,2026-04-22T19:18:42.732810
Plahotniuc was found guilty of partaking in the 2014-15 fraud which involved $1bn (£748m) - at the time 12% of Moldova&#x27;s total GDP,https://www.bbc.com/news/articles/cwykz04e4ndo?at_medium=RSS&amp;at_campaign=rss,www.bbc.com,Moldovan oligarch jailed in $1bn &#x27;theft of the century&#x27; fraud case,0,LOW,False,,,mainstream,2026-04-22T19:18:42.940889
"A beer &quot;serving&quot; might meet around 15% of your daily B6 requirement, the authors say, and even alcohol-free lager could have the same effect",https://www.bbc.com/news/articles/cvglqw709k1o?at_medium=RSS&amp;at_campaign=rss,www.bbc.com,Your pint could come with a surprising health benefit,0,LOW,False,,,mainstream,2026-04-22T19:18:43.213681
