claim,source_url,source_domain,article_title,risk_score,risk_category,has_factcheck,factcheck_rating,factcheck_source,source_type,checked_at
"Yet, Trump has repeatedly boasted that “factory construction” is up 41%",https://www.factcheck.org/2026/02/manufacturing-construction-spending-declines-under-trump/,www.factcheck.org,Manufacturing Construction Spending Declines Under Trump - FactCheck.org,0,LOW,False,,,factcheck,2026-02-28T18:37:50.466268
Trump cited the 41% statistic in a White House press conference on Jan,https://www.factcheck.org/2026/02/manufacturing-construction-spending-declines-under-trump/,www.factcheck.org,Manufacturing Construction Spending Declines Under Trump - FactCheck.org,0,LOW,False,,,factcheck,2026-02-28T18:37:50.679739
”&nbsp; “Investment in American factories is up 41%,https://www.factcheck.org/2026/02/manufacturing-construction-spending-declines-under-trump/,www.factcheck.org,Manufacturing Construction Spending Declines Under Trump - FactCheck.org,0,LOW,False,,,factcheck,2026-02-28T18:37:50.891868
[DEBUNKED] Fact Check: Video Does NOT Show U.S. Fighter Jets Involved In Real Dogfight Over Iran -- It's Game Video | Lead Stories,https://leadstories.com/hoax-alert/2026/02/fact-check-video-does-not-show-us-fighter-jets-involved-in-a-real-dogfight-over-iran.html,leadstories.com,Fact Check: Video Does NOT Show U.S. Fighter Jets Involved In Real Dogfight Over Iran -- It's Game V,0.9,HIGH,True,FALSE - Debunked by fact-checkers,leadstories.com,factcheck,2026-02-28T18:37:51.149763
[DEBUNKED] Fact Check: Video Does NOT Show Fire At Tel Aviv Munitions Storage Building During Iran Attack on Israel In 2026 -- It's A 2024 Apartment Fire | Lead Stories,https://leadstories.com/hoax-alert/2026/02/fact-check-video-does-not-show-tel-aviv-munitions-strage-fire-in-2026o.html,leadstories.com,Fact Check: Video Does NOT Show Fire At Tel Aviv Munitions Storage Building During Iran Attack on Is,0.9,HIGH,True,FALSE - Debunked by fact-checkers,leadstories.com,factcheck,2026-02-28T18:37:51.338603
[DEBUNKED] Fact Check: Iranian Leader Khamenei's Name IS Mentioned In The Epstein Files -- 196 Results In Search | Lead Stories,https://leadstories.com/hoax-alert/2026/02/fact-check-khamenei-epstein-files.html,leadstories.com,Fact Check: Iranian Leader Khamenei's Name IS Mentioned In The Epstein Files -- 196 Results In Searc,0.9,HIGH,True,FALSE - Debunked by fact-checkers,leadstories.com,factcheck,2026-02-28T18:37:51.512693
[DEBUNKED] Fact Check: NO Official Reports John Bolton Has Died In Wake Of Iran Strikes Late February 2026 -- Confirmed Alive | Lead Stories,https://leadstories.com/hoax-alert/2026/02/fact-check-john-bolton-dead-rip-iran-february-2026.html,leadstories.com,Fact Check: NO Official Reports John Bolton Has Died In Wake Of Iran Strikes Late February 2026 -- C,0.9,HIGH,True,FALSE - Debunked by fact-checkers,leadstories.com,factcheck,2026-02-28T18:37:51.697487
[DEBUNKED] Fact Check: Photo EDITED To Look Like Maxwell Was Touching Melania's Breast While Posing With Trump At A Costume Party | Lead Stories,https://leadstories.com/hoax-alert/2026/02/fact-check-edited-photo-shows-ghislain-maxwell-touching-melania-trump-breast.html,leadstories.com,Fact Check: Photo EDITED To Look Like Maxwell Was Touching Melania's Breast While Posing With Trump ,0.9,HIGH,True,FALSE - Debunked by fact-checkers,leadstories.com,factcheck,2026-02-28T18:37:51.886309
"[DEBUNKED] Fact Check: Fake ""Epstein File Secret Report 77/5000"" Is AI-Generated Video -- Salacious Clickbait | Lead Stories",https://leadstories.com/hoax-alert/2026/02/fact-check-fake-epstein-file-secret-report-775000-ai-generated-video.html,leadstories.com,"Fact Check: Fake ""Epstein File Secret Report 77/5000"" Is AI-Generated Video -- Salacious Clickbait |",0.9,HIGH,True,FALSE - Debunked by fact-checkers,leadstories.com,factcheck,2026-02-28T18:37:52.057767
[DEBUNKED] Fact Check: Video Posted By White House Of USA Men's Hockey Player Brady Tkachuk Calling Canada 'Maple Syrup Eating F***s' Is NOT Real -- AI-Generated | Lead Stories,https://leadstories.com/hoax-alert/2026/02/fact-check-ai-video-white-house-usa-men-hockey-tkachuk-insult-canada-maple-syrup-ai-generated.html,leadstories.com,Fact Check: Video Posted By White House Of USA Men's Hockey Player Brady Tkachuk Calling Canada 'Map,0.9,HIGH,True,FALSE - Debunked by fact-checkers,leadstories.com,factcheck,2026-02-28T18:37:52.245589
[DEBUNKED] Fact Check: Photo Does NOT Show Hillary Clinton Posing With Jeffrey Epstein And Ghislaine Maxwell -- It's Jimmy Buffett's Wife | Lead Stories,https://leadstories.com/hoax-alert/2026/02/fact-check-photo-does-not-show-hillary-clinton-posing-with-jeffrey-epstein-and-ghislaine-maxwell.html,leadstories.com,Fact Check: Photo Does NOT Show Hillary Clinton Posing With Jeffrey Epstein And Ghislaine Maxwell --,0.9,HIGH,True,FALSE - Debunked by fact-checkers,leadstories.com,factcheck,2026-02-28T18:37:52.436404
[DEBUNKED] Fact Check: Authentic Video Does NOT Show Hilary Knight Saying She Was 'Mortified' For The US Men's Hockey Team | Lead Stories,https://leadstories.com/hoax-alert/2026/02/fact-check-authentic-video-does-not-show-hilary-knight-saying-she-was-mortified-for-the-us-mens-hockey-team.html,leadstories.com,Fact Check: Authentic Video Does NOT Show Hilary Knight Saying She Was 'Mortified' For The US Men's ,0.9,HIGH,True,FALSE - Debunked by fact-checkers,leadstories.com,factcheck,2026-02-28T18:37:52.612560
[DEBUNKED] Fact Check: Waffle House Did NOT Announce Plans for Floating Restaurants On Lakes In Southeastern U.S. -- It's A Joke | Lead Stories,https://leadstories.com/hoax-alert/2026/02/fact-check-waffle-house-did-not-announce-plans-for-floating-restaurants-on-lakes.html,leadstories.com,Fact Check: Waffle House Did NOT Announce Plans for Floating Restaurants On Lakes In Southeastern U.,0.9,HIGH,True,FALSE - Debunked by fact-checkers,leadstories.com,factcheck,2026-02-28T18:37:52.795413
[DEBUNKED] Fact Check: AI-Generated Video Is FAKE Emotional Courtroom Story About A Boy Who Worked Illegally To Care For His Sister | Lead Stories,https://leadstories.com/hoax-alert/2026/02/fact-check-ai-generated-video-courtroom-sory-about-boy-who-worked-illegally-to-care-for-sister.html,leadstories.com,Fact Check: AI-Generated Video Is FAKE Emotional Courtroom Story About A Boy Who Worked Illegally To,0.9,HIGH,True,FALSE - Debunked by fact-checkers,leadstories.com,factcheck,2026-02-28T18:37:52.978421
[DEBUNKED] Fact Check: FAKE Image Showed Canada's Mark Carney Dining With Ghislaine Maxwell | Lead Stories,https://leadstories.com/hoax-alert/2026/02/fact-check-fake-image-showed-canadas-mark-carney-dining-with-ghislaine-maxwell.html,leadstories.com,Fact Check: FAKE Image Showed Canada's Mark Carney Dining With Ghislaine Maxwell | Lead Stories,0.9,HIGH,True,FALSE - Debunked by fact-checkers,leadstories.com,factcheck,2026-02-28T18:37:53.159057
[DEBUNKED] Fact Check: Tampa International Airport Did NOT Ban Pajamas -- The Tweet Is A Joke | Lead Stories,https://leadstories.com/hoax-alert/2026/02/fact-check-tampa-airport-did-not-ban-pajamas.html,leadstories.com,Fact Check: Tampa International Airport Did NOT Ban Pajamas -- The Tweet Is A Joke | Lead Stories,0.9,HIGH,True,FALSE - Debunked by fact-checkers,leadstories.com,factcheck,2026-02-28T18:37:53.339917
"[DEBUNKED] Fact Check: Rubio, Kennedy, Jordan, Denzel, Others Did NOT Invoke 'Born In America' Bill Blocking Naturalized Americans From Office | Lead Stories",https://leadstories.com/hoax-alert/2026/02/fact-check-there-is-no-born-in-america-act.html,leadstories.com,"Fact Check: Rubio, Kennedy, Jordan, Denzel, Others Did NOT Invoke 'Born In America' Bill Blocking Na",0.9,HIGH,True,FALSE - Debunked by fact-checkers,leadstories.com,factcheck,2026-02-28T18:37:53.533350
[DEBUNKED] Fact Check: Devarjaye 'DJ' Daniel Did NOT Die In February 2026 | Lead Stories,https://leadstories.com/hoax-alert/2026/02/fact-check-devarjaye-dj-daniel-did-not-die-in-february-2026.html,leadstories.com,Fact Check: Devarjaye 'DJ' Daniel Did NOT Die In February 2026 | Lead Stories,0.9,HIGH,True,FALSE - Debunked by fact-checkers,leadstories.com,factcheck,2026-02-28T18:37:53.725155
"Trump reinstated a global 15% tariff after the decision, using other laws",https://www.poynter.org/fact-checking/2026/do-trump-tariffs-cost-families-1700-dollars/,www.poynter.org,"Trump says tariffs help America. Estimates suggest they cost families about $1,700. - Poynter",0,LOW,False,,,factcheck,2026-02-28T18:37:54.717306
"Other tariffs, which are temporary and up to 15% on imported goods, could also add",https://www.poynter.org/fact-checking/2026/do-trump-tariffs-cost-families-1700-dollars/,www.poynter.org,"Trump says tariffs help America. Estimates suggest they cost families about $1,700. - Poynter",0,LOW,False,,,factcheck,2026-02-28T18:37:54.931118
"[DEBUNKED] How did the media react to Trump’s long, long speech? - Poynter",https://www.poynter.org/commentary/2026/reaction-donald-trump-state-union-address/,www.poynter.org,"How did the media react to Trump’s long, long speech? - Poynter",0.9,HIGH,True,FALSE - Debunked by fact-checkers,www.poynter.org,factcheck,2026-02-28T18:37:55.096353
"That’s lower than the year-over-year rate when he took office in January 2025, but it had already fallen from a peak of roughly 9% in the summer",https://www.poynter.org/fact-checking/2026/trump-state-of-the-union-fact-check/,www.poynter.org,"A fact check of Trump’s State of the Union finds exaggerations on inflation, gas prices and immigrat",0.1,LOW,False,,,factcheck,2026-02-28T18:37:55.474614
"Israels Generalstabschef Eyal Zamir hat derweil erklärt, dass die Luftstreitkräfte am Samstag den größten Angriff ihrer Geschichte geflogen seien – und immer noch dabei sind",https://www.spiegel.de/ausland/iran-krieg-benjamin-netanyahu-telefoniert-mit-donald-trump-und-postet-ein-foto-ueber-den-krieg-gegen-hitler-a-4d1b8934-c54d-4599-ad8e-45bee281d4c5#ref=rss,www.spiegel.de,Iran-Krieg: Benjamin Netanyahu telefoniert mit Donald Trump und postet ein Foto über den Krieg gegen,0.1,LOW,False,,,mainstream,2026-02-28T18:38:10.141792
"Statt seiner Verantwortung nachzukommen, das eigene Volk zu schützen, hat die iranische Führung alle Aufforderungen, diese Gewalt einzustellen, in den Wind geschlagen",https://www.spiegel.de/politik/iran-friedrich-merz-kritisiert-iranische-fuehrung-scharf-a-2308ea33-ecfd-49af-8c28-48ec4778bf7f#ref=rss,www.spiegel.de,Iran: Friedrich Merz kritisiert iranische Führung scharf - DER SPIEGEL,0.1,LOW,False,,,mainstream,2026-02-28T18:38:11.340707
"Zum Login SPIEGEL plus Nur für Neukunden € 1,– für 4 Wochen danach € 5,99 pro Woche Freier Zugriff auf alle S+-Artikel auf SPIEGEL",https://www.spiegel.de/politik/deutschland/iran-usa-konflikt-friedrich-merz-verurteilt-iran-bleibt-zu-us-politik-stumm-a-3e3acf49-8807-40eb-8755-670ab1fe90fd#ref=rss,www.spiegel.de,"Iran-USA-Konflikt: Friedrich Merz verurteilt Iran, bleibt zu US-Politik stumm - DER SPIEGEL",0.1,LOW,False,,,mainstream,2026-02-28T18:38:13.101771
"E-Paper (PDF), Digital-Archiv und S+-Newsletter Jederzeit kündigen Jetzt abonnieren SPIEGEL plus 52 Wochen 25 % sparen € 4,49 pro Woche für 52 Wochen danach € 5,99 pro Woche Freier Zugriff auf alle S+-Artikel auf SPIEGEL",https://www.spiegel.de/politik/deutschland/iran-usa-konflikt-friedrich-merz-verurteilt-iran-bleibt-zu-us-politik-stumm-a-3e3acf49-8807-40eb-8755-670ab1fe90fd#ref=rss,www.spiegel.de,"Iran-USA-Konflikt: Friedrich Merz verurteilt Iran, bleibt zu US-Politik stumm - DER SPIEGEL",0.1,LOW,False,,,mainstream,2026-02-28T18:38:13.200016
"Am Anfang habe es noch wenige Tiere gegeben, schließlich immer mehr",https://www.spiegel.de/wissenschaft/natur/erholt-sich-die-population-singen-die-aelteren-wal-maennchen-a-a66f33bf-441b-419b-b33e-1ad70bb17497#ref=rss,www.spiegel.de,"Erholt sich die Population, singen die älteren Wal-Männchen - DER SPIEGEL",0.1,LOW,False,,,mainstream,2026-02-28T18:38:14.462955
"Klicken Sie dafür einfach auf den Link zu Ihrer Lieblings-App:Spotify&nbsp; Apple Podcasts&nbsp;Amazon Music&nbsp;Castbox&nbsp;Overcast&nbsp;Deezer&nbsp;Und abonnieren Sie dann den Podcast, um keine Fol",https://www.spiegel.de/ausland/mexiko-sicherheitskraefte-toeten-chef-des-groessten-kartells-in-spektakulaerer-aktion-a-7ccbf17d-410d-4fa5-b830-8b13584cdc65#ref=rss,www.spiegel.de,Mexiko: Sicherheitskräfte töten Chef des größten Kartells in spektakulärer Aktion - DER SPIEGEL,0.1,LOW,False,,,mainstream,2026-02-28T18:38:15.826070
"Zum Login SPIEGEL plus Nur für Neukunden € 1,– für 4 Wochen danach € 5,99 pro Woche Freier Zugriff auf alle S+-Artikel auf SPIEGEL",https://www.spiegel.de/wissenschaft/oranienburg-wie-ein-pflegeheim-es-schafft-gesundes-essen-anzubieten-a-a83b1a19-10f3-47c3-bcc6-90235da2abd6#ref=rss,www.spiegel.de,"Oranienburg: Wie ein Pflegeheim es schafft, gesundes Essen anzubieten - DER SPIEGEL",0.1,LOW,False,,,mainstream,2026-02-28T18:38:17.809126
"E-Paper (PDF), Digital-Archiv und S+-Newsletter Jederzeit kündigen Jetzt abonnieren SPIEGEL plus 52 Wochen 25 % sparen € 4,49 pro Woche für 52 Wochen danach € 5,99 pro Woche Freier Zugriff auf alle S+-Artikel auf SPIEGEL",https://www.spiegel.de/wissenschaft/oranienburg-wie-ein-pflegeheim-es-schafft-gesundes-essen-anzubieten-a-a83b1a19-10f3-47c3-bcc6-90235da2abd6#ref=rss,www.spiegel.de,"Oranienburg: Wie ein Pflegeheim es schafft, gesundes Essen anzubieten - DER SPIEGEL",0.1,LOW,False,,,mainstream,2026-02-28T18:38:18.024680
"Zum Login SPIEGEL plus Nur für Neukunden € 1,– für 4 Wochen danach € 5,99 pro Woche Freier Zugriff auf alle S+-Artikel auf SPIEGEL",https://www.spiegel.de/ausland/iran-das-regime-in-teheran-ist-moerderisch-donald-trumps-krieg-ist-trotzdem-falsch-a-b88ec8b5-2922-459a-85c0-da2ee32092e8#ref=rss,www.spiegel.de,Iran: Das Regime in Teheran ist mörderisch. Donald Trumps Krieg ist trotzdem falsch - DER SPIEGEL,0.1,LOW,False,,,mainstream,2026-02-28T18:38:20.057770
"E-Paper (PDF), Digital-Archiv und S+-Newsletter Jederzeit kündigen Jetzt abonnieren SPIEGEL plus 52 Wochen 25 % sparen € 4,49 pro Woche für 52 Wochen danach € 5,99 pro Woche Freier Zugriff auf alle S+-Artikel auf SPIEGEL",https://www.spiegel.de/ausland/iran-das-regime-in-teheran-ist-moerderisch-donald-trumps-krieg-ist-trotzdem-falsch-a-b88ec8b5-2922-459a-85c0-da2ee32092e8#ref=rss,www.spiegel.de,Iran: Das Regime in Teheran ist mörderisch. Donald Trumps Krieg ist trotzdem falsch - DER SPIEGEL,0.1,LOW,False,,,mainstream,2026-02-28T18:38:20.273996
"passive=""updateTranslateY""> image""> Absurde Baukosten, hohe Mieten Solvent, zuverlässig – warum Paulina und Jonas trotzdem keine Wohnung finden Gedrängel bei der Besichtigung, Bruchbuden zu Wucherpreisen, mickriges Angebot",https://www.spiegel.de/wirtschaft/soziales/immobilien-absurde-baukosten-hohe-mieten-warum-junge-menschen-kaum-eine-chance-haben-a-3385782c-295f-4e10-bfe8-c943e420b11a#ref=rss,www.spiegel.de,"Immobilien: Absurde Baukosten, hohe Mieten - warum junge Menschen kaum eine Chance haben - DER SPIEG",0.1,LOW,False,,,mainstream,2026-02-28T18:38:22.912712
"Zum Login SPIEGEL plus Nur für Neukunden € 1,– für 4 Wochen danach € 5,99 pro Woche Freier Zugriff auf alle S+-Artikel auf SPIEGEL",https://www.spiegel.de/wirtschaft/soziales/immobilien-absurde-baukosten-hohe-mieten-warum-junge-menschen-kaum-eine-chance-haben-a-3385782c-295f-4e10-bfe8-c943e420b11a#ref=rss,www.spiegel.de,"Immobilien: Absurde Baukosten, hohe Mieten - warum junge Menschen kaum eine Chance haben - DER SPIEG",0.1,LOW,False,,,mainstream,2026-02-28T18:38:23.121609
"E-Paper (PDF), Digital-Archiv und S+-Newsletter Jederzeit kündigen Jetzt abonnieren SPIEGEL plus 52 Wochen 25 % sparen € 4,49 pro Woche für 52 Wochen danach € 5,99 pro Woche Freier Zugriff auf alle S+-Artikel auf SPIEGEL",https://www.spiegel.de/wirtschaft/soziales/immobilien-absurde-baukosten-hohe-mieten-warum-junge-menschen-kaum-eine-chance-haben-a-3385782c-295f-4e10-bfe8-c943e420b11a#ref=rss,www.spiegel.de,"Immobilien: Absurde Baukosten, hohe Mieten - warum junge Menschen kaum eine Chance haben - DER SPIEG",0.1,LOW,False,,,mainstream,2026-02-28T18:38:23.332504
"Der operative Gewinn sei um 30 Prozent auf 10,2 Milliarden Dollar ​gefallen, teilte das Unternehmen ⁠am Samstag mit",https://www.spiegel.de/wirtschaft/berkshire-hathaway-wertberichtigungen-belasten-letztes-quartal-von-warren-buffett-als-ceo-a-8c51041b-2f9a-45b1-92f2-13557e5a77fd#ref=rss,www.spiegel.de,Berkshire Hathaway: Wertberichtigungen belasten letztes Quartal von Warren Buffett als CEO - DER SPI,0.1,LOW,False,,,mainstream,2026-02-28T18:38:25.346971
"Berkshire beendete das Jahr mit einer ‌Barreserve ​von ‌373,3 Milliarden Dollar",https://www.spiegel.de/wirtschaft/berkshire-hathaway-wertberichtigungen-belasten-letztes-quartal-von-warren-buffett-als-ceo-a-8c51041b-2f9a-45b1-92f2-13557e5a77fd#ref=rss,www.spiegel.de,Berkshire Hathaway: Wertberichtigungen belasten letztes Quartal von Warren Buffett als CEO - DER SPI,0,LOW,False,,,mainstream,2026-02-28T18:38:25.566662
Buffett selbst steht mit einem geschätzten Vermögen von 146 Milliarden Dollar auf Platz elf der Forbes-Liste der reichsten Menschen der Welt,https://www.spiegel.de/wirtschaft/berkshire-hathaway-wertberichtigungen-belasten-letztes-quartal-von-warren-buffett-als-ceo-a-8c51041b-2f9a-45b1-92f2-13557e5a77fd#ref=rss,www.spiegel.de,Berkshire Hathaway: Wertberichtigungen belasten letztes Quartal von Warren Buffett als CEO - DER SPI,0,LOW,False,,,mainstream,2026-02-28T18:38:25.776674
"Zum Login SPIEGEL plus Nur für Neukunden € 1,– für 4 Wochen danach € 5,99 pro Woche Freier Zugriff auf alle S+-Artikel auf SPIEGEL",https://www.spiegel.de/wirtschaft/iran-so-bewegt-der-angriff-die-preise-fuer-heizen-und-tanken-a-bccce5d1-9190-423c-ae7a-69ef0ed0f301#ref=rss,www.spiegel.de,Iran: So bewegt der Angriff die Preise für Heizen und Tanken - DER SPIEGEL,0.1,LOW,False,,,mainstream,2026-02-28T18:38:26.904852
"E-Paper (PDF), Digital-Archiv und S+-Newsletter Jederzeit kündigen Jetzt abonnieren SPIEGEL plus 52 Wochen 25 % sparen € 4,49 pro Woche für 52 Wochen danach € 5,99 pro Woche Freier Zugriff auf alle S+-Artikel auf SPIEGEL",https://www.spiegel.de/wirtschaft/iran-so-bewegt-der-angriff-die-preise-fuer-heizen-und-tanken-a-bccce5d1-9190-423c-ae7a-69ef0ed0f301#ref=rss,www.spiegel.de,Iran: So bewegt der Angriff die Preise für Heizen und Tanken - DER SPIEGEL,0.1,LOW,False,,,mainstream,2026-02-28T18:38:27.129478
"length - 1, 500, false)"" data-area=""nav-bar"" data-app-hidden x-lazyload> Menü Startseite Ausland Daten und Visualisierungen Iran-Krieg in Grafiken und Karten: Hier finden Sie alle wichtigen Daten $swiper",https://www.spiegel.de/ausland/iran-krieg-in-grafiken-und-karten-hier-finden-sie-alle-wichtigen-daten-a-8a4e9e9d-22d0-4e5d-80c7-6515b6632480#ref=rss,www.spiegel.de,Iran-Krieg in Grafiken und Karten: Hier finden Sie alle wichtigen Daten - DER SPIEGEL,0.1,LOW,False,,,mainstream,2026-02-28T18:38:29.177809
"Zum Login SPIEGEL plus Nur für Neukunden € 1,– für 4 Wochen danach € 5,99 pro Woche Freier Zugriff auf alle S+-Artikel auf SPIEGEL",https://www.spiegel.de/ausland/iran-krieg-in-grafiken-und-karten-hier-finden-sie-alle-wichtigen-daten-a-8a4e9e9d-22d0-4e5d-80c7-6515b6632480#ref=rss,www.spiegel.de,Iran-Krieg in Grafiken und Karten: Hier finden Sie alle wichtigen Daten - DER SPIEGEL,0.1,LOW,False,,,mainstream,2026-02-28T18:38:29.399359
"E-Paper (PDF), Digital-Archiv und S+-Newsletter Jederzeit kündigen Jetzt abonnieren SPIEGEL plus 52 Wochen 25 % sparen € 4,49 pro Woche für 52 Wochen danach € 5,99 pro Woche Freier Zugriff auf alle S+-Artikel auf SPIEGEL",https://www.spiegel.de/ausland/iran-krieg-in-grafiken-und-karten-hier-finden-sie-alle-wichtigen-daten-a-8a4e9e9d-22d0-4e5d-80c7-6515b6632480#ref=rss,www.spiegel.de,Iran-Krieg in Grafiken und Karten: Hier finden Sie alle wichtigen Daten - DER SPIEGEL,0.1,LOW,False,,,mainstream,2026-02-28T18:38:29.611740
"In a sign of the impact, F1&#x27;s own statistics show 43% of its overall fanbase is now aged under 35, up by 30% since 2018",https://www.bbc.com/news/articles/cp8rz13gdx0o?at_medium=RSS&amp;at_campaign=rss,www.bbc.com,How Netflix&#x27;s Drive to Survive triggered a new F1 celebrity age,0,LOW,False,,,mainstream,2026-02-28T18:38:30.960764
"YouGov research in 2023 said the latest Drive to Survive series had been watched by seven million people, with 18-29-year-olds making up 31% of the audience",https://www.bbc.com/news/articles/cp8rz13gdx0o?at_medium=RSS&amp;at_campaign=rss,www.bbc.com,How Netflix&#x27;s Drive to Survive triggered a new F1 celebrity age,0,LOW,False,,,mainstream,2026-02-28T18:38:31.174709
"Roughly 10% to 30% of people who have the condition also produce socially unacceptable words as tics, such as swearing, known as coprolalia",https://www.bbc.com/news/articles/cx24p8pmdryo?at_medium=RSS&amp;at_campaign=rss,www.bbc.com,Tourette&#x27;s: &#x27;I shouted at police that I had drugs in my bag&#x27;,0,LOW,False,,,mainstream,2026-02-28T18:38:31.459581
