claim,source_url,source_domain,article_title,risk_score,risk_category,has_factcheck,factcheck_rating,factcheck_source,source_type,checked_at
"[DEBUNKED] Lies about Russia’s military success, Yermak’s arrest and secret biolabs - EUvsDisinfo",https://euvsdisinfo.eu/lies-about-russias-military-success-yermaks-arrest-and-secret-biolabs/,euvsdisinfo.eu,"Lies about Russia’s military success, Yermak’s arrest and secret biolabs - EUvsDisinfo",0.9,HIGH,True,FALSE - Debunked by fact-checkers,euvsdisinfo.eu,factcheck,2026-06-22T11:58:26.103164
"[DEBUNKED] Victory Day propaganda, masking fear with intimidation, and abduction denial - EUvsDisinfo",https://euvsdisinfo.eu/victory-day-propaganda-masking-fear-with-intimidation-and-abduction-denial/,euvsdisinfo.eu,"Victory Day propaganda, masking fear with intimidation, and abduction denial - EUvsDisinfo",0.9,HIGH,True,FALSE - Debunked by fact-checkers,euvsdisinfo.eu,factcheck,2026-06-22T11:58:28.565867
"length - 1, 500, false)"" data-area=""nav-bar"" data-app-hidden x-lazyload> Menü Startseite Wirtschaft Arbeitsmarkt Gen Z verdient laut britischem Thinktank mit Mitte 20 mehr als Millennials in dem Alter $swiper",https://www.spiegel.de/wirtschaft/gen-z-verdient-laut-britischem-thinktank-mit-mitte-20-mehr-als-millennials-in-dem-alter-a-7ebc87e9-bdf0-4560-9240-2110e38cb79f#ref=rss,www.spiegel.de,Gen Z verdient laut britischem Thinktank mit Mitte 20 mehr als Millennials in dem Alter - DER SPIEGE,0,LOW,False,,,mainstream,2026-06-22T11:58:38.052056
Offenbar nicht: Laut Analyse der Denkfabrik »Resolution Foundation« ist die Karriere der Ende der Neunzigerjahre Geborenen besser angelaufen als die ihrer Vorgänger,https://www.spiegel.de/wirtschaft/gen-z-verdient-laut-britischem-thinktank-mit-mitte-20-mehr-als-millennials-in-dem-alter-a-7ebc87e9-bdf0-4560-9240-2110e38cb79f#ref=rss,www.spiegel.de,Gen Z verdient laut britischem Thinktank mit Mitte 20 mehr als Millennials in dem Alter - DER SPIEGE,0,LOW,False,,,mainstream,2026-06-22T11:58:38.141566
Und damit nicht genug: Die Gen Z verdiente laut der Denkfabrik sogar mehr als jede andere Altersgruppe seit den in den Fünfzigerjahren geborenen arbeitenden M,https://www.spiegel.de/wirtschaft/gen-z-verdient-laut-britischem-thinktank-mit-mitte-20-mehr-als-millennials-in-dem-alter-a-7ebc87e9-bdf0-4560-9240-2110e38cb79f#ref=rss,www.spiegel.de,Gen Z verdient laut britischem Thinktank mit Mitte 20 mehr als Millennials in dem Alter - DER SPIEGE,0,LOW,False,,,mainstream,2026-06-22T11:58:38.231762
"Oktober 1987, dem »Schwarzen Montag«, brachen die Börsenkurse weltweit um bis zu 20 Prozent ein",https://www.spiegel.de/wirtschaft/alan-greenspan-ist-tot-ehemaliger-chef-der-us-notenbank-im-alter-von-100-jahren-gestorben-a-f3cf1245-1203-47e3-b2c3-2f42b5c6f432#ref=rss,www.spiegel.de,Alan Greenspan ist tot: Ehemaliger Chef der US-Notenbank im Alter von 100 Jahren gestorben - DER SPI,0,LOW,False,,,mainstream,2026-06-22T11:58:38.898777
"Greenspan beruhigte die Märkte, indem er frisches Geld in das Finanzsystem pumpte – ein Mittel, das er von nun an immer wieder erfolgreich anwenden würde",https://www.spiegel.de/wirtschaft/alan-greenspan-ist-tot-ehemaliger-chef-der-us-notenbank-im-alter-von-100-jahren-gestorben-a-f3cf1245-1203-47e3-b2c3-2f42b5c6f432#ref=rss,www.spiegel.de,Alan Greenspan ist tot: Ehemaliger Chef der US-Notenbank im Alter von 100 Jahren gestorben - DER SPI,0.1,LOW,False,,,mainstream,2026-06-22T11:58:38.989772
"Was immer auch geschehen mochte, der Notenbank-Chef würde schon die passende Antwort haben",https://www.spiegel.de/wirtschaft/alan-greenspan-ist-tot-ehemaliger-chef-der-us-notenbank-im-alter-von-100-jahren-gestorben-a-f3cf1245-1203-47e3-b2c3-2f42b5c6f432#ref=rss,www.spiegel.de,Alan Greenspan ist tot: Ehemaliger Chef der US-Notenbank im Alter von 100 Jahren gestorben - DER SPI,0.1,LOW,False,,,mainstream,2026-06-22T11:58:39.080502
"Zum Login SPIEGEL plus Nur für Neukunden € 1,– für 4 Wochen danach € 5,99 pro Woche Freier Zugriff auf alle S+-Artikel auf SPIEGEL",https://www.spiegel.de/sport/fussball/wm-2026-news-heute-kap-verdes-wm-maerchen-geht-weiter-a-2f221d46-8478-4ec4-a830-c5ae9d5e4a9c#ref=rss,www.spiegel.de,WM 2026 News heute: Nico Schlotterbeck fällt für restliche WM aus - DER SPIEGEL,0.1,LOW,False,,,mainstream,2026-06-22T11:58:40.321048
"E-Paper (PDF), Digital-Archiv und S+-Newsletter Jederzeit kündigen Jetzt abonnieren SPIEGEL plus 52 Wochen 25 % sparen € 4,49 pro Woche für 52 Wochen danach € 5,99 pro Woche Freier Zugriff auf alle S+-Artikel auf SPIEGEL",https://www.spiegel.de/sport/fussball/wm-2026-news-heute-kap-verdes-wm-maerchen-geht-weiter-a-2f221d46-8478-4ec4-a830-c5ae9d5e4a9c#ref=rss,www.spiegel.de,WM 2026 News heute: Nico Schlotterbeck fällt für restliche WM aus - DER SPIEGEL,0.1,LOW,False,,,mainstream,2026-06-22T11:58:40.410502
"Zum Login SPIEGEL plus Nur für Neukunden € 1,– für 4 Wochen danach € 5,99 pro Woche Freier Zugriff auf alle S+-Artikel auf SPIEGEL",https://www.spiegel.de/ausland/klimawandel-in-ozeanien-tuvalu-wehrt-sich-gegen-den-untergang-a-bfb97017-59f8-4fe2-9489-9118c96c036e#ref=rss,www.spiegel.de,Klimawandel in Ozeanien: Tuvalu wehrt sich gegen den Untergang - DER SPIEGEL,0.1,LOW,False,,,mainstream,2026-06-22T11:58:41.097639
"»Leider kam von den Bikern auf all meine Bemühungen hin keine Reaktion«, heißt es in dem Statement",https://www.spiegel.de/panorama/justiz/heilbronn-drahtseile-ueber-illegalen-fahrradweg-gespannt-jaeger-wegen-versuchten-mordes-vor-gericht-a-714cc760-79fd-4d2d-be66-44aa6211c48c#ref=rss,www.spiegel.de,Heilbronn: Drahtseile über illegalen Fahrradweg gespannt – Jäger wegen versuchten Mordes vor Gericht,0.1,LOW,False,,,mainstream,2026-06-22T11:58:41.837589
Im Gegenteil: Der Trail sei immer intensiver genutzt worden,https://www.spiegel.de/panorama/justiz/heilbronn-drahtseile-ueber-illegalen-fahrradweg-gespannt-jaeger-wegen-versuchten-mordes-vor-gericht-a-714cc760-79fd-4d2d-be66-44aa6211c48c#ref=rss,www.spiegel.de,Heilbronn: Drahtseile über illegalen Fahrradweg gespannt – Jäger wegen versuchten Mordes vor Gericht,0.1,LOW,False,,,mainstream,2026-06-22T11:58:41.928169
"Am Sonntag, dem Internationalen Vatertag, der immer am dritten Sonntag im Juni gefeiert wird, postete die Schauspielerin einen entsprechenden Beitrag auf Instagram",https://www.spiegel.de/panorama/nicole-kidman-gratuliert-ex-mann-keith-urban-zum-internationalen-vatertag-a-08d80a82-10ed-4651-8046-7f9610192707#ref=rss,www.spiegel.de,Nicole Kidman: Hollywood-Star gratuliert Ex-Mann Keith Urban zum internationalen Vatertag - DER SPIE,0.1,LOW,False,,,mainstream,2026-06-22T11:58:43.250855
Laut Kidman hatten die beiden ein enges Verhältnis,https://www.spiegel.de/panorama/nicole-kidman-gratuliert-ex-mann-keith-urban-zum-internationalen-vatertag-a-08d80a82-10ed-4651-8046-7f9610192707#ref=rss,www.spiegel.de,Nicole Kidman: Hollywood-Star gratuliert Ex-Mann Keith Urban zum internationalen Vatertag - DER SPIE,0,LOW,False,,,mainstream,2026-06-22T11:58:43.341852
Alle rechtlichen Fragen zu Vermögen und Sorgerecht waren bereits am Tag ihres Antrags geklärt und unterschrieben,https://www.spiegel.de/panorama/nicole-kidman-gratuliert-ex-mann-keith-urban-zum-internationalen-vatertag-a-08d80a82-10ed-4651-8046-7f9610192707#ref=rss,www.spiegel.de,Nicole Kidman: Hollywood-Star gratuliert Ex-Mann Keith Urban zum internationalen Vatertag - DER SPIE,0.1,LOW,False,,,mainstream,2026-06-22T11:58:43.435539
"Zum Login SPIEGEL plus Nur für Neukunden € 1,– für 4 Wochen danach € 5,99 pro Woche Freier Zugriff auf alle S+-Artikel auf SPIEGEL",https://www.spiegel.de/mobilitaet/fahrrad/deutschland-ruecksichtslose-radfahrer-rote-ampel-mir-egal-a-cf6289c7-31e8-4faf-8955-2e5c3a68681b#ref=rss,www.spiegel.de,Deutschland - rücksichtslose Radfahrer: Rote Ampel? Mir egal! - DER SPIEGEL,0.1,LOW,False,,,mainstream,2026-06-22T11:58:44.126168
"E-Paper (PDF), Digital-Archiv und S+-Newsletter Jederzeit kündigen Jetzt abonnieren SPIEGEL plus 52 Wochen 25 % sparen € 4,49 pro Woche für 52 Wochen danach € 5,99 pro Woche Freier Zugriff auf alle S+-Artikel auf SPIEGEL",https://www.spiegel.de/mobilitaet/fahrrad/deutschland-ruecksichtslose-radfahrer-rote-ampel-mir-egal-a-cf6289c7-31e8-4faf-8955-2e5c3a68681b#ref=rss,www.spiegel.de,Deutschland - rücksichtslose Radfahrer: Rote Ampel? Mir egal! - DER SPIEGEL,0.1,LOW,False,,,mainstream,2026-06-22T11:58:44.217568
"»Dafür bitte ich um Entschuldigung, insbesondere bei denjenigen in der CDU, die immer wieder die Notwendigkeit einer klaren Brandmauer zur AfD betonen",https://www.spiegel.de/politik/deutschland/die-linke-luigi-pantisano-bittet-cdu-nach-faschismus-vergleich-um-entschuldigung-a-333b93fe-5031-4de2-aa29-88da247b23ee#ref=rss,www.spiegel.de,Die Linke: Luigi Pantisano entschuldigt sich bei CDU nach »Faschismus«-Vergleich - DER SPIEGEL,0.1,LOW,False,,,mainstream,2026-06-22T11:58:44.882495
"Er erhielt ein denkbar schlechtes Ergebnis, nur 53,3 Prozent der Delegierten wählten ihn ins Amt",https://www.spiegel.de/politik/deutschland/die-linke-luigi-pantisano-bittet-cdu-nach-faschismus-vergleich-um-entschuldigung-a-333b93fe-5031-4de2-aa29-88da247b23ee#ref=rss,www.spiegel.de,Die Linke: Luigi Pantisano entschuldigt sich bei CDU nach »Faschismus«-Vergleich - DER SPIEGEL,0,LOW,False,,,mainstream,2026-06-22T11:58:44.972346
"Am Mittwoch steigen die Temperaturen laut DWD im Norden auf 27 bis 34 Grad, sonst auf 32 bis 39 Grad",https://www.spiegel.de/panorama/wetter-in-deutschland-diese-woche-koennte-es-bis-zu-40-grad-heiss-werden-a-339dbd27-3f42-4f4c-b4a6-e7e5f2857a2c#ref=rss,www.spiegel.de,Wetter: Hitze-Welle in Deutschland - diese Woche könnte es bis zu 40 Grad heiß werden - DER SPIEGEL,0,LOW,False,,,mainstream,2026-06-22T11:58:45.744577
Begleitet wird die Hitze im Süden und Südosten laut Vorhersage auch von kräftigen örtlichen Schauern und Gewittern,https://www.spiegel.de/panorama/wetter-in-deutschland-diese-woche-koennte-es-bis-zu-40-grad-heiss-werden-a-339dbd27-3f42-4f4c-b4a6-e7e5f2857a2c#ref=rss,www.spiegel.de,Wetter: Hitze-Welle in Deutschland - diese Woche könnte es bis zu 40 Grad heiß werden - DER SPIEGEL,0,LOW,False,,,mainstream,2026-06-22T11:58:45.842078
«Nach Angaben des örtlichen Katastrophenschutzes war das Hotel zu rund 80 Prozent belegt,https://www.spiegel.de/panorama/dominikanische-republik-hunderte-fliehen-vor-feuer-in-luxushotel-in-bayahibe-a-99223ddd-73c8-4f78-bd0e-5ed6b5efeae2#ref=rss,www.spiegel.de,Dominikanische Republik: Hunderte fliehen vor Feuer in Luxushotel in Bayahibe - DER SPIEGEL,0,LOW,False,,,mainstream,2026-06-22T11:58:46.514181
"Zum Login SPIEGEL plus Nur für Neukunden € 1,– für 4 Wochen danach € 5,99 pro Woche Freier Zugriff auf alle S+-Artikel auf SPIEGEL",https://www.spiegel.de/panorama/justiz/magdeburg-was-der-prozess-gegen-den-todesfahrer-den-ueberlebenden-gebracht-hat-a-59c0ad02-08f6-4224-a1b0-5cc0b3855496#ref=rss,www.spiegel.de,Magdeburg: Was der Prozess gegen den Todesfahrer den Überlebenden gebracht hat - DER SPIEGEL,0.1,LOW,False,,,mainstream,2026-06-22T11:58:47.164046
"E-Paper (PDF), Digital-Archiv und S+-Newsletter Jederzeit kündigen Jetzt abonnieren SPIEGEL plus 52 Wochen 25 % sparen € 4,49 pro Woche für 52 Wochen danach € 5,99 pro Woche Freier Zugriff auf alle S+-Artikel auf SPIEGEL",https://www.spiegel.de/panorama/justiz/magdeburg-was-der-prozess-gegen-den-todesfahrer-den-ueberlebenden-gebracht-hat-a-59c0ad02-08f6-4224-a1b0-5cc0b3855496#ref=rss,www.spiegel.de,Magdeburg: Was der Prozess gegen den Todesfahrer den Überlebenden gebracht hat - DER SPIEGEL,0.1,LOW,False,,,mainstream,2026-06-22T11:58:47.262061
Laut Polizei rutschte der Mann auf dem Rückweg seiner Wanderung aus und stürzte knapp 50 Meter steil bergab,https://www.spiegel.de/panorama/oesterreich-59-jaehriger-deutscher-verunglueckt-bei-wanderung-toedlich-a-4a40bcc3-8af8-441e-a630-b69ca9896aa1#ref=rss,www.spiegel.de,Österreich: Deutscher verunglückt bei Wanderung in Vorarlberg tödlich - DER SPIEGEL,0,LOW,False,,,mainstream,2026-06-22T11:58:47.930287
Hinweise auf ein Fremdverschulden lagen nach Angaben der Polizei nicht vor,https://www.spiegel.de/panorama/oesterreich-59-jaehriger-deutscher-verunglueckt-bei-wanderung-toedlich-a-4a40bcc3-8af8-441e-a630-b69ca9896aa1#ref=rss,www.spiegel.de,Österreich: Deutscher verunglückt bei Wanderung in Vorarlberg tödlich - DER SPIEGEL,0,LOW,False,,,mainstream,2026-06-22T11:58:48.018840
The former Greater Manchester mayor increased Labour&#x27;s share of the vote from 45% at the 2024 general election to almost 55%,https://www.bbc.com/news/articles/cp8pml5z8p6o?at_medium=RSS&amp;at_campaign=rss,www.bbc.com,Who is Andy Burnham? Returning MP who wants to be prime minister,0,LOW,False,,,mainstream,2026-06-22T11:58:49.175724
"Under Castlelake&#x27;s latest offer, the airline&#x27;s shareholders would receive 625p per share, a 24% premium to last Friday&#x27;s closing price",https://www.bbc.com/news/articles/c30yz76834yo?at_medium=RSS&amp;at_campaign=rss,www.bbc.com,EasyJet rejects £4.7bn takeover offer from US investment firm Castlelake,0,LOW,False,,,mainstream,2026-06-22T11:58:50.130951
14% in EasyJet through the funds it manages - said its latest bid &quot;offers compelling value&quot; to the carrier&#x27;s shareholders,https://www.bbc.com/news/articles/c30yz76834yo?at_medium=RSS&amp;at_campaign=rss,www.bbc.com,EasyJet rejects £4.7bn takeover offer from US investment firm Castlelake,0,LOW,False,,,mainstream,2026-06-22T11:58:50.219076
