claim,source_url,source_domain,article_title,risk_score,risk_category,has_factcheck,factcheck_rating,factcheck_source,source_type,checked_at
[DEBUNKED] Iran-Krieg: Fake-Satellitenbild stellt Brände von Öl-Anlagen falsch dar,https://correctiv.org/faktencheck/2026/03/27/iran-krieg-fake-satellitenbild-stellt-braende-von-oel-anlagen-in-golfstaaten-falsch-dar/,correctiv.org,Iran-Krieg: Fake-Satellitenbild stellt Brände von Öl-Anlagen falsch dar,0.9,HIGH,True,FALSE - Debunked by fact-checkers,correctiv.org,factcheck,2026-03-29T07:06:58.162447
[DEBUNKED] Wahlbetrug in Baden-Württemberg? Video mit Chrupalla in falschen Kontext gesetzt,https://correctiv.org/faktencheck/2026/03/26/video-in-falschem-kontext-tino-chrupalla-hat-keinen-wahlbetrug-in-baden-wuerttemberg-aufgedeckt/,correctiv.org,Wahlbetrug in Baden-Württemberg? Video mit Chrupalla in falschen Kontext gesetzt,0.9,HIGH,True,FALSE - Debunked by fact-checkers,correctiv.org,factcheck,2026-03-29T07:06:59.952432
[DEBUNKED] Ausraster an Berliner Supermarktkasse ist KI-generiert - correctiv.org,https://correctiv.org/faktencheck/aus-der-community/2026/03/26/ausraster-an-berliner-supermarktkasse-ist-ki-generiert/,correctiv.org,Ausraster an Berliner Supermarktkasse ist KI-generiert - correctiv.org,0.9,HIGH,True,FALSE - Debunked by fact-checkers,correctiv.org,factcheck,2026-03-29T07:07:01.648551
"Laut dem Bundesamt für Verfassungsschutz, das bereits Anfang Februar auf die Attacke hingewiesen hatte, ohne jedoch Russland zu nennen, läuft die Phishing-Kampagne „seit mehreren Monaten und ist aktuell noch aktiv“",https://correctiv.org/hybride-kriegsfuehrung/2026/03/25/nach-correctiv-recherche-zu-phishing-attacke-innenpolitiker-sehen-defizite-im-umgang-mit-hybriden-bedrohungen-russlands/,correctiv.org,Politiker fordern nach Phishing-Angriff Schritte gegen hybride Bedrohung,0,LOW,False,,,factcheck,2026-03-29T07:07:02.654136
"(Symbolfoto: picture alliance/dpa | Ronny Hartmann) Rund 900 Millionen Euro will die Bundeswehr für Container ausgeben, in denen Soldatinnen und Soldatinnen zeitweise schlafen sollen",https://correctiv.org/aktuelles/sicherheit-und-verteidigung/2026/03/26/milliardenteure-uebergangsloesung-tausende-soldaten-sollen-in-containern-schlafen-bundeswehr-verteidigungsministerium/,correctiv.org,Bundeswehr: Tausende Soldaten sollen in Containern schlafen,0,LOW,False,,,factcheck,2026-03-29T07:07:03.505820
Das Containerprogramm mit dem Namen „SIPGO“ ist jedoch in sechs EU-weiten Ausschreibungen zu finden: Sie summieren sich auf das Gesamtvolumen von rund 900 Millionen Euro,https://correctiv.org/aktuelles/sicherheit-und-verteidigung/2026/03/26/milliardenteure-uebergangsloesung-tausende-soldaten-sollen-in-containern-schlafen-bundeswehr-verteidigungsministerium/,correctiv.org,Bundeswehr: Tausende Soldaten sollen in Containern schlafen,0,LOW,False,,,factcheck,2026-03-29T07:07:03.567131
Diese haben einen Umfang von mindestens 400 Millionen Euro,https://correctiv.org/aktuelles/sicherheit-und-verteidigung/2026/03/26/milliardenteure-uebergangsloesung-tausende-soldaten-sollen-in-containern-schlafen-bundeswehr-verteidigungsministerium/,correctiv.org,Bundeswehr: Tausende Soldaten sollen in Containern schlafen,0,LOW,False,,,factcheck,2026-03-29T07:07:03.623626
90 12051 Berlin Fax: +49 (0) 30 – 555 780 2 20 Büro Berlin Singerstraße 109 10179 Berlin Buchladen Essen Akazienallee 10 45127 Essen Online-Shop Jugendredaktion Salon5 Alle Standorte CORRECTIV,https://correctiv.org/in-eigener-sache/2026/03/25/top-investigativjournalist-martin-murphy-verstaerkt-correctiv/,correctiv.org,Top-Investigativjournalist Martin Murphy verstärkt CORRECTIV - correctiv.org,0.1,LOW,False,,,factcheck,2026-03-29T07:07:05.415943
[DEBUNKED] EU-Strafen für US-Techfirmen sind nicht mit Steuern vergleichbar,https://correctiv.org/faktencheck/2026/03/24/warum-eu-strafgelder-fuer-us-techfirmen-nicht-mit-steuern-europaeischer-firmen-vergleichbar-sind/,correctiv.org,EU-Strafen für US-Techfirmen sind nicht mit Steuern vergleichbar,0.9,HIGH,True,FALSE - Debunked by fact-checkers,correctiv.org,factcheck,2026-03-29T07:07:06.308512
"Die Recherche zeigt erstmals in einer unabhängigen Untersuchung, dass die Spuren alle nach Russland weisen",https://correctiv.org/hybride-kriegsfuehrung/2026/03/24/hackerangriff-ueber-signal-neue-spuren-fuehren-nach-russland-cyber-phishing/,correctiv.org,Hackerangriff über Signal: Neue Spuren führen nach Russland - correctiv.org,0.1,LOW,False,,,factcheck,2026-03-29T07:07:07.288456
"Die globale und beispiellose Attacke, die laut FBI inzwischen tausende Accounts kompromittiert hat, könnte mit einem Programm durchgeführt worden sein, das für knapp 700 US-Dollar auf russischen Hackerbörsen gehandelt wurde",https://correctiv.org/hybride-kriegsfuehrung/2026/03/24/hackerangriff-ueber-signal-neue-spuren-fuehren-nach-russland-cyber-phishing/,correctiv.org,Hackerangriff über Signal: Neue Spuren führen nach Russland - correctiv.org,0,LOW,False,,,factcheck,2026-03-29T07:07:07.347511
[DEBUNKED] Warum die Berichte über angebliche Kürzungen bei CORRECTIV falsch sind - correctiv.org,https://correctiv.org/in-eigener-sache/2026/03/24/warum-die-berichte-ueber-angebliche-kuerzungen-bei-correctiv-falsch-sind/,correctiv.org,Warum die Berichte über angebliche Kürzungen bei CORRECTIV falsch sind - correctiv.org,0.9,HIGH,True,FALSE - Debunked by fact-checkers,correctiv.org,factcheck,2026-03-29T07:07:08.415145
[DEBUNKED] Falschbehauptung zu angeblichem Wahlbetrug in Baden-Württemberg,https://correctiv.org/faktencheck/2026/03/23/falsche-behauptungen-zu-angeblichem-wahlbetrug-in-baden-wuerttemberg/,correctiv.org,Falschbehauptung zu angeblichem Wahlbetrug in Baden-Württemberg,0.9,HIGH,True,FALSE - Debunked by fact-checkers,correctiv.org,factcheck,2026-03-29T07:07:09.215924
[DEBUNKED] Strom für drei Milliarden Euro „weggeworfen“? Reiches Äußerung ist irreführend,https://correctiv.org/faktencheck/2026/03/23/katherina-reiche-strom-fuer-drei-milliarden-euro-weggeworfen-ist-irrefuehrend/,correctiv.org,Strom für drei Milliarden Euro „weggeworfen“? Reiches Äußerung ist irreführend,0.9,HIGH,True,FALSE - Debunked by fact-checkers,correctiv.org,factcheck,2026-03-29T07:07:10.122878
[DEBUNKED] Epsteins Verbindungen nach Russland: Der Fall Lana Poschidajewa,https://correctiv.org/aktuelles/russland-ukraine-2/2026/03/21/jeffrey-epstein-und-der-russische-geheimdienst-die-unerzaehlte-geschichte-der-lana-poschidajewa/,correctiv.org,Epsteins Verbindungen nach Russland: Der Fall Lana Poschidajewa,0.9,HIGH,True,FALSE - Debunked by fact-checkers,correctiv.org,factcheck,2026-03-29T07:07:10.951566
[DEBUNKED] Die 15 witzigsten &quot;Heimatstrom&quot;-Memes – und wie sie Rechte entlarven - Volksverpetzer,https://www.volksverpetzer.de/aktuelles/witzigsten-heimatstrom-memes/,www.volksverpetzer.de,Die 15 witzigsten &quot;Heimatstrom&quot;-Memes – und wie sie Rechte entlarven - Volksverpetzer,0.9,HIGH,True,FALSE - Debunked by fact-checkers,www.volksverpetzer.de,factcheck,2026-03-29T07:07:23.683865
"Das trifft viele Brauereien hart, weil sie immer wieder in neue Flaschen investieren müssen",https://www.volksverpetzer.de/aktuelles/afd-bayern-bier-teurer/,www.volksverpetzer.de,Die AfD Bayern will dein Bier teurer machen! - Volksverpetzer,0.1,LOW,False,,,factcheck,2026-03-29T07:07:26.300271
[DEBUNKED] Wie du von Rechten bei Gewalt gegen Frauen belogen wirst - Volksverpetzer,https://www.volksverpetzer.de/analyse/merz-gewalt-gegen-frauen/,www.volksverpetzer.de,Wie du von Rechten bei Gewalt gegen Frauen belogen wirst - Volksverpetzer,0.9,HIGH,True,FALSE - Debunked by fact-checkers,www.volksverpetzer.de,factcheck,2026-03-29T07:07:27.319994
"Die vielen „Einzelfälle“ der inszenierten ""Angriffe"" auf die AfD Erst vor zwei Wochen stellte sich heraus, dass ein „linksextremer Angriff“, der von der AfD in Rosenheim so angezeigt und den Medien so berichtet worden war, gar nie gab",https://www.volksverpetzer.de/aktuelles/afd-auto-angezuendet-fake/,www.volksverpetzer.de,AfD-Mitglied hat Auto selbst angezündet – Nächster Fake-„Antifa-Anschlag“ aufgeflogen! - Volksverpet,0.1,LOW,False,,,factcheck,2026-03-29T07:07:49.992688
"Wie viele Fälle von „linker Gewalt“ gibt es noch, die nie welche waren",https://www.volksverpetzer.de/aktuelles/afd-auto-angezuendet-fake/,www.volksverpetzer.de,AfD-Mitglied hat Auto selbst angezündet – Nächster Fake-„Antifa-Anschlag“ aufgeflogen! - Volksverpet,0.1,LOW,False,,,factcheck,2026-03-29T07:07:50.050335
"Es gab keine Hinweise auf eine Injektion, keine auf einen Anschlag",https://www.volksverpetzer.de/aktuelles/afd-auto-angezuendet-fake/,www.volksverpetzer.de,AfD-Mitglied hat Auto selbst angezündet – Nächster Fake-„Antifa-Anschlag“ aufgeflogen! - Volksverpet,0.1,LOW,False,,,factcheck,2026-03-29T07:07:50.112906
"Während SPD und CDU um den ersten Platz kämpfen, liegt die rechtsextreme AfD in Umfragen seit Monaten stabil auf Platz drei, aktuell mit 19 Prozent",https://www.volksverpetzer.de/analyse/rheinland-pfalz-rechte-landnahme/,www.volksverpetzer.de,Rheinland-Pfalz: Sie wollten das Dorf übernehmen – dann passierte DAS! - Volksverpetzer,0,LOW,False,,,factcheck,2026-03-29T07:07:51.394706
"Bei der letzten Landtagswahl war sie noch bei 8,3 Prozent gelandet",https://www.volksverpetzer.de/analyse/rheinland-pfalz-rechte-landnahme/,www.volksverpetzer.de,Rheinland-Pfalz: Sie wollten das Dorf übernehmen – dann passierte DAS! - Volksverpetzer,0,LOW,False,,,factcheck,2026-03-29T07:07:51.456519
[DEBUNKED] Nur 1000: Rechter KI-Fake über Teilnehmerzahl bei Naidoo-Demo - Volksverpetzer,https://www.volksverpetzer.de/faktencheck/ki-fake-teilnehmer-naidoo-demo/,www.volksverpetzer.de,Nur 1000: Rechter KI-Fake über Teilnehmerzahl bei Naidoo-Demo - Volksverpetzer,0.9,HIGH,True,FALSE - Debunked by fact-checkers,www.volksverpetzer.de,factcheck,2026-03-29T07:07:53.838443
""" kommt, wenn sie in einem Wahlkreis knapp mit 25 % auf Platz 1 liegt*, warum werden ihre Niederlagen verschwiegen",https://www.volksverpetzer.de/analyse/kommunalwahl-ergebnis-ioffenbach-halbiert/,www.volksverpetzer.de,Warum titelt niemand: &quot;AfD-Ergebnis in Offenbach HALBIERT&quot;? - Volksverpetzer,0.1,LOW,False,,,factcheck,2026-03-29T07:07:54.981582
"Wenn sie in Büdingen aber mit 25,36 Prozent der Stimmen knapp Platz 1 belegt, titeln die Medien ""Erdrutsch"" und ""AfD-Sieg""",https://www.volksverpetzer.de/analyse/kommunalwahl-ergebnis-ioffenbach-halbiert/,www.volksverpetzer.de,Warum titelt niemand: &quot;AfD-Ergebnis in Offenbach HALBIERT&quot;? - Volksverpetzer,0,LOW,False,,,factcheck,2026-03-29T07:07:55.037065
Der rechte Flopp in Offenbach bekommt gar keine Aufmerksamkeit,https://www.volksverpetzer.de/analyse/kommunalwahl-ergebnis-ioffenbach-halbiert/,www.volksverpetzer.de,Warum titelt niemand: &quot;AfD-Ergebnis in Offenbach HALBIERT&quot;? - Volksverpetzer,0.1,LOW,False,,,factcheck,2026-03-29T07:07:55.114942
"Im Intranet-Beitrag stand laut t-online allerdings bereits in der Überschrift, dass die neue Kantinenpächterin einlädt",https://www.volksverpetzer.de/faktencheck/ramadan-buffet-nius-blamiert/,www.volksverpetzer.de,Ramadan-Luxusbuffet erfunden: NIUS blamiert sich wieder mit Fake-Story! - Volksverpetzer,0.1,LOW,False,,,factcheck,2026-03-29T07:08:05.267679
"Es war aber keine ""Ramadanfeier"" – und auch Getränke wurden vorher schon ausgeteilt",https://www.volksverpetzer.de/faktencheck/ramadan-buffet-nius-blamiert/,www.volksverpetzer.de,Ramadan-Luxusbuffet erfunden: NIUS blamiert sich wieder mit Fake-Story! - Volksverpetzer,0.1,LOW,False,,,factcheck,2026-03-29T07:08:05.325765
"&nbsp; Hier kombiniert man clever alle rechten Feindbilder&nbsp;– Bürgergeldempfänger, Muslime und Steuergelder",https://www.volksverpetzer.de/faktencheck/ramadan-buffet-nius-blamiert/,www.volksverpetzer.de,Ramadan-Luxusbuffet erfunden: NIUS blamiert sich wieder mit Fake-Story! - Volksverpetzer,0.1,LOW,False,,,factcheck,2026-03-29T07:08:05.385253
"[DEBUNKED] Did Ted Lieu claim Epstein paid Pam Bondi's college, law school tuition? | Snopes.com",https://www.snopes.com/fact-check/ted-lieu-pam-bondis-tuition-epstein/,www.snopes.com,"Did Ted Lieu claim Epstein paid Pam Bondi's college, law school tuition? | Snopes.com",0.9,HIGH,True,FALSE - Debunked by fact-checkers,www.snopes.com,factcheck,2026-03-29T07:08:05.472495
[DEBUNKED] Did US Army raise maximum enlistment age to 42? Here's the full story | Snopes.com,https://www.snopes.com/fact-check/us-army-enlistment-age/,www.snopes.com,Did US Army raise maximum enlistment age to 42? Here's the full story | Snopes.com,0.9,HIGH,True,FALSE - Debunked by fact-checkers,www.snopes.com,factcheck,2026-03-29T07:08:05.565806
[DEBUNKED] 16 rumors about mail-in ballots we've inspected | Snopes.com,https://www.snopes.com/collections/mail-in-ballots-rumors-collection/,www.snopes.com,16 rumors about mail-in ballots we've inspected | Snopes.com,0.9,HIGH,True,FALSE - Debunked by fact-checkers,www.snopes.com,factcheck,2026-03-29T07:08:05.656642
[DEBUNKED] Inspecting alleged Trump Truth Social post saying he's no longer interested in making Canada the 51st state | Snopes.com,https://www.snopes.com/fact-check/trump-truth-social-canada-51-state/,www.snopes.com,Inspecting alleged Trump Truth Social post saying he's no longer interested in making Canada the 51s,0.9,HIGH,True,FALSE - Debunked by fact-checkers,www.snopes.com,factcheck,2026-03-29T07:08:06.119028
[DEBUNKED] Hegseth's pastor said he wants Democratic Texas Rep. James Talarico 'crucified.' Here's context | Snopes.com,https://www.snopes.com/fact-check/hegseth-pastor-talarico-crucified/,www.snopes.com,Hegseth's pastor said he wants Democratic Texas Rep. James Talarico 'crucified.' Here's context | Sn,0.9,HIGH,True,FALSE - Debunked by fact-checkers,www.snopes.com,factcheck,2026-03-29T07:08:06.206975
[DEBUNKED] Did Trump mistake White House patio umbrellas for Iranian officials? | Snopes.com,https://www.snopes.com/fact-check/trump-umbrellas-iran/,www.snopes.com,Did Trump mistake White House patio umbrellas for Iranian officials? | Snopes.com,0.9,HIGH,True,FALSE - Debunked by fact-checkers,www.snopes.com,factcheck,2026-03-29T07:08:06.288524
[DEBUNKED] Did Obamas open $100M 'Humanitarian Hope Center'? | Snopes.com,https://www.snopes.com/fact-check/obama-humanitarian-hope-center/,www.snopes.com,Did Obamas open $100M 'Humanitarian Hope Center'? | Snopes.com,0.9,HIGH,True,FALSE - Debunked by fact-checkers,www.snopes.com,factcheck,2026-03-29T07:08:06.669044
"In Northern Europe, it grew more prevalent this winter, with 30% of cases in Germany, Denmark and The Netherlands linked to the ""cicada"" variant",http://www.politifact.com/article/2026/mar/26/covid-19-variant-cicada-ba32-vaccine-coronavirus/,www.politifact.com,PolitiFact | What we know about the new COVID-19 variant ‘cicada’ or BA.3.2.,0,LOW,False,,,factcheck,2026-03-29T07:08:06.881486
"[DEBUNKED] PolitiFact | After voting by mail in Florida, Trump said mail-in voting means cheating. Pants on Fire!",http://www.politifact.com/factchecks/2026/mar/25/donald-trump/trump-voted-by-mail-in-florida-the-same-month-he-f/,www.politifact.com,"PolitiFact | After voting by mail in Florida, Trump said mail-in voting means cheating. Pants on Fir",0.9,HIGH,True,FALSE - Debunked by fact-checkers,www.politifact.com,factcheck,2026-03-29T07:08:07.016560
"About 95% of TSA’s 60,000 employees are considered essential workers",http://www.politifact.com/article/2026/mar/23/TSA-ICE-DHS-shutdown-funding-paid-Trump-airport/,www.politifact.com,PolitiFact | Why are ICE agents paid during the partial government shutdown but TSA agents aren&#x27,0,LOW,False,,,factcheck,2026-03-29T07:08:07.474683
[DEBUNKED] PolitiFact | This video doesn&#x27;t show Israelis fleeing to Cyprus; it&#x27;s from the Philippines,http://www.politifact.com/factchecks/2026/mar/23/social-media/israelis-fleeing-cyprus-video/,www.politifact.com,PolitiFact | This video doesn&#x27;t show Israelis fleeing to Cyprus; it&#x27;s from the Philippines,0.9,HIGH,True,FALSE - Debunked by fact-checkers,www.politifact.com,factcheck,2026-03-29T07:08:07.546819
"Online searches for gambling addiction help have risen 23% since the 2018 Supreme Court decision, a 2025 JAMA Internal Medicine study found",http://www.politifact.com/article/2026/mar/23/march-madness-sports-betting-gambling-help-support/,www.politifact.com,PolitiFact | Is this March Madness betting cause for concern? How to tell and what to do,0,LOW,False,,,factcheck,2026-03-29T07:08:07.690619
"That’s also true of 22% of Americans broadly, the poll found",http://www.politifact.com/article/2026/mar/23/march-madness-sports-betting-gambling-help-support/,www.politifact.com,PolitiFact | Is this March Madness betting cause for concern? How to tell and what to do,0,LOW,False,,,factcheck,2026-03-29T07:08:07.750700
[DEBUNKED] PolitiFact | Trump says Iran is a country ‘based on disinformation.’ Here’s how Iran conducts influence ops,http://www.politifact.com/article/2026/mar/23/iran-disinformation-campaigns-influence-operations/,www.politifact.com,PolitiFact | Trump says Iran is a country ‘based on disinformation.’ Here’s how Iran conducts influe,0.9,HIGH,True,FALSE - Debunked by fact-checkers,www.politifact.com,factcheck,2026-03-29T07:08:07.914895
"More Info I would like to contribute One Time Monthly Yearly Join Now James Fishback stated on March 11, 2026 in a speech: ""Youth underemployment for college grads is 70%"" nationwide",http://www.politifact.com/factchecks/2026/mar/23/james-fishback/florida-youth-underemployment-college-graduate/,www.politifact.com,"PolitiFact | Is underemployment for young US college grads 70%, as FL governor candidate James Fishb",0,LOW,False,,,factcheck,2026-03-29T07:08:08.038848
"National Jobs Florida James Fishback By Samantha Putterman March 23, 2026 Is underemployment for young US college grads 70%, as FL governor candidate James Fishback says",http://www.politifact.com/factchecks/2026/mar/23/james-fishback/florida-youth-underemployment-college-graduate/,www.politifact.com,"PolitiFact | Is underemployment for young US college grads 70%, as FL governor candidate James Fishb",0,LOW,False,,,factcheck,2026-03-29T07:08:08.107273
The rate since 2008 has ranged from 38% to 48%,http://www.politifact.com/factchecks/2026/mar/23/james-fishback/florida-youth-underemployment-college-graduate/,www.politifact.com,"PolitiFact | Is underemployment for young US college grads 70%, as FL governor candidate James Fishb",0,LOW,False,,,factcheck,2026-03-29T07:08:08.165755
"More Info I would like to contribute One Time Monthly Yearly Join Now Tammy Duckworth stated on March 18, 2026 in an X post: “9% of American citizens don't have the identification that the SAVE act requires to vote",http://www.politifact.com/factchecks/2026/mar/20/tammy-duckworth/SAVE-America-Act-voter-ID-drivers-licenses-REAL-ID/,www.politifact.com,PolitiFact | Do nearly 1 in 10 Americans lack the ID the SAVE America Act would require to vote?,0,LOW,False,,,factcheck,2026-03-29T07:08:08.293845
A 2023 national survey found 9% of adult U,http://www.politifact.com/factchecks/2026/mar/20/tammy-duckworth/SAVE-America-Act-voter-ID-drivers-licenses-REAL-ID/,www.politifact.com,PolitiFact | Do nearly 1 in 10 Americans lack the ID the SAVE America Act would require to vote?,0,LOW,False,,,factcheck,2026-03-29T07:08:08.355704
"citizens could not readily access documentary proof of citizenship, and 9% also lack a nonexpired driver’s license",http://www.politifact.com/factchecks/2026/mar/20/tammy-duckworth/SAVE-America-Act-voter-ID-drivers-licenses-REAL-ID/,www.politifact.com,PolitiFact | Do nearly 1 in 10 Americans lack the ID the SAVE America Act would require to vote?,0,LOW,False,,,factcheck,2026-03-29T07:08:08.416445
[DEBUNKED] Meta Oversight Board thinks Community Notes are inadequate as a standalone solution for addressing harmful misinformation – Full Fact,https://fullfact.org/technology/meta-oversight-board-community-notes-are-inadequate/,fullfact.org,Meta Oversight Board thinks Community Notes are inadequate as a standalone solution for addressing h,0.9,HIGH,True,FALSE - Debunked by fact-checkers,fullfact.org,factcheck,2026-03-29T07:08:08.878884
[DEBUNKED] Fake Keir Starmer post about US leaving NATO circulates online – Full Fact,https://fullfact.org/politics/keir-starmer-america-NATO-bases-statement-x-fake/,fullfact.org,Fake Keir Starmer post about US leaving NATO circulates online – Full Fact,0.9,HIGH,True,FALSE - Debunked by fact-checkers,fullfact.org,factcheck,2026-03-29T07:08:09.386497
[DEBUNKED] Video of 2022 fire in Saudi Arabia shared with false claims it shows Tel Aviv – Full Fact,https://fullfact.org/conflict/2022-saudi-arabia-fire-falsely-shared-as-tel-aviv/,fullfact.org,Video of 2022 fire in Saudi Arabia shared with false claims it shows Tel Aviv – Full Fact,0.9,HIGH,True,FALSE - Debunked by fact-checkers,fullfact.org,factcheck,2026-03-29T07:08:09.858610
"5% in 2027, and we will hit that",https://fullfact.org/politics/keir-starmer-270-billion-defence/,fullfact.org,Defence spending is not set to get an extra £270 billion – Full Fact,0,LOW,False,,,factcheck,2026-03-29T07:08:10.641992
[DEBUNKED] Old footage of market fire shared with false claims it shows Dubai airport in flames – Full Fact,https://fullfact.org/conflict/dubai-airport-fire-miscaptioned-old-footage/,fullfact.org,Old footage of market fire shared with false claims it shows Dubai airport in flames – Full Fact,0.9,HIGH,True,FALSE - Debunked by fact-checkers,fullfact.org,factcheck,2026-03-29T07:08:11.088518
[DEBUNKED] Fake Farage X post about Trump on £5 notes circulates – Full Fact,https://fullfact.org/politics/nigel-farage-donald-trump-5-pound-notes-fake-x-post/,fullfact.org,Fake Farage X post about Trump on £5 notes circulates – Full Fact,0.9,HIGH,True,FALSE - Debunked by fact-checkers,fullfact.org,factcheck,2026-03-29T07:08:11.599336
[DEBUNKED] Fake image of Jewish charity ambulances on fire shared online – Full Fact,https://fullfact.org/crime/fake-image-jewish-charity-ambulances-on-fire/,fullfact.org,Fake image of Jewish charity ambulances on fire shared online – Full Fact,0.9,HIGH,True,FALSE - Debunked by fact-checkers,fullfact.org,factcheck,2026-03-29T07:08:12.050765
"[DEBUNKED] Video shows queue for fuel in Spain, not UK – Full Fact",https://fullfact.org/economy/video-fuel-queue-spain-not-uk/,fullfact.org,"Video shows queue for fuel in Spain, not UK – Full Fact",0.9,HIGH,True,FALSE - Debunked by fact-checkers,fullfact.org,factcheck,2026-03-29T07:08:12.526114
[DEBUNKED] Footage doesn’t show attack on the King Fahd causeway – Full Fact,https://fullfact.org/conflict/king-fahd-bridge-attack-false/,fullfact.org,Footage doesn’t show attack on the King Fahd causeway – Full Fact,0.9,HIGH,True,FALSE - Debunked by fact-checkers,fullfact.org,factcheck,2026-03-29T07:08:12.986736
"According to&nbsp;a 2023 survey&nbsp;by New York University’s Brennan Center for Justice and other groups, more than 9% of Americans of voting age, or 21",https://www.factcheck.org/2026/03/competing-claims-on-save-america-act-disenfranchising-voters/,www.factcheck.org,Competing Claims on SAVE America Act Disenfranchising Voters - FactCheck.org,0,LOW,False,,,factcheck,2026-03-29T07:08:13.152059
[DEBUNKED] EPA’s Misleading Claim of $1.3 Trillion in Deregulatory ‘Savings’ - FactCheck.org,https://www.factcheck.org/2026/03/epas-misleading-claim-of-1-3-trillion-in-deregulatory-savings/,www.factcheck.org,EPA’s Misleading Claim of $1.3 Trillion in Deregulatory ‘Savings’ - FactCheck.org,0.9,HIGH,True,FALSE - Debunked by fact-checkers,www.factcheck.org,factcheck,2026-03-29T07:08:13.698450
[DEBUNKED] Biden Makes Flawed Comparisons with Trump - FactCheck.org,https://www.factcheck.org/2026/03/biden-makes-flawed-comparisons-with-trump/,www.factcheck.org,Biden Makes Flawed Comparisons with Trump - FactCheck.org,0.9,HIGH,True,FALSE - Debunked by fact-checkers,www.factcheck.org,factcheck,2026-03-29T07:08:14.957843
[DEBUNKED] FactChecking Claims in Casey Means&#039; Surgeon General Confirmation Hearing - FactCheck.org,https://www.factcheck.org/2026/03/factchecking-claims-in-casey-means-surgeon-general-confirmation-hearing/,www.factcheck.org,FactChecking Claims in Casey Means&#039; Surgeon General Confirmation Hearing - FactCheck.org,0.9,HIGH,True,FALSE - Debunked by fact-checkers,www.factcheck.org,factcheck,2026-03-29T07:08:15.055924
[DEBUNKED] Fact Check: FAKE Screenshot Shows Trump Calling For Tiger Woods Pardon In DUI Case -- No Such Truth Social Post | Lead Stories,https://leadstories.com/hoax-alert/2026/03/fact-check-tiger-woods-trump-dui-pardon-ron-desantis.html,leadstories.com,Fact Check: FAKE Screenshot Shows Trump Calling For Tiger Woods Pardon In DUI Case -- No Such Truth ,0.9,HIGH,True,FALSE - Debunked by fact-checkers,leadstories.com,factcheck,2026-03-29T07:08:15.193358
[DEBUNKED] Fact Check: Trump Quote About Attacks From '17 Different Angles' Involving Carrier Was About U.S. Attacking Venezuela -- NOT Iran | Lead Stories,https://leadstories.com/hoax-alert/2026/03/fact-check-trump-carrier-17-angles-iran-one-in-the-morning.html,leadstories.com,Fact Check: Trump Quote About Attacks From '17 Different Angles' Involving Carrier Was About U.S. At,0.9,HIGH,True,FALSE - Debunked by fact-checkers,leadstories.com,factcheck,2026-03-29T07:08:15.331971
