claim,source_url,source_domain,article_title,risk_score,risk_category,has_factcheck,factcheck_rating,factcheck_source,source_type,checked_at
[DEBUNKED] Did President Trump call into C-SPAN under a fake name? - Poynter,https://www.poynter.org/commentary/2026/cspan-caller-who-is-john-barron/,www.poynter.org,Did President Trump call into C-SPAN under a fake name? - Poynter,0.9,HIGH,True,FALSE - Debunked by fact-checkers,www.poynter.org,factcheck,2026-02-25T19:10:53.087568
Das bestätigte ein Sprecher der Eliteuniversität,https://www.spiegel.de/ausland/larry-summers-und-epstein-ehemaliger-us-finanzminister-verlaesst-harvard-a-e9011166-93fb-489e-bf91-ee62365884e0#ref=rss,www.spiegel.de,Larry Summers und Epstein: Ehemaliger US-Finanzminister verlässt Harvard - DER SPIEGEL,0,LOW,False,,,mainstream,2026-02-25T19:11:08.288199
Nicht immer läuft der Kampf gegen Organisierte Kriminalität so reibungslos wie in der Übung,https://www.spiegel.de/politik/deutschland/wie-klingbeil-und-dobrindt-an-die-villen-und-luxusautos-der-clan-chefs-wollen-a-89753cff-8799-4d9b-9fb6-e4aa48d61274#ref=rss,www.spiegel.de,Wie Klingbeil und Dobrindt an die Villen und Luxusautos der Clan-Chefs wollen - DER SPIEGEL,0.1,LOW,False,,,mainstream,2026-02-25T19:11:09.583180
"Zum Login SPIEGEL plus Nur für Neukunden € 1,– für 4 Wochen danach € 5,99 pro Woche Freier Zugriff auf alle S+-Artikel auf SPIEGEL",https://www.spiegel.de/kultur/berlinale-tricia-tuttle-vor-dem-aus-wolfram-weimer-als-treibende-kraft-a-1a2ca777-b852-46ec-a881-512d28d4fde7#ref=rss,www.spiegel.de,Berlinale: Tricia Tuttle vor dem Aus – Wolfram Weimer als treibende Kraft - DER SPIEGEL,0.1,LOW,False,,,mainstream,2026-02-25T19:11:10.808314
"E-Paper (PDF), Digital-Archiv und S+-Newsletter Jederzeit kündigen Jetzt abonnieren SPIEGEL plus 52 Wochen 25 % sparen € 4,49 pro Woche für 52 Wochen danach € 5,99 pro Woche Freier Zugriff auf alle S+-Artikel auf SPIEGEL",https://www.spiegel.de/kultur/berlinale-tricia-tuttle-vor-dem-aus-wolfram-weimer-als-treibende-kraft-a-1a2ca777-b852-46ec-a881-512d28d4fde7#ref=rss,www.spiegel.de,Berlinale: Tricia Tuttle vor dem Aus – Wolfram Weimer als treibende Kraft - DER SPIEGEL,0.1,LOW,False,,,mainstream,2026-02-25T19:11:11.007487
Rund 100 Reisende mussten nach Angaben der Bundespolizei den ICE in Stendal (Sachsen-Anhalt) verlassen und auf einen späteren Zug ausweichen,https://www.spiegel.de/panorama/stendal-frau-soll-zugbegleiter-angegriffen-haben-fahrt-wird-abgebrochen-a-ddc0b31c-5f86-41c6-aa16-872b92a79ab9#ref=rss,www.spiegel.de,Stendal: Frau soll Zugbegleiter angegriffen haben – Fahrt wird abgebrochen - DER SPIEGEL,0,LOW,False,,,mainstream,2026-02-25T19:11:12.459664
"Zum Login SPIEGEL plus Nur für Neukunden € 1,– für 4 Wochen danach € 5,99 pro Woche Freier Zugriff auf alle S+-Artikel auf SPIEGEL",https://www.spiegel.de/wirtschaft/unternehmen/elon-musk-schwoert-tesla-belegschaft-in-gruenheide-per-videobotschaft-auf-kurs-ein-a-013d52e2-5dfb-40fc-b2f7-63196305ac1d#ref=rss,www.spiegel.de,Elon Musk schwört Tesla-Belegschaft in Grünheide per Videobotschaft auf Kurs ein - DER SPIEGEL,0.1,LOW,False,,,mainstream,2026-02-25T19:11:13.657715
"E-Paper (PDF), Digital-Archiv und S+-Newsletter Jederzeit kündigen Jetzt abonnieren SPIEGEL plus 52 Wochen 25 % sparen € 4,49 pro Woche für 52 Wochen danach € 5,99 pro Woche Freier Zugriff auf alle S+-Artikel auf SPIEGEL",https://www.spiegel.de/wirtschaft/unternehmen/elon-musk-schwoert-tesla-belegschaft-in-gruenheide-per-videobotschaft-auf-kurs-ein-a-013d52e2-5dfb-40fc-b2f7-63196305ac1d#ref=rss,www.spiegel.de,Elon Musk schwört Tesla-Belegschaft in Grünheide per Videobotschaft auf Kurs ein - DER SPIEGEL,0.1,LOW,False,,,mainstream,2026-02-25T19:11:13.886435
"Zum Login SPIEGEL plus Nur für Neukunden € 1,– für 4 Wochen danach € 5,99 pro Woche Freier Zugriff auf alle S+-Artikel auf SPIEGEL",https://www.spiegel.de/panorama/epstein-akten-der-heidelberg-maezen-und-sein-koenig-jeffrey-a-e368d075-857e-4850-b782-0a5f96ebd5e2#ref=rss,www.spiegel.de,Epstein-Akten: Der Heidelberg-Mäzen und sein »König« Jeffrey - DER SPIEGEL,0.1,LOW,False,,,mainstream,2026-02-25T19:11:15.164992
"E-Paper (PDF), Digital-Archiv und S+-Newsletter Jederzeit kündigen Jetzt abonnieren SPIEGEL plus 52 Wochen 25 % sparen € 4,49 pro Woche für 52 Wochen danach € 5,99 pro Woche Freier Zugriff auf alle S+-Artikel auf SPIEGEL",https://www.spiegel.de/panorama/epstein-akten-der-heidelberg-maezen-und-sein-koenig-jeffrey-a-e368d075-857e-4850-b782-0a5f96ebd5e2#ref=rss,www.spiegel.de,Epstein-Akten: Der Heidelberg-Mäzen und sein »König« Jeffrey - DER SPIEGEL,0.1,LOW,False,,,mainstream,2026-02-25T19:11:15.369557
Ab April könnten bis zu 15 Euro zusätzlich zum Übernachtungspreis für eine Nacht etwa in Barcelona fällig werden,https://www.spiegel.de/wirtschaft/service/spanien-katalonien-verdoppelt-tourismusabgabe-als-reaktion-auf-proteste-a-479cef10-4ec5-4301-86a9-b4ba0017268c#ref=rss,www.spiegel.de,Spanien: Katalonien verdoppelt Tourismusabgabe als Reaktion auf Proteste - DER SPIEGEL,0,LOW,False,,,mainstream,2026-02-25T19:11:16.573278
"Das vom spanischen Regionalparlament verabschiedete Gesetz sieht vor, die Abgabe von bisher 5 Euro bis 7,50 auf 10 Euro bis 15 Euro zu erhöhen",https://www.spiegel.de/wirtschaft/service/spanien-katalonien-verdoppelt-tourismusabgabe-als-reaktion-auf-proteste-a-479cef10-4ec5-4301-86a9-b4ba0017268c#ref=rss,www.spiegel.de,Spanien: Katalonien verdoppelt Tourismusabgabe als Reaktion auf Proteste - DER SPIEGEL,0,LOW,False,,,mainstream,2026-02-25T19:11:16.773617
"Die Region ringt seit Jahren mit den Folgen der Tatsache, dass immer mehr Menschen dort Urlaub machen",https://www.spiegel.de/wirtschaft/service/spanien-katalonien-verdoppelt-tourismusabgabe-als-reaktion-auf-proteste-a-479cef10-4ec5-4301-86a9-b4ba0017268c#ref=rss,www.spiegel.de,Spanien: Katalonien verdoppelt Tourismusabgabe als Reaktion auf Proteste - DER SPIEGEL,0.1,LOW,False,,,mainstream,2026-02-25T19:11:16.976932
"Für alle, die informiert mitreden wollen",https://www.spiegel.de/ausland/bill-clinton-und-hillary-clinton-vor-befragung-die-schleppende-aufklaerung-im-fall-epstein-podcast-a-1f0d4e45-207f-44fc-99e0-fa3280ad124e#ref=rss,www.spiegel.de,Bill Clinton und Hillary Clinton vor Befragung: Die schleppende Aufklärung im Fall Epstein – Podcast,0.1,LOW,False,,,mainstream,2026-02-25T19:11:18.541251
"Für alle, die informiert mitreden wollen",https://www.spiegel.de/ausland/bill-clinton-und-hillary-clinton-vor-befragung-die-schleppende-aufklaerung-im-fall-epstein-a-971c2919-5c9a-4030-a64a-edff96d956dd#ref=rss,www.spiegel.de,Bill Clinton und Hillary Clinton vor Befragung: Die schleppende Aufklärung im Fall Epstein - DER SPI,0.1,LOW,False,,,mainstream,2026-02-25T19:11:20.114482
"»Auf einer Skala von eins bis zehn äußerte gut jeder Vierte zumindest grundsätzliches Interesse«, berichtet mein Kollege Matthias Gebauer",https://www.spiegel.de/politik/deutschland/news-des-tages-annalena-baerbock-uno-letzte-karte-a-b31db5f6-0c3f-4260-ba08-3fa1cec81a8a#ref=rss,www.spiegel.de,"News des Tages: Annalena Baerbock - Uno, letzte Karte? - DER SPIEGEL",0,LOW,False,,,mainstream,2026-02-25T19:11:21.394264
"Heer, Luftwaffe, Marine, alle sollen in den ersten drei Monaten dasselbe lernen",https://www.spiegel.de/politik/deutschland/news-des-tages-annalena-baerbock-uno-letzte-karte-a-b31db5f6-0c3f-4260-ba08-3fa1cec81a8a#ref=rss,www.spiegel.de,"News des Tages: Annalena Baerbock - Uno, letzte Karte? - DER SPIEGEL",0.1,LOW,False,,,mainstream,2026-02-25T19:11:21.593316
«Hier alle Hintergründe: Das erwartet junge Rekruten beim neuen Wehrdienst&nbsp; 2,https://www.spiegel.de/politik/deutschland/news-des-tages-annalena-baerbock-uno-letzte-karte-a-b31db5f6-0c3f-4260-ba08-3fa1cec81a8a#ref=rss,www.spiegel.de,"News des Tages: Annalena Baerbock - Uno, letzte Karte? - DER SPIEGEL",0.1,LOW,False,,,mainstream,2026-02-25T19:11:21.677841
"Zum Login SPIEGEL plus Nur für Neukunden € 1,– für 4 Wochen danach € 5,99 pro Woche Freier Zugriff auf alle S+-Artikel auf SPIEGEL",https://www.spiegel.de/kultur/literatur/heavens-gate-von-daniel-fassbender-die-perfekte-welle-der-falsche-fall-a-a7f1c947-f3fb-4bc0-bfef-ba029cea45d1#ref=rss,www.spiegel.de,"»Heaven’s Gate« von Daniel Faßbender: Die perfekte Welle, der falsche Fall - DER SPIEGEL",0.1,LOW,False,,,mainstream,2026-02-25T19:11:22.871875
"E-Paper (PDF), Digital-Archiv und S+-Newsletter Jederzeit kündigen Jetzt abonnieren SPIEGEL plus 52 Wochen 25 % sparen € 4,49 pro Woche für 52 Wochen danach € 5,99 pro Woche Freier Zugriff auf alle S+-Artikel auf SPIEGEL",https://www.spiegel.de/kultur/literatur/heavens-gate-von-daniel-fassbender-die-perfekte-welle-der-falsche-fall-a-a7f1c947-f3fb-4bc0-bfef-ba029cea45d1#ref=rss,www.spiegel.de,"»Heaven’s Gate« von Daniel Faßbender: Die perfekte Welle, der falsche Fall - DER SPIEGEL",0.1,LOW,False,,,mainstream,2026-02-25T19:11:23.079673
"Zum Login SPIEGEL plus Nur für Neukunden € 1,– für 4 Wochen danach € 5,99 pro Woche Freier Zugriff auf alle S+-Artikel auf SPIEGEL",https://www.spiegel.de/politik/afd-skandal-vorwuerfe-von-vetternwirtschaft-belasten-die-partei-basis-reagiert-gelassen-a-24263042-94dc-430b-b5de-1a402b5e5285#ref=rss,www.spiegel.de,AfD-Skandal: Vorwürfe von Vetternwirtschaft belasten die Partei – Basis reagiert gelassen - DER SPIE,0.1,LOW,False,,,mainstream,2026-02-25T19:11:24.276362
"E-Paper (PDF), Digital-Archiv und S+-Newsletter Jederzeit kündigen Jetzt abonnieren SPIEGEL plus 52 Wochen 25 % sparen € 4,49 pro Woche für 52 Wochen danach € 5,99 pro Woche Freier Zugriff auf alle S+-Artikel auf SPIEGEL",https://www.spiegel.de/politik/afd-skandal-vorwuerfe-von-vetternwirtschaft-belasten-die-partei-basis-reagiert-gelassen-a-24263042-94dc-430b-b5de-1a402b5e5285#ref=rss,www.spiegel.de,AfD-Skandal: Vorwürfe von Vetternwirtschaft belasten die Partei – Basis reagiert gelassen - DER SPIE,0.1,LOW,False,,,mainstream,2026-02-25T19:11:24.501596
"Sie konzentrierten ihre Ermittlungen auf Verbindungen zu Familienmitgliedern, bestätigte die Polizei auf SPIEGEL-Anfrage",https://www.spiegel.de/panorama/justiz/barssel-verschwundene-kinder-aus-niedersachsen-in-luxemburg-wieder-aufgetaucht-a-818e0ba4-4390-4920-be69-3581256f86ef#ref=rss,www.spiegel.de,Barßel: Verschwundene Kinder aus Niedersachsen in Luxemburg wieder aufgetaucht - DER SPIEGEL,0,LOW,False,,,mainstream,2026-02-25T19:11:26.667851
"Zum Login SPIEGEL plus Nur für Neukunden € 1,– für 4 Wochen danach € 5,99 pro Woche Freier Zugriff auf alle S+-Artikel auf SPIEGEL",https://www.spiegel.de/politik/manuel-hagel-cdu-wahlkampfdebakel-auch-konservative-politiker-haben-eine-lernkurve-a-c62a93b7-80d0-472e-be9b-c0f15a3920d1#ref=rss,www.spiegel.de,Manuel Hagel/CDU-Wahlkampfdebakel: Auch konservative Politiker haben eine Lernkurve - DER SPIEGEL,0.1,LOW,False,,,mainstream,2026-02-25T19:11:28.160200
"E-Paper (PDF), Digital-Archiv und S+-Newsletter Jederzeit kündigen Jetzt abonnieren SPIEGEL plus 52 Wochen 25 % sparen € 4,49 pro Woche für 52 Wochen danach € 5,99 pro Woche Freier Zugriff auf alle S+-Artikel auf SPIEGEL",https://www.spiegel.de/politik/manuel-hagel-cdu-wahlkampfdebakel-auch-konservative-politiker-haben-eine-lernkurve-a-c62a93b7-80d0-472e-be9b-c0f15a3920d1#ref=rss,www.spiegel.de,Manuel Hagel/CDU-Wahlkampfdebakel: Auch konservative Politiker haben eine Lernkurve - DER SPIEGEL,0.1,LOW,False,,,mainstream,2026-02-25T19:11:28.364220
"Last year, their number of call outs increased by over 70%",https://www.bbc.com/news/articles/cx2g3vmde0eo?at_medium=RSS&amp;at_campaign=rss,www.bbc.com,Mexico drug violence: BBC reports from Sinaloa city turned into war zone by cartel feud,0,LOW,False,,,mainstream,2026-02-25T19:11:28.675751
4% in the 12 months to January 2026 - down from 3% over President Biden&#x27;s final year in office,https://www.bbc.com/news/articles/cgmlzg0p8k2o?at_medium=RSS&amp;at_campaign=rss,www.bbc.com,Fact-checking Trump&#x27;s longest ever State of the Union,0,LOW,False,,,mainstream,2026-02-25T19:11:29.577804
"1% in June 2022, following Russia&#x27;s full-scale invasion of Ukraine, which contributed to inflation across the globe",https://www.bbc.com/news/articles/cgmlzg0p8k2o?at_medium=RSS&amp;at_campaign=rss,www.bbc.com,Fact-checking Trump&#x27;s longest ever State of the Union,0,LOW,False,,,mainstream,2026-02-25T19:11:29.809040
"Beef prices did fall slightly last month, but they had increased 15% in the 12 months to January 2026",https://www.bbc.com/news/articles/cgmlzg0p8k2o?at_medium=RSS&amp;at_campaign=rss,www.bbc.com,Fact-checking Trump&#x27;s longest ever State of the Union,0,LOW,False,,,mainstream,2026-02-25T19:11:30.008803
"It is focussed on West Antarctica, home to 30-40% of the global population of Emperor penguins",https://www.bbc.com/news/articles/c204626888zo?at_medium=RSS&amp;at_campaign=rss,www.bbc.com,"Emperor Penguins moult to survive, but scientists fear it may now be killing them",0,LOW,False,,,mainstream,2026-02-25T19:11:30.309063
"&quot;It&#x27;s incredibly energy-intensive and the birds use up to 50% of their body mass,&quot; he says",https://www.bbc.com/news/articles/c204626888zo?at_medium=RSS&amp;at_campaign=rss,www.bbc.com,"Emperor Penguins moult to survive, but scientists fear it may now be killing them",0,LOW,False,,,mainstream,2026-02-25T19:11:30.522837
"That is a fall of £117 a year, or 7%, from the previous cap which applied between January to March",https://www.bbc.com/news/articles/cdd29v8mp9jo?at_medium=RSS&amp;at_campaign=rss,www.bbc.com,Energy bills: What is happening to gas and electricity prices?,0,LOW,False,,,mainstream,2026-02-25T19:11:30.776013
"From 1 April, charges related to the insulation scheme - called the Energy Company Obligation - will be scrapped, and for three years, renewable energy projects will be 75%-funded by general taxation instead of a levy on energy bills",https://www.bbc.com/news/articles/cdd29v8mp9jo?at_medium=RSS&amp;at_campaign=rss,www.bbc.com,Energy bills: What is happening to gas and electricity prices?,0.1,LOW,False,,,mainstream,2026-02-25T19:11:30.980310
