claim,source_url,source_domain,article_title,risk_score,risk_category,has_factcheck,factcheck_rating,factcheck_source,source_type,checked_at
[DEBUNKED] Did Obama stiff Black contractors who helped build library? Why claims lack context | Snopes.com,https://www.snopes.com/news/2026/06/24/obama-stiff-black-contractors/,www.snopes.com,Did Obama stiff Black contractors who helped build library? Why claims lack context | Snopes.com,0.9,HIGH,True,FALSE - Debunked by fact-checkers,www.snopes.com,factcheck,2026-06-25T20:03:47.812572
[DEBUNKED] Unpacking claim Oklahoma judge ruled woman 'not allowed to speak abuser's name' | Snopes.com,https://www.snopes.com/fact-check/oklahoma-judge-speak-abuser-name/,www.snopes.com,Unpacking claim Oklahoma judge ruled woman 'not allowed to speak abuser's name' | Snopes.com,0.9,HIGH,True,FALSE - Debunked by fact-checkers,www.snopes.com,factcheck,2026-06-25T20:03:47.899720
[DEBUNKED] PolitiFact | Colombia&#x27;s fast voting results aren&#x27;t proof of cheating in California elections,http://www.politifact.com/article/2026/jun/25/Colombia-presidential-elections-california-primary/,www.politifact.com,PolitiFact | Colombia&#x27;s fast voting results aren&#x27;t proof of cheating in California electio,0.9,HIGH,True,FALSE - Debunked by fact-checkers,www.politifact.com,factcheck,2026-06-25T20:03:47.981512
"Between his second inauguration and the day of his February 2026 State of the Union address — the first time he mentioned the $30,000 figure — the S&amp;P rose by about 13%",http://www.politifact.com/factchecks/2026/jun/25/donald-trump/401k-second-term-balance-stock-market/,www.politifact.com,PolitiFact | Donald Trump exaggerates 401(k) gains during his second term,0,LOW,False,,,factcheck,2026-06-25T20:03:48.289686
"From his second inauguration to June 23, the day of his Pennsylvania speech, the S&amp;P rose by about 24%",http://www.politifact.com/factchecks/2026/jun/25/donald-trump/401k-second-term-balance-stock-market/,www.politifact.com,PolitiFact | Donald Trump exaggerates 401(k) gains during his second term,0,LOW,False,,,factcheck,2026-06-25T20:03:48.489730
"[DEBUNKED] PolitiFact | At GlobalFact 2026, fact-checkers report challenges, resilience",http://www.politifact.com/article/2026/jun/24/at-globalfact-2026-fact-checkers-report-challenges/,www.politifact.com,"PolitiFact | At GlobalFact 2026, fact-checkers report challenges, resilience",0.9,HIGH,True,FALSE - Debunked by fact-checkers,www.politifact.com,factcheck,2026-06-25T20:03:48.746802
[DEBUNKED] PolitiFact | It’s unclear who will pay for Iran’s $300B reconstruction fund. Here’s why,http://www.politifact.com/article/2026/jun/22/trump-iran-300-billion-fund/,www.politifact.com,PolitiFact | It’s unclear who will pay for Iran’s $300B reconstruction fund. Here’s why,0.9,HIGH,True,FALSE - Debunked by fact-checkers,www.politifact.com,factcheck,2026-06-25T20:03:49.182824
[DEBUNKED] PolitiFact | AI ads skewed Talarico’s words and positions. It’s part of a changing scene in political advertising,http://www.politifact.com/article/2026/jun/22/talarico-artificial-intelligence-ads-senate-texas/,www.politifact.com,PolitiFact | AI ads skewed Talarico’s words and positions. It’s part of a changing scene in politica,0.9,HIGH,True,FALSE - Debunked by fact-checkers,www.politifact.com,factcheck,2026-06-25T20:03:49.276668
[DEBUNKED] PolitiFact | What PolitiFact learned from looking at presidential falsehoods throughout U.S. history,http://www.politifact.com/article/2026/jun/22/america-250-presidential-falsehoods-lies/,www.politifact.com,PolitiFact | What PolitiFact learned from looking at presidential falsehoods throughout U.S. history,0.9,HIGH,True,FALSE - Debunked by fact-checkers,www.politifact.com,factcheck,2026-06-25T20:03:49.346333
[DEBUNKED] PolitiFact | 11 times US presidents shaded reality as they shaped US history,http://www.politifact.com/article/2026/jun/22/falsehoods-250th-history-president-politifact/,www.politifact.com,PolitiFact | 11 times US presidents shaded reality as they shaped US history,0.9,HIGH,True,FALSE - Debunked by fact-checkers,www.politifact.com,factcheck,2026-06-25T20:03:49.525441
[DEBUNKED] PolitiFact | Did Mike Collins ‘admit’ that Trump was in the Epstein files? A Jon Ossoff ad omits critical facts,http://www.politifact.com/factchecks/2026/jun/18/jon-ossoff/did-mike-collins-admit-that-trump-was-in-the-epste/,www.politifact.com,PolitiFact | Did Mike Collins ‘admit’ that Trump was in the Epstein files? A Jon Ossoff ad omits cri,0.9,HIGH,True,FALSE - Debunked by fact-checkers,www.politifact.com,factcheck,2026-06-25T20:03:49.596612
"Across the country, private companies are not required to give workers the day off, but an estimated 41% of employers with 500 or more employees do, according to a 2024 survey by consulting firm Mercer",http://www.politifact.com/article/2026/jun/18/juneteenth-has-been-a-federal-holiday-since-2021-b/,www.politifact.com,"PolitiFact | Juneteenth has been a federal holiday since 2021, but it’s not a paid day off in all 50",0.1,LOW,False,,,factcheck,2026-06-25T20:03:49.904718
"Who we are Our team Careers Funding Independence Impartiality Feedback &amp; corrections International networks FAQs Contact us Search Home / Economy, Business &amp; Finance What does the new 22% charge mean for stocks and shares ISAs",https://fullfact.org/economy/stocks-and-shares-isa-22-percent/,fullfact.org,What does the new 22% charge mean for stocks and shares ISAs? – Full Fact,0,LOW,False,,,factcheck,2026-06-25T20:03:50.847247
25 June 2026 What was claimed The government is introducing a 22% tax on stocks and shares ISAs,https://fullfact.org/economy/stocks-and-shares-isa-22-percent/,fullfact.org,What does the new 22% charge mean for stocks and shares ISAs? – Full Fact,0,LOW,False,,,factcheck,2026-06-25T20:03:50.958452
"The 22% rate will only apply to interest gained on cash held inside stocks and shares ISAs not the actual cash itself, and it also won’t apply to investment growth in a stocks and shares ISA",https://fullfact.org/economy/stocks-and-shares-isa-22-percent/,fullfact.org,What does the new 22% charge mean for stocks and shares ISAs? – Full Fact,0,LOW,False,,,factcheck,2026-06-25T20:03:51.169731
"[DEBUNKED] No, Amazon is not selling HP laptops for £3 – Full Fact",https://fullfact.org/shopping/amazon-laptop-deals-fake-repeated/,fullfact.org,"No, Amazon is not selling HP laptops for £3 – Full Fact",0.9,HIGH,True,FALSE - Debunked by fact-checkers,fullfact.org,factcheck,2026-06-25T20:03:51.758907
"The UKSA also said it was worried that the Conservatives were giving the impression that “welfare” was mainly about sickness and out-of-work benefits, when “approximately 55% of social security expenditure is spent on pensioners”",https://fullfact.org/economy/statistics-watchdog-challenges-badenoch-over-welfare-claim-after-full-fact-intervention/,fullfact.org,Statistics watchdog challenges Badenoch over welfare claim after Full Fact intervention – Full Fact,0,LOW,False,,,factcheck,2026-06-25T20:03:52.581380
[DEBUNKED] Grimsby housing development homes aren’t ‘exclusively for immigrants’ – Full Fact,https://fullfact.org/immigration/grimsby-immigrants-ferriby-fields-false/,fullfact.org,Grimsby housing development homes aren’t ‘exclusively for immigrants’ – Full Fact,0.9,HIGH,True,FALSE - Debunked by fact-checkers,fullfact.org,factcheck,2026-06-25T20:03:53.219344
[DEBUNKED] Video shows explosions in China not Russian attack on Ukraine – Full Fact,https://fullfact.org/conflict/russia-ukraine-attack-miscaptioned-video/,fullfact.org,Video shows explosions in China not Russian attack on Ukraine – Full Fact,0.9,HIGH,True,FALSE - Debunked by fact-checkers,fullfact.org,factcheck,2026-06-25T20:03:53.868349
[DEBUNKED] More AI videos of small boat crossings circulate on Facebook – Full Fact,https://fullfact.org/immigration/ai-video-migrant-boat/,fullfact.org,More AI videos of small boat crossings circulate on Facebook – Full Fact,0.9,HIGH,True,FALSE - Debunked by fact-checkers,fullfact.org,factcheck,2026-06-25T20:03:54.644306
[DEBUNKED] Incorrect name for crocodile attack arrest circulates online – Full Fact,https://fullfact.org/crime/crocodile-attack-arrest-misidentified/,fullfact.org,Incorrect name for crocodile attack arrest circulates online – Full Fact,0.9,HIGH,True,FALSE - Debunked by fact-checkers,fullfact.org,factcheck,2026-06-25T20:03:55.275704
"[DEBUNKED] No, Keir Starmer won’t get a £115,000 ‘pension’ as an ex-PM – Full Fact",https://fullfact.org/politics/keir-starmer-115000-pension-for-life/,fullfact.org,"No, Keir Starmer won’t get a £115,000 ‘pension’ as an ex-PM – Full Fact",0.9,HIGH,True,FALSE - Debunked by fact-checkers,fullfact.org,factcheck,2026-06-25T20:03:56.647873
"[DEBUNKED] No, an Iranian footballer wasn’t deported after New Zealand World Cup match – Full Fact",https://fullfact.org/sport/world-cup-Iran-footballer-not-deported-gun-celebration/,fullfact.org,"No, an Iranian footballer wasn’t deported after New Zealand World Cup match – Full Fact",0.9,HIGH,True,FALSE - Debunked by fact-checkers,fullfact.org,factcheck,2026-06-25T20:03:57.273936
[DEBUNKED] How Trump&#039;s Preliminary Deal with Iran Compares with His Rhetoric - FactCheck.org,https://www.factcheck.org/2026/06/how-trumps-preliminary-deal-with-iran-compares-with-his-rhetoric/,www.factcheck.org,How Trump&#039;s Preliminary Deal with Iran Compares with His Rhetoric - FactCheck.org,0.9,HIGH,True,FALSE - Debunked by fact-checkers,www.factcheck.org,factcheck,2026-06-25T20:03:58.034193
"&#8220;We cut the flow of fentanyl across our border by 59%, which is unheard of,&#8221; Trump said in May 22 remarks in New York",https://www.factcheck.org/2026/06/trump-makes-unsupported-claims-about-drug-flows/,www.factcheck.org,Trump Makes Unsupported Claims About Drug Flows - FactCheck.org,0,LOW,False,,,factcheck,2026-06-25T20:03:59.270520
"&#8220;And we cut the flow of fentanyl and drugs into our country by the ocean and the sea, in other words, coming in by water, by ocean and sea by 97%",https://www.factcheck.org/2026/06/trump-makes-unsupported-claims-about-drug-flows/,www.factcheck.org,Trump Makes Unsupported Claims About Drug Flows - FactCheck.org,0,LOW,False,,,factcheck,2026-06-25T20:03:59.498784
"Then, on May 28, in an interview with his daughter-in-law, Lara Trump, on Fox News, he said, &#8220;We have drugs down 97%",https://www.factcheck.org/2026/06/trump-makes-unsupported-claims-about-drug-flows/,www.factcheck.org,Trump Makes Unsupported Claims About Drug Flows - FactCheck.org,0,LOW,False,,,factcheck,2026-06-25T20:03:59.699770
[DEBUNKED] FactChecking Trump&#039;s Contentious &#039;Meet the Press&#039; Interview - FactCheck.org,https://www.factcheck.org/2026/06/factchecking-trumps-contentious-meet-the-press-interview/,www.factcheck.org,FactChecking Trump&#039;s Contentious &#039;Meet the Press&#039; Interview - FactCheck.org,0.9,HIGH,True,FALSE - Debunked by fact-checkers,www.factcheck.org,factcheck,2026-06-25T20:04:00.755776
[DEBUNKED] Trump Misrepresents Climate Change Scenarios - FactCheck.org,https://www.factcheck.org/2026/06/trump-misrepresents-climate-change-scenarios/,www.factcheck.org,Trump Misrepresents Climate Change Scenarios - FactCheck.org,0.9,HIGH,True,FALSE - Debunked by fact-checkers,www.factcheck.org,factcheck,2026-06-25T20:04:01.090026
[DEBUNKED] Fact Check: Harry Kane Did NOT Say He Lost Control of His Body During Ghana Match After Witch Doctor's 'Curse' | Lead Stories,https://leadstories.com/hoax-alert/2026/06/fact-check-harry-kane-did-not-say-he-lost-control-of-his-body-during-ghana-match-after-witch-doctors-curse.html,leadstories.com,Fact Check: Harry Kane Did NOT Say He Lost Control of His Body During Ghana Match After Witch Doctor,0.9,HIGH,True,FALSE - Debunked by fact-checkers,leadstories.com,factcheck,2026-06-25T20:04:01.270835
[DEBUNKED] Fact Check: FAKE Photo Does NOT Show Officer From Montreal Shooting -- The Image Is Likely AI-Generated And Victim Was Not A Rabbi  | Lead Stories,https://leadstories.com/hoax-alert/2026/06/fact-check-fake-photo-does-not-show-police-officer-who-reportedly-shot-rabbi-during-montreal-attack-carrying-rifle-wearing-uniform.html,leadstories.com,Fact Check: FAKE Photo Does NOT Show Officer From Montreal Shooting -- The Image Is Likely AI-Genera,0.9,HIGH,True,FALSE - Debunked by fact-checkers,leadstories.com,factcheck,2026-06-25T20:04:01.457971
[DEBUNKED] Viral Video Of Littered Street In Paris -- What We Know | Lead Stories,https://leadstories.com/hoax-alert/2026/06/video-of-littered-street-in-paris-what-we-know.html,leadstories.com,Viral Video Of Littered Street In Paris -- What We Know | Lead Stories,0.9,HIGH,True,FALSE - Debunked by fact-checkers,leadstories.com,factcheck,2026-06-25T20:04:01.666048
[DEBUNKED] Fact Check: Altered Photo Of Tray Liner Under McDonald's Breakfast Shows Charlie Kirk Lookalike -- Not Real | Lead Stories,https://leadstories.com/hoax-alert/2026/06/fact-check-someone-who-looks-like-charlie-kirk-on-tray-liner-picture-under-mcdonalds-breakfast-photo-was-changed.html,leadstories.com,Fact Check: Altered Photo Of Tray Liner Under McDonald's Breakfast Shows Charlie Kirk Lookalike -- N,0.9,HIGH,True,FALSE - Debunked by fact-checkers,leadstories.com,factcheck,2026-06-25T20:04:01.847563
[DEBUNKED] Fact Check: Video Clip Does NOT Show Victims From Hot Air Balloon Accident In Brazil -- Different Ride In Initial Footage | Lead Stories,https://leadstories.com/hoax-alert/2026/06/fact-check-video-clip-does-not-show-victims-from-hot-air-balloon-accident-brazil-different-ride-initial-footage.html,leadstories.com,Fact Check: Video Clip Does NOT Show Victims From Hot Air Balloon Accident In Brazil -- Different Ri,0.9,HIGH,True,FALSE - Debunked by fact-checkers,leadstories.com,factcheck,2026-06-25T20:04:02.035865
"[DEBUNKED] Fact Check: Photo Does NOT Show Blue Tarp Covering Fence Around Washington, D.C., Reflecting Pool During Late June 2026 | Lead Stories",https://leadstories.com/hoax-alert/2026/06/fact-check-real-photo-does-not-show-blue-tarp-covering-fence-around-washington-dc-reflecting-pool-during-late-june-2026.html,leadstories.com,"Fact Check: Photo Does NOT Show Blue Tarp Covering Fence Around Washington, D.C., Reflecting Pool Du",0.9,HIGH,True,FALSE - Debunked by fact-checkers,leadstories.com,factcheck,2026-06-25T20:04:02.207206
[DEBUNKED] Fact Check: FAKE Video Of Hands Sticking Out Of The Ground Does NOT Show People Allegedly Buried Alive In Sudan | Lead Stories,https://leadstories.com/hoax-alert/2026/06/fact-check-fake-video-of-hands-sticking-out-of-the-ground-is-coupled-with-baseless-claim-it-shows-people-buried-alive-in-sudan.html,leadstories.com,Fact Check: FAKE Video Of Hands Sticking Out Of The Ground Does NOT Show People Allegedly Buried Ali,0.9,HIGH,True,FALSE - Debunked by fact-checkers,leadstories.com,factcheck,2026-06-25T20:04:02.392529
[DEBUNKED] Fact Check: FAKE Video Shows Orthodox Priests Blessing Gas Station Pump -- It Is AI-Generated | Lead Stories,https://leadstories.com/hoax-alert/2026/06/fact-check-fake-video-shows-orthodox-priests-blessing-gas-station-pump.html,leadstories.com,Fact Check: FAKE Video Shows Orthodox Priests Blessing Gas Station Pump -- It Is AI-Generated | Lead,0.9,HIGH,True,FALSE - Debunked by fact-checkers,leadstories.com,factcheck,2026-06-25T20:04:02.599997
"[DEBUNKED] Fact Check: FBI Did NOT Raid 'Antifa' Storage Unit, Find 'Aggressive Algae' -- It's From Satire Site | Lead Stories",https://leadstories.com/hoax-alert/2026/06/fact-check-fbi-did-not-raid-antifa-storage-unit-find-aggressive-algae-its-from-satire-site.html,leadstories.com,"Fact Check: FBI Did NOT Raid 'Antifa' Storage Unit, Find 'Aggressive Algae' -- It's From Satire Site",0.9,HIGH,True,FALSE - Debunked by fact-checkers,leadstories.com,factcheck,2026-06-25T20:04:02.790174
[DEBUNKED] Fact Check: Video Does NOT Show Swedish Soccer Player Lucas Bergvall Saying 'Please Stop Voting for Mass Migration' | Lead Stories,https://leadstories.com/hoax-alert/2026/06/fact-check-video-does-not-show-swedish-soccer-player-lucas-bergvall-saying-please-stop-voting-for-mass-migration.html,leadstories.com,Fact Check: Video Does NOT Show Swedish Soccer Player Lucas Bergvall Saying 'Please Stop Voting for ,0.9,HIGH,True,FALSE - Debunked by fact-checkers,leadstories.com,factcheck,2026-06-25T20:04:03.021202
[DEBUNKED] Fact Check: Italian PM Giorgia Meloni Did NOT Point Out US Nuclear Weapon Use In Response To Trump | Lead Stories,https://leadstories.com/hoax-alert/2026/06/fact-check-italy-pm-giorgia-meloni-did-not-point-out-us-nuclear-weapons-use-in-response-to-trump.html,leadstories.com,Fact Check: Italian PM Giorgia Meloni Did NOT Point Out US Nuclear Weapon Use In Response To Trump |,0.9,HIGH,True,FALSE - Debunked by fact-checkers,leadstories.com,factcheck,2026-06-25T20:04:03.229436
"[DEBUNKED] Fact Check: Benjamin Netanyahu Did NOT Attend Argentina-Austria Match on June 22, 2026 -- Image Is Fake | Lead Stories",https://leadstories.com/hoax-alert/2026/06/fact-check-benjamin-netanyahu-did-not-attend-argentina-austria-match-on-june-22-2026.html,leadstories.com,"Fact Check: Benjamin Netanyahu Did NOT Attend Argentina-Austria Match on June 22, 2026 -- Image Is F",0.9,HIGH,True,FALSE - Debunked by fact-checkers,leadstories.com,factcheck,2026-06-25T20:04:03.427375
[DEBUNKED] Fact Check: Jeff Bezos Did NOT Say Water Should Be Used To Fuel AI Rather Than For Human Consumption In Public Remarks At 2026 VivaTech Conference In Paris | Lead Stories,https://leadstories.com/hoax-alert/2026/06/fact-check-jeff-bezos-did-not-say-water-should-be-used-to-fuel-ai-rather-than-for-human-consumption-in-public-remarks-at-2026-vivatech-conference-in-paris.html,leadstories.com,Fact Check: Jeff Bezos Did NOT Say Water Should Be Used To Fuel AI Rather Than For Human Consumption,0.9,HIGH,True,FALSE - Debunked by fact-checkers,leadstories.com,factcheck,2026-06-25T20:04:03.650810
[DEBUNKED] Fact Check: FAKE AI Video Shows Ribbon Cutting Ceremony For Fictional Asphalt Road In 'Mukhosransk' -- Russia's 'Nowheresville' | Lead Stories,https://leadstories.com/hoax-alert/2026/06/fact-check-fake-vide-shows-ribbon-cutting-ceremony-for-a-fake-new-asphalt-road-in-mukhosransk-russia.html,leadstories.com,Fact Check: FAKE AI Video Shows Ribbon Cutting Ceremony For Fictional Asphalt Road In 'Mukhosransk' ,0.9,HIGH,True,FALSE - Debunked by fact-checkers,leadstories.com,factcheck,2026-06-25T20:04:03.831148
[DEBUNKED] Fact Check: NO EVIDENCE Image of '0-1' Spray-Painted Below 'Department of War' Plaque Is Real | Lead Stories,https://leadstories.com/hoax-alert/2026/06/fact-check-no-evidence-image-of-0-1-spray-painted-below-department-of-war-plaque-is-real.html,leadstories.com,Fact Check: NO EVIDENCE Image of '0-1' Spray-Painted Below 'Department of War' Plaque Is Real | Lead,0.9,HIGH,True,FALSE - Debunked by fact-checkers,leadstories.com,factcheck,2026-06-25T20:04:04.022253
"[DEBUNKED] Warmongering NATO, peaceful Belarus, and Bulgaria’s “punishment” - EUvsDisinfo",https://euvsdisinfo.eu/warmongering-nato-peaceful-belarus-and-bulgarias-punishment/,euvsdisinfo.eu,"Warmongering NATO, peaceful Belarus, and Bulgaria’s “punishment” - EUvsDisinfo",0.9,HIGH,True,FALSE - Debunked by fact-checkers,euvsdisinfo.eu,factcheck,2026-06-25T20:04:07.744472
"[DEBUNKED] Religion, drones, and “piracy”: latest trends in Russian FIMI - EUvsDisinfo",https://euvsdisinfo.eu/religion-drones-and-piracy-latest-trends-in-russian-fimi/,euvsdisinfo.eu,"Religion, drones, and “piracy”: latest trends in Russian FIMI - EUvsDisinfo",0.9,HIGH,True,FALSE - Debunked by fact-checkers,euvsdisinfo.eu,factcheck,2026-06-25T20:04:10.955388
"[DEBUNKED] Victim-blaming Kyiv, pressuring Moldova, and drone disinformation - EUvsDisinfo",https://euvsdisinfo.eu/victim-blaming-kyiv-pressuring-moldova-and-drone-disinformation/,euvsdisinfo.eu,"Victim-blaming Kyiv, pressuring Moldova, and drone disinformation - EUvsDisinfo",0.9,HIGH,True,FALSE - Debunked by fact-checkers,euvsdisinfo.eu,factcheck,2026-06-25T20:04:12.691607
"[DEBUNKED] Tough love: Spies, dating apps and the dark side of online intimacy - EUvsDisinfo",https://euvsdisinfo.eu/tough-love-spies-dating-apps-and-the-dark-side-of-online-intimacy/,euvsdisinfo.eu,"Tough love: Spies, dating apps and the dark side of online intimacy - EUvsDisinfo",0.9,HIGH,True,FALSE - Debunked by fact-checkers,euvsdisinfo.eu,factcheck,2026-06-25T20:04:15.568714
"[DEBUNKED] Lies about Russia’s military success, Yermak’s arrest and secret biolabs - EUvsDisinfo",https://euvsdisinfo.eu/lies-about-russias-military-success-yermaks-arrest-and-secret-biolabs/,euvsdisinfo.eu,"Lies about Russia’s military success, Yermak’s arrest and secret biolabs - EUvsDisinfo",0.9,HIGH,True,FALSE - Debunked by fact-checkers,euvsdisinfo.eu,factcheck,2026-06-25T20:04:16.846111
"[DEBUNKED] Victory Day propaganda, masking fear with intimidation, and abduction denial - EUvsDisinfo",https://euvsdisinfo.eu/victory-day-propaganda-masking-fear-with-intimidation-and-abduction-denial/,euvsdisinfo.eu,"Victory Day propaganda, masking fear with intimidation, and abduction denial - EUvsDisinfo",0.9,HIGH,True,FALSE - Debunked by fact-checkers,euvsdisinfo.eu,factcheck,2026-06-25T20:04:19.669743
"com Facebook E-Mail Messenger WhatsApp Link kopieren SPIEGEL bei Google bevorzugen image""> Bild vergrößern Minister Pistorius: Nicht immer mit letztem Nachdruck Foto: Chris Emil Jan√É¬üen / IMAGO Sie können den Artikel leider nicht mehr aufrufen",https://www.spiegel.de/politik/deutschland/boris-pistorius-ende-des-marine-grossprojekts-erhoeht-druck-auf-minister-a-88240908-beb6-4c96-9a96-4bf874e5d663#ref=rss,www.spiegel.de,Boris Pistorius: Ende des Marine-Großprojekts erhöht Druck auf Minister - DER SPIEGEL,0.1,LOW,False,,,mainstream,2026-06-25T20:04:37.529171
"Zum Login SPIEGEL plus Nur für Neukunden € 1,– für 4 Wochen danach € 5,99 pro Woche Freier Zugriff auf alle S+-Artikel auf SPIEGEL",https://www.spiegel.de/politik/deutschland/boris-pistorius-ende-des-marine-grossprojekts-erhoeht-druck-auf-minister-a-88240908-beb6-4c96-9a96-4bf874e5d663#ref=rss,www.spiegel.de,Boris Pistorius: Ende des Marine-Großprojekts erhöht Druck auf Minister - DER SPIEGEL,0.1,LOW,False,,,mainstream,2026-06-25T20:04:37.730765
"E-Paper (PDF), Digital-Archiv und S+-Newsletter Jederzeit kündigen Jetzt abonnieren SPIEGEL plus 52 Wochen 25 % sparen € 4,49 pro Woche für 52 Wochen danach € 5,99 pro Woche Freier Zugriff auf alle S+-Artikel auf SPIEGEL",https://www.spiegel.de/politik/deutschland/boris-pistorius-ende-des-marine-grossprojekts-erhoeht-druck-auf-minister-a-88240908-beb6-4c96-9a96-4bf874e5d663#ref=rss,www.spiegel.de,Boris Pistorius: Ende des Marine-Großprojekts erhöht Druck auf Minister - DER SPIEGEL,0.1,LOW,False,,,mainstream,2026-06-25T20:04:37.930818
"Der Bund werde 80 Prozent der Kosten tragen, die den Kommunen künftig durch neue Bundesgesetze entstehen",https://www.spiegel.de/politik/bund-und-laender-einigung-auf-entlastung-fuer-kommunen-erzielt-a-0cee57d9-9c60-44dd-af61-447a78fc5a8e#ref=rss,www.spiegel.de,Bund und Länder: Einigung auf Entlastung für Kommunen erzielt - DER SPIEGEL,0,LOW,False,,,mainstream,2026-06-25T20:04:39.289819
"length - 1, 500, false)"" data-area=""nav-bar"" data-app-hidden x-lazyload> Menü Startseite Kultur Fußball-WM 2026: »Der Zug hat keine Bremse« wird zur inoffiziellen WM-Hymne $swiper",https://www.spiegel.de/kultur/fussball-wm-2026-der-zug-hat-keine-bremse-wird-zur-inoffiziellen-wm-hymne-a-f7535cd6-4790-46bc-8163-edbf3f49eb2e#ref=rss,www.spiegel.de,Fußball-WM 2026: »Der Zug hat keine Bremse« wird zur inoffiziellen WM-Hymne - DER SPIEGEL,0.1,LOW,False,,,mainstream,2026-06-25T20:04:40.499324
Andere Nutzungen verletzen das Urheberrecht »Der Zug hat keine Bremse« Dieses Sauflied ist die wahre WM-Hymne Shakira,https://www.spiegel.de/kultur/fussball-wm-2026-der-zug-hat-keine-bremse-wird-zur-inoffiziellen-wm-hymne-a-f7535cd6-4790-46bc-8163-edbf3f49eb2e#ref=rss,www.spiegel.de,Fußball-WM 2026: »Der Zug hat keine Bremse« wird zur inoffiziellen WM-Hymne - DER SPIEGEL,0.1,LOW,False,,,mainstream,2026-06-25T20:04:40.703735
Die deutsche Nationalmannschaft und ihre Fans feiern am liebsten zum Ballermann-Hit »Der Zug hat keine Bremse«,https://www.spiegel.de/kultur/fussball-wm-2026-der-zug-hat-keine-bremse-wird-zur-inoffiziellen-wm-hymne-a-f7535cd6-4790-46bc-8163-edbf3f49eb2e#ref=rss,www.spiegel.de,Fußball-WM 2026: »Der Zug hat keine Bremse« wird zur inoffiziellen WM-Hymne - DER SPIEGEL,0.1,LOW,False,,,mainstream,2026-06-25T20:04:40.815595
"Zum Login SPIEGEL plus Nur für Neukunden € 1,– für 4 Wochen danach € 5,99 pro Woche Freier Zugriff auf alle S+-Artikel auf SPIEGEL",https://www.spiegel.de/kultur/literatur/medusa-protocol-was-machen-auftragsmoerder-wenn-sie-nicht-mehr-toeten-wollen-a-29fdf00b-84a4-4dca-9cd1-779eb2a6864f#ref=rss,www.spiegel.de,"»Medusa Protocol«: Was machen Auftragsmörder, wenn sie nicht mehr töten wollen? - DER SPIEGEL",0.1,LOW,False,,,mainstream,2026-06-25T20:04:42.028806
"E-Paper (PDF), Digital-Archiv und S+-Newsletter Jederzeit kündigen Jetzt abonnieren SPIEGEL plus 52 Wochen 25 % sparen € 4,49 pro Woche für 52 Wochen danach € 5,99 pro Woche Freier Zugriff auf alle S+-Artikel auf SPIEGEL",https://www.spiegel.de/kultur/literatur/medusa-protocol-was-machen-auftragsmoerder-wenn-sie-nicht-mehr-toeten-wollen-a-29fdf00b-84a4-4dca-9cd1-779eb2a6864f#ref=rss,www.spiegel.de,"»Medusa Protocol«: Was machen Auftragsmörder, wenn sie nicht mehr töten wollen? - DER SPIEGEL",0.1,LOW,False,,,mainstream,2026-06-25T20:04:42.234878
