claim,source_url,source_domain,article_title,risk_score,risk_category,has_factcheck,factcheck_rating,factcheck_source,source_type,checked_at
"[DEBUNKED] No, the Supreme Court has not ordered Keir Starmer to resign – Full Fact",https://fullfact.org/politics/supreme-court-not-ordered-keir-starmer-to-resign/,fullfact.org,"No, the Supreme Court has not ordered Keir Starmer to resign – Full Fact",0.9,HIGH,True,FALSE - Debunked by fact-checkers,fullfact.org,factcheck,2026-05-04T03:24:10.543413
[DEBUNKED] Fake report of van and truck drivers ramming into Muslim street prayers shared online – Full Fact,https://fullfact.org/crime/van-ram-muslim-prayers-false/,fullfact.org,Fake report of van and truck drivers ramming into Muslim street prayers shared online – Full Fact,0.9,HIGH,True,FALSE - Debunked by fact-checkers,fullfact.org,factcheck,2026-05-04T03:24:11.078917
[DEBUNKED] False claims Laura Kuenssberg clashed with Rupert Lowe on air shared online – Full Fact,https://fullfact.org/politics/kuenssberg-lowe-bbc-sunday-interview-fake/,fullfact.org,False claims Laura Kuenssberg clashed with Rupert Lowe on air shared online – Full Fact,0.9,HIGH,True,FALSE - Debunked by fact-checkers,fullfact.org,factcheck,2026-05-04T03:24:11.453122
[DEBUNKED] Fake BBC News report about stolen Cézanne painting appearing in Zelenskyy video circulates online – Full Fact,https://fullfact.org/culture-and-society/fake-bbc-news-report-stolen-cezanne-painting-zelenskyy/,fullfact.org,Fake BBC News report about stolen Cézanne painting appearing in Zelenskyy video circulates online – ,0.9,HIGH,True,FALSE - Debunked by fact-checkers,fullfact.org,factcheck,2026-05-04T03:24:11.986076
[DEBUNKED] Video of voters on the street is AI-generated – Full Fact,https://fullfact.org/politics/fake-reform-voters-street/,fullfact.org,Video of voters on the street is AI-generated – Full Fact,0.9,HIGH,True,FALSE - Debunked by fact-checkers,fullfact.org,factcheck,2026-05-04T03:24:12.362340
[DEBUNKED] Facebook ads offer fake Toby Carvery giveaway – Full Fact,https://fullfact.org/shopping/toby-carvery-facebook-ads/,fullfact.org,Facebook ads offer fake Toby Carvery giveaway – Full Fact,0.9,HIGH,True,FALSE - Debunked by fact-checkers,fullfact.org,factcheck,2026-05-04T03:24:12.976735
[DEBUNKED] Rupert Lowe doesn’t appear on Time magazine’s 2026 list of the 100 most influential people – Full Fact,https://fullfact.org/politics/rupert-lowe-time100-2026-false/,fullfact.org,Rupert Lowe doesn’t appear on Time magazine’s 2026 list of the 100 most influential people – Full Fa,0.9,HIGH,True,FALSE - Debunked by fact-checkers,fullfact.org,factcheck,2026-05-04T03:24:13.512713
[DEBUNKED] Video of Donald Trump altered to include fake audio of him criticising Sadiq Khan – Full Fact,https://fullfact.org/politics/fake-videos-donald-trump-criticising-sadiq-khan/,fullfact.org,Video of Donald Trump altered to include fake audio of him criticising Sadiq Khan – Full Fact,0.9,HIGH,True,FALSE - Debunked by fact-checkers,fullfact.org,factcheck,2026-05-04T03:24:14.056003
[DEBUNKED] Project 2025 Series Wins National Headliner Award - FactCheck.org,https://www.factcheck.org/2026/04/project-2025-series-wins-national-headliner-award/,www.factcheck.org,Project 2025 Series Wins National Headliner Award - FactCheck.org,0.9,HIGH,True,FALSE - Debunked by fact-checkers,www.factcheck.org,factcheck,2026-05-04T03:24:14.886476
[DEBUNKED] The Persistent Misleading Claim That Vaccines Aren’t Properly Tested for Safety - FactCheck.org,https://www.factcheck.org/2026/04/the-persistent-misleading-claim-that-vaccines-arent-properly-tested-for-safety/,www.factcheck.org,The Persistent Misleading Claim That Vaccines Aren’t Properly Tested for Safety - FactCheck.org,0.9,HIGH,True,FALSE - Debunked by fact-checkers,www.factcheck.org,factcheck,2026-05-04T03:24:14.927145
"border with Mexico decreased about 92%, and refugee admissions dropped by the same percentage",https://www.factcheck.org/2026/04/trumps-numbers-april-2026-update/,www.factcheck.org,"Trump&#039;s Numbers, April 2026 Update - FactCheck.org",0,LOW,False,,,factcheck,2026-05-04T03:24:15.077224
The trade deficit dropped 14% for the most recent 12 months,https://www.factcheck.org/2026/04/trumps-numbers-april-2026-update/,www.factcheck.org,"Trump&#039;s Numbers, April 2026 Update - FactCheck.org",0,LOW,False,,,factcheck,2026-05-04T03:24:15.156621
"7%, and oil imports declined almost 6",https://www.factcheck.org/2026/04/trumps-numbers-april-2026-update/,www.factcheck.org,"Trump&#039;s Numbers, April 2026 Update - FactCheck.org",0,LOW,False,,,factcheck,2026-05-04T03:24:15.234738
[DEBUNKED] An Attack Over ICE in the Massachusetts Democratic Senate Race - FactCheck.org,https://www.factcheck.org/2026/04/an-attack-over-ice-in-the-massachusetts-democratic-senate-race/,www.factcheck.org,An Attack Over ICE in the Massachusetts Democratic Senate Race - FactCheck.org,0.9,HIGH,True,FALSE - Debunked by fact-checkers,www.factcheck.org,factcheck,2026-05-04T03:24:15.756260
[DEBUNKED] Fact Check: Trump DID Post Uno Meme Saying 'I Have All The Cards' -- A Losing Hand In That Game | Lead Stories,https://leadstories.com/hoax-alert/2026/05/fact-check-trump-uno-i-have-all-the-cards.html,leadstories.com,Fact Check: Trump DID Post Uno Meme Saying 'I Have All The Cards' -- A Losing Hand In That Game | Le,0.9,HIGH,True,FALSE - Debunked by fact-checkers,leadstories.com,factcheck,2026-05-04T03:24:16.088268
[DEBUNKED] Fact Check: Posts Saying You Can Stand Where Three States Meet Use FAKE Photos -- Spam From Bangladesh | Lead Stories,https://leadstories.com/hoax-alert/2026/05/fact-check-posts-saying+you+can-stand-where-three-states-meet-use-fake-photos.html,leadstories.com,Fact Check: Posts Saying You Can Stand Where Three States Meet Use FAKE Photos -- Spam From Banglade,0.9,HIGH,True,FALSE - Debunked by fact-checkers,leadstories.com,factcheck,2026-05-04T03:24:16.220331
[DEBUNKED] Fact Check: Fake AI-Generated Video Shows Erika Kirk Breathing Heavily Into The Microphone | Lead Stories,https://leadstories.com/hoax-alert/2026/05/fact-check-fake-ai-generated-video-shows-erika-kirk-breathing-heavily-into-the-microphone.html,leadstories.com,Fact Check: Fake AI-Generated Video Shows Erika Kirk Breathing Heavily Into The Microphone | Lead St,0.9,HIGH,True,FALSE - Debunked by fact-checkers,leadstories.com,factcheck,2026-05-04T03:24:16.557853
[DEBUNKED] Fact Check: Donald Trump Did NOT Post An Image Of Himself Helping Lady Liberty Give Birth To A Mini-Trump Wrapped In An American Flag | Lead Stories,https://leadstories.com/hoax-alert/2026/05/fact-check-donald-trump-did-not-post-image-helping-lady-liberty-give-brth-mini-trump-american-flag.html,leadstories.com,Fact Check: Donald Trump Did NOT Post An Image Of Himself Helping Lady Liberty Give Birth To A Mini-,0.9,HIGH,True,FALSE - Debunked by fact-checkers,leadstories.com,factcheck,2026-05-04T03:24:16.674204
"[DEBUNKED] Fact Check: FAKE Donald Trump Truth Social Post Warns Jimmy Kimmel, Others: 'I Had James Comey Arrested' | Lead Stories",https://leadstories.com/hoax-alert/2026/05/ffact-check-fake-donald-trump-truth-social-post-warns-jimmy-kimmel-others-i-had-james-comey-arrested.html,leadstories.com,"Fact Check: FAKE Donald Trump Truth Social Post Warns Jimmy Kimmel, Others: 'I Had James Comey Arres",0.9,HIGH,True,FALSE - Debunked by fact-checkers,leadstories.com,factcheck,2026-05-04T03:24:16.816608
[DEBUNKED] Fact Check: FAKE Video Shows Queen Camilla Calling Donald Trump An 'Arrogant And Rude Clown' -- It's AI-Generated | Lead Stories,https://leadstories.com/hoax-alert/2026/05/fact-check-fake-video-shows-queen-camilla-calling-donald-trump-an-arrogant-and-rude-clown.html,leadstories.com,Fact Check: FAKE Video Shows Queen Camilla Calling Donald Trump An 'Arrogant And Rude Clown' -- It's,0.9,HIGH,True,FALSE - Debunked by fact-checkers,leadstories.com,factcheck,2026-05-04T03:24:16.962800
[DEBUNKED] Fact Check: WHCD Shooting Suspect Cole Tomas Allen Was NOT On The Payroll Of Top California Democratic Politicians Or The DNC | Lead Stories,https://leadstories.com/hoax-alert/2026/04/fact-check--whcd-shooting-suspect-cole-tomas-allen-not-on-payroll-california-democratic-politicians.html,leadstories.com,Fact Check: WHCD Shooting Suspect Cole Tomas Allen Was NOT On The Payroll Of Top California Democrat,0.9,HIGH,True,FALSE - Debunked by fact-checkers,leadstories.com,factcheck,2026-05-04T03:24:17.119698
[DEBUNKED] Fact Check: Posts Saying Netflix Announced 'Till The End' Series Directed By Joe Berlinger Are NOT Real -- Spam From Vietnam | Lead Stories,https://leadstories.com/hoax-alert/2026/04/fact-check-posts-saying-netflix-announced-till-the-end-series-by-joe-berlinger-not-real.html,leadstories.com,Fact Check: Posts Saying Netflix Announced 'Till The End' Series Directed By Joe Berlinger Are NOT R,0.9,HIGH,True,FALSE - Debunked by fact-checkers,leadstories.com,factcheck,2026-05-04T03:24:17.255425
[DEBUNKED] Fact Check: President Trump Did NOT Visit Secret Service Officer Shot At White House Correspondents' Dinner In Hospital | Lead Stories,https://leadstories.com/hoax-alert/2026/04/fact-check-president-trump-did-not-visit-secret-service-officer-shot-at-white-house-correspondents-dinner-in-hospital.html,leadstories.com,Fact Check: President Trump Did NOT Visit Secret Service Officer Shot At White House Correspondents',0.9,HIGH,True,FALSE - Debunked by fact-checkers,leadstories.com,factcheck,2026-05-04T03:24:17.385383
"[DEBUNKED] Fact Check: FAKE Pictures Show Giorgia Meloni Wearing Palestinian Flag Scarf, Slapping Benjamin Netanyahu -- They're Screenshots From An AI Video | Lead Stories",https://leadstories.com/hoax-alert/2026/04/fact-check-fake-pictures-are-not-real-images-of-meloni-wearing-palestinian-flag-scarf-slapping-netanyahu.html,leadstories.com,"Fact Check: FAKE Pictures Show Giorgia Meloni Wearing Palestinian Flag Scarf, Slapping Benjamin Neta",0.9,HIGH,True,FALSE - Debunked by fact-checkers,leadstories.com,factcheck,2026-05-04T03:24:17.522785
[DEBUNKED] Fact Check: Cole Tomas Allen's Brother Or Family Did NOT Warn Police 48 Hours In Advance Of Shooting At White House Correspondents' Dinner | Lead Stories,https://leadstories.com/hoax-alert/2026/04/fact-check-cole-tomas-allens-brother-or-family-did-not-warn-police-48-hours-in-advance-of-shooting-at-white-house-correspondents-dinner.html,leadstories.com,Fact Check: Cole Tomas Allen's Brother Or Family Did NOT Warn Police 48 Hours In Advance Of Shooting,0.9,HIGH,True,FALSE - Debunked by fact-checkers,leadstories.com,factcheck,2026-05-04T03:24:17.654161
[DEBUNKED] Fact Check: Posts Saying Your Favorite Artists Will Take Over The Stage At 2026 FIFA World Cup Are NOT Real -- Spam From Vietnam | Lead Stories,https://leadstories.com/hoax-alert/2026/04/fact-check-posts-saying-artist-will-take-over-stage-at-fifa-world-cup-not-real.html,leadstories.com,Fact Check: Posts Saying Your Favorite Artists Will Take Over The Stage At 2026 FIFA World Cup Are N,0.9,HIGH,True,FALSE - Debunked by fact-checkers,leadstories.com,factcheck,2026-05-04T03:24:17.792454
"[DEBUNKED] Fact Check: FAKE Video Shows Giorgia Meloni Ignoring, Walking Away From Benjamin Netanyahu At UN | Lead Stories",https://leadstories.com/hoax-alert/2026/04/fact-check-fake-video-shows-giorgia-meloni-ignoring-walking-away-from-benjamin-netanyahu-at-un.html,leadstories.com,"Fact Check: FAKE Video Shows Giorgia Meloni Ignoring, Walking Away From Benjamin Netanyahu At UN | L",0.9,HIGH,True,FALSE - Debunked by fact-checkers,leadstories.com,factcheck,2026-05-04T03:24:17.919243
[DEBUNKED] Fact Check: Seth Rogen Did NOT Die At 44 -- Death Hoax After Fictional Show Death | Lead Stories,https://leadstories.com/hoax-alert/2026/04/fact-check-no-evidence-seth-rogen-died-at-44.html,leadstories.com,Fact Check: Seth Rogen Did NOT Die At 44 -- Death Hoax After Fictional Show Death | Lead Stories,0.9,HIGH,True,FALSE - Debunked by fact-checkers,leadstories.com,factcheck,2026-05-04T03:24:18.889025
"[DEBUNKED] Fact Check: Trump Did NOT Make Social Media Post About 'Nora O'Dumble,' Epstein, Ballroom | Lead Stories",https://leadstories.com/hoax-alert/2026/04/fact-check-trump-did-not-make-social-media-post-about-nora-odumble-epstein-ballroom.html,leadstories.com,"Fact Check: Trump Did NOT Make Social Media Post About 'Nora O'Dumble,' Epstein, Ballroom | Lead Sto",0.9,HIGH,True,FALSE - Debunked by fact-checkers,leadstories.com,factcheck,2026-05-04T03:24:19.009182
"But, as The New York Times later revealed, the book was 78% AI generated",https://www.poynter.org/commentary/2026/book-reviews-criticism-ai-generated-shy-girl-mia-ballard/,www.poynter.org,I gave ‘Shy Girl’ a five-star review before I found out it was AI-generated - Poynter,0.05,LOW,False,,,factcheck,2026-05-04T03:24:19.376711
"“We don&#8217;t always agree 100% with our primary dictionary,” the AP told Pawcatuck",https://www.poynter.org/reporting-editing/2026/ap-style-healthcare-hyphen-change-aces-conference-copy-editing/,www.poynter.org,"Handle with care: AP style drops the hyphen in healthcare, childcare and daycare - Poynter",0.1,LOW,False,,,factcheck,2026-05-04T03:24:19.854166
Bei »Caren Miosga« verteidigte er sich nun in alle Richtungen,https://www.spiegel.de/politik/friedrich-merz-bei-caren-miosga-was-der-kanzler-zu-donald-trump-dem-iran-krieg-und-dem-koalitions-zoff-sagte-a-d12a6527-8c87-4b05-89f4-99ab238c5648#ref=rss,www.spiegel.de,"Friedrich Merz bei Caren Miosga: Was der Kanzler zu Donald Trump, dem Iran-Krieg und dem Koalitions-",0.1,LOW,False,,,mainstream,2026-05-04T03:24:30.241504
"Er verwies zudem darauf, dass es immer noch Zurückweisungen an den Grenzen gebe",https://www.spiegel.de/politik/deutschland/alexander-dobrindt-will-grenzkontrollen-trotz-gesunkener-migrationszahlen-fortsetzen-a-f4a4b3c2-7368-4c53-809a-e0b491bcbe81#ref=rss,www.spiegel.de,Alexander Dobrindt will Grenzkontrollen trotz gesunkener Migrationszahlen fortsetzen - DER SPIEGEL,0.1,LOW,False,,,mainstream,2026-05-04T03:24:31.335454
"»Grenzkontrollen haben immer zu dem gehört, was ich durchaus ja als kritisch gesehen habe«, sagte sie im",https://www.spiegel.de/politik/deutschland/alexander-dobrindt-will-grenzkontrollen-trotz-gesunkener-migrationszahlen-fortsetzen-a-f4a4b3c2-7368-4c53-809a-e0b491bcbe81#ref=rss,www.spiegel.de,Alexander Dobrindt will Grenzkontrollen trotz gesunkener Migrationszahlen fortsetzen - DER SPIEGEL,0.1,LOW,False,,,mainstream,2026-05-04T03:24:31.417817
Sprecher Ted Goodman machte demnach keine Angaben zum Grund oder zur bisherigen Dauer des Krankenhausaufenthalts,https://www.spiegel.de/ausland/rudy-giuliani-ex-anwalt-von-donald-trump-in-kritischem-zustand-im-krankenhaus-a-a25d8a88-0c93-46ec-adb3-3d852a37b272#ref=rss,www.spiegel.de,Rudy Giuliani: Ex-Anwalt von Donald Trump in kritischem Zustand im Krankenhaus - DER SPIEGEL,0.1,LOW,False,,,mainstream,2026-05-04T03:24:32.196907
"Giuliani sei ein »Kämpfer«, der in seinem Leben jeder Herausforderung mit »standhafter Stärke« begegnet sei, schrieb Goodman bei X&nbsp;",https://www.spiegel.de/ausland/rudy-giuliani-ex-anwalt-von-donald-trump-in-kritischem-zustand-im-krankenhaus-a-a25d8a88-0c93-46ec-adb3-3d852a37b272#ref=rss,www.spiegel.de,Rudy Giuliani: Ex-Anwalt von Donald Trump in kritischem Zustand im Krankenhaus - DER SPIEGEL,0,LOW,False,,,mainstream,2026-05-04T03:24:32.272729
"Das Gesamtvolumen des Projekts liegt bei rund 3,6 Milliarden Euro inklusive eines langfristigen Wartungsvertrags",https://www.spiegel.de/wirtschaft/unternehmen/deutsche-bahn-italo-luca-cordero-di-montezemolo-plant-einstieg-ab-2028-a-4397acc5-264f-414f-9f63-57393f9603d9#ref=rss,www.spiegel.de,Deutsche Bahn/Italo: Luca Cordero di Montezemolo plant Einstieg ab 2028 - DER SPIEGEL,0,LOW,False,,,mainstream,2026-05-04T03:24:34.753647
Montezemolo verweist auf die Erfahrungen in Italien: Seit dem Markteintritt von Italo seien die Ticketpreise im Schnitt um etwa 40 Prozent gesunken,https://www.spiegel.de/wirtschaft/unternehmen/deutsche-bahn-italo-luca-cordero-di-montezemolo-plant-einstieg-ab-2028-a-4397acc5-264f-414f-9f63-57393f9603d9#ref=rss,www.spiegel.de,Deutsche Bahn/Italo: Luca Cordero di Montezemolo plant Einstieg ab 2028 - DER SPIEGEL,0,LOW,False,,,mainstream,2026-05-04T03:24:34.834115
"Laut der Weltgesundheitsorganisation (WHO) starben mindestens drei Menschen, ein weiterer Patient wird auf einer Intensivstation in Südafrika behandelt",https://www.spiegel.de/panorama/kreuzfahrtschiff-im-atlantik-ausbruch-von-atemwegserkrankungen-mit-drei-toten-a-35655e5a-3655-480f-bf0d-5d61a6028546#ref=rss,www.spiegel.de,Kreuzfahrtschiff im Atlantik: Ausbruch von Atemwegserkrankungen mit drei Toten - DER SPIEGEL,0,LOW,False,,,mainstream,2026-05-04T03:24:35.576905
Die WHO bestätigte später drei Todesfälle und sprach von einem Patienten in kritischem Zustand,https://www.spiegel.de/panorama/kreuzfahrtschiff-im-atlantik-ausbruch-von-atemwegserkrankungen-mit-drei-toten-a-35655e5a-3655-480f-bf0d-5d61a6028546#ref=rss,www.spiegel.de,Kreuzfahrtschiff im Atlantik: Ausbruch von Atemwegserkrankungen mit drei Toten - DER SPIEGEL,0,LOW,False,,,mainstream,2026-05-04T03:24:35.655515
Laut Medienberichten hat die WHO den Ausbruch als »Ereignis im Bereich der öffentlichen Gesundheit« bezeichnet,https://www.spiegel.de/panorama/kreuzfahrtschiff-im-atlantik-ausbruch-von-atemwegserkrankungen-mit-drei-toten-a-35655e5a-3655-480f-bf0d-5d61a6028546#ref=rss,www.spiegel.de,Kreuzfahrtschiff im Atlantik: Ausbruch von Atemwegserkrankungen mit drei Toten - DER SPIEGEL,0,LOW,False,,,mainstream,2026-05-04T03:24:35.735576
"Dahinter schöpfen die McLaren neue Hoffnung, Max Verstappens Kunst wird immer brotloser",https://www.spiegel.de/sport/formel1/grosser-preis-von-miami-kimi-antonelli-gewinnt-erneut-aber-lando-norris-und-oscar-piastri-kommen-naeher-a-8239bb39-a35f-463d-bdad-dd2b2c4ea6b9#ref=rss,www.spiegel.de,"Großer Preis von Miami: Kimi Antonelli gewinnt erneut, aber Lando Norris und Oscar Piastri kommen nä",0.1,LOW,False,,,mainstream,2026-05-04T03:24:36.405693
"Zum Login SPIEGEL plus Nur für Neukunden € 1,– für 4 Wochen danach € 5,99 pro Woche Freier Zugriff auf alle S+-Artikel auf SPIEGEL",https://www.spiegel.de/sport/formel1/grosser-preis-von-miami-kimi-antonelli-gewinnt-erneut-aber-lando-norris-und-oscar-piastri-kommen-naeher-a-8239bb39-a35f-463d-bdad-dd2b2c4ea6b9#ref=rss,www.spiegel.de,"Großer Preis von Miami: Kimi Antonelli gewinnt erneut, aber Lando Norris und Oscar Piastri kommen nä",0.1,LOW,False,,,mainstream,2026-05-04T03:24:36.491328
"E-Paper (PDF), Digital-Archiv und S+-Newsletter Jederzeit kündigen Jetzt abonnieren SPIEGEL plus 52 Wochen 25 % sparen € 4,49 pro Woche für 52 Wochen danach € 5,99 pro Woche Freier Zugriff auf alle S+-Artikel auf SPIEGEL",https://www.spiegel.de/sport/formel1/grosser-preis-von-miami-kimi-antonelli-gewinnt-erneut-aber-lando-norris-und-oscar-piastri-kommen-naeher-a-8239bb39-a35f-463d-bdad-dd2b2c4ea6b9#ref=rss,www.spiegel.de,"Großer Preis von Miami: Kimi Antonelli gewinnt erneut, aber Lando Norris und Oscar Piastri kommen nä",0.1,LOW,False,,,mainstream,2026-05-04T03:24:36.574768
"Zum Login SPIEGEL plus Nur für Neukunden € 1,– für 4 Wochen danach € 5,99 pro Woche Freier Zugriff auf alle S+-Artikel auf SPIEGEL",https://www.spiegel.de/ausland/zohran-mamdani-100-tage-war-der-buergermeister-von-new-york-ruhig-damit-ist-jetzt-schluss-a-dbceaa99-b687-4b4c-8741-7c240ac96d7b#ref=rss,www.spiegel.de,Zohran Mamdani: 100 Tage war der Bürgermeister von New York ruhig - damit ist jetzt Schluss - DER SP,0.1,LOW,False,,,mainstream,2026-05-04T03:24:37.243892
"E-Paper (PDF), Digital-Archiv und S+-Newsletter Jederzeit kündigen Jetzt abonnieren SPIEGEL plus 52 Wochen 25 % sparen € 4,49 pro Woche für 52 Wochen danach € 5,99 pro Woche Freier Zugriff auf alle S+-Artikel auf SPIEGEL",https://www.spiegel.de/ausland/zohran-mamdani-100-tage-war-der-buergermeister-von-new-york-ruhig-damit-ist-jetzt-schluss-a-dbceaa99-b687-4b4c-8741-7c240ac96d7b#ref=rss,www.spiegel.de,Zohran Mamdani: 100 Tage war der Bürgermeister von New York ruhig - damit ist jetzt Schluss - DER SP,0.1,LOW,False,,,mainstream,2026-05-04T03:24:37.324328
"Laut den marokkanischen Streitkräften ereignete sich der Vorfall am Samstagabend gegen 21 Uhr in der Nähe des Trainingsgeländes Cap Draa, unweit der Atlantikküste",https://www.spiegel.de/ausland/marokko-suche-nach-zwei-vermissten-us-soldaten-im-kuestengebiet-a-9af1127f-8bde-4104-83fe-5b654b0e49ee#ref=rss,www.spiegel.de,Marokko: Suche nach zwei vermissten US-Soldaten im Küstengebiet - DER SPIEGEL,0,LOW,False,,,mainstream,2026-05-04T03:24:37.996678
"Zum Login SPIEGEL plus Nur für Neukunden € 1,– für 4 Wochen danach € 5,99 pro Woche Freier Zugriff auf alle S+-Artikel auf SPIEGEL",https://www.spiegel.de/stil/watches-and-wonders-bertrand-meylan-von-moser-cie-ueber-luxusuhren-rolex-und-humor-a-1715aa5a-69cb-480f-8c79-b0cea9d09b6d#ref=rss,www.spiegel.de,"Watches and Wonders: Bertrand Meylan von Moser & Cie. über Luxusuhren, Rolex und Humor - DER SPIEGEL",0.1,LOW,False,,,mainstream,2026-05-04T03:24:38.753178
"E-Paper (PDF), Digital-Archiv und S+-Newsletter Jederzeit kündigen Jetzt abonnieren SPIEGEL plus 52 Wochen 25 % sparen € 4,49 pro Woche für 52 Wochen danach € 5,99 pro Woche Freier Zugriff auf alle S+-Artikel auf SPIEGEL",https://www.spiegel.de/stil/watches-and-wonders-bertrand-meylan-von-moser-cie-ueber-luxusuhren-rolex-und-humor-a-1715aa5a-69cb-480f-8c79-b0cea9d09b6d#ref=rss,www.spiegel.de,"Watches and Wonders: Bertrand Meylan von Moser & Cie. über Luxusuhren, Rolex und Humor - DER SPIEGEL",0.1,LOW,False,,,mainstream,2026-05-04T03:24:38.846287
"Er stellte Miosga gegenüber aber auch klar, dass er keine andere Mehrheit suche",https://www.spiegel.de/kultur/tv/friedrich-merz-bei-caren-miosga-kanzler-verteidigt-kurs-zu-trump-und-iran-konflikt-a-934b7653-323b-4a61-8942-8cb8a5363a46#ref=rss,www.spiegel.de,Friedrich Merz bei Caren Miosga: Kanzler verteidigt Kurs zu Trump und Iran-Konflikt - DER SPIEGEL,0.1,LOW,False,,,mainstream,2026-05-04T03:24:39.508730
About 20% of the world&#x27;s oil and liquefied natural gas (LNG) usually passes through the strait and the conflict has sent global energy prices soaring,https://www.bbc.com/news/articles/c775jevkyv2o?at_medium=RSS&amp;at_campaign=rss,www.bbc.com,Trump says US to &#x27;guide&#x27; stranded ships through Strait of Hormuz,0,LOW,False,,,mainstream,2026-05-04T03:24:41.610334
And it was simultaneously the first time since 1832 that the Conservatives had won less than 30% at a general election,https://www.bbc.com/news/articles/c202wg747qpo?at_medium=RSS&amp;at_campaign=rss,www.bbc.com,Chris Mason: Elections this week a smorgasbord of competitiveness,0,LOW,False,,,mainstream,2026-05-04T03:24:41.754674
"As a result, under normal circumstances it is a major exporter, accounting for about 20% of the fuel traded on international markets each day",https://www.bbc.com/news/articles/c86d9v28qxxo?at_medium=RSS&amp;at_campaign=rss,www.bbc.com,The threat to summer holidays looming with jet fuel shortages,0,LOW,False,,,mainstream,2026-05-04T03:24:41.908705
"By early April, it had touched $1838 – an increase of more than 120%",https://www.bbc.com/news/articles/c86d9v28qxxo?at_medium=RSS&amp;at_campaign=rss,www.bbc.com,The threat to summer holidays looming with jet fuel shortages,0,LOW,False,,,mainstream,2026-05-04T03:24:41.990117
"&quot;The UK is particularly dependent on imports, which make up 65% of what we need",https://www.bbc.com/news/articles/c86d9v28qxxo?at_medium=RSS&amp;at_campaign=rss,www.bbc.com,The threat to summer holidays looming with jet fuel shortages,0,LOW,False,,,mainstream,2026-05-04T03:24:42.069135
"1% of ad spend, compared with roughly 4% for fossil related products",https://www.bbc.com/news/articles/c9wejdekpwyo?at_medium=RSS&amp;at_campaign=rss,www.bbc.com,Amsterdam bans public adverts for meat and fossil fuels,0,LOW,False,,,mainstream,2026-05-04T03:24:42.605168
Shares in eBay jumped by more than 13% in after-hours trading when news of the potential offer emerged on Friday,https://www.bbc.com/news/articles/cn0p8yled1do?at_medium=RSS&amp;at_campaign=rss,www.bbc.com,GameStop makes $55.5bn takeover offer for eBay,0,LOW,False,,,mainstream,2026-05-04T03:24:42.753318
"On Monday, more than 30 European leaders and Canada&#x27;s prime minister will take part in a European Political Community (EPC) summit in the capital Yerevan",https://www.bbc.com/news/articles/cgkp1124y3yo?at_medium=RSS&amp;at_campaign=rss,www.bbc.com,European leaders converge on Armenia as Russia looks on,0,LOW,False,,,mainstream,2026-05-04T03:24:42.891911
"If respiratory symptoms develop, the mortality rate is approximately 38%, according to the CDC",https://www.bbc.com/news/articles/c8r8j1l6j0go?at_medium=RSS&amp;at_campaign=rss,www.bbc.com,Hantavirus: What we know about the Atlantic cruise ship outbreak,0,LOW,False,,,mainstream,2026-05-04T03:24:43.103762
