claim,source_url,source_domain,article_title,risk_score,risk_category,has_factcheck,factcheck_rating,factcheck_source,source_type,checked_at
"Zum Login SPIEGEL plus Nur für Neukunden € 1,– für 4 Wochen danach € 5,99 pro Woche Freier Zugriff auf alle S+-Artikel auf SPIEGEL",https://www.spiegel.de/gesundheit/diagnose/ein-raetselhafter-patient-warum-ist-er-so-muede-a-2318aaf2-4b56-49da-aefd-389fdc75cb5a#ref=rss,www.spiegel.de,Ein rätselhafter Patient: Warum ist er so müde? - DER SPIEGEL,0.1,LOW,False,,,mainstream,2026-06-30T09:40:03.789056
"E-Paper (PDF), Digital-Archiv und S+-Newsletter Jederzeit kündigen Jetzt abonnieren SPIEGEL plus 52 Wochen 25 % sparen € 4,49 pro Woche für 52 Wochen danach € 5,99 pro Woche Freier Zugriff auf alle S+-Artikel auf SPIEGEL",https://www.spiegel.de/gesundheit/diagnose/ein-raetselhafter-patient-warum-ist-er-so-muede-a-2318aaf2-4b56-49da-aefd-389fdc75cb5a#ref=rss,www.spiegel.de,Ein rätselhafter Patient: Warum ist er so müde? - DER SPIEGEL,0.1,LOW,False,,,mainstream,2026-06-30T09:40:03.866261
Viele Menschen mit kleinen Einkommen zahlten jedoch gar keine oder nur wenige Steuern,https://www.spiegel.de/politik/deutschland/cdu-politiker-sebastian-lechner-raet-zu-verschiebung-der-steuerreform-auf-naechstes-jahr-a-84ff9f10-fff6-49fa-8d59-1aaad76adf73#ref=rss,www.spiegel.de,Sebastian Lechner: CDU-Politiker rät zu Verschiebung der Steuerreform auf nächstes Jahr - DER SPIEGE,0.1,LOW,False,,,mainstream,2026-06-30T09:40:05.602278
Mehr zum Thema Vorschlag für Reform: Unionspolitiker wollen alle Einkommensgruppen steuerlich entlasten Nina Warken und die Gesundheitsreform: Alle sind sauer auf sie,https://www.spiegel.de/politik/deutschland/cdu-politiker-sebastian-lechner-raet-zu-verschiebung-der-steuerreform-auf-naechstes-jahr-a-84ff9f10-fff6-49fa-8d59-1aaad76adf73#ref=rss,www.spiegel.de,Sebastian Lechner: CDU-Politiker rät zu Verschiebung der Steuerreform auf nächstes Jahr - DER SPIEGE,0.1,LOW,False,,,mainstream,2026-06-30T09:40:05.684207
"Also wir waren auf jeden Fall alle, glaube ich, total dabei",https://www.spiegel.de/sport/wm-aus-fuer-nationalmannschaft-reaktion-der-fans-meine-stimmung-ist-kaputt-a-8d331dfe-b5d5-4f8a-b40a-d843bda98e03#ref=rss,www.spiegel.de,WM 2026: Reaktion zum Aus der DFB-Auswahl: »Meine Stimmung ist kaputt« - DER SPIEGEL,0.1,LOW,False,,,mainstream,2026-06-30T09:40:06.318818
Die eigentliche Funktion soll im Laufe des Jahres schrittweise für alle Nutzer freigeschaltet werden,https://www.spiegel.de/netzwelt/apps/whatsapp-so-funktioniert-die-kommunikation-ueber-benutzernamen-a-8ce310d4-fb14-47b9-85f3-115e783e8955#ref=rss,www.spiegel.de,WhatsApp: So funktioniert die Kommunikation über Benutzernamen - DER SPIEGEL,0.1,LOW,False,,,mainstream,2026-06-30T09:40:06.927238
Sie ist für alle Chatpartner sichtbar,https://www.spiegel.de/netzwelt/apps/whatsapp-so-funktioniert-die-kommunikation-ueber-benutzernamen-a-8ce310d4-fb14-47b9-85f3-115e783e8955#ref=rss,www.spiegel.de,WhatsApp: So funktioniert die Kommunikation über Benutzernamen - DER SPIEGEL,0.1,LOW,False,,,mainstream,2026-06-30T09:40:07.008264
Andere Nutzungen verletzen das Urheberrecht Trotzdem keine Trendwende Zahl der Arbeitslosen sinkt im Juni leicht Am Ende des ersten Halbjahres sind in Deutschland weniger als drei Millionen Menschen arbeitslos – aber mehr als im vergangenen Jahr,https://www.spiegel.de/wirtschaft/soziales/arbeitsmarkt-zahl-der-arbeitslosen-sinkt-im-juni-leicht-a-51c5f55c-c56a-4f6c-8f4e-ff8453178108#ref=rss,www.spiegel.de,Arbeitsmarkt: Zahl der Arbeitslosen sinkt im Juni leicht - DER SPIEGEL,0.1,LOW,False,,,mainstream,2026-06-30T09:40:07.647007
"000 auf 2,936 Millionen zurück, teilte die Bundesagentur ‌für Arbeit (BA) mit",https://www.spiegel.de/wirtschaft/soziales/arbeitsmarkt-zahl-der-arbeitslosen-sinkt-im-juni-leicht-a-51c5f55c-c56a-4f6c-8f4e-ff8453178108#ref=rss,www.spiegel.de,Arbeitsmarkt: Zahl der Arbeitslosen sinkt im Juni leicht - DER SPIEGEL,0,LOW,False,,,mainstream,2026-06-30T09:40:07.728623
"Die Arbeitslosenquote sank um 0,1 Prozentpunkte auf 6,2 Prozent",https://www.spiegel.de/wirtschaft/soziales/arbeitsmarkt-zahl-der-arbeitslosen-sinkt-im-juni-leicht-a-51c5f55c-c56a-4f6c-8f4e-ff8453178108#ref=rss,www.spiegel.de,Arbeitsmarkt: Zahl der Arbeitslosen sinkt im Juni leicht - DER SPIEGEL,0,LOW,False,,,mainstream,2026-06-30T09:40:07.807150
"Jolie fuhr fort: »Deshalb rede ich mir irgendwie ein, dass dieser Aspekt meines Lebens keine zentrale Rolle spielt, wenn ich mich auf meine Kinder und meine Familie konzentriere",https://www.spiegel.de/kultur/kino/angelina-jolie-seit-zehn-jahren-kein-date-jetzt-will-sie-wieder-frei-sein-a-9fd86e3f-c2b3-4e1c-96f6-baf0bad7a744#ref=rss,www.spiegel.de,Angelina Jolie: Hollywood-Star hatte seit Scheidung von Brad Pitt kein Date - DER SPIEGEL,0.1,LOW,False,,,mainstream,2026-06-30T09:40:08.444940
"Zum Login SPIEGEL plus Nur für Neukunden € 1,– für 4 Wochen danach € 5,99 pro Woche Freier Zugriff auf alle S+-Artikel auf SPIEGEL",https://www.spiegel.de/sport/fussball/fussball-wm-2026-deutschland-scheitert-das-foxborough-fiasko-a-30fae64b-400e-4597-8bdc-35a6f127ab87#ref=rss,www.spiegel.de,Fußball-WM 2026: Deutschland scheitert – das Foxborough-Fiasko - DER SPIEGEL,0.1,LOW,False,,,mainstream,2026-06-30T09:40:09.136705
"E-Paper (PDF), Digital-Archiv und S+-Newsletter Jederzeit kündigen Jetzt abonnieren SPIEGEL plus 52 Wochen 25 % sparen € 4,49 pro Woche für 52 Wochen danach € 5,99 pro Woche Freier Zugriff auf alle S+-Artikel auf SPIEGEL",https://www.spiegel.de/sport/fussball/fussball-wm-2026-deutschland-scheitert-das-foxborough-fiasko-a-30fae64b-400e-4597-8bdc-35a6f127ab87#ref=rss,www.spiegel.de,Fußball-WM 2026: Deutschland scheitert – das Foxborough-Fiasko - DER SPIEGEL,0.1,LOW,False,,,mainstream,2026-06-30T09:40:09.214869
The child was one of 23 at Outwood Grange Academy in Wakefield who spent more than 20% of their days in the booths in one of the past two academic years,https://www.bbc.co.uk/news/articles/c5yzlnp6p52o?at_medium=RSS&amp;at_campaign=rss,www.bbc.co.uk,"Pupil put in isolation booth for more than half a school year, BBC learns - BBC News",0,LOW,False,,,mainstream,2026-06-30T09:40:09.641200
An analysis by education consultants The Key Group found 18% of students at hundreds of secondary schools using the practice were isolated at least once during the academic year,https://www.bbc.co.uk/news/articles/c5yzlnp6p52o?at_medium=RSS&amp;at_campaign=rss,www.bbc.co.uk,"Pupil put in isolation booth for more than half a school year, BBC learns - BBC News",0,LOW,False,,,mainstream,2026-06-30T09:40:09.721683
"Agreed sales were 7% below last year, Zoopla said, but the picture varied across the country with sales down 12% in Wales and 11% in the East Midlands",https://www.bbc.co.uk/news/articles/cdr4env2v14o?at_medium=RSS&amp;at_campaign=rss,www.bbc.co.uk,Homes harder to sell as high mortgage rates frustrate buyers - BBC News,0,LOW,False,,,mainstream,2026-06-30T09:40:09.958389
83% at the start of March to a peak of 5,https://www.bbc.co.uk/news/articles/cdr4env2v14o?at_medium=RSS&amp;at_campaign=rss,www.bbc.co.uk,Homes harder to sell as high mortgage rates frustrate buyers - BBC News,0,LOW,False,,,mainstream,2026-06-30T09:40:10.036739
"90% on 12 April, according to the financial information service Moneyfacts",https://www.bbc.co.uk/news/articles/cdr4env2v14o?at_medium=RSS&amp;at_campaign=rss,www.bbc.co.uk,Homes harder to sell as high mortgage rates frustrate buyers - BBC News,0,LOW,False,,,mainstream,2026-06-30T09:40:10.116918
"But at least Germany had the safety net of penalties, and could fall back on a perfect 100% World Cup shootout record of played four, won four",https://www.bbc.co.uk/sport/football/articles/c992kzk00kzo?at_medium=RSS&amp;at_campaign=rss,www.bbc.co.uk,World Cup 2026: Julian Nagelsmann faces pressure as Germany bow out - BBC Sport,0.1,LOW,False,,,mainstream,2026-06-30T09:40:10.443242
