claim,source_url,source_domain,article_title,risk_score,risk_category,has_factcheck,factcheck_rating,factcheck_source,source_type,checked_at
[DEBUNKED] Harry Kane didn’t refuse to wear a rainbow symbol in matches – Full Fact,https://fullfact.org/sport/harry-kane-lgbt-refused-to-wear-symbol-fake-quote/,fullfact.org,Harry Kane didn’t refuse to wear a rainbow symbol in matches – Full Fact,0.9,HIGH,True,FALSE - Debunked by fact-checkers,fullfact.org,factcheck,2026-07-14T02:35:54.394831
[DEBUNKED] HAARP can’t cause heatwaves – Full Fact,https://fullfact.org/environment/haarp-heatwave-false-claims/,fullfact.org,HAARP can’t cause heatwaves – Full Fact,0.9,HIGH,True,FALSE - Debunked by fact-checkers,fullfact.org,factcheck,2026-07-14T02:35:55.030005
[DEBUNKED] Convicted child murderer Jamie Varley hasn’t been stabbed in prison – Full Fact,https://fullfact.org/crime/jamie-varley-prison-stabbed-false-claim/,fullfact.org,Convicted child murderer Jamie Varley hasn’t been stabbed in prison – Full Fact,0.9,HIGH,True,FALSE - Debunked by fact-checkers,fullfact.org,factcheck,2026-07-14T02:35:56.774909
[DEBUNKED] Twin Venezuelan earthquakes not caused by HAARP – Full Fact,https://fullfact.org/environment/venezuela-earthquake-haarp-false/,fullfact.org,Twin Venezuelan earthquakes not caused by HAARP – Full Fact,0.9,HIGH,True,FALSE - Debunked by fact-checkers,fullfact.org,factcheck,2026-07-14T02:35:59.701905
[DEBUNKED] FactCheck.org Wins Sigma Delta Chi Award for Fact-Checking - FactCheck.org,https://www.factcheck.org/2026/07/factcheck-org-wins-sigma-delta-chi-award-for-fact-checking/,www.factcheck.org,FactCheck.org Wins Sigma Delta Chi Award for Fact-Checking - FactCheck.org,0.9,HIGH,True,FALSE - Debunked by fact-checkers,www.factcheck.org,factcheck,2026-07-14T02:36:01.316187
[DEBUNKED] Alaska Senate Race Ads Mislead on Peltola&#039;s Votes on Military Pay Raise - FactCheck.org,https://www.factcheck.org/2026/07/alaska-senate-race-ads-mislead-on-peltolas-votes-on-military-pay-raise/,www.factcheck.org,Alaska Senate Race Ads Mislead on Peltola&#039;s Votes on Military Pay Raise - FactCheck.org,0.9,HIGH,True,FALSE - Debunked by fact-checkers,www.factcheck.org,factcheck,2026-07-14T02:36:01.377749
[DEBUNKED] Democratic Group Makes False Claim in Insider-Trading Ad Attacking Susan Collins - FactCheck.org,https://www.factcheck.org/2026/07/democratic-group-makes-false-claim-in-insider-trading-ad-attacking-susan-collins/,www.factcheck.org,Democratic Group Makes False Claim in Insider-Trading Ad Attacking Susan Collins - FactCheck.org,0.9,HIGH,True,FALSE - Debunked by fact-checkers,www.factcheck.org,factcheck,2026-07-14T02:36:01.771168
[DEBUNKED] How Trump&#039;s Preliminary Deal with Iran Compares with His Rhetoric - FactCheck.org,https://www.factcheck.org/2026/06/how-trumps-preliminary-deal-with-iran-compares-with-his-rhetoric/,www.factcheck.org,How Trump&#039;s Preliminary Deal with Iran Compares with His Rhetoric - FactCheck.org,0.9,HIGH,True,FALSE - Debunked by fact-checkers,www.factcheck.org,factcheck,2026-07-14T02:36:03.431282
[DEBUNKED] Fact Check: NO EVIDENCE Russia Hit Skyfall Facility Visited By Lindsey Graham | Lead Stories,https://leadstories.com/hoax-alert/2026/07/fact-check-no-evidence-russia-hit-skyfall-facility-visited-by-lindsey-graham.html,leadstories.com,Fact Check: NO EVIDENCE Russia Hit Skyfall Facility Visited By Lindsey Graham | Lead Stories,0.9,HIGH,True,FALSE - Debunked by fact-checkers,leadstories.com,factcheck,2026-07-14T02:36:03.679214
[DEBUNKED] Fact Check: FAKE Video Of Man Catching Wife 'In The Act' Kissing Another Man -- It's Skit With Actors | Lead Stories,https://leadstories.com/hoax-alert/2026/07/fact-check-fake-video-of-man-catching-wife-in-the-act-kissing-another-man-its-skit-with-actors.html,leadstories.com,Fact Check: FAKE Video Of Man Catching Wife 'In The Act' Kissing Another Man -- It's Skit With Actor,0.9,HIGH,True,FALSE - Debunked by fact-checkers,leadstories.com,factcheck,2026-07-14T02:36:03.874838
"[DEBUNKED] Fact Check: Police Did NOT Decide Against Releasing CCTV Footage Of M.P. Ann Widdecombe Murder Suspect To Hide His Race, Ethnicity | Lead Stories",https://leadstories.com/hoax-alert/2026/07/fact-check-police-did-not-decide-against-releasing-cctv-footage-of-mp-ann-widdecombe-murder-suspect-to-hide-his-race-ethnicity.html,leadstories.com,Fact Check: Police Did NOT Decide Against Releasing CCTV Footage Of M.P. Ann Widdecombe Murder Suspe,0.9,HIGH,True,FALSE - Debunked by fact-checkers,leadstories.com,factcheck,2026-07-14T02:36:04.070094
[DEBUNKED] Fact Check: FAKE Garbled Newspaper Text Does NOT Appear In Mitch McConnell's Proof Of Life Photo | Lead Stories,https://leadstories.com/hoax-alert/2026/07/fact-check-fake-garbled-newspaper-text-does-not-appear-in-mitch-mcconnells-proof-of-life-photo.html,leadstories.com,Fact Check: FAKE Garbled Newspaper Text Does NOT Appear In Mitch McConnell's Proof Of Life Photo | L,0.9,HIGH,True,FALSE - Debunked by fact-checkers,leadstories.com,factcheck,2026-07-14T02:36:04.257436
[DEBUNKED] Fact Check: Mitch McConnell Photo Released In July 2026 Has NOT Been Publicly Available Since 2023 | Lead Stories,https://leadstories.com/hoax-alert/2026/07/fact-check-mitch-mcconnell-photo-released-in-july-2026-has-not-been-publicly-available-since-2023.html,leadstories.com,Fact Check: Mitch McConnell Photo Released In July 2026 Has NOT Been Publicly Available Since 2023 |,0.9,HIGH,True,FALSE - Debunked by fact-checkers,leadstories.com,factcheck,2026-07-14T02:36:04.427240
[DEBUNKED] Warning: Google Gemini SynthID AI Watermark Detector Appears To Mix Up Results In Same Chat -- Consistently Shows False Positives And Negatives Under Certain Conditions | Lead Stories,https://leadstories.com/analysis/2026/07/google-gemini-synthid-detector-confuses-results-within-same-chat.html,leadstories.com,Warning: Google Gemini SynthID AI Watermark Detector Appears To Mix Up Results In Same Chat -- Consi,0.9,HIGH,True,FALSE - Debunked by fact-checkers,leadstories.com,factcheck,2026-07-14T02:36:04.620870
[DEBUNKED] Fact Check: UNSOURCED Wikipedia Page Does NOT Prove Egypt-Argentina Match Referee Francois Letexier Grew Up In 'Orthodox Jewish Family' | Lead Stories,https://leadstories.com/hoax-alert/2026/07/fact-check-unsourced-wikipedia-page-does-not-prove-egypt-argentina-match-referee-francois-letexier-grew-up-in-orthodox-jewish-family.html,leadstories.com,Fact Check: UNSOURCED Wikipedia Page Does NOT Prove Egypt-Argentina Match Referee Francois Letexier ,0.9,HIGH,True,FALSE - Debunked by fact-checkers,leadstories.com,factcheck,2026-07-14T02:36:04.813109
[DEBUNKED] Fact Check: Image Does NOT Show FIFA President Infantino Making Phone Call During Egypt-Argentina Match -- He Was At A Different Game | Lead Stories,https://leadstories.com/hoax-alert/2026/07/fact-check-video-does-not-show-fifa-president-infantino-making-phone-call-during-egypt-argentina-match.html,leadstories.com,Fact Check: Image Does NOT Show FIFA President Infantino Making Phone Call During Egypt-Argentina Ma,0.9,HIGH,True,FALSE - Debunked by fact-checkers,leadstories.com,factcheck,2026-07-14T02:36:04.981214
[DEBUNKED] Fact Check: FAKE France 24 Video Does NOT Accurately Summarize UPA-Related Monument Legislation | Lead Stories,https://leadstories.com/hoax-alert/2026/07/fact-check-fake-france-24-video-does-not-accurately-summarize-upa-related-monument-legislation.html,leadstories.com,Fact Check: FAKE France 24 Video Does NOT Accurately Summarize UPA-Related Monument Legislation | Le,0.9,HIGH,True,FALSE - Debunked by fact-checkers,leadstories.com,factcheck,2026-07-14T02:36:05.164859
[DEBUNKED] Fact Check: REAL Email In Epstein Files Contains Joke About Mitt Romney's Wife And Barack Obama | Lead Stories,https://leadstories.com/hoax-alert/2026/07/fact-check-real-email-in-epstein-files-contains-joke-about-mitt-romneys-wife-and-barack-obama.html,leadstories.com,Fact Check: REAL Email In Epstein Files Contains Joke About Mitt Romney's Wife And Barack Obama | Le,0.9,HIGH,True,FALSE - Debunked by fact-checkers,leadstories.com,factcheck,2026-07-14T02:36:05.344894
[DEBUNKED] Fact Check: Image Trump Posted as 'Retribution' Against Iran Does NOT Show July 2026 U.S. Bombing -- It Is June 2025 Israeli Attack | Lead Stories,https://leadstories.com/hoax-alert/2026/07/fact-check-image-trump-posted-as-retribution-against-iran-does-not-show-july-2026-us-bombing-its-june-2025-israeli-attack.html,leadstories.com,Fact Check: Image Trump Posted as 'Retribution' Against Iran Does NOT Show July 2026 U.S. Bombing --,0.9,HIGH,True,FALSE - Debunked by fact-checkers,leadstories.com,factcheck,2026-07-14T02:36:05.517238
[DEBUNKED] Prebunk: London Calling To Stop Falling For Fake UK Protest Videos -- AI Is Leading You Down The River Thames | Lead Stories,https://leadstories.com/hoax-alert/2026/07/prebunk-london-calling-to-stop-falling-for-fake-uk-protest-videos-ai-is-leading-you-down-the-river-thames.html,leadstories.com,Prebunk: London Calling To Stop Falling For Fake UK Protest Videos -- AI Is Leading You Down The Riv,0.9,HIGH,True,FALSE - Debunked by fact-checkers,leadstories.com,factcheck,2026-07-14T02:36:05.685860
[DEBUNKED] Fact Check: Video Does NOT Show FIFA's Infantino Reaction To Egypt Scoring Goal During World Cup In July 2026  | Lead Stories,https://leadstories.com/hoax-alert/2026/07/fact-check-video-does-not-show-fifas-infantino-reaction-to-egypt-scoring-goal-during-world-cup-in-july-2026.html,leadstories.com,Fact Check: Video Does NOT Show FIFA's Infantino Reaction To Egypt Scoring Goal During World Cup In ,0.9,HIGH,True,FALSE - Debunked by fact-checkers,leadstories.com,factcheck,2026-07-14T02:36:05.873772
[DEBUNKED] Fact Check: Image Does NOT Show FIFA President Infantino Looking Anxious After Messi Missed Penalty Against Egypt -- Predates The Match | Lead Stories,https://leadstories.com/hoax-alert/2026/07/fact-check-image-does-not-show-fifa-president-infantino-looking-anxious-after-messi-missed-penalty-against-egypt-it-was-from-another-match.html,leadstories.com,Fact Check: Image Does NOT Show FIFA President Infantino Looking Anxious After Messi Missed Penalty ,0.9,HIGH,True,FALSE - Debunked by fact-checkers,leadstories.com,factcheck,2026-07-14T02:36:06.057046
[DEBUNKED] Fact Check: FAKE Video Of PM Giorgia Meloni Saying She Is A Christian Daughter Of Italy Who Will Not Allow Sharia Law In Her Country | Lead Stories,https://leadstories.com/hoax-alert/2026/07/fact-check-fake-video-of-pm-giorgia-meloni-describing-herself-as-christian-daughter-of-italy-who-will-not-allow-implementation-of-sharia-law.html,leadstories.com,Fact Check: FAKE Video Of PM Giorgia Meloni Saying She Is A Christian Daughter Of Italy Who Will Not,0.9,HIGH,True,FALSE - Debunked by fact-checkers,leadstories.com,factcheck,2026-07-14T02:36:06.233469
"[DEBUNKED] No, Kenya’s Higher Education Loans Board did not announce opening date for loan applications for medical training college students - Africa Check",https://africacheck.org/fact-checks/meta-programme-fact-checks/no-kenyas-higher-education-loans-board-did-not-announce,africacheck.org,"No, Kenya’s Higher Education Loans Board did not announce opening date for loan applications for med",0.9,HIGH,True,FALSE - Debunked by fact-checkers,africacheck.org,factcheck,2026-07-14T02:36:06.454215
"[DEBUNKED] Video of looting in mall is not from 2026 anti-migration protests in Durban, South Africa – originates from 2021 unrest - Africa Check",https://africacheck.org/fact-checks/meta-programme-fact-checks/video-looting-mall-not-2026-anti-migration-protests-durban,africacheck.org,"Video of looting in mall is not from 2026 anti-migration protests in Durban, South Africa – originat",0.9,HIGH,True,FALSE - Debunked by fact-checkers,africacheck.org,factcheck,2026-07-14T02:36:07.304803
"[DEBUNKED] No, former Kenyan president Kenyatta hasn’t endorsed opposition politician Edwin Sifuna for the presidency – quote is fabricated - Africa Check",https://africacheck.org/fact-checks/meta-programme-fact-checks/no-former-kenyan-president-kenyatta-hasnt-endorsed,africacheck.org,"No, former Kenyan president Kenyatta hasn’t endorsed opposition politician Edwin Sifuna for the pres",0.9,HIGH,True,FALSE - Debunked by fact-checkers,africacheck.org,factcheck,2026-07-14T02:36:07.504974
[DEBUNKED] No evidence Kenya’s interior minister Kipchumba Murkomen said government would ‘incorporate goons’ into National Police Service - Africa Check,https://africacheck.org/fact-checks/meta-programme-fact-checks/no-evidence-kenyas-interior-minister-kipchumba-murkomen-said,africacheck.org,No evidence Kenya’s interior minister Kipchumba Murkomen said government would ‘incorporate goons’ i,0.9,HIGH,True,FALSE - Debunked by fact-checkers,africacheck.org,factcheck,2026-07-14T02:36:07.721949
[DEBUNKED] AI-generated video circulated as proof of Nigerian army intercepting vehicle carrying casket filled with rifles and ammunition - Africa Check,https://africacheck.org/fact-checks/meta-programme-fact-checks/ai-generated-video-circulated-proof-nigerian-army,africacheck.org,AI-generated video circulated as proof of Nigerian army intercepting vehicle carrying casket filled ,0.9,HIGH,True,FALSE - Debunked by fact-checkers,africacheck.org,factcheck,2026-07-14T02:36:07.946371
[DEBUNKED] Fabricated graphics falsely quote Kenyan lawmaker Caleb Amisi as questioning opposition politician’s ability to defeat Ruto in 2027 - Africa Check,https://africacheck.org/fact-checks/meta-programme-fact-checks/fabricated-graphics-falsely-quote-kenyan-lawmaker-caleb,africacheck.org,Fabricated graphics falsely quote Kenyan lawmaker Caleb Amisi as questioning opposition politician’s,0.9,HIGH,True,FALSE - Debunked by fact-checkers,africacheck.org,factcheck,2026-07-14T02:36:08.147929
[DEBUNKED] Viral video does not show Nigeria’s Ogun state deputy governor and commissioners prostrating before governor - Africa Check,https://africacheck.org/fact-checks/meta-programme-fact-checks/viral-video-does-not-show-nigerias-ogun-state-deputy,africacheck.org,Viral video does not show Nigeria’s Ogun state deputy governor and commissioners prostrating before ,0.9,HIGH,True,FALSE - Debunked by fact-checkers,africacheck.org,factcheck,2026-07-14T02:36:08.370769
[DEBUNKED] Ignore fraudulent Teachers Service Commission job ad on Facebook in Kenya - Africa Check,https://africacheck.org/fact-checks/meta-programme-fact-checks/ignore-fraudulent-teachers-service-commission-job-ad,africacheck.org,Ignore fraudulent Teachers Service Commission job ad on Facebook in Kenya - Africa Check,0.9,HIGH,True,FALSE - Debunked by fact-checkers,africacheck.org,factcheck,2026-07-14T02:36:08.564624
[DEBUNKED] SCAM ALERT: South Africa’s department of health is not offering “cleaner jobs” through unverified links on Facebook - Africa Check,https://africacheck.org/fact-checks/meta-programme-fact-checks/scam-alert-south-africas-department-health-not-offering,africacheck.org,SCAM ALERT: South Africa’s department of health is not offering “cleaner jobs” through unverified li,0.9,HIGH,True,FALSE - Debunked by fact-checkers,africacheck.org,factcheck,2026-07-14T02:36:08.795093
US-Präsident Trump hat inzwischen den Kongress offiziell über die Wiederaufnahme des Irankriegs informiert,https://www.spiegel.de/ausland/us-armee-greift-erneut-iran-an-emirate-melden-attacken-auf-oeltanker-a-1bcfa99b-9d17-4bd6-9fad-0de401f18f9e#ref=rss,www.spiegel.de,US-Armee greift erneut Iran an – Emirate melden Attacken auf Öltanker - DER SPIEGEL,0,LOW,False,,,mainstream,2026-07-14T02:36:22.443768
"Die »Washington Post« schrieb, dass sie keine politische Vergangenheit vorweise und dass über ihre eigenen politischen Ansichten öffentlich nur wenig bekannt sei",https://www.spiegel.de/ausland/lindsey-graham-schwester-soll-nach-donald-trumps-vorschlag-uebergangssenatorin-werden-a-ae10abf4-16c4-4d8f-8f0b-6f3154720c49#ref=rss,www.spiegel.de,Lindsey Graham: Schwester soll nach Donald Trumps Vorschlag Übergangssenatorin werden - DER SPIEGEL,0.1,LOW,False,,,mainstream,2026-07-14T02:36:24.608397
"Dabei präzisierte er aber nicht, welche Länder der multinationalen Truppe im Einzelnen angehören werden – dazu hatte es bislang keine Einigung und öffentliche Ankündigung der Koalition der Willigen gegeben",https://www.spiegel.de/ausland/emmanuel-macron-ueberrascht-mit-ankuendigung-von-manoevern-fuer-ukraine-a-34dd70b3-1db2-42e5-b46c-ed0c61e5d423#ref=rss,www.spiegel.de,Emmanuel Macron überrascht mit Ankündigung von Manövern für Ukraine - DER SPIEGEL,0.1,LOW,False,,,mainstream,2026-07-14T02:36:25.787691
"Hong / AP Paramount darf den Konkurrenten Warner für 111 Milliarden US-Dollar kaufen, das entschied die US-Regierung im Juni",https://www.spiegel.de/kultur/kino/warner-und-paramount-us-bundesstaaten-wollen-uebernahme-stoppen-a-ae433872-cc75-40e8-aee3-3be07f060ea3#ref=rss,www.spiegel.de,Warner und Paramount: US-Bundesstaaten wollen Übernahme stoppen - DER SPIEGEL,0,LOW,False,,,mainstream,2026-07-14T02:36:27.780736
"Die Folge: Beschäftigte sowie Richterinnen und Richter kommen nicht an die elektronischen Akten heran, können keine Fälle bearbeiten und ihre E-Mails nicht lesen",https://www.spiegel.de/panorama/justiz/berlin-it-ausfall-legt-gerichte-und-justizverwaltung-lahm-a-41e32927-792f-4c97-bf00-b2859b32aeab#ref=rss,www.spiegel.de,Berlin: IT-Ausfall legt Gerichte und Justizverwaltung lahm - DER SPIEGEL,0.1,LOW,False,,,mainstream,2026-07-14T02:36:28.979456
"Nach Angaben der Senatsjustizverwaltung handelt es sich um ein Lizenzproblem für eine Schnittstellensoftware, die für das Einwählen auf die Server nötig ist",https://www.spiegel.de/panorama/justiz/berlin-it-ausfall-legt-gerichte-und-justizverwaltung-lahm-a-41e32927-792f-4c97-bf00-b2859b32aeab#ref=rss,www.spiegel.de,Berlin: IT-Ausfall legt Gerichte und Justizverwaltung lahm - DER SPIEGEL,0,LOW,False,,,mainstream,2026-07-14T02:36:29.190522
"Beschäftigte nach Hause geschicktWegen der massiven Probleme wurden alle Beschäftigten am Mittag nach Hause geschickt, wie ein Sprecher des Kammergerichts sagte",https://www.spiegel.de/panorama/justiz/berlin-it-ausfall-legt-gerichte-und-justizverwaltung-lahm-a-41e32927-792f-4c97-bf00-b2859b32aeab#ref=rss,www.spiegel.de,Berlin: IT-Ausfall legt Gerichte und Justizverwaltung lahm - DER SPIEGEL,0.1,LOW,False,,,mainstream,2026-07-14T02:36:29.420286
"Und ich dachte immer, ich würde beim Sportgucken ganz aus dem Häusc",https://www.spiegel.de/panorama/leute/fussball-wm-david-beckham-erklaert-reaktion-von-victoria-beckham-waehrend-viertelfinale-a-e1534fa8-ff39-47e7-bb4c-c37c04e9e475#ref=rss,www.spiegel.de,Fußball WM - David Beckham erklärt Reaktion von Victoria Beckham während Viertelfinale - DER SPIEGEL,0.1,LOW,False,,,mainstream,2026-07-14T02:36:31.472155
Deswegen seien alle Zugänge »für einen längeren Zeitraum« geschlossen worden,https://www.spiegel.de/kultur/musik/jay-z-in-new-york-hunderte-fans-stuermen-eingaenge-a-f9aab147-6300-4730-9886-e64368925da4#ref=rss,www.spiegel.de,Jay-Z in New York: Hunderte Fans stürmen Eingänge - DER SPIEGEL,0.1,LOW,False,,,mainstream,2026-07-14T02:36:33.642097
"Zum Login SPIEGEL plus Nur für Neukunden € 1,– für 4 Wochen danach € 5,99 pro Woche Freier Zugriff auf alle S+-Artikel auf SPIEGEL",https://www.spiegel.de/ausland/russland-im-stimmungstief-eine-veraengstigte-depressive-und-zutiefst-unglueckliche-waehlerschaft-a-163aa883-940f-4fb4-8d32-2759f83e4aa4#ref=rss,www.spiegel.de,"Russland im Stimmungstief: »Eine verängstigte, depressive und zutiefst unglückliche Wählerschaft« - ",0.1,LOW,False,,,mainstream,2026-07-14T02:36:34.740425
"E-Paper (PDF), Digital-Archiv und S+-Newsletter Jederzeit kündigen Jetzt abonnieren SPIEGEL plus 52 Wochen 25 % sparen € 4,49 pro Woche für 52 Wochen danach € 5,99 pro Woche Freier Zugriff auf alle S+-Artikel auf SPIEGEL",https://www.spiegel.de/ausland/russland-im-stimmungstief-eine-veraengstigte-depressive-und-zutiefst-unglueckliche-waehlerschaft-a-163aa883-940f-4fb4-8d32-2759f83e4aa4#ref=rss,www.spiegel.de,"Russland im Stimmungstief: »Eine verängstigte, depressive und zutiefst unglückliche Wählerschaft« - ",0.1,LOW,False,,,mainstream,2026-07-14T02:36:34.965245
Mit der Aufnahme in die Sanktionsliste dürfen US-Bürgerinnen und Bürger sowie US-Unternehmen grundsätzlich keine Geschäfte mehr mit den betroffenen Organisationen tätigen,https://www.spiegel.de/ausland/usa-sanktionieren-kubas-tourismusministerium-a-31280735-da78-4773-9450-12a20c5f087c#ref=rss,www.spiegel.de,USA sanktionieren Kubas Tourismusministerium - DER SPIEGEL,0.1,LOW,False,,,mainstream,2026-07-14T02:36:37.052343
"Die Rapid Response Brigades sind regierungsnahe Gruppen, die nach Angaben von Menschenrechtsorganisationen wiederholt gegen regierungskritische Demonstranten eingesetzt wurden",https://www.spiegel.de/ausland/usa-sanktionieren-kubas-tourismusministerium-a-31280735-da78-4773-9450-12a20c5f087c#ref=rss,www.spiegel.de,USA sanktionieren Kubas Tourismusministerium - DER SPIEGEL,0,LOW,False,,,mainstream,2026-07-14T02:36:37.275884
"In a Truth Social post earlier in the day, Trump said the US was reinstating a naval blockade of Iranian ports and would impose a 20% charge on all cargo shipped through the Strait of Hormuz",https://www.bbc.co.uk/news/articles/c8d2vn38dy1o?at_medium=RSS&amp;at_campaign=rss,www.bbc.co.uk,UAE condemns Iran&#x27;s &#x27;brazen&#x27; attack on tankers as US launches fresh strikes - BBC New,0,LOW,False,,,mainstream,2026-07-14T02:36:38.564378
"Large swathes of England have so far recorded 0% of the rainfall they would normally expect in July, with Wisley in Surrey having gone 26 consecutive days without any",https://www.bbc.co.uk/weather/articles/cvge2zq0zg3o?at_medium=RSS&amp;at_campaign=rss,www.bbc.co.uk,UK weather: no widespread rain in forecast as heatwave continues - BBC Weather,0,LOW,False,,,mainstream,2026-07-14T02:36:39.148981
"Image source, BBC Weather Watchers / Bailey / Met OfficeImage caption, Provisional Met Office data shows that first 11 days of July brought most places less than 20% of their usual monthly rainfall",https://www.bbc.co.uk/weather/articles/cvge2zq0zg3o?at_medium=RSS&amp;at_campaign=rss,www.bbc.co.uk,UK weather: no widespread rain in forecast as heatwave continues - BBC Weather,0,LOW,False,,,mainstream,2026-07-14T02:36:39.355292
"Most areas of Wales have seen less than 10% of the usual July average, and in Northern Ireland the figure varies from 1% to 20%",https://www.bbc.co.uk/weather/articles/cvge2zq0zg3o?at_medium=RSS&amp;at_campaign=rss,www.bbc.co.uk,UK weather: no widespread rain in forecast as heatwave continues - BBC Weather,0,LOW,False,,,mainstream,2026-07-14T02:36:39.572991
"Under Labour&#x27;s rules, leadership candidates need 20% of the party&#x27;s MPs - 81 out of a total of 403 - to nominate them",https://www.bbc.co.uk/news/articles/c05y3rj09qqo?at_medium=RSS&amp;at_campaign=rss,www.bbc.co.uk,Burnham cements Labour leadership with backing of 349 MPs - BBC News,0,LOW,False,,,mainstream,2026-07-14T02:36:39.913642
"If companies do not do this they can be fined up to 10% of their global revenues, which in the case of Google could run into many billions of pounds",https://www.bbc.co.uk/news/articles/c5yzn2g0xw9o?at_medium=RSS&amp;at_campaign=rss,www.bbc.co.uk,"YouTube still recommending eating disorder videos, researchers claim - BBC News",0.1,LOW,False,,,mainstream,2026-07-14T02:36:40.181362
"The South American side have been the most clinical, converting 18% of their chances, while the opposite is true of European champions Spain",https://www.bbc.co.uk/sport/football/articles/cx2k9qj2nyvo?at_medium=RSS&amp;at_campaign=rss,www.bbc.co.uk,"World Cup 2026: France, Spain, England &amp; Argentina statistical analysis - BBC Sport",0,LOW,False,,,mainstream,2026-07-14T02:36:40.995463
Luis de la Fuente&#x27;s side have also enjoyed the most possession (66%) - not just of the teams remaining but of any side at this World Cup - and have the joint-best passing accuracy at the tournament along with Argentina (90,https://www.bbc.co.uk/sport/football/articles/cx2k9qj2nyvo?at_medium=RSS&amp;at_campaign=rss,www.bbc.co.uk,"World Cup 2026: France, Spain, England &amp; Argentina statistical analysis - BBC Sport",0,LOW,False,,,mainstream,2026-07-14T02:36:41.080455
