claim,source_url,source_domain,article_title,risk_score,risk_category,has_factcheck,factcheck_rating,factcheck_source,source_type,checked_at
"Zum Login SPIEGEL plus Nur für Neukunden € 1,– für 4 Wochen danach € 5,99 pro Woche Freier Zugriff auf alle S+-Artikel auf SPIEGEL",https://www.spiegel.de/sport/fussball/wm-2026-news-heute-iran-holt-remis-gegen-neuseeland-a-79611414-e03e-4f3a-a1bf-629d0479c898#ref=rss,www.spiegel.de,WM 2026 News heute: Iran holt Remis gegen Neuseeland - DER SPIEGEL,0.1,LOW,False,,,mainstream,2026-06-16T04:22:55.293439
"E-Paper (PDF), Digital-Archiv und S+-Newsletter Jederzeit kündigen Jetzt abonnieren SPIEGEL plus 52 Wochen 25 % sparen € 4,49 pro Woche für 52 Wochen danach € 5,99 pro Woche Freier Zugriff auf alle S+-Artikel auf SPIEGEL",https://www.spiegel.de/sport/fussball/wm-2026-news-heute-iran-holt-remis-gegen-neuseeland-a-79611414-e03e-4f3a-a1bf-629d0479c898#ref=rss,www.spiegel.de,WM 2026 News heute: Iran holt Remis gegen Neuseeland - DER SPIEGEL,0.1,LOW,False,,,mainstream,2026-06-16T04:22:55.491389
"Aktiv leben, mehr erreichen – immer dienstags image""> yacobchuk / [M] DER SPIEGEL; Foto: yacobchuk / iStockphoto / Getty Images Ausgabe Nr",https://www.spiegel.de/fitness/japanese-walking-so-gelingt-der-perfekte-intervall-spaziergang-a-95fd6acf-9d93-4dc3-b21f-e5f4de5f4004#ref=rss,www.spiegel.de,Japanese Walking: So gelingt der perfekte Intervall-Spaziergang - DER SPIEGEL,0.1,LOW,False,,,mainstream,2026-06-16T04:22:56.529468
25 Sie haben keine Lust zu joggen,https://www.spiegel.de/fitness/japanese-walking-so-gelingt-der-perfekte-intervall-spaziergang-a-95fd6acf-9d93-4dc3-b21f-e5f4de5f4004#ref=rss,www.spiegel.de,Japanese Walking: So gelingt der perfekte Intervall-Spaziergang - DER SPIEGEL,0.1,LOW,False,,,mainstream,2026-06-16T04:22:56.729730
"Dann versuchen Sie es mal mit Japanese Walking Noch immer fällt es vielen Menschen schwer, sich regelmäßig zu bewegen",https://www.spiegel.de/fitness/japanese-walking-so-gelingt-der-perfekte-intervall-spaziergang-a-95fd6acf-9d93-4dc3-b21f-e5f4de5f4004#ref=rss,www.spiegel.de,Japanese Walking: So gelingt der perfekte Intervall-Spaziergang - DER SPIEGEL,0.1,LOW,False,,,mainstream,2026-06-16T04:22:56.932188
"Aktiv leben, mehr erreichen – immer dienstags image""> Foto: Markus Hertrich / RTL Ausgabe Nr",https://www.spiegel.de/fitness/ninja-warrior-athleten-das-grosse-hangeln-so-werden-sie-fit-a-28e3280e-6584-4cda-8880-a3450087486f#ref=rss,www.spiegel.de,»Ninja Warrior«-Athleten: Das große Hangeln – so werden Sie fit - DER SPIEGEL,0.1,LOW,False,,,mainstream,2026-06-16T04:22:58.056560
2026 • Alle Ausgaben Sie können den Artikel leider nicht mehr aufrufen,https://www.spiegel.de/fitness/ninja-warrior-athleten-das-grosse-hangeln-so-werden-sie-fit-a-28e3280e-6584-4cda-8880-a3450087486f#ref=rss,www.spiegel.de,»Ninja Warrior«-Athleten: Das große Hangeln – so werden Sie fit - DER SPIEGEL,0.1,LOW,False,,,mainstream,2026-06-16T04:22:58.281614
"Zum Login SPIEGEL plus Nur für Neukunden € 1,– für 4 Wochen danach € 5,99 pro Woche Freier Zugriff auf alle S+-Artikel auf SPIEGEL",https://www.spiegel.de/fitness/ninja-warrior-athleten-das-grosse-hangeln-so-werden-sie-fit-a-28e3280e-6584-4cda-8880-a3450087486f#ref=rss,www.spiegel.de,»Ninja Warrior«-Athleten: Das große Hangeln – so werden Sie fit - DER SPIEGEL,0.1,LOW,False,,,mainstream,2026-06-16T04:22:58.481426
"Stand Juni bevorrateten die Vereinigten Staaten noch 340,3 Millionen Barrel Öl, wie das Energieministerium in Washington mitteilte – so wenig wie seit Juli 1983 nicht mehr",https://www.spiegel.de/wirtschaft/iran-krieg-oelreserve-der-usa-faellt-auf-tiefsten-stand-seit-40-jahren-a-dc019ddf-9976-401f-85df-546b38191f16#ref=rss,www.spiegel.de,Iran-Krieg: Ölreserve der USA fällt auf tiefsten Stand seit 40 Jahren - DER SPIEGEL,0,LOW,False,,,mainstream,2026-06-16T04:22:59.632775
"Die psychologisch wichtige Marke von 300 Millionen Barrel an gilt vielen Beobachtern als Schmerzgrenze&nbsp;, gerade um auch für mögliche Naturkatastrophen wie Hurrikans stets gewappnet zu sein",https://www.spiegel.de/wirtschaft/iran-krieg-oelreserve-der-usa-faellt-auf-tiefsten-stand-seit-40-jahren-a-dc019ddf-9976-401f-85df-546b38191f16#ref=rss,www.spiegel.de,Iran-Krieg: Ölreserve der USA fällt auf tiefsten Stand seit 40 Jahren - DER SPIEGEL,0,LOW,False,,,mainstream,2026-06-16T04:22:59.864415
"Zum Login SPIEGEL plus Nur für Neukunden € 1,– für 4 Wochen danach € 5,99 pro Woche Freier Zugriff auf alle S+-Artikel auf SPIEGEL",https://www.spiegel.de/ausland/gavin-newsom-fast-fuenf-minuten-lang-rechnet-kaliforniens-gouverneur-mit-trump-ab-a-6162da2c-44e6-4a65-a388-f5a8a5cd1333#ref=rss,www.spiegel.de,Gavin Newsom: Fast fünf Minuten lang rechnet Kaliforniens Gouverneur mit Trump ab - DER SPIEGEL,0.1,LOW,False,,,mainstream,2026-06-16T04:23:01.923227
"E-Paper (PDF), Digital-Archiv und S+-Newsletter Jederzeit kündigen Jetzt abonnieren SPIEGEL plus 52 Wochen 25 % sparen € 4,49 pro Woche für 52 Wochen danach € 5,99 pro Woche Freier Zugriff auf alle S+-Artikel auf SPIEGEL",https://www.spiegel.de/ausland/gavin-newsom-fast-fuenf-minuten-lang-rechnet-kaliforniens-gouverneur-mit-trump-ab-a-6162da2c-44e6-4a65-a388-f5a8a5cd1333#ref=rss,www.spiegel.de,Gavin Newsom: Fast fünf Minuten lang rechnet Kaliforniens Gouverneur mit Trump ab - DER SPIEGEL,0.1,LOW,False,,,mainstream,2026-06-16T04:23:02.123497
"Laut der Nachrichtenagentur AP, die als erste über den Fall berichtet hatte&nbsp;, könnte den Beschuldigten im Tschad auch ein juristisches Nachspiel drohen",https://www.spiegel.de/ausland/aerzte-ohne-grenzen-entlaesst-18-mitarbeiter-nach-missbrauchsvorwuerfen-im-tschad-a-2c523454-926f-4e8c-b9f0-c42c64fa3d54#ref=rss,www.spiegel.de,Ärzte ohne Grenzen entlässt 18 Mitarbeiter nach Missbrauchsvorwürfen im Tschad - DER SPIEGEL,0,LOW,False,,,mainstream,2026-06-16T04:23:03.958563
"Zum Login SPIEGEL plus Nur für Neukunden € 1,– für 4 Wochen danach € 5,99 pro Woche Freier Zugriff auf alle S+-Artikel auf SPIEGEL",https://www.spiegel.de/sport/fussball/wm-2026-live-belgien-gegen-aegypten-im-liveticker-a-0689ab29-b212-46e6-85df-da2341c803f2#ref=rss,www.spiegel.de,WM 2026: Drei Erkenntnisse zu Spaniens Blamage gegen Kap Verde - DER SPIEGEL,0.1,LOW,False,,,mainstream,2026-06-16T04:23:05.059001
"E-Paper (PDF), Digital-Archiv und S+-Newsletter Jederzeit kündigen Jetzt abonnieren SPIEGEL plus 52 Wochen 25 % sparen € 4,49 pro Woche für 52 Wochen danach € 5,99 pro Woche Freier Zugriff auf alle S+-Artikel auf SPIEGEL",https://www.spiegel.de/sport/fussball/wm-2026-live-belgien-gegen-aegypten-im-liveticker-a-0689ab29-b212-46e6-85df-da2341c803f2#ref=rss,www.spiegel.de,WM 2026: Drei Erkenntnisse zu Spaniens Blamage gegen Kap Verde - DER SPIEGEL,0.1,LOW,False,,,mainstream,2026-06-16T04:23:05.280178
"»Wir müssen jetzt erst einmal wissen: Ist wirklich klar, es gibt keine Kampfhandlungen",https://www.spiegel.de/ausland/wadephul-nennt-bedingungen-fuer-deutschen-militaereinsatz-in-strasse-von-hormus-a-49b380a4-5422-461c-8710-e07fec9c659a#ref=rss,www.spiegel.de,Wadephul nennt Bedingungen für deutschen Militäreinsatz in Straße von Hormus - DER SPIEGEL,0.1,LOW,False,,,mainstream,2026-06-16T04:23:07.256763
Alle acht Besatzungsmitglieder starben,https://www.spiegel.de/panorama/usa-b-52-langstrecken-bomber-der-us-streitkraefte-in-kalifornien-abgestuerzt-a-2c7d6e18-c10f-4aea-8e07-b67c239d8cc0#ref=rss,www.spiegel.de,USA: B-52-Langstrecken-Bomber der US-Streitkräfte in Kalifornien abgestürzt - DER SPIEGEL,0.1,LOW,False,,,mainstream,2026-06-16T04:23:08.367326
"Andere Nutzungen verletzen das Urheberrecht Belgiens 1:1 gegen Ägypten Lukaku sorgt auch für Tore, wenn er gar nicht am Ball ist Die goldene Generation der Belgier ist älter geworden, aber immer noch brandgefährlich",https://www.spiegel.de/sport/fussball/wm-2026-romelu-lukaku-erzwingt-belgiens-ausgleich-gegen-aegypten-nach-einwechslung-a-26c9a38f-5ef5-4cfd-b2a5-07cd304bac4c#ref=rss,www.spiegel.de,WM 2026: Romelu Lukaku erzwingt Belgiens Ausgleich gegen Ägypten nach Einwechslung - DER SPIEGEL,0.1,LOW,False,,,mainstream,2026-06-16T04:23:09.437578
"Zum Login SPIEGEL plus Nur für Neukunden € 1,– für 4 Wochen danach € 5,99 pro Woche Freier Zugriff auf alle S+-Artikel auf SPIEGEL",https://www.spiegel.de/sport/fussball/wm-2026-romelu-lukaku-erzwingt-belgiens-ausgleich-gegen-aegypten-nach-einwechslung-a-26c9a38f-5ef5-4cfd-b2a5-07cd304bac4c#ref=rss,www.spiegel.de,WM 2026: Romelu Lukaku erzwingt Belgiens Ausgleich gegen Ägypten nach Einwechslung - DER SPIEGEL,0.1,LOW,False,,,mainstream,2026-06-16T04:23:09.637353
"E-Paper (PDF), Digital-Archiv und S+-Newsletter Jederzeit kündigen Jetzt abonnieren SPIEGEL plus 52 Wochen 25 % sparen € 4,49 pro Woche für 52 Wochen danach € 5,99 pro Woche Freier Zugriff auf alle S+-Artikel auf SPIEGEL",https://www.spiegel.de/sport/fussball/wm-2026-romelu-lukaku-erzwingt-belgiens-ausgleich-gegen-aegypten-nach-einwechslung-a-26c9a38f-5ef5-4cfd-b2a5-07cd304bac4c#ref=rss,www.spiegel.de,WM 2026: Romelu Lukaku erzwingt Belgiens Ausgleich gegen Ägypten nach Einwechslung - DER SPIEGEL,0.1,LOW,False,,,mainstream,2026-06-16T04:23:09.835880
