claim,source_url,source_domain,article_title,risk_score,risk_category,has_factcheck,factcheck_rating,factcheck_source,source_type,checked_at
April 2026 Die PCK Schwedt bezieht aktuell rund 20 Prozent ihres Öls aus Kasachstan über die Druschba-Pipeline,https://correctiv.org/aktuelles/russland-ukraine-2/2026/04/22/russland-kuendigt-transit-stopp-von-kasachischem-oel-nach-deutschland-an-pck-schwedt/,correctiv.org,Russland stoppt Transit kasachischen Öls nach Deutschland,0,LOW,False,,,factcheck,2026-04-22T19:17:06.045871
Damit bestätigte erstmals ein Vertreter der russischen Regierung frühere Medienberichte sowie eine Aussage des kasachischen Energieministers Yerlan Akkenzhenov,https://correctiv.org/aktuelles/russland-ukraine-2/2026/04/22/russland-kuendigt-transit-stopp-von-kasachischem-oel-nach-deutschland-an-pck-schwedt/,correctiv.org,Russland stoppt Transit kasachischen Öls nach Deutschland,0,LOW,False,,,factcheck,2026-04-22T19:17:06.157983
Die deutsche Tochter der russischen Rosneft steht unter der Treuhand und hält rund 54 Prozent an der Ölraffinerie Schwedt,https://correctiv.org/aktuelles/russland-ukraine-2/2026/04/22/russland-kuendigt-transit-stopp-von-kasachischem-oel-nach-deutschland-an-pck-schwedt/,correctiv.org,Russland stoppt Transit kasachischen Öls nach Deutschland,0,LOW,False,,,factcheck,2026-04-22T19:17:06.262634
[DEBUNKED] Gesundheitsreform: AfD-Politiker streut Falschbehauptung zu Asylbewerbern,https://correctiv.org/faktencheck/2026/04/21/gesundheitsreform-afd-politiker-streut-falschbehauptung-zu-asylbewerbern/,correctiv.org,Gesundheitsreform: AfD-Politiker streut Falschbehauptung zu Asylbewerbern,0.9,HIGH,True,FALSE - Debunked by fact-checkers,correctiv.org,factcheck,2026-04-22T19:17:07.220631
Illustration: Ivo Mayr / CORRECTIV (KI-generiert) Offenbar sind die deutschen Behörden noch immer nicht auf den Online-Handel mit riskanten Produkten vorbereitet,https://correctiv.org/aktuelles/wirtschaft/2026/04/22/nach-correctiv-recherche-deutsche-behoerden-bleiben-untaetig-verbotenes-kosmetik-produkt-bleibt-im-handel/,correctiv.org,verbotenes-kosmetik-produkt-bleibt-im-handel,0.1,LOW,False,,,factcheck,2026-04-22T19:17:08.149035
"Jeder Verbraucher, der ein zweifelhaftes Produkt erworben habe, könne sich jeweils vor Ort an seine Behörde wenden",https://correctiv.org/aktuelles/wirtschaft/2026/04/22/nach-correctiv-recherche-deutsche-behoerden-bleiben-untaetig-verbotenes-kosmetik-produkt-bleibt-im-handel/,correctiv.org,verbotenes-kosmetik-produkt-bleibt-im-handel,0,LOW,False,,,factcheck,2026-04-22T19:17:08.259027
"Da der Onlineshop in Irland ansässig sei, bestehe „keine örtliche Zuständigkeit für die Berliner Lebensmittelüberwachung“",https://correctiv.org/aktuelles/wirtschaft/2026/04/22/nach-correctiv-recherche-deutsche-behoerden-bleiben-untaetig-verbotenes-kosmetik-produkt-bleibt-im-handel/,correctiv.org,verbotenes-kosmetik-produkt-bleibt-im-handel,0.1,LOW,False,,,factcheck,2026-04-22T19:17:08.362324
"Modern und klimaneutral, so bewirbt die Bahn das mehr als 400 Millionen Euro teure Projekt",https://correctiv.org/umweltverbrechen-in-nrw/2026/04/20/schadstoffbelasteter-boden-der-deutschen-bahn-prozess-wegen-illegaler-entsorgung/,correctiv.org,Schadstoffbelasteter Boden der Deutschen Bahn: Gerichtsprozess wegen illegaler Entsorgung - correcti,0,LOW,False,,,factcheck,2026-04-22T19:17:09.210356
"&#8220; Strippenzieher vor Gericht Ob sich der Verdacht bestätigt und welche Rolle die DB als Bauherrin tatsächlich spielte, wird in den nächsten Monaten am Landgericht Dortmund geklärt",https://correctiv.org/umweltverbrechen-in-nrw/2026/04/20/schadstoffbelasteter-boden-der-deutschen-bahn-prozess-wegen-illegaler-entsorgung/,correctiv.org,Schadstoffbelasteter Boden der Deutschen Bahn: Gerichtsprozess wegen illegaler Entsorgung - correcti,0,LOW,False,,,factcheck,2026-04-22T19:17:09.325077
Bei dem belasteten Boden der ICE-Baustelle handelt es sich nach Angaben von Ermittlern um insgesamt rund 24,https://correctiv.org/umweltverbrechen-in-nrw/2026/04/20/schadstoffbelasteter-boden-der-deutschen-bahn-prozess-wegen-illegaler-entsorgung/,correctiv.org,Schadstoffbelasteter Boden der Deutschen Bahn: Gerichtsprozess wegen illegaler Entsorgung - correcti,0,LOW,False,,,factcheck,2026-04-22T19:17:09.429209
Hier sind noch einmal alle Cartoons der Woche im Überblick,https://correctiv.org/aktuelles/gesellschaft-2/2026/04/17/cartoon-arena-die-debatte-zu-sexualisierter-gewalt-gegen-frauen/,correctiv.org,Cartoon-Arena: Die Debatte zu sexualisierter digitaler Gewalt gegen Frauen - correctiv.org,0.1,LOW,False,,,factcheck,2026-04-22T19:17:10.995081
90 12051 Berlin Fax: +49 (0) 30 – 555 780 2 20 Büro Berlin Singerstraße 109 10179 Berlin Buchladen Essen Akazienallee 10 45127 Essen Online-Shop Jugendredaktion Salon5 Alle Standorte CORRECTIV,https://correctiv.org/aktuelles/gesellschaft-2/2026/04/17/cartoon-arena-die-debatte-zu-sexualisierter-gewalt-gegen-frauen/,correctiv.org,Cartoon-Arena: Die Debatte zu sexualisierter digitaler Gewalt gegen Frauen - correctiv.org,0.1,LOW,False,,,factcheck,2026-04-22T19:17:11.105568
"[DEBUNKED] Spritpreise, Entlastung: Wie viel kommt bei den Bürgern an?",https://correctiv.org/aktuelles/politik-2/2026/04/15/spritpreise-entlastung-wie-viel-kommt-bei-den-buergern-an/,correctiv.org,"Spritpreise, Entlastung: Wie viel kommt bei den Bürgern an?",0.9,HIGH,True,FALSE - Debunked by fact-checkers,correctiv.org,factcheck,2026-04-22T19:17:12.737875
[DEBUNKED] Polizeiliche Kriminalstatistik: 5 Behauptungen im Faktencheck,https://correctiv.org/faktencheck/hintergrund/2026/04/15/polizeiliche-kriminalstatistik-faktencheck/,correctiv.org,Polizeiliche Kriminalstatistik: 5 Behauptungen im Faktencheck,0.9,HIGH,True,FALSE - Debunked by fact-checkers,correctiv.org,factcheck,2026-04-22T19:17:13.647707
Laut dem nicht rechtskräftigen Urteil des Landgerichts Berlin müsste CORRECTIV zwei Formulierungen in der Recherche „Geheimplan gegen Deutschland“ ändern,https://correctiv.org/in-eigener-sache/2026/04/15/martin-sellner-die-afd-und-der-rechtsstreit-um-voelkische-tarnbegriffe/,correctiv.org,"Martin Sellner, die AfD und der Rechtsstreit um völkische Tarnbegriffe - correctiv.org",0.05,LOW,False,,,factcheck,2026-04-22T19:17:14.576020
Im Hintergrund werden alle Verfahren von der Kanzlei Höcker geführt,https://correctiv.org/in-eigener-sache/2026/04/15/martin-sellner-die-afd-und-der-rechtsstreit-um-voelkische-tarnbegriffe/,correctiv.org,"Martin Sellner, die AfD und der Rechtsstreit um völkische Tarnbegriffe - correctiv.org",0.1,LOW,False,,,factcheck,2026-04-22T19:17:14.664981
So hat das Landgericht Hamburg erst im Dezember 2025 in einem in Teilen identischen Streitkomplex die Einordnung von CORRECTIV zur „Remigration“ in zwei Verfahren ausdrücklich als zulässige Wertung bestätigt,https://correctiv.org/in-eigener-sache/2026/04/15/martin-sellner-die-afd-und-der-rechtsstreit-um-voelkische-tarnbegriffe/,correctiv.org,"Martin Sellner, die AfD und der Rechtsstreit um völkische Tarnbegriffe - correctiv.org",0,LOW,False,,,factcheck,2026-04-22T19:17:14.768942
April 2026 Europas Gesamtbevölkerung ist in den vergangenen Jahrzehnten gewachsen – doch die Hälfte aller Städte und Gemeinden haben Einwohner verloren,https://correctiv.org/aktuelles/2026/04/21/die-haelfte-der-europaeischen-gemeinden-hat-weniger-einwohner-als-vor-60-jahren/,correctiv.org,Diese europäischen Orte verlieren Einwohner,0.1,LOW,False,,,factcheck,2026-04-22T19:17:15.846235
Das Dorf Villarroya in der Region la Rioja verlor dagegen etwa 98 Prozent seiner Einwohner,https://correctiv.org/aktuelles/2026/04/21/die-haelfte-der-europaeischen-gemeinden-hat-weniger-einwohner-als-vor-60-jahren/,correctiv.org,Diese europäischen Orte verlieren Einwohner,0,LOW,False,,,factcheck,2026-04-22T19:17:15.949050
Seit 1961 haben 84 Prozent der griechischen Gemeinden Einwohner verloren,https://correctiv.org/aktuelles/2026/04/21/die-haelfte-der-europaeischen-gemeinden-hat-weniger-einwohner-als-vor-60-jahren/,correctiv.org,Diese europäischen Orte verlieren Einwohner,0,LOW,False,,,factcheck,2026-04-22T19:17:16.052572
[DEBUNKED] Hochradioaktiver Atommüll benötigt mehr Platz als Kristina Schröder behauptet - correctiv.org,https://correctiv.org/faktencheck/aus-der-community/2026/04/14/hochradioaktiver-atommuell-benoetigt-mehr-platz-als-kristina-schroeder-behauptet/,correctiv.org,Hochradioaktiver Atommüll benötigt mehr Platz als Kristina Schröder behauptet - correctiv.org,0.9,HIGH,True,FALSE - Debunked by fact-checkers,correctiv.org,factcheck,2026-04-22T19:17:16.813083
"In Umfragen liegt die AfD in Sachsen-Anhalt bei 38 Prozent, deutlich vor der CDU mit gut 25 Prozent",https://correctiv.org/aktuelles/afd/2026/04/13/remigration-als-leitmotiv-was-die-afd-in-sachsen-anhalt-plant/,correctiv.org,„Remigration“ als Leitmotiv: Was die AfD in Sachsen-Anhalt plant,0,LOW,False,,,factcheck,2026-04-22T19:17:17.821610
"Spitzenkandidat Ulrich Siegmund forderte mehr Unterstützung, die Partei brauche „45 Prozent plus X“ Prozent",https://correctiv.org/aktuelles/afd/2026/04/13/remigration-als-leitmotiv-was-die-afd-in-sachsen-anhalt-plant/,correctiv.org,„Remigration“ als Leitmotiv: Was die AfD in Sachsen-Anhalt plant,0,LOW,False,,,factcheck,2026-04-22T19:17:17.929289
"Für eine Alleinregierung der AfD könnten auch weniger als 50 Prozent der Stimmen reichen, sollten Grüne, FDP und BSW mit ihrem Einzug in den Landtag an der Fünf-Prozent-Hürde scheitern",https://correctiv.org/aktuelles/afd/2026/04/13/remigration-als-leitmotiv-was-die-afd-in-sachsen-anhalt-plant/,correctiv.org,„Remigration“ als Leitmotiv: Was die AfD in Sachsen-Anhalt plant,0.1,LOW,False,,,factcheck,2026-04-22T19:17:18.033669
[DEBUNKED] Ungarn hat nicht alle Verträge mit der EU gekündigt,https://correctiv.org/faktencheck/2026/04/13/nein-ungarn-hat-nicht-alle-vertraege-mit-der-eu-gekuendigt/,correctiv.org,Ungarn hat nicht alle Verträge mit der EU gekündigt,0.9,HIGH,True,FALSE - Debunked by fact-checkers,correctiv.org,factcheck,2026-04-22T19:17:18.859280
"Darunter finden sich Kosmetikartikel wie Duschgels oder Körperlotionen, die auch jahrelang nach dem offiziellen Verbot im Umlauf sind – zumindest auf Online-Plattformen",https://correctiv.org/aktuelles/wirtschaft/2026/04/14/in-der-schoenheitsfalle-giftige-kosmetik/,correctiv.org,In der Schönheitsfalle: Giftige Kosmetik - correctiv.org,0,LOW,False,,,factcheck,2026-04-22T19:17:19.924117
"Wildtiere, die an Orten auftauchen, an denen Menschen sie nicht gewohnt sind, sorgen ja immer wieder für Schlagzeilen und Diskussionen",https://www.volksverpetzer.de/aktuelles/rechte-ostsee-wal-afd/,www.volksverpetzer.de,"So weird versuchen manche AfD-Fans, den Ostsee-Wal zu instrumentalisieren! - Volksverpetzer",0.1,LOW,False,,,factcheck,2026-04-22T19:17:42.372672
"März strandete er mehrmals in der Ostsee, konnte sich aber immer wieder durch Rettungsmaßnahmen freischwimmen",https://www.volksverpetzer.de/aktuelles/rechte-ostsee-wal-afd/,www.volksverpetzer.de,"So weird versuchen manche AfD-Fans, den Ostsee-Wal zu instrumentalisieren! - Volksverpetzer",0.1,LOW,False,,,factcheck,2026-04-22T19:17:42.471065
""" Andere sagen ""Rettet Wale und keine Migranten",https://www.volksverpetzer.de/aktuelles/rechte-ostsee-wal-afd/,www.volksverpetzer.de,"So weird versuchen manche AfD-Fans, den Ostsee-Wal zu instrumentalisieren! - Volksverpetzer",0.1,LOW,False,,,factcheck,2026-04-22T19:17:42.580332
[DEBUNKED] Dreiste Wählertäuschung! Juristen zerlegen Migrations-Pläne der AfD Sachsen-Anhalt - Volksverpetzer,https://www.volksverpetzer.de/analyse/afd-sachsen-anhalt-migration-luege/,www.volksverpetzer.de,Dreiste Wählertäuschung! Juristen zerlegen Migrations-Pläne der AfD Sachsen-Anhalt - Volksverpetzer,0.9,HIGH,True,FALSE - Debunked by fact-checkers,www.volksverpetzer.de,factcheck,2026-04-22T19:17:44.544954
"Screenshot Jeder Blick in den Spiegel wird zur Bewertung, jeder Millimeter des Gesichts zu einem Datenpunkt",https://www.volksverpetzer.de/analyse/looksmaxxing-tiktok-nazi/,www.volksverpetzer.de,Looksmaxxing – Macht dieser TikTok-Trend dein Kind zum Nazi? - Volksverpetzer,0,LOW,False,,,factcheck,2026-04-22T19:17:46.366458
"Wissenschaftliche Belege gibt es dafür zwar keine, trotzdem scheint das nur die wenigsten abzuschrecken",https://www.volksverpetzer.de/analyse/looksmaxxing-tiktok-nazi/,www.volksverpetzer.de,Looksmaxxing – Macht dieser TikTok-Trend dein Kind zum Nazi? - Volksverpetzer,0.1,LOW,False,,,factcheck,2026-04-22T19:17:46.461493
In beiden Ländern träumt die AfD seit Monaten angesichts von Umfragewerten von deutlich über 30 bis zu 40 Prozent von der Regierung und sieht die Wahlen in Baden-Württemberg und Rheinland-Pfalz als gutes Vorzeichen,https://www.volksverpetzer.de/analyse/afd-osten-keiner-merkt-es/,www.volksverpetzer.de,Die AfD verliert alle Wahlen im Osten – und keiner bekommt es mit - Volksverpetzer,0,LOW,False,,,factcheck,2026-04-22T19:17:47.859343
"Bei den Bürgermeisterwahlen im vorpommerschen Anklam gewann der amtierende Bürgermeister Michael Galander von der Wählergemeinschaft Initiativen für Anklam mit 72,13 Prozent haushoch gegen AfD-Kandidat Jörg Valentin (27,9 Prozent)",https://www.volksverpetzer.de/analyse/afd-osten-keiner-merkt-es/,www.volksverpetzer.de,Die AfD verliert alle Wahlen im Osten – und keiner bekommt es mit - Volksverpetzer,0,LOW,False,,,factcheck,2026-04-22T19:17:47.963646
"Denn immer wieder zeigt sich, dass auf kommunaler Ebene eben nach persönlicher Sympathie und Kompetenz und weniger nach Parteibuch entschieden wird",https://www.volksverpetzer.de/analyse/afd-osten-keiner-merkt-es/,www.volksverpetzer.de,Die AfD verliert alle Wahlen im Osten – und keiner bekommt es mit - Volksverpetzer,0.1,LOW,False,,,factcheck,2026-04-22T19:17:48.069735
"Zeit, über eine Tatsache zu sprechen, die sich heute niemand mehr bewusst zu sein scheint: Entgegen rechter Erzählungen, die so oft wiederholt wurden, dass es niemand mehr hinterfragt, gab es 2015 nie eine ""Grenzöffnung"" durch Deutschland",https://www.volksverpetzer.de/analyse/orban-schuld-an-2015/,www.volksverpetzer.de,"Die Wahrheit über Orbán, die AfD-Wähler nicht hören wollen - Volksverpetzer",0.1,LOW,False,,,factcheck,2026-04-22T19:17:49.049671
"Angela Merkel ließ legal offene Grenzen offen, wie auch gerichtlich bestätigt wurde",https://www.volksverpetzer.de/analyse/orban-schuld-an-2015/,www.volksverpetzer.de,"Die Wahrheit über Orbán, die AfD-Wähler nicht hören wollen - Volksverpetzer",0,LOW,False,,,factcheck,2026-04-22T19:17:49.142077
"Orbán war mitverantwortlich für den ""Kontrollverlust"" Im Juni 2015 gab Ungarn bekannt, dass keine Schutzsuchenden aus anderen europäischen Ländern mehr nach Ungarn zurückgenommen werden",https://www.volksverpetzer.de/analyse/orban-schuld-an-2015/,www.volksverpetzer.de,"Die Wahrheit über Orbán, die AfD-Wähler nicht hören wollen - Volksverpetzer",0.1,LOW,False,,,factcheck,2026-04-22T19:17:49.253205
[DEBUNKED] Orbáns Propagandisten für die AfD: Ungarns langer Arm bis Deutschland - Volksverpetzer,https://www.volksverpetzer.de/analyse/orbans-propagandisten-afd/,www.volksverpetzer.de,Orbáns Propagandisten für die AfD: Ungarns langer Arm bis Deutschland - Volksverpetzer,0.9,HIGH,True,FALSE - Debunked by fact-checkers,www.volksverpetzer.de,factcheck,2026-04-22T19:17:51.432751
[DEBUNKED] Energiewende: Wie Reiche mit falschen und irreführenden Zahlen täuscht - Volksverpetzer,https://www.volksverpetzer.de/faktencheck/reiche-faz-energiewende/,www.volksverpetzer.de,Energiewende: Wie Reiche mit falschen und irreführenden Zahlen täuscht - Volksverpetzer,0.9,HIGH,True,FALSE - Debunked by fact-checkers,www.volksverpetzer.de,factcheck,2026-04-22T19:17:52.426984
[DEBUNKED] Was Trump blocked from using nuclear codes against Iran? Not so fast | Snopes.com,https://www.snopes.com/fact-check/rump-nuclear-codes-iran/,www.snopes.com,Was Trump blocked from using nuclear codes against Iran? Not so fast | Snopes.com,0.9,HIGH,True,FALSE - Debunked by fact-checkers,www.snopes.com,factcheck,2026-04-22T19:17:53.675733
[DEBUNKED] California bill dubbed 'Stop Nick Shirley Act' wouldn't 'criminalize investigative journalism' | Snopes.com,https://www.snopes.com/fact-check/california-stop-nick-shirley-act/,www.snopes.com,California bill dubbed 'Stop Nick Shirley Act' wouldn't 'criminalize investigative journalism' | Sno,0.9,HIGH,True,FALSE - Debunked by fact-checkers,www.snopes.com,factcheck,2026-04-22T19:17:53.806400
[DEBUNKED] Did Trump share post threatening to release 'Vatican files' that could 'bring down' Catholic Church? | Snopes.com,https://www.snopes.com/fact-check/trump-vatican-files-post-fake/,www.snopes.com,Did Trump share post threatening to release 'Vatican files' that could 'bring down' Catholic Church?,0.9,HIGH,True,FALSE - Debunked by fact-checkers,www.snopes.com,factcheck,2026-04-22T19:17:54.259032
[DEBUNKED] Breaking down claim Trump evicted 74-year-old stroke victim in the '80s | Snopes.com,https://www.snopes.com/news/2026/04/22/trump-evict-stroke-victim-80s/,www.snopes.com,Breaking down claim Trump evicted 74-year-old stroke victim in the '80s | Snopes.com,0.9,HIGH,True,FALSE - Debunked by fact-checkers,www.snopes.com,factcheck,2026-04-22T19:17:54.403512
"[DEBUNKED] Is John Thune 'no longer considering' SAVE America Act in Senate, as Rep. Anna Paulina Luna claimed? | Snopes.com",https://www.snopes.com/fact-check/thune-save-america-act/,www.snopes.com,"Is John Thune 'no longer considering' SAVE America Act in Senate, as Rep. Anna Paulina Luna claimed?",0.9,HIGH,True,FALSE - Debunked by fact-checkers,www.snopes.com,factcheck,2026-04-22T19:17:54.540091
[DEBUNKED] Image claiming to show Trump's intact ear after assassination attempt is fake. Here's proof | Snopes.com,https://www.snopes.com/fact-check/trump-ear-image-assassination/,www.snopes.com,Image claiming to show Trump's intact ear after assassination attempt is fake. Here's proof | Snopes,0.9,HIGH,True,FALSE - Debunked by fact-checkers,www.snopes.com,factcheck,2026-04-22T19:17:54.665935
[DEBUNKED] Facts behind claim CNN reported 62M men visited 'online rape academy' | Snopes.com,https://www.snopes.com/fact-check/online-rape-academy-cnn/,www.snopes.com,Facts behind claim CNN reported 62M men visited 'online rape academy' | Snopes.com,0.9,HIGH,True,FALSE - Debunked by fact-checkers,www.snopes.com,factcheck,2026-04-22T19:17:55.103593
"[DEBUNKED] CNN reported on 'online rape academy,' but '62M men' figure misrepresents findings | Snopes.com",https://www.snopes.com/fact-check/cnn-online-rape-academy/,www.snopes.com,"CNN reported on 'online rape academy,' but '62M men' figure misrepresents findings | Snopes.com",0.9,HIGH,True,FALSE - Debunked by fact-checkers,www.snopes.com,factcheck,2026-04-22T19:17:55.256843
[DEBUNKED] PolitiFact | Facebook users shared a supposed video of Trump at Walter Reed hospital. It’s AI-generated,http://www.politifact.com/factchecks/2026/apr/21/facebook-posts/Trump-Walter-Reed-AI-video/,www.politifact.com,PolitiFact | Facebook users shared a supposed video of Trump at Walter Reed hospital. It’s AI-genera,0.9,HIGH,True,FALSE - Debunked by fact-checkers,www.politifact.com,factcheck,2026-04-22T19:17:55.860784
"In terms of percentage increase measured in actual dollars, Trump’s proposal would increase the defense budget by 44%, making it the largest percentage increase in actual dollars since the Korean War and the third largest since WWII",http://www.politifact.com/factchecks/2026/apr/20/democratic-national-committee/trump-defense-budget-ww2/,www.politifact.com,PolitiFact | Would Trump’s proposed military budget be the largest increase since WWII?,0,LOW,False,,,factcheck,2026-04-22T19:17:56.107119
"If the plan is approved, total national defense funding would increase by about 44%",http://www.politifact.com/factchecks/2026/apr/20/democratic-national-committee/trump-defense-budget-ww2/,www.politifact.com,PolitiFact | Would Trump’s proposed military budget be the largest increase since WWII?,0,LOW,False,,,factcheck,2026-04-22T19:17:56.215116
"7, 1941, bombing of Pearl Harbor, Congress approved a 1942 budget that included a landmark 299% military spending increase over the year before, according to th",http://www.politifact.com/factchecks/2026/apr/20/democratic-national-committee/trump-defense-budget-ww2/,www.politifact.com,PolitiFact | Would Trump’s proposed military budget be the largest increase since WWII?,0,LOW,False,,,factcheck,2026-04-22T19:17:56.320532
"[DEBUNKED] PolitiFact | This video shows a 2025 oil tankers collision, not a 2026 US strike on Iranian cargo ship",http://www.politifact.com/factchecks/2026/apr/20/social-media/old-video-us-attack-iran-ship/,www.politifact.com,"PolitiFact | This video shows a 2025 oil tankers collision, not a 2026 US strike on Iranian cargo sh",0.9,HIGH,True,FALSE - Debunked by fact-checkers,www.politifact.com,factcheck,2026-04-22T19:17:56.468188
"[DEBUNKED] PolitiFact | Social media users questioned Pete Hegseth, Pope Leo&#x27;s Bible quotes. Here&#x27;s the full context",http://www.politifact.com/article/2026/apr/17/Pope-Leo-Hegseth-Bible-verse-Jesus-Pulp-Fiction/,www.politifact.com,"PolitiFact | Social media users questioned Pete Hegseth, Pope Leo&#x27;s Bible quotes. Here&#x27;s t",0.9,HIGH,True,FALSE - Debunked by fact-checkers,www.politifact.com,factcheck,2026-04-22T19:17:56.618843
"More Info I would like to contribute One Time Monthly Yearly Join Now Restoration of America stated on April 13, 2026 in an ad: “83% of us favor requiring a photo ID to vote",http://www.politifact.com/factchecks/2026/apr/17/restoration-of-america/SAVE-America-Act-voter-ID-citizenship-poll/,www.politifact.com,PolitiFact | SAVE America Act ad cites voter ID poll from before bill and misleads on international ,0,LOW,False,,,factcheck,2026-04-22T19:17:56.979941
A 2025 Pew Research Center survey found 83% of U,http://www.politifact.com/factchecks/2026/apr/17/restoration-of-america/SAVE-America-Act-voter-ID-citizenship-poll/,www.politifact.com,PolitiFact | SAVE America Act ad cites voter ID poll from before bill and misleads on international ,0,LOW,False,,,factcheck,2026-04-22T19:17:57.097142
83% of us favor requiring a photo ID to vote,http://www.politifact.com/factchecks/2026/apr/17/restoration-of-america/SAVE-America-Act-voter-ID-citizenship-poll/,www.politifact.com,PolitiFact | SAVE America Act ad cites voter ID poll from before bill and misleads on international ,0,LOW,False,,,factcheck,2026-04-22T19:17:57.201679
[DEBUNKED] PolitiFact | Social media clips of crying U.S. soldiers may be AI-generated. Here’s how to spot them,http://www.politifact.com/article/2026/apr/16/US-military-iran-videos-AI-crying/,www.politifact.com,PolitiFact | Social media clips of crying U.S. soldiers may be AI-generated. Here’s how to spot them,0.9,HIGH,True,FALSE - Debunked by fact-checkers,www.politifact.com,factcheck,2026-04-22T19:17:57.478337
"5% of workers are in tipped jobs, including 5% of workers in the bottom quarter of earners, a Yale Budget Lab analysis found",http://www.politifact.com/article/2026/apr/14/Trump-taxes-Door-Dash-tips-overtime/,www.politifact.com,"PolitiFact | Trump tax cuts: Sorting truth versus spin on tips, overtime, Social Security policy bef",0,LOW,False,,,factcheck,2026-04-22T19:17:58.111969
[DEBUNKED] Fake image of people cleaning blood off street in Iran shared online – Full Fact,https://fullfact.org/conflict/ai-image-blood-street-iran-fake/,fullfact.org,Fake image of people cleaning blood off street in Iran shared online – Full Fact,0.9,HIGH,True,FALSE - Debunked by fact-checkers,fullfact.org,factcheck,2026-04-22T19:17:59.569719
[DEBUNKED] Fake AI-edited image of Reform UK MP Sarah Pochin circulates online – Full Fact,https://fullfact.org/politics/edited-image-reform-uk-sarah-pochin-campaign/,fullfact.org,Fake AI-edited image of Reform UK MP Sarah Pochin circulates online – Full Fact,0.9,HIGH,True,FALSE - Debunked by fact-checkers,fullfact.org,factcheck,2026-04-22T19:18:00.529328
[DEBUNKED] False claims about rioters recently storming migrant hotels in Rotherham and Tamworth circulate online – Full Fact,https://fullfact.org/immigration/false-claim-460-rioters-rotherham-tamworth-migrant-hotels/,fullfact.org,False claims about rioters recently storming migrant hotels in Rotherham and Tamworth circulate onli,0.9,HIGH,True,FALSE - Debunked by fact-checkers,fullfact.org,factcheck,2026-04-22T19:18:01.033565
[DEBUNKED] Video of Muslim women calling for Brighton beach to be dog-free is AI – Full Fact,https://fullfact.org/culture-and-society/muslim-women-beach-dogs-brighton-fake-ai/,fullfact.org,Video of Muslim women calling for Brighton beach to be dog-free is AI – Full Fact,0.9,HIGH,True,FALSE - Debunked by fact-checkers,fullfact.org,factcheck,2026-04-22T19:18:01.597673
"3%, roughly one in six, this is only the percentage of ‘economically active’ 16-24 year olds who are unemployed",https://fullfact.org/economy/youth-unemployment-wales/,fullfact.org,Are one in six young people in Wales unemployed? – Full Fact,0,LOW,False,,,factcheck,2026-04-22T19:18:03.227156
"3%, which is roughly one in six, this figure only refers to the percentage of ‘economically active’ 16-24 year olds in Wales who are unemployed",https://fullfact.org/economy/youth-unemployment-wales/,fullfact.org,Are one in six young people in Wales unemployed? – Full Fact,0,LOW,False,,,factcheck,2026-04-22T19:18:03.335164
[DEBUNKED] Old footage from China shared with false claims it shows attack on Israeli power plant – Full Fact,https://fullfact.org/conflict/miscaptioned-footage-haifa-power-plant-israel-iran-china/,fullfact.org,Old footage from China shared with false claims it shows attack on Israeli power plant – Full Fact,0.9,HIGH,True,FALSE - Debunked by fact-checkers,fullfact.org,factcheck,2026-04-22T19:18:03.843456
