claim,source_url,source_domain,article_title,risk_score,risk_category,has_factcheck,factcheck_rating,factcheck_source,source_type,checked_at
[DEBUNKED] Was man named Ethan Caldwell arrested for posing as museum tour guide? | Snopes.com,https://www.snopes.com/fact-check/ethan-caldwell-museum-guide-arrested/,www.snopes.com,Was man named Ethan Caldwell arrested for posing as museum tour guide? | Snopes.com,0.9,HIGH,True,FALSE - Debunked by fact-checkers,www.snopes.com,factcheck,2026-06-22T11:58:03.479290
[DEBUNKED] 19 rumors involving Hunter Biden from our archives | Snopes.com,https://www.snopes.com/collections/hunter-biden-collection/,www.snopes.com,19 rumors involving Hunter Biden from our archives | Snopes.com,0.9,HIGH,True,FALSE - Debunked by fact-checkers,www.snopes.com,factcheck,2026-06-22T11:58:03.570566
[DEBUNKED] Did Scotland fans give Lincoln Memorial statue a traffic cone hat? | Snopes.com,https://www.snopes.com/fact-check/abraham-lincoln-traffic-cone/,www.snopes.com,Did Scotland fans give Lincoln Memorial statue a traffic cone hat? | Snopes.com,0.9,HIGH,True,FALSE - Debunked by fact-checkers,www.snopes.com,factcheck,2026-06-22T11:58:03.653286
[DEBUNKED] Alleged image of graffiti beneath 'Department of War' sign isn't what it seems | Snopes.com,https://www.snopes.com/fact-check/graffiti-department-of-war/,www.snopes.com,Alleged image of graffiti beneath 'Department of War' sign isn't what it seems | Snopes.com,0.9,HIGH,True,FALSE - Debunked by fact-checkers,www.snopes.com,factcheck,2026-06-22T11:58:03.743618
[DEBUNKED] Claims Obama hasn't paid Black contractors who worked on library are missing key context | Snopes.com,https://www.snopes.com/news/2026/06/19/obama-library-contractors-not-paid/,www.snopes.com,Claims Obama hasn't paid Black contractors who worked on library are missing key context | Snopes.co,0.9,HIGH,True,FALSE - Debunked by fact-checkers,www.snopes.com,factcheck,2026-06-22T11:58:04.034848
[DEBUNKED] PolitiFact | Did Mike Collins ‘admit’ that Trump was in the Epstein files? A Jon Ossoff ad omits critical facts,http://www.politifact.com/factchecks/2026/jun/18/jon-ossoff/did-mike-collins-admit-that-trump-was-in-the-epste/,www.politifact.com,PolitiFact | Did Mike Collins ‘admit’ that Trump was in the Epstein files? A Jon Ossoff ad omits cri,0.9,HIGH,True,FALSE - Debunked by fact-checkers,www.politifact.com,factcheck,2026-06-22T11:58:04.213430
"Across the country, private companies are not required to give workers the day off, but an estimated 41% of employers with 500 or more employees do, according to a 2024 survey by consulting firm Mercer",http://www.politifact.com/article/2026/jun/18/juneteenth-has-been-a-federal-holiday-since-2021-b/,www.politifact.com,"PolitiFact | Juneteenth has been a federal holiday since 2021, but it’s not a paid day off in all 50",0.1,LOW,False,,,factcheck,2026-06-22T11:58:04.397134
"2% of the worker’s income into Social Security, up to the cap",http://www.politifact.com/factchecks/2026/jun/17/bernie-sanders/elon-musk-social-security-taxes-spacex/,www.politifact.com,PolitiFact | Social Security tax rules mean Elon Musk could pay the same or less than someone making,0,LOW,False,,,factcheck,2026-06-22T11:58:04.571243
"4% rate on their income, so their Social Security taxes would max out at $22,878",http://www.politifact.com/factchecks/2026/jun/17/bernie-sanders/elon-musk-social-security-taxes-spacex/,www.politifact.com,PolitiFact | Social Security tax rules mean Elon Musk could pay the same or less than someone making,0,LOW,False,,,factcheck,2026-06-22T11:58:04.660596
Caleb’s 20/13 vision is 30% better than the average person,http://www.politifact.com/factchecks/2026/jun/17/kenzie-annis/love-island-usa-fact-check-is-2030-vision-better-t/,www.politifact.com,PolitiFact | ‘Love Island USA’ fact-check: Is 20/30 vision better than 20/13 vision?,0,LOW,False,,,factcheck,2026-06-22T11:58:04.861230
"[DEBUNKED] PolitiFact | No, these aren’t images of the B-52 bomber crash at Edwards Air Force Base",http://www.politifact.com/article/2026/jun/16/B-52-bomber-crash-california-ai/,www.politifact.com,"PolitiFact | No, these aren’t images of the B-52 bomber crash at Edwards Air Force Base",0.9,HIGH,True,FALSE - Debunked by fact-checkers,www.politifact.com,factcheck,2026-06-22T11:58:05.069803
[DEBUNKED] PolitiFact | Is Graham Platner’s oyster farm ‘totally fake’? Fact-checking attack on Senate candidate from Maine,http://www.politifact.com/factchecks/2026/jun/16/steve-robinson/is-graham-platners-oyster-farm-totally-fake-fact-c/,www.politifact.com,PolitiFact | Is Graham Platner’s oyster farm ‘totally fake’? Fact-checking attack on Senate candidat,0.9,HIGH,True,FALSE - Debunked by fact-checkers,www.politifact.com,factcheck,2026-06-22T11:58:05.165057
"fail to reach a nuclear accord, he would restart military attacks or make the United States ""the guardian of the Middle East"" in return for 20% of the region’s revenues",http://www.politifact.com/article/2026/jun/15/Iran-nuclear-peace-deal-Obama-Strait-Hormuz/,www.politifact.com,PolitiFact | Would Trump’s Iran deal bring ‘peace’? Here’s why that is a stretch.,0,LOW,False,,,factcheck,2026-06-22T11:58:05.357080
"[DEBUNKED] PolitiFact | At the White House UFC fight, a victor said Michelle Obama is a man. That’s still Pants on Fire",http://www.politifact.com/factchecks/2026/jun/15/josh-hokit/josh-hokit-ufc-white-house-michelle-obama/,www.politifact.com,"PolitiFact | At the White House UFC fight, a victor said Michelle Obama is a man. That’s still Pants",0.9,HIGH,True,FALSE - Debunked by fact-checkers,www.politifact.com,factcheck,2026-06-22T11:58:05.442390
"Until now, the number of teams playing in the World Cup maxed out at 32 and the highest number of matches was 64 — about 40% fewer games than the U",http://www.politifact.com/article/2026/jun/12/World-cup-FIFA-tickets-pricing-Trump/,www.politifact.com,PolitiFact | Trump called the 2026 World Cup history’s ‘most successful.’ Problems cloud ticket sale,0,LOW,False,,,factcheck,2026-06-22T11:58:05.825419
"""If you live near one of these large data centers, your electricity bills over the last five years have gone up by as much as 267%,"" Warren said in a June 5 X post",http://www.politifact.com/factchecks/2026/jun/12/elizabeth-warren/data-centers-rising-electricity-costs/,www.politifact.com,PolitiFact | How much have data centers increased electricity prices?,0,LOW,False,,,factcheck,2026-06-22T11:58:06.034792
"That article found that wholesale prices in locations near data centers have risen, in some places, by ""as much as 267%"" compared with five years ago",http://www.politifact.com/factchecks/2026/jun/12/elizabeth-warren/data-centers-rising-electricity-costs/,www.politifact.com,PolitiFact | How much have data centers increased electricity prices?,0,LOW,False,,,factcheck,2026-06-22T11:58:06.137458
[DEBUNKED] PolitiFact | Would North Carolina bill allow the ‘murder’ of birth control users? Vague bill likely to stall,http://www.politifact.com/article/2026/jun/11/would-north-carolina-bill-allow-the-murder-of-birt/,www.politifact.com,PolitiFact | Would North Carolina bill allow the ‘murder’ of birth control users? Vague bill likely ,0.9,HIGH,True,FALSE - Debunked by fact-checkers,www.politifact.com,factcheck,2026-06-22T11:58:06.326996
"[DEBUNKED] No, an Iranian footballer wasn’t deported after New Zealand World Cup match – Full Fact",https://fullfact.org/sport/world-cup-Iran-footballer-not-deported-gun-celebration/,fullfact.org,"No, an Iranian footballer wasn’t deported after New Zealand World Cup match – Full Fact",0.9,HIGH,True,FALSE - Debunked by fact-checkers,fullfact.org,factcheck,2026-06-22T11:58:06.898204
[DEBUNKED] Row over ‘Jimmy Savile’ banner images in Makerfield by-election - were pictures shared online real or fake? – Full Fact,https://fullfact.org/politics/makerfield-election-lee-anderson-ai-edited-picture/,fullfact.org,Row over ‘Jimmy Savile’ banner images in Makerfield by-election - were pictures shared online real o,0.9,HIGH,True,FALSE - Debunked by fact-checkers,fullfact.org,factcheck,2026-06-22T11:58:07.391026
"[DEBUNKED] No, a BBC episode wasn’t taken down following a clash between Sir Jim Ratcliffe and Laura Kuenssberg – Full Fact",https://fullfact.org/politics/fake-guardian-article-laura-kuenssberg-jim-ratcliffe/,fullfact.org,"No, a BBC episode wasn’t taken down following a clash between Sir Jim Ratcliffe and Laura Kuenssberg",0.9,HIGH,True,FALSE - Debunked by fact-checkers,fullfact.org,factcheck,2026-06-22T11:58:07.796200
"[DEBUNKED] No, Tesco isn’t selling a nutribullet baby food processor for £1.99 – Full Fact",https://fullfact.org/shopping/tesco-nutribullet-baby-false/,fullfact.org,"No, Tesco isn’t selling a nutribullet baby food processor for £1.99 – Full Fact",0.9,HIGH,True,FALSE - Debunked by fact-checkers,fullfact.org,factcheck,2026-06-22T11:58:08.798103
[DEBUNKED] Viral image of Iran footballer holding pink school bag is AI – Full Fact,https://fullfact.org/sport/photo-iran-football-player-pink-school-bag-ai-world-cup/,fullfact.org,Viral image of Iran footballer holding pink school bag is AI – Full Fact,0.9,HIGH,True,FALSE - Debunked by fact-checkers,fullfact.org,factcheck,2026-06-22T11:58:09.273126
[DEBUNKED] Clip of fighter jet being shot down is from video game – Full Fact,https://fullfact.org/conflict/iran-israel-fighter-jet-video-game-war-thunder/,fullfact.org,Clip of fighter jet being shot down is from video game – Full Fact,0.9,HIGH,True,FALSE - Debunked by fact-checkers,fullfact.org,factcheck,2026-06-22T11:58:09.858355
[DEBUNKED] Footage of 2025 Ballymena fire falsely linked to recent Belfast riots – Full Fact,https://fullfact.org/crime/belfast-hmo-fire-video-old-ballymena/,fullfact.org,Footage of 2025 Ballymena fire falsely linked to recent Belfast riots – Full Fact,0.9,HIGH,True,FALSE - Debunked by fact-checkers,fullfact.org,factcheck,2026-06-22T11:58:10.233129
"&#8220;We cut the flow of fentanyl across our border by 59%, which is unheard of,&#8221; Trump said in May 22 remarks in New York",https://www.factcheck.org/2026/06/trump-makes-unsupported-claims-about-drug-flows/,www.factcheck.org,Trump Makes Unsupported Claims About Drug Flows - FactCheck.org,0,LOW,False,,,factcheck,2026-06-22T11:58:11.835159
"&#8220;And we cut the flow of fentanyl and drugs into our country by the ocean and the sea, in other words, coming in by water, by ocean and sea by 97%",https://www.factcheck.org/2026/06/trump-makes-unsupported-claims-about-drug-flows/,www.factcheck.org,Trump Makes Unsupported Claims About Drug Flows - FactCheck.org,0,LOW,False,,,factcheck,2026-06-22T11:58:11.933865
"Then, on May 28, in an interview with his daughter-in-law, Lara Trump, on Fox News, he said, &#8220;We have drugs down 97%",https://www.factcheck.org/2026/06/trump-makes-unsupported-claims-about-drug-flows/,www.factcheck.org,Trump Makes Unsupported Claims About Drug Flows - FactCheck.org,0,LOW,False,,,factcheck,2026-06-22T11:58:12.030629
[DEBUNKED] FactChecking Trump&#039;s Contentious &#039;Meet the Press&#039; Interview - FactCheck.org,https://www.factcheck.org/2026/06/factchecking-trumps-contentious-meet-the-press-interview/,www.factcheck.org,FactChecking Trump&#039;s Contentious &#039;Meet the Press&#039; Interview - FactCheck.org,0.9,HIGH,True,FALSE - Debunked by fact-checkers,www.factcheck.org,factcheck,2026-06-22T11:58:12.630125
[DEBUNKED] Trump Misrepresents Climate Change Scenarios - FactCheck.org,https://www.factcheck.org/2026/06/trump-misrepresents-climate-change-scenarios/,www.factcheck.org,Trump Misrepresents Climate Change Scenarios - FactCheck.org,0.9,HIGH,True,FALSE - Debunked by fact-checkers,www.factcheck.org,factcheck,2026-06-22T11:58:13.045952
"[DEBUNKED] Stopping Fraud Won&#039;t &#039;Save&#039; Social Security, Create &#039;Balanced Budget,&#039; as Trump Suggests - FactCheck.org",https://www.factcheck.org/2026/06/stopping-fraud-wont-save-social-security-create-balanced-budget-as-trump-suggests/,www.factcheck.org,"Stopping Fraud Won&#039;t &#039;Save&#039; Social Security, Create &#039;Balanced Budget,&#039; as T",0.9,HIGH,True,FALSE - Debunked by fact-checkers,www.factcheck.org,factcheck,2026-06-22T11:58:13.297635
“The measles vaccine prevents measles in 97% of the people who take it,https://www.factcheck.org/2026/05/a-timeline-of-rfk-jr-s-mixed-messaging-on-the-measles-vaccine/,www.factcheck.org,A Timeline of RFK Jr.&#039;s Mixed Messaging on the Measles Vaccine - FactCheck.org,0,LOW,False,,,factcheck,2026-06-22T11:58:13.481984
[DEBUNKED] Fact Check: NO EVIDENCE Image of '0-1' Spray-Painted Below 'Department of War' Plaque Is Real | Lead Stories,https://leadstories.com/hoax-alert/2026/06/fact-check-no-evidence-image-of-0-1-spray-painted-below-department-of-war-plaque-is-real.html,leadstories.com,Fact Check: NO EVIDENCE Image of '0-1' Spray-Painted Below 'Department of War' Plaque Is Real | Lead,0.9,HIGH,True,FALSE - Debunked by fact-checkers,leadstories.com,factcheck,2026-06-22T11:58:13.615513
[DEBUNKED] Fact Check: Review Does NOT Show Statistically Valid 'Vaxxed vs. Unvaxxed' Chronic Disease Analysis In Children | Lead Stories,https://leadstories.com/hoax-alert/2026/06/fact-check-review-does-not-show-statistically-valid-vaxxed-vs-unvaxxed-chronic-disease-analysis-in-children.html,leadstories.com,Fact Check: Review Does NOT Show Statistically Valid 'Vaxxed vs. Unvaxxed' Chronic Disease Analysis ,0.9,HIGH,True,FALSE - Debunked by fact-checkers,leadstories.com,factcheck,2026-06-22T11:58:13.743366
[DEBUNKED] Fact Check: FAKE Bodycam Footage Shows Traffic Stop Skit Of Nervous Teen Getting Driving Tips From Officer | Lead Stories,https://leadstories.com/hoax-alert/2026/06/fact-check-fake-bodycam-footage-shows-a-traffic-stop-skit-depicting-a-nervous-teen-getting-helpful-driving-tips-from-officer.html,leadstories.com,Fact Check: FAKE Bodycam Footage Shows Traffic Stop Skit Of Nervous Teen Getting Driving Tips From O,0.9,HIGH,True,FALSE - Debunked by fact-checkers,leadstories.com,factcheck,2026-06-22T11:58:13.874544
[DEBUNKED] Fact Check: FAKE Viral Image Of Brigitte Macron Pulling Away From Trump Trying To Kiss Her In Versailles | Lead Stories,https://leadstories.com/hoax-alert/2026/06/fact-check-fake-viral-image-of-brigitte-macron-pulling-away-from-trump.html,leadstories.com,Fact Check: FAKE Viral Image Of Brigitte Macron Pulling Away From Trump Trying To Kiss Her In Versai,0.9,HIGH,True,FALSE - Debunked by fact-checkers,leadstories.com,factcheck,2026-06-22T11:58:14.004980
"[DEBUNKED] Fact Check: EDITED Photo Falsely Shows Michelle Obama Standing Taller Than Barack Obama, Bidens, Bushes, Clintons | Lead Stories",https://leadstories.com/hoax-alert/2026/06/fact-check-edited-photo-falsely-shows-michelle-obama-standing-taller-than-barack-obama-bidens-bushes-clintons.html,leadstories.com,"Fact Check: EDITED Photo Falsely Shows Michelle Obama Standing Taller Than Barack Obama, Bidens, Bus",0.9,HIGH,True,FALSE - Debunked by fact-checkers,leadstories.com,factcheck,2026-06-22T11:58:14.148808
[DEBUNKED] Fact Check: Photo Is NOT Mugshot Of Woman Who 'Glued Her Husband's Butt Cheeks Together' -- Arrested For Arson  | Lead Stories,https://leadstories.com/hoax-alert/2026/06/fact-check-photo-not-mugshot-woman-who-glued-husband-butt-cheeks-together-arrested-arson.html,leadstories.com,Fact Check: Photo Is NOT Mugshot Of Woman Who 'Glued Her Husband's Butt Cheeks Together' -- Arrested,0.9,HIGH,True,FALSE - Debunked by fact-checkers,leadstories.com,factcheck,2026-06-22T11:58:14.275347
[DEBUNKED] Fact Check: FAKE Story About Ethan Caldwell Arrested For Pretending To Be A Museum Tour Guide And Making Up History Of Art -- It Is Satire | Lead Stories,https://leadstories.com/hoax-alert/2026/06/fact-check-fake-story-about-ethan-caldwell-museum-tour-guide-arrested-satire.html,leadstories.com,Fact Check: FAKE Story About Ethan Caldwell Arrested For Pretending To Be A Museum Tour Guide And Ma,0.9,HIGH,True,FALSE - Debunked by fact-checkers,leadstories.com,factcheck,2026-06-22T11:58:14.404796
[DEBUNKED] Fact Check: Image Was Altered With OpenAI Tools To Make German Soccer Fan Look Like Adolf Hitler | Lead Stories,https://leadstories.com/hoax-alert/2026/06/fact-check-image-altered-with-openai-tools-made-german-soccer-fan-in-the-stands-look-like-adolf-hitler.html,leadstories.com,Fact Check: Image Was Altered With OpenAI Tools To Make German Soccer Fan Look Like Adolf Hitler | L,0.9,HIGH,True,FALSE - Debunked by fact-checkers,leadstories.com,factcheck,2026-06-22T11:58:14.544432
[DEBUNKED] Fact Check: Britain Is NOT Banning VPNs Next Month -- It Proposed Ban On Social Media For Children Under 16 | Lead Stories,https://leadstories.com/hoax-alert/2026/06/fact-check-britain-is-not-banning-vpns-next-month-it-proposed-ban-on-social-media-for-children-under-16.html,leadstories.com,Fact Check: Britain Is NOT Banning VPNs Next Month -- It Proposed Ban On Social Media For Children U,0.9,HIGH,True,FALSE - Debunked by fact-checkers,leadstories.com,factcheck,2026-06-22T11:58:14.678863
"[DEBUNKED] Fact Check: FAKE Photos Of Barron Trump, Justin Trudeau Present False Comparison  | Lead Stories",https://leadstories.com/hoax-alert/2026/06/fact-check-fake-photos-of-barron-trump-justin-trudeau-present-false-comparison.html,leadstories.com,"Fact Check: FAKE Photos Of Barron Trump, Justin Trudeau Present False Comparison  | Lead Stories",0.9,HIGH,True,FALSE - Debunked by fact-checkers,leadstories.com,factcheck,2026-06-22T11:58:14.827355
[DEBUNKED] Fact Check: UFC Fighter Ciryl Gane Did NOT Refuse To Shake Hands With Donald Trump At White House Event | Lead Stories,https://leadstories.com/hoax-alert/2026/06/fact-check-gane-did-not-refuse-to-shake-hands-with-trump.html,leadstories.com,Fact Check: UFC Fighter Ciryl Gane Did NOT Refuse To Shake Hands With Donald Trump At White House Ev,0.9,HIGH,True,FALSE - Debunked by fact-checkers,leadstories.com,factcheck,2026-06-22T11:58:14.957179
[DEBUNKED] Fact Check: Video Does NOT Prove Donald Trump Jr. Opened Pack With White Substance At His Father's 80th Birthday | Lead Stories,https://leadstories.com/hoax-alert/2026/06/fact-check-video-does-not-prove-donald-trump-jr-opened-pack-with-white-substance.html,leadstories.com,Fact Check: Video Does NOT Prove Donald Trump Jr. Opened Pack With White Substance At His Father's 8,0.9,HIGH,True,FALSE - Debunked by fact-checkers,leadstories.com,factcheck,2026-06-22T11:58:15.081852
[DEBUNKED] Fact Check: U.S. Park Police Did Not Arrest 'Antifa Operatives' For Dumping Algae Into Reflecting Pool -- Claim Originated As Spoof | Lead Stories,https://leadstories.com/hoax-alert/2026/06/fact-check-us-park-police-did-not-arrest-antifa-operatives-for-dumping-algae-into-reflecting-pool-.html,leadstories.com,Fact Check: U.S. Park Police Did Not Arrest 'Antifa Operatives' For Dumping Algae Into Reflecting Po,0.9,HIGH,True,FALSE - Debunked by fact-checkers,leadstories.com,factcheck,2026-06-22T11:58:15.210829
[DEBUNKED] Fact Check: New York Knicks Did NOT Decline White House Invitation -- Date To Be Decided | Lead Stories,https://leadstories.com/hoax-alert/2026/06/fact-check-new-york-knicks-did-not-decline-white-house-invitation.html,leadstories.com,Fact Check: New York Knicks Did NOT Decline White House Invitation -- Date To Be Decided | Lead Stor,0.9,HIGH,True,FALSE - Debunked by fact-checkers,leadstories.com,factcheck,2026-06-22T11:58:15.351882
[DEBUNKED] Fact Check: Video Does NOT Show Algerian Fans Chanting 'Messi Is The Enemy Of Allah' Before World Cup Match With Argentina In Kansas City | Lead Stories,https://leadstories.com/hoax-alert/2026/06/fact-check-video-does-not-show-algerian-fans-chanting-messi-is-the-enemy-of-allah-before-world-cup-match-with-argentina.html,leadstories.com,Fact Check: Video Does NOT Show Algerian Fans Chanting 'Messi Is The Enemy Of Allah' Before World Cu,0.9,HIGH,True,FALSE - Debunked by fact-checkers,leadstories.com,factcheck,2026-06-22T11:58:15.509137
"[DEBUNKED] No, Kenya’s Mediamax has not announced Kameme FM will go offline - Africa Check",https://africacheck.org/fact-checks/meta-programme-fact-checks/no-kenyas-mediamax-has-not-announced-kameme-fm-will-go,africacheck.org,"No, Kenya’s Mediamax has not announced Kameme FM will go offline - Africa Check",0.9,HIGH,True,FALSE - Debunked by fact-checkers,africacheck.org,factcheck,2026-06-22T11:58:16.136178
[DEBUNKED] Ignore doctored image of Kenyan politicians Kimani Ichung’wa and Liza Chelule carrying bundles of cash - Africa Check,https://africacheck.org/fact-checks/meta-programme-fact-checks/ignore-doctored-image-kenyan-politicians-kimani-ichungwa-and,africacheck.org,Ignore doctored image of Kenyan politicians Kimani Ichung’wa and Liza Chelule carrying bundles of ca,0.9,HIGH,True,FALSE - Debunked by fact-checkers,africacheck.org,factcheck,2026-06-22T11:58:16.305655
[DEBUNKED] Kenya’s national exams body denies planning to replace teachers with non-teachers as test supervisors - Africa Check,https://africacheck.org/fact-checks/meta-programme-fact-checks/kenyas-national-exams-body-denies-planning-replace-teachers,africacheck.org,Kenya’s national exams body denies planning to replace teachers with non-teachers as test supervisor,0.9,HIGH,True,FALSE - Debunked by fact-checkers,africacheck.org,factcheck,2026-06-22T11:58:16.479881
[DEBUNKED] Nigeria’s ruling party has not released final list of senatorial candidates for 2027 elections - Africa Check,https://africacheck.org/fact-checks/meta-programme-fact-checks/nigerias-ruling-party-has-not-released-final-list-senatorial,africacheck.org,Nigeria’s ruling party has not released final list of senatorial candidates for 2027 elections - Afr,0.9,HIGH,True,FALSE - Debunked by fact-checkers,africacheck.org,factcheck,2026-06-22T11:58:16.640958
[DEBUNKED] Fabricated quote used to claim Trump warned Kenyan president Ruto over ‘oppressing Kenyans’ at G7 summit - Africa Check,https://africacheck.org/fact-checks/meta-programme-fact-checks/fabricated-quote-used-claim-trump-warned-kenyan-president,africacheck.org,Fabricated quote used to claim Trump warned Kenyan president Ruto over ‘oppressing Kenyans’ at G7 su,0.9,HIGH,True,FALSE - Debunked by fact-checkers,africacheck.org,factcheck,2026-06-22T11:58:16.824225
[DEBUNKED] Kenya Medical Research Institute dismisses claims about recruiting volunteers for malaria study - Africa Check,https://africacheck.org/fact-checks/meta-programme-fact-checks/kenya-medical-research-institute-dismisses-claims-about,africacheck.org,Kenya Medical Research Institute dismisses claims about recruiting volunteers for malaria study - Af,0.9,HIGH,True,FALSE - Debunked by fact-checkers,africacheck.org,factcheck,2026-06-22T11:58:17.000108
[DEBUNKED] Fake graphics used to claim Indian doctor contracted to poison former Kenyan prime minister Raila Odinga - Africa Check,https://africacheck.org/fact-checks/meta-programme-fact-checks/fake-graphics-used-claim-indian-doctor-contracted-poison,africacheck.org,Fake graphics used to claim Indian doctor contracted to poison former Kenyan prime minister Raila Od,0.9,HIGH,True,FALSE - Debunked by fact-checkers,africacheck.org,factcheck,2026-06-22T11:58:17.169389
[DEBUNKED] West African exam body did not announce deployment of security agencies to 2026 test centres - Africa Check,https://africacheck.org/fact-checks/meta-programme-fact-checks/west-african-exam-body-did-not-announce-deployment-security,africacheck.org,West African exam body did not announce deployment of security agencies to 2026 test centres - Afric,0.9,HIGH,True,FALSE - Debunked by fact-checkers,africacheck.org,factcheck,2026-06-22T11:58:17.341386
[DEBUNKED] Beware dodgy links: Nigeria’s electoral commission not hiring ad-hoc staff for 2027 elections - Africa Check,https://africacheck.org/fact-checks/meta-programme-fact-checks/beware-dodgy-links-nigerias-electoral-commission-not-hiring,africacheck.org,Beware dodgy links: Nigeria’s electoral commission not hiring ad-hoc staff for 2027 elections - Afri,0.9,HIGH,True,FALSE - Debunked by fact-checkers,africacheck.org,factcheck,2026-06-22T11:58:17.524129
"[DEBUNKED] Warmongering NATO, peaceful Belarus, and Bulgaria’s “punishment” - EUvsDisinfo",https://euvsdisinfo.eu/warmongering-nato-peaceful-belarus-and-bulgarias-punishment/,euvsdisinfo.eu,"Warmongering NATO, peaceful Belarus, and Bulgaria’s “punishment” - EUvsDisinfo",0.9,HIGH,True,FALSE - Debunked by fact-checkers,euvsdisinfo.eu,factcheck,2026-06-22T11:58:18.783034
"[DEBUNKED] Religion, drones, and “piracy”: latest trends in Russian FIMI - EUvsDisinfo",https://euvsdisinfo.eu/religion-drones-and-piracy-latest-trends-in-russian-fimi/,euvsdisinfo.eu,"Religion, drones, and “piracy”: latest trends in Russian FIMI - EUvsDisinfo",0.9,HIGH,True,FALSE - Debunked by fact-checkers,euvsdisinfo.eu,factcheck,2026-06-22T11:58:21.184446
"[DEBUNKED] Victim-blaming Kyiv, pressuring Moldova, and drone disinformation - EUvsDisinfo",https://euvsdisinfo.eu/victim-blaming-kyiv-pressuring-moldova-and-drone-disinformation/,euvsdisinfo.eu,"Victim-blaming Kyiv, pressuring Moldova, and drone disinformation - EUvsDisinfo",0.9,HIGH,True,FALSE - Debunked by fact-checkers,euvsdisinfo.eu,factcheck,2026-06-22T11:58:22.563583
"[DEBUNKED] Tough love: Spies, dating apps and the dark side of online intimacy - EUvsDisinfo",https://euvsdisinfo.eu/tough-love-spies-dating-apps-and-the-dark-side-of-online-intimacy/,euvsdisinfo.eu,"Tough love: Spies, dating apps and the dark side of online intimacy - EUvsDisinfo",0.9,HIGH,True,FALSE - Debunked by fact-checkers,euvsdisinfo.eu,factcheck,2026-06-22T11:58:24.990560
