claim,source_url,source_domain,article_title,risk_score,risk_category,has_factcheck,factcheck_rating,factcheck_source,source_type,checked_at
"[DEBUNKED] Fact Check: Video Of Transgender, LGBTQ+ People Blocked From Women's Restrooms Is NOT Real Footage | Lead Stories",https://leadstories.com/hoax-alert/2026/03/fact-check-video-of-transgender-lgbtq-people-blocked-from-womens-restrooms-is-not-real-footage.html,leadstories.com,"Fact Check: Video Of Transgender, LGBTQ+ People Blocked From Women's Restrooms Is NOT Real Footage |",0.9,HIGH,True,FALSE - Debunked by fact-checkers,leadstories.com,factcheck,2026-03-28T12:59:37.456666
[DEBUNKED] Fact Check: Photo Does NOT Show Hillary Clinton Pulling Jeffrey Epstein's Tie In Front Of Bill Clinton -- It's AI-Generated | Lead Stories,https://leadstories.com/hoax-alert/2026/03/fact-check-photo-does-not-show-hillary-clinton-pulling-jeffrey-epsteins-tie-in-front-of-bill-clinton.html,leadstories.com,Fact Check: Photo Does NOT Show Hillary Clinton Pulling Jeffrey Epstein's Tie In Front Of Bill Clint,0.9,HIGH,True,FALSE - Debunked by fact-checkers,leadstories.com,factcheck,2026-03-28T12:59:37.616366
[DEBUNKED] Fact Check: Skit Of ICE Agent Removing a U.S. Citizen From A Plane Is NOT Real | Lead Stories,https://leadstories.com/hoax-alert/2026/03/fact-check-skit-ice-agent-remove-us-citizen-plane-not-real.html,leadstories.com,Fact Check: Skit Of ICE Agent Removing a U.S. Citizen From A Plane Is NOT Real | Lead Stories,0.9,HIGH,True,FALSE - Debunked by fact-checkers,leadstories.com,factcheck,2026-03-28T12:59:37.758365
[DEBUNKED] Fact Check: Lunch Date Video Does NOT Show Real Woman Confronted By Her Husband For Cheating -- It's Staged Scene | Lead Stories,https://leadstories.com/hoax-alert/2026/03/fact-check-lunch-date-video-does-not-show-real-woman-confronted-by-her-husband-for-cheating.html,leadstories.com,Fact Check: Lunch Date Video Does NOT Show Real Woman Confronted By Her Husband For Cheating -- It's,0.9,HIGH,True,FALSE - Debunked by fact-checkers,leadstories.com,factcheck,2026-03-28T12:59:37.908735
[DEBUNKED] Fact Check: Video Does NOT Show Iranian Missiles Destroying U.S. Navy Warship In Strait Of Hormuz | Lead Stories,https://leadstories.com/hoax-alert/2026/03/fact-check-video-does-not-show-iranian-missiles-destroying-us-navy-warship-in-strait-of-hormuz.html,leadstories.com,Fact Check: Video Does NOT Show Iranian Missiles Destroying U.S. Navy Warship In Strait Of Hormuz | ,0.9,HIGH,True,FALSE - Debunked by fact-checkers,leadstories.com,factcheck,2026-03-28T12:59:38.045962
"[DEBUNKED] Fact Check: Erika Kirk Did NOT Announce She Is Opening An Orphanage ""In Honor Of Charlie"" -- It's A False Rumor Started From Clickbait | Lead Stories",https://leadstories.com/hoax-alert/2026/03/fact-check-erika-kirk-did-not-announce-she-is-opening-an-orphanage-in-honor-of-charlie.html,leadstories.com,"Fact Check: Erika Kirk Did NOT Announce She Is Opening An Orphanage ""In Honor Of Charlie"" -- It's A ",0.9,HIGH,True,FALSE - Debunked by fact-checkers,leadstories.com,factcheck,2026-03-28T12:59:38.186792
"[DEBUNKED] Fact Check: FAKE Photo Shows Hollywood Actors, Including Stallone and Schwarzenegger, Attending Chuck Norris' Funeral -- It's AI | Lead Stories",https://leadstories.com/hoax-alert/2026/03/fact-check-fake-photo-shows-hollywood-actors-including-stallone-and-schwarzenegger-attending-chuck-norris-funeral.html,leadstories.com,"Fact Check: FAKE Photo Shows Hollywood Actors, Including Stallone and Schwarzenegger, Attending Chuc",0.9,HIGH,True,FALSE - Debunked by fact-checkers,leadstories.com,factcheck,2026-03-28T12:59:38.324548
[DEBUNKED] Fact Check: Wolff's Book About Trump Does NOT Mention 'Gorilla Channel' -- It's A Joke From 2018 | Lead Stories,https://leadstories.com/hoax-alert/2026/03/fact-check-wolffs-book-about-trump-does-not-mention-gorilla-channel.html,leadstories.com,Fact Check: Wolff's Book About Trump Does NOT Mention 'Gorilla Channel' -- It's A Joke From 2018 | L,0.9,HIGH,True,FALSE - Debunked by fact-checkers,leadstories.com,factcheck,2026-03-28T12:59:38.464931
[DEBUNKED] Fact Check: Lufthansa Did NOT Offer Free Business Class Tickets To People In Israel To Apologize For Holocaust | Lead Stories,https://leadstories.com/hoax-alert/2026/03/fact-check-lufthansa-did-not-offer-free-business-class-tickets-to-people-in-israel-to-apologize-for-holocaust.html,leadstories.com,Fact Check: Lufthansa Did NOT Offer Free Business Class Tickets To People In Israel To Apologize For,0.9,HIGH,True,FALSE - Debunked by fact-checkers,leadstories.com,factcheck,2026-03-28T12:59:38.614660
[DEBUNKED] Fact Check: Trump Did NOT Announce That Everyone Born Before 2000 Would Have All Debt Erased | Lead Stories,https://leadstories.com/hoax-alert/2026/03/fact-check-trump-did-not-announce-that-everyone-born-before-2000-would-have-all-debt-erased.html,leadstories.com,Fact Check: Trump Did NOT Announce That Everyone Born Before 2000 Would Have All Debt Erased | Lead ,0.9,HIGH,True,FALSE - Debunked by fact-checkers,leadstories.com,factcheck,2026-03-28T12:59:38.767431
[DEBUNKED] Fact Check: Trump Did NOT Say Queen Elizabeth Should Pardon Prince Andrew -- Satire Post | Lead Stories,https://leadstories.com/hoax-alert/2026/03/fact-check-trump-did-not-say-queen-elizabeth-should-pardon-prince-andrew-satire.html,leadstories.com,Fact Check: Trump Did NOT Say Queen Elizabeth Should Pardon Prince Andrew -- Satire Post | Lead Stor,0.9,HIGH,True,FALSE - Debunked by fact-checkers,leadstories.com,factcheck,2026-03-28T12:59:38.934698
[DEBUNKED] Fact Check: FAKE Selfie Of Seven Dogs Walking Together In China Is NOT Real Photo | Lead Stories,https://leadstories.com/hoax-alert/2026/03/ffact-check-fake-selfie-of-seven-dogs-walking-together-in-china-is-not-real-photo.html,leadstories.com,Fact Check: FAKE Selfie Of Seven Dogs Walking Together In China Is NOT Real Photo | Lead Stories,0.9,HIGH,True,FALSE - Debunked by fact-checkers,leadstories.com,factcheck,2026-03-28T12:59:39.072098
[DEBUNKED] Fact Check: Kuwait Did NOT Declare War on Iran | Lead Stories,https://leadstories.com/hoax-alert/2026/03/fact-check-kuwait-did-not-declare-war-on-iran.html,leadstories.com,Fact Check: Kuwait Did NOT Declare War on Iran | Lead Stories,0.9,HIGH,True,FALSE - Debunked by fact-checkers,leadstories.com,factcheck,2026-03-28T12:59:39.215416
[DEBUNKED] Savannah Guthrie opens up about mother’s disappearance in heart-wrenching interview - Poynter,https://www.poynter.org/commentary/2026/savannah-guthrie-today-show-interview-hoda/,www.poynter.org,Savannah Guthrie opens up about mother’s disappearance in heart-wrenching interview - Poynter,0.9,HIGH,True,FALSE - Debunked by fact-checkers,www.poynter.org,factcheck,2026-03-28T12:59:39.400816
"(AP Photo/Julie Jacobson) By: Amaris Castillo March 26, 2026 --> --> About a quarter of all AM/FM radio stations in the United States have a faith focus, and 98% of U",https://www.poynter.org/reporting-editing/2026/christian-news-radio-united-states/,www.poynter.org,"A quarter of US radio stations are religious, and most listeners aren’t tuning in for politics, stud",0,LOW,False,,,factcheck,2026-03-28T12:59:40.635776
"Among listeners, 62% of those surveyed said they tune in because the content is “spiritually uplifting",https://www.poynter.org/reporting-editing/2026/christian-news-radio-united-states/,www.poynter.org,"A quarter of US radio stations are religious, and most listeners aren’t tuning in for politics, stud",0,LOW,False,,,factcheck,2026-03-28T12:59:40.730771
"Forty percent said those topics are a minor reason for listening to these stations, and just 14% called it a major one",https://www.poynter.org/reporting-editing/2026/christian-news-radio-united-states/,www.poynter.org,"A quarter of US radio stations are religious, and most listeners aren’t tuning in for politics, stud",0.1,LOW,False,,,factcheck,2026-03-28T12:59:40.823173
[DEBUNKED] IFCN Director Angie Drobnic Holan comments on Meta and community notes following the Oversight Board’s recent advisory - Poynter,https://www.poynter.org/ifcn/2026/ifcn-director-angie-drobnic-holan-comments-on-meta-and-community-notes-following-the-oversight-boards-recent-advisory/,www.poynter.org,IFCN Director Angie Drobnic Holan comments on Meta and community notes following the Oversight Board,0.9,HIGH,True,FALSE - Debunked by fact-checkers,www.poynter.org,factcheck,2026-03-28T12:59:40.985181
"Meta is responsible for 70% of that, while YouTube is responsible for the other 30%",https://www.poynter.org/commentary/2026/meta-and-youtube-lawsuit-social-media-addiction/,www.poynter.org,Big Tech just lost a ‘social media addiction’ case. It may not be the last. - Poynter,0,LOW,False,,,factcheck,2026-03-28T12:59:41.259119
"(Courtesy: Spencer Najera) By: Alex Mahadevan March 26, 2026 --> --> Of the 440 applications Texas Tribune chief product officer Darla Cameron received for an AI engineering role, 90% were junk",https://www.poynter.org/tech-tools/2026/how-to-start-using-ai-journalism/,www.poynter.org,AI advice from journalists who stopped talking and started building - Poynter,0,LOW,False,,,factcheck,2026-03-28T12:59:41.485372
"At the Pew Research Center, audience editor Claire Dannenbaum noticed her team was spending 95% of its time writing formulaic social media posts and only 5% actually engaging with audiences",https://www.poynter.org/tech-tools/2026/how-to-start-using-ai-journalism/,www.poynter.org,AI advice from journalists who stopped talking and started building - Poynter,0,LOW,False,,,factcheck,2026-03-28T12:59:41.582105
"[DEBUNKED] Who is keeping the war with Iran going? Trump, once again, blames the media. - Poynter",https://www.poynter.org/commentary/2026/trump-blames-media-war-iran/,www.poynter.org,"Who is keeping the war with Iran going? Trump, once again, blames the media. - Poynter",0.9,HIGH,True,FALSE - Debunked by fact-checkers,www.poynter.org,factcheck,2026-03-28T12:59:41.734914
"About 95% of TSA’s 60,000 employees are considered essential workers",https://www.poynter.org/fact-checking/2026/why-is-tsa-not-being-paid-ice-is/,www.poynter.org,Why are ICE agents still being paid during the shutdown while TSA workers aren’t? - Poynter,0,LOW,False,,,factcheck,2026-03-28T12:59:42.135288
Doch schon in den Siebzigerjahren wurde er immer wieder für große Kinoproduktionen gebucht,https://www.spiegel.de/kultur/kino/zurueck-in-die-zukunft-james-tolkan-ist-tot-a-b269bcc9-590a-4146-9952-fd76ad9c496d#ref=rss,www.spiegel.de,»Zurück in die Zukunft«: James Tolkan ist tot - DER SPIEGEL,0.1,LOW,False,,,mainstream,2026-03-28T12:59:51.363238
Doch nicht alle ihrer Flüche sind niedlich,https://www.spiegel.de/familie/leben-mit-downsyndrom-warum-ich-manchmal-lachen-muss-wenn-meine-tochter-schimpft-a-c000bba2-eea9-4e28-9a61-188b0badb32c#ref=rss,www.spiegel.de,"Leben mit Downsyndrom: Warum ich manchmal lachen muss, wenn meine Tochter schimpft - DER SPIEGEL",0.1,LOW,False,,,mainstream,2026-03-28T12:59:52.449073
"Wer hat schon Logopädie, keine Ahnung von Grammatik, aber trotzdem ein Gefühl für sprachliche Wirkung",https://www.spiegel.de/familie/leben-mit-downsyndrom-warum-ich-manchmal-lachen-muss-wenn-meine-tochter-schimpft-a-c000bba2-eea9-4e28-9a61-188b0badb32c#ref=rss,www.spiegel.de,"Leben mit Downsyndrom: Warum ich manchmal lachen muss, wenn meine Tochter schimpft - DER SPIEGEL",0.1,LOW,False,,,mainstream,2026-03-28T12:59:52.542982
"Natürlich könnte es sein, dass unsere Tochter einfach alle Flüche aneinanderreiht, die sie irgendwo aufgeschnappt hat",https://www.spiegel.de/familie/leben-mit-downsyndrom-warum-ich-manchmal-lachen-muss-wenn-meine-tochter-schimpft-a-c000bba2-eea9-4e28-9a61-188b0badb32c#ref=rss,www.spiegel.de,"Leben mit Downsyndrom: Warum ich manchmal lachen muss, wenn meine Tochter schimpft - DER SPIEGEL",0.1,LOW,False,,,mainstream,2026-03-28T12:59:52.635209
"Laut der Erhebung gaben 38 Prozent der befragten Frauen an, schon einmal gesundheitliche Beschwerden nach dem Dreh an der Uhr gehabt zu haben",https://www.spiegel.de/gesundheit/sommerzeit-frauen-leiden-offenbar-staerker-unter-zeitumstellung-a-cefad12a-3b94-4441-9bec-5fca2e7bf013#ref=rss,www.spiegel.de,Sommerzeit: Frauen leiden offenbar stärker unter Zeitumstellung - DER SPIEGEL,0,LOW,False,,,mainstream,2026-03-28T12:59:53.406936
Unter den Männern sind es 22 Prozent,https://www.spiegel.de/gesundheit/sommerzeit-frauen-leiden-offenbar-staerker-unter-zeitumstellung-a-cefad12a-3b94-4441-9bec-5fca2e7bf013#ref=rss,www.spiegel.de,Sommerzeit: Frauen leiden offenbar stärker unter Zeitumstellung - DER SPIEGEL,0,LOW,False,,,mainstream,2026-03-28T12:59:53.499682
Schlapp und müdeInsgesamt fühlen sich laut Umfrage etwa 30 Prozent aller Befragten durch die Zeitumstellung beeinträchtigt,https://www.spiegel.de/gesundheit/sommerzeit-frauen-leiden-offenbar-staerker-unter-zeitumstellung-a-cefad12a-3b94-4441-9bec-5fca2e7bf013#ref=rss,www.spiegel.de,Sommerzeit: Frauen leiden offenbar stärker unter Zeitumstellung - DER SPIEGEL,0.1,LOW,False,,,mainstream,2026-03-28T12:59:53.592725
"Dieser hatte seine Popularität in der Vergangenheit immer wieder dazu genutzt, um auf Gefahren für die mentale Gesundh",https://www.spiegel.de/panorama/leute/prinz-william-ruiniert-der-herzog-von-cornwall-den-bauern-die-mentale-gesundheit-a-4abcdb5e-e26e-4458-a67b-6a62b809aee1#ref=rss,www.spiegel.de,Prinz William: Ruiniert der Herzog von Cornwall den Bauern die mentale Gesundheit? - DER SPIEGEL,0.1,LOW,False,,,mainstream,2026-03-28T12:59:56.462677
"Zum Login SPIEGEL plus Nur für Neukunden € 1,– für 4 Wochen danach € 5,99 pro Woche Freier Zugriff auf alle S+-Artikel auf SPIEGEL",https://www.spiegel.de/netzwelt/collien-fernandes-wie-eine-protestbewegung-entsteht-und-warum-sie-fuer-opfer-so-wichtig-ist-a-b38bb09b-3db8-40b1-9c5c-7c186ffcfd00#ref=rss,www.spiegel.de,Collien Fernandes: Wie eine Protestbewegung entsteht und warum sie für Opfer so wichtig ist - DER SP,0.1,LOW,False,,,mainstream,2026-03-28T12:59:57.654811
"E-Paper (PDF), Digital-Archiv und S+-Newsletter Jederzeit kündigen Jetzt abonnieren SPIEGEL plus 52 Wochen 25 % sparen € 4,49 pro Woche für 52 Wochen danach € 5,99 pro Woche Freier Zugriff auf alle S+-Artikel auf SPIEGEL",https://www.spiegel.de/netzwelt/collien-fernandes-wie-eine-protestbewegung-entsteht-und-warum-sie-fuer-opfer-so-wichtig-ist-a-b38bb09b-3db8-40b1-9c5c-7c186ffcfd00#ref=rss,www.spiegel.de,Collien Fernandes: Wie eine Protestbewegung entsteht und warum sie für Opfer so wichtig ist - DER SP,0.1,LOW,False,,,mainstream,2026-03-28T12:59:57.752018
Das Quiz besteht immer aus sieben Fragen,https://www.spiegel.de/games/taegliches-quiz-beim-spiegel-7-fragen-zum-allgemeinwissen-pro-tag-a-8a9692b2-4462-4192-942c-fd7809c7519c#ref=rss,www.spiegel.de,Quiz des Tages beim SPIEGEL: 7 Fragen zum Allgemeinwissen pro Tag - DER SPIEGEL,0.1,LOW,False,,,mainstream,2026-03-28T12:59:59.404434
"Zum Login SPIEGEL plus Nur für Neukunden € 1,– für 4 Wochen danach € 5,99 pro Woche Freier Zugriff auf alle S+-Artikel auf SPIEGEL",https://www.spiegel.de/ausland/krieg-im-nahen-osten-warum-die-golfstaaten-ein-zu-schnelles-ende-des-krieges-fuerchten-a-50af600a-33b0-4647-8623-9ee5bcb2b78d#ref=rss,www.spiegel.de,Krieg im Nahen Osten: Warum die Golfstaaten ein zu schnelles Ende des Krieges fürchten - DER SPIEGEL,0.1,LOW,False,,,mainstream,2026-03-28T13:00:00.582237
"E-Paper (PDF), Digital-Archiv und S+-Newsletter Jederzeit kündigen Jetzt abonnieren SPIEGEL plus 52 Wochen 25 % sparen € 4,49 pro Woche für 52 Wochen danach € 5,99 pro Woche Freier Zugriff auf alle S+-Artikel auf SPIEGEL",https://www.spiegel.de/ausland/krieg-im-nahen-osten-warum-die-golfstaaten-ein-zu-schnelles-ende-des-krieges-fuerchten-a-50af600a-33b0-4647-8623-9ee5bcb2b78d#ref=rss,www.spiegel.de,Krieg im Nahen Osten: Warum die Golfstaaten ein zu schnelles Ende des Krieges fürchten - DER SPIEGEL,0.1,LOW,False,,,mainstream,2026-03-28T13:00:00.676178
Es war nach offiziellen Angaben der erste Vater-Sohn-Assist der bisherigen NBA-Historie,https://www.spiegel.de/sport/basketball/basketball-lebron-james-mit-erstem-vater-sohn-assist-der-nba-a-f4bb326a-95be-469e-a182-39dca1e107e7#ref=rss,www.spiegel.de,LeBron James mit erstem Vater-Sohn-Assist der NBA - DER SPIEGEL,0,LOW,False,,,mainstream,2026-03-28T13:00:01.358683
"Den Behörden ist die 1902 erbaute Zugtrasse ein Dorn im Auge: Immer wieder kommt es zu gefährlichen Situationen – 2022 überlebte ein koreanischer Besucher nur knapp, als er beim Fotografieren von einem Zug erfasst wurde",https://www.spiegel.de/reise/vietnam-hanoi-weltberuehmte-train-street-lockt-trotz-sicherheitsrisiko-a-78626b25-a723-4eac-9e70-cd274f491650#ref=rss,www.spiegel.de,Vietnam: Hanoi streitet weiter um seine »Train Street« - DER SPIEGEL,0.1,LOW,False,,,mainstream,2026-03-28T13:00:02.515205
"Bis Juli soll der Verkehr deutlich eingeschränkt werden, vor allem sollen keine Personenzüge mehr durch die Gasse fahren",https://www.spiegel.de/reise/vietnam-hanoi-weltberuehmte-train-street-lockt-trotz-sicherheitsrisiko-a-78626b25-a723-4eac-9e70-cd274f491650#ref=rss,www.spiegel.de,Vietnam: Hanoi streitet weiter um seine »Train Street« - DER SPIEGEL,0.1,LOW,False,,,mainstream,2026-03-28T13:00:02.569660
"Gut ein Fünftel (21 Prozent) hilft Beschäftigten bei der Wohnungssuche, etwa organisatorisch oder finanziell",https://www.spiegel.de/karriere/jede-zehnte-firma-bietet-wohnraum-fuer-beschaeftigte-a-4804e656-dcc8-4a7a-b04f-3ff7b6f08bb4#ref=rss,www.spiegel.de,Jede zehnte Firma bietet Wohnraum für Beschäftigte - DER SPIEGEL,0,LOW,False,,,mainstream,2026-03-28T13:00:03.330142
"Keine flächendeckende VerbreitungDirekte Angebote wie Werkswohnungen&nbsp; bleiben aber die Ausnahme, so die Studie",https://www.spiegel.de/karriere/jede-zehnte-firma-bietet-wohnraum-fuer-beschaeftigte-a-4804e656-dcc8-4a7a-b04f-3ff7b6f08bb4#ref=rss,www.spiegel.de,Jede zehnte Firma bietet Wohnraum für Beschäftigte - DER SPIEGEL,0.1,LOW,False,,,mainstream,2026-03-28T13:00:03.480718
Mitarbeiterwohnungen können laut IW-Studie punktuell zur Entlastung angespannter Wohnungsmärkte beitragen,https://www.spiegel.de/karriere/jede-zehnte-firma-bietet-wohnraum-fuer-beschaeftigte-a-4804e656-dcc8-4a7a-b04f-3ff7b6f08bb4#ref=rss,www.spiegel.de,Jede zehnte Firma bietet Wohnraum für Beschäftigte - DER SPIEGEL,0,LOW,False,,,mainstream,2026-03-28T13:00:03.578951
"&quot;In the last three years, we&#x27;ve seen the average cost of the price for food go up by 25%, we&#x27;ve seen our energy costs go up 35%, the national living wage has gone up by just under 40%",https://www.bbc.com/news/articles/cwywxlvelevo?at_medium=RSS&amp;at_campaign=rss,www.bbc.com,Teenagers say weekend and Saturday jobs are &#x27;impossible&#x27; to find,0,LOW,False,,,mainstream,2026-03-28T13:00:06.735958
Around 20% of the world’s oil supply normally passes through the Strait of Hormuz - the narrow waterway between Iran and the horn-like tip of the Arabian peninsula,https://www.bbc.com/news/videos/cx24jk0z74yo?at_medium=RSS&amp;at_campaign=rss,www.bbc.com,Watch: Why is it so hard to pass through the Strait of Hormuz?,0,LOW,False,,,mainstream,2026-03-28T13:00:07.086127
