claim,source_url,source_domain,article_title,risk_score,risk_category,has_factcheck,factcheck_rating,factcheck_source,source_type,checked_at
[DEBUNKED] Bielefeld: Neuer Oberbürgermeister-Kandidat ist „KI-Satire“,https://correctiv.org/faktencheck/2026/04/28/bielefeld-oberbuergermeister-kandidat-ist-ki-satire/,correctiv.org,Bielefeld: Neuer Oberbürgermeister-Kandidat ist „KI-Satire“,0.9,HIGH,True,FALSE - Debunked by fact-checkers,correctiv.org,factcheck,2026-04-29T03:23:15.568240
"[DEBUNKED] Doch, Leitungswasser gilt weiterhin als Trinkwasser",https://correctiv.org/faktencheck/2026/04/28/doch-deutsches-leitungswasser-gilt-weiterhin-als-trinkwasser/,correctiv.org,"Doch, Leitungswasser gilt weiterhin als Trinkwasser",0.9,HIGH,True,FALSE - Debunked by fact-checkers,correctiv.org,factcheck,2026-04-29T03:23:16.460547
[DEBUNKED] Umbau der Demokratieförderung schwächt Schulen - correctiv.org,https://correctiv.org/aktuelles/bildung/2026/04/28/streichliste-demokratie-leben-schwaecht-die-schulen/,correctiv.org,Umbau der Demokratieförderung schwächt Schulen - correctiv.org,0.9,HIGH,True,FALSE - Debunked by fact-checkers,correctiv.org,factcheck,2026-04-29T03:23:17.389235
"November 2023, über das heute noch immer diskutiert wird, beginnt mit einem „Gedicht“",https://correctiv.org/aktuelles/neue-rechte/2026/04/28/dies-unser-volk-bislang-unveroeffentlichte-inhalte-der-potsdam-konferenz/,correctiv.org,„Dies unser Volk!“ – Bislang unveröffentlichte Inhalte der Potsdam-Konferenz - correctiv.org,0.1,LOW,False,,,factcheck,2026-04-29T03:23:18.456225
"Vermutlich wissen nicht alle Anwesenden, wer auf der Aufnahme zu hören ist",https://correctiv.org/aktuelles/neue-rechte/2026/04/28/dies-unser-volk-bislang-unveroeffentlichte-inhalte-der-potsdam-konferenz/,correctiv.org,„Dies unser Volk!“ – Bislang unveröffentlichte Inhalte der Potsdam-Konferenz - correctiv.org,0.1,LOW,False,,,factcheck,2026-04-29T03:23:18.550299
[DEBUNKED] Tiktok-Video zeigt nicht Zehntausende bei Demo gegen Kanzler-Gehalt,https://correctiv.org/faktencheck/2026/04/24/merz-muss-weg-video-zeigt-demo-gegen-benzinpreise-nicht-kanzler-gehalt/,correctiv.org,Tiktok-Video zeigt nicht Zehntausende bei Demo gegen Kanzler-Gehalt,0.9,HIGH,True,FALSE - Debunked by fact-checkers,correctiv.org,factcheck,2026-04-29T03:23:19.351437
April 2026 Laut Polizeilicher Kriminalstatistik ist die Anzahl von Straftaten im Jahr 2025 gesunken,https://correctiv.org/faktencheck/hintergrund/2026/04/24/kriminalstatistik-cannabis-legalisierung-nicht-allein-fuer-rueckgang-von-straftaten-verantwortlich/,correctiv.org,Kriminalstatistik: Cannabis-Legalisierung nicht allein für Straftaten-Rückgang verantwortlich,0,LOW,False,,,factcheck,2026-04-29T03:23:20.226648
[DEBUNKED] Die wichtigsten Fakten zum deutsch-türkischen Sozialabkommen,https://correctiv.org/faktencheck/hintergrund/2026/04/24/fakten-zum-deutsch-tuerkischen-sozialabkommen-debatte-um-familienversicherung/,correctiv.org,Die wichtigsten Fakten zum deutsch-türkischen Sozialabkommen,0.9,HIGH,True,FALSE - Debunked by fact-checkers,correctiv.org,factcheck,2026-04-29T03:23:21.155509
[DEBUNKED] Bundestag debattiert über CORRECTIV-Recherche,https://correctiv.org/in-eigener-sache/2026/04/24/bundestag-debattiert-ueber-correctiv-recherche-geheimplan-gegen-deutschland/,correctiv.org,Bundestag debattiert über CORRECTIV-Recherche,0.9,HIGH,True,FALSE - Debunked by fact-checkers,correctiv.org,factcheck,2026-04-29T03:23:21.941462
Das Familienministerium sichert nun den Start zum neuen Schuljahr sowie Plätze für alle zu,https://correctiv.org/aktuelles/bildung/2026/04/24/rechtsanspruch-auf-ganztag-kommt-trotz-sparliste-wie-geplant/,correctiv.org,Rechtsanspruch auf Ganztag kommt trotz Sparliste wie geplant - correctiv.org,0.1,LOW,False,,,factcheck,2026-04-29T03:23:22.814950
"April 2026 Wenn alle Erstklässler ab August Anspruch auf Ganztagsbetreuung haben, brauchen manche Kommunen noch mehr Schulmensen",https://correctiv.org/aktuelles/bildung/2026/04/24/rechtsanspruch-auf-ganztag-kommt-trotz-sparliste-wie-geplant/,correctiv.org,Rechtsanspruch auf Ganztag kommt trotz Sparliste wie geplant - correctiv.org,0.1,LOW,False,,,factcheck,2026-04-29T03:23:22.928837
"000 Kinder wiederholen die erste Klasse Bereits 2021 trat das Ganztagsfördergesetz in Kraft, nach dem ab dem kommenden Schuljahr alle Erstklässler in Deutschland Anspruch auf eine Ganztagsbetreuung haben",https://correctiv.org/aktuelles/bildung/2026/04/24/rechtsanspruch-auf-ganztag-kommt-trotz-sparliste-wie-geplant/,correctiv.org,Rechtsanspruch auf Ganztag kommt trotz Sparliste wie geplant - correctiv.org,0.1,LOW,False,,,factcheck,2026-04-29T03:23:23.042945
Dort verzeichnete nur rund jede dreizehnte Gemeinde ein Einnahmeplus von 10 Prozent oder mehr verglichen mit dem Vorjahr,https://correctiv.org/aktuelles/politik-2/2026/04/24/grundsteuerreform-fuehrt-sie-wirklich-zu-steuererhoehungen/,correctiv.org,Grundsteuerreform: Führt sie wirklich zu Steuererhöhungen? - correctiv.org,0,LOW,False,,,factcheck,2026-04-29T03:23:23.913188
Anders in Hessen: Dort nahm fast die Hälfte der Städte und Gemeinden mindestens 10 Prozent mehr ein,https://correctiv.org/aktuelles/politik-2/2026/04/24/grundsteuerreform-fuehrt-sie-wirklich-zu-steuererhoehungen/,correctiv.org,Grundsteuerreform: Führt sie wirklich zu Steuererhöhungen? - correctiv.org,0,LOW,False,,,factcheck,2026-04-29T03:23:24.014511
Alle Angaben zu Grundsteuereinnahmen in diesem Artikel beziehen sich auf die Grundsteuer B,https://correctiv.org/aktuelles/politik-2/2026/04/24/grundsteuerreform-fuehrt-sie-wirklich-zu-steuererhoehungen/,correctiv.org,Grundsteuerreform: Führt sie wirklich zu Steuererhöhungen? - correctiv.org,0.1,LOW,False,,,factcheck,2026-04-29T03:23:24.129965
"Deutschland schickt zwar eine Delegation, kann aber bislang keine konkreten neuen Zusagen vorweisen",https://correctiv.org/aktuelles/klimawandel/2026/04/23/deutschland-hat-fuer-klimakonferenz-in-kolumbien-nichts-neues-im-gepaeck/,correctiv.org,Deutschland hat für Klimakonferenz in Kolumbien nichts Neues im Gepäck,0.1,LOW,False,,,factcheck,2026-04-29T03:23:25.907343
Keine gute Vorbereitung für die Reise nach Kolumbien,https://correctiv.org/aktuelles/klimawandel/2026/04/23/deutschland-hat-fuer-klimakonferenz-in-kolumbien-nichts-neues-im-gepaeck/,correctiv.org,Deutschland hat für Klimakonferenz in Kolumbien nichts Neues im Gepäck,0.1,LOW,False,,,factcheck,2026-04-29T03:23:26.009053
Martin Sellner hat sein „Remigrationskonzept“ in Potsdam vorgestellt und das auch später bestätigt,https://correctiv.org/in-eigener-sache/2026/04/23/rechtliche-auseinandersetzungen-um-geheimplan-gegen-deutschland-eine-einordnung/,correctiv.org,Rechtliche Auseinandersetzungen um „Geheimplan gegen Deutschland”: Eine Einordnung - correctiv.org,0,LOW,False,,,factcheck,2026-04-29T03:23:26.923593
[DEBUNKED] AfD-Klage zur Bundestagswahl 2025 frei erfunden - correctiv.org,https://correctiv.org/faktencheck/aus-der-community/2026/04/23/afd-klage-zur-bundestagswahl-2025-frei-erfunden/,correctiv.org,AfD-Klage zur Bundestagswahl 2025 frei erfunden - correctiv.org,0.9,HIGH,True,FALSE - Debunked by fact-checkers,correctiv.org,factcheck,2026-04-29T03:23:27.723509
[DEBUNKED] Schöne Lügen: Wie KI-Frauen für die AfD und Erotik-Plattformen werben,https://correctiv.org/faktencheck/hintergrund/2026/04/28/wie-ki-frauen-fuer-afd-und-erotik-werben-tiktok/,correctiv.org,Schöne Lügen: Wie KI-Frauen für die AfD und Erotik-Plattformen werben,0.9,HIGH,True,FALSE - Debunked by fact-checkers,correctiv.org,factcheck,2026-04-29T03:23:28.653156
[DEBUNKED] Syrer verklagt Jobcenter wegen Bürgergeld – Ist das echt?,https://www.mimikama.org/verklagt-ein-syrer-das-jobcenter-wegen-buergergeld/,www.mimikama.org,Syrer verklagt Jobcenter wegen Bürgergeld – Ist das echt?,0.9,HIGH,True,FALSE - Debunked by fact-checkers,www.mimikama.org,factcheck,2026-04-29T03:23:28.762500
[DEBUNKED] Greift Googles Gemini auf private Fotos zu?,https://www.mimikama.org/google-gemini-private-fotos/,www.mimikama.org,Greift Googles Gemini auf private Fotos zu?,0.9,HIGH,True,FALSE - Debunked by fact-checkers,www.mimikama.org,factcheck,2026-04-29T03:23:28.987601
[DEBUNKED] So funktionieren WhatsApp-Fake-Abstimmungen,https://www.mimikama.org/whatsapp-fake-abstimmungen-voting-seite-qr-code/,www.mimikama.org,So funktionieren WhatsApp-Fake-Abstimmungen,0.9,HIGH,True,FALSE - Debunked by fact-checkers,www.mimikama.org,factcheck,2026-04-29T03:23:29.182764
[DEBUNKED] Kirchenglockenläuten verboten? Debatte über Tradition und Ruhezeiten,https://www.mimikama.org/wird-kirchenglockenlaeuten-wirklich-verboten/,www.mimikama.org,Kirchenglockenläuten verboten? Debatte über Tradition und Ruhezeiten,0.9,HIGH,True,FALSE - Debunked by fact-checkers,www.mimikama.org,factcheck,2026-04-29T03:23:29.306637
[DEBUNKED] Ist die WhatsApp-Abstimmung für &quot;Franziska&quot; echt?,https://www.mimikama.org/whatsapp-abstimmung-franziska-fake/,www.mimikama.org,Ist die WhatsApp-Abstimmung für &quot;Franziska&quot; echt?,0.9,HIGH,True,FALSE - Debunked by fact-checkers,www.mimikama.org,factcheck,2026-04-29T03:23:29.432961
[DEBUNKED] Faktencheck: Deutschland hat keinen Molten-Salt-Reactor gestartet,https://www.mimikama.org/molten-salt-reactor-in-deutschland/,www.mimikama.org,Faktencheck: Deutschland hat keinen Molten-Salt-Reactor gestartet,0.9,HIGH,True,FALSE - Debunked by fact-checkers,www.mimikama.org,factcheck,2026-04-29T03:23:29.555795
[DEBUNKED] Warum AfD-Storys mit Alice Weidel so überzeugend wirken,https://www.mimikama.org/afd-narrative-weidel-storys/,www.mimikama.org,Warum AfD-Storys mit Alice Weidel so überzeugend wirken,0.9,HIGH,True,FALSE - Debunked by fact-checkers,www.mimikama.org,factcheck,2026-04-29T03:23:29.760079
[DEBUNKED] Faktencheck: Stimmt die Ukraine-Rentenerhöhung um 12 Prozent?,https://www.mimikama.org/ukraine-rentenerhoehung-12-prozent/,www.mimikama.org,Faktencheck: Stimmt die Ukraine-Rentenerhöhung um 12 Prozent?,0.9,HIGH,True,FALSE - Debunked by fact-checkers,www.mimikama.org,factcheck,2026-04-29T03:23:29.864402
[DEBUNKED] Medienkompetenz für Kinder: Was sie in jedem Alter lernen sollten,https://www.mimikama.org/medienkompetenz-nach-alter/,www.mimikama.org,Medienkompetenz für Kinder: Was sie in jedem Alter lernen sollten,0.9,HIGH,True,FALSE - Debunked by fact-checkers,www.mimikama.org,factcheck,2026-04-29T03:23:30.364250
[DEBUNKED] Vergleichsdruck bei Kindern? So reagieren Eltern richtig,https://www.mimikama.org/andere-eltern-lockerer/,www.mimikama.org,Vergleichsdruck bei Kindern? So reagieren Eltern richtig,0.9,HIGH,True,FALSE - Debunked by fact-checkers,www.mimikama.org,factcheck,2026-04-29T03:23:30.485542
[DEBUNKED] Kontrolle bei Medien: Wie viel ist sinnvoll für Eltern?,https://www.mimikama.org/kontrolle-oder-vertrauen/,www.mimikama.org,Kontrolle bei Medien: Wie viel ist sinnvoll für Eltern?,0.9,HIGH,True,FALSE - Debunked by fact-checkers,www.mimikama.org,factcheck,2026-04-29T03:23:30.882023
"[DEBUNKED] Bill Gates, Zecken und Fleischallergie: Stimmt das?",https://www.mimikama.org/bill-gates-zecken-fleischallergie-alpha-gal/,www.mimikama.org,"Bill Gates, Zecken und Fleischallergie: Stimmt das?",0.9,HIGH,True,FALSE - Debunked by fact-checkers,www.mimikama.org,factcheck,2026-04-29T03:23:30.994219
[DEBUNKED] Vorsicht: Deepfakes in Schulen – KI-Nacktbilder als digitale Gewalt,https://www.mimikama.org/deepfakes-schule/,www.mimikama.org,Vorsicht: Deepfakes in Schulen – KI-Nacktbilder als digitale Gewalt,0.9,HIGH,True,FALSE - Debunked by fact-checkers,www.mimikama.org,factcheck,2026-04-29T03:23:31.429090
[DEBUNKED] Kind orten per Handy – So nutzen Sie Standortfreigabe richtig!,https://www.mimikama.org/standortfreigabe/,www.mimikama.org,Kind orten per Handy – So nutzen Sie Standortfreigabe richtig!,0.9,HIGH,True,FALSE - Debunked by fact-checkers,www.mimikama.org,factcheck,2026-04-29T03:23:31.872936
[DEBUNKED] &quot;Sämtlich unwahr&quot;: Gericht-Doppel-Klatsche für Reichelts Hetz-Portal NIUS! - Volksverpetzer,https://www.volksverpetzer.de/aktuelles/gericht-doppel-klatsche-nius/,www.volksverpetzer.de,&quot;Sämtlich unwahr&quot;: Gericht-Doppel-Klatsche für Reichelts Hetz-Portal NIUS! - Volksverpetze,0.9,HIGH,True,FALSE - Debunked by fact-checkers,www.volksverpetzer.de,factcheck,2026-04-29T03:23:32.480369
"Immer wieder Robert Habeck, Karl Lauterbach, Dunja Hayali, wirklich ganz oft Merkel, aber auch Spahn, Söder und viele, viele mehr sind pausenlos Ziel des rechten Hasses und strafrechtlich relevanter Morddrohungen",https://www.volksverpetzer.de/aktuelles/extrem-hass-afd-merz-reiche/,www.volksverpetzer.de,Morddrohungen: So extrem ist der Hass in AfD-Gruppen auf Merz und Reiche - Volksverpetzer,0.1,LOW,False,,,factcheck,2026-04-29T03:23:33.211010
&#8220; Und noch nie machte der rechte Hass natürlich Halt vor der CDU oder CSU,https://www.volksverpetzer.de/aktuelles/extrem-hass-afd-merz-reiche/,www.volksverpetzer.de,Morddrohungen: So extrem ist der Hass in AfD-Gruppen auf Merz und Reiche - Volksverpetzer,0.1,LOW,False,,,factcheck,2026-04-29T03:23:33.322149
"Im Jahr 2025 sank die Zahl der angezeigten Verbrechen deutlich (-5,6%)",https://www.volksverpetzer.de/analyse/auslaenderkriminalitaet-geht-zurueck/,www.volksverpetzer.de,(Ausländer)Kriminalität geht zurück! Wie du über Sicherheit belogen wirst - Volksverpetzer,0,LOW,False,,,factcheck,2026-04-29T03:23:34.078423
"So gingen zum Beispiel zurück: Gewaltkriminalität (-2,3%), Straßenkriminalität (-7%), Raubüberfälle (-6%) oder Betrug (-8%)",https://www.volksverpetzer.de/analyse/auslaenderkriminalitaet-geht-zurueck/,www.volksverpetzer.de,(Ausländer)Kriminalität geht zurück! Wie du über Sicherheit belogen wirst - Volksverpetzer,0,LOW,False,,,factcheck,2026-04-29T03:23:34.178640
Und auch die Zahl der ausländischen Tatverdächtigen (-10%) und ihr Anteil an den Straftaten (-2%) ging zurück,https://www.volksverpetzer.de/analyse/auslaenderkriminalitaet-geht-zurueck/,www.volksverpetzer.de,(Ausländer)Kriminalität geht zurück! Wie du über Sicherheit belogen wirst - Volksverpetzer,0,LOW,False,,,factcheck,2026-04-29T03:23:34.261835
"Wildtiere, die an Orten auftauchen, an denen Menschen sie nicht gewohnt sind, sorgen ja immer wieder für Schlagzeilen und Diskussionen",https://www.volksverpetzer.de/aktuelles/rechte-ostsee-wal-afd/,www.volksverpetzer.de,"So weird versuchen manche AfD-Fans, den Ostsee-Wal zu instrumentalisieren! - Volksverpetzer",0.1,LOW,False,,,factcheck,2026-04-29T03:23:34.986300
"März strandete er mehrmals in der Ostsee, konnte sich aber immer wieder durch Rettungsmaßnahmen freischwimmen",https://www.volksverpetzer.de/aktuelles/rechte-ostsee-wal-afd/,www.volksverpetzer.de,"So weird versuchen manche AfD-Fans, den Ostsee-Wal zu instrumentalisieren! - Volksverpetzer",0.1,LOW,False,,,factcheck,2026-04-29T03:23:35.097153
""" Andere sagen ""Rettet Wale und keine Migranten",https://www.volksverpetzer.de/aktuelles/rechte-ostsee-wal-afd/,www.volksverpetzer.de,"So weird versuchen manche AfD-Fans, den Ostsee-Wal zu instrumentalisieren! - Volksverpetzer",0.1,LOW,False,,,factcheck,2026-04-29T03:23:35.199098
[DEBUNKED] Dreiste Wählertäuschung! Juristen zerlegen Migrations-Pläne der AfD Sachsen-Anhalt - Volksverpetzer,https://www.volksverpetzer.de/analyse/afd-sachsen-anhalt-migration-luege/,www.volksverpetzer.de,Dreiste Wählertäuschung! Juristen zerlegen Migrations-Pläne der AfD Sachsen-Anhalt - Volksverpetzer,0.9,HIGH,True,FALSE - Debunked by fact-checkers,www.volksverpetzer.de,factcheck,2026-04-29T03:23:35.827042
"Screenshot Jeder Blick in den Spiegel wird zur Bewertung, jeder Millimeter des Gesichts zu einem Datenpunkt",https://www.volksverpetzer.de/analyse/looksmaxxing-tiktok-nazi/,www.volksverpetzer.de,Looksmaxxing – Macht dieser TikTok-Trend dein Kind zum Nazi? - Volksverpetzer,0,LOW,False,,,factcheck,2026-04-29T03:23:37.171317
"Wissenschaftliche Belege gibt es dafür zwar keine, trotzdem scheint das nur die wenigsten abzuschrecken",https://www.volksverpetzer.de/analyse/looksmaxxing-tiktok-nazi/,www.volksverpetzer.de,Looksmaxxing – Macht dieser TikTok-Trend dein Kind zum Nazi? - Volksverpetzer,0.1,LOW,False,,,factcheck,2026-04-29T03:23:37.278742
In beiden Ländern träumt die AfD seit Monaten angesichts von Umfragewerten von deutlich über 30 bis zu 40 Prozent von der Regierung und sieht die Wahlen in Baden-Württemberg und Rheinland-Pfalz als gutes Vorzeichen,https://www.volksverpetzer.de/analyse/afd-osten-keiner-merkt-es/,www.volksverpetzer.de,Die AfD verliert alle Wahlen im Osten – und keiner bekommt es mit - Volksverpetzer,0,LOW,False,,,factcheck,2026-04-29T03:23:37.998416
"Bei den Bürgermeisterwahlen im vorpommerschen Anklam gewann der amtierende Bürgermeister Michael Galander von der Wählergemeinschaft Initiativen für Anklam mit 72,13 Prozent haushoch gegen AfD-Kandidat Jörg Valentin (27,9 Prozent)",https://www.volksverpetzer.de/analyse/afd-osten-keiner-merkt-es/,www.volksverpetzer.de,Die AfD verliert alle Wahlen im Osten – und keiner bekommt es mit - Volksverpetzer,0,LOW,False,,,factcheck,2026-04-29T03:23:38.098464
"Denn immer wieder zeigt sich, dass auf kommunaler Ebene eben nach persönlicher Sympathie und Kompetenz und weniger nach Parteibuch entschieden wird",https://www.volksverpetzer.de/analyse/afd-osten-keiner-merkt-es/,www.volksverpetzer.de,Die AfD verliert alle Wahlen im Osten – und keiner bekommt es mit - Volksverpetzer,0.1,LOW,False,,,factcheck,2026-04-29T03:23:38.198833
"Zeit, über eine Tatsache zu sprechen, die sich heute niemand mehr bewusst zu sein scheint: Entgegen rechter Erzählungen, die so oft wiederholt wurden, dass es niemand mehr hinterfragt, gab es 2015 nie eine ""Grenzöffnung"" durch Deutschland",https://www.volksverpetzer.de/analyse/orban-schuld-an-2015/,www.volksverpetzer.de,"Die Wahrheit über Orbán, die AfD-Wähler nicht hören wollen - Volksverpetzer",0.1,LOW,False,,,factcheck,2026-04-29T03:23:50.104302
"Angela Merkel ließ legal offene Grenzen offen, wie auch gerichtlich bestätigt wurde",https://www.volksverpetzer.de/analyse/orban-schuld-an-2015/,www.volksverpetzer.de,"Die Wahrheit über Orbán, die AfD-Wähler nicht hören wollen - Volksverpetzer",0,LOW,False,,,factcheck,2026-04-29T03:23:50.211633
"Orbán war mitverantwortlich für den ""Kontrollverlust"" Im Juni 2015 gab Ungarn bekannt, dass keine Schutzsuchenden aus anderen europäischen Ländern mehr nach Ungarn zurückgenommen werden",https://www.volksverpetzer.de/analyse/orban-schuld-an-2015/,www.volksverpetzer.de,"Die Wahrheit über Orbán, die AfD-Wähler nicht hören wollen - Volksverpetzer",0.1,LOW,False,,,factcheck,2026-04-29T03:23:50.310214
[DEBUNKED] Orbáns Propagandisten für die AfD: Ungarns langer Arm bis Deutschland - Volksverpetzer,https://www.volksverpetzer.de/analyse/orbans-propagandisten-afd/,www.volksverpetzer.de,Orbáns Propagandisten für die AfD: Ungarns langer Arm bis Deutschland - Volksverpetzer,0.9,HIGH,True,FALSE - Debunked by fact-checkers,www.volksverpetzer.de,factcheck,2026-04-29T03:23:51.855555
[DEBUNKED] Did Kid Rock address Pentagon about Strait of Hormuz? Photo is miscaptioned | Snopes.com,https://www.snopes.com/fact-check/kid-rock-address-pentagon/,www.snopes.com,Did Kid Rock address Pentagon about Strait of Hormuz? Photo is miscaptioned | Snopes.com,0.9,HIGH,True,FALSE - Debunked by fact-checkers,www.snopes.com,factcheck,2026-04-29T03:23:52.283042
[DEBUNKED] Did White House Correspondents' dinner shooting suspect work as driver for Savannah Guthrie? | Snopes.com,https://www.snopes.com/fact-check/correspondents-dinner-suspect-savannah-guthrie/,www.snopes.com,Did White House Correspondents' dinner shooting suspect work as driver for Savannah Guthrie? | Snope,0.9,HIGH,True,FALSE - Debunked by fact-checkers,www.snopes.com,factcheck,2026-04-29T03:23:52.452319
[DEBUNKED] 22 claims about Trump's 2024 assassination attempt we've investigated | Snopes.com,https://www.snopes.com/collections/trump-assassination-attempt-claims/,www.snopes.com,22 claims about Trump's 2024 assassination attempt we've investigated | Snopes.com,0.9,HIGH,True,FALSE - Debunked by fact-checkers,www.snopes.com,factcheck,2026-04-29T03:23:52.591180
[DEBUNKED] Did acting AG Todd Blanche say predators won't be prosecuted in Epstein case? There's no proof | Snopes.com,https://www.snopes.com/fact-check/blanche-esptein-prosecution-quote/,www.snopes.com,Did acting AG Todd Blanche say predators won't be prosecuted in Epstein case? There's no proof | Sno,0.9,HIGH,True,FALSE - Debunked by fact-checkers,www.snopes.com,factcheck,2026-04-29T03:23:53.395594
[DEBUNKED] Is this video of snowy giant sequoia tree real? | Snopes.com,https://www.snopes.com/fact-check/giant-sequoia-video/,www.snopes.com,Is this video of snowy giant sequoia tree real? | Snopes.com,0.9,HIGH,True,FALSE - Debunked by fact-checkers,www.snopes.com,factcheck,2026-04-29T03:23:53.532709
[DEBUNKED] Does photo show Stephen Miller using pregnant wife as 'human shield' at White House correspondents' dinner? | Snopes.com,https://www.snopes.com/fact-check/miller-pregnant-wife-human-shield/,www.snopes.com,Does photo show Stephen Miller using pregnant wife as 'human shield' at White House correspondents' ,0.9,HIGH,True,FALSE - Debunked by fact-checkers,www.snopes.com,factcheck,2026-04-29T03:23:53.671399
[DEBUNKED] Is White House correspondents' dinner shooting suspect registered Democrat who donated to Harris? | Snopes.com,https://www.snopes.com/fact-check/cole-tomas-allen-democrat-harris/,www.snopes.com,Is White House correspondents' dinner shooting suspect registered Democrat who donated to Harris? | ,0.9,HIGH,True,FALSE - Debunked by fact-checkers,www.snopes.com,factcheck,2026-04-29T03:23:53.801222
"Drought Monitor, and about 22% of the state is in an ""exceptional drought,"" the system’s highest level",http://www.politifact.com/article/2026/apr/27/Florida-drought-hurricane-season-active/,www.politifact.com,PolitiFact | DeSantis said Florida’s drought could bring a quieter hurricane season. Is that true?,0,LOW,False,,,factcheck,2026-04-29T03:23:54.330049
[DEBUNKED] PolitiFact | Fact-checking falsehoods after shooting in hotel hosting correspondents’ dinner Trump attended,http://www.politifact.com/article/2026/apr/26/Trump-White-House-correspondents-dinner-conspiracy/,www.politifact.com,PolitiFact | Fact-checking falsehoods after shooting in hotel hosting correspondents’ dinner Trump a,0.9,HIGH,True,FALSE - Debunked by fact-checkers,www.politifact.com,factcheck,2026-04-29T03:23:54.810665
[DEBUNKED] PolitiFact | Florida governor’s race: Fact-checking whether Byron Donalds voted against military pay raises,http://www.politifact.com/factchecks/2026/apr/23/jay-collins/byron-donalds-florida-military-pay-votes/,www.politifact.com,PolitiFact | Florida governor’s race: Fact-checking whether Byron Donalds voted against military pay,0.9,HIGH,True,FALSE - Debunked by fact-checkers,www.politifact.com,factcheck,2026-04-29T03:23:54.947566
"“If you have a $600 drug and you reduce it to $10, that's a 600% reduction",http://www.politifact.com/factchecks/2026/apr/23/robert-f-kennedy-jr/percentage-decreases-drug-prices-trump-math/,www.politifact.com,PolitiFact | RFK Jr. said there&#x27;s more than one way to calculate a percentage decrease. That do,0,LOW,False,,,factcheck,2026-04-29T03:23:55.169417
"For anything higher than a 100% decrease in price, the seller would be paying the customer to take the product",http://www.politifact.com/factchecks/2026/apr/23/robert-f-kennedy-jr/percentage-decreases-drug-prices-trump-math/,www.politifact.com,PolitiFact | RFK Jr. said there&#x27;s more than one way to calculate a percentage decrease. That do,0.1,LOW,False,,,factcheck,2026-04-29T03:23:55.252413
"3% decrease, not a 600% decrease",http://www.politifact.com/factchecks/2026/apr/23/robert-f-kennedy-jr/percentage-decreases-drug-prices-trump-math/,www.politifact.com,PolitiFact | RFK Jr. said there&#x27;s more than one way to calculate a percentage decrease. That do,0,LOW,False,,,factcheck,2026-04-29T03:23:55.356263
"More Info I would like to contribute One Time Monthly Yearly Join Now Joe Rogan stated on April 18, 2026 in comments at the Oval Office: “With one dose of ibogaine, more than 80% of people are free of (opioid) addiction",http://www.politifact.com/factchecks/2026/apr/22/joe-rogan/ibogaine-opioid-addiction-psychedelic-withdrawal/,www.politifact.com,PolitiFact | Joe Rogan exaggerates efficacy of psychedelic ibogaine for treating opioid addiction,0,LOW,False,,,factcheck,2026-04-29T03:23:55.599766
"With two doses, it's more than 90%",http://www.politifact.com/factchecks/2026/apr/22/joe-rogan/ibogaine-opioid-addiction-psychedelic-withdrawal/,www.politifact.com,PolitiFact | Joe Rogan exaggerates efficacy of psychedelic ibogaine for treating opioid addiction,0,LOW,False,,,factcheck,2026-04-29T03:23:55.699773
"These small, observational studies found opioid cessation rates between 23% to 55% after a year",http://www.politifact.com/factchecks/2026/apr/22/joe-rogan/ibogaine-opioid-addiction-psychedelic-withdrawal/,www.politifact.com,PolitiFact | Joe Rogan exaggerates efficacy of psychedelic ibogaine for treating opioid addiction,0,LOW,False,,,factcheck,2026-04-29T03:23:55.798063
"More Info I would like to contribute One Time Monthly Yearly Join Now Chris Wright stated on April 19, 2026 in an interview on CNN&#x27;s &quot;State of the Union&quot;: Solar and wind have not reached “3% of global energy",http://www.politifact.com/factchecks/2026/apr/22/chris-wright/wind-solar-energy-oil-strait-hormuz-iran/,www.politifact.com,"PolitiFact | Solar and wind account for 3% of global energy, but are a growing power source for home",0,LOW,False,,,factcheck,2026-04-29T03:23:56.173883
