claim,source_url,source_domain,article_title,risk_score,risk_category,has_factcheck,factcheck_rating,factcheck_source,source_type,checked_at
[DEBUNKED] Social media posts share fake Boots La Roche-Posay offer – Full Fact,https://fullfact.org/shopping/boots-larocheposay-set-false/,fullfact.org,Social media posts share fake Boots La Roche-Posay offer – Full Fact,0.9,HIGH,True,FALSE - Debunked by fact-checkers,fullfact.org,factcheck,2026-05-26T03:42:44.358792
[DEBUNKED] Image of crowd doesn’t show last weekend’s Unite the Kingdom march – Full Fact,https://fullfact.org/politics/image-crowd-unite-kingdom-old-AI/,fullfact.org,Image of crowd doesn’t show last weekend’s Unite the Kingdom march – Full Fact,0.9,HIGH,True,FALSE - Debunked by fact-checkers,fullfact.org,factcheck,2026-05-26T03:42:44.910143
"[DEBUNKED] Video shows church attack in Mexico, not Yorkshire – Full Fact",https://fullfact.org/world/video-church-attack-mexico-not-yorkshire/,fullfact.org,"Video shows church attack in Mexico, not Yorkshire – Full Fact",0.9,HIGH,True,FALSE - Debunked by fact-checkers,fullfact.org,factcheck,2026-05-26T03:42:45.491645
"[DEBUNKED] No, the UK Government’s X account hasn’t been suspended – Full Fact",https://fullfact.org/politics/uk-gov-x-account-not-suspended/,fullfact.org,"No, the UK Government’s X account hasn’t been suspended – Full Fact",0.9,HIGH,True,FALSE - Debunked by fact-checkers,fullfact.org,factcheck,2026-05-26T03:42:45.952716
[DEBUNKED] Video of 2025 Unite the Kingdom protest shared as last weekend’s march – Full Fact,https://fullfact.org/politics/old-video-2025-unite-the-kingdom-march/,fullfact.org,Video of 2025 Unite the Kingdom protest shared as last weekend’s march – Full Fact,0.9,HIGH,True,FALSE - Debunked by fact-checkers,fullfact.org,factcheck,2026-05-26T03:42:47.543887
[DEBUNKED] Viral post includes several false claims about UK taxes – Full Fact,https://fullfact.org/economy/viral-post-includes-false-claims-about-UK-taxes/,fullfact.org,Viral post includes several false claims about UK taxes – Full Fact,0.9,HIGH,True,FALSE - Debunked by fact-checkers,fullfact.org,factcheck,2026-05-26T03:42:48.116987
[DEBUNKED] China hasn’t banned US citizens over hantavirus – Full Fact,https://fullfact.org/health/China-US-hantavirus-ban-false/,fullfact.org,China hasn’t banned US citizens over hantavirus – Full Fact,0.9,HIGH,True,FALSE - Debunked by fact-checkers,fullfact.org,factcheck,2026-05-26T03:42:48.692079
[DEBUNKED] RFK Jr.’s Muddled Claims on Drug Approval Speed - FactCheck.org,https://www.factcheck.org/2026/05/rfk-jr-s-muddled-claims-on-drug-approval-speed/,www.factcheck.org,RFK Jr.’s Muddled Claims on Drug Approval Speed - FactCheck.org,0.9,HIGH,True,FALSE - Debunked by fact-checkers,www.factcheck.org,factcheck,2026-05-26T03:42:49.280723
"[DEBUNKED] Ad in Texas GOP Runoff Attacks Cornyn on Immigration, Islam - FactCheck.org",https://www.factcheck.org/2026/05/ad-in-texas-gop-runoff-attacks-cornyn-on-immigration-islam/,www.factcheck.org,"Ad in Texas GOP Runoff Attacks Cornyn on Immigration, Islam - FactCheck.org",0.9,HIGH,True,FALSE - Debunked by fact-checkers,www.factcheck.org,factcheck,2026-05-26T03:42:49.816357
"56, or 53%, from the average price of $2",https://www.factcheck.org/2026/05/what-will-happen-to-gasoline-prices-when-the-iran-war-ends/,www.factcheck.org,What Will Happen To Gasoline Prices When the Iran War Ends? - FactCheck.org,0,LOW,False,,,factcheck,2026-05-26T03:42:50.534702
[DEBUNKED] Kennedy Denies the One Big Beautiful Bill Act&#039;s Spending Cuts to Medicaid - FactCheck.org,https://www.factcheck.org/2026/05/kennedy-denies-the-one-big-beautiful-bill-acts-spending-cuts-to-medicaid/,www.factcheck.org,Kennedy Denies the One Big Beautiful Bill Act&#039;s Spending Cuts to Medicaid - FactCheck.org,0.9,HIGH,True,FALSE - Debunked by fact-checkers,www.factcheck.org,factcheck,2026-05-26T03:42:51.831081
[DEBUNKED] Fact Check: Kid Rock Did NOT Say He 'Will Not Put Out Any More Music' If Democrats Win The House During The Midterms | Lead Stories,https://leadstories.com/hoax-alert/2026/05/fact-check-kid-rock-did-not-say-he-wouldnt-put-out-more-music-democrats-midterms.html,leadstories.com,Fact Check: Kid Rock Did NOT Say He 'Will Not Put Out Any More Music' If Democrats Win The House Dur,0.9,HIGH,True,FALSE - Debunked by fact-checkers,leadstories.com,factcheck,2026-05-26T03:42:53.686667
[DEBUNKED] Fact Check: No Evidence Bahamas Barred Trump From Attending Son's Wedding Under Immigration Laws | Lead Stories,https://leadstories.com/hoax-alert/2026/05/fact-check-no-evidence-bahamas-barred-trump-from-attending-sons-wedding-under-immigration-laws.html,leadstories.com,Fact Check: No Evidence Bahamas Barred Trump From Attending Son's Wedding Under Immigration Laws | L,0.9,HIGH,True,FALSE - Debunked by fact-checkers,leadstories.com,factcheck,2026-05-26T03:42:53.852235
[DEBUNKED] Fact Check: Fake Video Of HOA Courtroom Drama Is AI-Generated Engagement Bait | Lead Stories,https://leadstories.com/hoax-alert/2026/05/fact-check-fake-video-of-hoa-courtroom-drama-is-ai-generated-engagement-bait.html,leadstories.com,Fact Check: Fake Video Of HOA Courtroom Drama Is AI-Generated Engagement Bait | Lead Stories,0.9,HIGH,True,FALSE - Debunked by fact-checkers,leadstories.com,factcheck,2026-05-26T03:42:54.022448
[DEBUNKED] Fact Check: FAKE Video Shows Scooter Snapping In Half At A Green Light -- AI-Generated | Lead Stories,https://leadstories.com/hoax-alert/2026/05/fact-check-fake-video-of-scooter-snapping-in-half-at-a-green-light-is-not-real-footage.html,leadstories.com,Fact Check: FAKE Video Shows Scooter Snapping In Half At A Green Light -- AI-Generated | Lead Storie,0.9,HIGH,True,FALSE - Debunked by fact-checkers,leadstories.com,factcheck,2026-05-26T03:42:54.173185
[DEBUNKED] Fact Check: Posts Saying Your Favorite Celeb Filed a $50 Million Defamation Lawsuit Against A News Host for On-Air Defamation Are NOT Real -- Spam From Vietnam | Lead Stories,https://leadstories.com/hoax-alert/2026/05/fact-check-posts-saying-celeb-warned-you-defamed-me-on-live-tv-are-not-real.html,leadstories.com,Fact Check: Posts Saying Your Favorite Celeb Filed a $50 Million Defamation Lawsuit Against A News H,0.9,HIGH,True,FALSE - Debunked by fact-checkers,leadstories.com,factcheck,2026-05-26T03:42:54.329997
[DEBUNKED] Fact Check: 'Sovereign Settings' Do NOT Exist On X | Lead Stories,https://leadstories.com/hoax-alert/2026/05/fact-check-sovereign-settings-do-not-exist-on-x.html,leadstories.com,Fact Check: 'Sovereign Settings' Do NOT Exist On X | Lead Stories,0.9,HIGH,True,FALSE - Debunked by fact-checkers,leadstories.com,factcheck,2026-05-26T03:42:54.491038
[DEBUNKED] Fact Check: James Woods Did Not Call President Trump The 'Most Treacherous And Truly Worthless Republican Leader In The History Of The Party' -- He Was Referring To Senate Majority Leader John Thune | Lead Stories,https://leadstories.com/hoax-alert/2026/05/fact-check-james-woods-did-not-call-president-trump-the-most-treacherous-and-truly-worthless-republican-leader-in-the-history-of-the-party.html,leadstories.com,Fact Check: James Woods Did Not Call President Trump The 'Most Treacherous And Truly Worthless Repub,0.9,HIGH,True,FALSE - Debunked by fact-checkers,leadstories.com,factcheck,2026-05-26T03:42:54.648297
[DEBUNKED] Fact Check: OpenAI Has NOT Announced Plans To Let Users 'Securely Connect' ChatGPT To Their DNA -- Parody Post | Lead Stories,https://leadstories.com/hoax-alert/2026/05/fact-check-openai-has-not-announced-plans-to-let-users-securely-connect-chatgpt-to-their-dna-parody-post.html,leadstories.com,Fact Check: OpenAI Has NOT Announced Plans To Let Users 'Securely Connect' ChatGPT To Their DNA -- P,0.9,HIGH,True,FALSE - Debunked by fact-checkers,leadstories.com,factcheck,2026-05-26T03:42:54.813819
[DEBUNKED] Fact Check: Video Of Alleged Hitler Lookalike Is NOT Real Footage Of Person At Soccer Match In Argentina | Lead Stories,https://leadstories.com/hoax-alert/2026/05/fact-check-video-of-hitler-lookalike-is-not-real-footage.html,leadstories.com,Fact Check: Video Of Alleged Hitler Lookalike Is NOT Real Footage Of Person At Soccer Match In Argen,0.9,HIGH,True,FALSE - Debunked by fact-checkers,leadstories.com,factcheck,2026-05-26T03:42:54.986539
"[DEBUNKED] Fact Check: Video Of Fox News Guest Robert Harward, Focus Of 'Face Mask' Rumors, Is REAL And Unedited | Lead Stories",https://leadstories.com/hoax-alert/2026/05/fact-check-video-of-fox-news-guest-robert-harward-focus-of-face-mask-rumors-is-real-not-ai.html,leadstories.com,"Fact Check: Video Of Fox News Guest Robert Harward, Focus Of 'Face Mask' Rumors, Is REAL And Unedite",0.9,HIGH,True,FALSE - Debunked by fact-checkers,leadstories.com,factcheck,2026-05-26T03:42:55.154642
[DEBUNKED] Fact Check: FAKE Video Shows Trump Touching And Kissing Man's Belly -- Originated From Known Parody Account | Lead Stories,https://leadstories.com/hoax-alert/2026/05/fact-check-altered-video-showing-trump-touching-and-kissing-mans-belly-originated-from-known-satire-account.html,leadstories.com,Fact Check: FAKE Video Shows Trump Touching And Kissing Man's Belly -- Originated From Known Parody ,0.9,HIGH,True,FALSE - Debunked by fact-checkers,leadstories.com,factcheck,2026-05-26T03:42:55.309652
[DEBUNKED] Fact Check: Man In Video Saying He Would Cast Unclaimed Ballots For Spencer Pratt For Los Angeles Mayor Can't -- NOT LA Ballots | Lead Stories,https://leadstories.com/hoax-alert/2026/05/fact-check-multiple-ballots-filled-out-mailed-by-one-person-voting-spencer-pratt-la-mayor-will-not-counted.html,leadstories.com,Fact Check: Man In Video Saying He Would Cast Unclaimed Ballots For Spencer Pratt For Los Angeles Ma,0.9,HIGH,True,FALSE - Debunked by fact-checkers,leadstories.com,factcheck,2026-05-26T03:42:55.484678
[DEBUNKED] Fact Check: FAKE Video Shows Tesla Cybertruck Carrying Solar Panels -- Original Poster Admits It Is AI-Generated | Lead Stories,https://leadstories.com/hoax-alert/2026/05/fact-check-fake-video-shows-tesla-cybertruck-carrying-solar-panels.html,leadstories.com,Fact Check: FAKE Video Shows Tesla Cybertruck Carrying Solar Panels -- Original Poster Admits It Is ,0.9,HIGH,True,FALSE - Debunked by fact-checkers,leadstories.com,factcheck,2026-05-26T03:42:55.642430
[DEBUNKED] Fact Check: FAKE Image Of Judge Hugging '88-Year-Old Man Named Vietnam Veteran' Is NOT Real Photo | Lead Stories,https://leadstories.com/hoax-alert/2026/05/fact-check-image-of-judge-hugging-88-year-old-man-named-vietnam-veteran-is-not-real-photo.html,leadstories.com,Fact Check: FAKE Image Of Judge Hugging '88-Year-Old Man Named Vietnam Veteran' Is NOT Real Photo | ,0.9,HIGH,True,FALSE - Debunked by fact-checkers,leadstories.com,factcheck,2026-05-26T03:42:55.817224
[DEBUNKED] Fact Check: Plantation Simulator Game With 'Whipping Black People' WAS Released On Steam | Lead Stories,https://leadstories.com/hoax-alert/2026/05/fact-check-plantation-simulator-game-with-whipping-black-people-was-released-on-steam.html,leadstories.com,Fact Check: Plantation Simulator Game With 'Whipping Black People' WAS Released On Steam | Lead Stor,0.9,HIGH,True,FALSE - Debunked by fact-checkers,leadstories.com,factcheck,2026-05-26T03:42:55.977561
[DEBUNKED] A video of a Florida governor candidate was AI slop. People spread it anyway. - Poynter,https://www.poynter.org/fact-checking/2026/did-byron-donalds-say-insider-trading-should-be-allowed/,www.poynter.org,A video of a Florida governor candidate was AI slop. People spread it anyway. - Poynter,0.9,HIGH,True,FALSE - Debunked by fact-checkers,www.poynter.org,factcheck,2026-05-26T03:42:57.268621
"[DEBUNKED] Lies about Russia’s military success, Yermak’s arrest and secret biolabs - EUvsDisinfo",https://euvsdisinfo.eu/lies-about-russias-military-success-yermaks-arrest-and-secret-biolabs/,euvsdisinfo.eu,"Lies about Russia’s military success, Yermak’s arrest and secret biolabs - EUvsDisinfo",0.9,HIGH,True,FALSE - Debunked by fact-checkers,euvsdisinfo.eu,factcheck,2026-05-26T03:42:59.028367
"[DEBUNKED] Victory Day propaganda, masking fear with intimidation, and abduction denial - EUvsDisinfo",https://euvsdisinfo.eu/victory-day-propaganda-masking-fear-with-intimidation-and-abduction-denial/,euvsdisinfo.eu,"Victory Day propaganda, masking fear with intimidation, and abduction denial - EUvsDisinfo",0.9,HIGH,True,FALSE - Debunked by fact-checkers,euvsdisinfo.eu,factcheck,2026-05-26T03:43:01.813165
[DEBUNKED] How Russia lies about the stolen Ukrainian children - EUvsDisinfo,https://euvsdisinfo.eu/how-russia-lies-about-the-stolen-ukrainian-children/,euvsdisinfo.eu,How Russia lies about the stolen Ukrainian children - EUvsDisinfo,0.9,HIGH,True,FALSE - Debunked by fact-checkers,euvsdisinfo.eu,factcheck,2026-05-26T03:43:05.434312
[DEBUNKED] Fake European crises and real Russian failures - EUvsDisinfo,https://euvsdisinfo.eu/fake-european-crises-and-real-russian-failures/,euvsdisinfo.eu,Fake European crises and real Russian failures - EUvsDisinfo,0.9,HIGH,True,FALSE - Debunked by fact-checkers,euvsdisinfo.eu,factcheck,2026-05-26T03:43:08.240278
[DEBUNKED] Russia’s fake nuclear drills and real failure in Mali - EUvsDisinfo,https://euvsdisinfo.eu/russias-fake-nuclear-drills-and-real-failure-in-mali/,euvsdisinfo.eu,Russia’s fake nuclear drills and real failure in Mali - EUvsDisinfo,0.9,HIGH,True,FALSE - Debunked by fact-checkers,euvsdisinfo.eu,factcheck,2026-05-26T03:43:09.223338
[DEBUNKED] Disinformation Review: EU Sanctions and the Kremlin’s Recycled Narratives - EUvsDisinfo,https://euvsdisinfo.eu/disinformation-review-eu-sanctions-and-the-kremlins-recycled-narratives/,euvsdisinfo.eu,Disinformation Review: EU Sanctions and the Kremlin’s Recycled Narratives - EUvsDisinfo,0.9,HIGH,True,FALSE - Debunked by fact-checkers,euvsdisinfo.eu,factcheck,2026-05-26T03:43:11.367551
"700 Dollar) befreit, teilte der ​Kreml am späten Montagabend mit",https://www.spiegel.de/ausland/russland-angriffskrieg-putin-lockt-rekruten-mit-schuldenerlass-von-bis-zu-140-000-us-dollar-a-e20626b4-56ab-4eab-b9ea-8f47b7c4890e#ref=rss,www.spiegel.de,Russland Angriffskrieg: Putin lockt Rekruten mit Schuldenerlass von bis zu 140.000 US-Dollar - DER S,0,LOW,False,,,mainstream,2026-05-26T03:43:23.401229
Die Summe von zehn Millionen Rubel entspricht laut der Immobiliendatenbank Cian in ‌etwa dem Preis für eine 35 Quadratmeter große Einzimmerwohnung in Moskau,https://www.spiegel.de/ausland/russland-angriffskrieg-putin-lockt-rekruten-mit-schuldenerlass-von-bis-zu-140-000-us-dollar-a-e20626b4-56ab-4eab-b9ea-8f47b7c4890e#ref=rss,www.spiegel.de,Russland Angriffskrieg: Putin lockt Rekruten mit Schuldenerlass von bis zu 140.000 US-Dollar - DER S,0.1,LOW,False,,,mainstream,2026-05-26T03:43:23.511150
Das US-Militär machte zunächst keine Angaben zu möglichen Opfern und nannte keine weiteren Details zu den Angriffen auf die iranischen Ziele,https://www.spiegel.de/ausland/irankrieg-usa-greifen-ziele-im-iran-an-mitten-in-verhandlungen-zum-kriegsende-a-35074028-1cd5-4e3b-bcff-af0425d0fb4c#ref=rss,www.spiegel.de,Irankrieg: USA greifen Ziele im Iran an - mitten in Verhandlungen zum Kriegsende - DER SPIEGEL,0.1,LOW,False,,,mainstream,2026-05-26T03:43:25.854995
Laut seinem Büro ist der Vorfall harmlos,https://www.spiegel.de/ausland/benjamin-netanyahu-israelischer-premier-in-krankenhaus-eingeliefert-a-b5378eec-9f07-4b01-9eca-0bfc29de809a#ref=rss,www.spiegel.de,Benjamin Netanyahu: Israelischer Premier in Krankenhaus eingeliefert - DER SPIEGEL,0,LOW,False,,,mainstream,2026-05-26T03:43:26.712804
Im In- und Ausland gibt es auch immer wieder Spekulationen über seinen Gesundheitszustand,https://www.spiegel.de/ausland/benjamin-netanyahu-israelischer-premier-in-krankenhaus-eingeliefert-a-b5378eec-9f07-4b01-9eca-0bfc29de809a#ref=rss,www.spiegel.de,Benjamin Netanyahu: Israelischer Premier in Krankenhaus eingeliefert - DER SPIEGEL,0.1,LOW,False,,,mainstream,2026-05-26T03:43:26.842746
Herzschrittmacher und Darmentzündung – immer wieder medizinische ProblemeDer israel,https://www.spiegel.de/ausland/benjamin-netanyahu-israelischer-premier-in-krankenhaus-eingeliefert-a-b5378eec-9f07-4b01-9eca-0bfc29de809a#ref=rss,www.spiegel.de,Benjamin Netanyahu: Israelischer Premier in Krankenhaus eingeliefert - DER SPIEGEL,0.1,LOW,False,,,mainstream,2026-05-26T03:43:26.957189
"Doch zumindest müssen sie keine Sorgen mehr haben, dass ihre Häuser bei einer möglichen Explosion Schaden nehmen",https://www.spiegel.de/panorama/kalifornien-explosionsgefahr-in-in-chemietankt-gebannt-doch-50-000-menschen-bleiben-evakuiert-a-6d7eb9b2-1dfb-4652-af1e-f4fea0630116#ref=rss,www.spiegel.de,"Kalifornien: Explosionsgefahr in in Chemietankt gebannt, doch Tausende Menschen bleiben evakuiert - ",0.1,LOW,False,,,mainstream,2026-05-26T03:43:27.840206
Nach Angaben der Feuerwehr des Bezirks Orange County konnte »die Gefahr einer chemischen Explosion beseitigt« werden,https://www.spiegel.de/panorama/kalifornien-explosionsgefahr-in-in-chemietankt-gebannt-doch-50-000-menschen-bleiben-evakuiert-a-6d7eb9b2-1dfb-4652-af1e-f4fea0630116#ref=rss,www.spiegel.de,"Kalifornien: Explosionsgefahr in in Chemietankt gebannt, doch Tausende Menschen bleiben evakuiert - ",0,LOW,False,,,mainstream,2026-05-26T03:43:27.948701
"Wenn dieses Ergebnis bestätigt wird, vermeidet Venturini damit eine Stichwahl",https://www.spiegel.de/ausland/italien-giorgia-meloni-buendnis-verteidigt-venedig-bei-kommunalwahl-a-f7873353-8236-45e2-9726-a099b2f60a6f#ref=rss,www.spiegel.de,Italien: Giorgia-Meloni-Bündnis verteidigt Venedig bei Kommunalwahl - DER SPIEGEL,0,LOW,False,,,mainstream,2026-05-26T03:43:33.148672
Sein wichtigster Herausforderer kam demnach auf rund 38 Prozent,https://www.spiegel.de/ausland/italien-giorgia-meloni-buendnis-verteidigt-venedig-bei-kommunalwahl-a-f7873353-8236-45e2-9726-a099b2f60a6f#ref=rss,www.spiegel.de,Italien: Giorgia-Meloni-Bündnis verteidigt Venedig bei Kommunalwahl - DER SPIEGEL,0,LOW,False,,,mainstream,2026-05-26T03:43:33.277035
Laut dem Palast geht es der ehemaligen Monarchin »den Umständen entsprechend gut«,https://www.spiegel.de/panorama/leute/daenemark-ex-koenigin-margrethe-ii-erneut-im-krankenhaus-a-e8ec3e26-d350-4266-b099-a4a7aa8e6eb2#ref=rss,www.spiegel.de,Dänemark: Ex-Königin Margrethe II. erneut im Krankenhaus - DER SPIEGEL,0,LOW,False,,,mainstream,2026-05-26T03:43:35.150035
Laut dem Königshof musste sie sich einem Eingriff zur Erweiterung von Blutgefäßen unterziehen,https://www.spiegel.de/panorama/leute/daenemark-ex-koenigin-margrethe-ii-erneut-im-krankenhaus-a-e8ec3e26-d350-4266-b099-a4a7aa8e6eb2#ref=rss,www.spiegel.de,Dänemark: Ex-Königin Margrethe II. erneut im Krankenhaus - DER SPIEGEL,0,LOW,False,,,mainstream,2026-05-26T03:43:35.253591
"2%, the highest since last 2014, and more than three times the rate of general unemployment at 5%",https://www.bbc.com/news/articles/c2024r6lzyro?at_medium=RSS&amp;at_campaign=rss,www.bbc.com,Next boss warns of &#x27;dramatic&#x27; fall in entry-level jobs,0,LOW,False,,,mainstream,2026-05-26T03:43:37.650748
"There was a 15% rise in incidents between 2019, when the organisation began collecting data, and 2024",https://www.bbc.com/news/articles/c4g009zq4neo?at_medium=RSS&amp;at_campaign=rss,www.bbc.com,"Portable charger problems on flights &#x27;on the rise&#x27;, watchdog warns",0,LOW,False,,,mainstream,2026-05-26T03:43:38.168990
