claim,source_url,source_domain,article_title,risk_score,risk_category,has_factcheck,factcheck_rating,factcheck_source,source_type,checked_at
"It referred to calculations from the New York State Division of the Budget that put the ""new effective tariff rate"" at 21% on imported goods, or $4,200 more per New York household",http://www.politifact.com/factchecks/2026/may/21/kirsten-gillibrand/tariff-burden-households-new-york/,www.politifact.com,"PolitiFact | Sen. Kirsten Gillibrand says tariffs cost New Yorkers $4,200 a year. Most recent estima",0,LOW,False,,,factcheck,2026-06-01T21:35:02.158607
[DEBUNKED] AI-generated videos of Australian Navy recirculate online – Full Fact,https://fullfact.org/immigration/ai-generated-videos-australian-border-force-recirculate/,fullfact.org,AI-generated videos of Australian Navy recirculate online – Full Fact,0.9,HIGH,True,FALSE - Debunked by fact-checkers,fullfact.org,factcheck,2026-06-01T21:35:02.482794
[DEBUNKED] Toolstation is not offering £10 power tool kits – Full Fact,https://fullfact.org/shopping/toolstation-power-tool-kit-fake-offer/,fullfact.org,Toolstation is not offering £10 power tool kits – Full Fact,0.9,HIGH,True,FALSE - Debunked by fact-checkers,fullfact.org,factcheck,2026-06-01T21:35:02.806096
[DEBUNKED] Video shows community gathering not ‘UK city council meeting’ – Full Fact,https://fullfact.org/politics/city-council-meeting-video-miscaptioned/,fullfact.org,Video shows community gathering not ‘UK city council meeting’ – Full Fact,0.9,HIGH,True,FALSE - Debunked by fact-checkers,fullfact.org,factcheck,2026-06-01T21:35:03.386065
[DEBUNKED] A £10 airfryer offer from Currys is fake – Full Fact,https://fullfact.org/shopping/currys-ninja-fake-offer/,fullfact.org,A £10 airfryer offer from Currys is fake – Full Fact,0.9,HIGH,True,FALSE - Debunked by fact-checkers,fullfact.org,factcheck,2026-06-01T21:35:03.686084
[DEBUNKED] Starbucks is not banning dogs from UK stores to adhere to halal rules – Full Fact,https://fullfact.org/economy/starbucks-banning-pets-halal-certified-misleading/,fullfact.org,Starbucks is not banning dogs from UK stores to adhere to halal rules – Full Fact,0.9,HIGH,True,FALSE - Debunked by fact-checkers,fullfact.org,factcheck,2026-06-01T21:35:04.094939
[DEBUNKED] Melanoma is not the ‘most common cancer globally’ – Full Fact,https://fullfact.org/health/melanoma-is-not-the-most-common-cancer-globally/,fullfact.org,Melanoma is not the ‘most common cancer globally’ – Full Fact,0.9,HIGH,True,FALSE - Debunked by fact-checkers,fullfact.org,factcheck,2026-06-01T21:35:04.591372
[DEBUNKED] This Tesco HexClad offer is not a genuine deal from the retailer – Full Fact,https://fullfact.org/shopping/tesco-hexclad-fake-offer/,fullfact.org,This Tesco HexClad offer is not a genuine deal from the retailer – Full Fact,0.9,HIGH,True,FALSE - Debunked by fact-checkers,fullfact.org,factcheck,2026-06-01T21:35:05.298694
[DEBUNKED] Southport attacker Axel Rudakubana has not suffered ‘violent assault’ in prison – Full Fact,https://fullfact.org/crime/southport-killer-rudakubana-prison-attack-claim-false/,fullfact.org,Southport attacker Axel Rudakubana has not suffered ‘violent assault’ in prison – Full Fact,0.9,HIGH,True,FALSE - Debunked by fact-checkers,fullfact.org,factcheck,2026-06-01T21:35:05.708269
“The measles vaccine prevents measles in 97% of the people who take it,https://www.factcheck.org/2026/05/a-timeline-of-rfk-jr-s-mixed-messaging-on-the-measles-vaccine/,www.factcheck.org,A Timeline of RFK Jr.&#039;s Mixed Messaging on the Measles Vaccine - FactCheck.org,0,LOW,False,,,factcheck,2026-06-01T21:35:06.524495
[DEBUNKED] Trump Distorts Maryland&#039;s Primary Ballot Mix-up to Attack Mail-in Voting - FactCheck.org,https://www.factcheck.org/2026/05/trump-distorts-marylands-primary-ballot-mix-up-to-attack-mail-in-voting/,www.factcheck.org,Trump Distorts Maryland&#039;s Primary Ballot Mix-up to Attack Mail-in Voting - FactCheck.org,0.9,HIGH,True,FALSE - Debunked by fact-checkers,www.factcheck.org,factcheck,2026-06-01T21:35:06.570351
[DEBUNKED] RFK Jr.’s Muddled Claims on Drug Approval Speed - FactCheck.org,https://www.factcheck.org/2026/05/rfk-jr-s-muddled-claims-on-drug-approval-speed/,www.factcheck.org,RFK Jr.’s Muddled Claims on Drug Approval Speed - FactCheck.org,0.9,HIGH,True,FALSE - Debunked by fact-checkers,www.factcheck.org,factcheck,2026-06-01T21:35:06.794599
"[DEBUNKED] Ad in Texas GOP Runoff Attacks Cornyn on Immigration, Islam - FactCheck.org",https://www.factcheck.org/2026/05/ad-in-texas-gop-runoff-attacks-cornyn-on-immigration-islam/,www.factcheck.org,"Ad in Texas GOP Runoff Attacks Cornyn on Immigration, Islam - FactCheck.org",0.9,HIGH,True,FALSE - Debunked by fact-checkers,www.factcheck.org,factcheck,2026-06-01T21:35:06.875717
"56, or 53%, from the average price of $2",https://www.factcheck.org/2026/05/what-will-happen-to-gasoline-prices-when-the-iran-war-ends/,www.factcheck.org,What Will Happen to Gasoline Prices When the Iran War Ends? - FactCheck.org,0,LOW,False,,,factcheck,2026-06-01T21:35:06.998740
[DEBUNKED] Kennedy Denies the One Big Beautiful Bill Act&#039;s Spending Cuts to Medicaid - FactCheck.org,https://www.factcheck.org/2026/05/kennedy-denies-the-one-big-beautiful-bill-acts-spending-cuts-to-medicaid/,www.factcheck.org,Kennedy Denies the One Big Beautiful Bill Act&#039;s Spending Cuts to Medicaid - FactCheck.org,0.9,HIGH,True,FALSE - Debunked by fact-checkers,www.factcheck.org,factcheck,2026-06-01T21:35:07.505020
[DEBUNKED] Fact Check: FAKE Video Shows A Diver In A Spiked 'Shark-Proof Suit' -- It's AI | Lead Stories,https://leadstories.com/hoax-alert/2026/06/fact-check-fake-video-shows-diver-spiked-shark-proof-suit-its-ai.html,leadstories.com,Fact Check: FAKE Video Shows A Diver In A Spiked 'Shark-Proof Suit' -- It's AI | Lead Stories,0.9,HIGH,True,FALSE - Debunked by fact-checkers,leadstories.com,factcheck,2026-06-01T21:35:08.012197
[DEBUNKED] Fact Check: Blackout Scene ADDED To Later Copies Of Video Of Kilt-Wearing Electrician  | Lead Stories,https://leadstories.com/hoax-alert/2026/06/fact-check-blackout-scene-added-to-later-copies-of-video-of-kilt-wearing-electrician.html,leadstories.com,Fact Check: Blackout Scene ADDED To Later Copies Of Video Of Kilt-Wearing Electrician  | Lead Storie,0.9,HIGH,True,FALSE - Debunked by fact-checkers,leadstories.com,factcheck,2026-06-01T21:35:08.149154
[DEBUNKED] Fact Check: REUSED Video of Masked People With Torches Does NOT Show Church In UK's Yorkshire | Lead Stories,https://leadstories.com/hoax-alert/2026/06/fact-check-reused-video-of-people-with-torches-does-not-show-yorkshire.html,leadstories.com,Fact Check: REUSED Video of Masked People With Torches Does NOT Show Church In UK's Yorkshire | Lead,0.9,HIGH,True,FALSE - Debunked by fact-checkers,leadstories.com,factcheck,2026-06-01T21:35:08.289095
[DEBUNKED] Fact Check: Wall Street Journal Did NOT Report That Graham Platner Called His Penis 'Mein Fuhrer' In Message To Woman | Lead Stories,https://leadstories.com/hoax-alert/2026/06/fact-check-wall-street-journal-did-not-report-that-graham-platner-called-his-penis-mein-fuhrer-in-message-to-woman.html,leadstories.com,Fact Check: Wall Street Journal Did NOT Report That Graham Platner Called His Penis 'Mein Fuhrer' In,0.9,HIGH,True,FALSE - Debunked by fact-checkers,leadstories.com,factcheck,2026-06-01T21:35:08.433597
[DEBUNKED] Fact Check: AI Video Of Trump's Name Being Removed From Kennedy Center Is NOT Real  | Lead Stories,https://leadstories.com/hoax-alert/2026/05/fact-check-video-trump-removed-from-kennedy-center.html,leadstories.com,Fact Check: AI Video Of Trump's Name Being Removed From Kennedy Center Is NOT Real  | Lead Stories,0.9,HIGH,True,FALSE - Debunked by fact-checkers,leadstories.com,factcheck,2026-06-01T21:35:08.564417
"[DEBUNKED] Fact Check: FAKE Quote By Muslim Man Saying 'Christians, You're No Longer Allowed To Say 'Merry Christmas'' | Lead Stories",https://leadstories.com/hoax-alert/2026/05/fact-check-fake-quote-muslim-man-saying-christians-youre-no-longer-allowed-say-merry-christmas.html,leadstories.com,"Fact Check: FAKE Quote By Muslim Man Saying 'Christians, You're No Longer Allowed To Say 'Merry Chri",0.9,HIGH,True,FALSE - Debunked by fact-checkers,leadstories.com,factcheck,2026-06-01T21:35:08.684500
"[DEBUNKED] Fact Check: UNVERIFIED Claim About Waiting List For Superyachts And Ukrainian Officials Comes From Single, Unnamed Source | Lead Stories",https://leadstories.com/hoax-alert/2026/05/fact-check-unverified-claim-about-waiting-list-for-superyachts-and-ukrainian-officials-unnamed-source.html,leadstories.com,Fact Check: UNVERIFIED Claim About Waiting List For Superyachts And Ukrainian Officials Comes From S,0.9,HIGH,True,FALSE - Debunked by fact-checkers,leadstories.com,factcheck,2026-06-01T21:35:08.817835
[DEBUNKED] Fact Check: FAKE Emerson Poll Shows Spencer Pratt Leading Karen Bass In LA Mayor's Race -- Made Up Numbers | Lead Stories,https://leadstories.com/hoax-alert/2026/05/fact-check-fake-emerson-poll-sows-spencer-pratt-leading-karen-bass-los-angeles-mayor-made-up-numbers.html,leadstories.com,Fact Check: FAKE Emerson Poll Shows Spencer Pratt Leading Karen Bass In LA Mayor's Race -- Made Up N,0.9,HIGH,True,FALSE - Debunked by fact-checkers,leadstories.com,factcheck,2026-06-01T21:35:08.952120
[DEBUNKED] Fact Check: Edited Audio Has Fart Sounds NOT In Original Video Of Trump's Return To White House After Arlington Memorial Day Ceremony | Lead Stories,https://leadstories.com/hoax-alert/2026/05/fact-check-edited-audio-has-fart-sounds-not-in-original-video-of-trumps-return-to-white-house-after-arlington-memorial-day-ceremony.html,leadstories.com,Fact Check: Edited Audio Has Fart Sounds NOT In Original Video Of Trump's Return To White House Afte,0.9,HIGH,True,FALSE - Debunked by fact-checkers,leadstories.com,factcheck,2026-06-01T21:35:09.073184
[DEBUNKED] Fact Check: FAKE Meme Shows 'Epic' Trump-Obama Exchange About Iran Nuclear Deal -- No Evidence It Happened | Lead Stories,https://leadstories.com/hoax-alert/2026/05/fact-check-meme-does-not-accurately-present-epic-moment-interaction-between-trump-obama-about-iran-nuclear-deals.html,leadstories.com,Fact Check: FAKE Meme Shows 'Epic' Trump-Obama Exchange About Iran Nuclear Deal -- No Evidence It Ha,0.9,HIGH,True,FALSE - Debunked by fact-checkers,leadstories.com,factcheck,2026-06-01T21:35:09.189585
[DEBUNKED] Fact Check: FAKE Video Shows U.S. Strike on Iranian Drone Carrier IRIS Shahid Bagheri -- It Was Created by AI | Lead Stories,https://leadstories.com/hoax-alert/2026/05/fact-check-fake-video-shows-us-strike-on-iranian-drone-carrier-iris-shahid-bagheri-or-any-iranian-aircraft-carrier.html,leadstories.com,Fact Check: FAKE Video Shows U.S. Strike on Iranian Drone Carrier IRIS Shahid Bagheri -- It Was Crea,0.9,HIGH,True,FALSE - Debunked by fact-checkers,leadstories.com,factcheck,2026-06-01T21:35:09.309280
"[DEBUNKED] Fact Check: Armenian Mirror-Spectator Did NOT Produce Report Saying PM Nikol Pashinyan Agreed To Resettle 250,000 Refugees Without Legal Status In EU | Lead Stories",https://leadstories.com/hoax-alert/2026/05/fact-check-armenian-mirror-spectator-did-not-produce-report-saying-that-pm-nikol-pashinyan-agreed-to-resettle-250-000-refugees.html,leadstories.com,Fact Check: Armenian Mirror-Spectator Did NOT Produce Report Saying PM Nikol Pashinyan Agreed To Res,0.9,HIGH,True,FALSE - Debunked by fact-checkers,leadstories.com,factcheck,2026-06-01T21:35:09.447477
"[DEBUNKED] Fact Check: NO Evidence Three Sisters Drowned In Brighton, England, Ran GoFundMe Campaign For Mother Whose Body Was Never Found | Lead Stories",https://leadstories.com/hoax-alert/2026/05/fact-check-no-evidence-family-of-three-sisters-drowned-in-brighton-england-previously-ran-gofundme-campaign-for-mother-whose-body-was-never-found.html,leadstories.com,"Fact Check: NO Evidence Three Sisters Drowned In Brighton, England, Ran GoFundMe Campaign For Mother",0.9,HIGH,True,FALSE - Debunked by fact-checkers,leadstories.com,factcheck,2026-06-01T21:35:09.572241
[DEBUNKED] Fact Check: FAKE BBC News Video Report Says France Is Deploying 800 French Foreign Legion Soldiers To Armenia | Lead Stories,https://leadstories.com/hoax-alert/2026/05/fact-check-fake-bbc-news-video-report-says-france-deploying-800-french-foreign-legion-soldiers-armenia.html,leadstories.com,Fact Check: FAKE BBC News Video Report Says France Is Deploying 800 French Foreign Legion Soldiers T,0.9,HIGH,True,FALSE - Debunked by fact-checkers,leadstories.com,factcheck,2026-06-01T21:35:09.691945
[DEBUNKED] Fact Check: The White House DID Publish A Post Commemorating The Tenth Anniversary Of The Death Of Harambe The Gorilla | Lead Stories,https://leadstories.com/hoax-alert/2026/05/fact-check-the-white-house-did-publish-a-post-commemorating-the-tenth-anniversary-of-the-death-of-harambe-the-gorilla.html,leadstories.com,Fact Check: The White House DID Publish A Post Commemorating The Tenth Anniversary Of The Death Of H,0.9,HIGH,True,FALSE - Debunked by fact-checkers,leadstories.com,factcheck,2026-06-01T21:35:09.823837
"[DEBUNKED] Victim-blaming Kyiv, pressuring Moldova, and drone disinformation - EUvsDisinfo",https://euvsdisinfo.eu/victim-blaming-kyiv-pressuring-moldova-and-drone-disinformation/,euvsdisinfo.eu,"Victim-blaming Kyiv, pressuring Moldova, and drone disinformation - EUvsDisinfo",0.9,HIGH,True,FALSE - Debunked by fact-checkers,euvsdisinfo.eu,factcheck,2026-06-01T21:35:14.028435
"[DEBUNKED] Tough love: Spies, dating apps and the dark side of online intimacy - EUvsDisinfo",https://euvsdisinfo.eu/tough-love-spies-dating-apps-and-the-dark-side-of-online-intimacy/,euvsdisinfo.eu,"Tough love: Spies, dating apps and the dark side of online intimacy - EUvsDisinfo",0.9,HIGH,True,FALSE - Debunked by fact-checkers,euvsdisinfo.eu,factcheck,2026-06-01T21:35:16.450659
"[DEBUNKED] Lies about Russia’s military success, Yermak’s arrest and secret biolabs - EUvsDisinfo",https://euvsdisinfo.eu/lies-about-russias-military-success-yermaks-arrest-and-secret-biolabs/,euvsdisinfo.eu,"Lies about Russia’s military success, Yermak’s arrest and secret biolabs - EUvsDisinfo",0.9,HIGH,True,FALSE - Debunked by fact-checkers,euvsdisinfo.eu,factcheck,2026-06-01T21:35:17.870308
"[DEBUNKED] Victory Day propaganda, masking fear with intimidation, and abduction denial - EUvsDisinfo",https://euvsdisinfo.eu/victory-day-propaganda-masking-fear-with-intimidation-and-abduction-denial/,euvsdisinfo.eu,"Victory Day propaganda, masking fear with intimidation, and abduction denial - EUvsDisinfo",0.9,HIGH,True,FALSE - Debunked by fact-checkers,euvsdisinfo.eu,factcheck,2026-06-01T21:35:20.569978
[DEBUNKED] How Russia lies about the stolen Ukrainian children - EUvsDisinfo,https://euvsdisinfo.eu/how-russia-lies-about-the-stolen-ukrainian-children/,euvsdisinfo.eu,How Russia lies about the stolen Ukrainian children - EUvsDisinfo,0.9,HIGH,True,FALSE - Debunked by fact-checkers,euvsdisinfo.eu,factcheck,2026-06-01T21:35:23.329077
[DEBUNKED] Fake European crises and real Russian failures - EUvsDisinfo,https://euvsdisinfo.eu/fake-european-crises-and-real-russian-failures/,euvsdisinfo.eu,Fake European crises and real Russian failures - EUvsDisinfo,0.9,HIGH,True,FALSE - Debunked by fact-checkers,euvsdisinfo.eu,factcheck,2026-06-01T21:35:25.742875
"Zum Login SPIEGEL plus Nur für Neukunden € 1,– für 4 Wochen danach € 5,99 pro Woche Freier Zugriff auf alle S+-Artikel auf SPIEGEL",https://www.spiegel.de/ausland/ukraine-beschwerden-von-soldaten-angst-kann-man-nicht-mit-angst-besiegen-a-79c42105-e680-447e-a476-bd6d9a1f6ed1#ref=rss,www.spiegel.de,Ukraine: Beschwerden von Soldaten - »Angst kann man nicht mit Angst besiegen« - DER SPIEGEL,0.1,LOW,False,,,mainstream,2026-06-01T21:35:33.948321
"E-Paper (PDF), Digital-Archiv und S+-Newsletter Jederzeit kündigen Jetzt abonnieren SPIEGEL plus 52 Wochen 25 % sparen € 4,49 pro Woche für 52 Wochen danach € 5,99 pro Woche Freier Zugriff auf alle S+-Artikel auf SPIEGEL",https://www.spiegel.de/ausland/ukraine-beschwerden-von-soldaten-angst-kann-man-nicht-mit-angst-besiegen-a-79c42105-e680-447e-a476-bd6d9a1f6ed1#ref=rss,www.spiegel.de,Ukraine: Beschwerden von Soldaten - »Angst kann man nicht mit Angst besiegen« - DER SPIEGEL,0.1,LOW,False,,,mainstream,2026-06-01T21:35:34.025865
"So sieht es eine Einigung vor, die Vertreter des Europaparlaments und der Regierungen der Mitgliedsländer nach Angaben der zyprischen EU-Ratspräsidentschaft erzielt haben",https://www.spiegel.de/politik/deutschland/eu-macht-weg-fuer-abschiebezentren-in-drittstaaten-frei-a-4970fc7b-c6d1-466f-88f6-15e21345e132#ref=rss,www.spiegel.de,Migration und Asyl: Europäische Union macht Weg für Abschiebezentren in Drittstaaten frei - DER SPIE,0,LOW,False,,,mainstream,2026-06-01T21:35:35.176138
Das kann mehrere Gründe haben: Manche Menschen werden von ihren Heimatländern nicht wieder aufgenommen und mit einigen Staaten pflegt die Bundesregierung keine diplomatischen Beziehungen,https://www.spiegel.de/politik/deutschland/eu-macht-weg-fuer-abschiebezentren-in-drittstaaten-frei-a-4970fc7b-c6d1-466f-88f6-15e21345e132#ref=rss,www.spiegel.de,Migration und Asyl: Europäische Union macht Weg für Abschiebezentren in Drittstaaten frei - DER SPIE,0.1,LOW,False,,,mainstream,2026-06-01T21:35:35.261149
Frankreich und Belgien hätten laut den Berichten nun gemeinsame Ermittlungen angeschoben,https://www.spiegel.de/panorama/justiz/belgien-belgische-fahnder-entdecken-neue-faehrte-nach-juwelendiebstahl-im-louvre-a-31fa9da9-042a-4ccf-aab4-0df1471cbf17#ref=rss,www.spiegel.de,Belgien: Belgische Fahnder entdecken neue Fährte nach Juwelendiebstahl im Louvre - DER SPIEGEL,0,LOW,False,,,mainstream,2026-06-01T21:35:36.372592
Oktober 2025 sollen mehrere Täter in den Louvre eingedrungen sein – und dort die Kronjuwelen im Wert von schätzungsweise 88 Millionen Euro gestohlen haben,https://www.spiegel.de/panorama/justiz/belgien-belgische-fahnder-entdecken-neue-faehrte-nach-juwelendiebstahl-im-louvre-a-31fa9da9-042a-4ccf-aab4-0df1471cbf17#ref=rss,www.spiegel.de,Belgien: Belgische Fahnder entdecken neue Fährte nach Juwelendiebstahl im Louvre - DER SPIEGEL,0,LOW,False,,,mainstream,2026-06-01T21:35:36.420344
"Zudem habe Israels Premier Netanyahu dem US-Präsidenten in einem Telefonat zugesichert, keine Truppen nach Beirut zu schicken",https://www.spiegel.de/ausland/iran-krieg-donald-trump-spricht-von-fortsetzung-der-iran-gespraeche-und-deeskalation-zwischen-israel-und-hisbollah-a-422959dd-cebf-499d-8633-d03650456d83#ref=rss,www.spiegel.de,Iran-Krieg: Donald Trump spricht von Fortsetzung der Iran-Gespräche – und Deeskalation zwischen Isra,0.1,LOW,False,,,mainstream,2026-06-01T21:35:37.602392
"Netanyahu habe ihm zugesichert, dass keine israelischen Truppen in den Libanon entsandt würden",https://www.spiegel.de/ausland/iran-krieg-donald-trump-spricht-von-fortsetzung-der-iran-gespraeche-und-deeskalation-zwischen-israel-und-hisbollah-a-422959dd-cebf-499d-8633-d03650456d83#ref=rss,www.spiegel.de,Iran-Krieg: Donald Trump spricht von Fortsetzung der Iran-Gespräche – und Deeskalation zwischen Isra,0.1,LOW,False,,,mainstream,2026-06-01T21:35:37.695867
Keegan zufolge bezifferte sein Arzt die Chancen auf Genesung auf 33 Prozent,https://www.spiegel.de/sport/fussball/kevin-keegan-krebserkrankung-von-englands-fussball-ikone-im-fortgeschrittenen-stadium-a-032233b2-0c95-441a-910f-babe3d51250c#ref=rss,www.spiegel.de,Kevin Keegan: Krebserkrankung von Englands Fußball-Ikone im fortgeschrittenen Stadium - DER SPIEGEL,0,LOW,False,,,mainstream,2026-06-01T21:35:38.443821
"»Ich dachte, es wären 80 oder 90 Prozent«, sagte er",https://www.spiegel.de/sport/fussball/kevin-keegan-krebserkrankung-von-englands-fussball-ikone-im-fortgeschrittenen-stadium-a-032233b2-0c95-441a-910f-babe3d51250c#ref=rss,www.spiegel.de,Kevin Keegan: Krebserkrankung von Englands Fußball-Ikone im fortgeschrittenen Stadium - DER SPIEGEL,0,LOW,False,,,mainstream,2026-06-01T21:35:38.524659
Denn immer wieder beugte sich die Institution den Mächtigen,https://www.spiegel.de/geschichte/wie-die-forschungsfreiheit-in-harvard-schon-frueher-bedroht-wurde-a-f7cba22b-6760-4334-be6a-b0c530446ff4#ref=rss,www.spiegel.de,Harvard-Universität: Kam ein Nazi in die USA. Und wurde in Ehren empfangen - DER SPIEGEL,0.1,LOW,False,,,mainstream,2026-06-01T21:35:39.708068
"Zum Login SPIEGEL plus Nur für Neukunden € 1,– für 4 Wochen danach € 5,99 pro Woche Freier Zugriff auf alle S+-Artikel auf SPIEGEL",https://www.spiegel.de/geschichte/wie-die-forschungsfreiheit-in-harvard-schon-frueher-bedroht-wurde-a-f7cba22b-6760-4334-be6a-b0c530446ff4#ref=rss,www.spiegel.de,Harvard-Universität: Kam ein Nazi in die USA. Und wurde in Ehren empfangen - DER SPIEGEL,0.1,LOW,False,,,mainstream,2026-06-01T21:35:39.790733
"E-Paper (PDF), Digital-Archiv und S+-Newsletter Jederzeit kündigen Jetzt abonnieren SPIEGEL plus 52 Wochen 25 % sparen € 4,49 pro Woche für 52 Wochen danach € 5,99 pro Woche Freier Zugriff auf alle S+-Artikel auf SPIEGEL",https://www.spiegel.de/geschichte/wie-die-forschungsfreiheit-in-harvard-schon-frueher-bedroht-wurde-a-f7cba22b-6760-4334-be6a-b0c530446ff4#ref=rss,www.spiegel.de,Harvard-Universität: Kam ein Nazi in die USA. Und wurde in Ehren empfangen - DER SPIEGEL,0.1,LOW,False,,,mainstream,2026-06-01T21:35:39.874130
Zuletzt wurde das US-Unternehmen mit 965 Milliarden Dollar bewertet,https://www.spiegel.de/wirtschaft/unternehmen/chatgpt-konkurrent-anthropic-meldet-boersengang-an-a-390e1deb-bd7d-4cdd-b58b-9109179c0d6e#ref=rss,www.spiegel.de,ChatGPT-Konkurrent Anthropic meldet Börsengang an - DER SPIEGEL,0,LOW,False,,,mainstream,2026-06-01T21:35:40.629586
Zudem wollen Microsoft ​und Nvidia bis zu ⁠15 Milliarden Dollar in das ​Unternehmen investieren,https://www.spiegel.de/wirtschaft/unternehmen/chatgpt-konkurrent-anthropic-meldet-boersengang-an-a-390e1deb-bd7d-4cdd-b58b-9109179c0d6e#ref=rss,www.spiegel.de,ChatGPT-Konkurrent Anthropic meldet Börsengang an - DER SPIEGEL,0,LOW,False,,,mainstream,2026-06-01T21:35:40.807181
Anthropic schloss zuletzt eine 65 Milliarden Dollar schwere Finanzierungsrunde zu einer Gesamtbewertung von 965 Milliarden Dollar ab,https://www.spiegel.de/wirtschaft/unternehmen/chatgpt-konkurrent-anthropic-meldet-boersengang-an-a-390e1deb-bd7d-4cdd-b58b-9109179c0d6e#ref=rss,www.spiegel.de,ChatGPT-Konkurrent Anthropic meldet Börsengang an - DER SPIEGEL,0,LOW,False,,,mainstream,2026-06-01T21:35:40.884714
"Nach dem Rückzug von FDP-Landeschef Henning Höne, dessen Bewerbung sie unterstützt hatte, habe sie bei den Partei-Mitgliedern eine wachsende Enttäuschung darüber wahrgenommen, »dass sie keine Wahl haben«, so Strack-Zimmermann",https://www.spiegel.de/politik/deutschland/fdp-marie-agnes-strack-zimmermann-will-ueberraschende-kandidatur-erst-zwei-tage-vor-parteitag-beschlossen-haben-a-be2f685b-b6bd-421d-a224-8eb6156e3052#ref=rss,www.spiegel.de,FDP: Marie-Agnes Strack-Zimmermann will überraschende Kandidatur erst zwei Tage vor Parteitag beschl,0.1,LOW,False,,,mainstream,2026-06-01T21:35:41.551050
"Schwule Lebensrealitäten in einer Serie abzubilden, das ist in Polen (noch) keine Selbstverständlichkeit",https://www.spiegel.de/kultur/tv/netflix-amazon-prime-disney-neue-filme-und-serien-im-juni-2026-a-298014e4-4453-40c5-b68d-5c6ca2b72124#ref=rss,www.spiegel.de,"Netflix, Amazon Prime, Disney+: Neue Filme und Serien im Juni 2026 - DER SPIEGEL",0.1,LOW,False,,,mainstream,2026-06-01T21:35:42.302840
"Zum Login SPIEGEL plus Nur für Neukunden € 1,– für 4 Wochen danach € 5,99 pro Woche Freier Zugriff auf alle S+-Artikel auf SPIEGEL",https://www.spiegel.de/sport/fussball/fussball-wm-2026-neymar-ronaldo-messi-und-ein-oberliga-kicker-aus-koblenz-a-e03622c0-3094-4e76-b79d-01d279b30853#ref=rss,www.spiegel.de,"Fußball-WM 2026: Neymar, Ronaldo, Messi – und ein Oberliga-Kicker aus Koblenz - DER SPIEGEL",0.1,LOW,False,,,mainstream,2026-06-01T21:35:43.052449
"E-Paper (PDF), Digital-Archiv und S+-Newsletter Jederzeit kündigen Jetzt abonnieren SPIEGEL plus 52 Wochen 25 % sparen € 4,49 pro Woche für 52 Wochen danach € 5,99 pro Woche Freier Zugriff auf alle S+-Artikel auf SPIEGEL",https://www.spiegel.de/sport/fussball/fussball-wm-2026-neymar-ronaldo-messi-und-ein-oberliga-kicker-aus-koblenz-a-e03622c0-3094-4e76-b79d-01d279b30853#ref=rss,www.spiegel.de,"Fußball-WM 2026: Neymar, Ronaldo, Messi – und ein Oberliga-Kicker aus Koblenz - DER SPIEGEL",0.1,LOW,False,,,mainstream,2026-06-01T21:35:43.135472
"Zum Login SPIEGEL plus Nur für Neukunden € 1,– für 4 Wochen danach € 5,99 pro Woche Freier Zugriff auf alle S+-Artikel auf SPIEGEL",https://www.spiegel.de/politik/deutschland/bafoeg-warum-studierende-jetzt-doch-um-die-erhoehung-bangen-muessen-a-2bf4cbc3-a763-4eb3-ab62-d7e7aa95f07d#ref=rss,www.spiegel.de,Bafög: Warum Studierende jetzt doch um die Erhöhung bangen müssen - DER SPIEGEL,0.1,LOW,False,,,mainstream,2026-06-01T21:35:44.310017
"E-Paper (PDF), Digital-Archiv und S+-Newsletter Jederzeit kündigen Jetzt abonnieren SPIEGEL plus 52 Wochen 25 % sparen € 4,49 pro Woche für 52 Wochen danach € 5,99 pro Woche Freier Zugriff auf alle S+-Artikel auf SPIEGEL",https://www.spiegel.de/politik/deutschland/bafoeg-warum-studierende-jetzt-doch-um-die-erhoehung-bangen-muessen-a-2bf4cbc3-a763-4eb3-ab62-d7e7aa95f07d#ref=rss,www.spiegel.de,Bafög: Warum Studierende jetzt doch um die Erhöhung bangen müssen - DER SPIEGEL,0.1,LOW,False,,,mainstream,2026-06-01T21:35:44.395422
