claim,source_url,source_domain,article_title,risk_score,risk_category,has_factcheck,factcheck_rating,factcheck_source,source_type,checked_at
[DEBUNKED] Old footage of market fire shared with false claims it shows Dubai airport in flames – Full Fact,https://fullfact.org/conflict/dubai-airport-fire-miscaptioned-old-footage/,fullfact.org,Old footage of market fire shared with false claims it shows Dubai airport in flames – Full Fact,0.9,HIGH,True,FALSE - Debunked by fact-checkers,fullfact.org,factcheck,2026-03-26T07:13:52.297395
[DEBUNKED] Fake Farage X post about Trump on £5 notes circulates – Full Fact,https://fullfact.org/politics/nigel-farage-donald-trump-5-pound-notes-fake-x-post/,fullfact.org,Fake Farage X post about Trump on £5 notes circulates – Full Fact,0.9,HIGH,True,FALSE - Debunked by fact-checkers,fullfact.org,factcheck,2026-03-26T07:13:52.931167
[DEBUNKED] Fake image of Jewish charity ambulances on fire shared online – Full Fact,https://fullfact.org/crime/fake-image-jewish-charity-ambulances-on-fire/,fullfact.org,Fake image of Jewish charity ambulances on fire shared online – Full Fact,0.9,HIGH,True,FALSE - Debunked by fact-checkers,fullfact.org,factcheck,2026-03-26T07:13:53.590423
"[DEBUNKED] Video shows queue for fuel in Spain, not UK – Full Fact",https://fullfact.org/economy/video-fuel-queue-spain-not-uk/,fullfact.org,"Video shows queue for fuel in Spain, not UK – Full Fact",0.9,HIGH,True,FALSE - Debunked by fact-checkers,fullfact.org,factcheck,2026-03-26T07:13:54.314134
[DEBUNKED] Footage doesn’t show attack on the King Fahd causeway – Full Fact,https://fullfact.org/conflict/king-fahd-bridge-attack-false/,fullfact.org,Footage doesn’t show attack on the King Fahd causeway – Full Fact,0.9,HIGH,True,FALSE - Debunked by fact-checkers,fullfact.org,factcheck,2026-03-26T07:13:55.042198
[DEBUNKED] The government finally corrects its misleading sunbeds claim – Full Fact,https://fullfact.org/health/the-government-finally-corrects-its-misleading-sunbeds-claim/,fullfact.org,The government finally corrects its misleading sunbeds claim – Full Fact,0.9,HIGH,True,FALSE - Debunked by fact-checkers,fullfact.org,factcheck,2026-03-26T07:13:55.549846
"According to&nbsp;a 2023 survey&nbsp;by New York University’s Brennan Center for Justice and other groups, more than 9% of Americans of voting age, or 21",https://www.factcheck.org/2026/03/competing-claims-on-save-america-act-disenfranchising-voters/,www.factcheck.org,Competing Claims on SAVE America Act Disenfranchising Voters - FactCheck.org,0,LOW,False,,,factcheck,2026-03-26T07:13:56.409185
[DEBUNKED] EPA’s Misleading Claim of $1.3 Trillion in Deregulatory ‘Savings’ - FactCheck.org,https://www.factcheck.org/2026/03/epas-misleading-claim-of-1-3-trillion-in-deregulatory-savings/,www.factcheck.org,EPA’s Misleading Claim of $1.3 Trillion in Deregulatory ‘Savings’ - FactCheck.org,0.9,HIGH,True,FALSE - Debunked by fact-checkers,www.factcheck.org,factcheck,2026-03-26T07:13:56.691267
[DEBUNKED] Biden Makes Flawed Comparisons with Trump - FactCheck.org,https://www.factcheck.org/2026/03/biden-makes-flawed-comparisons-with-trump/,www.factcheck.org,Biden Makes Flawed Comparisons with Trump - FactCheck.org,0.9,HIGH,True,FALSE - Debunked by fact-checkers,www.factcheck.org,factcheck,2026-03-26T07:13:57.103511
[DEBUNKED] FactChecking Claims in Casey Means&#039; Surgeon General Confirmation Hearing - FactCheck.org,https://www.factcheck.org/2026/03/factchecking-claims-in-casey-means-surgeon-general-confirmation-hearing/,www.factcheck.org,FactChecking Claims in Casey Means&#039; Surgeon General Confirmation Hearing - FactCheck.org,0.9,HIGH,True,FALSE - Debunked by fact-checkers,www.factcheck.org,factcheck,2026-03-26T07:13:57.172145
"[DEBUNKED] Fact Check: Erika Kirk Did NOT Announce She Is Opening An Orphanage ""In Honor Of Charlie"" -- It's A False Rumor Started From Clickbait | Lead Stories",https://leadstories.com/hoax-alert/2026/03/fact-check-erika-kirk-did-not-announce-she-is-opening-an-orphanage-in-honor-of-charlie.html,leadstories.com,"Fact Check: Erika Kirk Did NOT Announce She Is Opening An Orphanage ""In Honor Of Charlie"" -- It's A ",0.9,HIGH,True,FALSE - Debunked by fact-checkers,leadstories.com,factcheck,2026-03-26T07:13:57.338655
"[DEBUNKED] Fact Check: FAKE Photo Shows Hollywood Actors, Including Stallone and Schwarzenegger, Attending Chuck Norris' Funeral -- It's AI | Lead Stories",https://leadstories.com/hoax-alert/2026/03/fact-check-fake-photo-shows-hollywood-actors-including-stallone-and-schwarzenegger-attending-chuck-norris-funeral.html,leadstories.com,"Fact Check: FAKE Photo Shows Hollywood Actors, Including Stallone and Schwarzenegger, Attending Chuc",0.9,HIGH,True,FALSE - Debunked by fact-checkers,leadstories.com,factcheck,2026-03-26T07:13:57.502770
[DEBUNKED] Fact Check: Wolff's Book About Trump Does NOT Mention 'Gorilla Channel' -- It's A Joke From 2018 | Lead Stories,https://leadstories.com/hoax-alert/2026/03/fact-check-wolffs-book-about-trump-does-not-mention-gorilla-channel.html,leadstories.com,Fact Check: Wolff's Book About Trump Does NOT Mention 'Gorilla Channel' -- It's A Joke From 2018 | L,0.9,HIGH,True,FALSE - Debunked by fact-checkers,leadstories.com,factcheck,2026-03-26T07:13:57.697131
[DEBUNKED] Fact Check: Lufthansa Did NOT Offer Free Business Class Tickets To People In Israel To Apologize For Holocaust | Lead Stories,https://leadstories.com/hoax-alert/2026/03/fact-check-lufthansa-did-not-offer-free-business-class-tickets-to-people-in-israel-to-apologize-for-holocaust.html,leadstories.com,Fact Check: Lufthansa Did NOT Offer Free Business Class Tickets To People In Israel To Apologize For,0.9,HIGH,True,FALSE - Debunked by fact-checkers,leadstories.com,factcheck,2026-03-26T07:13:57.868493
[DEBUNKED] Fact Check: Trump Did NOT Announce That Everyone Born Before 2000 Would Have All Debt Erased | Lead Stories,https://leadstories.com/hoax-alert/2026/03/fact-check-trump-did-not-announce-that-everyone-born-before-2000-would-have-all-debt-erased.html,leadstories.com,Fact Check: Trump Did NOT Announce That Everyone Born Before 2000 Would Have All Debt Erased | Lead ,0.9,HIGH,True,FALSE - Debunked by fact-checkers,leadstories.com,factcheck,2026-03-26T07:13:58.040836
[DEBUNKED] Fact Check: Trump Did NOT Say Queen Elizabeth Should Pardon Prince Andrew -- Satire Post | Lead Stories,https://leadstories.com/hoax-alert/2026/03/fact-check-trump-did-not-say-queen-elizabeth-should-pardon-prince-andrew-satire.html,leadstories.com,Fact Check: Trump Did NOT Say Queen Elizabeth Should Pardon Prince Andrew -- Satire Post | Lead Stor,0.9,HIGH,True,FALSE - Debunked by fact-checkers,leadstories.com,factcheck,2026-03-26T07:13:58.225235
[DEBUNKED] Fact Check: FAKE Selfie Of Seven Dogs Walking Together In China Is NOT Real Photo | Lead Stories,https://leadstories.com/hoax-alert/2026/03/ffact-check-fake-selfie-of-seven-dogs-walking-together-in-china-is-not-real-photo.html,leadstories.com,Fact Check: FAKE Selfie Of Seven Dogs Walking Together In China Is NOT Real Photo | Lead Stories,0.9,HIGH,True,FALSE - Debunked by fact-checkers,leadstories.com,factcheck,2026-03-26T07:13:58.399201
[DEBUNKED] Fact Check: Kuwait Did NOT Declare War on Iran | Lead Stories,https://leadstories.com/hoax-alert/2026/03/fact-check-kuwait-did-not-declare-war-on-iran.html,leadstories.com,Fact Check: Kuwait Did NOT Declare War on Iran | Lead Stories,0.9,HIGH,True,FALSE - Debunked by fact-checkers,leadstories.com,factcheck,2026-03-26T07:13:58.570151
[DEBUNKED] Fact Check: Pilots Of Air Canada Plane Crash With Fire Truck At LaGuardia Were NOT Female -- Two Male Pilots  | Lead Stories,https://leadstories.com/hoax-alert/2026/03/fact-check-pilots-of-air-canada-plane-crash-with-fire-truck-at-laguardia-were-not-female.html,leadstories.com,Fact Check: Pilots Of Air Canada Plane Crash With Fire Truck At LaGuardia Were NOT Female -- Two Mal,0.9,HIGH,True,FALSE - Debunked by fact-checkers,leadstories.com,factcheck,2026-03-26T07:13:58.739588
"[DEBUNKED] Fact Check: FAKE TV Special ""Seeking The Truth, Finding Justice"" About Virginia Giuffre Allegedly Funded By Celebrities From Pope Leo XIV To Barbra Streisand -- Story Is Viet Spam | Lead Stories",https://leadstories.com/hoax-alert/2026/03/fact-check-fake-tv-special-seeking-the-truth-finding-justice-about-virginia-giuffre-allegedly-funded-by-celebrities-from-pope-leo-xiv-to-barbra-streisand.html,leadstories.com,"Fact Check: FAKE TV Special ""Seeking The Truth, Finding Justice"" About Virginia Giuffre Allegedly Fu",0.9,HIGH,True,FALSE - Debunked by fact-checkers,leadstories.com,factcheck,2026-03-26T07:13:58.914848
[DEBUNKED] Fact Check: Hungarian Opposition Leader Péter Magyár Did NOT Call Trump 'A Senile Grandpa' | Lead Stories,https://leadstories.com/hoax-alert/2026/03/fact-check-hungarian-opposition-leader-peter-magyar-did-not-call-trump-a-senile-grandpa.html,leadstories.com,Fact Check: Hungarian Opposition Leader Péter Magyár Did NOT Call Trump 'A Senile Grandpa' | Lead St,0.9,HIGH,True,FALSE - Debunked by fact-checkers,leadstories.com,factcheck,2026-03-26T07:13:59.086615
"[DEBUNKED] Fact Check: Keanu Reeves, Other Celebrities, Did NOT Say Children Should Be Raised According To ""Traditional Values"" Avoiding ""LGBTQ Themes"" -- It's A Fake Clickbait Story From Overseas | Lead Stories",https://leadstories.com/hoax-alert/2026/03/fact-check-keanu-reeves-other-celebrities-did-not-say-children-should-be-raised-according-to-traditional-values.html,leadstories.com,"Fact Check: Keanu Reeves, Other Celebrities, Did NOT Say Children Should Be Raised According To ""Tra",0.9,HIGH,True,FALSE - Debunked by fact-checkers,leadstories.com,factcheck,2026-03-26T07:13:59.260466
[DEBUNKED] Fact Check: FAKE AI Montage Does NOT Show Real Convictions Or Repossessions Related To Somali Daycare Fraud In Minnesota | Lead Stories,https://leadstories.com/hoax-alert/2026/03/fact-check-fake-ai-montage-does-not-shows-real-convictions-or-repos-related-to-somali-fraud-scheme-minnesota.html,leadstories.com,Fact Check: FAKE AI Montage Does NOT Show Real Convictions Or Repossessions Related To Somali Daycar,0.9,HIGH,True,FALSE - Debunked by fact-checkers,leadstories.com,factcheck,2026-03-26T07:13:59.448894
[DEBUNKED] Fact Check: Video SHOWS Plainclothes ICE Agents Arresting Woman At San Francisco Airport Gate -- NOT Related To ICE Surge To Help TSA | Lead Stories,https://leadstories.com/hoax-alert/2026/03/fact-check-video-shows-plainclothes-ice-agents-arresting-woman-at-san-francisco-airport-gate.html,leadstories.com,Fact Check: Video SHOWS Plainclothes ICE Agents Arresting Woman At San Francisco Airport Gate -- NOT,0.9,HIGH,True,FALSE - Debunked by fact-checkers,leadstories.com,factcheck,2026-03-26T07:13:59.619777
[DEBUNKED] Fact Check: Arnold Schwarzenegger Did NOT Reveal Chuck Norris Asked Him To Take Care Of Kickstart Kids Before Norris Died | Lead Stories,https://leadstories.com/hoax-alert/2026/03/fact-check-arnold-schwarzenegger-not-reveal-chuck-norris-asked-take-care-kickstarter-kids-before-died.html,leadstories.com,Fact Check: Arnold Schwarzenegger Did NOT Reveal Chuck Norris Asked Him To Take Care Of Kickstart Ki,0.9,HIGH,True,FALSE - Debunked by fact-checkers,leadstories.com,factcheck,2026-03-26T07:13:59.798307
"[DEBUNKED] Who is keeping the war with Iran going? Trump, once again, blames the media. - Poynter",https://www.poynter.org/commentary/2026/trump-blames-media-war-iran/,www.poynter.org,"Who is keeping the war with Iran going? Trump, once again, blames the media. - Poynter",0.9,HIGH,True,FALSE - Debunked by fact-checkers,www.poynter.org,factcheck,2026-03-26T07:13:59.930631
"About 95% of TSA’s 60,000 employees are considered essential workers",https://www.poynter.org/fact-checking/2026/why-is-tsa-not-being-paid-ice-is/,www.poynter.org,Why are ICE agents still being paid during the shutdown while TSA workers aren’t? - Poynter,0,LOW,False,,,factcheck,2026-03-26T07:14:00.539145
[DEBUNKED] Trump says Iran is ‘based on disinformation.’ Experts say its influence operations go far beyond that. - Poynter,https://www.poynter.org/fact-checking/2026/trump-iran-based-disinformation/,www.poynter.org,Trump says Iran is ‘based on disinformation.’ Experts say its influence operations go far beyond tha,0.9,HIGH,True,FALSE - Debunked by fact-checkers,www.poynter.org,factcheck,2026-03-26T07:14:00.899249
"[DEBUNKED] MediaWise launches Teen Creator Network with $300,000 grant from Patrick J. McGovern Foundation - Poynter",https://www.poynter.org/news-release/2026/mediawise-launches-teen-creator-network-social-media-video-tiktok/,www.poynter.org,"MediaWise launches Teen Creator Network with $300,000 grant from Patrick J. McGovern Foundation - Po",0.9,HIGH,True,FALSE - Debunked by fact-checkers,www.poynter.org,factcheck,2026-03-26T07:14:01.168554
"Roughly 6% of staff, or nearly 60 individuals, were affected, according to The New York Post",https://www.poynter.org/business-work/2026/cbs-news-layoffs-cuts-news-radio/,www.poynter.org,CBS News cuts radio division amid layoffs - Poynter,0,LOW,False,,,factcheck,2026-03-26T07:14:01.733711
"Laut Gericht wurde Ramadan untersagt, Kontakt zu den Opfern aufzunehmen, außerdem muss er seine Opfer entschädigen",https://www.spiegel.de/panorama/justiz/paris-prediger-tariq-ramadan-wegen-vergewaltigung-zu-18-jahren-haft-verurteilt-a-230224e4-732d-41e9-972e-9eb66298c687#ref=rss,www.spiegel.de,Paris: Prediger Tariq Ramadan wegen Vergewaltigung zu 18 Jahren Haft verurteilt - DER SPIEGEL,0,LOW,False,,,mainstream,2026-03-26T07:14:16.215954
"Zum Login SPIEGEL plus Nur für Neukunden € 1,– für 4 Wochen danach € 5,99 pro Woche Freier Zugriff auf alle S+-Artikel auf SPIEGEL",https://www.spiegel.de/panorama/justiz/fabian-aus-guestrow-in-mecklenburg-vorpommern-was-die-ermittler-gina-vorwerfen-a-4d332d16-725c-457e-89e9-f7379d9f4d1c#ref=rss,www.spiegel.de,Fabian aus Güstrow in Mecklenburg-Vorpommern: Was die Ermittler Gina vorwerfen - DER SPIEGEL,0.1,LOW,False,,,mainstream,2026-03-26T07:14:17.635990
"E-Paper (PDF), Digital-Archiv und S+-Newsletter Jederzeit kündigen Jetzt abonnieren SPIEGEL plus 52 Wochen 25 % sparen € 4,49 pro Woche für 52 Wochen danach € 5,99 pro Woche Freier Zugriff auf alle S+-Artikel auf SPIEGEL",https://www.spiegel.de/panorama/justiz/fabian-aus-guestrow-in-mecklenburg-vorpommern-was-die-ermittler-gina-vorwerfen-a-4d332d16-725c-457e-89e9-f7379d9f4d1c#ref=rss,www.spiegel.de,Fabian aus Güstrow in Mecklenburg-Vorpommern: Was die Ermittler Gina vorwerfen - DER SPIEGEL,0.1,LOW,False,,,mainstream,2026-03-26T07:14:17.839590
"Wir sollten nur keine moralischen Debatten führen, wenn das Turnier 2034 in Saudi-Arabien stattfindet",https://www.spiegel.de/panorama/fussball-wm-verglichen-mit-den-usa-war-katar-ein-friedlicher-gastgeber-kolumne-a-fa792059-cd99-4369-9c43-277b7acb0c15#ref=rss,www.spiegel.de,Fußball-WM: Verglichen mit den USA war Katar ein friedlicher Gastgeber – Kolumne - DER SPIEGEL,0.1,LOW,False,,,mainstream,2026-03-26T07:14:19.282330
"Zum Login SPIEGEL plus Nur für Neukunden € 1,– für 4 Wochen danach € 5,99 pro Woche Freier Zugriff auf alle S+-Artikel auf SPIEGEL",https://www.spiegel.de/panorama/fussball-wm-verglichen-mit-den-usa-war-katar-ein-friedlicher-gastgeber-kolumne-a-fa792059-cd99-4369-9c43-277b7acb0c15#ref=rss,www.spiegel.de,Fußball-WM: Verglichen mit den USA war Katar ein friedlicher Gastgeber – Kolumne - DER SPIEGEL,0.1,LOW,False,,,mainstream,2026-03-26T07:14:19.484384
"E-Paper (PDF), Digital-Archiv und S+-Newsletter Jederzeit kündigen Jetzt abonnieren SPIEGEL plus 52 Wochen 25 % sparen € 4,49 pro Woche für 52 Wochen danach € 5,99 pro Woche Freier Zugriff auf alle S+-Artikel auf SPIEGEL",https://www.spiegel.de/panorama/fussball-wm-verglichen-mit-den-usa-war-katar-ein-friedlicher-gastgeber-kolumne-a-fa792059-cd99-4369-9c43-277b7acb0c15#ref=rss,www.spiegel.de,Fußball-WM: Verglichen mit den USA war Katar ein friedlicher Gastgeber – Kolumne - DER SPIEGEL,0.1,LOW,False,,,mainstream,2026-03-26T07:14:19.598139
"Zum Login SPIEGEL plus Nur für Neukunden € 1,– für 4 Wochen danach € 5,99 pro Woche Freier Zugriff auf alle S+-Artikel auf SPIEGEL",https://www.spiegel.de/kultur/autobiografischer-roman-entzug-von-christoph-peters-die-luege-vom-saufen-fuer-die-kunst-a-038d3a9f-19be-4086-9540-f051762aa7f9#ref=rss,www.spiegel.de,Autobiografischer Roman »Entzug« von Christoph Peters: Die Lüge vom Saufen für die Kunst - DER SPIEG,0.1,LOW,False,,,mainstream,2026-03-26T07:14:21.052190
"E-Paper (PDF), Digital-Archiv und S+-Newsletter Jederzeit kündigen Jetzt abonnieren SPIEGEL plus 52 Wochen 25 % sparen € 4,49 pro Woche für 52 Wochen danach € 5,99 pro Woche Freier Zugriff auf alle S+-Artikel auf SPIEGEL",https://www.spiegel.de/kultur/autobiografischer-roman-entzug-von-christoph-peters-die-luege-vom-saufen-fuer-die-kunst-a-038d3a9f-19be-4086-9540-f051762aa7f9#ref=rss,www.spiegel.de,Autobiografischer Roman »Entzug« von Christoph Peters: Die Lüge vom Saufen für die Kunst - DER SPIEG,0.1,LOW,False,,,mainstream,2026-03-26T07:14:21.251370
Der Einsatzort war laut einem Sprecher abgesperrt,https://www.spiegel.de/panorama/weissensee-in-thueringen-burg-aus-dem-12-jahrhundert-bei-brand-beschaedigt-a-5b268717-0098-47b2-b1de-bd6e24651ae2#ref=rss,www.spiegel.de,Weißensee in Thüringen: Burg aus dem 12. Jahrhundert bei Brand beschädigt - DER SPIEGEL,0,LOW,False,,,mainstream,2026-03-26T07:14:22.610478
"Zum Login SPIEGEL plus Nur für Neukunden € 1,– für 4 Wochen danach € 5,99 pro Woche Freier Zugriff auf alle S+-Artikel auf SPIEGEL",https://www.spiegel.de/start/physician-assistant-werden-die-arbeit-mit-herzkranken-menschen-ist-emotional-fordernd-a-5b9a05c6-6588-4ce6-a483-4432d2d0dd54#ref=rss,www.spiegel.de,Physician Assistant werden: »Die Arbeit mit herzkranken Menschen ist emotional fordernd« - DER SPIEG,0.1,LOW,False,,,mainstream,2026-03-26T07:14:23.886913
"E-Paper (PDF), Digital-Archiv und S+-Newsletter Jederzeit kündigen Jetzt abonnieren SPIEGEL plus 52 Wochen 25 % sparen € 4,49 pro Woche für 52 Wochen danach € 5,99 pro Woche Freier Zugriff auf alle S+-Artikel auf SPIEGEL",https://www.spiegel.de/start/physician-assistant-werden-die-arbeit-mit-herzkranken-menschen-ist-emotional-fordernd-a-5b9a05c6-6588-4ce6-a483-4432d2d0dd54#ref=rss,www.spiegel.de,Physician Assistant werden: »Die Arbeit mit herzkranken Menschen ist emotional fordernd« - DER SPIEG,0.1,LOW,False,,,mainstream,2026-03-26T07:14:24.090685
"Zum Login SPIEGEL plus Nur für Neukunden € 1,– für 4 Wochen danach € 5,99 pro Woche Freier Zugriff auf alle S+-Artikel auf SPIEGEL",https://www.spiegel.de/wirtschaft/unternehmen/wer-zahlt-fuer-sauberes-wasser-die-pharmaindustrie-oder-die-privaten-verbraucher-a-28904f1b-eba9-4679-8382-794dc2c6799a#ref=rss,www.spiegel.de,Wer zahlt für sauberes Wasser – die Pharmaindustrie oder die privaten Verbraucher? - DER SPIEGEL,0.1,LOW,False,,,mainstream,2026-03-26T07:14:25.297432
"E-Paper (PDF), Digital-Archiv und S+-Newsletter Jederzeit kündigen Jetzt abonnieren SPIEGEL plus 52 Wochen 25 % sparen € 4,49 pro Woche für 52 Wochen danach € 5,99 pro Woche Freier Zugriff auf alle S+-Artikel auf SPIEGEL",https://www.spiegel.de/wirtschaft/unternehmen/wer-zahlt-fuer-sauberes-wasser-die-pharmaindustrie-oder-die-privaten-verbraucher-a-28904f1b-eba9-4679-8382-794dc2c6799a#ref=rss,www.spiegel.de,Wer zahlt für sauberes Wasser – die Pharmaindustrie oder die privaten Verbraucher? - DER SPIEGEL,0.1,LOW,False,,,mainstream,2026-03-26T07:14:25.500880
"Zum Login SPIEGEL plus Nur für Neukunden € 1,– für 4 Wochen danach € 5,99 pro Woche Freier Zugriff auf alle S+-Artikel auf SPIEGEL",https://www.spiegel.de/mobilitaet/auto/lindau-verkehrsministerkonferenz-beraet-tempolimit-80-auf-landstrassen-a-6500b0b5-5969-4a6b-97e9-2e5a2de9aa78#ref=rss,www.spiegel.de,Lindau: Verkehrsministerkonferenz berät Tempolimit 80 auf Landstraßen - DER SPIEGEL,0.1,LOW,False,,,mainstream,2026-03-26T07:14:26.936456
"E-Paper (PDF), Digital-Archiv und S+-Newsletter Jederzeit kündigen Jetzt abonnieren SPIEGEL plus 52 Wochen 25 % sparen € 4,49 pro Woche für 52 Wochen danach € 5,99 pro Woche Freier Zugriff auf alle S+-Artikel auf SPIEGEL",https://www.spiegel.de/mobilitaet/auto/lindau-verkehrsministerkonferenz-beraet-tempolimit-80-auf-landstrassen-a-6500b0b5-5969-4a6b-97e9-2e5a2de9aa78#ref=rss,www.spiegel.de,Lindau: Verkehrsministerkonferenz berät Tempolimit 80 auf Landstraßen - DER SPIEGEL,0.1,LOW,False,,,mainstream,2026-03-26T07:14:27.166370
"Zum Login SPIEGEL plus Nur für Neukunden € 1,– für 4 Wochen danach € 5,99 pro Woche Freier Zugriff auf alle S+-Artikel auf SPIEGEL",https://www.spiegel.de/politik/deutschland/spd-lars-klingbeil-setzt-auf-reformen-als-seine-letzte-karte-a-8fe50c06-d8c8-4673-a9c8-158aa37cb199#ref=rss,www.spiegel.de,SPD: Lars Klingbeil setzt auf Reformen als seine letzte Karte - DER SPIEGEL,0.1,LOW,False,,,mainstream,2026-03-26T07:14:28.419564
"E-Paper (PDF), Digital-Archiv und S+-Newsletter Jederzeit kündigen Jetzt abonnieren SPIEGEL plus 52 Wochen 25 % sparen € 4,49 pro Woche für 52 Wochen danach € 5,99 pro Woche Freier Zugriff auf alle S+-Artikel auf SPIEGEL",https://www.spiegel.de/politik/deutschland/spd-lars-klingbeil-setzt-auf-reformen-als-seine-letzte-karte-a-8fe50c06-d8c8-4673-a9c8-158aa37cb199#ref=rss,www.spiegel.de,SPD: Lars Klingbeil setzt auf Reformen als seine letzte Karte - DER SPIEGEL,0.1,LOW,False,,,mainstream,2026-03-26T07:14:28.511586
"Gesund leben, sich gut fühlen – immer donnerstags image""> Foto: BreBa photography / beyond / plainpicture Ausgabe Nr",https://www.spiegel.de/gesundheit/lymphdrainage-und-brasilianische-lymphmassage-koennen-lymphoedeme-so-behandelt-werden-a-93e188ac-ac88-4cbd-9bd1-9b41ffff903d#ref=rss,www.spiegel.de,Lymphdrainage und brasilianische Lymphmassage: Können Lymphödeme so behandelt werden? - DER SPIEGEL,0.1,LOW,False,,,mainstream,2026-03-26T07:14:31.001658
2026 • Alle Ausgaben Sie können den Artikel leider nicht mehr aufrufen,https://www.spiegel.de/gesundheit/lymphdrainage-und-brasilianische-lymphmassage-koennen-lymphoedeme-so-behandelt-werden-a-93e188ac-ac88-4cbd-9bd1-9b41ffff903d#ref=rss,www.spiegel.de,Lymphdrainage und brasilianische Lymphmassage: Können Lymphödeme so behandelt werden? - DER SPIEGEL,0.1,LOW,False,,,mainstream,2026-03-26T07:14:31.227012
"Zum Login SPIEGEL plus Nur für Neukunden € 1,– für 4 Wochen danach € 5,99 pro Woche Freier Zugriff auf alle S+-Artikel auf SPIEGEL",https://www.spiegel.de/gesundheit/lymphdrainage-und-brasilianische-lymphmassage-koennen-lymphoedeme-so-behandelt-werden-a-93e188ac-ac88-4cbd-9bd1-9b41ffff903d#ref=rss,www.spiegel.de,Lymphdrainage und brasilianische Lymphmassage: Können Lymphödeme so behandelt werden? - DER SPIEGEL,0.1,LOW,False,,,mainstream,2026-03-26T07:14:31.427580
Laut dem Branchendienst »The Hollywood Reporter«&nbsp; war zuletzt von einer Veröffentlichung in 2027 die Rede gewesen,https://www.spiegel.de/kultur/harry-potter-serie-bei-hbo-max-erster-teaser-veroeffentlicht-an-weihnachten-gehts-los-a-c20cb013-921a-430a-a5b6-d21c9ebf0432#ref=rss,www.spiegel.de,»Harry Potter«-Serie bei HBO Max: Erster Teaser veröffentlicht - an Weihnachten geht's los - DER SPI,0,LOW,False,,,mainstream,2026-03-26T07:14:33.927327
"Meta will be expected to shoulder 70% of Kaley&#x27;s damages award, with Google the remaining 30%",https://www.bbc.com/news/articles/c747x7gz249o?at_medium=RSS&amp;at_campaign=rss,www.bbc.com,Meta and YouTube found liable in social media addiction trial,0,LOW,False,,,mainstream,2026-03-26T07:14:36.371228
The government believes around 75% of Russia&#x27;s crude oil is transported by ageing ships and has imposed sanctions on 544 vessels thought to be in the shadow fleet,https://www.bbc.com/news/articles/cvg0n9z3jlvo?at_medium=RSS&amp;at_campaign=rss,www.bbc.com,British forces preparing to board Russian shadow fleet ships in UK waters,0,LOW,False,,,mainstream,2026-03-26T07:14:36.720997
"In 2024, Roblox averaged more than 80 million global players per day - with roughly 40% of them under the age of 13",https://www.bbc.com/news/articles/cd6l07wwvlpo?at_medium=RSS&amp;at_campaign=rss,www.bbc.com,"Parents should monitor children 24/7 on Roblox, says developer",0,LOW,False,,,mainstream,2026-03-26T07:14:37.126914
"&quot;He said concerns were flagged via a form, but added &quot;maybe 30% actually get accepted&quo",https://www.bbc.com/news/articles/cd6l07wwvlpo?at_medium=RSS&amp;at_campaign=rss,www.bbc.com,"Parents should monitor children 24/7 on Roblox, says developer",0,LOW,False,,,mainstream,2026-03-26T07:14:37.338554
"Last May, the government struck a trade deal with the US which removed a 19% tariff on ethanol imports up to a quota of 1",https://www.bbc.com/news/articles/cew7xrj4497o?at_medium=RSS&amp;at_campaign=rss,www.bbc.com,Government to reopen CO2 plant in Iran war contingency plan,0,LOW,False,,,mainstream,2026-03-26T07:14:37.765057
