claim,source_url,source_domain,article_title,risk_score,risk_category,has_factcheck,factcheck_rating,factcheck_source,source_type,checked_at
[DEBUNKED] Hitzedarstellung im TV: Video zu Wetterkarten ist nicht echt,https://correctiv.org/faktencheck/2026/06/29/hitzedarstellung-im-tv-video-zu-wetterkarten-ist-nicht-echt/,correctiv.org,Hitzedarstellung im TV: Video zu Wetterkarten ist nicht echt,0.9,HIGH,True,FALSE - Debunked by fact-checkers,correctiv.org,factcheck,2026-06-29T19:59:30.823202
"[DEBUNKED] Video von Kind, das Regenbogenflagge in den Müll wirft, ist KI-generiert",https://correctiv.org/faktencheck/2026/06/29/video-von-kind-das-regenbogenflagge-in-den-muell-wirft-ist-ki-generiert/,correctiv.org,"Video von Kind, das Regenbogenflagge in den Müll wirft, ist KI-generiert",0.9,HIGH,True,FALSE - Debunked by fact-checkers,correctiv.org,factcheck,2026-06-29T19:59:32.070856
"Laut Insidern fürchtet der Vorstand um Blume, dass Europas größter Autohersteller ab dem Jahr 2030 dauerhaft in die Verlustzone rutschen könnte",https://correctiv.org/aktuelles/wirtschaft/2026/06/29/vorstand-will-sparpaket-mit-aller-macht-durchdruecken/,correctiv.org,Vorstand will Sparpaket auch gegen Nein von Aufsichtsrat durchdrücken - correctiv.org,0,LOW,False,,,factcheck,2026-06-29T19:59:32.888553
"Foto: Hans-Joachim Scheidemann / picture alliance / dpa Ein Zwischenbericht einer Untersuchung von Kardinal Franz Hengsbach bestätigt, dass der erste Ruhrbischof Missbrauch begangen haben soll",https://correctiv.org/aktuelles/akten-des-missbrauchs/2026/06/26/neue-studie-aus-dem-bistum-essen-kardinal-hengsbach-war-taeter-und-pflegte-enge-kontakte-zu-ratzinger/,correctiv.org,Neue Studie: Kardinal Hengsbach war Täter und pflegte Kontakte zu Ratzinger,0,LOW,False,,,factcheck,2026-06-29T19:59:33.666853
Nach Angaben der Koordinierungsstelle des Programms wurden zwischen 2020 und 2025 mehr als 75,https://correctiv.org/aktuelles/integration-gesellschaft/2026/06/26/foerderung-fuer-den-studienzugang-zugewanderter-vor-dem-aus/,correctiv.org,Förderung für den Studienzugang Zugewanderter vor dem Aus - correctiv.org,0.1,LOW,False,,,factcheck,2026-06-29T19:59:35.037818
Als besonders erfolgreich gelten die Sprachkurse: 83 Prozent der Teilnehmenden erreichten das für ein Studium erforderliche Sprachniveau C1,https://correctiv.org/aktuelles/integration-gesellschaft/2026/06/26/foerderung-fuer-den-studienzugang-zugewanderter-vor-dem-aus/,correctiv.org,Förderung für den Studienzugang Zugewanderter vor dem Aus - correctiv.org,0,LOW,False,,,factcheck,2026-06-29T19:59:35.131777
"„Eine Fortführung des Programms hätte vor dem Hintergrund der haushaltspolitischen und strukturellen Rahmenbedingungen keine tragfähige Grundlage“, sagte sie",https://correctiv.org/aktuelles/integration-gesellschaft/2026/06/26/foerderung-fuer-den-studienzugang-zugewanderter-vor-dem-aus/,correctiv.org,Förderung für den Studienzugang Zugewanderter vor dem Aus - correctiv.org,0.1,LOW,False,,,factcheck,2026-06-29T19:59:35.225606
[DEBUNKED] Landverkauf an Israel? Bild von Grenzschild in Albanien ist nicht echt,https://correctiv.org/faktencheck/2026/06/26/landverkauf-an-israel-bild-von-grenzschild-in-albanien-ist-nicht-echt/,correctiv.org,Landverkauf an Israel? Bild von Grenzschild in Albanien ist nicht echt,0.9,HIGH,True,FALSE - Debunked by fact-checkers,correctiv.org,factcheck,2026-06-29T19:59:35.803281
"&nbsp; CORRECTIV hat Guttenberg mehrfach angeschrieben und um seine Sicht der Dinge gebeten, erhielt jedoch keine Antwort",https://correctiv.org/aktuelles/lobbyismus/2026/06/26/guttenberg-der-mann-aller-maerkte/,correctiv.org,Guttenberg: Der Mann aller Märkte,0.1,LOW,False,,,factcheck,2026-06-29T19:59:36.476673
"Der Vorwurf ließ sich nicht belegen, da der Beschuldigte ihn bestritt und keine Anzeige erstattet wurde",https://correctiv.org/aktuelles/gewalt-im-sport/2026/06/26/bvb-bericht-zu-mutmasslichen-missbrauchsfaellen/,correctiv.org,BVB: Bericht zu Missbrauchsvorwürfen soll Ende des Jahres veröffentlicht werden,0.1,LOW,False,,,factcheck,2026-06-29T19:59:37.162224
"Ziel des Gutachtens ist laut der GFF, „wichtige Lücken in der Debatte um ein Verbot der AfD“ zu schließen",https://correctiv.org/aktuelles/debatte-um-afd-verbot/2026/06/25/afd-verbot-gutachten-faq/,correctiv.org,FAQ zu AfD-Gutachten: 1500 Seiten zur Verfassungsfeindlichkeit,0,LOW,False,,,factcheck,2026-06-29T19:59:37.926101
"Denn bislang habe es keine belastbare, wissenschaftlich erarbeitete Antwort auf die Frage gegeben, ob die AfD nach den Maßstäben des Artikels 21 des Grundgesetzes verfassungswidrig sei – und damit verboten werden könnte",https://correctiv.org/aktuelles/debatte-um-afd-verbot/2026/06/25/afd-verbot-gutachten-faq/,correctiv.org,FAQ zu AfD-Gutachten: 1500 Seiten zur Verfassungsfeindlichkeit,0.1,LOW,False,,,factcheck,2026-06-29T19:59:38.016064
"Anfang 2022 hielt Gazprom Germania, die deutsche Tochtergesellschaft des russischen Staatskonzerns, 25 Prozent der Erdgasspeicherkapazitäten in Deutschland",https://correctiv.org/hybride-kriegsfuehrung/2026/06/24/wollte-gazprom-deutschland-ins-chaos-stuerzen-bundesanwaltschaft-ermittelt-wegen-versuchter-sabotage/,correctiv.org,Wollte Gazprom Deutschland ins Chaos stürzen? Bundesanwaltschaft ermittelt,0,LOW,False,,,factcheck,2026-06-29T19:59:38.775759
"Laut der Bundesanwaltschaft konnte so der Sabotageplan vereitelt werden, da das Bundeswirtschaftsministerium die treuhänderische Verwaltung der Gazprom Germania durch die Bundesnetzagentur anordnete",https://correctiv.org/hybride-kriegsfuehrung/2026/06/24/wollte-gazprom-deutschland-ins-chaos-stuerzen-bundesanwaltschaft-ermittelt-wegen-versuchter-sabotage/,correctiv.org,Wollte Gazprom Deutschland ins Chaos stürzen? Bundesanwaltschaft ermittelt,0,LOW,False,,,factcheck,2026-06-29T19:59:38.865243
Die Kosten für die Kampfschiffe hätten sich auf 18 Milliarden Euro mehr als verdoppelt,https://correctiv.org/aktuelles/bundeswehr/2026/06/24/pistorius-beendet-teuerstes-marine-projekt-der-geschichte/,correctiv.org,Pistorius beendet teuerstes Marine-Projekt der Geschichte,0,LOW,False,,,factcheck,2026-06-29T19:59:39.531858
"Weiter wird der Bau aber nicht gehen – am späten Dienstag hat Verteidigungsminister Boris Pistorius (SPD) laut beteiligten Personen die mitwirkenden Werften informiert, das Projekt F126 sei beendet",https://correctiv.org/aktuelles/bundeswehr/2026/06/24/pistorius-beendet-teuerstes-marine-projekt-der-geschichte/,correctiv.org,Pistorius beendet teuerstes Marine-Projekt der Geschichte,0,LOW,False,,,factcheck,2026-06-29T19:59:39.675395
"Die offiziellen Kündigungsschreiben wolle die Beschaffungsbehörde an diesem Mittwoch an die Werften Damen (Niederlande) und die Rheinmetall-Tochter NVL verschicken, wie die Personen CORRECTIV berichteten",https://correctiv.org/aktuelles/bundeswehr/2026/06/24/pistorius-beendet-teuerstes-marine-projekt-der-geschichte/,correctiv.org,Pistorius beendet teuerstes Marine-Projekt der Geschichte,0.1,LOW,False,,,factcheck,2026-06-29T19:59:39.773745
Nach Angaben der Polizei kamen etwa 4,https://correctiv.org/faktencheck/hintergrund/2026/06/24/warum-die-polizei-das-trommeln-auf-einer-anti-merz-demo-einschraenkte/,correctiv.org,Warum die Polizei das Trommeln auf einer Anti-Merz-Demo einschränkte,0,LOW,False,,,factcheck,2026-06-29T19:59:40.546402
"Mit dem neuen Format erweitert CORRECTIV sein wachsendes tagesaktuelles Angebot um einen Podcast für alle, die sich zum Feierabend kompakt über die wichtigsten politischen Nachrichten und Einordnungen des Tages informieren möchten",https://correctiv.org/in-eigener-sache/2026/06/22/was-zaehlt-correctiv-startet-taeglichen-nachrichten-podcast/,correctiv.org,„Was zählt“: CORRECTIV startet täglichen Nachrichten-Podcast - correctiv.org,0.1,LOW,False,,,factcheck,2026-06-29T19:59:41.129759
90 12051 Berlin Fax: +49 (0) 30 – 555 780 2 20 Büro Berlin Singerstraße 109 10179 Berlin Buchladen Essen Akazienallee 10 45127 Essen Online-Shop Jugendredaktion Salon5 Alle Standorte CORRECTIV,https://correctiv.org/in-eigener-sache/2026/06/22/was-zaehlt-correctiv-startet-taeglichen-nachrichten-podcast/,correctiv.org,„Was zählt“: CORRECTIV startet täglichen Nachrichten-Podcast - correctiv.org,0.1,LOW,False,,,factcheck,2026-06-29T19:59:41.218871
[DEBUNKED] Ist eine Ampel in Berlin wegen 35 Grad Hitze geschmolzen?,https://www.mimikama.org/ampel-berlin-35-grad-geschmolzen/,www.mimikama.org,Ist eine Ampel in Berlin wegen 35 Grad Hitze geschmolzen?,0.9,HIGH,True,FALSE - Debunked by fact-checkers,www.mimikama.org,factcheck,2026-06-29T19:59:41.308223
[DEBUNKED] Sind diese Angebote für Klimageräte und Ventilatoren von Lidl und Netto echt?,https://www.mimikama.org/klimageraet-ventilator-lidl-netto-fake-shop/,www.mimikama.org,Sind diese Angebote für Klimageräte und Ventilatoren von Lidl und Netto echt?,0.9,HIGH,True,FALSE - Debunked by fact-checkers,www.mimikama.org,factcheck,2026-06-29T19:59:41.730354
[DEBUNKED] Solaranlagen verursachen keine Hitzewelle – Fakten statt Falschinfo!,https://www.mimikama.org/solaranlagen-verursachen-keine-hitzewelle/,www.mimikama.org,Solaranlagen verursachen keine Hitzewelle – Fakten statt Falschinfo!,0.9,HIGH,True,FALSE - Debunked by fact-checkers,www.mimikama.org,factcheck,2026-06-29T19:59:41.818143
Unter 16-Jährige sollten keine Accounts mehr auf großen Social-Media-Plattformen haben,https://www.mimikama.org/australiens-social-media-verbot-scheitert-am-alltag/,www.mimikama.org,Australiens Social-Media-Verbot scheitert am Alltag,0.1,LOW,False,,,factcheck,2026-06-29T19:59:41.993235
Die neue Studie zeigt: So einfach ist es nicht,https://www.mimikama.org/australiens-social-media-verbot-scheitert-am-alltag/,www.mimikama.org,Australiens Social-Media-Verbot scheitert am Alltag,0,LOW,False,,,factcheck,2026-06-29T19:59:42.088304
Bei den 14- bis 15-Jährigen sank sie leicht von 78 auf 69 Prozent,https://www.mimikama.org/australiens-social-media-verbot-scheitert-am-alltag/,www.mimikama.org,Australiens Social-Media-Verbot scheitert am Alltag,0,LOW,False,,,factcheck,2026-06-29T19:59:42.182732
[DEBUNKED] CERN wird 2026 nicht wegen einer „Matrix“ abgeschaltet,https://www.mimikama.org/cern-2026-nicht-wegen-einer-matrix-abgeschaltet/,www.mimikama.org,CERN wird 2026 nicht wegen einer „Matrix“ abgeschaltet,0.9,HIGH,True,FALSE - Debunked by fact-checkers,www.mimikama.org,factcheck,2026-06-29T19:59:42.304802
[DEBUNKED] Maischberger: Eskalation im Studio zwischen Merz und Chrupalla?,https://www.mimikama.org/maischberger-eskalation-studio-merz-chrupalla-fake/,www.mimikama.org,Maischberger: Eskalation im Studio zwischen Merz und Chrupalla?,0.9,HIGH,True,FALSE - Debunked by fact-checkers,www.mimikama.org,factcheck,2026-06-29T19:59:42.423540
[DEBUNKED] Früher war es auch heiß,https://www.mimikama.org/frueher-war-es-auch-heiss-hitzetage-klimawandel/,www.mimikama.org,Früher war es auch heiß,0.9,HIGH,True,FALSE - Debunked by fact-checkers,www.mimikama.org,factcheck,2026-06-29T19:59:42.511744
[DEBUNKED] Wurde in Indien ein 5G-Mast aus Protest angezündet?,https://www.mimikama.org/indien-5g-mast-angezuendet/,www.mimikama.org,Wurde in Indien ein 5G-Mast aus Protest angezündet?,0.9,HIGH,True,FALSE - Debunked by fact-checkers,www.mimikama.org,factcheck,2026-06-29T19:59:42.614802
"[DEBUNKED] Heimarbeit mit Kugelschreibern, Haargummis und Perlen?",https://www.mimikama.org/heimarbeit-kugelschreiber-haargummi-perlen-betrug/,www.mimikama.org,"Heimarbeit mit Kugelschreibern, Haargummis und Perlen?",0.9,HIGH,True,FALSE - Debunked by fact-checkers,www.mimikama.org,factcheck,2026-06-29T19:59:42.699135
[DEBUNKED] Lamborghini auf A12? KI-Bild entlarvt zahlreiche Fehler!,https://www.mimikama.org/lamborghini-auf-der-a12-fehler-entlarven-ki-bild/,www.mimikama.org,Lamborghini auf A12? KI-Bild entlarvt zahlreiche Fehler!,0.9,HIGH,True,FALSE - Debunked by fact-checkers,www.mimikama.org,factcheck,2026-06-29T19:59:42.779693
[DEBUNKED] Verschenkt Elon Musk tatsächlich Geld für ein Krypto-Casino?,https://www.mimikama.org/verschenkt-elon-musk-geld-krypto-casino/,www.mimikama.org,Verschenkt Elon Musk tatsächlich Geld für ein Krypto-Casino?,0.9,HIGH,True,FALSE - Debunked by fact-checkers,www.mimikama.org,factcheck,2026-06-29T19:59:42.866268
"Sie müssen keine neue Geschichte erfinden, sondern nur eine vertraute Kaufsituation nachbauen: ein Angebot, ein Login, ein Warenkorb, eine Zahlung",https://www.mimikama.org/amazon-prime-day-2026-betrug-erkennen/,www.mimikama.org,Vorsicht: Amazon Prime Day 2026 – Betrug erkennen und schützen!,0.1,LOW,False,,,factcheck,2026-06-29T19:59:43.051904
Nach Angaben von Check Point Research wurden bereits Monate vor dem Shopping-Event tausende neue Amazon-bezogene Domains registriert,https://www.mimikama.org/amazon-prime-day-2026-betrug-erkennen/,www.mimikama.org,Vorsicht: Amazon Prime Day 2026 – Betrug erkennen und schützen!,0,LOW,False,,,factcheck,2026-06-29T19:59:43.139979
Im Umfeld des Prime Day wurden laut Check Point Research etwa Domains nach dem Muster „amazon-prime,https://www.mimikama.org/amazon-prime-day-2026-betrug-erkennen/,www.mimikama.org,Vorsicht: Amazon Prime Day 2026 – Betrug erkennen und schützen!,0,LOW,False,,,factcheck,2026-06-29T19:59:43.233152
[DEBUNKED] Werden auf Vinted Kinder verkauft?,https://www.mimikama.org/vinted-kinder-verkauft-faktencheck/,www.mimikama.org,Werden auf Vinted Kinder verkauft?,0.9,HIGH,True,FALSE - Debunked by fact-checkers,www.mimikama.org,factcheck,2026-06-29T19:59:43.317026
[DEBUNKED] CDU-Abgeordneter zur AfD gewechselt? Falsches Video entlarvt Lüge!,https://www.mimikama.org/cdu-abgeordneter-zur-afd-gewechselt-nein/,www.mimikama.org,CDU-Abgeordneter zur AfD gewechselt? Falsches Video entlarvt Lüge!,0.9,HIGH,True,FALSE - Debunked by fact-checkers,www.mimikama.org,factcheck,2026-06-29T19:59:43.399893
[DEBUNKED] Wetterkarten-Manipulation: KI-Video als falscher Beweis entlarvt,https://www.mimikama.org/ki-video-als-beweis-fuer-wetterkarten-manipulation/,www.mimikama.org,Wetterkarten-Manipulation: KI-Video als falscher Beweis entlarvt,0.9,HIGH,True,FALSE - Debunked by fact-checkers,www.mimikama.org,factcheck,2026-06-29T19:59:43.484115
"Auf diesen Widerspruch zur Bezeichnung hinzuweisen, ist keine Spitzfindigkeit",https://www.volksverpetzer.de/analyse/eu-verordnung-rueckfuehrung/,www.volksverpetzer.de,Abschreckung durch Angst: Wie die neue EU-Verordnung das Wort ‚Rückführung&#039; aushöhlt - Volksver,0.1,LOW,False,,,factcheck,2026-06-29T19:59:44.353889
Die Partei findet aber immer mehr politische Anschlussstellen auf der Suche nach einer neuen deutschen Identität,https://www.volksverpetzer.de/analyse/afd-sachsen-anhalt-bauhaus/,www.volksverpetzer.de,Will die AfD Sachsen-Anhalt das Architektur-Erbe ihres eigenen Bundeslandes verbannen? - Volksverpet,0.1,LOW,False,,,factcheck,2026-06-29T19:59:45.233169
"Im ersten Wahlgang gewann der Rechtsextremist Hartung mit 29 Prozent der Stimmen, musste aber in die Stichwahl gegen Hoffmann von der CDU, der 23,6 Prozent der Stimmen geholt hatte",https://www.volksverpetzer.de/aktuelles/aue-bad-schlema-nazi-ard/,www.volksverpetzer.de,Aue-Bad Schlema: Neonazi verliert die Wahl – und bekommt ARD-Sendezeit - Volksverpetzer,0,LOW,False,,,factcheck,2026-06-29T19:59:46.232183
Laut einem Policy Paper des Else Frenkel-Brunswik-Instituts von 2022 ist er „eine der bekanntesten Personen aus der Neonazi-Szene im Erzgebirgskreis,https://www.volksverpetzer.de/aktuelles/aue-bad-schlema-nazi-ard/,www.volksverpetzer.de,Aue-Bad Schlema: Neonazi verliert die Wahl – und bekommt ARD-Sendezeit - Volksverpetzer,0,LOW,False,,,factcheck,2026-06-29T19:59:46.322049
[DEBUNKED] Volksverpetzer gewinnt gegen die Ostdeutsche Allgemeine vor Gericht - Volksverpetzer,https://www.volksverpetzer.de/aktuelles/volksverpetzer-gewinnt-ostdeutsche-allgemeine/,www.volksverpetzer.de,Volksverpetzer gewinnt gegen die Ostdeutsche Allgemeine vor Gericht - Volksverpetzer,0.9,HIGH,True,FALSE - Debunked by fact-checkers,www.volksverpetzer.de,factcheck,2026-06-29T19:59:47.098154
"“ Warte mal - die AfD, das waren doch die, die überall eine „Islamisierung“ wittern, für die es überhaupt keine Faktengrundlage gibt",https://www.volksverpetzer.de/analyse/afd-unterstuetzt-terroristen/,www.volksverpetzer.de,‚Selbst anpacken‘: AfD unterstützt Terroristen in Deutschland? - Volksverpetzer,0.1,LOW,False,,,factcheck,2026-06-29T19:59:47.977547
Auch kandidiert er laut seinem Instagram-Profil für die „Generation Deutschland“ Baden-Württemberg,https://www.volksverpetzer.de/analyse/afd-unterstuetzt-terroristen/,www.volksverpetzer.de,‚Selbst anpacken‘: AfD unterstützt Terroristen in Deutschland? - Volksverpetzer,0,LOW,False,,,factcheck,2026-06-29T19:59:48.070784
"OAZ-Chefredakteur mit „langem Bart“ Vor ein paar Wochen berichtete er hinter vorgehaltener Hand über seine Erfahrungen dort als Redakteur: „Die Wahrheit ist: Der wahre Chefredakteur, und das weiß auch jeder im Haus, trägt einen langen Bart",https://www.volksverpetzer.de/aktuelles/100-tage-oaz-fake-redaktion-autoren-geklaut/,www.volksverpetzer.de,Fake-Redaktion der „Ostdeutschen Allgemeinen“: Fast 400 Autoren „geklaut“ - Volksverpetzer,0,LOW,False,,,factcheck,2026-06-29T19:59:48.950088
"Friedrich würde nie, nie, nie einen selbstbewussten, eigenständigen und unabhängigen Chefredakteur akzeptieren",https://www.volksverpetzer.de/aktuelles/100-tage-oaz-fake-redaktion-autoren-geklaut/,www.volksverpetzer.de,Fake-Redaktion der „Ostdeutschen Allgemeinen“: Fast 400 Autoren „geklaut“ - Volksverpetzer,0.1,LOW,False,,,factcheck,2026-06-29T19:59:49.048804
Und die alle hatten bis auf wenige Ausnahmen eines miteinander gemein: Sie hatten noch nicht eine Zeile für die OAZ geschrieben,https://www.volksverpetzer.de/aktuelles/100-tage-oaz-fake-redaktion-autoren-geklaut/,www.volksverpetzer.de,Fake-Redaktion der „Ostdeutschen Allgemeinen“: Fast 400 Autoren „geklaut“ - Volksverpetzer,0.1,LOW,False,,,factcheck,2026-06-29T19:59:49.111243
"Diesen Monat schauen wir auf eine Millionenspende an die AfD, die die rechtsextreme Partei laut Gericht nicht zurückbekommt",https://www.volksverpetzer.de/serie/urteile-mai-2026-afd-spende/,www.volksverpetzer.de,Urteile Mai 2026: Die AfD spendiert dem Staat unfreiwillig Millionen - Volksverpetzer,0,LOW,False,,,factcheck,2026-06-29T19:59:49.988429
"2,35 Millionen Euro an - vermeintlicher Spender: der Österreicher Gerhard Dingler - ein früherer Regionalpolitiker der FPÖ",https://www.volksverpetzer.de/serie/urteile-mai-2026-afd-spende/,www.volksverpetzer.de,Urteile Mai 2026: Die AfD spendiert dem Staat unfreiwillig Millionen - Volksverpetzer,0,LOW,False,,,factcheck,2026-06-29T19:59:50.088260
"Geldwerte Leistungen, auch Werbemaßnahmen ab einer bestimmten Größenordnung, sind laut Verwaltungsgericht Berlin Spenden",https://www.volksverpetzer.de/serie/urteile-mai-2026-afd-spende/,www.volksverpetzer.de,Urteile Mai 2026: Die AfD spendiert dem Staat unfreiwillig Millionen - Volksverpetzer,0,LOW,False,,,factcheck,2026-06-29T19:59:50.181203
"Man sieht, dass bis auf den letzten Stuhl alle Plätze belegt sind",https://www.volksverpetzer.de/aktuelles/lohnt-kaempfen-merz-keine-antwort/,www.volksverpetzer.de,Wofür lohnt es sich zu kämpfen? Warum Merz keine Antwort auf diese Frage hat - Volksverpetzer,0.1,LOW,False,,,factcheck,2026-06-29T19:59:51.063551
Er räumt Ängste und Vorwürfe aus und geht sachlich auf alle Entgegnungen ein,https://www.volksverpetzer.de/aktuelles/lohnt-kaempfen-merz-keine-antwort/,www.volksverpetzer.de,Wofür lohnt es sich zu kämpfen? Warum Merz keine Antwort auf diese Frage hat - Volksverpetzer,0.1,LOW,False,,,factcheck,2026-06-29T19:59:51.162125
"Die ehemalige Menschenrechtsbeauftragte der CDU Erika Steinbach facht den Hass auf Walter Lübcke über ihre Social-Media-Kanäle immer wieder an, sodass der CDU-Politiker Peter Tauber ihr eine direkte Mitschuld an dem Mord zuspricht",https://www.volksverpetzer.de/aktuelles/lohnt-kaempfen-merz-keine-antwort/,www.volksverpetzer.de,Wofür lohnt es sich zu kämpfen? Warum Merz keine Antwort auf diese Frage hat - Volksverpetzer,0.1,LOW,False,,,factcheck,2026-06-29T19:59:51.253662
"[DEBUNKED] Ich habe den WELT-Artikel von Kristina Schröder gelesen, damit ihr es nicht müsst - Volksverpetzer",https://www.volksverpetzer.de/faktencheck/welt-schroeder-klima-fake/,www.volksverpetzer.de,"Ich habe den WELT-Artikel von Kristina Schröder gelesen, damit ihr es nicht müsst - Volksverpetzer",0.9,HIGH,True,FALSE - Debunked by fact-checkers,www.volksverpetzer.de,factcheck,2026-06-29T19:59:52.031090
[DEBUNKED] 13 stories about the founding fathers for America's 250th birthday | Snopes.com,https://www.snopes.com/collections/founding-fathers-america-250/,www.snopes.com,13 stories about the founding fathers for America's 250th birthday | Snopes.com,0.9,HIGH,True,FALSE - Debunked by fact-checkers,www.snopes.com,factcheck,2026-06-29T19:59:52.246117
"[DEBUNKED] Did Matthew McConaughey publicly praise Trump, calling him 'a great friend'? | Snopes.com",https://www.snopes.com/fact-check/matthew-mcconaughey-trump-statement/,www.snopes.com,"Did Matthew McConaughey publicly praise Trump, calling him 'a great friend'? | Snopes.com",0.9,HIGH,True,FALSE - Debunked by fact-checkers,www.snopes.com,factcheck,2026-06-29T19:59:52.345166
[DEBUNKED] Does image show Lindsey Graham posing with shirtless UFC fighters? | Snopes.com,https://www.snopes.com/fact-check/lindsey-graham-ufc-fighters/,www.snopes.com,Does image show Lindsey Graham posing with shirtless UFC fighters? | Snopes.com,0.9,HIGH,True,FALSE - Debunked by fact-checkers,www.snopes.com,factcheck,2026-06-29T19:59:52.885693
"[DEBUNKED] Social Security checks weren't renamed 'federal benefit payments,' despite claims | Snopes.com",https://www.snopes.com/fact-check/social-security-benefit-payment/,www.snopes.com,"Social Security checks weren't renamed 'federal benefit payments,' despite claims | Snopes.com",0.9,HIGH,True,FALSE - Debunked by fact-checkers,www.snopes.com,factcheck,2026-06-29T19:59:53.000233
"[DEBUNKED] Don't believe story about heroic 'K9 Valor' surviving suicide bombing, saving 47 soldiers | Snopes.com",https://www.snopes.com/fact-check/k9-valor-medal-honor-story/,www.snopes.com,"Don't believe story about heroic 'K9 Valor' surviving suicide bombing, saving 47 soldiers | Snopes.c",0.9,HIGH,True,FALSE - Debunked by fact-checkers,www.snopes.com,factcheck,2026-06-29T19:59:53.101697
"[DEBUNKED] Does image show barbed wire fencing, guard towers around reflecting pool? Don't be fooled | Snopes.com",https://www.snopes.com/fact-check/reflecting-pool-barbed-wire-towers/,www.snopes.com,"Does image show barbed wire fencing, guard towers around reflecting pool? Don't be fooled | Snopes.c",0.9,HIGH,True,FALSE - Debunked by fact-checkers,www.snopes.com,factcheck,2026-06-29T19:59:53.314933
[DEBUNKED] Did beluga whale escape captivity in Alaska to reunite with its calf? | Snopes.com,https://www.snopes.com/fact-check/beluga-whale-escape-captivity/,www.snopes.com,Did beluga whale escape captivity in Alaska to reunite with its calf? | Snopes.com,0.9,HIGH,True,FALSE - Debunked by fact-checkers,www.snopes.com,factcheck,2026-06-29T19:59:53.433477
[DEBUNKED] Rumor that Vinted users are selling children is flooding social media. Here's what we know | Snopes.com,https://www.snopes.com/news/2026/06/26/vinted-child-trafficking/,www.snopes.com,Rumor that Vinted users are selling children is flooding social media. Here's what we know | Snopes.,0.9,HIGH,True,FALSE - Debunked by fact-checkers,www.snopes.com,factcheck,2026-06-29T19:59:53.578688
"Between 50% and 70% of all adult white men met the requirement, said Rosemarie Zagarri, a history professor at George Mason University who has researched voting in early America",http://www.politifact.com/article/2026/jun/29/250th-anniversary-history-voting-mail-election/,www.politifact.com,PolitiFact | From booze-filled parties to mail ballots: how did American voting actually evolve?,0,LOW,False,,,factcheck,2026-06-29T19:59:54.075150
[DEBUNKED] PolitiFact | Fact-checking Florida Republicans’ Sunshine State Showdown,http://www.politifact.com/article/2026/jun/27/Florida-GOP-Byron-Donalds-governor-election/,www.politifact.com,PolitiFact | Fact-checking Florida Republicans’ Sunshine State Showdown,0.9,HIGH,True,FALSE - Debunked by fact-checkers,www.politifact.com,factcheck,2026-06-29T19:59:54.196893
"[DEBUNKED] PolitiFact | Platner says Collins sided with Trump to cut Medicaid, SNAP and help the rich. That’s False.",http://www.politifact.com/factchecks/2026/jun/25/graham-platner/Susan-Collins-Maine-Senate-Trump-tax-bill-SNAP/,www.politifact.com,"PolitiFact | Platner says Collins sided with Trump to cut Medicaid, SNAP and help the rich. That’s F",0.9,HIGH,True,FALSE - Debunked by fact-checkers,www.politifact.com,factcheck,2026-06-29T19:59:54.627889
[DEBUNKED] PolitiFact | Colombia&#x27;s fast voting results aren&#x27;t proof of cheating in California elections,http://www.politifact.com/article/2026/jun/25/Colombia-presidential-elections-california-primary/,www.politifact.com,PolitiFact | Colombia&#x27;s fast voting results aren&#x27;t proof of cheating in California electio,0.9,HIGH,True,FALSE - Debunked by fact-checkers,www.politifact.com,factcheck,2026-06-29T19:59:54.745374
"Between his second inauguration and the day of his February 2026 State of the Union address — the first time he mentioned the $30,000 figure — the S&amp;P rose by about 13%",http://www.politifact.com/factchecks/2026/jun/25/donald-trump/401k-second-term-balance-stock-market/,www.politifact.com,PolitiFact | Donald Trump exaggerates 401(k) gains during his second term,0,LOW,False,,,factcheck,2026-06-29T19:59:54.924582
