claim,source_url,source_domain,article_title,risk_score,risk_category,has_factcheck,factcheck_rating,factcheck_source,source_type,checked_at
"If the number of seats is increased by 50%, he said, the south would have 195 seats in an expanded House of 815, while the remaining states would command 620 seats",https://www.hindustantimes.com/india-news/tgana-cm-opposes-centre-s-move-to-scale-ls-assembly-seats-101774468837961.html,hindustantimes.com,"T’gana CM opposes Centre’s move to scale LS, assembly seats| India News",0,LOW,False,,,unknown,2026-03-26T07:13:03.218272
"When radiologist readers were unaware of the study’s true purpose, only 41% spontaneously identified AI-generated images, according to a report published in Radiology",https://www.businessday.co.za/lifestyle/2026-03-26-fake-medical-images-pose-high-stakes-risk-study-finds/,businessday.co.za,"Fake medical images pose &#x27;high-stakes&#x27; risk, study finds",0,LOW,False,,,unknown,2026-03-26T07:13:10.140839
"After being informed that the dataset contained synthetic images, the radiologists’ mean accuracy in differentiating the real and synthetic X-rays rose to 75%",https://www.businessday.co.za/lifestyle/2026-03-26-fake-medical-images-pose-high-stakes-risk-study-finds/,businessday.co.za,"Fake medical images pose &#x27;high-stakes&#x27; risk, study finds",0,LOW,False,,,unknown,2026-03-26T07:13:10.377543
5 Pro (Google) and Llama 4 Maverick (Meta Platforms) — at detecting the fake images ranged from 57% to 85%,https://www.businessday.co.za/lifestyle/2026-03-26-fake-medical-images-pose-high-stakes-risk-study-finds/,businessday.co.za,"Fake medical images pose &#x27;high-stakes&#x27; risk, study finds",0,LOW,False,,,unknown,2026-03-26T07:13:10.600484
"In the end, Barbara Corcoran agreed to investing in the company, with the agreement she would be paid back her 15% investment on the $3 million proposal within three years",https://www.abc12.com/news/business/freeland-company-lands-deal-on-shark-tank/article_b058363f-b961-4b94-b089-a06f6263deb1.html,abc12.com,Freeland company lands deal on Shark Tank | Business | abc12.com,0,LOW,False,,,unknown,2026-03-26T07:13:13.026513
"Laut dem Bundesamt für Verfassungsschutz, das bereits Anfang Februar auf die Attacke hingewiesen hatte, ohne jedoch Russland zu nennen, läuft die Phishing-Kampagne „seit mehreren Monaten und ist aktuell noch aktiv“",https://correctiv.org/hybride-kriegsfuehrung/2026/03/25/nach-correctiv-recherche-zu-phishing-attacke-innenpolitiker-sehen-defizite-im-umgang-mit-hybriden-bedrohungen-russlands/,correctiv.org,Politiker fordern nach Phishing-Angriff Schritte gegen hybride Bedrohung,0,LOW,False,,,factcheck,2026-03-26T07:13:14.446691
"(Symbolfoto: picture alliance/dpa | Ronny Hartmann) Rund 900 Millionen Euro will die Bundeswehr für Container ausgeben, in denen Soldatinnen und Soldatinnen zeitweise schlafen sollen",https://correctiv.org/aktuelles/sicherheit-und-verteidigung/2026/03/26/milliardenteure-uebergangsloesung-tausende-soldaten-sollen-in-containern-schlafen-bundeswehr-verteidigungsministerium/,correctiv.org,Bundeswehr: Tausende Soldaten sollen in Containern schlafen,0,LOW,False,,,factcheck,2026-03-26T07:13:15.908234
Das Containerprogramm mit dem Namen „SIPGO“ ist jedoch in sechs EU-weiten Ausschreibungen zu finden: Sie summieren sich auf das Gesamtvolumen von rund 900 Millionen Euro,https://correctiv.org/aktuelles/sicherheit-und-verteidigung/2026/03/26/milliardenteure-uebergangsloesung-tausende-soldaten-sollen-in-containern-schlafen-bundeswehr-verteidigungsministerium/,correctiv.org,Bundeswehr: Tausende Soldaten sollen in Containern schlafen,0,LOW,False,,,factcheck,2026-03-26T07:13:16.107636
Diese haben einen Umfang von mindestens 400 Millionen Euro,https://correctiv.org/aktuelles/sicherheit-und-verteidigung/2026/03/26/milliardenteure-uebergangsloesung-tausende-soldaten-sollen-in-containern-schlafen-bundeswehr-verteidigungsministerium/,correctiv.org,Bundeswehr: Tausende Soldaten sollen in Containern schlafen,0,LOW,False,,,factcheck,2026-03-26T07:13:16.332956
90 12051 Berlin Fax: +49 (0) 30 – 555 780 2 20 Büro Berlin Singerstraße 109 10179 Berlin Buchladen Essen Akazienallee 10 45127 Essen Online-Shop Jugendredaktion Salon5 Alle Standorte CORRECTIV,https://correctiv.org/in-eigener-sache/2026/03/25/top-investigativjournalist-martin-murphy-verstaerkt-correctiv/,correctiv.org,Top-Investigativjournalist Martin Murphy verstärkt CORRECTIV - correctiv.org,0.1,LOW,False,,,factcheck,2026-03-26T07:13:18.727899
[DEBUNKED] EU-Strafen für US-Techfirmen sind nicht mit Steuern vergleichbar,https://correctiv.org/faktencheck/2026/03/24/warum-eu-strafgelder-fuer-us-techfirmen-nicht-mit-steuern-europaeischer-firmen-vergleichbar-sind/,correctiv.org,EU-Strafen für US-Techfirmen sind nicht mit Steuern vergleichbar,0.9,HIGH,True,FALSE - Debunked by fact-checkers,correctiv.org,factcheck,2026-03-26T07:13:19.937182
"Die Recherche zeigt erstmals in einer unabhängigen Untersuchung, dass die Spuren alle nach Russland weisen",https://correctiv.org/hybride-kriegsfuehrung/2026/03/24/hackerangriff-ueber-signal-neue-spuren-fuehren-nach-russland-cyber-phishing/,correctiv.org,Hackerangriff über Signal: Neue Spuren führen nach Russland - correctiv.org,0.1,LOW,False,,,factcheck,2026-03-26T07:13:21.348664
"Die globale und beispiellose Attacke, die laut FBI inzwischen tausende Accounts kompromittiert hat, könnte mit einem Programm durchgeführt worden sein, das für knapp 700 US-Dollar auf russischen Hackerbörsen gehandelt wurde",https://correctiv.org/hybride-kriegsfuehrung/2026/03/24/hackerangriff-ueber-signal-neue-spuren-fuehren-nach-russland-cyber-phishing/,correctiv.org,Hackerangriff über Signal: Neue Spuren führen nach Russland - correctiv.org,0,LOW,False,,,factcheck,2026-03-26T07:13:21.547202
[DEBUNKED] Warum die Berichte über angebliche Kürzungen bei CORRECTIV falsch sind - correctiv.org,https://correctiv.org/in-eigener-sache/2026/03/24/warum-die-berichte-ueber-angebliche-kuerzungen-bei-correctiv-falsch-sind/,correctiv.org,Warum die Berichte über angebliche Kürzungen bei CORRECTIV falsch sind - correctiv.org,0.9,HIGH,True,FALSE - Debunked by fact-checkers,correctiv.org,factcheck,2026-03-26T07:13:22.619346
[DEBUNKED] Falschbehauptung zu angeblichem Wahlbetrug in Baden-Württemberg,https://correctiv.org/faktencheck/2026/03/23/falsche-behauptungen-zu-angeblichem-wahlbetrug-in-baden-wuerttemberg/,correctiv.org,Falschbehauptung zu angeblichem Wahlbetrug in Baden-Württemberg,0.9,HIGH,True,FALSE - Debunked by fact-checkers,correctiv.org,factcheck,2026-03-26T07:13:23.833704
[DEBUNKED] Strom für drei Milliarden Euro „weggeworfen“? Reiches Äußerung ist irreführend,https://correctiv.org/faktencheck/2026/03/23/katherina-reiche-strom-fuer-drei-milliarden-euro-weggeworfen-ist-irrefuehrend/,correctiv.org,Strom für drei Milliarden Euro „weggeworfen“? Reiches Äußerung ist irreführend,0.9,HIGH,True,FALSE - Debunked by fact-checkers,correctiv.org,factcheck,2026-03-26T07:13:25.083903
[DEBUNKED] Epsteins Verbindungen nach Russland: Der Fall Lana Poschidajewa,https://correctiv.org/aktuelles/russland-ukraine-2/2026/03/21/jeffrey-epstein-und-der-russische-geheimdienst-die-unerzaehlte-geschichte-der-lana-poschidajewa/,correctiv.org,Epsteins Verbindungen nach Russland: Der Fall Lana Poschidajewa,0.9,HIGH,True,FALSE - Debunked by fact-checkers,correctiv.org,factcheck,2026-03-26T07:13:26.295313
"6,5 Millionen Euro Entsorgungskosten Das Duo soll für die illegale Entsorgung von insgesamt rund 125",https://correctiv.org/muell/2026/03/20/weitere-anklage-wegen-schadstoffbelasteter-boeden/,correctiv.org,Weitere Anklage wegen schadstoffbelasteter Böden - correctiv.org,0,LOW,False,,,factcheck,2026-03-26T07:13:27.537257
"Die Entsorgung der dort abgelagerten Materialien wird laut Mitteilung der Staatsanwaltschaft insgesamt mindestens 6,5 Millionen Euro kosten",https://correctiv.org/muell/2026/03/20/weitere-anklage-wegen-schadstoffbelasteter-boeden/,correctiv.org,Weitere Anklage wegen schadstoffbelasteter Böden - correctiv.org,0,LOW,False,,,factcheck,2026-03-26T07:13:27.626710
Das bestätigte auf Anfrage von CORRECTIV die Dortmunder Staatsanwaltschaft,https://correctiv.org/muell/2026/03/20/weitere-anklage-wegen-schadstoffbelasteter-boeden/,correctiv.org,Weitere Anklage wegen schadstoffbelasteter Böden - correctiv.org,0,LOW,False,,,factcheck,2026-03-26T07:13:27.826690
Im Überblick sehen Sie noch einmal alle Cartoons der Woche: Nummer 1: Katharina Greve aus dem SPOTLIGHT am Montag,https://correctiv.org/artikel/2026/03/20/spotlight-cartoon-arena-bundesregierung-setzt-auf-gas/,correctiv.org,SPOTLIGHT Cartoon-Arena: Bundesregierung setzt auf Gas - correctiv.org,0.1,LOW,False,,,factcheck,2026-03-26T07:13:29.060487
90 12051 Berlin Fax: +49 (0) 30 – 555 780 2 20 Büro Berlin Singerstraße 109 10179 Berlin Buchladen Essen Akazienallee 10 45127 Essen Online-Shop Jugendredaktion Salon5 Alle Standorte CORRECTIV,https://correctiv.org/artikel/2026/03/20/spotlight-cartoon-arena-bundesregierung-setzt-auf-gas/,correctiv.org,SPOTLIGHT Cartoon-Arena: Bundesregierung setzt auf Gas - correctiv.org,0.1,LOW,False,,,factcheck,2026-03-26T07:13:29.264133
"Kurz davor behauptete ein DB-Vorstand, das Deutschland-Ticket habe im Fernverkehr 15 Millionen Fahrgäste abgezogen",https://correctiv.org/aktuelles/deutsche-bahn/2026/03/20/verbaende-kritisieren-bahn-aussagen-zum-deutschland-ticket/,correctiv.org,Zieht das Deutschlandticket 15 Millionen Fahrgäste aus dem DB-Fernverkehr ab?,0,LOW,False,,,factcheck,2026-03-26T07:13:30.585126
Der für den Fernverkehr zuständige DB-Manager Michael Peterson war in einem Interview mit der Süddeutschen Zeitung vom vergangenen Wochenende auf die teils niedrige Auslastung der Fernverkehrszüge von mitunter nur 30 Prozent angesprochen worden,https://correctiv.org/aktuelles/deutsche-bahn/2026/03/20/verbaende-kritisieren-bahn-aussagen-zum-deutschland-ticket/,correctiv.org,Zieht das Deutschlandticket 15 Millionen Fahrgäste aus dem DB-Fernverkehr ab?,0.1,LOW,False,,,factcheck,2026-03-26T07:13:30.812592
Das hat uns 15 Millionen Fahrgäste aus den Zügen gezogen,https://correctiv.org/aktuelles/deutsche-bahn/2026/03/20/verbaende-kritisieren-bahn-aussagen-zum-deutschland-ticket/,correctiv.org,Zieht das Deutschlandticket 15 Millionen Fahrgäste aus dem DB-Fernverkehr ab?,0,LOW,False,,,factcheck,2026-03-26T07:13:31.036759
CORRECTIV-Abfrage zeigt: Bis zu 41 Prozent weniger Bewerber in den Ländern,https://correctiv.org/aktuelles/sicherheit/2026/03/20/polizei-am-limit-die-zahlen-aller-bundeslaender-im-check/,correctiv.org,Polizei am Limit? Die Zahlen aller Bundesländer im Check,0,LOW,False,,,factcheck,2026-03-26T07:13:32.479813
"“ Bewerberzahlen gehen bis zu 41 Prozent zurück Die Nachwuchssorgen beginnen beim schwindenden Interesse für den Polizeiberuf: Wie die CORRECTIV-Abfrage zeigt, bewarben sich im Jahr 2020 noch 73",https://correctiv.org/aktuelles/sicherheit/2026/03/20/polizei-am-limit-die-zahlen-aller-bundeslaender-im-check/,correctiv.org,Polizei am Limit? Die Zahlen aller Bundesländer im Check,0,LOW,False,,,factcheck,2026-03-26T07:13:32.703280
Das entspricht einem Rückgang von etwa 14 Prozent,https://correctiv.org/aktuelles/sicherheit/2026/03/20/polizei-am-limit-die-zahlen-aller-bundeslaender-im-check/,correctiv.org,Polizei am Limit? Die Zahlen aller Bundesländer im Check,0,LOW,False,,,factcheck,2026-03-26T07:13:32.928856
"Die vielen „Einzelfälle“ der inszenierten ""Angriffe"" auf die AfD Erst vor zwei Wochen stellte sich heraus, dass ein „linksextremer Angriff“, der von der AfD in Rosenheim so angezeigt und den Medien so berichtet worden war, gar nie gab",https://www.volksverpetzer.de/aktuelles/afd-auto-angezuendet-fake/,www.volksverpetzer.de,AfD-Mitglied hat Auto selbst angezündet – Nächster Fake-„Antifa-Anschlag“ aufgeflogen! - Volksverpet,0.1,LOW,False,,,factcheck,2026-03-26T07:13:36.045176
"Wie viele Fälle von „linker Gewalt“ gibt es noch, die nie welche waren",https://www.volksverpetzer.de/aktuelles/afd-auto-angezuendet-fake/,www.volksverpetzer.de,AfD-Mitglied hat Auto selbst angezündet – Nächster Fake-„Antifa-Anschlag“ aufgeflogen! - Volksverpet,0.1,LOW,False,,,factcheck,2026-03-26T07:13:36.249112
"Es gab keine Hinweise auf eine Injektion, keine auf einen Anschlag",https://www.volksverpetzer.de/aktuelles/afd-auto-angezuendet-fake/,www.volksverpetzer.de,AfD-Mitglied hat Auto selbst angezündet – Nächster Fake-„Antifa-Anschlag“ aufgeflogen! - Volksverpet,0.1,LOW,False,,,factcheck,2026-03-26T07:13:36.449585
"Während SPD und CDU um den ersten Platz kämpfen, liegt die rechtsextreme AfD in Umfragen seit Monaten stabil auf Platz drei, aktuell mit 19 Prozent",https://www.volksverpetzer.de/analyse/rheinland-pfalz-rechte-landnahme/,www.volksverpetzer.de,Rheinland-Pfalz: Sie wollten das Dorf übernehmen – dann passierte DAS! - Volksverpetzer,0,LOW,False,,,factcheck,2026-03-26T07:13:37.513685
"Bei der letzten Landtagswahl war sie noch bei 8,3 Prozent gelandet",https://www.volksverpetzer.de/analyse/rheinland-pfalz-rechte-landnahme/,www.volksverpetzer.de,Rheinland-Pfalz: Sie wollten das Dorf übernehmen – dann passierte DAS! - Volksverpetzer,0,LOW,False,,,factcheck,2026-03-26T07:13:37.598891
[DEBUNKED] Nur 1000: Rechter KI-Fake über Teilnehmerzahl bei Naidoo-Demo - Volksverpetzer,https://www.volksverpetzer.de/faktencheck/ki-fake-teilnehmer-naidoo-demo/,www.volksverpetzer.de,Nur 1000: Rechter KI-Fake über Teilnehmerzahl bei Naidoo-Demo - Volksverpetzer,0.9,HIGH,True,FALSE - Debunked by fact-checkers,www.volksverpetzer.de,factcheck,2026-03-26T07:13:38.648574
""" kommt, wenn sie in einem Wahlkreis knapp mit 25 % auf Platz 1 liegt*, warum werden ihre Niederlagen verschwiegen",https://www.volksverpetzer.de/analyse/kommunalwahl-ergebnis-ioffenbach-halbiert/,www.volksverpetzer.de,Warum titelt niemand: &quot;AfD-Ergebnis in Offenbach HALBIERT&quot;? - Volksverpetzer,0.1,LOW,False,,,factcheck,2026-03-26T07:13:39.629449
"Wenn sie in Büdingen aber mit 25,36 Prozent der Stimmen knapp Platz 1 belegt, titeln die Medien ""Erdrutsch"" und ""AfD-Sieg""",https://www.volksverpetzer.de/analyse/kommunalwahl-ergebnis-ioffenbach-halbiert/,www.volksverpetzer.de,Warum titelt niemand: &quot;AfD-Ergebnis in Offenbach HALBIERT&quot;? - Volksverpetzer,0,LOW,False,,,factcheck,2026-03-26T07:13:39.834242
Der rechte Flopp in Offenbach bekommt gar keine Aufmerksamkeit,https://www.volksverpetzer.de/analyse/kommunalwahl-ergebnis-ioffenbach-halbiert/,www.volksverpetzer.de,Warum titelt niemand: &quot;AfD-Ergebnis in Offenbach HALBIERT&quot;? - Volksverpetzer,0.1,LOW,False,,,factcheck,2026-03-26T07:13:40.036931
"Im Intranet-Beitrag stand laut t-online allerdings bereits in der Überschrift, dass die neue Kantinenpächterin einlädt",https://www.volksverpetzer.de/faktencheck/ramadan-buffet-nius-blamiert/,www.volksverpetzer.de,Ramadan-Luxusbuffet erfunden: NIUS blamiert sich wieder mit Fake-Story! - Volksverpetzer,0.1,LOW,False,,,factcheck,2026-03-26T07:13:41.072911
"Es war aber keine ""Ramadanfeier"" – und auch Getränke wurden vorher schon ausgeteilt",https://www.volksverpetzer.de/faktencheck/ramadan-buffet-nius-blamiert/,www.volksverpetzer.de,Ramadan-Luxusbuffet erfunden: NIUS blamiert sich wieder mit Fake-Story! - Volksverpetzer,0.1,LOW,False,,,factcheck,2026-03-26T07:13:41.278851
"&nbsp; Hier kombiniert man clever alle rechten Feindbilder&nbsp;– Bürgergeldempfänger, Muslime und Steuergelder",https://www.volksverpetzer.de/faktencheck/ramadan-buffet-nius-blamiert/,www.volksverpetzer.de,Ramadan-Luxusbuffet erfunden: NIUS blamiert sich wieder mit Fake-Story! - Volksverpetzer,0.1,LOW,False,,,factcheck,2026-03-26T07:13:41.476857
[DEBUNKED] Spritpreise: Dieser AfD-Fake kostet dich Geld! - Volksverpetzer,https://www.volksverpetzer.de/faktencheck/afd-nicht-spritpreise-sparen/,www.volksverpetzer.de,Spritpreise: Dieser AfD-Fake kostet dich Geld! - Volksverpetzer,0.9,HIGH,True,FALSE - Debunked by fact-checkers,www.volksverpetzer.de,factcheck,2026-03-26T07:13:42.280798
[DEBUNKED] Das rechtsextreme Märchen „Großer Austausch“ auseinandergenommen - Volksverpetzer,https://www.volksverpetzer.de/analyse/rechtsextreme-maerchen-grosser-austausch/,www.volksverpetzer.de,Das rechtsextreme Märchen „Großer Austausch“ auseinandergenommen - Volksverpetzer,0.9,HIGH,True,FALSE - Debunked by fact-checkers,www.volksverpetzer.de,factcheck,2026-03-26T07:13:43.719813
"Nach Angaben der Stadt soll er sogar schriftlich erklärt haben, nicht von der Wählbarkeit ausgeschlossen zu sein",https://www.volksverpetzer.de/aktuelles/erlangen-afd-haftstrafe/,www.volksverpetzer.de,Erlangen: AfD verschweigt Haftstrafe – und schenkt den Grünen einen Sitz - Volksverpetzer,0,LOW,False,,,factcheck,2026-03-26T07:13:45.308170
[DEBUNKED] Is 50 Cent being boycotted? The truth about his alleged comments on pro-LGBTQ+ cartoons | Snopes.com,https://www.snopes.com/fact-check/50-cent-boycott-lgbtq-cartoons/,www.snopes.com,Is 50 Cent being boycotted? The truth about his alleged comments on pro-LGBTQ+ cartoons | Snopes.com,0.9,HIGH,True,FALSE - Debunked by fact-checkers,www.snopes.com,factcheck,2026-03-26T07:13:45.399420
[DEBUNKED] Kurt Russell isn't being boycotted over supposed comments about kids watching pro-LGBTQ+ cartoons | Snopes.com,https://www.snopes.com/fact-check/kurt-russell-kids-watch-cartoons-lgbtq/,www.snopes.com,Kurt Russell isn't being boycotted over supposed comments about kids watching pro-LGBTQ+ cartoons | ,0.9,HIGH,True,FALSE - Debunked by fact-checkers,www.snopes.com,factcheck,2026-03-26T07:13:45.492009
More than 70% of those taken have no criminal conviction,https://www.snopes.com/fact-check/christy-walton-ice-ad-nyt/,www.snopes.com,Walmart heiress Christy Walton took out anti-ICE ad in New York Times | Snopes.com,0,LOW,False,,,factcheck,2026-03-26T07:13:45.678065
[DEBUNKED] Does this photo show 2 young ICE agents at LaGuardia Airport? | Snopes.com,https://www.snopes.com/fact-check/laguardia-airport-young-ice-agents/,www.snopes.com,Does this photo show 2 young ICE agents at LaGuardia Airport? | Snopes.com,0.9,HIGH,True,FALSE - Debunked by fact-checkers,www.snopes.com,factcheck,2026-03-26T07:13:45.762848
[DEBUNKED] Mike Johnson wasn't caught on 'hot mic' saying it'd be 'huge' for GOP if SAVE America Act lowered voter turnout | Snopes.com,https://www.snopes.com/fact-check/johnson-hot-mic-save-america-act/,www.snopes.com,Mike Johnson wasn't caught on 'hot mic' saying it'd be 'huge' for GOP if SAVE America Act lowered vo,0.9,HIGH,True,FALSE - Debunked by fact-checkers,www.snopes.com,factcheck,2026-03-26T07:13:46.051621
[DEBUNKED] Did Michael B. Jordan respond to Kim Kardashian asking if he was single? | Snopes.com,https://www.snopes.com/fact-check/michael-b-jordan-kim-kardashian/,www.snopes.com,Did Michael B. Jordan respond to Kim Kardashian asking if he was single? | Snopes.com,0.9,HIGH,True,FALSE - Debunked by fact-checkers,www.snopes.com,factcheck,2026-03-26T07:13:46.135516
[DEBUNKED] Tune out claim Pope Leo XIV went live at 3 a.m. to share 'urgent message' | Snopes.com,https://www.snopes.com/fact-check/pope-leo-live-3-am-urgent-message/,www.snopes.com,Tune out claim Pope Leo XIV went live at 3 a.m. to share 'urgent message' | Snopes.com,0.9,HIGH,True,FALSE - Debunked by fact-checkers,www.snopes.com,factcheck,2026-03-26T07:13:46.309842
"[DEBUNKED] Don't believe claim Mark Ruffalo invested $369K in 'Where Truth Leads, Justice Follows' TV special | Snopes.com",https://www.snopes.com/fact-check/mark-ruffalo-where-truth-leads/,www.snopes.com,"Don't believe claim Mark Ruffalo invested $369K in 'Where Truth Leads, Justice Follows' TV special |",0.9,HIGH,True,FALSE - Debunked by fact-checkers,www.snopes.com,factcheck,2026-03-26T07:13:46.496021
"[DEBUNKED] PolitiFact | After voting by mail in Florida, Trump said mail-in voting means cheating. Pants on Fire!",http://www.politifact.com/factchecks/2026/mar/25/donald-trump/trump-voted-by-mail-in-florida-the-same-month-he-f/,www.politifact.com,"PolitiFact | After voting by mail in Florida, Trump said mail-in voting means cheating. Pants on Fir",0.9,HIGH,True,FALSE - Debunked by fact-checkers,www.politifact.com,factcheck,2026-03-26T07:13:46.857464
"About 95% of TSA’s 60,000 employees are considered essential workers",http://www.politifact.com/article/2026/mar/23/TSA-ICE-DHS-shutdown-funding-paid-Trump-airport/,www.politifact.com,PolitiFact | Why are ICE agents paid during the partial government shutdown but TSA agents aren&#x27,0,LOW,False,,,factcheck,2026-03-26T07:13:47.393497
[DEBUNKED] PolitiFact | This video doesn&#x27;t show Israelis fleeing to Cyprus; it&#x27;s from the Philippines,http://www.politifact.com/factchecks/2026/mar/23/social-media/israelis-fleeing-cyprus-video/,www.politifact.com,PolitiFact | This video doesn&#x27;t show Israelis fleeing to Cyprus; it&#x27;s from the Philippines,0.9,HIGH,True,FALSE - Debunked by fact-checkers,www.politifact.com,factcheck,2026-03-26T07:13:47.452030
"Online searches for gambling addiction help have risen 23% since the 2018 Supreme Court decision, a 2025 JAMA Internal Medicine study found",http://www.politifact.com/article/2026/mar/23/march-madness-sports-betting-gambling-help-support/,www.politifact.com,PolitiFact | Is this March Madness betting cause for concern? How to tell and what to do,0,LOW,False,,,factcheck,2026-03-26T07:13:47.740234
"That’s also true of 22% of Americans broadly, the poll found",http://www.politifact.com/article/2026/mar/23/march-madness-sports-betting-gambling-help-support/,www.politifact.com,PolitiFact | Is this March Madness betting cause for concern? How to tell and what to do,0,LOW,False,,,factcheck,2026-03-26T07:13:47.942017
[DEBUNKED] PolitiFact | Trump says Iran is a country ‘based on disinformation.’ Here’s how Iran conducts influence ops,http://www.politifact.com/article/2026/mar/23/iran-disinformation-campaigns-influence-operations/,www.politifact.com,PolitiFact | Trump says Iran is a country ‘based on disinformation.’ Here’s how Iran conducts influe,0.9,HIGH,True,FALSE - Debunked by fact-checkers,www.politifact.com,factcheck,2026-03-26T07:13:48.092102
"More Info I would like to contribute One Time Monthly Yearly Join Now James Fishback stated on March 11, 2026 in a speech: ""Youth underemployment for college grads is 70%"" nationwide",http://www.politifact.com/factchecks/2026/mar/23/james-fishback/florida-youth-underemployment-college-graduate/,www.politifact.com,"PolitiFact | Is underemployment for young US college grads 70%, as FL governor candidate James Fishb",0,LOW,False,,,factcheck,2026-03-26T07:13:48.369117
"National Jobs Florida James Fishback By Samantha Putterman March 23, 2026 Is underemployment for young US college grads 70%, as FL governor candidate James Fishback says",http://www.politifact.com/factchecks/2026/mar/23/james-fishback/florida-youth-underemployment-college-graduate/,www.politifact.com,"PolitiFact | Is underemployment for young US college grads 70%, as FL governor candidate James Fishb",0,LOW,False,,,factcheck,2026-03-26T07:13:48.572250
The rate since 2008 has ranged from 38% to 48%,http://www.politifact.com/factchecks/2026/mar/23/james-fishback/florida-youth-underemployment-college-graduate/,www.politifact.com,"PolitiFact | Is underemployment for young US college grads 70%, as FL governor candidate James Fishb",0,LOW,False,,,factcheck,2026-03-26T07:13:48.776799
"More Info I would like to contribute One Time Monthly Yearly Join Now Tammy Duckworth stated on March 18, 2026 in an X post: “9% of American citizens don't have the identification that the SAVE act requires to vote",http://www.politifact.com/factchecks/2026/mar/20/tammy-duckworth/SAVE-America-Act-voter-ID-drivers-licenses-REAL-ID/,www.politifact.com,PolitiFact | Do nearly 1 in 10 Americans lack the ID the SAVE America Act would require to vote?,0,LOW,False,,,factcheck,2026-03-26T07:13:49.064438
A 2023 national survey found 9% of adult U,http://www.politifact.com/factchecks/2026/mar/20/tammy-duckworth/SAVE-America-Act-voter-ID-drivers-licenses-REAL-ID/,www.politifact.com,PolitiFact | Do nearly 1 in 10 Americans lack the ID the SAVE America Act would require to vote?,0,LOW,False,,,factcheck,2026-03-26T07:13:49.288166
"citizens could not readily access documentary proof of citizenship, and 9% also lack a nonexpired driver’s license",http://www.politifact.com/factchecks/2026/mar/20/tammy-duckworth/SAVE-America-Act-voter-ID-drivers-licenses-REAL-ID/,www.politifact.com,PolitiFact | Do nearly 1 in 10 Americans lack the ID the SAVE America Act would require to vote?,0,LOW,False,,,factcheck,2026-03-26T07:13:49.509313
"[DEBUNKED] PolitiFact | Gabbard says president, not intelligence community, determines imminent threats. Is that true?",http://www.politifact.com/article/2026/mar/20/gabbard-ossoff-iran-intelligence-imminent/,www.politifact.com,"PolitiFact | Gabbard says president, not intelligence community, determines imminent threats. Is tha",0.9,HIGH,True,FALSE - Debunked by fact-checkers,www.politifact.com,factcheck,2026-03-26T07:13:49.628687
[DEBUNKED] Video of 2022 fire in Saudi Arabia shared with false claims it shows Tel Aviv – Full Fact,https://fullfact.org/conflict/2022-saudi-arabia-fire-falsely-shared-as-tel-aviv/,fullfact.org,Video of 2022 fire in Saudi Arabia shared with false claims it shows Tel Aviv – Full Fact,0.9,HIGH,True,FALSE - Debunked by fact-checkers,fullfact.org,factcheck,2026-03-26T07:13:50.427887
"5% in 2027, and we will hit that",https://fullfact.org/politics/keir-starmer-270-billion-defence/,fullfact.org,Defence spending is not set to get an extra £270 billion – Full Fact,0,LOW,False,,,factcheck,2026-03-26T07:13:51.636904
