claim,source_url,source_domain,article_title,risk_score,risk_category,has_factcheck,factcheck_rating,factcheck_source,source_type,checked_at
"Nicht alle sind echt, aber doch sehr viele",https://www.bild.de/politik/inland/zdf-verdonnert-mitarbeiter-nach-skandal-im-heute-journal-zu-pflichtschulungen-69960533465c8ddf9405ece8,bild.de,ZDF verdonnert Mitarbeiter nach Skandal im „heute journal“ zu Pflichtschulungen | Politik | BILD.de,0.1,LOW,False,,,unknown,2026-02-19T02:24:47.382379
Sicherheit auf Großveranstaltungen wie Umzügen zu Fasching sorgen immer wieder für Diskussionen,https://www.stimme.de/heilbronn/landkreis-heilbronn/fasching-umzug-polizei-einsatz-sicherheit-besucher-art-5142946,stimme.de,Fasching-Saison beendet – Polizei Heilbronn zieht Bilanz von Umzügen und Partys - STIMME.de,0.1,LOW,False,,,unknown,2026-02-19T02:24:48.216311
"Grund dafür sieht die Polizei laut Pressemitteilung auch in der &bdquo;starken Präsenz und einem konsequenten, niederschwelligen Ei",https://www.stimme.de/heilbronn/landkreis-heilbronn/fasching-umzug-polizei-einsatz-sicherheit-besucher-art-5142946,stimme.de,Fasching-Saison beendet – Polizei Heilbronn zieht Bilanz von Umzügen und Partys - STIMME.de,0.1,LOW,False,,,unknown,2026-02-19T02:24:48.326345
"Zu stark der Gegner, zu frisch noch immer der Trainerwechsel von Horst Steffen hin zu Daniel Thioune und vor allem zu mutmachend Werders Auftritt in H&auml;lfte zwei &ndash; so die allgemeine und nachvollziehbare Lesart der Partie",https://www.weser-kurier.de/werder/profis/werder-bremen-vom-europatraum-zum-abstiegskandidaten-in-neun-monaten-doc84mu0s0vlty12mui2l2l,weser-kurier.de,Werder Bremen: Vom Europatraum zum Abstiegskandidaten in neun Monaten,0.1,LOW,False,,,unknown,2026-02-19T02:24:49.538235
In den sozialen Medien verschwimmt die Grenze zwischen Realität und Fälschung immer stärker,https://www.nordkurier.de/panorama/mein-vertrauen-in-die-wirklichkeit-steht-auf-der-kippe-4369061,nordkurier.de,Gefahr durch KI-Fakes: Wahrheit wird infrage gestellt,0.1,LOW,False,,,unknown,2026-02-19T02:24:50.307471
"Heute reicht ein Klick, um per KI eine Wirklichkeit zu erschaffen, die es nie gab",https://www.nordkurier.de/panorama/mein-vertrauen-in-die-wirklichkeit-steht-auf-der-kippe-4369061,nordkurier.de,Gefahr durch KI-Fakes: Wahrheit wird infrage gestellt,0.1,LOW,False,,,unknown,2026-02-19T02:24:50.417871
"Diese Frage stelle ich mir immer häufiger, wenn ich durch die Tiefen sozialer Netzwerke scrolle",https://www.nordkurier.de/panorama/mein-vertrauen-in-die-wirklichkeit-steht-auf-der-kippe-4369061,nordkurier.de,Gefahr durch KI-Fakes: Wahrheit wird infrage gestellt,0.1,LOW,False,,,unknown,2026-02-19T02:24:50.530260
"Die Tollwut ist eine Virusinfektion, die durch Wild- und Haustiere übertragen wird und eine fast immer tödliche Entzündung des Gehirns und des Rückenmarks hervorruft",https://www.waz-online.de/wissen/hund-stirbt-an-tollwut-wie-gefaehrlich-ist-die-krankheit-WTPGMQ3DNFGE3HGCKVABFWHIQA.html,waz-online.de,Hund stirbt in Rheinland-Pfalz an Tollwut: Wie gefährlich ist die Krankheit?,0.1,LOW,False,,,unknown,2026-02-19T02:24:51.621007
Grundsätzlich sind jedoch alle Säugetiere für die Viren empfänglich,https://www.waz-online.de/wissen/hund-stirbt-an-tollwut-wie-gefaehrlich-ist-die-krankheit-WTPGMQ3DNFGE3HGCKVABFWHIQA.html,waz-online.de,Hund stirbt in Rheinland-Pfalz an Tollwut: Wie gefährlich ist die Krankheit?,0.1,LOW,False,,,unknown,2026-02-19T02:24:51.734387
"&nbsp; Der in Frage stehende Account des ""falschen"" Böhmermann wurde von X durch einen ""blauen Haken"" verifiziert und zählte laut Verfügungsantrag Ende Januar ungefähr 6",https://www.lto.de/recht/hintergruende/h/lg-koeln-28o3026-jan-boehmermann-x-parodie-account-loeschen-einstweilige-verfuegung,lto.de,Fake &#039;Parodie&#039; von Böhmermann: X muss Account löschen,0,LOW,False,,,unknown,2026-02-19T02:24:52.441625
"Laut eidesstattlicher Versicherung von Böhmermann störte ihn besonders, dass dort regelmäßig Inhalte aus dem rechten Spektrum unter Hinzufügen eines Kommentars ""gerepostet"" und entsprechend kommentiert wurden, was deren Reichweite gezielt erhöht hat",https://www.lto.de/recht/hintergruende/h/lg-koeln-28o3026-jan-boehmermann-x-parodie-account-loeschen-einstweilige-verfuegung,lto.de,Fake &#039;Parodie&#039; von Böhmermann: X muss Account löschen,0,LOW,False,,,unknown,2026-02-19T02:24:52.550880
"Die Tollwut ist eine Virusinfektion, die durch Wild- und Haustiere übertragen wird und eine fast immer tödliche Entzündung des Gehirns und des Rückenmarks hervorruft",https://www.rga.de/wissen/hund-stirbt-an-tollwut-wie-gefaehrlich-ist-die-krankheit-WTPGMQ3DNFGE3HGCKVABFWHIQA.html,rga.de,Hund stirbt in Rheinland-Pfalz an Tollwut: Wie gefährlich ist die Krankheit?,0.1,LOW,False,,,unknown,2026-02-19T02:24:54.102049
Grundsätzlich sind jedoch alle Säugetiere für die Viren empfänglich,https://www.rga.de/wissen/hund-stirbt-an-tollwut-wie-gefaehrlich-ist-die-krankheit-WTPGMQ3DNFGE3HGCKVABFWHIQA.html,rga.de,Hund stirbt in Rheinland-Pfalz an Tollwut: Wie gefährlich ist die Krankheit?,0.1,LOW,False,,,unknown,2026-02-19T02:24:54.177332
&quot;Eine der Forderungen war die Einführung einer Identitätspflicht für alle Anbieter auf Online-Plattformen sowie eine verpflichtende Zertifizierung der Verkaufsportale,https://www.n-tv.de/regionales/rheinland-pfalz-und-saarland/Tollwut-Virus-bei-totem-Hund-Ermittlungen-laufen-id30376696.html,n-tv.de,Rheinland-Pfalz &amp; Saarland: Tollwut-Virus bei totem Hund – Ermittlungen laufen - ntv.de,0.1,LOW,False,,,unknown,2026-02-19T02:24:56.866707
"Wie der aktuelle Stand außerhalb des Zuständigkeitsgebiets sei, darüber habe man keine Kenntnis",https://www.n-tv.de/regionales/rheinland-pfalz-und-saarland/Tollwut-Virus-bei-totem-Hund-Ermittlungen-laufen-id30376696.html,n-tv.de,Rheinland-Pfalz &amp; Saarland: Tollwut-Virus bei totem Hund – Ermittlungen laufen - ntv.de,0.1,LOW,False,,,unknown,2026-02-19T02:24:56.991931
"26 | 23:00 545,00 EUR 1,30 (+0,24%) Bid 545,00 EUR Ask 545,60 EUR Verwandte Artikel Similarweb Aktie: Absturz",https://www.boerse-express.com/news/articles/meta-aktie-milliarden-deal-mit-nvidia-867614,boerse-express.com,Finanznachrichten &amp; Börsen-News | Börse Express,0,LOW,False,,,unknown,2026-02-19T02:24:59.109396
Immer wieder sterben Konsumenten – und die Dunkelziffer ist hoch,http://www.op-online.de/deutschland/drogen-phaenomen-mit-fake-arnzei-bedrohlicher-als-die-mafia-zr-94175251.html,op-online.de,Drogen-Phänomen mit Fake-Arnzei „bedrohlicher als die Mafia“,0.1,LOW,False,,,unknown,2026-02-19T02:24:59.788035
Immer wieder sterben Konsumenten an Überdosen,http://www.op-online.de/deutschland/drogen-phaenomen-mit-fake-arnzei-bedrohlicher-als-die-mafia-zr-94175251.html,op-online.de,Drogen-Phänomen mit Fake-Arnzei „bedrohlicher als die Mafia“,0.1,LOW,False,,,unknown,2026-02-19T02:24:59.908325
Dabei geht es vor allem um sogenannte synthetische Opioide und immer neue hochpotente Designer-Drogen wie Cychlorphin,http://www.op-online.de/deutschland/drogen-phaenomen-mit-fake-arnzei-bedrohlicher-als-die-mafia-zr-94175251.html,op-online.de,Drogen-Phänomen mit Fake-Arnzei „bedrohlicher als die Mafia“,0.1,LOW,False,,,unknown,2026-02-19T02:25:00.016705
Für mich bedeutet das einen Schaden von 2000 Euro,http://www.wa.de/hamm/hammer-immobilienverwaltung-zweigt-auch-versicherungsbeitraege-ab-94174287.html,wa.de,Hammer Immobilienverwaltung zweigt auch Versicherungsbeiträge ab,0,LOW,False,,,unknown,2026-02-19T02:25:01.282193
Immer mehr Fälle von potenziell geschädigten Eigentümern wurden bekannt,http://www.wa.de/hamm/hammer-immobilienverwaltung-zweigt-auch-versicherungsbeitraege-ab-94174287.html,wa.de,Hammer Immobilienverwaltung zweigt auch Versicherungsbeiträge ab,0.1,LOW,False,,,unknown,2026-02-19T02:25:01.389288
Zwar blieb der Saal mit der «Mona Lisa» laut France 24 unversehrt,https://www.watson.ch/international/frankreich/746605491-louvre-in-der-krise-juwelenraub-und-millionenbetrug-durch-mitarbeiter,watson.ch,Louvre in der Krise: Juwelenraub und Millionenbetrug durch Mitarbeiter,0,LOW,False,,,unknown,2026-02-19T02:25:03.455296
Er treibt ein spektakuläres Renovierungsprogramm in der Höhe von 820 Millionen Euro voran,https://www.watson.ch/international/frankreich/746605491-louvre-in-der-krise-juwelenraub-und-millionenbetrug-durch-mitarbeiter,watson.ch,Louvre in der Krise: Juwelenraub und Millionenbetrug durch Mitarbeiter,0,LOW,False,,,unknown,2026-02-19T02:25:03.631578
"Menschen, die vor Beginn des Online-Zeitalters geboren wurden, die also keine digitalen Eingeborenen (Digital Natives),sondern Digital Zuagroaste aus einer analogen Zeit sind, fühlen sich mitunter verloren in der Parallelwelt des Webs",https://kurier.at/chronik/burgenland/digitale-kompetenz-senioren-online-betrug-schutz/403132435,kurier.at,Schützen und unterstützen wir die Älteren &#x7C; Kurier,0.1,LOW,False,,,unknown,2026-02-19T02:25:03.963727
"Burgenland: Falsche Heizungsinstallateure bestahlen 84-Jährigen Unlängst hieß es, ältere Menschen müssten sich keine Sorgen machen, man könne die ID-Austria auch weiterhin offline beantragen",https://kurier.at/chronik/burgenland/digitale-kompetenz-senioren-online-betrug-schutz/403132435,kurier.at,Schützen und unterstützen wir die Älteren &#x7C; Kurier,0.1,LOW,False,,,unknown,2026-02-19T02:25:04.098292
"Rehe, Dachse oder Hasen: Sie alle leben bei uns in Ostholstein",https://www.ln-online.de/lokales/ostholstein/das-sind-die-neuigkeiten-aus-ostholstein-fuer-den-18-februar-2026-M2MAJCDAMNHNPGURDQX4K4QLXE.html,ln-online.de,Das sind die Neuigkeiten aus Ostholstein für den 18. Februar 2026,0.1,LOW,False,,,unknown,2026-02-19T02:25:04.921472
Jetzt anmelden Kostenlos registrieren Copyright-Hinweis öffnen/schließen &copy; Jürg ChristandlExhumierungen haben immer wieder zu Ermittlungserfolgen geführt,https://kurier.at/chronik/niederoesterreich/pflegerin-unter-mordverdacht-gruft-jahrelang-von-wasser-geflutet/403132423,kurier.at,Pflegerin unter Mordverdacht: Gruft jahrelang von Wasser geflutet &#x7C; Kurier,0.1,LOW,False,,,unknown,2026-02-19T02:25:05.146016
"""Weil sie ihm die versprochene Gage für seine Hilfe angeblich nie bezahlt hat“, heißt es aus Ermittlerkreisen",https://kurier.at/chronik/niederoesterreich/pflegerin-unter-mordverdacht-gruft-jahrelang-von-wasser-geflutet/403132423,kurier.at,Pflegerin unter Mordverdacht: Gruft jahrelang von Wasser geflutet &#x7C; Kurier,0.1,LOW,False,,,unknown,2026-02-19T02:25:05.264017
"Das Unternehmen aus Aachen ist auf die Produktion von Fahrzeuglampen spezialisiert, stellte zuletzt im November eine LED-Lampe vor, die für „eine um bis zu 450 Prozent höhere Leuchtkraft“ sorgen soll",http://www.merkur.de/wirtschaft/not-insolvenz-deutsche-tochter-von-us-skandalkonzern-in-grosser-94173582.html,merkur.de,Insolvenz: Deutsche Tochter von US-Skandalkonzern zahlungsunfähig,0,LOW,False,,,unknown,2026-02-19T02:25:06.729799
"Das Unternehmen aus Aachen ist auf die Produktion von Fahrzeuglampen spezialisiert, stellte zuletzt im November eine LED-Lampe vor, die für „eine um bis zu 450 Prozent höhere Leuchtkraft“ sorgen soll",https://www.hna.de/wirtschaft/not-insolvenz-deutsche-tochter-von-us-skandalkonzern-in-grosser-94173592.html,hna.de,Insolvenz: Deutsche Tochter von US-Skandalkonzern zahlungsunfähig,0,LOW,False,,,unknown,2026-02-19T02:25:07.663601
"die Mail wirkt auf den ersten Blick offiziell: Logos von Innenministerium, Landespolizeidirektion und Europol sollen Seriosität vortäuschen",https://www.heute.at/s/fake-mails-im-umlauf-polizei-droht-mit-haftbefehl-120162991,heute.at,"Heftige Vorwürfe – Fake-Mails im Umlauf – ""Polizei"" droht mit Haftbefehl | Heute.at",0,LOW,False,,,unknown,2026-02-19T02:25:07.827965
"Damals hieß es in der offiziellen Info: ""Dieser Brief ist gefälscht",https://www.heute.at/s/fake-mails-im-umlauf-polizei-droht-mit-haftbefehl-120162991,heute.at,"Heftige Vorwürfe – Fake-Mails im Umlauf – ""Polizei"" droht mit Haftbefehl | Heute.at",0,LOW,False,,,unknown,2026-02-19T02:25:07.939672
"Wichtig: nicht antworten, keine Daten schicken, nichts anklicken",https://www.heute.at/s/fake-mails-im-umlauf-polizei-droht-mit-haftbefehl-120162991,heute.at,"Heftige Vorwürfe – Fake-Mails im Umlauf – ""Polizei"" droht mit Haftbefehl | Heute.at",0.1,LOW,False,,,unknown,2026-02-19T02:25:08.054273
"""/> News Online luring in Canada is up 106%, with predators now using AI to target youth",https://www.stcatharinesstandard.ca/news/spike-in-online-luring-canada/article_20212f99-7f0b-581d-a7b1-0e6d8c273f9b.html,stcatharinesstandard.ca,Convenant House Toronto raise alarm over spike in luring,0,LOW,False,,,unknown,2026-02-19T02:25:15.566040
"Internal and External Factors Affecting Cuba Despite the critical situation, Rojas notes, ""the collapse is not complete,"" as Cuba still maintains a self-sufficiency rate of 40% in energy",https://www.cubaheadlines.com/articles/321186,cubaheadlines.com,Cuban Government Could &#x22;Survive and Even Emerge Stronger&#x22; Through Negotiations with the U.,0,LOW,False,,,unknown,2026-02-19T02:25:19.698896
Dort soll es keine algorithmischen Feeds oder personalisierte Empfehlungen geben,https://correctiv.org/aktuelles/netzpolitik/2026/02/18/was-bringt-ein-social-media-verbot-fuer-kinder-und-jugendliche/,correctiv.org,Was bringt ein Social-Media-Verbot für Kinder und Jugendliche? - correctiv.org,0.1,LOW,False,,,factcheck,2026-02-19T02:25:22.252260
"Alle Anbieter, darunter die beliebtesten Netzwerke in Deutschland – Instagram, Tiktok, Facebook, Snapchat und Pinter",https://correctiv.org/aktuelles/netzpolitik/2026/02/18/was-bringt-ein-social-media-verbot-fuer-kinder-und-jugendliche/,correctiv.org,Was bringt ein Social-Media-Verbot für Kinder und Jugendliche? - correctiv.org,0.1,LOW,False,,,factcheck,2026-02-19T02:25:22.361069
(Foto: picture alliance/dpa | Kay Nietfeld) Das Verteidigungsministerium will neue Kampfdrohnen beschaffen und dafür Aufträge in Höhe von zunächst rund 540 Millionen Euro an zwei Start-ups erteilen,https://correctiv.org/aktuelles/sicherheit-und-verteidigung/2026/02/18/showdown-im-bundestag-kommen-pistorius-kampfdrohnen/,correctiv.org,Showdown im Bundestag: Kommen Pistorius’ Kampfdrohnen? - correctiv.org,0.1,LOW,False,,,factcheck,2026-02-19T02:25:23.194107
"Die Beschaffung könnte in den kommenden Jahren auf insgesamt rund 4,3 Milliarden Euro anwachsen und sich so in die teuersten Vorhaben der Bundeswehr einreihen",https://correctiv.org/aktuelles/sicherheit-und-verteidigung/2026/02/18/showdown-im-bundestag-kommen-pistorius-kampfdrohnen/,correctiv.org,Showdown im Bundestag: Kommen Pistorius’ Kampfdrohnen? - correctiv.org,0,LOW,False,,,factcheck,2026-02-19T02:25:23.303994
Laut den Beschlussvorlagen sollen sie an die jungen Unternehmen Stark und Helsing gehen,https://correctiv.org/aktuelles/sicherheit-und-verteidigung/2026/02/18/showdown-im-bundestag-kommen-pistorius-kampfdrohnen/,correctiv.org,Showdown im Bundestag: Kommen Pistorius’ Kampfdrohnen? - correctiv.org,0,LOW,False,,,factcheck,2026-02-19T02:25:23.411616
[DEBUNKED] Warum Schnee auf der Akropolis kein Beleg gegen den Klimawandel ist,https://correctiv.org/faktencheck/2026/02/18/video-von-schnee-akropolis-athen-griechenland-ist-alt-und-kein-beweis-gegen-klimawandel/,correctiv.org,Warum Schnee auf der Akropolis kein Beleg gegen den Klimawandel ist,0.9,HIGH,True,FALSE - Debunked by fact-checkers,correctiv.org,factcheck,2026-02-19T02:25:24.241190
[DEBUNKED] Keine Behandlung wegen Trump-Kappe? Arzt-Video ist ein Sketch - correctiv.org,https://correctiv.org/faktencheck/aus-der-community/2026/02/17/keine-behandlung-wegen-trump-kappe-arzt-video-ist-ein-sketch/,correctiv.org,Keine Behandlung wegen Trump-Kappe? Arzt-Video ist ein Sketch - correctiv.org,0.9,HIGH,True,FALSE - Debunked by fact-checkers,correctiv.org,factcheck,2026-02-19T02:25:24.952880
[DEBUNKED] Kein Epstein-Leak: Foto mit Friedrich Merz ist gefälscht,https://correctiv.org/faktencheck/2026/02/17/bild-von-friedrich-merz-und-jeffrey-epstein-ist-gefaelscht/,correctiv.org,Kein Epstein-Leak: Foto mit Friedrich Merz ist gefälscht,0.9,HIGH,True,FALSE - Debunked by fact-checkers,correctiv.org,factcheck,2026-02-19T02:25:25.778890
[DEBUNKED] Wie die Politik Leistungsberechtigte zum Problem erklärt,https://correctiv.org/faktencheck/hintergrund/2025/09/30/wie-die-politik-leistungsberechtigte-zum-problem-erklaert/,correctiv.org,Wie die Politik Leistungsberechtigte zum Problem erklärt,0.9,HIGH,True,FALSE - Debunked by fact-checkers,correctiv.org,factcheck,2026-02-19T02:25:26.719105
[DEBUNKED] Kernkraftwerke der vierten Generation machen Endlager nicht überflüssig,https://correctiv.org/faktencheck/2026/02/17/kernkraftwerke-der-vierten-generation-machen-endlager-nicht-ueberfluessig/,correctiv.org,Kernkraftwerke der vierten Generation machen Endlager nicht überflüssig,0.9,HIGH,True,FALSE - Debunked by fact-checkers,correctiv.org,factcheck,2026-02-19T02:25:27.547386
"Fast vier Jahre später erreicht der deutsche Ableger von Russia Today, RT DE, über Spiegelseiten noch immer Millionen Aufrufe",https://correctiv.org/faktencheck/hintergrund/2026/02/16/eu-sanktionen-inhalte-von-rt-de-erreichen-immer-noch-millionen-aufrufe/,correctiv.org,EU-Sanktionen: Inhalte von RT DE erreichen weiterhin Millionen,0.1,LOW,False,,,factcheck,2026-02-19T02:25:28.489494
"Einige sehen die Presse&#8211; und Meinungsfreiheit bedroht, andere kritisieren allgemein, dass technische Lösungen wie Sanktionen keine Probleme wie Propaganda oder Desinformationskampagnen lösen könnten",https://correctiv.org/faktencheck/hintergrund/2026/02/16/eu-sanktionen-inhalte-von-rt-de-erreichen-immer-noch-millionen-aufrufe/,correctiv.org,EU-Sanktionen: Inhalte von RT DE erreichen weiterhin Millionen,0.1,LOW,False,,,factcheck,2026-02-19T02:25:28.610488
Nach einer Polizeirazzia in einem Zürcher Rückkehrzentrum erhält ein Mann einen Strafbefehl wegen rechtswidrigen Aufenthalts – obwohl er das Land laut Dublin-Verordnung gar nicht verlassen darf,https://correctiv.org/zwischen-gefaengnis-und-nothilfe/2026/02/16/geh-aber-bleib/,correctiv.org,Weder ausreisen noch bleiben ist erlaubt - correctiv.org,0,LOW,False,,,factcheck,2026-02-19T02:25:29.531752
Im Fall von Italien tritt dieses Szenario derzeit immer ein,https://correctiv.org/zwischen-gefaengnis-und-nothilfe/2026/02/16/geh-aber-bleib/,correctiv.org,Weder ausreisen noch bleiben ist erlaubt - correctiv.org,0.1,LOW,False,,,factcheck,2026-02-19T02:25:29.595332
"Die Regierung von Giorgia Meloni hat 2022 beschlossen, „wegen der grossen Zahl an Anlandungen“ keine sogenannten Dublinfälle – also asylsuchende Personen, für die das Land gemäss Dublinabkommen zuständig wäre – mehr zurückzunehmen",https://correctiv.org/zwischen-gefaengnis-und-nothilfe/2026/02/16/geh-aber-bleib/,correctiv.org,Weder ausreisen noch bleiben ist erlaubt - correctiv.org,0.1,LOW,False,,,factcheck,2026-02-19T02:25:29.705538
"Er wurde als Geheimdienstmitarbeiter enttarnt und dann ganz offiziell zum Sicherheitsrisiko erklärt: Im Dezember 2024 belegte ihn die EU mit Sanktionen, weil er seine „destabilisierenden Aktivitäten“ im Auftrag der russischen Regierung ausübte",https://correctiv.org/aktuelles/russland-ukraine-2/2026/02/16/ein-russischer-agent-in-deutschland-und-der-glycerin-handel-russland-gru-sanktionen/,correctiv.org,Ein russischer Agent in Deutschland und der Glycerin-Handel,0.05,LOW,False,,,factcheck,2026-02-19T02:25:30.591933
"Auch das Land Bayern soll laut dem Dokument eine Summe eingezahlt haben, ebenso die Robert-Bosch-Stiftung und der Energieriese EnBW",https://correctiv.org/aktuelles/sicherheit-und-verteidigung/2026/02/13/millionen-aus-katar-wer-finanziert-die-muenchner-sicherheitskonferenz-msc-munich-security-conference/,correctiv.org,Millionen aus Katar: Wer finanziert die Sicherheitskonferenz? - correctiv.org,0,LOW,False,,,factcheck,2026-02-19T02:25:31.367800
Februar 2026 Hier sehen Sie noch einmal alle Cartoons dieser Woche,https://correctiv.org/aktuelles/politik-2/2026/02/13/cartoon-arena-sind-die-deutschen-zu-faul/,correctiv.org,Cartoon-Arena: Sind die Deutschen zu faul? - correctiv.org,0.1,LOW,False,,,factcheck,2026-02-19T02:25:32.075919
90 12051 Berlin Fax: +49 (0) 30 – 555 780 2 20 Büro Berlin Singerstraße 109 10179 Berlin Buchladen Essen Akazienallee 10 45127 Essen Online-Shop Jugendredaktion Salon5 Alle Standorte CORRECTIV,https://correctiv.org/aktuelles/politik-2/2026/02/13/cartoon-arena-sind-die-deutschen-zu-faul/,correctiv.org,Cartoon-Arena: Sind die Deutschen zu faul? - correctiv.org,0.1,LOW,False,,,factcheck,2026-02-19T02:25:32.192385
[DEBUNKED] Rote-Bete-Kapseln: Tiktok ignoriert Deepfake-Werbung mit Ärzten,https://correctiv.org/faktencheck/hintergrund/2026/02/13/rote-bete-kapseln-tiktok-ignoriert-deepfake-werbung-mit-aerzten/,correctiv.org,Rote-Bete-Kapseln: Tiktok ignoriert Deepfake-Werbung mit Ärzten,0.9,HIGH,True,FALSE - Debunked by fact-checkers,correctiv.org,factcheck,2026-02-19T02:25:33.729089
"Vier Bundesländer sind schon offiziell an Bord, bei vier weiteren steht theoretisch nichts mehr im Weg und mindestens zwei weitere wackeln bereits",https://www.volksverpetzer.de/analyse/afd-verbot-mehrheit-bundesrat/,www.volksverpetzer.de,AfD-Verbot: Für ein Szenario gibt es jetzt bereits eine Bundesrat-Mehrheit - Volksverpetzer,0,LOW,False,,,factcheck,2026-02-19T02:25:38.744321
[DEBUNKED] &quot;Nachdenkseiten&quot; enthüllt vor Gericht die wahren Geldgeber hinter Volksverpetzer! - Volksverpetzer,https://www.volksverpetzer.de/aktuelles/nachdenkseiten-gericht-geldgeber-volksverpetzer/,www.volksverpetzer.de,&quot;Nachdenkseiten&quot; enthüllt vor Gericht die wahren Geldgeber hinter Volksverpetzer! - Volksv,0.9,HIGH,True,FALSE - Debunked by fact-checkers,www.volksverpetzer.de,factcheck,2026-02-19T02:25:40.229032
"Nach einer aktuellen Studie der ARAG war im Jahr 2025 allerdings nur noch gut die Hälfte der Befragten in Deutschland davon überzeugt, dass Gerichte alle Menschen gleich behandeln",https://www.volksverpetzer.de/aktuelles/neutralitaet-ziel-kein-zustand/,www.volksverpetzer.de,Neutralität als Waffe: Wie man zum Schweigen gebracht wird - Volksverpetzer,0.1,LOW,False,,,factcheck,2026-02-19T02:25:41.485594
"Solche Modelle lassen sich prinzipiell auf jede beliebige Person zur Vorhersage von Informationen anwenden, die diese Person nie irgendwo preisgegeben hat",https://www.volksverpetzer.de/aktuelles/ice-personalisierter-werbung/,www.volksverpetzer.de,ICE &amp; KI: Von personalisierter Werbung zur staatlichen Verfolgung - Volksverpetzer,0.1,LOW,False,,,factcheck,2026-02-19T02:25:42.685853
"hereingefallen waren, ist der Absatz von Gasheizungen um über 65 % eingebrochen",https://www.volksverpetzer.de/faktencheck/mythos-gasmangellage/,www.volksverpetzer.de,Sogar Rechte machen jetzt Stimmung gegen Gasheizungen: Mythos &quot;Gasmangellage&quot; - Volksverpe,0.1,LOW,False,,,factcheck,2026-02-19T02:25:44.366921
"Im Neubau ist der Trend noch deutlicher, hier dominiert die Wärmepumpe bei 74 % der Heizungen",https://www.volksverpetzer.de/faktencheck/mythos-gasmangellage/,www.volksverpetzer.de,Sogar Rechte machen jetzt Stimmung gegen Gasheizungen: Mythos &quot;Gasmangellage&quot; - Volksverpe,0.1,LOW,False,,,factcheck,2026-02-19T02:25:44.480294
"380 Studie zeigt, warum BILD TV so peinlich gefloppt ist von Marie-Lena Nelle | Feb",https://www.volksverpetzer.de/aktuelles/studie-bild-tv-gefloppt/,www.volksverpetzer.de,"Studie zeigt, warum BILD TV so peinlich gefloppt ist - Volksverpetzer",0,LOW,False,,,factcheck,2026-02-19T02:25:45.602063
"Dazu der Druck, auch im Urlaub erreichbar zu sein, sowie das Gefühl, dass die Verantwortung immer bei denen landet, die gerade fehlen, selbst wenn sie krank sind",https://www.volksverpetzer.de/aktuelles/studie-bild-tv-gefloppt/,www.volksverpetzer.de,"Studie zeigt, warum BILD TV so peinlich gefloppt ist - Volksverpetzer",0.1,LOW,False,,,factcheck,2026-02-19T02:25:45.714397
Und damit starten wir rein: Es gibt nicht nur immer mehr Prozesse gegen Demokratiefeinde – es gibt auch immer mehr Urteile,https://www.volksverpetzer.de/serie/urteile-januar-2026-schule-nein-zu-afd-praktikum/,www.volksverpetzer.de,Urteile Januar 2026: Schule darf Praktikum bei der AfD ablehnen - Volksverpetzer,0.1,LOW,False,,,factcheck,2026-02-19T02:25:47.985897
&nbsp; Das Oberverwaltungsgericht Berlin-Brandenburg bestätigte nun in seinem Beschluss eine Entscheidung des Verwaltungsgerichts Frankfurt (Oder) und wies die Beschwerde der Schülerin zurück,https://www.volksverpetzer.de/serie/urteile-januar-2026-schule-nein-zu-afd-praktikum/,www.volksverpetzer.de,Urteile Januar 2026: Schule darf Praktikum bei der AfD ablehnen - Volksverpetzer,0,LOW,False,,,factcheck,2026-02-19T02:25:48.095862
[DEBUNKED] False claim that Epstein is alive in Colorado misrepresents 2021 emails about different man | Snopes.com,https://www.snopes.com/fact-check/epstein-colorado-emails/,www.snopes.com,False claim that Epstein is alive in Colorado misrepresents 2021 emails about different man | Snopes,0.9,HIGH,True,FALSE - Debunked by fact-checkers,www.snopes.com,factcheck,2026-02-19T02:25:48.876898
[DEBUNKED] Macaulay Culkin never said Michael Jackson 'saved' him from Epstein | Snopes.com,https://www.snopes.com/fact-check/macaulay-culkin-michael-jackson-epstein/,www.snopes.com,Macaulay Culkin never said Michael Jackson 'saved' him from Epstein | Snopes.com,0.9,HIGH,True,FALSE - Debunked by fact-checkers,www.snopes.com,factcheck,2026-02-19T02:25:48.958765
