claim,source_url,source_domain,article_title,risk_score,risk_category,has_factcheck,factcheck_rating,factcheck_source,source_type,checked_at
Login or signup to continue readingEOFY SAVE 50%All articles from our websiteThe digital version of Today&#x27;s PaperAll other regional websites in your areaContinueMinions &amp; Monsters is now showing in Australian cinemas,https://www.goulburnpost.com.au/story/9296576/chris-meledandri-the-man-behind-illuminations-minion-empire/,goulburnpost.com.au,"Chris Meledandri: the man behind Illumination&#x27;s Minion empire | Goulburn Post | Goulburn, NSW",0,LOW,False,,,unknown,2026-06-25T20:02:46.402549
A 2025 report by Vedere Labs found that at least 10% of newly registered domains between December 2024 and June 2025 were typosquatted versions of known brands,https://www.theupcoming.co.uk/2026/06/23/did-i-type-that-right-how-one-misspelled-url-can-lead-to-a-phishing-site/,theupcoming.co.uk,“Did I type that right?” How one misspelled url can lead to a phishing site &#8211; The Upcoming,0,LOW,False,,,unknown,2026-06-25T20:02:49.112204
"A study shows that over 70% of online users do not notice subtle differences in URLs, especially when t",https://www.theupcoming.co.uk/2026/06/23/did-i-type-that-right-how-one-misspelled-url-can-lead-to-a-phishing-site/,theupcoming.co.uk,“Did I type that right?” How one misspelled url can lead to a phishing site &#8211; The Upcoming,0,LOW,False,,,unknown,2026-06-25T20:02:49.352234
"Ziel des Gutachtens ist laut der GFF, „wichtige Lücken in der Debatte um ein Verbot der AfD“ zu schließen",https://correctiv.org/aktuelles/debatte-um-afd-verbot/2026/06/25/afd-verbot-gutachten-faq/,correctiv.org,FAQ zu AfD-Gutachten: 1500 Seiten zur Verfassungsfeindlichkeit,0,LOW,False,,,factcheck,2026-06-25T20:02:54.068622
"Denn bislang habe es keine belastbare, wissenschaftlich erarbeitete Antwort auf die Frage gegeben, ob die AfD nach den Maßstäben des Artikels 21 des Grundgesetzes verfassungswidrig sei – und damit verboten werden könnte",https://correctiv.org/aktuelles/debatte-um-afd-verbot/2026/06/25/afd-verbot-gutachten-faq/,correctiv.org,FAQ zu AfD-Gutachten: 1500 Seiten zur Verfassungsfeindlichkeit,0.1,LOW,False,,,factcheck,2026-06-25T20:02:54.297901
"Anfang 2022 hielt Gazprom Germania, die deutsche Tochtergesellschaft des russischen Staatskonzerns, 25 Prozent der Erdgasspeicherkapazitäten in Deutschland",https://correctiv.org/hybride-kriegsfuehrung/2026/06/24/wollte-gazprom-deutschland-ins-chaos-stuerzen-bundesanwaltschaft-ermittelt-wegen-versuchter-sabotage/,correctiv.org,Wollte Gazprom Deutschland ins Chaos stürzen? Bundesanwaltschaft ermittelt,0,LOW,False,,,factcheck,2026-06-25T20:02:55.573818
"Laut der Bundesanwaltschaft konnte so der Sabotageplan vereitelt werden, da das Bundeswirtschaftsministerium die treuhänderische Verwaltung der Gazprom Germania durch die Bundesnetzagentur anordnete",https://correctiv.org/hybride-kriegsfuehrung/2026/06/24/wollte-gazprom-deutschland-ins-chaos-stuerzen-bundesanwaltschaft-ermittelt-wegen-versuchter-sabotage/,correctiv.org,Wollte Gazprom Deutschland ins Chaos stürzen? Bundesanwaltschaft ermittelt,0,LOW,False,,,factcheck,2026-06-25T20:02:55.814973
Die Kosten für die Kampfschiffe hätten sich auf 18 Milliarden Euro mehr als verdoppelt,https://correctiv.org/aktuelles/bundeswehr/2026/06/24/pistorius-beendet-teuerstes-marine-projekt-der-geschichte/,correctiv.org,Pistorius beendet teuerstes Marine-Projekt der Geschichte,0,LOW,False,,,factcheck,2026-06-25T20:02:57.012024
"Weiter wird der Bau aber nicht gehen – am späten Dienstag hat Verteidigungsminister Boris Pistorius (SPD) laut beteiligten Personen die mitwirkenden Werften informiert, das Projekt F126 sei beendet",https://correctiv.org/aktuelles/bundeswehr/2026/06/24/pistorius-beendet-teuerstes-marine-projekt-der-geschichte/,correctiv.org,Pistorius beendet teuerstes Marine-Projekt der Geschichte,0,LOW,False,,,factcheck,2026-06-25T20:02:57.215257
"Die offiziellen Kündigungsschreiben wolle die Beschaffungsbehörde an diesem Mittwoch an die Werften Damen (Niederlande) und die Rheinmetall-Tochter NVL verschicken, wie die Personen CORRECTIV berichteten",https://correctiv.org/aktuelles/bundeswehr/2026/06/24/pistorius-beendet-teuerstes-marine-projekt-der-geschichte/,correctiv.org,Pistorius beendet teuerstes Marine-Projekt der Geschichte,0.1,LOW,False,,,factcheck,2026-06-25T20:02:57.420012
Nach Angaben der Polizei kamen etwa 4,https://correctiv.org/faktencheck/hintergrund/2026/06/24/warum-die-polizei-das-trommeln-auf-einer-anti-merz-demo-einschraenkte/,correctiv.org,Warum die Polizei das Trommeln auf einer Anti-Merz-Demo einschränkte,0,LOW,False,,,factcheck,2026-06-25T20:02:58.729564
"Mit dem neuen Format erweitert CORRECTIV sein wachsendes tagesaktuelles Angebot um einen Podcast für alle, die sich zum Feierabend kompakt über die wichtigsten politischen Nachrichten und Einordnungen des Tages informieren möchten",https://correctiv.org/in-eigener-sache/2026/06/22/was-zaehlt-correctiv-startet-taeglichen-nachrichten-podcast/,correctiv.org,„Was zählt“: CORRECTIV startet täglichen Nachrichten-Podcast - correctiv.org,0.1,LOW,False,,,factcheck,2026-06-25T20:02:59.721184
90 12051 Berlin Fax: +49 (0) 30 – 555 780 2 20 Büro Berlin Singerstraße 109 10179 Berlin Buchladen Essen Akazienallee 10 45127 Essen Online-Shop Jugendredaktion Salon5 Alle Standorte CORRECTIV,https://correctiv.org/in-eigener-sache/2026/06/22/was-zaehlt-correctiv-startet-taeglichen-nachrichten-podcast/,correctiv.org,„Was zählt“: CORRECTIV startet täglichen Nachrichten-Podcast - correctiv.org,0.1,LOW,False,,,factcheck,2026-06-25T20:02:59.920604
[DEBUNKED] CSD Dresden: Video für Desinformation über Teilnehmendenzahl genutzt,https://correctiv.org/faktencheck/2026/06/19/csd-dresden-video-fuer-desinformation-ueber-teilnehmendenzahl-genutzt/,correctiv.org,CSD Dresden: Video für Desinformation über Teilnehmendenzahl genutzt,0.9,HIGH,True,FALSE - Debunked by fact-checkers,correctiv.org,factcheck,2026-06-25T20:03:00.864726
"Während SPD und Linke keine russische Einflussnahme erkennen, werfen CDU und Grüne der Landesregierung mangelnde Transparenz und eine zu große Nähe zu Moskau vor",https://correctiv.org/aktuelles/russland-ukraine-2/2026/06/19/nord-stream-untersuchung-endet-im-streit-regierung-spricht-von-entlastung-opposition-von-taeuschung-klimastiftung-russland/,correctiv.org,"Nord Stream 2: Regierung spricht von Entlastung, Opposition von Täuschung",0.1,LOW,False,,,factcheck,2026-06-25T20:03:02.192726
"Sitzung zusammen, um den Abschlussbericht zu beschließen, wie die Grünen bestätigten",https://correctiv.org/aktuelles/russland-ukraine-2/2026/06/19/nord-stream-untersuchung-endet-im-streit-regierung-spricht-von-entlastung-opposition-von-taeuschung-klimastiftung-russland/,correctiv.org,"Nord Stream 2: Regierung spricht von Entlastung, Opposition von Täuschung",0,LOW,False,,,factcheck,2026-06-25T20:03:02.404480
Nicht alle von ihnen haben diesen unversehrt überstanden,https://correctiv.org/aktuelles/bundeswehr/2026/06/19/krieg-im-kopf/,correctiv.org,Krieg im Kopf,0.1,LOW,False,,,factcheck,2026-06-25T20:03:03.532467
Viele von ihnen haben Gefechte erlebt – und sie nicht immer unbeschadet überstanden,https://correctiv.org/aktuelles/bundeswehr/2026/06/19/krieg-im-kopf/,correctiv.org,Krieg im Kopf,0.1,LOW,False,,,factcheck,2026-06-25T20:03:03.742376
"„Gleichzeitig sprechen wissenschaftliche Untersuchungen und die Erfahrungen aus der Veteranenarbeit dafür, dass die offiziell erfassten Zahlen den tatsächlichen Unterstützungsbedarf nur teilweise abbilden",https://correctiv.org/aktuelles/bundeswehr/2026/06/19/krieg-im-kopf/,correctiv.org,Krieg im Kopf,0,LOW,False,,,factcheck,2026-06-25T20:03:03.972700
[DEBUNKED] Spionage an deutschen Hochschulen: Das Playbook der China-Agenten,https://correctiv.org/hybride-kriegsfuehrung/2026/06/18/spionage-an-deutschen-hochschulen-das-playbook-der-china-agenten/,correctiv.org,Spionage an deutschen Hochschulen: Das Playbook der China-Agenten,0.9,HIGH,True,FALSE - Debunked by fact-checkers,correctiv.org,factcheck,2026-06-25T20:03:04.895538
Das bestätigte ein Sprecher von Spahn auf CORRECTIV-Anfrage,https://correctiv.org/aktuelles/das-spahn-netzwerk/2026/06/18/jens-spahn-peter-thiel-dialog/,correctiv.org,Jens Spahn nahm an Geheim-Treffen von Peter Thiel teil,0,LOW,False,,,factcheck,2026-06-25T20:03:06.021909
Das nächste Treffen soll laut einem Bericht des US-Mediums Wired im August 2026 in Irland stattfinden,https://correctiv.org/aktuelles/das-spahn-netzwerk/2026/06/18/jens-spahn-peter-thiel-dialog/,correctiv.org,Jens Spahn nahm an Geheim-Treffen von Peter Thiel teil,0,LOW,False,,,factcheck,2026-06-25T20:03:06.235086
Der Sprecher bestätigte auf CORRECTIV-Anfrage die Einladung zu dem Treffen im August dieses Jahres,https://correctiv.org/aktuelles/das-spahn-netzwerk/2026/06/18/jens-spahn-peter-thiel-dialog/,correctiv.org,Jens Spahn nahm an Geheim-Treffen von Peter Thiel teil,0,LOW,False,,,factcheck,2026-06-25T20:03:06.438782
[DEBUNKED] Fast 100 Anschläge auf deutsche Verkehrsinfrastruktur,https://correctiv.org/hybride-kriegsfuehrung/2026/06/18/fast-100-anschlaege-auf-deutsche-verkehrsinfrastruktur-sabotage/,correctiv.org,Fast 100 Anschläge auf deutsche Verkehrsinfrastruktur,0.9,HIGH,True,FALSE - Debunked by fact-checkers,correctiv.org,factcheck,2026-06-25T20:03:07.362702
[DEBUNKED] Deutschland sagte keine 233 Millionen Euro für Sozialwohnungen in Ukraine zu,https://correctiv.org/faktencheck/2026/06/18/nein-deutschland-hat-keine-233-millionen-euro-fuer-sozialwohnungen-in-der-ukraine-zugesagt/,correctiv.org,Deutschland sagte keine 233 Millionen Euro für Sozialwohnungen in Ukraine zu,0.9,HIGH,True,FALSE - Debunked by fact-checkers,correctiv.org,factcheck,2026-06-25T20:03:08.357875
[DEBUNKED] Selenskyj soll über 80 Auslandsimmobilien besitzen? Vermeintliche Belege sind gefälscht - correctiv.org,https://correctiv.org/faktencheck/aus-der-community/2026/06/18/selenskyj-soll-ueber-80-auslandsimmobilien-besitzen-vermeintliche-belege-sind-gefaelscht/,correctiv.org,Selenskyj soll über 80 Auslandsimmobilien besitzen? Vermeintliche Belege sind gefälscht - correctiv.,0.9,HIGH,True,FALSE - Debunked by fact-checkers,correctiv.org,factcheck,2026-06-25T20:03:09.325349
Mindestens 80 Prozent der Kosten für diese Umrüstung sollen von der Pharma- und Kosmetikindustrie getragen werden,https://correctiv.org/aktuelles/europa-aktuelles/2026/06/18/evp-und-rechtspopulisten-stimmen-fuer-eine-verschiebung-der-eu-abwasserrichtlinie/,correctiv.org,Konservative wollen Pharmabranche entlasten - correctiv.org,0,LOW,False,,,factcheck,2026-06-25T20:03:10.494218
Bis Mitte 2027 müssen alle EU-Länder die neue Richtlinie umsetzen,https://correctiv.org/aktuelles/europa-aktuelles/2026/06/18/evp-und-rechtspopulisten-stimmen-fuer-eine-verschiebung-der-eu-abwasserrichtlinie/,correctiv.org,Konservative wollen Pharmabranche entlasten - correctiv.org,0.1,LOW,False,,,factcheck,2026-06-25T20:03:10.697091
"„Zur Finanzierung werden alle Pharma- und Kosmetikkonzerne herangezogen, die auf dem EU-Markt aktiv sind",https://correctiv.org/aktuelles/europa-aktuelles/2026/06/18/evp-und-rechtspopulisten-stimmen-fuer-eine-verschiebung-der-eu-abwasserrichtlinie/,correctiv.org,Konservative wollen Pharmabranche entlasten - correctiv.org,0.1,LOW,False,,,factcheck,2026-06-25T20:03:10.921258
[DEBUNKED] Amtliche Mitteilung zu Ruhestörung wegen Türkei-Spiel bei Fußball-WM ist gefälscht,https://correctiv.org/faktencheck/2026/06/17/amtliche-mitteilung-zu-ruhestoerung-wegen-tuerkei-spiel-bei-fussball-wm-ist-gefaelscht/,correctiv.org,Amtliche Mitteilung zu Ruhestörung wegen Türkei-Spiel bei Fußball-WM ist gefälscht,0.9,HIGH,True,FALSE - Debunked by fact-checkers,correctiv.org,factcheck,2026-06-25T20:03:11.994530
[DEBUNKED] Maischberger: Eskalation im Studio zwischen Merz und Chrupalla?,https://www.mimikama.org/maischberger-eskalation-studio-merz-chrupalla-fake/,www.mimikama.org,Maischberger: Eskalation im Studio zwischen Merz und Chrupalla?,0.9,HIGH,True,FALSE - Debunked by fact-checkers,www.mimikama.org,factcheck,2026-06-25T20:03:13.330742
[DEBUNKED] Früher war es auch heiß,https://www.mimikama.org/frueher-war-es-auch-heiss-hitzetage-klimawandel/,www.mimikama.org,Früher war es auch heiß,0.9,HIGH,True,FALSE - Debunked by fact-checkers,www.mimikama.org,factcheck,2026-06-25T20:03:14.715799
[DEBUNKED] Wurde in Indien ein 5G-Mast aus Protest angezündet?,https://www.mimikama.org/indien-5g-mast-angezuendet/,www.mimikama.org,Wurde in Indien ein 5G-Mast aus Protest angezündet?,0.9,HIGH,True,FALSE - Debunked by fact-checkers,www.mimikama.org,factcheck,2026-06-25T20:03:16.109779
"[DEBUNKED] Heimarbeit mit Kugelschreibern, Haargummis und Perlen?",https://www.mimikama.org/heimarbeit-kugelschreiber-haargummi-perlen-betrug/,www.mimikama.org,"Heimarbeit mit Kugelschreibern, Haargummis und Perlen?",0.9,HIGH,True,FALSE - Debunked by fact-checkers,www.mimikama.org,factcheck,2026-06-25T20:03:17.554724
[DEBUNKED] Lamborghini auf A12? KI-Bild entlarvt zahlreiche Fehler!,https://www.mimikama.org/lamborghini-auf-der-a12-fehler-entlarven-ki-bild/,www.mimikama.org,Lamborghini auf A12? KI-Bild entlarvt zahlreiche Fehler!,0.9,HIGH,True,FALSE - Debunked by fact-checkers,www.mimikama.org,factcheck,2026-06-25T20:03:18.937172
[DEBUNKED] Verschenkt Elon Musk tatsächlich Geld für ein Krypto-Casino?,https://www.mimikama.org/verschenkt-elon-musk-geld-krypto-casino/,www.mimikama.org,Verschenkt Elon Musk tatsächlich Geld für ein Krypto-Casino?,0.9,HIGH,True,FALSE - Debunked by fact-checkers,www.mimikama.org,factcheck,2026-06-25T20:03:20.760150
"Sie müssen keine neue Geschichte erfinden, sondern nur eine vertraute Kaufsituation nachbauen: ein Angebot, ein Login, ein Warenkorb, eine Zahlung",https://www.mimikama.org/amazon-prime-day-2026-betrug-erkennen/,www.mimikama.org,Vorsicht: Amazon Prime Day 2026 – Betrug erkennen und schützen!,0.1,LOW,False,,,factcheck,2026-06-25T20:03:22.896348
Nach Angaben von Check Point Research wurden bereits Monate vor dem Shopping-Event tausende neue Amazon-bezogene Domains registriert,https://www.mimikama.org/amazon-prime-day-2026-betrug-erkennen/,www.mimikama.org,Vorsicht: Amazon Prime Day 2026 – Betrug erkennen und schützen!,0,LOW,False,,,factcheck,2026-06-25T20:03:23.107720
Im Umfeld des Prime Day wurden laut Check Point Research etwa Domains nach dem Muster „amazon-prime,https://www.mimikama.org/amazon-prime-day-2026-betrug-erkennen/,www.mimikama.org,Vorsicht: Amazon Prime Day 2026 – Betrug erkennen und schützen!,0,LOW,False,,,factcheck,2026-06-25T20:03:23.315045
[DEBUNKED] Werden auf Vinted Kinder verkauft?,https://www.mimikama.org/vinted-kinder-verkauft-faktencheck/,www.mimikama.org,Werden auf Vinted Kinder verkauft?,0.9,HIGH,True,FALSE - Debunked by fact-checkers,www.mimikama.org,factcheck,2026-06-25T20:03:24.704851
[DEBUNKED] CDU-Abgeordneter zur AfD gewechselt? Falsches Video entlarvt Lüge!,https://www.mimikama.org/cdu-abgeordneter-zur-afd-gewechselt-nein/,www.mimikama.org,CDU-Abgeordneter zur AfD gewechselt? Falsches Video entlarvt Lüge!,0.9,HIGH,True,FALSE - Debunked by fact-checkers,www.mimikama.org,factcheck,2026-06-25T20:03:26.031463
[DEBUNKED] Wetterkarten-Manipulation: KI-Video als falscher Beweis entlarvt,https://www.mimikama.org/ki-video-als-beweis-fuer-wetterkarten-manipulation/,www.mimikama.org,Wetterkarten-Manipulation: KI-Video als falscher Beweis entlarvt,0.9,HIGH,True,FALSE - Debunked by fact-checkers,www.mimikama.org,factcheck,2026-06-25T20:03:27.923419
[DEBUNKED] Berlin: Wurde ein Mann wegen der Deutschlandfahne gestoppt?,https://www.mimikama.org/berlin-mann-gestoppt-deutschlandfahne/,www.mimikama.org,Berlin: Wurde ein Mann wegen der Deutschlandfahne gestoppt?,0.9,HIGH,True,FALSE - Debunked by fact-checkers,www.mimikama.org,factcheck,2026-06-25T20:03:29.316120
[DEBUNKED] KI-Video zur Deutschlandflagge: Falscher Polizeieinsatz entlarvt,https://www.mimikama.org/ki-video-verbot-deutschlandflagge/,www.mimikama.org,KI-Video zur Deutschlandflagge: Falscher Polizeieinsatz entlarvt,0.9,HIGH,True,FALSE - Debunked by fact-checkers,www.mimikama.org,factcheck,2026-06-25T20:03:30.635785
[DEBUNKED] Faktencheck: Kringel am Himmel sind keine Chemtrails,https://www.mimikama.org/kringel-am-himmel-chemtrail-beweis-faellt-leider-aus/,www.mimikama.org,Faktencheck: Kringel am Himmel sind keine Chemtrails,0.9,HIGH,True,FALSE - Debunked by fact-checkers,www.mimikama.org,factcheck,2026-06-25T20:03:32.048983
"Es kennt keine Oma, die sich freut, keinen stolzen ersten Schultag, keinen rührenden Familienmoment und keine Herzchen unter dem Beitrag",https://www.mimikama.org/was-eltern-ueber-kinderfotos-und-ki-wissen-muessen/,www.mimikama.org,Kinderfotos im Netz: Was Eltern über Risiken und KI wissen müssen,0.1,LOW,False,,,factcheck,2026-06-25T20:03:33.631712
Viele Erwachsene denken noch immer: „Ich poste doch nichts Schlimmes,https://www.mimikama.org/was-eltern-ueber-kinderfotos-und-ki-wissen-muessen/,www.mimikama.org,Kinderfotos im Netz: Was Eltern über Risiken und KI wissen müssen,0.1,LOW,False,,,factcheck,2026-06-25T20:03:33.830472
"Heute liegt das Bild auf Servern, in Chats, in Screenshots, in Backups, in Plattformarchiven und manchmal an Orten, an denen es nie hätte landen dürfen",https://www.mimikama.org/was-eltern-ueber-kinderfotos-und-ki-wissen-muessen/,www.mimikama.org,Kinderfotos im Netz: Was Eltern über Risiken und KI wissen müssen,0.1,LOW,False,,,factcheck,2026-06-25T20:03:34.064515
[DEBUNKED] Ist diese Vintage-Zahnpasta-Werbung echt?,https://www.mimikama.org/vintage-zahnpasta-werbung-echt-oder-ki/,www.mimikama.org,Ist diese Vintage-Zahnpasta-Werbung echt?,0.9,HIGH,True,FALSE - Debunked by fact-checkers,www.mimikama.org,factcheck,2026-06-25T20:03:35.919784
"Auf diesen Widerspruch zur Bezeichnung hinzuweisen, ist keine Spitzfindigkeit",https://www.volksverpetzer.de/analyse/eu-verordnung-rueckfuehrung/,www.volksverpetzer.de,Abschreckung durch Angst: Wie die neue EU-Verordnung das Wort ‚Rückführung&#039; aushöhlt - Volksver,0.1,LOW,False,,,factcheck,2026-06-25T20:03:37.159807
Die Partei findet aber immer mehr politische Anschlussstellen auf der Suche nach einer neuen deutschen Identität,https://www.volksverpetzer.de/analyse/afd-sachsen-anhalt-bauhaus/,www.volksverpetzer.de,Will die AfD Sachsen-Anhalt das Architektur-Erbe ihres eigenen Bundeslandes verbannen? - Volksverpet,0.1,LOW,False,,,factcheck,2026-06-25T20:03:38.168436
"Im ersten Wahlgang gewann der Rechtsextremist Hartung mit 29 Prozent der Stimmen, musste aber in die Stichwahl gegen Hoffmann von der CDU, der 23,6 Prozent der Stimmen geholt hatte",https://www.volksverpetzer.de/aktuelles/aue-bad-schlema-nazi-ard/,www.volksverpetzer.de,Aue-Bad Schlema: Neonazi verliert die Wahl – und bekommt ARD-Sendezeit - Volksverpetzer,0,LOW,False,,,factcheck,2026-06-25T20:03:39.193236
Laut einem Policy Paper des Else Frenkel-Brunswik-Instituts von 2022 ist er „eine der bekanntesten Personen aus der Neonazi-Szene im Erzgebirgskreis,https://www.volksverpetzer.de/aktuelles/aue-bad-schlema-nazi-ard/,www.volksverpetzer.de,Aue-Bad Schlema: Neonazi verliert die Wahl – und bekommt ARD-Sendezeit - Volksverpetzer,0,LOW,False,,,factcheck,2026-06-25T20:03:39.399621
[DEBUNKED] Volksverpetzer gewinnt gegen die Ostdeutsche Allgemeine vor Gericht - Volksverpetzer,https://www.volksverpetzer.de/aktuelles/volksverpetzer-gewinnt-ostdeutsche-allgemeine/,www.volksverpetzer.de,Volksverpetzer gewinnt gegen die Ostdeutsche Allgemeine vor Gericht - Volksverpetzer,0.9,HIGH,True,FALSE - Debunked by fact-checkers,www.volksverpetzer.de,factcheck,2026-06-25T20:03:40.182205
"“ Warte mal - die AfD, das waren doch die, die überall eine „Islamisierung“ wittern, für die es überhaupt keine Faktengrundlage gibt",https://www.volksverpetzer.de/analyse/afd-unterstuetzt-terroristen/,www.volksverpetzer.de,‚Selbst anpacken‘: AfD unterstützt Terroristen in Deutschland? - Volksverpetzer,0.1,LOW,False,,,factcheck,2026-06-25T20:03:41.227734
Auch kandidiert er laut seinem Instagram-Profil für die „Generation Deutschland“ Baden-Württemberg,https://www.volksverpetzer.de/analyse/afd-unterstuetzt-terroristen/,www.volksverpetzer.de,‚Selbst anpacken‘: AfD unterstützt Terroristen in Deutschland? - Volksverpetzer,0,LOW,False,,,factcheck,2026-06-25T20:03:41.427841
"OAZ-Chefredakteur mit „langem Bart“ Vor ein paar Wochen berichtete er hinter vorgehaltener Hand über seine Erfahrungen dort als Redakteur: „Die Wahrheit ist: Der wahre Chefredakteur, und das weiß auch jeder im Haus, trägt einen langen Bart",https://www.volksverpetzer.de/aktuelles/100-tage-oaz-fake-redaktion-autoren-geklaut/,www.volksverpetzer.de,Fake-Redaktion der „Ostdeutschen Allgemeinen“: Fast 400 Autoren „geklaut“ - Volksverpetzer,0,LOW,False,,,factcheck,2026-06-25T20:03:42.455596
"Friedrich würde nie, nie, nie einen selbstbewussten, eigenständigen und unabhängigen Chefredakteur akzeptieren",https://www.volksverpetzer.de/aktuelles/100-tage-oaz-fake-redaktion-autoren-geklaut/,www.volksverpetzer.de,Fake-Redaktion der „Ostdeutschen Allgemeinen“: Fast 400 Autoren „geklaut“ - Volksverpetzer,0.1,LOW,False,,,factcheck,2026-06-25T20:03:42.683144
Und die alle hatten bis auf wenige Ausnahmen eines miteinander gemein: Sie hatten noch nicht eine Zeile für die OAZ geschrieben,https://www.volksverpetzer.de/aktuelles/100-tage-oaz-fake-redaktion-autoren-geklaut/,www.volksverpetzer.de,Fake-Redaktion der „Ostdeutschen Allgemeinen“: Fast 400 Autoren „geklaut“ - Volksverpetzer,0.1,LOW,False,,,factcheck,2026-06-25T20:03:42.886515
"Diesen Monat schauen wir auf eine Millionenspende an die AfD, die die rechtsextreme Partei laut Gericht nicht zurückbekommt",https://www.volksverpetzer.de/serie/urteile-mai-2026-afd-spende/,www.volksverpetzer.de,Urteile Mai 2026: Die AfD spendiert dem Staat unfreiwillig Millionen - Volksverpetzer,0,LOW,False,,,factcheck,2026-06-25T20:03:43.920250
"2,35 Millionen Euro an - vermeintlicher Spender: der Österreicher Gerhard Dingler - ein früherer Regionalpolitiker der FPÖ",https://www.volksverpetzer.de/serie/urteile-mai-2026-afd-spende/,www.volksverpetzer.de,Urteile Mai 2026: Die AfD spendiert dem Staat unfreiwillig Millionen - Volksverpetzer,0,LOW,False,,,factcheck,2026-06-25T20:03:44.186562
"Geldwerte Leistungen, auch Werbemaßnahmen ab einer bestimmten Größenordnung, sind laut Verwaltungsgericht Berlin Spenden",https://www.volksverpetzer.de/serie/urteile-mai-2026-afd-spende/,www.volksverpetzer.de,Urteile Mai 2026: Die AfD spendiert dem Staat unfreiwillig Millionen - Volksverpetzer,0,LOW,False,,,factcheck,2026-06-25T20:03:44.387857
"Man sieht, dass bis auf den letzten Stuhl alle Plätze belegt sind",https://www.volksverpetzer.de/aktuelles/lohnt-kaempfen-merz-keine-antwort/,www.volksverpetzer.de,Wofür lohnt es sich zu kämpfen? Warum Merz keine Antwort auf diese Frage hat - Volksverpetzer,0.1,LOW,False,,,factcheck,2026-06-25T20:03:45.417598
Er räumt Ängste und Vorwürfe aus und geht sachlich auf alle Entgegnungen ein,https://www.volksverpetzer.de/aktuelles/lohnt-kaempfen-merz-keine-antwort/,www.volksverpetzer.de,Wofür lohnt es sich zu kämpfen? Warum Merz keine Antwort auf diese Frage hat - Volksverpetzer,0.1,LOW,False,,,factcheck,2026-06-25T20:03:45.626012
"Die ehemalige Menschenrechtsbeauftragte der CDU Erika Steinbach facht den Hass auf Walter Lübcke über ihre Social-Media-Kanäle immer wieder an, sodass der CDU-Politiker Peter Tauber ihr eine direkte Mitschuld an dem Mord zuspricht",https://www.volksverpetzer.de/aktuelles/lohnt-kaempfen-merz-keine-antwort/,www.volksverpetzer.de,Wofür lohnt es sich zu kämpfen? Warum Merz keine Antwort auf diese Frage hat - Volksverpetzer,0.1,LOW,False,,,factcheck,2026-06-25T20:03:45.826386
"[DEBUNKED] Ich habe den WELT-Artikel von Kristina Schröder gelesen, damit ihr es nicht müsst - Volksverpetzer",https://www.volksverpetzer.de/faktencheck/welt-schroeder-klima-fake/,www.volksverpetzer.de,"Ich habe den WELT-Artikel von Kristina Schröder gelesen, damit ihr es nicht müsst - Volksverpetzer",0.9,HIGH,True,FALSE - Debunked by fact-checkers,www.volksverpetzer.de,factcheck,2026-06-25T20:03:46.637507
[DEBUNKED] Don't fall for fake image of Donald and Ivanka Trump with Epstein | Snopes.com,https://www.snopes.com/fact-check/donald-ivanka-trump-epstein-photo/,www.snopes.com,Don't fall for fake image of Donald and Ivanka Trump with Epstein | Snopes.com,0.9,HIGH,True,FALSE - Debunked by fact-checkers,www.snopes.com,factcheck,2026-06-25T20:03:47.153770
[DEBUNKED] Did JPMorgan Chase fire DEI executive who stole Knicks trash can? What we know | Snopes.com,https://www.snopes.com/fact-check/jpmorgan-chase-knicks-trash-can/,www.snopes.com,Did JPMorgan Chase fire DEI executive who stole Knicks trash can? What we know | Snopes.com,0.9,HIGH,True,FALSE - Debunked by fact-checkers,www.snopes.com,factcheck,2026-06-25T20:03:47.314361
[DEBUNKED] Did Knicks decline White House invitation after winning NBA championship? | Snopes.com,https://www.snopes.com/fact-check/knicks-decline-white-house-invite/,www.snopes.com,Did Knicks decline White House invitation after winning NBA championship? | Snopes.com,0.9,HIGH,True,FALSE - Debunked by fact-checkers,www.snopes.com,factcheck,2026-06-25T20:03:47.476986
[DEBUNKED] Misleading posts compare Obama Presidential Center's ID requirement to voter ID laws | Snopes.com,https://www.snopes.com/fact-check/obama-presidential-center-id/,www.snopes.com,Misleading posts compare Obama Presidential Center's ID requirement to voter ID laws | Snopes.com,0.9,HIGH,True,FALSE - Debunked by fact-checkers,www.snopes.com,factcheck,2026-06-25T20:03:47.727235
