claim,source_url,source_domain,article_title,risk_score,risk_category,has_factcheck,factcheck_rating,factcheck_source,source_type,checked_at
"Zum Login SPIEGEL plus Nur für Neukunden € 1,– für 4 Wochen danach € 5,99 pro Woche Freier Zugriff auf alle S+-Artikel auf SPIEGEL",https://www.spiegel.de/netzwelt/web/vinted-werden-hier-kinder-verkauft-die-absurde-debatte-ueber-dubiose-anzeigen-a-bf88a6fc-14fb-4e91-879d-b74a692c5734#ref=rss,www.spiegel.de,Vinted: Werden hier Kinder verkauft? Die absurde Debatte über dubiose Anzeigen - DER SPIEGEL,0.1,LOW,False,,,mainstream,2026-06-25T20:04:43.355788
"E-Paper (PDF), Digital-Archiv und S+-Newsletter Jederzeit kündigen Jetzt abonnieren SPIEGEL plus 52 Wochen 25 % sparen € 4,49 pro Woche für 52 Wochen danach € 5,99 pro Woche Freier Zugriff auf alle S+-Artikel auf SPIEGEL",https://www.spiegel.de/netzwelt/web/vinted-werden-hier-kinder-verkauft-die-absurde-debatte-ueber-dubiose-anzeigen-a-bf88a6fc-14fb-4e91-879d-b74a692c5734#ref=rss,www.spiegel.de,Vinted: Werden hier Kinder verkauft? Die absurde Debatte über dubiose Anzeigen - DER SPIEGEL,0.1,LOW,False,,,mainstream,2026-06-25T20:04:43.600804
"Zum Login SPIEGEL plus Nur für Neukunden € 1,– für 4 Wochen danach € 5,99 pro Woche Freier Zugriff auf alle S+-Artikel auf SPIEGEL",https://www.spiegel.de/ausland/ukraine-krieg-wie-eine-angriffsdrohung-gegen-belarus-lukaschenko-in-bedraengnis-bringt-a-746a324d-b5fb-46ad-a9c3-54b975b9c749#ref=rss,www.spiegel.de,Ukraine-Krieg: Wie eine Angriffsdrohung gegen Belarus Lukaschenko in Bedrängnis bringt - DER SPIEGEL,0.1,LOW,False,,,mainstream,2026-06-25T20:04:45.684426
"E-Paper (PDF), Digital-Archiv und S+-Newsletter Jederzeit kündigen Jetzt abonnieren SPIEGEL plus 52 Wochen 25 % sparen € 4,49 pro Woche für 52 Wochen danach € 5,99 pro Woche Freier Zugriff auf alle S+-Artikel auf SPIEGEL",https://www.spiegel.de/ausland/ukraine-krieg-wie-eine-angriffsdrohung-gegen-belarus-lukaschenko-in-bedraengnis-bringt-a-746a324d-b5fb-46ad-a9c3-54b975b9c749#ref=rss,www.spiegel.de,Ukraine-Krieg: Wie eine Angriffsdrohung gegen Belarus Lukaschenko in Bedrängnis bringt - DER SPIEGEL,0.1,LOW,False,,,mainstream,2026-06-25T20:04:45.892567
Die Pflegekraft habe laut Kandie regelmäßig seinen Hämoglobinwert analysiert,https://www.spiegel.de/sport/leichtathletik/leichtathletik-ex-halbmarathonweltrekordler-kibiwott-kandie-verweigert-dopingtest-und-wird-lange-gesperrt-a-ca22750c-c9f4-464d-8283-3c357606b9bd#ref=rss,www.spiegel.de,Kibiwott Kandie: Lange Sperre nach verweigerter Dopingprobe und Fälschungen - DER SPIEGEL,0,LOW,False,,,mainstream,2026-06-25T20:04:47.088579
"Immer wieder fallen kenianische Läufer aufUm die verweigerte Probe zu begründen, legte Kandie später Dokumente vor, die seine dringend erforderliche Anwesenheit bei der Inspektion einer Baustelle in Eldoret am selben Tag belegen sollten",https://www.spiegel.de/sport/leichtathletik/leichtathletik-ex-halbmarathonweltrekordler-kibiwott-kandie-verweigert-dopingtest-und-wird-lange-gesperrt-a-ca22750c-c9f4-464d-8283-3c357606b9bd#ref=rss,www.spiegel.de,Kibiwott Kandie: Lange Sperre nach verweigerter Dopingprobe und Fälschungen - DER SPIEGEL,0.1,LOW,False,,,mainstream,2026-06-25T20:04:47.313691
positiv bewerten negativ bewerten Das Zentrum für Osteuropa- und internationale Studien (ZOiS) ist laut eigener Aussage Opfer eines Cyberangriffs geworden,https://www.spiegel.de/ausland/zois-osteuropa-institut-meldet-cyberangriff-a-e8265220-d38c-4b25-9af2-87876c95d8ec#ref=rss,www.spiegel.de,ZOiS: Renommiertes Osteuropa-Institut meldet Cyberangriff - DER SPIEGEL,0,LOW,False,,,mainstream,2026-06-25T20:04:48.378932
"length - 1, 500, false)"" data-area=""nav-bar"" data-app-hidden x-lazyload> Menü Startseite Sport Fußball-News Fußball-WM 2026 WM 2026 News heute: Undav ist laut Podolski »Kein zweiter Podolski« $swiper",https://www.spiegel.de/sport/fussball/wm-2026-news-heute-undav-ist-laut-podolski-kein-zweiter-podolski-a-8eb96729-89d6-45c4-b246-440984131588#ref=rss,www.spiegel.de,WM 2026 News heute: Undav ist laut Podolski »Kein zweiter Podolski« - DER SPIEGEL,0,LOW,False,,,mainstream,2026-06-25T20:04:49.498574
"Andere Nutzungen verletzen das Urheberrecht WM-Newsblog Undav laut Podolski »kein zweiter Podolski« Lukas Podolski war Torjäger, Sprücheklopfer der Nationalmannschaft und ist Fan-Liebling",https://www.spiegel.de/sport/fussball/wm-2026-news-heute-undav-ist-laut-podolski-kein-zweiter-podolski-a-8eb96729-89d6-45c4-b246-440984131588#ref=rss,www.spiegel.de,WM 2026 News heute: Undav ist laut Podolski »Kein zweiter Podolski« - DER SPIEGEL,0,LOW,False,,,mainstream,2026-06-25T20:04:49.707702
"Zum Login SPIEGEL plus Nur für Neukunden € 1,– für 4 Wochen danach € 5,99 pro Woche Freier Zugriff auf alle S+-Artikel auf SPIEGEL",https://www.spiegel.de/sport/fussball/wm-2026-news-heute-undav-ist-laut-podolski-kein-zweiter-podolski-a-8eb96729-89d6-45c4-b246-440984131588#ref=rss,www.spiegel.de,WM 2026 News heute: Undav ist laut Podolski »Kein zweiter Podolski« - DER SPIEGEL,0.1,LOW,False,,,mainstream,2026-06-25T20:04:49.912802
"»Ich muss einfach weiter Sport treiben, versuchen, so gesund wie möglich zu sein, und alle meine CT-Untersuchungen und Arzttermine wahrnehmen",https://www.spiegel.de/sport/tennis/tennis-chris-evert-macht-erneute-krebserkrankung-oeffentlich-a-64979334-141f-4327-ab18-4dc1ec976d36#ref=rss,www.spiegel.de,Tennis: Chris Evert macht erneute Krebserkrankung öffentlich - DER SPIEGEL,0.1,LOW,False,,,mainstream,2026-06-25T20:04:51.014482
Andere Nutzungen verletzen das Urheberrecht Reaktionen Neues Gutachten zur AfD bringt Bewegung in Verbotsdebatte »Unsere Demokratie ist keine Selbstverständlichkeit,https://www.spiegel.de/politik/deutschland/afd-gutachten-reaktionen-aus-sachsen-anhalt-und-dem-vorsitzenden-der-innenministerkonferenz-a-f152b00b-934a-4147-b93b-f7d6e20f9817#ref=rss,www.spiegel.de,AfD: Neues Gutachten bringt Bewegung in Verbotsdebatte - DER SPIEGEL,0.1,LOW,False,,,mainstream,2026-06-25T20:04:52.067617
"The agency estimated a 44% chance of more than 10,000 deaths",https://www.bbc.co.uk/news/articles/czx5k8pxdevo?at_medium=RSS&amp;at_campaign=rss,www.bbc.co.uk,Venezuela earthquakes in maps and charts: Where they hit and how severe they could be - BBC News,0,LOW,False,,,mainstream,2026-06-25T20:04:53.812764
"The USGS said there was a 44% chance it could hit up to 10,000 and a 30% chance it could reach 100,000",https://www.bbc.co.uk/news/articles/c4gyjgreg1ro?at_medium=RSS&amp;at_campaign=rss,www.bbc.co.uk,Two earthquakes have hit Venezuela â how bad is the damage? - BBC News,0,LOW,False,,,mainstream,2026-06-25T20:04:54.166493
